add_wish,discount_price,original_price,product_link,product_name,header_block
5958,$47.99,$63.00,http://www.jollychic.com/p/ice-cream-maker-household-automatic-frozen-fruit-yogurt-maker-machine-eu-plug-g689966.html,Ice Cream Maker Household Automatic Frozen Fruit&Yogurt Maker Machine-EU Plug,Kitchen
1441,$12.99,$19.99,http://www.jollychic.com/p/household-electronic-mini-portable-food-mixer-egg-beater-eu-plug-g698120.html,Household Electronic Mini Portable Food Mixer Egg Beater EU Plug,Kitchen
2632,$52.00,$67.00,http://www.jollychic.com/p/coffee-maker-household-large-capacity-automatic-drip-type-coffee-maker-infusing-tea-machine-g773664.html,Coffee Maker Household Large Capacity Automatic Drip Type Coffee Maker Infusing Tea Machine,Kitchen
4936,$2.99,$3.99,http://www.jollychic.com/p/sealing-machine-mini-household-battery-powered-plastic-bag-sealing-machine-g764166.html,Sealing Machine Mini Household Battery Powered Plastic Bag Sealing Machine,Kitchen
2604,$26.99,$39.99,http://www.jollychic.com/p/coffee-maker-household-mini-drip-type-coffee-maker-g564996.html,Coffee Maker Household Mini Drip Type Coffee Maker,Kitchen
4552,$16.99,$19.99,http://www.jollychic.com/p/household-portable-electronic-fruit-juicer-meat-blender-eu-plug-g592208.html,Household Portable Electronic Fruit Juicer Meat Blender EU Plug,Kitchen
2515,$18.99,$48.99,http://www.jollychic.com/p/artizan-multifunctional-electric-food-mixer-desktop-egg-beater-blender-for-baking-whisk-cream-drink-milk-g533330.html,ARTIZAN Multifunctional Electric Food Mixer Desktop Egg Beater Blender For Baking Whisk Cream Drink Milk,Kitchen
4145,$24.99,$38.99,http://www.jollychic.com/p/household-mini-multi-functional-coffee-maker-220v-550w-eu-plug-g592210.html,Household Mini Multi-Functional Coffee Maker 220V 550W EU Plug,Kitchen
2746,$13.99,$16.99,http://www.jollychic.com/p/household-portable-versatile-manual-coffee-grinder-coffee-maker-g562048.html,Household Portable Versatile Manual Coffee Grinder Coffee Maker,Kitchen
4513,$30.99,$68.00,http://www.jollychic.com/p/meat-grinder-household-multifunctional-meat-grinder-garlic-machine-220-240v-g476484.html,Meat Grinder Household Multifunctional Meat Grinder Garlic Machine 220-240V,Kitchen
1190,$30.99,$49.99,http://www.jollychic.com/p/coffee-maker-household-mini-multi-functional-coffee-maker-g551710.html,Coffee Maker Household Mini Multi-Functional Coffee Maker,Kitchen
992,$25.99,$35.99,http://www.jollychic.com/p/household-multifunctional-automatic-bread-maker-bread-machine-g575786.html,Household Multifunctional Automatic Bread Maker Bread Machine,Kitchen
197,$19.99,,http://www.jollychic.com/p/portable-dc-12v-food-milk-water-bottle-cup-warmer-heater-g580494.html,Portable DC 12V Food Milk Water Bottle Cup Warmer Heater,Kitchen
551,$9.99,$11.99,http://www.jollychic.com/p/yogurt-machine-household-full-automatic-stainless-steel-liner-yogurt-machine-17-5-2A17-5-2A12cm-g597518.html,Yogurt Machine Household Full-Automatic Stainless Steel Liner Yogurt Machine-17.5*17.5*12cm,Kitchen
143,$18.99,$31.99,http://www.jollychic.com/p/bear-electric-lunch-box-high-power-triple-sealed-circulation-heat-electric-lunch-box-china-standard-plug-h156-2A179mm-g607570.html,Bear Electric Lunch Box High Power Triple Sealed Circulation Heat Electric Lunch Box (China Standard Plug)-H156*179mm,Kitchen
102,$35.99,$45.99,http://www.jollychic.com/p/bear-egg-boiler-household-multi-functional-safe-high-power-stainless-steel-egg-boiler-chinese-standard-plug-g687444.html,Bear Egg Boiler Household Multi-Functional Safe High Power Stainless Steel Egg Boiler-Chinese Standard Plug,Kitchen
126,$12.99,$15.99,http://www.jollychic.com/p/mixer-cup-stainless-steel-anti-slip-auto-stirring-electric-mixer-cup-g713448.html,Mixer Cup Stainless Steel Anti-Slip Auto-Stirring Electric Mixer Cup,Kitchen
1746,$32.99,$42.99,http://www.jollychic.com/p/vacuum-sealing-machine-mini-freshness-retaining-low-noise-vacuum-sealing-machine-g764336.html,Vacuum Sealing Machine Mini Freshness Retaining Low Noise Vacuum Sealing Machine,Kitchen
194,$28.99,$42.99,http://www.jollychic.com/p/household-portable-multi-functional-yogurt-ice-cream-food-processor-g874344.html,Household Portable Multi-Functional Yogurt Ice Cream Food Processor,Kitchen
11,$16.99,,http://www.jollychic.com/p/kitchen-scale-0-01g-x-100g-digital-precision-pocket-scale-ash-tray-style-weighing-scales-g1053376.html,Kitchen Scale 0.01g x 100g Digital Precision Pocket Scale Ash Tray Style Weighing Scales,Kitchen
6394,$2.99,$3.99,http://www.jollychic.com/p/blender-household-mini-handheld-multi-functional-electric-egg-beater-g544668.html,Blender Household Mini Handheld Multi-Functional Electric Egg Beater,Kitchen
709,$84.00,$125.00,http://www.jollychic.com/p/household-multifunctional-portable-manual-coffee-maker-g478082.html,Household Multifunctional Portable Manual Coffee Maker,Kitchen
5402,$24.99,$29.99,http://www.jollychic.com/p/juicer-portable-multifunctional-cup-design-household-electric-fruit-juicer-g505820.html,Juicer Portable Multifunctional Cup Design Household Electric Fruit Juicer,Kitchen
271,$9.99,$15.99,http://www.jollychic.com/p/electric-lunch-box-portable-mini-electric-lunch-box-g551938.html,Electric Lunch Box Portable Mini Electric Lunch Box,Kitchen
301,$16.99,$29.99,http://www.jollychic.com/p/grinder-household-mini-multi-functional-electric-grinder-g555968.html,Grinder Household Mini Multi-Functional Electric Grinder,Kitchen
973,$27.99,$45.99,http://www.jollychic.com/p/household-multifunctional-sandwich-makers-toaster-breakfast-machine-g575782.html,Household Multifunctional Sandwich Makers Toaster Breakfast Machine,Kitchen
77,$52.00,$60.00,http://www.jollychic.com/p/meat-grinder-multi-functional-stainless-steel-high-power-electric-meat-grinder-215-2A180-2A265mm-g594646.html,Meat Grinder Multi-Functional Stainless Steel High Power Electric Meat Grinder-215*180*265mm,Kitchen
1469,$8.99,$10.99,http://www.jollychic.com/p/bottle-opener-mini-onetouch-automatic-electric-can-tin-bottle-opener-g606318.html,Bottle Opener Mini OneTouch Automatic Electric Can Tin Bottle Opener,Kitchen
262,$4.99,$5.99,http://www.jollychic.com/p/kitchen-scale-precise-versatile-multi-unit-display-max-5kg-kitchen-digital-scale-g652000.html,Kitchen Scale Precise Versatile Multi-Unit Display Max 5kg Kitchen Digital Scale,Kitchen
3666,$15.99,$19.99,http://www.jollychic.com/p/juicer-portable-mini-multi-functional-high-efficient-electric-juicer-g684952.html,Juicer Portable Mini Multi-Functional High Efficient Electric Juicer,Kitchen
99,$46.99,$61.00,http://www.jollychic.com/p/bear-electric-pan-household-with-steaming-stewing-function-electeic-electric-food-warmer220v-china-standard-plug-g687506.html,Bear Electric Pan Household With Steaming &Stewing Function Electeic Electric Food Warmer220V-China Standard Plug,Kitchen
121,$52.00,$67.00,http://www.jollychic.com/p/bear-egg-boiler-intelligent-reservation-precise-control-multi-functional-double-layer-egg-boiler-chinese-standard-plug-g687546.html,Bear Egg Boiler Intelligent Reservation Precise Control Multi-Functional Double Layer Egg Boiler-Chinese Standard Plug,Kitchen
239,$58.00,$65.00,http://www.jollychic.com/p/bear-food-processor-hosehold-electric-squeeze-juice-blending-grinding-machine220v-china-standard-plug-g687676.html,Bear Food Processor Hosehold Electric Squeeze Juice Blending Grinding Machine220V-China Standard Plug,Kitchen
275,$25.99,$30.99,http://www.jollychic.com/p/juicer-portable-safe-stainless-steel-blade-juicer-g764738.html,Juicer Portable Safe Stainless Steel Blade Juicer,Kitchen
39,$12.99,$19.99,http://www.jollychic.com/p/electric-fruit-juicer-380ml-usb-handheld-smoothie-maker-blender-juice-cup-g1002284.html,Electric Fruit Juicer 380ML USB Handheld Smoothie Maker Blender Juice Cup,Kitchen
600,$10.99,$12.99,http://www.jollychic.com/p/mini-portable-multifunctional-electric-food-steamer-egg-machine-g554254.html,Mini Portable Multifunctional Electric Food Steamer Egg Machine,Kitchen
40,$123.00,$190.00,http://www.jollychic.com/p/household-multifunctional-food-processor-soymilk-machine-smoothing-rice-cereal-machine-220v-240v-g476458.html,Household Multifunctional Food Processor Soymilk Machine Smoothing Rice Cereal Machine 220V-240V,Kitchen
2121,$13.99,$17.99,http://www.jollychic.com/p/artizan-electric-water-kettle-household-2l-stainless-steel-quick-boiling-pot-220v-1500w-g578034.html,ARTIZAN Electric Water Kettle Household 2L Stainless Steel Quick Boiling Pot 220V 1500W,Kitchen
982,$13.99,$21.99,http://www.jollychic.com/p/universal-convenient-kitchen-tools-diy-chocolate-melting-pot-g664238.html,Universal Convenient Kitchen Tools DIY Chocolate Melting Pot,Kitchen
784,$18.99,$25.99,http://www.jollychic.com/p/electric-blender-stainless-steel-blade-600ml-electric-blender-220v-g694578.html,Electric Blender Stainless Steel Blade 600ML Electric Blender 220V,Kitchen
2,$19.99,,http://www.jollychic.com/p/2pcs-fish-tank-uv-light-sterilizer-filter-9w-lamp-for-aquarium-water-disinfection-g1148198.html,2Pcs Fish Tank UV Light Sterilizer Filter 9W Lamp For Aquarium Water Disinfection,Kitchen
21,$29.99,,http://www.jollychic.com/p/coffee-bean-grinder-portable-universal-household-durable-coffee-grinder-eu-plug-g1226206.html,Coffee Bean Grinder Portable Universal Household Durable Coffee Grinder EU Plug,Kitchen
21,$5.99,$9.99,http://www.jollychic.com/p/electric-whisk-portable-handheld-household-durable-whisk-g1269646.html,Electric Whisk Portable Handheld Household Durable Whisk,Kitchen
550,$19.99,$22.99,http://www.jollychic.com/p/electric-lunch-box-portable-multi-functional-heating-electric-lunch-box-g547346.html,Electric Lunch Box Portable Multi-Functional Heating Electric Lunch Box,Kitchen
396,$20.99,$26.99,http://www.jollychic.com/p/household-mini-portable-convenient-electronic-handheld-juicer-g548756.html,Household Mini Portable Convenient Electronic Handheld Juicer,Kitchen
1029,$9.99,$13.99,http://www.jollychic.com/p/household-multifunctional-electric-steamer-egg-pot-egg-machine-g554256.html,Household Multifunctional Electric Steamer Egg Pot Egg Machine,Kitchen
217,$4.99,$6.99,http://www.jollychic.com/p/household-convenient-universal-food-processor-manual-juicer-g588904.html,Household Convenient Universal Food Processor Manual Juicer,Kitchen
33,$48.99,$58.00,http://www.jollychic.com/p/household-universal-portable-convenient-yogurt-machine-china-standard-plug-g607520.html,Household Universal Portable Convenient Yogurt Machine China Standard Plug,Kitchen
55,$41.99,$55.00,http://www.jollychic.com/p/bear-electric-lunch-box-high-power-constant-heating-vacuum-sealed-electric-lunch-box-china-standard-plug-h230-2A179mm-g607622.html,Bear Electric Lunch Box High Power Constant Heating Vacuum Sealed Electric Lunch Box (China Standard Plug)-H230*179mm,Kitchen
107,$5.99,$7.99,http://www.jollychic.com/p/kitchen-scale-universal-portable-digital-pocket-weighing-balance-scale-g663604.html,Kitchen Scale Universal Portable Digital Pocket Weighing Balance Scale,Kitchen
314,$23.99,$44.99,http://www.jollychic.com/p/bread-machine-conveient-stainless-steel-bread-toaster-for-2-slices-bread-g834614.html,Bread Machine Conveient Stainless Steel Bread Toaster For 2 Slices Bread,Kitchen
220,$7.99,$12.99,http://www.jollychic.com/p/coffee-cup-star-wars-heat-retaining-electric-auto-stirring-coffee-cup-g954452.html,Coffee Cup Star Wars Heat Retaining Electric Auto Stirring Coffee Cup,Kitchen
80,$35.99,$39.99,http://www.jollychic.com/p/juicer-usb-charge-portable-mini-electric-juicer-g990414.html,Juicer USB Charge Portable Mini Electric Juicer,Kitchen
26,$17.99,,http://www.jollychic.com/p/scale-white-slim-lcd-electronic-kitchen-digital-weight-scale-food-diet-scale-g1031896.html,Scale White Slim LCD Electronic Kitchen Digital Weight Scale Food Diet Scale,Kitchen
61,$17.99,$33.99,http://www.jollychic.com/p/bread-maker-universal-durable-stainless-steel-versatile-breakfast-toaster-eu-plug-g1217742.html,Bread Maker Universal Durable Stainless Steel Versatile Breakfast Toaster EU Plug,Kitchen
305,$17.99,$23.99,http://www.jollychic.com/p/water-purifier-mini-portable-safe-non-toxic-1-6l-household-water-purify-kettle-g630814.html,Water Purifier Mini Portable Safe Non-Toxic 1.6L Household Water Purify Kettle,Kitchen
59,$36.99,$46.99,http://www.jollychic.com/p/bear-egg-boiler-micro-computer-control-multi-functional-safe-durable-egg-boiler-chinese-standard-plug-g687568.html,Bear Egg Boiler Micro Computer Control Multi-Functional Safe Durable Egg Boiler-Chinese Standard Plug,Kitchen
74,$38.99,$54.00,http://www.jollychic.com/p/bear-electric-heating-pot-micro-computer-control-multi-protection-detachable-electric-heating-pot-chinese-standard-plug-g728562.html,Bear Electric Heating Pot Micro Computer Control Multi-Protection Detachable Electric Heating Pot-Chinese Standard Plug,Kitchen
177,$51.00,$66.00,http://www.jollychic.com/p/bear-juicer-portable-safe-stainless-steel-blade-detachable-juicer-chinese-standard-plug-g728906.html,Bear Juicer Portable Safe Stainless Steel Blade Detachable Juicer-Chinese Standard Plug,Kitchen
603,$95.00,$138.00,http://www.jollychic.com/p/salter-airfryer-domestic-mobile-non-lampblack-non-stick-fryer-g925998.html,SALTER Airfryer Domestic Mobile Non-lampblack Non-stick Fryer,Kitchen
33,$27.99,,http://www.jollychic.com/p/food-scale-mini-precision-digital-gram-jewelry-scale-with-lcd-display-g1032108.html,Food Scale Mini Precision Digital Gram Jewelry Scale With LCD Display,Kitchen
159,$109.00,,http://www.jollychic.com/p/electric-grill-double-layers-smokeless-bbq-electric-pan-grill-g1067106.html,Electric Grill Double Layers Smokeless BBQ Electric Pan Grill,Kitchen
58,$12.99,$24.99,http://www.jollychic.com/p/coffee-bean-grinder-dual-layer-design-manual-operation-durable-grinder-g1216722.html,Coffee Bean Grinder Dual Layer Design Manual Operation Durable Grinder,Kitchen
822,$62.00,$89.00,http://www.jollychic.com/p/food-processor-household-handheld-multi-functional-food-processor-g513792.html,Food Processor Household Handheld Multi-Functional Food Processor,Kitchen
501,$13.99,$14.99,http://www.jollychic.com/p/egg-machine-mini-portable-microwave-use-egg-boiler-g547344.html,Egg Machine Mini Portable Microwave Use Egg Boiler,Kitchen
579,$13.99,$17.99,http://www.jollychic.com/p/high-accuracy-digital-spoon-scale-kitchen-scales-measuring-spoons-tool-g551846.html,High Accuracy Digital Spoon Scale Kitchen Scales Measuring Spoons Tool,Kitchen
701,$13.99,$22.99,http://www.jollychic.com/p/artizan-multifunctional-blender-egg-beater-cream-bakery-and-noodle-machine-eu-220v-50hz-g570690.html,ARTIZAN Multifunctional Blender Egg Beater Cream Bakery And Noodle Machine-EU 220V-50Hz,Kitchen
467,$65.00,$66.00,http://www.jollychic.com/p/300w-household-multi-functional-high-speed-electronic-blender-juicer-us-plug-g589048.html,300W Household Multi-Functional High Speed Electronic Blender Juicer US Plug,Kitchen
89,$3.99,$6.99,http://www.jollychic.com/p/thermometer-lcd-display-fast-reading-stainless-steel-thermometer-for-cooking-liquid-g773444.html,Thermometer LCD Display Fast Reading Stainless Steel Thermometer For Cooking/ Liquid,Kitchen
41,$9.99,$12.99,http://www.jollychic.com/p/kitchen-scale-0-01-x-300g-electronic-digital-balance-pocket-weighing-scale-g806062.html,Kitchen Scale 0.01 x 300g Electronic Digital Balance Pocket Weighing Scale,Kitchen
476,$42.99,$70.00,http://www.jollychic.com/p/coffee-maker-household-mini-multi-functional-2-cups-heat-preserve-anti-slip-coffee-maker-au-plug-g886914.html,Coffee Maker Household Mini Multi-Functional 2 Cups Heat Preserve Anti-Slip Coffee Maker AU Plug,Kitchen
318,$23.99,$36.99,http://www.jollychic.com/p/vacuum-sealer-automatic-domestic-food-small-vacuum-package-sealer-g924382.html,Vacuum Sealer Automatic Domestic Food Small Vacuum Package Sealer,Kitchen
856,$43.99,$68.00,http://www.jollychic.com/p/coffee-maker-household-large-capacity-automatic-drip-type-coffee-or-tea-machine-g1094816.html,Coffee Maker Household Large Capacity Automatic Drip Type Coffee Or Tea Machine,Kitchen
55,$23.99,$39.99,http://www.jollychic.com/p/juicer-creative-household-portable-mini-juice-multi-function-durable-extractor-eu-plug-g1264428.html,Juicer Creative Household Portable Mini Juice Multi-Function Durable Extractor EU Plug,Kitchen
9,$27.99,,http://www.jollychic.com/p/milk-heater-portable-dc-12v-household-travel-cup-warmer-heater-g1287236.html,Milk Heater Portable DC 12V Household Travel Cup Warmer Heater,Kitchen
43,$72.00,$130.00,http://www.jollychic.com/p/food-processor-multifunctional-soymilk-machine-household-blender-juicer-220v-240v-g476510.html,Food Processor Multifunctional Soymilk Machine Household Blender Juicer 220V-240V,Kitchen
77,$114.00,$195.00,http://www.jollychic.com/p/drinks-blender-household-multifunctional-stainless-steel-single-headed-milkshake-machine-220-240v-g476582.html,Drinks Blender Household Multifunctional Stainless Steel Single-Headed Milkshake Machine 220-240V,Kitchen
138,$37.99,$56.00,http://www.jollychic.com/p/household-universal-portable-food-fruit-blender-china-standard-plug-g607294.html,Household Universal Portable Food Fruit Blender China Standard Plug,Kitchen
180,$2.99,$3.99,http://www.jollychic.com/p/thermometer-mini-portable-cooking-use-probe-type-digital-thermometer-g651988.html,Thermometer Mini Portable Cooking Use Probe Type Digital Thermometer,Kitchen
25,$66.00,$80.00,http://www.jollychic.com/p/bear-grinder-household-quiet-safe-fine-grinding-big-capacity-electric-grinder-chinese-standard-plug-g728646.html,Bear Grinder Household Quiet Safe Fine Grinding Big Capacity Electric Grinder-Chinese Standard Plug,Kitchen
181,$14.99,$16.99,http://www.jollychic.com/p/electric-juicer-380ml-usb-handheld-smoothie-maker-blender-bottle-juice-cup-g773332.html,Electric Juicer 380ML USB Handheld Smoothie Maker Blender Bottle Juice Cup,Kitchen
73,$8.99,$14.99,http://www.jollychic.com/p/milk-bubbler-tool-micro-simple-designed-bubbler-maker-a2-g796264.html,Milk Bubbler Tool Micro Simple Designed Bubbler Maker A2,Kitchen
586,$16.99,$22.99,http://www.jollychic.com/p/electric-juicer-multifunctional-household-mini-portable-wired-control-juicer-g825658.html,Electric Juicer Multifunctional Household Mini Portable Wired Control Juicer,Kitchen
141,$19.99,$26.99,http://www.jollychic.com/p/electric-fruit-juicer-usb-charging-stainless-steel-handheld-portable-juice-cup-g1039366.html,Electric Fruit Juicer USB Charging Stainless Steel Handheld Portable Juice Cup,Kitchen
51,$35.99,,http://www.jollychic.com/p/juicer-electric-multifunctional-home-mini-juicer-eu-g1052680.html,Juicer Electric Multifunctional Home Mini Juicer EU,Kitchen
38,$75.00,,http://www.jollychic.com/p/fruit-mask-machine-portable-multi-funtion-household-durable-high-quality-vegetable-mask-machine-g1141720.html,Fruit Mask Machine Portable Multi-Funtion Household Durable High Quality Vegetable Mask Machine,Kitchen
10,$35.99,$56.00,http://www.jollychic.com/p/bean-grinder-household-electric-semi-automatic-coffee-pot-coffee-bean-herbal-nut-grinder-g1270126.html,Bean Grinder Household Electric Semi-automatic Coffee Pot Coffee Bean Herbal Nut Grinder,Kitchen
7,$79.00,,http://www.jollychic.com/p/coffee-maker-one-click-operation-heat-preservation-full-automatic-drip-coffee-maker-eu-plug-g1289536.html,Coffee Maker One-Click Operation Heat Preservation Full Automatic Drip Coffee Maker EU Plug,Kitchen
2,$9.99,,http://www.jollychic.com/p/portable-mini-manual-fruit-juicer-plastic-household-portable-juicer-g1314338.html,Portable Mini Manual Fruit Juicer Plastic Household Portable Juicer,Kitchen
908,$15.99,$17.99,http://www.jollychic.com/p/universal-portable-high-precision-kitchen-electronic-scale-g500584.html,Universal Portable High Precision Kitchen Electronic Scale,Kitchen
857,$8.99,$11.99,http://www.jollychic.com/p/baby-bottle-warmer-household-portable-baby-milk-warmer-g545080.html,Baby Bottle Warmer Household Portable Baby Milk Warmer,Kitchen
1277,$7.99,$9.99,http://www.jollychic.com/p/self-stirring-mug-automatic-coffee-mixing-cup-electric-coffee-mug-thermocup-g551834.html,Self Stirring Mug Automatic Coffee Mixing Cup Electric Coffee Mug Thermocup,Kitchen
596,$8.99,$11.99,http://www.jollychic.com/p/household-mini-multi-functional-egg-boiler-220v-350w-eu-plug-g592942.html,Household Mini Multi-Functional Egg Boiler 220V 350W EU Plug,Kitchen
1091,$7.99,$9.99,http://www.jollychic.com/p/blender-electric-auto-stirring-anti-leak-stirring-cup-h19-6-2A7-6cm-g597520.html,Blender Electric Auto-Stirring Anti Leak Stirring Cup-H19.6*7.6cm,Kitchen
4987,$15.99,$22.99,http://www.jollychic.com/p/sealing-machine-lightweight-quick-temperature-adjustable-impulse-sealer-220v-300w-23-2A30-2A1-1cm-g609142.html,Sealing Machine Lightweight Quick Temperature Adjustable Impulse Sealer 220V 300W-23*30*1.1cm,Kitchen
28,$13.99,$15.99,http://www.jollychic.com/p/kitchen-scale-portable-universal-5kg-max-electric-kitchen-scale-g754824.html,Kitchen Scale Portable Universal 5KG Max Electric Kitchen Scale,Kitchen
292,$8.99,$14.99,http://www.jollychic.com/p/milk-bubbler-tool-micro-modern-designed-bubbler-maker-d-g778890.html,Milk Bubbler Tool Micro Modern Designed Bubbler Maker D,Kitchen
148,$22.99,$40.99,http://www.jollychic.com/p/bread-machine-household-mini-stainless-steel-double-layer-bread-toaster-g834616.html,Bread Machine Household Mini Stainless Steel Double Layer Bread Toaster,Kitchen
74,$39.99,,http://www.jollychic.com/p/juicer-portable-universal-usb-charging-multi-functional-juicer-g1027412.html,Juicer Portable Universal USB Charging Multi-Functional Juicer,Kitchen
1157,$18.99,$35.99,http://www.jollychic.com/p/electronic-spoon-weighing-electronic-spoon-scoop-said-food-scale-powder-scale-miniature-electronic-kitchen-scale-g412152.html,Electronic Spoon Weighing Electronic Spoon Scoop Said Food Scale Powder Scale Miniature Electronic Kitchen Scale,Kitchen
1912,$14.99,,http://www.jollychic.com/p/electric-home-egg-boiler-frying-non-stick-pan-multifunctional-cooker-steamer-g551832.html,Electric Home Egg boiler Frying Non Stick Pan Multifunctional Cooker Steamer,Kitchen
1163,$24.99,$31.99,http://www.jollychic.com/p/multi-functional-portable-household-usb-charging-electronic-juicer-g592380.html,Multi-functional Portable Household USB Charging Electronic Juicer,Kitchen
522,$12.99,$19.99,http://www.jollychic.com/p/artizan-electrical-hot-pot-household-multifunction-electric-heat-pot-boodle-pot-220-eu-g689884.html,Artizan Electrical Hot Pot Household Multifunction Electric Heat Pot Boodle Pot 220-EU,Kitchen
53,$36.99,$48.99,http://www.jollychic.com/p/bear-blender-multi-functional-big-capacity-high-speed-safe-electric-blender-chinese-standard-plug-g728962.html,Bear Blender Multi-Functional Big Capacity High Speed Safe Electric Blender-Chinese Standard Plug,Kitchen
454,$28.99,$32.99,http://www.jollychic.com/p/coffee-grinder-household-retro-style-household-hand-grinding-machine-g741288.html,Coffee Grinder Household Retro Style Household Hand Grinding Machine,Kitchen
75,$82.00,$87.00,http://www.jollychic.com/p/staresso-coffee-maker-portable-mini-easy-operation-hand-press-coffee-machine-g774644.html,STARESSO Coffee Maker Portable Mini Easy Operation Hand Press Coffee Machine,Kitchen
20,$8.99,$13.99,http://www.jollychic.com/p/electric-scale-0-1g-1000g-1kg-digital-pocket-scale-electronic-lcd-balance-weight-g805622.html,Electric Scale 0.1g 1000g 1Kg Digital Pocket Scale Electronic LCD Balance Weight,Kitchen
111,$6.99,$8.99,http://www.jollychic.com/p/kitchen-scale-0-1g-1000g-1kg-lcd-display-digital-balancing-weighting-scale-g806126.html,Kitchen Scale 0.1g - 1000g 1KG LCD Display Digital Balancing Weighting Scale,Kitchen
2180,$13.99,$20.99,http://www.jollychic.com/p/chocolate-melting-pot-household-smart-temperature-control-chocolate-machine-eu-plug-220-230v-g825188.html,Chocolate Melting Pot Household Smart Temperature Control Chocolate Machine-EU Plug-220-230V,Kitchen
245,$7.99,$12.99,http://www.jollychic.com/p/automatic-mixing-cup-handy-convenient-stirring-cup-coffee-drink-tea-cup-g855762.html,Automatic Mixing Cup Handy Convenient Stirring Cup Coffee Drink Tea Cup,Kitchen
81,$29.99,,http://www.jollychic.com/p/electric-blender-paste-blender-built-in-battery-1000-ml-electric-blender-g1120646.html,Electric Blender Paste Blender Built-In Battery 1000 ML Electric Blender,Kitchen
66,$10.99,$25.99,http://www.jollychic.com/p/grinder-portable-household-stainless-steel-manual-grinding-machine-g1178050.html,Grinder Portable Household Stainless Steel Manual Grinding Machine,Kitchen
3,$66.00,,http://www.jollychic.com/p/kemei-meat-grinder-stainless-steel-multi-purpose-housheold-electric-vegetables-mixer-g1311044.html,Kemei Meat Grinder Stainless Steel Multi-Purpose Housheold Electric Vegetables Mixer,Kitchen
52,$127.00,$194.00,http://www.jollychic.com/p/food-processor-multifunctional-blender-soymilk-machine-household-juicer-220v-240v-g476554.html,Food Processor Multifunctional Blender Soymilk Machine Household Juicer 220V-240V,Kitchen
392,$4.99,$7.99,http://www.jollychic.com/p/household-convenient-3-feet-automatic-vibrant-mixer-egg-machine-blender-g585454.html,Household Convenient 3 Feet Automatic Vibrant Mixer Egg Machine Blender,Kitchen
157,$24.99,$32.99,http://www.jollychic.com/p/bear-bean-grinder-electric-convenient-universal-household-coffee-bean-grinder220v-china-standard-plug-g687808.html,Bear Bean Grinder Electric Convenient Universal Household Coffee Bean Grinder220V-China Standard Plug,Kitchen
97,$9.99,$11.99,http://www.jollychic.com/p/kitchen-scale-portable-lightweight-accurate-with-lcd-kitchen-scale-g693582.html,Kitchen Scale Portable Lightweight Accurate With LCD Kitchen Scale,Kitchen
315,$13.99,$17.99,http://www.jollychic.com/p/smokeless-electrical-cookers-multi-functional-heating-pots-220v-600w-eu-plug-g694414.html,Smokeless Electrical Cookers Multi-functional Heating Pots 220V 600W-EU Plug,Kitchen
684,$10.99,$12.99,http://www.jollychic.com/p/mixer-cup-stainless-steel-auto-stirring-electric-mixer-cup-g713190.html,Mixer Cup Stainless Steel Auto-Stirring Electric Mixer Cup,Kitchen
