add_wish,discount_price,original_price,product_link,product_name,header_block
318,$18.99,$21.99,http://www.jollychic.com/p/lamp-portable-practical-5050-usb-30-led-rgb-color-changing-light-bar-5v-g809466.html,Lamp Portable Practical 5050 USB 30 LED RGB Color Changing Light Bar -5V,Appliances
50,$11.99,$18.99,http://www.jollychic.com/p/water-pump-solar-power-fountain-pool-water-pump-for-garden-plants-watering-g810420.html,Water Pump Solar Power Fountain Pool Water Pump For Garden/ Plants Watering,Appliances
2180,$13.99,$20.99,http://www.jollychic.com/p/chocolate-melting-pot-household-smart-temperature-control-chocolate-machine-eu-plug-220-230v-g825188.html,Chocolate Melting Pot Household Smart Temperature Control Chocolate Machine-EU Plug-220-230V,Appliances
235,$51.00,$78.00,http://www.jollychic.com/p/aroma-essential-oil-diffuser-color-changing-ultrasonic-air-humidifier-g828140.html,Aroma Essential Oil Diffuser Color Changing Ultrasonic Air Humidifier,Appliances
245,$7.99,$12.99,http://www.jollychic.com/p/automatic-mixing-cup-handy-convenient-stirring-cup-coffee-drink-tea-cup-g855762.html,Automatic Mixing Cup Handy Convenient Stirring Cup Coffee Drink Tea Cup,Appliances
33,$8.99,$15.99,http://www.jollychic.com/p/digital-scale-100g-x-0-01g-hosehold-lcd-jewelry-gold-gram-balance-weight-scale-g857178.html,Digital Scale 100g x 0.01G Hosehold LCD Jewelry Gold Gram Balance Weight Scale,Appliances
176,$13.99,$18.99,http://www.jollychic.com/p/electric-powder-puff-3d-multi-function-micro-frequency-vibration-beauty-makeup-g865348.html,Electric Powder Puff 3D Multi-Function Micro- Frequency Vibration Beauty Makeup,Appliances
5,$24.99,,http://www.jollychic.com/p/multi-functional-digital-thermometer-food-probe-oven-timer-temperature-measurer-g866026.html,Multi-Functional Digital Thermometer Food Probe Oven Timer Temperature Measurer,Appliances
51,$25.99,$39.99,http://www.jollychic.com/p/4-in-1-electric-rechargeable-foot-skin-grinder-shaver-defeatherer-hair-clipper-g866148.html,"4 In 1 Electric Rechargeable Foot Skin Grinder,Shaver, Defeatherer Hair Clipper",Appliances
37,$10.99,,http://www.jollychic.com/p/fan-clip-design-portable-rechargeable-usb-lightweight-fan-g870248.html,Fan Clip Design Portable Rechargeable USB Lightweight Fan,Appliances
32,$72.00,$90.00,http://www.jollychic.com/p/portable-facial-clean-device-mini-sonic-deep-clean-multi-function-messager-eu-g872052.html,Portable Facial Clean Device Mini Sonic Deep Clean Multi-Function Messager EU,Appliances
4,$5.99,$12.99,http://www.jollychic.com/p/portable-remote-controller-universal-remote-control-for-lcd-led-hdtv-tv-g873486.html,Portable Remote Controller Universal Remote Control For LCD/LED/HDTV/TV,Appliances
4,$13.99,$20.99,http://www.jollychic.com/p/water-spray-universal-portable-handheld-nano-atomized-facial-water-spray-g923668.html,Water Spray Universal Portable Handheld Nano Atomized Facial Water Spray,Appliances
140,$13.99,$23.99,http://www.jollychic.com/p/hair-straightener-anion-protection-household-portable-hair-straightener-g938936.html,Hair Straightener Anion Protection Household Portable Hair Straightener,Appliances
21,$13.99,$21.99,http://www.jollychic.com/p/hearing-aid-mini-super-adjustable-tone-earaids-g957976.html,Hearing Aid Mini Super Adjustable Tone EarAids,Appliances
18,$13.99,$20.99,http://www.jollychic.com/p/sunluxy-smart-camera-ir-leds-night-vision-indoor-700tvl-security-dome-camera-g958640.html,Sunluxy Smart Camera IR LEDs Night Vision Indoor 700TVL Security Dome Camera,Appliances
24,$30.99,$43.99,http://www.jollychic.com/p/camera-indoor-outdoor-day-night-weatherproof-security-camera-g960674.html,Camera Indoor Outdoor Day Night Weatherproof Security Camera,Appliances
13,$9.99,$12.99,http://www.jollychic.com/p/4000w-high-power-scr-regulator-electronic-volt-speed-controller-ac-220v-g965454.html,4000W High Power SCR Regulator Electronic Volt Speed Controller AC 220V,Appliances
92,$2.99,$11.99,http://www.jollychic.com/p/rgb-led-lamp-colorful-magic-bulbs-ac-85-265v-auto-rotating-stage-party-led-bulb-g966624.html,RGB LED Lamp Colorful Magic Bulbs AC 85-265V Auto Rotating Stage Party LED Bulb,Appliances
3,$9.99,$13.99,http://www.jollychic.com/p/kg316t-lcd-digital-display-microcomputer-switch-timer-controller-dc-ac-12v-uk-g980724.html,KG316T LCD Digital Display Microcomputer Switch Timer Controller DC/AC 12V UK,Appliances
145,$20.99,$26.99,http://www.jollychic.com/p/skinray-wavebetter-portable-skin-care-facial-cleaning-device-g983660.html,SKINRAY Wavebetter Portable Skin Care Facial Cleaning Device,Appliances
8,$24.99,$33.99,http://www.jollychic.com/p/hair-clipper-adult-children-electric-ultra-quiet-usb-charging-hair-clipper-g986324.html,Hair Clipper Adult&Children Electric Ultra Quiet USB Charging Hair Clipper,Appliances
10,$9.99,$13.99,http://www.jollychic.com/p/-rk-g12-10-150cm-automatic-doors-infrared-safety-detector-sensors-distance-active-g986920.html,(RK-G12)10-150cm Automatic Doors Infrared Safety Detector Sensors Distance Active,Appliances
2,$10.99,$13.99,http://www.jollychic.com/p/sonoff-wireless-wifi-itead-smart-switch-module-shell-abs-socket-for-home-diy-app-g989510.html,Sonoff Wireless WiFi ITEAD Smart Switch Module Shell ABS Socket For Home DIY APP,Appliances
88,$9.99,$13.99,http://www.jollychic.com/p/car-hair-straightener-travel-mini-flat-iron-styling-tools-convenient-portable-hair-straightener-g989534.html,Car Hair Straightener Travel Mini Flat Iron Styling Tools Convenient Portable Hair Straightener,Appliances
26,$21.99,$29.99,http://www.jollychic.com/p/toothbrush-sonic-patent-electric-holder-soft-brush-toothbrush-for-baby-and-adult-g990236.html,Toothbrush Sonic Patent Electric Holder Soft Brush Toothbrush For Baby and Adult,Appliances
11,$21.99,,http://www.jollychic.com/p/light-waterproof-digital-sensor-strips-activated-illumination-light-g990664.html,Light Waterproof Digital Sensor Strips Activated Illumination Light,Appliances
52,$26.99,$32.99,http://www.jollychic.com/p/110-220v-20w-rechargeable-and-electric-hair-clippers-trimmer-lcd-display-EF-BC-88eu-uk-us-au-standard-EF-BC-89-g993094.html,"110-220v ,20w Rechargeable And Electric Hair Clippers Trimmer LCD Display （EU UK US AU Standard）",Appliances
12,$11.99,,http://www.jollychic.com/p/thermometer-lcd-digital-solar-power-window-temperature-meter-g993638.html,Thermometer LCD Digital Solar Power Window Temperature Meter,Appliances
115,$5.99,$7.99,http://www.jollychic.com/p/camera-fake-dummy-bullet-imitation-home-security-surveillance-led-camera-g1000672.html,Camera Fake Dummy Bullet Imitation Home Security Surveillance LED Camera,Appliances
364,$9.99,$13.99,http://www.jollychic.com/p/artizan-hair-curler-2-in-1-multifunctional-electronic-dual-use-hair-straightener-g1009082.html,ARTIZAN Hair Curler 2 In 1 Multifunctional Electronic Dual-Use Hair Straightener,Appliances
49,$15.99,$23.99,http://www.jollychic.com/p/nose-hair-trimmer-universal-rechargeable-electric-cleaning-tool-eu-plug-g1009670.html,Nose Hair Trimmer Universal Rechargeable Electric Cleaning Tool EU Plug,Appliances
46,$4.99,$7.99,http://www.jollychic.com/p/led-light-5m-50-led-copper-wire-xmas-wedding-party-string-fairy-light-lamp-g1015796.html,LED Light 5M 50 LED Copper Wire Xmas Wedding Party String Fairy Light Lamp,Appliances
6,$146.00,,http://www.jollychic.com/p/ip-camera-wireless-smart-baby-monitor-cctv-security-camera-g1016914.html,IP Camera Wireless Smart Baby Monitor CCTV Security Camera,Appliances
2,$8.99,,http://www.jollychic.com/p/usb-voltmeter-multi-purpose-ammeter-power-capacity-tester-voltage-current-meter-g1016988.html,USB Voltmeter Multi-Purpose Ammeter Power Capacity Tester Voltage Current Meter,Appliances
7,$15.99,,http://www.jollychic.com/p/wired-smoke-infrared-detector-sensor-for-fire-alarm-system-home-security-dc12v-g1018338.html,Wired Smoke Infrared Detector Sensor for Fire Alarm System Home Security DC12V,Appliances
3,$30.99,,http://www.jollychic.com/p/1pcs-r7s-228-led-bulb-10w-smd-corn-light-lamp-g1019078.html,1Pcs R7S 228 LED Bulb 10W SMD Corn Light Lamp,Appliances
13,$26.99,,http://www.jollychic.com/p/electric-shaver-hair-removal-epilator-leg-underarm-bikini-line-body-shaving-care-tool-g1038874.html,Electric Shaver Hair Removal Epilator Leg Underarm Bikini Line Body Shaving Care Tool,Appliances
24,$17.99,$27.99,http://www.jollychic.com/p/steaming-iron-hand-held-household-portable-high-power-electric-iron-g1039482.html,Steaming Iron Hand-Held Household Portable High Power Electric Iron,Appliances
4,$9.99,,http://www.jollychic.com/p/waterproof-3m-30-led-silver-wire-string-light-indoor-outdoor-decoration-lamp-g1039488.html,Waterproof 3M 30 LED Silver Wire String Light Indoor Outdoor Decoration Lamp,Appliances
8,$10.99,,http://www.jollychic.com/p/usb-rechargeable-led-flashlight-powerful-mini-led-torch-waterproof-design-g1039810.html,USB Rechargeable LED Flashlight Powerful Mini LED Torch Waterproof Design,Appliances
7,$9.99,,http://www.jollychic.com/p/dust-proof-protective-cover-skin-case-for-apple-tv-4th-siri-remote-control-controller-g1041140.html,Dust-Proof Protective Cover Skin Case for Apple TV 4th Siri Remote Control Controller,Appliances
21,$14.99,,http://www.jollychic.com/p/night-light-circular-halo-light-control-induction-led-night-light-g1043870.html,Night Light Circular Halo Light Control Induction LED Night Light,Appliances
107,$39.99,,http://www.jollychic.com/p/silent-automatic-ceramic-hair-curler-lcd-display-curling-iron-roller-with-g1055458.html,Silent Automatic Ceramic Hair Curler LCD Display Curling Iron Roller with,Appliances
31,$5.99,$18.99,http://www.jollychic.com/p/light-solar-led-wall-waterproof-panel-light-for-outdoor-garden-fence-yard-g1055690.html,Light Solar Led Wall Waterproof Panel Light For Outdoor Garden Fence Yard,Appliances
23,$23.99,,http://www.jollychic.com/p/led-light-creative-eye-protection-folding-night-table-lamp-g1065858.html,LED Light Creative Eye-protection Folding Night Table Lamp,Appliances
37,$12.99,,http://www.jollychic.com/p/led-light-portable-mini-design-household-eye-protection-touch-night-light-g1076712.html,LED Light Portable Mini Design Household Eye Protection Touch Night Light,Appliances
164,$6.99,$13.99,http://www.jollychic.com/p/electric-eye-massager-mini-design-face-lift-firming-massager-beauty-instrument-g1077122.html,Electric Eye Massager Mini Design Face-Lift Firming Massager Beauty Instrument,Appliances
90,$13.99,$19.99,http://www.jollychic.com/p/nail-light-led-mini-design-portable-nail-polishing-nail-therapy-lamp-g1078336.html,Nail Light LED Mini Design Portable Nail Polishing Nail Therapy Lamp,Appliances
16,$40.99,$63.00,http://www.jollychic.com/p/veskys-smart-camera-1080p-2-0mp-hd-wi-fi-night-vision-ip-camera-eu-us-uk-plug-g1084210.html,VESKYS Smart Camera 1080P 2.0MP HD Wi-Fi Night Vision IP Camera EU/US/UK Plug,Appliances
9,$35.99,,http://www.jollychic.com/p/led-wall-lamp-simpe-style-shell-design-creative-decorative-painting-fresco-light-110v-240v-g1094526.html,LED Wall lamp Simpe Style Shell Design Creative Decorative Painting Fresco Light-110V-240V,Appliances
27,$13.99,,http://www.jollychic.com/p/massager-mini-three-foot-massager-electric-portable-g1119930.html,Massager Mini Three Foot Massager Electric Portable,Appliances
81,$29.99,,http://www.jollychic.com/p/electric-blender-paste-blender-built-in-battery-1000-ml-electric-blender-g1120646.html,Electric Blender Paste Blender Built-In Battery 1000 ML Electric Blender,Appliances
12,$12.99,,http://www.jollychic.com/p/2pcs-flashlights-mini-100lm-9-leds-lanyard-anti-slip-rubber-portable-torch-flashlight-g1137518.html,2PCS Flashlights Mini 100LM 9 LEDs Lanyard Anti-slip Rubber Portable Torch Flashlight,Appliances
7,$15.99,,http://www.jollychic.com/p/string-light-2m-20-leds-waterproof-battery-powered-string-fairy-lights-lamp-for-christmas-g1138030.html,String Light 2M 20 LEDs Waterproof Battery Powered String Fairy Lights Lamp For Christmas,Appliances
0,$23.99,,http://www.jollychic.com/p/croled-light-bulb-15w-g24-horizontal-plug-white-light-led-lamp-bulb-g1138772.html,CroLED Light Bulb 15W G24 Horizontal Plug White Light LED Lamp Bulb,Appliances
0,$5.99,,http://www.jollychic.com/p/light-bulb-warm-white-g4-1-5w-mini-smd-led-light-bulb-lamp-g1140348.html,Light Bulb Warm White G4 1.5W Mini SMD LED Light Bulb Lamp,Appliances
30,$5.99,$9.99,http://www.jollychic.com/p/ear-wax-remover-cleaner-set-safe-removal-vacuum-cleaner-health-cleaning-g1150246.html,Ear Wax Remover Cleaner Set Safe Removal Vacuum Cleaner Health Cleaning,Appliances
3,$54.00,,http://www.jollychic.com/p/aroma-essential-oil-diffuser-300ml-portable-ultrasonic-cool-mist-air-diffuser-us-standard-g1154276.html,Aroma Essential Oil Diffuser 300ml Portable Ultrasonic Cool Mist Air Diffuser US Standard,Appliances
0,$39.99,,http://www.jollychic.com/p/night-light-2-in-1-7-colors-changing-touch-table-desk-led-lamp-usb-speaker-g1156382.html,Night Light 2-In-1 7 Colors Changing Touch Table Desk LED Lamp USB Speaker,Appliances
23,$25.99,,http://www.jollychic.com/p/humidifier-universal-portable-household-mini-lemon-design-humidifier-g1164848.html,Humidifier Universal Portable Household Mini Lemon Design Humidifier,Appliances
3,$10.99,,http://www.jollychic.com/p/led-light-portable-colorful-light-cartoon-dolphin-design-bright-flashing-night-light-g1170842.html,LED Light Portable Colorful Light Cartoon Dolphin Design Bright Flashing Night Light,Appliances
66,$10.99,$25.99,http://www.jollychic.com/p/grinder-portable-household-stainless-steel-manual-grinding-machine-g1178050.html,Grinder Portable Household Stainless Steel Manual Grinding Machine,Appliances
19,$39.99,,http://www.jollychic.com/p/humidifier-household-office-mini-ultrasonic-mute-night-light-humidifying-atomizer-g1179184.html,Humidifier Household Office Mini Ultrasonic Mute Night Light Humidifying Atomizer,Appliances
189,$37.99,$45.99,http://www.jollychic.com/p/intelligent-light-rgb-colorful-light-creative-app-control-household-background-lamp-g1198404.html,Intelligent Light RGB Colorful Light Creative App Control Household Background Lamp,Appliances
1,$10.99,,http://www.jollychic.com/p/night-light-mini-g9-cob-6w-ac-100-120v-ultra-bright-360-beam-angle-dimmable-led-lamp-g1199434.html,Night Light Mini G9 COB 6W AC 100-120V Ultra Bright 360 Beam Angle Dimmable LED Lamp,Appliances
9,$22.99,$31.99,http://www.jollychic.com/p/lamp-led-creative-love-heart-design-eye-protective-led-desk-lamp-g1211214.html,Lamp LED Creative Love Heart Design Eye Protective LED Desk Lamp,Appliances
9,$28.99,$39.99,http://www.jollychic.com/p/kemei-hair-curling-comb-2-in-1-multi-purpose-household-portable-hair-dryer-g1234902.html,Kemei Hair Curling Comb 2 In 1 Multi-Purpose Household Portable Hair Dryer,Appliances
10,$22.99,$29.99,http://www.jollychic.com/p/electric-toothbrush-wireless-charging-waterproof-ultrasonic-clean-timing-portable-toothbrush-g1265282.html,Electric Toothbrush Wireless Charging Waterproof Ultrasonic Clean Timing Portable Toothbrush,Appliances
4,$10.99,$19.99,http://www.jollychic.com/p/electric-toothbrush-durable-charging-waterproof-ultrasonic-clean-soft-brush-portable-toothbrush-g1265760.html,Electric Toothbrush Durable Charging Waterproof Ultrasonic Clean Soft Brush Portable Toothbrush,Appliances
9,$12.99,$19.99,http://www.jollychic.com/p/massager-household-portable-health-care-acupuncture-massage-instrument-g1269232.html,Massager Household Portable Health Care Acupuncture Massage Instrument,Appliances
280,$16.99,$25.99,http://www.jollychic.com/p/beauty-wax-machine-multi-fucntion-face-foot-hand-cleasing-device-eu-plug-220v-g1270236.html,Beauty Wax Machine Multi-Fucntion Face Foot Hand Cleasing Device -EU Plug 220V,Appliances
34,$24.99,,http://www.jollychic.com/p/led-light-moon-star-clouds-lightning-shape-super-long-lift-time-neon-light-g1289338.html,LED Light Moon Star Clouds Lightning Shape Super Long Lift Time Neon Light,Appliances
10,$29.99,,http://www.jollychic.com/p/romantic-ocean-waves-led-night-light-projector-sleep-relaxing-lamp-with-speaker-g1294104.html,Romantic Ocean Waves LED Night Light Projector Sleep Relaxing Lamp With Speaker,Appliances
3,$66.00,,http://www.jollychic.com/p/kemei-meat-grinder-stainless-steel-multi-purpose-housheold-electric-vegetables-mixer-g1311044.html,Kemei Meat Grinder Stainless Steel Multi-Purpose Housheold Electric Vegetables Mixer,Appliances
2,$27.99,,http://www.jollychic.com/p/geekvape-tsunami-atomizer-high-quality-24-rda-rebulidable-dripping-atomizer-g1311808.html,GeekVape Tsunami Atomizer High Quality 24 RDA Rebulidable Dripping Atomizer,Appliances
5689,$5.99,$11.99,http://www.jollychic.com/p/mini-portable-foldable-three-gear-hair-drier-eu-plug-g368560.html,Mini Portable Foldable Three Gear Hair Drier EU Plug,Appliances
8047,$4.99,$14.99,http://www.jollychic.com/p/candy-color-handy-lovely-mini-curling-iron-g388700.html,Candy Color Handy Lovely Mini Curling Iron,Appliances
634,$33.99,$44.99,http://www.jollychic.com/p/white-ceramic-mini-automatic-hair-curling-iron-with-eu-us-uk-au-plug-g339674.html,White Ceramic Mini Automatic Hair Curling Iron With EU/US/UK/AU Plug,Appliances
1553,$5.99,$14.99,http://www.jollychic.com/p/handy-lightweight-pocket-hairdressing-curling-iron-eu-plug-g368504.html,Handy Lightweight Pocket Hairdressing Curling Iron EU Plug,Appliances
2969,$4.99,$9.99,http://www.jollychic.com/p/mini-cartoon-animal-pattern-usb-silent-electric-fan-g368632.html,Mini Cartoon Animal Pattern USB Silent Electric Fan,Appliances
1550,$7.99,$17.99,http://www.jollychic.com/p/hair-straightener-delicate-cute-mini-hair-curlers-g388504.html,Hair Straightener Delicate Cute Mini Hair Curlers,Appliances
32,$77.00,$100.00,http://www.jollychic.com/p/keeper-qf600-hd720p-camera-g396290.html,Keeper QF600 HD720P Camera,Appliances
22,$3.99,$10.99,http://www.jollychic.com/p/portable-flashlight-black-plastic-waterproof-pen-shaped-led-lamp-g405250.html,Portable Flashlight Black Plastic Waterproof Pen Shaped LED Lamp,Appliances
191,$53.00,,http://www.jollychic.com/p/professional-infrared-human-body-thermometer-temperature-tester-for-home-g415020.html,Professional Infrared Human Body Thermometer Temperature Tester For Home,Appliances
64,$27.99,,http://www.jollychic.com/p/portable-purifier-creative-polo-shirt-shape-usb-mini-humidifier-g421532.html,Portable Purifier Creative Polo Shirt Shape USB Mini Humidifier,Appliances
569,$66.00,$76.00,http://www.jollychic.com/p/household-20000mah-mini-solar-power-supply-kit-g460778.html,Household 20000mAh Mini Solar Power Supply Kit,Appliances
105,$36.99,$45.99,http://www.jollychic.com/p/ultra-thin-electric-pulse-arc-cigarette-lighter-g463614.html,Ultra-thin Electric Pulse Arc Cigarette Lighter,Appliances
52,$127.00,$194.00,http://www.jollychic.com/p/food-processor-multifunctional-blender-soymilk-machine-household-juicer-220v-240v-g476554.html,Food Processor Multifunctional Blender Soymilk Machine Household Juicer 220V-240V,Appliances
155,$70.00,,http://www.jollychic.com/p/mask-portable-intelligent-with-electric-fan-breathable-mask-g497176.html,Mask Portable Intelligent With Electric Fan Breathable Mask,Appliances
205,$185.00,$229.00,http://www.jollychic.com/p/wireless-camera-monitor-wireless-transmission-network-kit-support-android-ios-g509430.html,Wireless Camera Monitor Wireless Transmission Network Kit Support Android/iOS,Appliances
51,$4.99,$9.99,http://www.jollychic.com/p/green-lovely-elephant-night-lamp-led-night-lamp-g516250.html,Green Lovely Elephant Night Lamp LED Night Lamp,Appliances
807,$28.99,$46.99,http://www.jollychic.com/p/vacuum-3-in-1-household-convenient-broom-dustpan-dustbin-vacuum-cleaner-g523730.html,Vacuum 3-In-1 Household Convenient Broom Dustpan Dustbin Vacuum Cleaner,Appliances
777,$15.99,$18.99,http://www.jollychic.com/p/digital-weight-scale-mini-portable-ultra-thin-precise-electronic-scale-g538994.html,Digital Weight Scale Mini Portable Ultra-Thin Precise Electronic Scale,Appliances
4461,$8.99,$11.99,http://www.jollychic.com/p/romantic-sky-star-digital-led-projector-music-alarm-table-clock-calendar-g539804.html,Romantic Sky Star Digital LED Projector Music Alarm Table Clock Calendar,Appliances
71,$6.99,,http://www.jollychic.com/p/clock-household-multi-functional-led-backlight-clock-g541046.html,Clock Household Multi-Functional LED Backlight Clock,Appliances
2659,$7.99,$9.99,http://www.jollychic.com/p/lamp-power-saving-waterproof-decorative-led-string-light-g551828.html,Lamp Power Saving Waterproof Decorative LED String Light,Appliances
437,$19.99,$20.99,http://www.jollychic.com/p/high-temperature-sterilizer-box-tools-disinfection-box-nail-sterilizer-tools-g552922.html,High Temperature Sterilizer Box Tools Disinfection Box Nail Sterilizer Tools,Appliances
2600,$8.99,$13.99,http://www.jollychic.com/p/lamp-low-power-consumption-flamingo-pattern-decorative-led-light-g554646.html,Lamp Low Power Consumption Flamingo Pattern Decorative LED Light,Appliances
2175,$12.99,$19.99,http://www.jollychic.com/p/electric-shaver-mini-portable-facial-hair-epilator-g564834.html,Electric Shaver Mini Portable Facial Hair Epilator,Appliances
88,$6.99,$9.99,http://www.jollychic.com/p/lamp-mini-touch-control-adjustable-led-night-light-g575498.html,Lamp Mini Touch Control Adjustable LED Night Light,Appliances
392,$4.99,$7.99,http://www.jollychic.com/p/household-convenient-3-feet-automatic-vibrant-mixer-egg-machine-blender-g585454.html,Household Convenient 3 Feet Automatic Vibrant Mixer Egg Machine Blender,Appliances
1046,$6.99,$10.99,http://www.jollychic.com/p/multifunctional-rat-mouse-repellent-anti-mosquito-repeller-eu-plug-g589050.html,Multifunctional Rat Mouse Repellent Anti Mosquito Repeller EU Plug,Appliances
3700,$11.99,$15.99,http://www.jollychic.com/p/10-meters-outdoor-lantern-shaped-decorative-lamp-eu-plug-220v-g594618.html,10 Meters Outdoor Lantern Shaped Decorative Lamp EU Plug 220V,Appliances
355,$19.99,$22.99,http://www.jollychic.com/p/lamp-solar-power-pir-sensor-light-sensor-double-head-led-spot-light-18-2A11-2-2A17cm-g604876.html,Lamp Solar Power PIR Sensor Light Sensor Double-Head LED Spot Light-18*11.2*17cm,Appliances
48,$41.99,$52.00,http://www.jollychic.com/p/smart-socket-remote-wireless-control-time-setting-wifi-smart-socket-53-2A53-2A54mm-g607246.html,Smart Socket Remote Wireless Control Time Setting WiFi Smart Socket-53*53*54mm,Appliances
930,$4.99,$7.99,http://www.jollychic.com/p/2-in-1-dual-use-portable-universal-hair-curler-straightener-220v-eu-plug-g625538.html,2 In 1 Dual Use Portable Universal Hair Curler Straightener 220V EU Plug,Appliances
980,$6.99,$9.99,http://www.jollychic.com/p/universal-solar-energy-led-garden-lawn-pest-repeller-g625734.html,Universal Solar Energy LED Garden Lawn Pest Repeller,Appliances
813,$13.99,$15.99,http://www.jollychic.com/p/iron-multi-functional-2-in-1-portable-handheld-garment-steamer-air-humidifier-220v-eu-uk-plug-g626524.html,Iron Multi-Functional 2 In 1 Portable Handheld Garment Steamer Air Humidifier 220V EU/UK Plug,Appliances
14,$13.99,$18.99,http://www.jollychic.com/p/socket-with-lcd-screen-household-electric-power-measuring-socket-g651990.html,Socket With LCD Screen Household Electric Power Measuring Socket,Appliances
99,$1.99,,http://www.jollychic.com/p/lamp-portable-simple-operation-high-power-efficiency-battery-powered-led-camp-light-g652914.html,Lamp Portable Simple Operation High Power Efficiency Battery Powered LED Camp Light,Appliances
5,$40.99,$52.00,http://www.jollychic.com/p/heart-rate-strap-accurate-real-time-monitor-wireless-bluetooth-transmission-heart-rate-chest-strap-g652918.html,Heart Rate Strap Accurate Real-Time Monitor Wireless Bluetooth Transmission Heart Rate Chest Strap,Appliances
208,$12.99,$17.99,http://www.jollychic.com/p/digital-lcd-wrist-blood-pressure-monitor-heart-rate-monitor-g653582.html,Digital LCD Wrist Blood Pressure Monitor Heart Rate Monitor,Appliances
446,$6.99,$8.99,http://www.jollychic.com/p/portable-lovely-hedgehog-pattern-dry-wet-dual-use-hair-curler-china-standard-plug-g656200.html,Portable Lovely Hedgehog Pattern Dry Wet Dual Use Hair Curler-China Standard Plug,Appliances
852,$80.00,$100.00,http://www.jollychic.com/p/vacuum-cleaner-strong-suction-low-noise-high-performance-double-side-brush-intelligent-sweeping-vacuum-cleaner-g660574.html,Vacuum Cleaner Strong Suction Low Noise High Performance Double-Side Brush Intelligent Sweeping Vacuum Cleaner,Appliances
12,$34.99,$42.99,http://www.jollychic.com/p/flyco-electric-shaver-lcd-display-ipx7-waterproof-3d-floating-electric-shaver-chinese-standard-plug-100v-7E240v-g677512.html,Flyco Electric Shaver LCD Display IPX7 Waterproof 3D Floating Electric Shaver (Chinese Standard Plug)-100V~240V,Appliances
71,$19.99,$21.99,http://www.jollychic.com/p/flyco-electric-epilator-household-portable-fashion-underarm-hair-epilator-chinese-standard-plug-100v-240v-7E-g681242.html,Flyco Electric Epilator Household Portable Fashion Underarm Hair Epilator (Chinese Standard Plug)-100V-240V~,Appliances
6,$74.00,,http://www.jollychic.com/p/bear-humidifer-4l-large-capacity-office-household-mute-humidifier-220v-china-standard-plug-g687556.html,Bear Humidifer 4L Large Capacity Office Household Mute Humidifier 220V-China Standard Plug,Appliances
157,$24.99,$32.99,http://www.jollychic.com/p/bear-bean-grinder-electric-convenient-universal-household-coffee-bean-grinder220v-china-standard-plug-g687808.html,Bear Bean Grinder Electric Convenient Universal Household Coffee Bean Grinder220V-China Standard Plug,Appliances
106,$11.99,,http://www.jollychic.com/p/household-led-socket-electric-mosquito-killer-zapper-night-lamp-lights-g688208.html,Household LED Socket Electric Mosquito Killer Zapper Night Lamp Lights,Appliances
146,$9.99,$15.99,http://www.jollychic.com/p/clock-multi-functional-digital-projection-with-weather-forecast-function-electronic-clock-g693528.html,Clock Multi-Functional Digital Projection With Weather Forecast Function Electronic Clock,Appliances
