add_wish,discount_price,original_price,product_link,product_name,header_block
59,$30.99,$34.99,http://www.jollychic.com/p/juicer-household-mini-multi-functional-400ml-blender-juicer-g716678.html,Juicer Household Mini Multi-Functional 400ml Blender Juicer,Kitchen
24,$8.99,$19.99,http://www.jollychic.com/p/yogurt-maker-household-stainless-steel-automatic-diy-delicious-yoghurt-maker-g1212008.html,Yogurt Maker Household Stainless Steel Automatic DIY Delicious Yoghurt Maker,Kitchen
30,$15.99,$21.99,http://www.jollychic.com/p/electronic-digital-spoon-scale-300-0-1g-portable-universal-durable-kitchen-spoon-scale-g1217708.html,Electronic Digital Spoon Scale 300/0.1g Portable Universal Durable Kitchen Spoon Scale,Kitchen
3299,$6.99,$7.99,http://www.jollychic.com/p/coffee-filter-paper-v-shape-pour-over-coffee-filter-paper-40-pcs-box-g556306.html,Coffee Filter Paper V-Shape Pour-Over Coffee Filter Paper-40 Pcs/Box,Kitchen
624,$13.99,$16.99,http://www.jollychic.com/p/ice-crusher-mini-household-convenient-quick-manual-operation-ice-crusher-g694584.html,Ice Crusher Mini Household Convenient Quick Manual Operation Ice Crusher,Kitchen
289,$9.99,$14.99,http://www.jollychic.com/p/milk-bubbler-tool-micro-modern-designed-bubbler-maker-a1-g735366.html,Milk Bubbler Tool Micro Modern Designed Bubbler Maker A1,Kitchen
824,$3.99,$6.99,http://www.jollychic.com/p/plastic-sealer-mini-heat-sealing-machine-hand-press-packing-sealer-tool-g758964.html,Plastic Sealer Mini Heat Sealing Machine Hand Press Packing Sealer Tool,Kitchen
994,$4.99,$8.99,http://www.jollychic.com/p/portable-food-sealer-household-universal-convenient-mini-sealing-machine-g758982.html,Portable Food Sealer Household Universal Convenient Mini Sealing Machine,Kitchen
70,$59.00,$70.00,http://www.jollychic.com/p/juicer-and-drinking-dual-use-portable-charged-cup-shape-juicer-g879726.html,Juicer And Drinking Dual-use Portable Charged Cup-shape Juicer,Kitchen
88,$12.99,$16.99,http://www.jollychic.com/p/kitchen-thermometer-household-muliti-purpose-food-cooking-lcd-measuring-tool-g938106.html,Kitchen Thermometer Household Muliti-Purpose Food Cooking LCD Measuring Tool,Kitchen
155,$5.99,$10.99,http://www.jollychic.com/p/camping-bbq-gas-electronic-lighter-igniter-cooker-kitchen-g1038932.html,Camping BBQ Gas Electronic Lighter Igniter Cooker Kitchen,Kitchen
38,$49.99,,http://www.jollychic.com/p/whisk-household-portable-7-speed-balloon-whip-eggbeater-kitchen-tool-g1137574.html,Whisk Household Portable 7-Speed Balloon Whip Eggbeater Kitchen Tool,Kitchen
39,$30.99,$45.99,http://www.jollychic.com/p/cooker-multi-functional-electric-heating-lunch-box-mini-electric-cooker-eu-standard-g1224540.html,Cooker Multi-functional Electric Heating Lunch Box Mini Electric Cooker EU Standard,Kitchen
6,$18.99,$29.99,http://www.jollychic.com/p/egg-machine-220v-electric-automatic-egg-roll-maker-machine-household-kitchen-cooking-tool-eu-plug-g1225918.html,Egg Machine 220V Electric Automatic Egg Roll Maker Machine Household Kitchen Cooking Tool EU Plug,Kitchen
30,$51.00,$70.00,http://www.jollychic.com/p/bread-machine-multi-function-household-electric-baking-pan-eu-plug-g1269866.html,Bread Machine Multi-Function Household Electric Baking Pan-EU Plug,Kitchen
182,$28.99,$39.99,http://www.jollychic.com/p/portable-hand-held-food-salinity-meter-g464414.html,Portable Hand-Held Food Salinity Meter,Kitchen
2777,$30.99,$47.99,http://www.jollychic.com/p/food-processor-semi-automatic-potato-slicer-g516498.html,Food Processor Semi Automatic Potato Slicer,Kitchen
2538,$36.99,$45.99,http://www.jollychic.com/p/artizan-electric-bread-waffle-maker-household-cartton-cup-cake-dessert-maker-baking-pan-220v-1000w-g578036.html,ARTIZAN Electric Bread Waffle Maker Household Cartton Cup Cake Dessert Maker Baking Pan 220V 1000W,Kitchen
113,$40.99,$53.00,http://www.jollychic.com/p/bear-ice-maker-household-0-8l-practical-automatic-one-button-operation-ice-cream-machine-china-standard-plug-g607818.html,BEAR Ice Maker Household 0.8L Practical Automatic One-Button Operation Ice Cream Machine China Standard Plug,Kitchen
89,$26.99,$31.99,http://www.jollychic.com/p/bear-egg-boiler-easy-operation-even-heating-double-layer-egg-boiler-chinese-standard-plug-g687508.html,Bear Egg Boiler Easy Operation Even Heating Double Layer Egg Boiler-Chinese Standard Plug,Kitchen
99,$41.99,$55.00,http://www.jollychic.com/p/bear-grinder-multifunctional-practical-bean-coffee-bean-grinder-220v-china-standard-plug-g687730.html,Bear Grinder Multifunctional Practical Bean/Coffee Bean Grinder 220V-China Standard Plug,Kitchen
69,$36.99,$43.99,http://www.jollychic.com/p/bear-electric-lunch-box-vacuum-seal-steam-circulation-heating-two-layer-electric-lunch-box-chinese-standard-plug-g728208.html,Bear Electric Lunch Box Vacuum Seal Steam Circulation Heating Two-Layer Electric Lunch Box-Chinese Standard Plug,Kitchen
82,$35.99,$45.99,http://www.jollychic.com/p/bear-electric-lunch-box-vacuum-seal-stainless-steel-double-layer-electric-lunch-box-chinese-standard-plug-g728506.html,Bear Electric Lunch Box Vacuum Seal Stainless Steel Double Layer Electric Lunch Box-Chinese Standard Plug,Kitchen
43,$36.99,$49.99,http://www.jollychic.com/p/bear-egg-boiler-multi-functional-non-stick-power-adjustable-detachable-egg-machine-chinese-standard-plug-g728688.html,Bear Egg Boiler Multi-Functional Non-Stick Power Adjustable Detachable Egg Machine-Chinese Standard Plug,Kitchen
12,$8.99,$10.99,http://www.jollychic.com/p/pocket-scale-0-1-500g-mini-digital-weight-pocket-electric-scale-g806576.html,Pocket Scale 0.1-500g Mini Digital Weight Pocket Electric Scale,Kitchen
29,$22.99,,http://www.jollychic.com/p/kitchen-cooking-thermometer-digital-lcd-display-portable-multi-functional-food-thermometer-g1158194.html,Kitchen Cooking Thermometer Digital LCD Display Portable Multi-functional Food Thermometer,Kitchen
1005,$9.99,$13.99,http://www.jollychic.com/p/noodle-machine-household-manual-operate-stainless-steel-five-templates-pasta-maker-15-2A6cm-g591026.html,Noodle Machine Household Manual Operate Stainless Steel Five Templates Pasta Maker-15*6cm,Kitchen
195,$17.99,$32.99,http://www.jollychic.com/p/ice-maker-mini-household-hand-cranked-practical-ice-maker-g495370.html,Ice Maker Mini Household Hand-cranked Practical Ice Maker,Kitchen
148,$17.99,$26.99,http://www.jollychic.com/p/bear-eggbeater-household-handheld-silicone-push-button-portable-food-blender-china-standard-plug-g607838.html,BEAR Eggbeater Household Handheld Silicone Push Button Portable Food Blender China Standard Plug,Kitchen
71,$26.99,$37.99,http://www.jollychic.com/p/bear-conjee-soup-cooker-multifunctional-household-food-heating-machine-china-standard-plug-g608010.html,BEAR Conjee & Soup Cooker Multifunctional Household Food Heating Machine China Standard Plug,Kitchen
192,$18.99,$24.99,http://www.jollychic.com/p/juicer-portable-double-seal-usb-powered-320ml-electric-juicer-bottle-g609218.html,Juicer Portable Double Seal USB Powered 320ML Electric Juicer Bottle,Kitchen
752,$7.99,$12.99,http://www.jollychic.com/p/electric-kettle-stainless-steel-quick-heating-1-1l-electric-kettle-g672716.html,Electric Kettle Stainless Steel Quick Heating 1.1L Electric Kettle,Kitchen
724,$9.99,$14.99,http://www.jollychic.com/p/electric-water-kettle-household-stainless-steel-quick-boiling-pot-eu-plug-g679722.html,Electric Water Kettle Household Stainless Steel Quick Boiling Pot-EU Plug,Kitchen
54,$36.99,$49.99,http://www.jollychic.com/p/bear-egg-boiler-rotary-knob-timer-stainless-steel-double-layer-egg-boiler-chinese-standard-plug-g687424.html,Bear Egg Boiler Rotary Knob Timer Stainless Steel Double Layer Egg Boiler-Chinese Standard Plug,Kitchen
97,$72.00,$93.00,http://www.jollychic.com/p/bear-electric-food-processor-multifunctional-glass-meat-grinder-stirring-machine220v-china-standard-plug-g687628.html,Bear Electric Food Processor Multifunctional Glass Meat Grinder Stirring Machine220V-China Standard Plug,Kitchen
182,$24.99,$27.99,http://www.jollychic.com/p/juicer-multi-functional-universal-portable-quick-juicing-fruit-juicer-g755362.html,Juicer Multi-Functional Universal Portable Quick Juicing Fruit Juicer,Kitchen
100,$37.99,$58.00,http://www.jollychic.com/p/electric-water-kettle-double-material-thickness-household-stainless-steel-quick-boiling-pot-g861248.html,Electric Water Kettle Double Material Thickness Household Stainless Steel Quick Boiling Pot,Kitchen
397,$24.99,$32.99,http://www.jollychic.com/p/kitchen-scale-drip-coffee-with-timer-function-electronic-digital-kitchen-scale-g900656.html,Kitchen Scale Drip Coffee With Timer Function Electronic Digital Kitchen Scale,Kitchen
53,$8.99,,http://www.jollychic.com/p/reusable-k-cup-holder-replacement-part-coffee-filters-for-keurig-machi-g1040006.html,Reusable K-Cup Holder Replacement Part Coffee Filters For Keurig Machi,Kitchen
264,$8.99,,http://www.jollychic.com/p/instant-sealer-mini-handy-heat-manual-sealer-g1040662.html,Instant Sealer Mini Handy Heat Manual Sealer,Kitchen
44,$12.99,$19.99,http://www.jollychic.com/p/coffee-bean-grinder-practical-stainless-steel-hand-manual-handmade-grinder-g1141858.html,Coffee Bean Grinder Practical Stainless Steel Hand Manual Handmade Grinder,Kitchen
45,$6.99,$11.99,http://www.jollychic.com/p/egg-whisk-portable-household-14-inch-stainless-steel-semi-automatic-stirrer-g1269352.html,Egg Whisk Portable Household 14 Inch Stainless Steel Semi-Automatic Stirrer,Kitchen
248,$10.99,$18.99,http://www.jollychic.com/p/cake-baking-tools-mini-electronic-scales-g412098.html,Cake baking Tools Mini Electronic Scales,Kitchen
115,$72.00,$130.00,http://www.jollychic.com/p/food-processor-multifunctional-dicing-machine-soymilk-juicer-220v-240v-g476390.html,Food Processor Multifunctional Dicing Machine Soymilk Juicer 220V-240V,Kitchen
1663,$29.99,$36.99,http://www.jollychic.com/p/chocolate-melting-pot-auto-temperature-control-safe-convenient-double-pot-chocolate-melting-pot-l26-5-2Aw19-2Ah8cm-g591720.html,Chocolate Melting Pot Auto-Temperature Control Safe Convenient Double Pot Chocolate Melting Pot-L26.5*W19*H8cm,Kitchen
823,$25.99,$33.99,http://www.jollychic.com/p/multifunctional-portable-usb-charging-stylish-coffee-maker-electronic-juicer-g592350.html,Multifunctional Portable USB Charging Stylish Coffee Maker Electronic Juicer,Kitchen
44,$46.99,$52.00,http://www.jollychic.com/p/bear-egg-boiler-multi-functional-big-capacity-stainless-steel-egg-boiler-china-standard-plug-h247-2A233-2A193mm-g608096.html,Bear Egg Boiler Multi-Functional Big Capacity Stainless Steel Egg Boiler (China Standard Plug)-H247*233*193mm,Kitchen
141,$2.99,,http://www.jollychic.com/p/egg-machine-portable-heat-sensitive-boiled-egg-timer-g656762.html,Egg Machine Portable Heat Sensitive Boiled Egg Timer,Kitchen
2982,$15.99,$24.99,http://www.jollychic.com/p/popcorn-maker-household-mini-hot-air-technology-highly-efficient-popcorn-maker-g660576.html,Popcorn Maker Household Mini Hot-Air Technology Highly Efficient Popcorn Maker,Kitchen
1017,$8.99,$12.99,http://www.jollychic.com/p/mixer-cup-350ml-capacity-stainless-steel-liner-auto-stirring-electric-mixer-cup-g727846.html,Mixer Cup 350ml Capacity Stainless Steel Liner Auto-Stirring Electric Mixer Cup,Kitchen
32,$42.99,$56.00,http://www.jollychic.com/p/bear-electric-lunch-box-micro-computer-control-2l-large-capacity-quick-heating-electric-lunch-box-chinese-standard-plug-g728278.html,Bear Electric Lunch Box Micro Computer Control 2L Large Capacity Quick Heating Electric Lunch Box-Chinese Standard Plug,Kitchen
31,$49.99,,http://www.jollychic.com/p/bear-electric-lunch-box-vacuum-liner-time-appointment-function-double-layer-electric-lunch-box-chinese-standard-plug-g728462.html,Bear Electric Lunch Box Vacuum Liner Time Appointment Function Double Layer Electric Lunch Box-Chinese Standard Plug,Kitchen
25,$10.99,$13.99,http://www.jollychic.com/p/electronic-scale-lighter-style-lcd-mini-pocket-0-01-7E200g-gram-pocket-scale-g810418.html,Electronic Scale Lighter Style LCD Mini Pocket 0.01~200g Gram Pocket Scale,Kitchen
117,$24.99,$46.99,http://www.jollychic.com/p/juicer-household-portable-quick-squeeze-sharp-blade-universal-juicer-eu-plug-g893084.html,Juicer Household Portable Quick Squeeze Sharp Blade Universal Juicer EU Plug,Kitchen
173,$5.99,$7.99,http://www.jollychic.com/p/electric-whisk-multi-functionmini-handle-mixer-drink-whisk-mixer-egg-beater-g938254.html,Electric Whisk Multi-FunctionMini Handle Mixer Drink Whisk Mixer Egg Beater,Kitchen
286,$18.99,,http://www.jollychic.com/p/automatic-cupcake-batter-dispenser-diy-baking-essentials-g1040076.html,Automatic Cupcake Batter Dispenser DIY Baking Essentials,Kitchen
48,$115.00,$180.00,http://www.jollychic.com/p/multifunctional-5-in-1-large-capacity-grinding-soymilk-egg-breaking-machine-household-juicer-220-240v-g476506.html,Multifunctional 5-in-1 Large-capacity Grinding Soymilk Egg-breaking Machine Household Juicer 220-240V,Kitchen
3458,$8.99,$18.99,http://www.jollychic.com/p/egg-boiler-household-mini-multi-functional-egg-boiler-g516198.html,Egg Boiler Household Mini Multi-Functional Egg Boiler,Kitchen
928,$14.99,$25.99,http://www.jollychic.com/p/electric-lunch-box-multi-functional-steam-boil-heating-lunch-box-220v-200w-g546986.html,Electric Lunch Box Multi-Functional Steam & Boil Heating Lunch Box-220V&200W,Kitchen
1239,$12.99,$15.99,http://www.jollychic.com/p/high-accuracy-weighing-device-electronic-kitchen-scale-g554258.html,High Accuracy Weighing Device Electronic Kitchen Scale,Kitchen
645,$3.99,$5.99,http://www.jollychic.com/p/mini-digital-cooking-thermometer-sensor-prober-digital-food-thermometer-g554260.html,Mini Digital Cooking Thermometer Sensor Prober Digital Food Thermometer,Kitchen
2015,$38.99,$60.00,http://www.jollychic.com/p/household-food-vacuum-sealer-packaging-machine-automatic-electric-food-sealer-g562214.html,Household Food Vacuum Sealer Packaging Machine Automatic Electric Food Sealer,Kitchen
446,$42.99,$49.99,http://www.jollychic.com/p/portable-usb-rechargeable-electric-fruit-juicer-machine-4000mah-700ml-g582712.html,Portable USB Rechargeable Electric Fruit Juicer Machine 4000mAh 700ML,Kitchen
2104,$10.99,$13.99,http://www.jollychic.com/p/electric-kettle-stainless-steel-2-0l-auto-off-high-power-electric-kettle-22-5-2A17-5cm-g591028.html,Electric Kettle Stainless Steel 2.0L Auto-Off High Power Electric Kettle-22.5*17.5cm,Kitchen
453,$22.99,$29.99,http://www.jollychic.com/p/juicer-mini-portable-usb-powered-double-layer-glass-lightweight-juicer-g660590.html,Juicer Mini Portable USB Powered Double-Layer Glass Lightweight Juicer,Kitchen
32,$17.99,$26.99,http://www.jollychic.com/p/bear-egg-boiler-household-safe-temperature-control-system-egg-boiler-chinese-standard-plug-g687464.html,Bear Egg Boiler Household Safe Temperature Control System Egg Boiler-Chinese Standard Plug,Kitchen
210,$29.99,$45.99,http://www.jollychic.com/p/bear-egg-mixer-high-power-speed-adjustable-easy-storage-electric-hand-mixer-chinese-standard-plug-g728126.html,Bear Egg Mixer High Power Speed Adjustable Easy Storage Electric Hand Mixer-Chinese Standard Plug,Kitchen
778,$14.99,$17.99,http://www.jollychic.com/p/food-blender-household-portable-transparent-leakproof-bottle-blender-g754596.html,Food Blender Household Portable Transparent Leakproof Bottle Blender,Kitchen
115,$38.99,$53.00,http://www.jollychic.com/p/juicer-usb-powered-mini-portable-with-sealing-ring-juicer-g764572.html,Juicer USB Powered Mini Portable With Sealing Ring Juicer,Kitchen
340,$49.99,$70.00,http://www.jollychic.com/p/ice-cream-machine-automatical-healthy-ice-cream-maker-g986182.html,Ice Cream Machine Automatical Healthy Ice Cream Maker,Kitchen
6,$25.99,,http://www.jollychic.com/p/triple-timer-clock-kitchen-cooking-three-line-alarm-lcd-digital-count-down-g1022652.html,Triple Timer Clock kitchen Cooking Three Line Alarm LCD Digital Count Down,Kitchen
180,$14.99,,http://www.jollychic.com/p/electric-automatic-juice-water-dispenser-kitchen-vegetable-fruit-juice-tools-g1040164.html,Electric Automatic Juice Water Dispenser Kitchen Vegetable Fruit Juice Tools,Kitchen
87,$55.00,,http://www.jollychic.com/p/coffee-maker-household-mini-multi-functional-1-cups-coffee-maker-au-plug-150-ml-au-standard-g1113522.html,Coffee Maker Household Mini Multi-Functional 1 Cups Coffee Maker AU Plug 150 ML AU Standard,Kitchen
18,$60.00,$74.00,http://www.jollychic.com/p/coffee-maker-household-double-cup-type-multi-function-versatile-drop-coffee-maker-g1269582.html,Coffee Maker Household Double Cup Type Multi-Function Versatile Drop Coffee Maker,Kitchen
4096,$15.99,$69.00,http://www.jollychic.com/p/multifunctional-desktoptype-egg-beater-cream-bakery-and-noodle-machine-eu-g492134.html,Multifunctional DesktopType Egg Beater Cream Bakery And Noodle Machine-EU,Kitchen
4946,$16.99,$65.00,http://www.jollychic.com/p/egg-machine-3-in-1-household-cream-bakery-and-noodle-machine-eu-g492138.html,Egg Machine 3-In-1 Household Cream Bakery And Noodle Machine-EU,Kitchen
1111,$25.99,$49.99,http://www.jollychic.com/p/juice-blender-household-mini-portable-juicer-eu-plug-g462576.html,Juice Blender Household Mini Portable Juicer EU Plug,Kitchen
408,$38.99,$53.00,http://www.jollychic.com/p/rice-cooker-household-mini-portable-multi-functional-electric-rice-cooker-eu-plug-g462710.html,Rice Cooker Household Mini Portable Multi-Functional Electric Rice Cooker EU Plug,Kitchen
395,$33.99,$39.99,http://www.jollychic.com/p/household-universal-multifunctional-corn-popper-egg-machine-350w-ac220v-g500442.html,Household Universal Multifunctional Corn Popper Egg Machine 350W/AC220V,Kitchen
6062,$3.99,$4.99,http://www.jollychic.com/p/egg-beater-handheld-mini-portable-electric-mixer-g516280.html,Egg Beater Handheld Mini Portable Electric Mixer,Kitchen
90,$9.99,$13.99,http://www.jollychic.com/p/kitchen-scale-mini-portable-with-backlight-kitchen-electronic-scale-g536670.html,Kitchen Scale Mini Portable With Backlight Kitchen Electronic Scale,Kitchen
201,$55.00,$99.00,http://www.jollychic.com/p/grinder-household-mini-electric-coffee-bean-grinder-g495334.html,Grinder Household Mini Electric Coffee Bean Grinder,Kitchen
369,$11.99,$16.99,http://www.jollychic.com/p/household-multifunctional-universal-egg-machine-350w-ac220v-g500440.html,Household Multifunctional Universal Egg Machine 350W/AC220V,Kitchen
10175,$29.99,$45.99,http://www.jollychic.com/p/innovative-house-electricity-equipment-fully-automatic-diy-fruit-ice-cream-machine-black-silver-g336350.html,Innovative House Electricity Equipment Fully Automatic DIY Fruit Ice Cream Machine - Black Silver,Kitchen
924,$45.99,$55.00,http://www.jollychic.com/p/fryer-household-auto-oil-temperature-control-electric-fryer-g462760.html,Fryer Household Auto Oil Temperature Control Electric Fryer,Kitchen
1641,$8.99,$9.99,http://www.jollychic.com/p/kitchen-scale-mini-with-backlight-lcd-display-kitchen-electronic-scale-g536674.html,Kitchen Scale Mini With Backlight LCD Display Kitchen Electronic Scale,Kitchen
6038,$16.99,$29.99,http://www.jollychic.com/p/artizan-popcorn-maker-mini-household-electric-popcorn-maker-machine-eu-plug-g512366.html,ARTIZAN Popcorn Maker Mini Household Electric Popcorn Maker Machine EU Plug,Kitchen
262,$20.99,$22.99,http://www.jollychic.com/p/blender-mini-360-degree-all-direction-meat-grinder-eu-plug-g526154.html,Blender Mini 360 Degree All Direction Meat Grinder EU Plug,Kitchen
843,$10.99,$11.99,http://www.jollychic.com/p/kitchen-scale-mini-with-backlight-lcd-display-kitchen-electronic-scale-g536672.html,Kitchen Scale Mini With Backlight LCD Display Kitchen Electronic Scale,Kitchen
6452,$15.99,$59.00,http://www.jollychic.com/p/blender-multifunctional-desktop-pedestal-egg-beater-practical-egg-machine-eu-g492136.html,Blender Multifunctional Desktop Pedestal Egg Beater Practical Egg Machine-EU,Kitchen
218,$7.99,$8.99,http://www.jollychic.com/p/kitchen-scale-mini-portable-with-backlight-kitchen-electronic-scale-g536668.html,Kitchen Scale Mini Portable With Backlight Kitchen Electronic Scale,Kitchen
11140,$2.99,$3.99,http://www.jollychic.com/p/blender-mini-portable-handheld-electric-mixer-g527200.html,Blender Mini Portable Handheld Electric Mixer,Kitchen
14,$11.99,,http://www.jollychic.com/p/kitchen-timer-cooking-digital-countdown-alarm-clock-with-magnet-g960916.html,Kitchen Timer Cooking Digital Countdown Alarm Clock With Magnet,Kitchen
1,$55.00,,http://www.jollychic.com/p/duolvqi-multifunctional-fruit-juicer-mini-handmade-citrus-orange-juice-machine-juicer-g1322136.html,DUOLVQI Multifunctional Fruit Juicer Mini Handmade Citrus Orange Juice Machine juicer,Kitchen
0,$28.99,,http://www.jollychic.com/p/electronic-kitchen-scale-cooking-measure-tool-durable-stainless-steel-platform-g1322144.html,Electronic Kitchen Scale Cooking Measure Tool Durable Stainless Steel Platform,Kitchen
