add_wish,discount_price,original_price,product_link,product_name,header_block
5399,$2.99,$6.99,http://www.jollychic.com/p/simple-universal-holder-for-smarphone-tablet-ipad-g387722.html,Simple Universal Holder for Smarphone/Tablet/Ipad,Phone Holder
394,$4.99,$5.99,http://www.jollychic.com/p/solid-x-ring-kickstand-for-phones-g394398.html,Solid X-Ring Kickstand For Phones,Phone Holder
1859,$7.99,,http://www.jollychic.com/p/desktop-phone-tablet-stand-holder-3-5-10-5-inch-lazy-bed-tablet-pc-stands-mount-g540360.html,Desktop Phone Tablet Stand Holder 3.5-10.5 inch Lazy Bed Tablet PC Stands Mount,Phone Holder
1520,$2.99,$4.99,http://www.jollychic.com/p/phone-accessory-portable-cut-cat-shaped-stand-ring-phone-holder-g577714.html,Phone Accessory Portable Cut Cat Shaped Stand Ring Phone Holder,Phone Holder
178,$29.99,,http://www.jollychic.com/p/charge-holder-bamboo-three-usb-ports-iwatch-mobile-charge-holder-140-2A60-2A60mm-g590512.html,Charge Holder Bamboo Three USB Ports iWatch Mobile Charge Holder-140*60*60mm,Phone Holder
52,$5.99,,http://www.jollychic.com/p/phone-holder-versatile-portable-circle-shape-phone-holder-g738940.html,Phone Holder Versatile Portable Circle Shape Phone Holder,Phone Holder
183,$5.99,$9.99,http://www.jollychic.com/p/charger-holder-aluminum-alloy-usb-transfer-data-charging-dock-station-for-iphone-ipad-android-g758432.html,Charger Holder Aluminum Alloy USB Transfer Data & Charging Dock Station For iPhone iPad Android,Phone Holder
49,$10.99,$16.99,http://www.jollychic.com/p/phone-holder-flexible-durable-universal-aluminium-alloy-phone-holder-g800680.html,Phone Holder Flexible Durable Universal Aluminium Alloy Phone Holder,Phone Holder
148,$6.99,$10.99,http://www.jollychic.com/p/phone-holder-universal-angle-adjustable-portable-durable-metal-phone-holder-g826184.html,Phone Holder Universal Angle Adjustable Portable Durable Metal Phone Holder,Phone Holder
99,$16.99,$19.99,http://www.jollychic.com/p/phone-charging-holder-3-in-1-bamboo-phone-holderfor-apple-watch-phone-g933502.html,Phone Charging Holder 3 in 1 Bamboo Phone HolderFor Apple Watch&Phone,Phone Holder
60,$9.99,,http://www.jollychic.com/p/andoer-tripod-stand-2-in-1-multi-function-handheld-grip-for-gopro-hero-4-3-3-2-1-g1027914.html,Andoer Tripod Stand 2-In-1 Multi-Function Handheld Grip For GoPro Hero 4/3+/3/2/1,Phone Holder
135,$2.99,$6.99,http://www.jollychic.com/p/phone-holder-universal-durable-creative-grip-phone-finger-holder-for-samsung-iphone-smartphone-g1048620.html,Phone Holder Universal Durable Creative Grip Phone Finger Holder For Samsung iPhone Smartphone,Phone Holder
41,$8.99,,http://www.jollychic.com/p/raxfly-universal-holder-aluminium-alloy-holder-for-tablet-phone-g1086642.html,RAXFLY Universal Holder Aluminium Alloy Holder For Tablet Phone,Phone Holder
9,$13.99,,http://www.jollychic.com/p/phone-holder-aluminium-alloy-holder-for-watch-phones-g1088586.html,Phone Holder Aluminium Alloy Holder For Watch/Phones,Phone Holder
428,$6.99,$11.99,http://www.jollychic.com/p/phone-holder-multi-function-universal-portable-durable-adhesive-phone-stand-g1096016.html,Phone Holder Multi-Function Universal Portable Durable Adhesive Phone Stand,Phone Holder
73,$10.99,,http://www.jollychic.com/p/phone-holder-luxury-batman-shape-aluminum-metal-universal-finger-ring-for-smartphone-g1170446.html,Phone Holder Luxury Batman Shape Aluminum Metal Universal Finger Ring For Smartphone,Phone Holder
1737,$2.99,$6.99,http://www.jollychic.com/p/cute-cat-design-back-ring-holder-stand-for-smart-phones-g382600.html,Cute Cat Design Back Ring Holder Stand for Smart Phones,Phone Holder
31,$9.99,,http://www.jollychic.com/p/charge-holder-quick-charging-multi-functional-desktop-charge-holder-g492734.html,Charge Holder Quick Charging Multi-Functional Desktop Charge Holder,Phone Holder
1488,$4.99,,http://www.jollychic.com/p/convenient-universal-versatile-desktop-foldable-phone-holder-g496224.html,Convenient Universal Versatile Desktop Foldable Phone Holder,Phone Holder
56,$7.99,,http://www.jollychic.com/p/phone-holder-creative-cartoon-shape-detachable-portable-phone-holder-g1162640.html,Phone Holder Creative Cartoon Shape Detachable Portable Phone Holder,Phone Holder
10,$8.99,,http://www.jollychic.com/p/phone-holder-zinc-alloy-finger-ring-360-degree-rotation-multi-function-mobile-phone-bracket-g1162688.html,Phone Holder Zinc Alloy Finger Ring 360 Degree Rotation Multi-function Mobile Phone Bracket,Phone Holder
12,$4.99,$8.99,http://www.jollychic.com/p/phone-holder-portable-foldable-multi-functional-universal-phone-holder-g1198430.html,Phone Holder Portable Foldable Multi-Functional Universal Phone Holder,Phone Holder
38,$4.99,$10.99,http://www.jollychic.com/p/phone-holder-unique-pocket-watch-design-ring-stand-phone-holder-g1216556.html,Phone Holder Unique Pocket Watch Design Ring Stand Phone Holder,Phone Holder
18,$10.99,$18.99,http://www.jollychic.com/p/phone-holder-bat-shape-zinc-alloy-360-degree-rotating-finger-buckle-phone-holder-g1248496.html,Phone Holder Bat Shape Zinc Alloy 360 Degree Rotating Finger Buckle Phone Holder,Phone Holder
10,$8.99,,http://www.jollychic.com/p/phone-holder-unique-hang-type-portable-universal-durable-phone-holder-g1289106.html,Phone Holder Unique Hang Type Portable Universal Durable Phone Holder,Phone Holder
304,$9.99,,http://www.jollychic.com/p/cellphone-holder-creative-metal-multifunctional-phone-holder-with-stand-clip-g510916.html,Cellphone Holder Creative Metal Multifunctional Phone Holder With Stand Clip,Phone Holder
159,$4.99,$7.99,http://www.jollychic.com/p/phone-holder-crocodile-modeling-multifunctional-universal-car-phone-holder-g544984.html,Phone Holder Crocodile Modeling Multifunctional Universal Car Phone Holder,Phone Holder
5430,$4.99,$5.99,http://www.jollychic.com/p/phone-holder-portable-multi-functional-phone-holder-1pc-g550350.html,Phone Holder Portable Multi-Functional Phone Holder-1Pc,Phone Holder
701,$3.99,,http://www.jollychic.com/p/phone-holder-one-piece-seamless-bowknot-shape-ring-type-anti-drop-phone-holder-g614400.html,Phone Holder One Piece Seamless Bowknot Shape Ring Type Anti-Drop Phone Holder,Phone Holder
49,$14.99,$17.99,http://www.jollychic.com/p/earphone-bracket-universal-gaming-headphone-headset-hanger-bracket-holder-rack-stand-g851146.html,Earphone Bracket Universal Gaming Headphone Headset Hanger Bracket Holder Rack Stand,Phone Holder
180,$5.99,,http://www.jollychic.com/p/phone-holder-flexible-clamp-design-universal-desk-phone-holder-g1073134.html,Phone Holder Flexible Clamp Design Universal Desk Phone Holder,Phone Holder
30,$7.99,,http://www.jollychic.com/p/phone-holder-creative-finger-ring-buckle-oval-shape-holder-metal-rotatable-universal-phone-holder-g1124830.html,Phone Holder Creative Finger Ring Buckle Oval Shape Holder Metal Rotatable Universal Phone Holder,Phone Holder
18,$13.99,,http://www.jollychic.com/p/phone-holder-portable-rotating-folding-mobile-phone-ipad-tablet-pc-stand-g1129760.html,Phone Holder Portable Rotating Folding Mobile Phone/iPad/Tablet PC Stand,Phone Holder
12,$2.99,$6.99,http://www.jollychic.com/p/hipo-phone-holder-mini-portable-universal-adjustable-folding-mobile-phone-tablet-support-g1205528.html,Hipo Phone Holder Mini Portable Universal Adjustable Folding Mobile Phone Tablet Support,Phone Holder
7,$4.99,$7.99,http://www.jollychic.com/p/phone-tablet-holder-universal-tablet-support-folding-rotatable-support-5-10-inch-mobile-tablet-g1207600.html,Phone Tablet Holder Universal Tablet Support Folding Rotatable Support 5-10 Inch Mobile / Tablet,Phone Holder
9,$19.99,,http://www.jollychic.com/p/phone-holder-creative-versatile-durable-flexible-multi-function-microphone-bracket-g1278228.html,Phone Holder Creative Versatile Durable Flexible Multi-Function Microphone Bracket,Phone Holder
5592,$8.99,$12.99,http://www.jollychic.com/p/charge-holder-wall-mounted-versatile-phone-charge-holder-g536578.html,Charge Holder Wall-Mounted Versatile Phone Charge Holder,Phone Holder
1991,$3.99,,http://www.jollychic.com/p/phone-holder-portable-versatile-stick-type-adjustable-phone-holder-g617662.html,Phone Holder Portable Versatile Stick Type Adjustable Phone Holder,Phone Holder
677,$10.99,$11.99,http://www.jollychic.com/p/phone-holder-multifunctional-abs-magnesium-alloy-phone-clip-desk-clip-g619696.html,Phone Holder Multifunctional ABS+Magnesium Alloy Phone Clip Desk Clip,Phone Holder
195,$11.99,$18.99,http://www.jollychic.com/p/charge-holder-magnetic-type-usb-charging-dock-station-foriphone-ipad-android-g754722.html,Charge Holder Magnetic Type USB Charging Dock Station ForiPhone iPAD Android,Phone Holder
62,$23.99,$27.99,http://www.jollychic.com/p/marsboy-charging-holder-4-usb-ports-charging-station-holder-g961468.html,Marsboy Charging Holder 4 USB Ports Charging Station Holder,Phone Holder
18,$11.99,,http://www.jollychic.com/p/raxfly-phone-holder-flexible-portable-magnetic-anti-skidding-phone-holder-g1092182.html,RAXFLY Phone Holder Flexible Portable Magnetic Anti-Skidding Phone Holder,Phone Holder
8,$13.99,,http://www.jollychic.com/p/floveme-phone-holder-360-degree-rotatable-2-in-1-phone-holder-g1096038.html,FLOVEME Phone Holder 360 Degree Rotatable 2 In 1 Phone Holder,Phone Holder
24,$8.99,,http://www.jollychic.com/p/phone-holder-wooden-design-universal-portable-phone-holder-g1097394.html,Phone Holder Wooden Design Universal Portable Phone Holder,Phone Holder
21,$11.99,,http://www.jollychic.com/p/raxfly-watch-holder-universal-portable-stable-watch-holder-g1102280.html,RAXFLY Watch Holder Universal Portable Stable Watch Holder,Phone Holder
64,$9.99,,http://www.jollychic.com/p/phone-holder-scalable-creative-space-pattern-colorful-multi-function-cell-phone-holder-g1152392.html,Phone Holder Scalable Creative Space Pattern Colorful Multi-Function Cell Phone Holder,Phone Holder
14,$9.99,,http://www.jollychic.com/p/mobile-phone-finger-ring-buckle-support-smart-phone-g1158550.html,Mobile Phone Finger Ring Buckle Support Smart Phone,Phone Holder
16,$8.99,,http://www.jollychic.com/p/phone-holder-bear-shape-ring-buckle-360-degree-rotate-light-weight-universal-phone-holder-g1162094.html,Phone Holder Bear Shape Ring Buckle 360 Degree Rotate Light Weight Universal Phone Holder,Phone Holder
21,$7.99,$12.99,http://www.jollychic.com/p/phone-holder-aluminium-alloy-durable-portable-universal-phone-holder-g1198396.html,Phone Holder Aluminium Alloy Durable Portable Universal Phone Holder,Phone Holder
13,$6.99,$9.99,http://www.jollychic.com/p/phone-holder-2-in-1-portable-palm-design-metal-flexible-iphone-data-cable-phone-holder-g1232310.html,Phone Holder 2-In-1 Portable Palm Design Metal Flexible iPhone Data Cable Phone Holder,Phone Holder
4276,$2.99,,http://www.jollychic.com/p/novel-spider-shaped-foldable-phone-holder-g333776.html,Novel Spider Shaped Foldable Phone Holder,Phone Holder
84,$0.99,$3.99,http://www.jollychic.com/p/green-portable-and-foldable-multi-angle-smartphone-stand-g374824.html,Green Portable And Foldable Multi-angle Smartphone Stand,Phone Holder
50,$1.99,$3.99,http://www.jollychic.com/p/blue-portable-and-foldable-multi-angle-smartphone-stand-g374830.html,Blue Portable And Foldable Multi-angle Smartphone Stand,Phone Holder
118,$20.99,,http://www.jollychic.com/p/momax-charge-holder-portable-fast-charging-charge-holder-g500056.html,Momax Charge Holder Portable Fast Charging Charge Holder,Phone Holder
444,$3.99,,http://www.jollychic.com/p/phone-holder-portable-versatile-ring-type-phone-holder-g562502.html,Phone Holder Portable Versatile Ring Type Phone Holder,Phone Holder
79,$13.99,$19.99,http://www.jollychic.com/p/universal-multifunctional-portable-4-usb-port-charger-phone-holder-charging-g569756.html,Universal Multifunctional Portable 4 USB Port Charger Phone Holder Charging,Phone Holder
181,$29.99,$34.99,http://www.jollychic.com/p/charge-holder-four-usb-ports-smart-identification-detachable-multi-protection-charge-holder-g612092.html,Charge Holder Four USB Ports Smart Identification Detachable Multi-Protection Charge Holder,Phone Holder
16,$7.99,$15.99,http://www.jollychic.com/p/phone-holder-aluminium-alloy-180-degree-rotary-stand-for-phones-ipad-tablet-pc-g617756.html,Phone Holder Aluminium Alloy 180 Degree Rotary Stand For Phones/iPad/Tablet PC,Phone Holder
697,$4.99,,http://www.jollychic.com/p/artizan-car-holder-abs-metal-ring-holder-functional-phone-car-mount-bracket-stand-g622364.html,ARTIZAN Car Holder ABS+Metal Ring Holder Functional Phone Car Mount Bracket Stand,Phone Holder
103,$1.99,$5.99,http://www.jollychic.com/p/phone-holder-universal-portable-multi-angle-foldable-phone-holder-g740622.html,Phone Holder Universal Portable Multi Angle Foldable Phone Holder,Phone Holder
114,$2.99,,http://www.jollychic.com/p/phone-holder-portable-full-compatibility-universal-phone-holder-g945934.html,Phone Holder Portable Full Compatibility Universal Phone Holder,Phone Holder
23,$1.99,$4.99,http://www.jollychic.com/p/silicon-smart-phone-gps-mount-holder-band-strap-for-car-bike-motocycle-g1008098.html,Silicon Smart Phone GPS Mount Holder Band Strap for Car/Bike/Motocycle,Phone Holder
21,$21.99,,http://www.jollychic.com/p/floveme-charging-base-for-apple-smart-watch-phone-g1089676.html,FLOVEME Charging Base For Apple Smart Watch/ Phone,Phone Holder
7,$10.99,,http://www.jollychic.com/p/phone-holder-universal-outdoor-phone-holder-g1118330.html,Phone Holder Universal Outdoor Phone Holder,Phone Holder
16,$7.99,,http://www.jollychic.com/p/phone-holder-four-leaf-clover-shape-ring-button-creative-metal-finger-buckle-phone-holder-g1164506.html,Phone Holder Four-leaf Clover Shape Ring Button Creative Metal Finger Buckle Phone Holder,Phone Holder
13,$4.99,$7.99,http://www.jollychic.com/p/phone-holder-strong-absorption-rubber-stickers-universal-phone-holder-g1219544.html,Phone Holder Strong Absorption Rubber Stickers Universal Phone Holder,Phone Holder
3718,$2.99,$7.99,http://www.jollychic.com/p/360-degree-rotation-magnet-car-phone-holder-g346756.html,360 Degree Rotation Magnet Car Phone Holder,Phone Holder
315,$16.99,$19.99,http://www.jollychic.com/p/2-in-1-convenient-portable-smart-watch-iphone-charging-holder-g546870.html,2 In 1 Convenient Portable Smart Watch Iphone Charging Holder,Phone Holder
1386,$2.99,,http://www.jollychic.com/p/phone-holder-portable-cute-bear-shaped-stand-ring-phone-holder-g737368.html,Phone Holder Portable Cute Bear Shaped Stand Ring Phone Holder,Phone Holder
459,$4.99,$6.99,http://www.jollychic.com/p/phone-holder-pocket-watch-design-universal-portable-ring-stand-holder-g758114.html,Phone Holder Pocket Watch Design Universal Portable Ring Stand Holder,Phone Holder
334,$5.99,,http://www.jollychic.com/p/phone-holder-creative-universal-bedside-phone-holder-g1021328.html,Phone Holder Creative Universal Bedside Phone Holder,Phone Holder
20,$5.99,,http://www.jollychic.com/p/phone-holder-universal-foldable-mounts-holder-stand-for-smart-phones-g1036384.html,Phone Holder Universal Foldable Mounts Holder Stand For Smart Phones,Phone Holder
72,$8.99,,http://www.jollychic.com/p/phone-holder-for-phones-ipad-tablet-universal-holder-g1088448.html,Phone Holder For Phones Ipad Tablet Universal Holder,Phone Holder
17,$7.99,,http://www.jollychic.com/p/phone-holder-creative-three-feet-octopus-style-sponge-universal-portable-camera-holder-g1156424.html,Phone Holder Creative Three Feet Octopus Style Sponge Universal Portable Camera Holder,Phone Holder
9,$8.99,,http://www.jollychic.com/p/phone-holder-unique-elephant-design-durable-versatile-phone-holder-g1273804.html,Phone Holder Unique Elephant Design Durable Versatile Phone Holder,Phone Holder
8,$8.99,,http://www.jollychic.com/p/phone-holder-unique-household-stick-type-portable-hook-holder-g1274110.html,Phone Holder Unique Household Stick Type Portable Hook Holder,Phone Holder
205,$7.99,$11.99,http://www.jollychic.com/p/silver-apple-charge-base-data-synchronization-phone-holder-for-iphone5-5s-5c-6-6s-6-plus-6s-plus-g350598.html,Silver Apple Charge Base Data Synchronization/Phone Holder for iPhone5/5s/5c/6/6S/6 Plus /6s Plus,Phone Holder
2859,$7.99,$10.99,http://www.jollychic.com/p/apple-charge-base-data-synchronization-phone-holder-for-iphone-g421886.html,Apple Charge Base Data Synchronization Phone Holder for iPhone,Phone Holder
1380,$51.00,,http://www.jollychic.com/p/usb-multi-functional-wireless-bluetooth-stereo-rechargeable-speaker-g274943.html,USB Multi-functional Wireless Bluetooth Stereo Rechargeable Speaker,Phone Holder
2810,$2.99,$5.99,http://www.jollychic.com/p/compatible-360-degree-rotating-ring-kickstand-g296726.html,Compatible 360 Degree Rotating Ring Kickstand,Phone Holder
167,$30.99,,http://www.jollychic.com/p/multipurpose-bluetooth-stereo-speaker-mobile-phone-holder-g410198.html,Multipurpose Bluetooth Stereo Speaker Mobile Phone Holder,Phone Holder
130,$18.99,,http://www.jollychic.com/p/ultrathin-phone-holder-car-phone-qi-type-emitter-wireless-charger-g487124.html,Ultrathin Phone Holder Car Phone QI Type Emitter Wireless Charger,Phone Holder
1443,$5.99,,http://www.jollychic.com/p/diamond-crown-universal-mobile-phone-stand-ring-holder-for-phones-with-hook-g338448.html,Diamond Crown Universal Mobile Phone Stand Ring Holder For Phones With Hook,Phone Holder
786,$8.99,,http://www.jollychic.com/p/black-cool-vehicle-multifunctional-mouse-shape-mobile-phone-holder-g321030.html,Black Cool Vehicle Multifunctional Mouse Shape Mobile Phone Holder,Phone Holder
3402,$1.99,,http://www.jollychic.com/p/cute-piggy-shape-silica-gel-mobile-phone-support-g361338.html,Cute Piggy Shape Silica Gel Mobile Phone Support,Phone Holder
4176,$4.99,,http://www.jollychic.com/p/foldable-versatile-non-slip-phone-tablet-computer-holder-g433504.html,Foldable Versatile Non-Slip Phone Tablet Computer Holder,Phone Holder
152,$0.99,$3.99,http://www.jollychic.com/p/pink-portable-and-foldable-multi-angle-smartphone-stand-g374820.html,Pink Portable And Foldable Multi-angle Smartphone Stand,Phone Holder
225,$3.99,,http://www.jollychic.com/p/grey-portable-and-foldable-multi-angle-smartphone-stand-g374828.html,Grey Portable And Foldable Multi-angle Smartphone Stand,Phone Holder
6,$6.99,,http://www.jollychic.com/p/phone-holder-creative-clock-design-portable-mobile-phone-ring-stent-g1320752.html,Phone Holder Creative Clock Design Portable Mobile Phone Ring Stent,Phone Holder
0,$8.99,,http://www.jollychic.com/p/phone-holder-portable-magnetic-360-degree-rotation-aluminum-alloy-car-holder-g1321898.html,Phone Holder Portable Magnetic 360 Degree Rotation Aluminum Alloy Car Holder,Phone Holder
0,$12.99,,http://www.jollychic.com/p/new-bee-headset-stand-holder-classic-portable-headphone-stand-hanger-g1334228.html,New Bee Headset Stand Holder Classic Portable Headphone Stand Hanger,Phone Holder
0,$7.99,,http://www.jollychic.com/p/phone-holder-360-degree-anti-drop-love-heart-shape-fashion-ring-holder-for-iphone-samsung-g1336424.html,Phone Holder 360 Degree Anti-Drop Love Heart Shape Fashion Ring Holder For iPhone/Samsung,Phone Holder
