add_wish,discount_price,original_price,product_link,product_name,header_block
28,$54.00,$63.00,http://www.jollychic.com/p/smart-weight-loss-pad-portable-household-multi-function-abdominal-slimming-instrument-g1269312.html,Smart Weight Loss Pad Portable Household Multi-Function Abdominal Slimming Instrument,Appliances
6,$15.99,$25.99,http://www.jollychic.com/p/night-light-portable-cartoon-style-creative-usb-charging-night-lamp-g1269564.html,Night Light Portable Cartoon Style Creative USB Charging Night Lamp,Appliances
1,$24.99,,http://www.jollychic.com/p/brita-water-filter-element-durable-flow-control-water-purifier-g1312164.html,BRITA Water Filter Element Durable Flow Control Water Purifier,Appliances
0,$121.00,,http://www.jollychic.com/p/brita-filter-kettle-kit-with-6-filter-elements-housheold-3-5l-water-purifier-g1312166.html,BRITA Filter Kettle Kit With 6 Filter Elements Housheold 3.5L Water Purifier,Appliances
1005,$9.99,$13.99,http://www.jollychic.com/p/noodle-machine-household-manual-operate-stainless-steel-five-templates-pasta-maker-15-2A6cm-g591026.html,Noodle Machine Household Manual Operate Stainless Steel Five Templates Pasta Maker-15*6cm,Appliances
382,$20.99,$31.99,http://www.jollychic.com/p/beauty-tools-versatile-9-in1-electric-nail-polish-manicure-shaving-devices-g874406.html,Beauty Tools Versatile 9 In1 Electric Nail Polish Manicure Shaving Devices,Appliances
125,$3.99,$13.99,http://www.jollychic.com/p/green-environmental-nature-scene-humidifier-g249143.html,Green Environmental Nature Scene Humidifier,Appliances
3409,$18.99,$29.99,http://www.jollychic.com/p/new-novel-mini-fish-tank-pattern-usb-humidifier-g333920.html,New Novel Mini Fish Tank Pattern USB Humidifier,Appliances
1293,$13.99,$37.99,http://www.jollychic.com/p/windmill-shape-usb-humidifier-with-fan-g373856.html,Windmill Shape USB Humidifier with Fan,Appliances
165,$15.99,$24.99,http://www.jollychic.com/p/green-solar-power-pest-animal-repeller-g376490.html,Green Solar Power Pest Animal Repeller,Appliances
511,$6.99,$30.99,http://www.jollychic.com/p/cleansing-instrument-unique-design-washing-face-beauty-instrument-g403974.html,Cleansing Instrument Unique Design Washing Face Beauty Instrument,Appliances
44,$26.99,$35.99,http://www.jollychic.com/p/multi-functional-portable-household-handheld-electric-iron-china-standard-plug-1000w-1200w-110v-220v-7E50hz-60hz-g449466.html,"Multi-Functional Portable Household Handheld Electric Iron-China Standard Plug 1000W/1200W,110V/220V~50HZ/60HZ",Appliances
2665,$9.99,$22.99,http://www.jollychic.com/p/household-vacuum-mini-creative-cartoon-car-vacuum-cleaner-dust-collector-remover-g462934.html,Household Vacuum Mini Creative Cartoon Car Vacuum Cleaner Dust Collector Remover,Appliances
86,$38.99,$73.00,http://www.jollychic.com/p/electric-shaver-household-multi-functional-electric-hair-remover-g463270.html,Electric Shaver Household Multi-Functional Electric Hair Remover,Appliances
532,$43.99,$51.00,http://www.jollychic.com/p/electric-arc-copper-shell-heavy-armour-creative-lighter-g463602.html,Electric Arc Copper Shell Heavy Armour Creative Lighter,Appliances
195,$17.99,$32.99,http://www.jollychic.com/p/ice-maker-mini-household-hand-cranked-practical-ice-maker-g495370.html,Ice Maker Mini Household Hand-cranked Practical Ice Maker,Appliances
41,$20.99,$25.99,http://www.jollychic.com/p/smart-wifi-power-socket-wireless-plug-timer-switch-wall-plug-g500290.html,Smart Wifi Power Socket Wireless Plug Timer Switch Wall Plug,Appliances
165,$30.99,$64.00,http://www.jollychic.com/p/monitor-household-high-definition-night-vision-ip-security-camera-g504324.html,Monitor Household High Definition Night Vision IP Security Camera,Appliances
22,$73.00,$86.00,http://www.jollychic.com/p/monitor-high-definition-wireless-ip-infrared-security-camera-g512784.html,Monitor High Definition Wireless IP Infrared Security Camera,Appliances
51,$13.99,$15.99,http://www.jollychic.com/p/nose-hair-trimmer-household-portable-multifunctional-electric-beard-shaver-g525882.html,Nose Hair Trimmer Household Portable Multifunctional Electric Beard Shaver,Appliances
462,$14.99,$19.99,http://www.jollychic.com/p/facial-hair-remover-multifunctional-portable-electric-face-cleasing-detector-g546178.html,Facial Hair Remover Multifunctional Portable Electric Face Cleasing Detector,Appliances
5419,$14.99,$19.99,http://www.jollychic.com/p/facial-hair-remover-household-handheld-electric-face-cleasing-detector-g546182.html,Facial Hair Remover Household Handheld Electric Face Cleasing Detector,Appliances
81,$9.99,,http://www.jollychic.com/p/unique-design-high-power-home-sweater-hair-ball-trimmer-lint-remover-g554334.html,Unique Design High Power Home Sweater Hair Ball Trimmer Lint Remover,Appliances
293,$7.99,$12.99,http://www.jollychic.com/p/lamp-low-power-consumption-pineapple-pattern-decorative-led-light-g554644.html,Lamp Low Power Consumption Pineapple Pattern Decorative LED Light,Appliances
159,$14.99,,http://www.jollychic.com/p/fan-mini-portable-handheld-electric-fan-g556268.html,Fan Mini Portable Handheld Electric Fan,Appliances
90,$72.00,$98.00,http://www.jollychic.com/p/beauty-instrument-seven-in-one-ultra-sonic-facial-massage-device-g564832.html,Beauty Instrument Seven In One Ultra-Sonic Facial Massage Device,Appliances
454,$8.99,$19.99,http://www.jollychic.com/p/household-stylish-copper-wire-10-meter-decorative-led-lamp-g570628.html,Household Stylish Copper Wire 10 Meter Decorative LED Lamp,Appliances
691,$10.99,$13.99,http://www.jollychic.com/p/fans-mini-fragrance-household-portable-practical-air-fan-g570760.html,Fans Mini Fragrance Household Portable Practical Air Fan,Appliances
255,$12.99,$17.99,http://www.jollychic.com/p/3w-led-light-butterfly-shaped-led-colorful-creative-decorative-light-g570768.html,3W LED Light Butterfly Shaped LED Colorful Creative Decorative Light,Appliances
172,$4.99,$6.99,http://www.jollychic.com/p/1-meters-long-10-led-pineapple-style-home-decorative-led-lamp-g577972.html,1 Meters Long 10 LED Pineapple Style Home Decorative LED Lamp,Appliances
69,$2.99,$4.99,http://www.jollychic.com/p/socket-travel-use-portable-power-adapter-socket-4-2A3-4-2A5cm-g587942.html,Socket Travel Use Portable Power Adapter Socket-4*3.4*5CM,Appliances
50,$39.99,$41.99,http://www.jollychic.com/p/universal-versatile-home-smart-remote-controller-g588306.html,Universal Versatile Home Smart Remote Controller,Appliances
4332,$14.99,$21.99,http://www.jollychic.com/p/moon-stars-shaped-low-consumption-led-decoration-light-eu-plug-220v-g594634.html,Moon Stars Shaped Low Consumption LED Decoration Light EU Plug 220V,Appliances
148,$17.99,$26.99,http://www.jollychic.com/p/bear-eggbeater-household-handheld-silicone-push-button-portable-food-blender-china-standard-plug-g607838.html,BEAR Eggbeater Household Handheld Silicone Push Button Portable Food Blender China Standard Plug,Appliances
71,$26.99,$37.99,http://www.jollychic.com/p/bear-conjee-soup-cooker-multifunctional-household-food-heating-machine-china-standard-plug-g608010.html,BEAR Conjee & Soup Cooker Multifunctional Household Food Heating Machine China Standard Plug,Appliances
192,$18.99,$24.99,http://www.jollychic.com/p/juicer-portable-double-seal-usb-powered-320ml-electric-juicer-bottle-g609218.html,Juicer Portable Double Seal USB Powered 320ML Electric Juicer Bottle,Appliances
54,$17.99,$23.99,http://www.jollychic.com/p/humidifier-ultrasonic-low-noise-dual-outlet-with-led-light-humidifier-g651984.html,Humidifier Ultrasonic Low Noise Dual Outlet With LED Light Humidifier,Appliances
103,$5.99,$6.99,http://www.jollychic.com/p/security-alarm-mini-portable-buzzer-type-with-led-light-security-alarm-g660588.html,Security Alarm Mini Portable Buzzer Type With LED Light Security Alarm,Appliances
295,$11.99,$18.99,http://www.jollychic.com/p/hair-style-supplyquick-heating-hair-straightener-comb-eu-plug-g664484.html,Hair Style SupplyQuick Heating Hair Straightener Comb EU Plug,Appliances
14,$68.00,$74.00,http://www.jollychic.com/p/baby-care-monitor-household-hd-wifi-camera-with-night-vision-security-monitor-g668438.html,Baby Care Monitor Household HD Wifi Camera With Night Vision Security Monitor,Appliances
752,$7.99,$12.99,http://www.jollychic.com/p/electric-kettle-stainless-steel-quick-heating-1-1l-electric-kettle-g672716.html,Electric Kettle Stainless Steel Quick Heating 1.1L Electric Kettle,Appliances
708,$4.99,$8.99,http://www.jollychic.com/p/electric-pedicure-device-portable-waterproof-two-speed-exfoliating-electric-pedicure-device-g672718.html,Electric Pedicure Device Portable Waterproof Two-Speed Exfoliating Electric Pedicure Device,Appliances
25,$16.99,$22.99,http://www.jollychic.com/p/flyco-universal-low-noise-electric-hair-clipper-100-240v-china-standard-plug-g677312.html,Flyco Universal Low Noise Electric Hair Clipper 100-240V China Standard Plug,Appliances
16,$17.99,$19.99,http://www.jollychic.com/p/flyco-universal-portable-foldable-hair-dryer-220v-china-standard-plug-g678918.html,Flyco Universal Portable Foldable Hair Dryer 220V China Standard Plug,Appliances
5,$15.99,$20.99,http://www.jollychic.com/p/flyco-electric-shaver-portable-cambered-surface-blade-net-electric-shaver-chinese-standard-plug-100-7E240v-g679234.html,Flyco Electric Shaver Portable Cambered Surface Blade Net Electric Shaver (Chinese Standard Plug)-100~240V,Appliances
724,$9.99,$14.99,http://www.jollychic.com/p/electric-water-kettle-household-stainless-steel-quick-boiling-pot-eu-plug-g679722.html,Electric Water Kettle Household Stainless Steel Quick Boiling Pot-EU Plug,Appliances
43,$26.99,$30.99,http://www.jollychic.com/p/flyco-electric-iron-mini-high-power-temperature-control-steam-electric-iron-chinese-standard-plug-220v-g680704.html,Flyco Electric Iron Mini High Power Temperature Control Steam Electric Iron (Chinese Standard Plug)-220V,Appliances
24,$11.99,$17.99,http://www.jollychic.com/p/poree-electric-shaver-double-ring-blade-net-quick-shaving-electric-shaver-chinese-standard-plug-220v-g680824.html,Poree Electric Shaver Double Ring Blade Net Quick Shaving Electric Shaver (Chinese Standard Plug)-220V,Appliances
20,$14.99,$18.99,http://www.jollychic.com/p/flyco-hair-dryer-low-noise-high-power-mini-portable-hair-dryer-with-hot-cold-wind-chinese-standard-plug-220v-g680838.html,Flyco Hair Dryer Low Noise High Power Mini Portable Hair Dryer With Hot/Cold Wind (Chinese Standard Plug)-220V,Appliances
54,$36.99,$49.99,http://www.jollychic.com/p/bear-egg-boiler-rotary-knob-timer-stainless-steel-double-layer-egg-boiler-chinese-standard-plug-g687424.html,Bear Egg Boiler Rotary Knob Timer Stainless Steel Double Layer Egg Boiler-Chinese Standard Plug,Appliances
97,$72.00,$93.00,http://www.jollychic.com/p/bear-electric-food-processor-multifunctional-glass-meat-grinder-stirring-machine220v-china-standard-plug-g687628.html,Bear Electric Food Processor Multifunctional Glass Meat Grinder Stirring Machine220V-China Standard Plug,Appliances
55,$14.99,$16.99,http://www.jollychic.com/p/eyelash-curler-portable-micro-vibration-360-degree-curling-heating-electric-eyelash-curler-g694098.html,Eyelash Curler Portable Micro-Vibration 360 Degree Curling Heating Electric Eyelash Curler,Appliances
1893,$31.99,$38.99,http://www.jollychic.com/p/electric-robot-cleaner-2-in-1-swivel-cordless-drag-sweeping-vacuum-cleaner-g695660.html,Electric Robot Cleaner 2 In 1 Swivel Cordless Drag Sweeping Vacuum Cleaner,Appliances
38,$46.99,$88.00,http://www.jollychic.com/p/monitor-wireless-waterproof-960p-support-tf-card-security-bullet-ip-camera-monitor-g699874.html,Monitor Wireless Waterproof 960P Support TF Card Security Bullet IP Camera Monitor,Appliances
23,$21.99,$27.99,http://www.jollychic.com/p/nano-handy-mist-sprayer-mini-fashion-usb-charging-nanometre-water-sprayer-g721972.html,Nano Handy Mist Sprayer Mini Fashion USB Charging Nanometre Water Sprayer,Appliances
39,$59.00,$84.00,http://www.jollychic.com/p/monitor-high-definition-infrared-night-vision-two-way-voice-wifi-security-camera-g740448.html,Monitor High Definition Infrared Night Vision Two-Way Voice WiFi Security Camera,Appliances
295,$15.99,$24.99,http://www.jollychic.com/p/lamp-creative-hot-air-balloon-shape-remote-control-led-baby-intelligent-induction-night-light-g740900.html,Lamp Creative Hot-Air Balloon Shape Remote Control LED Baby Intelligent Induction Night Light,Appliances
182,$24.99,$27.99,http://www.jollychic.com/p/juicer-multi-functional-universal-portable-quick-juicing-fruit-juicer-g755362.html,Juicer Multi-Functional Universal Portable Quick Juicing Fruit Juicer,Appliances
18,$14.99,$16.99,http://www.jollychic.com/p/electric-fan-mini-portable-wind-power-adjustable-usb-charging-electric-fan-g764666.html,Electric Fan Mini Portable Wind Power Adjustable USB Charging Electric Fan,Appliances
38,$4.99,$6.99,http://www.jollychic.com/p/4pcs-high-quality-replacement-electric-toothbrush-head-versatile-for-braun-oral-b-d-series-electric-toothbrush-g773520.html,4Pcs High Quality Replacement Electric Toothbrush Head Versatile For Braun Oral-B D Series Electric Toothbrush,Appliances
59,$11.99,$12.99,http://www.jollychic.com/p/led-nail-lamp-smooth-nail-gel-polishing-usb-charging-portable-nail-dryer-g776674.html,LED Nail Lamp Smooth Nail Gel Polishing USB Charging Portable Nail Dryer,Appliances
13,$19.99,,http://www.jollychic.com/p/lamp-portable-foldable-square-christmas-led-solar-powered-lantern-g793266.html,Lamp Portable Foldable Square Christmas LED Solar Powered Lantern,Appliances
10,$21.99,,http://www.jollychic.com/p/flashlight-portable-ultra-bright-with-hook-and-magnet-outdoor-use-flashlight-g804330.html,Flashlight Portable Ultra-Bright With Hook And Magnet Outdoor Use Flashlight,Appliances
130,$41.99,,http://www.jollychic.com/p/lamp-creative-portable-led-snowflake-design-decorative-christmas-light-g809336.html,Lamp Creative Portable LED Snowflake Design Decorative Christmas Light,Appliances
5,$7.99,,http://www.jollychic.com/p/lamp-portable-led-smd-chip-bulbs-with-20w-high-power-led-driver-supply-g810412.html,Lamp Portable LED SMD Chip Bulbs With 20W High Power LED Driver Supply,Appliances
93,$9.99,$14.99,http://www.jollychic.com/p/hearing-aid-mini-noise-reduction-volume-adjustable-hearing-aid-g814056.html,Hearing Aid Mini Noise Reduction Volume Adjustable Hearing Aid,Appliances
9,$13.99,,http://www.jollychic.com/p/mini-professional-motor-power-supply-for-rotary-tattoo-machine-gun-tool-g821078.html,Mini Professional Motor Power Supply For Rotary Tattoo Machine Gun Tool,Appliances
80,$2.99,$6.99,http://www.jollychic.com/p/led-light-bulb-universal-mini-flexible-usb-charging-night-light-bulb-g847888.html,LED Light Bulb Universal Mini Flexible USB Charging Night Light Bulb,Appliances
80,$11.99,,http://www.jollychic.com/p/pest-propeller-led-lights-no-poison-solar-drive-snake-repellent-device-g855238.html,Pest Propeller LED-lights No-Poison Solar Drive Snake Repellent Device,Appliances
96,$8.99,$12.99,http://www.jollychic.com/p/pest-repeller-dual-sonic-ultrasonic-rats-mice-mosquito-insect-repellent-g856868.html,Pest Repeller Dual Sonic Ultrasonic Rats Mice Mosquito Insect Repellent,Appliances
29,$11.99,$20.99,http://www.jollychic.com/p/simple-curler-multi-function-black-and-white-dual-use-multi-purpose-hair-rods-eu-plug-g857302.html,Simple Curler Multi Function Black And White Dual-Use Multi-Purpose Hair Rods EU Plug,Appliances
100,$37.99,$58.00,http://www.jollychic.com/p/electric-water-kettle-double-material-thickness-household-stainless-steel-quick-boiling-pot-g861248.html,Electric Water Kettle Double Material Thickness Household Stainless Steel Quick Boiling Pot,Appliances
146,$4.99,$9.99,http://www.jollychic.com/p/portable-facial-massager-instrument-mini-electronic-4-heads-removing-tools-g865694.html,Portable Facial Massager Instrument MINI Electronic 4 Heads Removing Tools,Appliances
180,$3.99,,http://www.jollychic.com/p/mini-handheld-manual-stitch-clothes-fabrics-sewing-machine-needlework-g871154.html,Mini Handheld Manual Stitch Clothes Fabrics Sewing Machine Needlework,Appliances
7,$16.99,,http://www.jollychic.com/p/2-4ghz-wireless-remote-control-for-android-smart-tv-portable-controller-g873772.html,2.4GHz Wireless Remote Control For Android Smart TV Portable Controller,Appliances
397,$24.99,$32.99,http://www.jollychic.com/p/kitchen-scale-drip-coffee-with-timer-function-electronic-digital-kitchen-scale-g900656.html,Kitchen Scale Drip Coffee With Timer Function Electronic Digital Kitchen Scale,Appliances
19,$24.99,$32.99,http://www.jollychic.com/p/depilator-multi-functional-rechargeable-easy-operation-electric-depilator-eu-us-plug-g920752.html,Depilator Multi-Functional Rechargeable Easy Operation Electric Depilator EU/US Plug,Appliances
3,$15.99,$24.99,http://www.jollychic.com/p/light-portable-solar-powered-lantern-design-inflatable-outdoor-led-light-g960316.html,Light Portable Solar Powered Lantern Design Inflatable Outdoor LED Light,Appliances
145,$17.99,$26.99,http://www.jollychic.com/p/hair-straightener-comb-portable-lcd-screen-easy-operation-hair-straightener-eu-plug-g963668.html,Hair Straightener Comb Portable LCD Screen Easy Operation Hair Straightener EU Plug,Appliances
25,$82.00,$110.00,http://www.jollychic.com/p/smart-camera-2-4-inches-wireless-two-way-talk-universal-baby-monitor-uk-plug-g974894.html,Smart Camera 2.4 Inches Wireless Two Way Talk Universal Baby Monitor UK Plug,Appliances
76,$16.99,$26.99,http://www.jollychic.com/p/hair-straightener-household-portable-professional-flat-straightening-iron-styling-tool-g975860.html,Hair Straightener Household Portable Professional Flat Straightening Iron Styling Tool,Appliances
30,$20.99,,http://www.jollychic.com/p/fan-usb-oxygen-anion-portable-mini-fan-g986054.html,Fan USB Oxygen Anion Portable Mini Fan,Appliances
1,$25.99,$33.99,http://www.jollychic.com/p/orp-meter-tester-pen-redox-measure-drinkwater-drinking-quality-analysis-device-tester-g995460.html,ORP Meter Tester Pen Redox Measure Drinkwater Drinking Quality Analysis Device Tester,Appliances
31,$6.99,$9.99,http://www.jollychic.com/p/electronic-scale-200g-0-01g-mini-digital-pocket-weigh-scale-balance-g997754.html,Electronic Scale 200g/0.01g Mini Digital Pocket Weigh Scale Balance,Appliances
7,$12.99,$16.99,http://www.jollychic.com/p/2-pcs-hearing-aids-behind-ear-design-sound-amplifier-low-noise-heading-aids-g999396.html,2 Pcs Hearing Aids Behind Ear Design Sound Amplifier Low Noise Heading Aids,Appliances
5,$4.99,$5.99,http://www.jollychic.com/p/solid-state-relays-high-sensitivity-fast-switching-solid-state-relays-g999700.html,Solid State Relays High Sensitivity Fast Switching Solid State Relays,Appliances
18,$32.99,,http://www.jollychic.com/p/hair-clipper-multi-functional-portable-lcd-display-rechargeable-hair-clipper-eu-plug-g1009380.html,Hair Clipper Multi-Functional Portable LCD Display Rechargeable Hair Clipper EU Plug,Appliances
9,$15.99,$24.99,http://www.jollychic.com/p/hair-clipper-portable-low-noise-plug-and-play-universal-hair-clipper-eu-plug-g1010202.html,Hair Clipper Portable Low Noise Plug And Play Universal Hair Clipper EU Plug,Appliances
9,$3.99,$6.99,http://www.jollychic.com/p/flashlight-portable-multi-purpose-12-led-uv-invisible-blacklight-flashlight-torch-light-g1010570.html,Flashlight Portable Multi-Purpose 12 LED UV Invisible Blacklight Flashlight Torch Light,Appliances
2,$13.99,,http://www.jollychic.com/p/usb-voltmeter-multi-function-ammeter-current-voltage-capacity-monitor-tester-g1016902.html,USB Voltmeter Multi-Function Ammeter Current Voltage Capacity Monitor Tester,Appliances
167,$28.99,,http://www.jollychic.com/p/facial-cleansing-device-deep-clensing-blackheads-removing-pore-cleaning-portable-tools-g1017352.html,Facial Cleansing Device Deep Clensing Blackheads Removing Pore Cleaning Portable Tools,Appliances
177,$2.99,,http://www.jollychic.com/p/mini-home-snacks-sealing-machine-portable-travel-handheld-kitchen-sealing-tool-g1023742.html,Mini Home Snacks Sealing Machine Portable Travel Handheld Kitchen Sealing Tool,Appliances
238,$25.99,,http://www.jollychic.com/p/facial-cleansing-device-portable-deep-cleansing-comfy-beauty-apparatus-g1027134.html,Facial Cleansing Device Portable Deep Cleansing Comfy Beauty Apparatus,Appliances
157,$23.99,,http://www.jollychic.com/p/electric-nail-polisher-grinder-nail-trimmer-exfoliating-scrub-callour-remover-g1039666.html,Electric Nail Polisher Grinder nail trimmer Exfoliating Scrub Callour Remover,Appliances
38,$31.99,,http://www.jollychic.com/p/steam-iron-brush-handheld-household-steam-brush800w-mini-steam-ironing-machine-g1039808.html,Steam Iron Brush Handheld Household Steam Brush800W Mini Steam Ironing Machine,Appliances
53,$8.99,,http://www.jollychic.com/p/reusable-k-cup-holder-replacement-part-coffee-filters-for-keurig-machi-g1040006.html,Reusable K-Cup Holder Replacement Part Coffee Filters For Keurig Machi,Appliances
264,$8.99,,http://www.jollychic.com/p/instant-sealer-mini-handy-heat-manual-sealer-g1040662.html,Instant Sealer Mini Handy Heat Manual Sealer,Appliances
5,$20.99,,http://www.jollychic.com/p/beilejia-clipper-professional-corded-children-electric-hair-style-clipper-g1051846.html,Beilejia Clipper Professional Corded Children Electric Hair Style Clipper,Appliances
11,$17.99,,http://www.jollychic.com/p/outdoor-light-2000-lumen-xx2-led-usb-rechargeable-bright-light-bike-headlight-g1053952.html,Outdoor Light 2000 Lumen XX2 LED USB Rechargeable Bright Light Bike Headlight,Appliances
228,$9.99,$13.99,http://www.jollychic.com/p/massager-butterfly-design-body-muscle-electronic-slimming-massager-g1054190.html,Massager Butterfly Design Body Muscle Electronic Slimming Massager,Appliances
127,$9.99,$13.99,http://www.jollychic.com/p/led-light-spherical-rotation-night-sky-starry-flashing-decorative-lamp-for-wedding-party-g1054334.html,LED Light Spherical Rotation Night Sky Starry Flashing Decorative Lamp For Wedding/Party,Appliances
55,$4.99,$8.99,http://www.jollychic.com/p/led-light-led-copper-wire-string-fairy-lights-party-light-g1054428.html,LED Light LED Copper Wire String Fairy Lights Party Light,Appliances
23,$13.99,,http://www.jollychic.com/p/facial-water-sprayer-portable-mini-ultrasonic-atomizing-facial-water-humidifier-for-ios-android-g1059268.html,Facial Water Sprayer Portable Mini Ultrasonic Atomizing Facial Water Humidifier For iOS/Android,Appliances
44,$35.99,,http://www.jollychic.com/p/surker-hair-clipper-5-in-1-versatile-rechargeable-multifunctional-nose-eyebows-trimmer-g1059410.html,Surker Hair Clipper 5 In 1 Versatile Rechargeable Multifunctional Nose Eyebows Trimmer,Appliances
8,$45.99,,http://www.jollychic.com/p/ceramic-steaming-iron-portable-multi-function-durable-electric-iron-g1060836.html,Ceramic Steaming Iron Portable Multi-Function Durable Electric Iron,Appliances
1,$32.99,$47.99,http://www.jollychic.com/p/sonoff-th10-wifi-smart-switch-controller-temperature-and-humidity-sensor-h8o8-g1074274.html,Sonoff TH10 WiFi Smart Switch Controller Temperature And Humidity Sensor H8O8,Appliances
169,$6.99,$12.99,http://www.jollychic.com/p/nail-grinder-portable-practical-with-5-grinding-heads-multi-functional-electronic-nail-polisher-g1076754.html,Nail Grinder Portable Practical With 5 Grinding Heads Multi-Functional Electronic Nail Polisher,Appliances
84,$9.99,$17.99,http://www.jollychic.com/p/electric-toothbrush-rechargeable-portable-acoustic-toothbrush-for-children-kids-adults-g1078476.html,Electric Toothbrush Rechargeable Portable Acoustic Toothbrush For Children/Kids/Adults,Appliances
38,$24.99,,http://www.jollychic.com/p/freckles-removal-pen-portable-household-with-electric-ion-carbonation-function-plasma-mole-remover-g1093306.html,Freckles Removal Pen Portable Household With Electric Ion Carbonation Function Plasma Mole Remover,Appliances
19,$26.99,,http://www.jollychic.com/p/electric-hair-drier-home-anti-static-simple-and-delicate-strong-breeze-eu-uk-au-plug-g1118402.html,Electric Hair Drier Home Anti-Static Simple And Delicate Strong Breeze EU/UK/AU Plug,Appliances
1,$19.99,,http://www.jollychic.com/p/led-string-light-multi-purpose-portable-aquarium-submersible-lamp-led-light-bar-lamp-g1118890.html,LED String Light Multi-Purpose Portable Aquarium Submersible Lamp LED Light Bar Lamp,Appliances
6,$22.99,,http://www.jollychic.com/p/air-humidifier-usb-ultrasonic-led-light-essential-g1127516.html,Air Humidifier USB Ultrasonic Led Light Essential,Appliances
15,$19.99,,http://www.jollychic.com/p/10m-100-pcs-twinkling-led-round-bulb-string-lights-christmas-party-decoration-eu-standard-g1127522.html,10m 100 Pcs Twinkling LED Round Bulb String Lights Christmas Party Decoration EU Standard,Appliances
11,$1.99,,http://www.jollychic.com/p/seven-color-changeable-slowly-flash-puppy-dog-led-night-lights-lamp-wholesale-g1134006.html,Seven Color Changeable Slowly Flash Puppy/dog Led Night Lights Lamp Wholesale,Appliances
19,$29.99,,http://www.jollychic.com/p/kemei-km-2068-kemei-defeatherer-combo-defeatherer-epilator-shaver-eu-uk-au-standard-g1134070.html,KEMEI KM-2068 Kemei Defeatherer Combo Defeatherer Epilator Shaver EU/UK/AU Standard,Appliances
1,$33.99,,http://www.jollychic.com/p/4-pcs-lights-warm-white-energy-saving-48-leds-5050-smd-corn-lamp-bulb-6w-g1137866.html,4 Pcs Lights Warm White Energy Saving 48 LEDs 5050 SMD Corn Lamp Bulb 6W,Appliances
1,$61.00,,http://www.jollychic.com/p/ceiling-pendant-light-fixture-chrome-modern-3-head-household-decorative-lamp-g1137966.html,Ceiling Pendant Light Fixture Chrome Modern 3 Head Household Decorative Lamp,Appliances
82,$12.99,$19.99,http://www.jollychic.com/p/led-light-portable-multi-purpose-eye-protection-usb-reading-lamp-g1141106.html,LED Light Portable Multi-Purpose Eye Protection USB Reading Lamp,Appliances
2,$42.99,,http://www.jollychic.com/p/10-pcs-croled-light-bulb-candle-shaped-e14-6-led-5630-smd-warm-white-led-light-bulb-g1141156.html,10 Pcs CroLED Light Bulb Candle Shaped E14 6 LED 5630 SMD Warm White LED Light Bulb,Appliances
