add_wish,discount_price,original_price,product_link,product_name,header_block
0,$27.99,$34.99,http://www.jollychic.com/p/halcyon-nanometer-facial-steamer-handheld-durable-portable-household-usb-charging-water-sprayer-g1249124.html,HALCYON Nanometer Facial Steamer Handheld Durable Portable Household USB Charging Water Sprayer,Appliances
26,$25.99,$39.99,http://www.jollychic.com/p/hair-straightener-lcd-temperature-control-electric-automatic-comb-g1254362.html,Hair Straightener LCD Temperature Control Electric Automatic Comb,Appliances
1,$16.99,$25.99,http://www.jollychic.com/p/tattoo-machine-household-rotary-motor-tattoo-dragonfly-style-machine-g1254768.html,Tattoo Machine Household Rotary Motor Tattoo Dragonfly Style Machine,Appliances
7,$24.99,$33.99,http://www.jollychic.com/p/light-creative-camera-lens-shape-music-projection-perpetual-calendar-electronic-clock-star-light-g1265594.html,Light Creative Camera Lens Shape Music Projection Perpetual Calendar Electronic Clock Star Light,Appliances
2,$138.00,$179.00,http://www.jollychic.com/p/surveillance-camera-multi-function-indoor-and-outside-alarm-monitoring-camera-eu-us-uk-au-plug-g1266308.html,Surveillance Camera Multi-Function Indoor And Outside Alarm Monitoring Camera EU/US/UK/AU Plug,Appliances
6,$19.99,,http://www.jollychic.com/p/decorating-light-string-iron-hollow-pineapple-moon-five-pointed-star-heart-shape-light-string-g1274360.html,Decorating Light String Iron Hollow Pineapple Moon Five-pointed Star Heart Shape Light String,Appliances
12,$36.99,,http://www.jollychic.com/p/pen-holder-fan-lamp-multi-functional-usb-rechargeable-pen-holder-fan-lamp-g1276754.html,Pen Holder Fan Lamp Multi-functional USB Rechargeable Pen Holder Fan Lamp,Appliances
7,$24.99,,http://www.jollychic.com/p/night-light-usb-rechargeable-touch-sensor-led-silicone-night-light-g1276898.html,Night Light Usb Rechargeable Touch Sensor LED Silicone Night Light,Appliances
2,$38.99,,http://www.jollychic.com/p/outdoor-light-yellow-mini-rechargeable-usb-led-portable-durable-waterproof-torch-g1289738.html,Outdoor Light Yellow Mini Rechargeable USB LED Portable Durable Waterproof Torch,Appliances
1,$37.99,,http://www.jollychic.com/p/outdoor-light-black-mini-rechargeable-usb-led-lamp-multi-function-portable-waterproof-torch-g1290090.html,Outdoor Light Black Mini Rechargeable USB LED Lamp Multi-Function Portable Waterproof Torch,Appliances
0,$19.99,,http://www.jollychic.com/p/senkama-outdoor-light-ultra-bright-tent-light-portable-waterproof-usb-mini-led-lamp-g1297734.html,"SENKAMA Outdoor Light Ultra Bright Tent Light,Portable Waterproof USB Mini LED Lamp",Appliances
0,$39.99,,http://www.jollychic.com/p/hair-straightener-straight-and-curling-irons-gold-tourmaline-multi-function-straightener-eu-plug-g1320262.html,Hair Straightener Straight And Curling Irons Gold Tourmaline Multi-Function Straightener EU Plug,Appliances
2279,$12.99,$19.99,http://www.jollychic.com/p/led-clock-with-backlight-message-board-multi-functional-led-clock-g716578.html,LED Clock With Backlight Message Board Multi-Functional LED Clock,Appliances
29,$1.99,,http://www.jollychic.com/p/mini-usb-led-light-bulb-portable-computer-laptop-pc-desk-reading-bulb-g1019080.html,Mini USB LED Light Bulb Portable Computer Laptop PC Desk Reading Bulb,Appliances
1700,$24.99,$38.99,http://www.jollychic.com/p/bbp-2000-anti-static-ceramic-hair-straightener-heating-detangling-hair-brush-E2-80-93black-us-plug--g344718.html,BBP-2000 Anti-Static Ceramic Hair Straightener Heating Detangling Hair Brush –Black (US Plug),Appliances
55,$26.99,$30.99,http://www.jollychic.com/p/black-handy-hearing-aid-with-ear-hook-g374502.html,Black Handy Hearing-aid with Ear Hook,Appliances
1490,$5.99,$14.99,http://www.jollychic.com/p/multifunctional-white-and-black-style-handy-mini-hairdressing-hairdressing-curling-iron-g388586.html,Multifunctional White And Black Style Handy Mini Hairdressing Hairdressing Curling Iron,Appliances
1608,$18.99,$35.99,http://www.jollychic.com/p/cool-wall-lamp-european-style-human-body-induction-lamp-g394334.html,Cool Wall Lamp European Style Human Body Induction Lamp,Appliances
18,$13.99,,http://www.jollychic.com/p/tent-flashlight-red-aluminium-alloy-pen-shaped-waterproof-led-lamp-g405240.html,Tent Flashlight Red Aluminium Alloy Pen Shaped Waterproof LED Lamp,Appliances
74,$5.99,$10.99,http://www.jollychic.com/p/reciprocating-type-electric-shaver-single-swivel-head-shaver-china-standard-plug-g415872.html,Reciprocating Type Electric Shaver Single Swivel Head Shaver-China Standard Plug,Appliances
155,$57.00,$68.00,http://www.jollychic.com/p/multifunctional-dual-use-electronic-watch-cigarette-lighter-g463608.html,Multifunctional Dual Use Electronic Watch Cigarette Lighter,Appliances
83,$33.99,$64.00,http://www.jollychic.com/p/massage-device-household-mini-portable-whole-body-massage-device-g463666.html,Massage Device Household Mini Portable Whole Body Massage Device,Appliances
209,$129.00,$175.00,http://www.jollychic.com/p/baby-monitor-hd-camera-wireless-night-vision-two-way-voice-intercom-g479740.html,Baby Monitor HD Camera Wireless Night Vision Two Way Voice Intercom,Appliances
143,$4.99,$9.99,http://www.jollychic.com/p/wireless-remote-control-battery-doorbell-g487108.html,Wireless Remote Control Battery Doorbell,Appliances
53,$51.00,$60.00,http://www.jollychic.com/p/baby-care-monitor-multifunctional-household-smart-surveillance-camera-monitor-g492472.html,Baby Care Monitor Multifunctional Household Smart Surveillance Camera Monitor,Appliances
52,$51.00,$62.00,http://www.jollychic.com/p/monitor-household-remote-control-smart-wireless-camera-support-tf-card-wifi-g492474.html,Monitor Household Remote Control Smart Wireless Camera Support TF Card/Wifi,Appliances
148,$38.99,$60.00,http://www.jollychic.com/p/vacuum-household-portable-high-power-vacuum-cleaner-g495044.html,Vacuum Household Portable High Power Vacuum Cleaner,Appliances
64,$19.99,,http://www.jollychic.com/p/black-universal-multifunctional-5-mode-memory-white-light-flashlight-g505454.html,Black Universal Multifunctional 5-Mode Memory White Light Flashlight,Appliances
75,$5.99,,http://www.jollychic.com/p/lamp-portable-lightweight-led-arm-mounted-caution-light-g533920.html,Lamp Portable Lightweight LED Arm-Mounted Caution Light,Appliances
471,$15.99,$19.99,http://www.jollychic.com/p/lamp-solar-power-infrared-induction-light-sound-sensor-led-outdoor-lamp-g551110.html,Lamp Solar Power Infrared Induction Light & Sound Sensor LED Outdoor Lamp,Appliances
80,$20.99,$32.99,http://www.jollychic.com/p/lamp-fashion-touch-sensor-power-saving-led-table-lamp-g551956.html,Lamp Fashion Touch Sensor Power Saving LED Table Lamp,Appliances
343,$7.99,$13.99,http://www.jollychic.com/p/10pcs-lot-color-light-butterfly-wall-stickers-easy-installation-night-light-g552958.html,10pcs/lot Color light Butterfly Wall Stickers Easy Installation Night Light,Appliances
364,$5.99,$10.99,http://www.jollychic.com/p/household-anti-pest-bug-fly-killer-mosquito-repellent-lamp-g567372.html,Household Anti Pest Bug Fly Killer Mosquito Repellent Lamp,Appliances
817,$15.99,$22.99,http://www.jollychic.com/p/ufo-shaped-360-degree-rotating-night-light-new-motion-sensor-night-lamp-g578168.html,UFO Shaped 360 Degree Rotating Night Light New Motion Sensor Night Lamp,Appliances
205,$6.99,$7.99,http://www.jollychic.com/p/lamp-portable-stretchable-high-brightness-solar-led-camp-light-h19-2A9-5cm-g594270.html,Lamp Portable Stretchable High Brightness Solar LED Camp Light-H19*9.5cm,Appliances
246,$11.99,$14.99,http://www.jollychic.com/p/10-meters-string-led-outdoor-waterproof-ball-light-eu-plug-220v-g594640.html,10 Meters String LED Outdoor Waterproof Ball Light EU Plug 220V,Appliances
1278,$7.99,$9.99,http://www.jollychic.com/p/electric-toothbrush-ultrasonic-high-frequency-vibration-waterproof-electric-toothbrush-h15-2cm-g602184.html,Electric Toothbrush Ultrasonic High Frequency Vibration Waterproof Electric Toothbrush-H15.2cm,Appliances
47,$28.99,$37.99,http://www.jollychic.com/p/smart-socket-remote-wireless-control-wifi-smart-socket-g607248.html,Smart Socket Remote Wireless Control WiFi Smart Socket,Appliances
848,$7.99,$9.99,http://www.jollychic.com/p/pedicure-tool-mini-portable-low-noise-humanized-design-pedicure-tool-kit-12pcs-g609382.html,Pedicure Tool Mini Portable Low Noise Humanized Design Pedicure Tool Kit-12Pcs,Appliances
96,$59.00,$64.00,http://www.jollychic.com/p/smart-light-portable-functional-music-playing-led-bluetooth-light-with-speaker-changing-colors-g614814.html,Smart Light Portable Functional Music Playing LED Bluetooth Light With Speaker&Changing Colors,Appliances
189,$20.99,$26.99,http://www.jollychic.com/p/household-waterproof-cleaning-brush-bathtub-kitchen-electric-cleaning-brush-g619330.html,Household Waterproof Cleaning Brush Bathtub Kitchen Electric Cleaning Brush,Appliances
561,$4.99,,http://www.jollychic.com/p/household-animal-shaped-silent-zero-radiation-pest-repeller-220v-eu-plug-g625730.html,Household Animal Shaped Silent Zero Radiation Pest Repeller 220V EU Plug,Appliances
305,$17.99,$23.99,http://www.jollychic.com/p/water-purifier-mini-portable-safe-non-toxic-1-6l-household-water-purify-kettle-g630814.html,Water Purifier Mini Portable Safe Non-Toxic 1.6L Household Water Purify Kettle,Appliances
1320,$5.99,$8.99,http://www.jollychic.com/p/artizan-lamp-led-human-body-motion-induction-household-energy-saving-night-light-5w-g638970.html,ARTIZAN Lamp LED Human Body Motion Induction Household Energy Saving Night Light 5W,Appliances
138,$12.99,$14.99,http://www.jollychic.com/p/thermometer-with-backlight-screen-precise-infrared-digital-thermometer-g652002.html,Thermometer With Backlight Screen Precise Infrared Digital Thermometer,Appliances
1147,$7.99,,http://www.jollychic.com/p/electric-fan-portable-handheld-usb-powered-foldable-mini-electric-fan-g660594.html,Electric Fan Portable Handheld USB Powered Foldable Mini Electric Fan,Appliances
82,$9.99,,http://www.jollychic.com/p/household-universal-decoration-led-celling-light-led-g668566.html,Household Universal Decoration LED Celling Light LED,Appliances
46,$11.99,$15.99,http://www.jollychic.com/p/portable-universal-eye-massage-device-eye-beauty-tool-g680842.html,Portable Universal Eye Massage Device Eye Beauty Tool,Appliances
35,$8.99,$13.99,http://www.jollychic.com/p/smoke-alarm-detector-mini-sensitive-durable-accurate-carbon-monoxide-smoke-alarm-detector-g684936.html,Smoke Alarm Detector Mini Sensitive Durable Accurate Carbon Monoxide Smoke Alarm Detector,Appliances
59,$36.99,$46.99,http://www.jollychic.com/p/bear-egg-boiler-micro-computer-control-multi-functional-safe-durable-egg-boiler-chinese-standard-plug-g687568.html,Bear Egg Boiler Micro Computer Control Multi-Functional Safe Durable Egg Boiler-Chinese Standard Plug,Appliances
85,$14.99,,http://www.jollychic.com/p/universal-multi-functional-low-noise-no-radiation-pest-repeller-g688206.html,Universal Multi-Functional Low Noise No Radiation Pest Repeller,Appliances
36,$14.99,$16.99,http://www.jollychic.com/p/eyebrow-razor-mini-portable-safe-allergy-free-electric-eyebrow-razor-g694070.html,Eyebrow Razor Mini Portable Safe Allergy Free Electric Eyebrow Razor,Appliances
87,$29.99,$53.00,http://www.jollychic.com/p/monitor-hd-infrared-night-vision-wifi-remote-monitor-two-way-talk-security-camera-g694208.html,Monitor HD Infrared Night Vision WiFi Remote Monitor Two-Way Talk Security Camera,Appliances
74,$5.99,,http://www.jollychic.com/p/mosquito-repeller-2-in-1-portable-key-chain-electric-magnetic-ultrasonic-pest-killer-g696160.html,Mosquito Repeller 2 In 1 Portable Key Chain Electric Magnetic Ultrasonic Pest Killer,Appliances
197,$24.99,$29.99,http://www.jollychic.com/p/pulse-oximeter-abs-fingertip-type-portable-oled-display-screen-oximeter-g696446.html,Pulse Oximeter ABS Fingertip Type Portable OLED Display Screen Oximeter,Appliances
78,$19.99,,http://www.jollychic.com/p/portable-multi-functional-solar-power-animal-repeller-infrared-sensor-repeller-g698748.html,Portable Multi-Functional Solar Power Animal Repeller Infrared Sensor Repeller,Appliances
85,$36.99,$41.99,http://www.jollychic.com/p/smart-monitor-household-universal-10-meters-night-vision-camera-monitor-g711730.html,Smart Monitor Household Universal 10 Meters Night Vision Camera Monitor,Appliances
143,$9.99,$12.99,http://www.jollychic.com/p/eye-beauty-tool-led-handy-iontophoresis-eyes-massager-beauty-tool-g721804.html,Eye Beauty Tool LED Handy Iontophoresis Eyes Massager Beauty Tool,Appliances
74,$38.99,$54.00,http://www.jollychic.com/p/bear-electric-heating-pot-micro-computer-control-multi-protection-detachable-electric-heating-pot-chinese-standard-plug-g728562.html,Bear Electric Heating Pot Micro Computer Control Multi-Protection Detachable Electric Heating Pot-Chinese Standard Plug,Appliances
177,$51.00,$66.00,http://www.jollychic.com/p/bear-juicer-portable-safe-stainless-steel-blade-detachable-juicer-chinese-standard-plug-g728906.html,Bear Juicer Portable Safe Stainless Steel Blade Detachable Juicer-Chinese Standard Plug,Appliances
18,$28.99,$31.99,http://www.jollychic.com/p/epilator-handheld-household-durable-electric-epilator-with-4-epilating-heads-g739352.html,Epilator Handheld Household Durable Electric Epilator With 4 Epilating Heads,Appliances
172,$14.99,$21.99,http://www.jollychic.com/p/automatic-liquid-soap-dispenser-hands-free-household-soap-dispenser-auto-sanitiser-for-kitchen-bathroom-office-g747410.html,"Automatic Liquid Soap Dispenser Hands Free Household Soap Dispenser Auto Sanitiser For Kitchen, Bathroom, Office",Appliances
54,$18.99,$21.99,http://www.jollychic.com/p/lamp-white-cloud-shape-touch-inductiontype-led-bedroom-light-kid-s-night-light-g747856.html,Lamp White Cloud Shape Touch InductionType LED Bedroom Light Kid's Night Light,Appliances
35,$10.99,,http://www.jollychic.com/p/24-hour-mechanical-electrical-plug-program-timer-power-switch-eu-plug-g759148.html,24 Hour Mechanical Electrical Plug Program Timer Power Switch EU Plug,Appliances
25,$18.99,,http://www.jollychic.com/p/night-lamp-360-C2-B0rotating-body-sensor-portable-rechargeable-night-light-g759462.html,Night Lamp 360°Rotating Body Sensor Portable Rechargeable Night Light,Appliances
64,$10.99,$12.99,http://www.jollychic.com/p/dusting-brush-electronic-liquid-motor-brush-spins-motor-car-blind-cleaning-brush-g773334.html,Dusting Brush Electronic Liquid Motor Brush Spins Motor Car Blind Cleaning Brush,Appliances
270,$7.99,$8.99,http://www.jollychic.com/p/lint-remover-portable-practical-hair-ball-trimmer-for-vest-sweater-scarf-socks-g777010.html,Lint Remover Portable Practical Hair Ball Trimmer For Vest/Sweater/Scarf/Socks,Appliances
61,$28.99,,http://www.jollychic.com/p/air-conditioning-outlet-wind-shield-household-safe-health-baby-care-wind-board-g782988.html,Air Conditioning Outlet Wind Shield Household Safe Health Baby Care Wind Board,Appliances
165,$7.99,$12.99,http://www.jollychic.com/p/electric-fan-portable-angle-adjustable-handheld-bladeless-mini-cooling-fan-g788434.html,Electric Fan Portable Angle Adjustable Handheld Bladeless Mini Cooling Fan,Appliances
24,$13.99,,http://www.jollychic.com/p/portable-lightweight-multi-functional-universal-fly-catcher-swatter-g804356.html,Portable Lightweight Multi-Functional Universal Fly Catcher Swatter,Appliances
56,$2.99,,http://www.jollychic.com/p/flashlight-portable-ultra-bright-hand-press-charging-flashlight-g804602.html,Flashlight Portable Ultra-Bright Hand Press Charging Flashlight,Appliances
694,$11.99,$19.99,http://www.jollychic.com/p/lamp-eco-friendly-modern-style-hollow-out-decoration-table-lamp-g814268.html,Lamp Eco-Friendly Modern Style Hollow Out Decoration Table Lamp,Appliances
50,$13.99,$19.99,http://www.jollychic.com/p/lamp-6m-30led-water-droplets-design-solar-fairy-lights-outdoor-led-wedding-decorative-string-lights-g820922.html,Lamp 6M 30LED Water Droplets Design Solar Fairy Lights Outdoor LED Wedding Decorative String Lights,Appliances
102,$8.99,$11.99,http://www.jollychic.com/p/electric-hair-remover-household-portable-washable-lady-shaver-epilator-g825062.html,Electric Hair Remover Household Portable Washable Lady Shaver Epilator,Appliances
365,$22.99,$37.99,http://www.jollychic.com/p/home-humidifier-wood-grain-ultrasonic-aroma-cool-moist-humidifier-g828142.html,Home Humidifier Wood Grain Ultrasonic Aroma Cool Moist Humidifier,Appliances
17,$47.99,$57.00,http://www.jollychic.com/p/hair-style-supply-multi-functional-portable-anion-hair-curler-g848232.html,Hair Style Supply Multi-Functional Portable Anion Hair Curler,Appliances
262,$16.99,$25.99,http://www.jollychic.com/p/artizan-5-pcs-body-brushes-set-handheld-household-electric-shower-brush-bath-massage-brush-g857726.html,ARTIZAN 5 Pcs Body Brushes Set Handheld Household Electric Shower Brush Bath Massage Brush,Appliances
233,$28.99,$40.99,http://www.jollychic.com/p/handheld-steam-ironer-mini-portable-electric-brush-iron-g880634.html,Handheld Steam Ironer Mini Portable Electric Brush Iron,Appliances
73,$22.99,$32.99,http://www.jollychic.com/p/depilator-multi-functional-portable-rechargeable-electric-depilator-eu-plug-g923010.html,Depilator Multi-Functional Portable Rechargeable Electric Depilator EU Plug,Appliances
603,$95.00,$138.00,http://www.jollychic.com/p/salter-airfryer-domestic-mobile-non-lampblack-non-stick-fryer-g925998.html,SALTER Airfryer Domestic Mobile Non-lampblack Non-stick Fryer,Appliances
165,$26.99,$29.99,http://www.jollychic.com/p/hair-straightener-curler-household-ceramic-straight-and-roll-dual-function-hair-styling-tools-g937706.html,Hair Straightener&Curler Household Ceramic Straight And Roll Dual Function Hair Styling Tools,Appliances
46,$31.99,$48.99,http://www.jollychic.com/p/7-in-1-facial-cleaner-eu-standard--g951280.html,7 in 1 Facial Cleaner (EU Standard),Appliances
83,$8.99,$15.99,http://www.jollychic.com/p/30-led-light-string-transparent-crystal-ball-plastic-modeling-light-string-g960442.html,30 LED Light String Transparent Crystal Ball Plastic Modeling Light String,Appliances
17,$55.00,$63.00,http://www.jollychic.com/p/smart-camera-wireless-night-vision-hd-720p-waterproof-ip-network-security-camera-uk-plug-g960488.html,Smart Camera Wireless Night Vision HD 720P Waterproof IP/Network Security Camera UK Plug,Appliances
9,$19.99,$28.99,http://www.jollychic.com/p/hearing-aid-mini-volume-mode-adjustable-comfy-hearing-aid-g963170.html,Hearing Aid Mini Volume Mode Adjustable Comfy Hearing Aid,Appliances
49,$17.99,$26.99,http://www.jollychic.com/p/hair-straightener-comb-lcd-screen-portable-hair-straightener-us-eu-plug-g963472.html,Hair Straightener Comb LCD Screen Portable Hair Straightener US/EU Plug,Appliances
5,$14.99,$19.99,http://www.jollychic.com/p/wind-speed-thermometer-multi-function-humidity-wind-chill-indicator-anemometer-g970562.html,Wind Speed Thermometer Multi-Function Humidity Wind Chill Indicator Anemometer,Appliances
8,$13.99,$18.99,http://www.jollychic.com/p/jewelry-scale-lcd-pocket-digital-medical-lab-balance-scale-10-0-001g-g972458.html,Jewelry Scale LCD Pocket Digital Medical Lab Balance Scale-10/0.001g,Appliances
7,$13.99,$17.99,http://www.jollychic.com/p/xiaomi-smart-power-socket-strip-household-portable-3-usb-ports-board-converter-g980946.html,Xiaomi Smart Power Socket Strip Household Portable 3 USB Ports Board Converter,Appliances
10,$7.99,$10.99,http://www.jollychic.com/p/-rk-s28d-ceiling-mounted-pir-detector-ir-motion-automatic-sensor-on-off-switch-light-g981274.html,(RK-S28D)Ceiling Mounted PIR Detector IR Motion Automatic Sensor ON/OFF Switch Light,Appliances
287,$10.99,$16.99,http://www.jollychic.com/p/night-light-decoration-led-love-letters-night-light-g985098.html,Night Light Decoration LED Love Letters Night Light,Appliances
63,$27.99,$37.99,http://www.jollychic.com/p/beauty-apparatus-5-in-1-lady-epilator-shaver-facial-brush-callus-remover-and-massager-g990176.html,Beauty Apparatus 5 in 1 Lady Epilator Shaver Facial Brush Callus Remover and Massager,Appliances
141,$29.99,$36.99,http://www.jollychic.com/p/ceramic-hair-straightener-hair-iron-professional-hair-stylingtool-eu-standard--g993024.html,Ceramic Hair straightener Hair Iron Professional Hair stylingTool (EU Standard),Appliances
35,$6.99,$9.99,http://www.jollychic.com/p/croled-humidifier-12-led-400ml-large-capacity-universal-mist-maker-us-plug-g999352.html,CroLED Humidifier 12 LED 400ML Large Capacity Universal Mist Maker US Plug,Appliances
82,$21.99,$29.99,http://www.jollychic.com/p/depilator-6-in-1-multi-functional-portable-universal-rechargeable-electric-depilator-g1000688.html,Depilator 6 In 1 Multi-Functional Portable Universal Rechargeable Electric Depilator,Appliances
30,$1.99,$3.99,http://www.jollychic.com/p/flashlight-torch-multifunctional-outdoor-camping-working-led-tent-light-portable-emergency-lamp-g1002096.html,Flashlight Torch Multifunctional Outdoor Camping Working LED Tent Light Portable Emergency Lamp,Appliances
186,$48.99,,http://www.jollychic.com/p/electric-blackhead-remover-multi-function-portable-pore-vacuum-suction-tool-g1009848.html,Electric Blackhead Remover Multi-Function Portable Pore Vacuum Suction Tool,Appliances
78,$13.99,$21.99,http://www.jollychic.com/p/hair-straightener-household-portable-rapid-heating-hair-straightener-eu-plug-g1010096.html,Hair Straightener Household Portable Rapid Heating Hair Straightener EU Plug,Appliances
10,$47.99,,http://www.jollychic.com/p/camera-wifi-hd-network-wireless-security-ir-night-webcam-us-g1011508.html,Camera Wifi HD Network Wireless Security IR Night Webcam US,Appliances
2,$13.99,$18.99,http://www.jollychic.com/p/smart-band-heart-rate-monitor-bluetooth-4-0-wireless-elastic-chest-strap-smart-band-g1015576.html,Smart Band Heart Rate Monitor Bluetooth 4.0 Wireless Elastic Chest Strap Smart Band,Appliances
34,$12.99,,http://www.jollychic.com/p/led-light-10m-33ft100-led-durable-multi-purpose-christmas-wedding-party-string-fairy-light-dc-12v-g1015840.html,LED Light 10M/33FT100 LED Durable Multi-Purpose Christmas Wedding Party String Fairy Light DC 12V,Appliances
37,$13.99,,http://www.jollychic.com/p/led-light-household-mushroom-shape-creative-colorful-light-for-bedroom-hotel-g1016546.html,LED Light Household Mushroom Shape Creative Colorful Light For Bedroom/Hotel,Appliances
0,$5.99,,http://www.jollychic.com/p/rgb-super-bright-high-power-integrated-smd-led-chips-flood-light-bulb-g1016548.html,RGB Super Bright High Power Integrated SMD LED Chips Flood Light Bulb,Appliances
83,$4.99,$7.99,http://www.jollychic.com/p/night-light-romantic-led-starry-night-sky-projector-lamp-star-light-g1016872.html,Night Light Romantic LED Starry Night Sky Projector Lamp Star Light,Appliances
15,$26.99,,http://www.jollychic.com/p/wall-light-10-led-solar-power-pir-motion-sensor-outdoor-waterproof-garden-lamp-g1019086.html,Wall Light 10 LED Solar Power PIR Motion Sensor Outdoor Waterproof Garden Lamp,Appliances
26,$10.99,$15.99,http://www.jollychic.com/p/pill-fluff-remover-household-clothes-lint-pill-fluff-remover-plug-in-fabrics-sweater-fuzz-shaver-g1019394.html,Pill Fluff Remover Household Clothes Lint Pill Fluff Remover Plug in Fabrics Sweater Fuzz Shaver,Appliances
35,$11.99,,http://www.jollychic.com/p/massage-device-portable-pen-shaped-multi-functional-battery-powered-massage-device-g1027548.html,Massage Device Portable Pen Shaped Multi-Functional Battery Powered Massage Device,Appliances
33,$27.99,,http://www.jollychic.com/p/food-scale-mini-precision-digital-gram-jewelry-scale-with-lcd-display-g1032108.html,Food Scale Mini Precision Digital Gram Jewelry Scale With LCD Display,Appliances
169,$27.99,,http://www.jollychic.com/p/nano-facial-humidifier-with-makeup-mirror-nano-water-spray-chargable-portable-facial-humidifier-g1039026.html,Nano facial humidifier With Makeup Mirror Nano Water Spray Chargable Portable Facial humidifier,Appliances
34,$18.99,,http://www.jollychic.com/p/beauty-apparatus-portable-moisturize-mini-steam-humidifier-g1039972.html,Beauty Apparatus Portable Moisturize Mini Steam Humidifier,Appliances
162,$21.99,$31.99,http://www.jollychic.com/p/4in1-rechargeable-electric-depilator-shaver-epilator-callus-remover-hair-remover-eu-standard-g1040624.html,4in1 Rechargeable Electric Depilator Shaver Epilator Callus Remover Hair Remover EU Standard,Appliances
6,$22.99,,http://www.jollychic.com/p/homeuse-led-solar-powered-lantern-lamp-in-yard-garden-insect-killer-trapping-g1041030.html,Homeuse LED Solar Powered Lantern Lamp in Yard Garden Insect Killer Trapping,Appliances
39,$19.99,,http://www.jollychic.com/p/led-light-solar-glowing-magic-ball-led-light-g1066158.html,LED Light Solar Glowing Magic Ball LED light,Appliances
323,$25.99,,http://www.jollychic.com/p/water-pump-automatic-electric-barreled-purified-water-pump-g1066358.html,Water Pump Automatic Electric Barreled Purified Water Pump,Appliances
159,$109.00,,http://www.jollychic.com/p/electric-grill-double-layers-smokeless-bbq-electric-pan-grill-g1067106.html,Electric Grill Double Layers Smokeless BBQ Electric Pan Grill,Appliances
13,$16.99,,http://www.jollychic.com/p/led-cabinet-light-touch-sensor-21-led-light-bar-wardrobe-light-strip-g1077058.html,LED Cabinet Light Touch Sensor 21 LED Light Bar Wardrobe Light Strip,Appliances
139,$7.99,$11.99,http://www.jollychic.com/p/makeup-mirror-8x-magnifying-portable-mini-glass-makkeup-mirror-with-swivel-action-light-g1078402.html,Makeup Mirror 8X Magnifying Portable Mini Glass Makkeup Mirror With Swivel Action Light,Appliances
11,$35.99,,http://www.jollychic.com/p/surker-women-epilator-4-in-1-multifunctional-electric-foot-pedicure-depilation-hair-plucker-g1093884.html,Surker Women Epilator 4-In-1 Multifunctional Electric Foot Pedicure Depilation Hair Plucker,Appliances
16,$35.99,,http://www.jollychic.com/p/wall-lamp-exquisite-conch-pattern-household-multi-purpose-led-bedroom-wall-light-110v-230v-g1094506.html,Wall Lamp Exquisite Conch Pattern Household Multi-Purpose LED Bedroom Wall Light-110V-230V,Appliances
