add_wish,discount_price,original_price,product_link,product_name,header_block
544,$59.00,$79.00,http://www.jollychic.com/p/monitor-mini-dual-way-talking-night-vision-with-2-4-lcd-baby-monitor-67-2A105-2A67mm-g618776.html,"Monitor Mini Dual-Way Talking Night Vision With 2.4"" LCD Baby Monitor-67*105*67mm",Appliances
90,$19.99,$21.99,http://www.jollychic.com/p/mini-electric-usb-fan-cooler-household-air-condition-portable-fan-without-leaf-g747426.html,Mini Electric USB Fan Cooler Household Air Condition Portable Fan Without Leaf,Appliances
19014,$23.99,$24.99,http://www.jollychic.com/p/facial-cleanser-versatile-beauty-skin-care-deep-vacuum-suction-pore-cleanser-g738094.html,Facial Cleanser Versatile Beauty Skin Care Deep Vacuum Suction Pore Cleanser,Appliances
142,$9.99,$12.99,http://www.jollychic.com/p/id-card-reader-usb-contactless-smart-cardwith-5pcs-id-keyfobs-g403440.html,ID Card Reader USB Contactless Smart Cardwith 5pcs ID Keyfobs,Appliances
112,$4.99,$8.99,http://www.jollychic.com/p/security-alarm-ultra-thin-easy-installation-door-window-security-alarm-g660582.html,Security Alarm Ultra-Thin Easy Installation Door & Window Security Alarm,Appliances
5826,$2.99,$3.99,http://www.jollychic.com/p/anti-snore-strap-comfortable-non-allergic-anti-snoring-chin-strap-g541048.html,Anti Snore Strap Comfortable Non-Allergic Anti Snoring Chin Strap,Appliances
166,$9.99,$14.99,http://www.jollychic.com/p/2-in-1-multifunctional-facial-steamer-deeply-moisturing-household-humidifier-g1078140.html,2-In-1 Multifunctional Facial Steamer Deeply Moisturing Household Humidifier,Appliances
12418,$6.99,$8.99,http://www.jollychic.com/p/sewing-machine-mini-handheld-portable-stitch-electric-fabric-sewing-tools-g679714.html,Sewing Machine Mini Handheld Portable Stitch Electric Fabric Sewing Tools,Appliances
15258,$15.99,$19.99,http://www.jollychic.com/p/facial-cleanserdeep-cleansing-vibrating-portable-facial-cleansing-device-g731196.html,Facial CleanserDeep Cleansing Vibrating Portable Facial Cleansing Device,Appliances
2176,$4.99,$7.99,http://www.jollychic.com/p/light-bulbs-rgb-crystal-ball-colorful-rotating-led-stage-light-bulbs-6w-85-260v-g558402.html,Light Bulbs RGB Crystal Ball Colorful Rotating LED Stage Light Bulbs 6W/85-260V,Appliances
5958,$47.99,$63.00,http://www.jollychic.com/p/ice-cream-maker-household-automatic-frozen-fruit-yogurt-maker-machine-eu-plug-g689966.html,Ice Cream Maker Household Automatic Frozen Fruit&Yogurt Maker Machine-EU Plug,Appliances
10,$394.00,$440.00,http://www.jollychic.com/p/escam-hd-720p-8ch-wifi-nvr-camera-kit-up-to-4tb-hard-drive-uk-eu-us-au-standard-g1241600.html,ESCAM HD 720P 8ch Wifi NVR Camera Kit Up To 4TB Hard Drive UK/EU/US/AU Standard,Appliances
54,$29.99,,http://www.jollychic.com/p/wooden-clock-led-electronic-alarm-calendar-thermometer-sound-control-wooden-clock-g1039458.html,Wooden Clock LED Electronic Alarm Calendar Thermometer Sound Control Wooden Clock,Appliances
429,$16.99,$22.99,http://www.jollychic.com/p/handheld-multifunctional-personal-cooling-humidifier-usb-mini-misting-fan-g578150.html,Handheld Multifunctional Personal Cooling Humidifier USB Mini Misting Fan,Appliances
6546,$7.99,$15.99,http://www.jollychic.com/p/electric-suction-pore-cleaner-grease-face-messager-instrument-g865728.html,Electric Suction Pore Cleaner Grease Face Messager Instrument,Appliances
60,$30.99,,http://www.jollychic.com/p/fan-portable-usb-charging-handheld-no-blade-universal-cooling-fan-g807150.html,Fan Portable USB Charging Handheld No-Blade Universal Cooling Fan,Appliances
15978,$4.99,$6.99,http://www.jollychic.com/p/light-balloon-mixed-color-decorative-seven-color-light-led-balloon-15pcs-bag-g597688.html,Light Balloon Mixed Color Decorative Seven-Color Light LED Balloon-15Pcs/Bag,Appliances
92,$22.99,,http://www.jollychic.com/p/handheld-usb-personal-cooling-humidifier-mini-misting-fan-g578148.html,Handheld USB Personal Cooling Humidifier Mini Misting Fan,Appliances
1441,$12.99,$19.99,http://www.jollychic.com/p/household-electronic-mini-portable-food-mixer-egg-beater-eu-plug-g698120.html,Household Electronic Mini Portable Food Mixer Egg Beater EU Plug,Appliances
1118,$1.99,$3.99,http://www.jollychic.com/p/wireless-home-doors-windows-security-entry-alarm-system-magetic-sensor-white-g338472.html,Wireless Home Doors Windows Security Entry Alarm System / Magetic Sensor - White,Appliances
144,$8.99,$11.99,http://www.jollychic.com/p/fan-coffee-cup-sized-household-mini-wired-usb-portable-fan-g606402.html,Fan Coffee Cup Sized Household Mini Wired USB Portable Fan,Appliances
3474,$15.99,$17.99,http://www.jollychic.com/p/electronic-lighter-quartz-watch-usb-rechargeable-windproof-electronic-lighter-g694362.html,Electronic Lighter Quartz Watch USB Rechargeable Windproof Electronic Lighter,Appliances
885,$25.99,$44.99,http://www.jollychic.com/p/multifunctional-mountaineering-rescue-tool-windproof-lighter-g463610.html,Multifunctional Mountaineering Rescue Tool Windproof Lighter,Appliances
10947,$21.99,$22.99,http://www.jollychic.com/p/sewing-machine-household-mini-lightweight-with-lamp-electric-sewing-machine-g684748.html,Sewing Machine Household Mini Lightweight With Lamp Electric Sewing Machine,Appliances
75,$14.99,,http://www.jollychic.com/p/electric-fan-usb-charging-low-noise-8-inch-portable-electric-fan-g705570.html,Electric Fan USB Charging Low Noise 8 Inch Portable Electric Fan,Appliances
2632,$52.00,$67.00,http://www.jollychic.com/p/coffee-maker-household-large-capacity-automatic-drip-type-coffee-maker-infusing-tea-machine-g773664.html,Coffee Maker Household Large Capacity Automatic Drip Type Coffee Maker Infusing Tea Machine,Appliances
185,$2.99,$3.99,http://www.jollychic.com/p/smoke-alarm-detector-dustproof-anti-interference-photoelectric-sensor-fire-smoke-alarm-detector-g651986.html,Smoke Alarm Detector Dustproof Anti-Interference Photoelectric Sensor Fire Smoke Alarm Detector,Appliances
183,$49.99,$56.00,http://www.jollychic.com/p/monitor-multi-functional-panoramic-360-degree-wifi-camera-monitor-g807776.html,Monitor Multi-Functional Panoramic 360 Degree WIFI Camera Monitor,Appliances
2748,$4.99,$6.99,http://www.jollychic.com/p/portable-usb-charging-rechargeable-windproof-metal-flameless-cigarette-lighter-g587390.html,Portable USB Charging Rechargeable Windproof Metal Flameless Cigarette Lighter,Appliances
57,$7.99,,http://www.jollychic.com/p/fan-mini-portable-usb-plug-and-play-low-noise-fill-light-portable-fan-g1027582.html,Fan Mini Portable USB Plug And Play Low Noise Fill Light Portable Fan,Appliances
21,$42.99,,http://www.jollychic.com/p/led-mosquito-killer-lamp-usb-powered-non-toxic-universal-intelligent-health-led-light-bulb-g1118772.html,Led Mosquito Killer Lamp USB Powered Non-Toxic Universal Intelligent Health LED Light Bulb,Appliances
177,$14.99,,http://www.jollychic.com/p/fan-portable-durable-mini-design-household-usb-charging-handheld-fan-g1038816.html,Fan Portable Durable Mini Design Household USB Charging Handheld Fan,Appliances
568,$4.99,$5.99,http://www.jollychic.com/p/mini-portable-handheld-usb-rechargeable-cooling-fan-g653330.html,Mini Portable Handheld USB Rechargeable Cooling Fan,Appliances
240,$1.99,$6.99,http://www.jollychic.com/p/home-safety-wireless-longer-system-security-device-door-window-burglar-alarm-g805930.html,Home Safety Wireless Longer System Security Device Door Window Burglar Alarm,Appliances
28560,$6.99,$9.99,http://www.jollychic.com/p/lamp-waterproof-energy-saving-outdoor-decorative-holiday-led-string-light-3-meters-g604152.html,Lamp Waterproof Energy Saving Outdoor Decorative Holiday LED String Light-3 Meters,Appliances
7332,$4.99,$11.99,http://www.jollychic.com/p/portable-hair-drier-mini-cute-fresh-color-eu-plug-g388278.html,Portable Hair Drier Mini Cute Fresh Color EU Plug,Appliances
4936,$2.99,$3.99,http://www.jollychic.com/p/sealing-machine-mini-household-battery-powered-plastic-bag-sealing-machine-g764166.html,Sealing Machine Mini Household Battery Powered Plastic Bag Sealing Machine,Appliances
146,$6.99,,http://www.jollychic.com/p/lamp-portable-lightweight-high-brightness-solar-power-led-camp-light-h14-5-2A8cm-g594264.html,Lamp Portable Lightweight High Brightness Solar Power LED Camp Light-H14.5*8cm,Appliances
6603,$5.99,$10.99,http://www.jollychic.com/p/mini-hair-straightener-fashion-solid-dual-purpose-eu-plug-g388226.html,Mini Hair Straightener Fashion Solid Dual Purpose EU Plug,Appliances
63,$14.99,,http://www.jollychic.com/p/hair-drier-mini-hot-sales-handle-foldable-electric-thermostatic-hair-dryer-china-standard-plug-g1093830.html,Hair Drier Mini Hot Sales Handle Foldable Electric Thermostatic Hair Dryer-China Standard Plug,Appliances
214,$27.99,$31.99,http://www.jollychic.com/p/smart-infrared-thermometer-g415022.html,Smart Infrared Thermometer,Appliances
97,$5.99,$8.99,http://www.jollychic.com/p/portable-mini-usb-cool-fan-led-color-changing-flexible-gooseneck-fan-g664424.html,Portable Mini USB Cool Fan LED Color Changing Flexible Gooseneck Fan,Appliances
20374,$13.99,$26.99,http://www.jollychic.com/p/electric-3-barrel-ceramic-styler-hair-waver-curler-roller-g368864.html,Electric 3 Barrel Ceramic Styler Hair Waver Curler Roller,Appliances
12988,$4.99,$8.99,http://www.jollychic.com/p/practical-mini-hair-straightening-hairpin-for-bang-eu-plug-g368372.html,Practical Mini Hair Straightening Hairpin For Bang EU Plug,Appliances
52,$85.00,$89.00,http://www.jollychic.com/p/intelligent-visual-doorbell-cat-s-eye-smart-home-wireless-hd-wide-angle-night-vision-doorbell-g742986.html,Intelligent Visual Doorbell Cat's Eye Smart Home Wireless HD Wide-angle Night Vision Doorbell,Appliances
5924,$9.99,$15.99,http://www.jollychic.com/p/7-colour-bulb-humidifier-g387768.html,7 Colour Bulb Humidifier,Appliances
2169,$9.99,$15.99,http://www.jollychic.com/p/portable-household-handheld-garment-steamer-electronic-iron-eu-plug-g592212.html,Portable Household Handheld Garment Steamer Electronic Iron EU Plug,Appliances
2598,$19.99,$25.99,http://www.jollychic.com/p/massage-belt-loss-weight-fat-burning-slimming-massage-belt-g518902.html,Massage Belt Loss Weight Fat Burning Slimming Massage Belt,Appliances
8881,$4.99,$5.99,http://www.jollychic.com/p/led-projection-table-clock-colorful-star-sky-night-luminova-arlam-clock-g539806.html,LED Projection Table Clock Colorful Star Sky Night Luminova Arlam Clock,Appliances
500,$9.99,$14.99,http://www.jollychic.com/p/fan-usb-rechargeable-cute-creative-household-rabbit-radio-model-fan-with-led-light-g689964.html,Fan USB Rechargeable Cute Creative Household Rabbit/Radio Model Fan With LED Light,Appliances
741,$17.99,$19.99,http://www.jollychic.com/p/colorful-night-light-usb-plasma-ball-sphere-light-magic-crystal-lamp-g533172.html,Colorful Night Light USB Plasma Ball Sphere Light Magic Crystal Lamp,Appliances
409,$16.99,$26.99,http://www.jollychic.com/p/id-thick-card-pvc-access-control-door-entry-card-50pcs-125khz-g403504.html,ID Thick Card PVC Access Control Door Entry Card 50pcs 125KHz,Appliances
695,$11.99,$18.99,http://www.jollychic.com/p/facial-cleanser-electric-household-portable-facial-cleansing-brush-face-washing-tool-g884874.html,Facial Cleanser Electric Household Portable Facial Cleansing Brush Face Washing Tool,Appliances
25,$1.99,$6.99,http://www.jollychic.com/p/pest-repeller-led-socket-photocatalyst-mosquito-insect-trap-night-lamp-killer-g805540.html,Pest Repeller LED Socket Photocatalyst Mosquito Insect Trap Night Lamp Killer,Appliances
5850,$18.99,$22.99,http://www.jollychic.com/p/led-butterfly-combination-romantic-love-light-decorating-light-eu-plug-g599848.html,LED Butterfly Combination Romantic Love Light Decorating Light EU Plug,Appliances
1310,$1.99,,http://www.jollychic.com/p/led-light-unique-bendable-design-portable-usb-charging-night-light-g809866.html,LED Light Unique Bendable Design Portable USB Charging Night Light,Appliances
191,$38.99,$52.00,http://www.jollychic.com/p/veskys-monitor-360-degree-hd-full-view-ip-network-security-wi-fi-camera-g732774.html,VESKYS Monitor 360 Degree HD Full View IP Network Security Wi-Fi Camera,Appliances
221,$19.99,$23.99,http://www.jollychic.com/p/led-luminous-message-board-alarm-clock-with-calendar-voice-control-colorful-gradients-function-g580372.html,LED Luminous Message Board Alarm Clock With Calendar Voice Control Colorful Gradients Function,Appliances
7367,$6.99,$7.99,http://www.jollychic.com/p/facial-cleansing-device-portable-mini-five-in-one-facial-cleansing-device-5-1-2A3-3--g594514.html,"Facial Cleansing Device Portable Mini Five In One Facial Cleansing Device-5.1*3.3""",Appliances
6243,$16.99,$18.99,http://www.jollychic.com/p/hair-curling-iron-waver-roller-ceramic-triple-barrels-hair-curler-110-240v-45w-g582766.html,Hair Curling Iron Waver Roller Ceramic Triple Barrels Hair Curler 110-240V/45W,Appliances
2604,$26.99,$39.99,http://www.jollychic.com/p/coffee-maker-household-mini-drip-type-coffee-maker-g564996.html,Coffee Maker Household Mini Drip Type Coffee Maker,Appliances
12,$22.99,$25.99,http://www.jollychic.com/p/flyco-hair-dryer-hydrated-anion-portable-household-electric-hair-dryer-chinese-standard-plug-220v-g680878.html,Flyco Hair Dryer Hydrated Anion Portable Household Electric Hair Dryer(Chinese Standard Plug)-220V,Appliances
14309,$10.99,$13.99,http://www.jollychic.com/p/hair-curler-professional-safe-convenient-ceramic-coating-ergonomic-design-220v-35w-hair-curler-30-2A4cm-g588052.html,Hair Curler Professional Safe Convenient Ceramic Coating Ergonomic Design 220V/35W Hair Curler-30*4cm,Appliances
4288,$19.99,$26.99,http://www.jollychic.com/p/beauty-hydrating-instrument-face-hydration-sprayer-small-o-usb-g405452.html,Beauty Hydrating Instrument Face Hydration Sprayer Small O USB,Appliances
4608,$31.99,$33.99,http://www.jollychic.com/p/electric-blackhead-suction-ance-remover-beauty-instrument-g675720.html,Electric Blackhead Suction Ance Remover Beauty Instrument,Appliances
4552,$16.99,$19.99,http://www.jollychic.com/p/household-portable-electronic-fruit-juicer-meat-blender-eu-plug-g592208.html,Household Portable Electronic Fruit Juicer Meat Blender EU Plug,Appliances
588,$26.99,,http://www.jollychic.com/p/beauty-apparatus-freckle-remove-facial-beauty-device-g1040686.html,Beauty Apparatus Freckle Remove Facial Beauty Device,Appliances
5024,$32.99,,http://www.jollychic.com/p/lamp-charging-type-brightness-adjustable-luna-shape-led-light-g603832.html,Lamp Charging Type Brightness Adjustable Luna Shape LED Light,Appliances
524,$9.99,$16.99,http://www.jollychic.com/p/vacuum-cleaner-portable-multi-functional-universal-household-sweeper-g754602.html,Vacuum Cleaner Portable Multi-Functional Universal Household Sweeper,Appliances
2820,$13.99,$21.99,http://www.jollychic.com/p/beetle-mini-usb-humidifier-purifier-with-led-light-360-degree-rotation-g385442.html,Beetle Mini USB Humidifier Purifier with LED Light 360 Degree Rotation,Appliances
1331,$9.99,$14.99,http://www.jollychic.com/p/mini-portable-usb-rechargeable-water-drop-design-cooling-fan-g585334.html,Mini Portable USB Rechargeable Water Drop Design Cooling Fan,Appliances
2515,$18.99,$48.99,http://www.jollychic.com/p/artizan-multifunctional-electric-food-mixer-desktop-egg-beater-blender-for-baking-whisk-cream-drink-milk-g533330.html,ARTIZAN Multifunctional Electric Food Mixer Desktop Egg Beater Blender For Baking Whisk Cream Drink Milk,Appliances
2153,$8.99,$14.99,http://www.jollychic.com/p/portable-universal-easy-hair-braider-hair-braiding-machine-hair-style-tools-g698432.html,Portable Universal Easy Hair Braider Hair Braiding Machine Hair Style Tools,Appliances
4145,$24.99,$38.99,http://www.jollychic.com/p/household-mini-multi-functional-coffee-maker-220v-550w-eu-plug-g592210.html,Household Mini Multi-Functional Coffee Maker 220V 550W EU Plug,Appliances
465,$17.99,$39.99,http://www.jollychic.com/p/sewing-machine-household-electric-multifunctional-portable-tailor-machine-g874854.html,Sewing Machine Household Electric Multifunctional Portable Tailor Machine,Appliances
2746,$13.99,$16.99,http://www.jollychic.com/p/household-portable-versatile-manual-coffee-grinder-coffee-maker-g562048.html,Household Portable Versatile Manual Coffee Grinder Coffee Maker,Appliances
844,$11.99,$16.99,http://www.jollychic.com/p/electronic-lighter-fashion-usb-rechargeable-windproof-environmental-friendly-electronic-lighter-g704500.html,Electronic Lighter Fashion USB Rechargeable Windproof Environmental-Friendly Electronic Lighter,Appliances
211,$4.99,$8.99,http://www.jollychic.com/p/book-reading-lamp-portable-led-light-wedge-panel-paperback-night-light-g792558.html,Book Reading Lamp Portable LED Light Wedge Panel Paperback Night Light,Appliances
11315,$10.99,$13.99,http://www.jollychic.com/p/electric-waterproof-bath-brushes-back-skin-massage-health-care-rubbing-brush-g619334.html,Electric Waterproof Bath Brushes Back Skin Massage Health Care Rubbing Brush,Appliances
2227,$31.99,$40.99,http://www.jollychic.com/p/facial-cleansing-device-household-vacuum-nagetive-pressure-pore-cleaning-gentle-facial-cleansing-device-g680942.html,Facial Cleansing Device Household Vacuum Nagetive Pressure Pore Cleaning Gentle Facial Cleansing Device,Appliances
88,$24.99,,http://www.jollychic.com/p/led-light-bulb-9w-e27rgb-magic-light-bulb-lamp-with-wireless-remote-control-g1139124.html,LED Light Bulb 9W E27RGB Magic Light Bulb Lamp With Wireless Remote control,Appliances
13,$7.99,$9.99,http://www.jollychic.com/p/1000g-x-0-1g-digital-jewelry-scale-gem-pocket-design-mini-digital-weight-scale-g971414.html,1000G x 0.1G Digital Jewelry Scale Gem Pocket Design Mini Digital Weight Scale,Appliances
11611,$21.99,$24.99,http://www.jollychic.com/p/10-meters-rainbow-tube-string-light-copper-string-led-lights-eu-plug-g599850.html,10 Meters Rainbow Tube String Light Copper String LED Lights EU Plug,Appliances
6525,$12.99,$20.99,http://www.jollychic.com/p/hair-braided-tool-automatic-electric-braided-hair-styling-machine-g511130.html,Hair Braided Tool Automatic Electric Braided Hair Styling Machine,Appliances
477,$21.99,$33.99,http://www.jollychic.com/p/beauty-instrument-micro-crystal-blackhead-cleanser-facial-cleansing-devices-g880812.html,Beauty Instrument Micro-crystal Blackhead Cleanser Facial Cleansing Devices,Appliances
4513,$30.99,$68.00,http://www.jollychic.com/p/meat-grinder-household-multifunctional-meat-grinder-garlic-machine-220-240v-g476484.html,Meat Grinder Household Multifunctional Meat Grinder Garlic Machine 220-240V,Appliances
10353,$12.99,$28.99,http://www.jollychic.com/p/beauty-instrument-household-three-in-one-electric-facial-cleansing-instrument-g459080.html,Beauty Instrument Household Three In One Electric Facial Cleansing Instrument,Appliances
498,$5.99,$10.99,http://www.jollychic.com/p/teeth-whitening-apparatus-portable-functional-household-teeth-whitening-device-g1077732.html,Teeth Whitening Apparatus Portable Functional Household Teeth Whitening Device,Appliances
117,$1.99,$7.99,http://www.jollychic.com/p/portable-led-bulb-usb-light-reading-lamp-charging-light-blub-g856832.html,Portable LED Bulb USB Light Reading Lamp Charging Light Blub,Appliances
107,$5.99,$9.99,http://www.jollychic.com/p/masseur-portable-practical-usb-powered-electric-body-back-neck-massager-g1094318.html,Masseur Portable Practical USB Powered Electric Body Back Neck Massager,Appliances
806,$22.99,$30.99,http://www.jollychic.com/p/white-usb-charging-electric-eyelash-curler-g339704.html,White USB Charging Electric Eyelash Curler,Appliances
115,$43.99,$67.00,http://www.jollychic.com/p/rechargeable-bte-earhook-4-mode-volume-control-hearing-aid-eu-plug-g373072.html,Rechargeable BTE Earhook 4-Mode Volume Control Hearing Aid EU Plug,Appliances
40,$13.99,$17.99,http://www.jollychic.com/p/writable-id-keyfobs-rewrite-rfid-keytags-for-access-card-copier-g403450.html,Writable ID Keyfobs Rewrite RFID Keytags for Access Card Copier,Appliances
1237,$7.99,$11.99,http://www.jollychic.com/p/electric-body-sculpting-skipping-rope-dual-use-household-multi-functional-skipping-rope-g452848.html,Electric Body Sculpting Skipping Rope Dual-Use Household Multi-Functional Skipping Rope,Appliances
189,$15.99,$26.99,http://www.jollychic.com/p/thin-metal-windproof-cigarette-lighter-g463600.html,Thin Metal Windproof Cigarette Lighter,Appliances
241,$26.99,,http://www.jollychic.com/p/weather-station-projection-clock-3-7-inch-lcd-screen-led-projector-alarm-clock-g493924.html,Weather Station Projection Clock 3.7 Inch LCD Screen LED Projector Alarm Clock,Appliances
23,$23.99,$26.99,http://www.jollychic.com/p/smart-power-socket-remote-wifi-plug-timer-switch-g500288.html,Smart Power Socket Remote Wifi Plug Timer Switch,Appliances
49,$15.99,$17.99,http://www.jollychic.com/p/universal-mini-portable-convenient-lcd-screen-spring-scale-g500582.html,Universal Mini Portable Convenient LCD Screen Spring Scale,Appliances
40,$5.99,$10.99,http://www.jollychic.com/p/universal-black-portable-convenient-hook-electronic-hand-scale-g500592.html,Universal Black Portable Convenient Hook Electronic Hand Scale,Appliances
742,$31.99,$48.99,http://www.jollychic.com/p/beauty-instrument-portable-household-cleansing-radio-waves-acne-remover-g505822.html,Beauty Instrument Portable Household Cleansing Radio Waves Acne Remover,Appliances
200,$66.00,,http://www.jollychic.com/p/electric-clock-alarm-clock-cobblestone-shape-digital-wireless-weather-station-colorful-led-thermometer-alarm-clock-g511046.html,Electric Clock Alarm Clock Cobblestone Shape Digital Wireless Weather Station Colorful LED Thermometer Alarm Clock,Appliances
3398,$7.99,$9.99,http://www.jollychic.com/p/socket-travel-use-two-in-one-dual-usb-charging-socket-g513922.html,Socket Travel Use Two In One Dual USB Charging Socket,Appliances
126,$5.99,$9.99,http://www.jollychic.com/p/lamp-portable-adjustable-led-high-light-flashlight-g534582.html,Lamp Portable Adjustable LED High Light Flashlight,Appliances
1190,$30.99,$49.99,http://www.jollychic.com/p/coffee-maker-household-mini-multi-functional-coffee-maker-g551710.html,Coffee Maker Household Mini Multi-Functional Coffee Maker,Appliances
184,$7.99,$11.99,http://www.jollychic.com/p/led-coconut-tree-light-battery-baby-nightlight-marquee-lamp-for-home-decorations-g556948.html,LED Coconut Tree Light Battery Baby Nightlight Marquee Lamp For Home Decorations,Appliances
1909,$5.99,$6.99,http://www.jollychic.com/p/electric-perm-eyelash-curler-pen-shape-mascara-lash-curling-long-lasting-heated-g562056.html,Electric Perm Eyelash Curler Pen Shape Mascara Lash Curling Long Lasting Heated,Appliances
1257,$13.99,$16.99,http://www.jollychic.com/p/3pcs-led-solar-energy-lawn-lamp-mosaic-style-outdoor-sensor-light-g562384.html,3PCS LED Solar Energy Lawn Lamp Mosaic Style Outdoor Sensor Light,Appliances
75,$21.99,$28.99,http://www.jollychic.com/p/electric-shaver-mini-portable-dual-use-epilator-g564824.html,Electric Shaver Mini Portable Dual Use Epilator,Appliances
150,$8.99,$13.99,http://www.jollychic.com/p/household-mini-portable-usb-multifunctional-electronic-fan-g568998.html,Household Mini Portable USB Multifunctional Electronic Fan,Appliances
33,$19.99,,http://www.jollychic.com/p/lamp-seven-colors-changing-touch-control-led-night-light-g575440.html,Lamp Seven Colors Changing Touch Control LED Night Light,Appliances
992,$25.99,$35.99,http://www.jollychic.com/p/household-multifunctional-automatic-bread-maker-bread-machine-g575786.html,Household Multifunctional Automatic Bread Maker Bread Machine,Appliances
564,$19.99,$26.99,http://www.jollychic.com/p/artizan-electric-shoe-dryer-portable-shoes-gloves-socks-drying-sterilization-machine-220v150w-g578032.html,ARTIZAN Electric Shoe Dryer Portable Shoes/Gloves/Socks Drying Sterilization Machine 220V150W,Appliances
197,$19.99,,http://www.jollychic.com/p/portable-dc-12v-food-milk-water-bottle-cup-warmer-heater-g580494.html,Portable DC 12V Food Milk Water Bottle Cup Warmer Heater,Appliances
30,$16.99,,http://www.jollychic.com/p/lamp-lightweight-durable-aluminium-alloy-high-brightness-solar-led-camp-light-h17-5-2A5cm-g594268.html,Lamp Lightweight Durable Aluminium Alloy High Brightness Solar LED Camp Light-H17.5*5cm,Appliances
551,$9.99,$11.99,http://www.jollychic.com/p/yogurt-machine-household-full-automatic-stainless-steel-liner-yogurt-machine-17-5-2A17-5-2A12cm-g597518.html,Yogurt Machine Household Full-Automatic Stainless Steel Liner Yogurt Machine-17.5*17.5*12cm,Appliances
79,$43.99,,http://www.jollychic.com/p/monitor-wireless-bluetooth-mini-intelligent-sleep-analysis-monitor-device-33-3-2A33-3-2A13-2mm-g607242.html,Monitor Wireless Bluetooth Mini Intelligent Sleep Analysis & Monitor Device-33.3*33.3*13.2mm,Appliances
143,$18.99,$31.99,http://www.jollychic.com/p/bear-electric-lunch-box-high-power-triple-sealed-circulation-heat-electric-lunch-box-china-standard-plug-h156-2A179mm-g607570.html,Bear Electric Lunch Box High Power Triple Sealed Circulation Heat Electric Lunch Box (China Standard Plug)-H156*179mm,Appliances
77,$49.99,,http://www.jollychic.com/p/smart-bluetooth-lamp-portable-household-music-playing-night-light-with-speaker-and-multiple-light-colors-g609490.html,Smart Bluetooth Lamp Portable Household Music Playing Night Light With Speaker And Multiple Light Colors,Appliances
27,$2.99,,http://www.jollychic.com/p/thermometer-with-lcd-screen-precise-moisture-resistant-anti-interference-digital-thermometer-g652902.html,Thermometer With LCD Screen Precise Moisture-Resistant Anti-Interference Digital Thermometer,Appliances
29,$3.99,$4.99,http://www.jollychic.com/p/fish-alarm-mini-portable-energy-saving-sound-light-double-alarm-fish-bite-alarm-g656958.html,Fish Alarm Mini Portable Energy Saving Sound Light Double Alarm Fish Bite Alarm,Appliances
17,$24.99,$32.99,http://www.jollychic.com/p/flyco-electric-shaver-ipx7-washable-three-blade-heads-floating-electric-shaver-chinese-standard-plug-100v-7E240v-g677738.html,Flyco Electric Shaver IPX7 Washable Three Blade Heads Floating Electric Shaver (Chinese Standard Plug)-100V~240V,Appliances
