add_wish,discount_price,original_price,product_link,product_name,header_block
1766,$5.99,,http://www.jollychic.com/p/phone-holder-portable-wide-compatibility-durable-phone-holder-g876874.html,Phone Holder Portable Wide Compatibility Durable Phone Holder,Phone Holder
7479,$3.99,,http://www.jollychic.com/p/phone-holder-portable-flexible-360-degree-rotation-phone-camera-tripod-holder-h19cm-g606746.html,Phone Holder Portable Flexible 360 Degree Rotation Phone & Camera Tripod Holder-H19cm,Phone Holder
1436,$5.99,$9.99,http://www.jollychic.com/p/phone-holder-unique-design-portable-multi-functional-durable-phone-holder-g1208136.html,Phone Holder Unique Design Portable Multi-Functional Durable Phone Holder,Phone Holder
31,$1.99,$7.99,http://www.jollychic.com/p/phone-holder-360-degree-rotation-multi-function-navigation-universal-suction-cup-type-support-g1156268.html,Phone Holder 360 Degree Rotation Multi-Function Navigation Universal Suction Cup Type Support,Phone Holder
33,$9.99,,http://www.jollychic.com/p/phone-holder-unique-double-layer-design-portable-multi-functional-phone-holder-g1274344.html,Phone Holder Unique Double Layer Design Portable Multi-Functional Phone Holder,Phone Holder
43,$2.99,$7.99,http://www.jollychic.com/p/phone-holder-mobile-watch-2-in-1-bracket-universal-phone-holder-g1095022.html,Phone Holder Mobile Watch 2 In 1 Bracket Universal Phone Holder,Phone Holder
19949,$2.99,,http://www.jollychic.com/p/portable-plus-size-solid-finger-shaped-phone-stand-g322032.html,Portable Plus Size Solid Finger Shaped Phone Stand,Phone Holder
721,$5.99,,http://www.jollychic.com/p/phone-holder-durable-portable-universal-aluminium-alloy-phone-holder-g800650.html,Phone Holder Durable Portable Universal Aluminium Alloy Phone Holder,Phone Holder
8911,$4.99,,http://www.jollychic.com/p/artizan-mobile-phone-holder-versatile-flat-bracket-for-smartphones-ipad-g694364.html,ARTIZAN Mobile Phone Holder Versatile Flat Bracket For Smartphones/iPad,Phone Holder
55,$3.99,$8.99,http://www.jollychic.com/p/phone-holder-metal-plated-phillips-scissors-mirror-bow-ring-rotary-phone-bracket-g1164628.html,Phone Holder Metal Plated Phillips Scissors Mirror Bow Ring Rotary Phone Bracket,Phone Holder
7566,$3.99,,http://www.jollychic.com/p/phone-accessory-four-leaves-shaped-stand-ring-phone-holder-g609552.html,Phone Accessory Four Leaves Shaped Stand Ring Phone Holder,Phone Holder
377,$1.99,$6.99,http://www.jollychic.com/p/phone-holder-lightweight-flexible-clip-design-holder-for-smartphone-up-to-6-5-inch-g1067622.html,Phone Holder Lightweight Flexible Clip Design Holder For Smartphone Up To 6.5 Inch,Phone Holder
4632,$7.99,,http://www.jollychic.com/p/cute-cat-pattern-phone-stand-ring-g283168.html,Cute Cat Pattern Phone Stand Ring,Phone Holder
16688,$5.99,,http://www.jollychic.com/p/cute-cat-360-degree-rotating-ring-kickstand-for-phone-g291964.html,Cute Cat 360 Degree Rotating Ring Kickstand For Phone,Phone Holder
136,$4.99,$5.99,http://www.jollychic.com/p/baseus-thin-portable-stand-ring-phone-holder-g503660.html,Baseus Thin Portable Stand Ring Phone Holder,Phone Holder
568,$3.99,,http://www.jollychic.com/p/phone-holder-portable-versatile-ring-type-phone-holder-g562500.html,Phone Holder Portable Versatile Ring Type Phone Holder,Phone Holder
25,$11.99,,http://www.jollychic.com/p/multifunctional-detachable-portable-classic-headphone-holder-g592914.html,Multifunctional Detachable Portable Classic Headphone Holder,Phone Holder
474,$3.99,,http://www.jollychic.com/p/phone-holder-cute-dragonfly-pattern-360-degree-finger-ring-stand-for-smartphones-g604136.html,Phone Holder Cute Dragonfly Pattern 360 Degree Finger Ring Stand For Smartphones,Phone Holder
179,$12.99,$19.99,http://www.jollychic.com/p/charger-holder-2-in-1-usb-data-transmission-charging-dock-station-for-iphone-iwatch-g758430.html,Charger Holder 2 In 1 USB Data Transmission & Charging Dock Station For iPhone/iWatch,Phone Holder
9,$8.99,,http://www.jollychic.com/p/kkmoon-phone-holder-universal-durable-foldable-phone-holder-g1044610.html,KKMOON Phone Holder Universal Durable Foldable Phone Holder,Phone Holder
9,$6.99,,http://www.jollychic.com/p/2-pcs-nano-flourish-lama-rubber-pad-fast-swift-snap-technology-car-bracket-pods-for-cellphone-g1083000.html,2 Pcs Nano FLOURISH LAMA Rubber Pad Fast Swift-Snap Technology Car Bracket Pods For Cellphone,Phone Holder
62,$5.99,,http://www.jollychic.com/p/phone-holder-portable-metal-strong-absorption-universal-stand-ring-holder-g1094120.html,Phone Holder Portable Metal Strong Absorption Universal Stand Ring Holder,Phone Holder
197,$6.99,$10.99,http://www.jollychic.com/p/flourish-lama-phone-holder-multi-functional-portable-strong-absorption-phone-sticker-holder-g1096166.html,FLOURISH LAMA Phone Holder Multi-Functional Portable Strong Absorption Phone Sticker Holder,Phone Holder
60,$9.99,$15.99,http://www.jollychic.com/p/aluminum-alloy-phone-tablet-stand-holder-angle-adjustable-g1119450.html,Aluminum Alloy Phone Tablet Stand Holder Angle Adjustable,Phone Holder
8,$7.99,,http://www.jollychic.com/p/phone-holder-360-rotation-ring-buckle-universal-durable-aluminum-alloy-phone-holder-g1162830.html,Phone Holder 360 Rotation Ring Buckle Universal Durable Aluminum Alloy Phone Holder,Phone Holder
11,$8.99,,http://www.jollychic.com/p/phone-holder-creative-sticky-plastic-finger-ring-buckle-universal-lazy-stent-g1179760.html,Phone Holder Creative Sticky Plastic Finger Ring Buckle Universal Lazy Stent,Phone Holder
3601,$5.99,$8.99,http://www.jollychic.com/p/practical-octopus-pattern-mini-triangle-bracket-for-digital-devices-g322016.html,Practical Octopus Pattern Mini Triangle Bracket for Digital Devices,Phone Holder
859,$1.99,,http://www.jollychic.com/p/universal-s-shaped-solid-phone-support-g323610.html,Universal S Shaped Solid Phone Support,Phone Holder
76,$9.99,$15.99,http://www.jollychic.com/p/5-04-l-x-2-56-w-x-2-64-h-inch-apple-watch-iphone-stand-acrylic-charging-stand-station-desk-cradle-holder-g622460.html,"5.04(L) x 2.56(W) x 2.64(H) Inch Apple Watch & iPhone Stand, Acrylic Charging Stand Station Desk Cradle Holder",Phone Holder
39,$3.99,,http://www.jollychic.com/p/phone-ring-stand-holder-cross-metal-abs-finger-expanding-ring-grip-stand-g638270.html,Phone Ring Stand Holder Cross Metal ABS Finger Expanding Ring Grip Stand,Phone Holder
470,$4.99,$6.99,http://www.jollychic.com/p/phone-holder-portable-clover-design-universal-stand-ring-holder-g758112.html,Phone Holder Portable Clover Design Universal Stand Ring Holder,Phone Holder
1135,$4.99,$8.99,http://www.jollychic.com/p/universal-mini-flexible-stand-tripod-mount-free-holder-for-smart-phone-iphone-cf478-cf477--g930758.html,Universal Mini Flexible Stand Tripod Mount + Free Holder For Smart Phone iPhone (CF478/CF477 ),Phone Holder
7,$10.99,,http://www.jollychic.com/p/phone-holder-universal-durable-wooden-portable-phone-holder-g1043908.html,Phone Holder Universal Durable Wooden Portable Phone Holder,Phone Holder
18,$11.99,,http://www.jollychic.com/p/phone-holder-wood-pine-elk-type-universal-portable-phone-holder-g1094558.html,Phone Holder Wood Pine Elk Type Universal Portable Phone Holder,Phone Holder
26,$9.99,,http://www.jollychic.com/p/quality-magnetic-magnet-in-car-mobile-phone-holder-air-vent-mount-stand-kit-g1287380.html,Quality Magnetic Magnet In Car Mobile Phone Holder Air Vent Mount Stand Kit,Phone Holder
31,$10.99,,http://www.jollychic.com/p/3-pcs-phone-holder-universal-stick-type-portable-mini-phone-holder-g1298558.html,3 Pcs Phone Holder Universal Stick Type Portable Mini Phone Holder,Phone Holder
2746,$2.99,$6.99,http://www.jollychic.com/p/simple-durable-universal-holder-for-smartphones-tablet-ipad-g373392.html,Simple Durable Universal Holder for Smartphones/Tablet/Ipad,Phone Holder
2124,$2.99,$4.99,http://www.jollychic.com/p/phone-holder-angel-s-wing-ring-type-phone-holder-g533542.html,Phone Holder Angel's Wing Ring Type Phone Holder,Phone Holder
158,$6.99,$10.99,http://www.jollychic.com/p/phone-charger-5-port-usb-charger-multifunctional-phone-holder-5v-6a-us-plug-g548976.html,Phone Charger 5-Port USB Charger Multifunctional Phone Holder 5V/6A-US Plug,Phone Holder
562,$4.99,$6.99,http://www.jollychic.com/p/universal-portable-convenient-bedside-phone-holder-g554332.html,Universal Portable Convenient Bedside Phone Holder,Phone Holder
562,$3.99,,http://www.jollychic.com/p/phone-holder-versatile-peacock-shape-ring-type-phone-holder-g590368.html,Phone Holder Versatile Peacock Shape Ring Type Phone Holder,Phone Holder
749,$4.99,$6.99,http://www.jollychic.com/p/phone-holder-simple-style-versatile-aluminium-alloy-desk-phone-holder-7-3-2A6-5-2A7-6cm-g599454.html,Phone Holder Simple Style Versatile Aluminium Alloy Desk Phone Holder-7.3*6.5*7.6cm,Phone Holder
983,$5.99,,http://www.jollychic.com/p/mobile-phone-screen-amplifier-2-in-1-3d-video-high-definition-portable-phone-holder-phone-magnifier-g693510.html,Mobile Phone Screen Amplifier 2 In 1 3D Video High-Definition Portable Phone Holder Phone Magnifier,Phone Holder
9,$6.99,,http://www.jollychic.com/p/wide-handle-lcd-display-screen-opening-tile-suction-cup-tool-for-cellphone-g875920.html,Wide Handle LCD Display Screen Opening Tile Suction Cup Tool For Cellphone,Phone Holder
38,$5.99,$8.99,http://www.jollychic.com/p/phone-holder-flexible-universal-lazy-phone-stand-holder-g933662.html,Phone Holder Flexible Universal Lazy Phone Stand/Holder,Phone Holder
638,$4.99,,http://www.jollychic.com/p/phone-holder-expanding-stand-for-cell-phone-holder-360-degree-rotatable-sticky-holder-g986030.html,Phone Holder Expanding Stand For Cell Phone Holder 360 Degree Rotatable Sticky Holder,Phone Holder
130,$9.99,,http://www.jollychic.com/p/phone-holder-durable-aluminium-alloy-portable-universal-phone-holder-g1015842.html,Phone Holder Durable Aluminium Alloy Portable Universal Phone Holder,Phone Holder
9,$8.99,,http://www.jollychic.com/p/phone-holder-angle-adjustable-phone-holder-g1086750.html,Phone Holder Angle Adjustable Phone Holder,Phone Holder
13,$11.99,,http://www.jollychic.com/p/raxfly-phone-holder-universal-non-slip-design-aluminium-alloy-holder-g1094756.html,RAXFLY Phone Holder Universal Non-Slip Design Aluminium Alloy Holder,Phone Holder
17,$7.99,$11.99,http://www.jollychic.com/p/floveme-phone-holder-universal-wooden-design-durable-phone-holder-g1097312.html,FLOVEME Phone Holder Universal Wooden Design Durable Phone Holder,Phone Holder
98,$8.99,,http://www.jollychic.com/p/phone-holder-flexible-universal-clip-on-mobile-phone-holder-stand-tablet-holder-g1173648.html,Phone Holder Flexible Universal Clip-On Mobile Phone Holder Stand & Tablet Holder,Phone Holder
7,$7.99,$12.99,http://www.jollychic.com/p/phone-holder-creative-portable-ring-lanyard-short-section-anti-drop-chain-durable-metal-stent-g1192868.html,Phone Holder Creative Portable Ring Lanyard Short Section Anti-Drop Chain Durable Metal Stent,Phone Holder
4,$6.99,$9.99,http://www.jollychic.com/p/phone-holder-card-slotted-mobile-phone-finger-clasp-multi-function-lazy-stent-g1259118.html,Phone Holder Card Slotted Mobile Phone Finger Clasp Multi-Function Lazy Stent,Phone Holder
11083,$2.99,,http://www.jollychic.com/p/cute-cartoon-bear-desigend-diy-phone-holder-g323360.html,Cute Cartoon Bear Desigend DIY Phone Holder,Phone Holder
1743,$2.99,$9.99,http://www.jollychic.com/p/phone-holder-versatile-pony-shape-phone-holder-g428294.html,Phone Holder Versatile Pony Shape Phone Holder,Phone Holder
1698,$5.99,$9.99,http://www.jollychic.com/p/phone-holder-flexible-portable-car-bed-desk-bracket-mobile-phone-holder-g462684.html,Phone Holder Flexible Portable Car Bed Desk Bracket Mobile Phone Holder,Phone Holder
60,$6.99,$7.99,http://www.jollychic.com/p/versatile-portable-blue-iphone-phone-holder-charging-holder-g540854.html,Versatile Portable Blue Iphone Phone Holder Charging Holder,Phone Holder
202,$82.00,$90.00,http://www.jollychic.com/p/promate-charge-holder-three-in-one-quick-charging-wireless-charging-dock-g541732.html,Promate Charge Holder Three In One Quick Charging Wireless Charging Dock,Phone Holder
106,$3.99,,http://www.jollychic.com/p/phone-holder-portable-versatile-ring-type-phone-holder-g562498.html,Phone Holder Portable Versatile Ring Type Phone Holder,Phone Holder
123,$9.99,$13.99,http://www.jollychic.com/p/magnetic-phone-stand-multifunctional-portable-ring-shaped-buckle-car-holder-g617758.html,Magnetic Phone Stand Multifunctional Portable Ring-Shaped Buckle Car Holder,Phone Holder
296,$5.99,$8.99,http://www.jollychic.com/p/charger-holder-durable-usb-transfer-data-charging-dock-station-for-iphone-ipad-android-g758434.html,Charger Holder Durable USB Transfer Data & Charging Dock Station For iPhone iPad Android,Phone Holder
5,$21.99,,http://www.jollychic.com/p/jokoro-earphone-bracket-aluminum-alloy-h-stand-display-rack-holder-for-earphones-g842182.html,JOKORO Earphone Bracket Aluminum Alloy H Stand Display Rack Holder For Earphones,Phone Holder
47,$7.99,,http://www.jollychic.com/p/4pcs-phone-holder-elephant-silica-gel-soft-ipad-pen-spoon-holder-g863132.html,4PCs Phone Holder Elephant Silica Gel Soft IPAD Pen Spoon Holder,Phone Holder
12,$7.99,,http://www.jollychic.com/p/phone-holder-universal-octopus-adjustable-durable-phone-holder-g870258.html,Phone Holder Universal Octopus Adjustable Durable Phone Holder,Phone Holder
46,$12.99,$19.99,http://www.jollychic.com/p/phone-holder-universal-portable-foldable-flexible-phone-holder-g919212.html,Phone Holder Universal Portable Foldable Flexible Phone Holder,Phone Holder
70,$5.99,$9.99,http://www.jollychic.com/p/mobile-phone-holder-metal-finger-buckle-stent-sticker-for-ios-android-phone-g973518.html,Mobile Phone Holder Metal Finger Buckle Stent Sticker For IOS Android Phone,Phone Holder
233,$6.99,$10.99,http://www.jollychic.com/p/aluminum-metal-phone-stand-holder-iphone-6-7-plus-samsung-tablet-phone-holder-g1043588.html,Aluminum Metal Phone Stand Holder iPhone 6 7 Plus Samsung Tablet Phone Holder,Phone Holder
24,$8.99,,http://www.jollychic.com/p/phone-holder-apple-watch-iwatch-2-in-1-aluminum-alloy-bracket-g1094082.html,Phone Holder Apple Watch iwatch 2 In 1 Aluminum Alloy Bracket,Phone Holder
12,$5.99,,http://www.jollychic.com/p/phone-holder-portable-durable-portable-all-metal-finger-buckle-phone-stand-g1134412.html,Phone Holder Portable Durable Portable All metal Finger Buckle Phone Stand,Phone Holder
15,$8.99,,http://www.jollychic.com/p/phone-holder-creative-cartoon-cat-head-360-degree-rotate-finger-ring-buckle-holder-g1165846.html,Phone Holder Creative Cartoon Cat Head 360 Degree Rotate Finger Ring Buckle Holder,Phone Holder
3,$16.99,$29.99,http://www.jollychic.com/p/vertical-stand-cooling-fan-cooler-charger-dual-charger-ports-for-playstation-4-g1206560.html,Vertical Stand Cooling Fan Cooler Charger Dual Charger Ports For PlayStation 4,Phone Holder
13,$5.99,$10.99,http://www.jollychic.com/p/phone-holder-universal-phone-ipad-4-10-inch-abs-phone-holder-g1230798.html,Phone Holder Universal Phone Ipad 4-10 Inch ABS Phone Holder,Phone Holder
30925,$5.99,,http://www.jollychic.com/p/solid-color-portable-mobile-phone-holder-g216241.html,Solid Color Portable Mobile Phone Holder,Phone Holder
2878,$3.99,$7.99,http://www.jollychic.com/p/cute-animals-pattern-phone-stand-ring-g283210.html,Cute Animals Pattern Phone Stand Ring,Phone Holder
162,$9.99,,http://www.jollychic.com/p/universal-convenient-iphone-smart-watch-phone-holder-g540862.html,Universal Convenient Iphone Smart Watch Phone Holder,Phone Holder
416,$3.99,,http://www.jollychic.com/p/artizan-phone-holder-love-shaped-personality-desktop-versatile-phone-ring-bracket-g622366.html,ARTIZAN Phone Holder Love-Shaped Personality Desktop Versatile Phone Ring Bracket,Phone Holder
59,$3.99,,http://www.jollychic.com/p/silicon-smart-phone-gps-mount-holder-band-strap-for-car-bike-motocycle-g1025602.html,Silicon Smart Phone GPS Mount Holder Band Strap For Car/Bike/Motocycle,Phone Holder
30,$8.99,,http://www.jollychic.com/p/phone-holder-mcdodo-finger-ring-phone-holder-spinner-stand-grip-metal-360-degree-g1060342.html,Phone Holder Mcdodo Finger Ring Phone Holder Spinner Stand Grip Metal 360 Degree,Phone Holder
33,$2.99,$7.99,http://www.jollychic.com/p/phone-holder-lazy-finger-ring-buckle-star-shape-metal-rotatable-universal-phone-holder-g1124064.html,Phone Holder Lazy Finger Ring Buckle Star Shape Metal Rotatable Universal Phone Holder,Phone Holder
14,$5.99,,http://www.jollychic.com/p/phone-holder-lip-design-universal-stick-type-portable-ring-holder-phone-holder-g1133970.html,Phone Holder Lip Design Universal Stick Type Portable Ring Holder Phone Holder,Phone Holder
71,$2.99,$7.99,http://www.jollychic.com/p/phone-holder-cartoon-nano-micro-suction-rotatable-four-leaf-clover-shape-ring-bracket-g1164758.html,Phone Holder Cartoon Nano-micro- suction Rotatable Four-leaf Clover Shape Ring Bracket,Phone Holder
4,$5.99,$9.99,http://www.jollychic.com/p/phone-holder-creative-multi-function-electroplating-outlet-metal-universal-mobile-phone-stand-g1188502.html,Phone Holder Creative Multi - Function Electroplating Outlet Metal Universal Mobile Phone Stand,Phone Holder
4,$7.99,$10.99,http://www.jollychic.com/p/phone-ring-stand-holder-universal-360-C2-B0-rotation-type-phone-holder-g1219830.html,Phone Ring Stand Holder Universal 360° Rotation Type Phone Holder,Phone Holder
28,$11.99,$30.99,http://www.jollychic.com/p/smamao-oem-qi-fast-wireless-charger-stand-for-mobile-phones-g387814.html,SMAMAO OEM Qi Fast Wireless Charger Stand for Mobile Phones,Phone Holder
64,$12.99,$13.99,http://www.jollychic.com/p/promate-phone-holder-versatile-bicycle-phone-holder-cushioned-retractable-grips-g499242.html,Promate Phone Holder Versatile Bicycle Phone Holder Cushioned Retractable Grips,Phone Holder
406,$76.00,$80.00,http://www.jollychic.com/p/azpen-wireless-charger-multi-functional-bluetooth-speaker-qi-wireless-charger-g536598.html,AZPEN Wireless Charger Multi-Functional Bluetooth Speaker Qi Wireless Charger,Phone Holder
239,$3.99,,http://www.jollychic.com/p/phone-holder-reinstones-heart-shaped-little-love-pattern-ring-loop-bracket-g604138.html,Phone Holder Reinstones Heart-Shaped Little Love Pattern Ring Loop Bracket,Phone Holder
112,$5.99,,http://www.jollychic.com/p/phone-holder-portable-creative-metal-rhinestones-peacock-design-ring-holder-g880474.html,Phone Holder Portable Creative Metal Rhinestones Peacock Design Ring Holder,Phone Holder
57,$7.99,,http://www.jollychic.com/p/baseus-phone-holder-paste-type-multi-functional-versatile-finger-clip-bracket-ring-holder-g967856.html,Baseus Phone Holder Paste-Type Multi-Functional Versatile Finger Clip Bracket Ring Holder,Phone Holder
35,$4.99,$6.99,http://www.jollychic.com/p/earphone-holder-acrylic-fashion-desk-display-headset-headphone-stand-hanger-g1025756.html,Earphone Holder Acrylic Fashion Desk Display Headset Headphone Stand Hanger,Phone Holder
60,$9.99,,http://www.jollychic.com/p/earphone-bracket-lightweight-durable-l-shaped-earphone-holder-g1042658.html,Earphone Bracket Lightweight Durable L Shaped Earphone Holder,Phone Holder
34,$4.99,,http://www.jollychic.com/p/phone-holder-portable-silicone-strong-adhesive-phone-holder-g1067160.html,Phone Holder Portable Silicone Strong Adhesive Phone Holder,Phone Holder
27,$8.99,,http://www.jollychic.com/p/phone-holder-on-wall-abs-charging-bracket-g1097284.html,Phone Holder On Wall ABS Charging Bracket,Phone Holder
210,$5.99,$11.99,http://www.jollychic.com/p/phone-holder-durable-high-quality-double-dual-clip-type-rotary-phone-stand-g1190006.html,Phone Holder Durable High Quality Double Dual Clip Type Rotary Phone Stand,Phone Holder
3,$9.99,$13.99,http://www.jollychic.com/p/phone-holder-universal-portable-non-slip-luminous-durable-phone-pad-holder-g1208988.html,Phone Holder Universal Portable Non Slip Luminous Durable Phone Pad Holder,Phone Holder
11,$13.99,$15.99,http://www.jollychic.com/p/torras-phone-holder-universal-360-degree-multi-angle-adjustment-tablet-holder-stand-desk-mount-g1219736.html,TORRAS Phone Holder Universal 360 Degree Multi-Angle Adjustment Tablet Holder Stand Desk Mount,Phone Holder
7,$7.99,$10.99,http://www.jollychic.com/p/phone-ring-stand-holder-grip-kickstand-universal-smartphone-cell-phone-holder-g1220666.html,Phone Ring Stand Holder Grip Kickstand Universal Smartphone Cell Phone Holder,Phone Holder
8,$6.99,$9.99,http://www.jollychic.com/p/phone-holder-universal-v-fold-multi-color-desktop-lazy-stent-soft-rubber-to-protect-lazy-stent-g1266956.html,Phone Holder Universal V-fold Multi-Color Desktop Lazy Stent Soft Rubber To Protect Lazy Stent,Phone Holder
329,$30.99,,http://www.jollychic.com/p/versatile-foldable-portable-cell-phone-tablet-computer-holder-g439378.html,Versatile Foldable Portable Cell Phone Tablet Computer Holder,Phone Holder
33,$3.99,,http://www.jollychic.com/p/cell-phone-clip-holder-portable-o-shaped-phone-clip-for-gopro-camera-g528240.html,Cell Phone Clip Holder Portable O-Shaped Phone Clip For Gopro Camera,Phone Holder
2322,$3.99,,http://www.jollychic.com/p/phone-holder-universal-rotatory-functional-foldable-flexible-desk-phone-holder-phone-stand-g638274.html,Phone Holder Universal Rotatory Functional Foldable Flexible Desk Phone Holder Phone Stand,Phone Holder
443,$5.99,$7.99,http://www.jollychic.com/p/phone-holder-versatile-removable-stick-ring-type-shockproof-phone-holder-g655686.html,Phone Holder Versatile Removable Stick Ring Type Shockproof Phone Holder,Phone Holder
24,$9.99,,http://www.jollychic.com/p/earphone-rack-universal-portable-durable-head-mounted-headphone-rack-g801128.html,Earphone Rack Universal Portable Durable Head Mounted Headphone Rack,Phone Holder
113,$8.99,$11.99,http://www.jollychic.com/p/car-holder-portable-durable-360-degree-rotation-adjustable-phone-holder-g930286.html,Car Holder Portable Durable 360 Degree Rotation Adjustable Phone Holder,Phone Holder
263,$5.99,,http://www.jollychic.com/p/foldable-wall-charger-adapter-cell-phone-charging-stent-one-pieces-g1089688.html,Foldable Wall Charger Adapter Cell Phone Charging Stent One Pieces,Phone Holder
45,$9.99,,http://www.jollychic.com/p/phone-holder-tripod-universal-portable-mini-tripod-phone-holder-g1102830.html,Phone Holder Tripod Universal Portable Mini Tripod Phone Holder,Phone Holder
2345,$2.99,$7.99,http://www.jollychic.com/p/simple-cool-f1-universal-holder-for-smarphone-tablet-ipad-g387718.html,Simple Cool F1 Universal Holder for Smarphone/Tablet/Ipad,Phone Holder
1735,$8.99,$14.99,http://www.jollychic.com/p/creative-rotatable-pc-protective-support-for-ipad-g329454.html,Creative Rotatable PC Protective Support for IPad,Phone Holder
98,$9.99,$25.99,http://www.jollychic.com/p/removable-quick-charge-wireless-charger-holder-g417642.html,Removable Quick Charge Wireless Charger Holder,Phone Holder
1628,$3.99,,http://www.jollychic.com/p/phone-holder-portable-versatile-ring-type-lion-head-shaped-phone-holder-g586912.html,Phone Holder Portable Versatile Ring Type Lion Head Shaped Phone Holder,Phone Holder
1564,$7.99,$12.99,http://www.jollychic.com/p/phone-holder-universal-convenient-flexible-clip-on-phone-holder-g675462.html,Phone Holder Universal Convenient Flexible Clip-On Phone Holder,Phone Holder
111,$5.99,,http://www.jollychic.com/p/phone-holder-universal-adjustable-durable-foldable-phone-holder-g781872.html,Phone Holder Universal Adjustable Durable Foldable Phone Holder,Phone Holder
135,$18.99,$27.99,http://www.jollychic.com/p/flat-support-foldable-universal-desk-stand-for-convenience-ipad-holder-g837930.html,Flat Support Foldable Universal Desk Stand For Convenience Ipad Holder,Phone Holder
96,$5.99,$8.99,http://www.jollychic.com/p/phone-holder-portable-multi-function-phone-ring-holder-spiral-finger-decompression-tool-g926268.html,Phone Holder Portable Multi-Function Phone Ring Holder Spiral Finger Decompression Tool,Phone Holder
10,$5.99,,http://www.jollychic.com/p/phone-holder-creative-foldable-v-type-phone-holder-g1020388.html,Phone Holder Creative Foldable V-type Phone Holder,Phone Holder
8,$26.99,,http://www.jollychic.com/p/all-in-one-bamboo-phone-flat-watch-charging-bracket-4-usb-plug-g1072206.html,All-in-one bamboo Phone flat watch charging bracket 4 USB plug,Phone Holder
5,$8.99,,http://www.jollychic.com/p/phone-holder-creative-small-devil-shape-metal-lazy-mobile-phone-360-C2-B0-rotating-finger-buckle-g1260776.html,Phone Holder Creative Small Devil Shape Metal Lazy Mobile Phone 360 ° Rotating Finger Buckle,Phone Holder
917,$4.99,$7.99,http://www.jollychic.com/p/promate-universal-smartphones-gripmate-secure-finger-gripstand-phone-holder-g480498.html,Promate Universal Smartphones GripMate Secure Finger GripStand Phone Holder,Phone Holder
939,$14.99,$22.99,http://www.jollychic.com/p/phone-holder-versatile-phone-tablet-computer-holder-g488258.html,Phone Holder Versatile Phone Tablet Computer Holder,Phone Holder
743,$2.99,$5.99,http://www.jollychic.com/p/foldable-versatile-non-slip-mobile-phone-holder-g551860.html,Foldable Versatile Non-Slip Mobile Phone Holder,Phone Holder
909,$2.99,,http://www.jollychic.com/p/phone-holder-portable-versatile-360-degree-rotatable-rabbit-shape-ring-type-phone-holder-g617664.html,Phone Holder Portable Versatile 360 Degree Rotatable Rabbit Shape Ring Type Phone Holder,Phone Holder
128,$1.99,$4.99,http://www.jollychic.com/p/earphone-rack-portable-durable-hanger-type-head-mounted-headphone-rack-g801160.html,Earphone Rack Portable Durable Hanger Type Head Mounted Headphone Rack,Phone Holder
220,$6.99,$9.99,http://www.jollychic.com/p/phone-ring-holder-rotate-finger-ring-mobile-phone-stand-holder-for-all-smart-phones-g967862.html,Phone Ring Holder Rotate Finger Ring Mobile Phone Stand Holder For All Smart Phones,Phone Holder
544,$12.99,$24.99,http://www.jollychic.com/p/bamboo-combo-charging-dock-cradle-holder-for-apple-watch-iphone-6-6-plus-ipad-mini-g274863.html,Bamboo Combo Charging Dock Cradle Holder for Apple Watch/ iPhone 6 / 6 Plus / iPad Mini,Phone Holder
