add_wish,discount_price,original_price,product_link,product_name,header_block
1129,$2.99,$3.99,https://www.jollychic.com/p/lazy-black-and-white-panda-plush-hand-puppet-g184181.html,Lazy Black And White Panda Plush Hand Puppet,Plush & Doll
408,$3.99,,https://www.jollychic.com/p/bright-red-starling-parrot-plush-hand-puppet-g184465.html,"Bright Red""Starling"" Parrot Plush Hand Puppet",Plush & Doll
498,$3.99,,https://www.jollychic.com/p/santa-claus-plush-doll-finger-puppets-kid-toys-g184487.html,Santa Claus Plush Doll Finger Puppets Kid Toys,Plush & Doll
732,$11.99,$16.99,https://www.jollychic.com/p/animal-pattern-cute-vivid-baby-toy-g209071.html,Animal Pattern Cute Vivid Baby Toy,Plush & Doll
1370,$12.99,,https://www.jollychic.com/p/teddy-bear-cute-creative-baby-toy-g212193.html,Teddy Bear Cute Creative Baby Toy,Plush & Doll
1218,$5.99,$12.99,https://www.jollychic.com/p/cartoon-plush-baby-teether-rattle-pacify-toy-g280578.html,Cartoon Plush Baby Teether Rattle Pacify Toy,Plush & Doll
945,$12.99,,https://www.jollychic.com/p/cute-cartoon-nodding-musical-tumbler-toy-for-baby-g298016.html,Cute Cartoon Nodding Musical Tumbler Toy for Baby,Plush & Doll
468,$4.99,,https://www.jollychic.com/p/eye-pattern-creative-doll-accessories-diy-toy-g302658.html,Eye Pattern Creative Doll Accessories DIY Toy,Plush & Doll
10492,$3.99,,https://www.jollychic.com/p/cute-design-u-shape-soft-plush-pillow-g313600.html,Cute Design U Shape Soft Plush Pillow,Plush & Doll
814,$5.99,,https://www.jollychic.com/p/creative-lip-multifunctional-cushion-plush-pillow-g313692.html,Creative Lip Multifunctional Cushion Plush Pillow,Plush & Doll
5461,$11.99,,https://www.jollychic.com/p/colorful-creative-mister-donut-shaped-cushion-g313756.html,Colorful Creative Mister Donut Shaped Cushion,Plush & Doll
947,$5.99,$8.99,https://www.jollychic.com/p/striped-bear-pattern-cute-toy-for-kids-g314956.html,Striped Bear Pattern Cute Toy For Kids,Plush & Doll
342,$10.99,$18.99,https://www.jollychic.com/p/cute-clown-hand-puppets-plush-toys-for-kids-g335292.html,Cute Clown Hand Puppets Plush Toys For Kids,Plush & Doll
719,$11.99,,https://www.jollychic.com/p/6-pcs-animals-peekaboo-toys-extendable-stick-for-kids-g335352.html,6 Pcs Animals Peekaboo Toys Extendable Stick For Kids,Plush & Doll
2601,$6.99,,https://www.jollychic.com/p/4-pcs-cartoon-story-hand-puppets-for-kids-g335444.html,4 Pcs Cartoon Story Hand Puppets For Kids,Plush & Doll
1248,$11.99,,https://www.jollychic.com/p/6-pcs-clown-peekaboo-toys-extendable-stick-for-kids-g335486.html,6 Pcs Clown Peekaboo Toys Extendable Stick For Kids,Plush & Doll
3042,$10.99,,https://www.jollychic.com/p/6-pcs-prince-princess-hand-puppets-set-plush-toys-for-kids-g335572.html,6 Pcs Prince & Princess Hand Puppets Set Plush Toys For Kids,Plush & Doll
2422,$11.99,$18.99,https://www.jollychic.com/p/6-pcs-one-family-hand-puppet-for-kids-g358536.html,6 Pcs One Family Hand Puppet For Kids,Plush & Doll
4055,$18.99,,https://www.jollychic.com/p/kids-toy-doll-changing-clothes-diy-creative-toy-g435972.html,Kids Toy Doll Changing Clothes DIY Creative Toy,Plush & Doll
330,$15.99,$24.99,https://www.jollychic.com/p/creative-cartoon-pattern-multifunctional-plush-pillow-kids-toy-g451770.html,Creative Cartoon Pattern Multifunctional Plush Pillow Kids Toy,Plush & Doll
2523,$15.99,$24.99,https://www.jollychic.com/p/kid-s-doll-changing-clothes-creative-toy-g454452.html,Kid's Doll Changing Clothes Creative Toy,Plush & Doll
947,$12.99,,https://www.jollychic.com/p/kid-s-toy-creative-cute-kids-plush-toy-g454570.html,Kid's Toy Creative Cute Kids Plush Toy,Plush & Doll
1248,$6.99,,https://www.jollychic.com/p/kid-s-doll-spider-inspired-cute-toy-g455076.html,Kid's Doll Spider Inspired Cute Toy,Plush & Doll
1081,$3.99,$6.99,https://www.jollychic.com/p/toy-tiger-pattern-1-piece-cute-toy-g515012.html,Toy Tiger Pattern 1 Piece Cute Toy,Plush & Doll
716,$7.99,$12.99,https://www.jollychic.com/p/toys-100-pcs-cartoon-cute-sucker-toy-g516566.html,Toys 100 Pcs Cartoon Cute Sucker Toy,Plush & Doll
712,$7.99,$14.99,https://www.jollychic.com/p/doll-heart-pattern-cute-toy-g522198.html,Doll Heart Pattern Cute Toy,Plush & Doll
3524,$1.99,$5.99,https://www.jollychic.com/p/kid-s-anti-stress-toy-1-piece-cute-animals-pattern-squeeze-shape-kid-s-toy-g529246.html,Kid's Anti Stress Toy 1 Piece Cute Animals Pattern Squeeze Shape Kid's Toy,Plush & Doll
443,$6.99,$12.99,https://www.jollychic.com/p/baby-s-pacify-toy-cute-plush-bear-babys-calm-toy-g542464.html,Baby's Pacify Toy Cute Plush Bear Babys Calm Toy,Plush & Doll
460,$3.99,$4.99,https://www.jollychic.com/p/baby-s-handbell-1-piece-soft-cute-animals-pattern-plush-baby-s-toy-g559376.html,Baby's Handbell 1 Piece Soft Cute Animals Pattern Plush Baby's Toy,Plush & Doll
389,$10.99,,https://www.jollychic.com/p/kid-s-3d-painting-craft-set-gypsum-painted-dolls-diy-coloring-toys-g605020.html,Kid's 3D Painting Craft Set Gypsum Painted Dolls DIY Coloring Toys,Plush & Doll
11239,$17.99,$23.99,https://www.jollychic.com/p/plush-elephant-toy-60cm-soft-calm-doll-baby-s-toy-g616718.html,Plush Elephant Toy 60CM Soft Calm Doll Baby's Toy,Plush & Doll
253,$13.99,,https://www.jollychic.com/p/baby-s-plush-toy-set-5-pcs-cartoon-vegetables-soft-safe-calm-toy-g651098.html,Baby's Plush Toy Set 5 Pcs Cartoon Vegetables Soft Safe Calm Toy,Plush & Doll
956,$18.99,$34.99,https://www.jollychic.com/p/kid-s-doll-cute-cartoon-girl-soft-plush-toy-g653014.html,Kid's Doll Cute Cartoon Girl Soft Plush Toy,Plush & Doll
310,$3.99,$6.99,https://www.jollychic.com/p/baby-s-pacify-towel-cute-bear-pattern-soft-baby-s-toy-g660788.html,Baby's Pacify Towel Cute Bear Pattern Soft Baby's Toy,Plush & Doll
789,$17.99,$26.99,https://www.jollychic.com/p/kid-s-doll-1-piece-cartoon-pattern-cute-kid-s-toy-g661606.html,Kid's Doll 1 Piece Cartoon Pattern Cute Kid's Toy,Plush & Doll
247,$6.99,$8.99,https://www.jollychic.com/p/baby-s-plush-doll-sounding-animal-lion-puppy-piggy-soft-safe-baby-s-toy-g667740.html,Baby's Plush Doll Sounding Animal Lion Puppy Piggy Soft Safe Baby's Toy,Plush & Doll
1120,$13.99,$16.99,https://www.jollychic.com/p/kid-s-toy-doll-1-piece-cute-kids-toy-g685864.html,Kid's Toy Doll 1 Piece Cute Kids Toy,Plush & Doll
850,$0.99,$5.99,https://www.jollychic.com/p/educational-toy-6-pcs-car-pattern-cute-baby-s-toy-g698258.html,Educational Toy 6 Pcs Car Pattern Cute Baby's Toy,Plush & Doll
2991,$6.99,$15.99,https://www.jollychic.com/p/doll-set-flexible-joint-safe-educational-toy-gift-for-girls-g739682.html,Doll Set Flexible Joint Safe Educational Toy Gift For Girls,Plush & Doll
172,$5.99,$8.99,https://www.jollychic.com/p/baby-toy-multi-functional-cute-blue-bear-puppet-toy-g771926.html,Baby Toy Multi Functional Cute Blue Bear Puppet Toy,Plush & Doll
322,$8.99,,https://www.jollychic.com/p/baby-toy-multi-functional-cute-pink-soft-rabbit-puppet-toy-g771928.html,Baby Toy Multi Functional Cute Pink Soft Rabbit Puppet Toy,Plush & Doll
185,$6.99,$9.99,https://www.jollychic.com/p/baby-bed-bell-animal-plush-doll-teether-calm-toy-g790950.html,Baby Bed Bell Animal Plush Doll Teether Calm Toy,Plush & Doll
512,$25.99,$42.99,https://www.jollychic.com/p/baby-doll-with-clothes-flexible-eyes-soft-kids-toy-g801736.html,Baby Doll With Clothes Flexible Eyes Soft Kids Toy,Plush & Doll
999,$25.99,$46.99,https://www.jollychic.com/p/1-piece-smart-dancing-baby-doll-singing-and-dialogue-kids-toy-g801742.html,1 Piece Smart Dancing Baby Doll Singing And Dialogue Kids Toy,Plush & Doll
265,$23.99,$42.99,https://www.jollychic.com/p/plush-toy-car-cartoon-police-car-kids-toy-g802796.html,Plush Toy Car Cartoon Police Car Kids Toy,Plush & Doll
46,$10.99,,https://www.jollychic.com/p/1-piece-coloring-piggy-bank-creative-diy-gift-g817462.html,1 Piece Coloring Piggy Bank Creative DIY Gift,Plush & Doll
69,$10.99,,https://www.jollychic.com/p/baby-doll-cute-little-bee-bed-hanging-baby-girl-plush-toy-g821766.html,Baby Doll Cute Little Bee Bed Hanging Baby Girl Plush Toy,Plush & Doll
227,$6.99,$8.99,https://www.jollychic.com/p/baby-doll-cute-animal-bed-hanging-baby-girl-plush-calm-toy-g821770.html,Baby Doll Cute Animal Bed Hanging Baby Girl Plush Calm Toy,Plush & Doll
248,$3.99,$5.99,https://www.jollychic.com/p/baby-doll-cute-animal-pattern-bed-hanging-baby-girl-plush-calm-toy-g821772.html,Baby Doll Cute Animal Pattern Bed Hanging Baby Girl Plush Calm Toy,Plush & Doll
557,$20.99,$29.99,https://www.jollychic.com/p/finger-puppets-10-pcs-set-cute-animals-story-telling-mini-dolls-g867422.html,Finger Puppets 10 Pcs Set Cute Animals Story Telling Mini Dolls,Plush & Doll
3821,$3.99,$5.99,https://www.jollychic.com/p/soft-squishy-teeth-toy-slow-rising-jumbo-squeeze-kids-adults-stress-relief-toy-g886980.html,Soft Squishy Teeth Toy Slow Rising Jumbo Squeeze Kids Adults Stress Relief Toy,Plush & Doll
689,$8.99,$29.99,https://www.jollychic.com/p/kid-s-plush-doll-cute-simulation-panda-kid-s-gift-pillow-dolls-g990586.html,Kid's Plush Doll Cute Simulation Panda Kid's Gift Pillow Dolls,Plush & Doll
717,$9.99,$15.99,https://www.jollychic.com/p/kid-s-plush-doll-cute-simulation-elephant-kid-s-gift-pillow-dolls-g990588.html,Kid's Plush Doll Cute Simulation Elephant Kid's Gift Pillow Dolls,Plush & Doll
2366,$21.99,$35.99,https://www.jollychic.com/p/kid-s-plush-doll-safe-dining-soft-chair-kid-s-sofa-g990590.html,Kid's Plush Doll Safe Dining Soft Chair Kid's Sofa,Plush & Doll
1452,$7.99,,https://www.jollychic.com/p/kid-s-plush-doll-cute-simulation-poo-kid-s-gift-pillow-dolls-g990592.html,Kid's Plush Doll Cute Simulation Poo Kid's Gift Pillow Dolls,Plush & Doll
1356,$23.99,$33.99,https://www.jollychic.com/p/kid-s-baby-doll-long-hair-cute-baby-girl-lovely-toy-g1010788.html,Kid's Baby Doll Long Hair Cute Baby Girl Lovely Toy,Plush & Doll
628,$23.99,$36.99,https://www.jollychic.com/p/kid-s-doll-feeding-bottle-baby-talk-sleep-snore-cute-children-toy-g1010804.html,Kid's Doll Feeding Bottle Baby Talk Sleep Snore Cute Children Toy,Plush & Doll
1220,$8.99,,https://www.jollychic.com/p/plush-doll-cute-gig-faces-cat-birthday-gift-plush-toy-g1034676.html,Plush Doll Cute Gig Faces Cat Birthday Gift Plush Toy,Plush & Doll
90,$10.99,,https://www.jollychic.com/p/hand-painted-wooden-solider-handmade-nutcracker-doll-with-accessories-g1042088.html,Hand Painted Wooden Solider Handmade Nutcracker Doll With Accessories,Plush & Doll
54,$15.99,,https://www.jollychic.com/p/topbright-baby-s-cloth-bell-ball-colorful-educational-toy-g1049966.html,TOPBRIGHT Baby's Cloth Bell Ball Colorful Educational Toy,Plush & Doll
1310,$6.99,$10.99,https://www.jollychic.com/p/1-piece-cute-rabbit-plush-doll-in-pretty-dress-soft-plush-toy-g1056440.html,1 Piece Cute Rabbit Plush Doll In Pretty Dress Soft Plush Toy,Plush & Doll
114,$5.99,,https://www.jollychic.com/p/baby-dolls-3pcs-cartoon-animal-hand-puppet-calming-dolls-g1057146.html,Baby Dolls 3Pcs Cartoon Animal Hand Puppet Calming Dolls,Plush & Doll
284,$7.99,,https://www.jollychic.com/p/teddy-bear-plush-doll-soft-plush-toy-birthday-gift-g1061774.html,Teddy Bear Plush Doll Soft Plush Toy Birthday Gift,Plush & Doll
366,$56.00,,https://www.jollychic.com/p/kid-s-sounding-doll-multifunctionall-educational-toy-g1065004.html,Kid's Sounding Doll Multifunctionall Educational Toy,Plush & Doll
1062,$12.99,$25.99,https://www.jollychic.com/p/girl-s-dress-up-toy-kid-s-recreational-ornament-doll-toy-g1075488.html,Girl's Dress Up Toy Kid's Recreational Ornament Doll Toy,Plush & Doll
683,$14.99,$27.99,https://www.jollychic.com/p/children-s-high-simulation-fashion-doll-girl-s-dress-up-toy-g1075492.html,Children's High Simulation Fashion Doll Girl's Dress Up Toy,Plush & Doll
254,$1.99,$3.99,https://www.jollychic.com/p/finger-puppets-6-pcs-family-cute-toy-g1082788.html,Finger Puppets 6 Pcs Family Cute Toy,Plush & Doll
622,$11.99,$22.99,https://www.jollychic.com/p/kid-s-doll-toy-butterfly-fairy-girl-s-recreational-toy-g1093650.html,Kid's Doll Toy Butterfly Fairy Girl's Recreational Toy,Plush & Doll
851,$10.99,$19.99,https://www.jollychic.com/p/kid-s-doll-toy-fashion-girl-barbie-doll-toy-g1093654.html,Kid's Doll Toy Fashion Girl Barbie Doll Toy,Plush & Doll
238,$9.99,,https://www.jollychic.com/p/kid-s-toy-cartoon-plush-doll-creative-calming-kid-s-gift-toy-g1111558.html,Kid's Toy Cartoon Plush Doll Creative Calming Kid's Gift Toy,Plush & Doll
128,$23.99,$33.99,https://www.jollychic.com/p/kid-s-plush-toy-electric-concert-singing-calming-elephant-toy-g1111560.html,Kid's Plush Toy Electric Concert Singing Calming Elephant Toy,Plush & Doll
1054,$38.99,$73.00,https://www.jollychic.com/p/girl-s-barbie-doll-toy-recreational-dress-up-toy-g1125716.html,Girl's Barbie Doll Toy Recreational Dress Up Toy,Plush & Doll
741,$17.99,$36.99,https://www.jollychic.com/p/girl-s-barbie-doll-toy-lelia-perpetual-swing-toy-g1125726.html,Girl's Barbie Doll Toy Lelia Perpetual Swing Toy,Plush & Doll
203,$14.99,$33.99,https://www.jollychic.com/p/baby-s-height-gauge-animal-pattern-suspensible-plush-scale-soft-toy-g1125734.html,Baby's Height Gauge Animal Pattern Suspensible Plush Scale Soft Toy,Plush & Doll
68,$6.99,,https://www.jollychic.com/p/baby-pacify-towel-1-piece-lovely-cartoon-baby-toy-g1189812.html,Baby Pacify Towel 1 Piece Lovely Cartoon Baby Toy,Plush & Doll
1113,$9.99,$17.99,https://www.jollychic.com/p/doll-cute-1-piece-kids-toy-g1208726.html,Doll Cute 1 Piece Kids Toy,Plush & Doll
153,$15.99,$27.99,https://www.jollychic.com/p/electric-sing-song-elephant-doll-music-doll-kid-s-toy-g1222178.html,Electric Sing Song Elephant Doll Music Doll Kid's Toy,Plush & Doll
65,$39.99,$64.00,https://www.jollychic.com/p/kid-s-soothing-doll-sleeping-rabbit-baby-soft-plush-toy-g1238264.html,Kid's Soothing Doll Sleeping Rabbit Baby Soft Plush Toy,Plush & Doll
72,$39.99,$64.00,https://www.jollychic.com/p/kid-s-soothing-doll-sleeping-bear-baby-soft-plush-toy-g1239290.html,Kid's Soothing Doll Sleeping Bear Baby Soft Plush Toy,Plush & Doll
41,$6.99,$10.99,https://www.jollychic.com/p/plush-toy-thriller-game-1-piece-kids-toy-g1240084.html,Plush Toy Thriller Game 1 Piece Kids Toy,Plush & Doll
222,$19.99,,https://www.jollychic.com/p/ddung-doll-kid-s-doll-cute-birthday-gift-for-girls-g1288566.html,Ddung Doll Kid's Doll Cute Birthday Gift For Girls,Plush & Doll
130,$4.99,$10.99,https://www.jollychic.com/p/ice-bag-eyeshade-expression-sad-frog-creative-sleeping-eyepatch-g1288672.html,Ice Bag Eyeshade Expression Sad Frog Creative Sleeping Eyepatch,Plush & Doll
92,$6.99,,https://www.jollychic.com/p/1-pc-wind-up-mouse-toy-simulation-wag-tail-furry-mouse-toy-g1316978.html,1 Pc Wind Up Mouse Toy Simulation Wag Tail Furry Mouse Toy,Plush & Doll
103,$6.99,$16.99,https://www.jollychic.com/p/baby-s-pacifying-silicone-pacifier-cute-stuffed-animal-toy-g1342700.html,Baby's Pacifying Silicone Pacifier Cute Stuffed Animal Toy,Plush & Doll
76,$13.99,$26.99,https://www.jollychic.com/p/madagascar-giraffe-doll-stuffed-animal-soft-plush-toys-g1342718.html,Madagascar Giraffe Doll Stuffed Animal Soft Plush Toys,Plush & Doll
91,$5.99,$14.99,https://www.jollychic.com/p/cute-christmas-elfin-doll-kid-s-soft-plush-toy-g1344524.html,Cute Christmas Elfin Doll Kid's Soft Plush Toy,Plush & Doll
253,$4.99,$8.99,https://www.jollychic.com/p/cute-panda-plush-toy-round-big-head-cartoon-animal-body-pillow-g1363292.html,Cute Panda Plush Toy Round Big Head Cartoon Animal Body Pillow,Plush & Doll
434,$6.99,$11.99,https://www.jollychic.com/p/simulated-panda-plush-toy-cute-animal-plush-doll-g1363294.html,Simulated Panda Plush Toy Cute Animal Plush Doll,Plush & Doll
35,$8.99,$14.99,https://www.jollychic.com/p/1-pc-cute-cat-plush-doll-cartoon-expression-kids-adults-kitten-plus-toy-g1363306.html,1 Pc Cute Cat Plush Doll Cartoon Expression Kids Adults Kitten Plus Toy,Plush & Doll
46,$6.99,$11.99,https://www.jollychic.com/p/cute-hedgehog-plush-doll-cartoon-animal-plush-toy-g1363310.html,Cute Hedgehog Plush Doll Cartoon Animal Plush Toy,Plush & Doll
1242,$9.99,$14.99,https://www.jollychic.com/p/royal-buy-stuffed-animal-cushion-kids-baby-sleeping-soft-pillow-toy-cute-elephant-cotton-toys-g1366572.html,Royal-Buy Stuffed Animal Cushion Kids Baby Sleeping Soft Pillow Toy Cute Elephant Cotton Toys,Plush & Doll
21,$17.99,,https://www.jollychic.com/p/bed-hanging-appease-doll-baby-appease-soft-toys-g1382426.html,Bed Hanging Appease Doll Baby Appease Soft Toys,Plush & Doll
20,$9.99,,https://www.jollychic.com/p/baby-s-soothing-towel-elephant-doll-appease-soft-plush-toy-g1386514.html,Baby's Soothing Towel Elephant Doll Appease Soft Plush Toy,Plush & Doll
905,$6.99,$11.99,https://www.jollychic.com/p/kid-s-cartoon-models-lamb-plush-toys-shawn-sheep-dolls-g1415736.html,Kid's Cartoon Models Lamb Plush Toys Shawn Sheep Dolls,Plush & Doll
36,$5.99,,https://www.jollychic.com/p/kid-s-plush-doll-toy-cute-colorful-cartoon-plush-doll-g1445530.html,Kid's Plush Doll Toy Cute Colorful Cartoon Plush Doll,Plush & Doll
67,$5.99,,https://www.jollychic.com/p/kid-s-plush-doll-toy-cute-cartoon-red-doll-kid-s-birthday-gift-g1445558.html,Kid's Plush Doll Toy Cute Cartoon Red Doll Kid's Birthday Gift,Plush & Doll
35,$8.99,$13.99,https://www.jollychic.com/p/music-colorful-luminous-teddy-bear-plush-toy-holiday-gift-toy-g1452208.html,Music Colorful Luminous Teddy Bear Plush Toy Holiday Gift Toy,Plush & Doll
110,$3.99,$8.99,https://www.jollychic.com/p/kid-s-pendant-toy-unicorn-pattern-1-piece-cute-kids-toy-g1476390.html,Kid's Pendant Toy Unicorn Pattern 1 Piece Cute Kids Toy,Plush & Doll
52,$12.99,,https://www.jollychic.com/p/princess-mermaid-doll-simulated-eyes-music-light-girl-s-toy-g1537156.html,Princess Mermaid Doll Simulated Eyes Music Light Girl's Toy,Plush & Doll
30,$8.99,,https://www.jollychic.com/p/baby-plush-toy-cute-cartoon-pink-panther-calming-baby-toy-g1604874.html,Baby Plush Toy Cute Cartoon Pink Panther Calming Baby Toy,Plush & Doll
8,$8.99,$14.99,https://www.jollychic.com/p/kid-s-soft-toy-slow-rebound-penguin-shaped-simulation-doll-penguin-toy-g1611290.html,Kid's Soft Toy Slow Rebound Penguin Shaped Simulation Doll Penguin Toy,Plush & Doll
2,$6.99,$12.99,https://www.jollychic.com/p/kid-s-cartoon-cute-horn-small-whale-rebound-children-enlightenment-toy-g1611306.html,Kid's Cartoon Cute Horn Small Whale Rebound Children Enlightenment Toy,Plush & Doll
8,$7.99,$14.99,https://www.jollychic.com/p/kid-s-ocean-romance-moana-princess-doll-maui-plush-toy-doll-g1611352.html,Kid's Ocean Romance Moana Princess Doll Maui Plush Toy Doll,Plush & Doll
34,$10.99,$29.99,https://www.jollychic.com/p/kid-s-soft-toy-simulation-sleeping-cute-cat-slippers-doll-decoration-toy-g1611376.html,Kid's Soft Toy Simulation Sleeping Cute Cat Slippers Doll Decoration Toy,Plush & Doll
21,$5.99,$11.99,https://www.jollychic.com/p/cute-cartoon-animal-rabbit-soft-comfy-touch-lovely-plush-toy-g1611386.html,Cute Cartoon Animal Rabbit Soft Comfy Touch Lovely Plush Toy,Plush & Doll
8,$21.99,$35.99,https://www.jollychic.com/p/cute-decorative-color-soft-touching-lovely-lovers-teddy-bear-plush-doll-toy-g1611390.html,Cute Decorative Color Soft Touching Lovely Lovers Teddy Bear Plush Doll Toy,Plush & Doll
13,$17.99,$29.99,https://www.jollychic.com/p/adorable-cute-color-block-lovely-fairies-dolls-plush-toy-g1611394.html,Adorable Cute Color Block Lovely Fairies Dolls Plush Toy,Plush & Doll
5,$7.99,$13.99,https://www.jollychic.com/p/cute-candy-color-new-cute-deer-plush-giraffe-soft-toy-g1611396.html,Cute Candy Color New Cute Deer Plush Giraffe Soft Toy,Plush & Doll
7,$8.99,$15.99,https://www.jollychic.com/p/cute-comfy-touching-yellow-chicken-chic-lovely-doll-soft-toy-g1611398.html,Cute Comfy Touching Yellow Chicken Chic Lovely Doll Soft Toy,Plush & Doll
5,$12.99,$21.99,https://www.jollychic.com/p/cute-lovely-adorable-string-long-nose-elephant-doll-plush-soft-toy-g1611400.html,Cute Lovely Adorable String Long Nose Elephant Doll Plush Soft Toy,Plush & Doll
2,$15.99,$25.99,https://www.jollychic.com/p/cute-lovely-yellow-banana-plush-stuffed-pillow-cushion-g1611402.html,Cute Lovely Yellow Banana Plush Stuffed Pillow Cushion,Plush & Doll
4,$16.99,$26.99,https://www.jollychic.com/p/cute-lovely-adorable-string-cute-rabbit-pillow-buck-teeth-doll-soft-toy-g1611404.html,Cute Lovely Adorable String Cute Rabbit Pillow Buck Teeth Doll Soft Toy,Plush & Doll
3,$12.99,$21.99,https://www.jollychic.com/p/cute-lovely-comfy-yellow-chicken-stuffed-animal-soft-plush-toy-g1611408.html,Cute Lovely Comfy Yellow Chicken Stuffed Animal Soft plush Toy,Plush & Doll
1,$9.99,$16.99,https://www.jollychic.com/p/cute-lovely-comfy-decoration-candy-color-mermaid-plush-toy-g1611410.html,Cute Lovely Comfy Decoration Candy Color Mermaid Plush Toy,Plush & Doll
3,$8.99,$15.99,https://www.jollychic.com/p/lovely-comfy-cute-large-face-cat-plush-soft-toy-g1611414.html,Lovely Comfy Cute Large Face Cat Plush Soft Toy,Plush & Doll
4,$11.99,$20.99,https://www.jollychic.com/p/unicorn-shaped-cute-lovely-candy-color-cotton-horse-doll-soft-toy-g1611418.html,Unicorn Shaped Cute Lovely Candy Color Cotton Horse Doll Soft Toy,Plush & Doll
3,$11.99,$19.99,https://www.jollychic.com/p/lovely-cute-soft-cozy-plush-banana-monkey-cushion-kid-s-pillow-toy-g1611420.html,Lovely Cute Soft Cozy Plush Banana Monkey Cushion Kid's Pillow Toy,Plush & Doll
0,$11.99,$19.99,https://www.jollychic.com/p/cute-candy-color-adorable-patchwork-hippo-plush-toy-doll-g1611424.html,Cute Candy Color Adorable Patchwork Hippo Plush Toy Doll,Plush & Doll
3,$6.99,$12.99,https://www.jollychic.com/p/comfy-touch-candy-color-cute-dolphins-pillow-doll-plush-toy-g1611438.html,Comfy Touch Candy Color Cute Dolphins Pillow Doll Plush Toy,Plush & Doll
4,$10.99,$16.99,https://www.jollychic.com/p/lovely-smile-cute-cat-patchwork-cozy-plush-doll-toy-g1611462.html,Lovely Smile Cute Cat Patchwork Cozy Plush Doll Toy,Plush & Doll
1021,$3.99,,https://www.jollychic.com/p/cute-little-rabbit-timber-wolf-plush-hand-puppet-g184173.html,Cute Little Rabbit Timber Wolf Plush Hand Puppet,Plush & Doll
759,$3.99,,https://www.jollychic.com/p/soft-plush-gentle-sheep-hand-puppet-toy-g184187.html,Soft Plush Gentle Sheep Hand Puppet Toy,Plush & Doll
464,$3.99,,https://www.jollychic.com/p/curious-george-kangaroo-hand-puppet-toy-g184209.html,Curious George Kangaroo Hand Puppet Toy,Plush & Doll
538,$3.99,,https://www.jollychic.com/p/soft-plush-big-bad-wolf-hand-puppet-g184215.html,Soft Plush Big Bad Wolf Hand Puppet,Plush & Doll
592,$3.99,,https://www.jollychic.com/p/lovely-smily-cow-plush-hand-puppet-g184237.html,Lovely Smily Cow Plush Hand Puppet,Plush & Doll
472,$3.99,,https://www.jollychic.com/p/royal-puppy-plush-hand-puppet-toy-g184241.html,Royal Puppy Plush Hand Puppet Toy,Plush & Doll
217,$2.99,$3.99,https://www.jollychic.com/p/cunning-fox-soft-plush-hand-puppet-g184247.html,Cunning Fox Soft Plush Hand Puppet,Plush & Doll
390,$3.99,,https://www.jollychic.com/p/yellow-cute-plush-chicken-hand-puppet-g184273.html,Yellow Cute Plush Chicken Hand Puppet,Plush & Doll
376,$2.99,$3.99,https://www.jollychic.com/p/cute-civet-cats-plush-hand-puppet-toy-g184339.html,Cute Civet Cats Plush Hand Puppet Toy,Plush & Doll
262,$2.99,,https://www.jollychic.com/p/bright-color-cute-shark-hand-puppet-g184365.html,Bright Color Cute Shark Hand Puppet,Plush & Doll
977,$3.99,,https://www.jollychic.com/p/colorful-nice-design-plush-stars-hand-puppet-g184387.html,Colorful Nice Design Plush Stars Hand Puppet,Plush & Doll
611,$2.99,,https://www.jollychic.com/p/-stupid-donkey-design-plush-hand-puppet-g184409.html,"""Stupid"" Donkey Design Plush Hand Puppet",Plush & Doll
567,$3.99,,https://www.jollychic.com/p/fox-plush-doll-finger-puppets-kid-toys-g184437.html,Fox Plush Doll Finger Puppets Kid Toys,Plush & Doll
533,$3.99,,https://www.jollychic.com/p/sika-deer-plush-doll-finger-puppets-kid-toys-g184447.html,Sika Deer Plush Doll Finger Puppets Kid Toys,Plush & Doll
1509,$3.99,,https://www.jollychic.com/p/cat-plush-doll-finger-puppets-kid-toys-g184523.html,Cat Plush Doll Finger Puppets Kid Toys,Plush & Doll
202,$4.99,,https://www.jollychic.com/p/cute-pink-heart-shaped-embroidery-cow-hand-puppet-g184933.html,Cute Pink Heart Shaped Embroidery Cow Hand Puppet,Plush & Doll
505,$4.99,,https://www.jollychic.com/p/cute-heart-shaped-embroidery-smiling-monkey-hand-puppet-g184939.html,Cute Heart Shaped Embroidery Smiling Monkey Hand Puppet,Plush & Doll
171,$4.99,,https://www.jollychic.com/p/cute-heart-shaped-embroidery-cow-puppy-hand-puppet-g185019.html,Cute Heart Shaped Embroidery Cow Puppy Hand Puppet,Plush & Doll
341,$7.99,,https://www.jollychic.com/p/cartoon-chimpanzee-plush-doll-finger-puppets-kid-toys-g185271.html,Cartoon Chimpanzee Plush Doll Finger Puppets Kid Toys,Plush & Doll
2300,$12.99,$19.99,https://www.jollychic.com/p/cute-doll-girl-toy-gift-for-kids-g208259.html,Cute Doll Girl Toy Gift For Kids,Plush & Doll
854,$10.99,$16.99,https://www.jollychic.com/p/rabbit-pattern-bows-cute-baby-bag-toy-g209067.html,Rabbit Pattern Bows Cute Baby Bag Toy,Plush & Doll
3891,$9.99,,https://www.jollychic.com/p/soft-animal-creative-baby-toy-g209075.html,Soft Animal Creative Baby Toy,Plush & Doll
812,$6.99,$9.99,https://www.jollychic.com/p/dog-pattern-soft-cute-baby-sandbag-toy-g211031.html,Dog Pattern Soft Cute Baby Sandbag Toy,Plush & Doll
198,$20.99,,https://www.jollychic.com/p/parrot-pattern-creative-educational-baby-puppet-g212237.html,Parrot Pattern Creative Educational Baby Puppet,Plush & Doll
382,$10.99,,https://www.jollychic.com/p/ball-colorful-cute-baby-toy-g212265.html,Ball Colorful Cute Baby Toy,Plush & Doll
1460,$4.99,,https://www.jollychic.com/p/multiple-sizes-duck-pattern-cute-creative-baby-toy-g244069.html,Multiple Sizes Duck Pattern Cute Creative Baby Toy,Plush & Doll
1207,$6.99,,https://www.jollychic.com/p/10-inches-horse-pattern-cute-puppet-g247387.html,10 Inches Horse Pattern Cute Puppet,Plush & Doll
1572,$7.99,$12.99,https://www.jollychic.com/p/rabbit-star-design-plush-music-baby-toys-g285112.html,Rabbit Star Design Plush Music Baby Toys,Plush & Doll
1207,$6.99,$10.99,https://www.jollychic.com/p/5-pcs-funny-animals-plush-finger-puppets-toy-g287538.html,5 Pcs Funny Animals Plush Finger Puppets Toy,Plush & Doll
