add_wish,discount_price,original_price,product_link,product_name,header_block
8078,$6.99,,https://www.jollychic.com/p/cute-plush-animal-design-baby-s-toy-g288832.html,Cute Plush Animal Design Baby's Toy,Plush & Doll
459,$4.99,,https://www.jollychic.com/p/6-pcs-creative-design-recreational-plastic-doll-g304240.html,6 Pcs Creative Design Recreational Plastic Doll,Plush & Doll
943,$3.99,$6.99,https://www.jollychic.com/p/cartoon-mouse-soft-plush-pillow-g313658.html,Cartoon Mouse Soft Plush Pillow,Plush & Doll
1325,$5.99,,https://www.jollychic.com/p/rainbow-heart-shaped-soft-pillow-g313700.html,Rainbow Heart Shaped Soft Pillow,Plush & Doll
411,$18.99,,https://www.jollychic.com/p/cartoon-bear-soft-plush-pillow-g316584.html,Cartoon Bear Soft Plush Pillow,Plush & Doll
276,$3.99,$6.99,https://www.jollychic.com/p/christmas-snowman-glove-puppet-for-baby-g334736.html,Christmas Snowman Glove Puppet For Baby,Plush & Doll
1203,$11.99,,https://www.jollychic.com/p/cute-five-finger-glove-hand-puppets-plush-toys-for-kids-g335392.html,Cute Five Finger Glove Hand Puppets Plush Toys For Kids,Plush & Doll
1616,$9.99,,https://www.jollychic.com/p/6-pcs-different-career-hand-puppets-plush-toys-for-kids-g335506.html,6 Pcs Different Career Hand Puppets Plush Toys For Kids,Plush & Doll
264,$9.99,,https://www.jollychic.com/p/cute-monkey-cushion-kids-christmas-gift-toy-g403366.html,Cute Monkey Cushion Kids Christmas Gift Toy,Plush & Doll
701,$19.99,,https://www.jollychic.com/p/bear-doll-cute-kids-gift-toy-g403424.html,Bear Doll Cute Kids Gift Toy,Plush & Doll
259,$8.99,,https://www.jollychic.com/p/cute-animal-pattern-song-singing-kids-toy-g403468.html,Cute Animal Pattern Song Singing Kids Toy,Plush & Doll
424,$6.99,$9.99,https://www.jollychic.com/p/baby-toy-animal-pattern-sound-cute-baby-toy-g404492.html,Baby Toy Animal Pattern Sound Cute Baby Toy,Plush & Doll
350,$11.99,$17.99,https://www.jollychic.com/p/cute-cartoon-pattern-plush-pillow-kids-toy-g451746.html,Cute Cartoon Pattern Plush Pillow Kids Toy,Plush & Doll
324,$15.99,,https://www.jollychic.com/p/kids-toy-cute-animal-pattern-plush-pillow-g451776.html,Kids Toy Cute Animal Pattern Plush Pillow,Plush & Doll
1918,$13.99,$23.99,https://www.jollychic.com/p/kids-toy-cute-animal-carpet-plush-dolls-g451798.html,Kids Toy Cute Animal Carpet Plush Dolls,Plush & Doll
477,$7.99,,https://www.jollychic.com/p/plush-finger-puppets-4-pcs-little-red-riding-hood-pattern-kid-s-toy-g479370.html,Plush Finger Puppets 4 Pcs Little Red Riding Hood Pattern Kid's Toy,Plush & Doll
2325,$6.99,$12.99,https://www.jollychic.com/p/baby-s-pacify-toy-cute-bear-comfort-towel-plush-baby-s-toy-g482632.html,Baby's Pacify Toy Cute Bear Comfort Towel Plush Baby's Toy,Plush & Doll
63,$7.99,,https://www.jollychic.com/p/toy-santa-claus-christmas-4-pcs-cute-hanging-g509792.html,Toy Santa Claus Christmas 4 Pcs Cute Hanging,Plush & Doll
79,$4.99,,https://www.jollychic.com/p/hangings-reindeer-pattern-christmas-themed-6-pcs-toy-g510236.html,Hangings Reindeer Pattern Christmas Themed 6 Pcs Toy,Plush & Doll
133,$6.99,$11.99,https://www.jollychic.com/p/plush-toy-elephant-pattern-cute-toy-g518022.html,Plush Toy Elephant Pattern Cute Toy,Plush & Doll
328,$10.99,,https://www.jollychic.com/p/kid-s-plush-toy-1-piece-cute-dog-dolls-anime-dolls-g543782.html,Kid's Plush Toy 1 Piece Cute Dog Dolls Anime Dolls,Plush & Doll
2434,$16.99,,https://www.jollychic.com/p/baby-toy-soft-cute-girl-plush-doll-baby-plush-toys-g562922.html,Baby Toy Soft Cute Girl Plush Doll Baby Plush Toys,Plush & Doll
305,$10.99,,https://www.jollychic.com/p/kid-s-toy-crocodile-pattern-1-piece-kids-toy-g627672.html,Kid's Toy Crocodile Pattern 1 Piece Kids Toy,Plush & Doll
516,$5.99,$21.99,https://www.jollychic.com/p/baby-s-toy-cute-rabbit-bunny-doll-soft-calming-plush-toy-g652510.html,Baby's Toy Cute Rabbit Bunny Doll Soft Calming Plush Toy,Plush & Doll
281,$8.99,,https://www.jollychic.com/p/plush-doll-cute-mr-owl-soft-elastic-plush-toy-g656772.html,Plush Doll Cute Mr Owl Soft Elastic Plush Toy,Plush & Doll
138,$13.99,,https://www.jollychic.com/p/kid-s-doll-1-piece-monkey-pattern-cartoon-kid-s-toy-g661578.html,Kid's Doll 1 Piece Monkey Pattern Cartoon Kid's Toy,Plush & Doll
510,$14.99,,https://www.jollychic.com/p/doll-keychain-1-piece-cartoon-pattern-cute-kid-s-toy-g661648.html,Doll Keychain 1 Piece Cartoon Pattern Cute Kid's Toy,Plush & Doll
350,$10.99,$15.99,https://www.jollychic.com/p/plush-toy-1-piece-cute-animal-soft-nap-pillow-g692090.html,Plush Toy 1 Piece Cute Animal Soft Nap Pillow,Plush & Doll
69,$9.99,,https://www.jollychic.com/p/baby-toy-multifunctional-cute-animal-bed-hanging-plush-toy-g771896.html,Baby Toy Multifunctional Cute Animal Bed Hanging Plush Toy,Plush & Doll
97,$9.99,,https://www.jollychic.com/p/baby-toy-multi-functional-blue-firefly-bed-hanging-plush-toy-g771910.html,Baby Toy Multi Functional Blue Firefly Bed Hanging Plush Toy,Plush & Doll
343,$3.99,,https://www.jollychic.com/p/happy-monkey-baby-hand-bell-teether-cute-animal-plush-toy-g790928.html,Happy Monkey Baby Hand Bell Teether Cute Animal Plush Toy,Plush & Doll
159,$4.99,,https://www.jollychic.com/p/baby-hand-bell-cute-teething-animal-plush-doll-baby-calm-toy-g790940.html,Baby Hand Bell Cute Teething Animal Plush Doll Baby Calm Toy,Plush & Doll
147,$3.99,$6.99,https://www.jollychic.com/p/baby-doll-yellow-bear-plush-doll-cute-calm-toy-g792268.html,Baby Doll Yellow Bear Plush Doll Cute Calm Toy,Plush & Doll
114,$3.99,$4.99,https://www.jollychic.com/p/baby-toy-cartoon-bell-1-piece-baby-toy-g805202.html,Baby Toy Cartoon Bell 1 Piece Baby Toy,Plush & Doll
563,$12.99,,https://www.jollychic.com/p/baby-toy-doll-cute-baby-toy-g806586.html,Baby Toy Doll Cute Baby Toy,Plush & Doll
873,$10.99,,https://www.jollychic.com/p/rabbit-doll-cute-cartoon-rabbit-plush-toy-kid-s-gift-g817184.html,Rabbit Doll Cute Cartoon Rabbit Plush Toy Kid's Gift,Plush & Doll
1483,$10.99,,https://www.jollychic.com/p/baby-doll-cute-cartoon-sitting-baby-girl-plush-toy-g817190.html,Baby Doll Cute Cartoon Sitting Baby Girl Plush Toy,Plush & Doll
104,$10.99,,https://www.jollychic.com/p/1-piece-diy-coloring-piggy-bank-cartoon-rabbit-doll-coin-storage-box-g817448.html,1 Piece DIY Coloring Piggy Bank Cartoon Rabbit Doll Coin Storage Box,Plush & Doll
187,$10.99,,https://www.jollychic.com/p/plush-doll-cute-cartoon-baby-plush-toy-g817482.html,Plush Doll Cute Cartoon Baby Plush Toy,Plush & Doll
53,$11.99,,https://www.jollychic.com/p/baby-doll-cute-colorful-animal-bed-hanging-baby-girl-plush-toy-g821762.html,Baby Doll Cute Colorful Animal Bed Hanging Baby Girl Plush Toy,Plush & Doll
900,$12.99,,https://www.jollychic.com/p/kid-s-toy-ice-cream-cone-cartoon-kids-toy-g849626.html,Kid's Toy Ice Cream Cone Cartoon kids Toy,Plush & Doll
150,$8.99,,https://www.jollychic.com/p/5-pcs-baby-finger-puppets-set-cute-animals-baby-calm-toys-g867532.html,5 Pcs Baby Finger Puppets Set Cute Animals Baby Calm Toys,Plush & Doll
608,$8.99,,https://www.jollychic.com/p/kid-s-toy-dog-pattern-cute-kids-toy-g886972.html,Kid's Toy Dog Pattern Cute Kids Toy,Plush & Doll
314,$4.99,,https://www.jollychic.com/p/happy-monkey-baby-s-toys-cute-plush-animals-pattern-wrist-strap-toy-g924602.html,HAPPY MONKEY Baby's Toys Cute Plush Animals Pattern Wrist Strap Toy,Plush & Doll
150,$3.99,,https://www.jollychic.com/p/puppet-1-piece-cartoon-kids-toy-g948394.html,Puppet 1 Piece Cartoon Kids Toy,Plush & Doll
599,$12.99,,https://www.jollychic.com/p/kitten-plush-doll-cute-cartoon-cat-kids-adults-plush-toy-g966592.html,Kitten Plush Doll Cute Cartoon Cat Kids/Adults Plush Toy,Plush & Doll
44,$3.99,$7.99,https://www.jollychic.com/p/sozzy-handbell-1-piece-cartoon-animal-pattern-sound-baby-toy-g968428.html,Sozzy Handbell 1 Piece Cartoon Animal Pattern Sound Baby Toy,Plush & Doll
111,$9.99,$15.99,https://www.jollychic.com/p/5-pcs-finger-puppets-set-cute-plush-animals-adults-kids-toys-g978188.html,5 Pcs Finger Puppets Set Cute Plush Animals Adults/Kids Toys,Plush & Doll
101,$11.99,,https://www.jollychic.com/p/kid-s-toy-cute-cartoon-heart-animal-embroidery-u-shaped-plush-pillow-g1026846.html,Kid's Toy Cute Cartoon Heart Animal Embroidery U Shaped Plush Pillow,Plush & Doll
302,$10.99,,https://www.jollychic.com/p/polar-bear-plush-doll-large-size-lying-bear-soft-plush-toy-birthday-gift-g1029480.html,Polar Bear Plush Doll Large Size Lying Bear Soft Plush Toy Birthday Gift,Plush & Doll
273,$11.99,,https://www.jollychic.com/p/plush-doll-cute-animals-puppy-deer-rabbit-plush-toy-g1030052.html,Plush Doll Cute Animals Puppy/Deer/Rabbit Plush Toy,Plush & Doll
75,$20.99,,https://www.jollychic.com/p/plush-toy-rabbit-with-dress-1-piece-cute-kid-s-doll-toy-g1055332.html,Plush Toy Rabbit With Dress 1 Piece Cute Kid's Doll Toy,Plush & Doll
142,$4.99,,https://www.jollychic.com/p/puppets-8-pcs-cartoon-cute-kids-toy-g1057618.html,Puppets 8 Pcs Cartoon Cute Kids Toy,Plush & Doll
281,$24.99,$49.99,https://www.jollychic.com/p/kid-s-doll-speaking-singing-doll-toy-send-by-random-color-g1065002.html,"Kid's Doll Speaking Singing Doll Toy, Send By Random Color",Plush & Doll
81,$3.99,$7.99,https://www.jollychic.com/p/slingshot-monkey-flying-creative-1-piece-kids-toy-g1074246.html,Slingshot Monkey Flying Creative 1 Piece Kids Toy,Plush & Doll
469,$8.99,$18.99,https://www.jollychic.com/p/kid-s-doll-toy-little-fairy-dress-up-show-box-g1093658.html,Kid's Doll Toy Little Fairy Dress Up Show Box,Plush & Doll
22,$9.99,$15.99,https://www.jollychic.com/p/jollybaby-kid-s-tumbler-toy-cartoon-animal-pattern-soft-appeasing-toy-g1121050.html,Jollybaby Kid's Tumbler Toy Cartoon Animal Pattern Soft Appeasing Toy,Plush & Doll
156,$4.99,$6.99,https://www.jollychic.com/p/plush-toy-cartoon-cute-kids-toy-g1173682.html,Plush Toy Cartoon Cute Kids Toy,Plush & Doll
31,$13.99,,https://www.jollychic.com/p/baby-bed-hanging-1-piece-music-cartoon-star-baby-toy-g1189518.html,Baby Bed Hanging 1 Piece Music Cartoon Star Baby Toy,Plush & Doll
37,$6.99,$11.99,https://www.jollychic.com/p/baby-s-soothing-towel-elephant-doll-soft-plush-toy-g1198668.html,Baby's Soothing Towel Elephant Doll Soft Plush Toy,Plush & Doll
125,$4.99,$6.99,https://www.jollychic.com/p/doll-toy-1-piece-princess-dots-dress-cute-kids-toy-g1239584.html,Doll Toy 1 Piece Princess Dots Dress Cute Kids Toy,Plush & Doll
88,$6.99,$11.99,https://www.jollychic.com/p/plush-toy-cartoon-cat-1-piece-cute-kids-toy-g1268600.html,Plush Toy Cartoon Cat 1 Piece Cute Kids Toy,Plush & Doll
96,$7.99,$11.99,https://www.jollychic.com/p/plush-toy-cartoon-monkey-1-piece-cute-kids-toy-g1268602.html,Plush Toy Cartoon Monkey 1 Piece Cute Kids Toy,Plush & Doll
34,$3.99,$6.99,https://www.jollychic.com/p/cute-cartoon-daikon-plush-doll-creative-expression-cartoon-doll-g1275066.html,Cute Cartoon Daikon Plush Doll Creative Expression Cartoon Doll,Plush & Doll
115,$19.99,,https://www.jollychic.com/p/ddung-kid-s-mini-doll-birthday-gift-for-girls-g1288562.html,Ddung Kid's Mini Doll Birthday Gift For Girls,Plush & Doll
72,$9.99,$17.99,https://www.jollychic.com/p/1-piece-speaking-hamster-electric-plush-toy-record-sound-toy-birthday-gift-g1296968.html,1 Piece Speaking Hamster Electric Plush Toy Record Sound Toy Birthday Gift,Plush & Doll
120,$1.99,$6.99,https://www.jollychic.com/p/royal-buy-cartoon-plush-soft-doll-toy-stuffed-animal-kid-s-birthday-christmas-gift-g1341316.html,Royal-Buy Cartoon Plush Soft Doll Toy Stuffed Animal Kid's Birthday/Christmas Gift,Plush & Doll
46,$8.99,$16.99,https://www.jollychic.com/p/baby-s-rattle-multifunctional-plush-pendant-recreational-soft-toy-g1342698.html,Baby's Rattle Multifunctional Plush Pendant Recreational Soft Toy,Plush & Doll
97,$7.99,$16.99,https://www.jollychic.com/p/kid-s-cute-rabbit-doll-baby-children-appease-toy-g1355304.html,Kid's Cute Rabbit Doll Baby Children Appease Toy,Plush & Doll
48,$6.99,$11.99,https://www.jollychic.com/p/cute-husky-puppy-plush-doll-dog-doll-plush-toy-g1363296.html,Cute Husky Puppy Plush Doll Dog Doll Plush Toy,Plush & Doll
54,$3.99,$7.99,https://www.jollychic.com/p/cute-cartoon-whale-plush-doll-kids-adults-plush-toy-g1363302.html,Cute Cartoon Whale Plush Doll Kids Adults Plush Toy,Plush & Doll
48,$7.99,$14.99,https://www.jollychic.com/p/creative-cute-big-turtle-pills-small-turtles-plush-toys-g1366584.html,Creative Cute Big Turtle Pills Small Turtles Plush Toys,Plush & Doll
68,$3.99,$8.99,https://www.jollychic.com/p/five-pieces-pack-kid-s-hand-puppet-puzzle-toys-cute-cartoon-animal-finger-soft-toys-dolls-g1366586.html,Five Pieces Pack Kid's Hand Puppet Puzzle Toys Cute Cartoon Animal Finger Soft Toys & Dolls,Plush & Doll
141,$6.99,$12.99,https://www.jollychic.com/p/cute-cartoon-penguin-plush-doll-stuffed-animal-soft-toy-g1382424.html,Cute Cartoon Penguin Plush Doll Stuffed Animal Soft Toy,Plush & Doll
34,$3.99,$7.99,https://www.jollychic.com/p/6pcs-happy-family-hand-stuffed-toys-kid-s-soft-doll-toy-g1415772.html,6Pcs Happy Family Hand Stuffed Toys Kid's Soft Doll Toy,Plush & Doll
49,$2.99,$7.99,https://www.jollychic.com/p/cartoon-gibbon-doll-cute-decorative-plush-monkey-doll-g1417618.html,Cartoon Gibbon Doll Cute Decorative Plush Monkey Doll,Plush & Doll
24,$14.99,,https://www.jollychic.com/p/1-pc-cute-hippo-body-pillow-big-head-hippo-animal-doll-g1422878.html,1 Pc Cute Hippo Body Pillow Big Head Hippo Animal Doll,Plush & Doll
38,$5.99,,https://www.jollychic.com/p/kid-s-plush-doll-toy-cute-colorful-cartoon-doll-birthday-gift-g1445536.html,Kid's Plush Doll Toy Cute Colorful Cartoon Doll Birthday Gift,Plush & Doll
45,$5.99,,https://www.jollychic.com/p/kid-s-plush-doll-toy-cute-cartoon-frog-doll-kid-s-birthday-gift-g1445550.html,Kid's Plush Doll Toy Cute Cartoon Frog Doll Kid's Birthday Gift,Plush & Doll
91,$9.99,,https://www.jollychic.com/p/movable-joint-creative-wooden-puppet-toy-g1447066.html,Movable Joint Creative Wooden Puppet Toy,Plush & Doll
14,$3.99,$8.99,https://www.jollychic.com/p/toy-mouse-shape-fur-rabbit-mouse-cat-toy-catnip-pet-toys-g1452118.html,Toy Mouse Shape Fur Rabbit Mouse Cat Toy Catnip Pet Toys,Plush & Doll
4,$16.99,$24.99,https://www.jollychic.com/p/baby-s-soothing-towel-cute-animal-pattern-appease-soft-plush-baby-bibs-g1482184.html,Baby's Soothing Towel Cute Animal Pattern Appease Soft Plush Baby Bibs,Plush & Doll
39,$5.99,$10.99,https://www.jollychic.com/p/doll-1-pack-princess-changing-clothes-kids-toy-g1501932.html,Doll 1 Pack Princess Changing Clothes Kids Toy,Plush & Doll
4,$9.99,$16.99,https://www.jollychic.com/p/kid-s-merry-christmas-gift-teddy-bear-toy-for-children-birthday-gift-g1508036.html,Kid's Merry Christmas Gift Teddy Bear Toy for Children Birthday Gift,Plush & Doll
37,$5.99,$11.99,https://www.jollychic.com/p/doll-1-pack-cartoon-princess-changing-clothes-kids-toy-g1509436.html,Doll 1 Pack Cartoon Princess Changing Clothes Kids Toy,Plush & Doll
46,$7.99,$13.99,https://www.jollychic.com/p/doll-1-pack-princess-changing-clothes-cute-kids-toy-g1510692.html,Doll 1 Pack Princess Changing Clothes Cute Kids Toy,Plush & Doll
23,$6.99,$12.99,https://www.jollychic.com/p/doll-2-packs-princess-changing-clothes-cute-kids-toy-g1510696.html,Doll 2 Packs Princess Changing Clothes Cute Kids Toy,Plush & Doll
4,$7.99,$14.99,https://www.jollychic.com/p/girl-s-toy-cute-cartoon-plush-elephant-hand-puppet-game-toy-g1559784.html,Girl's Toy Cute Cartoon Plush Elephant Hand Puppet Game Toy,Plush & Doll
4,$7.99,$14.99,https://www.jollychic.com/p/girl-s-toy-cute-cartoon-plush-duck-hand-puppet-game-toy-g1559786.html,Girl's Toy Cute Cartoon Plush Duck Hand Puppet Game Toy,Plush & Doll
7,$10.99,$16.99,https://www.jollychic.com/p/baby-s-crib-mobile-toy-plush-cartoon-doll-bed-hanging-calming-toy-g1573996.html,Baby's Crib Mobile Toy Plush Cartoon Doll Bed Hanging Calming Toy,Plush & Doll
6,$4.99,$9.99,https://www.jollychic.com/p/baby-toy-cute-teddy-bear-bag-pendant-key-chain-g1574004.html,Baby Toy Cute Teddy Bear Bag Pendant Key Chain,Plush & Doll
351,$3.99,,https://www.jollychic.com/p/little-yellow-duck-plush-hand-puppet-g184223.html,Little Yellow Duck Plush Hand Puppet,Plush & Doll
954,$3.99,,https://www.jollychic.com/p/little-yellow-duck-plush-hand-puppet-g184349.html,Little Yellow Duck Plush Hand Puppet,Plush & Doll
535,$3.99,,https://www.jollychic.com/p/cute-little-tiger-plush-hand-puppet-g184399.html,Cute Little Tiger Plush Hand Puppet,Plush & Doll
437,$2.99,$3.99,https://www.jollychic.com/p/plush-yellow-cock-hen-hand-puppet-toy-g184459.html,Plush Yellow Cock/Hen Hand Puppet Toy,Plush & Doll
865,$3.99,,https://www.jollychic.com/p/elephant-plush-doll-finger-puppets-kid-toys-g184643.html,Elephant Plush Doll Finger Puppets Kid Toys,Plush & Doll
295,$3.99,,https://www.jollychic.com/p/large-sized-elephant-hand-puppet-g184895.html,Large Sized Elephant Hand Puppet,Plush & Doll
114,$3.99,,https://www.jollychic.com/p/cartoon-koala-plush-doll-finger-puppets-kid-toys-g185321.html,Cartoon Koala Plush Doll Finger Puppets Kid Toys,Plush & Doll
176,$25.99,$33.99,https://www.jollychic.com/p/ankylosaurus-cute-creative-baby-toy-g208179.html,Ankylosaurus Cute Creative Baby Toy,Plush & Doll
862,$5.99,$11.99,https://www.jollychic.com/p/teddy-bear-soft-bow-baby-toy-g211063.html,Teddy Bear Soft Bow Baby Toy,Plush & Doll
463,$21.99,,https://www.jollychic.com/p/multiple-sizes-camel-pattern-vivid-cute-baby-toy-g244205.html,Multiple Sizes Camel Pattern Vivid Cute Baby Toy,Plush & Doll
1116,$2.99,$7.99,https://www.jollychic.com/p/creative-cartoon-12-constellations-plush-pillow-g313850.html,Creative Cartoon 12 Constellations Plush Pillow,Plush & Doll
2207,$15.99,,https://www.jollychic.com/p/cartoon-ice-cream-design-soft-pillow-g313906.html,Cartoon Ice Cream Design Soft Pillow,Plush & Doll
1063,$7.99,,https://www.jollychic.com/p/monkey-cute-soft-toy-for-kids-g314570.html,Monkey Cute Soft Toy For Kids,Plush & Doll
1458,$15.99,,https://www.jollychic.com/p/bear-cute-toy-for-kids-g315404.html,Bear Cute Toy For Kids,Plush & Doll
268,$10.99,,https://www.jollychic.com/p/3-pcs-cute-animal-plush-toys-for-kids-g328018.html,3 Pcs Cute Animal Plush Toys For Kids,Plush & Doll
147,$13.99,$20.99,https://www.jollychic.com/p/cute-clown-hand-puppets-cartoon-backpack-for-kids-g335316.html,Cute Clown Hand Puppets Cartoon BackPack For Kids,Plush & Doll
191,$9.99,,https://www.jollychic.com/p/babys-toy-animal-pattern-sounding-doll-g403290.html,Babys Toy Animal Pattern Sounding Doll,Plush & Doll
238,$10.99,$16.99,https://www.jollychic.com/p/creative-colorful-dinosaur-cushion-kids-toy-g403322.html,Creative Colorful Dinosaur Cushion Kids Toy,Plush & Doll
553,$7.99,,https://www.jollychic.com/p/kids-toy-whale-cushion-plush-doll-g403404.html,Kids Toy Whale Cushion Plush Doll,Plush & Doll
283,$8.99,$21.99,https://www.jollychic.com/p/kids-toy-cute-bow-bear-plush-doll-g403430.html,Kids Toy Cute Bow Bear Plush Doll,Plush & Doll
674,$11.99,$15.99,https://www.jollychic.com/p/creative-animal-pattern-plush-doll-kids-toy-g403482.html,Creative Animal Pattern Plush Doll Kids Toy,Plush & Doll
173,$8.99,,https://www.jollychic.com/p/music-christmas-tree-doll-kids-toy-g403490.html,Music Christmas Tree Doll Kids Toy,Plush & Doll
379,$8.99,,https://www.jollychic.com/p/plush-doll-cute-bear-with-scarf-soft-creative-gift-kid-s-toy-g483794.html,Plush Doll Cute Bear With Scarf Soft Creative Gift Kid's Toy,Plush & Doll
167,$6.99,,https://www.jollychic.com/p/baby-s-pacify-towel-cartoon-pattern-creative-baby-s-toy-g488784.html,Baby's Pacify Towel Cartoon Pattern Creative Baby's Toy,Plush & Doll
190,$10.99,,https://www.jollychic.com/p/baby-s-pacify-toy-cute-animals-soft-creative-comfort-towel-baby-s-toy-g507848.html,Baby's Pacify Toy Cute Animals Soft Creative Comfort Towel Baby's Toy,Plush & Doll
110,$4.99,,https://www.jollychic.com/p/hangings-star-pattern-6-pcs-christmas-toy-g510062.html,Hangings Star Pattern 6 Pcs Christmas Toy,Plush & Doll
263,$9.99,,https://www.jollychic.com/p/plush-doll-multi-size-cute-sika-deer-soft-plush-toy-g656774.html,Plush Doll Multi Size Cute Sika Deer Soft Plush Toy,Plush & Doll
275,$6.99,$9.99,https://www.jollychic.com/p/baby-toy-multi-functional-comforting-flush-rabbit-puppet-toy-g771900.html,Baby Toy Multi Functional Comforting Flush Rabbit Puppet Toy,Plush & Doll
104,$7.99,,https://www.jollychic.com/p/happy-monkey-baby-plush-doll-cute-calm-toy-g790930.html,Happy Monkey Baby Plush Doll Cute Calm Toy,Plush & Doll
98,$11.99,,https://www.jollychic.com/p/baby-bed-bell-cute-puppy-with-sounding-paper-and-teether-baby-toy-g790946.html,Baby Bed Bell Cute Puppy With Sounding Paper And Teether Baby Toy,Plush & Doll
133,$3.99,$6.99,https://www.jollychic.com/p/baby-doll-grey-rabbit-plush-doll-cute-calm-toy-g792276.html,Baby Doll Grey Rabbit Plush Doll Cute Calm Toy,Plush & Doll
100,$3.99,$6.99,https://www.jollychic.com/p/baby-doll-red-fox-plush-doll-cute-calm-toy-g792304.html,Baby Doll Red Fox Plush Doll Cute Calm Toy,Plush & Doll
51,$5.99,$6.99,https://www.jollychic.com/p/baby-doll-pink-pig-plush-doll-cute-calm-toy-g792306.html,Baby Doll Pink Pig Plush Doll Cute Calm Toy,Plush & Doll
74,$10.99,$19.99,https://www.jollychic.com/p/kid-s-animal-doll-5-pcs-set-cute-rolling-animal-plush-doll-baby-toy-g798898.html,Kid's Animal Doll 5 Pcs Set Cute Rolling Animal Plush Doll Baby Toy,Plush & Doll
41,$37.99,,https://www.jollychic.com/p/1-piece-raccoon-doll-large-size-cute-cartoon-doll-birthday-gift-g802806.html,1 Piece Raccoon Doll Large Size Cute Cartoon Doll Birthday Gift,Plush & Doll
14,$5.99,$10.99,https://www.jollychic.com/p/1-piece-coloring-piggy-bank-cute-pig-creative-diy-gift-g817466.html,1 Piece Coloring Piggy Bank Cute Pig Creative DIY Gift,Plush & Doll
49,$10.99,,https://www.jollychic.com/p/baby-doll-cute-animal-bed-hanging-bell-baby-girl-plush-toy-g821768.html,Baby Doll Cute Animal Bed Hanging Bell Baby Girl Plush Toy,Plush & Doll
527,$12.99,,https://www.jollychic.com/p/kid-s-toy-rabbit-pattern-cute-kids-toy-g827172.html,Kid's Toy Rabbit Pattern Cute Kids Toy,Plush & Doll
14,$13.99,$19.99,https://www.jollychic.com/p/cartoon-numeral-body-pillow-cute-animal-number-shaped-plush-doll-g881306.html,Cartoon Numeral Body Pillow Cute Animal Number Shaped Plush Doll,Plush & Doll
38,$22.99,$35.99,https://www.jollychic.com/p/kid-s-toy-raccoon-pattern-1-piece-kids-toy-g897556.html,Kid's Toy Raccoon Pattern 1 Piece Kids Toy,Plush & Doll
53,$24.99,,https://www.jollychic.com/p/puppet-1-piece-animal-pattern-baby-toy-g897564.html,Puppet 1 Piece Animal Pattern Baby Toy,Plush & Doll
39,$46.99,$72.00,https://www.jollychic.com/p/cartoon-body-pillow-multifunctional-soft-owl-doll-blanket-for-children-g910736.html,Cartoon Body Pillow Multifunctional Soft Owl Doll Blanket For Children,Plush & Doll
71,$3.99,,https://www.jollychic.com/p/puppet-cartoon-1-piece-kids-toy-g913348.html,Puppet Cartoon 1 Piece Kids Toy,Plush & Doll
75,$11.99,,https://www.jollychic.com/p/plush-doll-teddy-bear-plush-toy-gift-for-girls-g935482.html,Plush Doll Teddy Bear Plush Toy Gift For Girls,Plush & Doll
41,$9.99,$10.99,https://www.jollychic.com/p/kid-s-toy-doll-1-piece-cute-kids-toy-g939442.html,Kid's Toy Doll 1 Piece Cute Kids Toy,Plush & Doll
40,$7.99,,https://www.jollychic.com/p/kid-s-toy-doll-cute-kids-toy-g939454.html,Kid's Toy Doll Cute Kids Toy,Plush & Doll
35,$7.99,,https://www.jollychic.com/p/doll-1-piece-cute-kids-toy-g939516.html,Doll 1 Piece Cute Kids Toy,Plush & Doll
55,$25.99,$31.99,https://www.jollychic.com/p/plush-doll-cute-dinosaur-pattern-kid-s-toy-gift-g939646.html,Plush Doll Cute Dinosaur Pattern Kid's Toy Gift,Plush & Doll
345,$15.99,$17.99,https://www.jollychic.com/p/kid-s-baby-doll-toys-set-kid-s-gift-box-g939662.html,Kid's Baby Doll Toys Set Kid's Gift Box,Plush & Doll
155,$7.99,,https://www.jollychic.com/p/kid-s-toy-lovely-doll-1-piece-kids-toy-g940072.html,Kid's Toy Lovely Doll 1 Piece Kids Toy,Plush & Doll
237,$23.99,$26.99,https://www.jollychic.com/p/baby-doll-set-cute-baby-girl-kid-s-toy-g940496.html,Baby Doll Set Cute Baby Girl Kid's Toy,Plush & Doll
69,$9.99,$10.99,https://www.jollychic.com/p/doll-battery-powered-walking-cute-kids-toy-g940916.html,Doll Battery Powered Walking Cute Kids Toy,Plush & Doll
53,$3.99,,https://www.jollychic.com/p/puppet-wolf-pattern-1-piece-kids-toy-g945850.html,Puppet Wolf Pattern 1 Piece Kids Toy,Plush & Doll
23,$6.99,$13.99,https://www.jollychic.com/p/kid-s-hand-grasp-toy-cute-animal-grip-strength-exercising-toy-g1021100.html,Kid's Hand Grasp Toy Cute Animal Grip Strength Exercising Toy,Plush & Doll
78,$11.99,,https://www.jollychic.com/p/plush-dolphin-soft-plush-doll-birthday-gift-g1023652.html,Plush Dolphin Soft Plush Doll Birthday Gift,Plush & Doll
43,$3.99,$7.99,https://www.jollychic.com/p/smiling-big-teeth-plush-toy-baby-pacific-dolls-exposed-teeth-animal-doll-g1042096.html,Smiling Big Teeth Plush Toy Baby Pacific Dolls Exposed Teeth Animal Doll,Plush & Doll
26,$4.99,$8.99,https://www.jollychic.com/p/plush-toy-camel-pattern-1-piece-kids-toy-g1164968.html,Plush Toy Camel Pattern 1 Piece Kids Toy,Plush & Doll
37,$3.99,$7.99,https://www.jollychic.com/p/baby-pacify-towel-cartoon-1-piece-cute-baby-toy-g1189414.html,Baby Pacify Towel Cartoon 1 Piece Cute Baby Toy,Plush & Doll
56,$23.99,,https://www.jollychic.com/p/girl-s-toy-cute-plush-dolls-calming-kid-s-gift-g1208402.html,Girl's Toy Cute Plush Dolls Calming Kid's Gift,Plush & Doll
70,$5.99,$9.99,https://www.jollychic.com/p/plush-toy-giraffe-pattern-1-piece-cute-kids-toy-g1268598.html,Plush Toy Giraffe Pattern 1 Piece Cute Kids Toy,Plush & Doll
111,$9.99,$19.99,https://www.jollychic.com/p/ddung-doll-cute-mini-doll-girl-s-toy-birthday-gift-for-children-g1288574.html,Ddung Doll Cute Mini Doll Girl's Toy Birthday Gift For Children,Plush & Doll
32,$6.99,$13.99,https://www.jollychic.com/p/1-pair-baby-s-rattle-plush-rabbit-soft-pacify-toy-g1315742.html,1 Pair Baby's Rattle Plush Rabbit Soft Pacify Toy,Plush & Doll
36,$6.99,$13.99,https://www.jollychic.com/p/plush-fox-doll-the-little-prince-s-fox-plush-toy-g1317036.html,Plush Fox Doll The Little Prince's Fox Plush Toy,Plush & Doll
