add_wish,discount_price,original_price,product_link,product_name,header_block
18,$4.99,$8.99,https://www.jollychic.com/p/hand-puppet-santa-claus-pattern-1-piece-cute-kids-toy-g1335916.html,Hand Puppet Santa Claus Pattern 1 Piece Cute Kids Toy,Plush & Doll
30,$8.99,$14.99,https://www.jollychic.com/p/royal-buy-baby-s-handbell-soft-giraffe-animal-rattles-handle-toy-g1339504.html,Royal-Buy Baby's Handbell Soft Giraffe Animal Rattles Handle Toy,Plush & Doll
50,$7.99,$14.99,https://www.jollychic.com/p/cute-rabbit-dolls-stuffed-animal-soft-plush-toy-kid-s-birthday-gift-g1342710.html,Cute Rabbit Dolls Stuffed Animal Soft Plush Toy Kid's Birthday Gift,Plush & Doll
29,$4.99,$10.99,https://www.jollychic.com/p/long-arm-monkey-dolls-stuffed-animal-soft-plush-toy-g1343398.html,Long Arm Monkey Dolls Stuffed Animal Soft Plush Toy,Plush & Doll
12,$16.99,,https://www.jollychic.com/p/knitted-doll-kid-s-soft-creative-toys-g1382536.html,Knitted Doll Kid's Soft Creative Toys,Plush & Doll
44,$16.99,,https://www.jollychic.com/p/kid-s-soothing-doll-sleeping-rabbit-baby-soft-plush-toy-g1386464.html,Kid's Soothing Doll Sleeping Rabbit Baby Soft Plush Toy,Plush & Doll
8,$9.99,,https://www.jollychic.com/p/cartoon-baby-elephant-plush-doll-cute-birthday-gift-g1417614.html,Cartoon Baby Elephant Plush Doll Cute Birthday Gift,Plush & Doll
11,$11.99,,https://www.jollychic.com/p/3-pcs-decorative-plush-flowers-cute-cartoon-flower-dolls-g1417616.html,3 Pcs Decorative Plush Flowers Cute Cartoon Flower Dolls,Plush & Doll
11,$14.99,,https://www.jollychic.com/p/1-pc-cartoon-rabbit-doll-decorative-hanging-plush-toy-g1417620.html,1 Pc Cartoon Rabbit Doll Decorative Hanging Plush Toy,Plush & Doll
13,$10.99,,https://www.jollychic.com/p/3-pcs-hide-and-seek-clowns-classic-children-toys-g1424214.html,3 Pcs Hide-And-Seek Clowns Classic Children Toys,Plush & Doll
12,$5.99,,https://www.jollychic.com/p/kid-s-plush-doll-toy-cute-cartoon-doll-kid-s-birthday-gift-g1445542.html,Kid's Plush Doll Toy Cute Cartoon Doll Kid's Birthday Gift,Plush & Doll
9,$6.99,,https://www.jollychic.com/p/kid-s-creative-cute-plush-sounding-chicken-toy-g1446974.html,Kid's Creative Cute Plush Sounding Chicken Toy,Plush & Doll
6,$9.99,,https://www.jollychic.com/p/chic-original-color-fantastic-hand-bells-to-appease-dolls-plush-baby-hand-puzzle-toys-g1452212.html,Chic Original Color Fantastic Hand Bells To Appease Dolls Plush Baby Hand Puzzle Toys,Plush & Doll
14,$12.99,$22.99,https://www.jollychic.com/p/kid-s-crocodile-throw-pillow-soft-plush-toy-creative-children-gift-g1521966.html,Kid's Crocodile Throw Pillow Soft Plush Toy Creative Children Gift,Plush & Doll
37,$9.99,$16.99,https://www.jollychic.com/p/baby-s-toy-cute-striped-bow-decoration-little-beer-doll-soft-calming-plush-toy-g1525512.html,Baby's Toy Cute Striped Bow Decoration Little Beer Doll Soft Calming Plush Toy,Plush & Doll
35,$10.99,$18.99,https://www.jollychic.com/p/baby-s-toy-cute-rabbit-doll-soft-calming-plush-toy-g1525518.html,Baby's Toy Cute Rabbit Doll Soft Calming Plush Toy,Plush & Doll
14,$9.99,$15.99,https://www.jollychic.com/p/kid-s-toy-doll-cartoon-3-pcs-cute-kids-toy-g1543302.html,Kid's Toy Doll Cartoon 3 Pcs Cute Kids Toy,Plush & Doll
3,$7.99,$14.99,https://www.jollychic.com/p/girl-s-toy-cute-plush-dog-hand-puppet-game-toy-g1559780.html,Girl's Toy Cute Plush Dog Hand Puppet Game Toy,Plush & Doll
4,$7.99,$14.99,https://www.jollychic.com/p/girl-s-toy-cute-cartoon-plush-eagle-hand-puppet-game-toy-g1559782.html,Girl's Toy Cute Cartoon Plush Eagle Hand Puppet Game Toy,Plush & Doll
8,$7.99,$14.99,https://www.jollychic.com/p/girl-s-toy-cute-cartoon-plush-panda-hand-puppet-game-toy-g1559788.html,Girl's Toy Cute Cartoon Plush Panda Hand Puppet Game Toy,Plush & Doll
3,$7.99,$14.99,https://www.jollychic.com/p/girl-s-toy-cute-cartoon-plush-bear-hand-puppet-game-toy-g1559790.html,Girl's Toy Cute Cartoon Plush Bear Hand Puppet Game Toy,Plush & Doll
7,$7.99,$14.99,https://www.jollychic.com/p/girl-s-toy-cute-cartoon-plush-rabbit-hand-puppet-game-toy-g1559792.html,Girl's Toy Cute Cartoon Plush Rabbit Hand Puppet Game Toy,Plush & Doll
2,$7.99,$14.99,https://www.jollychic.com/p/girl-s-toy-cute-cartoon-plush-santa-claus-hand-puppet-game-toy-g1559794.html,Girl's Toy Cute Cartoon Plush Santa Claus Hand Puppet Game Toy,Plush & Doll
1,$7.99,$14.99,https://www.jollychic.com/p/girl-s-toy-cute-cartoon-plush-parrot-hand-puppet-game-toy-g1559796.html,Girl's Toy Cute Cartoon Plush Parrot Hand Puppet Game Toy,Plush & Doll
32,$11.99,$19.99,https://www.jollychic.com/p/baby-toy-soft-cute-cartoon-moon-noctilucent-plush-pillow-toy-g1575062.html,Baby Toy Soft Cute Cartoon Moon Noctilucent Plush Pillow Toy,Plush & Doll
