add_wish,discount_price,original_price,product_link,product_name,header_block
1380,$8.99,$13.99,http://www.jollychic.com/p/lip-plumper-enhancer-silicone-multi-size-portable-soft-beauty-tools-g898104.html,Lip Plumper Enhancer Silicone Multi Size Portable Soft Beauty Tools,Personal Care
71,$8.99,$14.99,http://www.jollychic.com/p/ora2-toothpaste-natural-mint-refreshing-stain-clear-whitening-personal-care-g921990.html,Ora2 Toothpaste Natural Mint Refreshing Stain Clear Whitening Personal Care,Personal Care
88,$15.99,$25.99,http://www.jollychic.com/p/sara-sara-foot-cream-deodorant-anti-sweat-refresh-foot-care-g922008.html,Sara Sara Foot Cream Deodorant Anti Sweat Refresh Foot Care,Personal Care
1,$38.99,,http://www.jollychic.com/p/schwarzkopf-hair-conditioner-protection-milk-none-wash-repairing-cream-g930616.html,Schwarzkopf Hair Conditioner Protection Milk None Wash Repairing Cream,Personal Care
19,$59.00,,http://www.jollychic.com/p/schwarzkopf-hair-conditioner-rose-nourishing-repair-lubrication-repair-cream-g938562.html,Schwarzkopf Hair Conditioner Rose Nourishing Repair Lubrication Repair Cream,Personal Care
99,$32.99,,http://www.jollychic.com/p/schwarzkopf-polyflor-hair-conditioner-moisturizing-for-rough-fragrance-spray-g939294.html,Schwarzkopf Polyflor Hair Conditioner Moisturizing For Rough Fragrance Spray,Personal Care
1381,$5.99,$11.99,http://www.jollychic.com/p/hair-fixed-cream-refresh-clear-neat-smooth-hairstyling-hair-care-g940076.html,Hair Fixed Cream Refresh Clear Neat Smooth Hairstyling Hair Care,Personal Care
28,$9.99,$19.99,http://www.jollychic.com/p/kao-prettia-foam-hair-dye-natural-mocha-color-lasting-easy-diy-hairstyling-g981592.html,KAO PRETTIA Foam Hair Dye Natural Mocha Color Lasting Easy DIY Hairstyling,Personal Care
25,$11.99,$19.99,http://www.jollychic.com/p/kao-prettia-foam-hair-dye-graceful-chocolate-color-lasting-easy-diy-hairstyling-g981604.html,KAO PRETTIA Foam Hair Dye Graceful Chocolate Color Lasting Easy DIY Hairstyling,Personal Care
84,$38.99,,http://www.jollychic.com/p/kangfu-hair-drier-household-ion-hair-protective-straightening-hairstyle-g1003170.html,KangFu Hair Drier Household Ion Hair Protective Straightening Hairstyle,Personal Care
5,$25.99,,http://www.jollychic.com/p/kangfu-hair-drier-household-high-power-harmless-constant-air-hairstyle-g1003172.html,KangFu Hair Drier Household High Power Harmless Constant Air Hairstyle,Personal Care
54,$32.99,,http://www.jollychic.com/p/kangfu-hair-drier-high-power-mute-thermostatic-smooth-hairstyle-g1003180.html,KangFu Hair Drier High Power Mute Thermostatic Smooth Hairstyle,Personal Care
1280,$5.99,,http://www.jollychic.com/p/hair-wash-brush-massage-blood-circulation-improve-portable-brush-g1025532.html,Hair Wash Brush Massage Blood Circulation Improve Portable Brush,Personal Care
42,$7.99,,http://www.jollychic.com/p/8pcs-gel-toe-separators-bunion-relief-corrector-kit-health-tools-g1050762.html,8Pcs Gel Toe Separators Bunion Relief Corrector Kit Health Tools,Personal Care
268,$9.99,$15.99,http://www.jollychic.com/p/bomb-cosmetics-bath-blaster-orange-essence-oil-sweet-fragrance-bath-ball-g1056874.html,BOMB Cosmetics Bath Blaster Orange Essence Oil Sweet Fragrance Bath Ball,Personal Care
11,$24.99,,http://www.jollychic.com/p/ylg-hair-straightener-portable-candy-color-quick-drying-smooth-hairstyling-tool-g1078738.html,YLG Hair Straightener Portable Candy Color Quick Drying Smooth Hairstyling Tool,Personal Care
44,$5.99,,http://www.jollychic.com/p/cucnzn-one-pair-hand-mask-exfoliator-moisturizing-whitening-smoothing-hand-care-g1094962.html,CUCNZN One Pair Hand Mask Exfoliator Moisturizing Whitening Smoothing Hand Care,Personal Care
16,$6.99,,http://www.jollychic.com/p/nr-hair-removal-cream-deep-clean-quick-remove-gentle-personal-care-g1098002.html,NR Hair Removal Cream Deep Clean Quick Remove Gentle Personal Care,Personal Care
37,$33.99,,http://www.jollychic.com/p/hair-straightener-negative-ion-digital-display-temperature-control-hairstyling-tools-g1104166.html,Hair Straightener Negative Ion Digital Display Temperature Control Hairstyling Tools,Personal Care
26,$25.99,,http://www.jollychic.com/p/kangfu-hair-drier-foldable-high-power-household-hairstyling-tool-g1104398.html,KangFu Hair Drier Foldable High Power Household Hairstyling Tool,Personal Care
10,$63.00,,http://www.jollychic.com/p/kangfu-ion-hair-drier-high-power-mute-versatile-constant-temperature-hairstyle-g1119780.html,KangFu Ion Hair Drier High Power Mute Versatile Constant temperature Hairstyle,Personal Care
83,$6.99,,http://www.jollychic.com/p/17-pcs-set-teeth-whitening-bleaching-kit-practical-teeth-whitening-tools-kit-g1123696.html,17 Pcs/Set Teeth Whitening Bleaching Kit Practical Teeth Whitening Tools Kit,Personal Care
52,$5.99,,http://www.jollychic.com/p/3pcs-oral-care-tools-dental-cleansing-observation-reusable-tools-g1167930.html,3Pcs Oral Care Tools Dental Cleansing Observation Reusable Tools,Personal Care
22,$6.99,,http://www.jollychic.com/p/dr-rashel-hand-cream-nourishing-whitening-moisturizing-refreshing-hand-care-g1190170.html,DR.RASHEL Hand Cream Nourishing Whitening Moisturizing Refreshing Hand Care,Personal Care
67,$6.99,$10.99,http://www.jollychic.com/p/toe-board-foot-massager-butterfly-design-cushion-detoxifying-slimming-health-tool-g1193028.html,Toe Board Foot Massager Butterfly Design Cushion Detoxifying Slimming Health Tool,Personal Care
196,$5.99,,http://www.jollychic.com/p/head-scalp-massager-portable-curved-refreshing-comfy-relief-health-tool-g1209110.html,Head Scalp Massager Portable Curved Refreshing Comfy Relief Health Tool,Personal Care
12,$11.99,,http://www.jollychic.com/p/5pcs-foot-massager-ped-pal-kit-plantar-fasciitis-arch-support-health-tools-g1217590.html,5Pcs Foot Massager Ped Pal Kit Plantar Fasciitis Arch Support Health Tools,Personal Care
7,$54.00,,http://www.jollychic.com/p/hair-comb-straighten-hair-protective-antistatic-massaging-comb-g1226388.html,Hair Comb Straighten Hair Protective Antistatic Massaging Comb,Personal Care
161,$7.99,,http://www.jollychic.com/p/hair-comb-creative-household-comfy-massage-straighten-hair-brush-g1232940.html,Hair Comb Creative Household Comfy Massage Straighten Hair Brush,Personal Care
1,$18.99,,http://www.jollychic.com/p/kiladoll-one-pair-moisturizing-foot-mask-deep-nourish-soften-foot-care-g1296786.html,KilaDoll One Pair Moisturizing Foot Mask Deep Nourish Soften Foot Care,Personal Care
8379,$4.99,$8.99,http://www.jollychic.com/p/waist-twisting-disc-fitness-equipment-body-aerobic-magnetic-weight-loss-plate-g542612.html,Waist Twisting Disc Fitness Equipment Body Aerobic Magnetic Weight Loss Plate,Personal Care
202,$8.99,,http://www.jollychic.com/p/kafucard-anti-dandruff-protective-natural-solid-hair-shampoo-g331796.html,Kafucard Anti Dandruff Protective Natural Solid Hair Shampoo,Personal Care
167,$3.99,$5.99,http://www.jollychic.com/p/fresh-solid-perfume-balsam-light-fragrance-women-g348196.html,Fresh Solid Perfume Balsam Light Fragrance Women,Personal Care
679,$5.99,$11.99,http://www.jollychic.com/p/useful-rubber-roll-elastic-hair-curler-with-bag-42pcs-g357544.html,Useful Rubber Roll Elastic Hair Curler With Bag 42Pcs,Personal Care
486,$2.99,$5.99,http://www.jollychic.com/p/aloes-tender-hydrating-exfoliating-hands-mask-g365854.html,Aloes Tender Hydrating Exfoliating Hands Mask,Personal Care
44,$11.99,,http://www.jollychic.com/p/hair-care-plastic-hair-spiral-roller-5-pairs-g371778.html,Hair Care Plastic Hair Spiral Roller 5 Pairs,Personal Care
59,$5.99,,http://www.jollychic.com/p/sleep-tool-sponge-hair-curls-stick-15-pcs-g372024.html,Sleep Tool Sponge Hair Curls Stick 15 PCS,Personal Care
1689,$6.99,$10.99,http://www.jollychic.com/p/kafucard-whitening-goat-s-milk-nourishing-moist-body-cream-g373410.html,Kafucard Whitening Goat's Milk Nourishing Moist Body Cream,Personal Care
155,$10.99,,http://www.jollychic.com/p/depilatory-wax-strip-with-repair-cream-sets-g374338.html,Depilatory Wax Strip With Repair Cream Sets,Personal Care
915,$5.99,,http://www.jollychic.com/p/aloes-handcream-protective-anti-wrinkles-hands-moisturizer-g419524.html,Aloes Handcream Protective Anti Wrinkles Hands Moisturizer,Personal Care
748,$1.99,$5.99,http://www.jollychic.com/p/one-time-hair-wax-cover-white-hair-gradient-color-dye-pen-g434710.html,One-time Hair Wax Cover White Hair Gradient Color Dye Pen,Personal Care
587,$5.99,,http://www.jollychic.com/p/one-time-hair-wax-cover-white-hair-emergency-color-dye-hair-pen-g434932.html,One-time Hair Wax Cover White Hair Emergency Color Dye Hair Pen,Personal Care
418,$5.99,,http://www.jollychic.com/p/rose-body-lotion-moisturizing-body-nutrition-milk-g441762.html,Rose Body Lotion Moisturizing Body Nutrition Milk,Personal Care
191,$14.99,$18.99,http://www.jollychic.com/p/3d-rotating-body-massager-blood-circulation-healthy-device-g452830.html,3D Rotating Body Massager Blood Circulation Healthy Device,Personal Care
807,$6.99,$10.99,http://www.jollychic.com/p/hand-mask-fruit-whitening-silky-moisturizing-hand-mask-three-pairs-g454376.html,Hand Mask Fruit Whitening Silky Moisturizing Hand Mask Three Pairs,Personal Care
3368,$6.99,$8.99,http://www.jollychic.com/p/hand-cream-set-gift-package-3pcs-brightening-moisturizing-hand-care-g456308.html,Hand Cream Set Gift Package 3Pcs Brightening Moisturizing Hand Care,Personal Care
93,$5.99,,http://www.jollychic.com/p/hairstyling-tools-diy-buns-easy-natural-beauty-tools-g458864.html,Hairstyling Tools DIY Buns Easy Natural Beauty Tools,Personal Care
112,$4.99,$7.99,http://www.jollychic.com/p/dr-rashel-mixed-fruit-nutrition-hair-mask-ointment-moisturizing-conditioner-g461348.html,DR.RASHEL Mixed Fruit Nutrition Hair Mask Ointment Moisturizing Conditioner,Personal Care
445,$4.99,$7.99,http://www.jollychic.com/p/dr-rashel-castor-oil-nutrition-hair-mask-ointment-repairing-conditioner-g461388.html,DR.RASHEL Castor Oil Nutrition Hair Mask Ointment Repairing Conditioner,Personal Care
1087,$4.99,$6.99,http://www.jollychic.com/p/8pcs-hairstyling-tool-set-sponge-hair-disk-diy-easy-natural-black-beauty-tools-g467890.html,8Pcs Hairstyling Tool Set Sponge Hair Disk DIY Easy Natural Black Beauty Tools,Personal Care
173,$9.99,,http://www.jollychic.com/p/massage-comb-curly-hair-modelling-cushion-roller-comb-g488030.html,Massage Comb Curly Hair Modelling Cushion Roller Comb,Personal Care
111,$6.99,,http://www.jollychic.com/p/hair-wash-soap-green-tea-refreshing-oil-control-nourishing-shampoo-g503598.html,Hair Wash Soap Green Tea Refreshing Oil Control Nourishing Shampoo,Personal Care
350,$6.99,,http://www.jollychic.com/p/dr-rashel-soap-snail-collagen-brightening-exfoliating-moist-body-wash-g512964.html,DR.RASHEL Soap Snail Collagen Brightening Exfoliating Moist Body Wash,Personal Care
345,$6.99,,http://www.jollychic.com/p/dr-rashel-soap-seashell-collagen-smoothing-whitening-exfoliating-body-wash-g513002.html,DR.RASHEL Soap Seashell Collagen Smoothing Whitening Exfoliating Body Wash,Personal Care
144,$2.99,$6.99,http://www.jollychic.com/p/dr-rashel-soap-laurel-oil-collagen-moisturizing-refreshing-exfoliating-body-wash-g513658.html,DR.RASHEL Soap Laurel Oil Collagen Moisturizing Refreshing Exfoliating Body Wash,Personal Care
68,$5.99,$8.99,http://www.jollychic.com/p/remove-keratin-handmade-soap-moisturizing-body-care-soap-g528870.html,Remove Keratin Handmade Soap Moisturizing Body Care Soap,Personal Care
353,$5.99,$7.99,http://www.jollychic.com/p/co-e-body-wash-rose-oil-essence-whitening-moisturizing-bath-gel-g544826.html,CO.E Body Wash Rose Oil Essence Whitening Moisturizing Bath Gel,Personal Care
2136,$5.99,,http://www.jollychic.com/p/sports-gloves-half-finger-outdoor-sports-cycling-non-slip-safe-for-men-and-women-g574068.html,Sports Gloves Half Finger Outdoor Sports Cycling Non-slip Safe For Men And Women,Personal Care
635,$11.99,$22.99,http://www.jollychic.com/p/resistance-strap-upgraded-exercise-gym-muscle-buliding-elastic-tools-g579662.html,Resistance Strap Upgraded Exercise Gym Muscle Buliding Elastic Tools,Personal Care
962,$4.99,$8.99,http://www.jollychic.com/p/waist-twisting-disc-shaping-slimming-body-exercise-health-care-g609922.html,Waist Twisting Disc Shaping Slimming Body Exercise Health Care,Personal Care
722,$6.99,$10.99,http://www.jollychic.com/p/doradosun-morocco-hair-conditioner-for-curly-hair-holding-repairing-hair-care-g620888.html,DoraDoSun Morocco Hair Conditioner For Curly Hair Holding Repairing Hair Care,Personal Care
1381,$5.99,,http://www.jollychic.com/p/multifunction-body-trainer-magic-weight-loss-breast-enhancement-tools-g624996.html,Multifunction Body Trainer Magic Weight Loss Breast Enhancement Tools,Personal Care
1462,$10.99,$11.99,http://www.jollychic.com/p/running-waist-bag-belt-multi-function-marathon-outdoor-sports-yoga-pockets-g652078.html,Running Waist Bag Belt Multi Function Marathon Outdoor Sports Yoga Pockets,Personal Care
102,$18.99,$28.99,http://www.jollychic.com/p/hair-straightener-4in1-ceramic-replacable-flat-iron-hairstyling-tools-g665926.html,Hair Straightener 4in1 Ceramic Replacable Flat Iron Hairstyling Tools,Personal Care
797,$6.99,,http://www.jollychic.com/p/hair-dye-12-colors-non-toxic-temporary-unique-hairstyling-dye-g694644.html,Hair Dye 12 Colors Non Toxic Temporary Unique Hairstyling Dye,Personal Care
3,$41.99,,http://www.jollychic.com/p/hair-clipper-multi-function-recharged-sharp-safe-hairstyling-tool-g713610.html,Hair Clipper Multi Function Recharged Sharp Safe Hairstyling Tool,Personal Care
170,$7.99,$12.99,http://www.jollychic.com/p/one-pair-spa-gloves-essence-oil-reuseable-whitening-nourish-hand-care-g741348.html,One Pair Spa Gloves Essence Oil Reuseable Whitening Nourish Hand Care,Personal Care
163,$25.99,$34.99,http://www.jollychic.com/p/hair-straightner-curler-multi-function-ceramic-harmless-lasting-hairstyling-tool-g757116.html,Hair Straightner Curler Multi Function Ceramic Harmless Lasting Hairstyling Tool,Personal Care
225,$36.99,,http://www.jollychic.com/p/bath-salt-sage-essence-oil-deep-cleansing-nourish-massage-body-exfoliator-g760684.html,Bath Salt Sage Essence Oil Deep Cleansing Nourish Massage Body Exfoliator,Personal Care
84,$8.99,$15.99,http://www.jollychic.com/p/mini-facial-massager-rolling-waterproof-wrinkle-remove-face-lifting-tools-g762150.html,Mini Facial Massager Rolling Waterproof Wrinkle Remove Face Lifting Tools,Personal Care
45,$5.99,,http://www.jollychic.com/p/toe-corrector-protect-moisturizing-breathable-soft-adjustable-toe-spreader-health-care-tools-g799054.html,Toe Corrector Protect Moisturizing Breathable Soft Adjustable Toe Spreader Health Care Tools,Personal Care
46,$5.99,,http://www.jollychic.com/p/toe-corrector-protect-breathable-soft-adjustable-toe-spreader-health-care-tools-g799348.html,Toe Corrector Protect Breathable Soft Adjustable Toe Spreader Health Care Tools,Personal Care
117,$5.99,$8.99,http://www.jollychic.com/p/hand-cream-snail-essence-deep-moisture-revitalizing-hand-care-g810498.html,Hand Cream Snail Essence Deep Moisture Revitalizing Hand Care,Personal Care
344,$11.99,$15.99,http://www.jollychic.com/p/bath-blaster-rose-essence-fine-fragrance-moisture-deep-clean-bath-ball-g810524.html,Bath Blaster Rose Essence Fine Fragrance Moisture Deep Clean Bath Ball,Personal Care
33,$5.99,,http://www.jollychic.com/p/hair-removing-cream-natural-mild-soften-quick-hair-removal-g866604.html,Hair Removing Cream Natural Mild Soften Quick Hair Removal,Personal Care
31,$14.99,$22.99,http://www.jollychic.com/p/bobore-hand-cream-peony-extract-moisture-anti-ageing-hand-care-g875428.html,BOBORE Hand Cream Peony Extract Moisture Anti Ageing Hand Care,Personal Care
31,$35.99,,http://www.jollychic.com/p/schwarzkopf-hair-conditioner-supple-repairing-smoothing-hair-treatment-g928432.html,Schwarzkopf Hair Conditioner Supple Repairing Smoothing Hair Treatment,Personal Care
107,$4.99,$7.99,http://www.jollychic.com/p/2-pairs-foot-mask-wolfberry-essence-soften-exfoliating-smooth-foot-care-g928784.html,2 Pairs Foot Mask Wolfberry Essence Soften Exfoliating Smooth Foot Care,Personal Care
23,$45.99,,http://www.jollychic.com/p/schwarzkopf-liquid-oil-hair-conditioner-moisturizing-glossy-repair-hair-spray-g937486.html,Schwarzkopf Liquid Oil Hair Conditioner Moisturizing Glossy Repair Hair Spray,Personal Care
86,$16.99,$28.99,http://www.jollychic.com/p/liberta-baby-foot-2pcs-foot-masks-small-size-smooth-soften-foot-care-g944724.html,Liberta Baby Foot 2Pcs Foot Masks Small Size Smooth Soften Foot Care,Personal Care
243,$5.99,,http://www.jollychic.com/p/baimiss-body-lotion-silky-rose-moisturizing-body-cream-g954780.html,Baimiss Body Lotion Silky Rose Moisturizing Body Cream,Personal Care
57,$12.99,$25.99,http://www.jollychic.com/p/mediheal-10-pairs-hand-masks-deep-hydration-smoothing-hair-care-g975344.html,Mediheal 10 Pairs Hand Masks Deep Hydration Smoothing Hair Care,Personal Care
68,$3.99,$7.99,http://www.jollychic.com/p/5-pairs-foot-patches-pasters-anti-odor-detoxifying-moisture-foot-scare-g978206.html,5 Pairs Foot Patches Pasters Anti Odor Detoxifying Moisture Foot SCare,Personal Care
37,$5.99,$8.99,http://www.jollychic.com/p/hand-gel-mask-orange-essence-refresh-moisture-hydrating-hand-care-g980450.html,Hand Gel Mask Orange Essence Refresh Moisture Hydrating Hand Care,Personal Care
77,$3.99,$8.99,http://www.jollychic.com/p/dr-rashel-hand-wax-collagen-peel-off-exfoliating-moisture-hand-care-g1012826.html,DR RASHEL Hand Wax Collagen Peel Off Exfoliating Moisture Hand Care,Personal Care
14,$5.99,,http://www.jollychic.com/p/lameila-2pcs-hair-curler-manual-large-size-fluffy-bangs-hairstlying-tools-g1047208.html,Lameila 2Pcs Hair Curler Manual Large Size Fluffy Bangs Hairstlying Tools,Personal Care
467,$5.99,,http://www.jollychic.com/p/teeth-whitening-gel-pen-quick-stain-remove-whitening-oral-care-g1057402.html,Teeth Whitening Gel Pen Quick Stain Remove Whitening Oral Care,Personal Care
22,$11.99,$18.99,http://www.jollychic.com/p/hair-straightener-2in1-dual-use-ceramic-heated-flat-iron-hairstyling-tool-g1094168.html,Hair Straightener 2in1 Dual Use Ceramic Heated Flat Iron Hairstyling Tool,Personal Care
109,$5.99,,http://www.jollychic.com/p/60cs-salon-hair-sectioning-clips-clamp-hairdressing-styling-hair-tools-g1100310.html,60cs Salon Hair Sectioning Clips Clamp Hairdressing Styling Hair Tools,Personal Care
3,$22.99,,http://www.jollychic.com/p/hair-straightener-multi-functions-mini-temperature-control-quick-heated-household-hairstyling-tool-g1130314.html,Hair Straightener Multi Functions Mini Temperature Control Quick Heated Household Hairstyling Tool,Personal Care
3,$20.99,,http://www.jollychic.com/p/hair-straightener-professional-curling-multi-uses-heated-iron-hairstyling-tool-g1148002.html,Hair Straightener Professional Curling Multi Uses Heated Iron Hairstyling Tool,Personal Care
5,$22.99,,http://www.jollychic.com/p/hair-straightener-2in1-steaming-heated-flat-anti-static-hairstyling-tool-g1148010.html,Hair Straightener 2in1 Steaming Heated Flat Anti Static Hairstyling Tool,Personal Care
41,$10.99,,http://www.jollychic.com/p/3pcs-belly-slimming-paste-stickers-lose-weight-meso-cellulite-lifting-health-care-g1156446.html,3Pcs Belly Slimming Paste Stickers Lose Weight Meso Cellulite Lifting Health Care,Personal Care
144,$5.99,,http://www.jollychic.com/p/100pcs-depilatory-paper-leg-arm-armpit-hair-removal-nonwoven-waxing-strip-paper-g1184364.html,100Pcs Depilatory Paper Leg Arm Armpit Hair Removal Nonwoven Waxing Strip Paper,Personal Care
27,$26.99,,http://www.jollychic.com/p/hair-curler-professional-3-barrel-fast-heating-portable-curling-tool-g1192484.html,Hair Curler Professional 3 Barrel Fast Heating Portable Curling Tool,Personal Care
34,$12.99,,http://www.jollychic.com/p/hairstyling-care-tool-professional-handled-hair-care-hat-g1201084.html,Hairstyling Care Tool Professional Handled Hair Care Hat,Personal Care
8,$5.99,,http://www.jollychic.com/p/hair-comb-professional-anti-static-curved-hairstyle-massager-hair-brush-g1210922.html,Hair Comb Professional Anti Static Curved Hairstyle Massager Hair Brush,Personal Care
9,$5.99,,http://www.jollychic.com/p/2-pairs-gel-pad-foot-cushions-rapid-foot-pain-relief-health-tools-g1212098.html,2 Pairs Gel Pad Foot Cushions Rapid Foot Pain Relief Health Tools,Personal Care
4,$5.99,,http://www.jollychic.com/p/2-pairs-toe-treatment-set-soft-gel-splints-prevent-overlap-health-tools-g1212102.html,2 Pairs Toe Treatment Set Soft Gel Splints Prevent Overlap Health Tools,Personal Care
96,$7.99,,http://www.jollychic.com/p/10pcs-hair-removal-cream-armpit-legs-skin-care-painless-depilatory-paste-g1223038.html,10Pcs Hair Removal Cream Armpit Legs Skin Care Painless Depilatory Paste,Personal Care
6,$73.00,,http://www.jollychic.com/p/ultrasonic-body-skin-care-slimming-multi-functional-household-beauty-instrument-g1232292.html,Ultrasonic Body Skin Care Slimming Multi Functional Household Beauty Instrument,Personal Care
55,$5.99,,http://www.jollychic.com/p/5pcs-hand-cream-set-natural-plant-anti-wrinkle-moisturizing-smooth-hand-care-g1253630.html,5Pcs Hand Cream Set Natural Plant Anti Wrinkle Moisturizing Smooth Hand Care,Personal Care
128,$5.99,,http://www.jollychic.com/p/hair-massage-brush-salon-deep-clean-scalp-healthy-hair-comb-g1254636.html,Hair Massage Brush Salon Deep Clean Scalp Healthy Hair Comb,Personal Care
18,$4.99,$7.99,http://www.jollychic.com/p/aloe-vera-hand-cream-one-piece-natural-extract-moisture-smooth-hand-care-g1262392.html,Aloe Vera Hand Cream One Piece Natural Extract Moisture Smooth Hand Care,Personal Care
1,$25.99,,http://www.jollychic.com/p/ango-massage-oil-classic-gentle-smoothing-nourish-personal-care-g1263560.html,Ango Massage Oil Classic Gentle Smoothing Nourish Personal Care,Personal Care
36,$8.99,,http://www.jollychic.com/p/back-bandage-humpback-correcting-belt-adjustable-unisex-shaping-health-care-g1269366.html,Back Bandage Humpback Correcting Belt Adjustable Unisex Shaping Health Care,Personal Care
49,$11.99,,http://www.jollychic.com/p/hard-wax-bean-banana-aroma-beauty-salon-depilatory-dedicated-hair-removal-g1270730.html,Hard Wax Bean Banana Aroma Beauty Salon Depilatory Dedicated Hair Removal,Personal Care
6,$5.99,,http://www.jollychic.com/p/lamilee-body-lotion-sheep-oil-silky-long-lasting-whitening-moisturizing-body-care-g1274112.html,LaMilee Body Lotion Sheep Oil Silky Long Lasting Whitening Moisturizing Body Care,Personal Care
18,$7.99,,http://www.jollychic.com/p/the-saem-chocopie-hand-cream-cookies-smooth-cute-moisture-hand-care-g1280768.html,THE SAEM Chocopie Hand Cream Cookies Smooth Cute Moisture Hand Care,Personal Care
10,$15.99,,http://www.jollychic.com/p/electric-toothbrush-waterproof-whitening-oral-care-with-2pcs-brush-heads-g1284608.html,Electric Toothbrush Waterproof Whitening Oral Care With 2Pcs Brush Heads,Personal Care
13,$23.99,,http://www.jollychic.com/p/6-pcs-bath-balls-lavender-large-size-refreshing-useful-shower-ball-g1303908.html,6 Pcs Bath Balls Lavender Large Size Refreshing Useful Shower Ball,Personal Care
1072,$2.99,$5.99,http://www.jollychic.com/p/handcream-bamboo-shape-moisturizing-protective-hand-care-g404178.html,Handcream Bamboo Shape Moisturizing Protective Hand Care,Personal Care
176,$4.99,$26.99,http://www.jollychic.com/p/doradosun-revitalizing-body-lotion-with-long-lasting-fragrance-g297224.html,DoraDoSun Revitalizing Body Lotion With Long Lasting Fragrance,Personal Care
3875,$10.99,$16.99,http://www.jollychic.com/p/doradosun-remove-dead-skin-and-peeling-cuticles-heel-feet-mask-6pcs-g298002.html,DoraDoSun Remove Dead Skin And Peeling Cuticles Heel Feet Mask 6Pcs,Personal Care
95,$2.99,$6.99,http://www.jollychic.com/p/polygonum-oil-black-hair-shampoo-soap-g348492.html,Polygonum Oil Black Hair Shampoo Soap,Personal Care
177,$10.99,$16.99,http://www.jollychic.com/p/nourishment-moisturising-smooth-tender-hand-masks-5-pairs-g352188.html,Nourishment Moisturising Smooth Tender Hand Masks 5 Pairs,Personal Care
252,$8.99,,http://www.jollychic.com/p/magic-medium-curler-set-diy-iron-free-curls-18-pcs-g356972.html,Magic Medium Curler Set DIY Iron-free Curls 18 PCS,Personal Care
1014,$9.99,,http://www.jollychic.com/p/plump-chest-massage-oil-anti-sagging-g365688.html,Plump Chest Massage Oil Anti-sagging,Personal Care
729,$9.99,,http://www.jollychic.com/p/hair-fluffy-sponge-hair-pad-15-loaded-g371842.html,Hair Fluffy Sponge Hair Pad 15 Loaded,Personal Care
63,$11.99,,http://www.jollychic.com/p/simple-natural-sleeping-hair-roller-3pcs-g371924.html,Simple Natural Sleeping Hair Roller 3Pcs,Personal Care
54,$7.99,,http://www.jollychic.com/p/large-size-double-layer-hair-updo-hair-roller-2-sets-g371942.html,Large Size Double Layer Hair Updo Hair Roller 2 Sets,Personal Care
226,$14.99,,http://www.jollychic.com/p/lemon-fresh-vitality-bath-wash-gel-g373786.html,Lemon Fresh Vitality Bath Wash Gel,Personal Care
73,$8.99,$15.99,http://www.jollychic.com/p/men-s-labial-hair-depilatory-cream-body-hair-removal-g403918.html,Men's Labial Hair Depilatory Cream Body Hair Removal,Personal Care
156,$42.99,,http://www.jollychic.com/p/lemon-essential-oil-fragrance-brighten-skin-refreshing-essence-g405870.html,Lemon Essential Oil Fragrance Brighten Skin Refreshing Essence,Personal Care
291,$25.99,,http://www.jollychic.com/p/tea-tree-essential-oil-fragrance-deep-clean-remove-acne-essence-g405878.html,Tea Tree Essential Oil Fragrance Deep Clean Remove Acne Essence,Personal Care
1058,$3.99,$6.99,http://www.jollychic.com/p/milk-body-skin-nutrition-cream-whitening-moist-body-lotion-g406586.html,Milk Body Skin Nutrition Cream Whitening Moist Body Lotion,Personal Care
1070,$7.99,$14.99,http://www.jollychic.com/p/hand-care-suit-hand-cream-hand-mask-exfoliating-hand-gel-g406886.html,Hand Care Suit Hand Cream Hand Mask Exfoliating Hand Gel,Personal Care
101,$14.99,,http://www.jollychic.com/p/exfoliating-gel-gentle-moisturing-smooth-body-scrub-g428170.html,Exfoliating Gel Gentle Moisturing Smooth Body Scrub,Personal Care
