add_wish,discount_price,original_price,product_link,product_name,header_block
711,$5.99,,https://www.jollychic.com/p/snore-stopper-advanced-mouth-guard-safe-silicone-anti-bruxism-device-g636180.html,Snore Stopper Advanced Mouth Guard Safe Silicone Anti Bruxism Device,Health Care
1945,$5.99,,https://www.jollychic.com/p/body-cream-for-powerful-stretch-obesity-marks-marks-scar-removal-repair-cream-g647136.html,Body Cream For Powerful Stretch Obesity Marks Marks Scar Removal Repair Cream,Health Care
1494,$5.99,$8.99,https://www.jollychic.com/p/training-resistance-bands-x-type-rope-for-yoga-sports-chest-lifting-bands-g652074.html,Training Resistance Bands X Type Rope For Yoga Sports Chest Lifting Bands,Health Care
1719,$6.99,$9.99,https://www.jollychic.com/p/4pcs-yoga-resistance-loop-bands-physical-therapy-exercise-body-building-tools-g652076.html,4Pcs Yoga Resistance Loop Bands Physical Therapy Exercise Body Building Tools,Health Care
1652,$10.99,$11.99,https://www.jollychic.com/p/running-waist-bag-belt-multi-function-marathon-outdoor-sports-yoga-pockets-g652078.html,Running Waist Bag Belt Multi Function Marathon Outdoor Sports Yoga Pockets,Health Care
797,$3.99,,https://www.jollychic.com/p/sport-gloves-colorful-bicycle-half-finger-free-size-breathable-ourdoor-glooves-g652124.html,Sport Gloves Colorful Bicycle Half Finger Free size Breathable Ourdoor Glooves,Health Care
3072,$7.99,$11.99,https://www.jollychic.com/p/twister-plate-with-cord-resistance-bands-magnetic-waist-slimming-tools-g652126.html,Twister Plate With Cord Resistance Bands Magnetic Waist Slimming Tools,Health Care
294,$6.99,,https://www.jollychic.com/p/wrist-trainer-adjustable-strength-rehabilitation-muscle-building-tools-g652128.html,Wrist Trainer Adjustable Strength Rehabilitation Muscle Building Tools,Health Care
2915,$5.99,$7.99,https://www.jollychic.com/p/3pcs-exercise-tools-elastic-band-fat-burning-slimming-headband-wristband-set-g654832.html,3Pcs Exercise Tools Elastic Band Fat Burning Slimming Headband Wristband Set,Health Care
1045,$6.99,,https://www.jollychic.com/p/2pcs-fitness-gliding-disc-exercise-sliding-plate-flexibility-improving-tools-g684842.html,2Pcs Fitness Gliding Disc Exercise Sliding Plate Flexibility Improving Tools,Health Care
3557,$10.99,$15.99,https://www.jollychic.com/p/body-slimming-cream-leg-waist-fat-burning-shaping-massage-cream-g687924.html,Body Slimming Cream Leg Waist Fat Burning Shaping Massage Cream,Health Care
2555,$10.99,,https://www.jollychic.com/p/yoga-fitness-ball-home-pilates-thicken-no-smell-balance-sport-training-tool-g703936.html,Yoga Fitness Ball Home Pilates Thicken No Smell Balance Sport Training Tool,Health Care
116,$10.99,,https://www.jollychic.com/p/compound-essence-oil-waist-leg-slimming-massage-serum-g712164.html,Compound Essence Oil Waist Leg Slimming Massage Serum,Health Care
1111,$1.99,$5.99,https://www.jollychic.com/p/yoga-fitness-ball-home-exercise-balance-trainer-physical-weight-loss-tool-g723650.html,Yoga Fitness Ball Home Exercise Balance Trainer Physical Weight Loss Tool,Health Care
2139,$8.99,,https://www.jollychic.com/p/sports-bandage-waterproof-multi-use-tape-health-care-g743974.html,Sports Bandage Waterproof Multi Use Tape Health Care,Health Care
73,$5.99,,https://www.jollychic.com/p/cupping-therapy-one-piece-professional-silicone-cups-health-care-tool-large-size-g748262.html,Cupping Therapy One Piece Professional Silicone Cups Health Care Tool Large Size,Health Care
1757,$6.99,,https://www.jollychic.com/p/2pcs-8-shape-stretch-belt-yoga-resistance-band-body-building-tools-g753932.html,2Pcs 8 Shape Stretch Belt Yoga Resistance Band Body Building Tools,Health Care
3324,$12.99,,https://www.jollychic.com/p/4pcs-yoga-resistance-bands-stretch-belt-body-building-tools-g753934.html,4Pcs Yoga Resistance Bands Stretch Belt Body Building Tools,Health Care
354,$6.99,$10.99,https://www.jollychic.com/p/waist-support-belt-adjustable-tourmaline-self-heating-magnetic-health-care-g775750.html,Waist Support Belt Adjustable Tourmaline Self Heating Magnetic Health Care,Health Care
1053,$5.99,,https://www.jollychic.com/p/massage-yoga-ball-one-piece-crossfit-fitness-relax-relieve-fatigue-tools-g779342.html,Massage Yoga Ball One Piece Crossfit Fitness Relax Relieve Fatigue Tools,Health Care
200,$5.99,,https://www.jollychic.com/p/one-pair-silicone-heel-pads-relief-protect-health-care-tools-for-men-and-women-g797582.html,One Pair Silicone Heel Pads Relief Protect Health Care Tools For Men And Women,Health Care
165,$1.99,$5.99,https://www.jollychic.com/p/one-pair-silicone-toe-correctors-protecting-toe-spreaders-breathable-health-care-tools-g798156.html,One Pair Silicone Toe Correctors Protecting Toe Spreaders Breathable Health Care Tools,Health Care
152,$4.99,$8.99,https://www.jollychic.com/p/one-pair-toe-corrector-soft-convenient-big-toe-spreader-health-care-tools-g799258.html,One Pair Toe Corrector Soft Convenient Big Toe Spreader Health Care Tools,Health Care
91,$2.99,$7.99,https://www.jollychic.com/p/one-pair-toe-corrector-breathable-toe-spreader-comfort-forefoot-protect-health-care-tools-g799562.html,One Pair Toe Corrector Breathable Toe Spreader Comfort Forefoot Protect Health Care Tools,Health Care
700,$5.99,$11.99,https://www.jollychic.com/p/7pcs-toe-corrector-set-comfortable-toe-spreader-health-care-tools-g802552.html,7Pcs Toe Corrector Set Comfortable Toe Spreader Health Care Tools,Health Care
1868,$7.99,,https://www.jollychic.com/p/body-massage-brush-bath-spa-slimming-cellulite-relaxing-scrub-massager-g831984.html,Body Massage Brush Bath Spa Slimming Cellulite Relaxing Scrub Massager,Health Care
1521,$7.99,,https://www.jollychic.com/p/roller-ball-massager-one-piece-rotatable-9-metal-roller-ball-massage-tool-g839514.html,Roller Ball Massager One Piece Rotatable 9 Metal Roller Ball Massage Tool,Health Care
57,$5.99,,https://www.jollychic.com/p/4-pairs-silicone-toe-correctors-soft-toe-spreaders-health-care-tools-g859638.html,4 Pairs Silicone Toe Correctors Soft Toe Spreaders Health Care Tools,Health Care
296,$3.99,$8.99,https://www.jollychic.com/p/2-pairs-toe-correctors-breathable-toe-spreaders-comfortable-forefoot-protect-health-care-tools-g859702.html,2 Pairs Toe Correctors Breathable Toe Spreaders Comfortable Forefoot Protect Health Care Tools,Health Care
209,$15.99,,https://www.jollychic.com/p/tourmaline-self-heating-set-neck-guard-shoulder-pad-waist-belt-kneepad-set-g861556.html,Tourmaline Self-Heating Set Neck Guard Shoulder Pad Waist Belt Kneepad Set,Health Care
247,$11.99,$17.99,https://www.jollychic.com/p/foot-massager-mat-reflexology-walk-stone-pain-relieve-health-care-g875456.html,Foot Massager Mat Reflexology Walk Stone Pain Relieve Health Care,Health Care
318,$29.99,$47.99,https://www.jollychic.com/p/crane-beauty-belly-slimming-cream-natural-plant-extract-waist-firming-cream-g913060.html,CRANE BEAUTY Belly Slimming Cream Natural Plant Extract Waist Firming Cream,Health Care
316,$9.99,$14.99,https://www.jollychic.com/p/crane-beauty-body-slimming-cream-perfect-fat-burning-firming-slimming-cream-g913862.html,CRANE BEAUTY Body Slimming Cream Perfect Fat Burning Firming Slimming Cream,Health Care
318,$1.99,$8.99,https://www.jollychic.com/p/3-pairs-forefoot-pad-pain-relief-relax-multi-function-forefoot-inserts-g914286.html,3 Pairs Forefoot Pad Pain Relief Relax Multi Function Forefoot Inserts,Health Care
114,$3.99,$7.99,https://www.jollychic.com/p/2pcs-black-gel-heel-sleeves-massage-ball-foot-arch-support-health-care-g922634.html,2Pcs Black Gel Heel Sleeves Massage Ball Foot Arch Support Health Care,Health Care
94,$3.99,$7.99,https://www.jollychic.com/p/2pcs-gel-heel-nude-sleeves-with-massage-ball-pain-relief-for-foot-arch-support-g922638.html,2Pcs Gel Heel Nude Sleeves With Massage Ball Pain Relief For Foot Arch Support,Health Care
112,$8.99,,https://www.jollychic.com/p/2-pairs-gel-heel-white-sleeves-foot-arch-support-with-massage-ball-g922702.html,2 Pairs Gel Heel White Sleeves Foot Arch Support With Massage Ball,Health Care
363,$3.99,$8.99,https://www.jollychic.com/p/2-pairs-gel-heel-black-sleeves-with-massage-ball-for-foot-arch-support-g922704.html,2 Pairs Gel Heel Black Sleeves With Massage Ball For Foot Arch Support,Health Care
101,$3.99,$8.99,https://www.jollychic.com/p/2-pairs-gel-heel-sleeves-moisture-protective-with-massage-ball-foot-arch-support-g922706.html,2 Pairs Gel Heel Sleeves Moisture Protective With Massage Ball Foot Arch Support,Health Care
247,$19.99,$32.99,https://www.jollychic.com/p/neck-paste-useful-personal-health-caring-relieving-pressure-body-paste-g963454.html,Neck Paste Useful Personal Health Caring Relieving Pressure Body Paste,Health Care
170,$11.99,,https://www.jollychic.com/p/spring-hula-hoop-removable-elastic-weight-loss-waist-slimming-health-care-g969916.html,Spring Hula Hoop Removable Elastic Weight Loss Waist Slimming Health Care,Health Care
289,$5.99,,https://www.jollychic.com/p/neckline-slimmer-portable-neck-line-exerciser-thin-jaw-chin-massager-g970890.html,Neckline Slimmer Portable Neck Line Exerciser Thin Jaw Chin Massager,Health Care
333,$3.99,$7.99,https://www.jollychic.com/p/leg-roller-massager-portable-slimming-multi-dimensions-health-tools-g990734.html,Leg Roller Massager Portable Slimming Multi Dimensions Health Tools,Health Care
390,$11.99,$17.99,https://www.jollychic.com/p/arm-exerciser-muscle-strength-building-tightening-fat-burning-health-tools-g995068.html,Arm Exerciser Muscle Strength Building Tightening Fat Burning Health Tools,Health Care
307,$10.99,,https://www.jollychic.com/p/yoga-resistance-band-strap-one-piece-body-stretching-tightening-tools-g1012770.html,Yoga Resistance Band Strap One Piece Body Stretching Tightening Tools,Health Care
67,$6.99,,https://www.jollychic.com/p/anti-snoring-strap-breathable-face-slimming-comfy-health-tool-g1014976.html,Anti Snoring Strap Breathable Face Slimming Comfy Health Tool,Health Care
520,$10.99,,https://www.jollychic.com/p/electric-skipping-rope-device-distance-category-measure-durable-health-tools-g1023396.html,Electric Skipping Rope Device Distance Category Measure Durable Health Tools,Health Care
176,$3.99,$7.99,https://www.jollychic.com/p/4pcs-toe-corrector-adjustable-hasp-bursiti-splint-pain-relief-set-g1037162.html,4Pcs Toe Corrector Adjustable Hasp Bursiti Splint Pain Relief Set,Health Care
107,$1.99,$5.99,https://www.jollychic.com/p/body-massager-round-multi-function-relaxing-relief-slimming-health-tool-g1042194.html,Body Massager Round Multi Function Relaxing Relief Slimming Health Tool,Health Care
118,$6.99,,https://www.jollychic.com/p/2-pairs-gel-toe-separator-bunion-splint-forefeet-sleeve-cushions-g1078736.html,2 Pairs Gel Toe Separator Bunion Splint Forefeet Sleeve Cushions,Health Care
380,$5.99,,https://www.jollychic.com/p/beacuir-5pcs-belly-slimming-patch-lazy-beauty-health-patch-g1097828.html,BEACUIR 5Pcs Belly Slimming Patch Lazy Beauty Health Patch,Health Care
83,$6.99,,https://www.jollychic.com/p/one-pair-flat-foot-orthosis-silica-gel-pad-xo-correction-pain-relief-support-health-care-g1099636.html,One Pair Flat Foot Orthosis Silica Gel Pad XO Correction Pain Relief Support Health Care,Health Care
28,$42.99,$68.00,https://www.jollychic.com/p/fitpad-muscle-trainer-high-tech-muscle-charged-exercise-body-shape-relax-slimming-device-g1128346.html,FITPAD Muscle Trainer High-tech Muscle Charged Exercise Body Shape Relax Slimming Device,Health Care
314,$9.99,,https://www.jollychic.com/p/3d-face-body-roller-massager-shaping-slimming-beauty-tool-g1139088.html,3D Face Body Roller Massager Shaping Slimming Beauty Tool,Health Care
26,$5.99,,https://www.jollychic.com/p/back-scratcher-massager-one-piece-extendable-household-portable-health-tool-g1149552.html,Back Scratcher Massager One Piece Extendable Household Portable Health Tool,Health Care
65,$5.99,,https://www.jollychic.com/p/body-massager-hammer-one-piece-multi-function-pat-relaxing-health-care-g1154464.html,Body Massager Hammer One Piece Multi Function Pat Relaxing Health Care,Health Care
39,$2.99,$5.99,https://www.jollychic.com/p/body-back-massager-blood-circulation-improve-detoxifying-health-tool-g1154466.html,Body Back Massager Blood Circulation Improve Detoxifying Health Tool,Health Care
75,$5.99,,https://www.jollychic.com/p/silicone-grip-ball-strength-muscle-exercise-portable-health-tool-g1193022.html,Silicone Grip Ball Strength Muscle Exercise Portable Health Tool,Health Care
19,$1.99,$5.99,https://www.jollychic.com/p/4pcs-toes-correctors-soft-toe-spreaders-breathable-health-care-tools-g1200310.html,4Pcs Toes Correctors Soft Toe Spreaders Breathable Health Care Tools,Health Care
32,$1.99,$5.99,https://www.jollychic.com/p/2-pairs-gel-pad-foot-cushions-rapid-foot-pain-relief-health-tools-g1212098.html,2 Pairs Gel Pad Foot Cushions Rapid Foot Pain Relief Health Tools,Health Care
19,$0.99,$5.99,https://www.jollychic.com/p/2-pairs-toe-treatment-set-soft-gel-splints-prevent-overlap-health-tools-g1212102.html,2 Pairs Toe Treatment Set Soft Gel Splints Prevent Overlap Health Tools,Health Care
57,$11.99,,https://www.jollychic.com/p/5pcs-foot-massager-ped-pal-kit-plantar-fasciitis-arch-support-health-tools-g1217590.html,5Pcs Foot Massager Ped Pal Kit Plantar Fasciitis Arch Support Health Tools,Health Care
28,$18.99,$31.99,https://www.jollychic.com/p/electric-chest-massage-device-spa-effect-comfy-tools-g1232296.html,Electric Chest Massage Device SPA Effect Comfy Tools,Health Care
4,$1.99,$5.99,https://www.jollychic.com/p/2pcs-silicone-dilated-nostrils-converted-into-sleep-expanders-restrain-snore-instruments-g1232932.html,2Pcs Silicone Dilated Nostrils Converted Into Sleep Expanders Restrain Snore Instruments,Health Care
38,$5.99,,https://www.jollychic.com/p/nose-appliance-product-beauty-lifted-shape-nose-correction-beauty-tool-g1232948.html,Nose Appliance Product Beauty Lifted Shape Nose Correction Beauty Tool,Health Care
96,$5.99,,https://www.jollychic.com/p/pure-lavender-essence-oil-anti-acne-relaxing-massage-oil-g1256010.html,Pure Lavender Essence Oil Anti Acne Relaxing Massage Oil,Health Care
31,$9.99,$16.99,https://www.jollychic.com/p/6pcs-hand-gripper-silicone-ring-exercise-for-wrist-and-finger-fitness-training-g1299112.html,6Pcs Hand Gripper Silicone Ring Exercise For Wrist and Finger Fitness Training,Health Care
57,$5.99,$12.99,https://www.jollychic.com/p/facial-massager-aatural-jade-rolling-tightening-slimming-face-tool-g1345210.html,Facial Massager Aatural Jade Rolling Tightening Slimming Face Tool,Health Care
21,$5.99,$12.99,https://www.jollychic.com/p/1-pair-scraping-tool-taiji-therapy-stone-skinscraping-natural-stone-massage-tools-g1346482.html,1 Pair Scraping Tool Taiji Therapy Stone Skinscraping Natural Stone Massage Tools,Health Care
37,$1.99,$7.99,https://www.jollychic.com/p/2-pairs-silicone-arch-support-insoles-arch-pad-for-flat-foot-plantar-fasciitis-g1354356.html,2 Pairs Silicone Arch Support Insoles Arch Pad for Flat Foot Plantar Fasciitis,Health Care
40,$4.99,$11.99,https://www.jollychic.com/p/soapmeet-cool-floral-essencial-oil-smooth-anti-itch-massage-oil-g1356662.html,SOAPMEET Cool Floral Essencial Oil Smooth Anti Itch Massage Oil,Health Care
49,$13.99,,https://www.jollychic.com/p/body-massage-oil-ginger-root-extract-revitalizing-smooth-personal-care-g1372294.html,Body Massage Oil Ginger Root Extract Revitalizing Smooth Personal Care,Health Care
38,$13.99,,https://www.jollychic.com/p/body-massage-oil-tightening-deep-moisture-smooth-personal-care-g1372298.html,Body Massage Oil Tightening Deep Moisture Smooth Personal Care,Health Care
55,$5.99,$11.99,https://www.jollychic.com/p/royal-buy-100pcs-detox-foot-patch-pads-detoxify-toxins-fit-health-care-g1375962.html,Royal-Buy 100Pcs Detox Foot Patch Pads Detoxify Toxins Fit Health Care,Health Care
10,$9.99,$16.99,https://www.jollychic.com/p/foot-cushion-hanging-travel-portable-relaxing-versatile-health-care-g1378918.html,Foot Cushion Hanging Travel Portable Relaxing Versatile Health Care,Health Care
16,$37.99,,https://www.jollychic.com/p/royal-buy-slim-exercise-wrist-belt-thigh-massage-vibration-electronic-fitness-system-g1419488.html,Royal-Buy Slim Exercise Wrist Belt Thigh Massage Vibration Electronic Fitness System,Health Care
10,$32.99,,https://www.jollychic.com/p/royal-buy-electric-head-massager-relax-acupuncture-points-health-care-g1419854.html,Royal-Buy Electric Head Massager Relax Acupuncture Points Health Care,Health Care
9,$14.99,,https://www.jollychic.com/p/royal-buy-fingernail-toenail-corrector-professional-protecting-health-care-g1421334.html,Royal-Buy Fingernail Toenail Corrector Professional Protecting Health Care,Health Care
26,$8.99,,https://www.jollychic.com/p/royal-buy-anti-wrinkle-v-line-half-face-cheek-slimming-strap-chin-face-slim-mask-belt-g1423142.html,Royal-Buy Anti Wrinkle V Line Half Face Cheek Slimming Strap Chin Face Slim Mask Belt,Health Care
9,$58.00,,https://www.jollychic.com/p/yousure-microcurrent-thin-face-device-beauty-tool-g1423166.html,YOUSURE Microcurrent Thin Face Device Beauty Tool,Health Care
15,$8.99,,https://www.jollychic.com/p/body-massager-slimming-weight-loss-relax-roller-arch-massager-g1445646.html,Body Massager Slimming Weight Loss Relax Roller Arch Massager,Health Care
7,$82.00,,https://www.jollychic.com/p/2pcs-heath-tools-facial-cleansing-instrument-and-face-massager-g1456904.html,2Pcs Heath Tools Facial Cleansing Instrument And Face Massager,Health Care
7,$44.99,,https://www.jollychic.com/p/elhead-massage-feet-relax-acupuncture-points-health-care-g1456906.html,ElHead Massage Feet Relax Acupuncture Points Health Care,Health Care
10,$6.99,,https://www.jollychic.com/p/4-pairs-gel-toe-separators-bunion-corrector-protector-spacer-for-hallux-valgus-foot-g1467680.html,4 Pairs Gel Toe Separators Bunion Corrector Protector Spacer For Hallux Valgus Foot,Health Care
16,$4.99,$9.99,https://www.jollychic.com/p/body-massager-slimming-detoxifying-porable-health-tool-g1487212.html,Body Massager Slimming Detoxifying Porable Health Tool,Health Care
10,$9.99,,https://www.jollychic.com/p/hip-lift-tighten-moisturizing-cream-hip-shaping-lift-cream-g1536392.html,Hip Lift Tighten Moisturizing Cream Hip Shaping Lift Cream,Health Care
8,$10.99,,https://www.jollychic.com/p/slimming-body-green-tea-paste-tightening-health-tool-g1536394.html,Slimming Body Green Tea Paste Tightening Health Tool,Health Care
2,$9.99,,https://www.jollychic.com/p/hip-firming-ginger-moisturizing-cream-hip-shaping-lift-cream-g1536398.html,Hip Firming Ginger Moisturizing Cream Hip Shaping Lift Cream,Health Care
15,$9.99,,https://www.jollychic.com/p/hip-lift-up-moisturizing-tighten-cream-hip-shaping-lift-cream-g1536402.html,Hip Lift Up Moisturizing Tighten Cream Hip Shaping Lift Cream,Health Care
5,$9.99,,https://www.jollychic.com/p/beard-growth-repaired-and-activation-essential-oil-g1536404.html,Beard Growth Repaired And Activation Essential Oil,Health Care
19,$9.99,,https://www.jollychic.com/p/leg-arm-shaping-strap-one-piece-adhesive-strong-slimming-health-tool-g1539654.html,Leg Arm Shaping Strap One Piece Adhesive Strong Slimming Health Tool,Health Care
10,$8.99,,https://www.jollychic.com/p/body-slimming-gel-green-tea-body-burning-shaping-gel-g1555228.html,Body Slimming Gel Green Tea Body Burning Shaping Gel,Health Care
10,$8.99,,https://www.jollychic.com/p/capsicum-body-slimming-cream-tightening-shaping-massage-cream-g1555232.html,Capsicum Body Slimming Cream Tightening Shaping Massage Cream,Health Care
6,$10.99,,https://www.jollychic.com/p/innovative-massage-roller-chain-body-relaxation-slimming-health-tool-g1579606.html,Innovative Massage Roller Chain Body Relaxation Slimming Health Tool,Health Care
2,$8.99,,https://www.jollychic.com/p/aichun-mosquito-repellent-cream-refresh-cooling-soothing-cream-g1581404.html,Aichun Mosquito Repellent Cream Refresh Cooling Soothing Cream,Health Care
19,$8.99,,https://www.jollychic.com/p/aichun-ginger-slimming-gel-tightening-body-shaping-massage-gel-g1581450.html,Aichun Ginger Slimming Gel Tightening Body Shaping Massage Gel,Health Care
3,$10.99,,https://www.jollychic.com/p/aichun-ginger-hip-lifting-massage-cream-firming-shaping-cream-g1591296.html,Aichun Ginger Hip Lifting Massage Cream Firming Shaping Cream,Health Care
1616,$10.99,,https://www.jollychic.com/p/3pcs-facial-roller-nose-straightening-shaping-slimming-facial-massager-set-g273981.html,3Pcs Facial Roller Nose Straightening Shaping Slimming Facial Massager Set,Health Care
2095,$2.99,$4.99,https://www.jollychic.com/p/lameila-head-cleansing-hair-brush-massage-comb-g287456.html,Lameila Head Cleansing Hair Brush Massage Comb,Health Care
4072,$6.99,,https://www.jollychic.com/p/waist-tight-oil-slimming-belly-g351126.html,Waist Tight Oil Slimming Belly,Health Care
386,$7.99,$17.99,https://www.jollychic.com/p/shins-slimming-smooth-firming-cream-g363664.html,Shins Slimming Smooth Firming Cream,Health Care
1546,$5.99,$13.99,https://www.jollychic.com/p/hip-shaping-tightening-hip-massaging-cream-95ml-g363700.html,Hip Shaping Tightening Hip Massaging Cream 95ML,Health Care
653,$8.99,$20.99,https://www.jollychic.com/p/slimming-waist-massaging-cream-for-charming-body-g363708.html,Slimming Waist Massaging Cream For Charming Body,Health Care
1030,$12.99,,https://www.jollychic.com/p/firming-shaping-slimming-arm-massage-cream-g363934.html,Firming Shaping Slimming Arm Massage Cream,Health Care
1498,$5.99,$13.99,https://www.jollychic.com/p/slimming-firming-body-gel-fat-burning-g363950.html,Slimming Firming Body Gel Fat Burning,Health Care
4120,$1.99,$8.99,https://www.jollychic.com/p/tightening-belly-patches-slimming-paster-5pcs-g365620.html,Tightening Belly Patches Slimming Paster 5Pcs,Health Care
446,$7.99,$15.99,https://www.jollychic.com/p/breast-beauty-massaging-cream-for-bust-augmentation-g365788.html,Breast Beauty Massaging Cream For Bust Augmentation,Health Care
441,$4.99,$13.99,https://www.jollychic.com/p/compact-beauty-nose-nose-care-essential-oils-g365842.html,Compact Beauty Nose Nose Care Essential Oils,Health Care
894,$3.99,$10.99,https://www.jollychic.com/p/face-slimming-mask-strong-adhesive-stereo-cutting-masque-g400454.html,Face Slimming Mask Strong Adhesive Stereo Cutting Masque,Health Care
104,$14.99,$32.99,https://www.jollychic.com/p/slimming-shape-body-essential-oil-soothing-tender-skin-g406194.html,Slimming Shape Body Essential Oil Soothing Tender Skin,Health Care
187,$5.99,,https://www.jollychic.com/p/finger-roller-massage-device-portable-reduce-fat-beauty-tools-g452156.html,Finger Roller Massage Device Portable Reduce Fat Beauty Tools,Health Care
351,$5.99,,https://www.jollychic.com/p/rotating-massage-device-seven-bead-shaping-comfortable-beauty-health-care-g452554.html,Rotating Massage Device Seven-Bead Shaping Comfortable Beauty Health Care,Health Care
31,$5.99,,https://www.jollychic.com/p/health-care-device-body-pat-healthy-tool-g452676.html,Health Care Device Body Pat Healthy Tool,Health Care
737,$5.99,,https://www.jollychic.com/p/massage-brush-body-detoxifying-sliming-health-tools-g452752.html,Massage Brush Body Detoxifying Sliming Health Tools,Health Care
199,$14.99,$18.99,https://www.jollychic.com/p/3d-rotating-body-massager-blood-circulation-healthy-device-g452830.html,3D Rotating Body Massager Blood Circulation Healthy Device,Health Care
1071,$2.99,$7.99,https://www.jollychic.com/p/multifunction-gripping-rope-body-building-health-care-tool-g453060.html,Multifunction Gripping Rope Body Building Health Care Tool,Health Care
90,$2.99,$5.99,https://www.jollychic.com/p/3d-neck-massager-anti-fatigue-multifunction-health-care-tool-g453122.html,3D Neck Massager Anti Fatigue Multifunction Health Care Tool,Health Care
204,$8.99,$11.99,https://www.jollychic.com/p/rotating-massager-face-lifting-slimming-beauty-tool-g453350.html,Rotating Massager Face Lifting Slimming Beauty Tool,Health Care
368,$5.99,,https://www.jollychic.com/p/rotating-massager-multifunction-shin-face-arms-slimming-tool-g453486.html,Rotating Massager Multifunction Shin Face Arms Slimming Tool,Health Care
315,$5.99,,https://www.jollychic.com/p/linear-shape-gripping-rope-multifunction-body-building-tool-g453610.html,Linear Shape Gripping Rope Multifunction Body Building Tool,Health Care
46,$5.99,,https://www.jollychic.com/p/multifunction-massage-device-silicone-health-tools-g453722.html,Multifunction Massage Device Silicone Health Tools,Health Care
4729,$15.99,$23.99,https://www.jollychic.com/p/11-pcs-set-resistance-bands-workout-exercise-yoga-crossfit-fitness-rope-g557956.html,11 Pcs/Set Resistance Bands Workout Exercise Yoga Crossfit Fitness Rope,Health Care
228,$25.99,,https://www.jollychic.com/p/resistance-band-fabric-strech-fat-burning-muscle-buliding-elastic-strap-g579708.html,Resistance Band Fabric Strech Fat Burning Muscle Buliding Elastic Strap,Health Care
5408,$5.99,$11.99,https://www.jollychic.com/p/elastic-band-waist-fat-burning-body-buliding-slimming-exercise-tool-g588220.html,Elastic Band Waist Fat Burning Body Buliding Slimming Exercise Tool,Health Care
1483,$5.99,,https://www.jollychic.com/p/1-pc-adjustable-yoga-resistance-bands-chest-expander-tools-g600430.html,1 Pc Adjustable Yoga Resistance Bands Chest Expander Tools,Health Care
864,$2.99,$5.99,https://www.jollychic.com/p/slimming-massage-cream-for-body-fat-burning-shaping-cream-g602266.html,Slimming Massage Cream For Body Fat Burning Shaping Cream,Health Care
1657,$11.99,,https://www.jollychic.com/p/pilates-circle-magic-fitness-weight-loss-breast-enhancement-yoga-ring-g622924.html,Pilates Circle Magic Fitness Weight Loss Breast Enhancement Yoga Ring,Health Care
1498,$5.99,,https://www.jollychic.com/p/multifunction-body-trainer-magic-weight-loss-breast-enhancement-tools-g624996.html,Multifunction Body Trainer Magic Weight Loss Breast Enhancement Tools,Health Care
1565,$4.99,$6.99,https://www.jollychic.com/p/3pcs-chest-expander-headband-wristband-fitness-slimming-value-set-g652122.html,3Pcs Chest Expander Headband Wristband Fitness Slimming Value Set,Health Care
