add_wish,discount_price,original_price,product_link,product_name,header_block
2047,$4.99,$6.99,https://www.jollychic.com/p/legs-oil-slimming-essential-oil-g351356.html,Legs Oil Slimming Essential Oil,Health Care
943,$9.99,,https://www.jollychic.com/p/dr-rashel-ginseng-slimming-cream-moisturizing-whitening-firming-cream-g517588.html,DR.RASHEL Ginseng Slimming Cream Moisturizing Whitening Firming Cream,Health Care
7202,$2.99,$5.99,https://www.jollychic.com/p/5-pieces-belly-patch-wonder-weight-loss-fat-burning-slimming-fit-patch-g542808.html,5 Pieces Belly Patch Wonder Weight Loss Fat Burning Slimming Fit Patch,Health Care
1716,$7.99,,https://www.jollychic.com/p/stop-snoring-bandage-adjustable-jaw-support-breathable-bandage-g547086.html,Stop Snoring Bandage Adjustable Jaw Support Breathable Bandage,Health Care
6526,$5.99,$7.99,https://www.jollychic.com/p/twist-board-lady-thin-waist-home-fitness-equipment-loss-weight-twister-g550660.html,Twist Board Lady Thin Waist Home Fitness Equipment Loss Weight Twister,Health Care
1178,$1.99,$4.99,https://www.jollychic.com/p/foot-massage-magnetic-toe-rings-magnetic-therapy-fast-lose-weight-2pcs-set-g571616.html,Foot Massage Magnetic Toe Rings Magnetic Therapy Fast Lose Weight 2Pcs/set,Health Care
6279,$3.99,$5.99,https://www.jollychic.com/p/sports-gloves-riding-outdoor-sports-half-finger-non-slip-safe-for-men-and-women-g574170.html,Sports Gloves Riding Outdoor Sports Half Finger Non-slip Safe For Men And Women,Health Care
848,$15.99,$20.99,https://www.jollychic.com/p/suspension-training-band-body-slimming-household-exercise-elastic-band-g575648.html,Suspension Training Band Body Slimming Household Exercise Elastic Band,Health Care
678,$11.99,$22.99,https://www.jollychic.com/p/resistance-strap-upgraded-exercise-gym-muscle-buliding-elastic-tools-g579662.html,Resistance Strap Upgraded Exercise Gym Muscle Buliding Elastic Tools,Health Care
2969,$2.99,$5.99,https://www.jollychic.com/p/nose-massager-2pcs-lifting-up-shaping-straightening-beauty-tools-g583318.html,Nose Massager 2Pcs Lifting Up Shaping Straightening Beauty Tools,Health Care
778,$5.99,,https://www.jollychic.com/p/40-pcs-slimming-lose-weight-patch-traditional-navel-stick-g600450.html,40 Pcs Slimming Lose Weight Patch Traditional Navel Stick,Health Care
1082,$4.99,$8.99,https://www.jollychic.com/p/waist-twisting-disc-shaping-slimming-body-exercise-health-care-g609922.html,Waist Twisting Disc Shaping Slimming Body Exercise Health Care,Health Care
440,$6.99,$13.99,https://www.jollychic.com/p/wrist-strength-exerciser-adjustable-perfect-forearm-strengthener-g610268.html,Wrist Strength Exerciser Adjustable Perfect Forearm Strengthener,Health Care
1108,$11.99,,https://www.jollychic.com/p/twisting-plate-fitness-stability-exercise-waist-shaping-balance-board-g622928.html,Twisting Plate Fitness Stability Exercise Waist Shaping Balance Board,Health Care
883,$6.99,$10.99,https://www.jollychic.com/p/2pairs-leg-arm-shaper-slimming-fat-burning-fit-daily-wear-sleeves-g713594.html,2Pairs Leg Arm Shaper Slimming Fat Burning Fit Daily Wear Sleeves,Health Care
2555,$5.99,,https://www.jollychic.com/p/2pcs-arm-sleeve-weight-loss-slimming-shaping-tool-g713596.html,2Pcs Arm Sleeve Weight Loss Slimming Shaping Tool,Health Care
7538,$5.99,,https://www.jollychic.com/p/back-bandage-humpback-correcting-belt-adjustable-fabric-shaping-health-care-g743984.html,Back Bandage Humpback Correcting Belt Adjustable Fabric Shaping Health Care,Health Care
520,$8.99,$12.99,https://www.jollychic.com/p/vertebra-tractor-inflatable-backbone-protection-relaxing-health-care-g743986.html,Vertebra Tractor Inflatable Backbone Protection Relaxing Health Care,Health Care
108,$5.99,,https://www.jollychic.com/p/cupping-therapy-one-piece-professional-silicone-cups-health-care-tool-small-size-g748334.html,Cupping Therapy One Piece Professional Silicone Cups Health Care Tool Small Size,Health Care
780,$5.99,,https://www.jollychic.com/p/hip-lift-massage-cream-buttocks-enhancement-enlargement-cream-g765510.html,Hip Lift Massage Cream Buttocks Enhancement Enlargement Cream,Health Care
3031,$5.99,,https://www.jollychic.com/p/crew-toe-socks-anti-skid-colorful-yoga-massage-health-care-tools-g775180.html,Crew Toe Socks Anti Skid Colorful Yoga Massage Health Care Tools,Health Care
411,$8.99,,https://www.jollychic.com/p/facial-massager-rolling-wrinkle-remove-multi-uses-face-lifting-beauty-tools-g775244.html,Facial Massager Rolling Wrinkle Remove Multi Uses Face Lifting Beauty Tools,Health Care
1527,$5.99,,https://www.jollychic.com/p/one-pair-silicone-heel-socks-heel-protecting-moisturizing-shock-absorption-health-care-tools-g797672.html,One Pair Silicone Heel Socks Heel Protecting Moisturizing Shock Absorption Health Care Tools,Health Care
125,$7.99,,https://www.jollychic.com/p/2-pairs-silicone-big-toe-correctors-soft-toe-spreaders-health-care-tool-g797908.html,2 Pairs Silicone Big Toe Correctors Soft Toe Spreaders Health Care Tool,Health Care
134,$5.99,,https://www.jollychic.com/p/one-pair-silicone-toe-corrector-soft-big-toe-spreader-convenient-health-care-tools-g798726.html,One Pair Silicone Toe Corrector Soft Big Toe Spreader Convenient Health Care Tools,Health Care
64,$1.99,$5.99,https://www.jollychic.com/p/one-pair-toe-corrector-breathable-toe-spreader-comfort-forefoot-protect-health-care-tools-g799448.html,One Pair Toe Corrector Breathable Toe Spreader Comfort Forefoot Protect Health Care Tools,Health Care
629,$3.99,$6.99,https://www.jollychic.com/p/one-pair-toe-corrector-breathable-toe-spreader-comfort-forefoot-protect-health-care-tools-g799510.html,One Pair Toe Corrector Breathable Toe Spreader Comfort Forefoot Protect Health Care Tools,Health Care
1091,$8.99,$13.99,https://www.jollychic.com/p/back-stretcher-one-piece-lumbar-support-spine-pain-relief-health-care-g817158.html,Back Stretcher One Piece Lumbar Support Spine Pain Relief Health Care,Health Care
200,$15.99,$24.99,https://www.jollychic.com/p/yoga-mat-one-piece-massage-pain-relieve-acupressure-cushion-mat-g847396.html,Yoga Mat One Piece Massage Pain Relieve Acupressure Cushion Mat,Health Care
766,$5.99,,https://www.jollychic.com/p/waist-belt-tourmaline-self-heating-magnetic-therapy-health-care-tool-g859266.html,Waist Belt Tourmaline Self-Heating Magnetic Therapy Health Care Tool,Health Care
339,$5.99,,https://www.jollychic.com/p/one-pair-knee-pads-tourmaline-self-heating-magnetic-therapy-health-care-tools-g859268.html,One Pair Knee Pads Tourmaline Self-Heating Magnetic Therapy Health Care Tools,Health Care
486,$6.99,,https://www.jollychic.com/p/foot-massage-mat-small-size-reflexology-walk-cobblestone-health-care-g875454.html,Foot Massage Mat Small Size Reflexology Walk Cobblestone Health Care,Health Care
1626,$6.99,$13.99,https://www.jollychic.com/p/lip-plumper-enhancer-silicone-multi-size-portable-soft-beauty-tools-g898104.html,Lip Plumper Enhancer Silicone Multi Size Portable Soft Beauty Tools,Health Care
91,$3.99,$7.99,https://www.jollychic.com/p/2pcs-gel-heel-sleeves-white-with-massage-ball-foot-arch-support-value-set-g922642.html,2Pcs Gel Heel Sleeves White With Massage Ball Foot Arch Support Value Set,Health Care
138,$3.99,$8.99,https://www.jollychic.com/p/2-pairs-gel-heel-sleeves-pain-relief-moist-with-massage-ball-foot-arch-support-g922700.html,2 Pairs Gel Heel Sleeves Pain Relief Moist With Massage Ball Foot Arch Support,Health Care
620,$7.99,,https://www.jollychic.com/p/1-pair-silicone-toe-corrector-toe-spreaders-silicone-gel-pads-for-men-and-women-g928206.html,1 Pair Silicone Toe Corrector Toe Spreaders Silicone Gel Pads For Men and Women,Health Care
277,$19.99,$38.99,https://www.jollychic.com/p/kao-megrhythm-good-night-steam-patc-sholder-patch-g956322.html,Kao MegRhythm Good-Night Steam Patc Sholder Patch,Health Care
190,$3.99,$7.99,https://www.jollychic.com/p/4pcs-gel-toe-sleeves-toe-separator-kit-protective-soft-comfy-health-care-g959740.html,4Pcs Gel Toe Sleeves Toe Separator Kit Protective Soft Comfy Health Care,Health Care
2457,$5.99,,https://www.jollychic.com/p/3pcs-nose-up-clips-slimming-shaping-natural-straightening-bridge-beauty-tools-g969910.html,3Pcs Nose Up Clips Slimming Shaping Natural Straightening Bridge Beauty Tools,Health Care
933,$3.99,$6.99,https://www.jollychic.com/p/body-pat-stick-one-piece-massage-multi-function-health-tool-health-care-g969912.html,Body Pat Stick One Piece Massage Multi Function Health Tool Health Care,Health Care
3040,$15.99,,https://www.jollychic.com/p/chest-orthoses-large-size-humpback-rehabilitation-back-posture-correcting-belt-g978216.html,Chest Orthoses Large Size Humpback Rehabilitation Back Posture Correcting Belt,Health Care
2027,$3.99,$6.99,https://www.jollychic.com/p/nail-repairing-serum-for-damaged-nails-biotechnology-gentle-smoothing-essence-g1023392.html,Nail Repairing Serum For Damaged Nails Biotechnology Gentle Smoothing Essence,Health Care
324,$5.99,,https://www.jollychic.com/p/3pcs-anti-snoring-nose-clip-soft-breathable-portable-health-tools-g1023410.html,3Pcs Anti Snoring Nose Clip Soft Breathable Portable Health Tools,Health Care
350,$7.99,$12.99,https://www.jollychic.com/p/body-slimming-cream-natural-plant-detoxifying-tightening-massage-cream-g1027894.html,Body Slimming Cream Natural Plant Detoxifying Tightening Massage Cream,Health Care
4822,$4.99,$7.99,https://www.jollychic.com/p/massage-cream-stretch-marks-remove-tightening-smooth-cream-g1032682.html,Massage Cream Stretch Marks Remove Tightening Smooth Cream,Health Care
69,$5.99,,https://www.jollychic.com/p/3-pairs-toe-guard-shield-spacers-fast-pain-relief-health-tools-g1056410.html,3 Pairs Toe Guard Shield Spacers Fast Pain Relief Health Tools,Health Care
1364,$6.99,,https://www.jollychic.com/p/neckline-massager-thin-jaw-double-neckline-slimmer-skin-care-tool-g1060826.html,Neckline Massager Thin Jaw Double Neckline Slimmer Skin Care Tool,Health Care
85,$1.99,$7.99,https://www.jollychic.com/p/2-pairs-toe-separators-set-unisex-professional-health-care-tools-g1078748.html,2 Pairs Toe Separators Set Unisex Professional Health Care Tools,Health Care
82,$5.99,,https://www.jollychic.com/p/abs-muscle-toning-waist-band-fitness-gym-weight-loss-slimming-band-g1099640.html,ABS Muscle Toning Waist Band Fitness Gym Weight Loss Slimming Band,Health Care
89,$17.99,$26.99,https://www.jollychic.com/p/electronic-acupuncture-massage-pen-meridians-laser-magnet-therapy-health-care-g1123340.html,Electronic Acupuncture Massage Pen Meridians Laser Magnet Therapy Health Care,Health Care
181,$0.99,$5.99,https://www.jollychic.com/p/eye-shade-soft-adorable-panda-shape-cute-comfy-eye-patch-g1136048.html,Eye Shade Soft Adorable Panda Shape Cute Comfy Eye Patch,Health Care
525,$6.99,$14.99,https://www.jollychic.com/p/sixplus-mini-massage-device-portable-butterfly-shaped-multi-functional-massage-body-shape-device-g1139522.html,SIXPLUS Mini Massage Device Portable Butterfly Shaped Multi-Functional Massage Body Shape Device,Health Care
239,$6.99,$10.99,https://www.jollychic.com/p/body-massager-hammer-one-piece-double-sided-relief-relaxing-health-care-g1149560.html,Body Massager Hammer One Piece Double Sided Relief Relaxing Health Care,Health Care
105,$10.99,,https://www.jollychic.com/p/3pcs-belly-slimming-paste-stickers-lose-weight-meso-cellulite-lifting-health-care-g1156446.html,3Pcs Belly Slimming Paste Stickers Lose Weight Meso Cellulite Lifting Health Care,Health Care
318,$2.99,$5.99,https://www.jollychic.com/p/10pcs-magic-slimming-body-tea-paster-stickers-tightening-health-tool-g1167768.html,10Pcs Magic Slimming Body Tea Paster Stickers Tightening Health Tool,Health Care
322,$5.99,,https://www.jollychic.com/p/face-slimming-belt-chin-support-lifting-anti-snoring-band-strap-g1182846.html,Face Slimming Belt Chin Support Lifting Anti Snoring Band Strap,Health Care
39,$1.99,$5.99,https://www.jollychic.com/p/body-roller-massager-portable-blood-circulation-improve-health-tool-g1184360.html,Body Roller Massager Portable Blood Circulation Improve Health Tool,Health Care
78,$5.99,,https://www.jollychic.com/p/body-massager-portable-natural-resin-body-back-scraping-plate-health-tool-g1184512.html,Body Massager Portable Natural Resin Body Back Scraping Plate Health Tool,Health Care
369,$5.99,,https://www.jollychic.com/p/straighten-teeth-tray-retainer-crowded-irregular-teeth-corrector-g1184908.html,Straighten Teeth Tray Retainer Crowded Irregular Teeth Corrector,Health Care
179,$10.99,,https://www.jollychic.com/p/toe-board-foot-massager-butterfly-design-cushion-detoxifying-slimming-health-tool-g1193028.html,Toe Board Foot Massager Butterfly Design Cushion Detoxifying Slimming Health Tool,Health Care
1023,$1.99,$5.99,https://www.jollychic.com/p/head-scalp-massager-portable-curved-refreshing-comfy-relief-health-tool-g1209110.html,Head Scalp Massager Portable Curved Refreshing Comfy Relief Health Tool,Health Care
387,$5.99,,https://www.jollychic.com/p/facial-neck-massager-2in1-one-piece-tightening-slimming-health-tool-g1217598.html,Facial Neck Massager 2in1 One Piece Tightening Slimming Health Tool,Health Care
106,$7.99,,https://www.jollychic.com/p/waist-twisting-disc-fitness-equipment-body-aerobic-magnetic-weight-loss-plate-g1223852.html,Waist Twisting Disc Fitness Equipment Body Aerobic Magnetic Weight Loss Plate,Health Care
28,$68.00,,https://www.jollychic.com/p/3pieces-set-wireless-muscle-trainer-instrument-g1232934.html,3Pieces/Set Wireless Muscle Trainer Instrument,Health Care
94,$5.99,,https://www.jollychic.com/p/yoga-resistance-band-pilates-rubber-stretch-exercise-health-tools-g1232942.html,Yoga Resistance Band Pilates Rubber Stretch Exercise Health Tools,Health Care
197,$4.99,$6.99,https://www.jollychic.com/p/3d-facial-roller-massager-y-shaped-slimming-skin-lifting-tightening-tool-g1250322.html,3D Facial Roller Massager Y Shaped Slimming Skin Lifting Tightening Tool,Health Care
12,$16.99,$25.99,https://www.jollychic.com/p/ango-massage-oil-classic-gentle-smoothing-nourish-personal-care-g1263560.html,Ango Massage Oil Classic Gentle Smoothing Nourish Personal Care,Health Care
506,$3.99,$8.99,https://www.jollychic.com/p/back-bandage-humpback-correcting-belt-adjustable-unisex-shaping-health-care-g1269366.html,Back Bandage Humpback Correcting Belt Adjustable Unisex Shaping Health Care,Health Care
181,$15.99,$17.99,https://www.jollychic.com/p/mediheal-10pcs-slimming-patch-paster-double-effect-lifting-tightening-health-tool-g1270092.html,Mediheal 10Pcs Slimming Patch Paster Double Effect Lifting Tightening Health Tool,Health Care
224,$2.99,$5.99,https://www.jollychic.com/p/yoga-fitness-ball-home-pilates-thicken-balance-sport-training-tool-g1279298.html,Yoga Fitness Ball Home Pilates Thicken Balance Sport Training Tool,Health Care
49,$7.99,,https://www.jollychic.com/p/beads-balls-slimming-massager-handled-full-body-massage-heath-tools-g1299662.html,Beads Balls Slimming Massager Handled Full Body Massage Heath Tools,Health Care
109,$4.99,$10.99,https://www.jollychic.com/p/2-pairs-silicone-heel-pads-relieve-pain-foot-care-tool-g1305146.html,2 Pairs Silicone Heel Pads Relieve Pain Foot Care Tool,Health Care
113,$8.99,,https://www.jollychic.com/p/massage-glove-roller-steel-ball-relax-body-cellulite-massager-tool-pain-relief-g1309186.html,Massage Glove Roller Steel Ball Relax Body Cellulite Massager Tool Pain Relief,Health Care
256,$3.99,$8.99,https://www.jollychic.com/p/ingrown-toenail-correction-one-piece-toe-clamp-stainless-steel-health-tool-g1320528.html,Ingrown Toenail Correction One Piece Toe Clamp Stainless Steel Health Tool,Health Care
169,$7.99,,https://www.jollychic.com/p/shaping-compound-massage-essencial-oil-fat-burning-slimming-body-health-care-g1349468.html,Shaping Compound Massage Essencial Oil Fat Burning Slimming Body Health Care,Health Care
66,$3.99,$9.99,https://www.jollychic.com/p/neck-guard-velcro-natural-heating-magnetotherapy-relief-health-care-g1354360.html,Neck Guard Velcro Natural Heating Magnetotherapy Relief Health Care,Health Care
73,$14.99,,https://www.jollychic.com/p/electronic-massager-body-slimming-massage-with-electrode-pads-for-pain-relief-g1367730.html,Electronic Massager Body Slimming Massage with Electrode Pads for Pain Relief,Health Care
11,$7.99,,https://www.jollychic.com/p/massage-roller-magnet-tool-relax-body-cellulite-massager-tool-pain-relief-g1367750.html,Massage Roller Magnet Tool Relax Body Cellulite Massager Tool Pain Relief,Health Care
18,$2.99,$7.99,https://www.jollychic.com/p/one-pair-bunion-protector-adjustable-velcro-foot-pain-relief-health-care-g1370278.html,One Pair Bunion Protector Adjustable Velcro Foot Pain Relief Health Care,Health Care
211,$7.99,,https://www.jollychic.com/p/massage-oil-stretchmarks-remove-smoothing-nourish-personal-care-g1370316.html,Massage Oil Stretchmarks Remove Smoothing Nourish Personal Care,Health Care
111,$7.99,,https://www.jollychic.com/p/massage-oil-for-hips-enhancement-lifting-natural-pure-tightening-personal-care-g1370318.html,Massage Oil For Hips Enhancement Lifting Natural Pure Tightening Personal Care,Health Care
272,$6.99,,https://www.jollychic.com/p/head-massager-one-piece-multi-functional-octopus-refreshing-health-tool-g1370366.html,Head Massager One Piece Multi Functional Octopus Refreshing Health Tool,Health Care
96,$1.99,$4.99,https://www.jollychic.com/p/royal-buy-fat-burning-cream-hot-chilli-body-slimming-gel-weight-loss-massage-product-g1375968.html,Royal-Buy Fat Burning Cream Hot Chilli Body Slimming Gel Weight Loss Massage Product,Health Care
45,$19.99,,https://www.jollychic.com/p/3d-roller-massager-facial-body-lifting-tightening-health-tools-g1386446.html,3D Roller Massager Facial Body Lifting Tightening Health Tools,Health Care
123,$8.99,,https://www.jollychic.com/p/smiling-corrector-face-lifting-portable-beauty-health-tool-g1391920.html,Smiling Corrector Face Lifting Portable Beauty Health Tool,Health Care
151,$9.99,,https://www.jollychic.com/p/buck-teeth-corrector-all-match-cozy-invisible-health-tool-g1392386.html,Buck Teeth Corrector All Match Cozy Invisible Health Tool,Health Care
104,$18.99,$30.99,https://www.jollychic.com/p/royal-buy-inu-celluless-body-vacuum-anti-cellulite-massage-device-therapy-treatment-kit-g1419844.html,Royal-Buy INU Celluless Body Vacuum Anti Cellulite Massage Device Therapy Treatment Kit,Health Care
32,$9.99,,https://www.jollychic.com/p/royal-buy-face-lift-up-belt-massager-shaper-ant-aging-wrinkles-firming-health-tool-g1426474.html,Royal-Buy Face Lift Up Belt Massager Shaper Ant Aging Wrinkles Firming Health Tool,Health Care
10,$8.99,,https://www.jollychic.com/p/personal-body-fat-loss-caliper-one-piece-skinfold-accurate-tester-g1455368.html,Personal Body Fat Loss Caliper One Piece Skinfold Accurate Tester,Health Care
31,$7.99,,https://www.jollychic.com/p/5pcs-belly-pasters-stickers-slimming-detoxifying-health-care-g1510068.html,5Pcs Belly Pasters Stickers Slimming Detoxifying Health Care,Health Care
0,$92.00,,https://www.jollychic.com/p/eye-care-electric-face-massage-beauty-alleviate-fatigue-vibrator-usb-charges-g1607854.html,Eye Care Electric Face Massage Beauty Alleviate Fatigue Vibrator USB Charges,Health Care
0,$112.00,,https://www.jollychic.com/p/electric-body-massage-health-skin-care-ultrasonic-anti-cellulite-usb-charges-g1607856.html,Electric Body Massage Health Skin Care Ultrasonic Anti Cellulite USB Charges,Health Care
0,$102.00,,https://www.jollychic.com/p/face-care-ultrasonic-photon-ion-skin-care-vibration-facial-massager-usb-charges-g1607858.html,Face Care Ultrasonic Photon Ion Skin Care Vibration Facial Massager USB Charges,Health Care
0,$91.00,,https://www.jollychic.com/p/3-in-1-body-shaping-skin-massager-ems-electrode-pads-infrared-anti-cellulite-usb-g1607860.html,3 In 1 Body Shaping Skin Massager EMS Electrode Pads Infrared Anti Cellulite USB,Health Care
0,$94.00,,https://www.jollychic.com/p/electric-face-massage-body-lifting-firming-v-shape-beauty-skin-care-usb-charges-g1607862.html,Electric Face Massage Body Lifting Firming V Shape Beauty Skin Care USB Charges,Health Care
0,$8.99,,https://www.jollychic.com/p/snail-essence-stretch-marks-birth-marks-recovering-cream-g1617562.html,Snail Essence Stretch Marks Birth Marks Recovering Cream,Health Care
4,$5.99,,https://www.jollychic.com/p/aichun-green-tea-slimming-cream-shaping-lifting-body-massage-cream-g1617568.html,Aichun Green Tea Slimming Cream Shaping Lifting Body Massage Cream,Health Care
3,$8.99,,https://www.jollychic.com/p/aichun-paprika-easy-fast-slimming-gel-shaping-firming-massage-cream-g1617570.html,Aichun Paprika Easy Fast Slimming Gel Shaping Firming Massage Cream,Health Care
1,$8.99,,https://www.jollychic.com/p/aichun-hip-lifting-massage-cream-firming-detoxifying-cream-g1617578.html,Aichun Hip Lifting Massage Cream Firming Detoxifying Cream,Health Care
5,$8.99,,https://www.jollychic.com/p/aichun-body-slimming-cream-massage-3-days-fat-burning-cream-g1621512.html,Aichun Body Slimming Cream Massage 3 Days Fat Burning Cream,Health Care
3,$8.99,,https://www.jollychic.com/p/aichun-red-pepper-slimming-cream-tightening-detoxifying-massage-cream-g1621516.html,Aichun Red Pepper Slimming Cream Tightening Detoxifying Massage Cream,Health Care
1,$8.99,,https://www.jollychic.com/p/aichun-green-tea-easy-slimming-gel-fat-burning-firming-massage-gel-g1621526.html,Aichun Green Tea Easy Slimming Gel Fat Burning Firming Massage Gel,Health Care
0,$35.99,,https://www.jollychic.com/p/beauty-instrument-digital-skin-moisture-professional-test-device-g1622572.html,Beauty Instrument Digital Skin Moisture Professional Test Device,Health Care
0,$34.99,,https://www.jollychic.com/p/beauty-instrument-digital-skin-moisture-oil-content-professional-test-device-g1622578.html,Beauty Instrument Digital Skin Moisture Oil Content Professional Test Device,Health Care
0,$12.99,,https://www.jollychic.com/p/ingrown-toenail-care-tool-pedicure-foot-bunion-acronyx-corrector-protector-g1632588.html,Ingrown Toenail Care Tool Pedicure Foot Bunion Acronyx Corrector Protector,Health Care
1,$7.99,,https://www.jollychic.com/p/3pcs-slimming-patch-stickers-lose-weight-meso-cellulite-health-care-g1632592.html,3Pcs Slimming Patch Stickers Lose Weight Meso Cellulite Health Care,Health Care
160,$1.99,$5.99,https://www.jollychic.com/p/spring-massage-device-silicone-anti-fatigue-health-tools-g452594.html,Spring Massage Device Silicone Anti Fatigue Health Tools,Health Care
633,$5.99,,https://www.jollychic.com/p/massage-brush-blood-circulation-slimming-health-care-g452892.html,Massage Brush Blood Circulation Slimming Health Care,Health Care
200,$5.99,,https://www.jollychic.com/p/multifunction-rotating-massager-face-lifting-body-health-care-g453214.html,Multifunction Rotating Massager Face Lifting Body Health Care,Health Care
1384,$9.99,,https://www.jollychic.com/p/slimming-hot-cream-body-waist-leg-firming-tightening-cream-g517536.html,Slimming Hot Cream Body Waist Leg Firming Tightening Cream,Health Care
831,$9.99,,https://www.jollychic.com/p/dispel-fat-lines-stretch-mark-preventive-repairing-cream-g517608.html,Dispel Fat Lines Stretch Mark Preventive Repairing Cream,Health Care
682,$9.99,,https://www.jollychic.com/p/dr-rashel-hip-firming-moisturizing-cream-hip-shaping-lift-cream-g517642.html,DR.RASHEL Hip Firming Moisturizing Cream Hip Shaping Lift Cream,Health Care
9231,$5.99,$8.99,https://www.jollychic.com/p/waist-twisting-disc-fitness-equipment-body-aerobic-magnetic-weight-loss-plate-g542612.html,Waist Twisting Disc Fitness Equipment Body Aerobic Magnetic Weight Loss Plate,Health Care
10008,$5.99,,https://www.jollychic.com/p/training-resistance-bands-rope-for-yoga-sports-chest-developer-g548336.html,Training Resistance Bands Rope For Yoga Sports Chest Developer,Health Care
17031,$6.99,,https://www.jollychic.com/p/fitness-workout-yoga-rubber-tensile-pull-rope-resistance-band-chest-expander-g548392.html,Fitness Workout Yoga Rubber Tensile Pull Rope Resistance Band Chest Expander,Health Care
6923,$5.99,,https://www.jollychic.com/p/adjustable-skipping-rope-3m-steel-wire-high-speed-skipping-jump-rope-g550632.html,Adjustable Skipping Rope 3M Steel Wire High Speed Skipping Jump Rope,Health Care
17936,$11.99,,https://www.jollychic.com/p/elastic-exercise-band-waist-belly-legs-body-slimming-tool-g558748.html,Elastic Exercise Band Waist Belly Legs Body Slimming Tool,Health Care
5309,$7.99,,https://www.jollychic.com/p/fitness-resistance-bands-latex-pedal-exerciser-slim-weight-loss-tools-g562564.html,Fitness Resistance Bands Latex Pedal Exerciser Slim Weight Loss Tools,Health Care
2373,$5.99,,https://www.jollychic.com/p/sports-gloves-half-finger-outdoor-sports-cycling-non-slip-safe-for-men-and-women-g574068.html,Sports Gloves Half Finger Outdoor Sports Cycling Non-slip Safe For Men And Women,Health Care
3821,$5.99,,https://www.jollychic.com/p/elastic-yoga-pilates-rubber-stretch-exercise-resistance-band-g578130.html,Elastic Yoga Pilates Rubber Stretch Exercise Resistance Band,Health Care
1392,$12.99,$18.99,https://www.jollychic.com/p/resistance-band-regular-exercise-gym-muscle-buliding-elastic-strap-g579634.html,Resistance Band Regular Exercise Gym Muscle Buliding Elastic Strap,Health Care
351,$9.99,,https://www.jollychic.com/p/yoga-rope-body-exercise-muscular-extension-stretch-belt-without-mat-g600744.html,Yoga Rope Body Exercise Muscular Extension Stretch Belt Without Mat,Health Care
355,$5.99,$11.99,https://www.jollychic.com/p/facial-roller-massager-3d-manual-lifting-convenient-slimming-beauty-tools-g609916.html,Facial Roller Massager 3D Manual Lifting Convenient Slimming Beauty Tools,Health Care
4035,$5.99,$11.99,https://www.jollychic.com/p/2pcs-pushup-equipment-workout-pectoral-exercise-muscle-building-tools-g610270.html,2Pcs Pushup Equipment Workout Pectoral Exercise Muscle Building Tools,Health Care
1764,$1.99,$5.99,https://www.jollychic.com/p/face-massager-flower-shape-face-lifting-slimming-beauty-tools-g626290.html,Face Massager Flower Shape Face Lifting Slimming Beauty Tools,Health Care
