add_wish,discount_price,original_price,product_link,product_name,header_block
158,$9.99,,http://www.jollychic.com/p/hair-comb-candy-color-scalp-massage-anti-static-long-handle-comb-g600854.html,Hair Comb Candy Color Scalp Massage Anti Static Long Handle Comb,Personal Care
831,$2.99,$5.99,http://www.jollychic.com/p/slimming-massage-cream-for-body-fat-burning-shaping-cream-g602266.html,Slimming Massage Cream For Body Fat Burning Shaping Cream,Personal Care
548,$2.99,$6.99,http://www.jollychic.com/p/scrub-cream-cucumber-exfoliating-fresh-deep-clean-for-face-and-body-g602420.html,Scrub Cream Cucumber Exfoliating Fresh Deep Clean For Face And Body,Personal Care
1333,$5.99,,http://www.jollychic.com/p/8pcs-dental-care-kit-toothbrush-tongue-brush-stain-eraser-mirror-cleaning-set-g612484.html,8pcs Dental Care Kit Toothbrush Tongue Brush Stain Eraser Mirror Cleaning Set,Personal Care
192,$6.99,,http://www.jollychic.com/p/hairstyling-cape-pattern-hasp-black-waterproof-salon-tools-g642642.html,Hairstyling Cape Pattern Hasp Black Waterproof Salon Tools,Personal Care
1533,$5.99,,http://www.jollychic.com/p/body-cream-for-powerful-stretch-obesity-marks-marks-scar-removal-repair-cream-g647136.html,Body Cream For Powerful Stretch Obesity Marks Marks Scar Removal Repair Cream,Personal Care
513,$2.99,$5.99,http://www.jollychic.com/p/hairline-shadow-stick-3-colors-optional-natural-hair-loss-concealer-g676908.html,Hairline Shadow Stick 3 Colors Optional Natural Hair Loss Concealer,Personal Care
202,$6.99,$9.99,http://www.jollychic.com/p/hand-wax-rose-milk-essence-nutrients-fine-line-remove-hand-care-g695142.html,Hand Wax Rose Milk Essence Nutrients Fine Line Remove Hand Care,Personal Care
211,$11.99,$15.99,http://www.jollychic.com/p/bath-blaster-pink-elephants-orange-essence-oil-deep-nourishing-bath-ball-g700878.html,Bath Blaster Pink Elephants Orange Essence Oil Deep Nourishing Bath Ball,Personal Care
1814,$6.99,$10.99,http://www.jollychic.com/p/yoga-fitness-ball-home-pilates-thicken-no-smell-balance-sport-training-tool-g703936.html,Yoga Fitness Ball Home Pilates Thicken No Smell Balance Sport Training Tool,Personal Care
70,$18.99,,http://www.jollychic.com/p/hair-straightner-ceramic-electric-multi-function-hairstyling-tool-g737316.html,Hair Straightner Ceramic Electric Multi Function Hairstyling Tool,Personal Care
287,$5.99,,http://www.jollychic.com/p/6pcs-hair-disks-set-buns-multi-function-sponge-diy-hairstyling-tools-g748992.html,6Pcs Hair Disks Set Buns Multi Function Sponge DIY Hairstyling Tools,Personal Care
67,$6.99,,http://www.jollychic.com/p/anti-perspirant-rolling-on-armpit-refresh-durable-for-men-and-women-g755418.html,Anti Perspirant Rolling On Armpit Refresh Durable For Men And Women,Personal Care
711,$9.99,$13.99,http://www.jollychic.com/p/bath-blaster-jasmine-essential-oil-natural-refresh-body-clean-bath-ball-g760696.html,Bath Blaster Jasmine Essential Oil Natural Refresh Body Clean Bath Ball,Personal Care
146,$5.99,,http://www.jollychic.com/p/one-pair-silicone-toe-correctors-soft-toe-spreaders-breathable-health-care-tools-g797748.html,One Pair Silicone Toe Correctors Soft Toe Spreaders Breathable Health Care Tools,Personal Care
26,$9.99,,http://www.jollychic.com/p/one-pair-toe-corrector-breathable-toe-spreader-comfort-forefoot-protect-health-care-tools-g800074.html,One Pair Toe Corrector Breathable Toe Spreader Comfort Forefoot Protect Health Care Tools,Personal Care
121,$5.99,,http://www.jollychic.com/p/body-lotion-nourish-gentle-baby-skin-deep-moisture-body-care-g831960.html,Body Lotion Nourish Gentle Baby Skin Deep Moisture Body Care,Personal Care
1467,$3.99,$7.99,http://www.jollychic.com/p/body-massage-brush-bath-spa-slimming-cellulite-relaxing-scrub-massager-g831984.html,Body Massage Brush Bath Spa Slimming Cellulite Relaxing Scrub Massager,Personal Care
85,$6.99,$13.99,http://www.jollychic.com/p/dr-rashel-hair-essence-oil-protein-care-strengthen-repair-hair-conditioner-g920514.html,DR.RASHEL Hair Essence Oil Protein Care Strengthen Repair Hair Conditioner,Personal Care
67,$8.99,$14.99,http://www.jollychic.com/p/ora2-toothpaste-peach-leaf-mint-stain-clear-whitening-personal-care-g921992.html,Ora2 Toothpaste Peach Leaf Mint Stain Clear Whitening Personal Care,Personal Care
23,$5.99,$11.99,http://www.jollychic.com/p/prime-blue-men-s-spray-hair-gel-styling-curls-modelling-lasting-gel-g922012.html,PRIME BLUE Men's Spray Hair Gel Styling Curls Modelling Lasting Gel,Personal Care
114,$8.99,,http://www.jollychic.com/p/2-pairs-gel-heel-sleeves-pain-relief-moist-with-massage-ball-foot-arch-support-g922700.html,2 Pairs Gel Heel Sleeves Pain Relief Moist With Massage Ball Foot Arch Support,Personal Care
112,$5.99,,http://www.jollychic.com/p/3-pairs-foot-mask-fresh-milk-exfoliating-anti-feet-odor-tendering-foot-care-g928738.html,3 Pairs Foot Mask Fresh Milk Exfoliating Anti Feet Odor Tendering Foot Care,Personal Care
1,$34.99,,http://www.jollychic.com/p/schwarzkopf-shampoo-smooth-repairing-glossy-for-all-hair-types-g930618.html,Schwarzkopf Shampoo Smooth Repairing Glossy For All Hair Types,Personal Care
143,$5.99,$10.99,http://www.jollychic.com/p/shiseido-foot-cream-protective-anti-sweat-odor-soften-smooth-foot-care-g944700.html,Shiseido Foot Cream Protective Anti Sweat Odor Soften Smooth Foot Care,Personal Care
40,$17.99,$36.99,http://www.jollychic.com/p/curel-body-cream-eucalyptus-essence-alcohol-free-deep-moisture-for-dry-skin-g944706.html,Curel Body Cream Eucalyptus Essence Alcohol Free Deep Moisture For Dry Skin,Personal Care
168,$19.99,$32.99,http://www.jollychic.com/p/neck-paste-useful-personal-health-caring-relieving-pressure-body-paste-g963454.html,Neck Paste Useful Personal Health Caring Relieving Pressure Body Paste,Personal Care
100,$10.99,$18.99,http://www.jollychic.com/p/lirety-body-lotion-rose-aroma-deep-nourish-moisture-body-care-g964028.html,LIRETY Body Lotion Rose Aroma Deep Nourish Moisture Body Care,Personal Care
195,$15.99,$29.99,http://www.jollychic.com/p/horse-oil-shampoo-silicon-free-natural-protective-deep-clean-hair-wash-g964036.html,Horse Oil Shampoo Silicon Free Natural Protective Deep Clean Hair Wash,Personal Care
123,$17.99,$29.99,http://www.jollychic.com/p/siobijin-body-massage-salt-rose-scent-exfoliating-moisture-body-care-g964046.html,Siobijin Body Massage Salt Rose Scent Exfoliating Moisture Body Care,Personal Care
95,$7.99,$11.99,http://www.jollychic.com/p/spring-hula-hoop-removable-elastic-weight-loss-waist-slimming-health-care-g969916.html,Spring Hula Hoop Removable Elastic Weight Loss Waist Slimming Health Care,Personal Care
275,$9.99,$17.99,http://www.jollychic.com/p/lion-foot-exfoliating-gel-deep-moisture-soften-smoothing-hand-care-g981216.html,LION Foot Exfoliating Gel Deep Moisture Soften Smoothing Hand Care,Personal Care
41,$11.99,$19.99,http://www.jollychic.com/p/kao-prettia-foam-hair-dye-candy-brown-long-lasting-easy-diy-hairstyle-g981616.html,KAO PRETTIA Foam Hair Dye Candy Brown Long Lasting Easy DIY Hairstyle,Personal Care
72,$9.99,$19.99,http://www.jollychic.com/p/kao-prettia-foam-hair-dye-camel-color-long-lasting-easy-diy-hairstyling-g981620.html,KAO PRETTIA Foam Hair Dye Camel Color Long Lasting Easy DIY Hairstyling,Personal Care
5,$19.99,,http://www.jollychic.com/p/kangfu-hair-drier-foldable-high-power-household-hairstyle-g1003176.html,KangFu Hair Drier Foldable High Power Household Hairstyle,Personal Care
9,$42.99,,http://www.jollychic.com/p/kangfu-hair-drier-negative-ion-high-power-constant-temperature-hairstyle-g1004186.html,KangFu Hair Drier Negative Ion High Power Constant Temperature Hairstyle,Personal Care
43,$24.99,,http://www.jollychic.com/p/bomb-cosmetics-hair-soap-natural-essence-anti-dandruff-solid-shampoo-hair-wash-g1067336.html,BOMB Cosmetics Hair Soap Natural Essence Anti Dandruff Solid Shampoo Hair Wash,Personal Care
28,$15.99,$24.99,http://www.jollychic.com/p/bomb-cosmetics-hair-soap-orange-essence-refresh-solid-shampoo-hair-wash-g1067338.html,BOMB Cosmetics Hair Soap Orange Essence Refresh Solid Shampoo Hair Wash,Personal Care
59,$5.99,,http://www.jollychic.com/p/foot-care-little-toe-isolation-pad-moisturizing-adjust-spacing-comfy-foot-care-g1075638.html,Foot Care Little Toe Isolation Pad Moisturizing Adjust Spacing Comfy Foot Care,Personal Care
23,$21.99,,http://www.jollychic.com/p/hair-tool-multi-functional-both-straightener-comb-and-curler-comb-hairstyling-tool-g1075642.html,Hair Tool Multi functional Both Straightener Comb And Curler Comb Hairstyling Tool,Personal Care
287,$6.99,$10.99,http://www.jollychic.com/p/koogis-body-wash-deep-cleansing-whitening-nourish-bath-lotion-g1094512.html,KOOGIS Body Wash Deep Cleansing Whitening Nourish Bath Lotion,Personal Care
7,$21.99,,http://www.jollychic.com/p/hair-straightener-mini-portable-ceramic-versatile-hairstyling-tools-g1104164.html,Hair Straightener Mini Portable Ceramic Versatile Hairstyling Tools,Personal Care
38,$22.99,,http://www.jollychic.com/p/women-s-sleep-hair-rollers-nighttime-hair-curlers-g1121586.html,Women's Sleep Hair Rollers Nighttime Hair Curlers,Personal Care
76,$14.99,,http://www.jollychic.com/p/sixplus-electric-toothbrush-durable-ultrasonic-vibration-teeth-whitening-electric-toothbrush-g1139710.html,SIXPLUS Electric Toothbrush Durable Ultrasonic Vibration Teeth Whitening Electric Toothbrush,Personal Care
14,$5.99,,http://www.jollychic.com/p/back-scratcher-massager-one-piece-extendable-household-portable-health-tool-g1149552.html,Back Scratcher Massager One Piece Extendable Household Portable Health Tool,Personal Care
149,$4.99,$7.99,http://www.jollychic.com/p/hair-comb-anti-static-multiple-colors-massage-soft-straighten-hair-brush-g1228592.html,Hair Comb Anti Static Multiple Colors Massage Soft Straighten Hair Brush,Personal Care
0,$5.99,,http://www.jollychic.com/p/2pcs-silicone-dilated-nostrils-converted-into-sleep-expanders-restrain-snore-instruments-g1232932.html,2Pcs Silicone Dilated Nostrils Converted Into Sleep Expanders Restrain Snore Instruments,Personal Care
5,$5.99,,http://www.jollychic.com/p/pure-lavender-essence-oil-anti-acne-relaxing-massage-oil-g1256010.html,Pure Lavender Essence Oil Anti Acne Relaxing Massage Oil,Personal Care
1,$20.99,,http://www.jollychic.com/p/hair-straightener-multi-functional-2in1-ceramic-perfect-curling-portable-hair-styling-g1277726.html,Hair Straightener Multi Functional 2in1 Ceramic Perfect Curling Portable Hair Styling,Personal Care
96,$8.99,,http://www.jollychic.com/p/hair-comb-one-piece-bowknot-shape-adorable-anti-static-straighten-hair-brush-g1292274.html,Hair Comb One Piece Bowknot Shape Adorable Anti Static Straighten Hair Brush,Personal Care
0,$18.99,,http://www.jollychic.com/p/electric-massage-comb-natural-anti-static-healthy-shake-massage-hair-comb-g1299116.html,Electric Massage Comb Natural Anti Static Healthy Shake Massage Hair Comb,Personal Care
5,$5.99,,http://www.jollychic.com/p/lamilee-foot-masks-one-pair-milk-pedicure-peeling-renewal-foot-care-g1300918.html,LaMilee Foot Masks One Pair Milk Pedicure Peeling Renewal Foot Care,Personal Care
388,$5.99,,http://www.jollychic.com/p/water-lock-moisturizing-hand-cream-g337768.html,Water Lock Moisturizing Hand Cream,Personal Care
604,$1.99,$2.99,http://www.jollychic.com/p/moisturizing-hydrating-exfoliator-hand-care-mask-one-pair-g351196.html,Moisturizing Hydrating Exfoliator Hand Care Mask One Pair,Personal Care
382,$3.99,$6.99,http://www.jollychic.com/p/medium-roll-fascinating-curl-hair-shaping-tool-g357566.html,Medium Roll Fascinating Curl Hair Shaping Tool,Personal Care
11060,$7.99,$13.99,http://www.jollychic.com/p/exfoliating-scrub-electric-foot-care-tool-g370586.html,Exfoliating Scrub Electric Foot Care Tool,Personal Care
44,$6.99,,http://www.jollychic.com/p/6pcs-key-shape-sponge-updo-tool-g371868.html,6Pcs Key Shape Sponge Updo Tool,Personal Care
46,$7.99,,http://www.jollychic.com/p/diy-hair-updo-tool-beautiful-decoration-10pcs-g371918.html,DIY Hair Updo Tool Beautiful Decoration 10Pcs,Personal Care
221,$20.99,,http://www.jollychic.com/p/coco-scented-sweet-protective-body-cream-g373782.html,Coco Scented Sweet Protective Body Cream,Personal Care
418,$5.99,,http://www.jollychic.com/p/mild-smooth-skincare-depilatory-cream-30g-g373932.html,Mild Smooth Skincare Depilatory Cream 30G,Personal Care
197,$15.99,$23.99,http://www.jollychic.com/p/orange-essential-oil-fragrance-whitening-brightening-skin-essence-g405996.html,Orange Essential Oil Fragrance Whitening Brightening Skin Essence,Personal Care
2866,$4.99,$7.99,http://www.jollychic.com/p/dye-hair-mud-one-time-safe-attractive-hair-tintage-g435768.html,Dye Hair Mud One Time Safe Attractive Hair Tintage,Personal Care
312,$1.99,$5.99,http://www.jollychic.com/p/doradosun-foot-cream-whitening-nourishing-moisturizing-foot-care-g452994.html,Doradosun Foot Cream Whitening Nourishing Moisturizing Foot Care,Personal Care
38,$5.99,,http://www.jollychic.com/p/dr-rashel-hairstyling-wax-powerful-lasting-fluffy-styling-hair-wax-g461024.html,DR.RASHEL Hairstyling Wax Powerful Lasting Fluffy Styling Hair Wax,Personal Care
224,$7.99,,http://www.jollychic.com/p/gold-keratin-nutrition-hair-mask-ointment-moisturizing-conditioner-g461276.html,Gold Keratin Nutrition Hair Mask Ointment Moisturizing Conditioner,Personal Care
305,$9.99,,http://www.jollychic.com/p/hand-cream-white-rose-fragrance-hydrating-hands-care-g493134.html,Hand Cream White Rose Fragrance Hydrating Hands Care,Personal Care
468,$3.99,$6.99,http://www.jollychic.com/p/soap-turmeric-collagen-moist-whitening-exfoliating-body-wash-g513344.html,Soap Turmeric Collagen Moist Whitening Exfoliating Body Wash,Personal Care
115,$2.99,$6.99,http://www.jollychic.com/p/dr-rashel-soap-olive-oil-collagen-moist-whitening-organic-body-wash-g513712.html,DR.RASHEL Soap Olive Oil Collagen Moist Whitening Organic Body Wash,Personal Care
3687,$7.99,$12.99,http://www.jollychic.com/p/7-pcs-hand-cream-set-moisturizing-nourishing-perfume-scent-value-set-g556314.html,7 Pcs Hand Cream Set Moisturizing Nourishing Perfume Scent Value Set,Personal Care
113,$5.99,$10.99,http://www.jollychic.com/p/dr-rashel-hand-mask-5pcs-smooth-moist-milk-and-honey-collagen-hand-care-g574868.html,DR.RASHEL Hand Mask 5Pcs Smooth Moist Milk And Honey Collagen Hand Care,Personal Care
1070,$9.99,$14.99,http://www.jollychic.com/p/bath-blaster-lavender-oil-repairing-soothing-deep-clean-bath-ball-g612472.html,Bath Blaster Lavender Oil Repairing Soothing Deep Clean Bath Ball,Personal Care
1632,$5.99,,http://www.jollychic.com/p/15pcs-teeth-whitening-strips-4d-bleaching-ultra-white-breath-fresh-spray-set-g634736.html,15Pcs Teeth Whitening Strips 4D Bleaching Ultra White Breath Fresh Spray Set,Personal Care
605,$5.99,,http://www.jollychic.com/p/snore-stopper-advanced-mouth-guard-safe-silicone-anti-bruxism-device-g636180.html,Snore Stopper Advanced Mouth Guard Safe Silicone Anti Bruxism Device,Personal Care
122,$8.99,$11.99,http://www.jollychic.com/p/20pcs-magic-hair-curler-fiber-elastic-wavying-hairstyling-tools-g642790.html,20Pcs Magic Hair Curler Fiber Elastic Wavying Hairstyling Tools,Personal Care
268,$6.99,,http://www.jollychic.com/p/wrist-trainer-adjustable-strength-rehabilitation-muscle-building-tools-g652128.html,Wrist Trainer Adjustable Strength Rehabilitation Muscle Building Tools,Personal Care
81,$9.99,,http://www.jollychic.com/p/hair-rollers-usb-charged-bang-curler-natural-convenient-quick-hairstyling-tools-g652150.html,Hair Rollers USB Charged Bang Curler Natural Convenient Quick Hairstyling Tools,Personal Care
3141,$11.99,$15.99,http://www.jollychic.com/p/body-slimming-cream-leg-waist-fat-burning-shaping-massage-cream-g687924.html,Body Slimming Cream Leg Waist Fat Burning Shaping Massage Cream,Personal Care
18,$5.99,,http://www.jollychic.com/p/dr-rashel-hair-wax-long-lasting-shaping-fluffy-hairstyling-wax-g701320.html,DR.RASHEL Hair Wax Long Lasting Shaping Fluffy Hairstyling Wax,Personal Care
947,$7.99,,http://www.jollychic.com/p/10pcs-hair-combs-set-black-hair-cutting-portable-hair-styling-tools-g703934.html,10Pcs Hair Combs Set Black Hair Cutting Portable Hair Styling Tools,Personal Care
167,$1.99,$5.99,http://www.jollychic.com/p/hair-disk-sponge-hair-bun-lovely-heart-shape-diy-hairstyling-tool-g748968.html,Hair Disk Sponge Hair Bun Lovely Heart Shape DIY Hairstyling Tool,Personal Care
329,$24.99,$36.99,http://www.jollychic.com/p/bubble-bath-cream-violet-fragrance-fresh-natural-nourish-bath-and-shower-g760686.html,Bubble Bath Cream Violet Fragrance Fresh Natural Nourish Bath And Shower,Personal Care
210,$30.99,,http://www.jollychic.com/p/8pcs-ceramic-hairstyling-shellsl-heating-curling-wavyng-long-lasting-hairstyle-g762144.html,8Pcs Ceramic Hairstyling Shellsl Heating Curling Wavyng Long Lasting Hairstyle,Personal Care
133,$4.99,$10.99,http://www.jollychic.com/p/hand-mask-almond-milk-essence-peel-off-smooth-hand-care-g771686.html,Hand Mask Almond Milk Essence Peel Off Smooth Hand Care,Personal Care
46,$1.99,$5.99,http://www.jollychic.com/p/hair-brush-colorful-handle-hair-massaging-hairstyling-comb-g784360.html,Hair Brush Colorful Handle Hair Massaging Hairstyling Comb,Personal Care
48,$23.99,,http://www.jollychic.com/p/lavender-essential-oil-soap-oil-control-cleansing-whitening-bath-wash-g795834.html,Lavender Essential Oil Soap Oil Control Cleansing Whitening Bath Wash,Personal Care
130,$8.99,,http://www.jollychic.com/p/one-pair-toe-corrector-soft-convenient-big-toe-spreader-health-care-tools-g799258.html,One Pair Toe Corrector Soft Convenient Big Toe Spreader Health Care Tools,Personal Care
861,$8.99,$13.99,http://www.jollychic.com/p/back-stretcher-one-piece-lumbar-support-spine-pain-relief-health-care-g817158.html,Back Stretcher One Piece Lumbar Support Spine Pain Relief Health Care,Personal Care
1322,$4.99,$7.99,http://www.jollychic.com/p/roller-ball-massager-one-piece-rotatable-9-metal-roller-ball-massage-tool-g839514.html,Roller Ball Massager One Piece Rotatable 9 Metal Roller Ball Massage Tool,Personal Care
165,$37.99,$53.00,http://www.jollychic.com/p/hair-curler-ceramic-5in1-brush-quick-heating-shaping-hairstyling-tool-g847376.html,Hair Curler Ceramic 5in1 Brush Quick Heating Shaping Hairstyling Tool,Personal Care
125,$37.99,$54.00,http://www.jollychic.com/p/3d-face-body-roller-massager-shaping-slimming-diamond-cutting-beauty-tool-g851796.html,3D Face Body Roller Massager Shaping Slimming Diamond Cutting Beauty Tool,Personal Care
751,$5.99,,http://www.jollychic.com/p/beauty-blend-one-pair-bath-gloves-exfoliating-dead-skin-remove-tools-g892310.html,Beauty Blend One Pair Bath Gloves Exfoliating Dead Skin Remove Tools,Personal Care
18,$45.99,,http://www.jollychic.com/p/schwarzkopf-rose-hair-conditioner-deep-nourishing-moisturizing-hair-treatment-conditioner-g937698.html,Schwarzkopf Rose Hair Conditioner Deep Nourishing Moisturizing Hair Treatment Conditioner,Personal Care
34,$32.99,$45.99,http://www.jollychic.com/p/schwarzkopf-hair-conditioner-cashmere-nourish-essential-oil-repair-hair-care-g939596.html,Schwarzkopf Hair Conditioner Cashmere Nourish Essential Oil Repair Hair Care,Personal Care
140,$16.99,$28.99,http://www.jollychic.com/p/la-sincia-marinegel-hair-conditioner-deep-repair-luxury-hair-treatment-g955972.html,La SINCIA Marinegel Hair Conditioner Deep Repair Luxury Hair Treatment,Personal Care
209,$20.99,$38.99,http://www.jollychic.com/p/kao-megrhythm-good-night-steam-patc-sholder-patch-g956322.html,Kao MegRhythm Good-Night Steam Patc Sholder Patch,Personal Care
28,$2.99,$5.99,http://www.jollychic.com/p/5-pairs-toe-rings-silicone-foot-massage-magnetic-weight-loss-health-care-g958732.html,5 Pairs Toe Rings Silicone Foot Massage Magnetic Weight Loss Health Care,Personal Care
191,$7.99,$12.99,http://www.jollychic.com/p/manuka-s-cosmet-foot-cream-heels-protect-deep-moisture-foot-care-g963424.html,MANUKA'S COSMET Foot Cream Heels Protect Deep Moisture Foot Care,Personal Care
56,$21.99,$33.99,http://www.jollychic.com/p/hair-dryer-quick-drying-smooth-high-power-professional-hairstyling-tools-g969904.html,Hair Dryer Quick Drying Smooth High Power Professional Hairstyling Tools,Personal Care
378,$5.99,,http://www.jollychic.com/p/2-pairs-exfoliating-foot-masks-for-pedicure-peeling-renewal-foot-care-g978202.html,2 Pairs Exfoliating Foot Masks For Pedicure Peeling Renewal Foot Care,Personal Care
434,$8.99,$13.99,http://www.jollychic.com/p/bomb-cosmetics-bath-blaster-orange-blossom-essence-smoothing-bath-ball-g1056872.html,BOMB Cosmetics Bath Blaster Orange Blossom Essence Smoothing Bath Ball,Personal Care
303,$9.99,$15.99,http://www.jollychic.com/p/bomb-cosmetics-bath-blaster-fresh-berry-nourish-fragrance-bath-ball-g1056876.html,BOMB Cosmetics Bath Blaster Fresh Berry Nourish Fragrance Bath Ball,Personal Care
23,$21.99,,http://www.jollychic.com/p/hairstyling-tool-multi-functional-both-lasting-straightener-curler-hair-tool-g1074644.html,Hairstyling Tool Multi functional Both Lasting Straightener Curler Hair Tool,Personal Care
511,$5.99,,http://www.jollychic.com/p/10pcs-hair-curler-mushroom-pattern-single-package-wavying-easy-diy-hairstyling-tools-g1087456.html,10Pcs Hair Curler Mushroom Pattern Single Package Wavying Easy DIY Hairstyling Tools,Personal Care
14,$19.99,$30.99,http://www.jollychic.com/p/hair-straightener-professional-temperature-control-quick-heated-hairstyling-tool-g1099594.html,Hair Straightener Professional Temperature Control Quick Heated Hairstyling Tool,Personal Care
20,$31.99,,http://www.jollychic.com/p/hair-straightener-professional-curling-multi-uses-heated-iron-hairstyling-tool-g1099596.html,Hair Straightener Professional Curling Multi Uses Heated Iron Hairstyling Tool,Personal Care
11,$30.99,,http://www.jollychic.com/p/hair-straightener-3in1-multi-function-hold-lasting-quick-heating-hairstyling-tool-g1104168.html,Hair Straightener 3in1 Multi Function Hold Lasting Quick Heating Hairstyling Tool,Personal Care
344,$5.99,$9.99,http://www.jollychic.com/p/5pcs-hand-cream-deep-nourish-moisture-refreshing-fruit-smell-hand-care-g1127724.html,5Pcs Hand Cream Deep Nourish Moisture Refreshing Fruit Smell Hand Care,Personal Care
85,$5.99,,http://www.jollychic.com/p/eye-shade-soft-adorable-panda-shape-cute-comfy-eye-patch-g1136048.html,Eye Shade Soft Adorable Panda Shape Cute Comfy Eye Patch,Personal Care
0,$27.99,,http://www.jollychic.com/p/hair-curler-m-ulti-functional-quick-heating-wavying-hairstyling-tool-g1148006.html,Hair Curler M ulti Functional Quick Heating Wavying Hairstyling Tool,Personal Care
15,$5.99,,http://www.jollychic.com/p/body-back-massager-blood-circulation-improve-detoxifying-health-tool-g1154466.html,Body Back Massager Blood Circulation Improve Detoxifying Health Tool,Personal Care
20,$5.99,,http://www.jollychic.com/p/depilatory-wax-bar-waxing-cream-arm-leg-underarm-body-hair-removal-g1184366.html,Depilatory Wax Bar Waxing Cream Arm Leg Underarm Body Hair Removal,Personal Care
38,$5.99,,http://www.jollychic.com/p/hair-comb-scalp-widen-tooth-massage-smooth-beauty-hair-tools-g1201082.html,Hair Comb Scalp Widen Tooth Massage Smooth Beauty Hair Tools,Personal Care
2,$15.99,,http://www.jollychic.com/p/hair-straightener-ceramic-ion-heated-flat-versatile-hairstyling-tool-g1219586.html,Hair Straightener Ceramic Ion Heated Flat Versatile Hairstyling Tool,Personal Care
5,$68.00,,http://www.jollychic.com/p/3pieces-set-wireless-muscle-trainer-instrument-g1232934.html,3Pieces/Set Wireless Muscle Trainer Instrument,Personal Care
8,$23.99,,http://www.jollychic.com/p/15pcs-hand-cream-set-multiple-scent-deep-nourish-smooth-hand-care-value-set-g1266394.html,15Pcs Hand Cream Set Multiple Scent Deep Nourish Smooth Hand Care Value Set,Personal Care
1,$55.00,,http://www.jollychic.com/p/hair-straightener-multi-functional-2in1-curling-perfect-smooth-portable-hair-styling-g1277722.html,Hair Straightener Multi Functional 2in1 Curling Perfect Smooth Portable Hair Styling,Personal Care
96,$5.99,,http://www.jollychic.com/p/hair-comb-professional-portable-candy-color-anti-static-hair-brush-g1287664.html,Hair Comb Professional Portable Candy Color Anti Static Hair Brush,Personal Care
84,$14.99,,http://www.jollychic.com/p/hair-dye-mud-washable-temporary-hairdressing-cream-coloring-wax-g1292278.html,Hair Dye Mud Washable Temporary Hairdressing Cream Coloring Wax,Personal Care
1,$10.99,,http://www.jollychic.com/p/1-pair-gel-lined-ankle-pads-protector-sleeve-foot-care-g1299680.html,1 Pair Gel Lined Ankle Pads Protector Sleeve Foot Care,Personal Care
6,$8.99,,http://www.jollychic.com/p/massage-glove-roller-steel-ball-relax-body-cellulite-massager-tool-pain-relief-g1309186.html,Massage Glove Roller Steel Ball Relax Body Cellulite Massager Tool Pain Relief,Personal Care
9308,$2.99,$5.99,http://www.jollychic.com/p/training-resistance-bands-rope-for-yoga-sports-chest-developer-g548336.html,Training Resistance Bands Rope For Yoga Sports Chest Developer,Personal Care
63,$1.99,$4.99,http://www.jollychic.com/p/beauty-artisan-convenient-plastic-hair-curling-tools-3pcs-g319640.html,Beauty Artisan Convenient Plastic Hair Curling Tools 3Pcs,Personal Care
178,$2.99,$5.99,http://www.jollychic.com/p/fresh-light-flower-fragrant-durable-solid-balsam-g347834.html,Fresh Light Flower Fragrant Durable Solid Balsam,Personal Care
281,$5.99,,http://www.jollychic.com/p/rose-essence-protective-scent-hand-care-cream-g356676.html,Rose Essence Protective Scent Hand Care Cream,Personal Care
281,$8.99,$13.99,http://www.jollychic.com/p/fashion-personal-shaping-durable-hair-grandma-wax-g357080.html,Fashion Personal Shaping Durable Hair Grandma Wax,Personal Care
1474,$7.99,$13.99,http://www.jollychic.com/p/slimming-firming-body-gel-fat-burning-g363950.html,Slimming Firming Body Gel Fat Burning,Personal Care
1255,$7.99,$12.99,http://www.jollychic.com/p/wonderful-convenient-20pcs-hair-curler-sets-with-bag-g364332.html,Wonderful Convenient 20Pcs Hair Curler Sets With Bag,Personal Care
793,$3.99,$7.99,http://www.jollychic.com/p/honey-milk-peeling-exfoliating-foot-wax-g369974.html,Honey Milk Peeling Exfoliating Foot Wax,Personal Care
