add_wish,discount_price,original_price,product_link,product_name,header_block
22799,$2.99,,http://www.jollychic.com/p/exfoliating-scrub-tender-moist-protective-feet-patches-g351102.html,Exfoliating Scrub Tender Moist Protective Feet Patches,Personal Care
10441,$5.99,$9.99,http://www.jollychic.com/p/hand-cream-set-4pcs-exfoliating-moisturizing-whitening-fruit-scent-skin-care-g456278.html,Hand Cream Set 4Pcs Exfoliating Moisturizing Whitening Fruit Scent Skin Care,Personal Care
6996,$5.99,,http://www.jollychic.com/p/hair-wax-beans-natural-ingredient-soluble-quick-hair-removal-g992140.html,Hair Wax Beans Natural Ingredient Soluble Quick Hair Removal,Personal Care
437,$9.99,,http://www.jollychic.com/p/dr-rashel-garlic-collagen-hair-nutrition-mask-smooth-moisturizing-conditioner-g513768.html,DR.RASHEL Garlic Collagen Hair Nutrition Mask Smooth Moisturizing Conditioner,Personal Care
6252,$2.99,$5.99,http://www.jollychic.com/p/adjustable-skipping-rope-3m-steel-wire-high-speed-skipping-jump-rope-g550632.html,Adjustable Skipping Rope 3M Steel Wire High Speed Skipping Jump Rope,Personal Care
13792,$2.99,,http://www.jollychic.com/p/tender-moisturizing-brightening-exfoliator-hand-care-mask-g351212.html,Tender Moisturizing Brightening Exfoliator Hand Care Mask,Personal Care
2143,$3.99,$7.99,http://www.jollychic.com/p/whitening-exfoliating-honey-milk-hands-wax-g369914.html,Whitening Exfoliating Honey & Milk Hands Wax,Personal Care
1126,$3.99,$6.99,http://www.jollychic.com/p/nail-repairing-serum-for-damaged-nails-biotechnology-gentle-smoothing-essence-g1023392.html,Nail Repairing Serum For Damaged Nails Biotechnology Gentle Smoothing Essence,Personal Care
353,$8.99,,http://www.jollychic.com/p/teeth-whitening-powder-organic-activated-charcoal-smoke-coffee-stains-removal-g1228596.html,Teeth Whitening Powder Organic Activated Charcoal Smoke Coffee Stains Removal,Personal Care
12374,$4.99,$6.99,http://www.jollychic.com/p/shea-body-scrub-cream-exfoliating-remove-dead-skin-g374134.html,Shea Body Scrub Cream Exfoliating Remove Dead skin,Personal Care
374,$1.99,$7.99,http://www.jollychic.com/p/1-pair-silicone-toe-corrector-toe-spreaders-silicone-gel-pads-for-men-and-women-g928206.html,1 Pair Silicone Toe Corrector Toe Spreaders Silicone Gel Pads For Men and Women,Personal Care
130,$2.99,$8.99,http://www.jollychic.com/p/2-pairs-toe-correctors-breathable-toe-spreaders-comfortable-forefoot-protect-health-care-tools-g859710.html,2 Pairs Toe Correctors Breathable Toe Spreaders Comfortable Forefoot Protect Health Care Tools,Personal Care
2399,$4.99,$7.99,http://www.jollychic.com/p/massage-cream-stretch-marks-remove-tightening-smooth-cream-g1032682.html,Massage Cream Stretch Marks Remove Tightening Smooth Cream,Personal Care
152,$26.99,$41.99,http://www.jollychic.com/p/hair-curler-ceramic-3in1-multi-function-replacable-hair-brush-hairstyling-tool-g847380.html,Hair Curler Ceramic 3in1 Multi Function Replacable Hair Brush Hairstyling Tool,Personal Care
1145,$6.99,,http://www.jollychic.com/p/12pcs-foot-file-set-dead-skin-callus-remover-pedicure-rasp-tools-g1070608.html,12Pcs Foot File Set Dead Skin Callus Remover Pedicure Rasp Tools,Personal Care
627,$5.99,,http://www.jollychic.com/p/anti-friction-heel-gel-pad-orthopedic-shoes-for-women-foot-care-insoles-tool-g1121312.html,Anti-friction Heel Gel Pad Orthopedic Shoes For Women Foot Care Insoles Tool,Personal Care
2876,$4.99,$6.99,http://www.jollychic.com/p/12pcs-toenail-manicure-set-portable-grinding-nail-cutting-tools-g668288.html,12Pcs Toenail Manicure Set Portable Grinding Nail Cutting Tools,Personal Care
223,$1.99,$5.99,http://www.jollychic.com/p/hairstyling-tools-5pcs-diy-buns-easy-large-size-portable-sponge-black-beauty-tools-g468560.html,Hairstyling Tools 5Pcs DIY Buns Easy Large Size Portable Sponge Black Beauty Tools,Personal Care
1088,$4.99,$7.99,http://www.jollychic.com/p/hair-comb-curly-hair-shaping-air-bag-massaging-comb-g418214.html,Hair Comb Curly Hair Shaping Air Bag Massaging Comb,Personal Care
10577,$6.99,$10.99,http://www.jollychic.com/p/4pcs-hand-care-gloves-whitening-exfoliating-hydrating-hand-care-g604694.html,4PCs Hand Care Gloves Whitening Exfoliating Hydrating Hand Care,Personal Care
412,$12.99,,http://www.jollychic.com/p/2-pairs-spa-gel-socks-moisturizing-soften-silicone-foot-care-g1065258.html,2 Pairs SPA Gel Socks Moisturizing Soften Silicone Foot Care,Personal Care
7630,$6.99,$11.99,http://www.jollychic.com/p/2pcs-exfoliating-body-gel-with-snail-essence-body-lotion-whitening-body-care-g864048.html,2Pcs Exfoliating Body Gel With Snail Essence Body Lotion Whitening Body Care,Personal Care
1123,$3.99,$8.99,http://www.jollychic.com/p/one-pair-spa-gel-socks-moisturizing-silicone-repairing-cracked-skin-foot-care-g1065252.html,One Pair SPA Gel Socks Moisturizing Silicone Repairing Cracked Skin Foot Care,Personal Care
2130,$2.99,$6.99,http://www.jollychic.com/p/hair-dye-cream-one-time-hair-color-dye-mascara-g435150.html,Hair Dye Cream One-time Hair Color Dye Mascara,Personal Care
4205,$4.99,$6.99,http://www.jollychic.com/p/teeth-whitening-organic-activated-charcoal-smoke-coffee-stains-removal-g1135470.html,Teeth Whitening Organic Activated Charcoal Smoke Coffee Stains Removal,Personal Care
13415,$6.99,$10.99,http://www.jollychic.com/p/hand-wax-whitening-moist-anti-wrinkles-exfoliating-hand-care-g436152.html,Hand Wax Whitening Moist Anti Wrinkles Exfoliating Hand Care,Personal Care
1366,$3.99,$6.99,http://www.jollychic.com/p/2pcs-8-shape-stretch-belt-yoga-resistance-band-body-building-tools-g753932.html,2Pcs 8 Shape Stretch Belt Yoga Resistance Band Body Building Tools,Personal Care
6060,$4.99,$7.99,http://www.jollychic.com/p/twist-board-lady-thin-waist-home-fitness-equipment-loss-weight-twister-g550660.html,Twist Board Lady Thin Waist Home Fitness Equipment Loss Weight Twister,Personal Care
1052,$13.99,,http://www.jollychic.com/p/electric-hair-braid-device-diy-effective-good-looking-harmless-hair-tools-g1004190.html,Electric Hair Braid Device DIY Effective Good Looking Harmless Hair Tools,Personal Care
1671,$5.99,,http://www.jollychic.com/p/3pcs-nose-up-clips-slimming-shaping-natural-straightening-bridge-beauty-tools-g969910.html,3Pcs Nose Up Clips Slimming Shaping Natural Straightening Bridge Beauty Tools,Personal Care
8497,$6.99,$10.99,http://www.jollychic.com/p/3-pairs-exfoliating-foot-masks-for-pedicure-foot-care-feet-mask-g571750.html,3 Pairs Exfoliating Foot Masks For Pedicure Foot Care Feet Mask,Personal Care
496,$5.99,$11.99,http://www.jollychic.com/p/7pcs-toe-corrector-set-comfortable-toe-spreader-health-care-tools-g802552.html,7Pcs Toe Corrector Set Comfortable Toe Spreader Health Care Tools,Personal Care
675,$3.99,,http://www.jollychic.com/p/sport-gloves-colorful-bicycle-half-finger-free-size-breathable-ourdoor-glooves-g652124.html,Sport Gloves Colorful Bicycle Half Finger Free size Breathable Ourdoor Glooves,Personal Care
17516,$6.99,$9.99,http://www.jollychic.com/p/2pcs-spa-gel-socks-glloves-reusable-moisturizing-whitening-exfoliating-skin-care-g654812.html,2Pcs SPA Gel Socks Glloves Reusable Moisturizing Whitening Exfoliating SKin Care,Personal Care
7561,$8.99,$11.99,http://www.jollychic.com/p/4pcs-foot-mask-snail-essence-dead-skin-remove-exfoliating-moist-foot-care-g617930.html,4Pcs Foot Mask Snail Essence Dead Skin Remove Exfoliating Moist Foot Care,Personal Care
3337,$0.99,$4.99,http://www.jollychic.com/p/kafucard-snail-extracting-smooth-whitening-moisture-hand-care-cream-g331854.html,Kafucard Snail Extracting Smooth Whitening Moisture Hand Care Cream,Personal Care
51,$5.99,,http://www.jollychic.com/p/hair-brush-natural-wooden-massage-comb-scalp-paddle-hair-brush-g1182860.html,Hair Brush Natural Wooden Massage Comb Scalp Paddle Hair Brush,Personal Care
76,$1.99,$7.99,http://www.jollychic.com/p/2-pairs-silicone-big-toe-correctors-soft-toe-spreaders-health-care-tool-g797908.html,2 Pairs Silicone Big Toe Correctors Soft Toe Spreaders Health Care Tool,Personal Care
16644,$4.99,$11.99,http://www.jollychic.com/p/elastic-exercise-band-waist-belly-legs-body-slimming-tool-g558748.html,Elastic Exercise Band Waist Belly Legs Body Slimming Tool,Personal Care
904,$5.99,$12.99,http://www.jollychic.com/p/14pcs-foot-mask-exfoliating-anti-feet-odor-tender-milk-vinegar-masks-g713578.html,14Pcs Foot Mask Exfoliating Anti Feet Odor Tender Milk Vinegar Masks,Personal Care
899,$3.99,$6.99,http://www.jollychic.com/p/6pcs-hair-dye-cream-temporary-mixed-color-charming-hairstyling-g1044944.html,6Pcs Hair Dye Cream Temporary Mixed Color Charming Hairstyling,Personal Care
79,$5.99,,http://www.jollychic.com/p/one-pair-toe-corrector-soft-big-toe-spreader-convenient-health-care-tools-g799186.html,One Pair Toe Corrector Soft Big Toe Spreader Convenient Health Care Tools,Personal Care
762,$6.99,$12.99,http://www.jollychic.com/p/7pcs-hand-masks-whitening-moisturizing-smoothing-hand-care-g858910.html,7Pcs Hand Masks Whitening Moisturizing Smoothing Hand Care,Personal Care
247,$4.99,$7.99,http://www.jollychic.com/p/14pcs-teeth-bleaching-strips-professional-household-adhesive-stripes-g1099692.html,14Pcs Teeth Bleaching Strips Professional Household Adhesive Stripes,Personal Care
128,$2.99,$6.99,http://www.jollychic.com/p/dr-rashel-foot-cream-snake-oil-vaseline-moisturizing-anti-crack-foot-care-g575716.html,DR.RASHEL Foot Cream Snake Oil Vaseline Moisturizing Anti Crack Foot Care,Personal Care
886,$4.99,$6.99,http://www.jollychic.com/p/co-e-hairdressing-geltreatment-essential-oil-nutrition-repairing-hair-conditioner-g545248.html,CO.E Hairdressing Geltreatment Essential Oil Nutrition Repairing Hair Conditioner,Personal Care
5608,$2.99,$12.99,http://www.jollychic.com/p/smooth-moisturizing-body-gel-exfoliating-g369790.html,Smooth Moisturizing Body Gel Exfoliating,Personal Care
1001,$5.99,$8.99,http://www.jollychic.com/p/volcanic-mud-shower-gel-mild-non-stimulation-exfoliator-body-wash-g462598.html,Volcanic Mud Shower Gel Mild Non Stimulation Exfoliator Body Wash,Personal Care
6809,$5.99,,http://www.jollychic.com/p/5-pieces-belly-patch-wonder-weight-loss-fat-burning-slimming-fit-patch-g542808.html,5 Pieces Belly Patch Wonder Weight Loss Fat Burning Slimming Fit Patch,Personal Care
82,$5.99,,http://www.jollychic.com/p/one-pair-toe-correction-separator-silicone-pain-relief-health-tools-g1091188.html,One Pair Toe Correction Separator Silicone Pain Relief Health Tools,Personal Care
168,$7.99,$11.99,http://www.jollychic.com/p/depilatory-hard-wax-beans-strawberry-waxing-salon-hair-removal--g1186502.html,Depilatory Hard Wax Beans Strawberry Waxing Salon Hair Removal(,Personal Care
915,$4.99,$6.99,http://www.jollychic.com/p/chamomile-whole-body-skin-cream-whitening-moist-body-lotion-g406570.html,Chamomile Whole Body Skin Cream Whitening Moist Body Lotion,Personal Care
441,$5.99,,http://www.jollychic.com/p/5pcs-hand-cream-set-moisturizing-tightening-whitening-hand-care-g1182854.html,5Pcs Hand Cream Set Moisturizing Tightening Whitening Hand Care,Personal Care
2393,$5.99,,http://www.jollychic.com/p/crew-toe-socks-anti-skid-colorful-yoga-massage-health-care-tools-g775180.html,Crew Toe Socks Anti Skid Colorful Yoga Massage Health Care Tools,Personal Care
109,$6.99,,http://www.jollychic.com/p/24pcs-hair-dyeing-short-stick-set-multi-color-temporary-high-pigmentation-easy-hairstyling-tools-g468060.html,24Pcs Hair Dyeing Short Stick Set Multi Color Temporary High Pigmentation Easy Hairstyling Tools,Personal Care
6567,$5.99,,http://www.jollychic.com/p/back-bandage-humpback-correcting-belt-adjustable-fabric-shaping-health-care-g743984.html,Back Bandage Humpback Correcting Belt Adjustable Fabric Shaping Health Care,Personal Care
1222,$5.99,,http://www.jollychic.com/p/4pcs-hair-dye-pressed-powder-temporary-convenient-easy-wash-off-tools-g604722.html,4Pcs Hair Dye Pressed Powder Temporary Convenient Easy Wash Off Tools,Personal Care
2174,$5.99,,http://www.jollychic.com/p/bath-salt-lavender-exfoliating-nourish-tender-body-care-g455788.html,Bath Salt Lavender Exfoliating Nourish Tender Body Care,Personal Care
597,$6.99,$11.99,http://www.jollychic.com/p/2pcs-exfoliator-set-gentle-deep-cleansing-gel-whitening-smoothing-hand-and-foot-care-g858908.html,2Pcs Exfoliator Set Gentle Deep Cleansing Gel Whitening Smoothing Hand And Foot Care,Personal Care
242,$7.99,,http://www.jollychic.com/p/hair-conditioner-repairing-nourishing-haircare-lotion-g459154.html,Hair Conditioner Repairing Nourishing Haircare Lotion,Personal Care
816,$0.99,$5.99,http://www.jollychic.com/p/snail-hand-cream-nutrition-whitening-silky-moisturizing-hand-cream-g454432.html,Snail Hand Cream Nutrition Whitening Silky Moisturizing Hand Cream,Personal Care
1911,$8.99,$15.99,http://www.jollychic.com/p/chest-orthoses-large-size-humpback-rehabilitation-back-posture-correcting-belt-g978216.html,Chest Orthoses Large Size Humpback Rehabilitation Back Posture Correcting Belt,Personal Care
10766,$7.99,$14.99,http://www.jollychic.com/p/peeling-exfoliating-foot-mask-moisturizing-foot-care-4-pcs-g406826.html,Peeling Exfoliating Foot Mask Moisturizing Foot Care 4 PCS,Personal Care
1896,$4.99,,http://www.jollychic.com/p/1-pc-mini-hair-dye-comb-professional-hair-color-chalk-hair-dyeing-tool-g600656.html,1 Pc Mini Hair Dye Comb Professional Hair Color Chalk Hair Dyeing Tool,Personal Care
982,$7.99,$12.99,http://www.jollychic.com/p/doradosun-morocco-hair-oil-repairing-deep-nourishing-hair-care-g615892.html,DoraDoSun Morocco Hair Oil Repairing Deep Nourishing Hair Care,Personal Care
94,$5.99,,http://www.jollychic.com/p/one-pair-silicone-toe-corrector-soft-convenient-big-toe-spreader-health-care-tools-g798520.html,One Pair Silicone Toe Corrector Soft Convenient Big Toe Spreader Health Care Tools,Personal Care
113,$5.99,$8.99,http://www.jollychic.com/p/14-pcs-professional-teeth-whitening-strips-bleaching-whitener-g1112244.html,14 Pcs Professional Teeth Whitening Strips Bleaching Whitener,Personal Care
3903,$6.99,$11.99,http://www.jollychic.com/p/2pcs-foot-care-set-foot-salt-scrub-exfoliating-whitening-soften-value-set-g865314.html,2Pcs Foot Care Set Foot Salt Scrub Exfoliating Whitening Soften Value Set,Personal Care
2313,$7.99,$12.99,http://www.jollychic.com/p/4pcs-yoga-resistance-bands-stretch-belt-body-building-tools-g753934.html,4Pcs Yoga Resistance Bands Stretch Belt Body Building Tools,Personal Care
223,$4.99,$7.99,http://www.jollychic.com/p/agam-oil-keratin-nutrition-hair-mask-ointment-repairing-conditioner-g461358.html,Agam Oil Keratin Nutrition Hair Mask Ointment Repairing Conditioner,Personal Care
159,$14.99,$26.99,http://www.jollychic.com/p/la-sincia-marinegel-shampoo-deep-nourish-luxury-smoothing-hair-care-g955974.html,La SINCIA Marinegel Shampoo Deep Nourish Luxury Smoothing Hair Care,Personal Care
121,$6.99,,http://www.jollychic.com/p/beauty-artisan-4pcs-convenient-effective-hair-curling-tools-g319498.html,Beauty Artisan 4Pcs Convenient Effective Hair Curling Tools,Personal Care
1921,$3.99,,http://www.jollychic.com/p/banana-moisturizing-hand-care-cream-g346416.html,Banana Moisturizing Hand Care Cream,Personal Care
439,$2.99,$5.99,http://www.jollychic.com/p/solid-fruity-durable-light-scented-lady-s-balsam-g347948.html,Solid Fruity Durable Light Scented Lady's Balsam,Personal Care
244,$3.99,$6.99,http://www.jollychic.com/p/deep-sea-seaweed-cleansing-fresh-anti-dandruff-hair-soap-g348610.html,Deep Sea Seaweed Cleansing Fresh Anti Dandruff Hair Soap,Personal Care
256,$7.99,$11.99,http://www.jollychic.com/p/anti-odor-portable-spray-durable-net-balsam-odor-g357248.html,Anti Odor Portable Spray Durable Net Balsam Odor,Personal Care
179,$3.99,,http://www.jollychic.com/p/plastic-perm-bars-beautiful-curls-g364602.html,Plastic Perm Bars Beautiful Curls,Personal Care
440,$7.99,$15.99,http://www.jollychic.com/p/breast-beauty-massaging-cream-for-bust-augmentation-g365788.html,Breast Beauty Massaging Cream For Bust Augmentation,Personal Care
2295,$4.99,$9.99,http://www.jollychic.com/p/snail-exfoliating-whitening-moisturizing-body-cream-g365812.html,Snail Exfoliating Whitening Moisturizing Body Cream,Personal Care
6646,$3.99,$10.99,http://www.jollychic.com/p/health-care-foot-salt-whitening-exfoliating-g369820.html,Health Care Foot Salt Whitening & Exfoliating,Personal Care
672,$2.99,$10.99,http://www.jollychic.com/p/snail-whitening-regeneration-body-lotion-g370016.html,Snail Whitening Regeneration Body Lotion,Personal Care
67,$6.99,$17.99,http://www.jollychic.com/p/magic-hair-roller-for-bangs-hair-tails-five-pairs-g371724.html,Magic Hair Roller For Bangs Hair Tails Five Pairs,Personal Care
655,$4.99,,http://www.jollychic.com/p/convenient-sponge-hair-curler-6pcs-g372148.html,Convenient Sponge Hair Curler 6Pcs,Personal Care
93,$15.99,,http://www.jollychic.com/p/women-s-face-labial-hair-depilatory-cream-body-hair-removal-g403906.html,Women's Face Labial Hair Depilatory Cream Body Hair Removal,Personal Care
61,$16.99,,http://www.jollychic.com/p/whitening-moisturizing-exfoliating-hand-care-hand-mask-mud-g406780.html,Whitening Moisturizing Exfoliating Hand Care Hand Mask Mud,Personal Care
79,$10.99,,http://www.jollychic.com/p/multifunction-massage-device-body-pat-silicone-detoxifying-tool-g452868.html,Multifunction Massage Device Body Pat Silicone Detoxifying Tool,Personal Care
460,$4.99,$7.99,http://www.jollychic.com/p/foot-cream-moisturizing-anti-dryness-hydrating-body-care-g458296.html,Foot Cream Moisturizing Anti Dryness Hydrating Body Care,Personal Care
2939,$5.99,$8.99,http://www.jollychic.com/p/camellia-body-lotion-hydrating-exfoliating-smoothing-body-cream-g465176.html,Camellia Body Lotion Hydrating Exfoliating Smoothing Body Cream,Personal Care
204,$3.99,$5.99,http://www.jollychic.com/p/hairstyling-tools-5pcs-diy-easy-hair-bangs-fluffy-beauty-tools-g468482.html,Hairstyling Tools 5Pcs DIY Easy Hair Bangs Fluffy Beauty Tools,Personal Care
197,$1.99,$5.99,http://www.jollychic.com/p/avocado-depilatory-cream-no-stimulation-general-systemic-hair-remover-g473580.html,Avocado Depilatory Cream No Stimulation General Systemic Hair Remover,Personal Care
1670,$7.99,$11.99,http://www.jollychic.com/p/exfoliating-foot-scrub-cream-lavender-extract-dead-skin-removing-whitening-hand-scrub-g485402.html,Exfoliating Foot Scrub Cream Lavender Extract Dead Skin Removing Whitening Hand Scrub,Personal Care
1577,$5.99,$8.99,http://www.jollychic.com/p/hair-dryer-cap-good-quality-long-blow-pipe-hair-care-tool-g502704.html,Hair Dryer Cap Good Quality Long Blow Pipe Hair Care Tool,Personal Care
214,$2.99,$10.99,http://www.jollychic.com/p/dr-rashel-2-in-1-hair-oil-keratin-nursing-repairing-glossy-hair-care-oil-g513542.html,DR.RASHEL 2 In 1 Hair Oil Keratin Nursing Repairing Glossy Hair Care Oil,Personal Care
642,$6.99,$10.99,http://www.jollychic.com/p/dr-rashel-hair-oil-laurel-keratin-nursing-repairing-resistant-hair-care-oil-g513570.html,DR.RASHEL Hair Oil Laurel Keratin Nursing Repairing Resistant Hair Care Oil,Personal Care
390,$6.99,,http://www.jollychic.com/p/dr-rashel-foot-cream-cocoa-butter-and-vaseline-deep-nourishing-moist-foot-care-g575656.html,DR.RASHEL Foot Cream Cocoa Butter And Vaseline Deep Nourishing Moist Foot Care,Personal Care
273,$6.99,$9.99,http://www.jollychic.com/p/yoga-rope-body-exercise-muscular-extension-stretch-belt-without-mat-g600744.html,Yoga Rope Body Exercise Muscular Extension Stretch Belt Without Mat,Personal Care
185,$25.99,$31.99,http://www.jollychic.com/p/hair-curler-ceramic-led-display-long-lasting-curling-wavying-hairstyling-tools-g607106.html,Hair Curler Ceramic LED Display Long Lasting Curling Wavying Hairstyling Tools,Personal Care
424,$9.99,$13.99,http://www.jollychic.com/p/wrist-strength-exerciser-adjustable-perfect-forearm-strengthener-g610268.html,Wrist Strength Exerciser Adjustable Perfect Forearm Strengthener,Personal Care
638,$5.99,,http://www.jollychic.com/p/bath-hair-cap-double-layers-reusable-elastic-waterproof-salon-hat-g622948.html,Bath Hair Cap Double Layers Reusable Elastic Waterproof Salon Hat,Personal Care
22,$7.99,$12.99,http://www.jollychic.com/p/20pcs-hair-curler-with-hooks-fiber-magic-lasting-hairstyling-tools-g642754.html,20Pcs Hair Curler With Hooks Fiber Magic Lasting Hairstyling Tools,Personal Care
414,$10.99,,http://www.jollychic.com/p/42pcs-magic-hair-curler-rubber-lasting-soft-harmless-hairstyling-tools-g642918.html,42Pcs Magic Hair Curler Rubber Lasting Soft Harmless Hairstyling Tools,Personal Care
912,$4.99,$6.99,http://www.jollychic.com/p/2pcs-fitness-gliding-disc-exercise-sliding-plate-flexibility-improving-tools-g684842.html,2Pcs Fitness Gliding Disc Exercise Sliding Plate Flexibility Improving Tools,Personal Care
337,$8.99,,http://www.jollychic.com/p/hair-essence-oil-deep-nourishing-strengthen-repair-hair-conditioner-g694878.html,Hair Essence Oil Deep Nourishing Strengthen Repair Hair Conditioner,Personal Care
440,$10.99,$13.99,http://www.jollychic.com/p/bath-blaster-cute-duck-deep-cleansing-exfoliating-body-wash-bath-ball-g707742.html,Bath Blaster Cute Duck Deep Cleansing Exfoliating Body Wash Bath Ball,Personal Care
16,$37.99,,http://www.jollychic.com/p/electric-hair-clipper-rechargable-professional-g708582.html,Electric Hair Clipper Rechargable Professional,Personal Care
1163,$5.99,$8.99,http://www.jollychic.com/p/depilatory-cream-hair-removal-gentle-deep-clean-for-men-and-women-g732994.html,Depilatory Cream Hair Removal Gentle Deep Clean For Men And Women,Personal Care
3138,$7.99,$11.99,http://www.jollychic.com/p/women-s-electric-shaver-portable-waterproof-safe-beauty-tools-g737322.html,Women's Electric Shaver Portable Waterproof Safe Beauty Tools,Personal Care
180,$5.99,,http://www.jollychic.com/p/8pcs-interdental-cleansers-toothpick-brush-deep-cleansing-personal-care-g742032.html,8Pcs Interdental Cleansers Toothpick Brush Deep Cleansing Personal Care,Personal Care
603,$5.99,,http://www.jollychic.com/p/hip-lift-massage-cream-buttocks-enhancement-enlargement-cream-g765510.html,Hip Lift Massage Cream Buttocks Enhancement Enlargement Cream,Personal Care
335,$10.99,,http://www.jollychic.com/p/waist-support-belt-adjustable-tourmaline-self-heating-magnetic-health-care-g775750.html,Waist Support Belt Adjustable Tourmaline Self Heating Magnetic Health Care,Personal Care
112,$8.99,$13.99,http://www.jollychic.com/p/hair-conditioner-natural-tea-seed-anti-dandruff-oil-control-hair-care-g788720.html,Hair Conditioner Natural Tea Seed Anti Dandruff Oil Control Hair Care,Personal Care
880,$3.99,$6.99,http://www.jollychic.com/p/foot-file-stainless-steel-smooth-portable-exfoliating-foot-care-tool-g790736.html,Foot File Stainless Steel Smooth Portable Exfoliating Foot Care Tool,Personal Care
36,$1.99,$5.99,http://www.jollychic.com/p/one-pair-toe-corrector-breathable-toe-spreader-comfort-forefoot-protect-health-care-tools-g799448.html,One Pair Toe Corrector Breathable Toe Spreader Comfort Forefoot Protect Health Care Tools,Personal Care
78,$10.99,$16.99,http://www.jollychic.com/p/2-pairs-gel-toe-separator-bunion-straightener-splint-for-hammer-toe-g847400.html,2 Pairs Gel Toe Separator Bunion Straightener Splint For Hammer Toe,Personal Care
209,$3.99,$8.99,http://www.jollychic.com/p/3-pairs-forefoot-pad-pain-relief-relax-multi-function-forefoot-inserts-g914286.html,3 Pairs Forefoot Pad Pain Relief Relax Multi Function Forefoot Inserts,Personal Care
29,$8.99,$14.99,http://www.jollychic.com/p/prime-blue-men-s-hair-wax-long-lasting-moisturizing-matte-hairstyling-wax-g922206.html,PRIME BLUE Men's Hair Wax Long Lasting Moisturizing Matte Hairstyling Wax,Personal Care
96,$8.99,,http://www.jollychic.com/p/2-pairs-gel-heel-sleeves-moisture-protective-with-massage-ball-foot-arch-support-g922706.html,2 Pairs Gel Heel Sleeves Moisture Protective With Massage Ball Foot Arch Support,Personal Care
26,$28.99,$43.99,http://www.jollychic.com/p/schwarzkopf-shampoo-anti-dandruff-smooth-hair-wash-g937208.html,Schwarzkopf Shampoo Anti dandruff Smooth Hair Wash,Personal Care
39,$23.99,$39.99,http://www.jollychic.com/p/schwarzkopf-polyflor-hair-shampoo-repair-dull-cleasning-sulpple-hair-wash-g938510.html,Schwarzkopf Polyflor Hair shampoo Repair Dull Cleasning Sulpple Hair Wash,Personal Care
147,$6.99,$11.99,http://www.jollychic.com/p/kao-3pcs-bath-soap-orange-scent-refreshing-whitening-smooth-shower-body-wash-g948844.html,KAO 3Pcs Bath Soap Orange Scent Refreshing Whitening Smooth Shower Body Wash,Personal Care
97,$2.99,$5.99,http://www.jollychic.com/p/baimiss-body-lotion-sheep-oil-silky-whitening-moisturizing-body-care-g954890.html,Baimiss Body Lotion Sheep Oil Silky Whitening Moisturizing Body Care,Personal Care
57,$5.99,,http://www.jollychic.com/p/2-pairs-gel-toe-separators-double-size-slimming-relief-health-care-g965658.html,2 Pairs Gel Toe Separators Double Size Slimming Relief Health Care,Personal Care
5,$28.99,,http://www.jollychic.com/p/kangfu-hair-drier-blue-light-advanced-negative-ion-household-hairstyle-g1004184.html,KangFu Hair Drier Blue Light Advanced Negative Ion Household Hairstyle,Personal Care
24,$9.99,,http://www.jollychic.com/p/hair-brush-massage-scalp-smooth-delicate-hairstyling-comb-g1056430.html,Hair Brush Massage Scalp Smooth Delicate Hairstyling Comb,Personal Care
53,$11.99,$16.99,http://www.jollychic.com/p/ylg-mini-hair-straightener-travel-size-convenient-hairstyling-tool-g1078742.html,YLG Mini Hair Straightener Travel Size Convenient Hairstyling Tool,Personal Care
55,$7.99,,http://www.jollychic.com/p/2-pairs-toe-separators-set-unisex-professional-health-care-tools-g1078748.html,2 Pairs Toe Separators Set Unisex Professional Health Care Tools,Personal Care
288,$5.99,,http://www.jollychic.com/p/100pcs-hair-removal-papers-with-thicken-nonwovens-skin-care-mild-sets-g1081618.html,100Pcs Hair Removal Papers With Thicken Nonwovens Skin Care Mild Sets,Personal Care
11,$34.99,,http://www.jollychic.com/p/kangfu-hair-straightener-curling-wavying-multi-function-hairstyling-tool-g1099600.html,KangFu Hair Straightener Curling Wavying Multi Function Hairstyling Tool,Personal Care
