add_wish,discount_price,original_price,product_link,product_name,header_block
6,$7.99,$10.99,http://www.jollychic.com/p/high-pressure-hairdressing-flower-spray-bottle-sprayer-g1110024.html,High Pressure Hairdressing Flower Spray Bottle Sprayer,Personal Care
293,$6.99,$10.99,http://www.jollychic.com/p/9pcsteeth-whitening-bleaching-system-oral-gel-kit-tooth-whitener-sets-g1112606.html,9PcsTeeth Whitening Bleaching System Oral Gel Kit Tooth Whitener Sets,Personal Care
21,$5.99,,http://www.jollychic.com/p/feet-cuticle-callus-hard-skin-rasp-remove-file-pedicure-corn-cutter-20-blade-g1114404.html,Feet Cuticle Callus Hard Skin Rasp Remove File Pedicure Corn Cutter + 20 Blade,Personal Care
23,$31.99,,http://www.jollychic.com/p/hair-straightener-professional-multi-functions-temperature-control-quick-heated-hairstyling-tool-g1122106.html,Hair Straightener Professional Multi Functions Temperature Control Quick Heated Hairstyling Tool,Personal Care
45,$17.99,$26.99,http://www.jollychic.com/p/electronic-acupuncture-massage-pen-meridians-laser-magnet-therapy-health-care-g1123340.html,Electronic Acupuncture Massage Pen Meridians Laser Magnet Therapy Health Care,Personal Care
2,$13.99,,http://www.jollychic.com/p/hair-tool-multi-functional-dual-use-perfect-smooth-straightener-hair-curl-portable-hair-styling-g1123988.html,Hair Tool Multi Functional Dual Use Perfect Smooth Straightener Hair Curl Portable Hair Styling,Personal Care
36,$5.99,,http://www.jollychic.com/p/body-massager-hammer-one-piece-multi-function-pat-relaxing-health-care-g1154464.html,Body Massager Hammer One Piece Multi Function Pat Relaxing Health Care,Personal Care
8,$5.99,,http://www.jollychic.com/p/foot-rubbingtool-simple-useful-exfoliator-remove-personal-health-care-tool-g1175308.html,Foot RubbingTool Simple Useful Exfoliator Remove Personal Health Care Tool,Personal Care
70,$8.99,,http://www.jollychic.com/p/hair-brush-salon-barber-high-temperature-resistant-ceramic-iron-round-comb-g1186496.html,Hair Brush Salon Barber High Temperature Resistant Ceramic Iron Round Comb,Personal Care
7,$5.99,,http://www.jollychic.com/p/menstrual-pads-bag-10-colors-washable-pouch-reusable-sanitary-pads-g1211830.html,Menstrual Pads Bag 10 Colors Washable Pouch Reusable Sanitary Pads,Personal Care
117,$5.99,,http://www.jollychic.com/p/waxing-beans-rose-aroma-depilatory-arm-leg-hair-removal-g1250334.html,Waxing Beans Rose Aroma Depilatory Arm Leg Hair Removal,Personal Care
30,$11.99,,http://www.jollychic.com/p/hard-wax-beans-tea-tree-extract-beauty-salon-depilatory-dedicated-hair-removal-g1274840.html,Hard Wax Beans Tea Tree Extract Beauty Salon Depilatory Dedicated Hair Removal,Personal Care
5,$7.99,,http://www.jollychic.com/p/beads-balls-slimming-massager-handled-full-body-massage-heath-tools-g1299662.html,Beads Balls Slimming Massager Handled Full Body Massage Heath Tools,Personal Care
1521,$10.99,,http://www.jollychic.com/p/3pcs-facial-roller-nose-straightening-shaping-slimming-facial-massager-set-g273981.html,3Pcs Facial Roller Nose Straightening Shaping Slimming Facial Massager Set,Personal Care
586,$4.99,$12.99,http://www.jollychic.com/p/doradosun-organic-fruits-ingredients-moisturizing-exfoliating-gel-for-feet-g298606.html,DoraDoSun Organic Fruits Ingredients Moisturizing Exfoliating Gel For Feet,Personal Care
93,$4.99,,http://www.jollychic.com/p/beautyblend-diy-hair-styling-roller-curlers-clips-in-three-colors-g315832.html,Beautyblend DIY Hair Styling Roller Curlers Clips In Three Colors,Personal Care
408,$13.99,,http://www.jollychic.com/p/natural-shea-butter-moisturizing-hand-cream-g341052.html,Natural Shea Butter Moisturizing Hand Cream,Personal Care
154,$6.99,,http://www.jollychic.com/p/rose-otto-scented-long-lasting-portable-women-balsam-g347852.html,Rose Otto Scented Long Lasting Portable Women Balsam,Personal Care
197,$5.99,,http://www.jollychic.com/p/floral-fruity-solid-perfume-lasting-balsam-g348020.html,Floral Fruity Solid Perfume Lasting Balsam,Personal Care
1361,$4.99,$6.99,http://www.jollychic.com/p/legs-oil-slimming-essential-oil-g351356.html,Legs Oil Slimming Essential Oil,Personal Care
646,$2.99,$5.99,http://www.jollychic.com/p/damaged-hair-repairing-smooth-snail-essence-hair-care-mask-g371366.html,Damaged Hair Repairing Smooth Snail Essence Hair Care Mask,Personal Care
658,$4.99,,http://www.jollychic.com/p/useful-hair-bun-tool-hair-comb-set-5-sets-g371930.html,Useful Hair Bun Tool Hair Comb Set 5 Sets,Personal Care
52,$2.99,,http://www.jollychic.com/p/multi-functional-useful-hair-updo-tool-hair-roller-middle-size-2-sets-g371934.html,Multi Functional Useful Hair Updo Tool Hair Roller Middle Size 2 Sets,Personal Care
127,$5.99,,http://www.jollychic.com/p/3pcs-u-shape-quick-updo-tool-hair-styling-tools-g372014.html,3Pcs U Shape Quick Updo Tool Hair Styling Tools,Personal Care
21,$28.99,,http://www.jollychic.com/p/rose-depilation-set-repair-solution-depilatory-wax-paper-g374434.html,Rose Depilation Set Repair Solution Depilatory Wax Paper,Personal Care
197,$12.99,$20.99,http://www.jollychic.com/p/depilation-set-repair-solution-depilatory-wax-paper-g374836.html,Depilation Set Repair Solution Depilatory Wax Paper,Personal Care
5524,$8.99,$14.99,http://www.jollychic.com/p/barley-rice-milk-exfoliating-foot-mask-foot-care-4-pcs-g406834.html,Barley Rice Milk Exfoliating Foot Mask Foot Care 4 PCS,Personal Care
101,$7.99,,http://www.jollychic.com/p/hair-comb-fantastic-health-care-professional-massaging-comb-g416412.html,Hair Comb Fantastic Health Care Professional Massaging Comb,Personal Care
413,$8.99,,http://www.jollychic.com/p/hair-removal-cream-armpit-hair-leg-hair-depilatory-cream-g428018.html,Hair Removal Cream Armpit Hair Leg Hair Depilatory Cream,Personal Care
373,$5.99,,http://www.jollychic.com/p/goat-milk-body-lotion-moisturizing-nutrition-repairing-milk-g441764.html,Goat Milk Body Lotion Moisturizing Nutrition Repairing Milk,Personal Care
47,$4.99,,http://www.jollychic.com/p/short-scraping-tool-home-environmental-health-message-device-g452468.html,Short Scraping Tool Home Environmental Health Message Device,Personal Care
588,$5.99,,http://www.jollychic.com/p/massage-brush-blood-circulation-slimming-health-care-g452892.html,Massage Brush Blood Circulation Slimming Health Care,Personal Care
45,$5.99,,http://www.jollychic.com/p/multifunction-massage-device-silicone-health-tools-g453722.html,Multifunction Massage Device Silicone Health Tools,Personal Care
142,$4.99,,http://www.jollychic.com/p/5pcs-hair-updo-tools-beautiful-delicate-hair-styling-tapes-g455262.html,5Pcs Hair Updo Tools Beautiful Delicate Hair Styling Tapes,Personal Care
2724,$5.99,$8.99,http://www.jollychic.com/p/hairstyling-tools-20pcs-diy-buns-combs-hair-clips-easy-portable-beauty-tools-g492258.html,Hairstyling Tools 20Pcs DIY Buns Combs Hair Clips Easy Portable Beauty Tools,Personal Care
36,$2.99,$6.99,http://www.jollychic.com/p/dr-rashel-hair-wax-hold-shaping-hairstyling-moist-long-lasting-hair-care-g513312.html,DR.RASHEL Hair Wax Hold Shaping Hairstyling Moist Long Lasting Hair Care,Personal Care
289,$5.99,$10.99,http://www.jollychic.com/p/hair-oil-almond-sesame-nursing-repairing-glossy-hair-care-oil-g513574.html,Hair Oil Almond & Sesame Nursing Repairing Glossy Hair Care Oil,Personal Care
116,$6.99,,http://www.jollychic.com/p/dr-rashel-soap-black-sesame-collagen-moist-natural-exfoliating-body-wash-g513652.html,DR.RASHEL Soap Black Sesame Collagen Moist Natural Exfoliating Body Wash,Personal Care
74,$9.99,,http://www.jollychic.com/p/dr-rashel-chamomile-hair-nutrition-mask-repairing-moisturizing-conditioner-g513776.html,DR.RASHEL Chamomile Hair Nutrition Mask Repairing Moisturizing Conditioner,Personal Care
901,$5.99,$9.99,http://www.jollychic.com/p/dr-rashel-bath-soap-whitening-moisturizing-crystal-collagen-soap-g517900.html,DR.RASHEL Bath Soap Whitening Moisturizing Crystal Collagen Soap,Personal Care
215,$16.99,$25.99,http://www.jollychic.com/p/resistance-band-fabric-strech-fat-burning-muscle-buliding-elastic-strap-g579708.html,Resistance Band Fabric Strech Fat Burning Muscle Buliding Elastic Strap,Personal Care
89,$8.99,,http://www.jollychic.com/p/hair-comb-detangling-massage-smooth-portable-flower-pattern-hair-care-g600858.html,Hair Comb Detangling Massage Smooth Portable Flower Pattern Hair Care,Personal Care
3387,$5.99,$11.99,http://www.jollychic.com/p/2pcs-pushup-equipment-workout-pectoral-exercise-muscle-building-tools-g610270.html,2Pcs Pushup Equipment Workout Pectoral Exercise Muscle Building Tools,Personal Care
1532,$6.99,$11.99,http://www.jollychic.com/p/pilates-circle-magic-fitness-weight-loss-breast-enhancement-yoga-ring-g622924.html,Pilates Circle Magic Fitness Weight Loss Breast Enhancement Yoga Ring,Personal Care
137,$2.99,$10.99,http://www.jollychic.com/p/shampoo-anti-dandruff-kill-head-lice-deep-clean-hair-wash-g701158.html,Shampoo Anti Dandruff Kill Head Lice Deep Clean Hair Wash,Personal Care
747,$10.99,$13.99,http://www.jollychic.com/p/bath-blaster-lavender-oil-hydrating-soothing-deep-clean-bath-ball-g707744.html,Bath Blaster Lavender Oil Hydrating Soothing Deep Clean Bath Ball,Personal Care
333,$3.99,$6.99,http://www.jollychic.com/p/5pcs-hair-braiding-tool-quick-convenient-diy-hairstyling-tool-g716584.html,5Pcs Hair Braiding Tool Quick Convenient DIY Hairstyling Tool,Personal Care
127,$6.99,,http://www.jollychic.com/p/5pcs-hair-braiding-tool-sponge-flower-shape-elegant-hairstyling-tool-g716956.html,5Pcs Hair Braiding Tool Sponge Flower Shape Elegant Hairstyling Tool,Personal Care
115,$5.99,,http://www.jollychic.com/p/5pcs-interdental-cleansers-toothpick-brush-deep-cleansing-personal-care-g753856.html,5Pcs Interdental Cleansers Toothpick Brush Deep Cleansing Personal Care,Personal Care
297,$5.99,,http://www.jollychic.com/p/foot-scrub-exfoliatong-massage-dead-skin-remove-foot-care-g755350.html,Foot Scrub Exfoliatong Massage Dead Skin Remove Foot Care,Personal Care
770,$8.99,$13.99,http://www.jollychic.com/p/bath-blaster-rose-essential-extract-fragrance-durable-deep-clean-bath-ball-g760694.html,Bath Blaster Rose Essential Extract Fragrance Durable Deep Clean Bath Ball,Personal Care
27,$5.99,,http://www.jollychic.com/p/hair-brush-colorful-crooked-handle-hair-massaging-hairstyling-comb-g784344.html,Hair Brush Colorful Crooked Handle Hair Massaging Hairstyling Comb,Personal Care
142,$1.99,$5.99,http://www.jollychic.com/p/one-pair-silicone-toe-correctors-protecting-toe-spreaders-breathable-health-care-tools-g798156.html,One Pair Silicone Toe Correctors Protecting Toe Spreaders Breathable Health Care Tools,Personal Care
1986,$10.99,$13.99,http://www.jollychic.com/p/bath-blaster-rose-essence-nourish-moisture-deep-clean-bath-ball-g805760.html,Bath Blaster Rose Essence Nourish Moisture Deep Clean Bath Ball,Personal Care
191,$5.99,,http://www.jollychic.com/p/3pcs-hand-cream-set-snail-essence-nourishing-whitening-hand-care-g856016.html,3Pcs Hand Cream Set Snail Essence Nourishing Whitening Hand Care,Personal Care
286,$5.99,,http://www.jollychic.com/p/one-pair-knee-pads-tourmaline-self-heating-magnetic-therapy-health-care-tools-g859268.html,One Pair Knee Pads Tourmaline Self-Heating Magnetic Therapy Health Care Tools,Personal Care
298,$12.99,$20.99,http://www.jollychic.com/p/8pcs-foot-hand-mask-set-deep-nourish-soften-smooth-hand-foot-care-g867854.html,8Pcs Foot Hand Mask Set Deep Nourish Soften Smooth Hand Foot Care,Personal Care
35,$43.99,,http://www.jollychic.com/p/sausand-o-20pcs-body-slimming-cream-tightening-portable-fat-burning-cream-g913062.html,SAUSAND'O 20Pcs Body Slimming Cream Tightening Portable Fat Burning Cream,Personal Care
56,$7.99,,http://www.jollychic.com/p/2pcs-gel-heel-sleeves-white-with-massage-ball-foot-arch-support-value-set-g922642.html,2Pcs Gel Heel Sleeves White With Massage Ball Foot Arch Support Value Set,Personal Care
86,$8.99,,http://www.jollychic.com/p/2-pairs-gel-heel-white-sleeves-foot-arch-support-with-massage-ball-g922702.html,2 Pairs Gel Heel White Sleeves Foot Arch Support With Massage Ball,Personal Care
61,$8.99,,http://www.jollychic.com/p/hair-brush-horn-comb-retro-simple-designed-solid-no-static-comb-g934994.html,Hair Brush Horn Comb Retro Simple Designed Solid No Static Comb,Personal Care
78,$4.99,$8.99,http://www.jollychic.com/p/2pcs-body-exfoliating-cream-deep-clean-dead-skin-remove-watery-body-care-g939354.html,2Pcs Body Exfoliating Cream Deep Clean Dead Skin Remove Watery Body Care,Personal Care
70,$20.99,$41.99,http://www.jollychic.com/p/aromakifi-hair-conditioner-deep-moisture-smooth-natural-plant-extract-hair-care-g943324.html,AROMAKIFI Hair Conditioner Deep Moisture Smooth Natural Plant Extract Hair Care,Personal Care
207,$6.99,$12.99,http://www.jollychic.com/p/liberta-armpit-whitening-cream-deep-clean-smooth-anti-sweat-personal-care-g943348.html,Liberta Armpit Whitening Cream Deep Clean Smooth Anti Sweat Personal Care,Personal Care
142,$15.99,$28.99,http://www.jollychic.com/p/liberta-baby-foot-exfoliating-mask-foot-tender-remove-dead-skin-g949774.html,Liberta Baby Foot Exfoliating Mask Foot Tender Remove Dead Skin,Personal Care
36,$8.99,,http://www.jollychic.com/p/miss-rose-liquid-hand-soap-aloe-vitamin-e-deep-cleaning-gentle-hand-sanitizer-g953624.html,MISS ROSE Liquid Hand Soap Aloe Vitamin E Deep Cleaning Gentle Hand Sanitizer,Personal Care
33,$3.99,$5.99,http://www.jollychic.com/p/aroma-kifi-2pcs-hair-conditioner-travel-size-fluffy-moist-silicon-free-hair-care-g963440.html,AROMA KIFI 2Pcs Hair Conditioner Travel Size Fluffy Moist Silicon Free Hair Care,Personal Care
25,$9.99,$19.99,http://www.jollychic.com/p/kao-prettia-foam-hair-dye-deep-brown-elegant-long-lasting-easy-diy-hairstyling-g981612.html,KAO PRETTIA Foam Hair Dye Deep Brown Elegant Long Lasting Easy DIY Hairstyling,Personal Care
54,$5.99,,http://www.jollychic.com/p/3-pairs-toe-guard-shield-spacers-fast-pain-relief-health-tools-g1056410.html,3 Pairs Toe Guard Shield Spacers Fast Pain Relief Health Tools,Personal Care
102,$14.99,,http://www.jollychic.com/p/sixplus-mini-massage-device-portable-butterfly-shaped-multi-functional-massage-body-shape-device-g1139522.html,SIXPLUS Mini Massage Device Portable Butterfly Shaped Multi-Functional Massage Body Shape Device,Personal Care
13,$10.99,,http://www.jollychic.com/p/haircut-cape-stripe-hairdressing-cloth-wrap-for-barber-gown-salon-g1209128.html,Haircut Cape Stripe Hairdressing Cloth Wrap for Barber Gown Salon,Personal Care
3,$10.99,,http://www.jollychic.com/p/hair-brush-45mm-professional-hair-dressing-high-temperature-resistant-comb-g1274850.html,Hair Brush 45mm Professional Hair Dressing High Temperature Resistant Comb,Personal Care
30,$5.99,,http://www.jollychic.com/p/yoga-fitness-ball-home-pilates-thicken-balance-sport-training-tool-g1279298.html,Yoga Fitness Ball Home Pilates Thicken Balance Sport Training Tool,Personal Care
93,$5.99,,http://www.jollychic.com/p/hair-comb-egg-shape-candy-color-anti-static-smooth-hair-brush-g1292276.html,Hair Comb Egg Shape Candy Color Anti Static Smooth Hair Brush,Personal Care
0,$43.99,,http://www.jollychic.com/p/hair-tool-multi-functional-both-straightener-curler-smooth-comb-hairstyling-tool-g1304564.html,Hair Tool Multi functional Both Straightener Curler Smooth Comb Hairstyling Tool,Personal Care
6,$5.99,,http://www.jollychic.com/p/hand-cream-herbacin-smell-extract-smoothing-whitening-soft-hand-care-g1304568.html,Hand Cream Herbacin Smell Extract Smoothing Whitening Soft Hand Care,Personal Care
5,$10.99,,http://www.jollychic.com/p/2-pairs-silicone-heel-pads-relieve-pain-foot-care-tool-g1305146.html,2 Pairs Silicone Heel Pads Relieve Pain Foot Care Tool,Personal Care
2,$11.99,,http://www.jollychic.com/p/3pcs-finger-strecher-hand-and-wrist-trainer-yoga-resistance-band-finger-exercise-g1309182.html,3Pcs Finger Strecher Hand And Wrist Trainer Yoga Resistance Band Finger Exercise,Personal Care
397,$3.99,$7.99,http://www.jollychic.com/p/nivea-hand-cream-deep-nourish-soften-refresh-sheer-hand-cream-g948788.html,Nivea Hand Cream Deep Nourish Soften Refresh Sheer Hand Cream,Personal Care
2211,$5.99,$8.99,http://www.jollychic.com/p/back-bath-scrubber-one-piece-silicone-dual-sided-chopping-belt-scrubber-g861566.html,Back Bath Scrubber One Piece Silicone Dual Sided Chopping Belt Scrubber,Personal Care
1291,$2.99,,http://www.jollychic.com/p/co-e-organic-blueberry-extracts-whitening-tender-hand-cream-g327218.html,CO.E Organic Blueberry Extracts Whitening Tender Hand Cream,Personal Care
3542,$5.99,,http://www.jollychic.com/p/doradosun-exfoliator-anti-acne-tender-body-cream-g339326.html,DoraDoSun Exfoliator Anti Acne Tender Body Cream,Personal Care
170,$6.99,,http://www.jollychic.com/p/natural-cinnamon-shampoo-soap-conditioning-treatment-g348428.html,Natural Cinnamon Shampoo Soap Conditioning Treatment,Personal Care
194,$3.99,$6.99,http://www.jollychic.com/p/natural-lavender-essential-oil-shampoo-soap-g348562.html,Natural Lavender Essential Oil Shampoo Soap,Personal Care
4076,$2.99,$8.99,http://www.jollychic.com/p/tightening-belly-patches-slimming-paster-5pcs-g365620.html,Tightening Belly Patches Slimming Paster 5Pcs,Personal Care
1062,$4.99,$9.99,http://www.jollychic.com/p/whitening-bright-milk-smooth-firming-body-cream-g365636.html,Whitening Bright Milk Smooth Firming Body Cream,Personal Care
381,$7.99,$11.99,http://www.jollychic.com/p/body-odor-liquid-remove-bromhidrosis-g366048.html,Body Odor Liquid Remove Bromhidrosis,Personal Care
6045,$3.99,$10.99,http://www.jollychic.com/p/exfoliating-smooth-soothing-whitening-cleansing-soap-g369330.html,Exfoliating Smooth Soothing Whitening Cleansing Soap,Personal Care
159,$4.99,,http://www.jollychic.com/p/spiral-delicate-hair-styling-tool-for-updo-g372112.html,Spiral Delicate Hair Styling Tool For Updo,Personal Care
172,$13.99,,http://www.jollychic.com/p/hair-removal-cream-repair-lotion-depilation-suits-g373960.html,Hair Removal Cream + Repair Lotion Depilation Suits,Personal Care
106,$3.99,$5.99,http://www.jollychic.com/p/soapmeet-ice-orange-fresh-light-scented-solid-perfume-g381762.html,Soapmeet Ice Orange Fresh Light Scented Solid Perfume,Personal Care
231,$38.99,,http://www.jollychic.com/p/lavender-essential-oil-fragrance-skin-oil-balance-essence-g405640.html,Lavender Essential Oil Fragrance Skin Oil Balance Essence,Personal Care
99,$32.99,,http://www.jollychic.com/p/geranium-essential-oil-fragrance-skin-detoxification-firmming-essence-g405818.html,Geranium Essential Oil Fragrance Skin Detoxification Firmming Essence,Personal Care
829,$9.99,$11.99,http://www.jollychic.com/p/hair-comb-health-care-high-quality-air-bag-massaging-comb-g417114.html,Hair Comb Health Care High Quality Air Bag Massaging Comb,Personal Care
1167,$4.99,$7.99,http://www.jollychic.com/p/hair-dye-pencil-disposable-6-colors-lasting-hair-tintage-g435830.html,Hair Dye Pencil Disposable 6 Colors Lasting Hair Tintage,Personal Care
4179,$2.99,$6.99,http://www.jollychic.com/p/hand-cream-moist-anti-wrinkles-nourishing-lasting-hand-care-g437404.html,Hand Cream Moist Anti Wrinkles Nourishing Lasting Hand Care,Personal Care
71,$13.99,,http://www.jollychic.com/p/dandruff-clear-essence-fresh-nourish-moist-lasting-hair-care-g441754.html,Dandruff Clear Essence Fresh Nourish Moist Lasting Hair Care,Personal Care
26,$6.99,,http://www.jollychic.com/p/long-scraping-tool-home-environmental-health-message-device-g452454.html,Long Scraping Tool Home Environmental Health Message Device,Personal Care
106,$2.99,$5.99,http://www.jollychic.com/p/multifunction-massager-neck-waist-anti-fatigue-five-balls-health-care-g452958.html,Multifunction Massager Neck Waist Anti Fatigue Five Balls Health Care,Personal Care
496,$6.99,$10.99,http://www.jollychic.com/p/magic-hair-curler-pearl-cotton-gift-set-42pcs-g458828.html,Magic Hair Curler Pearl Cotton Gift Set 42Pcs,Personal Care
109,$8.99,,http://www.jollychic.com/p/plant-essence-body-lotion-moisturizing-smooth-body-care-milk-g462830.html,Plant Essence Body Lotion Moisturizing Smooth Body Care Milk,Personal Care
3035,$5.99,,http://www.jollychic.com/p/hair-dryer-cap-good-quality-hair-treatment-solid-beauty-hairstyling-tools-g467926.html,Hair Dryer Cap Good Quality Hair Treatment Solid Beauty Hairstyling Tools,Personal Care
28,$5.99,,http://www.jollychic.com/p/hairstyling-tools-5pcs-diy-hair-fluffy-useful-easy-beauty-tools-g468464.html,Hairstyling Tools 5Pcs DIY Hair Fluffy Useful Easy Beauty Tools,Personal Care
99,$5.99,,http://www.jollychic.com/p/kafuka-marine-fragrance-soap-moisturizing-deep-clean-skin-soap-g468982.html,Kafuka Marine Fragrance Soap Moisturizing Deep Clean Skin Soap,Personal Care
214,$2.99,$5.99,http://www.jollychic.com/p/dr-rashel-aloe-depilatory-cream-no-stimulation-general-armpit-hair-remover-g473622.html,DR.RASHEL Aloe Depilatory Cream No Stimulation General Armpit Hair Remover,Personal Care
91,$6.99,,http://www.jollychic.com/p/detangling-brush-multi-size-massage-smoothing-hair-brush-comb-g475208.html,Detangling Brush Multi Size Massage Smoothing Hair Brush Comb,Personal Care
187,$7.99,$12.99,http://www.jollychic.com/p/body-slimming-cream-thin-waist-leg-belly-body-massage-cream-g476638.html,Body Slimming Cream Thin Waist Leg Belly Body Massage Cream,Personal Care
1809,$7.99,$11.99,http://www.jollychic.com/p/hand-care-gloves-4pairs-nourishing-protecting-moist-whitening-hand-treatment-g485762.html,Hand Care Gloves 4Pairs Nourishing Protecting Moist Whitening Hand Treatment,Personal Care
520,$7.99,,http://www.jollychic.com/p/rose-essential-oil-soap-fresh-moisturizing-handmade-soap-g513794.html,Rose Essential Oil Soap Fresh Moisturizing Handmade Soap,Personal Care
1626,$4.99,$7.99,http://www.jollychic.com/p/stop-snoring-bandage-adjustable-jaw-support-breathable-bandage-g547086.html,Stop Snoring Bandage Adjustable Jaw Support Breathable Bandage,Personal Care
318,$4.99,$10.99,http://www.jollychic.com/p/dr-rashel-hand-mask-5pcs-dead-sea-mud-exfoliating-moisturizing-hand-care-g574554.html,DR.RASHEL Hand Mask 5Pcs Dead Sea Mud Exfoliating Moisturizing Hand Care,Personal Care
59,$4.99,$10.99,http://www.jollychic.com/p/hair-comb-flower-pattern-massage-portable-convenient-hair-care-g600856.html,Hair Comb Flower Pattern Massage Portable Convenient Hair Care,Personal Care
187,$4.99,,http://www.jollychic.com/p/lameila-hair-curler-small-bang-sponge-curler-hairdressing-tools-g600956.html,Lameila Hair Curler Small Bang Sponge Curler Hairdressing Tools,Personal Care
707,$4.99,$7.99,http://www.jollychic.com/p/20pcs-hairstyling-tools-diy-buns-combs-hair-clips-easy-portable-beauty-tools-g632106.html,20Pcs Hairstyling Tools DIY Buns Combs Hair Clips Easy Portable Beauty Tools,Personal Care
1690,$5.99,,http://www.jollychic.com/p/one-pair-spa-socks-essence-oil-nourishing-reuseable-soften-foot-care-g691870.html,One Pair Spa Socks Essence Oil Nourishing Reuseable Soften Foot Care,Personal Care
179,$5.99,$10.99,http://www.jollychic.com/p/hand-mask-charcoal-peel-off-exfoliating-moisture-hand-care-g701088.html,Hand Mask Charcoal Peel Off Exfoliating Moisture Hand Care,Personal Care
167,$6.99,,http://www.jollychic.com/p/5pcs-hair-braiding-tool-easy-diy-lasting-hairstyling-tool-g719952.html,5Pcs Hair Braiding Tool Easy DIY Lasting Hairstyling Tool,Personal Care
1051,$5.99,,http://www.jollychic.com/p/yoga-fitness-ball-home-exercise-balance-trainer-physical-weight-loss-tool-g723650.html,Yoga Fitness Ball Home Exercise Balance Trainer Physical Weight Loss Tool,Personal Care
69,$3.99,$6.99,http://www.jollychic.com/p/anti-perspirant-rolling-on-armpit-refreshing-deodorant-for-men-and-women-g755150.html,Anti Perspirant Rolling On Armpit Refreshing Deodorant For Men And Women,Personal Care
150,$5.99,$10.99,http://www.jollychic.com/p/7-pairsfoot-patches-5-pairs-anti-fatigue-detoxifying-adhesives-foot-care-g755696.html,7 PairsFoot Patches 5 Pairs Anti Fatigue Detoxifying Adhesives Foot Care,Personal Care
123,$4.99,$8.99,http://www.jollychic.com/p/hand-scrub-soothing-exfoliating-soften-hand-care-g771478.html,Hand Scrub Soothing Exfoliating Soften Hand Care,Personal Care
122,$5.99,,http://www.jollychic.com/p/one-pair-silicone-toe-corrector-soft-big-toe-spreader-convenient-health-care-tools-g798726.html,One Pair Silicone Toe Corrector Soft Big Toe Spreader Convenient Health Care Tools,Personal Care
838,$5.99,$8.99,http://www.jollychic.com/p/3pcs-teeth-whitening-instrument-portable-whitelight-teeth-device-set-g827382.html,3Pcs Teeth Whitening Instrument Portable Whitelight Teeth Device Set,Personal Care
49,$68.00,,http://www.jollychic.com/p/back-massage-instrument-heating-multi-direction-health-care-tool-g859270.html,Back Massage Instrument Heating Multi Direction Health Care Tool,Personal Care
41,$5.99,,http://www.jollychic.com/p/body-wash-exfoliator-moisturizing-oil-control-exfoliating-body-cleasner-g885428.html,Body Wash Exfoliator Moisturizing Oil Control Exfoliating Body Cleasner,Personal Care
609,$13.99,$25.99,http://www.jollychic.com/p/10pcs-teeth-whitening-set-brightening-gel-teeth-tray-strip-gentle-advance-set-g931690.html,10Pcs Teeth Whitening Set Brightening Gel Teeth Tray Strip Gentle Advance Set,Personal Care
310,$6.99,$12.99,http://www.jollychic.com/p/hand-cream-rice-extract-whitening-long-lasting-moisture-soften-hand-care-g963450.html,Hand Cream Rice Extract Whitening Long Lasting Moisture Soften Hand Care,Personal Care
63,$5.99,,http://www.jollychic.com/p/hair-wash-brush-one-piece-massage-scalp-deep-cleansing-silicone-brush-g980442.html,Hair Wash Brush One Piece Massage Scalp Deep Cleansing Silicone Brush,Personal Care
58,$5.99,$8.99,http://www.jollychic.com/p/hand-exfoliating-gel-dead-skin-remove-deep-moisture-soften-hand-care-g980448.html,Hand Exfoliating Gel Dead Skin Remove Deep Moisture Soften Hand Care,Personal Care
16,$9.99,$19.99,http://www.jollychic.com/p/kao-prettia-foam-hair-dye-natural-brown-fancy-easy-diy-hairstyling-g981602.html,KAO PRETTIA Foam Hair Dye Natural Brown Fancy Easy DIY Hairstyling,Personal Care
