add_wish,discount_price,original_price,product_link,product_name,header_block
847,$0.99,$4.99,https://www.jollychic.com/p/firming-delicate-essence-shrink-pores-g351214.html,Firming Delicate Essence Shrink pores,Serums
1936,$2.99,,https://www.jollychic.com/p/snail-original-fluid-repairing-tightening-protect-g352212.html,Snail Original Fluid Repairing Tightening Protect,Serums
657,$6.99,,https://www.jollychic.com/p/painting-style-whitening-protein-essence-g370906.html,Painting Style Whitening Protein Essence,Serums
227,$8.99,$18.99,https://www.jollychic.com/p/multiple-repair-nourishing-essence-regenerating-luster-serum-g392300.html,Multiple Repair Nourishing Essence Regenerating Luster Serum,Serums
63,$15.99,,https://www.jollychic.com/p/pure-powerful-essence-brightening-dull-moist-serum-g392362.html,Pure Powerful Essence Brightening Dull Moist Serum,Serums
207,$17.99,$28.99,https://www.jollychic.com/p/serums-moisturizing-hydrating-whitening-rose-essential-oil-g407660.html,Serums Moisturizing Hydrating Whitening Rose Essential Oil,Serums
245,$8.99,$15.99,https://www.jollychic.com/p/serums-squalane-pure-oil-repair-moisturizing-tender-essence-oil-g427898.html,Serums Squalane Pure Oil Repair Moisturizing Tender Essence Oil,Serums
4737,$10.99,,https://www.jollychic.com/p/youthful-serum-radiance-facial-moisturizing-firming-essence-g473462.html,Youthful Serum Radiance Facial Moisturizing Firming Essence,Serums
662,$3.99,$9.99,https://www.jollychic.com/p/aquo-luster-essence-smear-type-firming-hydrating-protain-cream-g486646.html,Aquo Luster Essence Smear Type Firming Hydrating Protain Cream,Serums
1955,$8.99,$12.99,https://www.jollychic.com/p/gold-collagen-facial-essence-whitening-repairing-anti-aging-serum-g513314.html,Gold Collagen Facial Essence Whitening Repairing Anti-aging Serum,Serums
637,$12.99,,https://www.jollychic.com/p/dr-rashel-pearl-collagen-facial-essence-repairing-whitening-anti-aging-serum-g513334.html,DR.RASHEL Pearl Collagen Facial Essence Repairing Whitening Anti-aging Serum,Serums
1065,$12.99,,https://www.jollychic.com/p/facial-serum-repairing-tightening-whitening-anti-aging-essence-g514350.html,Facial Serum Repairing Tightening Whitening Anti Aging Essence,Serums
14537,$5.99,$8.99,https://www.jollychic.com/p/rose-essential-oil-moisturizing-anti-wrinkle-whitening-fade-spots-oil-g535174.html,Rose Essential Oil Moisturizing Anti Wrinkle Whitening Fade Spots Oil,Serums
5926,$4.99,$7.99,https://www.jollychic.com/p/beauty-nose-essence-slim-high-smooth-nose-firming-essence-g537642.html,Beauty Nose Essence Slim High Smooth Nose Firming Essence,Serums
290,$7.99,$12.99,https://www.jollychic.com/p/dr-rashel-facial-serum-8in1-silver-collagen-smoothing-deep-nourishing-essence-g574910.html,DR.RASHEL Facial Serum 8in1 Silver Collagen Smoothing Deep Nourishing Essence,Serums
2076,$12.99,,https://www.jollychic.com/p/facial-serum-8in1-gold-collagen-brightening-moisturizing-essence-g574930.html,Facial Serum 8in1 Gold Collagen Brightening Moisturizing Essence,Serums
717,$9.99,,https://www.jollychic.com/p/eye-serum-pure-pearls-anti-wrinkle-moisturizing-firming-lifting-eye-cream-g595542.html,Eye Serum Pure Pearls Anti Wrinkle Moisturizing Firming Lifting Eye Cream,Serums
220,$10.99,$16.99,https://www.jollychic.com/p/co-e-face-serum-peach-tightening-pore-minimizing-face-essence-g661202.html,CO.E Face Serum Peach Tightening Pore Minimizing Face Essence,Serums
4291,$1.99,$5.99,https://www.jollychic.com/p/facial-serums-snail-extract-hydrating-pore-minimizing-facial-essence-g663190.html,Facial Serums Snail Extract Hydrating Pore Minimizing Facial Essence,Serums
741,$1.99,$5.99,https://www.jollychic.com/p/eye-cream-snail-essence-deep-hydration-roll-on-anti-ageing-eyes-care-g681338.html,Eye Cream Snail Essence Deep Hydration Roll On Anti Ageing Eyes Care,Serums
401,$1.99,$5.99,https://www.jollychic.com/p/facial-serum-hyaluronic-acid-deep-hydration-pure-essence-skin-care-g681346.html,Facial Serum Hyaluronic Acid Deep Hydration Pure Essence Skin Care,Serums
86,$6.99,$9.99,https://www.jollychic.com/p/acne-removing-essence-oil-control-pore-repairing-facial-serum-g694956.html,Acne Removing Essence Oil Control Pore Repairing Facial Serum,Serums
358,$8.99,,https://www.jollychic.com/p/lavender-compound-essencial-oil-acne-scar-remove-repair-serum-g695030.html,Lavender Compound Essencial Oil Acne Scar Remove Repair Serum,Serums
168,$4.99,$8.99,https://www.jollychic.com/p/rose-compound-essencial-oil-hydrating-water-lock-whitening-serum-g695040.html,Rose Compound Essencial Oil Hydrating Water Lock Whitening Serum,Serums
401,$10.99,,https://www.jollychic.com/p/compound-essence-oil-massage-face-lifting-shaping-sliming-serum-g712120.html,Compound Essence Oil Massage Face Lifting Shaping Sliming Serum,Serums
120,$0.99,$5.99,https://www.jollychic.com/p/facial-serum-hyaluronic-acid-pore-minimizing-hydrating-serum-g753244.html,Facial Serum Hyaluronic Acid Pore Minimizing Hydrating Serum,Serums
1332,$7.99,,https://www.jollychic.com/p/gold-essence-hyaluronic-acid-hydrating-pore-minimizing-brightening-facial-serum-g796926.html,Gold Essence Hyaluronic Acid Hydrating Pore Minimizing Brightening Facial Serum,Serums
394,$5.99,,https://www.jollychic.com/p/2pcs-hyaluronic-acid-serum-hydrating-pore-minimizing-dewy-skin-care-g807212.html,2Pcs Hyaluronic Acid Serum Hydrating Pore Minimizing Dewy Skin Care,Serums
121,$8.99,$12.99,https://www.jollychic.com/p/facial-serum-spring-whitening-water-lock-hydrating-facial-essence-g810494.html,Facial Serum Spring Whitening Water Lock Hydrating Facial Essence,Serums
5879,$7.99,$11.99,https://www.jollychic.com/p/gold-essence-liquid-youth-activating-anti-aging-facial-serum-g818584.html,Gold Essence Liquid Youth Activating Anti Aging Facial Serum,Serums
132,$18.99,$30.99,https://www.jollychic.com/p/facial-serum-hyaluronic-acid-extract-original-hydrating-dewy-skin-care-g825958.html,Facial Serum Hyaluronic Acid Extract Original Hydrating Dewy Skin Care,Serums
62,$18.99,$28.99,https://www.jollychic.com/p/eye-serum-pure-natural-extract-classic-tightening-fine-lines-remove-essence-g826634.html,Eye Serum Pure Natural Extract Classic Tightening Fine Lines Remove Essence,Serums
122,$3.99,$5.99,https://www.jollychic.com/p/facial-essence-one-piece-hyaluronic-acid-acne-scar-remove-repair-essence-g832662.html,Facial Essence One Piece Hyaluronic Acid Acne Scar Remove Repair Essence,Serums
70,$22.99,,https://www.jollychic.com/p/anti-acne-essencial-oil-skin-conditioning-repair-facial-serum-g836012.html,Anti Acne Essencial Oil Skin Conditioning Repair Facial Serum,Serums
68,$16.99,$26.99,https://www.jollychic.com/p/facial-serum-plant-extraction-vc-moisturizing-brightening-essence-g851794.html,Facial Serum Plant Extraction VC Moisturizing Brightening Essence,Serums
40,$11.99,$18.99,https://www.jollychic.com/p/facial-serum-one-piece-anti-ageing-youth-revitalizing-moisture-skin-care-g858428.html,Facial Serum One Piece Anti Ageing Youth Revitalizing Moisture Skin Care,Serums
219,$1.99,$5.99,https://www.jollychic.com/p/nose-serum-repairing-nourishing-oil-control-pore-minimizing-skin-care-g866752.html,Nose Serum Repairing Nourishing Oil Control Pore Minimizing Skin Care,Serums
328,$1.99,$5.99,https://www.jollychic.com/p/eye-cream-moisturizing-anti-wrinkle-moisturizing-refresh-eye-essence-g885196.html,Eye Cream Moisturizing Anti Wrinkle Moisturizing Refresh Eye Essence,Serums
36,$23.99,$36.99,https://www.jollychic.com/p/sausand-o-facial-serum-seaweed-hydro-brightening-facial-essence-g913068.html,SAUSAND'O Facial Serum Seaweed Hydro Brightening Facial Essence,Serums
288,$28.99,$57.00,https://www.jollychic.com/p/manuka-s-cosmet-facial-serum-tight-skin-moisturizing-brightening-essence-g949438.html,Manuka's cosmet Facial Serum Tight Skin Moisturizing Brightening Essence,Serums
180,$5.99,$13.99,https://www.jollychic.com/p/facial-serum-6pcs-hyaluronic-acid-extract-original-hydrating-skin-care-g955322.html,Facial Serum 6Pcs Hyaluronic Acid Extract Original Hydrating Skin Care,Serums
419,$5.99,$13.99,https://www.jollychic.com/p/6pcs-snail-concentrate-facial-hydrating-whitening-essence-g955918.html,6Pcs Snail Concentrate Facial Hydrating Whitening Essence,Serums
486,$14.99,$28.99,https://www.jollychic.com/p/mediheal-facial-serums-nmf-aquaring-essence-water-lock-whitening-skin-care-g955958.html,Mediheal Facial Serums NMF Aquaring Essence Water Lock Whitening Skin Care,Serums
772,$6.99,,https://www.jollychic.com/p/eye-cream-roller-ball-anti-aging-anti-wrinkle-moisturizing-massage-cream-g960246.html,Eye Cream Roller Ball Anti Aging Anti Wrinkle Moisturizing Massage Cream,Serums
219,$12.99,,https://www.jollychic.com/p/dr-rashel-facial-serums-collagen-moisturizing-tightening-whitening-essence-g1010746.html,DR.RASHEL Facial Serums Collagen Moisturizing Tightening Whitening Essence,Serums
241,$12.99,,https://www.jollychic.com/p/dr-rashel-facial-serums-gold-collagen-whitening-tightening-essence-g1011080.html,DR.RASHEL Facial Serums Gold Collagen Whitening Tightening Essence,Serums
126,$12.99,,https://www.jollychic.com/p/dr-rashel-facial-serums-silver-collagen-anti-wrinkle-tightening-whitening-essence-g1011710.html,DR.RASHEL Facial Serums Silver Collagen Anti Wrinkle Tightening Whitening Essence,Serums
903,$7.99,,https://www.jollychic.com/p/eyes-serum-one-piece-massage-roller-ball-firming-dark-circles-remove-essence-g1023404.html,Eyes Serum One Piece Massage Roller Ball Firming Dark Circles Remove Essence,Serums
2416,$2.99,$5.99,https://www.jollychic.com/p/essential-oil-for-nose-bridge-shaping-slimming-natural-plant-essence-g1042198.html,Essential Oil For Nose Bridge Shaping Slimming Natural Plant Essence,Serums
204,$5.99,,https://www.jollychic.com/p/facial-serum-one-piece-revitalizing-moisture-pure-essence-g1072660.html,Facial Serum One Piece Revitalizing Moisture Pure Essence,Serums
14,$27.99,$40.99,https://www.jollychic.com/p/yuxia-facial-serum-pimples-acne-removing-natural-soothing-skin-care-g1091758.html,Yuxia Facial Serum Pimples Acne Removing Natural Soothing Skin Care,Serums
17,$20.99,$35.99,https://www.jollychic.com/p/yuxia-facial-serum-anti-acne-soothing-gentle-repairing-skin-care-g1091760.html,Yuxia Facial Serum Anti Acne Soothing Gentle Repairing Skin Care,Serums
48,$6.99,$13.99,https://www.jollychic.com/p/caizhitang-eyes-serum-hyaluronic-acid-repair-tightening-essence-g1094518.html,CAIZHITANG Eyes Serum Hyaluronic Acid Repair Tightening Essence,Serums
57,$23.99,$36.99,https://www.jollychic.com/p/meier-serums-moisturizing-tightening-heart-shape-smooth-essence-skin-care-g1125182.html,Meier Serums Moisturizing Tightening Heart Shape Smooth Essence Skin Care,Serums
429,$5.99,,https://www.jollychic.com/p/facial-serum-anti-freckle-whitening-smooth-beauty-skin-care-g1167770.html,Facial Serum Anti Freckle Whitening Smooth Beauty Skin Care,Serums
272,$5.99,,https://www.jollychic.com/p/facial-serum-acne-scar-remove-moisture-repairing-skin-care-g1167928.html,Facial Serum Acne Scar Remove Moisture Repairing Skin Care,Serums
201,$49.99,,https://www.jollychic.com/p/innisfree-facial-serum-green-tea-sead-essence-deep-hydrating-skin-care-g1211770.html,Innisfree Facial Serum Green Tea Sead Essence Deep Hydrating Skin Care,Serums
44,$6.99,$10.99,https://www.jollychic.com/p/nr-facial-serum-pore-minimizing-smooth-hydrating-essence-g1216742.html,NR Facial Serum Pore Minimizing Smooth Hydrating Essence,Serums
2590,$9.99,,https://www.jollychic.com/p/otwoo-facial-serum-24k-gold-infused-deep-nourish-skin-care-g1229724.html,OTWOO Facial Serum 24K Gold Infused Deep Nourish Skin Care,Serums
212,$3.99,$5.99,https://www.jollychic.com/p/lamilee-sleeping-mask-rose-extract-gel-night-repair-nourish-whitening-mask-g1244240.html,LaMilee Sleeping Mask Rose Extract Gel Night Repair Nourish Whitening Mask,Serums
15,$8.99,$16.99,https://www.jollychic.com/p/facial-serum-whitening-hydrating-matcha-extract-repairing-essence-g1254630.html,Facial Serum Whitening Hydrating Matcha Extract Repairing Essence,Serums
244,$2.99,$5.99,https://www.jollychic.com/p/lamilee-aloe-moisturizer-comfy-soothing-nourishing-repair-skin-care-tool-g1274626.html,LaMilee Aloe Moisturizer Comfy Soothing Nourishing Repair Skin Care Tool,Serums
162,$2.99,$5.99,https://www.jollychic.com/p/lamilee-3pcs-aloe-moisturizer-refersh-whitening-lotion-comfy-soothing-repair-face-care-g1274628.html,LaMilee 3Pcs Aloe Moisturizer Refersh Whitening Lotion Comfy Soothing Repair Face Care,Serums
17,$36.99,,https://www.jollychic.com/p/haba-facial-serum-medicated-pure-squalane-whitening-massage-oil-skin-care-g1280788.html,HABA Facial Serum Medicated Pure Squalane Whitening Massage Oil Skin Care,Serums
36,$16.99,$25.99,https://www.jollychic.com/p/kiladoll-rose-essence-oil-natural-extract-moisture-whitening-facial-serum-g1296784.html,KilaDoll Rose Essence Oil Natural Extract Moisture Whitening Facial Serum,Serums
39,$5.99,,https://www.jollychic.com/p/laikou-eye-cream-snail-extract-moisturizing-natural-anti-black-circle-remove-eyescare-g1314000.html,LAIKOU Eye Cream Snail Extract Moisturizing Natural Anti Black Circle Remove EyesCare,Serums
401,$9.99,,https://www.jollychic.com/p/meiyanqiong-facial-serum-vitamin-c-brightening-hydrating-skin-care-g1323592.html,MeiYanQiong Facial Serum Vitamin C Brightening Hydrating Skin Care,Serums
211,$8.99,,https://www.jollychic.com/p/meiyanqiong-facial-serum-snail-essence-anti-ageing-rivitalizing-skin-care-g1323602.html,MeiYanQiong Facial Serum Snail Essence Anti Ageing Rivitalizing Skin Care,Serums
193,$7.99,,https://www.jollychic.com/p/facial-serum-v-shaping-slimming-face-lifting-skin-care-g1333892.html,Facial Serum V Shaping Slimming Face Lifting Skin Care,Serums
146,$5.99,,https://www.jollychic.com/p/laikou-glycerin-aloe-vera-oil-natural-smooth-moisturizing-serum-g1341518.html,LAIKOU Glycerin Aloe Vera Oil Natural Smooth Moisturizing Serum,Serums
41,$5.99,,https://www.jollychic.com/p/lamilee-facial-serum-hyaluronic-acid-deep-moisture-nourish-essence-g1345480.html,LaMilee Facial Serum Hyaluronic Acid Deep Moisture Nourish Essence,Serums
58,$10.99,,https://www.jollychic.com/p/goji-berry-essential-oil-nourishing-moisture-whitening-tightening-softening-rose-essence-skin-care-g1351820.html,Goji Berry Essential Oil Nourishing Moisture Whitening Tightening Softening Rose Essence Skin Care,Serums
423,$10.99,,https://www.jollychic.com/p/meiyanqiong-gold-dynamisante-serum-tightening-brightening-moisture-essence-skin-care-g1356222.html,MEIYANQIONG Gold Dynamisante Serum Tightening Brightening Moisture Essence Skin Care,Serums
589,$9.99,,https://www.jollychic.com/p/facial-serum-anti-ageing-whitening-tightening-skin-care-g1359354.html,Facial Serum Anti Ageing Whitening Tightening Skin Care,Serums
171,$9.99,,https://www.jollychic.com/p/water-ice-levins-compact-conditioning-oil-scar-recover-repair-serum-g1359406.html,Water Ice Levins Compact Conditioning Oil Scar Recover Repair Serum,Serums
68,$11.99,,https://www.jollychic.com/p/lavender-essencial-oil-anti-acne-repairing-smooth-moisture-facial-serum-g1366088.html,Lavender Essencial Oil Anti Acne Repairing Smooth Moisture Facial Serum,Serums
36,$8.99,,https://www.jollychic.com/p/eyes-serum-anti-wrinkles-brighten-smooth-eyes-essence-care-g1372308.html,Eyes Serum Anti Wrinkles Brighten Smooth Eyes Essence Care,Serums
14,$8.99,,https://www.jollychic.com/p/facial-serum-apple-essence-tightening-revitalizing-skin-care-g1372312.html,Facial Serum Apple Essence Tightening Revitalizing Skin Care,Serums
59,$8.99,,https://www.jollychic.com/p/facial-serum-tranexamic-acid-deep-hydrating-brighten-skin-care-g1372314.html,Facial Serum Tranexamic Acid Deep Hydrating Brighten Skin Care,Serums
17,$13.99,,https://www.jollychic.com/p/tea-tree-essencial-oil-refreshing-soothing-repair-facial-serum-g1372318.html,Tea Tree Essencial Oil Refreshing Soothing Repair Facial Serum,Serums
13,$13.99,,https://www.jollychic.com/p/sandalwood-essencial-oil-deep-hydration-smooth-facial-serum-g1372320.html,Sandalwood Essencial Oil Deep Hydration Smooth Facial Serum,Serums
31,$11.99,,https://www.jollychic.com/p/rose-essencial-oil-natural-replenish-nourishment-essence-g1372322.html,Rose Essencial Oil Natural Replenish Nourishment Essence,Serums
153,$8.99,,https://www.jollychic.com/p/argireline-facial-serum-pure-anti-ageing-wrinkles-remove-essence-g1373234.html,Argireline Facial Serum Pure Anti Ageing Wrinkles Remove Essence,Serums
49,$8.99,,https://www.jollychic.com/p/facial-serum-vc-extract-whitening-wrinkles-remove-essence-g1373238.html,Facial Serum VC Extract Whitening Wrinkles Remove Essence,Serums
54,$8.99,,https://www.jollychic.com/p/facial-serum-snail-extract-pore-shrinking-hydrating-essence-g1373240.html,Facial Serum Snail Extract Pore Shrinking Hydrating Essence,Serums
161,$8.99,,https://www.jollychic.com/p/hyaluronic-acid-facial-serum-anti-ageing-whitening-hydrating-essence-g1373242.html,Hyaluronic Acid Facial Serum Anti Ageing Whitening Hydrating Essence,Serums
96,$10.99,,https://www.jollychic.com/p/eyes-essence-tightening-24k-activated-gold-anti-black-circle-serum-g1383152.html,Eyes Essence Tightening 24K Activated Gold Anti Black Circle Serum,Serums
397,$11.99,,https://www.jollychic.com/p/beauty-glazed-facial-serum-24k-gold-moisture-beauty-oil-g1397468.html,BEAUTY GLAZED Facial Serum 24K Gold Moisture Beauty Oil,Serums
10,$11.99,,https://www.jollychic.com/p/firstsun-goji-berry-essential-oil-facial-anti-wrinkle-skin-tightening-serum-g1474658.html,FirstSun Goji Berry Essential Oil Facial Anti Wrinkle Skin Tightening Serum,Serums
19,$29.99,,https://www.jollychic.com/p/cassidea-8pcs-facial-serum-anti-ageing-tightening-smooth-essence-g1487204.html,CASSIDEA 8Pcs Facial Serum Anti Ageing Tightening Smooth Essence,Serums
22,$9.99,,https://www.jollychic.com/p/argireline-facial-serum-one-piece-anti-wrinkle-firming-whitening-skin-care-g1511130.html,Argireline Facial Serum One Piece Anti Wrinkle Firming Whitening Skin Care,Serums
362,$12.99,$19.99,https://www.jollychic.com/p/co-e-pure-olive-essences-deep-hydrating-tightening-skin-serum-g327122.html,CO.E Pure Olive Essences Deep Hydrating Tightening Skin Serum,Serums
104,$70.00,$105.00,https://www.jollychic.com/p/newborn-anti-wrinkle-firming-essence-g342058.html,Newborn Anti-wrinkle Firming Essence,Serums
72,$57.00,$97.00,https://www.jollychic.com/p/squalane-oil-vital-skincare-serums-plants-extract-g354996.html,Squalane Oil Vital Skincare Serums Plants Extract,Serums
343,$6.99,$14.99,https://www.jollychic.com/p/face-pulling-compact-firming-serum-g363714.html,Face Pulling Compact Firming Serum,Serums
226,$13.99,$36.99,https://www.jollychic.com/p/anti-allergy-hydration-repair-essence-g368844.html,Anti Allergy Hydration Repair Essence,Serums
105,$12.99,$31.99,https://www.jollychic.com/p/youth-hydrating-moisturizing-essence-watery-skin-g369248.html,Youth Hydrating Moisturizing Essence Watery Skin,Serums
191,$96.00,,https://www.jollychic.com/p/acid-serum-improve-dark-spots-soften-cutin-liquid-g403596.html,Acid Serum Improve Dark Spots Soften Cutin Liquid,Serums
717,$10.99,$18.99,https://www.jollychic.com/p/skin-acne-removing-oil-beautifying-essence-g403848.html,Skin Acne Removing Oil Beautifying Essence,Serums
142,$16.99,$28.99,https://www.jollychic.com/p/brightening-moisture-essential-oil-soothing-tender-skin-g406106.html,Brightening Moisture Essential Oil Soothing Tender Skin,Serums
70,$32.99,,https://www.jollychic.com/p/firming-moisture-essential-oil-firming-skin-activation-g406164.html,Firming Moisture Essential Oil Firming Skin Activation,Serums
43,$32.99,,https://www.jollychic.com/p/eye-meticulous-nursing-essential-oil-moisture-tender-skin-g406180.html,Eye Meticulous Nursing Essential Oil Moisture Tender Skin,Serums
137,$33.99,,https://www.jollychic.com/p/serums-rose-extract-brightening-nourish-whitening-facial-essence-g407650.html,Serums Rose Extract Brightening Nourish Whitening Facial Essence,Serums
51,$33.99,,https://www.jollychic.com/p/original-liquid-rose-essential-moisturizing-repair-facial-serums-g408080.html,Original Liquid Rose Essential Moisturizing Repair Facial Serums,Serums
86,$16.99,,https://www.jollychic.com/p/rose-moisturizing-facial-tender-care-whitening-essence-g408688.html,Rose Moisturizing Facial Tender Care Whitening Essence,Serums
55,$30.99,$45.99,https://www.jollychic.com/p/facial-serums-skin-care-perfect-anti-aging-liquid-essence-g422504.html,Facial Serums Skin Care Perfect Anti Aging Liquid Essence,Serums
77,$7.99,,https://www.jollychic.com/p/eyes-essence-aloe-cacti-avtivate-firming-moisturizing-eyes-serum-g424100.html,Eyes Essence Aloe & Cacti Avtivate Firming Moisturizing Eyes Serum,Serums
291,$8.99,,https://www.jollychic.com/p/serum-mung-bean-oil-control-brightening-pore-minimizing-essence-g427584.html,Serum Mung Bean Oil Control Brightening Pore Minimizing Essence,Serums
90,$37.99,,https://www.jollychic.com/p/whitening-essential-oil-whiten-repair-skin-firming-essence-g427742.html,Whitening Essential Oil Whiten Repair Skin Firming Essence,Serums
145,$8.99,$14.99,https://www.jollychic.com/p/doradosun-eyes-serum-anti-wrinkles-moisturizing-firming-essence-g428902.html,DoraDoSun Eyes Serum Anti Wrinkles Moisturizing Firming Essence,Serums
6714,$12.99,,https://www.jollychic.com/p/facial-plant-essence-whitening-improve-spot-shrink-pores-essence-g486412.html,Facial Plant Essence Whitening Improve Spot Shrink Pores Essence,Serums
1110,$9.99,,https://www.jollychic.com/p/shaping-face-lift-oil-moisturizing-firming-facial-essence-g526272.html,Shaping Face Lift Oil Moisturizing Firming Facial Essence,Serums
1014,$9.99,,https://www.jollychic.com/p/face-serum-hyaluronic-acid-hydrating-pore-minimizing-tightening-essence-g535282.html,Face Serum Hyaluronic Acid Hydrating Pore Minimizing Tightening Essence,Serums
93,$8.99,$16.99,https://www.jollychic.com/p/facial-serums-hydrating-brightening-pore-minimizing-skin-care-essence-g654822.html,Facial Serums Hydrating Brightening Pore Minimizing Skin Care Essence,Serums
83,$5.99,$8.99,https://www.jollychic.com/p/co-e-face-serum-chamomile-soothing-hydrating-facial-essence-g661598.html,CO.E Face Serum Chamomile Soothing Hydrating Facial Essence,Serums
46,$32.99,,https://www.jollychic.com/p/osm-face-serum-pearl-oxygen-skin-revive-refresh-whitening-skin-care-g732990.html,OSM Face Serum Pearl Oxygen Skin Revive Refresh Whitening Skin Care,Serums
62,$20.99,,https://www.jollychic.com/p/facial-serums-horse-oil-extract-hydrating-water-lock-pore-repairing-essence-g733000.html,Facial Serums Horse Oil Extract Hydrating Water Lock Pore Repairing Essence,Serums
30,$45.99,,https://www.jollychic.com/p/osm-facial-serum-pearl-whiten-intensive-moisturizing-skin-care-g742578.html,OSM Facial Serum Pearl Whiten Intensive Moisturizing Skin Care,Serums
32,$48.99,,https://www.jollychic.com/p/osm-eye-cream-pearl-water-miracle-moisturizing-tightening-skin-care-g743612.html,OSM Eye Cream Pearl Water Miracle Moisturizing Tightening Skin Care,Serums
46,$32.99,,https://www.jollychic.com/p/osm-facial-serum-pearls-essence-pore-firming-smoothing-skin-care-g751206.html,OSM Facial Serum Pearls Essence Pore Firming Smoothing Skin Care,Serums
32,$47.99,,https://www.jollychic.com/p/osm-eye-cream-pearl-vital-anti-black-circle-lifting-eye-essence-g764922.html,OSM Eye Cream Pearl Vital Anti Black Circle Lifting Eye Essence,Serums
21,$44.99,,https://www.jollychic.com/p/osm-facial-essence-pearl-vital-moisture-water-lock-essence-g764924.html,OSM Facial Essence Pearl Vital Moisture Water Lock Essence,Serums
419,$12.99,$18.99,https://www.jollychic.com/p/30pcs-eyes-serum-enzyme-extract-youth-rivitalizing-essence-g821080.html,30Pcs Eyes Serum Enzyme Extract Youth Rivitalizing Essence,Serums
26,$66.00,,https://www.jollychic.com/p/osm-facial-serum-face-lifting-slimming-anti-ageing-moist-essence-g832638.html,OSM Facial Serum Face Lifting Slimming Anti Ageing Moist Essence,Serums
76,$2.99,$5.99,https://www.jollychic.com/p/facial-serum-one-piece-micro-hydration-brightening-moisture-essence-g832658.html,Facial Serum One Piece Micro Hydration Brightening Moisture Essence,Serums
67,$30.99,,https://www.jollychic.com/p/facial-essencial-oil-rosemary-extract-tightening-revital-serum-g835978.html,Facial Essencial Oil Rosemary Extract Tightening Revital Serum,Serums
46,$18.99,$28.99,https://www.jollychic.com/p/facial-serum-tightening-anti-wrinkle-radiant-hydrating-essence-g851770.html,Facial Serum Tightening Anti Wrinkle Radiant Hydrating Essence,Serums
17,$58.00,$85.00,https://www.jollychic.com/p/bobore-3pcs-hyaluronic-acid-essence-micro-molecules-hydrating-facial-serum-g882330.html,BOBORE 3Pcs Hyaluronic Acid Essence Micro Molecules Hydrating Facial Serum,Serums
22,$20.99,$32.99,https://www.jollychic.com/p/crane-beauty-face-lotion-skin-firming-lifting-moisturizing-emulsion-g913064.html,CRANE BEAUTY Face Lotion Skin Firming Lifting Moisturizing Emulsion,Serums
18,$49.99,,https://www.jollychic.com/p/sausand-o-face-lotion-natural-seaweed-hydrating-firming-moisturizer-g913084.html,SAUSAND'O Face Lotion Natural Seaweed Hydrating Firming Moisturizer,Serums
160,$23.99,$36.99,https://www.jollychic.com/p/sausando-facial-serum-sea-weed-remodeling-anti-ageing-capsule-essence-g925390.html,SAUSANDO Facial Serum Sea Weed Remodeling Anti Ageing Capsule Essence,Serums
33,$20.99,$32.99,https://www.jollychic.com/p/sausando-facial-serum-sea-weed-extract-anti-acne-soothing-capsule-essence-g925398.html,SAUSANDO Facial Serum Sea Weed Extract Anti Acne Soothing Capsule Essence,Serums
9,$35.99,$70.00,https://www.jollychic.com/p/albatros-mineral-facial-serum-nourishing-hydrating-essence-g934590.html,Albatros Mineral Facial Serum Nourishing Hydrating Essence,Serums
31,$34.99,$68.00,https://www.jollychic.com/p/albatros-eye-contour-gel-nourishing-moisture-eyes-serum-g934652.html,Albatros Eye Contour Gel Nourishing Moisture Eyes Serum,Serums
271,$9.99,$18.99,https://www.jollychic.com/p/argan-labo-argan-oil-anti-crack-anti-ageing-nourish-serum-g963414.html,ARGAN LABO Argan Oil Anti Crack Anti Ageing Nourish Serum,Serums
