add_wish,discount_price,original_price,product_link,product_name,header_block
514,$13.99,$20.99,https://www.jollychic.com/p/vogue-style-galaxy-print-leggings-g9002.html,Vogue Style Galaxy Print Leggings,Leggings
3220,$14.99,,https://www.jollychic.com/p/mesh-patchwork-high-stretch-active-leggings-g152263.html,Mesh Patchwork High Stretch Active Leggings,Leggings
8216,$5.99,,https://www.jollychic.com/p/faux-leather-stretchy-style-skinny-black-leggings-g228523.html,Faux Leather Stretchy Style Skinny Black Leggings,Leggings
181,$11.99,,https://www.jollychic.com/p/faux-leather-cut-out-slim-black-leggings-g228815.html,Faux Leather Cut Out Slim Black Leggings,Leggings
822,$11.99,,https://www.jollychic.com/p/solid-personalized-hole-design-leggings-g255153.html,Solid Personalized Hole Design Leggings,Leggings
3255,$5.99,$9.99,https://www.jollychic.com/p/sexy-lace-patchwork-black-light-leggings-g333122.html,Sexy Lace Patchwork Black Light Leggings,Leggings
1270,$3.99,$6.99,https://www.jollychic.com/p/ethnic-style-women-s-leggings-floral-print-casual-leggings-g417276.html,Ethnic Style Women's Leggings Floral Print Casual Leggings,Leggings
489,$3.99,$6.99,https://www.jollychic.com/p/casual-style-women-s-skinny-leggings-floral-print-leggings-g417278.html,Casual Style Women's Skinny Leggings Floral Print Leggings,Leggings
1667,$3.99,$7.99,https://www.jollychic.com/p/women-s-leggings-high-waist-elastic-solid-slim-sport-style-leggings-g471640.html,Women's Leggings High Waist Elastic Solid Slim Sport Style Leggings,Leggings
400,$5.99,$11.99,https://www.jollychic.com/p/women-s-leggings-gauze-patchwork-bow-sexy-leggings-g477692.html,Women's Leggings Gauze Patchwork Bow Sexy Leggings,Leggings
1433,$14.99,,https://www.jollychic.com/p/women-s-leggings-elastic-waist-lace-patchwork-lace-up-faux-leather-leggings-g481002.html,Women's Leggings Elastic Waist Lace Patchwork Lace Up Faux Leather Leggings,Leggings
716,$8.99,$22.99,https://www.jollychic.com/p/women-s-leggings-mid-waist-elastic-sport-style-patchwork-cropped-yoga-leggings-g500036.html,Women's Leggings Mid Waist Elastic Sport Style Patchwork Cropped Yoga Leggings,Leggings
1746,$8.99,$13.99,https://www.jollychic.com/p/women-s-leggings-elastic-high-waist-gauze-patchwork-slim-camouflage-leggings-g508076.html,Women's Leggings Elastic High Waist Gauze Patchwork Slim Camouflage Leggings,Leggings
2253,$8.99,$13.99,https://www.jollychic.com/p/women-s-leggings-pu-leather-elastic-waist-thicken-warm-fashion-leggings-g530676.html,Women's Leggings PU Leather Elastic Waist Thicken Warm Fashion Leggings,Leggings
909,$9.99,$15.99,https://www.jollychic.com/p/women-s-leggings-cropped-hollow-out-solid-leggings-g544068.html,Women's Leggings Cropped Hollow Out Solid Leggings,Leggings
1590,$10.99,$18.99,https://www.jollychic.com/p/women-s-leggings-high-waisted-slim-skinny-sports-style-camouflage-leggings-g558072.html,Women's Leggings High Waisted Slim Skinny Sports Style Camouflage Leggings,Leggings
156,$18.99,,https://www.jollychic.com/p/women-s-leggings-gauze-patchwork-visable-sexy-leggings-g569744.html,Women's Leggings Gauze Patchwork Visable Sexy Leggings,Leggings
184,$8.99,$13.99,https://www.jollychic.com/p/women-s-leggings-skinny-colorblock-polka-dot-casual-leggings-g610568.html,Women's Leggings Skinny Colorblock Polka Dot Casual Leggings,Leggings
4914,$10.99,$20.99,https://www.jollychic.com/p/women-s-leggings-gauze-patchwork-see-through-sexy-leggings-g640782.html,Women's Leggings Gauze Patchwork See Through Sexy Leggings,Leggings
51,$11.99,$17.99,https://www.jollychic.com/p/women-s-leggings-pu-leather-elastic-waisted-beading-skinny-leggings-g642054.html,Women's Leggings PU Leather Elastic Waisted Beading Skinny Leggings,Leggings
176,$13.99,$20.99,https://www.jollychic.com/p/women-s-leggings-pu-leather-high-waisted-lace-patched-warm-leggings-g642060.html,Women's Leggings PU Leather High Waisted Lace Patched Warm Leggings,Leggings
848,$23.99,,https://www.jollychic.com/p/women-s-leggings-high-waisted-solid-color-pu-leather-lace-patchwork-leggings-g642742.html,Women's Leggings High Waisted Solid Color PU Leather Lace Patchwork Leggings,Leggings
247,$7.99,$10.99,https://www.jollychic.com/p/women-s-leggings-solid-color-lace-hem-casual-leggings-g645808.html,Women's Leggings Solid Color Lace Hem Casual Leggings,Leggings
2758,$9.99,,https://www.jollychic.com/p/women-s-leggings-solid-color-beading-skinny-casual-leggings-g645810.html,Women's Leggings Solid Color Beading Skinny Casual Leggings,Leggings
1669,$9.99,,https://www.jollychic.com/p/women-s-leggings-lace-patchwork-skinny-cropped-sexy-leggings-g645814.html,Women's Leggings Lace Patchwork Skinny Cropped Sexy Leggings,Leggings
1243,$13.99,$20.99,https://www.jollychic.com/p/women-s-leggings-elastic-waist-gauze-patch-black-leggings-g650434.html,Women's Leggings Elastic Waist Gauze Patch Black Leggings,Leggings
197,$4.99,$8.99,https://www.jollychic.com/p/women-s-leggings-striped-patched-color-block-skinny-leggings-g659472.html,Women's Leggings Striped Patched Color Block Skinny Leggings,Leggings
498,$7.99,$10.99,https://www.jollychic.com/p/women-s-leggings-hole-solid-color-skinny-leggings-g659484.html,Women's Leggings Hole Solid Color Skinny Leggings,Leggings
7454,$5.99,$8.99,https://www.jollychic.com/p/women-s-leggings-all-match-high-elastic-cozy-skinny-leggings-g667816.html,Women's Leggings All Match High Elastic Cozy Skinny Leggings,Leggings
1071,$15.99,$26.99,https://www.jollychic.com/p/women-s-high-waist-leggings-solid-color-skinny-leggings-g675392.html,Women's High Waist Leggings Solid Color Skinny Leggings,Leggings
1153,$12.99,$18.99,https://www.jollychic.com/p/women-s-leggings-solid-color-gauze-patched-skinny-leggings-g680730.html,Women's Leggings Solid Color Gauze Patched Skinny Leggings,Leggings
4854,$11.99,$18.99,https://www.jollychic.com/p/women-s-leggings-solid-color-high-waist-skinny-leggings-g703978.html,Women's Leggings Solid Color High Waist Skinny Leggings,Leggings
1195,$10.99,$16.99,https://www.jollychic.com/p/women-s-leggings-solid-color-pu-leather-skinny-plus-size-leggings-g760470.html,Women's Leggings Solid Color PU Leather Skinny Plus Size Leggings,Leggings
839,$8.99,$11.99,https://www.jollychic.com/p/women-s-leggings-solid-color-patchwork-skinny-leggings-g830182.html,Women's Leggings Solid Color Patchwork Skinny Leggings,Leggings
240,$10.99,$17.99,https://www.jollychic.com/p/women-s-leggings-solid-color-top-fashion-leggings-g851044.html,Women's Leggings Solid Color Top Fashion Leggings,Leggings
203,$3.99,$5.99,https://www.jollychic.com/p/women-s-leggings-solid-color-high-waist-skinny-leggings-g879458.html,Women's Leggings Solid Color High Waist Skinny Leggings,Leggings
159,$11.99,$19.99,https://www.jollychic.com/p/women-s-leggings-pu-leather-solid-skinny-leggings-g1014000.html,Women's Leggings PU Leather Solid Skinny Leggings,Leggings
108,$13.99,$21.99,https://www.jollychic.com/p/women-s-leggings-floral-skinny-elastic-yoga-sport-pants-g1040016.html,Women's Leggings Floral Skinny Elastic Yoga Sport Pants,Leggings
191,$14.99,$19.99,https://www.jollychic.com/p/women-s-leggings-solid-color-skinny-leggings-g1044814.html,Women's Leggings Solid Color Skinny Leggings,Leggings
976,$8.99,,https://www.jollychic.com/p/women-s-leggings-solid-color-high-waist-leggings-g1067150.html,Women's Leggings Solid Color High Waist Leggings,Leggings
51,$8.99,$12.99,https://www.jollychic.com/p/women-s-leggings-elastic-waist-flower-pattern-slim-fit-leggings-g1085564.html,Women's Leggings Elastic Waist Flower Pattern Slim Fit Leggings,Leggings
202,$13.99,$21.99,https://www.jollychic.com/p/women-s-plus-size-leggings-elastic-waist-letter-color-block-leggings-g1087756.html,Women's Plus Size Leggings Elastic Waist Letter Color Block Leggings,Leggings
65,$7.99,$11.99,https://www.jollychic.com/p/women-s-leggings-floral-pattern-ethnic-leggings-g1105212.html,Women's Leggings Floral Pattern Ethnic Leggings,Leggings
88,$11.99,$18.99,https://www.jollychic.com/p/women-s-leggings-net-patch-cozy-black-leggings-g1123646.html,Women's Leggings Net Patch Cozy Black Leggings,Leggings
87,$15.99,,https://www.jollychic.com/p/women-s-leggings-camouflage-pattern-patchwork-cozy-leggings-g1123652.html,Women's Leggings Camouflage Pattern Patchwork Cozy Leggings,Leggings
614,$9.99,,https://www.jollychic.com/p/women-s-leggings-color-block-patchwork-skinny-leggings-g1126876.html,Women's Leggings Color Block Patchwork Skinny Leggings,Leggings
398,$11.99,$15.99,https://www.jollychic.com/p/women-s-leggings-net-patch-skinny-leggings-g1145066.html,Women's Leggings Net Patch Skinny Leggings,Leggings
31,$12.99,$19.99,https://www.jollychic.com/p/women-s-leggings-floral-high-waist-skinny-leggings-g1148492.html,Women's Leggings Floral High Waist Skinny Leggings,Leggings
47,$11.99,$21.99,https://www.jollychic.com/p/women-s-leggings-embroidery-comfy-all-match-breathable-leggings-g1212634.html,Women's Leggings Embroidery Comfy All Match Breathable Leggings,Leggings
43,$7.99,,https://www.jollychic.com/p/women-s-leggings-floral-lace-patched-solid-leggings-g1240008.html,Women's Leggings Floral Lace Patched Solid Leggings,Leggings
1591,$6.99,$10.99,https://www.jollychic.com/p/women-s-leggings-solid-color-hollow-out-skinny-leggings-g1241400.html,Women's Leggings Solid Color Hollow Out Skinny Leggings,Leggings
379,$6.99,,https://www.jollychic.com/p/women-s-leggings-fashion-all-match-solid-color-fuax-leather-thin-slim-tight-pencil-pants-g1245176.html,Women's Leggings Fashion All Match Solid Color Fuax Leather Thin Slim Tight Pencil Pants,Leggings
35,$7.99,$18.99,https://www.jollychic.com/p/women-s-leggings-fashion-all-match-solid-color-lace-sexy-hollow-out-loose-wide-leg-pants-g1245178.html,Women's Leggings Fashion All Match Solid Color Lace Sexy Hollow Out Loose Wide Leg Pants,Leggings
38,$10.99,$19.99,https://www.jollychic.com/p/women-s-leggings-beautiful-pattern-black-skinny-leggings-g1253680.html,Women's Leggings Beautiful Pattern Black Skinny Leggings,Leggings
59,$10.99,$17.99,https://www.jollychic.com/p/women-s-leggings-high-waist-colorblock-cropped-sports-leggings-g1254232.html,Women's Leggings High Waist Colorblock Cropped Sports Leggings,Leggings
44,$8.99,$15.99,https://www.jollychic.com/p/women-s-leggings-high-waist-colorblock-cropped-sports-leggings-g1254236.html,Women's Leggings High Waist Colorblock Cropped Sports Leggings,Leggings
68,$13.99,,https://www.jollychic.com/p/women-s-legging-solid-color-high-waisted-long-slim-casual-pants-g1272014.html,Women's Legging Solid Color High Waisted Long Slim Casual Pants,Leggings
16,$11.99,$21.99,https://www.jollychic.com/p/women-s-leggings-high-waist-solid-lace-patchwork-sexy-leggings-g1275378.html,Women's Leggings High Waist Solid Lace Patchwork Sexy Leggings,Leggings
29,$11.99,$17.99,https://www.jollychic.com/p/women-s-leggings-solid-color-hollow-out-patched-leggings-g1277490.html,Women's Leggings Solid Color Hollow Out Patched Leggings,Leggings
142,$10.99,$17.99,https://www.jollychic.com/p/women-s-leggings-solid-comfy-hollow-out-all-match-breathable-leggings-g1287322.html,Women's Leggings Solid Comfy Hollow Out All Match Breathable Leggings,Leggings
27,$9.99,$16.99,https://www.jollychic.com/p/women-s-leggings-cross-solid-color-skinny-leggings-g1302332.html,Women's Leggings Cross Solid Color Skinny Leggings,Leggings
55,$11.99,$16.99,https://www.jollychic.com/p/women-s-leggings-color-block-all-match-leggings-g1302338.html,Women's Leggings Color Block All Match Leggings,Leggings
20,$9.99,$16.99,https://www.jollychic.com/p/women-s-leggings-color-block-skinny-leggings-g1302340.html,Women's Leggings Color Block Skinny Leggings,Leggings
88,$10.99,$16.99,https://www.jollychic.com/p/women-s-leggings-thin-color-block-skinny-leggings-g1302342.html,Women's Leggings Thin Color Block Skinny Leggings,Leggings
73,$9.99,$16.99,https://www.jollychic.com/p/women-s-leggings-color-block-chic-thin-leggings-g1302356.html,Women's Leggings Color Block Chic Thin Leggings,Leggings
189,$9.99,$16.99,https://www.jollychic.com/p/women-s-leggings-gauze-patch-skinny-cozy-leggings-g1302358.html,Women's Leggings Gauze Patch Skinny Cozy Leggings,Leggings
48,$15.99,$22.99,https://www.jollychic.com/p/women-s-leggings-simple-stripe-cozy-skinny-leggings-g1303130.html,Women's Leggings Simple Stripe Cozy Skinny Leggings,Leggings
29,$10.99,$16.99,https://www.jollychic.com/p/women-s-leggings-high-waist-hollow-out-sexy-leggings-g1303634.html,Women's Leggings High Waist hollow Out Sexy Leggings,Leggings
13,$9.99,$16.99,https://www.jollychic.com/p/women-s-leggings-color-block-print-skinny-leggings-g1306104.html,Women's Leggings Color Block Print Skinny Leggings,Leggings
34,$9.99,$16.99,https://www.jollychic.com/p/women-s-leggings-color-block-patchwork-leggings-g1306110.html,Women's Leggings Color Block Patchwork Leggings,Leggings
52,$10.99,$16.99,https://www.jollychic.com/p/women-s-leggings-see-through-patch-solid-leggings-g1308028.html,Women's Leggings See Through Patch Solid Leggings,Leggings
70,$9.99,$16.99,https://www.jollychic.com/p/women-s-leggings-gauze-patch-black-skinny-leggings-g1308030.html,Women's Leggings Gauze Patch Black Skinny Leggings,Leggings
21,$13.99,$21.99,https://www.jollychic.com/p/women-s-leggings-mesh-patchwork-hollow-out-sports-leggings-g1309648.html,Women's Leggings Mesh Patchwork Hollow Out Sports Leggings,Leggings
18,$11.99,$16.99,https://www.jollychic.com/p/women-s-leggings-gauze-patch-black-cropped-leggings-g1317288.html,Women's Leggings Gauze Patch Black Cropped Leggings,Leggings
10,$14.99,$27.99,https://www.jollychic.com/p/women-s-leggings-solid-color-pu-slim-elastic-plus-size-lengings-g1329658.html,Women's Leggings Solid Color PU Slim Elastic Plus Size Lengings,Leggings
79,$7.99,$13.99,https://www.jollychic.com/p/women-s-leggings-animal-pattern-print-skinny-leggings-g1336374.html,Women's Leggings Animal Pattern Print Skinny Leggings,Leggings
6,$7.99,$13.99,https://www.jollychic.com/p/women-s-leggings-vivid-print-high-waist-leggings-g1336386.html,Women's Leggings Vivid Print High Waist Leggings,Leggings
17,$21.99,,https://www.jollychic.com/p/women-s-leggings-outdoor-sports-elastic-tight-mesh-stitching-yoga-foot-leggings-g1364768.html,Women's Leggings Outdoor Sports Elastic Tight Mesh Stitching Yoga Foot Leggings,Leggings
10,$22.99,,https://www.jollychic.com/p/women-s-leggings-quick-dry-hollow-perspective-stitching-yoga-fitness-sports-skinny-pants-g1364778.html,Women's Leggings Quick-dry Hollow Perspective Stitching Yoga Fitness Sports Skinny Pants,Leggings
72,$7.99,$13.99,https://www.jollychic.com/p/women-s-leggings-spider-net-pattern-print-mid-waisted-fashion-elastic-leggings-g1364804.html,Women's Leggings Spider Net Pattern Print Mid Waisted Fashion Elastic Leggings,Leggings
8,$16.99,,https://www.jollychic.com/p/women-s-leggings-color-block-high-elastic-skinny-leggings-g1398104.html,Women's Leggings Color Block High Elastic Skinny Leggings,Leggings
20,$16.99,,https://www.jollychic.com/p/women-s-leggings-striped-color-block-mid-waits-skinny-leggings-g1427158.html,Women's Leggings Striped Color Block Mid Waits Skinny Leggings,Leggings
12,$10.99,$16.99,https://www.jollychic.com/p/women-s-leggings-solid-color-hollow-out-mid-waist-skinny-leggings-g1427162.html,Women's Leggings Solid Color Hollow Out Mid Waist Skinny Leggings,Leggings
19,$15.99,,https://www.jollychic.com/p/women-s-leggings-synthetic-leather-solid-color-all-match-leggings-g1427884.html,Women's Leggings Synthetic Leather Solid Color All Match Leggings,Leggings
13,$11.99,$18.99,https://www.jollychic.com/p/women-s-leggings-sweet-comfy-all-match-breathable-leggings-g1431668.html,Women's Leggings Sweet Comfy All Match Breathable Leggings,Leggings
12,$7.99,$13.99,https://www.jollychic.com/p/women-s-leggings-solid-comfy-thicken-all-match-breathable-leggings-g1454328.html,Women's Leggings Solid Comfy Thicken All Match Breathable Leggings,Leggings
12,$21.99,,https://www.jollychic.com/p/women-s-leggings-skinny-mid-waisted-floral-comfy-elastic-all-match-fashion-pants-g1458356.html,Women's Leggings Skinny Mid Waisted Floral Comfy Elastic All Match Fashion Pants,Leggings
9,$15.99,$24.99,https://www.jollychic.com/p/women-s-leggings-synthetic-leather-solid-color-skinny-leggings-g1477560.html,Women's Leggings Synthetic Leather Solid Color Skinny Leggings,Leggings
11,$22.99,,https://www.jollychic.com/p/women-s-leggings-synthetic-leather-thicken-warm-skinny-leggings-g1480232.html,Women's Leggings Synthetic Leather Thicken Warm Skinny Leggings,Leggings
360,$8.99,$15.99,https://www.jollychic.com/p/women-s-leggings-letter-pattern-high-waist-skinny-leggings-g1490230.html,Women's Leggings Letter Pattern High Waist Skinny Leggings,Leggings
0,$22.99,,https://www.jollychic.com/p/women-s-leggings-fashion-sexy-side-letter-skull-printing-slim-high-waist-sports-pencil-pants-g1626360.html,Women's Leggings Fashion Sexy Side Letter Skull Printing Slim High Waist Sports Pencil Pants,Leggings
0,$22.99,,https://www.jollychic.com/p/women-s-leggings-fashion-sexy-side-letter-skull-printing-slim-high-waist-sports-pencil-pants-g1626362.html,Women's Leggings Fashion Sexy Side Letter Skull Printing Slim High Waist Sports Pencil Pants,Leggings
0,$22.99,,https://www.jollychic.com/p/women-s-leggings-fashion-sexy-side-letter-skull-printing-slim-high-waist-sports-pencil-pants-g1626364.html,Women's Leggings Fashion Sexy Side Letter Skull Printing Slim High Waist Sports Pencil Pants,Leggings
0,$22.99,,https://www.jollychic.com/p/women-s-leggings-fashion-sexy-side-letter-skull-printing-slim-high-waist-sports-pencil-pants-g1626366.html,Women's Leggings Fashion Sexy Side Letter Skull Printing Slim High Waist Sports Pencil Pants,Leggings
0,$22.99,,https://www.jollychic.com/p/women-s-leggings-fashion-sexy-side-skull-printing-slim-high-waist-sports-pencil-pants-g1626374.html,Women's Leggings Fashion Sexy Side Skull Printing Slim High Waist Sports Pencil Pants,Leggings
0,$26.99,,https://www.jollychic.com/p/women-s-leggings-fashion-sexy-cartoon-digital-printing-slim-high-waist-sports-pencil-pants-g1626376.html,Women's Leggings Fashion Sexy Cartoon Digital Printing Slim High Waist Sports Pencil Pants,Leggings
0,$23.99,,https://www.jollychic.com/p/women-s-leggings-fashion-sexy-solid-color-starry-sky-slim-high-waist-sports-pants-g1626382.html,Women's Leggings Fashion Sexy Solid Color Starry Sky Slim High Waist Sports Pants,Leggings
0,$26.99,,https://www.jollychic.com/p/women-s-leggings-fashion-sexy-stripe-skull-printing-slim-breathable-high-waist-sports-pants-g1626384.html,Women's Leggings Fashion Sexy Stripe Skull Printing Slim Breathable High Waist Sports Pants,Leggings
1,$26.99,,https://www.jollychic.com/p/women-s-leggings-fashion-sexy-solid-color-printing-slim-breathable-high-waist-sports-pants-g1626386.html,Women's Leggings Fashion Sexy Solid Color Printing Slim Breathable High Waist Sports Pants,Leggings
0,$26.99,,https://www.jollychic.com/p/women-s-leggings-fashion-sexy-color-block-slim-breathable-high-waist-sports-pants-g1626392.html,Women's Leggings Fashion Sexy Color Block Slim Breathable High Waist Sports Pants,Leggings
0,$26.99,,https://www.jollychic.com/p/women-s-leggings-fashion-sexy-tiger-digital-printing-slim-high-waist-sports-pants-g1626394.html,Women's Leggings Fashion Sexy Tiger Digital Printing Slim High Waist Sports Pants,Leggings
0,$26.99,,https://www.jollychic.com/p/women-s-leggings-fashion-sexy-color-block-slim-breathable-high-waist-sports-pants-g1626396.html,Women's Leggings Fashion Sexy Color Block Slim Breathable High Waist Sports Pants,Leggings
0,$23.99,,https://www.jollychic.com/p/women-s-leggings-fashion-sexy-starry-sky-digital-printing-slim-high-waist-sports-pants-g1626398.html,Women's Leggings Fashion Sexy Starry Sky Digital Printing Slim High Waist Sports Pants,Leggings
0,$9.99,,https://www.jollychic.com/p/women-s-leggings-skull-pattern-high-waist-skinny-leggings-g1627276.html,Women's Leggings Skull Pattern High Waist Skinny Leggings,Leggings
0,$10.99,,https://www.jollychic.com/p/women-s-leggings-cartoon-color-block-skinny-leggings-g1627278.html,Women's Leggings Cartoon Color Block Skinny Leggings,Leggings
2,$13.99,,https://www.jollychic.com/p/women-s-leggings-color-block-skinny-leggings-g1627280.html,Women's Leggings Color Block Skinny Leggings,Leggings
0,$31.99,,https://www.jollychic.com/p/women-s-leggings-high-waist-solid-skinny-leggings-g1628728.html,Women's Leggings High Waist Solid Skinny Leggings,Leggings
0,$29.99,,https://www.jollychic.com/p/women-s-leather-pants-solid-color-mid-waist-slim-leather-pants-g1628982.html,Women's Leather Pants Solid Color Mid Waist Slim Leather Pants,Leggings
1,$26.99,,https://www.jollychic.com/p/women-s-leather-legging-solid-color-high-waist-slim-leather-legging-g1628986.html,Women's Leather Legging Solid Color High Waist Slim Leather Legging,Leggings
1,$26.99,,https://www.jollychic.com/p/women-s-legging-high-waist-solid-color-skinny-pants-g1629512.html,Women's Legging High Waist Solid Color Skinny Pants,Leggings
0,$21.99,,https://www.jollychic.com/p/women-s-leggings-striped-pattern-skinny-high-waist-pants-g1629554.html,Women's Leggings Striped Pattern Skinny High Waist Pants,Leggings
0,$21.99,,https://www.jollychic.com/p/women-s-leggings-patchwork-pattern-lace-decoration-skinny-high-waist-pants-g1629556.html,Women's Leggings Patchwork Pattern Lace Decoration Skinny High Waist Pants,Leggings
0,$21.99,,https://www.jollychic.com/p/women-s-leggings-skinny-high-waist-color-block-pants-g1629558.html,Women's Leggings Skinny High Waist Color Block Pants,Leggings
0,$19.99,,https://www.jollychic.com/p/women-s-leggings-letter-pattern-skinny-high-waist-pants-g1629562.html,Women's Leggings Letter Pattern Skinny High Waist Pants,Leggings
0,$21.99,,https://www.jollychic.com/p/women-s-leggings-floral-pattern-skinny-high-waist-pants-g1629588.html,Women's Leggings Floral Pattern Skinny High Waist Pants,Leggings
0,$25.99,,https://www.jollychic.com/p/women-s-fashion-legging-floral-pattern-high-waist-skinny-yoga-pant-g1629886.html,Women's Fashion Legging Floral Pattern High Waist Skinny Yoga Pant,Leggings
0,$13.99,,https://www.jollychic.com/p/women-s-legging-mid-waist-solid-color-pocket-decoration-casual-pants-g1631490.html,Women's Legging Mid Waist Solid Color Pocket Decoration Casual Pants,Leggings
0,$25.99,,https://www.jollychic.com/p/women-s-fashion-legging-floral-pattern-high-waist-skinny-yoga-pant-g1632438.html,Women's Fashion Legging Floral Pattern High Waist Skinny Yoga Pant,Leggings
0,$15.99,,https://www.jollychic.com/p/women-s-leggings-patchwork-letter-pattern-high-waisted-slim-leggings-g1633830.html,Women's Leggings Patchwork Letter Pattern High Waisted Slim Leggings,Leggings
0,$21.99,,https://www.jollychic.com/p/women-s-leggings-outdoor-wear-thin-high-waist-solid-color-stretchy-pencil-trousers-g1636320.html,Women's Leggings Outdoor Wear Thin High Waist Solid Color Stretchy Pencil Trousers,Leggings
520,$11.99,$15.99,https://www.jollychic.com/p/high-waist-back-lace-stretchy-skinny-leggings-g215499.html,High Waist Back Lace Stretchy Skinny Leggings,Leggings
1661,$5.99,$9.99,https://www.jollychic.com/p/elastic-high-quality-faux-denim-black-leggings-g228917.html,Elastic High Quality Faux Denim Black Leggings,Leggings
557,$11.99,,https://www.jollychic.com/p/color-block-sexy-pattern-skinny-long-leggings-g271083.html,Color Block Sexy Pattern Skinny Long Leggings,Leggings
955,$11.99,$22.99,https://www.jollychic.com/p/full-length-black-leggings-for-women-g328634.html,Full Length Black Leggings For Women,Leggings
4774,$5.99,$9.99,https://www.jollychic.com/p/vivid-rose-pattern-lace-patch-black-leggings-g333090.html,Vivid Rose Pattern Lace Patch Black Leggings,Leggings
2105,$4.99,$6.99,https://www.jollychic.com/p/sexy-mesh-patchwork-elastic-leggings-g333100.html,Sexy Mesh Patchwork Elastic Leggings,Leggings
3295,$5.99,$9.99,https://www.jollychic.com/p/hollow-out-design-pure-color-leggings-g333134.html,Hollow Out Design Pure Color Leggings,Leggings
1945,$8.99,,https://www.jollychic.com/p/black-full-length-thin-women-s-leggings-g343188.html,Black Full Length Thin Women's Leggings,Leggings
213,$7.99,$21.99,https://www.jollychic.com/p/midi-waist-black-elastic-leggings-g365424.html,Midi Waist Black Elastic Leggings,Leggings
3884,$6.99,,https://www.jollychic.com/p/sexy-style-plus-size-women-s-leggings-cropped-skinny-leggings-g403736.html,Sexy Style Plus Size Women's Leggings Cropped Skinny Leggings,Leggings
424,$15.99,$29.99,https://www.jollychic.com/p/women-s-leggings-mid-waist-slim-fit-skinny-leggings-g406092.html,Women's Leggings Mid Waist Slim Fit Skinny Leggings,Leggings
425,$4.99,$6.99,https://www.jollychic.com/p/top-fashion-women-s-skinny-leggings-floral-print-casual-leggings-g417280.html,Top Fashion Women's Skinny Leggings Floral Print Casual Leggings,Leggings
8687,$6.99,,https://www.jollychic.com/p/women-s-leggings-warm-solid-high-elastic-casual-leggings-g435338.html,Women's Leggings Warm Solid High Elastic Casual Leggings,Leggings
987,$6.99,$17.99,https://www.jollychic.com/p/women-s-legging-pu-leather-solid-cropped-leggings-g437304.html,Women's Legging PU Leather Solid Cropped Leggings,Leggings
292,$12.99,$26.99,https://www.jollychic.com/p/women-s-pu-leather-leggings-solid-color-elastic-waist-casual-leggings-g450374.html,Women's PU Leather Leggings Solid Color Elastic Waist Casual Leggings,Leggings
218,$3.99,$11.99,https://www.jollychic.com/p/women-s-leggings-hollow-out-lace-patchwork-sexy-leggings-g477694.html,Women's Leggings Hollow Out Lace Patchwork Sexy Leggings,Leggings
3150,$9.99,$12.99,https://www.jollychic.com/p/women-s-leggings-thicken-warm-geometric-pattern-casual-style-leggings-g494616.html,Women's Leggings Thicken Warm Geometric Pattern Casual Style Leggings,Leggings
150,$13.99,,https://www.jollychic.com/p/women-s-leggings-pu-leather-leopard-gauze-patchwork-hollow-out-fashion-leggings-g508102.html,Women's Leggings PU Leather Leopard Gauze Patchwork Hollow Out Fashion Leggings,Leggings
