add_wish,discount_price,original_price,product_link,product_name,header_block
24,$35.99,,http://www.jollychic.com/p/women-s-sports-swimsuit-colorblock-sleeveless-backless-sexy-one-piece-tankini-set-g1051750.html,Women's Sports Swimsuit Colorblock Sleeveless Backless Sexy One Piece Tankini Set,Beachwear
3,$22.99,,http://www.jollychic.com/p/women-s-2-pcs-swimsuit-colorblock-vintagepattern-underwired-sexy-bikini-set-g1063250.html,Women's 2 Pcs Swimsuit Colorblock VintagePattern Underwired Sexy Bikini Set,Beachwear
14,$21.99,,http://www.jollychic.com/p/women-s-swimwear-sweet-floral-o-neck-half-sleeve-chiffon-beach-cover-up-g1067652.html,Women's Swimwear Sweet Floral O Neck Half Sleeve Chiffon Beach Cover Up,Beachwear
4,$23.99,,http://www.jollychic.com/p/women-s-2-pcs-swimsuit-high-neck-lace-patchwork-backless-sexy-bikini-set-g1091528.html,Women's 2 Pcs Swimsuit High Neck Lace Patchwork Backless Sexy Bikini Set,Beachwear
11,$22.99,,http://www.jollychic.com/p/women-s-sleepwear-patchwork-elegant-retro-halterneck-one-piece-swimsuit-g1094774.html,Women's Sleepwear Patchwork Elegant Retro Halterneck One Piece Swimsuit,Beachwear
78,$23.99,,http://www.jollychic.com/p/women-s-swimwear-sexy-criss-cross-rivet-decor-beach-bikini-set-g1100082.html,Women's Swimwear Sexy Criss Cross Rivet Decor Beach Bikini Set,Beachwear
5,$35.99,,http://www.jollychic.com/p/women-s-swimwear-set-floral-racerback-bow-slim-conservative-tankini-set-g1109926.html,Women's Swimwear Set Floral Racerback Bow Slim Conservative Tankini Set,Beachwear
5,$17.99,,http://www.jollychic.com/p/women-s-swimwear-floral-vintage-v-neck-sleeveless-beach-wear-cover-up-dress-g1138478.html,Women's Swimwear Floral Vintage V Neck Sleeveless Beach Wear Cover Up Dress,Beachwear
11,$24.99,,http://www.jollychic.com/p/women-s-swimwear-solid-color-sexy-deep-v-halterneck-one-piece-tankini-g1138490.html,Women's Swimwear Solid Color Sexy Deep V Halterneck One Piece Tankini,Beachwear
47,$12.99,,http://www.jollychic.com/p/women-s-swimwear-set-geometric-halterneck-high-waist-sexy-bikini-set-g1144478.html,Women's Swimwear Set Geometric Halterneck High Waist Sexy Bikini Set,Beachwear
9,$17.99,,http://www.jollychic.com/p/women-s-swimwear-vintage-v-neck-sleeveless-beach-wear-long-cover-up-dress-g1144488.html,Women's Swimwear Vintage V Neck Sleeveless Beach Wear Long Cover Up Dress,Beachwear
21,$11.99,$16.99,http://www.jollychic.com/p/women-s-swimwear-color-block-chiffon-batwing-sleeve-beach-long-cover-up-dress-g1163146.html,Women's Swimwear Color Block Chiffon Batwing Sleeve Beach Long Cover Up Dress,Beachwear
13,$19.99,$29.99,http://www.jollychic.com/p/women-s-plus-size-swimwear-color-block-bow-sleeveless-conservative-tankini-dress-g1163164.html,Women's Plus Size Swimwear Color Block Bow Sleeveless Conservative Tankini Dress,Beachwear
8,$15.99,,http://www.jollychic.com/p/women-s-swimwear-tree-pattern-back-hollow-out-spaghetti-straps-one-piece-tankini-g1279904.html,Women's Swimwear Tree Pattern Back Hollow Out Spaghetti Straps One Piece Tankini,Beachwear
6,$22.99,,http://www.jollychic.com/p/women-s-swimwear-color-block-short-sleeve-conservative-sports-swimsuit-g1310670.html,Women's Swimwear Color Block Short Sleeve Conservative Sports Swimsuit,Beachwear
4,$18.99,,http://www.jollychic.com/p/women-s-swimwear-color-block-criss-cross-halterneck-sexy-one-piece-tankini-g1310674.html,Women's Swimwear Color Block Criss Cross Halterneck Sexy One Piece Tankini,Beachwear
731,$6.99,$8.99,http://www.jollychic.com/p/cool-cut-out-vivid-print-sexy-bikini-bottoms-g174305.html,Cool Cut-Out Vivid Print Sexy Bikini Bottoms,Beachwear
369,$8.99,$21.99,http://www.jollychic.com/p/adjustable-shoulder-straps-hollow-bottoms-bikinis-g232559.html,Adjustable Shoulder Straps Hollow Bottoms Bikinis,Beachwear
392,$12.99,$21.99,http://www.jollychic.com/p/women-s-plus-size-floral-two-pieces-swimwear-g359556.html,Women's Plus Size Floral Two Pieces Swimwear,Beachwear
1606,$9.99,$13.99,http://www.jollychic.com/p/women-s-bohemian-style-bikini-cover-up-g372420.html,Women's Bohemian Style Bikini Cover Up,Beachwear
1736,$9.99,$15.99,http://www.jollychic.com/p/women-s-coconut-tree-print-halter-underwire-bikini-g407094.html,Women's Coconut Tree Print Halter Underwire Bikini,Beachwear
2242,$14.99,$16.99,http://www.jollychic.com/p/women-s-swimwear-solid-color-back-hollow-out-halter-one-piece-swimwear-g482510.html,Women's Swimwear Solid Color Back Hollow Out Halter One-Piece Swimwear,Beachwear
595,$10.99,$15.99,http://www.jollychic.com/p/women-s-beach-blanket-roundness-shape-graphic-functional-beach-blanket-g488038.html,Women's Beach Blanket Roundness Shape Graphic Functional Beach Blanket,Beachwear
33,$22.99,,http://www.jollychic.com/p/women-s-swimwear-color-block-halter-one-piece-tankini-g524504.html,Women's Swimwear Color Block Halter One Piece Tankini,Beachwear
163,$12.99,$20.99,http://www.jollychic.com/p/women-s-swimwear-solid-sexy-saddish-lace-bikini-g524512.html,Women's Swimwear Solid Sexy Saddish Lace Bikini,Beachwear
835,$13.99,$20.99,http://www.jollychic.com/p/women-s-swimwear-stripe-pattern-sexy-saddish-beach-tankini-g533044.html,Women's Swimwear Stripe Pattern Sexy Saddish Beach Tankini,Beachwear
30,$24.99,,http://www.jollychic.com/p/women-s-swimwear-halterneck-floral-pattern-sexy-top-g544460.html,Women's Swimwear Halterneck Floral Pattern Sexy Top,Beachwear
93,$14.99,$25.99,http://www.jollychic.com/p/women-s-swimwear-suit-polka-dot-bow-decoration-halter-tankini-g547752.html,Women's Swimwear Suit Polka Dot Bow Decoration Halter Tankini,Beachwear
40,$31.99,,http://www.jollychic.com/p/women-s-swimwear-v-neck-halterneck-floral-striped-pattern-tankini-g556630.html,Women's Swimwear V Neck Halterneck Floral Striped Pattern Tankini,Beachwear
134,$13.99,,http://www.jollychic.com/p/women-s-swimwear-color-block-padded-sweet-sexy-bikini-g557612.html,Women's Swimwear Color Block Padded Sweet Sexy Bikini,Beachwear
104,$13.99,$20.99,http://www.jollychic.com/p/women-s-swimwear-stripe-pattern-color-block-padded-skinny-one-piece-g557622.html,Women's Swimwear Stripe Pattern Color Block Padded Skinny One Piece,Beachwear
16,$20.99,,http://www.jollychic.com/p/women-s-2pcs-swimwear-solid-color-hollow-out-padded-ruffled-tankini-g559100.html,Women's 2Pcs Swimwear Solid Color Hollow Out Padded Ruffled Tankini,Beachwear
51,$7.99,$19.99,http://www.jollychic.com/p/women-s-swimwear-hollow-out-halterneck-padded-sexy-bikini-g564652.html,Women's Swimwear Hollow Out Halterneck Padded Sexy Bikini,Beachwear
47,$31.99,,http://www.jollychic.com/p/women-s-swimwear-suspender-patchwork-ruffle-tankini-g594042.html,Women's Swimwear Suspender Patchwork Ruffle Tankini,Beachwear
64,$32.99,$37.99,http://www.jollychic.com/p/women-s-3pcs-swimwear-v-neck-soft-cover-ups-halter-hollow-out-bikini-suit-g603698.html,Women's 3Pcs Swimwear V Neck Soft Cover Ups Halter Hollow Out Bikini Suit,Beachwear
425,$27.99,$37.99,http://www.jollychic.com/p/women-s-swimwear-back-zipper-sexy-color-block-one-piece-tankini-g609446.html,Women's Swimwear Back Zipper Sexy Color Block One Piece Tankini,Beachwear
558,$9.99,$14.99,http://www.jollychic.com/p/women-s-swimwear-sexy-comfy-polka-dot-bikini-spilt-swimsuit-g627126.html,Women's Swimwear Sexy Comfy Polka Dot Bikini Spilt Swimsuit,Beachwear
128,$13.99,$20.99,http://www.jollychic.com/p/women-s-swimwear-set-floral-halterneck-front-drawstrings-padded-swim-dress-suit-g629916.html,Women's Swimwear Set Floral Halterneck Front Drawstrings Padded Swim Dress Suit,Beachwear
260,$15.99,$23.99,http://www.jollychic.com/p/women-s-3pcs-swimwear-color-block-short-sleeve-cover-ups-halter-sexy-bikini-suit-g629924.html,Women's 3Pcs Swimwear Color Block Short Sleeve Cover Ups Halter Sexy Bikini Suit,Beachwear
115,$23.99,,http://www.jollychic.com/p/women-s-swimwear-solid-color-backless-halterneck-slim-sexy-one-piece-tankini-g647072.html,Women's Swimwear Solid Color Backless Halterneck Slim Sexy One Piece Tankini,Beachwear
71,$27.99,,http://www.jollychic.com/p/women-s-swimwear-backless-deep-v-neck-solid-slim-sexy-one-pieces-swimsuit-g685766.html,Women's Swimwear Backless Deep V Neck Solid Slim Sexy One Pieces Swimsuit,Beachwear
395,$14.99,$20.99,http://www.jollychic.com/p/women-s-swimwear-solid-color-hollow-out-underwire-push-up-one-piece-swim-dress-g688288.html,Women's Swimwear Solid Color Hollow Out Underwire Push-Up One Piece Swim Dress,Beachwear
161,$32.99,,http://www.jollychic.com/p/women-s-3-pcs-swimwear-sexy-colorblock-letter-pattern-tankini-set-g710080.html,Women's 3 Pcs Swimwear Sexy Colorblock Letter Pattern Tankini Set,Beachwear
9,$27.99,,http://www.jollychic.com/p/women-s-swimwear-polka-dots-hollow-out-racerback-tankini-suit-g715300.html,Women's Swimwear Polka Dots Hollow Out Racerback Tankini Suit,Beachwear
114,$8.99,$13.99,http://www.jollychic.com/p/women-s-swim-pants-color-block-letter-pattern-high-waist-elastic-beach-pants-g715338.html,Women's Swim Pants Color Block Letter Pattern High Waist Elastic Beach Pants,Beachwear
83,$24.99,$38.99,http://www.jollychic.com/p/women-s-swimwear-v-neck-halterneck-backless-underwire-push-up-tankini-dress-g743052.html,Women's Swimwear V Neck Halterneck Backless Underwire Push-Up Tankini Dress,Beachwear
131,$18.99,$29.99,http://www.jollychic.com/p/women-s-swimwear-ruffles-halterneck-underwire-push-up-sexy-sweet-bikini-set-g751354.html,Women's Swimwear Ruffles Halterneck Underwire Push-Up Sexy Sweet Bikini Set,Beachwear
173,$29.99,$33.99,http://www.jollychic.com/p/women-s-swimwear-o-neck-solid-slim-backless-one-piece-tankini-g751536.html,Women's Swimwear O Neck Solid Slim Backless One Piece Tankini,Beachwear
66,$25.99,$39.99,http://www.jollychic.com/p/women-s-swimwear-sleeveless-o-neck-sexy-push-up-floral-slim-tankini-g751742.html,Women's Swimwear Sleeveless O Neck Sexy Push Up Floral Slim Tankini,Beachwear
62,$31.99,,http://www.jollychic.com/p/women-s-swimwear-sweet-ice-cream-pattern-crossover-straps-one-piece-tankini-g751754.html,Women's Swimwear Sweet Ice-Cream Pattern Crossover Straps One Piece Tankini,Beachwear
183,$23.99,$36.99,http://www.jollychic.com/p/women-s-swimwear-letter-pattern-long-sleeve-slim-sexy-tankini-set-g752668.html,Women's Swimwear Letter Pattern Long Sleeve Slim Sexy Tankini Set,Beachwear
91,$26.99,,http://www.jollychic.com/p/women-s-2-pcs-swimwear-sexy-summer-beach-crossover-swimsuit-bikini-set-g762862.html,Women's 2 Pcs Swimwear Sexy Summer Beach Crossover Swimsuit Bikini Set,Beachwear
6,$25.99,,http://www.jollychic.com/p/women-s-swimwear-backless-halterneck-solid-slim-sexy-one-pieces-swimsuit-g776648.html,Women's Swimwear Backless Halterneck Solid Slim Sexy One Pieces Swimsuit,Beachwear
60,$21.99,,http://www.jollychic.com/p/women-s-2-pcs-swimwear-solid-chic-simple-sexy-slim-split-bikini-set-g776846.html,Women's 2 Pcs Swimwear Solid Chic Simple Sexy Slim Split Bikini Set,Beachwear
83,$6.99,$11.99,http://www.jollychic.com/p/women-s-swimwear-solid-color-deep-v-slim-sexy-one-piece-tankini-g794796.html,Women's Swimwear Solid Color Deep V Slim Sexy One Piece Tankini,Beachwear
20,$31.99,,http://www.jollychic.com/p/women-s-swimwear-letter-pattern-sun-protective-long-sleeve-tankini-g800866.html,Women's Swimwear Letter Pattern Sun Protective Long Sleeve Tankini,Beachwear
190,$11.99,$17.99,http://www.jollychic.com/p/women-s-swimwear-floral-ruffles-hem-off-shoulder-sexy-one-piece-tankini-g803078.html,Women's Swimwear Floral Ruffles Hem Off Shoulder Sexy One Piece Tankini,Beachwear
57,$15.99,$23.99,http://www.jollychic.com/p/women-s-swimwear-panda-pattern-slim-sexy-one-pieces-swimsuit-g808524.html,Women's Swimwear Panda Pattern Slim Sexy One Pieces Swimsuit,Beachwear
52,$13.99,$22.99,http://www.jollychic.com/p/women-s-swimwear-off-shoulder-sexy-solid-cascading-ruffle-one-pieces-tankini-g808546.html,Women's Swimwear Off Shoulder Sexy Solid Cascading Ruffle One Pieces Tankini,Beachwear
56,$14.99,$24.99,http://www.jollychic.com/p/women-s-swimwear-v-neck-crossover-solid-slim-sexy-one-pieces-swimsuit-g822738.html,Women's Swimwear V Neck Crossover Solid Slim Sexy One Pieces Swimsuit,Beachwear
28,$35.99,,http://www.jollychic.com/p/women-s-swimwear-off-shoulder-cascading-ruffle-slim-sexy-one-pieces-swimsuit-g824508.html,Women's Swimwear Off Shoulder Cascading Ruffle Slim Sexy One Pieces Swimsuit,Beachwear
18,$22.99,,http://www.jollychic.com/p/women-s-swimwear-anchor-print-halter-neck-slim-one-piece-tankini-g839782.html,Women's Swimwear Anchor Print Halter Neck Slim One Piece Tankini,Beachwear
37,$20.99,,http://www.jollychic.com/p/women-s-2-pcs-swimwear-solid-color-halter-neck-sexy-bikini-set-g863538.html,Women's 2 Pcs Swimwear Solid Color Halter Neck Sexy Bikini Set,Beachwear
27,$20.99,,http://www.jollychic.com/p/women-s-swimwear-set-lace-hem-deep-v-wide-straps-sexy-bikini-set-g865038.html,Women's Swimwear Set Lace Hem Deep V Wide Straps Sexy Bikini Set,Beachwear
31,$14.99,$18.99,http://www.jollychic.com/p/women-s-swimwear-set-solid-color-halterneck-underwire-sexy-bikini-set-g870646.html,Women's Swimwear Set Solid Color Halterneck Underwire Sexy Bikini Set,Beachwear
35,$20.99,,http://www.jollychic.com/p/women-s-swimwear-sexy-floral-versatile-beach-cover-up-dress-g870662.html,Women's Swimwear Sexy Floral Versatile Beach Cover Up Dress,Beachwear
24,$20.99,,http://www.jollychic.com/p/women-s-swimwear-floral-off-shoulder-sweet-sexy-bikini-set-g874524.html,Women's Swimwear Floral Off Shoulder Sweet Sexy Bikini Set,Beachwear
64,$9.99,,http://www.jollychic.com/p/women-s-2-pcs-swimwear-sexy-triangle-cup-polka-dot-striped-pattern-bikini-set-g877858.html,Women's 2 Pcs Swimwear Sexy Triangle Cup Polka Dot Striped Pattern Bikini Set,Beachwear
243,$9.99,$14.99,http://www.jollychic.com/p/women-s-swimwear-white-floral-lace-hollow-out-three-quarter-sleeve-cover-up-g923346.html,Women's Swimwear White Floral Lace Hollow Out Three Quarter Sleeve Cover Up,Beachwear
38,$25.99,$30.99,http://www.jollychic.com/p/women-s-swimwear-color-block-side-split-loose-long-cover-up-dress-g928012.html,Women's Swimwear Color Block Side Split Loose Long Cover Up Dress,Beachwear
72,$28.99,,http://www.jollychic.com/p/women-s-swimwear-delicate-embroidery-v-neck-half-sleeves-sexy-cover-up-dress-g940862.html,Women's Swimwear Delicate Embroidery V Neck Half Sleeves Sexy Cover Up Dress,Beachwear
75,$13.99,$21.99,http://www.jollychic.com/p/women-s-swimwear-solid-color-deep-v-halterneck-high-waist-padded-bikini-set-g941552.html,Women's Swimwear Solid Color Deep V Halterneck High Waist Padded Bikini Set,Beachwear
15,$42.99,,http://www.jollychic.com/p/women-s-swimwear-set-sleeveless-push-up-comfy-tankini-set-g966714.html,Women's Swimwear Set Sleeveless Push Up Comfy Tankini Set,Beachwear
110,$20.99,,http://www.jollychic.com/p/women-s-swimwear-brief-solid-color-bow-elastic-waist-cozy-beach-shorts-g982244.html,Women's Swimwear Brief Solid Color Bow Elastic Waist Cozy Beach Shorts,Beachwear
40,$15.99,,http://www.jollychic.com/p/women-s-swimwear-set-floral-color-block-hollow-out-high-waist-sexy-bikini-set-g984586.html,Women's Swimwear Set Floral Color Block Hollow Out High Waist Sexy Bikini Set,Beachwear
36,$15.99,,http://www.jollychic.com/p/women-s-swimwear-vintage-floral-crossover-straps-sexy-one-piece-tankini-g987842.html,Women's Swimwear Vintage Floral Crossover Straps Sexy One Piece Tankini,Beachwear
11,$32.99,,http://www.jollychic.com/p/women-s-swimwear-patchwork-deep-v-sleeveless-back-hollow-out-tankini-dress-g990512.html,Women's Swimwear Patchwork Deep V Sleeveless Back Hollow Out Tankini Dress,Beachwear
40,$13.99,,http://www.jollychic.com/p/women-s-blouse-latest-tassel-decor-striped-pattern-short-sleeve-simple-bikini-cover-up-g995242.html,Women's Blouse Latest Tassel Decor Striped Pattern Short Sleeve Simple Bikini Cover Up,Beachwear
34,$12.99,,http://www.jollychic.com/p/women-s-blouse-latest-letter-pattern-half-sleeve-sunscreen-v-neck-sexy-bikini-cover-up-g995244.html,Women's Blouse Latest Letter Pattern Half Sleeve Sunscreen V Neck Sexy Bikini Cover Up,Beachwear
43,$21.99,,http://www.jollychic.com/p/women-s-2-pcs-sleepwear-solid-white-bow-ornament-sexy-bikini-set-g995250.html,Women's 2 Pcs Sleepwear Solid White Bow Ornament Sexy Bikini Set,Beachwear
18,$12.99,,http://www.jollychic.com/p/women-s-swimwear-blouse-colored-leopard-pattern-deep-v-loose-beach-cover-up-g995266.html,Women's Swimwear Blouse Colored Leopard Pattern Deep V Loose Beach Cover Up,Beachwear
33,$13.99,,http://www.jollychic.com/p/women-s-swimwear-set-vintage-color-block-triangle-cup-hollow-out-sexy-bikini-set-g1008218.html,Women's Swimwear Set Vintage Color Block Triangle Cup Hollow Out Sexy Bikini Set,Beachwear
9,$24.99,,http://www.jollychic.com/p/women-s-swimwear-set-push-up-lace-print-beach-sexy-swimsuit-bikini-set-g1008254.html,Women's Swimwear Set Push Up Lace Print Beach Sexy Swimsuit Bikini Set,Beachwear
7,$23.99,,http://www.jollychic.com/p/women-s-swimwear-set-fish-scale-pattern-triangle-cup-halter-sexy-bikini-set-g1008262.html,Women's Swimwear Set Fish Scale Pattern Triangle Cup Halter Sexy Bikini Set,Beachwear
10,$21.99,,http://www.jollychic.com/p/women-s-swimwear-set-vintage-floral-print-beach-halterneck-bikini-set-g1008858.html,Women's Swimwear Set Vintage Floral Print Beach Halterneck Bikini Set,Beachwear
18,$26.99,,http://www.jollychic.com/p/women-s-swimwear-set-vintage-halter-underwire-push-up-sexy-bikini-set-g1008872.html,Women's Swimwear Set Vintage Halter Underwire Push Up Sexy Bikini Set,Beachwear
18,$21.99,,http://www.jollychic.com/p/women-E2-80-99s-swimwear-set-sweet-floral-triangle-cup-halterneck-bikini-set-g1009192.html,Womens Swimwear Set Sweet Floral Triangle Cup Halterneck Bikini Set,Beachwear
53,$21.99,,http://www.jollychic.com/p/women-s-2-pcs-swimsuit-crossover-straps-halter-neck-bow-decor-backless-sexy-bikini-set-g1059680.html,Women's 2 Pcs Swimsuit Crossover Straps Halter Neck Bow Decor Backless Sexy Bikini Set,Beachwear
2,$21.99,,http://www.jollychic.com/p/women-s-swimwear-boho-style-geometric-o-neck-half-sleeve-cover-up-g1067648.html,Women's Swimwear Boho Style Geometric O Neck Half Sleeve Cover Up,Beachwear
129,$14.99,$20.99,http://www.jollychic.com/p/women-s-beachwear-solid-color-see-through-open-front-long-sleeve-cover-up-g1071712.html,Women's Beachwear Solid Color See Through Open Front Long Sleeve Cover Up,Beachwear
26,$20.99,,http://www.jollychic.com/p/women-s-swimwear-solid-color-cross-side-splited-backless-strap-sexy-dress-g1091540.html,Women's Swimwear Solid Color Cross Side Splited Backless Strap Sexy Dress,Beachwear
72,$23.99,,http://www.jollychic.com/p/women-s-swimwear-set-solid-color-braided-criss-sexy-halterneck-bikini-set-g1116488.html,Women's Swimwear Set Solid Color Braided Criss Sexy Halterneck Bikini Set,Beachwear
7,$22.99,,http://www.jollychic.com/p/women-s-swimwear-vintage-sweet-tassel-geometric-beach-wear-bottom-g1144486.html,Women's Swimwear Vintage Sweet Tassel Geometric Beach Wear Bottom,Beachwear
11,$25.99,,http://www.jollychic.com/p/women-s-swimwear-set-gradient-color-green-halterneck-padded-beach-bikini-set-g1163170.html,Women's Swimwear Set Gradient Color Green Halterneck Padded Beach Bikini Set,Beachwear
13,$19.99,,http://www.jollychic.com/p/women-s-swimwear-set-brief-pure-color-triangle-cup-sexy-bikini-set-g1177252.html,Women's Swimwear Set Brief Pure Color Triangle Cup Sexy Bikini Set,Beachwear
37,$19.99,,http://www.jollychic.com/p/women-s-swimwear-set-vintage-floral-ruffles-hem-deep-v-sweet-sexy-bikini-set-g1177256.html,Women's Swimwear Set Vintage Floral Ruffles Hem Deep V Sweet Sexy Bikini Set,Beachwear
5,$11.99,$15.99,http://www.jollychic.com/p/women-s-swimwear-conservative-striped-spaghetti-straps-tankini-set-g1230272.html,Women's Swimwear Conservative Striped Spaghetti Straps Tankini Set,Beachwear
7,$15.99,$21.99,http://www.jollychic.com/p/women-s-swimwear-set-sweet-striped-deep-v-sexy-beach-bikini-set-g1257070.html,Women's Swimwear Set Sweet Striped Deep V Sexy Beach Bikini Set,Beachwear
2044,$16.99,$22.99,http://www.jollychic.com/p/moulded-contour-cups-colorblock-bikinis-g232567.html,Moulded Contour Cups Colorblock Bikinis,Beachwear
2347,$9.99,$10.99,http://www.jollychic.com/p/sexy-handmade-crochet-halter-women-s-bikini-g347922.html,Sexy Handmade Crochet Halter Women's Bikini,Beachwear
1107,$17.99,$27.99,http://www.jollychic.com/p/women-s-fashion-hollow-out-crochet-one-piece-swimwear-g380638.html,Women's Fashion Hollow Out Crochet One Piece Swimwear,Beachwear
674,$29.99,$45.99,http://www.jollychic.com/p/women-s-muslim-color-patchwork-plus-size-split-conservative-swimwear-suit-g433664.html,Women's Muslim Color Patchwork Plus Size Split Conservative Swimwear Suit,Beachwear
93,$31.99,,http://www.jollychic.com/p/women-s-cover-up-v-collar-lace-hollow-flower-sexy-beach-cover-up-g533034.html,Women's Cover Up V Collar Lace Hollow Flower Sexy Beach Cover Up,Beachwear
31,$24.99,,http://www.jollychic.com/p/women-s-swimwear-floral-pattern-wireless-padded-sexy-top-g544518.html,Women's Swimwear Floral Pattern Wireless Padded Sexy Top,Beachwear
226,$18.99,$26.99,http://www.jollychic.com/p/women-s-swimwear-solid-color-halter-hollow-out-ruffled-strings-tankini-g551060.html,Women's Swimwear Solid Color Halter Hollow Out Ruffled Strings Tankini,Beachwear
1010,$20.99,$31.99,http://www.jollychic.com/p/women-s-swimwear-color-block-padded-slim-wet-suit-g551124.html,Women's Swimwear Color Block Padded Slim Wet Suit,Beachwear
478,$20.99,$31.99,http://www.jollychic.com/p/women-s-2pcs-swimwear-set-color-block-padded-wireless-sleeveless-divingsuit-g560950.html,Women's 2Pcs Swimwear Set Color Block Padded Wireless Sleeveless Divingsuit,Beachwear
57,$12.99,$17.99,http://www.jollychic.com/p/women-s-swimwear-vintage-halter-padded-hollow-out-high-waist-sexy-bikini-g564626.html,Women's Swimwear Vintage Halter Padded Hollow Out High Waist Sexy Bikini,Beachwear
106,$17.99,,http://www.jollychic.com/p/women-s-swimwear-floral-halterneck-hollow-out-backless-sexy-bikini-suit-g596730.html,Women's Swimwear Floral Halterneck Hollow Out Backless Sexy Bikini Suit,Beachwear
485,$14.99,$18.99,http://www.jollychic.com/p/women-s-beachwear-solid-color-floral-hem-v-neck-loose-cover-ups-dress-g599686.html,Women's Beachwear Solid Color Floral Hem V Neck Loose Cover Ups Dress,Beachwear
242,$23.99,$31.99,http://www.jollychic.com/p/women-s-3-pcs-swimwear-suit-push-up-sexy-solid-cover-up-bikini-suit-g602160.html,Women's 3 Pcs Swimwear Suit Push-Up Sexy Solid Cover Up Bikini Suit,Beachwear
74,$12.99,$19.99,http://www.jollychic.com/p/women-s-swimwear-colorblock-cascading-ruffle-slim-sexy-comfy-one-pieces-swimsuit-g652650.html,Women's Swimwear Colorblock Cascading Ruffle Slim Sexy Comfy One Pieces Swimsuit,Beachwear
28,$6.99,$18.99,http://www.jollychic.com/p/women-s-swimwear-black-back-string-halterneck-sexy-bikini-top-g685690.html,Women's Swimwear Black Back String Halterneck Sexy Bikini Top,Beachwear
1080,$23.99,$36.99,http://www.jollychic.com/p/women-s-3pcs-swimwear-ethnic-style-tassel-cover-ups-halter-underwire-bikini-set-g688860.html,Women's 3Pcs Swimwear Ethnic Style Tassel Cover Ups Halter Underwire Bikini Set,Beachwear
115,$35.99,,http://www.jollychic.com/p/women-s-swimwear-solid-color-ruffles-underwire-sweet-one-piece-tankini-g690260.html,Women's Swimwear Solid Color Ruffles Underwire Sweet One Piece Tankini,Beachwear
13,$9.99,$15.99,http://www.jollychic.com/p/women-s-2-pcs-swimwear-bohemia-geometric-pattern-sexy-slim-split-bikini-set-g737526.html,Women's 2 Pcs Swimwear Bohemia Geometric Pattern Sexy Slim Split Bikini Set,Beachwear
139,$18.99,,http://www.jollychic.com/p/women-s-swimwear-v-neck-long-sleeve-short-front-long-back-loose-cover-ups-dress-g740438.html,Women's Swimwear V Neck Long Sleeve Short Front Long Back Loose Cover Ups Dress,Beachwear
141,$12.99,$19.99,http://www.jollychic.com/p/women-s-swimwear-lace-floral-hollow-out-v-neck-long-sleeve-sexy-cover-ups-g771294.html,Women's Swimwear Lace Floral Hollow Out V Neck Long Sleeve Sexy Cover Ups,Beachwear
173,$7.99,$13.99,http://www.jollychic.com/p/women-s-swimwear-beach-short-sleeve-floral-loose-sun-protective-cover-ups-g776626.html,Women's Swimwear Beach Short Sleeve Floral Loose Sun Protective Cover Ups,Beachwear
105,$7.99,$11.99,http://www.jollychic.com/p/women-s-swimwear-set-color-block-halterneck-hollow-out-sexy-bikini-set-g794798.html,Women's Swimwear Set Color Block Halterneck Hollow Out Sexy Bikini Set,Beachwear
94,$36.99,,http://www.jollychic.com/p/women-s-3pcs-swimwear-floral-short-sleeve-cover-up-dress-halterneck-bikini-suit-g795308.html,Women's 3Pcs Swimwear Floral Short Sleeve Cover Up Dress Halterneck Bikini Suit,Beachwear
708,$26.99,$36.99,http://www.jollychic.com/p/women-s-2-pcs-swimwear-colorblock-chic-simple-sexy-slim-split-surfing-wetsuit-g800452.html,Women's 2 Pcs Swimwear Colorblock Chic Simple Sexy Slim Split Surfing Wetsuit,Beachwear
216,$14.99,$22.99,http://www.jollychic.com/p/topmelon-women-s-2-pcs-swimwear-cascading-ruffle-floral-sexy-split-bikini-set-g800860.html,TOPMELON Women's 2 Pcs Swimwear Cascading Ruffle Floral Sexy Split Bikini Set,Beachwear
65,$31.99,,http://www.jollychic.com/p/women-s-2-pcs-swimwear-floral-simple-comfy-sexy-slim-split-tankini-set-g809792.html,Women's 2 Pcs Swimwear Floral Simple Comfy Sexy Slim Split Tankini Set,Beachwear
27,$15.99,$23.99,http://www.jollychic.com/p/women-s-swimwear-3d-fierce-tiger-pattern-fashion-one-piece-tankini-g814824.html,Women's Swimwear 3D Fierce Tiger Pattern Fashion One Piece Tankini,Beachwear
22,$23.99,,http://www.jollychic.com/p/women-s-swimwear-barbie-doll-pattern-racerback-sweet-one-piece-tankini-g814940.html,Women's Swimwear Barbie Doll Pattern Racerback Sweet One Piece Tankini,Beachwear
32,$19.99,,http://www.jollychic.com/p/women-s-2-pcs-swimwear-vintage-triangle-cup-halter-neck-sexy-bikini-set-g839504.html,Women's 2 Pcs Swimwear Vintage Triangle Cup Halter Neck Sexy Bikini Set,Beachwear
128,$13.99,$20.99,http://www.jollychic.com/p/women-s-swimwear-solid-halterneck-slim-one-piece-tankini-g844940.html,Women's Swimwear Solid Halterneck Slim One Piece Tankini,Beachwear
