add_wish,discount_price,original_price,product_link,product_name,header_block
11868,$5.99,,https://www.jollychic.com/p/retro-style-round-frame-anti-uv-polarized-sunglasses-g25542.html,Retro Style Round Frame Anti UV Polarized Sunglasses,Sunglasses/Eyewears
659,$3.99,$9.99,https://www.jollychic.com/p/retro-polygon-frame-reflective-fashion-sunglasses-g139951.html,Retro Polygon Frame Reflective Fashion Sunglasses,Sunglasses/Eyewears
698,$1.99,$4.99,https://www.jollychic.com/p/round-lenses-mirrored-fashion-womens-sunglasses-g140819.html,Round Lenses Mirrored Fashion Womens Sunglasses,Sunglasses/Eyewears
7399,$4.99,$9.99,https://www.jollychic.com/p/goggles-alloy-frame-round-circle-eyeglasses-g220157.html,Goggles Alloy Frame Round Circle Eyeglasses,Sunglasses/Eyewears
2224,$3.99,$7.99,https://www.jollychic.com/p/premium-quality-mirrored-durable-arms-sunglasses-g253469.html,Premium Quality Mirrored Durable Arms Sunglasses,Sunglasses/Eyewears
85,$12.99,,https://www.jollychic.com/p/upscale-swish-transparent-frame-chromatic-lens-women-s-sunglasses-g306512.html,Upscale Swish Transparent Frame Chromatic Lens Women's Sunglasses,Sunglasses/Eyewears
280,$7.99,$16.99,https://www.jollychic.com/p/square-frame-unisex-chromatic-polarized-lenses-sunglasses-g331604.html,Square Frame Unisex Chromatic Polarized Lenses Sunglasses,Sunglasses/Eyewears
580,$13.99,,https://www.jollychic.com/p/classic-black-frame-high-quality-sunglasses-for-men-g348186.html,Classic Black Frame High Quality Sunglasses For Men,Sunglasses/Eyewears
834,$8.99,$14.99,https://www.jollychic.com/p/grey-gentle-ultra-thin-irregular-frame-sunglasses-for-men-g348230.html,Grey Gentle Ultra Thin Irregular Frame Sunglasses For Men,Sunglasses/Eyewears
1729,$7.99,$14.99,https://www.jollychic.com/p/fashion-silver-tone-ultra-thin-frame-sunglasses-for-men-g348238.html,Fashion Silver Tone Ultra Thin Frame Sunglasses For Men,Sunglasses/Eyewears
1754,$9.99,$17.99,https://www.jollychic.com/p/3-pcs-sunglasses-set-typical-top-grade-fashion-cycling-glasses-g458696.html,3 Pcs Sunglasses Set Typical Top Grade Fashion Cycling Glasses,Sunglasses/Eyewears
301,$4.99,$20.99,https://www.jollychic.com/p/3-pcs-sunglasses-set-faddish-polarized-various-shape-glasses-set-accessory-g482786.html,3 Pcs Sunglasses Set Faddish Polarized Various Shape Glasses Set Accessory,Sunglasses/Eyewears
342,$8.99,$20.99,https://www.jollychic.com/p/3-pcs-sunglasses-set-ritzy-butterfly-shape-wayfarer-series-glasses-set-accessory-g482914.html,3 Pcs Sunglasses Set Ritzy Butterfly Shape Wayfarer Series Glasses Set Accessory,Sunglasses/Eyewears
1766,$6.99,$10.99,https://www.jollychic.com/p/women-s-eyeglasses-vogue-personalized-optical-frame-glasses-accessory-g531870.html,Women's Eyeglasses Vogue Personalized Optical Frame Glasses Accessory,Sunglasses/Eyewears
174,$8.99,$16.99,https://www.jollychic.com/p/women-s-sunglasses-fashion-stylish-rivet-glasses-accessory-g558538.html,Women's Sunglasses Fashion Stylish Rivet Glasses Accessory,Sunglasses/Eyewears
56,$34.99,$47.99,https://www.jollychic.com/p/vegoos-women-s-sunglasses-trendy-oval-polarized-fashion-big-frame-accessory-g576940.html,VEGOOS Women's Sunglasses Trendy Oval Polarized Fashion Big Frame Accessory,Sunglasses/Eyewears
37,$53.00,$58.00,https://www.jollychic.com/p/vegoos-women-s-sunglasses-stylish-polarized-large-frame-retro-eyewear-accessory-g576998.html,VEGOOS Women's Sunglasses Stylish Polarized Large Frame Retro Eyewear Accessory,Sunglasses/Eyewears
112,$13.99,,https://www.jollychic.com/p/women-s-sunglasses-rhinestone-studded-simple-square-trendy-accessory-g615164.html,Women's Sunglasses Rhinestone Studded Simple Square Trendy Accessory,Sunglasses/Eyewears
214,$6.99,$13.99,https://www.jollychic.com/p/women-s-sunglasses-semi-rimmed-polarized-delicate-accessory-g615168.html,Women's Sunglasses Semi Rimmed Polarized Delicate Accessory,Sunglasses/Eyewears
365,$13.99,$24.99,https://www.jollychic.com/p/women-s-sunglasses-oversized-round-polarized-rimmed-stylish-accessory-g631058.html,Women's Sunglasses Oversized Round Polarized Rimmed Stylish Accessory,Sunglasses/Eyewears
234,$4.99,$8.99,https://www.jollychic.com/p/women-s-sunglasses-square-lens-simple-classic-stylish-accessory-g632852.html,Women's Sunglasses Square Lens Simple Classic Stylish Accessory,Sunglasses/Eyewears
2818,$17.99,$28.99,https://www.jollychic.com/p/women-polarized-sunglasses-cateye-metal-frame-vintage-glasses-accessory-g640946.html,Women Polarized Sunglasses Cateye Metal Frame Vintage Glasses Accessory,Sunglasses/Eyewears
2210,$20.99,$32.99,https://www.jollychic.com/p/women-s-polarized-sunglasses-multi-color-retro-cat-eye-casual-glasses-accessory-g642000.html,Women's Polarized Sunglasses Multi-Color Retro Cat Eye Casual Glasses Accessory,Sunglasses/Eyewears
974,$16.99,$24.99,https://www.jollychic.com/p/women-polarized-sunglasses-large-oval-frame-cycling-retro-glasses-accessory-g642010.html,Women Polarized Sunglasses Large Oval Frame Cycling Retro Glasses Accessory,Sunglasses/Eyewears
2887,$27.99,$28.99,https://www.jollychic.com/p/women-s-polarized-sunglasses-metal-round-frame-fashion-glasses-accessory-g642024.html,Women's Polarized Sunglasses Metal Round Frame Fashion Glasses Accessory,Sunglasses/Eyewears
546,$8.99,$13.99,https://www.jollychic.com/p/women-s-sunglasses-cat-eye-classic-multi-color-all-match-glasses-accessory-g658366.html,Women's Sunglasses Cat Eye Classic Multi-Color All Match Glasses Accessory,Sunglasses/Eyewears
451,$17.99,$28.99,https://www.jollychic.com/p/women-s-sunglasses-retro-style-round-frame-simple-uv-protection-glasses-g671418.html,Women's Sunglasses Retro Style Round Frame Simple UV Protection Glasses,Sunglasses/Eyewears
516,$8.99,$14.99,https://www.jollychic.com/p/women-s-sunglasses-plastic-rhinestone-decorative-glasses-trendy-accessory-g672100.html,Women's Sunglasses Plastic Rhinestone Decorative Glasses Trendy Accessory,Sunglasses/Eyewears
628,$8.99,$14.99,https://www.jollychic.com/p/women-s-sunglasses-unique-rimless-translucent-cat-eye-glasses-trendy-accessory-g673436.html,Women's Sunglasses Unique Rimless Translucent Cat Eye Glasses Trendy Accessory,Sunglasses/Eyewears
858,$12.99,$19.99,https://www.jollychic.com/p/women-s-sunglasses-cat-eye-polarized-vintage-stylish-glasses-g679456.html,Women's Sunglasses Cat Eye Polarized Vintage Stylish Glasses,Sunglasses/Eyewears
165,$10.99,$18.99,https://www.jollychic.com/p/women-s-sunglasses-unique-design-metal-frame-square-glasses-trendy-accessory-g680586.html,Women's Sunglasses Unique Design Metal Frame Square Glasses Trendy Accessory,Sunglasses/Eyewears
3502,$8.99,$16.99,https://www.jollychic.com/p/women-s-sunglasses-trendy-personalized-frame-round-circle-sunglasses-accessory-g683800.html,Women's Sunglasses Trendy Personalized Frame Round Circle Sunglasses Accessory,Sunglasses/Eyewears
236,$12.99,$20.99,https://www.jollychic.com/p/women-s-glasses-retro-round-circle-semi-rimless-simple-plain-galsses-g684770.html,Women's Glasses Retro Round Circle Semi Rimless Simple Plain Galsses,Sunglasses/Eyewears
3524,$13.99,$27.99,https://www.jollychic.com/p/kiki-women-s-sunglasses-square-glasses-vintage-oversized-glasses-g711440.html,KIKI Women's Sunglasses Square Glasses Vintage Oversized Glasses,Sunglasses/Eyewears
227,$16.99,$28.99,https://www.jollychic.com/p/kiki-women-s-polarized-sunglasses-brand-designer-plate-sun-glasses-g711442.html,KIKI Women's Polarized Sunglasses Brand Designer Plate Sun Glasses,Sunglasses/Eyewears
3916,$2.99,$8.99,https://www.jollychic.com/p/women-s-glasses-retro-metal-frame-round-circle-fashion-accessory-g741560.html,Women's Glasses Retro Metal Frame Round Circle Fashion Accessory,Sunglasses/Eyewears
234,$2.99,$7.99,https://www.jollychic.com/p/women-s-glasses-retro-metal-frame-fashion-all-match-accessory-g741606.html,Women's Glasses Retro Metal Frame Fashion All Match Accessory,Sunglasses/Eyewears
131,$6.99,$12.99,https://www.jollychic.com/p/women-s-sunglasses-vogue-round-circle-cool-all-match-glasses-accessory-g743184.html,Women's Sunglasses Vogue Round Circle Cool All Match Glasses Accessory,Sunglasses/Eyewears
82,$10.99,$21.99,https://www.jollychic.com/p/3pcs-women-s-sunglasses-set-all-match-uv-protection-elegant-accessories-g777304.html,3Pcs Women's Sunglasses Set All Match UV Protection Elegant Accessories,Sunglasses/Eyewears
404,$4.99,$10.99,https://www.jollychic.com/p/women-s-sunglasses-round-circle-leopard-pattern-trendy-accessory-g778208.html,Women's Sunglasses Round Circle Leopard Pattern Trendy Accessory,Sunglasses/Eyewears
107,$6.99,$12.99,https://www.jollychic.com/p/women-s-sunglasses-gradient-color-round-circle-sun-protection-trendy-accessory-g778646.html,Women's Sunglasses Gradient Color Round Circle Sun Protection Trendy Accessory,Sunglasses/Eyewears
157,$2.99,$7.99,https://www.jollychic.com/p/women-s-sunglasses-retro-metal-rim-round-circle-trendy-accessory-g780048.html,Women's Sunglasses Retro Metal Rim Round Circle Trendy Accessory,Sunglasses/Eyewears
86,$7.99,$12.99,https://www.jollychic.com/p/women-s-sunglasses-rhinestone-flower-design-rim-trendy-elegant-accessory-g792662.html,Women's Sunglasses Rhinestone Flower Design Rim Trendy Elegant Accessory,Sunglasses/Eyewears
363,$9.99,$18.99,https://www.jollychic.com/p/women-s-sunglasses-rhinestone-decorative-hollow-out-rim-unique-accessory-g792674.html,Women's Sunglasses Rhinestone Decorative Hollow Out Rim Unique Accessory,Sunglasses/Eyewears
113,$3.99,$7.99,https://www.jollychic.com/p/women-s-sunglasses-fashion-all-match-uv-protection-accessory-g871924.html,Women's Sunglasses Fashion All Match UV Protection Accessory,Sunglasses/Eyewears
774,$10.99,$17.99,https://www.jollychic.com/p/women-s-glasses-fashion-half-frame-casual-eyewear-accessory-g904820.html,Women's Glasses Fashion Half Frame Casual Eyewear Accessory,Sunglasses/Eyewears
354,$7.99,$14.99,https://www.jollychic.com/p/women-s-sunglasses-metal-rimmed-multiple-color-lens-retro-sunglasses-g941186.html,Women's Sunglasses Metal Rimmed Multiple Color Lens Retro Sunglasses,Sunglasses/Eyewears
714,$9.99,$15.99,https://www.jollychic.com/p/women-s-sunglasses-rhinestone-inlay-cat-eye-sun-protection-trendy-accessory-g978570.html,Women's Sunglasses Rhinestone Inlay Cat Eye Sun Protection Trendy Accessory,Sunglasses/Eyewears
46,$3.99,$7.99,https://www.jollychic.com/p/women-s-sunglasses-leopard-pattern-frame-stylish-uv-protection-glasses-g984450.html,Women's Sunglasses Leopard Pattern Frame Stylish UV Protection Glasses,Sunglasses/Eyewears
144,$5.99,$13.99,https://www.jollychic.com/p/women-s-sunglasses-metal-frame-stylish-cat-ears-round-sunglasses-g984906.html,Women's Sunglasses Metal Frame Stylish Cat Ears Round Sunglasses,Sunglasses/Eyewears
104,$8.99,$14.99,https://www.jollychic.com/p/women-s-sunglasses-fashion-personified-rim-casual-all-match-accessory-g1048128.html,Women's Sunglasses Fashion Personified Rim Casual All Match Accessory,Sunglasses/Eyewears
49,$5.99,$13.99,https://www.jollychic.com/p/women-s-glasses-fashion-half-rim-colorblock-all-match-eyewear-accessory-g1076580.html,Women's Glasses Fashion Half Rim Colorblock All Match Eyewear Accessory,Sunglasses/Eyewears
19,$4.99,$10.99,https://www.jollychic.com/p/women-s-sunglasses-trendy-big-frame-vintage-style-charming-accessory-g1076616.html,Women's Sunglasses Trendy Big Frame Vintage Style Charming Accessory,Sunglasses/Eyewears
35,$11.99,$18.99,https://www.jollychic.com/p/women-s-sunglasses-sun-protection-sweet-style-vogue-glasses-accessory-g1100508.html,Women's Sunglasses Sun Protection Sweet Style Vogue Glasses Accessory,Sunglasses/Eyewears
116,$4.99,$8.99,https://www.jollychic.com/p/women-s-glasses-round-frame-brief-faddish-all-match-accessory-g1158258.html,Women's Glasses Round Frame Brief Faddish All Match Accessory,Sunglasses/Eyewears
37,$8.99,$16.99,https://www.jollychic.com/p/women-s-eyeglasses-classic-preppy-style-semi-rimless-frame-trendy-accessory-g1175322.html,Women's Eyeglasses Classic Preppy Style Semi Rimless Frame Trendy Accessory,Sunglasses/Eyewears
2423,$5.99,$9.99,https://www.jollychic.com/p/women-s-fashion-glasses-cat-eye-metal-frame-gradient-lens-sunglasses-g1186948.html,Women's Fashion Glasses Cat Eye Metal Frame Gradient Lens Sunglasses,Sunglasses/Eyewears
126,$5.99,$9.99,https://www.jollychic.com/p/women-s-fashion-sunglasses-uv400-cat-eye-vintage-glasses-accessory-g1186952.html,Women's Fashion Sunglasses UV400 Cat Eye Vintage Glasses Accessory,Sunglasses/Eyewears
17,$4.99,$7.99,https://www.jollychic.com/p/women-s-sunglasses-flat-top-large-frame-vintage-uv400-sunglasses-g1194444.html,Women's Sunglasses Flat Top Large Frame Vintage UV400 Sunglasses,Sunglasses/Eyewears
191,$9.99,$16.99,https://www.jollychic.com/p/women-s-sunglasses-metal-circle-cat-eye-fashion-oversized-sunglasses-accessory-g1213108.html,Women's Sunglasses Metal Circle Cat Eye Fashion Oversized Sunglasses Accessory,Sunglasses/Eyewears
172,$8.99,$16.99,https://www.jollychic.com/p/women-s-sunglasses-candy-color-round-oversize-fashion-sunglasses-accessory-g1213126.html,Women's Sunglasses Candy Color Round Oversize Fashion Sunglasses Accessory,Sunglasses/Eyewears
443,$6.99,$11.99,https://www.jollychic.com/p/women-s-eyeglasses-round-oversized-vintage-unisex-eyeglasses-accessory-g1213152.html,Women's Eyeglasses Round Oversized Vintage Unisex Eyeglasses Accessory,Sunglasses/Eyewears
611,$9.99,$15.99,https://www.jollychic.com/p/women-s-sunglasses-geometry-shape-metal-frame-glasses-vintage-accessory-g1220568.html,Women's Sunglasses Geometry Shape Metal Frame Glasses Vintage Accessory,Sunglasses/Eyewears
25,$17.99,,https://www.jollychic.com/p/women-s-glasses-voguish-colorblock-half-frame-retro-eyewear-accessory-g1233552.html,Women's Glasses Voguish Colorblock Half Frame Retro Eyewear Accessory,Sunglasses/Eyewears
114,$6.99,$13.99,https://www.jollychic.com/p/women-s-glasses-metal-rim-brief-design-oversize-faddish-eyewear-accessory-g1233562.html,Women's Glasses Metal Rim Brief Design Oversize Faddish Eyewear Accessory,Sunglasses/Eyewears
2025,$6.99,$12.99,https://www.jollychic.com/p/women-s-glasses-unisex-transparent-polygon-shape-simple-eyewear-accessory-g1233566.html,Women's Glasses Unisex Transparent Polygon Shape Simple Eyewear Accessory,Sunglasses/Eyewears
94,$7.99,$12.99,https://www.jollychic.com/p/women-s-eyeglasses-solid-color-brief-style-all-match-accessory-g1251308.html,Women's Eyeglasses Solid Color Brief Style All Match Accessory,Sunglasses/Eyewears
114,$9.99,$15.99,https://www.jollychic.com/p/women-s-sunglasses-retro-cat-eye-oversized-trendy-eyewear-accessory-g1271464.html,Women's Sunglasses Retro Cat Eye Oversized Trendy Eyewear Accessory,Sunglasses/Eyewears
19,$5.99,$11.99,https://www.jollychic.com/p/women-s-sunglasses-faddish-style-cat-eye-big-frame-charming-accessory-g1279838.html,Women's Sunglasses Faddish Style Cat Eye Big Frame Charming Accessory,Sunglasses/Eyewears
17,$7.99,$16.99,https://www.jollychic.com/p/women-s-sunglasses-geometry-frame-brief-style-trendy-accessory-g1279844.html,Women's Sunglasses Geometry Frame Brief Style Trendy Accessory,Sunglasses/Eyewears
18,$5.99,$9.99,https://www.jollychic.com/p/women-s-sunglasses-rivet-design-one-piece-patchwork-flat-cat-eye-goggle-eyewear-g1279882.html,Women'S Sunglasses Rivet Design One Piece Patchwork Flat Cat Eye Goggle Eyewear,Sunglasses/Eyewears
278,$10.99,$17.99,https://www.jollychic.com/p/women-s-eyeglasses-thistles-and-thorns-round-clear-transparent-elegant-eyewear-g1280142.html,Women's Eyeglasses Thistles and Thorns Round Clear Transparent Elegant Eyewear,Sunglasses/Eyewears
39,$7.99,$16.99,https://www.jollychic.com/p/women-s-sunglasses-color-block-metal-frame-trendy-ladylike-accessory-g1282006.html,Women's Sunglasses Color Block Metal Frame Trendy Ladylike Accessory,Sunglasses/Eyewears
106,$19.99,,https://www.jollychic.com/p/women-s-eyeglasses-all-matched-vintage-oversized-chic-eyewear-accessory-g1301514.html,Women's Eyeglasses All Matched Vintage Oversized Chic Eyewear Accessory,Sunglasses/Eyewears
15,$8.99,$19.99,https://www.jollychic.com/p/women-s-cat-eye-sunglasses-big-frame-ladies-driving-eyewear-g1308774.html,Women's Cat Eye Sunglasses Big Frame Ladies Driving Eyewear,Sunglasses/Eyewears
18,$11.99,$26.99,https://www.jollychic.com/p/women-s-fashion-cat-eye-sunglasses-oversize-bow-simple-eyewear-g1308776.html,Women's Fashion Cat Eye Sunglasses Oversize Bow Simple Eyewear,Sunglasses/Eyewears
32,$9.99,$19.99,https://www.jollychic.com/p/women-s-eyewears-plastic-rectangular-frame-stylish-design-eyewear-accessory-g1319408.html,Women's Eyewears Plastic Rectangular Frame Stylish Design Eyewear Accessory,Sunglasses/Eyewears
138,$10.99,$23.99,https://www.jollychic.com/p/women-s-sunglasses-chic-all-match-metal-cat-eye-oversized-frame-eyewear-accessory-g1326882.html,Women's Sunglasses Chic All Match Metal Cat Eye Oversized Frame Eyewear Accessory,Sunglasses/Eyewears
9,$19.99,$32.99,https://www.jollychic.com/p/skadino-women-s-sunglasses-personalized-irregular-shaped-frame-chic-polarized-light-accessory-g1332540.html,SKADINO Women's Sunglasses Personalized Irregular Shaped Frame Chic Polarized Light Accessory,Sunglasses/Eyewears
14,$16.99,$41.99,https://www.jollychic.com/p/women-s-sunglasses-chic-polarized-full-rimmed-uv-protection-driving-glasses-g1334240.html,Women's Sunglasses Chic Polarized Full Rimmed UV Protection Driving Glasses,Sunglasses/Eyewears
194,$8.99,$21.99,https://www.jollychic.com/p/women-s-eyeglasses-brief-style-geometry-shape-trendy-ladylike-accessory-g1341920.html,Women's Eyeglasses Brief Style Geometry Shape Trendy Ladylike Accessory,Sunglasses/Eyewears
52,$38.99,,https://www.jollychic.com/p/women-s-sunglasses-retro-style-sweet-all-match-faddish-accessory-g1354778.html,women's Sunglasses Retro Style Sweet All Match Faddish Accessory,Sunglasses/Eyewears
140,$7.99,$19.99,https://www.jollychic.com/p/women-s-sunglasses-retro-style-irregular-shaped-fashion-all-match-glasses-accessory-g1361654.html,Women's Sunglasses Retro Style Irregular Shaped Fashion All Match Glasses Accessory,Sunglasses/Eyewears
27,$11.99,$26.99,https://www.jollychic.com/p/women-s-sunglasses-square-patchwork-triple-color-clear-frame-sunglasses-accessory-g1412066.html,Women's Sunglasses Square Patchwork Triple Color Clear Frame Sunglasses Accessory,Sunglasses/Eyewears
13,$28.99,,https://www.jollychic.com/p/women-s-sunglasses-large-frame-luxury-crystal-black-frame-fashion-plain-glasses-g1429714.html,Women's Sunglasses Large Frame Luxury Crystal Black Frame Fashion Plain Glasses,Sunglasses/Eyewears
8,$9.99,$21.99,https://www.jollychic.com/p/women-s-sunglasses-charming-decoration-brief-style-all-match-accessory-g1430158.html,Women's Sunglasses Charming Decoration Brief Style All Match Accessory,Sunglasses/Eyewears
7,$13.99,$27.99,https://www.jollychic.com/p/women-s-sunglasses-fashion-luxury-crystal-square-all-match-sunglasses-g1430352.html,Women's Sunglasses Fashion Luxury Crystal Square All Match Sunglasses,Sunglasses/Eyewears
45,$8.99,$18.99,https://www.jollychic.com/p/unisex-sunglasses-all-match-fashion-square-big-frame-accessory-g1441366.html,Unisex Sunglasses All-match Fashion Square Big Frame Accessory,Sunglasses/Eyewears
8,$29.99,,https://www.jollychic.com/p/women-s-sunglasses-crystal-diamond-polygon-irregularity-vintage-style-big-frame-sunglasses-g1467570.html,Women's Sunglasses Crystal Diamond Polygon Irregularity Vintage Style Big Frame Sunglasses,Sunglasses/Eyewears
20,$6.99,$17.99,https://www.jollychic.com/p/women-s-eyeglasses-half-frame-cat-eye-frame-simple-trendy-glasses-accessory-g1470628.html,Women's Eyeglasses Half Frame Cat Eye Frame Simple Trendy Glasses Accessory,Sunglasses/Eyewears
0,$25.99,,https://www.jollychic.com/p/women-s-eyeglasses-brief-style-personalized-all-match-ladylike-eyewear-accessory-g1602852.html,Women's Eyeglasses Brief Style Personalized All Match Ladylike Eyewear Accessory,Sunglasses/Eyewears
0,$25.99,,https://www.jollychic.com/p/women-s-eyeglasses-exquisite-design-all-match-elegant-chic-eyewear-accessory-g1602858.html,Women's Eyeglasses Exquisite Design All Match Elegant Chic Eyewear Accessory,Sunglasses/Eyewears
0,$25.99,,https://www.jollychic.com/p/women-s-eyeglasses-brief-style-preppy-all-match-personalized-graceful-eyewear-accessory-g1602864.html,Women's Eyeglasses Brief Style Preppy All Match Personalized Graceful Eyewear Accessory,Sunglasses/Eyewears
0,$25.99,,https://www.jollychic.com/p/women-s-eyeglasses-square-frame-plain-style-creative-stylish-eyewear-accessory-g1602870.html,Women's Eyeglasses Square Frame Plain Style Creative Stylish Eyewear Accessory,Sunglasses/Eyewears
0,$10.99,$16.99,https://www.jollychic.com/p/women-s-eyeglasses-square-full-frame-preppy-style-all-match-glasses-accessory-g1618954.html,Women's Eyeglasses Square Full Frame Preppy Style All Match Glasses Accessory,Sunglasses/Eyewears
0,$11.99,,https://www.jollychic.com/p/women-s-eyeglasses-square-full-frame-rhinestones-inlay-design-trendy-accessory-g1621282.html,Women's Eyeglasses Square Full Frame Rhinestones Inlay Design Trendy Accessory,Sunglasses/Eyewears
1,$11.99,,https://www.jollychic.com/p/women-s-eyeglasses-square-full-frame-rhinestones-inlay-trendy-fashion-watch-accessory-g1621284.html,Women's Eyeglasses Square Full Frame Rhinestones Inlay Trendy Fashion Watch Accessory,Sunglasses/Eyewears
0,$16.99,,https://www.jollychic.com/p/women-s-eyeglasses-round-thin-frame-preppy-style-trendy-couple-glasses-accessory-g1621286.html,Women's Eyeglasses Round Thin Frame Preppy Style Trendy Couple Glasses Accessory,Sunglasses/Eyewears
0,$15.99,,https://www.jollychic.com/p/women-s-sunglasses-solid-color-transparent-brief-style-faddish-eyewear-accessory-g1623476.html,Women's Sunglasses Solid Color Transparent Brief Style Faddish Eyewear Accessory,Sunglasses/Eyewears
0,$14.99,,https://www.jollychic.com/p/women-s-sunglasses-transparent-plain-style-all-match-ladylike-eyewear-accessory-g1623550.html,Women's Sunglasses Transparent Plain Style All Match Ladylike Eyewear Accessory,Sunglasses/Eyewears
0,$16.99,,https://www.jollychic.com/p/women-s-eyeglasses-round-frame-simple-design-preppy-style-eyewear-accessory-g1623744.html,Women's Eyeglasses Round Frame Simple Design Preppy Style Eyewear Accessory,Sunglasses/Eyewears
0,$17.99,,https://www.jollychic.com/p/women-s-eyeglasses-cat-eye-preppy-style-plain-all-match-chic-eyewear-accessory-g1623766.html,Women's Eyeglasses Cat Eye Preppy Style Plain All Match Chic Eyewear Accessory,Sunglasses/Eyewears
1,$25.99,,https://www.jollychic.com/p/women-s-sunglasses-all-match-trendy-personalized-design-polarized-sunglasses-accessory-g1624994.html,Women's Sunglasses All Match Trendy Personalized Design Polarized Sunglasses Accessory,Sunglasses/Eyewears
0,$25.99,,https://www.jollychic.com/p/women-s-sunglasses-color-block-frame-stylish-all-match-polarized-sunglasses-accessoy-g1624996.html,Women's Sunglasses Color Block Frame Stylish All Match Polarized Sunglasses Accessoy,Sunglasses/Eyewears
1,$22.99,,https://www.jollychic.com/p/women-s-sunglasses-round-frame-glasses-outdoor-polarized-sunglasses-accessory-g1625004.html,Women's Sunglasses Round Frame Glasses Outdoor Polarized Sunglasses Accessory,Sunglasses/Eyewears
0,$17.99,,https://www.jollychic.com/p/women-s-eyeglasses-round-frame-full-frame-vintage-style-all-match-glasses-accessory-g1625006.html,Women's Eyeglasses Round Frame Full Frame Vintage Style All Match Glasses Accessory,Sunglasses/Eyewears
0,$17.99,,https://www.jollychic.com/p/women-s-eyeglasses-round-thin-frame-vintage-style-couple-glasses-accessory-g1625014.html,Women's Eyeglasses Round Thin Frame Vintage Style Couple Glasses Accessory,Sunglasses/Eyewears
0,$17.99,,https://www.jollychic.com/p/women-s-eyeglasses-round-full-frame-anti-blue-ray-clear-lens-glasses-accessory-g1625030.html,Women's Eyeglasses Round Full Frame Anti Blue-Ray Clear Lens Glasses Accessory,Sunglasses/Eyewears
0,$17.99,,https://www.jollychic.com/p/women-s-eyeglasses-round-full-frame-simple-design-all-match-couple-glasses-accessory-g1625046.html,Women's Eyeglasses Round Full Frame Simple Design All Match Couple Glasses Accessory,Sunglasses/Eyewears
1,$17.99,,https://www.jollychic.com/p/women-s-eyeglasses-round-full-frame-radiation-protection-couple-clear-lens-glasses-accessory-g1625076.html,Women's Eyeglasses Round Full Frame Radiation Protection Couple Clear Lens Glasses Accessory,Sunglasses/Eyewears
0,$23.99,,https://www.jollychic.com/p/women-s-sunglasses-square-shape-full-frame-oversize-comfy-polarized-sunglasses-accessory-g1625230.html,Women's Sunglasses Square Shape Full Frame Oversize Comfy Polarized Sunglasses Accessory,Sunglasses/Eyewears
0,$36.99,,https://www.jollychic.com/p/women-s-sunglasses-square-frame-all-match-trendy-couple-polarized-sunglasses-accessory-g1625236.html,Women's Sunglasses Square Frame All Match Trendy Couple Polarized Sunglasses Accessory,Sunglasses/Eyewears
0,$24.99,,https://www.jollychic.com/p/women-s-sunglasses-round-full-frame-design-simple-all-match-couple-polarized-sunglasses-g1625248.html,Women's Sunglasses Round Full Frame Design Simple All Match Couple Polarized Sunglasses,Sunglasses/Eyewears
0,$12.99,,https://www.jollychic.com/p/women-s-sunglasses-round-frame-color-change-fashionable-couple-polarized-sunglasses-g1631920.html,Women's Sunglasses Round Frame Color Change Fashionable Couple Polarized Sunglasses,Sunglasses/Eyewears
0,$21.99,,https://www.jollychic.com/p/women-s-sunglasses-fashion-round-rivet-candy-color-driving-uv400-sunglasses-g1631922.html,Women's Sunglasses Fashion Round Rivet Candy Color Driving UV400 Sunglasses,Sunglasses/Eyewears
0,$18.99,,https://www.jollychic.com/p/women-s-sunglasses-fashion-oval-reflective-small-frame-driving-sunglasses-g1631924.html,Women's Sunglasses Fashion Oval Reflective Small Frame Driving Sunglasses,Sunglasses/Eyewears
0,$25.99,,https://www.jollychic.com/p/women-s-sunglasses-luxury-cat-eye-rimless-crystal-fashion-gradient-sunglasses-g1631926.html,Women's Sunglasses Luxury Cat Eye Rimless Crystal Fashion Gradient Sunglasses,Sunglasses/Eyewears
