add_wish,discount_price,original_price,product_link,product_name,header_block
798,$2.99,$8.99,https://www.jollychic.com/p/brown-curly-woman-quality-hair-extensions-g67946.html,Brown Curly Woman Quality Hair Extensions,Wigs
3403,$2.99,$9.99,https://www.jollychic.com/p/one-piece-straight-hair-woman-natural-extensions-g67972.html,One Piece Straight Hair Woman Natural Extensions,Wigs
8704,$3.99,$10.99,https://www.jollychic.com/p/solid-straight-ponytail-woman-fashion-wigs-g68054.html,Solid Straight Ponytail Woman Fashion Wigs,Wigs
445,$2.99,$9.99,https://www.jollychic.com/p/newly-chic-colorful-curly-tied-pony-wigs-g68060.html,Newly Chic Colorful Curly Tied Pony Wigs,Wigs
1189,$1.99,$9.99,https://www.jollychic.com/p/stylish-sweet-colorful-long-ponytail-curly-wig-g68068.html,Stylish Sweet Colorful Long Ponytail Curly Wig,Wigs
611,$1.99,$9.99,https://www.jollychic.com/p/one-piece-fashion-hair-extension-straight-wigs-g68072.html,One Piece Fashion Hair Extension Straight Wigs,Wigs
1086,$16.99,,https://www.jollychic.com/p/vintage-sizing-twist-stylish-chignons-for-women-black-g68436.html,Vintage Sizing Twist Stylish Chignons For Women Black,Wigs
261,$8.99,$16.99,https://www.jollychic.com/p/designer-soft-curly-hair-chignon-black-for-women-g68460.html,Designer Soft Curly Hair Chignon Black For Women,Wigs
1004,$10.99,$15.99,https://www.jollychic.com/p/fashion-short-style-gold-women-s-wig-g145053.html,Fashion Short Style Gold Women's Wig,Wigs
2232,$9.99,$31.99,https://www.jollychic.com/p/lady-straight-fluffy-mild-long-wig-g150625.html,Lady Straight Fluffy Mild Long Wig,Wigs
895,$1.99,$2.99,https://www.jollychic.com/p/lovely-natural-look-fluffy-ball-shape-curly-women-wig-g277689.html,Lovely Natural Look Fluffy Ball Shape Curly Women Wig,Wigs
423,$2.99,,https://www.jollychic.com/p/groovy-upscale-lively-women-synthetic-straight-bun-wig-g277697.html,Groovy Upscale Lively Women Synthetic Straight Bun Wig,Wigs
1499,$2.99,,https://www.jollychic.com/p/lovely-youthful-sterling-women-straight-bun-synthetic-wig-g277709.html,Lovely Youthful Sterling Women Straight Bun Synthetic Wig,Wigs
1242,$14.99,$18.99,https://www.jollychic.com/p/natural-look-cozy-wavy-synthetic-ritzy-women-s-long-wig-g281102.html,Natural Look Cozy Wavy Synthetic Ritzy Women's Long Wig,Wigs
711,$50.99,$71.00,https://www.jollychic.com/p/faddish-shimmering-straight-natural-20-pcs-women-s-wig-set-g388450.html,Faddish Shimmering Straight Natural 20 Pcs Women's Wig Set,Wigs
944,$47.99,$76.00,https://www.jollychic.com/p/high-end-chic-black-smooth-20-pcs-women-s-wig-set-g388462.html,High End Chic Black Smooth 20 Pcs Women's Wig Set,Wigs
935,$57.00,,https://www.jollychic.com/p/human-hair-wavy-classy-natural-black-sterling-women-s-wig-g388622.html,Human Hair Wavy Classy Natural Black Sterling Women's Wig,Wigs
5014,$7.99,$15.99,https://www.jollychic.com/p/natural-short-hair-replacement-wig-smooth-centre-parting-soft-women-s-wig-g389404.html,Natural Short Hair Replacement Wig Smooth Centre Parting Soft Women's Wig,Wigs
466,$3.99,$5.99,https://www.jollychic.com/p/women-s-wig-elegant-gradient-color-long-glossy-natural-straight-hair-accessory-g505568.html,Women's Wig Elegant Gradient Color Long Glossy Natural Straight Hair Accessory,Wigs
1086,$19.99,$24.99,https://www.jollychic.com/p/women-s-wig-mature-glam-gradient-color-straight-middle-length-synthetic-hair-g513564.html,Women's Wig Mature Glam Gradient Color Straight Middle Length Synthetic Hair,Wigs
1253,$14.99,$23.99,https://www.jollychic.com/p/women-s-wig-elegant-grey-long-curly-synthetic-hair-replacement-accessory-g543828.html,Women's Wig Elegant Grey Long Curly Synthetic Hair Replacement Accessory,Wigs
1507,$9.99,$14.99,https://www.jollychic.com/p/women-s-wig-classy-maroon-sideswept-bangs-kinky-long-sleek-hair-replacement-g550264.html,Women's Wig Classy Maroon Sideswept Bangs Kinky Long Sleek Hair Replacement,Wigs
130,$47.99,,https://www.jollychic.com/p/women-s-wig-silky-straight-unprocessed-human-hair-weft-extensions-g613414.html,Women's Wig Silky Straight Unprocessed Human Hair Weft Extensions,Wigs
75,$13.99,$21.99,https://www.jollychic.com/p/women-s-wig-short-straight-vogue-hair-accessory-g618038.html,Women's Wig Short Straight Vogue Hair Accessory,Wigs
509,$7.99,$11.99,https://www.jollychic.com/p/women-s-wig-bang-short-bob-style-lovely-fair-lady-hair-accessory-g618052.html,Women's Wig Bang Short Bob Style Lovely Fair Lady Hair Accessory,Wigs
450,$16.99,$24.99,https://www.jollychic.com/p/women-s-wig-bob-style-faddish-hair-accessory-g618072.html,Women's Wig Bob Style Faddish Hair Accessory,Wigs
528,$11.99,$22.99,https://www.jollychic.com/p/women-s-wig-fringe-groovy-glossy-hair-accessory-g618088.html,Women's Wig Fringe Groovy Glossy Hair Accessory,Wigs
67,$20.99,$33.99,https://www.jollychic.com/p/women-s-wig-apealing-fashion-brghtcolor-curly-hair-accessory-g621178.html,Women's Wig Apealing Fashion Brghtcolor Curly Hair Accessory,Wigs
35,$11.99,,https://www.jollychic.com/p/women-s-wig-glossy-lovely-bob-hairstyle-blunt-bangs-hair-accessory-g621704.html,Women's Wig Glossy Lovely Bob Hairstyle Blunt Bangs Hair Accessory,Wigs
1282,$16.99,$25.99,https://www.jollychic.com/p/women-s-wig-faddish-graceful-long-straight-silvery-grey-color-hair-wig-g624396.html,Women's Wig Faddish Graceful Long Straight Silvery Grey Color Hair Wig,Wigs
27,$141.00,,https://www.jollychic.com/p/women-s-wig-golden-blunt-cut-bangs-long-straight-human-hair-accessory-g632028.html,Women's Wig Golden Blunt Cut Bangs Long Straight Human Hair Accessory,Wigs
32,$142.00,,https://www.jollychic.com/p/women-s-wig-mix-color-tilted-frisette-straight-long-human-hair-accessory-g653762.html,Women's Wig Mix Color Tilted Frisette Straight Long Human Hair Accessory,Wigs
222,$16.99,$25.99,https://www.jollychic.com/p/women-s-wig-brown-soft-tilted-frisette-curly-long-synthetic-hair-accessory-g653794.html,Women's Wig Brown Soft Tilted Frisette Curly Long Synthetic Hair Accessory,Wigs
1450,$3.99,,https://www.jollychic.com/p/women-s-wig-seamless-new-trend-curly-charming-long-synthetic-hair-accessory-g662990.html,Women's Wig Seamless New Trend Curly Charming Long Synthetic Hair Accessory,Wigs
2469,$4.99,,https://www.jollychic.com/p/women-s-wig-seamless-synthetic-long-glossy-natural-straight-hair-accessory-g662996.html,Women's Wig Seamless Synthetic Long Glossy Natural Straight Hair Accessory,Wigs
48,$12.99,$17.99,https://www.jollychic.com/p/women-s-wig-black-stylish-soft-curly-short-human-hair-accessory-g677692.html,Women's Wig Black Stylish Soft Curly Short Human Hair Accessory,Wigs
243,$15.99,$24.99,https://www.jollychic.com/p/women-s-wig-wine-red-soft-tilted-frisette-straight-long-human-hair-accessory-g677698.html,Women's Wig Wine Red Soft Tilted Frisette Straight Long Human Hair Accessory,Wigs
95,$87.00,$146.00,https://www.jollychic.com/p/women-s-wig-brown-natural-lace-long-hair-synthetic-accessory-g678176.html,Women's Wig Brown Natural Lace Long Hair Synthetic Accessory,Wigs
188,$24.99,$27.99,https://www.jollychic.com/p/women-s-wig-short-curly-fashion-hair-synthetic-accessory-g678638.html,Women's Wig Short Curly Fashion Hair Synthetic Accessory,Wigs
423,$14.99,$24.99,https://www.jollychic.com/p/women-s-wig-black-long-straight-fashion-hair-synthetic-accessory-g679006.html,Women's Wig Black Long Straight Fashion Hair Synthetic Accessory,Wigs
1239,$78.00,$100.00,https://www.jollychic.com/p/women-s-wigs-trendy-black-long-straight-synthetic-hair-accessory-g681450.html,Women's Wigs Trendy Black Long Straight Synthetic Hair Accessory,Wigs
111,$14.99,$24.99,https://www.jollychic.com/p/women-s-wig-long-straight-slanting-bang-synthetic-hair-accessory-g701994.html,Women's Wig Long Straight Slanting Bang Synthetic Hair Accessory,Wigs
40,$16.99,,https://www.jollychic.com/p/women-s-wig-slanting-bang-long-curly-synthetic-hair-accessory-g701996.html,Women's Wig Slanting Bang Long Curly Synthetic Hair Accessory,Wigs
185,$66.00,$101.00,https://www.jollychic.com/p/women-s-wig-curly-long-black-chemical-fiber-hair-charming-accessory-g744364.html,Women's Wig Curly Long Black Chemical Fiber Hair Charming Accessory,Wigs
2751,$65.00,$110.00,https://www.jollychic.com/p/women-s-charming-chic-long-pin-curl-fiber-hair-without-bangs-g751834.html,Women's Charming Chic Long Pin Curl Fiber Hair Without Bangs,Wigs
1361,$95.00,,https://www.jollychic.com/p/women-s-wig-elegant-classy-sleek-long-straight-fiber-hair-accessory-g751844.html,Women's Wig Elegant Classy Sleek Long Straight Fiber Hair Accessory,Wigs
1258,$5.99,,https://www.jollychic.com/p/women-s-wig-long-straight-ponytail-multiple-colors-optional-hair-extension-g772210.html,Women's Wig Long Straight Ponytail Multiple Colors Optional Hair Extension,Wigs
243,$0.99,$5.99,https://www.jollychic.com/p/women-s-wig-artificial-side-bangs-hair-clip-design-hair-extension-g772270.html,Women's Wig Artificial Side Bangs Hair Clip Design Hair Extension,Wigs
128,$65.00,$100.00,https://www.jollychic.com/p/women-s-wigs-black-straight-central-parting-long-synthetic-hair-accessories-g782272.html,Women's Wigs Black Straight Central Parting Long Synthetic Hair Accessories,Wigs
12,$61.00,$102.00,https://www.jollychic.com/p/women-s-wig-black-lace-front-kinky-straight-wig-synthetic-hair-wig-accessory-g853158.html,Women's Wig Black Lace Front Kinky Straight Wig Synthetic Hair Wig Accessory,Wigs
46,$132.00,,https://www.jollychic.com/p/women-s-wig-gradient-color-slightly-curled-long-human-hair-accessory-g885820.html,Women's Wig Gradient Color Slightly Curled Long Human Hair Accessory,Wigs
532,$21.99,$28.99,https://www.jollychic.com/p/women-s-wig-fashion-all-match-charming-long-straight-synthetic-hair-accessory-g886182.html,Women's Wig Fashion All Match Charming Long Straight Synthetic Hair Accessory,Wigs
843,$19.99,$24.99,https://www.jollychic.com/p/women-s-wig-charming-central-parting-long-straight-hair-accessory-g894984.html,Women's Wig Charming Central Parting Long Straight Hair Accessory,Wigs
414,$18.99,$24.99,https://www.jollychic.com/p/women-s-wig-elegant-fashion-brown-natural-straight-side-parting-hair-accessory-g894996.html,Women's Wig Elegant Fashion Brown Natural Straight Side Parting Hair Accessory,Wigs
1028,$60.00,$100.00,https://www.jollychic.com/p/women-s-wig-side-parting-curly-short-hair-chemical-fiber-accessory-g916510.html,Women's Wig Side Parting Curly Short Hair Chemical Fiber Accessory,Wigs
820,$62.00,$96.00,https://www.jollychic.com/p/women-s-wig-bob-central-parting-heat-resistant-chemical-fiber-accessory-g916512.html,Women's Wig Bob Central Parting Heat Resistant Chemical Fiber Accessory,Wigs
256,$16.99,$24.99,https://www.jollychic.com/p/women-s-wig-mixed-color-straight-bobo-wig-accessory-g929784.html,Women's Wig Mixed Color Straight BoBo Wig Accessory,Wigs
107,$15.99,$23.99,https://www.jollychic.com/p/women-s-wig-long-straight-faddish-brown-hair-charming-all-match-accessory-g966780.html,Women's Wig Long Straight Faddish Brown Hair Charming All Match Accessory,Wigs
50,$78.00,$101.00,https://www.jollychic.com/p/women-s-wig-black-long-curly-fashion-hair-synthetic-accessory-g977536.html,Women's Wig Black Long Curly Fashion Hair Synthetic Accessory,Wigs
511,$14.99,$24.99,https://www.jollychic.com/p/women-s-wig-color-block-long-curly-fashion-hair-synthetic-accessory-g977538.html,Women's Wig Color Block Long Curly Fashion Hair Synthetic Accessory,Wigs
17,$18.99,$28.99,https://www.jollychic.com/p/women-s-wig-personalized-mixed-color-curly-long-pattern-accessory-g990618.html,Women's Wig Personalized Mixed Color Curly Long Pattern Accessory,Wigs
605,$6.99,,https://www.jollychic.com/p/women-s-extension-synthetic-hair-long-straight-silky-hair-wig-accessory-g1016186.html,Women's Extension Synthetic Hair Long Straight Silky Hair Wig Accessory,Wigs
27,$22.99,,https://www.jollychic.com/p/women-s-wig-middle-part-natural-slight-curly-hair-synthetic-charming-wig-accessory-g1016378.html,Women's Wig Middle Part Natural Slight Curly Hair Synthetic Charming Wig Accessory,Wigs
1321,$19.99,$28.99,https://www.jollychic.com/p/women-s-wig-long-curly-faddish-black-hair-synthetic-accessory-g1112816.html,Women's Wig Long Curly Faddish Black Hair Synthetic Accessory,Wigs
718,$16.99,$25.99,https://www.jollychic.com/p/women-s-synthetic-hair-wig-straight-short-pattern-deep-red-wig-g1142378.html,Women's Synthetic Hair Wig Straight Short Pattern Deep Red Wig,Wigs
526,$17.99,$26.99,https://www.jollychic.com/p/women-s-synthetic-hair-wig-gradiant-colour-long-pattern-stylish-wig-g1142384.html,Women's Synthetic Hair Wig Gradiant Colour Long Pattern Stylish Wig,Wigs
73,$20.99,$31.99,https://www.jollychic.com/p/women-s-wig-solid-color-personalized-curly-long-pattern-synthetic-hair-accessory-g1187828.html,Women's Wig Solid Color Personalized Curly Long Pattern Synthetic Hair Accessory,Wigs
173,$20.99,$33.99,https://www.jollychic.com/p/women-s-wig-air-bangs-flaxen-grey-curly-long-hair-wig-g1214550.html,Women's Wig Air Bangs Flaxen Grey Curly Long Hair Wig,Wigs
223,$9.99,$15.99,https://www.jollychic.com/p/women-s-ponytail-mixed-color-gradient-color-with-clips-hair-wig-extension-accessory-g1221416.html,Women's Ponytail Mixed Color Gradient Color With Clips Hair Wig Extension Accessory,Wigs
1899,$5.99,$9.99,https://www.jollychic.com/p/women-s-hair-extension-stylish-straight-hair-wig-accessory-g1221972.html,Women's Hair Extension Stylish Straight Hair Wig Accessory,Wigs
916,$4.99,$8.99,https://www.jollychic.com/p/women-s-fashion-wig-hair-extension-solid-color-long-straight-hair-wig-accessory-g1222866.html,Women's Fashion Wig Hair Extension Solid Color Long Straight Hair Wig Accessory,Wigs
151,$3.99,$4.99,https://www.jollychic.com/p/women-s-ponytail-wavy-curly-long-gradient-color-natural-wig-accessory-g1227126.html,Women's Ponytail Wavy Curly Long Gradient Color Natural Wig Accessory,Wigs
83,$3.99,,https://www.jollychic.com/p/women-s-ponytail-long-wavy-curly-natural-synthetic-wig-accessory-g1227132.html,Women's Ponytail Long Wavy Curly Natural Synthetic Wig Accessory,Wigs
19,$5.99,,https://www.jollychic.com/p/women-s-ponytail-retro-style-elegant-ladylike-faddish-accessory-g1233936.html,Women's Ponytail Retro Style Elegant Ladylike Faddish Accessory,Wigs
114,$5.99,,https://www.jollychic.com/p/women-s-ponytail-faddish-retro-style-elegant-ladylike-faddish-accessory-g1233962.html,Women's Ponytail Faddish Retro Style Elegant Ladylike Faddish Accessory,Wigs
29,$24.99,$38.99,https://www.jollychic.com/p/synthetic-hair-wig-chemical-fiber-brown-whole-curl-short-hair-wig-g1304512.html,Synthetic Hair Wig Chemical Fiber Brown Whole Curl Short Hair Wig,Wigs
55,$23.99,$36.99,https://www.jollychic.com/p/women-s-wig-middle-parted-long-curly-gradient-color-synthetic-hair-accessory-g1321618.html,Women's Wig Middle Parted Long Curly Gradient Color Synthetic Hair Accessory,Wigs
50,$24.99,$38.99,https://www.jollychic.com/p/women-s-synthetic-hair-wig-black-curly-middle-length-all-match-hair-accessory-g1361170.html,Women's Synthetic Hair Wig Black Curly Middle Length All Match Hair Accessory,Wigs
233,$21.99,$36.99,https://www.jollychic.com/p/women-s-synthetic-hair-wig-middle-parted-pink-gradient-straight-hair-accessory-g1361174.html,Women's Synthetic Hair Wig Middle Parted Pink Gradient Straight Hair Accessory,Wigs
64,$21.99,$36.99,https://www.jollychic.com/p/women-s-synthetic-hair-wig-black-middle-parted-long-curly-hair-accessory-g1361176.html,Women's Synthetic Hair Wig Black Middle Parted Long Curly Hair Accessory,Wigs
339,$15.99,$32.99,https://www.jollychic.com/p/women-s-synthetic-hair-wig-gradient-middle-parted-all-match-hair-accessory-g1361180.html,Women's Synthetic Hair Wig Gradient Middle Parted All Match Hair Accessory,Wigs
55,$24.99,$41.99,https://www.jollychic.com/p/women-s-hair-wig-synthetic-long-curly-side-fringe-chic-hair-accessory-g1363106.html,Women's Hair Wig Synthetic Long Curly Side Fringe Chic Hair Accessory,Wigs
26,$4.99,$11.99,https://www.jollychic.com/p/women-s-wig-short-straight-fluffy-ladylike-vintage-style-faddish-hair-accessory-g1380804.html,Women's Wig Short Straight Fluffy Ladylike Vintage Style Faddish Hair Accessory,Wigs
131,$5.99,$13.99,https://www.jollychic.com/p/women-s-wig-straight-bangs-ladylike-elegant-fashionable-hair-accessory-g1380806.html,Women's Wig Straight Bangs Ladylike Elegant Fashionable Hair Accessory,Wigs
103,$25.99,,https://www.jollychic.com/p/women-s-wig-middle-part-straight-gradient-color-trendy-synthetic-hair-wig-accessory-g1468304.html,Women's Wig Middle Part Straight Gradient Color Trendy Synthetic Hair Wig Accessory,Wigs
22,$13.99,$22.99,https://www.jollychic.com/p/12pcs-women-s-extension-long-straight-elegant-creative-chic-hair-accessory-g1469882.html,12Pcs Women's Extension Long Straight Elegant Creative Chic Hair Accessory,Wigs
11,$14.99,$24.99,https://www.jollychic.com/p/women-s-wig-solid-color-long-curly-fashion-hair-synthetic-accessory-g1475732.html,Women's Wig Solid Color Long Curly Fashion Hair Synthetic Accessory,Wigs
19,$9.99,$22.99,https://www.jollychic.com/p/7-pcs-women-s-extension-set-all-match-elegant-straight-long-pattern-accessory-g1482078.html,7 Pcs Women's Extension Set All Match Elegant Straight Long Pattern Accessory,Wigs
44,$5.99,$13.99,https://www.jollychic.com/p/women-s-ponytial-short-straight-pattern-solid-color-chemical-fiber-wig-accessory-g1495510.html,Women's Ponytial Short Straight Pattern Solid Color Chemical Fiber Wig Accessory,Wigs
14,$2.99,$7.99,https://www.jollychic.com/p/women-s-extension-butterfly-decor-long-shining-design-trendy-all-match-hair-accessory-g1571394.html,Women's Extension Butterfly Decor Long Shining Design Trendy All Match Hair Accessory,Wigs
15,$20.99,$34.99,https://www.jollychic.com/p/women-s-synthetic-hair-wig-gradient-color-long-straight-75cm-230g-all-match-chic-hair-accessory-g1583338.html,Women's Synthetic Hair Wig Gradient Color Long Straight 75cm 230g All Match Chic Hair Accessory,Wigs
14,$18.99,$30.99,https://www.jollychic.com/p/women-s-synthetic-hair-wig-gradient-color-long-straight-65cm-all-match-chic-hair-accessory-g1583342.html,Women's Synthetic Hair Wig Gradient Color Long Straight 65cm All Match Chic Hair Accessory,Wigs
0,$8.99,$14.99,https://www.jollychic.com/p/women-s-ponytail-solid-color-short-curly-pattern-top-fashion-all-match-hair-accessory-g1599014.html,Women's Ponytail Solid Color Short Curly Pattern Top Fashion All Match Hair Accessory,Wigs
2,$10.99,$17.99,https://www.jollychic.com/p/women-s-ponytail-brief-design-all-match-elegant-chic-hair-wig-accessory-g1599016.html,Women's Ponytail Brief Design All Match Elegant Chic Hair Wig Accessory,Wigs
0,$10.99,$17.99,https://www.jollychic.com/p/women-s-ponytail-solid-color-simple-style-all-match-chemical-fiber-hair-accessory-g1599018.html,Women's Ponytail Solid Color Simple Style All Match Chemical Fiber Hair Accessory,Wigs
1,$10.99,$17.99,https://www.jollychic.com/p/women-s-ponytail-solid-color-all-match-top-fashion-short-straight-pattern-hair-accessory-g1599020.html,Women's Ponytail Solid Color All Match Top Fashion Short Straight Pattern Hair Accessory,Wigs
2,$10.99,$17.99,https://www.jollychic.com/p/women-s-ponytail-solid-color-top-fashion-chemical-fiber-hair-accessory-g1599022.html,Women's Ponytail Solid Color Top Fashion Chemical Fiber Hair Accessory,Wigs
0,$10.99,$17.99,https://www.jollychic.com/p/women-s-ponytail-solid-color-simple-style-all-match-chemical-fiber-hair-accessory-g1600064.html,Women's Ponytail Solid Color Simple Style All Match Chemical Fiber Hair Accessory,Wigs
8,$10.99,$17.99,https://www.jollychic.com/p/women-s-ponytail-solid-color-top-fashion-all-match-elegant-pigtail-hair-accessory-g1600136.html,Women's Ponytail Solid Color Top Fashion All Match Elegant Pigtail Hair Accessory,Wigs
2,$10.99,$17.99,https://www.jollychic.com/p/women-s-ponytail-solid-color-top-fashion-ladylike-elegant-hair-accessory-g1600886.html,Women's Ponytail Solid Color Top Fashion Ladylike Elegant Hair Accessory,Wigs
7,$30.99,$43.99,https://www.jollychic.com/p/women-s-synthetic-hair-wig-solid-color-top-fashion-all-match-sweet-pattern-hair-accessory-g1600916.html,Women's Synthetic Hair Wig Solid Color Top Fashion All Match Sweet Pattern Hair Accessory,Wigs
10,$37.99,,https://www.jollychic.com/p/women-s-synthetic-hair-wig-long-straight-pattern-top-fashion-all-match-hair-accessory-g1600918.html,Women's Synthetic Hair Wig Long Straight Pattern Top Fashion All Match Hair Accessory,Wigs
4,$36.99,,https://www.jollychic.com/p/women-s-synthetic-hair-wig-short-straight-pattern-lovely-style-all-match-hair-accessory-g1600920.html,Women's Synthetic Hair Wig Short Straight Pattern Lovely Style All Match Hair Accessory,Wigs
3,$20.99,$29.99,https://www.jollychic.com/p/women-s-synthetic-hair-wig-solid-color-long-straight-pattern-top-fashion-cosplay-hair-accessory-g1600922.html,Women's Synthetic Hair Wig Solid Color Long Straight Pattern Top Fashion Cosplay Hair Accessory,Wigs
20,$22.99,$31.99,https://www.jollychic.com/p/women-s-synthetic-hair-wig-solid-color-long-straight-pattern-exquisite-cosplay-hair-accessory-g1600924.html,Women's Synthetic Hair Wig Solid Color Long Straight Pattern Exquisite Cosplay Hair Accessory,Wigs
2,$44.99,$64.00,https://www.jollychic.com/p/women-s-wig-black-charming-fashion-hair-human-hair-accessory-g1601972.html,Women's Wig Black Charming Fashion Hair Human Hair Accessory,Wigs
0,$44.99,$64.00,https://www.jollychic.com/p/women-s-wig-solid-color-short-charming-ladylike-faddish-accessory-g1601974.html,Women's Wig Solid Color Short Charming Ladylike Faddish Accessory,Wigs
0,$19.99,,https://www.jollychic.com/p/women-s-wig-faddish-long-curly-fashion-hair-synthetic-accessory-g1623820.html,Women's Wig Faddish Long Curly Fashion Hair Synthetic Accessory,Wigs
0,$16.99,,https://www.jollychic.com/p/women-s-wig-solid-color-long-straight-fashion-hair-synthetic-accessory-g1623824.html,Women's Wig Solid Color Long Straight Fashion Hair Synthetic Accessory,Wigs
0,$16.99,,https://www.jollychic.com/p/women-s-wig-long-straight-fashion-hair-ladylike-synthetic-accessory-g1623826.html,Women's Wig Long Straight Fashion Hair Ladylike Synthetic Accessory,Wigs
0,$17.99,,https://www.jollychic.com/p/women-s-wig-ladylike-solid-trendy-fashion-hair-synthetic-accessory-g1623828.html,Women's Wig Ladylike Solid Trendy Fashion Hair Synthetic Accessory,Wigs
0,$19.99,,https://www.jollychic.com/p/women-s-wig-solid-color-brief-faddish-charming-ladylike-accessory-g1623830.html,Women's Wig Solid Color Brief Faddish Charming Ladylike Accessory,Wigs
0,$13.99,$21.99,https://www.jollychic.com/p/women-s-ponytail-ladylike-solid-color-all-match-vogue-knitted-accessory-g1626888.html,Women's Ponytail Ladylike Solid Color All Match Vogue Knitted Accessory,Wigs
0,$10.99,$17.99,https://www.jollychic.com/p/women-s-ponytail-ladylike-solid-color-all-matched-vogue-accessory-g1626890.html,Women's Ponytail Ladylike Solid Color All Matched Vogue Accessory,Wigs
0,$24.99,,https://www.jollychic.com/p/women-s-synthetic-hair-wig-animation-wig-color-long-straight-hair-cosplay-play-wig-g1627256.html,Women's Synthetic Hair Wig Animation Wig Color Long Straight Hair Cosplay Play Wig,Wigs
0,$40.99,,https://www.jollychic.com/p/women-s-synthetic-hair-wig-charming-tilted-frisette-long-curly-fashion-hair-accessory-g1631580.html,Women's Synthetic Hair Wig Charming Tilted Frisette Long Curly Fashion Hair Accessory,Wigs
1,$40.99,,https://www.jollychic.com/p/women-s-synthetic-hair-wig-tilted-frisette-charming-long-curly-hair-accessory-g1631588.html,Women's Synthetic Hair Wig Tilted Frisette Charming Long Curly Hair Accessory,Wigs
0,$40.99,,https://www.jollychic.com/p/women-s-synthetic-hair-wig-trendy-color-block-all-match-long-curly-hair-accessory-g1631590.html,Women's Synthetic Hair Wig Trendy Color Block All Match Long Curly Hair Accessory,Wigs
0,$40.99,,https://www.jollychic.com/p/women-s-synthetic-hair-wig-all-match-classical-tilted-frisette-long-curly-hair-accessory-g1631598.html,Women's Synthetic Hair Wig All Match Classical Tilted Frisette Long Curly Hair Accessory,Wigs
0,$40.99,,https://www.jollychic.com/p/women-s-synthetic-hair-wig-color-block-long-curly-hair-accessory-g1631600.html,Women's Synthetic Hair Wig Color Block Long Curly Hair Accessory,Wigs
2561,$2.99,$9.99,https://www.jollychic.com/p/black-gradient-light-purple-woman-straight-hair-extensions-g68044.html,Black Gradient Light Purple Woman Straight Hair Extensions,Wigs
579,$4.99,$8.99,https://www.jollychic.com/p/top-grade-long-straight-woman-hair-extensions-g68046.html,Top Grade Long Straight Woman Hair Extensions,Wigs
412,$2.99,$8.99,https://www.jollychic.com/p/chic-heart-stolen-straight-style-hair-extension-gold-g68050.html,Chic Heart Stolen Straight Style Hair Extension Gold,Wigs
2059,$2.99,$8.99,https://www.jollychic.com/p/high-grade-long-straight-hair-extensions-g68056.html,High Grade Long Straight Hair Extensions,Wigs
305,$4.99,$8.99,https://www.jollychic.com/p/fashion-curly-one-pieces-woman-hair-extensions-g68066.html,Fashion Curly One Pieces Woman Hair Extensions,Wigs
866,$3.99,$8.99,https://www.jollychic.com/p/designer-long-straight-yellow-hair-extensions-for-women-g68106.html,Designer Long Straight Yellow Hair Extensions For Women,Wigs
911,$4.99,$8.99,https://www.jollychic.com/p/new-in-coffee-long-straight-womens-hair-extensions-g68414.html,New In Coffee Long Straight Womens Hair Extensions,Wigs
1327,$23.99,$31.99,https://www.jollychic.com/p/gold-charm-wavy-curly-middle-divide-long-wigs-g68570.html,Gold Charm Wavy Curly Middle Divide Long Wigs,Wigs
514,$1.99,$7.99,https://www.jollychic.com/p/bright-color-tie-up-woman-faux-ponytail-g77304.html,Bright Color Tie Up Woman Faux Ponytail,Wigs
378,$1.99,$7.99,https://www.jollychic.com/p/stylish-long-curly-tie-up-ponytail-g77316.html,Stylish Long Curly Tie Up Ponytail,Wigs
889,$17.99,$30.99,https://www.jollychic.com/p/curly-long-fashion-wigs-for-women-g84276.html,Curly Long Fashion Wigs For Women,Wigs
2085,$14.99,$24.99,https://www.jollychic.com/p/new-in-long-curly-party-wig-brown-g88018.html,New In Long Curly Party Wig Brown,Wigs
