add_wish,discount_price,original_price,product_link,product_name,header_block
11,$19.99,,https://www.jollychic.com/p/women-s-gloves-warm-bow-knot-ornament-comfy-all-match-gloves-accessory-g1432618.html,Women's Gloves Warm Bow Knot Ornament Comfy All Match Gloves Accessory,Gloves
3,$19.99,,https://www.jollychic.com/p/women-s-gloves-patchwork-design-bow-knot-fluff-ornament-elegant-gloves-accessory-g1432648.html,Women's Gloves Patchwork Design Bow Knot Fluff Ornament Elegant Gloves Accessory,Gloves
0,$45.99,,https://www.jollychic.com/p/women-s-gloves-ladylike-all-match-brief-style-faddish-accessory-g1449520.html,Women's Gloves Ladylike All Match Brief Style Faddish Accessory,Gloves
3,$16.99,,https://www.jollychic.com/p/women-s-gloves-brief-style-faddish-color-block-trendy-all-match-accessory-g1449524.html,Women's Gloves Brief Style Faddish Color Block Trendy All Match Accessory,Gloves
3,$20.99,,https://www.jollychic.com/p/women-s-gloves-sweet-style-solid-color-faddish-all-match-warm-accessory-g1449526.html,Women's Gloves Sweet Style Solid Color Faddish All Match Warm Accessory,Gloves
3,$16.99,,https://www.jollychic.com/p/women-s-gloves-patchwork-warm-wearable-sweet-style-faddish-accessory-g1449532.html,Women's Gloves Patchwork Warm Wearable Sweet Style Faddish Accessory,Gloves
1,$16.99,,https://www.jollychic.com/p/women-s-gloves-patchwork-warm-wearable-sweet-style-faddish-accessory-g1449536.html,Women's Gloves Patchwork Warm Wearable Sweet Style Faddish Accessory,Gloves
4,$19.99,,https://www.jollychic.com/p/women-s-gloves-ladylike-all-match-brief-style-faddish-accessory-g1449538.html,Women's Gloves Ladylike All Match Brief Style Faddish Accessory,Gloves
3,$19.99,,https://www.jollychic.com/p/women-s-gloves-brief-style-faddish-solid-color-trendy-all-match-accessory-g1449542.html,Women's Gloves Brief Style Faddish Solid Color Trendy All Match Accessory,Gloves
16,$15.99,,https://www.jollychic.com/p/women-s-gloves-long-solid-color-knitting-keep-warm-brief-style-glove-accessory-g1465302.html,Women's Gloves Long Solid Color Knitting Keep Warm Brief Style Glove Accessory,Gloves
15,$7.99,$10.99,https://www.jollychic.com/p/women-s-knitted-gloves-mixed-color-chic-classic-fingerless-soft-gloves-accessory-g1517148.html,Women's Knitted Gloves Mixed Color Chic Classic Fingerless Soft Gloves Accessory,Gloves
6,$7.99,$10.99,https://www.jollychic.com/p/women-s-warm-gloves-knitted-solid-color-all-match-fashion-gloves-accessory-g1517216.html,Women's Warm Gloves Knitted Solid Color All Match Fashion Gloves Accessory,Gloves
6,$6.99,$9.99,https://www.jollychic.com/p/women-s-warm-gloves-knitted-solid-color-brief-style-all-match-gloves-accessory-g1517246.html,Women's Warm Gloves Knitted Solid Color Brief Style All Match Gloves Accessory,Gloves
18,$6.99,$9.99,https://www.jollychic.com/p/women-s-warm-gloves-vogue-knitted-solid-color-patchwork-soft-gloves-accessory-g1517306.html,Women's Warm Gloves Vogue Knitted Solid Color Patchwork Soft Gloves Accessory,Gloves
14,$6.99,$9.99,https://www.jollychic.com/p/women-s-warm-gloves-brief-style-geometric-pattern-hollowed-chic-gloves-accessory-g1517308.html,Women's Warm Gloves Brief Style Geometric Pattern Hollowed Chic Gloves Accessory,Gloves
