add_wish,discount_price,original_price,product_link,product_name,header_block
4,$106.00,,https://www.jollychic.com/p/women-s-wig-black-soft-tilted-frisette-curly-short-human-hair-accessory-g665250.html,Women's Wig Black Soft Tilted Frisette Curly Short Human Hair Accessory,Wigs
13,$64.00,,https://www.jollychic.com/p/women-s-wig-voguish-soft-tilted-frisette-straight-short-human-hair-accessory-g665340.html,Women's Wig Voguish Soft Tilted Frisette Straight Short Human Hair Accessory,Wigs
3,$125.00,,https://www.jollychic.com/p/women-s-wig-black-soft-tilted-frisette-straight-long-human-hair-accessory-g665342.html,Women's Wig Black Soft Tilted Frisette Straight Long Human Hair Accessory,Wigs
18,$130.00,,https://www.jollychic.com/p/women-s-wig-gradient-bang-natural-shiny-soft-curly-short-human-hair-accessory-g665458.html,Women's Wig Gradient Bang Natural Shiny Soft Curly Short Human Hair Accessory,Wigs
14,$105.00,,https://www.jollychic.com/p/women-s-wig-voguish-shiny-lace-tilted-frisette-curly-short-human-hair-accessory-g666662.html,Women's Wig Voguish Shiny Lace Tilted Frisette Curly Short Human Hair Accessory,Wigs
3,$92.00,,https://www.jollychic.com/p/women-s-wig-gradient-bobo-style-curly-short-human-hair-accessory-g676218.html,Women's Wig Gradient Bobo Style Curly Short Human Hair Accessory,Wigs
10,$112.00,,https://www.jollychic.com/p/women-s-wig-mix-color-fluffy-shiny-curly-long-human-hair-accessory-g676220.html,Women's Wig Mix Color Fluffy Shiny Curly Long Human Hair Accessory,Wigs
15,$130.00,,https://www.jollychic.com/p/women-s-wig-long-wavy-flat-bangs-dark-black-human-hair-elegant-accessory-g676478.html,Women's Wig Long Wavy Flat Bangs Dark Black Human Hair Elegant Accessory,Wigs
3,$64.00,,https://www.jollychic.com/p/women-s-wig-short-white-vintage-human-hair-elegant-accessory-g676656.html,Women's Wig Short White Vintage Human Hair Elegant Accessory,Wigs
41,$130.00,,https://www.jollychic.com/p/women-s-wig-long-straight-side-bangs-volume-black-elegant-human-hair-accessory-g677322.html,Women's Wig Long Straight Side Bangs Volume Black Elegant Human Hair Accessory,Wigs
45,$14.99,$20.99,https://www.jollychic.com/p/women-s-wig-deep-brown-natural-lace-short-curly-hair-synthetic-accessory-g678404.html,Women's Wig Deep Brown Natural Lace Short Curly Hair Synthetic Accessory,Wigs
23,$21.99,,https://www.jollychic.com/p/women-s-wig-deep-purple-short-fashion-hair-synthetic-accessory-g678640.html,Women's Wig Deep Purple Short Fashion Hair Synthetic Accessory,Wigs
64,$19.99,$22.99,https://www.jollychic.com/p/women-s-wig-compound-color-long-straight-faddish-hair-synthetic-accessory-g678982.html,Women's Wig Compound Color Long Straight Faddish Hair Synthetic Accessory,Wigs
68,$15.99,$21.99,https://www.jollychic.com/p/women-s-wig-black-short-curly-trendy-hair-synthetic-accessory-g678984.html,Women's Wig Black Short Curly Trendy Hair Synthetic Accessory,Wigs
12,$73.00,,https://www.jollychic.com/p/women-s-wig-vogue-short-straight-tilted-frisette-human-hair-accessory-g689436.html,Women's Wig Vogue Short Straight Tilted Frisette Human Hair Accessory,Wigs
4,$81.00,,https://www.jollychic.com/p/women-s-wig-side-swept-short-straight-hair-wig-with-bangs-human-hair-accessory-g697690.html,Women's Wig Side Swept Short Straight Hair Wig With Bangs Human Hair Accessory,Wigs
35,$91.00,$152.00,https://www.jollychic.com/p/women-s-wig-black-natural-elegant-26-inch-synthetic-long-hair-accessory-g724142.html,Women's Wig Black Natural Elegant 26 Inch Synthetic Long Hair Accessory,Wigs
9,$135.00,,https://www.jollychic.com/p/women-s-wig-tilted-frisette-popular-long-natural-curly-hair-human-hair-accessory-g727710.html,Women's Wig Tilted Frisette Popular Long Natural Curly Hair Human Hair Accessory,Wigs
5,$81.00,$135.00,https://www.jollychic.com/p/women-s-wig-long-curly-hair-sexy-tilted-frisette-human-hair-accessory-g727728.html,Women's Wig Long Curly Hair Sexy Tilted Frisette Human Hair Accessory,Wigs
12,$49.99,$82.00,https://www.jollychic.com/p/women-s-wig-short-curly-hair-charming-tilted-frisette-chic-human-hair-accessory-g727732.html,Women's Wig Short Curly Hair Charming Tilted Frisette Chic Human Hair Accessory,Wigs
20,$69.00,$115.00,https://www.jollychic.com/p/women-s-wig-natural-charming-long-slightly-curly-hair-human-hair-accessory-g727736.html,Women's Wig Natural Charming Long Slightly Curly Hair Human Hair Accessory,Wigs
4,$54.00,,https://www.jollychic.com/p/women-s-wig-charming-elegant-short-curly-hair-stylish-human-hair-accessory-g727758.html,Women's Wig Charming Elegant Short Curly Hair Stylish Human Hair Accessory,Wigs
20,$60.00,$100.00,https://www.jollychic.com/p/women-s-wig-mix-color-side-bangs-mid-length-curly-human-hair-accessory-g755276.html,Women's Wig Mix Color Side Bangs Mid Length Curly Human Hair Accessory,Wigs
12,$38.99,$64.00,https://www.jollychic.com/p/women-s-wig-gradient-side-bangs-short-human-hair-wig-accessory-g755280.html,Women's Wig Gradient Side Bangs Short Human Hair Wig Accessory,Wigs
66,$5.99,,https://www.jollychic.com/p/women-s-wig-chic-brown-long-curly-side-parting-hair-accessory-g782728.html,Women's Wig Chic Brown Long Curly Side Parting Hair Accessory,Wigs
2,$65.00,,https://www.jollychic.com/p/women-s-wig-personalized-mixed-color-short-pattern-straight-hair-accessory-g812212.html,Women's Wig Personalized Mixed Color Short Pattern Straight Hair Accessory,Wigs
22,$34.99,$56.00,https://www.jollychic.com/p/women-s-wig-trendy-grey-loose-short-human-hair-accessory-g814740.html,Women's Wig Trendy Grey Loose Short Human Hair Accessory,Wigs
18,$62.00,,https://www.jollychic.com/p/women-s-wig-maroon-faddish-slightly-fluffy-curly-human-hair-accessory-g872344.html,Women's Wig Maroon Faddish Slightly Fluffy Curly Human Hair Accessory,Wigs
8,$128.00,,https://www.jollychic.com/p/women-s-wig-black-bangs-long-straight-sleek-human-hair-accessory-g872346.html,Women's Wig Black Bangs Long Straight Sleek Human Hair Accessory,Wigs
3,$129.00,,https://www.jollychic.com/p/women-s-wig-sweet-style-blunt-bangs-long-human-hair-accessory-g885824.html,Women's Wig Sweet Style Blunt Bangs Long Human Hair Accessory,Wigs
20,$51.00,,https://www.jollychic.com/p/women-s-wig-long-pattern-curly-cool-human-hair-accessory-g940046.html,Women's Wig Long Pattern Curly Cool Human Hair Accessory,Wigs
11,$118.00,,https://www.jollychic.com/p/women-s-wig-elegant-classic-golden-flowing-long-straight-human-hair-g964880.html,Women's Wig Elegant Classic Golden Flowing Long Straight Human Hair,Wigs
6,$87.00,,https://www.jollychic.com/p/women-s-wig-sleek-length-straight-black-faddish-hair-accessory-g965238.html,Women's Wig Sleek Length Straight Black Faddish Hair Accessory,Wigs
11,$61.00,,https://www.jollychic.com/p/women-s-wig-ladylike-side-fringe-short-golden-wavy-human-hair-accessory-g966756.html,Women's Wig Ladylike Side Fringe Short Golden Wavy Human Hair Accessory,Wigs
9,$61.00,,https://www.jollychic.com/p/women-s-wig-ladylike-side-fringe-short-wavy-human-hair-trendy-accessory-g966760.html,Women's Wig Ladylike Side Fringe Short Wavy Human Hair Trendy Accessory,Wigs
18,$26.99,,https://www.jollychic.com/p/women-s-wig-elegant-mixed-color-long-pattern-chic-synthetic-hair-accessory-g993502.html,Women's Wig Elegant Mixed Color Long Pattern Chic Synthetic Hair Accessory,Wigs
13,$22.99,,https://www.jollychic.com/p/women-s-wig-side-part-medium-length-slight-curly-hair-chemical-fiber-ladylike-wig-accessory-g1017718.html,Women's Wig Side Part Medium-Length Slight Curly Hair Chemical Fiber Ladylike Wig Accessory,Wigs
12,$56.00,,https://www.jollychic.com/p/women-s-wig-sweet-style-all-match-straight-stylish-human-hair-accessory-g1026440.html,Women's Wig Sweet Style All Match Straight Stylish Human Hair Accessory,Wigs
10,$55.00,,https://www.jollychic.com/p/women-s-human-hair-wig-stylish-short-curly-dainty-human-hair-wig-accessory-g1062366.html,Women's Human Hair Wig Stylish Short Curly Dainty Human Hair Wig Accessory,Wigs
24,$28.99,,https://www.jollychic.com/p/women-s-wig-long-straight-fashion-hair-synthetic-accessory-g1112818.html,Women's Wig Long Straight Fashion Hair Synthetic Accessory,Wigs
10,$68.00,,https://www.jollychic.com/p/women-s-human-hair-wig-elegant-short-curly-solid-colour-wig-g1142380.html,Women's Human Hair Wig Elegant Short Curly Solid Colour Wig,Wigs
7,$68.00,,https://www.jollychic.com/p/women-s-human-hair-wig-stratified-slightly-wavy-short-mixed-grey-stylish-wig-accessory-g1178188.html,Women's Human Hair Wig Stratified Slightly Wavy Short Mixed Grey Stylish Wig Accessory,Wigs
6,$12.99,$25.99,https://www.jollychic.com/p/women-s-slightly-curly-hair-wig-highlight-synthetic-hair-wig-accessory-g1180182.html,Women's Slightly Curly Hair Wig Highlight Synthetic Hair Wig Accessory,Wigs
6,$33.99,,https://www.jollychic.com/p/women-s-synthetic-hair-wig-voguish-mixed-color-central-parting-long-lightly-curly-hair-g1229586.html,Women's Synthetic Hair Wig Voguish Mixed Color Central Parting Long Lightly Curly Hair,Wigs
8,$30.99,,https://www.jollychic.com/p/women-s-wig-color-block-long-curly-fashion-hair-synthetic-accessory-g1234166.html,Women's Wig Color Block Long Curly Fashion Hair Synthetic Accessory,Wigs
7,$11.99,$16.99,https://www.jollychic.com/p/women-s-hair-extension-trendy-gradient-color-seamless-long-straight-hair-accessory-g1272542.html,Women's Hair Extension Trendy Gradient Color Seamless Long Straight Hair Accessory,Wigs
12,$8.99,,https://www.jollychic.com/p/women-s-extension-synthetic-hair-long-straight-silky-colorful-hair-wig-accessory-g1376410.html,Women's Extension Synthetic Hair Long Straight Silky Colorful Hair Wig Accessory,Wigs
12,$8.99,,https://www.jollychic.com/p/women-s-extension-synthetic-hair-long-straight-silky-colorful-natural-hair-wig-accessory-g1376416.html,Women's Extension Synthetic Hair Long Straight Silky Colorful Natural Hair Wig Accessory,Wigs
5,$14.99,$24.99,https://www.jollychic.com/p/women-s-wig-ladylike-black-long-curly-fashion-hair-synthetic-accessory-g1475734.html,Women's Wig Ladylike Black Long Curly Fashion Hair Synthetic Accessory,Wigs
0,$36.99,,https://www.jollychic.com/p/women-s-synthetic-hair-wig-elegant-curly-fashion-short-hair-accessory-g1572052.html,Women's Synthetic Hair Wig Elegant Curly Fashion Short Hair Accessory,Wigs
2,$24.99,$35.99,https://www.jollychic.com/p/women-s-synthetic-hair-wig-curly-fashion-short-hair-accessory-g1572056.html,Women's Synthetic Hair Wig Curly Fashion Short Hair Accessory,Wigs
2,$18.99,$30.99,https://www.jollychic.com/p/women-s-synthetic-hair-wig-color-block-short-straight-pattern-hair-accessory-g1572876.html,Women's Synthetic Hair Wig Color Block Short Straight Pattern Hair Accessory,Wigs
7,$22.99,$37.99,https://www.jollychic.com/p/women-s-synthetic-hair-wig-color-block-long-curly-pattern-all-match-chic-hair-accessory-g1572896.html,Women's Synthetic Hair Wig Color Block Long Curly Pattern All Match Chic Hair Accessory,Wigs
183,$26.99,,https://www.jollychic.com/p/glossy-solid-medium-length-wig-for-women-g84260.html,Glossy Solid Medium Length Wig For Women,Wigs
134,$51.00,$154.00,https://www.jollychic.com/p/swish-curly-sweet-style-human-hair-women-s-long-wig-g340760.html,Swish Curly Sweet Style Human Hair Women's Long Wig,Wigs
51,$153.00,,https://www.jollychic.com/p/human-hair-bang-straight-women-s-wig-g397902.html,Human Hair Bang Straight Women's Wig,Wigs
61,$148.00,,https://www.jollychic.com/p/women-s-wig-fashion-long-wavy-loose-natural-replacement-wig-g457882.html,Women's Wig Fashion Long Wavy Loose Natural Replacement Wig,Wigs
49,$86.00,,https://www.jollychic.com/p/women-s-wig-personalized-white-short-human-hair-fringe-wig-g459050.html,Women's Wig Personalized White Short Human Hair Fringe Wig,Wigs
21,$132.00,,https://www.jollychic.com/p/women-s-wig-refined-sideswept-bangs-curly-short-human-hair-g463052.html,Women's Wig Refined Sideswept Bangs Curly Short Human Hair,Wigs
63,$100.00,,https://www.jollychic.com/p/women-s-wig-lovely-youthful-sideswept-bangs-synthetic-human-hair-accessory-g502768.html,Women's Wig Lovely Youthful Sideswept Bangs Synthetic Human Hair Accessory,Wigs
19,$134.00,,https://www.jollychic.com/p/women-s-wig-cool-magnanimous-straight-human-hair-accessory-g522840.html,Women's Wig Cool Magnanimous Straight Human Hair Accessory,Wigs
11,$105.00,,https://www.jollychic.com/p/women-s-wig-winsome-mixed-color-nifty-human-hair-accessory-g522842.html,Women's Wig Winsome Mixed Color Nifty Human Hair Accessory,Wigs
7,$79.00,,https://www.jollychic.com/p/women-s-wig-enchanting-short-kinky-human-hair-accessory-g522876.html,Women's Wig Enchanting Short Kinky Human Hair Accessory,Wigs
6,$120.00,,https://www.jollychic.com/p/women-s-wig-swish-classic-bob-haircut-style-short-human-hair-accessory-g524136.html,Women's Wig Swish Classic Bob Haircut Style Short Human Hair Accessory,Wigs
4,$96.00,,https://www.jollychic.com/p/women-s-wig-fair-lady-classic-black-lovely-blunt-cut-bangs-human-hair-accessory-g525960.html,Women's Wig Fair Lady Classic Black Lovely Blunt Cut Bangs Human Hair Accessory,Wigs
6,$144.00,,https://www.jollychic.com/p/women-s-wig-top-quality-charming-pale-brown-long-human-hair-accessory-g526024.html,Women's Wig Top Quality Charming Pale Brown Long Human Hair Accessory,Wigs
28,$136.00,,https://www.jollychic.com/p/women-s-wig-adorable-nifty-vogue-blunt-cut-bangs-human-hair-accessory-g531856.html,Women's Wig Adorable Nifty Vogue Blunt Cut Bangs Human Hair Accessory,Wigs
21,$96.00,,https://www.jollychic.com/p/women-s-wig-fashion-short-straight-smooth-bobo-style-human-hair-accessory-g531906.html,Women's Wig Fashion Short Straight Smooth BOBO Style Human Hair Accessory,Wigs
13,$49.99,,https://www.jollychic.com/p/women-s-trendy-wig-glossy-brown-high-end-short-human-hair-replacement-g534500.html,Women's Trendy Wig Glossy Brown High End Short Human Hair Replacement,Wigs
16,$99.00,,https://www.jollychic.com/p/women-s-wig-classic-black-lovely-bob-haircut-short-human-hair-accessory-g535902.html,Women's Wig Classic Black Lovely Bob Haircut Short Human Hair Accessory,Wigs
6,$69.00,,https://www.jollychic.com/p/women-s-wig-graceful-refined-natural-smooth-short-human-hair-accessory-g535952.html,Women's Wig Graceful Refined Natural Smooth Short Human Hair Accessory,Wigs
1,$66.00,,https://www.jollychic.com/p/women-s-black-wig-loose-concise-short-straight-human-hair-accessory-g536018.html,Women's Black Wig Loose Concise Short Straight Human Hair Accessory,Wigs
21,$79.00,,https://www.jollychic.com/p/women-s-wig-evenly-blended-natural-short-human-hair-accessory-g536110.html,Women's Wig Evenly Blended Natural Short Human Hair Accessory,Wigs
1,$66.00,,https://www.jollychic.com/p/women-s-wig-sassy-glossy-ladylike-short-human-hair-accessory-g536112.html,Women's Wig Sassy Glossy Ladylike Short Human Hair Accessory,Wigs
11,$110.00,,https://www.jollychic.com/p/women-s-wig-sideswept-bangs-mature-sparkling-straight-human-hair-replacement-g536450.html,Women's Wig Sideswept Bangs Mature Sparkling Straight Human Hair Replacement,Wigs
53,$75.00,,https://www.jollychic.com/p/women-s-wig-graceful-gentlewoman-demeanor-red-short-human-hair-accessory-g536452.html,Women's Wig Graceful Gentlewoman Demeanor Red Short Human Hair Accessory,Wigs
23,$126.00,,https://www.jollychic.com/p/women-s-wig-vogue-gradient-black-silver-middle-length-straight-human-hair-g536454.html,Women's Wig Vogue Gradient Black Silver Middle Length Straight Human Hair,Wigs
25,$75.00,,https://www.jollychic.com/p/women-s-wig-trendy-loose-short-fringe-natural-human-hair-accessory-g537156.html,Women's Wig Trendy Loose Short Fringe Natural Human Hair Accessory,Wigs
16,$97.00,,https://www.jollychic.com/p/women-s-wig-natural-sideswept-bangs-sleek-bob-haircut-style-human-hair-g554314.html,Women's Wig Natural Sideswept Bangs Sleek Bob Haircut Style Human Hair,Wigs
103,$71.00,,https://www.jollychic.com/p/women-s-wig-dashing-handsome-mixed-color-short-human-hair-replacement-g554740.html,Women's Wig Dashing Handsome Mixed Color Short Human Hair Replacement,Wigs
3,$137.00,,https://www.jollychic.com/p/women-s-wig-blunt-cut-bangs-black-sweet-brief-style-slightly-curly-human-hair-g554746.html,Women's Wig Blunt Cut Bangs Black Sweet Brief Style Slightly Curly Human Hair,Wigs
72,$131.00,,https://www.jollychic.com/p/women-s-wig-sexy-gradient-color-long-curly-human-hair-accessory-g557484.html,Women's Wig Sexy Gradient Color Long Curly Human Hair Accessory,Wigs
40,$97.00,,https://www.jollychic.com/p/women-s-wig-preppy-medium-curly-side-fringe-human-hair-accessory-g557486.html,Women's Wig Preppy Medium Curly Side Fringe Human Hair Accessory,Wigs
4,$66.00,,https://www.jollychic.com/p/women-s-wig-elegant-mature-sleek-short-human-hair-accessory-g560356.html,Women's Wig Elegant Mature Sleek Short Human Hair Accessory,Wigs
17,$71.00,,https://www.jollychic.com/p/women-s-wig-faddish-short-side-fringe-smooth-personality-human-hair-accessory-g565492.html,Women's Wig Faddish Short Side Fringe Smooth Personality Human Hair Accessory,Wigs
9,$142.00,,https://www.jollychic.com/p/women-s-wig-ladylike-long-wavy-side-fringe-natural-human-hair-accessory-g567408.html,Women's Wig Ladylike Long Wavy Side Fringe Natural Human Hair Accessory,Wigs
11,$96.00,,https://www.jollychic.com/p/women-s-wig-lovely-sweet-glossy-bobo-human-hair-accessory-g572248.html,Women's Wig Lovely Sweet Glossy Bobo Human Hair Accessory,Wigs
18,$79.00,,https://www.jollychic.com/p/women-s-wig-sassy-dashing-ol-style-shiny-short-human-hair-accessory-g573538.html,Women's Wig Sassy Dashing OL Style Shiny Short Human Hair Accessory,Wigs
16,$79.00,,https://www.jollychic.com/p/women-s-wig-nifty-lovely-sweet-sideswept-bangs-mixed-color-short-human-hair-g573726.html,Women's Wig Nifty Lovely Sweet Sideswept Bangs Mixed Color Short Human Hair,Wigs
19,$142.00,,https://www.jollychic.com/p/women-s-wig-sweet-lovely-fair-lady-glossy-long-curly-human-hair-accessory-g580360.html,Women's Wig Sweet Lovely Fair Lady Glossy Long Curly Human Hair Accessory,Wigs
178,$130.00,,https://www.jollychic.com/p/women-s-wig-trendy-blunt-cut-bangs-straight-human-hair-accessory-g587882.html,Women's Wig Trendy Blunt Cut Bangs Straight Human Hair Accessory,Wigs
5,$111.00,,https://www.jollychic.com/p/women-s-wig-exquisite-short-kinky-side-fringe-natural-human-hair-accessory-g597418.html,Women's Wig Exquisite Short Kinky Side Fringe Natural Human Hair Accessory,Wigs
5,$82.00,$121.00,https://www.jollychic.com/p/women-s-wig-lovely-side-fringe-long-kinky-human-hair-accessory-g599152.html,Women's Wig Lovely Side Fringe Long Kinky Human Hair Accessory,Wigs
34,$65.00,,https://www.jollychic.com/p/women-s-wig-exquisite-short-curly-side-natural-fringe-human-hair-accessory-g599158.html,Women's Wig Exquisite Short Curly Side Natural Fringe Human Hair Accessory,Wigs
3,$106.00,,https://www.jollychic.com/p/women-s-wig-stylish-bob-human-hair-wig-g610384.html,Women's Wig Stylish Bob Human Hair Wig,Wigs
9,$68.00,$130.00,https://www.jollychic.com/p/women-s-wig-glossy-vogue-natural-curly-shoulder-length-style-hair-accessory-g618760.html,Women's Wig Glossy Vogue Natural Curly Shoulder Length Style Hair Accessory,Wigs
9,$29.99,,https://www.jollychic.com/p/women-s-wig-sexy-charming-deep-red-pin-curly-hairstyle-hair-accessory-g620540.html,Women's Wig Sexy Charming Deep Red Pin Curly Hairstyle Hair Accessory,Wigs
4,$10.99,$26.99,https://www.jollychic.com/p/women-s-wig-simple-classic-black-central-parting-bang-curly-hair-accessory-g620788.html,Women's Wig Simple Classic Black Central Parting Bang Curly Hair Accessory,Wigs
11,$96.00,,https://www.jollychic.com/p/women-s-wig-elegant-personalied-shiny-inclined-bang-hair-replacement-g621232.html,Women's Wig Elegant Personalied Shiny Inclined Bang Hair Replacement,Wigs
14,$61.00,,https://www.jollychic.com/p/women-s-short-wig-chic-mature-short-brown-human-hair-replacement-g621266.html,Women's Short Wig Chic Mature Short Brown Human Hair Replacement,Wigs
14,$142.00,,https://www.jollychic.com/p/women-s-long-wig-classic-simple-blunt-bang-ladylike-black-hair-wig-g621276.html,Women's Long Wig Classic Simple Blunt Bang Ladylike Black Hair Wig,Wigs
4,$49.99,,https://www.jollychic.com/p/women-s-wig-simple-chic-sideswept-fringe-short-straight-human-hair-wig-g621706.html,Women's Wig Simple Chic Sideswept Fringe Short Straight Human Hair Wig,Wigs
124,$13.99,$25.99,https://www.jollychic.com/p/women-s-wig-trendy-simple-long-straight-smoking-pink-color-hair-wig-g624400.html,Women's Wig Trendy Simple Long Straight Smoking Pink Color Hair Wig,Wigs
13,$63.00,$97.00,https://www.jollychic.com/p/women-s-wig-vogue-nofty-bob-hairstyle-short-straight-human-hair-accessory-g625124.html,Women's Wig Vogue Nofty Bob Hairstyle Short Straight Human Hair Accessory,Wigs
29,$33.99,$54.00,https://www.jollychic.com/p/women-s-short-wig-simple-ol-style-natural-human-hair-accessory-g627634.html,Women's Short Wig Simple OL Style Natural Human Hair Accessory,Wigs
8,$60.00,,https://www.jollychic.com/p/women-s-wig-black-ladylike-tilted-frisette-straight-short-human-hair-accessory-g639234.html,Women's Wig Black Ladylike Tilted Frisette Straight Short Human Hair Accessory,Wigs
21,$141.00,,https://www.jollychic.com/p/women-s-wig-natural-stylish-tilted-frisette-straight-long-human-hair-accessory-g641148.html,Women's Wig Natural Stylish Tilted Frisette Straight Long Human Hair Accessory,Wigs
9,$65.00,,https://www.jollychic.com/p/women-s-wig-voguish-shiny-tilted-frisette-straight-short-human-hair-accessory-g641190.html,Women's Wig Voguish Shiny Tilted frisette Straight Short Human Hair Accessory,Wigs
6,$145.00,,https://www.jollychic.com/p/women-s-wig-side-part-body-wave-long-human-hair-wig-accessory-g647674.html,Women's Wig Side Part Body Wave Long Human Hair Wig Accessory,Wigs
62,$41.99,$107.00,https://www.jollychic.com/p/women-s-wig-voguish-shiny-pin-curly-24-inch-long-synthetic-hair-accessory-g647748.html,Women's Wig Voguish Shiny Pin Curly 24 Inch Long Synthetic Hair Accessory,Wigs
5,$76.00,,https://www.jollychic.com/p/women-s-wig-short-straight-human-hair-wig-accessory-g655532.html,Women's Wig Short Straight Human Hair Wig Accessory,Wigs
6,$135.00,,https://www.jollychic.com/p/women-s-wig-body-wave-side-part-middle-length-human-hair-wig-accessory-g655540.html,Women's Wig Body Wave Side Part Middle Length Human Hair Wig Accessory,Wigs
3,$135.00,,https://www.jollychic.com/p/women-s-wig-side-part-big-wave-middle-length-human-hair-wig-accessory-g655546.html,Women's Wig Side Part Big Wave Middle Length Human Hair Wig Accessory,Wigs
25,$69.00,,https://www.jollychic.com/p/women-s-wig-voguish-shiny-tilted-frisette-straight-short-human-hair-accessory-g665262.html,Women's Wig Voguish Shiny Tilted Frisette Straight Short Human Hair Accessory,Wigs
11,$140.00,,https://www.jollychic.com/p/women-s-wig-bang-soft-natural-shiny-straight-long-human-hair-accessory-g665346.html,Women's Wig Bang Soft Natural Shiny Straight Long Human Hair Accessory,Wigs
4,$69.00,,https://www.jollychic.com/p/women-s-wig-multi-color-soft-tilted-frisette-straight-short-human-hair-accessory-g666678.html,Women's Wig Multi Color Soft Tilted Frisette Straight Short Human Hair Accessory,Wigs
9,$140.00,,https://www.jollychic.com/p/women-s-wig-long-curly-side-bangs-yellow-mature-human-hair-accessory-g676324.html,Women's Wig Long Curly Side Bangs Yellow Mature Human Hair Accessory,Wigs
7,$44.99,$69.00,https://www.jollychic.com/p/women-s-wig-short-mixed-color-side-bangs-human-hair-attractive-accessory-g676650.html,Women's Wig Short Mixed Color Side Bangs Human Hair Attractive Accessory,Wigs
6,$84.00,,https://www.jollychic.com/p/women-s-wig-short-curly-side-bangs-black-bob-elegant-human-hair-accessory-g677170.html,Women's Wig Short Curly Side Bangs Black Bob Elegant Human Hair Accessory,Wigs
1,$84.00,,https://www.jollychic.com/p/women-s-wig-short-flat-bangs-black-sleek-bob-human-hair-accessory-g677492.html,Women's Wig Short Flat Bangs Black Sleek Bob Human Hair Accessory,Wigs
100,$20.99,$29.99,https://www.jollychic.com/p/women-s-wig-black-long-african-fashion-hair-synthetic-accessory-g679094.html,Women's Wig Black Long African Fashion Hair Synthetic Accessory,Wigs
10,$56.00,$94.00,https://www.jollychic.com/p/women-s-wig-elegant-tilted-frisette-curly-human-hair-accessory-g689440.html,Women's Wig Elegant Tilted Frisette Curly Human Hair Accessory,Wigs
8,$59.00,,https://www.jollychic.com/p/women-s-wig-chic-tilted-frisette-short-straight-human-hair-accessory-g689486.html,Women's Wig Chic Tilted Frisette Short Straight Human Hair Accessory,Wigs
8,$132.00,,https://www.jollychic.com/p/women-s-wig-graceful-long-curly-hair-tilted-frisette-human-hair-accessory-g689736.html,Women's Wig Graceful Long Curly Hair Tilted Frisette Human Hair Accessory,Wigs
37,$61.00,$96.00,https://www.jollychic.com/p/women-s-wig-blunt-bang-black-long-curly-human-hair-accessory-g701732.html,Women's Wig Blunt Bang Black Long Curly Human Hair Accessory,Wigs
0,$60.00,,https://www.jollychic.com/p/women-s-wig-color-mixing-cool-short-straight-human-hair-accessory-g701774.html,Women's Wig Color Mixing Cool Short Straight Human Hair Accessory,Wigs
11,$25.99,,https://www.jollychic.com/p/women-s-wig-slanting-bang-short-curly-light-gold-synthetic-hair-accessory-g701986.html,Women's Wig Slanting Bang Short Curly Light Gold Synthetic Hair Accessory,Wigs
65,$100.00,,https://www.jollychic.com/p/women-s-wig-black-long-straight-fashion-hair-synthetic-accessory-g736594.html,Women's Wig Black Long Straight Fashion Hair Synthetic Accessory,Wigs
5,$61.00,,https://www.jollychic.com/p/women-s-wig-short-black-side-bangs-human-hair-charming-accessory-g744514.html,Women's Wig Short Black Side Bangs Human Hair Charming Accessory,Wigs
5,$64.00,,https://www.jollychic.com/p/women-s-wig-charming-bangs-short-small-curly-black-human-hair-accessory-g754488.html,Women's Wig Charming Bangs Short Small Curly Black Human Hair Accessory,Wigs
10,$73.00,,https://www.jollychic.com/p/women-s-wig-elegant-bangs-shaggy-short-human-hair-accessory-g754752.html,Women's Wig Elegant Bangs Shaggy Short Human Hair Accessory,Wigs
