add_wish,discount_price,original_price,product_link,product_name,header_block
86,$11.99,$21.99,https://www.jollychic.com/p/women-s-leggings-solid-color-lace-patched-see-through-skinny-leggings-g856242.html,Women's Leggings Solid Color Lace Patched See Through Skinny Leggings,Leggings
885,$9.99,$14.99,https://www.jollychic.com/p/women-s-leggings-elastic-waist-gauze-patched-hollow-out-skinny-leggings-g857366.html,Women's Leggings Elastic Waist Gauze Patched Hollow Out Skinny Leggings,Leggings
490,$9.99,$14.99,https://www.jollychic.com/p/women-s-leggings-elastic-waist-lace-patched-hollow-out-sexy-leggings-g857368.html,Women's Leggings Elastic Waist Lace Patched Hollow Out Sexy Leggings,Leggings
81,$7.99,$15.99,https://www.jollychic.com/p/women-s-leggings-pu-leather-lacing-design-hollow-out-sexy-leggings-g857374.html,Women's Leggings PU Leather Lacing Design Hollow Out Sexy Leggings,Leggings
132,$6.99,$11.99,https://www.jollychic.com/p/women-s-leggings-floral-animal-print-skinny-fashion-leggings-g878358.html,Women's Leggings Floral Animal Print Skinny Fashion Leggings,Leggings
309,$12.99,,https://www.jollychic.com/p/women-s-slim-leggings-hole-design-top-fashion-skinny-leggings-g878362.html,Women's Slim Leggings Hole Design Top Fashion Skinny Leggings,Leggings
163,$3.99,$5.99,https://www.jollychic.com/p/women-s-slim-leggings-high-waist-stretchy-style-faux-leather-slim-leggings-g879460.html,Women's Slim Leggings High Waist Stretchy Style Faux Leather Slim Leggings,Leggings
155,$13.99,$20.99,https://www.jollychic.com/p/women-s-leggings-mesh-patch-solid-skinny-thin-leggings-g907212.html,Women's Leggings Mesh Patch Solid Skinny Thin Leggings,Leggings
603,$12.99,$19.99,https://www.jollychic.com/p/women-s-leggings-elastic-waist-skinny-black-leggings-g913434.html,Women's Leggings Elastic Waist Skinny Black Leggings,Leggings
267,$7.99,,https://www.jollychic.com/p/women-s-leggings-mid-waist-floral-print-slim-leggings-g944134.html,Women's Leggings Mid Waist Floral Print Slim Leggings,Leggings
921,$8.99,$12.99,https://www.jollychic.com/p/women-s-leggings-mid-waist-solid-color-slim-leggings-g944140.html,Women's Leggings Mid Waist Solid Color Slim Leggings,Leggings
174,$10.99,$18.99,https://www.jollychic.com/p/women-s-leggings-mid-waist-side-stripe-pattern-skinny-leggings-g1010744.html,Women's Leggings Mid Waist Side Stripe Pattern Skinny Leggings,Leggings
531,$11.99,$18.99,https://www.jollychic.com/p/women-s-leggings-high-waist-solid-sexy-leggings-g1014320.html,Women's Leggings High Waist Solid Sexy Leggings,Leggings
91,$13.99,$18.99,https://www.jollychic.com/p/women-s-leggings-high-waist-solid-leggings-g1016246.html,Women's Leggings High Waist Solid Leggings,Leggings
819,$7.99,$12.99,https://www.jollychic.com/p/women-s-leggings-solid-color-hollow-out-skinny-leggings-g1017500.html,Women's Leggings Solid Color Hollow Out Skinny Leggings,Leggings
84,$16.99,$25.99,https://www.jollychic.com/p/women-s-wide-leg-leggings-floral-pattern-loose-leggings-g1031780.html,Women's Wide Leg Leggings Floral Pattern Loose Leggings,Leggings
192,$13.99,$18.99,https://www.jollychic.com/p/women-s-leggings-solid-color-high-waist-skinny-leggings-g1044198.html,Women's Leggings Solid Color High Waist Skinny Leggings,Leggings
16,$16.99,$23.99,https://www.jollychic.com/p/women-s-leggings-color-block-skinny-leggings-g1076452.html,Women's Leggings Color Block Skinny Leggings,Leggings
349,$12.99,$17.99,https://www.jollychic.com/p/women-s-leggings-hollow-out-solid-color-cozy-leggings-g1123654.html,Women's Leggings Hollow Out Solid Color Cozy Leggings,Leggings
91,$15.99,$24.99,https://www.jollychic.com/p/women-s-leggings-simple-solid-color-fitness-high-elastic-leggings-g1131892.html,Women's Leggings Simple Solid Color Fitness High Elastic Leggings,Leggings
72,$13.99,$20.99,https://www.jollychic.com/p/women-s-leggings-patchwork-hollow-out-skinny-sexy-pants-g1218680.html,Women's Leggings Patchwork Hollow Out Skinny Sexy Pants,Leggings
69,$12.99,$19.99,https://www.jollychic.com/p/women-s-leggings-sexy-hollow-out-elastic-waist-tight-leggings-g1223236.html,Women's Leggings Sexy Hollow Out Elastic Waist Tight Leggings,Leggings
15,$15.99,,https://www.jollychic.com/p/women-s-leggings-high-waist-colorblock-cropped-sports-leggings-g1254234.html,Women's Leggings High Waist Colorblock Cropped Sports Leggings,Leggings
8,$10.99,$17.99,https://www.jollychic.com/p/women-s-leggings-high-waist-colorblock-sports-leggings-g1254710.html,Women's Leggings High Waist Colorblock Sports Leggings,Leggings
71,$10.99,$17.99,https://www.jollychic.com/p/women-s-leggings-high-waist-colorblock-skinny-sports-leggings-g1254716.html,Women's Leggings High Waist Colorblock Skinny Sports Leggings,Leggings
622,$10.99,$14.99,https://www.jollychic.com/p/women-s-leggings-solid-color-high-waist-skinny-leggings-g1257456.html,Women's Leggings Solid Color High Waist Skinny Leggings,Leggings
101,$9.99,$17.99,https://www.jollychic.com/p/women-s-leggings-solid-comfy-all-match-breathable-letter-pattern-leggings-g1287318.html,Women's Leggings Solid Comfy All Match Breathable Letter Pattern Leggings,Leggings
120,$10.99,$17.99,https://www.jollychic.com/p/women-s-leggings-striped-simple-comfy-all-match-breathable-leggings-g1287324.html,Women's Leggings Striped Simple Comfy All Match Breathable Leggings,Leggings
590,$13.99,,https://www.jollychic.com/p/women-s-leggings-solid-color-striped-skinny-casual-pants-g1302220.html,Women's Leggings Solid Color Striped Skinny Casual Pants,Leggings
21,$9.99,$15.99,https://www.jollychic.com/p/women-s-stirrup-leggings-1200d-solid-color-slim-body-shaping-cozy-pants-g1302306.html,Women's Stirrup Leggings 1200D Solid Color Slim Body Shaping Cozy Pants,Leggings
23,$9.99,$16.99,https://www.jollychic.com/p/women-s-leggings-color-block-patchwork-leggings-g1302336.html,Women's Leggings Color Block Patchwork Leggings,Leggings
28,$9.99,$16.99,https://www.jollychic.com/p/women-s-leggings-cross-solid-all-match-skinny-leggings-g1302350.html,Women's Leggings Cross Solid All Match Skinny Leggings,Leggings
16,$15.99,$22.99,https://www.jollychic.com/p/women-s-leggings-black-cozy-all-match-leggings-g1303136.html,Women's Leggings Black Cozy All Match Leggings,Leggings
26,$12.99,$21.99,https://www.jollychic.com/p/women-s-leggings-mid-waisted-letter-pattern-thin-all-match-plus-size-leggings-g1305928.html,Women's Leggings Mid Waisted Letter Pattern Thin All Match Plus Size Leggings,Leggings
9,$7.99,$13.99,https://www.jollychic.com/p/women-s-leggings-color-block-comfy-high-elastic-skinny-leggings-g1308014.html,Women's Leggings Color Block Comfy High Elastic Skinny Leggings,Leggings
9,$9.99,$16.99,https://www.jollychic.com/p/women-s-leggings-classic-color-block-patchwork-leggings-g1308024.html,Women's Leggings Classic Color Block Patchwork Leggings,Leggings
14,$13.99,,https://www.jollychic.com/p/women-s-leggings-high-waist-print-color-block-sports-leggings-g1313578.html,Women's Leggings High Waist Print Color Block Sports Leggings,Leggings
13,$13.99,$23.99,https://www.jollychic.com/p/women-s-leggings-elastic-waist-animal-pattern-skinny-leggings-g1332018.html,Women's Leggings Elastic Waist Animal Pattern Skinny Leggings,Leggings
44,$6.99,$12.99,https://www.jollychic.com/p/women-s-leggings-color-block-stripe-leggings-g1336344.html,Women's Leggings Color Block Stripe Leggings,Leggings
14,$7.99,$13.99,https://www.jollychic.com/p/women-s-leggings-leopard-color-block-skinny-leggings-g1336372.html,Women's Leggings Leopard Color Block Skinny Leggings,Leggings
55,$7.99,$13.99,https://www.jollychic.com/p/women-s-leggings-floral-color-block-skinny-leggings-g1336376.html,Women's Leggings Floral Color Block Skinny Leggings,Leggings
32,$9.99,$15.99,https://www.jollychic.com/p/women-s-leggings-letter-pattern-cozy-skinny-leggings-g1336426.html,Women's Leggings Letter Pattern Cozy Skinny Leggings,Leggings
43,$18.99,$28.99,https://www.jollychic.com/p/women-s-leggings-elastic-waist-solid-color-plus-size-skinny-leggings-g1341016.html,Women's Leggings Elastic Waist Solid Color Plus Size Skinny Leggings,Leggings
1,$14.99,$22.99,https://www.jollychic.com/p/women-s-leggings-color-block-print-stylish-skinny-leggings-g1342748.html,Women's Leggings Color Block Print Stylish Skinny Leggings,Leggings
78,$13.99,$21.99,https://www.jollychic.com/p/women-s-leggings-different-colors-striped-high-waist-comfy-yoga-running-pants-g1350064.html,Women's Leggings Different Colors Striped High Waist Comfy Yoga Running Pants,Leggings
22,$12.99,,https://www.jollychic.com/p/women-s-leggings-ladies-sports-slim-camouflage-printing-nine-point-leggings-g1364776.html,Women's Leggings Ladies Sports Slim Camouflage Printing Nine-point Leggings,Leggings
34,$7.99,$13.99,https://www.jollychic.com/p/women-s-leggings-slim-elastic-peony-flower-pattern-printed-mid-waisted-slim-skinny-leggings-g1364788.html,Women's Leggings Slim Elastic Peony Flower Pattern Printed Mid Waisted Slim Skinny Leggings,Leggings
35,$7.99,$13.99,https://www.jollychic.com/p/women-s-leggings-floral-print-color-blocking-comfortable-fashion-skinny-pants-g1364816.html,Women's Leggings Floral Print Color Blocking Comfortable Fashion Skinny Pants,Leggings
127,$6.99,$13.99,https://www.jollychic.com/p/women-s-leggings-solid-comfy-all-match-breathable-stylish-leggings-g1425008.html,Women's Leggings Solid Comfy All Match Breathable Stylish Leggings,Leggings
7,$18.99,,https://www.jollychic.com/p/women-s-leggings-starry-night-pattern-comfy-all-match-breathable-leggings-g1431672.html,Women's Leggings Starry Night Pattern Comfy All Match Breathable Leggings,Leggings
42,$13.99,$21.99,https://www.jollychic.com/p/women-s-fashion-legging-stylish-all-match-brushed-high-elastic-leather-pant-g1434264.html,Women's Fashion Legging Stylish All Match Brushed High Elastic Leather Pant,Leggings
28,$17.99,,https://www.jollychic.com/p/women-s-leggings-starry-sky-pattern-casual-leggings-g1449560.html,Women's Leggings Starry Sky Pattern Casual Leggings,Leggings
0,$21.99,,https://www.jollychic.com/p/women-s-legging-floral-pattern-mid-waist-new-all-match-sexy-milk-silk-wild-legging-g1465992.html,Women's Legging Floral Pattern Mid Waist New All Match Sexy Milk Silk Wild Legging,Leggings
24,$24.99,,https://www.jollychic.com/p/women-s-leggings-striped-comfy-all-match-breathable-stylish-leggings-g1477270.html,Women's Leggings Striped Comfy All Match Breathable Stylish Leggings,Leggings
47,$11.99,$24.99,https://www.jollychic.com/p/women-s-leggings-high-waisted-letter-pattern-all-match-plus-size-leggings-g1496316.html,Women's Leggings High Waisted Letter Pattern All Match Plus Size Leggings,Leggings
2,$15.99,,https://www.jollychic.com/p/women-s-leggings-colored-bubbles-pattern-elastic-wait-plus-size-slim-leggings-g1563000.html,Women's Leggings Colored Bubbles Pattern Elastic Wait Plus Size Slim Leggings,Leggings
17,$15.99,,https://www.jollychic.com/p/women-s-leggings-warm-solid-comfy-thicken-all-match-breathable-leggings-g1571862.html,Women's Leggings Warm Solid Comfy Thicken All Match Breathable Leggings,Leggings
10,$15.99,,https://www.jollychic.com/p/women-s-leggings-solid-comfy-high-waisted-all-match-breathable-warm-leggings-g1571866.html,Women's Leggings Solid Comfy High Waisted All Match Breathable Warm Leggings,Leggings
1,$15.99,,https://www.jollychic.com/p/women-s-leggings-solid-comfy-all-match-breathable-warm-leggings-g1571870.html,Women's Leggings Solid Comfy All Match Breathable Warm Leggings,Leggings
5,$15.99,,https://www.jollychic.com/p/women-s-leggings-solid-comfy-all-match-breathable-warm-thicken-leggings-g1571876.html,Women's Leggings Solid Comfy All Match Breathable Warm Thicken Leggings,Leggings
3,$15.99,,https://www.jollychic.com/p/women-s-leggings-solid-comfy-all-match-breathable-warm-leggings-g1571878.html,Women's Leggings Solid Comfy All Match Breathable Warm Leggings,Leggings
5,$15.99,,https://www.jollychic.com/p/women-s-leggings-solid-comfy-thicken-warm-all-match-breathable-leggings-g1571884.html,Women's Leggings Solid Comfy Thicken Warm All Match Breathable Leggings,Leggings
1,$14.99,,https://www.jollychic.com/p/women-s-leggings-solid-comfy-mid-waisted-all-match-breathable-stylish-leggings-g1571886.html,Women's Leggings Solid Comfy Mid Waisted All Match Breathable Stylish Leggings,Leggings
9,$18.99,,https://www.jollychic.com/p/women-s-leggings-solid-comfy-thicken-all-match-breathable-leggings-g1571888.html,Women's Leggings Solid Comfy Thicken All Match Breathable Leggings,Leggings
4,$13.99,,https://www.jollychic.com/p/women-s-leggings-solid-comfy-shiny-all-match-breathable-stylish-leggings-g1571892.html,Women's Leggings Solid Comfy Shiny All Match Breathable Stylish Leggings,Leggings
4,$21.99,,https://www.jollychic.com/p/women-s-legging-sexy-fashion-high-waist-casual-floral-punk-personality-legging-g1591454.html,Women's Legging Sexy Fashion High Waist Casual Floral Punk Personality Legging,Leggings
3,$11.99,$18.99,https://www.jollychic.com/p/women-E2-80-99s-leggings-high-waist-stretchy-faux-leather-skinny-pants-fashionable-wear-g1594200.html,Womens Leggings High Waist Stretchy Faux Leather Skinny Pants Fashionable Wear,Leggings
11,$7.99,$13.99,https://www.jollychic.com/p/women-s-leggings-solid-color-elastic-waist-slim-leggings-g1604132.html,Women's Leggings Solid Color Elastic Waist Slim Leggings,Leggings
0,$22.99,,https://www.jollychic.com/p/women-s-leggings-solid-comfy-all-match-patchwork-breathable-stylish-leggings-g1605250.html,Women's Leggings Solid Comfy All Match Patchwork Breathable Stylish Leggings,Leggings
5,$19.99,,https://www.jollychic.com/p/women-s-leggings-solid-comfy-all-match-breathable-stylish-leggings-g1605270.html,Women's Leggings Solid Comfy All Match Breathable Stylish Leggings,Leggings
7,$15.99,$24.99,https://www.jollychic.com/p/women-s-leggings-applique-solid-high-waist-stylish-all-match-leather-leggings-g1605822.html,Women's Leggings Applique Solid High Waist Stylish All Match Leather Leggings,Leggings
3,$22.99,,https://www.jollychic.com/p/women-s-leggings-thin-stretchy-letter-hollow-hem-solid-color-slim-cut-pencil-pants-g1606178.html,Women's Leggings Thin Stretchy Letter Hollow Hem Solid Color Slim Cut Pencil Pants,Leggings
2,$22.99,,https://www.jollychic.com/p/women-s-leggings-flower-embroidery-slit-hem-skinny-elastic-waist-solid-color-pencil-brousers-g1606180.html,Women's Leggings Flower Embroidery Slit Hem Skinny Elastic Waist Solid Color Pencil Brousers,Leggings
8,$29.99,,https://www.jollychic.com/p/women-s-legging-solid-hollow-out-slim-cut-high-waist-strenhy-hole-skinny-pencil-trousers-g1606186.html,Women's Legging Solid Hollow Out Slim Cut High Waist Strenhy Hole Skinny Pencil Trousers,Leggings
2,$24.99,,https://www.jollychic.com/p/women-s-leggings-solid-comfy-warm-all-match-breathable-stylish-leggings-g1606202.html,Women's Leggings Solid Comfy Warm All Match Breathable Stylish Leggings,Leggings
2,$24.99,,https://www.jollychic.com/p/women-s-plus-size-leggings-solid-all-match-warm-comfy-bottoms-g1606204.html,Women's Plus Size Leggings Solid All Match Warm Comfy Bottoms,Leggings
31,$26.99,,https://www.jollychic.com/p/women-s-leggings-floral-pattern-skinny-casual-leggings-g1607576.html,Women's Leggings Floral Pattern Skinny Casual Leggings,Leggings
1,$28.99,,https://www.jollychic.com/p/women-s-leggings-floral-pattern-skinny-casual-leggings-g1607578.html,Women's Leggings Floral Pattern Skinny Casual Leggings,Leggings
6,$33.99,,https://www.jollychic.com/p/women-s-leggings-solid-comfy-all-match-breathable-stylish-leggings-g1608670.html,Women's Leggings Solid Comfy All Match Breathable Stylish Leggings,Leggings
16,$21.99,,https://www.jollychic.com/p/women-s-leggings-color-block-floral-print-slim-skinny-leggings-g1609046.html,Women's Leggings Color Block Floral Print Slim Skinny Leggings,Leggings
1,$13.99,,https://www.jollychic.com/p/women-s-leggings-high-waisted-solid-skinny-straight-pants-g1610154.html,Women's Leggings High Waisted Solid Skinny Straight Pants,Leggings
1,$21.99,,https://www.jollychic.com/p/women-s-leggings-solid-color-button-skinny-leggings-g1622432.html,Women's Leggings Solid Color Button Skinny Leggings,Leggings
0,$26.99,,https://www.jollychic.com/p/jmfive-women-s-legging-leather-patchwork-zipper-pocket-pant-g1623444.html,Jmfive Women's Legging Leather Patchwork Zipper Pocket Pant,Leggings
1,$25.99,,https://www.jollychic.com/p/women-s-leggings-solid-color-high-waist-pu-skinny-leggings-g1624450.html,Women's Leggings Solid Color High Waist PU Skinny Leggings,Leggings
1,$25.99,,https://www.jollychic.com/p/women-s-leggings-letter-patchwork-slim-leggings-g1624452.html,Women's Leggings Letter Patchwork Slim Leggings,Leggings
1176,$11.99,,https://www.jollychic.com/p/solid-faux-leather-ninth-fashion-leggings-for-women-g147119.html,Solid Faux Leather Ninth Fashion Leggings For Women,Leggings
429,$3.99,,https://www.jollychic.com/p/illusion-striped-high-stretch-leggings-g199231.html,Illusion Striped High Stretch Leggings,Leggings
6610,$12.99,,https://www.jollychic.com/p/cute-applique-elastic-waist-stretchy-slim-leggings-g213613.html,Cute Applique Elastic Waist Stretchy Slim Leggings,Leggings
3164,$13.99,,https://www.jollychic.com/p/high-waist-elastic-slim-fashion-leggings-g239905.html,High Waist Elastic Slim Fashion Leggings,Leggings
2559,$9.99,,https://www.jollychic.com/p/black-high-waist-elastic-protection-leggings-g314536.html,Black High Waist Elastic Protection Leggings,Leggings
2279,$8.99,,https://www.jollychic.com/p/plus-size-smooth-black-leggings-g342572.html,Plus Size Smooth Black Leggings,Leggings
15392,$6.99,$10.99,https://www.jollychic.com/p/plus-size-elastic-striped-soft-leggings-g342600.html,Plus Size Elastic Striped Soft Leggings,Leggings
3625,$9.99,,https://www.jollychic.com/p/plus-size-solid-leggings-g344546.html,Plus Size Solid Leggings,Leggings
972,$27.99,,https://www.jollychic.com/p/mesh-patchwork-sheer-black-leggings-g380022.html,Mesh Patchwork Sheer Black Leggings,Leggings
1610,$8.99,$13.99,https://www.jollychic.com/p/casual-style-women-s-skinny-leggings-solid-plus-size-leggings-g403734.html,Casual Style Women's Skinny Leggings Solid Plus Size Leggings,Leggings
1624,$6.99,,https://www.jollychic.com/p/women-s-leggings-high-waist-solid-cozy-leggings-g434062.html,Women's Leggings High Waist Solid Cozy Leggings,Leggings
2666,$6.99,,https://www.jollychic.com/p/women-s-leggings-high-elastic-skinny-all-match-leggings-g434064.html,Women's Leggings High Elastic Skinny All Match Leggings,Leggings
1390,$6.99,,https://www.jollychic.com/p/women-s-leggings-elastic-waist-warm-blue-leggings-g435340.html,Women's Leggings Elastic Waist Warm Blue Leggings,Leggings
984,$6.99,,https://www.jollychic.com/p/women-s-leggings-high-waist-plaid-blue-leggings-g435344.html,Women's Leggings High Waist Plaid Blue Leggings,Leggings
167,$6.99,$23.99,https://www.jollychic.com/p/women-s-leggings-elastic-waist-casual-solid-leggings-g445434.html,Women's Leggings Elastic Waist Casual Solid Leggings,Leggings
881,$9.99,,https://www.jollychic.com/p/women-s-plus-size-leggings-high-waist-elastic-jeans-like-cropped-leggings-g453344.html,Women's Plus Size Leggings High Waist Elastic Jeans Like Cropped Leggings,Leggings
312,$10.99,,https://www.jollychic.com/p/women-s-leggings-high-waist-fashion-colorful-patterned-slim-leggings-g465850.html,Women's Leggings High Waist Fashion Colorful Patterned Slim Leggings,Leggings
1053,$8.99,$11.99,https://www.jollychic.com/p/women-s-leggings-high-waist-skinny-plus-size-cropped-leggings-g539268.html,Women's Leggings High Waist Skinny Plus Size Cropped Leggings,Leggings
3759,$13.99,$18.99,https://www.jollychic.com/p/women-s-leggings-elastic-waist-hollow-out-solid-color-skinny-leggings-g553506.html,Women's Leggings Elastic Waist Hollow Out Solid Color Skinny Leggings,Leggings
5161,$7.99,,https://www.jollychic.com/p/women-s-leggings-solid-color-high-waist-skinny-plus-size-leggings-g578118.html,Women's Leggings Solid Color High Waist Skinny Plus Size Leggings,Leggings
1298,$11.99,$15.99,https://www.jollychic.com/p/women-s-leggings-elastic-waisted-sold-color-skinny-leggings-g614268.html,Women's Leggings Elastic Waisted Sold Color Skinny Leggings,Leggings
714,$6.99,,https://www.jollychic.com/p/women-s-leggings-elastic-waist-cozy-skinny-leggings-g616038.html,Women's Leggings Elastic Waist Cozy Skinny Leggings,Leggings
134,$13.99,$20.99,https://www.jollychic.com/p/women-s-leggings-elastic-waisted-gauze-patched-hollow-out-casual-leggings-g642724.html,Women's Leggings Elastic Waisted Gauze Patched Hollow Out Casual Leggings,Leggings
601,$6.99,,https://www.jollychic.com/p/women-s-leggings-casual-color-block-skinny-thin-leggings-g667824.html,Women's Leggings Casual Color Block Skinny Thin Leggings,Leggings
648,$18.99,,https://www.jollychic.com/p/women-s-leggings-solid-color-side-pocket-skinny-leggings-g680732.html,Women's Leggings Solid Color Side Pocket Skinny Leggings,Leggings
3902,$14.99,$21.99,https://www.jollychic.com/p/women-s-leggings-hollow-out-solid-color-skinny-sexy-leggings-g707118.html,Women's Leggings Hollow Out Solid Color Skinny Sexy Leggings,Leggings
202,$11.99,,https://www.jollychic.com/p/women-s-leggings-solid-color-lace-plus-size-leggings-g712190.html,Women's Leggings Solid Color Lace Plus Size Leggings,Leggings
491,$6.99,,https://www.jollychic.com/p/women-s-leggings-camouflage-pattern-casual-skinny-leggings-g837952.html,Women's Leggings Camouflage Pattern Casual Skinny Leggings,Leggings
46,$6.99,,https://www.jollychic.com/p/women-s-leggings-camouflage-casual-skinny-leggings-g837954.html,Women's Leggings Camouflage Casual Skinny Leggings,Leggings
76,$2.99,$6.99,https://www.jollychic.com/p/women-s-leggings-camouflage-casual-skinny-leggings-g837956.html,Women's Leggings Camouflage Casual Skinny Leggings,Leggings
194,$6.99,,https://www.jollychic.com/p/women-s-leggings-high-waist-solid-plus-size-cropped-leggings-g844460.html,Women's Leggings High Waist Solid Plus Size Cropped Leggings,Leggings
57,$12.99,$22.99,https://www.jollychic.com/p/women-s-leggings-quick-dry-fitness-slim-tightly-leggings-g846940.html,Women's Leggings Quick Dry Fitness Slim Tightly Leggings,Leggings
351,$8.99,$13.99,https://www.jollychic.com/p/women-s-leggings-mid-waist-hollow-out-skinny-leggings-g878356.html,Women's Leggings Mid Waist Hollow Out Skinny Leggings,Leggings
69,$8.99,$13.99,https://www.jollychic.com/p/women-s-leggings-high-waist-floral-sports-skinny-leggings-g958374.html,Women's Leggings High Waist Floral Sports Skinny Leggings,Leggings
109,$12.99,$19.99,https://www.jollychic.com/p/women-s-leggings-stretch-patchwork-skinny-plus-size-leggings-g980836.html,Women's Leggings Stretch Patchwork Skinny Plus Size Leggings,Leggings
77,$11.99,$16.99,https://www.jollychic.com/p/women-s-leggings-high-waist-solid-hole-sexy-leggings-g992584.html,Women's Leggings High Waist Solid Hole Sexy Leggings,Leggings
201,$4.99,$8.99,https://www.jollychic.com/p/women-s-leggings-elastic-waist-color-block-leggings-g999156.html,Women's Leggings Elastic Waist Color Block Leggings,Leggings
137,$18.99,$28.99,https://www.jollychic.com/p/women-s-wide-leg-leggings-floral-pattern-loose-leggings-g1031784.html,Women's Wide Leg Leggings Floral Pattern Loose Leggings,Leggings
94,$13.99,$21.99,https://www.jollychic.com/p/women-s-leggings-color-block-sheath-elastic-yoga-sport-pants-g1039346.html,Women's Leggings Color Block Sheath Elastic Yoga Sport Pants,Leggings
36,$11.99,$18.99,https://www.jollychic.com/p/women-s-leggings-hole-decoration-casual-skinny-leggings-g1071620.html,Women's Leggings Hole Decoration Casual Skinny Leggings,Leggings
54,$5.99,,https://www.jollychic.com/p/women-s-leggings-mid-waist-solid-color-slim-leggings-g1226316.html,Women's Leggings Mid Waist Solid Color Slim Leggings,Leggings
8,$21.99,,https://www.jollychic.com/p/women-s-legging-colored-striped-print-pattern-breathable-dri-fit-cozy-pants-g1228766.html,Women's Legging Colored Striped Print Pattern Breathable Dri-Fit Cozy Pants,Leggings
42,$7.99,,https://www.jollychic.com/p/women-s-leggings-solid-lace-patched-hollow-out-leggings-g1240006.html,Women's Leggings Solid Lace Patched Hollow Out Leggings,Leggings
23,$9.99,$15.99,https://www.jollychic.com/p/women-s-leggings-high-waist-colorblock-cropped-sports-leggings-g1254242.html,Women's Leggings High Waist Colorblock Cropped Sports Leggings,Leggings
11,$10.99,$16.99,https://www.jollychic.com/p/women-s-short-leggings-solid-color-slimming-leggings-g1254668.html,Women's Short Leggings Solid Color Slimming Leggings,Leggings
74,$9.99,$15.99,https://www.jollychic.com/p/women-s-leggings-stylish-one-piece-solid-color-slim-comfy-all-match-bottom-g1276552.html,Women's Leggings Stylish One-piece Solid Color Slim Comfy All Match Bottom,Leggings
4,$21.99,,https://www.jollychic.com/p/women-s-sexy-gym-pants-side-hole-leggings-fitness-pants-g1294558.html,Women's Sexy Gym Pants Side Hole Leggings Fitness Pants,Leggings
72,$13.99,$21.99,https://www.jollychic.com/p/women-s-cutout-leggings-sexy-hole-skinny-yoga-pants-active-tights-g1294572.html,Women's Cutout Leggings Sexy Hole Skinny Yoga Pants Active Tights,Leggings
23,$16.99,$28.99,https://www.jollychic.com/p/women-s-plus-size-pants-solid-color-cropped-pants-g1296020.html,Women's Plus Size Pants Solid Color Cropped Pants,Leggings
36,$13.99,$21.99,https://www.jollychic.com/p/women-s-legging-breathable-patchwork-casual-skinny-comfy-all-match-sports-pants-g1299886.html,Women's Legging Breathable Patchwork Casual Skinny Comfy All Match Sports Pants,Leggings
9,$10.99,$16.99,https://www.jollychic.com/p/women-s-2-pairs-tights-solid-color-belly-in-hip-lifted-comfortable-tights-g1302308.html,Women's 2 Pairs Tights Solid Color Belly-In Hip-Lifted Comfortable Tights,Leggings
21,$7.99,$13.99,https://www.jollychic.com/p/women-s-leggings-high-elastic-color-block-cozy-leggings-g1308006.html,Women's Leggings High Elastic Color Block Cozy Leggings,Leggings
8,$7.99,$13.99,https://www.jollychic.com/p/women-s-leggings-comfy-print-skinny-leggings-g1308018.html,Women's Leggings Comfy Print Skinny Leggings,Leggings
