add_wish,discount_price,original_price,product_link,product_name,header_block
623,$256.50,$342.00,https://www.jollychic.com/p/floor-length-rhinestones-dress-for-mother-of-bride-g326968.html,Floor Length Rhinestones Dress For Mother Of Bride,Weddings & Events
5624,$33.99,$53.00,https://www.jollychic.com/p/women-s-sleeveless-v-neck-floral-long-evening-dress-g390414.html,Women's Sleeveless V Neck Floral Long Evening Dress,Weddings & Events
1534,$130.00,$193.00,https://www.jollychic.com/p/women-s-v-neck-three-quarters-sleeve-lace-wedding-dress-g391480.html,Women's V Neck Three Quarters Sleeve Lace Wedding Dress,Weddings & Events
9743,$85.00,$130.00,https://www.jollychic.com/p/women-s-lace-applique-backless-ladylike-long-tulle-evening-dress-g471564.html,Women's Lace Applique Backless Ladylike Long Tulle Evening Dress,Weddings & Events
6005,$92.00,$114.00,https://www.jollychic.com/p/women-s-lace-applique-hollow-out-long-bateau-elegant-evening-dress-g472008.html,Women's Lace Applique Hollow Out Long Bateau Elegant Evening Dress,Weddings & Events
4512,$197.00,$291.00,https://www.jollychic.com/p/women-s-evening-dress-sweet-flower-mesh-patchwork-long-evening-dress-g478958.html,Women's Evening Dress Sweet Flower Mesh Patchwork Long Evening Dress,Weddings & Events
561,$143.00,$210.00,https://www.jollychic.com/p/women-s-plus-size-wedding-dress-flowers-applique-long-train-wedding-dress-g479072.html,Women's Plus Size Wedding Dress Flowers Applique Long Train Wedding Dress,Weddings & Events
1005,$99.99,$138.00,https://www.jollychic.com/p/women-s-plus-size-evening-dress-flowers-embroidery-long-ladylike-evening-dress-g482926.html,Women's Plus Size Evening Dress Flowers Embroidery Long Ladylike Evening Dress,Weddings & Events
592,$46.99,$69.00,https://www.jollychic.com/p/women-s-coat-capelet-wedding-dress-solid-color-warmth-faux-fur-coat-capelet-g484246.html,Women's Coat Capelet Wedding Dress Solid Color Warmth Faux-Fur Coat Capelet,Weddings & Events
1084,$142.00,$177.00,https://www.jollychic.com/p/women-s-wedding-dress-flower-lace-appliques-sweet-ladylike-wedding-dress-g493876.html,Women's Wedding Dress Flower Lace Appliques Sweet Ladylike Wedding Dress,Weddings & Events
881,$138.00,$187.00,https://www.jollychic.com/p/women-s-wedding-dress-lace-flowers-appliques-strapless-long-train-wedding-dress-g493878.html,Women's Wedding Dress Lace Flowers Appliques Strapless Long Train Wedding Dress,Weddings & Events
2878,$84.00,$104.00,https://www.jollychic.com/p/women-s-evening-dress-lace-embroidery-hollow-out-ladylike-long-evening-dress-g494770.html,Women's Evening Dress Lace Embroidery Hollow Out Ladylike Long Evening Dress,Weddings & Events
1872,$51.00,$84.00,https://www.jollychic.com/p/women-s-evening-dress-sequins-strapless-slim-tulle-long-ladylike-evening-dress-g494886.html,Women's Evening Dress Sequins Strapless Slim Tulle Long Ladylike Evening Dress,Weddings & Events
370,$139.00,$173.00,https://www.jollychic.com/p/women-s-wedding-dress-back-lace-up-rhinestones-tulle-long-wedding-dress-g495012.html,Women's Wedding Dress Back Lace-Up Rhinestones Tulle Long Wedding Dress,Weddings & Events
6813,$202.40,$253.00,https://www.jollychic.com/p/women-s-wedding-dress-lace-flowers-appliques-bateau-ladylike-wedding-dress-g495016.html,Women's Wedding Dress Lace Flowers Appliques Bateau Ladylike Wedding Dress,Weddings & Events
157,$169.60,$212.00,https://www.jollychic.com/p/women-s-wedding-dress-color-patchwork-cascading-ruffles-long-wedding-dress-g495018.html,Women's Wedding Dress Color Patchwork Cascading Ruffles Long Wedding Dress,Weddings & Events
259,$200.00,$247.00,https://www.jollychic.com/p/women-s-wedding-dress-white-strapless-flower-elegant-tulle-long-wedding-dress-g499802.html,Women's Wedding Dress White Strapless Flower Elegant Tulle Long Wedding Dress,Weddings & Events
7333,$74.00,$96.00,https://www.jollychic.com/p/women-s-evening-dress-strapless-high-waist-appliques-evening-dress-g516054.html,Women's Evening Dress Strapless High Waist Appliques Evening Dress,Weddings & Events
5841,$111.00,$147.00,https://www.jollychic.com/p/women-s-wedding-dress-butterfly-appliques-long-train-wedding-dress-g519908.html,Women's Wedding Dress Butterfly Appliques Long Train Wedding Dress,Weddings & Events
3654,$54.00,$73.00,https://www.jollychic.com/p/women-s-evening-dress-floral-patchwork-off-shoulder-evening-dress-g534854.html,Women's Evening Dress Floral Patchwork Off Shoulder Evening Dress,Weddings & Events
3635,$93.00,$132.00,https://www.jollychic.com/p/women-s-evening-dress-long-v-neck-appliques-sweet-evening-dress-g537350.html,Women's Evening Dress long V Neck Appliques Sweet Evening Dress,Weddings & Events
1792,$55.00,$84.00,https://www.jollychic.com/p/women-s-wedding-dress-off-the-shoulder-flower-appliques-beading-evening-dress-g551638.html,Women's Wedding Dress Off The Shoulder Flower Appliques Beading Evening Dress,Weddings & Events
712,$62.00,$102.00,https://www.jollychic.com/p/women-s-wedding-dress-lace-flower-rhinestones-appliques-belt-maxi-long-dress-g554408.html,Women's Wedding Dress Lace Flower Rhinestones Appliques Belt Maxi Long Dress,Weddings & Events
689,$161.00,$212.00,https://www.jollychic.com/p/women-s-wedding-dress-one-shoulder-big-bow-patchwork-ladylike-maxi-long-dress-g572176.html,Women's Wedding Dress One Shoulder Big Bow Patchwork Ladylike Maxi Long Dress,Weddings & Events
576,$66.75,$89.00,https://www.jollychic.com/p/women-s-evening-dress-ruffles-short-sleeve-beading-a-line-homecoming-dress-g603214.html,Women's Evening Dress Ruffles Short Sleeve Beading A-Line Homecoming Dress,Weddings & Events
324,$63.00,$84.00,https://www.jollychic.com/p/women-s-wedding-dress-lace-flower-appliques-v-neck-sweet-maxi-long-dress-g609564.html,Women's Wedding Dress Lace Flower Appliques V Neck Sweet Maxi Long Dress,Weddings & Events
1028,$134.00,$174.00,https://www.jollychic.com/p/women-s-wedding-dress-lace-off-shoulder-court-train-ladylike-evening-dress-g609652.html,Women's Wedding Dress Lace Off Shoulder Court Train Ladylike Evening Dress,Weddings & Events
316,$77.00,$102.00,https://www.jollychic.com/p/women-s-wedding-dress-flower-appliques-halter-stand-collar-vintage-maxi-dress-g609822.html,Women's Wedding Dress Flower Appliques Halter Stand Collar Vintage Maxi Dress,Weddings & Events
895,$82.00,$122.00,https://www.jollychic.com/p/women-s-wedding-dress-strapless-flower-appliques-belt-sweep-train-prom-dress-g612406.html,Women's Wedding Dress Strapless Flower Appliques Belt Sweep Train Prom Dress,Weddings & Events
308,$55.00,$111.00,https://www.jollychic.com/p/women-s-wedding-dress-flower-appliques-strapless-ball-gown-sweet-maxi-dress-g612408.html,Women's Wedding Dress Flower Appliques Strapless Ball Gown Sweet Maxi Dress,Weddings & Events
1760,$134.00,$178.00,https://www.jollychic.com/p/women-s-wedding-dress-fishtail-ball-gown-one-shoulder-long-sleeve-evening-dress-g636396.html,Women's Wedding Dress Fishtail Ball Gown One Shoulder Long Sleeve Evening Dress,Weddings & Events
214,$107.25,$143.00,https://www.jollychic.com/p/women-s-evening-dress-inclined-shoulder-elegant-beading-bridesmaid-aline-dress-g638712.html,Women's Evening Dress Inclined Shoulder Elegant Beading Bridesmaid Aline Dress,Weddings & Events
183,$99.00,$132.00,https://www.jollychic.com/p/women-s-evening-dress-lace-solid-sexy-v-neck-short-sleeve-party-aline-dress-g638716.html,Women's Evening Dress Lace Solid Sexy V Neck Short Sleeve Party Aline Dress,Weddings & Events
436,$122.25,$163.00,https://www.jollychic.com/p/women-s-halter-neck-dress-rhinestones-thin-slim-fishtail-long-bridal-gowns-g645406.html,Women's Halter Neck Dress Rhinestones Thin Slim Fishtail Long Bridal Gowns,Weddings & Events
5273,$80.00,$102.00,https://www.jollychic.com/p/women-s-evening-dress-floral-embroidery-off-shoulder-elegant-maxi-long-dress-g701440.html,Women's Evening Dress Floral Embroidery Off Shoulder Elegant Maxi Long Dress,Weddings & Events
1326,$127.00,$237.00,https://www.jollychic.com/p/women-s-wedding-gown-a-strapless-floral-embroidery-sexy-crossover-evening-dress-g703746.html,Women's Wedding Gown A Strapless Floral Embroidery Sexy Crossover Evening Dress,Weddings & Events
230,$152.00,$237.00,https://www.jollychic.com/p/women-s-wedding-dress-mid-waisted-crossover-sleeveless-chic-evening-dress-g703750.html,Women's Wedding Dress Mid Waisted Crossover Sleeveless Chic Evening Dress,Weddings & Events
261,$125.25,$167.00,https://www.jollychic.com/p/women-s-wedding-dress-lace-stand-collar-half-sleeve-hollow-out-back-maxi-dress-g704530.html,Women's Wedding Dress Lace Stand Collar Half Sleeve Hollow Out Back Maxi Dress,Weddings & Events
246,$141.00,$188.00,https://www.jollychic.com/p/women-s-wedding-dress-stand-collar-lace-half-sleeve-hollow-out-back-maxi-dress-g738152.html,Women's Wedding Dress Stand Collar Lace Half Sleeve Hollow Out Back Maxi Dress,Weddings & Events
387,$123.00,$164.00,https://www.jollychic.com/p/women-s-wedding-dress-white-strapless-sweetheart-neck-ball-gown-maxi-dress-g738154.html,Women's Wedding Dress White Strapless Sweetheart Neck Ball Gown Maxi Dress,Weddings & Events
438,$63.00,$107.00,https://www.jollychic.com/p/women-s-wedding-dress-three-quarters-sleeve-stand-collar-hollow-out-maxi-dress-g738156.html,Women's Wedding Dress Three Quarters Sleeve Stand Collar Hollow Out Maxi Dress,Weddings & Events
182,$126.75,$169.00,https://www.jollychic.com/p/women-s-wedding-dress-long-mandarin-sleeve-v-neck-ball-gown-maxi-dress-g738192.html,Women's Wedding Dress Long Mandarin Sleeve V Neck Ball Gown Maxi Dress,Weddings & Events
602,$99.00,$123.00,https://www.jollychic.com/p/women-s-wedding-dress-flower-three-quarter-sleeve-back-hollow-out-maxi-dress-g765854.html,Women's Wedding Dress Flower Three Quarter Sleeve Back Hollow Out Maxi Dress,Weddings & Events
242,$78.00,$97.00,https://www.jollychic.com/p/women-s-wedding-dress-lace-stand-collar-short-sleeve-sweep-train-evening-dress-g791720.html,Women's Wedding Dress Lace Stand Collar Short Sleeve Sweep Train Evening Dress,Weddings & Events
4343,$83.00,$108.00,https://www.jollychic.com/p/women-s-evening-dress-solid-color-lace-floral-half-sleeve-elegant-maxi-dress-g804654.html,Women's Evening Dress Solid Color Lace Floral Half Sleeve Elegant Maxi Dress,Weddings & Events
811,$74.00,$114.00,https://www.jollychic.com/p/women-s-evening-dress-floral-half-sleeve-backless-sweep-train-mermaid-dress-g808772.html,Women's Evening Dress Floral Half Sleeve Backless Sweep Train Mermaid Dress,Weddings & Events
396,$67.00,$89.00,https://www.jollychic.com/p/women-s-evening-dress-flower-embroidery-ruffles-half-sleeve-vintage-maxi-dress-g831422.html,Women's Evening Dress Flower Embroidery Ruffles Half Sleeve Vintage Maxi Dress,Weddings & Events
124,$111.00,$138.00,https://www.jollychic.com/p/women-s-evening-dress-solid-color-off-shoulder-half-sleeve-aline-banquet-dress-g881350.html,Women's Evening Dress Solid Color Off Shoulder Half Sleeve Aline Banquet Dress,Weddings & Events
226,$96.00,$128.00,https://www.jollychic.com/p/women-e-prom-dress-strapless-beaded-short-front-long-back-banquet-dress-g881358.html,Women'e Prom Dress Strapless Beaded Short Front Long Back Banquet Dress,Weddings & Events
309,$103.00,$128.00,https://www.jollychic.com/p/women-s-prom-dress-sparkle-sequins-v-neck-sleeve-short-homecoming-dress-g881362.html,Women's Prom Dress Sparkle Sequins V Neck Sleeve Short Homecoming Dress,Weddings & Events
124,$103.00,$128.00,https://www.jollychic.com/p/women-s-evening-dress-color-block-strapless-side-split-floor-length-maxi-dress-g881378.html,Women's Evening Dress Color Block Strapless Side Split Floor Length Maxi Dress,Weddings & Events
1021,$100.00,$134.00,https://www.jollychic.com/p/women-s-evening-dress-floral-lace-half-sleeve-elegant-aline-banquet-dress-g881424.html,Women's Evening Dress Floral Lace Half Sleeve Elegant Aline Banquet Dress,Weddings & Events
335,$58.00,$88.00,https://www.jollychic.com/p/women-s-prom-dress-color-block-floral-elegant-off-shoulder-cocktail-dress-g886750.html,Women's Prom Dress Color Block Floral Elegant Off Shoulder Cocktail Dress,Weddings & Events
103,$69.00,$91.00,https://www.jollychic.com/p/women-s-wedding-dress-solid-color-floral-sleeveless-jewel-neck-elegant-dress-g1009262.html,Women's Wedding Dress Solid Color Floral Sleeveless Jewel Neck Elegant Dress,Weddings & Events
801,$133.00,$166.00,https://www.jollychic.com/p/women-s-wedding-dress-white-off-shoulder-half-sleeve-court-train-elegant-evening-dress-g1040890.html,Women's Wedding Dress White Off Shoulder Half Sleeve Court Train Elegant Evening Dress,Weddings & Events
180,$63.00,$111.00,https://www.jollychic.com/p/women-s-evening-dress-ladylike-flower-appliques-off-shoulder-half-sleeve-aline-maxi-dress-g1080372.html,Women's Evening Dress Ladylike Flower Appliques Off Shoulder Half Sleeve Aline Maxi Dress,Weddings & Events
351,$113.00,$129.00,https://www.jollychic.com/p/women-s-wedding-dress-solid-color-slash-neck-flare-sleeve-sweet-cocktail-dress-g1145678.html,Women's Wedding Dress Solid Color Slash Neck Flare Sleeve Sweet Cocktail Dress,Weddings & Events
327,$47.99,$75.00,https://www.jollychic.com/p/women-s-quinceanera-dress-solid-color-slash-neck-lace-up-rhinestone-decor-cocktail-dress-g1191812.html,Women's Quinceanera Dress Solid Color Slash Neck Lace Up Rhinestone Decor Cocktail Dress,Weddings & Events
833,$81.00,$106.00,https://www.jollychic.com/p/women-s-evening-dress-flower-embroidery-pattern-backless-half-sleeve-cocktail-dress-g1191820.html,Women's Evening Dress Flower Embroidery Pattern Backless Half Sleeve Cocktail Dress,Weddings & Events
71,$105.00,$138.00,https://www.jollychic.com/p/women-s-evening-dress-solid-color-slash-neck-sleeveless-sexy-cocktail-dress-g1191828.html,Women's Evening Dress Solid Color Slash Neck Sleeveless Sexy Cocktail Dress,Weddings & Events
165,$113.00,$148.00,https://www.jollychic.com/p/women-s-evening-dress-floral-pattern-half-sleeve-o-neck-sweet-cocktail-dress-g1191830.html,Women's Evening Dress Floral Pattern Half Sleeve O Neck Sweet Cocktail Dress,Weddings & Events
689,$114.00,$154.00,https://www.jollychic.com/p/women-s-evening-dress-solid-red-embroidery-sleeveless-o-neck-ruffles-decor-cocktail-dress-g1191836.html,Women's Evening Dress Solid Red Embroidery Sleeveless O Neck Ruffles Decor Cocktail Dress,Weddings & Events
276,$72.00,$111.00,https://www.jollychic.com/p/women-s-evening-dress-solid-color-gauze-patchwork-sleeveless-backless-cocktail-dress-g1191852.html,Women's Evening Dress Solid Color Gauze Patchwork Sleeveless Backless Cocktail Dress,Weddings & Events
136,$149.00,$185.00,https://www.jollychic.com/p/women-s-wedding-dress-solid-color-slash-neck-flower-ornament-rhinestone-decor-elegant-dress-g1191892.html,Women's Wedding Dress Solid Color Slash Neck Flower Ornament Rhinestone Decor Elegant Dress,Weddings & Events
2316,$140.00,$184.00,https://www.jollychic.com/p/women-s-wedding-dress-flower-pendant-sleeveless-off-shoulder-swallow-tail-dress-g1233758.html,Women's Wedding Dress Flower Pendant Sleeveless Off Shoulder Swallow Tail Dress,Weddings & Events
585,$143.00,$189.00,https://www.jollychic.com/p/women-s-wedding-dress-solid-color-lace-patchwork-slash-neck-off-shoulder-elegant-dress-g1233786.html,Women's Wedding Dress Solid Color Lace Patchwork Slash Neck Off Shoulder Elegant Dress,Weddings & Events
336,$100.00,$124.00,https://www.jollychic.com/p/women-s-wedding-dress-solid-color-lace-embroidery-slash-neck-off-shoulder-elegant-dress-g1234364.html,Women's Wedding Dress Solid Color Lace Embroidery Slash Neck Off Shoulder Elegant Dress,Weddings & Events
189,$67.00,$87.00,https://www.jollychic.com/p/women-s-wedding-dress-solid-color-lace-patchwork-slash-neck-off-shoulder-half-sleeve-simple-dress-g1306414.html,Women's Wedding Dress Solid Color Lace Patchwork Slash Neck Off Shoulder Half Sleeve Simple Dress,Weddings & Events
80,$82.00,$107.00,https://www.jollychic.com/p/women-s-wedding-dress-embroidey-rhinestone-decor-slash-neck-off-shoulder-half-sleeve-elegant-dress-g1306416.html,Women's Wedding Dress Embroidey Rhinestone Decor Slash Neck Off Shoulder Half Sleeve Elegant Dress,Weddings & Events
35,$104.00,$120.00,https://www.jollychic.com/p/women-s-evening-dress-ladylike-embroidery-sequins-back-hollow-out-sleeveless-maxi-dress-g1314158.html,Women's Evening Dress Ladylike Embroidery Sequins Back Hollow Out Sleeveless Maxi Dress,Weddings & Events
171,$191.00,$200.00,https://www.jollychic.com/p/women-s-wedding-dress-solid-color-gauze-patchwork-long-sleeve-flower-bow-decor-dress-g1404896.html,Women's Wedding Dress Solid Color Gauze Patchwork Long Sleeve Flower Bow Decor Dress,Weddings & Events
58,$113.00,$125.00,https://www.jollychic.com/p/women-s-wedding-dress-solid-color-slash-neck-off-shoulder-back-bandage-tassel-decor-dress-g1404900.html,Women's Wedding Dress Solid Color Slash Neck Off Shoulder Back Bandage Tassel Decor Dress,Weddings & Events
168,$120.00,$133.00,https://www.jollychic.com/p/women-s-evening-dress-solid-color-half-sleeve-backless-deep-v-sexy-dress-g1406736.html,Women's Evening Dress Solid Color Half Sleeve Backless Deep V Sexy Dress,Weddings & Events
66,$64.00,$84.00,https://www.jollychic.com/p/women-s-bridal-veils-solid-color-lace-flower-decor-floor-length-sweet-wedding-accessory-g1406822.html,Women's Bridal Veils Solid Color Lace Flower Decor Floor Length Sweet Wedding Accessory,Weddings & Events
179,$171.00,$179.00,https://www.jollychic.com/p/women-s-wedding-dress-ladylike-hollow-out-lace-backless-long-sleeve-court-train-dress-g1415122.html,Women's Wedding Dress Ladylike Hollow Out Lace Backless Long Sleeve Court Train Dress,Weddings & Events
183,$110.00,$125.00,https://www.jollychic.com/p/women-s-wedding-dress-hollow-out-lace-long-sleeve-ball-gown-elegant-maxi-dress-g1428116.html,Women's Wedding Dress Hollow Out Lace Long Sleeve Ball Gown Elegant Maxi Dress,Weddings & Events
79,$129.00,$164.00,https://www.jollychic.com/p/women-s-wedding-dress-elegant-hollow-out-lace-three-quarter-sleeve-bow-belt-maxi-dress-g1428122.html,Women's Wedding Dress Elegant Hollow Out Lace Three Quarter Sleeve Bow Belt Maxi Dress,Weddings & Events
174,$81.00,$92.00,https://www.jollychic.com/p/women-s-cocktail-dress-solid-color-off-shoulder-ruffles-elegant-sheath-party-dress-g1444582.html,Women's Cocktail Dress Solid Color Off Shoulder Ruffles Elegant Sheath Party Dress,Weddings & Events
101,$103.00,$120.00,https://www.jollychic.com/p/women-s-cocktail-dress-fashion-sequined-o-neck-long-sleeve-ladylike-sheath-party-dress-g1444638.html,Women's Cocktail Dress Fashion Sequined O Neck Long Sleeve Ladylike Sheath Party Dress,Weddings & Events
0,$87.00,,https://www.jollychic.com/p/women-s-wedding-veil-lace-sweet-flower-applique-trailing-long-cute-edge-wedding-veil-g1622358.html,Women's Wedding Veil Lace Sweet Flower Applique Trailing Long Cute Edge Wedding Veil,Weddings & Events
0,$79.00,,https://www.jollychic.com/p/women-s-wedding-veil-lace-floral-hem-appliques-trailing-long-nice-wedding-veil-g1622362.html,Women's Wedding Veil Lace Floral Hem Appliques Trailing Long Nice Wedding Veil,Weddings & Events
0,$74.00,,https://www.jollychic.com/p/women-s-wraps-cape-floral-embroidery-artificial-plush-long-sleeve-thicken-wedding-coat-g1622398.html,Women's Wraps Cape Floral Embroidery Artificial Plush Long Sleeve Thicken Wedding Coat,Weddings & Events
0,$97.00,,https://www.jollychic.com/p/women-s-cocktail-dress-lace-sweet-floral-off-shoulder-tea-length-aline-party-dress-g1622854.html,Women's Cocktail Dress Lace Sweet Floral Off Shoulder Tea Length Aline Party Dress,Weddings & Events
1,$71.00,,https://www.jollychic.com/p/women-s-wraps-cape-solid-color-artificial-fur-pearl-decor-long-sleeve-wedding-capelet-g1622858.html,Women's Wraps Cape Solid Color Artificial Fur Pearl Decor Long Sleeve Wedding Capelet,Weddings & Events
0,$65.00,,https://www.jollychic.com/p/women-s-wraps-cape-artificial-fur-flower-embroidery-thicken-warm-wedding-capelet-g1622866.html,Women's Wraps Cape Artificial Fur Flower Embroidery Thicken Warm Wedding Capelet,Weddings & Events
0,$71.00,,https://www.jollychic.com/p/women-s-wraps-cape-flower-embroidery-artificial-fur-thicken-warm-wedding-capelet-g1622868.html,Women's Wraps Cape Flower Embroidery Artificial Fur Thicken Warm Wedding Capelet,Weddings & Events
0,$60.00,,https://www.jollychic.com/p/women-s-cocktail-dress-solid-color-slash-neck-off-shoulder-hip-hugger-hollow-out-sexy-dress-g1629836.html,Women's Cocktail Dress Solid Color Slash Neck Off Shoulder Hip Hugger Hollow Out Sexy Dress,Weddings & Events
0,$68.00,,https://www.jollychic.com/p/women-s-cocktail-dress-long-sleeve-solid-color-lace-patchwork-hollow-out-sexy-dress-g1630958.html,Women's Cocktail Dress Long Sleeve Solid Color Lace Patchwork Hollow Out Sexy Dress,Weddings & Events
0,$68.00,,https://www.jollychic.com/p/women-s-cocktail-dress-solid-color-one-off-shoulder-side-bandage-decor-irregular-dress-g1631284.html,Women's Cocktail Dress Solid Color One Off Shoulder Side Bandage Decor Irregular Dress,Weddings & Events
0,$67.00,,https://www.jollychic.com/p/women-s-cocktail-dress-solid-color-strapped-ruffles-decor-zipper-pleated-hip-sexy-skirt-set-g1631534.html,Women's Cocktail Dress Solid Color Strapped Ruffles Decor Zipper Pleated Hip Sexy Skirt Set,Weddings & Events
0,$67.00,,https://www.jollychic.com/p/women-s-cocktail-dress-solid-color-slash-neck-off-shoulder-split-sexy-dress-g1631756.html,Women's Cocktail Dress Solid Color Slash Neck Off Shoulder Split Sexy Dress,Weddings & Events
0,$60.00,,https://www.jollychic.com/p/women-s-cocktail-dress-solid-color-strapped-side-split-slim-sexy-dress-g1631956.html,Women's Cocktail Dress Solid Color Strapped Side Split Slim Sexy Dress,Weddings & Events
0,$73.00,,https://www.jollychic.com/p/women-s-cocktail-dress-solid-off-shoulder-side-bandage-button-decor-hollow-out-sexy-dress-g1632160.html,Women's Cocktail Dress Solid Off Shoulder Side Bandage Button Decor Hollow Out Sexy Dress,Weddings & Events
0,$74.00,,https://www.jollychic.com/p/women-s-cocktail-dress-solid-color-long-sleeve-turtle-neck-zipper-bow-decor-slim-sexy-dress-g1632230.html,Women's Cocktail Dress Solid Color Long Sleeve Turtle Neck Zipper Bow Decor Slim Sexy Dress,Weddings & Events
1,$92.00,,https://www.jollychic.com/p/women-s-cocktail-dress-solid-color-slash-neck-sleeveless-side-split-sexy-party-dress-g1632926.html,Women's Cocktail Dress Solid Color Slash Neck Sleeveless Side Split Sexy Party Dress,Weddings & Events
0,$78.00,,https://www.jollychic.com/p/women-s-cocktail-dress-solid-color-sleeveless-off-shoulder-slim-pleated-hip-sexy-skirt-set-g1633490.html,Women's Cocktail Dress Solid Color Sleeveless Off Shoulder Slim Pleated Hip Sexy Skirt Set,Weddings & Events
0,$67.00,,https://www.jollychic.com/p/women-s-cocktail-dress-solid-color-lace-hem-slash-neck-off-shoulder-sexy-dress-g1633712.html,Women's Cocktail Dress Solid Color Lace Hem Slash Neck Off Shoulder Sexy Dress,Weddings & Events
0,$92.00,,https://www.jollychic.com/p/women-s-cocktail-dress-solid-color-side-split-bandage-decor-deep-v-slim-sexy-dress-g1633858.html,Women's Cocktail Dress Solid Color Side Split Bandage Decor Deep V Slim Sexy Dress,Weddings & Events
0,$83.00,,https://www.jollychic.com/p/women-s-cocktail-dress-v-neck-one-shoulder-cloak-decor-side-split-sexy-dress-g1634410.html,Women's Cocktail Dress V Neck One Shoulder Cloak Decor Side Split Sexy Dress,Weddings & Events
1,$67.00,,https://www.jollychic.com/p/women-s-cocktail-dress-solid-color-backless-sleeveless-hollow-out-slim-sexy-dress-g1634478.html,Women's Cocktail Dress Solid Color Backless Sleeveless Hollow Out Slim Sexy Dress,Weddings & Events
0,$78.00,,https://www.jollychic.com/p/women-s-cocktail-dress-solid-color-backless-bandage-decor-hollow-out-sexy-dress-g1635482.html,Women's Cocktail Dress Solid Color Backless Bandage Decor Hollow Out Sexy Dress,Weddings & Events
5,$78.00,,https://www.jollychic.com/p/women-s-cocktail-dress-solid-color-v-neck-side-bandage-hollow-out-sexy-dress-g1635730.html,Women's Cocktail Dress Solid Color V Neck Side Bandage Hollow Out Sexy Dress,Weddings & Events
0,$119.00,,https://www.jollychic.com/p/women-s-cocktail-dress-solid-color-long-sleeve-v-neck-rivet-decor-sexy-dress-g1635792.html,Women's Cocktail Dress Solid Color Long Sleeve V Neck Rivet Decor Sexy Dress,Weddings & Events
0,$78.00,,https://www.jollychic.com/p/women-s-cocktail-dress-solid-color-o-neck-short-sleeve-hollow-out-sexy-dress-g1635960.html,Women's Cocktail Dress Solid Color O Neck Short Sleeve Hollow Out Sexy Dress,Weddings & Events
0,$73.00,,https://www.jollychic.com/p/women-s-cocktail-dress-flower-embroidery-slash-neck-off-shoulder-high-waist-sexy-slim-dress-g1636022.html,Women's Cocktail Dress Flower Embroidery Slash Neck Off Shoulder High Waist Sexy Slim Dress,Weddings & Events
0,$84.00,,https://www.jollychic.com/p/women-s-cocktail-dress-solid-color-sleeveless-v-neck-bandage-decor-sexy-mini-dress-g1636158.html,Women's Cocktail Dress Solid Color Sleeveless V Neck Bandage Decor Sexy Mini Dress,Weddings & Events
0,$92.00,,https://www.jollychic.com/p/women-s-cocktail-dress-striped-color-block-tassel-decor-stand-collar-sexy-dress-g1636278.html,Women's Cocktail Dress Striped Color Block Tassel Decor Stand Collar Sexy Dress,Weddings & Events
0,$79.00,,https://www.jollychic.com/p/women-s-evening-wear-suit-solid-color-sleeveless-high-waist-slim-one-piece-jumpsuit-g1636556.html,Women's Evening Wear Suit Solid Color Sleeveless High Waist Slim One Piece Jumpsuit,Weddings & Events
1,$84.00,,https://www.jollychic.com/p/women-s-evening-wear-suit-striped-pattern-v-neck-tassel-decor-long-sleeve-one-piece-jumpsuit-g1636610.html,Women's Evening Wear Suit Striped Pattern V Neck Tassel Decor Long Sleeve One Piece Jumpsuit,Weddings & Events
40,$111.00,$148.00,https://www.jollychic.com/p/women-s-strapless-beading-color-block-ball-gown-evening-dress-g386982.html,Women's Strapless Beading Color Block Ball Gown Evening Dress,Weddings & Events
