add_wish,discount_price,original_price,product_link,product_name,header_block
940,$6.99,,https://www.jollychic.com/p/unique-design-metal-built-in-buckle-gold-belt-g31339.html,Unique Design Metal Built-in Buckle Gold Belt,Belts
3330,$4.99,$8.99,https://www.jollychic.com/p/four-double-breasted-clemence-thicken-super-wide-fuax-leather-belt-g31386.html,Four Double-Breasted Clemence Thicken Super wide Fuax Leather Belt,Belts
665,$6.99,,https://www.jollychic.com/p/metal-sequined-high-waist-skinny-decorate-belt-g31388.html,Metal Sequined High Waist Skinny Decorate Belt,Belts
3830,$5.99,,https://www.jollychic.com/p/silk-purity-elegant-bowknot-wide-belt-evening-party-g31394.html,Silk Purity Elegant Bowknot Wide Belt Evening Party,Belts
435,$3.99,,https://www.jollychic.com/p/fashion-all-match-genuine-leather-western-belts-with-diamond-g34889.html,Fashion All-Match Genuine Leather Western Belts With Diamond,Belts
986,$4.99,$7.99,https://www.jollychic.com/p/hot-sale-fresh-fashion-large-flower-wide-belts-for-women-g35080.html,Hot Sale Fresh Fashion Large Flower Wide Belts For Women,Belts
1200,$3.99,$5.99,https://www.jollychic.com/p/vintage-style-metal-embelishment-wide-elastic-belt-g72084.html,Vintage Style Metal Embelishment Wide Elastic Belt,Belts
1052,$1.99,$2.99,https://www.jollychic.com/p/simple-solid-thin-versatile-belt-for-women-g123161.html,Simple Solid Thin Versatile Belt For Women,Belts
2703,$6.99,$7.99,https://www.jollychic.com/p/simple-all-match-treading-rope-women-s-cinch-belt-g270285.html,Simple All Match Treading Rope Women's Cinch Belt,Belts
1007,$4.99,$8.99,https://www.jollychic.com/p/special-exaggerate-punk-style-women-s-cinch-belt-g270291.html,Special Exaggerate Punk Style Women's Cinch Belt,Belts
1707,$5.99,,https://www.jollychic.com/p/lovely-floral-embroidery-lace-up-women-s-cinch-belt-g270321.html,Lovely Floral Embroidery Lace Up Women's Cinch Belt,Belts
980,$3.99,,https://www.jollychic.com/p/shiny-all-match-mini-bowknot-thin-belt-g270339.html,Shiny All Match Mini Bowknot Thin Belt,Belts
2437,$5.99,,https://www.jollychic.com/p/exaggerate-solid-color-leaf-shape-thin-women-s-belt-g270349.html,Exaggerate Solid Color Leaf Shape Thin Women's Belt,Belts
943,$5.99,,https://www.jollychic.com/p/punk-style-unique-hollow-out-metallic-ornament-women-s-cinch-belt-g287982.html,Punk Style Unique Hollow Out Metallic Ornament Women's Cinch Belt,Belts
594,$4.99,,https://www.jollychic.com/p/casual-vintage-star-lace-up-stylish-women-s-cinch-belt-g288114.html,Casual Vintage Star Lace Up Stylish Women's Cinch Belt,Belts
1150,$4.99,,https://www.jollychic.com/p/blinking-metallic-leaf-shape-super-thin-women-s-belt-g288122.html,Blinking Metallic Leaf Shape Super Thin Women's Belt,Belts
1035,$5.99,,https://www.jollychic.com/p/brief-design-metal-hasp-sterling-women-s-thin-belt-g328226.html,Brief Design Metal Hasp Sterling Women's Thin Belt,Belts
1168,$2.99,$5.99,https://www.jollychic.com/p/brief-design-thin-solid-color-rhinestone-inlay-women-s-belt-g328268.html,Brief Design Thin Solid Color Rhinestone Inlay Women's Belt,Belts
1157,$7.99,$15.99,https://www.jollychic.com/p/shining-flower-shape-rhinestone-inlay-women-s-wide-cinch-belt-g328320.html,Shining Flower Shape Rhinestone Inlay Women's Wide Cinch Belt,Belts
684,$7.99,$11.99,https://www.jollychic.com/p/brief-design-solid-color-dainty-all-match-women-s-belt-g328346.html,Brief Design Solid Color Dainty All Match Women's Belt,Belts
2600,$5.99,,https://www.jollychic.com/p/swish-shinny-metal-leaves-shape-women-s-belt-g358180.html,Swish Shinny Metal Leaves Shape Women's Belt,Belts
1289,$3.99,$9.99,https://www.jollychic.com/p/exquisite-high-end-all-match-hollow-out-tassel-women-s-belt-g358218.html,Exquisite High End All Match Hollow Out Tassel Women's Belt,Belts
2618,$4.99,$9.99,https://www.jollychic.com/p/women-s-sweet-belt-bowknot-gleaming-super-wide-belt-g423802.html,Women's Sweet Belt Bowknot Gleaming Super Wide Belt,Belts
917,$3.99,$7.99,https://www.jollychic.com/p/women-s-belt-pearl-decoration-thin-sweet-style-belt-g423808.html,Women's Belt Pearl Decoration Thin Sweet Style Belt,Belts
752,$1.99,$5.99,https://www.jollychic.com/p/women-s-cinch-belt-faddish-brief-shimmering-spangle-ornament-thin-belt-g497436.html,Women's Cinch Belt Faddish Brief Shimmering Spangle Ornament Thin Belt,Belts
212,$8.99,,https://www.jollychic.com/p/women-s-jeans-belt-retro-solid-color-fair-lady-belt-accessory-g499354.html,Women's Jeans Belt Retro Solid Color Fair Lady Belt Accessory,Belts
914,$9.99,$15.99,https://www.jollychic.com/p/women-s-dress-belt-rhinestone-ornament-gorgeous-chic-accessory-g576168.html,Women's Dress Belt Rhinestone Ornament Gorgeous Chic Accessory,Belts
799,$3.99,$7.99,https://www.jollychic.com/p/women-s-belt-chic-metallic-multi-layer-buckled-wide-belt-accessory-g576764.html,Women's Belt Chic Metallic Multi Layer Buckled Wide Belt Accessory,Belts
1472,$5.99,,https://www.jollychic.com/p/women-s-cinch-belt-lace-up-elastic-design-sweet-belt-g592534.html,Women's Cinch Belt Lace Up Elastic Design Sweet Belt,Belts
287,$3.99,$6.99,https://www.jollychic.com/p/women-s-cinch-belt-knot-ornament-faddish-thin-belt-g626352.html,Women's Cinch Belt Knot Ornament Faddish Thin Belt,Belts
98,$5.99,,https://www.jollychic.com/p/women-s-cinch-belt-simple-stylish-thin-belt-g626660.html,Women's Cinch Belt Simple Stylish Thin Belt,Belts
53,$1.99,$5.99,https://www.jollychic.com/p/women-s-cinch-belt-kiss-fish-paint-leather-belt-g626750.html,Women's Cinch Belt Kiss Fish Paint Leather Belt,Belts
49,$5.99,,https://www.jollychic.com/p/women-s-cinch-belt-simple-style-buckled-belt-g626776.html,Women's Cinch Belt Simple Style Buckled Belt,Belts
166,$11.99,,https://www.jollychic.com/p/women-s-belt-metallic-round-buckled-belt-g626890.html,Women's Belt Metallic Round Buckled Belt,Belts
40,$15.99,,https://www.jollychic.com/p/women-s-cinch-belt-retro-stylish-wide-all-match-belt-g626902.html,Women's Cinch Belt Retro Stylish Wide All Match Belt,Belts
6957,$3.99,$10.99,https://www.jollychic.com/p/women-s-belt-dress-decoration-slim-all-match-lace-up-accessory-g628868.html,Women's Belt Dress Decoration Slim All Match Lace Up Accessory,Belts
366,$9.99,$18.99,https://www.jollychic.com/p/women-s-belt-rhinestone-ornament-elastic-dress-decoration-accessory-g628878.html,Women's Belt Rhinestone Ornament Elastic Dress Decoration Accessory,Belts
551,$5.99,$9.99,https://www.jollychic.com/p/women-s-belts-trendy-letter-print-all-match-long-belt-accessory-g636104.html,Women's Belts Trendy Letter Print All Match Long Belt Accessory,Belts
343,$6.99,$9.99,https://www.jollychic.com/p/women-s-belts-trendy-all-match-letter-pattern-chic-belt-accessory-g636114.html,Women's Belts Trendy All Match Letter Pattern Chic Belt Accessory,Belts
1340,$6.99,$9.99,https://www.jollychic.com/p/women-s-belts-all-match-chic-letter-pattern-casual-belt-accessory-g636116.html,Women's Belts All Match Chic Letter Pattern Casual Belt Accessory,Belts
365,$4.99,$8.99,https://www.jollychic.com/p/women-s-belt-bow-knot-design-faux-leather-wide-belt-accessory-g666686.html,Women's Belt Bow Knot Design Faux Leather Wide Belt Accessory,Belts
2080,$3.99,$9.99,https://www.jollychic.com/p/women-s-belt-lace-up-floral-border-sweet-wide-belt-accessory-g666688.html,Women's Belt Lace Up Floral Border Sweet Wide Belt Accessory,Belts
595,$4.99,$9.99,https://www.jollychic.com/p/women-s-belt-elastic-lace-up-exquisite-super-wide-belt-accessory-g666690.html,Women's Belt Elastic Lace Up Exquisite Super Wide Belt Accessory,Belts
920,$5.99,$13.99,https://www.jollychic.com/p/women-s-belt-elastic-strappy-super-wide-waist-belt-charming-accessory-g724636.html,Women's Belt Elastic Strappy Super Wide Waist Belt Charming Accessory,Belts
332,$4.99,$13.99,https://www.jollychic.com/p/women-s-belts-exquisite-bow-knot-waist-belts-accessory-g757546.html,Women's Belts Exquisite Bow Knot Waist Belts Accessory,Belts
97,$5.99,$13.99,https://www.jollychic.com/p/women-s-belts-stylish-rhinestones-decor-thin-belts-accessory-g757550.html,Women's Belts Stylish Rhinestones Decor Thin Belts Accessory,Belts
138,$4.99,$13.99,https://www.jollychic.com/p/women-s-belts-metallic-joint-stylish-patent-leather-thin-belts-accessory-g757612.html,Women's Belts Metallic Joint Stylish Patent Leather Thin Belts Accessory,Belts
504,$5.99,$14.99,https://www.jollychic.com/p/women-s-belts-retro-hollow-out-all-match-cinch-belt-accessory-g757638.html,Women's Belts Retro Hollow Out All Match Cinch Belt Accessory,Belts
241,$2.99,$12.99,https://www.jollychic.com/p/women-s-belts-frame-style-buckles-hand-braided-all-match-belts-accessory-g758842.html,Women's Belts Frame Style Buckles Hand Braided All Match Belts Accessory,Belts
276,$4.99,$13.99,https://www.jollychic.com/p/women-s-belts-leaves-shaped-belt-joint-stylish-belts-accessory-g759168.html,Women's Belts Leaves Shaped Belt Joint Stylish Belts Accessory,Belts
148,$8.99,$21.99,https://www.jollychic.com/p/women-s-belts-stylish-hollow-out-metallic-ornament-cinch-belt-accessory-g759362.html,Women's Belts Stylish Hollow Out Metallic Ornament Cinch Belt Accessory,Belts
253,$5.99,$16.99,https://www.jollychic.com/p/women-s-belts-rose-flowers-shaped-belt-joint-waist-belt-accessory-g759370.html,Women's Belts Rose Flowers Shaped Belt Joint Waist Belt Accessory,Belts
174,$22.99,,https://www.jollychic.com/p/women-s-belts-geometric-colorblock-stylish-cinch-belt-accessory-g759640.html,Women's Belts Geometric Colorblock Stylish Cinch Belt Accessory,Belts
152,$8.99,$22.99,https://www.jollychic.com/p/women-s-belts-metallic-chain-ornament-elastic-cinch-belts-accessory-g759696.html,Women's Belts Metallic Chain Ornament Elastic Cinch Belts Accessory,Belts
94,$6.99,$19.99,https://www.jollychic.com/p/women-s-belts-stylish-hollow-out-elastic-faddish-cinch-belt-accessory-g759712.html,Women's Belts Stylish Hollow Out Elastic Faddish Cinch Belt Accessory,Belts
268,$9.99,$22.99,https://www.jollychic.com/p/women-s-belts-retro-stylish-lion-s-head-waist-belt-accessory-g759788.html,Women's Belts Retro Stylish Lion's Head Waist Belt Accessory,Belts
101,$7.99,$19.99,https://www.jollychic.com/p/women-s-belts-retro-stylish-metallic-antique-cinch-belt-accessory-g759806.html,Women's Belts Retro Stylish Metallic Antique Cinch Belt Accessory,Belts
151,$5.99,$13.99,https://www.jollychic.com/p/women-s-belts-stylish-imitation-opal-inlay-cinch-belt-accessory-g759814.html,Women's Belts Stylish Imitation Opal Inlay Cinch Belt Accessory,Belts
39,$2.99,$14.99,https://www.jollychic.com/p/women-s-belts-wide-hollow-out-flower-embossed-elastic-belt-accessory-g776000.html,Women's Belts Wide Hollow Out Flower Embossed Elastic Belt Accessory,Belts
54,$2.99,$14.99,https://www.jollychic.com/p/women-s-belts-sweet-imitation-pearls-ornament-cinch-belts-accessory-g776002.html,Women's Belts Sweet Imitation Pearls Ornament Cinch Belts Accessory,Belts
95,$12.99,$21.99,https://www.jollychic.com/p/women-s-waist-chain-vintage-coins-pendant-belt-charming-accessory-g776670.html,Women's Waist Chain Vintage Coins Pendant Belt Charming Accessory,Belts
1413,$7.99,$19.99,https://www.jollychic.com/p/women-s-belt-elastic-strappy-embroidery-rose-waist-belt-charming-accessory-g776672.html,Women's Belt Elastic Strappy Embroidery Rose Waist Belt Charming Accessory,Belts
97,$5.99,$10.99,https://www.jollychic.com/p/women-s-waist-chain-simple-style-multi-layers-charming-accessory-g779230.html,Women's Waist Chain Simple Style Multi Layers Charming Accessory,Belts
179,$13.99,$34.99,https://www.jollychic.com/p/women-s-belt-double-buckle-adjustable-faux-leather-vintage-accessory-g780230.html,Women's Belt Double Buckle Adjustable Faux Leather Vintage Accessory,Belts
45,$7.99,$15.99,https://www.jollychic.com/p/women-s-waist-chain-alloy-coin-dancing-all-match-accessory-g842540.html,Women's Waist Chain Alloy Coin Dancing All Match Accessory,Belts
116,$32.99,,https://www.jollychic.com/p/women-s-belt-elegant-imitation-pearl-pendant-dancing-chain-accessory-g843408.html,Women's Belt Elegant Imitation Pearl Pendant Dancing Chain Accessory,Belts
58,$6.99,$18.99,https://www.jollychic.com/p/women-s-belts-imitation-pearls-ornament-elastic-bow-knot-belt-accessory-g843578.html,Women's Belts Imitation Pearls Ornament Elastic Bow Knot Belt Accessory,Belts
167,$3.99,$6.99,https://www.jollychic.com/p/women-s-belts-patchwork-brief-style-buckle-faddish-jeans-accessory-g905176.html,Women 's Belts Patchwork Brief Style Buckle Faddish Jeans Accessory,Belts
63,$2.99,$6.99,https://www.jollychic.com/p/women-s-belts-patchwork-brief-style-buckle-trendy-all-match-accessory-g905178.html,Women 's Belts Patchwork Brief Style Buckle Trendy All Match Accessory,Belts
224,$3.99,$6.99,https://www.jollychic.com/p/women-s-belt-solid-color-heel-bar-buckle-stylish-belt-accessory-g959586.html,Women's Belt Solid Color Heel Bar Buckle Stylish Belt Accessory,Belts
73,$1.99,$6.99,https://www.jollychic.com/p/women-s-belt-solid-color-simple-style-hollowed-out-trendy-belt-accessory-g979758.html,Women's Belt Solid Color Simple Style Hollowed Out Trendy Belt Accessory,Belts
108,$6.99,,https://www.jollychic.com/p/women-s-belt-brief-style-hollow-out-patchwork-faddish-accessory-g1045490.html,Women's Belt Brief Style Hollow Out Patchwork Faddish Accessory,Belts
285,$6.99,,https://www.jollychic.com/p/women-s-belt-vintage-style-buckle-patchwork-faddish-accessory-g1045496.html,Women's Belt Vintage Style Buckle Patchwork Faddish Accessory,Belts
199,$5.99,$13.99,https://www.jollychic.com/p/women-s-belt-fashion-round-circle-buckled-solid-color-belt-accessory-g1062986.html,Women's Belt Fashion Round Circle Buckled Solid Color Belt Accessory,Belts
40,$5.99,$12.99,https://www.jollychic.com/p/women-s-belt-bow-knot-decor-solid-color-all-match-trendy-casual-belt-accessory-g1062992.html,Women's Belt Bow Knot Decor Solid Color All Match Trendy Casual Belt Accessory,Belts
121,$4.99,$11.99,https://www.jollychic.com/p/women-s-jeans-belt-solid-color-round-buckle-stylish-belt-accessory-g1062994.html,Women's Jeans Belt Solid Color Round Buckle Stylish Belt Accessory,Belts
138,$6.99,$14.99,https://www.jollychic.com/p/women-s-belt-solid-color-simple-all-match-stylish-belt-accessory-g1062996.html,Women's Belt Solid Color Simple All Match Stylish Belt Accessory,Belts
202,$14.99,$41.99,https://www.jollychic.com/p/women-s-belt-retro-style-ladylike-hollow-patchwork-faddish-accessory-g1113424.html,Women's Belt Retro Style Ladylike Hollow Patchwork Faddish Accessory,Belts
9,$25.99,,https://www.jollychic.com/p/women-s-belt-retro-solid-color-hollow-out-casual-trendy-accessory-g1162040.html,Women's Belt Retro Solid Color Hollow Out Casual Trendy Accessory,Belts
21,$26.99,,https://www.jollychic.com/p/women-s-belt-fashion-solid-color-all-match-leather-accessory-g1162042.html,Women's Belt Fashion Solid Color All Match Leather Accessory,Belts
27,$16.99,$25.99,https://www.jollychic.com/p/women-s-belt-retro-solid-color-all-match-trendy-accessory-g1162044.html,Women's Belt Retro Solid Color All Match Trendy Accessory,Belts
28,$5.99,,https://www.jollychic.com/p/women-s-belt-stylish-solid-color-letter-shape-decoration-stylish-unisex-accessory-108g-g1166438.html,Women's Belt Stylish Solid Color Letter Shape Decoration Stylish Unisex Accessory 108g,Belts
37,$9.99,$18.99,https://www.jollychic.com/p/women-s-cinch-belts-bow-knot-ornament-wide-belt-accessory-g1181070.html,Women's Cinch Belts Bow Knot Ornament Wide Belt Accessory,Belts
253,$7.99,$14.99,https://www.jollychic.com/p/women-s-cinch-belts-canvas-letter-imprint-stylish-waist-belt-accessory-g1181074.html,Women's Cinch Belts Canvas Letter Imprint Stylish Waist Belt Accessory,Belts
329,$4.99,$9.99,https://www.jollychic.com/p/women-s-corset-retro-style-tassel-decorative-faddish-ladylike-accessory-g1209314.html,Women's Corset Retro Style Tassel Decorative Faddish Ladylike Accessory,Belts
28,$11.99,$18.99,https://www.jollychic.com/p/women-s-jeans-belt-double-metal-ring-decoration-solid-color-all-match-belt-g1214126.html,Women's Jeans Belt Double Metal Ring Decoration Solid Color All Match Belt,Belts
39,$12.99,$19.99,https://www.jollychic.com/p/women-s-jeans-belt-waist-belt-retro-style-simple-stylish-buckle-belt-g1226904.html,Women's Jeans Belt Waist Belt Retro Style Simple Stylish Buckle Belt,Belts
26,$6.99,$19.99,https://www.jollychic.com/p/women-s-corset-belt-solid-color-plain-style-all-match-circle-ring-decorated-fashion-accessory-g1294192.html,Women's Corset Belt Solid Color Plain Style All Match Circle Ring Decorated Fashion Accessory,Belts
17,$6.99,$18.99,https://www.jollychic.com/p/women-s-corset-plain-style-leopard-print-fashion-all-match-accessory-g1294194.html,Women's Corset Plain Style Leopard Print Fashion All Match Accessory,Belts
34,$6.99,$19.99,https://www.jollychic.com/p/women-s-corset-flower-embroidery-lace-up-all-match-fashion-accessory-g1294196.html,Women's Corset Flower Embroidery Lace Up All Match Fashion Accessory,Belts
14,$4.99,$14.99,https://www.jollychic.com/p/women-s-belt-candy-color-pin-buckle-patent-leather-belt-accessory-g1305688.html,Women's Belt Candy Color Pin Buckle Patent Leather Belt Accessory,Belts
33,$5.99,$14.99,https://www.jollychic.com/p/women-s-belt-solid-color-retro-style-all-match-knitted-belt-accessory-g1305694.html,Women's Belt Solid Color Retro Style All Match Knitted Belt Accessory,Belts
12,$6.99,$18.99,https://www.jollychic.com/p/women-s-corset-personalized-all-match-retro-style-trendy-accessory-g1305992.html,Women's Corset Personalized All Match Retro Style Trendy Accessory,Belts
13,$5.99,$16.99,https://www.jollychic.com/p/women-s-belt-preppy-style-casual-all-match-fashion-pin-buckle-accessory-g1313268.html,Women's Belt Preppy Style Casual All Match Fashion Pin Buckle Accessory,Belts
8,$5.99,$15.99,https://www.jollychic.com/p/women-s-belt-fresh-style-candy-color-all-match-knotted-ring-accessory-g1313278.html,Women's Belt Fresh Style Candy Color All Match Knotted Ring Accessory,Belts
17,$6.99,$18.99,https://www.jollychic.com/p/women-s-corset-causal-brief-style-all-matched-vogue-bold-belt-accessory-g1313320.html,Women's Corset Causal Brief Style All Matched Vogue Bold Belt Accessory,Belts
8,$5.99,$17.99,https://www.jollychic.com/p/women-s-corset-ladylike-all-matched-hollowed-out-heart-shaped-buckle-bold-belt-accessory-g1313322.html,Women's Corset Ladylike All Matched Hollowed Out Heart Shaped Buckle Bold Belt Accessory,Belts
16,$5.99,$15.99,https://www.jollychic.com/p/women-s-waist-chain-patchwork-top-fashion-all-match-accessory-g1321442.html,Women's Waist Chain Patchwork Top Fashion All Match Accessory,Belts
71,$4.99,$15.99,https://www.jollychic.com/p/women-s-belt-solid-color-no-cut-simple-style-all-match-accessory-g1321482.html,Women's Belt Solid Color No Cut Simple Style All Match Accessory,Belts
27,$7.99,$18.99,https://www.jollychic.com/p/women-s-corset-solid-color-bandeau-design-sexy-accessory-g1323502.html,Women's Corset Solid Color Bandeau Design Sexy Accessory,Belts
47,$5.99,$14.99,https://www.jollychic.com/p/women-s-belt-solid-color-simple-style-chic-all-match-belt-accessory-g1323526.html,Women's Belt Solid Color Simple Style Chic All Match Belt Accessory,Belts
38,$4.99,$19.99,https://www.jollychic.com/p/women-s-waist-chain-solid-color-creative-belt-accessory-g1323528.html,Women's Waist Chain Solid Color Creative Belt Accessory,Belts
27,$2.99,$10.99,https://www.jollychic.com/p/women-s-belt-fashionable-all-matched-candy-color-brief-style-accessory-g1336946.html,Women's Belt Fashionable All Matched Candy Color Brief Style Accessory,Belts
205,$3.99,$9.99,https://www.jollychic.com/p/women-s-corset-vintage-style-elastic-lace-up-stylish-all-match-accessory-g1344028.html,Women's Corset Vintage Style Elastic Lace Up Stylish All Match Accessory,Belts
20,$20.99,,https://www.jollychic.com/p/women-s-corset-rhinestones-inlay-elegant-faddish-accessory-g1345616.html,Women's Corset Rhinestones Inlay Elegant Faddish Accessory,Belts
85,$11.99,$25.99,https://www.jollychic.com/p/women-s-belt-brief-style-faddish-buckle-all-match-trendy-accessory-g1354380.html,Women's Belt Brief Style Faddish Buckle All Match Trendy Accessory,Belts
16,$2.99,$9.99,https://www.jollychic.com/p/women-s-waist-chain-solid-color-multi-layer-alloy-fashionable-accessory-g1378712.html,Women's Waist Chain Solid Color Multi-Layer Alloy Fashionable Accessory,Belts
12,$10.99,$26.99,https://www.jollychic.com/p/women-s-belt-carve-pattern-rivet-decoration-brief-design-all-match-belt-accessory-g1430498.html,Women's Belt Carve Pattern Rivet Decoration Brief Design All Match Belt Accessory,Belts
10,$2.99,$10.99,https://www.jollychic.com/p/women-s-belt-solid-color-brief-design-classic-buckled-all-match-belt-accessory-g1430500.html,Women's Belt Solid Color Brief Design Classic Buckled All Match Belt Accessory,Belts
16,$5.99,$14.99,https://www.jollychic.com/p/women-s-belt-solid-color-creative-buckled-all-match-top-fashion-belt-accessory-g1430504.html,Women's Belt Solid Color Creative Buckled All Match Top Fashion Belt Accessory,Belts
28,$10.99,,https://www.jollychic.com/p/women-s-suspender-solid-color-elastic-adjustable-fashion-jeans-belt-g1447490.html,Women's Suspender Solid Color Elastic Adjustable Fashion Jeans Belt,Belts
10,$29.99,,https://www.jollychic.com/p/women-s-corset-retro-style-hollow-out-brief-faddish-accessory-g1452982.html,Women's Corset Retro Style Hollow Out Brief Faddish Accessory,Belts
75,$9.99,,https://www.jollychic.com/p/women-s-corset-solid-color-bow-knot-ladylike-all-matched-accessory-g1480956.html,Women's Corset Solid Color Bow Knot Ladylike All Matched Accessory,Belts
40,$9.99,$13.99,https://www.jollychic.com/p/women-s-corset-lace-design-bow-knot-decor-pu-wrap-around-waist-band-belt-g1500316.html,Women's Corset Lace Design Bow Knot Decor PU Wrap Around Waist Band Belt,Belts
40,$6.99,$9.99,https://www.jollychic.com/p/women-s-corset-bow-knot-design-solid-color-wrap-around-waist-band-belt-accessory-g1500348.html,Women's Corset Bow Knot Design Solid Color Wrap Around Waist Band Belt Accessory,Belts
7,$13.99,,https://www.jollychic.com/p/2pcs-overalls-clip-set-fashion-solid-color-three-clips-anti-skid-elastic-suspenders-and-bow-tie-set-g1587920.html,2Pcs Overalls Clip Set Fashion Solid Color Three Clips Anti-Skid Elastic Suspenders And Bow Tie Set,Belts
6,$8.99,$13.99,https://www.jollychic.com/p/overalls-clip-set-fashion-solid-color-three-clips-suspenders-and-bow-tie-set-g1587922.html,Overalls Clip Set Fashion Solid Color Three Clips Suspenders And Bow Tie Set,Belts
3,$8.99,$12.99,https://www.jollychic.com/p/women-s-belt-voguish-vintage-solid-popular-jean-belt-accessory-g1606790.html,Women's Belt Voguish Vintage Solid Popular Jean Belt Accessory,Belts
0,$4.99,,https://www.jollychic.com/p/women-s-jeans-belt-hollow-out-design-round-ring-decor-vintage-style-accessory-g1619810.html,Women's Jeans Belt Hollow Out Design Round Ring Decor Vintage Style Accessory,Belts
0,$5.99,,https://www.jollychic.com/p/women-s-jeans-belt-metal-buckle-design-vintage-casual-style-accessory-g1619818.html,Women's Jeans Belt Metal Buckle Design Vintage Casual Style Accessory,Belts
298,$5.99,,https://www.jollychic.com/p/new-fashion-electroplate-sheet-metal-elastic-belt-g31307.html,New Fashion Electroplate Sheet Metal Elastic Belt,Belts
226,$3.99,,https://www.jollychic.com/p/all-match-sequined-decorate-elastic-woman-belt-g31365.html,All-match Sequined Decorate Elastic Woman Belt,Belts
231,$4.99,,https://www.jollychic.com/p/western-retro-palace-female-metal-wide-cool-belts-g34870.html,Western Retro Palace Female Metal Wide Cool Belts,Belts
243,$3.99,,https://www.jollychic.com/p/solid-sweet-fashion-alloy-wide-belts-for-women-g34873.html,Solid Sweet Fashion Alloy Wide Belts For Women,Belts
311,$3.99,,https://www.jollychic.com/p/rectangle-fashion-retro-all-match-metal-slim-belt-for-women-g34901.html,Rectangle Fashion Retro All-Match Metal Slim Belt For Women,Belts
1585,$4.99,$7.99,https://www.jollychic.com/p/western-trendy-solid-female-wide-elastic-waist-belt-g35054.html,Western Trendy Solid Female Wide Elastic Waist Belt,Belts
215,$6.99,,https://www.jollychic.com/p/all-match-briefness-elastic-mental-waist-belt-g36278.html,All Match Briefness Elastic Mental Waist Belt,Belts
159,$8.99,,https://www.jollychic.com/p/wide-leisure-nice-design-women-belt-g185671.html,Wide Leisure Nice Design Women Belt,Belts
301,$1.99,$9.99,https://www.jollychic.com/p/flamboyant-red-vintage-studs-belt-for-women-g292576.html,Flamboyant Red Vintage Studs Belt For Women,Belts
126,$5.99,$10.99,https://www.jollychic.com/p/women-s-dress-belt-punk-stylish-belt-chic-accessory-g581576.html,Women's Dress Belt Punk Stylish Belt Chic Accessory,Belts
50,$5.99,,https://www.jollychic.com/p/women-s-cinch-belt-simple-style-hollow-out-all-match-belt-g626366.html,Women's Cinch Belt Simple Style Hollow Out All Match Belt,Belts
95,$6.99,,https://www.jollychic.com/p/women-s-cinch-belt-bow-tied-metallic-round-ornament-belt-g626792.html,Women's Cinch Belt Bow Tied Metallic Round Ornament Belt,Belts
148,$7.99,$11.99,https://www.jollychic.com/p/women-s-belts-all-match-casual-metal-round-hoop-canvas-belt-accessory-g636100.html,Women's Belts All Match Casual Metal Round Hoop Canvas Belt Accessory,Belts
164,$4.99,$8.99,https://www.jollychic.com/p/women-s-belts-solid-color-brief-style-double-buckle-casual-accessory-g636102.html,Women's Belts Solid Color Brief Style Double Buckle Casual Accessory,Belts
102,$3.99,$8.99,https://www.jollychic.com/p/women-s-belts-brief-style-all-match-solid-color-casual-belt-accessory-g636106.html,Women's Belts Brief Style All Match Solid Color Casual Belt Accessory,Belts
68,$5.99,,https://www.jollychic.com/p/women-s-belt-different-color-big-flower-appliques-elastic-sweet-belt-g665470.html,Women's Belt Different Color Big Flower Appliques Elastic Sweet Belt,Belts
65,$4.99,$7.99,https://www.jollychic.com/p/women-s-belt-solid-color-3-flowers-ornament-elastic-nice-belt-g665472.html,Women's Belt Solid Color 3 Flowers Ornament Elastic Nice Belt,Belts
