add_wish,discount_price,original_price,product_link,product_name,header_block
44,$17.99,,https://www.jollychic.com/p/women-s-sunglasses-large-frame-full-rim-personalized-chic-accessory-g677980.html,Women's Sunglasses Large Frame Full Rim Personalized Chic Accessory,Sunglasses/Eyewears
31,$8.99,$17.99,https://www.jollychic.com/p/women-s-sunglasses-large-retro-full-rim-cool-all-match-accessory-g677990.html,Women's Sunglasses Large Retro Full Rim Cool All Match Accessory,Sunglasses/Eyewears
41,$24.99,,https://www.jollychic.com/p/women-s-sunglasses-faddish-colorful-film-all-matched-glasses-accessory-g678854.html,Women's Sunglasses Faddish Colorful Film All Matched Glasses Accessory,Sunglasses/Eyewears
191,$10.99,$19.99,https://www.jollychic.com/p/women-s-sunglasses-polarized-uv-protection-retro-round-glasses-g679460.html,Women's Sunglasses Polarized UV Protection Retro Round Glasses,Sunglasses/Eyewears
43,$11.99,$18.99,https://www.jollychic.com/p/women-s-sunglasses-colorblock-metal-frame-round-glasses-trendy-accessory-g680628.html,Women's Sunglasses Colorblock Metal Frame Round Glasses Trendy Accessory,Sunglasses/Eyewears
67,$9.99,$17.99,https://www.jollychic.com/p/women-s-glasses-round-circle-retro-full-rim-simple-plain-glasses-g684884.html,Women's Glasses Round Circle Retro Full Rim Simple Plain Glasses,Sunglasses/Eyewears
40,$10.99,$17.99,https://www.jollychic.com/p/women-s-glasses-trendy-all-match-full-rim-square-frame-casual-plain-glasses-g684888.html,Women's Glasses Trendy All Match Full Rim Square Frame Casual Plain Glasses,Sunglasses/Eyewears
134,$5.99,,https://www.jollychic.com/p/women-s-sunglasses-classic-metallic-frame-all-matched-dazzling-accessory-g693116.html,Women's Sunglasses Classic Metallic Frame All Matched Dazzling Accessory,Sunglasses/Eyewears
178,$20.99,,https://www.jollychic.com/p/women-s-sunglasses-exquisite-rhinestone-inlay-trendy-cat-eye-glasses-accessory-g730018.html,Women's Sunglasses Exquisite Rhinestone Inlay Trendy Cat Eye Glasses Accessory,Sunglasses/Eyewears
11,$2.99,$8.99,https://www.jollychic.com/p/women-s-sunglasses-all-matched-polarized-light-vintage-glass-accessory-g766628.html,Women's Sunglasses All Matched Polarized Light Vintage Glass Accessory,Sunglasses/Eyewears
12,$19.99,$42.99,https://www.jollychic.com/p/women-s-glasses-polarized-light-alloy-frame-driving-glass-accessory-g768138.html,Women's Glasses Polarized Light Alloy Frame Driving Glass Accessory,Sunglasses/Eyewears
88,$11.99,$21.99,https://www.jollychic.com/p/3pcs-women-s-sunglasses-set-all-match-uv-protection-vogue-accessories-g777310.html,3Pcs Women's Sunglasses Set All Match UV Protection Vogue Accessories,Sunglasses/Eyewears
15,$9.99,$15.99,https://www.jollychic.com/p/women-s-sunglasses-semi-rim-round-circle-sun-protection-trendy-accessory-g792656.html,Women's Sunglasses Semi Rim Round Circle Sun Protection Trendy Accessory,Sunglasses/Eyewears
24,$10.99,$16.99,https://www.jollychic.com/p/women-s-sunglasses-colorblock-stripe-pattern-metal-rim-square-vintage-accessory-g792664.html,Women's Sunglasses Colorblock Stripe Pattern Metal Rim Square Vintage Accessory,Sunglasses/Eyewears
56,$10.99,$17.99,https://www.jollychic.com/p/women-s-sunglasses-fashionable-all-matched-metallic-frame-glasses-accessory-g844512.html,Women's Sunglasses Fashionable All Matched Metallic Frame Glasses Accessory,Sunglasses/Eyewears
50,$11.99,$18.99,https://www.jollychic.com/p/women-s-glasses-simple-style-large-frame-all-matched-glasses-accessory-g844524.html,Women's Glasses Simple Style Large Frame All Matched Glasses Accessory,Sunglasses/Eyewears
10,$5.99,$11.99,https://www.jollychic.com/p/2-pcs-women-s-sunglasses-faddish-full-rim-resin-accessory-g871346.html,2 Pcs Women's Sunglasses Faddish Full Rim Resin Accessory,Sunglasses/Eyewears
19,$10.99,$20.99,https://www.jollychic.com/p/women-s-sunglasses-rimless-simple-stylish-all-match-glasses-accessory-g876236.html,Women's Sunglasses Rimless Simple Stylish All Match Glasses Accessory,Sunglasses/Eyewears
79,$9.99,$18.99,https://www.jollychic.com/p/women-s-sunglasses-cat-ears-design-fashion-casual-accessory-g886294.html,Women's Sunglasses Cat Ears Design Fashion Casual Accessory,Sunglasses/Eyewears
79,$17.99,,https://www.jollychic.com/p/women-s-sunglasses-love-heart-shape-lens-vinatge-trendy-sunglasses-g909482.html,Women's Sunglasses Love Heart Shape Lens Vinatge Trendy Sunglasses,Sunglasses/Eyewears
46,$14.99,,https://www.jollychic.com/p/women-s-sunglasses-lemon-shape-design-stylish-all-match-accessory-g940930.html,Women's Sunglasses Lemon Shape Design Stylish All Match Accessory,Sunglasses/Eyewears
32,$19.99,,https://www.jollychic.com/p/women-s-eyeglasses-retro-style-oversized-full-frame-accessory-g971034.html,Women's Eyeglasses Retro Style Oversized Full Frame Accessory,Sunglasses/Eyewears
24,$22.99,,https://www.jollychic.com/p/women-s-eyeglasses-preppy-style-vintage-all-match-round-frame-accessory-g971476.html,Women's Eyeglasses Preppy Style Vintage All Match Round Frame Accessory,Sunglasses/Eyewears
12,$4.99,$8.99,https://www.jollychic.com/p/men-s-glasses-frame-fashion-vintage-round-circle-unisex-accessory-g992218.html,Men's Glasses Frame Fashion Vintage Round Circle Unisex Accessory,Sunglasses/Eyewears
15,$8.99,$13.99,https://www.jollychic.com/p/men-s-sunglasses-metal-frame-round-circle-unisex-glasses-accessory-g1003362.html,Men's Sunglasses Metal Frame Round Circle Unisex Glasses Accessory,Sunglasses/Eyewears
11,$5.99,$13.99,https://www.jollychic.com/p/men-s-sunglasses-polygon-oversize-fashion-all-match-unisex-glasses-accessory-g1004808.html,Men's Sunglasses Polygon Oversize Fashion All Match Unisex Glasses Accessory,Sunglasses/Eyewears
13,$13.99,,https://www.jollychic.com/p/women-s-glasses-square-frame-simple-style-all-match-accessory-g1024212.html,Women's Glasses Square Frame Simple Style All Match Accessory,Sunglasses/Eyewears
13,$8.99,$14.99,https://www.jollychic.com/p/women-s-cat-eye-sunglasses-simple-style-chic-glasses-accessory-g1025558.html,Women's Cat Eye Sunglasses Simple Style Chic Glasses Accessory,Sunglasses/Eyewears
51,$10.99,$21.99,https://www.jollychic.com/p/women-s-sunglasses-polarized-round-frame-semi-rim-glasses-accessory-g1036746.html,Women's Sunglasses Polarized Round Frame Semi Rim Glasses Accessory,Sunglasses/Eyewears
31,$4.99,$12.99,https://www.jollychic.com/p/women-s-sunglasses-brief-style-solid-color-glasses-trendy-accessory-g1044406.html,Women's Sunglasses Brief Style Solid Color Glasses Trendy Accessory,Sunglasses/Eyewears
10,$8.99,$13.99,https://www.jollychic.com/p/women-s-glasses-vogue-full-frame-all-matched-eyewear-accessory-g1076708.html,Women's Glasses Vogue Full Frame All Matched Eyewear Accessory,Sunglasses/Eyewears
46,$12.99,,https://www.jollychic.com/p/women-s-sunglasses-retro-color-block-full-rim-faddish-frame-glasses-g1077144.html,Women's Sunglasses Retro Color Block Full Rim Faddish Frame Glasses,Sunglasses/Eyewears
9,$7.99,$15.99,https://www.jollychic.com/p/women-s-sunglasses-plastic-frame-durable-faddish-glasses-accessory-g1099176.html,Women's Sunglasses Plastic Frame Durable Faddish Glasses Accessory,Sunglasses/Eyewears
20,$10.99,$17.99,https://www.jollychic.com/p/women-s-sunglasses-personality-creative-shape-design-accessory-g1100500.html,Women's Sunglasses Personality Creative Shape Design Accessory,Sunglasses/Eyewears
5,$107.00,$119.00,https://www.jollychic.com/p/coach-women-s-sunglasses-black-frame-grey-gradient-lenses-oval-shape-trendy-accessory-g1138278.html,Coach Women's Sunglasses Black Frame Grey Gradient Lenses Oval Shape Trendy Accessory,Sunglasses/Eyewears
4,$143.00,$159.00,https://www.jollychic.com/p/michael-kors-women-s-sunglasses-voguish-round-shape-gradient-lenses-accessory-g1138406.html,Michael Kors Women's Sunglasses Voguish Round Shape Gradient Lenses Accessory,Sunglasses/Eyewears
13,$10.99,$19.99,https://www.jollychic.com/p/women-s-sunglasses-retro-style-metal-frame-elegant-fashion-eyewear-g1140410.html,Women's Sunglasses Retro Style Metal Frame Elegant Fashion Eyewear,Sunglasses/Eyewears
171,$8.99,$16.99,https://www.jollychic.com/p/women-s-sunglasses-stylish-cat-eye-irregular-lens-stylish-accessory-g1163040.html,Women's Sunglasses Stylish Cat Eye Irregular Lens Stylish Accessory,Sunglasses/Eyewears
21,$16.99,,https://www.jollychic.com/p/women-s-sunglasses-round-shape-metal-frame-vintage-accessory-g1173824.html,Women's Sunglasses Round Shape Metal Frame Vintage Accessory,Sunglasses/Eyewears
5,$11.99,$18.99,https://www.jollychic.com/p/women-s-sunglasses-vogue-rimless-plastic-eyewear-accessory-g1176662.html,Women's Sunglasses Vogue Rimless Plastic Eyewear Accessory,Sunglasses/Eyewears
2,$6.99,$15.99,https://www.jollychic.com/p/women-s-sunglasses-simple-style-round-circle-chic-glasses-accessory-g1178724.html,Women's Sunglasses Simple Style Round Circle Chic Glasses Accessory,Sunglasses/Eyewears
40,$11.99,$17.99,https://www.jollychic.com/p/women-s-sunglasses-colorful-round-lens-fancy-retro-sunglasses-g1181650.html,Women's Sunglasses Colorful Round Lens Fancy Retro Sunglasses,Sunglasses/Eyewears
3,$12.99,$21.99,https://www.jollychic.com/p/women-s-sunglasses-personality-cozy-design-eyewear-accessory-g1186798.html,Women's Sunglasses Personality Cozy Design Eyewear Accessory,Sunglasses/Eyewears
73,$6.99,$11.99,https://www.jollychic.com/p/kesmall-1pcs-fashion-round-bamboo-sunglasses-case-women-men-wood-eyeglasses-box-g1186876.html,KESMALL 1PCS Fashion Round Bamboo Sunglasses Case Women Men Wood Eyeglasses Box,Sunglasses/Eyewears
2,$4.99,$9.99,https://www.jollychic.com/p/women-s-sunglasses-retro-style-fashion-large-frame-personalized-accessory-g1186918.html,Women's Sunglasses Retro Style Fashion Large Frame Personalized Accessory,Sunglasses/Eyewears
7,$15.99,,https://www.jollychic.com/p/women-s-sunglasses-unisex-metal-square-wave-rim-clear-trendy-accessory-g1200942.html,Women's Sunglasses Unisex Metal Square Wave Rim Clear Trendy Accessory,Sunglasses/Eyewears
87,$12.99,,https://www.jollychic.com/p/women-s-sunglasses-fresh-style-color-block-charming-popular-accessory-g1220596.html,Women's Sunglasses Fresh Style Color Block Charming Popular Accessory,Sunglasses/Eyewears
6,$14.99,,https://www.jollychic.com/p/women-s-eyeglasses-patchwork-brief-style-big-frame-trendy-accessory-g1228172.html,Women's Eyeglasses Patchwork Brief Style Big Frame Trendy Accessory,Sunglasses/Eyewears
11,$14.99,,https://www.jollychic.com/p/women-s-eyeglasses-big-frame-retro-style-all-match-metal-accessory-g1228174.html,Women's Eyeglasses Big Frame Retro Style All Match Metal Accessory,Sunglasses/Eyewears
12,$1.99,$4.99,https://www.jollychic.com/p/kesmall-sunglasses-bag-chic-colorful-foldable-eyeglasses-bag-eyewear-accessory-g1248426.html,KESMALL Sunglasses Bag Chic Colorful Foldable Eyeglasses Bag Eyewear Accessory,Sunglasses/Eyewears
18,$1.99,$4.99,https://www.jollychic.com/p/kesmall-eyeglasses-case-fashion-solid-eva-zipper-with-hook-storage-case-eyewear-accessory-g1248428.html,KESMALL Eyeglasses Case Fashion Solid EVA Zipper With Hook Storage Case Eyewear Accessory,Sunglasses/Eyewears
22,$7.99,$14.99,https://www.jollychic.com/p/women-s-sunglasses-eye-cat-faddish-big-frame-ladylike-accessory-g1251320.html,Women's Sunglasses Eye Cat Faddish Big Frame Ladylike Accessory,Sunglasses/Eyewears
12,$8.99,$13.99,https://www.jollychic.com/p/men-s-sunglasses-fashionable-rimless-vintage-heart-shape-glasses-accessory-g1271444.html,Men's Sunglasses Fashionable Rimless Vintage Heart Shape Glasses Accessory,Sunglasses/Eyewears
1,$7.99,$15.99,https://www.jollychic.com/p/women-s-sunglasses-retro-style-big-frame-color-block-accessory-g1275616.html,Women's Sunglasses Retro Style Big Frame Color Block Accessory,Sunglasses/Eyewears
5,$5.99,$11.99,https://www.jollychic.com/p/women-s-sunglasses-faddish-style-cat-eye-big-frame-charming-accessory-g1279836.html,Women's Sunglasses Faddish Style Cat Eye Big Frame Charming Accessory,Sunglasses/Eyewears
18,$11.99,$24.99,https://www.jollychic.com/p/women-s-eyeglasses-square-clear-lens-full-frame-plain-glasses-g1293002.html,Women's Eyeglasses Square Clear Lens Full Frame Plain Glasses,Sunglasses/Eyewears
6,$8.99,$18.99,https://www.jollychic.com/p/women-s-stylish-sunglasses-super-light-clear-glasses-frame-eyeglasses-g1308784.html,Women's Stylish Sunglasses Super Light Clear Glasses Frame Eyeglasses,Sunglasses/Eyewears
19,$5.99,$15.99,https://www.jollychic.com/p/sunglasses-vintage-style-oval-circle-unique-unisex-accessory-g1310206.html,Sunglasses Vintage Style Oval Circle Unique Unisex Accessory,Sunglasses/Eyewears
0,$10.99,$23.99,https://www.jollychic.com/p/women-s-sunglasses-multi-colors-optional-metal-curved-legs-frameless-sunglasses-g1315356.html,Women's Sunglasses Multi Colors Optional Metal Curved Legs Frameless Sunglasses,Sunglasses/Eyewears
2,$10.99,$24.99,https://www.jollychic.com/p/women-s-sunglasses-pink-mirror-rimless-cat-eye-hollow-out-alloy-fashion-eyewear-g1316258.html,Women's Sunglasses Pink Mirror Rimless Cat Eye Hollow Out Alloy Fashion Eyewear,Sunglasses/Eyewears
2,$13.99,$27.99,https://www.jollychic.com/p/women-s-sunglasses-cozy-design-polarized-eyewear-accessory-g1319412.html,Women's Sunglasses Cozy Design Polarized Eyewear Accessory,Sunglasses/Eyewears
24,$8.99,$18.99,https://www.jollychic.com/p/women-s-eyeglasses-vintage-metal-no-degree-clear-glasses-unisex-eyeglasses-frame-g1322166.html,Women's Eyeglasses Vintage Metal No Degree Clear Glasses Unisex Eyeglasses Frame,Sunglasses/Eyewears
1566,$5.99,$15.99,https://www.jollychic.com/p/women-s-eyeglasses-chic-cool-metal-frame-transparent-lens-goggles-eyewear-accessory-g1326876.html,Women's Eyeglasses Chic Cool Metal Frame Transparent Lens Goggles Eyewear Accessory,Sunglasses/Eyewears
40,$19.99,,https://www.jollychic.com/p/women-s-eyeglasses-preppy-style-brief-vintage-round-frame-chic-accessory-g1340706.html,Women's Eyeglasses Preppy Style Brief Vintage Round Frame Chic Accessory,Sunglasses/Eyewears
2,$29.99,,https://www.jollychic.com/p/women-s-sunglasses-retro-style-patchwork-personalized-vogue-accessory-g1341754.html,Women's Sunglasses Retro Style Patchwork Personalized Vogue Accessory,Sunglasses/Eyewears
2,$11.99,$25.99,https://www.jollychic.com/p/women-s-sunglasses-brief-style-ladylike-retro-luxury-diamond-sunglasses-g1344024.html,Women's Sunglasses Brief Style Ladylike Retro Luxury Diamond Sunglasses,Sunglasses/Eyewears
33,$7.99,$19.99,https://www.jollychic.com/p/women-s-optical-eyeglasses-frame-preppy-style-all-match-round-metal-frame-accessory-g1361624.html,Women's Optical Eyeglasses Frame Preppy Style All Match Round Metal Frame Accessory,Sunglasses/Eyewears
11,$10.99,$24.99,https://www.jollychic.com/p/women-s-sunglasses-oversized-square-shaped-mirrored-lenses-womens-accessory-g1362712.html,Women's Sunglasses Oversized Square Shaped Mirrored Lenses Womens Accessory,Sunglasses/Eyewears
8,$10.99,$24.99,https://www.jollychic.com/p/women-s-round-sunglasses-alloy-pink-mirror-cat-eye-oversize-eyewear-g1363080.html,Women's Round Sunglasses Alloy Pink Mirror Cat Eye Oversize Eyewear,Sunglasses/Eyewears
2,$36.99,,https://www.jollychic.com/p/women-s-sunglasses-color-block-square-frame-retro-style-accessory-g1381594.html,Women's Sunglasses Color Block Square Frame Retro Style Accessory,Sunglasses/Eyewears
6,$22.99,,https://www.jollychic.com/p/women-s-sunglasses-cat-eye-round-circle-fancy-retro-glasses-g1388566.html,Women's Sunglasses Cat Eye Round Circle Fancy Retro Glasses,Sunglasses/Eyewears
6,$5.99,,https://www.jollychic.com/p/women-s-eyeglasses-case-large-size-sunglasses-storage-box-zipper-case-g1389168.html,Women's Eyeglasses Case Large Size Sunglasses Storage Box Zipper Case,Sunglasses/Eyewears
2,$10.99,$23.99,https://www.jollychic.com/p/women-s-sunglasses-square-rivet-big-frame-oversize-sun-glasses-eyewear-accessory-g1413022.html,Women's Sunglasses Square Rivet Big Frame Oversize Sun Glasses Eyewear Accessory,Sunglasses/Eyewears
3,$11.99,,https://www.jollychic.com/p/women-s-sunglasses-retro-style-patchwork-color-block-faddish-accessory-g1429650.html,Women's Sunglasses Retro Style Patchwork Color Block Faddish Accessory,Sunglasses/Eyewears
5,$3.99,$11.99,https://www.jollychic.com/p/women-s-sunglasses-retro-style-all-match-geometry-shape-frame-glasses-g1430122.html,Women's Sunglasses Retro Style All Match Geometry Shape Frame Glasses,Sunglasses/Eyewears
4,$8.99,$18.99,https://www.jollychic.com/p/women-s-sunglasses-vintage-style-gradient-sunglasses-mirror-oculos-accessories-g1430406.html,Women's Sunglasses Vintage Style Gradient Sunglasses Mirror Oculos Accessories,Sunglasses/Eyewears
11,$17.99,,https://www.jollychic.com/p/women-s-eyeglasses-square-shape-full-frame-simple-vintage-style-all-match-glasses-accessory-g1469178.html,Women's Eyeglasses Square Shape Full Frame Simple Vintage Style All Match Glasses Accessory,Sunglasses/Eyewears
9,$19.99,,https://www.jollychic.com/p/women-s-eyeglasses-simple-square-shape-full-frame-vintage-style-glasses-accessory-g1470532.html,Women's Eyeglasses Simple Square Shape Full Frame Vintage Style Glasses Accessory,Sunglasses/Eyewears
0,$23.99,,https://www.jollychic.com/p/women-s-sunglasses-fashion-square-oversized-retro-metal-frame-sun-glasses-g1482612.html,Women's Sunglasses Fashion Square Oversized Retro Metal Frame Sun Glasses,Sunglasses/Eyewears
11,$6.99,$17.99,https://www.jollychic.com/p/women-s-optical-glasses-frame-rhinestones-decoration-stainless-steel-half-rim-accessory-g1484186.html,Women's Optical Glasses Frame Rhinestones Decoration Stainless Steel Half Rim Accessory,Sunglasses/Eyewears
4,$22.99,,https://www.jollychic.com/p/women-s-sunglasses-big-frame-cat-eye-ladylike-charming-trendy-accessory-g1487630.html,Women's Sunglasses Big Frame Cat Eye Ladylike Charming Trendy Accessory,Sunglasses/Eyewears
0,$14.99,$22.99,https://www.jollychic.com/p/unisex-fashion-sunglasses-metal-frame-simple-stylish-clear-glasses-g1498482.html,Unisex Fashion Sunglasses Metal Frame Simple Stylish Clear Glasses,Sunglasses/Eyewears
4,$14.99,$22.99,https://www.jollychic.com/p/women-s-eyeglasses-plain-style-exquisite-all-match-trendy-eyewear-accessory-g1499732.html,Women's Eyeglasses Plain Style Exquisite All Match Trendy Eyewear Accessory,Sunglasses/Eyewears
0,$11.99,$16.99,https://www.jollychic.com/p/pinglas-women-s-sunglasses-mirrored-clear-frame-beach-sun-glasses-g1500352.html,PINGLAS Women's Sunglasses Mirrored Clear Frame Beach Sun Glasses,Sunglasses/Eyewears
0,$16.99,,https://www.jollychic.com/p/women-s-sunglasses-big-frame-cat-eye-protection-all-match-fashion-sunglasses-g1519082.html,Women's Sunglasses Big Frame Cat Eye Protection All Match Fashion Sunglasses,Sunglasses/Eyewears
0,$92.00,,https://www.jollychic.com/p/jo-women-s-sunglasses-polarized-vintage-wayfarer-round-stylish-protection-sunglasses-g1519854.html,JO Women's Sunglasses Polarized Vintage Wayfarer Round Stylish Protection Sunglasses,Sunglasses/Eyewears
6,$10.99,$15.99,https://www.jollychic.com/p/women-s-sunglasses-fresh-style-heart-design-classic-all-match-accessory-g1524226.html,Women's Sunglasses Fresh Style Heart Design Classic All Match Accessory,Sunglasses/Eyewears
6,$14.99,$21.99,https://www.jollychic.com/p/women-s-sunglasses-patchwork-charming-retro-brief-style-trendy-accessory-g1528518.html,Women's Sunglasses Patchwork Charming Retro Brief Style Trendy Accessory,Sunglasses/Eyewears
2,$14.99,$21.99,https://www.jollychic.com/p/women-s-sunglasses-brief-style-ladylike-all-match-retro-geometry-frame-accessory-g1528526.html,Women's Sunglasses Brief Style Ladylike All Match Retro Geometry Frame Accessory,Sunglasses/Eyewears
0,$35.99,,https://www.jollychic.com/p/colossein-women-s-sunglasses-trendy-rivets-decor-polarized-light-vintage-accessory-g1545732.html,COLOSSEIN Women's Sunglasses Trendy Rivets Decor Polarized Light Vintage Accessory,Sunglasses/Eyewears
7,$35.99,,https://www.jollychic.com/p/colossein-women-s-sunglasses-punk-style-rivets-decor-polarized-light-accessory-g1545736.html,COLOSSEIN Women's Sunglasses Punk Style Rivets Decor Polarized Light Accessory,Sunglasses/Eyewears
0,$8.99,$25.99,https://www.jollychic.com/p/women-s-eyeglasses-color-block-frame-full-rim-glasses-frame-all-match-glasses-accessory-g1566362.html,Women's Eyeglasses Color Block Frame Full Rim Glasses Frame All Match Glasses Accessory,Sunglasses/Eyewears
0,$14.99,,https://www.jollychic.com/p/women-s-eyeglasses-eyes-protection-anti-blue-rays-uv400-all-match-accessory-g1571538.html,Women's Eyeglasses Eyes Protection Anti Blue Rays UV400 All Match Accessory,Sunglasses/Eyewears
1,$11.99,,https://www.jollychic.com/p/women-s-eyeglasses-metal-oval-frame-vintage-style-fashion-eyewear-accessory-g1571558.html,Women's Eyeglasses Metal Oval Frame Vintage Style Fashion Eyewear Accessory,Sunglasses/Eyewears
272,$11.99,,https://www.jollychic.com/p/rhinestone-alloy-patchwork-frame-cat-eye-sunglasses-g133417.html,Rhinestone Alloy Patchwork Frame Cat Eye Sunglasses,Sunglasses/Eyewears
163,$10.99,,https://www.jollychic.com/p/bright-frame-round-lens-fashion-sunglasses-g139519.html,Bright Frame Round Lens Fashion Sunglasses,Sunglasses/Eyewears
216,$8.99,,https://www.jollychic.com/p/cats-eye-stylish-flower-pattern-sunglasses-g213515.html,Cats Eye Stylish Flower Pattern Sunglasses,Sunglasses/Eyewears
220,$4.99,$6.99,https://www.jollychic.com/p/cross-embellishment-peaked-rimmed-sunglasses-g253855.html,Cross Embellishment Peaked Rimmed Sunglasses,Sunglasses/Eyewears
218,$3.99,$7.99,https://www.jollychic.com/p/stylish-upscale-patchwork-bicolor-women-s-delicate-sunglasses-g276471.html,Stylish Upscale Patchwork Bicolor Women's Delicate Sunglasses,Sunglasses/Eyewears
190,$3.99,$8.99,https://www.jollychic.com/p/modern-ultra-thin-light-all-match-sunglasses-g278267.html,Modern Ultra Thin Light All Match Sunglasses,Sunglasses/Eyewears
26,$22.99,,https://www.jollychic.com/p/3-pcs-sunglasses-set-large-frame-frog-mirror-polarized-glasses-set-accessory-g482908.html,3 Pcs Sunglasses Set Large Frame Frog Mirror Polarized Glasses Set Accessory,Sunglasses/Eyewears
302,$13.99,,https://www.jollychic.com/p/women-s-sunglasses-gold-reflective-lens-round-circle-lovely-glasses-accessory-g489114.html,Women's Sunglasses Gold Reflective Lens Round Circle Lovely Glasses Accessory,Sunglasses/Eyewears
42,$5.99,$9.99,https://www.jollychic.com/p/women-s-sunglasses-refined-leopard-frame-cat-eye-glasses-accessory-g558102.html,Women's Sunglasses Refined Leopard Frame Cat Eye Glasses Accessory,Sunglasses/Eyewears
49,$6.99,$16.99,https://www.jollychic.com/p/women-s-sunglasses-stylish-rimless-nose-pad-unique-accessory-g615154.html,Women's Sunglasses Stylish Rimless Nose Pad Unique Accessory,Sunglasses/Eyewears
84,$20.99,,https://www.jollychic.com/p/women-s-sunglasses-semi-circle-polarized-simple-classic-metal-frame-accessory-g631872.html,Women's Sunglasses Semi Circle Polarized Simple Classic Metal Frame Accessory,Sunglasses/Eyewears
12,$16.99,,https://www.jollychic.com/p/women-s-eyeglasses-oval-frame-with-flax-metal-arms-casual-glasses-accessory-g657890.html,Women's Eyeglasses Oval Frame With Flax Metal Arms Casual Glasses Accessory,Sunglasses/Eyewears
19,$9.99,$15.99,https://www.jollychic.com/p/women-s-sunglasses-fashion-cycling-cat-eye-metal-frame-round-glasses-accessory-g658152.html,Women's Sunglasses Fashion Cycling Cat Eye Metal Frame Round Glasses Accessory,Sunglasses/Eyewears
60,$8.99,$19.99,https://www.jollychic.com/p/women-s-sunglasses-personalied-nifty-colorful-cat-eye-sunglasses-accessory-g671346.html,Women's Sunglasses Personalied Nifty Colorful Cat Eye Sunglasses Accessory,Sunglasses/Eyewears
155,$9.99,$17.99,https://www.jollychic.com/p/women-s-sunglasses-chic-pink-round-frame-uv-protection-cat-eye-glasses-g671414.html,Women's Sunglasses Chic Pink Round Frame UV Protection Cat Eye Glasses,Sunglasses/Eyewears
56,$11.99,$18.99,https://www.jollychic.com/p/women-s-sunglasses-hollow-out-round-circle-glasses-sweet-accessory-g672382.html,Women's Sunglasses Hollow Out Round Circle Glasses Sweet Accessory,Sunglasses/Eyewears
22,$9.99,$15.99,https://www.jollychic.com/p/women-s-sunglasses-colorblock-irregular-octagon-glasses-trendy-accessory-g672542.html,Women's Sunglasses Colorblock Irregular Octagon Glasses Trendy Accessory,Sunglasses/Eyewears
24,$14.99,,https://www.jollychic.com/p/women-s-sunglasses-plastic-irregular-cat-eye-glasses-trendy-accessory-g673176.html,Women's Sunglasses Plastic Irregular Cat Eye Glasses Trendy Accessory,Sunglasses/Eyewears
56,$8.99,$13.99,https://www.jollychic.com/p/women-s-sunglasses-cat-ears-design-plastic-glasses-unique-accessory-g674232.html,Women's Sunglasses Cat Ears Design Plastic Glasses Unique Accessory,Sunglasses/Eyewears
20,$5.99,$10.99,https://www.jollychic.com/p/women-s-sunglasses-plastic-frame-simple-style-faddish-accessory-g678282.html,Women's Sunglasses Plastic Frame Simple Style Faddish Accessory,Sunglasses/Eyewears
32,$11.99,$18.99,https://www.jollychic.com/p/women-s-sunglasses-groovy-cat-eye-solid-color-lenses-outdoor-glassses-g679606.html,Women's Sunglasses Groovy Cat Eye Solid Color Lenses Outdoor Glassses,Sunglasses/Eyewears
16,$11.99,$18.99,https://www.jollychic.com/p/women-s-sunglasses-chic-simple-eye-cat-full-rimmed-glasses-accessory-g679884.html,Women's Sunglasses Chic Simple Eye Cat Full Rimmed Glasses Accessory,Sunglasses/Eyewears
37,$5.99,,https://www.jollychic.com/p/women-s-sunglasses-retro-style-square-shaped-fashionable-accessory-g692994.html,Women's Sunglasses Retro Style Square Shaped Fashionable Accessory,Sunglasses/Eyewears
317,$12.99,,https://www.jollychic.com/p/women-s-sunglasses-round-circle-sun-protection-vintage-trendy-accessory-g778206.html,Women's Sunglasses Round Circle Sun Protection Vintage Trendy Accessory,Sunglasses/Eyewears
300,$4.99,$10.99,https://www.jollychic.com/p/women-s-sunglasses-vogue-round-circle-full-rim-eyewear-accessory-g809380.html,Women's Sunglasses Vogue Round Circle Full Rim Eyewear Accessory,Sunglasses/Eyewears
