add_wish,discount_price,original_price,product_link,product_name,header_block
18,$18.99,,https://www.jollychic.com/p/women-s-belt-color-block-retro-style-geometry-pattern-accessory-g1113428.html,Women's Belt Color Block Retro Style Geometry Pattern Accessory,Belts
15,$8.99,$16.99,https://www.jollychic.com/p/women-s-belt-vintage-style-all-match-patchwork-faddish-accessory-g1113434.html,Women's Belt Vintage Style All Match Patchwork Faddish Accessory,Belts
18,$9.99,$18.99,https://www.jollychic.com/p/women-s-belt-brief-style-hollow-out-jeans-faddish-ladylike-accessory-g1113436.html,Women's Belt Brief Style Hollow Out Jeans Faddish Ladylike Accessory,Belts
11,$18.99,,https://www.jollychic.com/p/women-s-cinch-belts-big-bow-knot-ornament-elastic-wide-belt-accessory-g1181068.html,Women's Cinch Belts Big Bow Knot Ornament Elastic Wide Belt Accessory,Belts
15,$14.99,,https://www.jollychic.com/p/women-s-belts-solid-color-all-match-waist-belt-accessory-g1181080.html,Women's Belts Solid Color All Match Waist Belt Accessory,Belts
11,$16.99,$25.99,https://www.jollychic.com/p/women-s-belt-solid-color-pin-buckle-waist-belt-accessory-g1181090.html,Women's Belt Solid Color Pin Buckle Waist Belt Accessory,Belts
10,$11.99,,https://www.jollychic.com/p/women-s-belt-chain-sweet-style-flowers-ornament-ladylike-trendy-accessory-g1187610.html,Women's Belt Chain Sweet Style Flowers Ornament Ladylike Trendy Accessory,Belts
17,$18.99,$28.99,https://www.jollychic.com/p/women-s-jean-belt-retro-style-all-matched-fashionable-trendy-accessory-g1195310.html,Women's Jean Belt Retro Style All Matched Fashionable Trendy Accessory,Belts
30,$18.99,$28.99,https://www.jollychic.com/p/women-s-jean-belt-personalized-all-match-embossed-retro-style-accessory-g1195312.html,Women's Jean Belt Personalized All Match Embossed Retro Style Accessory,Belts
7,$17.99,$26.99,https://www.jollychic.com/p/women-s-jean-belt-fresh-style-all-matched-simple-style-flower-print-accessory-g1195314.html,Women's Jean Belt Fresh Style All Matched Simple Style Flower Print Accessory,Belts
11,$11.99,$18.99,https://www.jollychic.com/p/women-s-cinch-belt-solid-color-all-match-elastic-thin-waist-belt-g1214130.html,Women's Cinch Belt Solid Color All Match Elastic Thin Waist Belt,Belts
9,$18.99,,https://www.jollychic.com/p/women-s-jeans-belt-flower-decoration-thin-waist-belt-g1214132.html,Women's Jeans Belt Flower Decoration Thin Waist Belt,Belts
10,$14.99,,https://www.jollychic.com/p/women-s-jeans-belt-pin-buckle-candy-color-all-match-waist-belt-g1214134.html,Women's Jeans Belt Pin Buckle Candy Color All Match Waist Belt,Belts
20,$22.99,,https://www.jollychic.com/p/women-s-jeans-belt-plain-stylish-all-match-exquisite-belt-g1226902.html,Women's Jeans Belt Plain Stylish All Match Exquisite Belt,Belts
9,$16.99,$25.99,https://www.jollychic.com/p/women-s-belt-retro-style-ladylike-hollow-patchwork-faddish-accessory-g1233862.html,Women's Belt Retro Style Ladylike Hollow Patchwork Faddish Accessory,Belts
4,$13.99,$21.99,https://www.jollychic.com/p/women-s-belts-retro-solid-color-all-matched-faddish-accessory-g1276246.html,Women's Belts Retro Solid Color All Matched Faddish Accessory,Belts
5,$4.99,$12.99,https://www.jollychic.com/p/women-s-belt-all-matched-simple-style-vintage-chic-accessory-g1294384.html,Women's Belt All Matched Simple Style Vintage Chic Accessory,Belts
7,$5.99,$14.99,https://www.jollychic.com/p/women-s-belt-sweet-style-bow-knot-fashionable-all-matched-accessory-g1294386.html,Women's Belt Sweet Style Bow Knot Fashionable All Matched Accessory,Belts
7,$5.99,$16.99,https://www.jollychic.com/p/women-s-belt-simple-style-heart-shaped-hollowed-out-pin-buckle-belt-accessory-g1305690.html,Women's Belt Simple Style Heart Shaped Hollowed Out Pin Buckle Belt Accessory,Belts
17,$4.99,$15.99,https://www.jollychic.com/p/women-s-belt-all-matched-fashionable-personalized-creative-belt-accessory-g1305704.html,Women's Belt All Matched Fashionable Personalized Creative Belt Accessory,Belts
7,$5.99,$16.99,https://www.jollychic.com/p/women-s-belt-elegant-all-matched-fashionable-leather-belt-accessory-g1305708.html,Women's Belt Elegant All Matched Fashionable Leather Belt Accessory,Belts
17,$5.99,$16.99,https://www.jollychic.com/p/women-s-belt-candy-color-simple-style-all-match-hollowed-out-chic-belt-accessory-g1305710.html,Women's Belt Candy Color Simple Style All Match Hollowed Out Chic Belt Accessory,Belts
12,$5.99,$15.99,https://www.jollychic.com/p/women-s-corset-all-match-retro-style-heart-design-trendy-accessory-g1305986.html,Women's Corset All Match Retro Style Heart Design Trendy Accessory,Belts
9,$5.99,$15.99,https://www.jollychic.com/p/women-s-corset-all-matched-rhinestones-ornament-vintage-chic-accessory-g1305988.html,Women's Corset All Matched Rhinestones Ornament Vintage Chic Accessory,Belts
5,$6.99,$18.99,https://www.jollychic.com/p/women-s-corset-patchwork-all-matched-fashionable-simple-style-accessory-g1305994.html,Women's Corset Patchwork All Matched Fashionable Simple Style Accessory,Belts
4,$12.99,$32.99,https://www.jollychic.com/p/women-s-belt-casual-all-match-vogue-pin-buckle-brief-bold-belt-accessory-g1313276.html,Women's Belt Casual All Match Vogue Pin Buckle Brief Bold Belt Accessory,Belts
8,$10.99,$26.99,https://www.jollychic.com/p/women-s-belt-fashion-all-matched-metallic-ring-knotted-accessory-g1313280.html,Women's Belt Fashion All Matched Metallic Ring Knotted Accessory,Belts
4,$6.99,$18.99,https://www.jollychic.com/p/women-s-corset-elegant-simple-style-all-match-vogue-smooth-buckle-accessory-g1313300.html,Women's Corset Elegant Simple Style All Match Vogue Smooth Buckle Accessory,Belts
3,$6.99,$18.99,https://www.jollychic.com/p/women-s-corset-all-matched-rhinestone-ornament-vogue-bold-belt-accessory-g1313304.html,Women's Corset All Matched Rhinestone Ornament Vogue Bold Belt Accessory,Belts
13,$6.99,$18.99,https://www.jollychic.com/p/women-s-corset-retro-style-faddish-leaves-shaped-buckle-elegant-bold-belt-accessory-g1313316.html,Women's Corset Retro Style Faddish Leaves Shaped Buckle Elegant Bold Belt Accessory,Belts
5,$6.99,$18.99,https://www.jollychic.com/p/women-s-corset-brief-style-fashionable-all-match-bold-belt-accessory-g1313318.html,Women's Corset Brief Style Fashionable All Match Bold Belt Accessory,Belts
6,$5.99,$15.99,https://www.jollychic.com/p/women-s-belt-candy-color-simple-style-patent-leather-chic-accessory-g1313394.html,Women's Belt Candy Color Simple Style Patent Leather Chic Accessory,Belts
12,$4.99,$14.99,https://www.jollychic.com/p/women-s-belt-chain-retro-style-solid-color-all-matched-knitted-tassel-accessory-g1313406.html,Women's Belt Chain Retro Style Solid Color All Matched Knitted Tassel Accessory,Belts
4,$4.99,$13.99,https://www.jollychic.com/p/women-s-belt-chain-solid-color-retro-style-all-matched-tassel-knitted-accessory-g1313414.html,Women's Belt Chain Solid Color Retro Style All Matched Tassel Knitted Accessory,Belts
4,$4.99,$14.99,https://www.jollychic.com/p/women-s-belt-chain-chic-retro-style-beaded-tassel-thin-belt-accessory-g1313418.html,Women's Belt Chain Chic Retro Style Beaded Tassel Thin Belt Accessory,Belts
1,$5.99,$16.99,https://www.jollychic.com/p/women-s-belt-preppy-style-all-matched-square-buckle-fashion-accessory-g1313430.html,Women's Belt Preppy Style All Matched Square Buckle Fashion Accessory,Belts
1,$5.99,$16.99,https://www.jollychic.com/p/women-s-belt-candy-color-vogue-simple-style-square-buckle-thin-belt-accessory-g1313434.html,Women's Belt Candy Color Vogue Simple Style Square Buckle Thin Belt Accessory,Belts
17,$3.99,$11.99,https://www.jollychic.com/p/women-s-belt-chic-all-match-croco-pin-buckle-belt-accessory-g1316752.html,Women's Belt Chic All Match Croco Pin Buckle Belt Accessory,Belts
27,$3.99,$11.99,https://www.jollychic.com/p/women-s-belt-retro-chic-all-match-croco-pin-buckle-thin-belt-accessory-g1316754.html,Women's Belt Retro Chic All Match Croco Pin Buckle Thin Belt Accessory,Belts
5,$5.99,$16.99,https://www.jollychic.com/p/women-s-belt-solid-color-simple-style-all-match-chic-belt-accessory-g1321446.html,Women's Belt Solid Color Simple Style All Match Chic Belt Accessory,Belts
4,$5.99,$15.99,https://www.jollychic.com/p/women-s-belt-solid-color-woven-style-retro-chic-belt-accessory-g1321472.html,Women's Belt Solid Color Woven Style Retro Chic Belt Accessory,Belts
3,$6.99,$18.99,https://www.jollychic.com/p/women-s-belt-simple-style-top-fashion-canvas-bet-accessory-g1321498.html,Women's Belt Simple Style Top Fashion Canvas Bet Accessory,Belts
8,$9.99,$30.99,https://www.jollychic.com/p/women-s-belt-solid-color-faux-leather-retro-belt-accessory-g1323510.html,Women's Belt Solid Color Faux Leather Retro Belt Accessory,Belts
9,$5.99,$15.99,https://www.jollychic.com/p/women-s-corset-solid-color-bow-design-retro-belt-accessory-g1323532.html,Women's Corset Solid Color Bow Design Retro Belt Accessory,Belts
5,$5.99,$15.99,https://www.jollychic.com/p/women-s-belt-solid-color-bow-design-retro-all-match-belt-accessory-g1323538.html,Women's Belt Solid Color Bow Design Retro All Match Belt Accessory,Belts
14,$3.99,$11.99,https://www.jollychic.com/p/women-s-belt-chic-all-match-retro-croco-pin-buckle-thin-belt-accessory-g1326920.html,Women's Belt Chic All Match Retro Croco Pin Buckle Thin Belt Accessory,Belts
24,$3.99,$11.99,https://www.jollychic.com/p/women-s-belt-chic-retro-croco-pin-buckle-all-match-thin-belt-accessory-g1326922.html,Women's Belt Chic Retro Croco Pin Buckle All Match Thin Belt Accessory,Belts
8,$4.99,$14.99,https://www.jollychic.com/p/women-s-corset-sweet-style-hollowed-out-heart-shaped-vogue-accessory-g1336880.html,Women's Corset Sweet Style Hollowed Out Heart Shaped Vogue Accessory,Belts
2,$3.99,$12.99,https://www.jollychic.com/p/women-s-corset-brief-style-fashionable-rhinestone-inlay-elegant-accessory-g1336882.html,Women's Corset Brief Style Fashionable Rhinestone Inlay Elegant Accessory,Belts
7,$4.99,$14.99,https://www.jollychic.com/p/women-s-belt-simple-style-candy-color-all-matched-vogue-accessory-g1336890.html,Women's Belt Simple Style Candy Color All Matched Vogue Accessory,Belts
2,$2.99,$10.99,https://www.jollychic.com/p/women-s-belt-ladylike-bow-knot-all-match-sweet-style-vogue-accessory-g1336916.html,Women's Belt Ladylike Bow Knot All Match Sweet Style Vogue Accessory,Belts
4,$18.99,,https://www.jollychic.com/p/women-s-corset-thin-metal-decoration-elegant-all-match-accessory-g1345618.html,Women's Corset Thin Metal Decoration Elegant All Match Accessory,Belts
11,$18.99,,https://www.jollychic.com/p/women-s-corset-color-block-brief-style-all-match-accessory-g1345624.html,Women's Corset Color Block Brief Style All Match Accessory,Belts
5,$20.99,,https://www.jollychic.com/p/women-s-belt-thin-metal-decoration-all-match-fashionable-accessory-g1345626.html,Women's Belt Thin Metal Decoration All Match Fashionable Accessory,Belts
31,$3.99,$11.99,https://www.jollychic.com/p/women-s-belt-simple-solid-vintage-design-soft-belt-accessory-g1367026.html,Women's Belt Simple Solid Vintage Design Soft Belt Accessory,Belts
14,$6.99,$16.99,https://www.jollychic.com/p/women-s-corset-circle-decoration-brief-design-all-match-faddish-belt-accessory-g1371730.html,Women's Corset Circle Decoration Brief Design All Match Faddish Belt Accessory,Belts
6,$22.99,,https://www.jollychic.com/p/women-s-jeans-belt-sweet-style-all-matched-knitted-thin-belt-accessory-g1377136.html,Women's Jeans Belt Sweet Style All Matched Knitted Thin Belt Accessory,Belts
2,$32.99,,https://www.jollychic.com/p/women-s-belt-chic-all-match-solid-color-cattlehide-pin-buckle-belt-accessory-g1402500.html,Women's Belt Chic All Match Solid Color Cattlehide Pin Buckle Belt Accessory,Belts
2,$34.99,,https://www.jollychic.com/p/women-s-belt-chic-all-match-solid-color-cattlehide-crown-pin-buckle-belt-accessory-g1402504.html,Women's Belt Chic All Match Solid Color Cattlehide Crown Pin Buckle Belt Accessory,Belts
3,$4.99,$13.99,https://www.jollychic.com/p/women-s-jeans-belt-pu-solid-color-simple-style-all-match-varsity-belt-g1407344.html,Women's Jeans Belt PU Solid Color Simple Style All Match Varsity Belt,Belts
16,$14.99,,https://www.jollychic.com/p/women-s-corset-retro-style-color-block-sweet-faddish-ladylike-accessory-g1450622.html,Women's Corset Retro Style Color Block Sweet Faddish Ladylike Accessory,Belts
6,$12.99,,https://www.jollychic.com/p/women-s-belt-retro-style-rivet-decorative-faddish-ladylike-accessory-g1452984.html,Women's Belt Retro Style Rivet Decorative Faddish Ladylike Accessory,Belts
3,$8.99,,https://www.jollychic.com/p/women-s-chain-brief-solid-color-sweet-faddish-ladylike-accessory-g1452986.html,Women's Chain Brief Solid Color Sweet Faddish Ladylike Accessory,Belts
1,$11.99,,https://www.jollychic.com/p/women-s-corset-faddish-retro-style-solid-color-sweet-ladylike-brief-accessory-g1452988.html,Women's Corset Faddish Retro Style Solid Color Sweet Ladylike Brief Accessory,Belts
1,$12.99,,https://www.jollychic.com/p/women-s-corset-retro-style-solid-color-sweet-faddish-ladylike-accessory-g1452990.html,Women's Corset Retro Style Solid Color Sweet Faddish Ladylike Accessory,Belts
2,$11.99,,https://www.jollychic.com/p/women-s-corset-rhinestone-decorative-faddish-patchwork-all-match-accessory-g1452992.html,Women's Corset Rhinestone Decorative Faddish Patchwork All Match Accessory,Belts
6,$11.99,,https://www.jollychic.com/p/women-s-corset-brief-solid-color-patchwork-faddish-ladylike-accessory-g1452998.html,Women's Corset Brief Solid Color Patchwork Faddish Ladylike Accessory,Belts
2,$38.99,,https://www.jollychic.com/p/women-s-corset-brief-solid-color-retro-patchwork-faddish-ladylike-accessory-g1454586.html,Women's Corset Brief Solid Color Retro Patchwork Faddish Ladylike Accessory,Belts
2,$38.99,,https://www.jollychic.com/p/women-s-corset-retro-style-solid-color-sweet-faddish-ladylike-accessory-g1454588.html,Women's Corset Retro Style Solid Color Sweet Faddish Ladylike Accessory,Belts
1,$12.99,,https://www.jollychic.com/p/women-s-corset-bowknot-decorative-sweet-style-ladylike-trendy-accessory-g1454590.html,Women's Corset Bowknot Decorative Sweet Style Ladylike Trendy Accessory,Belts
0,$10.99,,https://www.jollychic.com/p/women-s-belt-brief-style-hollow-out-jeans-faddish-ladylike-accessory-g1455624.html,Women's Belt Brief Style Hollow Out Jeans Faddish Ladylike Accessory,Belts
1,$33.99,,https://www.jollychic.com/p/women-s-jeans-belt-all-match-top-fashion-chic-original-stylish-classic-belt-g1466014.html,Women's Jeans Belt All Match Top Fashion Chic Original Stylish Classic Belt,Belts
7,$22.99,,https://www.jollychic.com/p/women-s-jeans-belt-all-match-top-fashion-rose-pattern-chic-original-stylish-classic-belt-g1466088.html,Women's Jeans Belt All Match Top Fashion Rose Pattern Chic Original Stylish Classic Belt,Belts
3,$31.99,,https://www.jollychic.com/p/women-s-jeans-belt-all-match-top-fashion-chic-original-stylish-classic-belt-g1466090.html,Women's Jeans Belt All Match Top Fashion Chic Original Stylish Classic Belt,Belts
19,$17.99,,https://www.jollychic.com/p/women-s-jeans-belt-colorful-floral-leopard-pattern-all-match-faddish-jeans-belt-g1477134.html,Women's Jeans Belt Colorful Floral Leopard Pattern All Match Faddish Jeans Belt,Belts
1,$18.99,,https://www.jollychic.com/p/women-s-corset-hollow-out-pin-buckle-design-simple-sweet-style-accessory-g1484596.html,Women's Corset Hollow Out Pin Buckle Design Simple Sweet Style Accessory,Belts
1,$25.99,,https://www.jollychic.com/p/women-s-corset-wide-comfy-patchwork-design-elastic-belt-accessory-g1484598.html,Women's Corset Wide Comfy Patchwork Design Elastic Belt Accessory,Belts
2,$28.99,,https://www.jollychic.com/p/women-s-corset-rivets-round-ring-decor-wide-elastic-belt-accessory-g1484602.html,Women's Corset Rivets Round Ring Decor Wide Elastic Belt Accessory,Belts
1,$28.99,,https://www.jollychic.com/p/women-s-corset-simple-solid-color-smooth-buckle-design-casual-elastic-belt-accessory-g1484604.html,Women's Corset Simple Solid Color Smooth Buckle Design Casual Elastic Belt Accessory,Belts
4,$9.99,,https://www.jollychic.com/p/women-s-jean-belt-imitation-gemstone-flower-decor-ladylike-style-trendy-accessory-g1484752.html,Women's Jean Belt Imitation Gemstone Flower Decor Ladylike Style Trendy Accessory,Belts
14,$7.99,$21.99,https://www.jollychic.com/p/women-s-jeans-belt-stripe-check-pattern-patchwork-all-match-jeans-belt-g1486876.html,Women's Jeans Belt Stripe Check Pattern Patchwork All Match Jeans Belt,Belts
7,$14.99,$28.99,https://www.jollychic.com/p/women-s-corset-floral-embroidery-beading-design-vintage-style-all-match-stylish-accessory-g1491802.html,Women's Corset Floral Embroidery Beading Design Vintage Style All Match Stylish Accessory,Belts
16,$11.99,$17.99,https://www.jollychic.com/p/women-s-jeans-belt-classic-unique-brief-design-circle-top-fashion-alloy-pretty-belt-accessory-g1498116.html,Women's Jeans Belt Classic Unique Brief Design Circle Top Fashion Alloy Pretty Belt Accessory,Belts
12,$11.99,$17.99,https://www.jollychic.com/p/women-s-jeans-belt-fashionable-solid-all-match-hollow-out-brief-design-sweet-belt-accessory-g1498130.html,Women's Jeans Belt Fashionable Solid All Match Hollow Out Brief Design Sweet Belt Accessory,Belts
11,$15.99,$23.99,https://www.jollychic.com/p/women-s-jeans-belt-solid-color-all-matched-pin-buckle-belt-g1548312.html,Women's Jeans Belt Solid Color All Matched Pin Buckle Belt,Belts
15,$11.99,$17.99,https://www.jollychic.com/p/woemn-s-jeans-belt-stylish-rivets-decor-chic-belt-accessory-g1548316.html,Woemn's Jeans Belt Stylish Rivets Decor Chic Belt Accessory,Belts
12,$15.99,$23.99,https://www.jollychic.com/p/women-s-jeans-belt-fashion-rivets-decor-pin-buckle-trendy-belt-g1548322.html,Women's Jeans Belt Fashion Rivets Decor Pin Buckle Trendy Belt,Belts
2,$18.99,$28.99,https://www.jollychic.com/p/women-s-jeans-belt-all-match-comfy-rhinestones-breathable-accessory-g1548556.html,Women's Jeans Belt All Match Comfy Rhinestones Breathable Accessory,Belts
6,$8.99,$12.99,https://www.jollychic.com/p/women-s-jeans-belt-all-match-comfy-simple-breathable-accessory-g1548562.html,Women's Jeans Belt All Match Comfy Simple Breathable Accessory,Belts
1,$8.99,$12.99,https://www.jollychic.com/p/women-s-jeans-belt-all-match-comfy-rhinestones-bow-pattern-breathable-accessory-g1548570.html,Women's Jeans Belt All Match Comfy Rhinestones Bow Pattern Breathable Accessory,Belts
1,$7.99,$11.99,https://www.jollychic.com/p/women-s-jeans-belt-all-match-comfy-basic-simple-breathable-accessory-g1548576.html,Women's Jeans Belt All Match Comfy Basic Simple Breathable Accessory,Belts
3,$8.99,$12.99,https://www.jollychic.com/p/women-s-jeans-belt-all-match-comfy-simple-vintage-breathable-accessory-g1548596.html,Women's Jeans Belt All Match Comfy Simple Vintage Breathable Accessory,Belts
1,$7.99,$11.99,https://www.jollychic.com/p/women-s-jeans-belt-all-match-candy-color-basic-simple-breathable-accessory-g1548598.html,Women's Jeans Belt All Match Candy Color Basic Simple Breathable Accessory,Belts
3,$7.99,$10.99,https://www.jollychic.com/p/women-s-jeans-belt-all-match-hollow-out-basic-simple-heart-pattern-breathable-accessory-g1548602.html,Women's Jeans Belt All Match Hollow Out Basic Simple Heart Pattern Breathable Accessory,Belts
2,$10.99,$15.99,https://www.jollychic.com/p/women-s-jeans-belt-hollow-out-vintage-style-heart-buckle-design-elegant-belt-accessory-g1561762.html,Women's Jeans Belt Hollow Out Vintage Style Heart Buckle Design Elegant Belt Accessory,Belts
247,$7.99,,https://www.jollychic.com/p/euro-style-imitation-leather-joint-mental-waist-belt-g36288.html,Euro Style Imitation Leather Joint Mental Waist Belt,Belts
1633,$8.99,$12.99,https://www.jollychic.com/p/delicate-sleek-metallic-floral-carved-luxury-women-s-cinch-belt-g288006.html,Delicate Sleek Metallic Floral Carved Luxury Women's Cinch Belt,Belts
172,$4.99,$18.99,https://www.jollychic.com/p/thin-winsome-groovy-peculiar-ladylike-belt-for-women-g292566.html,Thin Winsome Groovy Peculiar Ladylike Belt For Women,Belts
179,$6.99,,https://www.jollychic.com/p/women-s-cinch-belt-casual-brown-woven-belt-accessory-g497520.html,Women's Cinch Belt Casual Brown Woven Belt Accessory,Belts
136,$6.99,$16.99,https://www.jollychic.com/p/women-s-jeans-belt-metal-rivet-retro-style-belt-accessory-g499364.html,Women's Jeans Belt Metal Rivet Retro Style Belt Accessory,Belts
89,$2.99,$13.99,https://www.jollychic.com/p/women-s-belts-rhinestones-decor-stylish-wide-waist-belts-accessory-g757994.html,Women's Belts Rhinestones Decor Stylish Wide Waist Belts Accessory,Belts
106,$4.99,$13.99,https://www.jollychic.com/p/women-s-belts-rhinestones-ornament-peach-heart-stylish-belt-accessory-g758270.html,Women's Belts Rhinestones Ornament Peach Heart Stylish Belt Accessory,Belts
66,$14.99,$31.99,https://www.jollychic.com/p/women-s-waist-chain-retro-hollowed-tassel-pendant-coin-decor-accessory-g896590.html,Women's Waist Chain Retro Hollowed Tassel Pendant Coin Decor Accessory,Belts
66,$31.99,$52.00,https://www.jollychic.com/p/women-s-belt-vintage-flower-embroidery-handmade-fancy-decorative-belt-g933426.html,Women's Belt Vintage Flower Embroidery Handmade Fancy Decorative Belt,Belts
19,$5.99,$13.99,https://www.jollychic.com/p/women-s-belt-solid-color-rose-pattern-embossed-center-bar-buckled-belt-accessory-g1026704.html,Women's Belt Solid Color Rose Pattern Embossed Center Bar Buckled Belt Accessory,Belts
6,$16.99,$25.99,https://www.jollychic.com/p/women-s-belt-simple-style-all-match-solid-color-square-buckle-trendy-accessory-g1162034.html,Women's Belt Simple Style All Match Solid Color Square Buckle Trendy Accessory,Belts
12,$16.99,$25.99,https://www.jollychic.com/p/women-s-belt-all-match-love-heart-shape-hollowed-faddish-leather-accessory-g1162036.html,Women's Belt All Match Love Heart Shape Hollowed Faddish Leather Accessory,Belts
4,$16.99,$25.99,https://www.jollychic.com/p/women-s-belt-all-match-solid-color-hollowed-out-leather-accessory-g1162038.html,Women's Belt All Match Solid Color Hollowed Out Leather Accessory,Belts
17,$25.99,$39.99,https://www.jollychic.com/p/women-s-cinch-belts-rhinestone-ornament-elastic-belt-accessory-g1181072.html,Women's Cinch Belts Rhinestone Ornament Elastic Belt Accessory,Belts
15,$11.99,$18.99,https://www.jollychic.com/p/women-s-belts-heart-decoration-all-match-waist-belt-accessory-g1181078.html,Women's Belts Heart Decoration All Match Waist Belt Accessory,Belts
19,$18.99,,https://www.jollychic.com/p/women-s-corset-casual-style-all-matched-trendy-lace-up-belt-accessory-g1187602.html,Women's Corset Casual Style All Matched Trendy Lace Up Belt Accessory,Belts
7,$18.99,$28.99,https://www.jollychic.com/p/women-s-belt-solid-color-retro-style-brief-all-match-trendy-accessory-g1233856.html,Women's Belt Solid Color Retro Style Brief All Match Trendy Accessory,Belts
19,$16.99,$25.99,https://www.jollychic.com/p/women-s-belt-geometry-pattern-retro-style-ladylike-accessory-g1233860.html,Women's Belt Geometry Pattern Retro Style Ladylike Accessory,Belts
15,$6.99,$22.99,https://www.jollychic.com/p/women-s-belt-brief-style-casual-all-matched-fashionable-belt-accessory-g1305700.html,Women's Belt Brief Style Casual All Matched Fashionable Belt Accessory,Belts
3,$5.99,$15.99,https://www.jollychic.com/p/women-s-belt-solid-color-simple-style-all-matched-chic-belt-accessory-g1305702.html,Women's Belt Solid Color Simple Style All Matched Chic Belt Accessory,Belts
8,$5.99,$16.99,https://www.jollychic.com/p/women-s-belt-solid-color-brief-style-bow-knot-belt-accessory-g1305706.html,Women's Belt Solid Color Brief Style Bow Knot Belt Accessory,Belts
9,$6.99,$18.99,https://www.jollychic.com/p/women-s-corset-elegant-all-match-geometric-pattern-buckle-faddish-accessory-g1305990.html,Women's Corset Elegant All Match Geometric Pattern Buckle Faddish Accessory,Belts
7,$11.99,$31.99,https://www.jollychic.com/p/women-s-belt-british-style-casual-all-match-candy-color-vogue-pin-buckle-accessory-g1313272.html,Women's Belt British Style Casual All Match Candy Color Vogue Pin Buckle Accessory,Belts
4,$12.99,$32.99,https://www.jollychic.com/p/women-s-belt-chic-all-match-metallic-ring-pendant-pin-buckle-thin-belt-accessory-g1313274.html,Women's Belt Chic All Match Metallic Ring Pendant Pin Buckle Thin Belt Accessory,Belts
7,$6.99,$18.99,https://www.jollychic.com/p/women-s-corset-sweet-style-vogue-flower-ornament-bold-belt-accessory-g1313312.html,Women's Corset Sweet Style Vogue Flower Ornament Bold Belt Accessory,Belts
4,$5.99,$17.99,https://www.jollychic.com/p/women-s-corset-vintage-brief-style-all-match-trendy-bold-belt-accessory-g1313324.html,Women's Corset Vintage Brief Style All Match Trendy Bold Belt Accessory,Belts
16,$5.99,$16.99,https://www.jollychic.com/p/women-s-belt-candy-color-fresh-style-casual-fashionable-belt-accessory-g1313390.html,Women's Belt Candy Color Fresh Style Casual Fashionable Belt Accessory,Belts
18,$5.99,$16.99,https://www.jollychic.com/p/women-s-belt-chain-vintage-fashionable-all-matched-knitted-tassel-accessory-g1313412.html,Women's Belt Chain Vintage Fashionable All Matched Knitted Tassel Accessory,Belts
5,$4.99,$14.99,https://www.jollychic.com/p/women-s-belt-chain-retro-style-fashionable-beaded-belt-accessory-g1313424.html,Women's Belt Chain Retro Style Fashionable Beaded Belt Accessory,Belts
20,$5.99,$16.99,https://www.jollychic.com/p/women-s-belt-personalized-brief-style-circular-buckle-all-match-faddish-accessory-g1313438.html,Women's Belt Personalized Brief Style Circular Buckle All Match Faddish Accessory,Belts
20,$5.99,$15.99,https://www.jollychic.com/p/women-s-jeans-belt-solid-color-stylish-tassel-patched-woven-belt-accessory-g1321438.html,Women's Jeans Belt Solid Color Stylish Tassel Patched Woven Belt Accessory,Belts
15,$4.99,$14.99,https://www.jollychic.com/p/women-s-belt-solid-color-top-fashion-woven-stylish-accessory-g1321454.html,Women's Belt Solid Color Top Fashion Woven Stylish Accessory,Belts
