add_wish,discount_price,original_price,product_link,product_name,header_block
11,$9.99,,http://www.jollychic.com/p/women-s-swimwear-color-block-striped-bow-comfortable-beach-shorts-g966718.html,Women's Swimwear Color Block Striped Bow Comfortable Beach Shorts,Beachwear
16,$21.99,,http://www.jollychic.com/p/women-s-2-pcs-swimwear-sequins-pentangle-pattern-simple-comfy-bikini-set-g977584.html,Women's 2 Pcs Swimwear Sequins Pentangle Pattern Simple Comfy Bikini Set,Beachwear
22,$28.99,,http://www.jollychic.com/p/women-s-3pcs-swimwear-plus-size-color-block-sleeveless-back-hollow-out-tankini-set-g982262.html,Women's 3Pcs Swimwear Plus Size Color Block Sleeveless Back Hollow Out Tankini Set,Beachwear
87,$29.99,,http://www.jollychic.com/p/women-s-swimwear-set-color-block-checkered-halterneck-high-waist-sexy-tankini-set-g982276.html,Women's Swimwear Set Color Block Checkered Halterneck High Waist Sexy Tankini Set,Beachwear
88,$15.99,,http://www.jollychic.com/p/women-s-swimwear-set-floral-high-waist-underwire-padded-sexy-bikini-set-g983220.html,Women's Swimwear Set Floral High Waist Underwire Padded Sexy Bikini Set,Beachwear
12,$18.99,,http://www.jollychic.com/p/women-s-swimwear-set-sweet-candy-color-floral-halterneck-backless-tankini-set-g984110.html,Women's Swimwear Set Sweet Candy Color Floral Halterneck Backless Tankini Set,Beachwear
366,$9.99,$13.99,http://www.jollychic.com/p/women-s-swimwear-set-floral-halterneck-high-waist-wireless-padded-sexy-bikini-set-g984390.html,Women's Swimwear Set Floral Halterneck High Waist Wireless Padded Sexy Bikini Set,Beachwear
27,$16.99,,http://www.jollychic.com/p/women-s-swimwear-set-color-block-drawstring-halterneck-sexy-bikini-set-g984690.html,Women's Swimwear Set Color Block Drawstring Halterneck Sexy Bikini Set,Beachwear
89,$19.99,,http://www.jollychic.com/p/women-s-swimwear-solid-black-ruffles-hem-halterneck-backless-one-piece-tankini-g988372.html,Women's Swimwear Solid Black Ruffles Hem Halterneck Backless One Piece Tankini,Beachwear
55,$14.99,,http://www.jollychic.com/p/women-s-swimwear-blouse-floral-pattern-deep-v-half-sleeve-loose-cover-up-g995260.html,Women's Swimwear Blouse Floral Pattern Deep V Half Sleeve Loose Cover Up,Beachwear
8,$33.99,,http://www.jollychic.com/p/women-s-swimwear-bathing-suit-embroidery-cover-up-g1000194.html,Women's Swimwear Bathing Suit Embroidery Cover Up,Beachwear
179,$26.99,,http://www.jollychic.com/p/women-s-2-pcs-swimwear-high-waist-polka-dots-bow-ornament-bikini-swimsuit-g1000596.html,Women's 2 Pcs Swimwear High Waist Polka Dots Bow Ornament Bikini Swimsuit,Beachwear
30,$13.99,,http://www.jollychic.com/p/women-s-swimwear-set-black-criss-cross-deep-v-halterneck-sexy-bikini-set-g1008854.html,Women's Swimwear Set Black Criss Cross Deep V Halterneck Sexy Bikini Set,Beachwear
36,$22.99,,http://www.jollychic.com/p/women-s-swimwear-vintage-retro-boho-geometric-halterneck-one-piece-swimsuit-g1008902.html,Women's Swimwear Vintage Retro Boho Geometric Halterneck One Piece Swimsuit,Beachwear
37,$20.99,,http://www.jollychic.com/p/women-s-swimwear-set-pure-color-hollow-out-triangle-cup-sexy-bikini-set-g1014836.html,Women's Swimwear Set Pure Color Hollow Out Triangle Cup Sexy Bikini Set,Beachwear
13,$8.99,,http://www.jollychic.com/p/women-s-swimwear-brief-solid-color-sexy-bikini-bottom-g1015402.html,Women's Swimwear Brief Solid Color Sexy Bikini Bottom,Beachwear
26,$20.99,,http://www.jollychic.com/p/women-s-swimwear-sexy-solid-color-hollow-out-halterneck-one-piece-tankini-g1015408.html,Women's Swimwear Sexy Solid Color Hollow Out Halterneck One Piece Tankini,Beachwear
104,$35.99,,http://www.jollychic.com/p/women-s-2-pcs-sports-swimsuit-colorblock-short-sleeve-o-neck-tankini-set-g1051752.html,Women's 2 Pcs Sports Swimsuit Colorblock Short Sleeve O Neck Tankini Set,Beachwear
18,$22.99,,http://www.jollychic.com/p/women-s-2-pcs-swimsuit-colorblock-striped-pattern-underwired-bow-sexy-bikini-set-g1063246.html,Women's 2 Pcs Swimsuit Colorblock Striped Pattern Underwired Bow Sexy Bikini Set,Beachwear
12,$22.99,,http://www.jollychic.com/p/women-s-2-pcs-swimsuit-colorblock-geometric-pattern-adjustable-push-up-sexy-bikini-set-g1063258.html,Women's 2 Pcs Swimsuit Colorblock Geometric Pattern Adjustable Push Up Sexy Bikini Set,Beachwear
24,$33.99,,http://www.jollychic.com/p/women-s-swimwear-colorblock-sleeveless-backless-ruffles-decor-one-piece-swimdress-g1091532.html,Women's Swimwear Colorblock Sleeveless Backless Ruffles Decor One Piece Swimdress,Beachwear
14,$23.99,,http://www.jollychic.com/p/women-s-swimwear-color-block-vintage-mermaid-pattern-halterneck-bikini-set-g1100100.html,Women's Swimwear Color Block Vintage Mermaid Pattern Halterneck Bikini Set,Beachwear
18,$21.99,,http://www.jollychic.com/p/women-s-swimwear-set-strappy-crossover-straps-triangle-cup-sexy-bikini-set-g1109928.html,Women's Swimwear Set Strappy Crossover Straps Triangle Cup Sexy Bikini Set,Beachwear
23,$17.99,,http://www.jollychic.com/p/women-s-swimwear-off-shoulder-short-sleeve-beach-faddish-cover-up-dress-g1109950.html,Women's Swimwear Off Shoulder Short Sleeve Beach Faddish Cover Up Dress,Beachwear
31,$17.99,,http://www.jollychic.com/p/women-s-swimwear-set-vintage-floral-ruffles-spaghetti-straps-sexy-bikini-set-g1109952.html,Women's Swimwear Set Vintage Floral Ruffles Spaghetti Straps Sexy Bikini Set,Beachwear
9,$24.99,,http://www.jollychic.com/p/women-s-swimwear-set-vintage-color-block-halter-triangle-cup-sexy-bikini-set-g1116474.html,Women's Swimwear Set Vintage Color Block Halter Triangle Cup Sexy Bikini Set,Beachwear
19,$13.99,$18.99,http://www.jollychic.com/p/women-s-swimwear-solid-white-o-neck-short-sleeve-hollow-out-cover-up-dress-g1163152.html,Women's Swimwear Solid White O Neck Short Sleeve Hollow Out Cover Up Dress,Beachwear
10,$13.99,$18.99,http://www.jollychic.com/p/women-s-swimwear-vintage-print-three-quarter-sleeve-front-open-cover-up-g1163154.html,Women's Swimwear Vintage Print Three Quarter Sleeve Front Open Cover Up,Beachwear
13,$20.99,,http://www.jollychic.com/p/women-s-2-pcs-swimsuit-solid-color-backless-front-bow-ornament-sexy-bikini-set-g1169726.html,Women's 2 Pcs Swimsuit Solid Color Backless Front Bow Ornament Sexy Bikini Set,Beachwear
44,$19.99,$33.99,http://www.jollychic.com/p/women-s-swimwear-color-block-hollow-out-sexy-beach-cover-up-g1195438.html,Women's Swimwear Color Block Hollow Out Sexy Beach Cover Up,Beachwear
5,$9.99,$14.99,http://www.jollychic.com/p/women-s-swimwear-set-sexy-flora-deep-v-halterneck-vintage-bikini-suit-g1230270.html,Women's Swimwear Set Sexy Flora Deep V Halterneck Vintage Bikini Suit,Beachwear
4,$23.99,$36.99,http://www.jollychic.com/p/women-s-swimwear-color-block-polka-dots-halterneck-irregular-hem-swim-dress-g1247162.html,Women's Swimwear Color Block Polka Dots Halterneck Irregular Hem Swim Dress,Beachwear
109,$3.99,$7.99,http://www.jollychic.com/p/sweet-floral-pattern-slim-cool-bikini-panties-g174275.html,Sweet Floral Pattern Slim Cool Bikini Panties,Beachwear
482,$5.99,,http://www.jollychic.com/p/personalized-design-hollow-out-swimwear-hat-g265775.html,Personalized Design Hollow Out Swimwear Hat,Beachwear
1425,$8.99,$27.99,http://www.jollychic.com/p/low-waist-padded-swimwear-set-g267411.html,Low Waist Padded Swimwear Set,Beachwear
440,$9.99,$22.99,http://www.jollychic.com/p/print-sleeveless-one-piece-swimsuit-with-skirt-overlay-g331522.html,Print Sleeveless One Piece Swimsuit With Skirt Overlay,Beachwear
733,$13.99,$22.99,http://www.jollychic.com/p/front-zipper-hollow-out-side-long-sleeve-one-piece-swimwear-g339022.html,Front Zipper Hollow Out Side Long Sleeve One Piece Swimwear,Beachwear
246,$16.99,$22.99,http://www.jollychic.com/p/women-s-chiffon-print-long-sleeve-bikini-veil-g355062.html,Women's Chiffon Print Long Sleeve Bikini Veil,Beachwear
1008,$13.99,$21.99,http://www.jollychic.com/p/women-s-floral-halter-two-piece-swimwear-g360070.html,Women's Floral Halter Two Piece Swimwear,Beachwear
396,$7.99,$9.99,http://www.jollychic.com/p/women-s-classic-striped-halterneck-bikini-g372356.html,Women's Classic Striped Halterneck Bikini,Beachwear
400,$10.99,$15.99,http://www.jollychic.com/p/women-s-handmade-sennit-strapless-halter-bikini-g407096.html,Women's Handmade Sennit Strapless Halter Bikini,Beachwear
675,$30.99,$45.99,http://www.jollychic.com/p/women-s-muslim-plus-size-solid-ruffles-conservative-swimwear-suit-g433720.html,Women's Muslim Plus Size Solid Ruffles Conservative Swimwear Suit,Beachwear
410,$16.99,$27.99,http://www.jollychic.com/p/women-s-swimwear-dress-irregular-ruffles-one-piece-swimwear-dress-g482356.html,Women's Swimwear Dress Irregular Ruffles One-Piece Swimwear Dress,Beachwear
381,$9.99,$15.99,http://www.jollychic.com/p/women-s-swimwear-mesh-patchwork-tassels-ornament-halt-bikinis-g482414.html,Women's Swimwear Mesh Patchwork Tassels Ornament Halt Bikinis,Beachwear
586,$10.99,$18.99,http://www.jollychic.com/p/women-s-swimwear-halter-neck-high-waist-casual-style-sweet-floral-tankini-g499212.html,Women's Swimwear Halter Neck High Waist Casual Style Sweet Floral Tankini,Beachwear
260,$24.99,$30.99,http://www.jollychic.com/p/women-s-swimwear-3pcs-cute-short-sleeve-letter-print-swimwear-g511122.html,Women's Swimwear 3Pcs Cute Short Sleeve Letter Print Swimwear,Beachwear
106,$15.99,$24.99,http://www.jollychic.com/p/women-s-swimwear-color-block-one-piece-tankini-g524508.html,Women's Swimwear Color Block One Piece Tankini,Beachwear
130,$12.99,$18.99,http://www.jollychic.com/p/women-s-swimwear-hollow-out-floral-pattern-sexy-bikini-bra-g541182.html,Women's Swimwear Hollow Out Floral Pattern Sexy Bikini Bra,Beachwear
52,$27.99,,http://www.jollychic.com/p/women-s-swimwear-solid-color-hollow-out-sexy-one-piece-tankini-g541870.html,Women's Swimwear Solid Color Hollow Out Sexy One Piece Tankini,Beachwear
807,$16.99,$27.99,http://www.jollychic.com/p/women-s-swimwear-prints-flounce-detachable-padded-vintage-tankini-g551102.html,Women's Swimwear Prints Flounce Detachable Padded Vintage Tankini,Beachwear
87,$27.99,,http://www.jollychic.com/p/women-s-swimwear-print-racerback-spaghetti-straps-detachable-padded-tankini-g551152.html,Women's Swimwear Print Racerback Spaghetti Straps Detachable Padded Tankini,Beachwear
276,$18.99,$31.99,http://www.jollychic.com/p/women-s-swimwear-slip-strapless-patchwork-tankini-g594048.html,Women's Swimwear Slip Strapless Patchwork Tankini,Beachwear
386,$6.99,$18.99,http://www.jollychic.com/p/women-s-swimwear-suit-coconut-tree-pattern-spaghetti-straps-tankini-set-g605596.html,Women's Swimwear Suit Coconut Tree Pattern Spaghetti Straps Tankini Set,Beachwear
265,$10.99,$17.99,http://www.jollychic.com/p/women-s-swimsuit-floral-pattern-hollow-out-halterneck-sexy-bikini-set-g605646.html,Women's Swimsuit Floral Pattern Hollow Out Halterneck Sexy Bikini Set,Beachwear
199,$24.99,$37.99,http://www.jollychic.com/p/women-s-3pcs-swimwear-floral-sleeveless-cover-ups-dress-halter-sweet-bikini-suit-g613992.html,Women's 3Pcs Swimwear Floral Sleeveless Cover Ups Dress Halter Sweet Bikini Suit,Beachwear
46,$24.99,,http://www.jollychic.com/p/women-s-3pcs-swimwear-floral-hollow-out-cover-ups-dress-solid-halter-bikini-suit-g627506.html,Women's 3Pcs Swimwear Floral Hollow Out Cover Ups Dress Solid Halter Bikini Suit,Beachwear
332,$10.99,$21.99,http://www.jollychic.com/p/women-s-swimwear-one-shoulder-striped-cascading-ruffle-one-pieces-tankini-g663430.html,Women's Swimwear One Shoulder Striped Cascading Ruffle One Pieces Tankini,Beachwear
40,$27.99,,http://www.jollychic.com/p/women-s-swimwear-black-one-shoulder-side-hollow-out-slim-one-piece-tankini-g685698.html,Women's Swimwear Black One Shoulder Side Hollow Out Slim One Piece Tankini,Beachwear
43,$19.99,$28.99,http://www.jollychic.com/p/women-s-swimwear-black-strapless-hollow-out-slim-sexy-one-piece-tankini-g685702.html,Women's Swimwear Black Strapless Hollow Out Slim Sexy One Piece Tankini,Beachwear
19,$18.99,,http://www.jollychic.com/p/women-s-swimwear-crossover-solid-backless-sexy-breathable-bra-g685760.html,Women's Swimwear Crossover Solid Backless Sexy Breathable Bra,Beachwear
107,$13.99,$21.99,http://www.jollychic.com/p/women-s-swimwear-color-block-button-three-quarters-sleeve-long-beach-cover-ups-g738648.html,Women's Swimwear Color Block Button Three Quarters Sleeve Long Beach Cover Ups,Beachwear
82,$18.99,$30.99,http://www.jollychic.com/p/women-s-3pcs-swimwear-color-block-short-sleeve-cover-up-padded-casual-swim-set-g743050.html,Women's 3Pcs Swimwear Color Block Short Sleeve Cover Up Padded Casual Swim Set,Beachwear
41,$32.99,,http://www.jollychic.com/p/women-s-plus-size-swimwear-sweet-patchwork-short-sleeve-hollow-out-swim-dress-g751170.html,Women's Plus Size Swimwear Sweet Patchwork Short Sleeve Hollow Out Swim Dress,Beachwear
123,$17.99,$26.99,http://www.jollychic.com/p/women-s-swimwear-pure-color-sweet-ruffles-tassel-halterneck-high-waist-tankini-set-g751678.html,Women's Swimwear Pure Color Sweet Ruffles Tassel Halterneck High Waist Tankini Set,Beachwear
71,$21.99,,http://www.jollychic.com/p/women-s-swimwear-beach-solid-lace-long-sleeve-hollow-out-cover-ups-g776628.html,Women's Swimwear Beach Solid Lace Long Sleeve Hollow Out Cover Ups,Beachwear
65,$19.99,,http://www.jollychic.com/p/women-s-swimwear-solid-sexy-embroidery-long-sleeve-comfy-cover-ups-g776634.html,Women's Swimwear Solid Sexy Embroidery Long Sleeve Comfy Cover Ups,Beachwear
251,$14.99,$22.99,http://www.jollychic.com/p/women-s-swimwear-backless-halterneck-solid-slim-sexy-one-pieces-swimsuit-g791592.html,Women's Swimwear Backless Halterneck Solid Slim Sexy One Pieces Swimsuit,Beachwear
31,$22.99,,http://www.jollychic.com/p/women-s-swimwear-cute-cherry-pattern-halterneck-slim-one-piece-tankini-g794802.html,Women's Swimwear Cute Cherry Pattern Halterneck Slim One Piece Tankini,Beachwear
6,$23.99,,http://www.jollychic.com/p/women-s-swimwear-faddish-cute-dog-pattern-racerback-one-piece-tankini-g814812.html,Women's Swimwear Faddish Cute Dog Pattern Racerback One Piece Tankini,Beachwear
141,$23.99,,http://www.jollychic.com/p/women-s-swimwear-3d-sexy-red-lip-pattern-racerback-one-piece-tankini-g815012.html,Women's Swimwear 3D Sexy Red Lip Pattern Racerback One Piece Tankini,Beachwear
37,$21.99,,http://www.jollychic.com/p/women-s-2-pcs-swimwear-solid-color-halter-neck-sexy-bikini-set-g839780.html,Women's 2 Pcs Swimwear Solid Color Halter Neck Sexy Bikini Set,Beachwear
30,$15.99,,http://www.jollychic.com/p/women-s-swimwear-set-floral-pattern-halter-neck-crossover-straps-sexy-bikini-set-g871748.html,Women's Swimwear Set Floral Pattern Halter Neck Crossover Straps Sexy Bikini Set,Beachwear
21,$20.99,,http://www.jollychic.com/p/women-s-overcoat-stylish-rainbow-striped-pattern-loose-beach-bikini-blouse-g881124.html,Women's Overcoat Stylish Rainbow Striped Pattern Loose Beach Bikini Blouse,Beachwear
23,$20.99,,http://www.jollychic.com/p/women-s-swimwear-color-block-v-neck-sleeveless-sweet-cover-up-dress-g907060.html,Women's Swimwear Color Block V Neck Sleeveless Sweet Cover Up Dress,Beachwear
477,$14.99,$22.99,http://www.jollychic.com/p/women-s-swimwear-color-block-back-hollow-out-sleeveless-one-piece-tankini-g929432.html,Women's Swimwear Color Block Back Hollow Out Sleeveless One Piece Tankini,Beachwear
74,$19.99,,http://www.jollychic.com/p/women-s-swimwear-colorful-tassel-decor-white-chiffon-cover-up-dress-g944750.html,Women's Swimwear Colorful Tassel Decor White Chiffon Cover Up Dress,Beachwear
27,$19.99,,http://www.jollychic.com/p/women-s-swimwear-flower-embroidery-halterneck-sexy-one-piece-tankini-g961152.html,Women's Swimwear Flower Embroidery Halterneck Sexy One Piece Tankini,Beachwear
12,$17.99,,http://www.jollychic.com/p/women-s-swimwear-elastic-waist-floral-zipper-pocket-comfy-beach-shorts-g975150.html,Women's Swimwear Elastic Waist Floral Zipper Pocket Comfy Beach Shorts,Beachwear
16,$20.99,,http://www.jollychic.com/p/women-s-swimwear-brief-pure-color-spaghetti-straps-beach-cover-up-dress-g975176.html,Women's Swimwear Brief Pure Color Spaghetti Straps Beach Cover Up Dress,Beachwear
47,$14.99,$22.99,http://www.jollychic.com/p/women-s-swimwear-set-leaf-graphic-crossing-design-sexy-bikini-set-g980606.html,Women's Swimwear Set Leaf Graphic Crossing Design Sexy Bikini Set,Beachwear
279,$11.99,$17.99,http://www.jollychic.com/p/women-s-bikini-set-sexy-solid-color-floral-halterneck-triangle-cup-swimwear-set-g982232.html,Women's Bikini Set Sexy Solid Color Floral Halterneck Triangle Cup Swimwear Set,Beachwear
25,$16.99,,http://www.jollychic.com/p/women-s-swimwear-set-vintage-floral-high-waist-underwire-padded-sexy-bikini-set-g983300.html,Women's Swimwear Set Vintage Floral High Waist Underwire Padded Sexy Bikini Set,Beachwear
24,$10.99,,http://www.jollychic.com/p/women-s-swimwear-blouse-tiger-pattern-halter-neck-half-sleeve-loose-cover-up-g995262.html,Women's Swimwear Blouse Tiger Pattern Halter Neck Half Sleeve Loose Cover Up,Beachwear
40,$12.99,,http://www.jollychic.com/p/women-s-swimwear-blouse-letter-pattern-o-neck-sunscreen-loose-cover-up-g995264.html,Women's Swimwear Blouse Letter Pattern O Neck Sunscreen Loose Cover Up,Beachwear
7,$24.99,,http://www.jollychic.com/p/women-s-swimwear-set-vintage-floral-ruffles-criss-cross-beach-sweet-bikini-set-g1008850.html,Women's Swimwear Set Vintage Floral Ruffles Criss Cross Beach Sweet Bikini Set,Beachwear
12,$24.99,,http://www.jollychic.com/p/women-s-swimwear-set-rose-floral-color-block-beach-sexy-bikini-set-g1008864.html,Women's Swimwear Set Rose Floral Color Block Beach Sexy Bikini Set,Beachwear
21,$37.99,,http://www.jollychic.com/p/women-s-swimwear-vintage-blossom-long-sleeve-zip-back-one-piece-swimsuit-g1008882.html,Women's Swimwear Vintage Blossom Long Sleeve Zip Back One Piece Swimsuit,Beachwear
28,$19.99,,http://www.jollychic.com/p/women-s-swimwear-solid-color-hollow-out-halterneck-cover-up-dress-g1014842.html,Women's Swimwear Solid Color Hollow Out Halterneck Cover Up Dress,Beachwear
18,$28.99,,http://www.jollychic.com/p/women-s-swimwear-vintage-lace-hollow-out-deep-v-halter-one-piece-tankini-g1015202.html,Women's Swimwear Vintage Lace Hollow Out Deep V Halter One Piece Tankini,Beachwear
9,$8.99,,http://www.jollychic.com/p/women-s-swimwear-solid-color-sexy-low-waist-bikini-bottom-g1015220.html,Women's Swimwear Solid Color Sexy Low Waist Bikini Bottom,Beachwear
6,$20.99,,http://www.jollychic.com/p/women-s-swimwear-set-pure-color-triangle-cup-halter-strappy-sexy-bikini-set-g1015412.html,Women's Swimwear Set Pure Color Triangle Cup Halter Strappy Sexy Bikini Set,Beachwear
26,$37.99,,http://www.jollychic.com/p/women-s-3pcs-swimwear-boho-vintage-pattern-halter-boy-leg-cover-up-bikini-suit-g1051762.html,Women's 3Pcs Swimwear Boho Vintage Pattern Halter Boy Leg Cover Up Bikini Suit,Beachwear
152,$15.99,$21.99,http://www.jollychic.com/p/women-s-2-pcs-swimsuit-solid-cross-straps-bow-ornament-hollow-out-sexy-bikini-set-g1059684.html,Women's 2 Pcs Swimsuit Solid Cross Straps Bow Ornament Hollow Out Sexy Bikini Set,Beachwear
39,$22.99,,http://www.jollychic.com/p/women-s-2-pcs-swimsuit-colorblock-striped-pattern-underwired-bow-sexy-bikini-set-g1063244.html,Women's 2 Pcs Swimsuit Colorblock Striped Pattern Underwired Bow Sexy Bikini Set,Beachwear
23,$39.99,,http://www.jollychic.com/p/women-s-2-pcs-swimsuit-low-cup-striped-pattern-camisole-high-waist-boyshorts-cozy-tankini-set-g1079184.html,Women's 2 Pcs Swimsuit Low Cup Striped Pattern Camisole High Waist Boyshorts Cozy Tankini Set,Beachwear
60,$29.99,,http://www.jollychic.com/p/women-s-swimwear-floral-pattern-off-shoulder-backless-side-spilted-dress-cover-up-g1091538.html,Women's Swimwear Floral Pattern Off Shoulder Backless Side Spilted Dress Cover Up,Beachwear
3,$23.99,,http://www.jollychic.com/p/women-s-swimwear-sexy-pure-color-crossover-straps-hollow-out-one-piece-swimsuits-g1100084.html,Women's Swimwear Sexy Pure Color Crossover Straps Hollow Out One Piece Swimsuits,Beachwear
26,$8.99,,http://www.jollychic.com/p/women-s-swimwear-solid-color-sexy-hollow-out-beach-thong-g1100086.html,Women's Swimwear Solid Color Sexy Hollow Out Beach Thong,Beachwear
28,$21.99,,http://www.jollychic.com/p/women-s-swimwear-set-brief-solid-color-strappy-sexy-bikini-set-g1116484.html,Women's Swimwear Set Brief Solid Color Strappy Sexy Bikini Set,Beachwear
7,$21.99,,http://www.jollychic.com/p/women-s-swimwear-set-sexy-pure-color-knot-thong-beach-wear-bikini-suit-g1116498.html,Women's Swimwear Set Sexy Pure Color Knot Thong Beach Wear Bikini Suit,Beachwear
169,$17.99,$22.99,http://www.jollychic.com/p/women-s-swimwear-floral-deep-v-backless-sexy-one-piece-tankini-g1123490.html,Women's Swimwear Floral Deep V Backless Sexy One Piece Tankini,Beachwear
8,$14.99,,http://www.jollychic.com/p/women-s-2-pcs-swimwear-leopard-pattern-colorblock-bow-decor-dri-fit-bikini-set-g1125770.html,Women's 2 Pcs Swimwear Leopard Pattern Colorblock Bow Decor Dri-Fit Bikini Set,Beachwear
31,$10.99,$13.99,http://www.jollychic.com/p/women-s-swimwear-set-striped-off-shoulder-halterneck-wireless-beach-tankini-set-g1138492.html,Women's Swimwear Set Striped Off Shoulder Halterneck Wireless Beach Tankini Set,Beachwear
34,$17.99,$24.99,http://www.jollychic.com/p/women-s-swimwear-set-high-waist-floral-beach-swimsuit-bikini-suit-g1163142.html,Women's Swimwear Set High Waist Floral Beach Swimsuit Bikini Suit,Beachwear
34,$22.99,,http://www.jollychic.com/p/women-s-swimwear-solid-white-hollow-out-v-neck-side-split-long-cover-up-dress-g1163156.html,Women's Swimwear Solid White Hollow Out V Neck Side Split Long Cover Up Dress,Beachwear
7,$22.99,$33.99,http://www.jollychic.com/p/women-s-swimwear-sweet-floral-tassel-v-neck-short-sleeve-cover-up-dress-g1195434.html,Women's Swimwear Sweet Floral Tassel V Neck Short Sleeve Cover Up Dress,Beachwear
12,$25.99,$35.99,http://www.jollychic.com/p/women-s-swimwear-set-striped-long-sleeve-zipper-conservative-tankini-suit-g1225390.html,Women's Swimwear Set Striped Long Sleeve Zipper Conservative Tankini Suit,Beachwear
9,$18.99,$25.99,http://www.jollychic.com/p/women-s-swimsuit-underwired-sweet-floral-beach-wear-sexy-bikini-set-g1236752.html,Women's Swimsuit Underwired Sweet Floral Beach Wear Sexy Bikini Set,Beachwear
5,$16.99,,http://www.jollychic.com/p/women-s-swimwear-solid-color-lace-hollow-out-tassel-short-sleeve-cover-up-dress-g1310668.html,Women's Swimwear Solid Color Lace Hollow Out Tassel Short Sleeve Cover Up Dress,Beachwear
627,$9.99,$13.99,http://www.jollychic.com/p/women-s-swimwear-set-sweet-floral-halterneck-ruffles-underwire-tankini-dress-g958454.html,Women's Swimwear Set Sweet Floral Halterneck Ruffles Underwire Tankini Dress,Beachwear
1204,$17.99,,http://www.jollychic.com/p/one-piece-sexy-cut-out-women-s-black-bikini-g240837.html,One Piece Sexy Cut Out Women's Black Bikini,Beachwear
221,$15.99,$18.99,http://www.jollychic.com/p/hollow-out-sexy-high-waist-one-piece-bikinis-g243615.html,Hollow Out Sexy High Waist One Piece Bikinis,Beachwear
1960,$10.99,$15.99,http://www.jollychic.com/p/tassel-adornment-halterneck-2pcs-bikinis-set-g285250.html,Tassel Adornment Halterneck 2Pcs Bikinis Set,Beachwear
373,$15.99,$23.99,http://www.jollychic.com/p/sexy-halterneck-one-piece-swimsuit-g331472.html,Sexy Halterneck One Piece Swimsuit,Beachwear
727,$25.99,$38.99,http://www.jollychic.com/p/women-s-fashion-contrast-color-one-piece-diving-suit-g420912.html,Women's Fashion Contrast Color One Piece Diving Suit,Beachwear
65,$16.99,,http://www.jollychic.com/p/women-s-swimwear-color-patchwork-hand-knitting-crossover-straps-bikinis-g482418.html,Women's Swimwear Color Patchwork Hand Knitting Crossover Straps Bikinis,Beachwear
1425,$17.99,$23.99,http://www.jollychic.com/p/women-s-swimwear-solid-color-sexy-saddish-beach-bikini-g524510.html,Women's Swimwear Solid Color Sexy Saddish Beach Bikini,Beachwear
207,$11.99,$17.99,http://www.jollychic.com/p/women-s-swimwear-color-block-patchwork-padded-sexy-tankini-g533040.html,Women's Swimwear Color Block Patchwork Padded Sexy Tankini,Beachwear
72,$27.99,,http://www.jollychic.com/p/women-s-swimwear-hollow-out-solid-sexy-bikini-g541184.html,Women's Swimwear Hollow Out Solid Sexy Bikini,Beachwear
52,$15.99,$26.99,http://www.jollychic.com/p/women-s-swimwear-velvet-solid-color-hollow-out-one-piece-tankini-g553406.html,Women's Swimwear Velvet Solid Color Hollow Out One Piece Tankini,Beachwear
194,$13.99,$20.99,http://www.jollychic.com/p/women-s-swimwear-leaves-pattern-v-neck-low-waist-crossover-sexy-bikini-g564624.html,Women's Swimwear Leaves Pattern V Neck Low Waist Crossover Sexy Bikini,Beachwear
142,$23.99,,http://www.jollychic.com/p/women-s-beachwear-solid-color-ultrathin-breathable-shirt-long-cover-ups-dress-g588548.html,Women's Beachwear Solid Color Ultrathin Breathable Shirt Long Cover Ups Dress,Beachwear
588,$14.99,$24.99,http://www.jollychic.com/p/women-s-swimwear-bow-solid-one-piece-tankini-g594044.html,Women's Swimwear Bow Solid One Piece Tankini,Beachwear
101,$28.99,$34.99,http://www.jollychic.com/p/women-s-3-pcs-swimwear-color-block-cover-ups-halterneck-bikini-suit-g599534.html,Women's 3 Pcs Swimwear Color Block Cover Ups Halterneck Bikini Suit,Beachwear
539,$22.99,$35.99,http://www.jollychic.com/p/women-s-swimwear-set-blossoms-pattern-holllow-out-underwire-one-piece-bikini-suit-g599968.html,Women's Swimwear Set Blossoms Pattern Holllow Out Underwire One Piece Bikini Suit,Beachwear
71,$39.99,,http://www.jollychic.com/p/women-s-3pcs-swimwear-v-neck-hollow-out-cover-ups-dress-sweet-bikini-suit-g615712.html,Women's 3Pcs Swimwear V Neck Hollow Out Cover Ups Dress Sweet Bikini Suit,Beachwear
2493,$29.99,$39.99,http://www.jollychic.com/p/women-s-3pcs-swimwear-white-sleeveless-split-cover-ups-dress-halter-bikini-suit-g616280.html,Women's 3Pcs Swimwear White Sleeveless Split Cover Ups Dress Halter Bikini Suit,Beachwear
1768,$8.99,$14.99,http://www.jollychic.com/p/women-s-swimwear-solid-sexy-crossover-split-bikini-swimming-suit-g627108.html,Women's Swimwear Solid Sexy Crossover Split Bikini Swimming Suit,Beachwear
