add_wish,discount_price,original_price,product_link,product_name,header_block
18,$11.99,$18.99,https://www.jollychic.com/p/women-s-sunglasses-rimmed-square-vintage-polarized-lightweight-accessory-g615178.html,Women's Sunglasses Rimmed Square Vintage Polarized Lightweight Accessory,Sunglasses/Eyewears
77,$12.99,,https://www.jollychic.com/p/women-s-sunglasses-round-circle-retro-style-charming-glasses-accessory-g633060.html,Women's Sunglasses Round Circle Retro Style Charming Glasses Accessory,Sunglasses/Eyewears
23,$3.99,$11.99,https://www.jollychic.com/p/women-s-sunglasses-irregular-lens-metallic-frame-glasses-accessory-g647660.html,Women's Sunglasses Irregular Lens Metallic Frame Glasses Accessory,Sunglasses/Eyewears
18,$10.99,$17.99,https://www.jollychic.com/p/women-s-sunglasses-unique-light-color-irregular-metal-glasses-trendy-accessory-g672324.html,Women's Sunglasses Unique Light Color Irregular Metal Glasses Trendy Accessory,Sunglasses/Eyewears
221,$18.99,,https://www.jollychic.com/p/women-s-sunglasses-light-color-metal-round-circle-glasses-exquisite-accessory-g672492.html,Women's Sunglasses Light Color Metal Round Circle Glasses Exquisite Accessory,Sunglasses/Eyewears
15,$10.99,$16.99,https://www.jollychic.com/p/women-s-sunglasses-metal-irregular-cat-eye-glasses-trendy-accessory-g673434.html,Women's Sunglasses Metal Irregular Cat Eye Glasses Trendy Accessory,Sunglasses/Eyewears
19,$10.99,$17.99,https://www.jollychic.com/p/women-s-eyeglasses-full-rimmed-nose-pad-square-plain-glasses-accessory-g677584.html,Women's Eyeglasses Full Rimmed Nose Pad Square Plain Glasses Accessory,Sunglasses/Eyewears
21,$5.99,$9.99,https://www.jollychic.com/p/women-s-sunglasses-crown-decor-plastic-frame-faddish-accessory-g677978.html,Women's Sunglasses Crown Decor Plastic Frame Faddish Accessory,Sunglasses/Eyewears
27,$17.99,,https://www.jollychic.com/p/women-s-sunglasses-round-lens-metal-full-rimmed-polarized-accessory-g679656.html,Women's Sunglasses Round Lens Metal Full Rimmed Polarized Accessory,Sunglasses/Eyewears
44,$8.99,$16.99,https://www.jollychic.com/p/women-s-sunglasses-nifty-vogue-cat-eye-metal-rimmed-outdoor-glasses-g684556.html,Women's Sunglasses Nifty Vogue Cat Eye Metal Rimmed Outdoor Glasses,Sunglasses/Eyewears
9,$5.99,,https://www.jollychic.com/p/women-s-sunglasses-faddish-gradient-semi-frame-riding-glasses-accessory-g693076.html,Women's Sunglasses Faddish Gradient Semi Frame Riding Glasses Accessory,Sunglasses/Eyewears
125,$8.99,$17.99,https://www.jollychic.com/p/women-s-sunglasses-personalized-design-cool-glasses-accessory-g743478.html,Women's Sunglasses Personalized Design Cool Glasses Accessory,Sunglasses/Eyewears
38,$13.99,,https://www.jollychic.com/p/women-s-sunglasses-all-match-trendy-full-rim-classic-glasses-accessory-g743486.html,Women's Sunglasses All Match Trendy Full Rim Classic Glasses Accessory,Sunglasses/Eyewears
67,$17.99,$20.99,https://www.jollychic.com/p/women-s-eyeglasses-vintage-round-circle-glasses-metal-frame-accessory-g782142.html,Women's Eyeglasses Vintage Round Circle Glasses Metal Frame Accessory,Sunglasses/Eyewears
40,$3.99,$11.99,https://www.jollychic.com/p/women-s-sunglasses-all-match-chic-vintage-style-cool-glasses-accessory-g786556.html,Women's Sunglasses All Match Chic Vintage Style Cool Glasses Accessory,Sunglasses/Eyewears
16,$41.99,$64.00,https://www.jollychic.com/p/women-s-sunglasses-polarized-full-rim-all-match-chic-glasses-accessory-g791644.html,Women's Sunglasses Polarized Full Rim All Match Chic Glasses Accessory,Sunglasses/Eyewears
32,$13.99,$20.99,https://www.jollychic.com/p/women-s-glasses-classic-full-rim-all-match-casual-plain-glasses-accessory-g797450.html,Women's Glasses Classic Full Rim All Match Casual Plain Glasses Accessory,Sunglasses/Eyewears
14,$13.99,$21.99,https://www.jollychic.com/p/women-s-sunglasses-solid-classic-design-vintage-trendy-accessory-g855134.html,Women's Sunglasses Solid Classic Design Vintage Trendy Accessory,Sunglasses/Eyewears
4,$25.99,$42.99,https://www.jollychic.com/p/topsight-women-s-sunglasses-charming-all-match-polarized-square-sunglasses-g925576.html,Topsight Women's Sunglasses Charming All Match Polarized Square Sunglasses,Sunglasses/Eyewears
18,$12.99,,https://www.jollychic.com/p/women-s-sunglasses-vintage-wood-grain-uv-protection-stylish-accessory-g934296.html,Women's Sunglasses Vintage Wood Grain UV Protection Stylish Accessory,Sunglasses/Eyewears
18,$9.99,$15.99,https://www.jollychic.com/p/women-s-sunglasses-trendy-all-match-full-rim-classic-glasses-accessory-g941394.html,Women's Sunglasses Trendy All Match Full Rim Classic Glasses Accessory,Sunglasses/Eyewears
6,$9.99,,https://www.jollychic.com/p/women-s-sunglasses-square-lens-uv-block-oversized-sunglasses-g942438.html,Women's Sunglasses Square Lens Uv Block Oversized Sunglasses,Sunglasses/Eyewears
20,$4.99,$10.99,https://www.jollychic.com/p/women-s-sunglasses-vintage-style-oversized-fashion-all-match-unisex-glasses-accessory-g966242.html,Women's Sunglasses Vintage Style Oversized Fashion All Match Unisex Glasses Accessory,Sunglasses/Eyewears
15,$21.99,,https://www.jollychic.com/p/women-s-sunglasses-color-block-round-frame-retro-style-accessory-g967146.html,Women's Sunglasses Color Block Round Frame Retro Style Accessory,Sunglasses/Eyewears
16,$20.99,,https://www.jollychic.com/p/women-s-sunglasses-retro-style-cat-eye-metallic-frame-glasses-accessory-g971026.html,Women's Sunglasses Retro Style Cat Eye Metallic Frame Glasses Accessory,Sunglasses/Eyewears
8,$26.99,$40.99,https://www.jollychic.com/p/topsight-women-s-eyewears-black-rimmed-frame-light-uv-protection-glasses-g971396.html,Topsight Women's Eyewears Black Rimmed Frame Light UV Protection Glasses,Sunglasses/Eyewears
17,$14.99,,https://www.jollychic.com/p/women-s-sunglasses-trendy-vintage-all-match-full-frame-plano-dual-purpose-sunglasses-set-g999964.html,Women's Sunglasses Trendy Vintage All Match Full Frame Plano Dual Purpose Sunglasses Set,Sunglasses/Eyewears
7,$7.99,$17.99,https://www.jollychic.com/p/women-s-sunglasses-trendy-big-frame-vintage-style-charming-accessory-g1044408.html,Women's Sunglasses Trendy Big Frame Vintage Style Charming Accessory,Sunglasses/Eyewears
20,$16.99,$25.99,https://www.jollychic.com/p/women-s-sunglasses-sweet-style-heart-shape-design-trendy-accessory-g1045286.html,Women's Sunglasses Sweet Style Heart Shape Design Trendy Accessory,Sunglasses/Eyewears
11,$13.99,$22.99,https://www.jollychic.com/p/women-s-sunglasses-retro-classy-full-rim-square-frame-accessory-g1045288.html,Women's Sunglasses Retro Classy Full Rim Square Frame Accessory,Sunglasses/Eyewears
38,$10.99,$21.99,https://www.jollychic.com/p/women-s-sunglasses-trendy-big-frame-vintage-style-charming-accessory-g1045292.html,Women's Sunglasses Trendy Big Frame Vintage Style Charming Accessory,Sunglasses/Eyewears
6,$3.99,$6.99,https://www.jollychic.com/p/women-s-sunglasses-retro-color-block-all-match-glasses-accessory-g1096304.html,Women's Sunglasses Retro Color Block All Match Glasses Accessory,Sunglasses/Eyewears
5,$15.99,,https://www.jollychic.com/p/women-s-sunglasses-preppy-big-frame-vintage-style-charming-accessory-g1112720.html,Women's Sunglasses Preppy Big Frame Vintage Style Charming Accessory,Sunglasses/Eyewears
24,$17.99,,https://www.jollychic.com/p/women-s-sunglasses-round-colored-lens-fashion-eyewear-g1116574.html,Women's Sunglasses Round Colored Lens Fashion Eyewear,Sunglasses/Eyewears
123,$7.99,$11.99,https://www.jollychic.com/p/women-s-sunglasses-cat-eyes-mirrored-lenses-metal-frame-uv-accessory-g1127314.html,Women's Sunglasses Cat Eyes Mirrored Lenses Metal Frame UV Accessory,Sunglasses/Eyewears
4,$10.99,$24.99,https://www.jollychic.com/p/women-s-sunglasses-vintage-half-frame-classy-all-match-accessory-g1130332.html,Women's Sunglasses Vintage Half Frame Classy All Match Accessory,Sunglasses/Eyewears
1,$106.00,$118.00,https://www.jollychic.com/p/michael-kors-black-sunglasses-plastic-frame-and-plastic-temple-with-dark-grey-lenses-g1138390.html,MICHAEL KORS BLACK SUNGLASSES PLASTIC FRAME AND PLASTIC TEMPLE WITH DARK GREY LENSES,Sunglasses/Eyewears
4,$216.00,$240.00,https://www.jollychic.com/p/versace-women-s-sunglasses-black-frame-ladylike-faddish-accessroy-g1138498.html,VERSACE Women's Sunglasses Black Frame Ladylike Faddish Accessroy,Sunglasses/Eyewears
3,$14.99,$29.99,https://www.jollychic.com/p/women-s-sunglasses-brief-style-all-matched-full-frame-classic-polarized-light-accessory-g1166744.html,Women's Sunglasses Brief Style All Matched Full Frame Classic Polarized Light Accessory,Sunglasses/Eyewears
1,$6.99,,https://www.jollychic.com/p/women-s-sunglasses-cat-eye-big-frame-color-block-trendy-accessory-g1173808.html,Women's Sunglasses Cat Eye Big Frame Color Block Trendy Accessory,Sunglasses/Eyewears
1,$8.99,$20.99,https://www.jollychic.com/p/women-s-sunglasses-polarized-light-all-matched-retro-style-accessory-g1175118.html,Women's Sunglasses Polarized Light All Matched Retro Style Accessory,Sunglasses/Eyewears
2,$5.99,$10.99,https://www.jollychic.com/p/women-s-sunglasses-colorblock-full-frame-trendy-accessory-g1176658.html,Women's Sunglasses Colorblock Full Frame Trendy Accessory,Sunglasses/Eyewears
6,$11.99,$18.99,https://www.jollychic.com/p/women-s-eyeglasses-retro-full-frame-all-match-faddish-accessory-g1177396.html,Women's Eyeglasses Retro Full Frame All Match Faddish Accessory,Sunglasses/Eyewears
5,$7.99,$12.99,https://www.jollychic.com/p/women-s-sunglasses-fashion-thin-full-frame-all-match-accessory-g1179048.html,Women's Sunglasses Fashion Thin Full Frame All Match Accessory,Sunglasses/Eyewears
1,$8.99,$13.99,https://www.jollychic.com/p/women-s-sunglasses-vogue-thin-frame-all-match-eyewear-accessory-g1179056.html,Women's Sunglasses Vogue Thin Frame All Match Eyewear Accessory,Sunglasses/Eyewears
4,$77.00,,https://www.jollychic.com/p/skadino-women-s-wood-sunglasses-sport-retro-color-block-square-frame-accessory-g1179864.html,SKADINO Women's Wood Sunglasses Sport Retro Color Block Square Frame Accessory,Sunglasses/Eyewears
12,$4.99,$9.99,https://www.jollychic.com/p/women-s-sunglasses-vintage-irregular-shaped-hollowed-out-chic-accessory-g1186916.html,Women's Sunglasses Vintage Irregular Shaped Hollowed Out Chic Accessory,Sunglasses/Eyewears
10,$9.99,$16.99,https://www.jollychic.com/p/sunglasses-semi-rimless-metal-retro-fashion-all-matched-resin-unisex-accessory-g1212472.html,Sunglasses Semi-Rimless Metal Retro Fashion All Matched Resin Unisex Accessory,Sunglasses/Eyewears
3,$53.00,,https://www.jollychic.com/p/skadino-women-s-sunglasses-wooden-retro-style-uv400-protection-polarized-light-trendy-accessory-g1214436.html,SKADINO Women's Sunglasses Wooden Retro Style UV400 Protection Polarized Light Trendy Accessory,Sunglasses/Eyewears
5,$18.99,,https://www.jollychic.com/p/women-s-sunglasses-color-block-trendy-big-frame-vintage-style-charming-accessory-g1225940.html,Women's Sunglasses Color Block Trendy Big Frame Vintage Style Charming Accessory,Sunglasses/Eyewears
4,$8.99,$17.99,https://www.jollychic.com/p/women-s-glasses-fashion-retro-half-frame-all-match-eyewear-accessory-g1233554.html,Women's Glasses Fashion Retro Half Frame All Match Eyewear Accessory,Sunglasses/Eyewears
3,$17.99,,https://www.jollychic.com/p/women-s-glasses-fashion-full-frame-simple-retro-eyewear-accessory-g1234344.html,Women's Glasses Fashion Full Frame Simple Retro Eyewear Accessory,Sunglasses/Eyewears
2,$33.99,,https://www.jollychic.com/p/women-s-sunglasses-stylish-colorblock-fashion-glass-accessory-all-match-sunglass-g1273158.html,Women's Sunglasses Stylish Colorblock Fashion Glass Accessory All Match Sunglass,Sunglasses/Eyewears
12,$7.99,$15.99,https://www.jollychic.com/p/women-s-sunglasses-color-block-brief-retro-style-faddish-accessory-g1275620.html,Women's Sunglasses Color Block Brief Retro Style Faddish Accessory,Sunglasses/Eyewears
6,$7.99,$15.99,https://www.jollychic.com/p/women-s-sunglasses-retro-style-full-rim-round-frame-all-match-accessory-g1282008.html,Women's Sunglasses Retro Style Full Rim Round Frame All Match Accessory,Sunglasses/Eyewears
20,$6.99,$12.99,https://www.jollychic.com/p/women-s-sunglasses-big-frame-fresh-style-trendy-color-block-accessory-g1282112.html,Women's Sunglasses Big Frame Fresh Style Trendy Color Block Accessory,Sunglasses/Eyewears
12,$6.99,$17.99,https://www.jollychic.com/p/women-s-sunglasses-cat-eye-shape-full-frame-candy-color-rivet-eyeswear-g1292992.html,Women's Sunglasses Cat Eye Shape Full Frame Candy Color Rivet Eyeswear,Sunglasses/Eyewears
9,$9.99,$21.99,https://www.jollychic.com/p/women-s-sunglasses-half-frame-alloy-chic-elegant-glasses-g1293006.html,Women's Sunglasses Half Frame Alloy Chic Elegant Glasses,Sunglasses/Eyewears
9,$9.99,$21.99,https://www.jollychic.com/p/women-s-stylish-sunglasses-clear-lens-glasses-frame-eyeglasses-g1308786.html,Women's Stylish Sunglasses Clear Lens Glasses Frame Eyeglasses,Sunglasses/Eyewears
4,$8.99,$18.99,https://www.jollychic.com/p/sunglassses-metal-gradient-faddish-all-match-unisex-accessory-g1310038.html,Sunglassses Metal Gradient Faddish All Match Unisex Accessory,Sunglasses/Eyewears
16,$8.99,$19.99,https://www.jollychic.com/p/women-s-eyeglasses-unisex-metal-round-clear-glasses-vintage-eyeglasses-frame-g1315930.html,Women's Eyeglasses Unisex Metal Round Clear Glasses Vintage Eyeglasses Frame,Sunglasses/Eyewears
5,$13.99,$27.99,https://www.jollychic.com/p/women-s-sunglasses-metal-frame-cozy-design-eyewear-accessory-g1319406.html,Women's Sunglasses Metal Frame Cozy Design Eyewear Accessory,Sunglasses/Eyewears
13,$8.99,$18.99,https://www.jollychic.com/p/women-s-eyeglasses-trendy-design-frame-cozy-design-eyewear-accessory-g1319478.html,Women's Eyeglasses Trendy Design Frame Cozy Design Eyewear Accessory,Sunglasses/Eyewears
0,$11.99,$26.99,https://www.jollychic.com/p/women-s-sunglasses-faddish-unique-skull-cat-eye-sunglasses-g1320388.html,Women's Sunglasses Faddish Unique Skull Cat Eye Sunglasses,Sunglasses/Eyewears
11,$11.99,$24.99,https://www.jollychic.com/p/women-s-fashion-sunglasses-metal-clear-lens-aviator-sunglasses-g1321274.html,Women's Fashion Sunglasses Metal Clear Lens Aviator Sunglasses,Sunglasses/Eyewears
0,$7.99,$19.99,https://www.jollychic.com/p/women-s-sunglasses-trendy-vintage-rivet-inlay-cat-eye-sunglasses-g1321764.html,Women's Sunglasses Trendy Vintage Rivet Inlay Cat Eye Sunglasses,Sunglasses/Eyewears
6,$11.99,$26.99,https://www.jollychic.com/p/women-s-sunglasses-chic-cool-metal-thick-frame-colored-film-goggles-fashion-accessories-g1326816.html,Women's Sunglasses Chic Cool Metal Thick Frame Colored Film Goggles Fashion Accessories,Sunglasses/Eyewears
8,$13.99,$27.99,https://www.jollychic.com/p/women-s-eyeglasses-faddish-half-rimmed-metal-frame-all-match-eyewear-accessory-g1339374.html,Women's Eyeglasses Faddish Half Rimmed Metal Frame All Match Eyewear Accessory,Sunglasses/Eyewears
12,$9.99,$22.99,https://www.jollychic.com/p/sunglasses-cat-eye-brief-style-comfortable-unisex-accessory-g1344784.html,Sunglasses Cat Eye Brief Style Comfortable Unisex Accessory,Sunglasses/Eyewears
14,$36.99,,https://www.jollychic.com/p/women-s-sunglasses-fresh-style-geometry-shape-ladylike-accessory-g1354780.html,Women's Sunglasses Fresh Style Geometry Shape Ladylike Accessory,Sunglasses/Eyewears
20,$8.99,$21.99,https://www.jollychic.com/p/women-s-eyeglasses-vinatge-round-clear-glasses-oversize-transparent-eyewear-g1363000.html,Women's Eyeglasses Vinatge Round Clear Glasses Oversize Transparent Eyewear,Sunglasses/Eyewears
9,$9.99,$22.99,https://www.jollychic.com/p/women-s-sunglasses-gradient-lens-square-one-piece-flat-ladies-goggle-eyewear-g1363530.html,Women's Sunglasses Gradient Lens Square One Piece Flat Ladies Goggle Eyewear,Sunglasses/Eyewears
4,$15.99,$30.99,https://www.jollychic.com/p/women-s-sunglasses-polarized-cat-eye-all-match-chic-eyewear-accessory-g1382260.html,Women's Sunglasses Polarized Cat Eye All Match Chic Eyewear Accessory,Sunglasses/Eyewears
7,$9.99,$21.99,https://www.jollychic.com/p/women-s-sunglasses-trendy-rimless-unique-modern-fancy-glasses-g1388550.html,Women's Sunglasses Trendy Rimless Unique Modern Fancy Glasses,Sunglasses/Eyewears
13,$12.99,$25.99,https://www.jollychic.com/p/women-s-sunglasses-retro-hollow-out-full-rim-geometry-frame-glasses-g1429684.html,Women's Sunglasses Retro Hollow Out Full Rim Geometry Frame Glasses,Sunglasses/Eyewears
1,$8.99,$18.99,https://www.jollychic.com/p/women-s-sunglasses-rivet-wood-grain-vintage-style-cool-all-match-sunglasses-g1429700.html,Women's Sunglasses Rivet Wood Grain Vintage Style Cool All Match Sunglasses,Sunglasses/Eyewears
2,$11.99,$25.99,https://www.jollychic.com/p/women-s-sunglasses-retro-hollow-out-full-rim-round-frame-glasses-g1430160.html,Women's Sunglasses Retro Hollow Out Full Rim Round Frame Glasses,Sunglasses/Eyewears
4,$7.99,$18.99,https://www.jollychic.com/p/women-s-sunglasses-retro-style-all-match-geometry-shape-frame-glasses-g1430174.html,Women's Sunglasses Retro Style All Match Geometry Shape Frame Glasses,Sunglasses/Eyewears
4,$9.99,$22.99,https://www.jollychic.com/p/women-s-eyeglasses-retro-brief-geometry-shape-all-match-glasses-accessory-g1433302.html,Women's Eyeglasses Retro Brief Geometry Shape All Match Glasses Accessory,Sunglasses/Eyewears
34,$10.99,$23.99,https://www.jollychic.com/p/women-s-sunglasses-color-film-metal-circular-frame-ladies-fashion-accessory-g1441908.html,Women's Sunglasses Color Film Metal Circular Frame Ladies Fashion Accessory,Sunglasses/Eyewears
1,$25.99,,https://www.jollychic.com/p/women-s-sunglasses-metal-round-circle-oversize-solid-color-faddish-eyewear-accessory-g1466294.html,Women's Sunglasses Metal Round Circle Oversize Solid Color Faddish Eyewear Accessory,Sunglasses/Eyewears
3,$24.99,,https://www.jollychic.com/p/women-s-eyeglasses-brief-style-all-match-geometry-frame-faddish-accessory-g1482250.html,Women's Eyeglasses Brief Style All Match Geometry Frame Faddish Accessory,Sunglasses/Eyewears
3,$17.99,,https://www.jollychic.com/p/women-s-eyeglasses-square-frame-brief-style-faddish-patchwork-accessory-g1482280.html,Women's Eyeglasses Square Frame Brief Style Faddish Patchwork Accessory,Sunglasses/Eyewears
5,$22.99,,https://www.jollychic.com/p/women-s-eyeglasses-metal-full-frame-round-frame-simple-clear-lens-glasses-g1482784.html,Women's Eyeglasses Metal Full Frame Round Frame Simple Clear Lens Glasses,Sunglasses/Eyewears
2,$8.99,$18.99,https://www.jollychic.com/p/women-s-sunglasses-retro-style-metal-cat-eye-design-chic-glasses-accessory-g1484202.html,Women 's Sunglasses Retro Style Metal Cat Eye Design Chic Glasses Accessory,Sunglasses/Eyewears
1,$4.99,$13.99,https://www.jollychic.com/p/women-s-sunglasses-fashion-traveling-folding-square-mixed-color-glasses-accessory-g1484228.html,Women's Sunglasses Fashion Traveling Folding Square Mixed Color Glasses Accessory,Sunglasses/Eyewears
2,$4.99,$12.99,https://www.jollychic.com/p/women-s-eyeglasses-round-frame-brief-retro-faddish-all-match-accessory-g1487622.html,Women's Eyeglasses Round Frame Brief Retro Faddish All Match Accessory,Sunglasses/Eyewears
0,$10.99,$24.99,https://www.jollychic.com/p/women-s-sunglasses-adorable-cat-eye-sweet-solid-color-all-match-eyewear-accessory-g1491784.html,Women's Sunglasses Adorable Cat Eye Sweet Solid Color All Match Eyewear Accessory,Sunglasses/Eyewears
21,$9.99,$14.99,https://www.jollychic.com/p/women-s-eyeglasses-clear-glasses-frame-round-gold-tranparent-eyeglasses-fashion-accessories-g1492804.html,Women's Eyeglasses Clear Glasses Frame Round Gold Tranparent Eyeglasses Fashion Accessories,Sunglasses/Eyewears
2,$11.99,$17.99,https://www.jollychic.com/p/unisex-eyeglasses-vintage-stylish-metal-round-frame-clear-glasses-g1498462.html,Unisex Eyeglasses Vintage Stylish Metal Round Frame Clear Glasses,Sunglasses/Eyewears
1,$14.99,,https://www.jollychic.com/p/women-s-sunglasses-vintage-cat-eye-plano-lens-glasses-g1498502.html,Women's Sunglasses Vintage Cat Eye Plano Lens Glasses,Sunglasses/Eyewears
0,$15.99,,https://www.jollychic.com/p/unisex-sunglasses-vintage-stylish-square-mirror-eyewear-g1498516.html,Unisex Sunglasses Vintage Stylish Square Mirror Eyewear,Sunglasses/Eyewears
0,$9.99,$22.99,https://www.jollychic.com/p/women-s-sunglasses-geometry-shape-charming-all-match-trendy-accessory-g1498860.html,Women's Sunglasses Geometry Shape Charming All Match Trendy Accessory,Sunglasses/Eyewears
0,$8.99,$19.99,https://www.jollychic.com/p/women-s-sunglasses-retro-style-big-frame-ladylike-charming-accessory-g1498888.html,Women's Sunglasses Retro Style Big Frame Ladylike Charming Accessory,Sunglasses/Eyewears
2,$8.99,$19.99,https://www.jollychic.com/p/women-s-sunglasses-hollow-out-big-frame-retro-all-match-ladylike-accessory-g1498900.html,Women's Sunglasses Hollow Out Big Frame Retro All Match Ladylike Accessory,Sunglasses/Eyewears
2,$17.99,$26.99,https://www.jollychic.com/p/women-s-eyeglasses-half-frame-preppy-style-top-fashion-eyewear-accessory-g1499636.html,Women's Eyeglasses Half Frame Preppy Style Top Fashion Eyewear Accessory,Sunglasses/Eyewears
0,$16.99,$25.99,https://www.jollychic.com/p/women-s-sunglasses-round-frame-retro-style-all-match-faddish-eyewear-accessory-g1499672.html,Women's Sunglasses Round Frame Retro Style All Match Faddish Eyewear Accessory,Sunglasses/Eyewears
1,$16.99,$25.99,https://www.jollychic.com/p/women-s-sunglasses-round-frame-top-fashion-all-match-chic-eyewear-accessory-g1499682.html,Women's Sunglasses Round Frame Top Fashion All Match Chic Eyewear Accessory,Sunglasses/Eyewears
5,$22.99,,https://www.jollychic.com/p/women-s-sunglasses-cat-eye-big-rimless-frame-fashion-accessories-g1504912.html,Women's Sunglasses Cat Eye Big Rimless Frame Fashion Accessories,Sunglasses/Eyewears
0,$20.99,,https://www.jollychic.com/p/women-s-sunglass-vintage-fashion-cat-eye-shaped-frame-accessory-g1504916.html,Women's Sunglass Vintage Fashion Cat Eye Shaped Frame Accessory,Sunglasses/Eyewears
0,$9.99,$14.99,https://www.jollychic.com/p/women-s-sunglasses-transparent-heart-shaped-creative-stylish-eyewear-accessory-g1525546.html,Women's Sunglasses Transparent Heart Shaped Creative Stylish Eyewear Accessory,Sunglasses/Eyewears
0,$37.99,,https://www.jollychic.com/p/women-s-eyeglasses-vintage-full-large-frame-fashion-accessory-g1545758.html,Women's Eyeglasses Vintage Full Large Frame Fashion Accessory,Sunglasses/Eyewears
1,$24.99,$36.99,https://www.jollychic.com/p/pinglas-women-s-eyeglasses-preppy-style-casual-all-matched-round-shaped-accessory-g1545762.html,PINGLAS Women's Eyeglasses Preppy Style Casual All Matched Round Shaped Accessory,Sunglasses/Eyewears
3,$24.99,$36.99,https://www.jollychic.com/p/pinglas-women-s-eyeglasses-simple-style-all-match-transparent-frame-vogue-accessory-g1545764.html,PINGLAS Women's Eyeglasses Simple Style All Match Transparent Frame Vogue Accessory,Sunglasses/Eyewears
0,$6.99,$25.99,https://www.jollychic.com/p/women-s-sunglasses-fashion-trend-color-film-eyewear-g1563898.html,Women's Sunglasses Fashion Trend Color Film Eyewear,Sunglasses/Eyewears
1,$8.99,$25.99,https://www.jollychic.com/p/women-s-eyeglasses-rimless-oval-frame-simple-all-match-eyewear-accessory-g1566372.html,Women's Eyeglasses Rimless Oval Frame Simple All Match Eyewear Accessory,Sunglasses/Eyewears
0,$21.99,,https://www.jollychic.com/p/1-pc-women-s-sunglasses-unique-oversized-vintage-chic-sunglasses-accessory-g1571534.html,1 Pc Women's Sunglasses Unique Oversized Vintage Chic Sunglasses Accessory,Sunglasses/Eyewears
1,$16.99,,https://www.jollychic.com/p/women-s-eyeglasses-irregular-frame-solid-color-all-match-ladylike-eyewear-accessory-g1572036.html,Women's Eyeglasses Irregular Frame Solid Color All Match Ladylike Eyewear Accessory,Sunglasses/Eyewears
2684,$3.99,$9.99,https://www.jollychic.com/p/versatile-semi-frame-optical-cheap-glasses-g53440.html,Versatile Semi Frame Optical Cheap Glasses,Sunglasses/Eyewears
4647,$5.99,$12.99,https://www.jollychic.com/p/cat-eye-fashion-mirrored-lenses-womens-sunglasses-g181565.html,Cat Eye Fashion Mirrored Lenses Womens Sunglasses,Sunglasses/Eyewears
588,$3.99,$13.99,https://www.jollychic.com/p/lady-cat-eye-super-light-sunglasses-g214043.html,Lady Cat Eye Super Light Sunglasses,Sunglasses/Eyewears
33,$18.99,,https://www.jollychic.com/p/two-tone-brief-design-frame-polarizer-unisex-fancy-sunglasses-g281974.html,Two Tone Brief Design Frame Polarizer Unisex Fancy Sunglasses,Sunglasses/Eyewears
60,$15.99,,https://www.jollychic.com/p/metallic-ornament-polarizer-shining-high-end-unisex-sunglasses-g283224.html,Metallic Ornament Polarizer Shining High End Unisex Sunglasses,Sunglasses/Eyewears
862,$5.99,$17.99,https://www.jollychic.com/p/two-tone-gentle-gold-tone-frame-sunglasses-for-men-g348018.html,Two Tone Gentle Gold Tone Frame Sunglasses For Men,Sunglasses/Eyewears
2794,$7.99,$14.99,https://www.jollychic.com/p/original-design-circular-frame-all-match-high-end-women-s-sunglasses-g370574.html,Original Design Circular Frame All Match High End Women's Sunglasses,Sunglasses/Eyewears
40,$13.99,,https://www.jollychic.com/p/women-s-sunglasses-fashion-casual-cat-eye-resin-glasses-g458682.html,Women's Sunglasses Fashion Casual Cat Eye Resin Glasses,Sunglasses/Eyewears
31,$16.99,$25.99,https://www.jollychic.com/p/women-s-sunglasses-vogue-metal-leg-translucent-frame-pink-lens-glasses-g539234.html,Women's Sunglasses Vogue Metal Leg Translucent Frame Pink Lens Glasses,Sunglasses/Eyewears
21,$10.99,$16.99,https://www.jollychic.com/p/women-s-sunglasses-boutique-trendy-round-lens-simple-glasses-accessory-g549472.html,Women's Sunglasses Boutique Trendy Round Lens Simple Glasses Accessory,Sunglasses/Eyewears
184,$12.99,$18.99,https://www.jollychic.com/p/women-s-sunglasses-classic-square-trendy-unique-design-accessory-g627756.html,Women's Sunglasses Classic Square Trendy Unique Design Accessory,Sunglasses/Eyewears
103,$15.99,$24.99,https://www.jollychic.com/p/women-s-sunglasses-polarized-round-fashion-classic-accessory-g631048.html,Women's Sunglasses Polarized Round Fashion Classic Accessory,Sunglasses/Eyewears
