add_wish,discount_price,original_price,product_link,product_name,header_block
1057,$16.99,$27.99,https://www.jollychic.com/p/women-s-wig-mid-split-tilted-frisette-curly-long-synthetic-hair-accessory-g651526.html,Women's Wig Mid Split Tilted frisette Curly Long Synthetic Hair Accessory,Wigs
71,$12.99,$24.99,https://www.jollychic.com/p/women-s-wig-light-brown-tilted-frisette-curly-long-synthetic-hair-accessory-g653738.html,Women's Wig Light Brown Tilted Frisette Curly Long Synthetic Hair Accessory,Wigs
339,$15.99,$21.99,https://www.jollychic.com/p/women-s-wig-black-soft-tilted-frisette-straight-long-human-hair-accessory-g653744.html,Women's Wig Black Soft Tilted Frisette Straight Long Human Hair Accessory,Wigs
191,$13.99,$21.99,https://www.jollychic.com/p/women-s-wig-bang-natural-soft-shiny-straight-long-synthetic-hair-accessory-g653746.html,Women's Wig Bang Natural Soft Shiny Straight Long Synthetic Hair Accessory,Wigs
84,$20.99,,https://www.jollychic.com/p/women-s-wig-stylish-various-sizes-curly-human-hair-weave-accessory-g677548.html,Women's Wig Stylish Various Sizes Curly Human Hair Weave Accessory,Wigs
32,$27.99,,https://www.jollychic.com/p/women-s-wig-wine-red-soft-tilted-frisette-straight-long-human-hair-accessory-g677672.html,Women's Wig Wine Red Soft Tilted Frisette Straight Long Human Hair Accessory,Wigs
84,$17.99,$27.99,https://www.jollychic.com/p/women-s-wig-blonde-natural-tilted-frisette-curly-long-synthetic-hair-accessory-g677678.html,Women's Wig Blonde Natural Tilted Frisette Curly Long Synthetic Hair Accessory,Wigs
430,$18.99,$24.99,https://www.jollychic.com/p/women-s-wig-gradient-natural-soft-fluffy-curly-long-synthetic-hair-accessory-g677688.html,Women's Wig Gradient Natural Soft Fluffy Curly Long Synthetic Hair Accessory,Wigs
71,$25.99,,https://www.jollychic.com/p/women-s-wig-elegant-slanting-bang-long-curly-synthetic-hair-accessory-g701780.html,Women's Wig Elegant Slanting Bang Long Curly Synthetic Hair Accessory,Wigs
93,$16.99,$24.99,https://www.jollychic.com/p/women-s-wig-chic-black-short-curly-synthetic-hair-accesspry-g702000.html,Women's Wig Chic Black Short Curly Synthetic Hair Accesspry,Wigs
86,$67.00,$101.00,https://www.jollychic.com/p/women-s-wig-black-wavy-middle-length-natural-hair-accessory-g744366.html,Women's Wig Black Wavy Middle Length Natural Hair Accessory,Wigs
27,$45.99,$71.00,https://www.jollychic.com/p/women-s-wig-mixed-color-side-bangs-curly-short-human-hair-trendy-accessory-g744528.html,Women's Wig Mixed Color Side Bangs Curly Short Human Hair Trendy Accessory,Wigs
933,$64.00,$99.00,https://www.jollychic.com/p/women-s-wig-chic-medium-length-curly-fiber-human-hair-accessory-g751746.html,Women's Wig Chic Medium Length Curly Fiber Human Hair Accessory,Wigs
152,$16.99,$26.99,https://www.jollychic.com/p/women-s-wig-elegant-black-central-parting-curly-synthenic-hair-accessory-g755288.html,Women's Wig Elegant Black Central Parting Curly Synthenic Hair Accessory,Wigs
206,$16.99,$24.99,https://www.jollychic.com/p/women-s-wig-black-natural-straight-central-parting-long-synthetic-hair-accessory-g756406.html,Women's Wig Black Natural Straight Central Parting Long Synthetic Hair Accessory,Wigs
708,$67.00,$102.00,https://www.jollychic.com/p/women-s-wigs-black-long-straight-central-parting-synthetic-hair-accessories-g782302.html,Women's Wigs Black Long Straight Central Parting Synthetic Hair Accessories,Wigs
34,$15.99,$24.99,https://www.jollychic.com/p/women-s-wigs-vogue-loose-side-fringe-short-curly-synthetic-hair-accessory-g818748.html,Women's Wigs Vogue Loose Side Fringe Short Curly Synthetic Hair Accessory,Wigs
439,$69.00,$111.00,https://www.jollychic.com/p/women-s-wigs-natural-soft-kinky-curly-synthetic-fiber-long-hair-accessory-g831688.html,Women's Wigs Natural Soft Kinky Curly Synthetic Fiber Long Hair Accessory,Wigs
729,$63.00,$103.00,https://www.jollychic.com/p/women-s-wigs-black-soft-synthetic-fiber-loose-wave-long-human-hair-accessory-g831692.html,Women's Wigs Black Soft Synthetic Fiber Loose Wave Long Human Hair Accessory,Wigs
118,$13.99,$22.99,https://www.jollychic.com/p/women-s-wig-black-color-short-curly-synthetic-hair-wig-accessory-g843594.html,Women's Wig Black Color Short Curly Synthetic Hair Wig Accessory,Wigs
97,$20.99,$29.99,https://www.jollychic.com/p/women-s-wig-black-color-middle-part-long-straight-synthetic-hair-wig-accessory-g843596.html,Women's Wig Black Color Middle Part Long Straight Synthetic Hair Wig Accessory,Wigs
486,$18.99,$28.99,https://www.jollychic.com/p/women-s-accessory-central-parting-charming-long-curly-synthetic-hair-accessory-g844124.html,Women's Accessory Central Parting Charming Long Curly Synthetic Hair Accessory,Wigs
71,$11.99,$17.99,https://www.jollychic.com/p/women-s-wig-enchanting-brown-blunt-cut-bangs-long-straight-synthetic-hair-g872342.html,Women's Wig Enchanting Brown Blunt Cut Bangs Long Straight Synthetic Hair,Wigs
372,$16.99,$25.99,https://www.jollychic.com/p/women-s-wig-middle-part-mature-long-wave-synthetic-hair-accessory-g875784.html,Women's Wig Middle Part Mature Long Wave Synthetic Hair Accessory,Wigs
83,$17.99,$27.99,https://www.jollychic.com/p/women-s-wig-simple-style-fashion-long-curly-hair-synthetic-hair-accessory-g885602.html,Women's Wig Simple Style Fashion Long Curly Hair Synthetic Hair Accessory,Wigs
172,$22.99,$28.99,https://www.jollychic.com/p/women-s-wig-faddish-charming-long-curly-hair-synthetic-hair-accessory-g885604.html,Women's Wig Faddish Charming Long Curly Hair Synthetic Hair Accessory,Wigs
99,$32.99,$51.00,https://www.jollychic.com/p/women-s-wig-vogue-tilted-frisette-short-curly-fluffy-human-hair-accessory-g885822.html,Women's Wig Vogue Tilted Frisette Short Curly Fluffy Human Hair Accessory,Wigs
332,$18.99,$28.99,https://www.jollychic.com/p/women-s-wig-tilted-frisette-color-mixing-long-curly-synthetic-hair-accessory-g886186.html,Women's Wig Tilted Frisette Color Mixing Long Curly Synthetic Hair Accessory,Wigs
305,$16.99,$24.99,https://www.jollychic.com/p/women-s-wig-sexy-natural-fluffy-short-slightly-curled-synthetic-hair-accessory-g886192.html,Women's Wig Sexy Natural Fluffy Short Slightly Curled Synthetic Hair Accessory,Wigs
360,$18.99,$24.99,https://www.jollychic.com/p/women-s-wig-black-long-straight-fashion-hair-synthetic-accessory-g904828.html,Women's Wig Black Long Straight Fashion Hair Synthetic Accessory,Wigs
285,$67.00,$111.00,https://www.jollychic.com/p/women-s-wig-chic-long-curly-hair-chemical-fiber-hair-accessory-g916556.html,Women's Wig Chic Long Curly Hair Chemical Fiber Hair Accessory,Wigs
191,$7.99,$15.99,https://www.jollychic.com/p/women-s-hair-wig-stylish-elegant-kinky-curly-long-synthetic-hair-wig-accessory-g922612.html,Women's Hair Wig Stylish Elegant Kinky Curly Long Synthetic Hair Wig Accessory,Wigs
36,$38.99,$51.00,https://www.jollychic.com/p/women-s-hair-wig-simple-stylish-elegant-short-human-hair-wig-accessory-g922622.html,Women's Hair Wig Simple Stylish Elegant Short Human Hair Wig Accessory,Wigs
37,$14.99,$28.99,https://www.jollychic.com/p/women-s-wig-black-long-curly-faddish-hair-synthetic-accessory-g960526.html,Women's Wig Black Long Curly Faddish Hair Synthetic Accessory,Wigs
30,$17.99,$26.99,https://www.jollychic.com/p/women-s-wig-long-straight-faddish-brown-hair-synthetic-accessory-g960530.html,Women's Wig Long Straight Faddish Brown Hair Synthetic Accessory,Wigs
21,$118.00,,https://www.jollychic.com/p/women-s-wig-charming-middle-length-sideswept-bangs-black-human-hair-g965234.html,Women's Wig Charming Middle Length Sideswept Bangs Black Human Hair,Wigs
82,$67.00,$103.00,https://www.jollychic.com/p/women-s-wig-trendy-elegant-curly-long-pattern-hair-accessory-g993506.html,Women's Wig Trendy Elegant Curly Long Pattern Hair Accessory,Wigs
88,$15.99,$23.99,https://www.jollychic.com/p/women-s-wig-side-part-chemical-fiber-short-natural-nifty-wig-accessory-g1015836.html,Women's Wig Side Part Chemical Fiber Short Natural Nifty Wig Accessory,Wigs
52,$15.99,$23.99,https://www.jollychic.com/p/women-s-wig-synthetic-hair-side-part-short-natural-faddish-wig-accessory-g1015864.html,Women's Wig Synthetic Hair Side Part Short Natural Faddish Wig Accessory,Wigs
132,$5.99,,https://www.jollychic.com/p/women-s-extension-synthetic-hair-long-wavy-hair-ladylike-wig-accessory-g1017280.html,Women's Extension Synthetic Hair Long Wavy Hair Ladylike Wig Accessory,Wigs
19,$14.99,$22.99,https://www.jollychic.com/p/women-s-wig-side-part-medium-length-straight-hair-synthetic-hair-trendy-wig-accessory-g1017504.html,Women's Wig Side part Medium-length Straight Hair Synthetic Hair Trendy Wig Accessory,Wigs
188,$16.99,$25.99,https://www.jollychic.com/p/women-s-wig-trendy-bobhaircut-straight-short-pattern-synthetic-hair-accessory-g1064512.html,Women's Wig Trendy Bobhaircut Straight Short Pattern Synthetic Hair Accessory,Wigs
25,$33.99,$56.00,https://www.jollychic.com/p/women-s-wig-short-curly-fashion-hair-synthetic-charming-accessory-g1112812.html,Women's Wig Short Curly Fashion Hair Synthetic Charming Accessory,Wigs
8,$120.00,,https://www.jollychic.com/p/women-s-wig-sweet-style-curly-blunt-bangs-mid-long-pattern-human-hair-accessory-g1143692.html,Women's Wig Sweet Style Curly Blunt Bangs Mid Long Pattern Human Hair Accessory,Wigs
13,$18.99,$28.99,https://www.jollychic.com/p/women-s-wig-solid-color-fashion-wave-curly-long-pattern-synthetic-hair-accessory-g1143694.html,Women's Wig Solid Color Fashion Wave Curly Long Pattern Synthetic Hair Accessory,Wigs
14,$19.99,,https://www.jollychic.com/p/women-s-wig-black-long-curly-fashion-hair-synthetic-accessory-g1191422.html,Women's Wig Black Long Curly Fashion Hair Synthetic Accessory,Wigs
15,$72.00,$106.00,https://www.jollychic.com/p/women-s-human-hair-wig-elegant-bob-short-straight-with-bang-hair-accessory-g1195516.html,Women's Human Hair Wig Elegant Bob Short Straight With Bang Hair Accessory,Wigs
5,$3.99,$7.99,https://www.jollychic.com/p/women-s-wig-classic-solid-wavy-elegant-long-faddish-hair-accessory-g1205964.html,Women's Wig Classic Solid Wavy Elegant Long Faddish Hair Accessory,Wigs
5,$34.99,,https://www.jollychic.com/p/women-s-wig-black-long-curly-fashion-hair-synthetic-accessory-g1209320.html,Women's Wig Black Long Curly Fashion Hair Synthetic Accessory,Wigs
33,$19.99,$32.99,https://www.jollychic.com/p/women-s-wig-gradient-color-curly-long-hair-middle-part-synthetic-hair-wig-g1214538.html,Women's Wig Gradient Color Curly Long Hair Middle Part Synthetic Hair Wig,Wigs
20,$21.99,$33.99,https://www.jollychic.com/p/women-s-wig-air-bangs-grey-curly-synthetic-hair-wig-g1214546.html,Women's Wig Air Bangs Grey Curly Synthetic Hair Wig,Wigs
183,$5.99,$9.99,https://www.jollychic.com/p/women-s-hair-wig-long-wave-hair-extension-synthetic-hair-accessory-g1222080.html,Women's Hair Wig Long Wave Hair Extension Synthetic Hair Accessory,Wigs
167,$4.99,$8.99,https://www.jollychic.com/p/women-s-hair-extension-wig-long-wave-synthetic-hair-accessory-g1222966.html,Women's Hair Extension Wig Long Wave Synthetic Hair Accessory,Wigs
29,$6.99,$9.99,https://www.jollychic.com/p/women-s-wig-synthetic-hair-long-straight-hair-extension-fashion-wig-accessory-g1223250.html,Women's Wig Synthetic Hair Long Straight Hair Extension Fashion Wig Accessory,Wigs
52,$15.99,$26.99,https://www.jollychic.com/p/women-s-hair-wig-gradient-color-elegant-short-wave-synthetic-hair-accessory-g1223642.html,Women's Hair Wig Gradient Color Elegant Short Wave Synthetic Hair Accessory,Wigs
2,$27.99,,https://www.jollychic.com/p/women-s-hair-wig-long-straight-hair-middle-part-synthetic-hair-wig-accessory-g1227650.html,Women's Hair wig Long Straight Hair Middle Part Synthetic Hair Wig Accessory,Wigs
33,$17.99,$30.99,https://www.jollychic.com/p/women-s-synthetic-hair-wig-fashion-mixed-color-tilted-frisette-fluffy-short-hair-accessory-g1229910.html,Women's Synthetic Hair Wig Fashion Mixed Color Tilted Frisette Fluffy Short Hair Accessory,Wigs
92,$19.99,$30.99,https://www.jollychic.com/p/women-s-wig-color-long-curly-fashion-hair-synthetic-accessory-g1234168.html,Women's Wig Color Long Curly Fashion Hair Synthetic Accessory,Wigs
63,$5.99,$9.99,https://www.jollychic.com/p/women-s-hair-extension-trendy-chic-seamless-long-straight-hair-accessory-g1272536.html,Women's Hair Extension Trendy Chic Seamless Long Straight Hair Accessory,Wigs
85,$22.99,$38.99,https://www.jollychic.com/p/synthetic-hair-wig-chemical-fiber-black-lightly-curl-middle-length-hair-wig-g1304504.html,Synthetic Hair Wig Chemical Fiber Black Lightly Curl Middle Length Hair Wig,Wigs
18,$23.99,$38.99,https://www.jollychic.com/p/synthetic-hair-wig-chemical-fiber-middle-length-black-straight-hair-wig-g1304506.html,Synthetic Hair Wig Chemical Fiber Middle Length Black Straight Hair Wig,Wigs
85,$20.99,$38.99,https://www.jollychic.com/p/synthetic-hair-wig-chemical-fiber-short-black-straight-hair-wig-g1304508.html,Synthetic Hair Wig Chemical Fiber Short Black Straight Hair Wig,Wigs
15,$18.99,$36.99,https://www.jollychic.com/p/women-s-synthetic-hair-wig-fashion-all-match-color-long-pattern-hair-accessory-g1343276.html,Women's Synthetic Hair Wig Fashion All Match Color Long Pattern Hair Accessory,Wigs
14,$26.99,$37.99,https://www.jollychic.com/p/women-s-hair-wig-synthetic-side-parted-short-curly-fashion-hair-accessory-g1363096.html,Women's Hair Wig Synthetic Side Parted Short Curly Fashion Hair Accessory,Wigs
9,$22.99,$38.99,https://www.jollychic.com/p/women-s-hair-wig-synthetic-gradient-middle-parted-long-all-match-hair-accessory-g1363098.html,Women's Hair Wig Synthetic Gradient Middle Parted Long All Match Hair Accessory,Wigs
9,$22.99,$38.99,https://www.jollychic.com/p/women-s-hair-wig-synthetic-long-curly-black-elegant-hair-accessory-g1363100.html,Women's Hair Wig Synthetic Long Curly Black Elegant Hair Accessory,Wigs
22,$21.99,$36.99,https://www.jollychic.com/p/women-s-hair-wig-synthetic-short-curly-trendy-hair-accessory-g1363112.html,Women's Hair Wig Synthetic Short Curly Trendy Hair Accessory,Wigs
15,$9.99,$22.99,https://www.jollychic.com/p/women-s-extension-long-straight-elegant-ladylike-gradient-faddish-hair-accessory-g1431782.html,Women's Extension Long Straight Elegant Ladylike Gradient Faddish Hair Accessory,Wigs
22,$19.99,$31.99,https://www.jollychic.com/p/women-s-wig-middle-part-straight-black-middle-long-synthetic-hair-wig-accessory-g1468238.html,Women's Wig Middle Part Straight Black Middle-Long Synthetic Hair Wig Accessory,Wigs
5,$24.99,,https://www.jollychic.com/p/women-s-wig-natural-long-straight-blunt-bangs-elegant-synthetic-hair-wig-accessory-g1468244.html,Women's Wig Natural Long Straight Blunt Bangs Elegant Synthetic Hair Wig Accessory,Wigs
10,$4.99,$10.99,https://www.jollychic.com/p/women-s-wig-ponytail-synthetic-gradient-long-elegant-hair-accessory-g1469046.html,Women's Wig Ponytail Synthetic Gradient Long Elegant Hair Accessory,Wigs
7,$13.99,$22.99,https://www.jollychic.com/p/12pcs-women-s-extension-long-straight-elegant-chic-hair-accessory-g1469048.html,12Pcs Women's Extension Long Straight Elegant Chic Hair Accessory,Wigs
5,$13.99,$22.99,https://www.jollychic.com/p/12pcs-women-s-extension-long-straight-solid-color-top-fashion-all-match-wig-accessory-g1469868.html,12Pcs Women's Extension Long Straight Solid Color Top Fashion All Match Wig Accessory,Wigs
10,$14.99,$24.99,https://www.jollychic.com/p/women-s-wig-ponytail-elegant-long-wave-solid-color-faddish-hair-accessory-g1471306.html,Women's Wig Ponytail Elegant Long Wave Solid Color Faddish Hair Accessory,Wigs
6,$7.99,$12.99,https://www.jollychic.com/p/women-s-ponytail-wig-solid-color-long-curly-pattern-stylish-all-match-accessory-g1472782.html,Women's Ponytail Wig Solid Color Long Curly Pattern Stylish All Match Accessory,Wigs
8,$10.99,,https://www.jollychic.com/p/women-s-ponytail-long-straight-pattern-solid-color-fashionable-all-match-accessory-g1472796.html,Women's Ponytail Long Straight Pattern Solid Color Fashionable All Match Accessory,Wigs
16,$5.99,$14.99,https://www.jollychic.com/p/5-pcs-women-s-wig-fashion-elegant-all-matched-straight-long-pattern-extension-accessory-g1481824.html,5 Pcs Women's Wig Fashion Elegant All Matched Straight Long Pattern Extension Accessory,Wigs
2,$8.99,$14.99,https://www.jollychic.com/p/women-s-ponytail-wig-solid-color-long-curly-pattern-stylish-all-match-accessory-g1491096.html,Women's Ponytail Wig Solid Color Long Curly Pattern Stylish All Match Accessory,Wigs
5,$9.99,$14.99,https://www.jollychic.com/p/women-s-ponytail-brief-design-all-match-long-straight-pattern-chic-wig-accessory-g1516056.html,Women's Ponytail Brief Design All Match Long Straight Pattern Chic Wig Accessory,Wigs
9,$10.99,$17.99,https://www.jollychic.com/p/7pcs-women-s-extension-solid-color-long-straight-pattern-all-match-trendy-wig-accessory-g1572882.html,7Pcs Women's Extension Solid Color Long Straight Pattern All Match Trendy Wig Accessory,Wigs
6,$10.99,$17.99,https://www.jollychic.com/p/7pcs-women-s-extension-long-curly-pattern-chemical-fiber-stylish-wig-accessory-g1572884.html,7Pcs Women's Extension Long Curly Pattern Chemical Fiber Stylish Wig Accessory,Wigs
348,$4.99,$8.99,https://www.jollychic.com/p/deep-brown-curly-woman-hair-extensions-g67966.html,Deep Brown Curly Woman Hair Extensions,Wigs
697,$20.99,$26.99,https://www.jollychic.com/p/stylish-long-curly-blend-human-hair-wig-deep-brown-g73884.html,Stylish Long Curly Blend Human Hair Wig Deep Brown,Wigs
156,$15.99,$23.99,https://www.jollychic.com/p/cute-neat-bangs-smooth-curly-wig-g74066.html,Cute Neat Bangs Smooth Curly Wig,Wigs
437,$7.99,,https://www.jollychic.com/p/charming-tiny-curly-tie-up-women-s-hair-ponytail-g77302.html,Charming Tiny Curly Tie Up Women's Hair Ponytail,Wigs
847,$15.99,$28.99,https://www.jollychic.com/p/slight-wavy-solid-long-wig-for-woman-black-g84250.html,Slight Wavy Solid Long Wig For Woman Black,Wigs
690,$18.99,$28.99,https://www.jollychic.com/p/slight-wavy-solid-long-wig-for-woman-red-g84256.html,Slight Wavy Solid Long Wig For Woman Red,Wigs
320,$10.99,$15.99,https://www.jollychic.com/p/fringe-bob-style-stylish-women-E2-80-98s-wig-g134017.html,Fringe Bob Style Stylish Womens Wig,Wigs
390,$5.99,$6.99,https://www.jollychic.com/p/exaggerate-synthetic-long-havana-mambo-twist-g277559.html,Exaggerate Synthetic Long Havana Mambo Twist,Wigs
379,$6.99,,https://www.jollychic.com/p/special-long-sterling-women-s-havana-mambo-twist-g277569.html,Special Long Sterling Women's Havana Mambo Twist,Wigs
473,$2.99,$3.99,https://www.jollychic.com/p/swish-grey-long-straight-smooth-women-synthetic-ponytail-g277675.html,Swish Grey Long Straight Smooth Women Synthetic Ponytail,Wigs
597,$14.99,$18.99,https://www.jollychic.com/p/oblique-bangs-synthetic-curly-sleek-ritzy-women-s-long-wig-g281146.html,Oblique Bangs Synthetic Curly Sleek Ritzy Women's Long Wig,Wigs
1092,$61.00,$74.00,https://www.jollychic.com/p/vogue-latest-design-human-hair-sterling-women-s-short-wig-g322818.html,Vogue Latest Design Human Hair Sterling Women's Short Wig,Wigs
207,$84.00,,https://www.jollychic.com/p/natural-black-high-end-human-hair-loose-wave-closure-women-s-wig-g388742.html,Natural Black High End Human Hair Loose Wave Closure Women's Wig,Wigs
274,$5.99,,https://www.jollychic.com/p/natural-curly-long-wig-sterling-gradient-color-loose-women-s-wig-g389302.html,Natural Curly Long Wig Sterling Gradient Color Loose Women's Wig,Wigs
70,$114.00,,https://www.jollychic.com/p/human-hair-wig-irregular-cut-short-fashion-women-s-wig-g395990.html,Human Hair Wig Irregular Cut Short Fashion Women's Wig,Wigs
105,$57.00,$145.00,https://www.jollychic.com/p/women-s-wig-glossy-ritzy-new-style-long-human-hair-g491286.html,Women's Wig Glossy Ritzy New Style Long Human Hair,Wigs
153,$19.99,,https://www.jollychic.com/p/women-s-wig-swish-shiny-soft-touch-wavy-glam-human-hair-extension-g498530.html,Women's Wig Swish Shiny Soft Touch Wavy Glam Human Hair Extension,Wigs
47,$25.99,,https://www.jollychic.com/p/women-s-wig-mature-elegant-wavy-human-hair-accessory-g500386.html,Women's Wig Mature Elegant Wavy Human Hair Accessory,Wigs
111,$22.99,,https://www.jollychic.com/p/women-s-wig-silky-straight-ombre-hair-extension-accessory-g501574.html,Women's Wig Silky Straight Ombre Hair Extension Accessory,Wigs
44,$21.99,,https://www.jollychic.com/p/women-s-wig-chic-refined-mixed-color-straight-human-hair-accessory-g501630.html,Women's Wig Chic Refined Mixed Color Straight Human Hair Accessory,Wigs
308,$19.99,,https://www.jollychic.com/p/women-s-wig-natural-black-wavy-classy-human-hair-extension-g502954.html,Women's Wig Natural Black Wavy Classy Human Hair Extension,Wigs
628,$6.99,$11.99,https://www.jollychic.com/p/women-s-wig-vogue-enchanting-fair-lady-synthetic-accessory-g504998.html,Women's Wig Vogue Enchanting Fair Lady Synthetic Accessory,Wigs
190,$2.99,$5.99,https://www.jollychic.com/p/women-s-wig-sterling-enchanting-cosplay-long-straight-gradient-hair-extension-g505488.html,Women's Wig Sterling Enchanting Cosplay Long Straight Gradient Hair Extension,Wigs
163,$5.99,,https://www.jollychic.com/p/women-s-wig-stylish-attractive-kinky-bundled-ponytail-hair-extension-g505514.html,Women's Wig Stylish Attractive Kinky Bundled Ponytail Hair Extension,Wigs
12,$129.00,,https://www.jollychic.com/p/women-s-wig-sexy-charming-middle-length-sideswept-bangs-black-human-hair-g518094.html,Women's Wig Sexy Charming Middle Length Sideswept Bangs Black Human Hair,Wigs
39,$19.99,,https://www.jollychic.com/p/women-s-wig-trendy-all-match-long-straight-human-hair-accessory-g524068.html,Women's Wig Trendy All Match Long Straight Human Hair Accessory,Wigs
53,$69.00,,https://www.jollychic.com/p/women-s-wig-trendy-short-curly-hair-natural-human-hair-accessory-g528256.html,Women's Wig Trendy Short Curly Hair Natural Human Hair Accessory,Wigs
122,$59.00,$91.00,https://www.jollychic.com/p/women-s-wig-fashion-fringe-natural-preppy-medium-human-hair-accessory-g540120.html,Women's Wig Fashion Fringe Natural Preppy Medium Human Hair Accessory,Wigs
30,$142.00,,https://www.jollychic.com/p/women-s-wig-exquisite-natural-long-curly-human-hair-accessory-g540126.html,Women's Wig Exquisite Natural Long Curly Human Hair Accessory,Wigs
41,$137.00,,https://www.jollychic.com/p/women-s-wig-sexy-highlight-long-curly-human-hair-accessory-g555326.html,Women's Wig Sexy Highlight Long Curly Human Hair Accessory,Wigs
238,$38.99,$66.00,https://www.jollychic.com/p/women-s-wig-fashion-side-fringe-loose-short-natural-human-hair-accessory-g555330.html,Women's Wig Fashion Side Fringe Loose Short Natural Human Hair Accessory,Wigs
20,$71.00,,https://www.jollychic.com/p/women-s-wig-personality-sideswept-bangs-short-human-hair-wig-accessory-g572482.html,Women's Wig Personality Sideswept Bangs Short Human Hair Wig Accessory,Wigs
8,$142.00,,https://www.jollychic.com/p/women-s-wig-sweet-long-curly-natural-side-fringe-human-hair-accessory-g595690.html,Women's Wig Sweet Long Curly Natural Side Fringe Human Hair Accessory,Wigs
55,$47.99,,https://www.jollychic.com/p/women-s-wig-high-quality-body-wave-human-hair-weft-extensions-g613412.html,Women's Wig High Quality Body Wave Human Hair Weft Extensions,Wigs
52,$42.99,$69.00,https://www.jollychic.com/p/women-s-short-wig-winsome-simple-straight-inclined-bang-human-hair-accessory-g618758.html,Women's Short Wig Winsome Simple Straight Inclined Bang Human Hair Accessory,Wigs
11,$33.99,,https://www.jollychic.com/p/women-s-wig-unique-long-curly-synthetic-hair-replacement-wig-g620778.html,Women's Wig Unique Long Curly Synthetic Hair Replacement Wig,Wigs
238,$23.99,$25.99,https://www.jollychic.com/p/women-s-wig-classic-graceful-long-straight-glossy-brown-hair-wig-g624394.html,Women's Wig Classic Graceful Long Straight Glossy Brown Hair Wig,Wigs
20,$121.00,,https://www.jollychic.com/p/women-s-wig-simple-flowing-natural-blunt-bang-human-hair-accessory-g627614.html,Women's Wig Simple Flowing Natural Blunt Bang Human Hair Accessory,Wigs
65,$51.00,$65.00,https://www.jollychic.com/p/women-s-wig-ladylike-kinky-short-straight-black-human-hair-accessory-g632342.html,Women's Wig Ladylike Kinky Short Straight Black Human Hair Accessory,Wigs
31,$15.99,$24.99,https://www.jollychic.com/p/women-s-wig-voguish-natural-mid-split-straight-long-synthetic-hair-accessory-g653812.html,Women's Wig Voguish Natural Mid Split Straight Long Synthetic Hair Accessory,Wigs
99,$76.00,$146.00,https://www.jollychic.com/p/women-s-wig-mix-color-natural-shiny-soft-curly-long-fluffy-human-hair-accessory-g665508.html,Women's Wig Mix Color Natural Shiny Soft Curly Long Fluffy Human Hair Accessory,Wigs
10,$130.00,,https://www.jollychic.com/p/women-s-wig-voguish-shiny-bobo-style-straight-short-human-hair-accessory-g666668.html,Women's Wig Voguish Shiny Bobo Style Straight Short Human Hair Accessory,Wigs
61,$30.99,,https://www.jollychic.com/p/women-s-wig-various-sizes-natural-high-quality-human-hair-weave-accessory-g677540.html,Women's Wig Various Sizes Natural High Quality Human Hair Weave Accessory,Wigs
415,$18.99,$24.99,https://www.jollychic.com/p/women-s-wig-black-soft-tilted-frisette-curly-long-synthetic-hair-accessory-g677694.html,Women's Wig Black Soft Tilted Frisette Curly Long Synthetic Hair Accessory,Wigs
130,$13.99,$20.99,https://www.jollychic.com/p/women-s-wig-deep-brown-natural-lace-short-fashion-hair-synthetic-accessory-g678642.html,Women's Wig Deep Brown Natural Lace Short Fashion Hair Synthetic Accessory,Wigs
209,$17.99,$27.99,https://www.jollychic.com/p/women-s-wig-black-long-straight-fashion-hair-synthetic-accessory-g736602.html,Women's Wig Black Long Straight Fashion Hair Synthetic Accessory,Wigs
172,$17.99,$27.99,https://www.jollychic.com/p/women-s-wig-black-natural-curly-fashion-hair-synthetic-accessory-g736604.html,Women's Wig Black Natural Curly Fashion Hair Synthetic Accessory,Wigs
639,$58.00,$110.00,https://www.jollychic.com/p/women-s-charming-elegant-long-kinky-mature-fiber-hair-without-bangs-g751744.html,Women's Charming Elegant Long Kinky Mature Fiber Hair Without Bangs,Wigs
