add_wish,discount_price,original_price,product_link,product_name,header_block
48,$4.99,$8.99,https://www.jollychic.com/p/women-s-gloves-touchscreen-type-warm-cozy-sterling-solid-color-accessory-g467616.html,Women's Gloves Touchscreen Type Warm Cozy Sterling Solid Color Accessory,Gloves
42,$5.99,$10.99,https://www.jollychic.com/p/women-s-gloves-elegant-charming-solid-warm-sweet-ladylike-accessory-g467618.html,Women's Gloves Elegant Charming Solid Warm Sweet Ladylike Accessory,Gloves
55,$4.99,$8.99,https://www.jollychic.com/p/women-s-gloves-stylish-classy-plaid-sweet-high-end-accessory-g467632.html,Women's Gloves Stylish Classy Plaid Sweet High End Accessory,Gloves
130,$8.99,,https://www.jollychic.com/p/women-s-gloves-ladylike-laced-lovely-touchscreen-floral-decorative-accessory-g469068.html,Women's Gloves Ladylike Laced Lovely Touchscreen Floral Decorative Accessory,Gloves
166,$4.99,$8.99,https://www.jollychic.com/p/women-s-gloves-elegant-glam-soft-sterling-touchscreen-warm-accessory-g536248.html,Women's Gloves Elegant Glam Soft Sterling Touchscreen Warm Accessory,Gloves
124,$6.99,$13.99,https://www.jollychic.com/p/women-s-gloves-flower-laced-decorative-half-fingered-long-sleeve-gloves-g573686.html,Women's Gloves Flower Laced Decorative Half Fingered Long Sleeve Gloves,Gloves
125,$4.99,$13.99,https://www.jollychic.com/p/women-s-gloves-comfy-striped-bow-knot-ladylike-fingerless-long-arm-accessory-g573692.html,Women's Gloves Comfy Striped Bow Knot Ladylike Fingerless Long Arm Accessory,Gloves
225,$1.99,$5.99,https://www.jollychic.com/p/women-s-gloves-ladylike-solid-color-anti-uv-long-sleeve-comfy-gloves-accessory-g1039970.html,Women's Gloves Ladylike Solid Color Anti UV Long Sleeve Comfy Gloves Accessory,Gloves
100,$5.99,$14.99,https://www.jollychic.com/p/women-s-gloves-ladylike-flower-decor-anti-uv-lace-fingered-chiffon-accessory-g1040186.html,Women's Gloves Ladylike Flower Decor Anti UV Lace Fingered Chiffon Accessory,Gloves
605,$4.99,$12.99,https://www.jollychic.com/p/women-s-gloves-solid-color-uv-protection-half-fingered-long-sleeve-gloves-g1040190.html,Women's Gloves Solid Color UV Protection Half Fingered Long Sleeve Gloves,Gloves
355,$1.99,$5.99,https://www.jollychic.com/p/women-s-gloves-faddish-solid-color-anti-uv-half-fingered-long-sleeve-gloves-g1040192.html,Women's Gloves Faddish Solid Color Anti UV Half Fingered Long Sleeve Gloves,Gloves
47,$29.99,,https://www.jollychic.com/p/women-s-warm-gloves-unisex-tow-sides-using-fingered-comfortable-accessory-g1093196.html,Women's Warm Gloves Unisex Tow Sides Using Fingered Comfortable Accessory,Gloves
274,$15.99,$29.99,https://www.jollychic.com/p/women-s-gloves-geometry-pattern-decorative-sweet-style-faddish-accessory-g1130110.html,Women's Gloves Geometry Pattern Decorative Sweet Style Faddish Accessory,Gloves
605,$11.99,$18.99,https://www.jollychic.com/p/women-s-gloves-fashion-all-matched-waterproof-breathable-sports-gloves-g1153200.html,Women's Gloves Fashion All Matched Waterproof Breathable Sports Gloves,Gloves
141,$8.99,$17.99,https://www.jollychic.com/p/women-s-gloves-all-match-solid-elbow-stylish-sun-protection-accessory-g1175548.html,Women's Gloves All Match Solid Elbow Stylish Sun Protection Accessory,Gloves
108,$7.99,$13.99,https://www.jollychic.com/p/women-s-gloves-solid-fluffy-hair-breathable-waterproof-fashion-warm-accessory-g1175550.html,Women's Gloves Solid Fluffy Hair Breathable Waterproof Fashion Warm Accessory,Gloves
28,$6.99,$13.99,https://www.jollychic.com/p/women-s-gloves-lace-solid-color-sweet-style-sun-protection-accessory-g1175554.html,Women's Gloves Lace Solid Color Sweet Style Sun Protection Accessory,Gloves
39,$5.99,$9.99,https://www.jollychic.com/p/women-s-gloves-grenadine-dual-use-all-match-fashion-accessory-g1175702.html,Women's Gloves Grenadine Dual Use All Match Fashion Accessory,Gloves
138,$7.99,$14.99,https://www.jollychic.com/p/women-s-warm-gloves-fluffy-hair-decor-rhombus-sewing-thread-pattern-stylish-accessory-g1195624.html,Women's Warm Gloves Fluffy Hair Decor Rhombus Sewing Thread Pattern Stylish Accessory,Gloves
49,$5.99,$14.99,https://www.jollychic.com/p/women-s-warm-gloves-all-matched-comfy-soft-casual-touchscreen-gloves-accessory-g1301086.html,Women's Warm Gloves All Matched Comfy Soft Casual Touchscreen Gloves Accessory,Gloves
66,$3.99,$8.99,https://www.jollychic.com/p/women-s-gloves-solid-color-brief-style-faddish-all-match-charming-accessory-g1308294.html,Women's Gloves Solid Color Brief Style Faddish All Match Charming Accessory,Gloves
28,$4.99,$11.99,https://www.jollychic.com/p/women-s-gloves-hollow-out-ladylike-all-match-brief-style-faddish-accessory-g1308296.html,Women's Gloves Hollow Out Ladylike All Match Brief Style Faddish Accessory,Gloves
65,$3.99,$11.99,https://www.jollychic.com/p/women-s-gloves-solid-color-brief-style-faddish-all-match-warm-accessory-g1308298.html,Women's Gloves Solid Color Brief Style Faddish All Match Warm Accessory,Gloves
25,$5.99,$17.99,https://www.jollychic.com/p/1-pc-women-s-glove-ladylike-all-match-brief-style-faddish-accessory-g1308302.html,1 Pc Women's Glove Ladylike All Match Brief Style Faddish Accessory,Gloves
13,$14.99,,https://www.jollychic.com/p/women-s-gloves-warm-simple-patchwork-design-gloves-accessory-g1340256.html,Women's Gloves Warm Simple Patchwork Design Gloves Accessory,Gloves
32,$7.99,$16.99,https://www.jollychic.com/p/women-s-warm-gloves-flower-decor-patchwork-design-stylish-gloves-accessory-g1340322.html,Women's Warm Gloves Flower Decor Patchwork Design Stylish Gloves Accessory,Gloves
39,$3.99,$12.99,https://www.jollychic.com/p/women-s-sun-protection-gloves-solid-color-simple-style-all-match-accessory-g1344902.html,Women's Sun Protection Gloves Solid Color Simple Style All Match Accessory,Gloves
685,$3.99,$11.99,https://www.jollychic.com/p/women-s-warm-gloves-solid-color-knitted-short-fingerless-gloves-accessory-g1357350.html,Women's Warm Gloves Solid Color Knitted Short Fingerless Gloves Accessory,Gloves
98,$7.99,$14.99,https://www.jollychic.com/p/women-s-warm-gloves-chic-candy-color-brief-long-pattern-gloves-accessory-g1358408.html,Women's Warm Gloves Chic Candy Color Brief Long Pattern Gloves Accessory,Gloves
107,$7.99,$14.99,https://www.jollychic.com/p/women-s-warm-gloves-geometric-pattern-solid-color-vogue-long-pattern-gloves-accessory-g1358410.html,Women's Warm Gloves Geometric Pattern Solid Color Vogue Long Pattern Gloves Accessory,Gloves
127,$7.99,$14.99,https://www.jollychic.com/p/women-s-warm-gloves-geometric-pattern-solid-color-patchwork-gloves-accessory-g1358412.html,Women's Warm Gloves Geometric Pattern Solid Color Patchwork Gloves Accessory,Gloves
81,$7.99,$14.99,https://www.jollychic.com/p/women-s-warm-gloves-geometric-pattern-hollowed-out-long-pattern-gloves-accessory-g1358414.html,Women's Warm Gloves Geometric Pattern Hollowed Out Long Pattern Gloves Accessory,Gloves
102,$6.99,$12.99,https://www.jollychic.com/p/women-s-warm-gloves-mixed-color-snowflake-print-knitted-short-fingerless-accessory-g1358416.html,Women's Warm Gloves Mixed Color Snowflake Print Knitted Short Fingerless Accessory,Gloves
35,$6.99,$13.99,https://www.jollychic.com/p/women-s-warm-gloves-personalized-skull-print-knitted-fingerless-soft-gloves-accessory-g1358418.html,Women's Warm Gloves Personalized Skull Print Knitted Fingerless Soft Gloves Accessory,Gloves
79,$5.99,$11.99,https://www.jollychic.com/p/women-s-warm-gloves-preppy-style-mixed-color-striped-fingerless-gloves-accessory-g1358420.html,Women's Warm Gloves Preppy Style Mixed Color Striped Fingerless Gloves Accessory,Gloves
215,$5.99,$11.99,https://www.jollychic.com/p/women-s-warm-gloves-color-block-chic-all-match-knitted-fingerless-gloves-accessory-g1358422.html,Women's Warm Gloves Color Block Chic All Match Knitted Fingerless Gloves Accessory,Gloves
132,$6.99,$13.99,https://www.jollychic.com/p/women-s-warm-gloves-simple-animal-pattern-knitted-long-pattern-fingerless-gloves-accessory-g1358424.html,Women's Warm Gloves Simple Animal Pattern Knitted Long Pattern Fingerless Gloves Accessory,Gloves
105,$6.99,$13.99,https://www.jollychic.com/p/women-s-warm-gloves-vogue-mixed-color-snowflake-print-long-fingerless-gloves-accessory-g1358426.html,Women's Warm Gloves Vogue Mixed Color Snowflake Print Long Fingerless Gloves Accessory,Gloves
80,$7.99,$14.99,https://www.jollychic.com/p/women-s-warm-gloves-solid-color-geometric-pattern-knitted-long-pattern-gloves-accessory-g1358432.html,Women's Warm Gloves Solid Color Geometric Pattern Knitted Long Pattern Gloves Accessory,Gloves
97,$7.99,$14.99,https://www.jollychic.com/p/women-s-warm-gloves-brief-geometric-pattern-knitted-fingerless-gloves-accessory-g1358434.html,Women's Warm Gloves Brief Geometric Pattern Knitted Fingerless Gloves Accessory,Gloves
209,$6.99,$13.99,https://www.jollychic.com/p/women-s-warm-gloves-all-match-fashion-casual-knitted-fingerless-gloves-accessory-g1358436.html,Women's Warm Gloves All Match Fashion Casual Knitted Fingerless Gloves Accessory,Gloves
47,$6.99,$13.99,https://www.jollychic.com/p/women-s-warm-gloves-chic-color-block-all-match-knitted-fingerless-gloves-accessory-g1358438.html,Women's Warm Gloves Chic Color Block All Match Knitted Fingerless Gloves Accessory,Gloves
130,$4.99,$12.99,https://www.jollychic.com/p/women-s-glove-solid-color-all-match-sweet-style-brief-accessory-g1362436.html,Women's Glove Solid Color All Match Sweet Style Brief Accessory,Gloves
85,$5.99,$10.99,https://www.jollychic.com/p/women-s-sun-protection-gloves-uv-simple-style-all-match-outdoor-accessory-g1363542.html,Women's Sun Protection Gloves UV Simple Style All Match Outdoor Accessory,Gloves
15,$22.99,,https://www.jollychic.com/p/women-s-winter-gloves-windproof-warm-outdoor-sport-cycling-gloves-g1367040.html,Women's Winter Gloves Windproof Warm Outdoor Sport Cycling Gloves,Gloves
176,$8.99,$17.99,https://www.jollychic.com/p/women-s-gloves-solid-color-warm-sweet-style-brief-accessory-g1381276.html,Women's Gloves Solid Color Warm Sweet Style Brief Accessory,Gloves
68,$14.99,,https://www.jollychic.com/p/women-s-glove-ladylike-solid-color-all-match-sweet-style-brief-accessory-g1381278.html,Women's Glove Ladylike Solid Color All Match Sweet Style Brief Accessory,Gloves
588,$6.99,$14.99,https://www.jollychic.com/p/women-s-gloves-knitted-lace-fingerless-warm-soft-gloves-g1381282.html,Women's Gloves Knitted Lace Fingerless Warm Soft Gloves,Gloves
5,$9.99,$22.99,https://www.jollychic.com/p/women-s-gloves-double-layer-fluff-lace-ornament-warm-stylish-gloves-accessories-g1432436.html,Women's Gloves Double Layer Fluff Lace Ornament Warm Stylish Gloves Accessories,Gloves
4,$9.99,$22.99,https://www.jollychic.com/p/women-s-gloves-double-layer-warm-lace-ornament-trendy-gloves-accessories-g1432440.html,Women's Gloves Double Layer Warm Lace Ornament Trendy Gloves Accessories,Gloves
5,$6.99,$17.99,https://www.jollychic.com/p/women-s-gloves-bow-knot-ornament-warm-simple-gloves-accessories-g1432486.html,Women's Gloves Bow Knot Ornament Warm Simple Gloves Accessories,Gloves
2,$19.99,,https://www.jollychic.com/p/women-s-gloves-patchwork-design-fluff-lace-warm-elegant-gloves-accessory-g1432684.html,Women's Gloves Patchwork Design Fluff Lace Warm Elegant Gloves Accessory,Gloves
5,$14.99,,https://www.jollychic.com/p/women-s-gloves-skid-resistance-patchwork-design-flower-decor-warm-gloves-accessory-g1432702.html,Women's Gloves Skid Resistance Patchwork Design Flower Decor Warm Gloves Accessory,Gloves
40,$11.99,,https://www.jollychic.com/p/women-s-gloves-hollow-out-short-color-block-warm-casual-glove-accessory-g1433144.html,Women's Gloves Hollow Out Short Color Block Warm Casual Glove Accessory,Gloves
6,$13.99,,https://www.jollychic.com/p/women-s-gloves-long-pattern-pompon-decoration-sweet-warm-cozy-glove-accessory-g1433152.html,Women's Gloves Long Pattern Pompon Decoration Sweet Warm Cozy Glove Accessory,Gloves
39,$5.99,$11.99,https://www.jollychic.com/p/women-s-gloves-knitted-color-block-short-pattern-all-match-keep-warm-glove-accessory-g1433156.html,Women's Gloves Knitted Color Block Short Pattern All Match Keep Warm Glove Accessory,Gloves
37,$5.99,$11.99,https://www.jollychic.com/p/women-s-gloves-solid-color-short-pattern-brief-style-all-match-glove-accessory-g1433158.html,Women's Gloves Solid Color Short Pattern Brief Style All Match Glove Accessory,Gloves
228,$5.99,$10.99,https://www.jollychic.com/p/women-s-gloves-short-pattern-brief-style-solid-color-all-match-glove-accessory-g1433168.html,Women's Gloves Short Pattern Brief Style Solid Color All Match Glove Accessory,Gloves
16,$11.99,,https://www.jollychic.com/p/women-s-gloves-solid-color-hollow-out-long-pattern-simple-style-glove-accessory-g1433170.html,Women's Gloves Solid Color Hollow Out Long Pattern Simple Style Glove Accessory,Gloves
27,$11.99,,https://www.jollychic.com/p/women-s-gloves-five-pointer-star-pattern-color-block-sweet-short-glove-accessory-g1433732.html,Women's Gloves Five Pointer Star Pattern Color Block Sweet Short Glove Accessory,Gloves
16,$11.99,,https://www.jollychic.com/p/women-s-gloves-color-block-hollow-out-short-simple-style-glove-accessory-g1433734.html,Women's Gloves Color Block Hollow Out Short Simple Style Glove Accessory,Gloves
33,$10.99,,https://www.jollychic.com/p/women-s-gloves-long-pattern-solid-color-ladylike-chic-glove-accessory-g1434284.html,Women's Gloves Long Pattern Solid Color Ladylike Chic Glove Accessory,Gloves
47,$10.99,,https://www.jollychic.com/p/women-s-gloves-solid-color-knitting-short-brief-style-chic-glove-accessory-g1434286.html,Women's Gloves Solid Color Knitting Short Brief Style Chic Glove Accessory,Gloves
27,$10.99,,https://www.jollychic.com/p/women-s-gloves-short-solid-color-knitting-ladylike-glove-accessory-g1434288.html,Women's Gloves Short Solid Color Knitting Ladylike Glove Accessory,Gloves
41,$11.99,,https://www.jollychic.com/p/women-s-gloves-solid-color-knitting-ladylike-charming-glove-accessory-g1434290.html,Women's Gloves Solid Color Knitting Ladylike Charming Glove Accessory,Gloves
562,$9.99,,https://www.jollychic.com/p/women-s-gloves-short-plain-style-solid-color-graceful-chic-glove-accessory-g1434294.html,Women's Gloves Short Plain Style Solid Color Graceful Chic Glove Accessory,Gloves
103,$10.99,,https://www.jollychic.com/p/women-s-gloves-button-decoration-solid-color-elegant-glove-accessory-g1434296.html,Women's Gloves Button Decoration Solid Color Elegant Glove Accessory,Gloves
8,$17.99,,https://www.jollychic.com/p/women-s-gloves-ladylike-all-match-brief-style-solid-color-faddish-accessory-g1449528.html,Women's Gloves Ladylike All Match Brief Style Solid Color Faddish Accessory,Gloves
19,$17.99,,https://www.jollychic.com/p/women-s-gloves-warm-solid-color-preppy-style-faddish-accessory-g1449534.html,Women's Gloves Warm Solid Color Preppy Style Faddish Accessory,Gloves
4,$17.99,,https://www.jollychic.com/p/women-s-warm-gloves-solid-color-all-matched-fashion-accessory-g1451618.html,Women's Warm Gloves Solid Color All Matched Fashion Accessory,Gloves
37,$14.99,,https://www.jollychic.com/p/women-s-warm-gloves-chic-heart-shaped-pattern-preppy-style-versatile-accessory-g1451620.html,Women's Warm Gloves Chic Heart Shaped Pattern Preppy Style Versatile Accessory,Gloves
56,$9.99,,https://www.jollychic.com/p/women-s-warm-glove-diamond-pattern-knitting-cute-half-finger-thick-warm-gloves-g1457624.html,Women's Warm Glove Diamond Pattern Knitting Cute Half Finger Thick Warm Gloves,Gloves
25,$13.99,,https://www.jollychic.com/p/women-s-gloves-long-pattern-solid-color-knitting-keep-warm-chic-glove-accessory-g1465244.html,Women's Gloves Long Pattern Solid Color Knitting Keep Warm Chic Glove Accessory,Gloves
77,$10.99,,https://www.jollychic.com/p/woman-s-gloves-short-pattern-solid-color-keep-warm-all-match-chic-glove-accessory-g1465250.html,Woman's Gloves Short Pattern Solid Color Keep Warm All Match Chic Glove Accessory,Gloves
60,$10.99,,https://www.jollychic.com/p/woman-s-gloves-solid-color-warm-short-casual-comfy-all-match-fashion-shoes-g1465306.html,Woman's Gloves Solid Color Warm Short Casual Comfy All Match Fashion Shoes,Gloves
572,$4.99,$10.99,https://www.jollychic.com/p/women-s-gloves-solid-color-all-match-casual-comfortable-fashion-glove-accessory-g1465312.html,Women's Gloves Solid Color All Match Casual Comfortable Fashion Glove Accessory,Gloves
16,$7.99,$17.99,https://www.jollychic.com/p/long-sleeve-gloves-cashmere-exposed-half-finger-solid-color-warm-gloves-g1486884.html,Long Sleeve Gloves Cashmere Exposed Half Finger Solid Color Warm Gloves,Gloves
21,$11.99,,https://www.jollychic.com/p/women-s-gloves-elegant-all-matched-lace-versatile-chic-accessory-g1491242.html,Women's Gloves Elegant All Matched Lace Versatile Chic Accessory,Gloves
4,$14.99,$21.99,https://www.jollychic.com/p/women-s-gloves-knitting-wool-fluffy-hair-ornament-casual-warm-couple-gloves-g1494230.html,Women's Gloves Knitting Wool Fluffy Hair Ornament Casual Warm Couple Gloves,Gloves
51,$14.99,$21.99,https://www.jollychic.com/p/women-s-gloves-solid-color-brief-style-faddish-all-match-warm-accessory-g1515822.html,Women's Gloves Solid Color Brief Style Faddish All Match Warm Accessory,Gloves
12,$14.99,$21.99,https://www.jollychic.com/p/women-s-gloves-brief-style-faddish-solid-color-trendy-all-match-accessory-g1515824.html,Women's Gloves Brief Style Faddish Solid Color Trendy All Match Accessory,Gloves
51,$7.99,$10.99,https://www.jollychic.com/p/women-s-gloves-solid-color-brief-style-knitted-long-fingerless-gloves-accessory-g1517160.html,Women's Gloves Solid Color Brief Style Knitted Long Fingerless Gloves Accessory,Gloves
9,$7.99,$10.99,https://www.jollychic.com/p/women-s-warm-gloves-mixed-color-fingerless-soft-knitted-gloves-accessory-g1517206.html,Women's Warm Gloves Mixed Color Fingerless Soft Knitted Gloves Accessory,Gloves
17,$6.99,$9.99,https://www.jollychic.com/p/women-s-warm-gloves-knitted-solid-color-long-fingerless-gloves-accessory-g1517210.html,Women's Warm Gloves Knitted Solid Color Long Fingerless Gloves Accessory,Gloves
12,$7.99,$10.99,https://www.jollychic.com/p/women-s-warm-gloves-knitted-snowflake-pattern-soft-long-fingerless-gloves-accessory-g1517222.html,Women's Warm Gloves Knitted Snowflake Pattern Soft Long Fingerless Gloves Accessory,Gloves
10,$7.99,$10.99,https://www.jollychic.com/p/women-s-warm-gloves-knitted-lovely-cartoon-pattern-vogue-gloves-accessory-g1517230.html,Women's Warm Gloves Knitted Lovely Cartoon Pattern Vogue Gloves Accessory,Gloves
48,$6.99,$9.99,https://www.jollychic.com/p/women-s-knitted-gloves-all-match-trendy-fingerless-soft-warm-gloves-accessory-g1517238.html,Women's Knitted Gloves All Match Trendy Fingerless Soft Warm Gloves Accessory,Gloves
11,$9.99,$13.99,https://www.jollychic.com/p/women-s-warm-gloves-chic-lace-patchwork-ladylike-hollowed-all-match-gloves-accessory-g1517254.html,Women's Warm Gloves Chic Lace Patchwork Ladylike Hollowed All Match Gloves Accessory,Gloves
14,$7.99,$10.99,https://www.jollychic.com/p/women-s-gloves-ladylike-lace-patchwork-knitted-short-pattern-gloves-accessory-g1517976.html,Women's Gloves Ladylike Lace Patchwork Knitted Short Pattern Gloves Accessory,Gloves
18,$7.99,$11.99,https://www.jollychic.com/p/women-s-gloves-solid-color-knitted-soft-warm-long-pattern-gloves-accessory-g1517980.html,Women's Gloves Solid Color Knitted Soft Warm Long Pattern Gloves Accessory,Gloves
13,$7.99,$10.99,https://www.jollychic.com/p/women-s-gloves-mixed-color-vogue-knitted-short-fingerless-gloves-accessory-g1517984.html,Women's Gloves Mixed Color Vogue Knitted Short Fingerless Gloves Accessory,Gloves
42,$19.99,,https://www.jollychic.com/p/women-s-glove-cut-cat-pad-pattern-half-finger-warm-glove-accessory-g1537406.html,Women's Glove Cut Cat-pad Pattern Half Finger Warm Glove Accessory,Gloves
79,$16.99,,https://www.jollychic.com/p/women-s-glove-half-finger-woolen-pattern-fashion-warm-glove-accessory-g1537410.html,Women's Glove Half finger Woolen Pattern Fashion Warm Glove Accessory,Gloves
49,$25.99,,https://www.jollychic.com/p/women-s-glove-solid-color-outdoor-touch-screen-leather-warm-gloves-accessory-g1537414.html,Women 's Glove Solid Color Outdoor Touch Screen Leather Warm Gloves Accessory,Gloves
44,$21.99,,https://www.jollychic.com/p/women-s-glove-solid-color-outdoor-touch-screen-brushed-warm-glove-accessory-g1537418.html,Women's Glove Solid Color Outdoor Touch Screen Brushed Warm Glove Accessory,Gloves
36,$17.99,,https://www.jollychic.com/p/women-s-glove-color-contrast-half-finger-fashion-retro-woolen-glove-accessory-g1537422.html,Women's Glove Color Contrast Half Finger Fashion Retro Woolen Glove Accessory,Gloves
19,$21.99,,https://www.jollychic.com/p/2-pcs-women-s-glove-solid-color-cut-cony-hair-warm-glove-accessory-g1537424.html,2 Pcs Women's Glove Solid Color Cut Cony Hair Warm Glove Accessory,Gloves
15,$21.99,,https://www.jollychic.com/p/2-pcs-women-s-gloves-solid-color-touch-screen-warm-glove-assessories-g1537426.html,2 Pcs Women's Gloves Solid Color Touch Screen Warm Glove Assessories,Gloves
7,$18.99,,https://www.jollychic.com/p/women-s-warm-gloves-solid-color-personalized-touchscreen-fashion-glove-accessory-g1555392.html,Women's Warm Gloves Solid Color Personalized Touchscreen Fashion Glove Accessory,Gloves
28,$21.99,,https://www.jollychic.com/p/women-s-warm-gloves-touchscreen-deer-pattern-sweet-keep-warm-faddish-glove-accessory-g1566048.html,Women's Warm Gloves Touchscreen Deer Pattern Sweet Keep Warm Faddish Glove Accessory,Gloves
10,$21.99,,https://www.jollychic.com/p/women-s-gloves-keep-warm-color-block-pompon-decoration-sweet-ladylike-glove-accessory-g1566054.html,Women's Gloves Keep Warm Color Block Pompon Decoration Sweet Ladylike Glove Accessory,Gloves
139,$11.99,,https://www.jollychic.com/p/new-in-soft-thicken-solid-quilted-winter-gloves-g69070.html,New In Soft Thicken Solid Quilted Winter Gloves,Gloves
49,$23.99,$36.99,https://www.jollychic.com/p/patchwork-buckle-thermal-gloves-g216773.html,Patchwork Buckle Thermal Gloves,Gloves
83,$8.99,$14.99,https://www.jollychic.com/p/women-s-gloves-ladylike-refined-bow-knot-touchscreen-type-accessory-g467634.html,Women's Gloves Ladylike Refined Bow Knot Touchscreen Type Accessory,Gloves
172,$8.99,$13.99,https://www.jollychic.com/p/women-s-gloves-fingerless-long-lace-uv-protection-sleeve-gloves-g573676.html,Women's Gloves Fingerless Long Lace UV Protection Sleeve Gloves,Gloves
48,$5.99,$14.99,https://www.jollychic.com/p/women-s-gloves-ladylike-flower-decor-anti-uv-lace-fingered-trendy-accessory-g1040184.html,Women's Gloves Ladylike Flower Decor Anti UV Lace Fingered Trendy Accessory,Gloves
67,$5.99,$14.99,https://www.jollychic.com/p/women-s-gloves-sweet-bow-knot-decor-uv-protection-lace-fingered-accessory-g1040188.html,Women's Gloves Sweet Bow Knot Decor UV Protection Lace Fingered Accessory,Gloves
244,$11.99,$19.99,https://www.jollychic.com/p/women-s-warm-gloves-solid-color-half-fingered-stylish-accessory-g1095124.html,Women's Warm Gloves Solid Color Half Fingered Stylish Accessory,Gloves
55,$25.99,$52.00,https://www.jollychic.com/p/3-pcs-women-s-gloves-color-block-warm-sweet-style-faddish-accessory-g1130096.html,3 Pcs Women's Gloves Color Block Warm Sweet Style Faddish Accessory,Gloves
16,$39.99,$66.00,https://www.jollychic.com/p/3-pcs-women-s-gloves-set-geometry-pattern-decorative-sweet-style-faddish-accessory-g1130098.html,3 Pcs Women's Gloves Set Geometry Pattern Decorative Sweet Style Faddish Accessory,Gloves
25,$32.99,,https://www.jollychic.com/p/women-s-gloves-ladylike-all-match-brief-style-faddish-accessory-g1130100.html,Women's Gloves Ladylike All Match Brief Style Faddish Accessory,Gloves
8,$29.99,,https://www.jollychic.com/p/women-s-gloves-brief-style-flowers-decorative-warm-faddish-accessory-g1130102.html,Women's Gloves Brief Style Flowers Decorative Warm Faddish Accessory,Gloves
15,$29.99,,https://www.jollychic.com/p/women-s-gloves-solid-color-warm-sweet-style-faddish-accessory-g1130108.html,Women's Gloves Solid Color Warm Sweet Style Faddish Accessory,Gloves
48,$10.99,$17.99,https://www.jollychic.com/p/women-s-gloves-all-match-solid-color-wearable-fashion-warm-accessory-g1175650.html,Women's Gloves All Match Solid Color Wearable Fashion Warm Accessory,Gloves
33,$21.99,,https://www.jollychic.com/p/women-s-gloves-bow-knot-decor-solid-color-rhombic-sewing-thread-wearable-fashion-warm-accessory-g1195626.html,Women's Gloves Bow Knot Decor Solid Color Rhombic Sewing Thread Wearable Fashion Warm Accessory,Gloves
9,$15.99,,https://www.jollychic.com/p/women-s-gloves-skid-resistance-patchwork-design-thick-warm-gloves-accessory-g1340246.html,Women's Gloves Skid Resistance Patchwork Design Thick Warm Gloves Accessory,Gloves
180,$5.99,$11.99,https://www.jollychic.com/p/women-s-warm-gloves-solid-color-brief-all-match-knitted-fingerless-gloves-accessory-g1358430.html,Women's Warm Gloves Solid Color Brief All Match Knitted Fingerless Gloves Accessory,Gloves
17,$9.99,$22.99,https://www.jollychic.com/p/women-s-gloves-ladylike-all-matched-hollowed-out-chic-accessory-g1378654.html,Women's Gloves Ladylike All Matched Hollowed Out Chic Accessory,Gloves
2,$9.99,$22.99,https://www.jollychic.com/p/women-s-gloves-lace-ornament-warm-elegant-solid-color-gloves-accessories-g1432444.html,Women's Gloves Lace Ornament Warm Elegant Solid Color Gloves Accessories,Gloves
5,$19.99,,https://www.jollychic.com/p/women-s-gloves-warm-comfy-bow-knot-fluff-ornament-elegant-gloves-accessories-g1432542.html,Women's Gloves Warm Comfy Bow Knot Fluff Ornament Elegant Gloves Accessories,Gloves
3,$21.99,,https://www.jollychic.com/p/women-s-gloves-lacework-ornament-patchwork-design-warm-sweet-gloves-accessories-g1432560.html,Women's Gloves Lacework Ornament Patchwork Design Warm Sweet Gloves Accessories,Gloves
9,$8.99,$19.99,https://www.jollychic.com/p/women-s-gloves-simple-warm-patchwork-design-practical-gloves-accessory-g1432596.html,Women's Gloves Simple Warm Patchwork Design Practical Gloves Accessory,Gloves
