add_wish,discount_price,original_price,product_link,product_name,header_block
22,$25.99,$35.99,http://www.jollychic.com/p/women-s-swimwear-set-color-block-o-neck-long-sleeve-conservative-tankini-suit-g1225396.html,Women's Swimwear Set Color Block O Neck Long Sleeve Conservative Tankini Suit,Beachwear
15,$23.99,$33.99,http://www.jollychic.com/p/women-s-swimsuit-color-block-letters-pattern-long-sleeve-surfing-set-g1279888.html,Women's Swimsuit Color Block Letters Pattern Long Sleeve Surfing Set,Beachwear
77,$13.99,$15.99,http://www.jollychic.com/p/ruffles-hems-padded-blue-cool-2pcs-swimwear-suit-g254859.html,Ruffles Hems Padded Blue Cool 2Pcs Swimwear Suit,Beachwear
404,$11.99,$17.99,http://www.jollychic.com/p/2pcs-halter-neck-floral-tropical-bikini-swimsuits-g285554.html,2Pcs Halter Neck Floral Tropical Bikini Swimsuits,Beachwear
2646,$11.99,$15.99,http://www.jollychic.com/p/women-s-deep-v-neck-hollow-out-bikini-veil-g354158.html,Women's Deep V Neck Hollow Out Bikini Veil,Beachwear
1063,$4.99,,http://www.jollychic.com/p/women-s-solid-color-patchwork-swimming-hat-g399674.html,Women's Solid Color Patchwork Swimming Hat,Beachwear
768,$14.99,$24.99,http://www.jollychic.com/p/women-s-swimwear-solid-color-mesh-patchwork-hollow-out-swimwear-dress-g482668.html,Women's Swimwear Solid Color Mesh Patchwork Hollow Out Swimwear Dress,Beachwear
2335,$15.99,$23.99,http://www.jollychic.com/p/women-s-swimwear-color-patchwork-zipper-faddish-swimwear-tankini-g512090.html,Women's Swimwear Color Patchwork Zipper Faddish Swimwear Tankini,Beachwear
135,$15.99,$24.99,http://www.jollychic.com/p/women-s-swimwear-color-block-vintage-one-piece-tankini-g524502.html,Women's Swimwear Color Block Vintage One Piece Tankini,Beachwear
266,$13.99,$22.99,http://www.jollychic.com/p/women-s-swimwear-hollow-out-underwire-sexy-one-piece-tankini-g540624.html,Women's Swimwear Hollow Out Underwire Sexy One Piece Tankini,Beachwear
356,$13.99,$20.99,http://www.jollychic.com/p/women-s-swimwear-striped-slash-neck-short-sleeve-removable-halter-sexy-bikini-g564622.html,Women's Swimwear Striped Slash Neck Short Sleeve Removable Halter Sexy Bikini,Beachwear
500,$10.99,$17.99,http://www.jollychic.com/p/women-s-cover-up-classic-pattern-see-through-beach-cover-up-g576646.html,Women's Cover Up Classic Pattern See Through Beach Cover Up,Beachwear
439,$13.99,$19.99,http://www.jollychic.com/p/women-s-swimwear-solid-halter-top-high-waist-geometric-briefs-faddish-bikini-set-g581650.html,Women's Swimwear Solid Halter Top High Waist Geometric Briefs Faddish Bikini Set,Beachwear
50,$25.99,,http://www.jollychic.com/p/women-s-swimwear-ethnic-lace-patchwork-spaghetti-straps-vintage-bikini-set-g596722.html,Women's Swimwear Ethnic Lace Patchwork Spaghetti Straps Vintage Bikini Set,Beachwear
94,$37.99,,http://www.jollychic.com/p/women-s-3pcs-swimwear-classic-pattern-cover-ups-halterneck-bikini-suit-g600148.html,Women's 3Pcs Swimwear Classic Pattern Cover Ups Halterneck Bikini Suit,Beachwear
467,$13.99,$21.99,http://www.jollychic.com/p/women-s-3pcs-swimwear-black-lace-cover-ups-pure-color-halterneck-bikini-set-g604678.html,Women's 3Pcs Swimwear Black Lace Cover Ups Pure Color Halterneck Bikini Set,Beachwear
913,$12.99,$18.99,http://www.jollychic.com/p/women-s-swimwear-deep-v-neck-tassel-elastic-sexy-one-piece-tankini-g606370.html,Women's Swimwear Deep V Neck Tassel Elastic Sexy One Piece Tankini,Beachwear
1663,$31.99,$37.99,http://www.jollychic.com/p/women-s-swimwear-front-zipper-color-block-sexy-one-piece-tankini-g609444.html,Women's Swimwear Front Zipper Color Block Sexy One Piece Tankini,Beachwear
246,$10.99,$15.99,http://www.jollychic.com/p/women-s-swimwear-solid-sleeveless-sexy-tankini-g611810.html,Women's Swimwear Solid Sleeveless Sexy Tankini,Beachwear
699,$25.99,$39.99,http://www.jollychic.com/p/women-s-3pcs-swimwear-long-sleeve-front-open-cover-ups-halter-ethnic-bikini-suit-g613636.html,Women's 3Pcs Swimwear Long Sleeve Front Open Cover Ups Halter Ethnic Bikini Suit,Beachwear
94,$44.99,,http://www.jollychic.com/p/women-s-swimwear-v-neck-bow-halterneck-push-up-one-piece-tankini-dress-g614286.html,Women's Swimwear V Neck Bow Halterneck Push Up One Piece Tankini Dress,Beachwear
305,$11.99,$17.99,http://www.jollychic.com/p/women-s-swimwear-v-neck-hollow-out-back-ethnic-pattern-one-piece-tankini-dress-g627300.html,Women's Swimwear V Neck Hollow Out Back Ethnic Pattern One Piece Tankini Dress,Beachwear
777,$24.99,,http://www.jollychic.com/p/women-s-swimwear-colorblock-simple-patchwork-sexy-split-bikini-swimming-suit-g646464.html,Women's Swimwear Colorblock Simple Patchwork Sexy Split Bikini Swimming Suit,Beachwear
213,$12.99,$15.99,http://www.jollychic.com/p/women-s-swimwear-solid-color-v-neck-crossover-straps-slim-one-piece-tankini-g657360.html,Women's Swimwear Solid Color V Neck Crossover Straps Slim One Piece Tankini,Beachwear
55,$13.99,$17.99,http://www.jollychic.com/p/women-s-swimwear-topmelon-bohemia-beach-floral-cover-ups-sexy-skirt-g657932.html,Women's Swimwear Topmelon Bohemia Beach Floral Cover Ups Sexy Skirt,Beachwear
122,$11.99,$17.99,http://www.jollychic.com/p/women-s-swimwear-set-color-block-patchwork-halterneck-sexy-bikini-set-g675252.html,Women's Swimwear Set Color Block Patchwork Halterneck Sexy Bikini Set,Beachwear
16,$27.99,,http://www.jollychic.com/p/women-s-swimwear-black-spaghetti-straps-side-hollow-out-one-piece-tankini-g685696.html,Women's Swimwear Black Spaghetti Straps Side Hollow Out One Piece Tankini,Beachwear
476,$18.99,$29.99,http://www.jollychic.com/p/women-s-swimwear-set-solid-color-flowers-appliques-halterneck-sweet-tankini-suit-g688242.html,Women's Swimwear Set Solid Color Flowers Appliques Halterneck Sweet Tankini Suit,Beachwear
179,$13.99,$20.99,http://www.jollychic.com/p/women-s-swimwear-solid-color-push-up-crossover-straps-slim-one-piece-swim-dress-g688458.html,Women's Swimwear Solid Color Push-Up Crossover Straps Slim One Piece Swim Dress,Beachwear
62,$17.99,,http://www.jollychic.com/p/women-s-2-pcs-swimwear-blue-and-white-pattern-simple-sexy-slim-split-bikini-set-g737100.html,Women's 2 Pcs Swimwear Blue And White Pattern Simple Sexy Slim Split Bikini Set,Beachwear
372,$14.99,$20.99,http://www.jollychic.com/p/women-s-swimwear-solid-color-lace-hollow-out-half-sleeve-long-cover-ups-dress-g740408.html,Women's Swimwear Solid Color Lace Hollow Out Half Sleeve Long Cover Ups Dress,Beachwear
461,$10.99,$15.99,http://www.jollychic.com/p/women-s-swimwear-solid-color-short-sleeve-side-split-long-cover-ups-dress-g740560.html,Women's Swimwear Solid Color Short Sleeve Side Split Long Cover Ups Dress,Beachwear
75,$31.99,,http://www.jollychic.com/p/women-s-swimwear-floral-backless-halterneck-cover-up-dress-sweet-bikini-set-g751242.html,Women's Swimwear Floral Backless Halterneck Cover Up Dress Sweet Bikini Set,Beachwear
10,$18.99,,http://www.jollychic.com/p/women-s-swimwear-solid-color-backless-sleeveless-slim-one-piece-tankin-g753746.html,Women's Swimwear Solid Color Backless Sleeveless Slim One Piece Tankin,Beachwear
19,$22.99,,http://www.jollychic.com/p/women-s-2-pcs-swimwear-colorblock-floral-simple-sexy-slim-split-bikini-set-g791588.html,Women's 2 Pcs Swimwear Colorblock Floral Simple Sexy Slim Split Bikini Set,Beachwear
27,$35.99,,http://www.jollychic.com/p/women-s-3pcs-swimwear-solid-color-cascading-ruffles-cover-ups-sexy-bikini-suit-g795310.html,Women's 3Pcs Swimwear Solid Color Cascading Ruffles Cover Ups Sexy Bikini Suit,Beachwear
122,$19.99,$30.99,http://www.jollychic.com/p/women-s-2-pcs-swimwear-o-neck-underwire-sexy-split-tankini-suit-g809794.html,Women's 2 Pcs Swimwear O Neck Underwire Sexy Split Tankini Suit,Beachwear
132,$15.99,$23.99,http://www.jollychic.com/p/women-s-swimwear-brief-style-letter-pattern-racerback-one-piece-tankini-g815008.html,Women's Swimwear Brief Style Letter Pattern Racerback One Piece Tankini,Beachwear
58,$24.99,,http://www.jollychic.com/p/women-s-swimwear-solid-color-halterneck-beach-sexy-cover-up-g865042.html,Women's Swimwear Solid Color Halterneck Beach Sexy Cover Up,Beachwear
245,$19.99,,http://www.jollychic.com/p/women-s-swimwear-pure-color-v-neck-short-sleeve-long-cover-up-dress-g870632.html,Women's Swimwear Pure Color V Neck Short Sleeve Long Cover Up Dress,Beachwear
13,$15.99,,http://www.jollychic.com/p/women-s-2-pcs-swimwear-stylish-feather-floral-pattern-stylish-tankini-set-g871750.html,Women's 2 Pcs Swimwear Stylish Feather Floral Pattern Stylish Tankini Set,Beachwear
57,$24.99,,http://www.jollychic.com/p/women-s-swimwear-solid-color-deep-v-long-sleeve-slim-split-long-cover-up-dress-g877906.html,Women's Swimwear Solid Color Deep V Long Sleeve Slim Split Long Cover Up Dress,Beachwear
1845,$10.99,$14.99,http://www.jollychic.com/p/women-s-swimwear-lace-hem-deep-v-halterneck-one-piece-tankini-g877922.html,Women's Swimwear Lace Hem Deep V Halterneck One Piece Tankini,Beachwear
35,$13.99,$21.99,http://www.jollychic.com/p/women-s-swimwear-set-sweet-deep-v-halterneck-slim-sexy-tankini-set-g891522.html,Women's Swimwear Set Sweet Deep V Halterneck Slim Sexy Tankini Set,Beachwear
9,$26.99,,http://www.jollychic.com/p/women-s-swimwear-sweet-ruffles-hem-v-neck-sleeveless-cover-up-dress-g900688.html,Women's Swimwear Sweet Ruffles Hem V Neck Sleeveless Cover Up Dress,Beachwear
16,$15.99,$24.99,http://www.jollychic.com/p/women-s-swimwear-solid-color-ruffles-halterneck-sexy-cover-up-dress-g900690.html,Women's Swimwear Solid Color Ruffles Halterneck Sexy Cover Up Dress,Beachwear
3,$32.99,,http://www.jollychic.com/p/women-s-swimwear-color-block-deep-v-halterneck-sleeveless-tankini-set-g902818.html,Women's Swimwear Color Block Deep V Halterneck Sleeveless Tankini Set,Beachwear
4,$18.99,$28.99,http://www.jollychic.com/p/women-s-swimwear-set-print-o-neck-sleeeless-padded-tankini-set-g912426.html,Women's Swimwear Set Print O Neck Sleeeless Padded Tankini Set,Beachwear
42,$28.99,,http://www.jollychic.com/p/women-s-swimwear-solid-color-hollow-out-v-neck-half-sleeve-long-cover-up-dress-g928010.html,Women's Swimwear Solid Color Hollow Out V Neck Half Sleeve Long Cover Up Dress,Beachwear
483,$9.99,$14.99,http://www.jollychic.com/p/women-s-swimwear-set-leaf-pattern-halterneck-crossing-design-sexy-bikini-set-g930256.html,Women's Swimwear Set Leaf Pattern Halterneck Crossing Design Sexy Bikini Set,Beachwear
45,$14.99,,http://www.jollychic.com/p/women-s-swimwear-ethnic-style-pattern-sexy-beach-shawl-cover-up-g944752.html,Women's Swimwear Ethnic Style Pattern Sexy Beach Shawl Cover Up,Beachwear
18,$22.99,,http://www.jollychic.com/p/women-s-swimwear-suit-green-hollow-out-halterneck-sexy-bikini-set-g960156.html,Women's Swimwear Suit Green Hollow Out Halterneck Sexy Bikini Set,Beachwear
60,$26.99,,http://www.jollychic.com/p/women-s-swimwear-solid-color-hollow-out-ruffles-off-shoulder-one-piece-tankini-g966730.html,Women's Swimwear Solid Color Hollow Out Ruffles Off Shoulder One Piece Tankini,Beachwear
755,$15.99,$24.99,http://www.jollychic.com/p/women-s-tankini-set-vintage-color-block-polka-dots-halterneck-high-waist-swimwear-set-g982274.html,Women's Tankini Set Vintage Color Block Polka Dots Halterneck High Waist Swimwear Set,Beachwear
89,$34.99,,http://www.jollychic.com/p/women-s-plus-size-swimwear-polka-dots-crossover-straps-one-piece-tankini-dress-g988856.html,Women's Plus Size Swimwear Polka Dots Crossover Straps One Piece Tankini Dress,Beachwear
22,$10.99,,http://www.jollychic.com/p/women-s-swimwear-set-pure-color-triangle-cup-sexy-bikini-set-g990500.html,Women's Swimwear Set Pure Color Triangle Cup Sexy Bikini Set,Beachwear
28,$28.99,,http://www.jollychic.com/p/women-s-sleepwear-latest-gradient-off-shoulder-casual-one-piece-tankini-suit-g995258.html,Women's Sleepwear Latest Gradient Off Shoulder Casual One Piece Tankini Suit,Beachwear
17,$25.99,,http://www.jollychic.com/p/women-s-swimwear-sweet-floral-underwire-backless-one-piece-swimsuit-g1007558.html,Women's Swimwear Sweet Floral Underwire Backless One Piece Swimsuit,Beachwear
17,$14.99,,http://www.jollychic.com/p/women-s-swimwear-set-lace-hem-crossover-straps-sexy-beach-bikini-set-g1008852.html,Women's Swimwear Set Lace Hem Crossover Straps Sexy Beach Bikini Set,Beachwear
45,$27.99,,http://www.jollychic.com/p/women-s-2pcs-swimwear-vintage-halterneck-high-waist-sexy-bikini-set-g1014858.html,Women's 2Pcs Swimwear Vintage Halterneck High Waist Sexy Bikini Set,Beachwear
29,$22.99,,http://www.jollychic.com/p/women-s-swimwear-set-vintage-floral-triangle-cup-tassel-sweet-beach-bikini-set-g1015198.html,Women's Swimwear Set Vintage Floral Triangle Cup Tassel Sweet Beach Bikini Set,Beachwear
34,$19.99,,http://www.jollychic.com/p/women-s-swimwear-white-hollow-out-floral-lace-short-sleeve-cover-up-g1015414.html,Women's Swimwear White Hollow Out Floral Lace Short Sleeve Cover Up,Beachwear
56,$16.99,,http://www.jollychic.com/p/women-s-swimwear-solid-color-drawstring-deep-v-long-sleeve-beach-cover-up-g1038538.html,Women's Swimwear Solid Color Drawstring Deep V Long Sleeve Beach Cover Up,Beachwear
18,$44.99,,http://www.jollychic.com/p/women-s-swim-dress-floral-patteern-v-neck-backless-adjustable-sexy-one-piece-dress-g1079188.html,Women's Swim Dress Floral Patteern V Neck Backless Adjustable Sexy One Piece Dress,Beachwear
14,$16.99,,http://www.jollychic.com/p/women-s-2-pcs-swimsuit-polka-dots-pattern-patchwork-halter-neck-backless-sexy-swimwear-g1091520.html,Women's 2 Pcs Swimsuit Polka Dots Pattern Patchwork Halter Neck Backless Sexy Swimwear,Beachwear
19,$28.99,,http://www.jollychic.com/p/women-s-swimwear-vintage-solid-criss-cross-v-neck-one-piece-sexy-swimsuit-g1091524.html,Women's Swimwear Vintage Solid Criss Cross V Neck One Piece Sexy Swimsuit,Beachwear
5,$21.99,,http://www.jollychic.com/p/women-s-swimwear-color-block-mermaid-pattern-halterneck-beach-bikini-set-g1100094.html,Women's Swimwear Color Block Mermaid Pattern Halterneck Beach Bikini Set,Beachwear
18,$29.99,,http://www.jollychic.com/p/women-s-swimwear-color-block-long-sleeve-v-neck-chiffon-beach-wear-cover-up-g1109938.html,Women's Swimwear Color Block Long Sleeve V Neck Chiffon Beach Wear Cover Up,Beachwear
20,$17.99,,http://www.jollychic.com/p/women-s-swimwear-vintage-floral-jumpsuit-beach-wear-cover-up-g1138440.html,Women's Swimwear Vintage Floral Jumpsuit Beach Wear Cover Up,Beachwear
20,$17.99,,http://www.jollychic.com/p/women-s-swimwear-vintage-jumpsuit-pocketed-beach-wear-cover-up-g1138480.html,Women's Swimwear Vintage Jumpsuit Pocketed Beach Wear Cover Up,Beachwear
18,$8.99,,http://www.jollychic.com/p/women-s-swimwear-solid-color-strappy-halterneck-sexy-beach-wear-bikini-g1144482.html,Women's Swimwear Solid Color Strappy Halterneck Sexy Beach Wear Bikini,Beachwear
17,$13.99,,http://www.jollychic.com/p/women-s-swimwear-halterneck-underwire-floral-striped-high-waist-bikini-set-g1148296.html,Women's Swimwear Halterneck Underwire Floral Striped High Waist Bikini Set,Beachwear
16,$11.99,$16.99,http://www.jollychic.com/p/women-s-swimwear-simple-pure-color-side-drawstrings-swim-shorts-g1163158.html,Women's Swimwear Simple Pure Color Side Drawstrings Swim Shorts,Beachwear
13,$20.99,,http://www.jollychic.com/p/women-s-beach-dress-solid-color-short-sleeve-v-neck-sash-decor-sunscreen-cover-up-g1169720.html,Women's Beach Dress Solid Color Short Sleeve V Neck Sash Decor Sunscreen Cover-Up,Beachwear
17,$18.99,$26.99,http://www.jollychic.com/p/women-s-2-pcs-swimsuit-colorblock-short-sleeve-o-neck-cozy-tankini-set-g1204304.html,Women's 2 Pcs Swimsuit Colorblock Short Sleeve O Neck Cozy Tankini Set,Beachwear
7,$31.99,,http://www.jollychic.com/p/women-s-2pcs-swimwear-fashion-color-block-long-sleeve-conservative-tankini-set-g1304990.html,Women's 2Pcs Swimwear Fashion Color Block Long Sleeve Conservative Tankini Set,Beachwear
5,$22.99,,http://www.jollychic.com/p/women-s-swimwear-vintage-floral-chiffon-side-split-long-beach-wear-loose-pants-g1306574.html,Women's Swimwear Vintage Floral Chiffon Side Split Long Beach Wear Loose Pants,Beachwear
275,$7.99,$18.99,http://www.jollychic.com/p/backless-brief-sexy-one-pieces-bikini-g240197.html,Backless Brief Sexy One Pieces Bikini,Beachwear
253,$7.99,$18.99,http://www.jollychic.com/p/sexy-backless-crochet-triangle-women-s-bikini-g341086.html,Sexy Backless Crochet Triangle Women's Bikini,Beachwear
487,$4.99,$5.99,http://www.jollychic.com/p/water-proof-comfortable-swimming-cap-g341764.html,Water Proof Comfortable Swimming Cap,Beachwear
1091,$12.99,$18.99,http://www.jollychic.com/p/women-s-sleeveless-cascading-ruffles-bikini-veil-g354210.html,Women's Sleeveless Cascading Ruffles Bikini Veil,Beachwear
187,$5.99,$9.99,http://www.jollychic.com/p/women-s-floral-cut-out-halterneck-bikini-g372338.html,Women's Floral Cut Out Halterneck Bikini,Beachwear
386,$22.99,$35.99,http://www.jollychic.com/p/women-s-3-pcs-swimwear-stripe-preppy-style-tankini-swimwear-suit-g482634.html,Women's 3 Pcs Swimwear Stripe Preppy Style Tankini Swimwear Suit,Beachwear
1694,$14.99,$18.99,http://www.jollychic.com/p/women-s-swimwear-plus-size-halter-neck-high-waist-casual-style-sweet-floral-tankini-g499214.html,Women's Swimwear Plus Size Halter Neck High Waist Casual Style Sweet Floral Tankini,Beachwear
309,$17.99,$27.99,http://www.jollychic.com/p/women-s-swimwear-long-sleeve-half-zipper-hot-spring-one-piece-swimwear-g510960.html,Women's Swimwear Long Sleeve Half Zipper Hot Spring One-Piece Swimwear,Beachwear
317,$22.99,$30.99,http://www.jollychic.com/p/women-s-3-pcs-swimwear-suit-print-long-sleeve-faddish-swimwear-suit-g512170.html,Women's 3 Pcs Swimwear Suit Print Long Sleeve Faddish Swimwear Suit,Beachwear
25,$20.99,,http://www.jollychic.com/p/women-s-swimwear-plus-size-color-block-one-piece-swimwear-g525674.html,Women's Swimwear Plus Size Color Block One Piece Swimwear,Beachwear
66,$27.99,,http://www.jollychic.com/p/women-s-swimwear-solid-color-hollow-out-one-piece-tankini-g527176.html,Women's Swimwear Solid Color Hollow Out One Piece Tankini,Beachwear
631,$17.99,$22.99,http://www.jollychic.com/p/women-s-swimwear-one-piece-color-block-hollow-out-tankini-g533042.html,Women's Swimwear One Piece Color Block Hollow Out Tankini,Beachwear
78,$24.99,,http://www.jollychic.com/p/women-s-swimwear-color-block-wireless-hollow-out-sexy-one-piece-tankini-g544462.html,Women's Swimwear Color Block Wireless Hollow Out Sexy One Piece Tankini,Beachwear
32,$27.99,,http://www.jollychic.com/p/women-s-swimwear-striped-patchwork-halterneck-hollow-out-bow-sexy-tankini-g551164.html,Women's Swimwear Striped Patchwork Halterneck Hollow Out Bow Sexy Tankini,Beachwear
20,$26.99,,http://www.jollychic.com/p/women-s-swimwear-black-hollow-out-crossover-straps-ruffles-one-piece-tankini-g553354.html,Women's Swimwear Black Hollow Out Crossover Straps Ruffles One Piece Tankini,Beachwear
60,$24.99,,http://www.jollychic.com/p/women-s-swimwear-v-neck-striped-racerback-padded-tankini-g556674.html,Women's Swimwear V Neck Striped Racerback Padded Tankini,Beachwear
108,$12.99,$19.99,http://www.jollychic.com/p/women-s-swimwear-floral-graphic-hollow-out-drawstring-low-waist-sexy-bikini-g564634.html,Women's Swimwear Floral Graphic Hollow Out Drawstring Low Waist Sexy Bikini,Beachwear
1872,$15.99,$20.99,http://www.jollychic.com/p/women-s-beachwear-white-ruffles-long-sleeve-open-front-cover-ups-dress-g587886.html,Women's Beachwear White Ruffles Long Sleeve Open Front Cover Ups Dress,Beachwear
616,$10.99,$15.99,http://www.jollychic.com/p/women-s-swimwear-solid-color-letters-backless-one-piece-tankini-g596736.html,Women's Swimwear Solid Color Letters Backless One Piece Tankini,Beachwear
1738,$22.99,$33.99,http://www.jollychic.com/p/women-s-3pcs-swimwear-solid-color-hollow-out-underwire-faddish-bikini-suit-g600002.html,Women's 3Pcs Swimwear Solid Color Hollow Out Underwire Faddish Bikini Suit,Beachwear
76,$13.99,,http://www.jollychic.com/p/women-s-swimwear-colorblock-ethnic-argyle-sexy-split-bikini-swimming-suit-g633200.html,Women's Swimwear Colorblock Ethnic Argyle Sexy Split Bikini Swimming Suit,Beachwear
25,$27.99,,http://www.jollychic.com/p/women-s-swimsuit-color-block-crossover-straps-camisole-padded-tankini-set-g637426.html,Women's Swimsuit Color Block Crossover Straps Camisole Padded Tankini Set,Beachwear
328,$12.99,$20.99,http://www.jollychic.com/p/women-s-swimwear-tassel-one-shoulder-solid-slim-sexy-one-pieces-swimsuit-g663432.html,Women's Swimwear Tassel One Shoulder Solid Slim Sexy One Pieces Swimsuit,Beachwear
64,$6.99,$16.99,http://www.jollychic.com/p/women-s-2-pcs-swimwear-floral-simple-comfy-sexy-slim-split-bikini-set-g675080.html,Women's 2 Pcs Swimwear Floral Simple Comfy Sexy Slim Split Bikini Set,Beachwear
181,$11.99,$17.99,http://www.jollychic.com/p/women-s-swimwear-set-color-block-geometric-halterneck-sexy-bikini-set-g675256.html,Women's Swimwear Set Color Block Geometric Halterneck Sexy Bikini Set,Beachwear
41,$21.99,,http://www.jollychic.com/p/women-s-plus-size-swimwear-blossoms-v-neck-bow-belt-swim-dress-g688382.html,Women's Plus Size Swimwear Blossoms V Neck Bow Belt Swim Dress,Beachwear
271,$13.99,,http://www.jollychic.com/p/women-s-swim-pants-color-block-floral-high-waist-elastic-beach-pants-g715336.html,Women's Swim Pants Color Block Floral High Waist Elastic Beach Pants,Beachwear
272,$21.99,$33.99,http://www.jollychic.com/p/women-s-swimwear-colorblock-slim-sexy-thin-sports-swimsuit-g751174.html,Women's Swimwear Colorblock Slim Sexy Thin Sports Swimsuit,Beachwear
298,$15.99,$23.99,http://www.jollychic.com/p/women-s-swimwear-tassel-hollow-out-solid-slim-sexy-cover-up-swimsuit-g758962.html,Women's Swimwear Tassel Hollow Out Solid Slim Sexy Cover Up Swimsuit,Beachwear
843,$15.99,$22.99,http://www.jollychic.com/p/women-s-swimwear-flower-embroidery-short-sleeve-side-split-long-cover-up-dress-g771288.html,Women's Swimwear Flower Embroidery Short Sleeve Side Split Long Cover Up Dress,Beachwear
46,$17.99,,http://www.jollychic.com/p/women-s-swimwear-solid-color-lace-hollow-out-three-quarters-sleeve-cover-ups-g771292.html,Women's Swimwear Solid Color Lace Hollow Out Three Quarters Sleeve Cover Ups,Beachwear
224,$13.99,$21.99,http://www.jollychic.com/p/women-s-swimwear-beach-hollow-out-crossover-sexy-comfy-simple-cover-ups-g776646.html,Women's Swimwear Beach Hollow Out Crossover Sexy Comfy Simple Cover Ups,Beachwear
14,$19.99,,http://www.jollychic.com/p/topmelon-women-s-swimwear-solid-halterneck-backless-sexy-slim-one-pieces-g800854.html,TOPMELON Women's Swimwear Solid Halterneck Backless Sexy Slim One Pieces,Beachwear
29,$12.99,$19.99,http://www.jollychic.com/p/topmelon-women-s-swimwear-zipper-patchwork-backless-sexy-slim-tankini-g800856.html,TOPMELON Women's Swimwear Zipper Patchwork Backless Sexy Slim Tankini,Beachwear
20,$22.99,,http://www.jollychic.com/p/topmelon-women-s-2-pcs-swimwear-cascading-ruffle-floral-sexy-split-bikini-set-g800862.html,TOPMELON Women's 2 Pcs Swimwear Cascading Ruffle Floral Sexy Split Bikini Set,Beachwear
24,$20.99,,http://www.jollychic.com/p/women-s-swimwear-sweet-seashell-shape-underwire-halterneck-sexy-bikini-set-g803076.html,Women's Swimwear Sweet Seashell Shape Underwire Halterneck Sexy Bikini Set,Beachwear
21,$21.99,,http://www.jollychic.com/p/women-s-swimwear-color-block-adjustable-straps-wireless-padded-tankini-g808234.html,Women's Swimwear Color Block Adjustable Straps Wireless Padded Tankini,Beachwear
32,$8.99,,http://www.jollychic.com/p/women-s-swimwear-tassels-wireless-padded-sexy-strapless-bikini-g811482.html,Women's Swimwear Tassels Wireless Padded Sexy Strapless Bikini,Beachwear
24,$23.99,,http://www.jollychic.com/p/women-s-swimwear-cute-colorful-balloon-pattern-racerback-one-piece-tankini-g814800.html,Women's Swimwear Cute Colorful Balloon Pattern Racerback One Piece Tankini,Beachwear
743,$15.99,$23.99,http://www.jollychic.com/p/women-s-swimwear-color-block-sexy-3d-print-racerback-one-piece-tankini-g814830.html,Women's Swimwear Color Block Sexy 3D Print Racerback One Piece Tankini,Beachwear
88,$20.99,$31.99,http://www.jollychic.com/p/women-s-swimwear-floral-pattern-sleeveless-front-zipper-neck-one-piece-tankini-g826672.html,Women's Swimwear Floral Pattern Sleeveless Front Zipper Neck One Piece Tankini,Beachwear
149,$12.99,$20.99,http://www.jollychic.com/p/women-s-swimwear-floral-deep-v-long-sleeve-visible-loose-cover-up-dress-g850038.html,Women's Swimwear Floral Deep V Long Sleeve Visible Loose Cover Up Dress,Beachwear
12,$20.99,,http://www.jollychic.com/p/women-s-swimwear-set-solid-color-ruffles-hem-triangle-cup-sexy-bikini-set-g854930.html,Women's Swimwear Set Solid Color Ruffles Hem Triangle Cup Sexy Bikini Set,Beachwear
37,$19.99,,http://www.jollychic.com/p/women-s-swimwear-spaghetti-straps-color-block-striped-cover-up-dress-g854934.html,Women's Swimwear Spaghetti Straps Color Block Striped Cover Up Dress,Beachwear
94,$17.99,$24.99,http://www.jollychic.com/p/women-s-swimwear-solid-color-halterneck-comfort-sexy-cover-up-g865066.html,Women's Swimwear Solid Color Halterneck Comfort Sexy Cover Up,Beachwear
35,$17.99,,http://www.jollychic.com/p/women-s-2-pcs-swimwear-stylish-pineapple-pattern-zipper-halter-neck-tankini-set-g871754.html,Women's 2 Pcs Swimwear Stylish Pineapple Pattern Zipper Halter Neck Tankini Set,Beachwear
280,$8.99,$13.99,http://www.jollychic.com/p/women-s-swimwear-hollow-out-crossover-straps-wireless-sexy-bikini-set-g877552.html,Women's Swimwear Hollow Out Crossover Straps Wireless Sexy Bikini Set,Beachwear
1166,$10.99,$15.99,http://www.jollychic.com/p/women-s-swimwear-sexy-crossing-design-halterneck-bikini-set-g878062.html,Women's Swimwear Sexy Crossing Design Halterneck Bikini Set,Beachwear
33,$24.99,,http://www.jollychic.com/p/women-s-swimwear-pure-color-strapless-floral-lace-cover-up-dress-g891514.html,Women's Swimwear Pure Color Strapless Floral Lace Cover Up Dress,Beachwear
26,$31.99,,http://www.jollychic.com/p/women-s-swimwear-set-floral-striped-spaghetti-straps-sexy-tankini-set-g904834.html,Women's Swimwear Set Floral Striped Spaghetti Straps Sexy Tankini Set,Beachwear
