add_wish,discount_price,original_price,product_link,product_name,header_block
3471,$13.99,$19.99,http://www.jollychic.com/p/women-s-swimwear-set-sweet-floral-halterneck-underwire-push-up-bikini-long-dress-g1067644.html,Women's Swimwear Set Sweet Floral Halterneck Underwire Push Up Bikini Long Dress,Beachwear
719,$34.99,,http://www.jollychic.com/p/women-s-3-pcs-swimwear-push-up-sexy-camouflage-cover-up-tankini-set-g722086.html,Women's 3 Pcs Swimwear Push Up Sexy Camouflage Cover Up Tankini Set,Beachwear
4020,$15.99,$21.99,http://www.jollychic.com/p/sexy-hollow-out-front-one-piece-swimsuit-g313874.html,Sexy Hollow Out Front One Piece Swimsuit,Beachwear
194,$13.99,$20.99,http://www.jollychic.com/p/women-s-2-pcs-swimwear-colorblock-floral-simple-sexy-slim-bikini-set-g692382.html,Women's 2 Pcs Swimwear Colorblock Floral Simple Sexy Slim Bikini Set,Beachwear
497,$12.99,$18.99,http://www.jollychic.com/p/women-s-3pcs-swimwear-polka-dots-spaghetti-straps-cover-ups-halter-bikini-suit-g629926.html,Women's 3Pcs Swimwear Polka Dots Spaghetti Straps Cover Ups Halter Bikini Suit,Beachwear
735,$11.99,$15.99,http://www.jollychic.com/p/women-s-swimwear-striped-shorts-solid-color-ruffles-spaghetti-straps-tankini-set-g1033546.html,Women's Swimwear Striped Shorts Solid Color Ruffles Spaghetti Straps Tankini Set,Beachwear
621,$15.99,$25.99,http://www.jollychic.com/p/women-s-plus-size-solid-color-halter-one-piece-swimwear-g370270.html,Women's Plus Size Solid Color Halter One Piece Swimwear,Beachwear
678,$15.99,$24.99,http://www.jollychic.com/p/women-s-beachwear-three-quarters-sleeve-floral-open-front-long-cover-ups-dress-g588150.html,Women's Beachwear Three Quarters Sleeve Floral Open Front Long Cover Ups Dress,Beachwear
200,$9.99,$17.99,http://www.jollychic.com/p/sexy-2pcs-solid-halter-lace-up-bikini-swimwear-g101748.html,Sexy 2Pcs Solid Halter Lace Up Bikini Swimwear,Beachwear
5103,$12.99,$16.99,http://www.jollychic.com/p/2pcs-striped-underpants-halter-best-bikinis-g101906.html,2Pcs Striped Underpants Halter Best Bikinis,Beachwear
1142,$14.99,$21.99,http://www.jollychic.com/p/plus-size-colorblock-bikinis-with-wire-support-g311362.html,Plus Size Colorblock Bikinis With Wire Support,Beachwear
63,$13.99,,http://www.jollychic.com/p/women-s-2-pcs-swimwear-colorblock-cartoon-simple-sexy-slim-split-bikini-set-g723030.html,Women's 2 Pcs Swimwear Colorblock Cartoon Simple Sexy Slim Split Bikini Set,Beachwear
103,$8.99,$13.99,http://www.jollychic.com/p/women-s-2-pcs-swimwear-leopard-backless-simple-sexy-slim-split-bikini-set-g723036.html,Women's 2 Pcs Swimwear Leopard Backless Simple Sexy Slim Split Bikini Set,Beachwear
14,$12.99,,http://www.jollychic.com/p/women-s-swimwear-color-block-halterneck-triangle-cup-sexy-bikini-set-g766146.html,Women's Swimwear Color Block Halterneck Triangle Cup Sexy Bikini Set,Beachwear
18,$22.99,,http://www.jollychic.com/p/women-s-swimwear-solid-color-off-shoulder-short-sleeve-sexy-tankini-g1100080.html,Women's Swimwear Solid Color Off Shoulder Short Sleeve Sexy Tankini,Beachwear
7,$25.99,$36.99,http://www.jollychic.com/p/women-s-swimwear-set-print-sleeveless-padded-high-waist-conservative-tankini-suit-g1247164.html,Women's Swimwear Set Print Sleeveless Padded High Waist Conservative Tankini Suit,Beachwear
5,$18.99,,http://www.jollychic.com/p/women-s-swimsuit-floral-pattern-sleeveless-deep-v-neck-one-piece-bikini-set-g1306580.html,Women's Swimsuit Floral Pattern Sleeveless Deep V Neck One Piece Bikini Set,Beachwear
114,$12.99,$20.99,http://www.jollychic.com/p/women-s-swimwear-solid-color-v-neck-sleeveless-one-piece-tankini-g930268.html,Women's Swimwear Solid Color V Neck Sleeveless One Piece Tankini,Beachwear
280,$17.99,$26.99,http://www.jollychic.com/p/women-s-swimwear-halterneck-solid-slim-sexy-one-pieces-swimsuit-g763948.html,Women's Swimwear Halterneck Solid Slim Sexy One Pieces Swimsuit,Beachwear
320,$10.99,$16.99,http://www.jollychic.com/p/women-s-2-pcs-swimwear-halterneck-colorblock-bow-sexy-slim-bikini-set-g667416.html,Women's 2 Pcs Swimwear Halterneck Colorblock Bow Sexy Slim Bikini Set,Beachwear
119,$15.99,$24.99,http://www.jollychic.com/p/women-s-swimwear-set-striped-halterneck-bow-backless-slim-tankini-suit-g808236.html,Women's Swimwear Set Striped Halterneck Bow Backless Slim Tankini Suit,Beachwear
41,$15.99,$23.99,http://www.jollychic.com/p/women-s-swimwear-off-the-shoulder-floral-pattern-sexy-one-piece-bikini-set-g925820.html,Women's Swimwear Off The Shoulder Floral Pattern Sexy One Piece Bikini Set,Beachwear
232,$19.99,,http://www.jollychic.com/p/women-s-swimwear-solid-color-crossover-straps-simple-one-piece-bikini-set-g995334.html,Women's Swimwear Solid Color Crossover Straps Simple One Piece Bikini Set,Beachwear
107,$31.99,,http://www.jollychic.com/p/women-s-swimwear-dress-colorblock-halter-neck-underwire-beach-dress-g1018232.html,Women's Swimwear Dress Colorblock Halter Neck Underwire Beach Dress,Beachwear
17,$37.99,,http://www.jollychic.com/p/women-s-3-swimsuit-pcs-solid-color-lace-patchwotk-hollow-out-sexy-swimwear-g1079196.html,Women's 3 Swimsuit Pcs Solid Color Lace Patchwotk Hollow Out Sexy Swimwear,Beachwear
2133,$19.99,$25.99,http://www.jollychic.com/p/women-s-swimwear-bohemia-style-beach-solid-lace-hollow-out-cover-up-g695576.html,Women's Swimwear Bohemia Style Beach Solid Lace Hollow Out Cover Up,Beachwear
2284,$15.99,$25.99,http://www.jollychic.com/p/floral-printed-bra-halter-high-waist-tankinis-online-g101862.html,Floral Printed Bra Halter High Waist Tankinis Online,Beachwear
427,$8.99,$21.99,http://www.jollychic.com/p/solid-sexy-underwire-women-s-swimwear-suit-g136257.html,Solid Sexy Underwire Women's Swimwear Suit,Beachwear
229,$7.99,$18.99,http://www.jollychic.com/p/pullover-style-deep-v-neck-backless-swimsuit-g137277.html,Pullover Style Deep V Neck Backless Swimsuit,Beachwear
697,$13.99,$19.99,http://www.jollychic.com/p/sexy-deep-v-neck-hollow-out-one-pieces-bikinis-g137873.html,Sexy Deep V-Neck Hollow Out One Pieces Bikinis,Beachwear
171,$7.99,$14.99,http://www.jollychic.com/p/women-s-swimwear-colorblock-ethnic-stylish-sexy-split-bikini-swimming-suit-g627116.html,Women's Swimwear Colorblock Ethnic Stylish Sexy Split Bikini Swimming Suit,Beachwear
340,$11.99,$17.99,http://www.jollychic.com/p/women-s-2-pcs-swimwear-colorblock-floral-striped-sexy-slim-bikini-set-g667424.html,Women's 2 Pcs Swimwear Colorblock Floral Striped Sexy Slim Bikini Set,Beachwear
492,$16.99,$25.99,http://www.jollychic.com/p/women-s-swimwear-solid-color-back-hollow-out-sexy-one-piece-tankini-g781284.html,Women's Swimwear Solid Color Back Hollow Out Sexy One Piece Tankini,Beachwear
73,$13.99,$20.99,http://www.jollychic.com/p/women-s-swimwear-solid-color-backless-sliped-sexy-one-piece-bikini-set-g917398.html,Women's Swimwear Solid Color Backless Sliped Sexy One Piece Bikini Set,Beachwear
130,$29.99,,http://www.jollychic.com/p/women-s-swimwear-sleeveless-one-piece-bikini-monokini-sexy-swimsuit-g762860.html,Women's Swimwear Sleeveless One Piece Bikini Monokini Sexy Swimsuit,Beachwear
1197,$11.99,$18.99,http://www.jollychic.com/p/two-pieces-halter-lace-up-bikini-swimsuits-g136683.html,Two Pieces Halter Lace Up Bikini Swimsuits,Beachwear
1485,$15.99,$18.99,http://www.jollychic.com/p/one-piece-deep-v-neck-tassels-bikini-g144645.html,One Piece Deep V Neck Tassels Bikini,Beachwear
212,$9.99,$15.99,http://www.jollychic.com/p/women-s-2-pcs-swimwear-set-sexy-comfy-solid-comfy-chic-bikini-set-g667412.html,Women's 2 Pcs Swimwear Set Sexy Comfy Solid Comfy Chic Bikini Set,Beachwear
192,$11.99,$17.99,http://www.jollychic.com/p/women-s-swimwear-hollow-out-solid-slim-sexy-one-pieces-cover-ups-swimsuit-g762850.html,Women's Swimwear Hollow Out Solid Slim Sexy One Pieces Cover Ups Swimsuit,Beachwear
138,$20.99,$35.99,http://www.jollychic.com/p/women-s-2-pcs-swimwear-moire-pattern-cascading-ruffle-stylish-tankini-set-g871758.html,Women's 2 Pcs Swimwear Moire Pattern Cascading Ruffle Stylish Tankini Set,Beachwear
117,$16.99,,http://www.jollychic.com/p/women-s-2-pcs-swimsuit-sweet-floral-high-waist-halterneck-sexy-bikini-set-g995342.html,Women's 2 Pcs Swimsuit Sweet Floral High Waist Halterneck Sexy Bikini Set,Beachwear
106,$24.99,,http://www.jollychic.com/p/women-s-2-pcs-swimwear-solid-chest-wrap-high-waist-floral-pattern-boyshorts-sexy-swimsuit-g1063240.html,Women's 2 Pcs Swimwear Solid Chest Wrap High Waist Floral Pattern Boyshorts Sexy Swimsuit,Beachwear
76,$14.99,,http://www.jollychic.com/p/women-s-swimwear-set-pure-color-strappy-halterneck-sexy-bikini-set-g1067646.html,Women's Swimwear Set Pure Color Strappy Halterneck Sexy Bikini Set,Beachwear
189,$39.99,,http://www.jollychic.com/p/women-s-3-pcs-swimwear-solid-color-adjustable-strap-top-ethnic-style-dress-sunscreen-sexy-swimsuit-g1079202.html,Women's 3 Pcs Swimwear Solid Color Adjustable Strap Top Ethnic Style Dress Sunscreen Sexy Swimsuit,Beachwear
79,$37.99,,http://www.jollychic.com/p/women-s-3-pcs-swimsuit-underwire-push-up-backless-hollow-out-sexy-swimwear-g1079210.html,Women's 3 Pcs Swimsuit Underwire Push Up Backless Hollow Out Sexy Swimwear,Beachwear
548,$10.99,$20.99,http://www.jollychic.com/p/halterneck-contrast-color-hipster-bikinis-set-g137673.html,Halterneck Contrast Color Hipster Bikinis Set,Beachwear
22,$9.99,$15.99,http://www.jollychic.com/p/women-s-2-pcs-swimwear-halterneck-polka-dot-sexy-slim-bikini-set-g692190.html,Women's 2 Pcs Swimwear Halterneck Polka Dot Sexy Slim Bikini Set,Beachwear
196,$13.99,$21.99,http://www.jollychic.com/p/women-s-swimwear-set-green-triangle-cup-hollow-out-sexy-bikini-set-g781282.html,Women's Swimwear Set Green Triangle Cup Hollow Out Sexy Bikini Set,Beachwear
29,$13.99,$20.99,http://www.jollychic.com/p/women-s-swimwear-crossbones-pattern-crossover-straps-one-piece-bikini-set-g917400.html,Women's Swimwear Crossbones Pattern Crossover Straps One Piece Bikini Set,Beachwear
150,$16.99,$25.99,http://www.jollychic.com/p/women-s-swimwear-sexy-lace-bohemia-beach-embroidery-cover-ups-g664016.html,Women's Swimwear Sexy Lace Bohemia Beach Embroidery Cover Ups,Beachwear
2,$25.99,,http://www.jollychic.com/p/women-s-2-pcs-swimsuit-floral-pattern-halter-neck-o-neck-sexy-bikini-set-g1306576.html,Women's 2 Pcs Swimsuit Floral Pattern Halter Neck O Neck Sexy Bikini Set,Beachwear
0,$18.99,,http://www.jollychic.com/p/women-s-swimsuit-striped-pentagram-pattern-sleeveless-o-neck-backless-sexy-one-piece-bikini-set-g1306586.html,Women's Swimsuit Striped Pentagram Pattern Sleeveless O Neck Backless Sexy One Piece Bikini Set,Beachwear
796,$12.99,$20.99,http://www.jollychic.com/p/sexy-halter-push-up-bikini-swimsuit-g144611.html,Sexy Halter Push Up Bikini Swimsuit,Beachwear
1418,$17.99,$22.99,http://www.jollychic.com/p/hollow-out-black-one-piece-swimsuit-g314018.html,Hollow Out Black One Piece Swimsuit,Beachwear
316,$9.99,$10.99,http://www.jollychic.com/p/flowy-hem-light-weight-beach-cover-up-g340302.html,Flowy Hem Light Weight Beach Cover Up,Beachwear
84,$17.99,$26.99,http://www.jollychic.com/p/women-s-coat-solid-long-sleeve-hollow-out-lace-outwear-g556384.html,Women's Coat Solid Long Sleeve Hollow Out Lace Outwear,Beachwear
48,$10.99,$14.99,http://www.jollychic.com/p/women-s-2-pcs-swimwear-colorblock-floral-simple-sexy-slim-split-bikini-set-g692374.html,Women's 2 Pcs Swimwear Colorblock Floral Simple Sexy Slim Split Bikini Set,Beachwear
151,$14.99,$20.99,http://www.jollychic.com/p/women-s-swimwear-colorblock-lattice-pattern-slim-one-pieces-swimming-suit-g692378.html,Women's Swimwear Colorblock Lattice Pattern Slim One Pieces Swimming Suit,Beachwear
28,$34.99,,http://www.jollychic.com/p/women-s-3-pcs-swimsuit-solid-color-camisole-cozy-boyshorts-hollow-out-blouse-swimwear-g1079194.html,Women's 3 Pcs Swimsuit Solid Color Camisole Cozy Boyshorts Hollow Out Blouse Swimwear,Beachwear
40,$44.99,,http://www.jollychic.com/p/women-s-2-pcs-floral-pattern-swimsuit-one-piece-lace-patchwork-hollow-out-blouse-sexy-swimwear-g1079212.html,Women's 2 Pcs Floral Pattern Swimsuit One Piece Lace Patchwork Hollow Out Blouse Sexy Swimwear,Beachwear
6,$22.99,,http://www.jollychic.com/p/women-s-2-pcs-solid-swimsuit-fashion-bandage-bikini-set-swimwear-g1309612.html,Women's 2 Pcs Solid Swimsuit Fashion Bandage Bikini Set Swimwear,Beachwear
2719,$11.99,$16.99,http://www.jollychic.com/p/women-s-swimwear-set-ruffles-off-shoulder-leaf-pattern-sexy-tankini-set-g875930.html,Women's Swimwear Set Ruffles Off Shoulder Leaf Pattern Sexy Tankini Set,Beachwear
207,$43.99,$86.00,http://www.jollychic.com/p/floral-waisted-v-neck-women-s-bikini-cover-up-g45605.html,Floral Waisted V-neck Women's Bikini Cover Up,Beachwear
56,$20.99,,http://www.jollychic.com/p/women-s-swimwear-halterneck-solid-simple-sexy-one-piece-tankini-g692188.html,Women's Swimwear Halterneck Solid Simple Sexy One Piece Tankini,Beachwear
95,$13.99,$21.99,http://www.jollychic.com/p/women-s-swimwear-solid-color-halter-neck-bow-decor-simple-one-piece-tankini-set-g995272.html,Women's Swimwear Solid Color Halter Neck Bow Decor Simple One Piece Tankini Set,Beachwear
22,$37.99,,http://www.jollychic.com/p/women-s-swimsuit-solid-color-underwire-hollow-out-sexy-one-piece-swimsuit-g1079206.html,Women's Swimsuit Solid Color Underwire Hollow Out Sexy One Piece Swimsuit,Beachwear
18,$11.99,,http://www.jollychic.com/p/women-s-swimsuit-v-neck-solid-sexy-bikini-swimsuit-g1107718.html,Women's Swimsuit V Neck Solid Sexy Bikini Swimsuit,Beachwear
856,$8.99,$16.99,http://www.jollychic.com/p/women-s-plus-size-swimwear-solid-black-high-waist-crossover-straps-tankini-set-g984322.html,Women's Plus Size Swimwear Solid Black High Waist Crossover Straps Tankini Set,Beachwear
114,$18.99,$21.99,http://www.jollychic.com/p/plus-size-geometric-print-one-piece-swimsuit-g318896.html,Plus Size Geometric Print One Piece Swimsuit,Beachwear
159,$8.99,$14.99,http://www.jollychic.com/p/women-s-swimwear-colorblock-ethnic-sexy-split-bikini-swimming-suit-g627114.html,Women's Swimwear Colorblock Ethnic Sexy Split Bikini Swimming Suit,Beachwear
16,$12.99,,http://www.jollychic.com/p/women-s-swimwear-color-block-triangle-cup-halterneck-sexy-bikini-set-g766144.html,Women's Swimwear Color Block Triangle Cup Halterneck Sexy Bikini Set,Beachwear
189,$14.99,$22.99,http://www.jollychic.com/p/women-s-swimwear-solid-color-hollow-out-sexy-one-piece-bikini-set-g917394.html,Women's Swimwear Solid Color Hollow Out Sexy One Piece Bikini Set,Beachwear
22,$37.99,,http://www.jollychic.com/p/women-s-3-pcs-swimwear-stylish-solid-color-thollow-out-tassel-bow-decor-sexy-swimsuit-g1079200.html,Women's 3 Pcs Swimwear Stylish Solid Color THollow Out Tassel Bow Decor Sexy Swimsuit,Beachwear
417,$17.99,$25.99,http://www.jollychic.com/p/women-s-fashion-sexy-hand-knitting-bikini-g366112.html,Women's Fashion Sexy Hand Knitting Bikini,Beachwear
124,$12.99,$19.99,http://www.jollychic.com/p/women-s-swimwear-deep-v-floral-pattern-hollow-out-sexy-one-piece-tankini-g564648.html,Women's Swimwear Deep V Floral Pattern Hollow Out Sexy One Piece Tankini,Beachwear
55,$13.99,$20.99,http://www.jollychic.com/p/women-s-2-pcs-swimwear-solid-crossover-simple-sexy-slim-bikini-set-g692384.html,Women's 2 Pcs Swimwear Solid Crossover Simple Sexy Slim Bikini Set,Beachwear
137,$8.99,$13.99,http://www.jollychic.com/p/women-s-2-pcs-swimwear-colorblock-cartoon-simple-sexy-slim-split-bikini-set-g723016.html,Women's 2 Pcs Swimwear Colorblock Cartoon Simple Sexy Slim Split Bikini Set,Beachwear
96,$10.99,$17.99,http://www.jollychic.com/p/women-s-swimwear-set-solid-color-halterneck-sexy-wireless-padded-bikini-set-g811534.html,Women's Swimwear Set Solid Color Halterneck Sexy Wireless Padded Bikini Set,Beachwear
5,$31.99,,http://www.jollychic.com/p/women-s-2-pcs-patchwork-colorblock-pattern-ruffles-straped-tankini-set-g871684.html,Women's 2 Pcs Patchwork Colorblock Pattern Ruffles Straped Tankini Set,Beachwear
179,$14.99,$22.99,http://www.jollychic.com/p/women-s-swimwear-solid-color-hollow-out-backless-sexy-one-piece-bikini-set-g917390.html,Women's Swimwear Solid Color Hollow Out Backless Sexy One Piece Bikini Set,Beachwear
12,$15.99,$23.99,http://www.jollychic.com/p/women-s-swimwear-sweet-plaid-hollow-out-sleeveless-sexy-one-piece-tankini-g940860.html,Women's Swimwear Sweet Plaid Hollow Out Sleeveless Sexy One Piece Tankini,Beachwear
3,$18.99,,http://www.jollychic.com/p/women-s-swimsuit-colorblock-sleeveless-o-neck-backless-sexy-one-piece-bikini-set-g1306582.html,Women's Swimsuit Colorblock Sleeveless O Neck Backless Sexy One Piece Bikini Set,Beachwear
4175,$10.99,$15.99,http://www.jollychic.com/p/women-s-2-pcs-swimwear-cascading-ruffle-sexy-slim-split-bikini-set-g791598.html,Women's 2 Pcs Swimwear Cascading Ruffle Sexy Slim Split Bikini Set,Beachwear
3399,$8.99,$12.99,http://www.jollychic.com/p/women-s-swimwear-solid-color-tassel-loose-chiffon-cover-ups-dress-g740454.html,Women's Swimwear Solid Color Tassel Loose Chiffon Cover Ups Dress,Beachwear
470,$12.99,$16.99,http://www.jollychic.com/p/fashion-chain-contrast-color-bikinis-set-g137667.html,Fashion Chain Contrast Color Bikinis Set,Beachwear
3637,$8.99,$15.99,http://www.jollychic.com/p/solid-v-neck-sexy-elastic-high-waist-cover-up-g280906.html,Solid V Neck Sexy Elastic High Waist Cover Up,Beachwear
2949,$20.99,$28.99,http://www.jollychic.com/p/solid-split-cover-ups-with-pocket-g282070.html,Solid Split Cover Ups With Pocket,Beachwear
94,$9.99,$14.99,http://www.jollychic.com/p/women-s-swimwear-colorblock-ethnic-argyle-sexy-split-bikini-swimming-suit-g627120.html,Women's Swimwear Colorblock Ethnic Argyle Sexy Split Bikini Swimming Suit,Beachwear
101,$27.99,,http://www.jollychic.com/p/women-s-swimwear-strapless-solid-sexy-one-piece-tankini-g627122.html,Women's Swimwear Strapless Solid Sexy One Piece Tankini,Beachwear
16,$12.99,,http://www.jollychic.com/p/women-s-swimwear-color-block-triangle-cup-halterneck-sexy-bikini-set-g766138.html,Women's Swimwear Color Block Triangle Cup Halterneck Sexy Bikini Set,Beachwear
10,$44.99,,http://www.jollychic.com/p/women-s-3-pcs-swimwear-stylish-colorblock-bra-hollow-out-briefs-lace-patchwork-blouse-sexy-swimsuit-g1079208.html,Women's 3 Pcs Swimwear Stylish Colorblock Bra Hollow Out Briefs Lace Patchwork Blouse Sexy Swimsuit,Beachwear
1,$8.99,$17.99,http://www.jollychic.com/p/women-s-swimsuit-colorblock-sleeveless-o-neck-sexy-one-piece-bikini-set-g1306584.html,Women's Swimsuit Colorblock Sleeveless O Neck Sexy One Piece Bikini Set,Beachwear
336,$22.99,$34.99,http://www.jollychic.com/p/women-s-swimwear-adjustable-spaghetti-straps-elastic-classic-sweet-bikini-set-g616216.html,Women's Swimwear Adjustable Spaghetti Straps Elastic Classic Sweet Bikini Set,Beachwear
510,$23.99,$33.99,http://www.jollychic.com/p/women-s-swimwear-color-block-o-neck-short-sleeve-slim-one-piece-tankini-g1014856.html,Women's Swimwear Color Block O Neck Short Sleeve Slim One Piece Tankini,Beachwear
588,$11.99,$17.99,http://www.jollychic.com/p/women-s-solid-color-off-the-shoulder-ruffle-sexy-one-piece-bikini-set-g917402.html,Women's Solid Color Off The Shoulder Ruffle Sexy One Piece Bikini Set,Beachwear
450,$7.99,$22.99,http://www.jollychic.com/p/porcelain-printed-solid-underpants-halter-sexy-bikinis-g101870.html,Porcelain Printed Solid Underpants Halter Sexy Bikinis,Beachwear
65,$7.99,$19.99,http://www.jollychic.com/p/hollow-out-solid-halterneck-bikinis-g136943.html,Hollow Out Solid Halterneck Bikinis,Beachwear
211,$4.99,$7.99,http://www.jollychic.com/p/solid-color-sexy-cut-out-cute-swim-bottoms-g152831.html,Solid Color Sexy Cut-out Cute Swim Bottoms,Beachwear
87,$15.99,,http://www.jollychic.com/p/women-s-2-pcs-swimwear-set-halterneck-ethnic-style-sexy-slim-split-bikini-suit-g667420.html,Women's 2 Pcs Swimwear Set Halterneck Ethnic Style Sexy Slim Split Bikini Suit,Beachwear
269,$13.99,$20.99,http://www.jollychic.com/p/women-s-2-pcs-swimwear-colorblock-floral-simple-sexy-slim-split-bikini-set-g692380.html,Women's 2 Pcs Swimwear Colorblock Floral Simple Sexy Slim Split Bikini Set,Beachwear
219,$6.99,$9.99,http://www.jollychic.com/p/women-s-swimwear-colorblock-wireless-sexy-split-bikini-swimming-suit-g697930.html,Women's Swimwear Colorblock Wireless Sexy Split Bikini Swimming Suit,Beachwear
31,$13.99,,http://www.jollychic.com/p/women-s-2-pcs-swimwear-colorblock-comfy-simple-sexy-slim-split-bikini-set-g723042.html,Women's 2 Pcs Swimwear Colorblock Comfy Simple Sexy Slim Split Bikini Set,Beachwear
33,$19.99,,http://www.jollychic.com/p/women-s-swimwear-palm-tree-pattern-breathable-sexy-one-piece-swim-suit-g995274.html,Women's Swimwear Palm Tree Pattern Breathable Sexy One Piece Swim Suit,Beachwear
20,$44.99,,http://www.jollychic.com/p/women-s-3-pcs-swimwear-stylish-solid-color-bra-set-holiow-out-sexy-blouse-comfy-swimsuit-g1079204.html,Women's 3 Pcs Swimwear Stylish Solid Color Bra Set Holiow Out Sexy Blouse Comfy Swimsuit,Beachwear
381,$34.99,,http://www.jollychic.com/p/women-s-3-pcs-swimsuit-ethnic-style-tassel-decor-sleevelesss-sexy-comfy-swimwear-g1079214.html,Women's 3 Pcs Swimsuit Ethnic Style Tassel Decor Sleevelesss Sexy Comfy Swimwear,Beachwear
389,$13.99,$20.99,http://www.jollychic.com/p/women-s-swimwear-solid-color-backless-cascading-ruffle-sexy-one-piece-bikini-set-g917384.html,Women's Swimwear Solid Color Backless Cascading Ruffle Sexy One Piece Bikini Set,Beachwear
1773,$25.99,$33.99,http://www.jollychic.com/p/women-s-2-pcs-swimwear-set-long-sleeve-colorblock-tankini-suit-g697908.html,Women's 2 Pcs Swimwear Set Long Sleeve Colorblock Tankini Suit,Beachwear
436,$4.99,$7.99,http://www.jollychic.com/p/leopard-bowknot-low-rise-hipster-bikini-bottoms-g136355.html,Leopard Bowknot Low-Rise Hipster Bikini Bottoms,Beachwear
645,$13.99,$17.99,http://www.jollychic.com/p/2pcs-halter-solid-leopard-sexy-bikinis-g137237.html,2Pcs Halter Solid Leopard Sexy Bikinis,Beachwear
22,$13.99,,http://www.jollychic.com/p/women-s-2-pcs-swimwear-colorblock-geometric-pattern-sexy-slim-split-bikini-set-g723032.html,Women's 2 Pcs Swimwear Colorblock Geometric Pattern Sexy Slim Split Bikini Set,Beachwear
190,$13.99,$21.99,http://www.jollychic.com/p/women-s-swimwear-set-solid-color-triangle-cup-weaving-sexy-bikini-suit-g786430.html,Women's Swimwear Set Solid Color Triangle Cup Weaving Sexy Bikini Suit,Beachwear
32,$9.99,$16.99,http://www.jollychic.com/p/women-s-swimwear-colorblock-backless-push-up-one-piece-cozy-swimsuit-g954146.html,Women's Swimwear Colorblock Backless Push Up One Piece Cozy Swimsuit,Beachwear
9,$30.99,,http://www.jollychic.com/p/women-s-swimwear-flower-embroidery-tassel-transparent-long-sleeve-cover-up-g1064508.html,Women's Swimwear Flower Embroidery Tassel Transparent Long Sleeve Cover Up,Beachwear
25,$37.99,,http://www.jollychic.com/p/women-s-2-pcs-swimsuit-solid-color-underwire-push-up-sunscreen-comfy-swimwear-g1079198.html,Women's 2 Pcs Swimsuit Solid Color Underwire Push Up Sunscreen Comfy Swimwear,Beachwear
168,$15.99,$24.99,http://www.jollychic.com/p/women-s-swimwear-set-vintage-floral-high-waist-halterneck-sexy-tankini-set-g975164.html,Women's Swimwear Set Vintage Floral High Waist Halterneck Sexy Tankini Set,Beachwear
4097,$5.99,$22.99,http://www.jollychic.com/p/2pcs-strapless-padded-print-bikini-set-g137227.html,2Pcs Strapless Padded Print Bikini Set,Beachwear
938,$24.99,,http://www.jollychic.com/p/women-s-swimwear-sexy-floral-bohemia-beach-tassel-cover-ups-g664012.html,Women's Swimwear Sexy Floral Bohemia Beach Tassel Cover Ups,Beachwear
7060,$9.99,$13.99,http://www.jollychic.com/p/2pcs-bikinis-patch-mesh-bra-skinny-panties-g154671.html,2Pcs Bikinis Patch Mesh Bra Skinny Panties,Beachwear
368,$23.99,$33.99,http://www.jollychic.com/p/women-s-3pcs-swimwear-hollow-out-hoodies-cover-ups-sexy-underwire-bikini-set-g690588.html,Women's 3Pcs Swimwear Hollow Out Hoodies Cover Ups Sexy Underwire Bikini Set,Beachwear
1473,$15.99,$22.99,http://www.jollychic.com/p/padding-halter-dots-pattern-cheap-tankinis-g101866.html,Padding Halter Dots Pattern Cheap Tankinis,Beachwear
206,$3.99,$8.99,http://www.jollychic.com/p/one-piece-hollow-out-solid-sexy-swimsuit-g144349.html,One Piece Hollow Out Solid Sexy Swimsuit,Beachwear
275,$5.99,$17.99,http://www.jollychic.com/p/straps-back-one-piece-swimsuit-g361192.html,Straps Back One Piece Swimsuit,Beachwear
313,$24.99,$38.99,http://www.jollychic.com/p/women-s-swimwear-set-solid-cropped-cover-ups-floral-long-pants-tankini-suit-g795314.html,Women's Swimwear Set Solid Cropped Cover Ups Floral Long Pants Tankini Suit,Beachwear
139,$26.99,,http://www.jollychic.com/p/women-s-swimwear-set-solid-color-flower-appliques-sexy-beach-bikini-set-g1008954.html,Women's Swimwear Set Solid Color Flower Appliques Sexy Beach Bikini Set,Beachwear
1665,$24.99,$27.99,http://www.jollychic.com/p/women-s-swimwear-2pcs-sleeveless-color-patchwork-swimwear-g511002.html,Women's Swimwear 2Pcs Sleeveless Color Patchwork Swimwear,Beachwear
1434,$11.99,$17.99,http://www.jollychic.com/p/sexy-halter-hollow-out-solid-bikini-set-g144367.html,Sexy Halter Hollow Out Solid Bikini Set,Beachwear
1450,$11.99,$16.99,http://www.jollychic.com/p/one-shoulder-cut-out-black-one-piece-bikinis-g144435.html,One Shoulder Cut Out Black One Piece Bikinis,Beachwear
52,$8.99,$12.99,http://www.jollychic.com/p/women-s-swim-pants-solid-color-side-drawstrings-high-waist-beach-pants-g715294.html,Women's Swim Pants Solid Color Side Drawstrings High Waist Beach Pants,Beachwear
591,$29.99,,http://www.jollychic.com/p/women-s-2pcs-swimwear-color-block-front-zipper-padded-wireless-divingsuit-g560972.html,Women's 2Pcs Swimwear Color Block Front Zipper Padded Wireless Divingsuit,Beachwear
173,$31.99,$41.99,http://www.jollychic.com/p/women-s-swimwear-v-neck-spaghetti-straps-irregular-hem-beach-cover-up-dress-g1067474.html,Women's Swimwear V Neck Spaghetti Straps Irregular Hem Beach Cover Up Dress,Beachwear
10,$16.99,,http://www.jollychic.com/p/women-s-swimwear-solid-color-drawstrings-elastic-waist-swim-bottom-g1148298.html,Women's Swimwear Solid Color Drawstrings Elastic Waist Swim Bottom,Beachwear
