add_wish,discount_price,original_price,product_link,product_name,header_block
149,$10.99,,https://www.jollychic.com/p/stretchy-high-quality-cozy-leggings-g372912.html,Stretchy High Quality Cozy Leggings,Leggings
219,$7.99,$23.99,https://www.jollychic.com/p/women-s-plus-size-leggings-solid-fleece-skinny-leggings-g462584.html,Women's Plus Size Leggings Solid Fleece Skinny Leggings,Leggings
250,$14.99,$22.99,https://www.jollychic.com/p/women-s-leggings-pu-leather-patchwork-punk-style-leggings-g497626.html,Women's Leggings PU Leather Patchwork Punk Style Leggings,Leggings
308,$11.99,$15.99,https://www.jollychic.com/p/women-s-leggings-elastic-waist-polka-dots-fashion-style-leggings-g518864.html,Women's Leggings Elastic Waist Polka Dots Fashion Style Leggings,Leggings
23,$15.99,,https://www.jollychic.com/p/women-s-leggings-low-waist-elastic-colorblock-fashion-style-leggings-g518866.html,Women's Leggings Low Waist Elastic Colorblock Fashion Style Leggings,Leggings
63,$9.99,$27.99,https://www.jollychic.com/p/women-s-leggings-pu-leather-solid-high-waist-skinny-leggings-g569752.html,Women's Leggings PU Leather Solid High Waist Skinny Leggings,Leggings
632,$8.99,$13.99,https://www.jollychic.com/p/women-s-leggings-elastic-waisted-floral-pattern-casual-style-leggings-g574132.html,Women's Leggings Elastic Waisted Floral Pattern Casual Style Leggings,Leggings
99,$13.99,,https://www.jollychic.com/p/women-s-leggings-mid-waisted-leg-bone-pattern-skinny-sexy-leggings-g602082.html,Women's Leggings Mid Waisted Leg Bone Pattern Skinny Sexy Leggings,Leggings
30,$10.99,$17.99,https://www.jollychic.com/p/women-s-leggings-cartoon-pattern-casual-skinny-leggings-g616390.html,Women's Leggings Cartoon Pattern Casual Skinny Leggings,Leggings
104,$20.99,$31.99,https://www.jollychic.com/p/women-s-leggings-elastic-waist-solid-cropped-leggings-g797430.html,Women's Leggings Elastic Waist Solid Cropped Leggings,Leggings
174,$8.99,$14.99,https://www.jollychic.com/p/women-s-leggings-see-through-slim-top-fashion-leggings-g864462.html,Women's Leggings See Through Slim Top Fashion Leggings,Leggings
21,$15.99,,https://www.jollychic.com/p/women-s-leggings-mid-waist-color-block-leggings-g905436.html,Women's Leggings Mid Waist Color Block Leggings,Leggings
5,$20.99,,https://www.jollychic.com/p/women-s-leggings-color-block-skinny-leggings-g912814.html,Women's Leggings Color Block Skinny Leggings,Leggings
150,$37.99,,https://www.jollychic.com/p/women-s-leggings-solid-color-basic-full-length-plus-size-leggings-g1020666.html,Women's Leggings Solid Color Basic Full Length Plus Size Leggings,Leggings
44,$10.99,$14.99,https://www.jollychic.com/p/women-s-leggings-color-block-skinny-leggings-g1032296.html,Women's Leggings Color Block Skinny Leggings,Leggings
20,$21.99,,https://www.jollychic.com/p/women-s-leggings-christmas-pattern-skinny-leggings-g1044794.html,Women's Leggings Christmas Pattern Skinny Leggings,Leggings
10,$23.99,,https://www.jollychic.com/p/women-s-leggings-mid-waisted-animal-pattern-skinny-leggings-g1055898.html,Women's Leggings Mid Waisted Animal Pattern Skinny Leggings,Leggings
17,$23.99,,https://www.jollychic.com/p/women-s-leggings-cartoon-pattern-casual-skinny-leggings-g1076454.html,Women's Leggings Cartoon Pattern Casual Skinny Leggings,Leggings
6,$14.99,$23.99,https://www.jollychic.com/p/women-s-leggings-floral-pattern-skinny-casual-leggings-g1082216.html,Women's Leggings Floral Pattern Skinny Casual Leggings,Leggings
10,$13.99,$23.99,https://www.jollychic.com/p/women-s-leggings-color-block-high-waist-leggings-g1082218.html,Women's Leggings Color Block High Waist Leggings,Leggings
33,$11.99,,https://www.jollychic.com/p/women-s-leggings-floral-pattern-color-block-skinny-casual-leggings-g1105214.html,Women's Leggings Floral Pattern Color Block Skinny Casual Leggings,Leggings
29,$7.99,$11.99,https://www.jollychic.com/p/women-s-leggings-floral-pattern-skinny-leggings-g1105218.html,Women's Leggings Floral Pattern Skinny Leggings,Leggings
34,$4.99,$11.99,https://www.jollychic.com/p/women-s-leggings-floral-color-block-skinny-yoga-leggings-g1105230.html,Women's Leggings Floral Color Block Skinny Yoga Leggings,Leggings
58,$12.99,$19.99,https://www.jollychic.com/p/women-s-leggings-all-match-hole-design-leggings-g1119144.html,Women's Leggings All Match Hole Design Leggings,Leggings
73,$12.99,$19.99,https://www.jollychic.com/p/women-s-leggings-solid-color-thin-skinny-leggings-g1119146.html,Women's Leggings Solid Color Thin Skinny Leggings,Leggings
30,$30.99,,https://www.jollychic.com/p/women-s-leggings-lace-patched-hollow-out-solid-color-cropped-leggings-g1127758.html,Women's Leggings Lace Patched Hollow Out Solid Color Cropped Leggings,Leggings
22,$17.99,$27.99,https://www.jollychic.com/p/women-s-leggings-solid-patchwork-cozy-leggings-g1145068.html,Women's Leggings Solid Patchwork Cozy Leggings,Leggings
17,$14.99,$22.99,https://www.jollychic.com/p/women-s-leggings-mid-waisted-floral-pattern-skinny-leggings-g1215470.html,Women's Leggings Mid Waisted Floral Pattern Skinny Leggings,Leggings
32,$13.99,$20.99,https://www.jollychic.com/p/women-s-leggings-solid-color-hollow-out-skinny-sexy-fitness-pants-g1218682.html,Women's Leggings Solid Color Hollow Out Skinny Sexy Fitness Pants,Leggings
7,$19.99,$20.99,https://www.jollychic.com/p/women-s-leggings-sexy-solid-patchwork-lace-tight-leggings-g1222580.html,Women's Leggings Sexy Solid Patchwork Lace Tight Leggings,Leggings
9,$17.99,$20.99,https://www.jollychic.com/p/women-s-leggings-hollow-out-elastic-waist-tight-leggings-g1222586.html,Women's Leggings Hollow Out Elastic Waist Tight Leggings,Leggings
6,$5.99,$11.99,https://www.jollychic.com/p/women-s-leggings-all-match-cozy-print-leggings-g1223778.html,Women's Leggings All Match Cozy Print Leggings,Leggings
9,$11.99,,https://www.jollychic.com/p/women-s-leggings-low-waist-casual-color-block-leggings-g1223794.html,Women's Leggings Low Waist Casual Color Block Leggings,Leggings
4,$11.99,,https://www.jollychic.com/p/women-s-leggings-print-cute-pattern-skinny-leggings-g1223824.html,Women's Leggings Print Cute Pattern Skinny Leggings,Leggings
11,$9.99,$15.99,https://www.jollychic.com/p/women-s-leggings-high-waist-colorblock-cropped-sports-leggings-g1254244.html,Women's Leggings High Waist Colorblock Cropped Sports Leggings,Leggings
6,$22.99,,https://www.jollychic.com/p/women-s-leggings-letter-floral-color-block-leggings-g1275038.html,Women's Leggings Letter Floral Color Block Leggings,Leggings
6,$25.99,,https://www.jollychic.com/p/women-s-leggings-hole-patchwork-mid-waisted-leggings-g1276242.html,Women's Leggings Hole Patchwork Mid Waisted Leggings,Leggings
11,$11.99,$19.99,https://www.jollychic.com/p/women-s-leggings-solid-color-three-quarters-skinny-leggings-g1277492.html,Women's Leggings Solid Color Three Quarters Skinny Leggings,Leggings
1,$22.99,,https://www.jollychic.com/p/women-s-leggings-three-quarters-patched-skinny-leggings-g1294054.html,Women's Leggings Three Quarters Patched Skinny Leggings,Leggings
9,$9.99,,https://www.jollychic.com/p/women-s-legging-floral-printed-skinny-comfy-all-match-pants-g1299550.html,Women's Legging Floral Printed Skinny Comfy All Match Pants,Leggings
5,$9.99,,https://www.jollychic.com/p/women-s-legging-floral-printed-casual-skinny-comfy-all-match-pants-g1299812.html,Women's Legging Floral Printed Casual Skinny Comfy All Match Pants,Leggings
2,$26.99,,https://www.jollychic.com/p/women-s-legging-colorblock-mid-waisted-comfortable-yoga-legging-g1299948.html,Women's Legging Colorblock Mid Waisted Comfortable Yoga Legging,Leggings
1,$18.99,,https://www.jollychic.com/p/women-s-leggings-solid-color-button-mid-waist-leggings-g1301128.html,Women's Leggings Solid Color Button Mid Waist Leggings,Leggings
18,$15.99,$22.99,https://www.jollychic.com/p/women-s-leggings-solid-gauze-patch-black-skinny-leggings-g1303134.html,Women's Leggings Solid Gauze Patch Black Skinny Leggings,Leggings
6,$9.99,$16.99,https://www.jollychic.com/p/women-s-leggings-gauze-patch-cozy-skinny-leggings-g1306112.html,Women's Leggings Gauze Patch Cozy Skinny Leggings,Leggings
15,$9.99,$15.99,https://www.jollychic.com/p/women-s-leggings-elastic-waist-colorful-stripe-leggings-g1307998.html,Women's Leggings Elastic Waist Colorful Stripe Leggings,Leggings
18,$7.99,$13.99,https://www.jollychic.com/p/women-s-leggings-animal-pattern-skinny-leggings-g1308000.html,Women's Leggings Animal Pattern Skinny Leggings,Leggings
20,$17.99,$29.99,https://www.jollychic.com/p/women-s-leggings-stripe-color-block-cozy-leggings-g1308008.html,Women's Leggings Stripe Color Block Cozy Leggings,Leggings
8,$8.99,$16.99,https://www.jollychic.com/p/women-s-leggings-casual-skinny-black-leggings-g1317282.html,Women's Leggings Casual Skinny Black Leggings,Leggings
12,$9.99,$16.99,https://www.jollychic.com/p/women-s-leggings-classic-gauze-patch-black-leggings-g1317286.html,Women's Leggings Classic Gauze Patch Black Leggings,Leggings
6,$9.99,$16.99,https://www.jollychic.com/p/women-s-leggings-gauze-patch-black-cozy-leggings-g1317290.html,Women's Leggings Gauze Patch Black Cozy Leggings,Leggings
13,$22.99,,https://www.jollychic.com/p/women-s-leggings-hollow-out-comfy-all-match-breathable-leggings-g1331122.html,Women's Leggings Hollow Out Comfy All Match Breathable Leggings,Leggings
5,$14.99,$23.99,https://www.jollychic.com/p/women-s-leggings-mid-waisted-color-block-skinny-leggings-g1332014.html,Women's Leggings Mid Waisted Color Block Skinny Leggings,Leggings
2,$14.99,$22.99,https://www.jollychic.com/p/women-s-leggings-low-waisted-skull-pattern-skinny-leggings-g1332026.html,Women's Leggings Low Waisted Skull Pattern Skinny Leggings,Leggings
4,$15.99,$24.99,https://www.jollychic.com/p/women-s-leggings-low-waisted-skull-pattern-skinny-leggings-g1332030.html,Women's Leggings Low Waisted Skull Pattern Skinny Leggings,Leggings
3,$11.99,$19.99,https://www.jollychic.com/p/women-s-leggings-comfy-color-block-high-waist-leggings-g1336352.html,Women's Leggings Comfy Color Block High Waist Leggings,Leggings
4,$9.99,$15.99,https://www.jollychic.com/p/women-s-leggings-pu-patch-cozy-skinny-leggings-g1336356.html,Women's Leggings PU Patch Cozy Skinny Leggings,Leggings
13,$8.99,$13.99,https://www.jollychic.com/p/women-s-leggings-casual-animal-color-block-leggings-g1336362.html,Women's Leggings Casual Animal Color Block Leggings,Leggings
3,$16.99,$26.99,https://www.jollychic.com/p/women-s-legging-thicken-vintage-style-flora-slim-all-match-pant-g1338022.html,Women's Legging Thicken Vintage Style Flora Slim All Match Pant,Leggings
6,$25.99,,https://www.jollychic.com/p/women-s-leggings-high-waist-patchwork-skinny-leggings-g1344642.html,Women's Leggings High Waist Patchwork Skinny Leggings,Leggings
6,$24.99,$37.99,https://www.jollychic.com/p/women-s-leggings-floral-skinny-yoga-midi-waist-leggings-g1347754.html,Women's Leggings Floral Skinny Yoga Midi Waist Leggings,Leggings
18,$13.99,,https://www.jollychic.com/p/women-s-legging-print-letter-high-waisted-skinny-legging-g1352210.html,Women's Legging Print Letter High Waisted Skinny Legging,Leggings
6,$24.99,$37.99,https://www.jollychic.com/p/women-s-leggings-high-waist-solid-sexy-plus-size-leggings-g1362744.html,Women's Leggings High Waist Solid Sexy Plus Size Leggings,Leggings
1,$21.99,,https://www.jollychic.com/p/women-s-leggings-fashion-sexy-design-digital-print-comfortable-skinny-leggings-g1364736.html,Women's Leggings Fashion Sexy Design Digital Print Comfortable Skinny Leggings,Leggings
5,$21.99,,https://www.jollychic.com/p/women-s-leggings-high-waisted-floral-printed-color-blocking-slim-fitness-pants-g1364738.html,Women's Leggings High Waisted Floral Printed Color Blocking Slim Fitness Pants,Leggings
6,$21.99,,https://www.jollychic.com/p/women-s-leggings-floral-high-waist-fashion-design-skinny-render-pants-g1364740.html,Women's Leggings Floral High Waist Fashion Design Skinny Render Pants,Leggings
6,$7.99,$13.99,https://www.jollychic.com/p/women-s-leggings-slim-cross-printing-floral-pattern-elastic-mid-waisted-skinny-pants-g1364806.html,Women's Leggings Slim Cross Printing Floral Pattern Elastic Mid Waisted Skinny Pants,Leggings
3,$14.99,$22.99,https://www.jollychic.com/p/women-s-leggings-solid-color-letters-full-length-leggings-g1391224.html,Women's Leggings Solid Color Letters Full Length Leggings,Leggings
5,$19.99,,https://www.jollychic.com/p/women-s-leggings-solid-comfy-all-match-seamless-breathable-leggings-g1395158.html,Women's Leggings Solid Comfy All Match Seamless Breathable Leggings,Leggings
10,$21.99,,https://www.jollychic.com/p/women-s-leggings-high-waist-colorblock-skinny-leggings-g1395268.html,Women's Leggings High Waist Colorblock Skinny Leggings,Leggings
8,$16.99,,https://www.jollychic.com/p/women-s-leggings-color-block-all-match-casual-leggings-g1398114.html,Women's Leggings Color Block All Match Casual Leggings,Leggings
1,$17.99,,https://www.jollychic.com/p/women-s-leggings-fashion-halloween-cartoon-digital-printing-skinny-render-pants-g1400622.html,Women's Leggings Fashion Halloween Cartoon Digital Printing Skinny Render Pants,Leggings
1,$17.99,,https://www.jollychic.com/p/women-s-leggings-fashion-halloween-cartoon-digital-printing-skinny-render-pants-g1400626.html,Women's Leggings Fashion Halloween Cartoon Digital Printing Skinny Render Pants,Leggings
3,$23.99,$36.99,https://www.jollychic.com/p/women-s-bell-bottom-solid-color-split-elastic-plus-size-leggings-g1402022.html,Women's Bell Bottom Solid Color Split Elastic Plus Size Leggings,Leggings
37,$15.99,$23.99,https://www.jollychic.com/p/women-s-black-legging-brushed-bubble-skirt-stylish-fake-two-pieces-trouser-g1434262.html,Women's Black Legging Brushed Bubble Skirt Stylish Fake Two Pieces Trouser,Leggings
2,$14.99,,https://www.jollychic.com/p/women-s-leggings-solid-color-high-waisted-skinny-elastic-all-match-pencil-pants-g1456278.html,Women's Leggings Solid Color High Waisted Skinny Elastic All Match Pencil Pants,Leggings
3,$15.99,,https://www.jollychic.com/p/women-s-leggings-letter-pattern-slim-leggings-g1465882.html,Women's Leggings Letter Pattern Slim Leggings,Leggings
3,$21.99,,https://www.jollychic.com/p/women-s-casual-legging-leopard-appliques-new-high-waist-elastic-fashion-black-legging-g1465998.html,Women's Casual Legging Leopard Appliques New High Waist Elastic Fashion Black Legging,Leggings
5,$14.99,,https://www.jollychic.com/p/women-s-fashion-legging-solid-hollow-out-slim-female-style-high-waist-legging-g1470174.html,Women's Fashion Legging Solid Hollow Out Slim Female Style High Waist Legging,Leggings
0,$14.99,,https://www.jollychic.com/p/women-s-fashion-legging-solid-hollow-out-thin-slim-high-waist-legging-g1470192.html,Women's Fashion Legging Solid Hollow out Thin Slim High Waist Legging,Leggings
1,$21.99,,https://www.jollychic.com/p/women-s-leggings-colorblock-comfy-all-match-breathable-stylish-leggings-g1477288.html,Women's Leggings Colorblock Comfy All Match Breathable Stylish Leggings,Leggings
42,$6.99,$12.99,https://www.jollychic.com/p/women-s-leggings-floral-skinny-mid-waist-patchwork-skinny-fluffy-leggings-g1477382.html,Women's Leggings Floral Skinny Mid Waist Patchwork Skinny Fluffy Leggings,Leggings
3,$12.99,,https://www.jollychic.com/p/women-s-leggings-mid-waisted-candy-color-skinny-leggings-g1482964.html,Women's Leggings Mid Waisted Candy Color Skinny Leggings,Leggings
2,$22.99,,https://www.jollychic.com/p/women-s-leggings-high-waist-solid-pu-skinny-leggings-g1486614.html,Women's Leggings High Waist Solid PU Skinny Leggings,Leggings
1,$22.99,,https://www.jollychic.com/p/women-s-leggings-high-waist-solid-pu-skinny-leggings-g1486618.html,Women's Leggings High Waist Solid PU Skinny Leggings,Leggings
2,$7.99,$13.99,https://www.jollychic.com/p/women-s-leggings-striped-midi-waist-skinny-color-block-leggings-g1490232.html,Women's Leggings Striped Midi Waist Skinny Color Block Leggings,Leggings
0,$11.99,$18.99,https://www.jollychic.com/p/women-s-leggings-floral-mid-waist-loose-plus-size-leggings-g1490254.html,Women's Leggings Floral Mid Waist Loose Plus Size Leggings,Leggings
4,$32.99,,https://www.jollychic.com/p/forqueens-women-s-plus-size-legging-slim-knit-black-pant-g1492536.html,ForQueens Women's Plus Size Legging Slim Knit Black Pant,Leggings
6,$7.99,$13.99,https://www.jollychic.com/p/women-s-legging-patchwork-pattern-mid-waist-all-match-skinny-pants-g1516384.html,Women's Legging Patchwork Pattern Mid Waist All Match Skinny Pants,Leggings
0,$132.00,$341.00,https://www.jollychic.com/p/women-s-legging-all-match-floral-pattern-high-waist-skinny-pants-g1516396.html,Women's Legging All Match Floral Pattern High Waist Skinny Pants,Leggings
2,$7.99,$13.99,https://www.jollychic.com/p/women-s-legging-all-match-skinny-argyle-pattern-high-waist-pants-g1516404.html,Women's Legging All Match Skinny Argyle Pattern High Waist Pants,Leggings
6,$7.99,$13.99,https://www.jollychic.com/p/women-s-legging-geometric-pattern-skinny-high-waist-pant-g1516414.html,Women's Legging Geometric Pattern Skinny High Waist Pant,Leggings
0,$8.99,$14.99,https://www.jollychic.com/p/women-s-leggings-letter-pattern-skinny-mid-waist-pants-g1516492.html,Women's Leggings Letter Pattern Skinny Mid Waist Pants,Leggings
2,$18.99,$29.99,https://www.jollychic.com/p/women-s-leggings-high-waist-solid-leather-leggings-g1521748.html,Women's Leggings High Waist Solid Leather Leggings,Leggings
1,$16.99,,https://www.jollychic.com/p/women-s-leggings-snowflake-moose-pattern-elastic-waist-belly-in-skinny-pants-g1535474.html,Women's Leggings Snowflake Moose Pattern Elastic Waist Belly-In Skinny Pants,Leggings
1,$16.99,,https://www.jollychic.com/p/women-s-leggings-clouds-moon-pattern-elastic-waist-belly-in-skinny-pants-g1535478.html,Women's Leggings Clouds Moon Pattern Elastic Waist Belly-In Skinny Pants,Leggings
1,$16.99,,https://www.jollychic.com/p/women-s-leggings-christmas-santa-claus-pattern-elastic-waist-belly-in-skinny-pants-g1535480.html,Women's Leggings Christmas Santa Claus Pattern Elastic Waist Belly-In Skinny Pants,Leggings
1,$16.99,,https://www.jollychic.com/p/women-s-leggings-snow-moose-pattern-elastic-waist-lip-hip-skinny-pants-g1535498.html,Women's Leggings Snow Moose Pattern Elastic Waist Lip-Hip Skinny Pants,Leggings
2,$16.99,,https://www.jollychic.com/p/women-s-leggings-christmas-pattern-elastic-waist-lip-hip-skinny-pants-g1535502.html,Women's Leggings Christmas Pattern Elastic Waist Lip-Hip Skinny Pants,Leggings
1,$16.99,,https://www.jollychic.com/p/women-s-leggings-santa-claus-pattern-elastic-waist-lip-hip-skinny-pants-g1535504.html,Women's Leggings Santa Claus Pattern Elastic Waist Lip-Hip Skinny Pants,Leggings
1,$16.99,,https://www.jollychic.com/p/women-s-leggings-colorblock-letter-pattern-elastic-waist-belly-in-skinny-pants-g1535534.html,Women's Leggings Colorblock Letter Pattern Elastic Waist Belly-In Skinny Pants,Leggings
0,$24.99,,https://www.jollychic.com/p/women-s-leggings-plaid-high-waisted-sexy-skinny-fashion-pants-g1540384.html,Women's Leggings Plaid High Waisted Sexy Skinny Fashion Pants,Leggings
5,$15.99,,https://www.jollychic.com/p/women-s-leggings-gradient-ramp-elastic-fashion-all-match-skinny-pants-g1540978.html,Women's Leggings Gradient Ramp Elastic Fashion All Match Skinny Pants,Leggings
1,$15.99,,https://www.jollychic.com/p/women-s-leggings-elastic-comfy-fashion-skinny-pencil-pants-g1540982.html,Women's Leggings Elastic Comfy Fashion Skinny Pencil Pants,Leggings
3,$15.99,,https://www.jollychic.com/p/women-s-leggings-letter-print-elastic-fashion-printing-skinny-pants-g1540984.html,Women's Leggings Letter Print Elastic Fashion Printing Skinny Pants,Leggings
4,$12.99,$18.99,https://www.jollychic.com/p/women-s-legging-pure-color-plush-large-size-skinny-pants-g1545990.html,Women's Legging Pure Color Plush Large Size Skinny Pants,Leggings
1,$28.99,,https://www.jollychic.com/p/women-s-leggings-solid-color-pocket-button-skinny-pu-plus-size-leggings-g1554000.html,Women's Leggings Solid Color Pocket Button Skinny PU Plus Size Leggings,Leggings
1,$9.99,,https://www.jollychic.com/p/women-s-leggings-patchwork-leopard-high-waist-skinny-leggings-g1554056.html,Women's Leggings Patchwork Leopard High Waist Skinny Leggings,Leggings
3,$9.99,,https://www.jollychic.com/p/women-s-leggings-patchwork-leopard-high-waist-skinny-leggings-g1554058.html,Women's Leggings Patchwork Leopard High Waist Skinny Leggings,Leggings
6,$12.99,$19.99,https://www.jollychic.com/p/women-s-leggings-solid-color-side-split-elastic-waist-slim-leggings-g1563004.html,Women's Leggings Solid Color Side Split Elastic Waist Slim Leggings,Leggings
1,$24.99,,https://www.jollychic.com/p/women-s-leggings-striped-pattern-elastic-high-waist-slim-leggings-g1563018.html,Women's Leggings Striped Pattern Elastic High Waist Slim Leggings,Leggings
0,$24.99,,https://www.jollychic.com/p/women-s-legging-abstract-floral-mid-waist-sheath-legging-g1569318.html,Women's Legging Abstract Floral Mid Waist Sheath Legging,Leggings
1,$24.99,,https://www.jollychic.com/p/women-s-legging-abstract-floral-high-waist-sheath-legging-g1569322.html,Women's Legging Abstract Floral High Waist Sheath Legging,Leggings
0,$24.99,,https://www.jollychic.com/p/women-s-legging-abstract-floral-high-waist-sheath-legging-g1569324.html,Women's Legging Abstract Floral High Waist Sheath Legging,Leggings
56,$8.99,$20.99,https://www.jollychic.com/p/cute-picture-printed-polyester-leggings-g9073.html,Cute Picture Printed Polyester Leggings,Leggings
1097,$9.99,$14.99,https://www.jollychic.com/p/black-lace-up-faux-leather-patchwork-leggings-g87342.html,Black Lace-up Faux Leather Patchwork Leggings,Leggings
101,$12.99,$21.99,https://www.jollychic.com/p/women-s-leggings-high-waist-solid-plus-size-leggings-g401584.html,Women's Leggings High Waist Solid Plus Size Leggings,Leggings
214,$12.99,,https://www.jollychic.com/p/women-s-plus-size-leggings-high-waist-jeans-like-solid-leggings-g453494.html,Women's Plus Size Leggings High Waist Jeans Like Solid Leggings,Leggings
394,$31.99,$59.00,https://www.jollychic.com/p/women-s-leggings-elastic-waist-cozy-solid-leggings-g453862.html,Women's Leggings Elastic Waist Cozy Solid Leggings,Leggings
144,$27.99,$51.00,https://www.jollychic.com/p/women-s-leggings-solid-high-waist-elastic-waist-skinny-leggings-g453914.html,Women's Leggings Solid High Waist Elastic Waist Skinny Leggings,Leggings
333,$8.99,,https://www.jollychic.com/p/women-s-plus-size-leggings-high-waist-high-elastic-slim-faux-leather-leggings-g466052.html,Women's Plus Size Leggings High Waist High Elastic Slim Faux Leather Leggings,Leggings
2711,$7.99,$10.99,https://www.jollychic.com/p/women-s-plus-size-leggings-mid-waist-elastic-solid-slim-velvet-thick-leggings-g466068.html,Women's Plus Size Leggings Mid Waist Elastic Solid Slim Velvet Thick Leggings,Leggings
739,$17.99,$23.99,https://www.jollychic.com/p/women-s-leggings-gauze-patchwork-visable-sexy-leggings-g569750.html,Women's Leggings Gauze Patchwork Visable Sexy Leggings,Leggings
107,$8.99,,https://www.jollychic.com/p/women-s-leggings-elastic-waist-cropped-black-leggings-g667834.html,Women's Leggings Elastic Waist Cropped Black Leggings,Leggings
98,$18.99,,https://www.jollychic.com/p/women-s-leggings-elastic-waist-leaves-pattern-casual-style-leggings-g710986.html,Women's Leggings Elastic Waist Leaves Pattern Casual Style Leggings,Leggings
688,$5.99,$8.99,https://www.jollychic.com/p/women-s-leggings-cozy-elastic-waist-lace-patch-cropped-leggings-g788192.html,Women's Leggings Cozy Elastic Waist Lace Patch Cropped Leggings,Leggings
27,$5.99,$17.99,https://www.jollychic.com/p/women-s-leggings-low-waist-animal-print-slim-leggings-g851048.html,Women's Leggings Low Waist Animal Print Slim Leggings,Leggings
30,$17.99,,https://www.jollychic.com/p/women-s-leggings-solid-color-lace-patchwork-skinny-leggings-g865952.html,Women's Leggings Solid Color Lace Patchwork Skinny Leggings,Leggings
15,$13.99,$20.99,https://www.jollychic.com/p/women-s-leggings-color-block-christmas-pattern-skinny-leggings-g912818.html,Women's Leggings Color Block Christmas Pattern Skinny Leggings,Leggings
46,$15.99,,https://www.jollychic.com/p/women-s-leggings-floral-pattern-elastic-waist-skinny-leggings-g917228.html,Women's Leggings Floral Pattern Elastic Waist Skinny Leggings,Leggings
6,$15.99,,https://www.jollychic.com/p/women-s-leggings-solid-color-patchwork-skinny-yoga-leggings-g1031764.html,Women's Leggings Solid Color Patchwork Skinny Yoga Leggings,Leggings
40,$16.99,$24.99,https://www.jollychic.com/p/women-s-leggings-high-waist-cozy-black-leggings-g1034572.html,Women's Leggings High Waist Cozy Black Leggings,Leggings
137,$16.99,,https://www.jollychic.com/p/women-s-leggings-high-waist-solid-hollow-out-sexy-leggings-g1039790.html,Women's Leggings High Waist Solid Hollow Out Sexy Leggings,Leggings
14,$21.99,,https://www.jollychic.com/p/women-s-leggings-color-block-skinny-leggings-g1044798.html,Women's Leggings Color Block Skinny Leggings,Leggings
28,$20.99,,https://www.jollychic.com/p/women-s-leggings-color-block-skinny-leggings-g1052778.html,Women's Leggings Color Block Skinny Leggings,Leggings
22,$11.99,$24.99,https://www.jollychic.com/p/women-s-leggings-elastic-waist-color-block-leggings-g1054592.html,Women's Leggings Elastic Waist Color Block Leggings,Leggings
37,$23.99,,https://www.jollychic.com/p/women-s-leggings-mid-waisted-floral-pattern-skinny-leggings-g1055896.html,Women's Leggings Mid Waisted Floral Pattern Skinny Leggings,Leggings
69,$11.99,$24.99,https://www.jollychic.com/p/women-s-leggings-all-match-cozy-solid-leggings-g1066120.html,Women's Leggings All Match Cozy Solid Leggings,Leggings
15,$23.99,,https://www.jollychic.com/p/women-s-leggings-color-block-casual-skinny-leggings-g1076456.html,Women's Leggings Color Block Casual Skinny Leggings,Leggings
10,$11.99,,https://www.jollychic.com/p/women-s-leggings-color-block-skinny-casual-leggings-g1105208.html,Women's Leggings Color Block Skinny Casual Leggings,Leggings
