add_wish,discount_price,original_price,product_link,product_name,header_block
75,$130.00,$142.00,https://www.jollychic.com/p/women-s-cocktail-dress-solid-color-sexy-tassel-beading-hollow-out-ladylike-short-party-dress-g1456982.html,Women's Cocktail Dress Solid Color Sexy Tassel Beading Hollow Out Ladylike Short Party Dress,Weddings & Events
60,$82.00,$109.00,https://www.jollychic.com/p/women-s-evening-dress-solid-color-slash-neck-off-shoulder-half-sleeve-elegant-dress-g1492818.html,Women's Evening Dress Solid Color Slash Neck Off Shoulder Half Sleeve Elegant Dress,Weddings & Events
1121,$80.00,$143.00,https://www.jollychic.com/p/women-s-short-beading-homecoming-dress-evening-dress-g346686.html,Women's Short Beading Homecoming Dress Evening Dress,Weddings & Events
675,$40.60,$58.00,https://www.jollychic.com/p/women-s-sexy-sheer-halter-long-evening-dress-g391342.html,Women's Sexy Sheer Halter Long Evening Dress,Weddings & Events
1117,$30.99,$59.00,https://www.jollychic.com/p/women-s-evening-dress-long-dress-off-shoulder-floor-length-mermaid-dress-g395120.html,Women's Evening Dress Long Dress Off Shoulder Floor Length Mermaid Dress,Weddings & Events
1576,$105.00,$166.00,https://www.jollychic.com/p/women-s-plus-size-delicate-floral-appliques-strapless-wedding-dress-g472414.html,Women's Plus Size Delicate Floral Appliques Strapless Wedding Dress,Weddings & Events
851,$100.00,$163.00,https://www.jollychic.com/p/women-s-dress-tulle-rhinestones-sleeveless-ornament-cocktail-homecoming-dress-g474092.html,Women's Dress Tulle Rhinestones Sleeveless Ornament Cocktail Homecoming Dress,Weddings & Events
901,$134.00,$178.00,https://www.jollychic.com/p/women-s-wedding-dress-mesh-patchwork-embroidery-slim-mermaid-long-wedding-dress-g478908.html,Women's Wedding Dress Mesh Patchwork Embroidery Slim Mermaid Long Wedding Dress,Weddings & Events
1308,$126.00,$170.00,https://www.jollychic.com/p/women-s-wedding-dress-lace-appliques-slim-mermaid-long-train-wedding-dress-g478910.html,Women's Wedding Dress Lace Appliques Slim Mermaid Long Train Wedding Dress,Weddings & Events
2529,$101.00,$139.00,https://www.jollychic.com/p/women-s-plus-size-evening-dress-sequins-ornament-long-ladylike-evening-dress-g478912.html,Women's Plus Size Evening Dress Sequins Ornament Long Ladylike Evening Dress,Weddings & Events
1125,$38.99,$100.00,https://www.jollychic.com/p/women-s-plus-size-evening-dress-lace-embroidery-tulle-long-evening-dress-g482810.html,Women's Plus Size Evening Dress Lace Embroidery Tulle Long Evening Dress,Weddings & Events
2312,$45.99,$63.00,https://www.jollychic.com/p/women-s-prom-dress-strapless-cascading-ruffles-sweet-short-homecoming-dress-g488824.html,Women's Prom Dress Strapless Cascading Ruffles Sweet Short Homecoming Dress,Weddings & Events
1565,$38.99,$58.00,https://www.jollychic.com/p/women-s-plus-size-prom-dress-solid-color-ruffles-short-homecoming-dress-g489016.html,Women's Plus Size Prom Dress Solid Color Ruffles Short Homecoming Dress,Weddings & Events
1430,$51.99,$84.00,https://www.jollychic.com/p/women-s-cocktail-dress-high-low-bandage-sexy-dress-g490260.html,Women's Cocktail Dress High Low Bandage Sexy Dress,Weddings & Events
1450,$9.99,$15.99,https://www.jollychic.com/p/women-s-capelet-wedding-dress-solid-faux-fur-capelet-g490262.html,Women's Capelet Wedding Dress Solid Faux-Fur Capelet,Weddings & Events
1032,$48.99,$84.00,https://www.jollychic.com/p/women-s-evening-dress-lace-patchwork-slim-long-evening-dress-g490546.html,Women's Evening Dress Lace Patchwork Slim Long Evening Dress,Weddings & Events
7507,$48.99,$68.00,https://www.jollychic.com/p/women-s-prom-dress-lace-embroidery-bow-short-tulle-homecoming-dress-g491896.html,Women's Prom Dress Lace Embroidery Bow Short Tulle Homecoming Dress,Weddings & Events
1429,$131.00,$163.00,https://www.jollychic.com/p/women-s-wedding-dress-flowers-appliques-back-lace-up-bow-long-wedding-dress-g494388.html,Women's Wedding Dress Flowers Appliques Back Lace-Up Bow Long Wedding Dress,Weddings & Events
524,$131.00,$163.00,https://www.jollychic.com/p/women-s-wedding-dress-lace-appliques-flower-rhinestones-mermaid-wedding-dress-g494562.html,Women's Wedding Dress Lace Appliques Flower Rhinestones Mermaid Wedding Dress,Weddings & Events
1015,$84.00,$107.00,https://www.jollychic.com/p/women-s-evening-dress-solid-color-sequins-slim-mermaid-ladylike-evening-dress-g494784.html,Women's Evening Dress Solid Color Sequins Slim Mermaid Ladylike Evening Dress,Weddings & Events
825,$80.25,$107.00,https://www.jollychic.com/p/women-s-evening-dress-gradient-ramp-strapless-tulle-faddish-long-evening-dress-g494786.html,Women's Evening Dress Gradient Ramp Strapless Tulle Faddish Long Evening Dress,Weddings & Events
1075,$51.00,$84.00,https://www.jollychic.com/p/women-s-evening-dress-solid-color-sequins-ruching-long-ladylike-evening-dress-g494884.html,Women's Evening Dress Solid Color Sequins Ruching Long Ladylike Evening Dress,Weddings & Events
892,$109.99,$177.00,https://www.jollychic.com/p/women-s-wedding-dress-ruching-cascading-ruffles-long-elegant-wedding-dress-g495010.html,Women's Wedding Dress Ruching Cascading Ruffles Long Elegant Wedding Dress,Weddings & Events
278,$63.00,$86.00,https://www.jollychic.com/p/women-s-wedding-dress-cascading-ruffles-mesh-bow-beading-long-wedding-dress-g495142.html,Women's Wedding Dress Cascading Ruffles Mesh Bow Beading Long Wedding Dress,Weddings & Events
432,$90.00,$121.00,https://www.jollychic.com/p/women-s-wedding-dress-ruching-cascading-ruffles-bow-long-wedding-dress-g495144.html,Women's Wedding Dress Ruching Cascading Ruffles Bow Long Wedding Dress,Weddings & Events
169,$182.00,$228.00,https://www.jollychic.com/p/women-s-wedding-dress-strapless-flower-elegant-tulle-long-wedding-dress-g499814.html,Women's Wedding Dress Strapless Flower Elegant Tulle Long Wedding Dress,Weddings & Events
513,$99.00,$132.00,https://www.jollychic.com/p/women-s-plus-size-evening-dress-floral-appliques-ladylike-lace-evening-dress-g505666.html,Women's Plus Size Evening Dress Floral Appliques Ladylike Lace Evening Dress,Weddings & Events
2207,$76.00,$102.00,https://www.jollychic.com/p/women-s-plus-size-wedding-dress-strapless-lace-hollow-out-wedding-dress-g510428.html,Women's Plus Size Wedding Dress Strapless Lace Hollow Out Wedding Dress,Weddings & Events
376,$66.00,$89.00,https://www.jollychic.com/p/women-s-plus-size-evening-dress-solid-color-strapless-mermaid-ladylike-evening-dress-g512686.html,Women's Plus Size Evening Dress Solid Color Strapless Mermaid Ladylike Evening Dress,Weddings & Events
151,$110.00,$146.00,https://www.jollychic.com/p/women-s-wedding-dress-2pcs-sleeveless-appliques-lace-wedding-dress-g516056.html,Women's Wedding Dress 2Pcs Sleeveless Appliques Lace Wedding Dress,Weddings & Events
820,$97.50,$150.00,https://www.jollychic.com/p/women-s-evening-dress-light-blue-beading-tulle-ruffles-flowers-evening-dress-g516058.html,Women's Evening Dress Light Blue Beading Tulle Ruffles Flowers Evening Dress,Weddings & Events
1387,$100.00,$146.00,https://www.jollychic.com/p/women-s-wedding-dress-2pcs-sleeveless-appliques-lace-wedding-dress-g516196.html,Women's Wedding Dress 2Pcs Sleeveless Appliques Lace Wedding Dress,Weddings & Events
717,$92.00,$168.00,https://www.jollychic.com/p/women-s-evening-dress-solid-color-lace-see-through-evening-dress-g519906.html,Women's Evening Dress Solid Color Lace See Through Evening Dress,Weddings & Events
4843,$75.00,$106.00,https://www.jollychic.com/p/women-s-evening-dress-half-sleeve-sweep-length-evening-dress-g520142.html,Women's Evening Dress Half Sleeve Sweep Length Evening Dress,Weddings & Events
654,$82.00,$102.00,https://www.jollychic.com/p/women-s-wedding-dress-off-the-shoulder-half-sleeve-lace-flower-maxi-long-dress-g552230.html,Women's Wedding Dress Off The Shoulder Half Sleeve Lace Flower Maxi Long Dress,Weddings & Events
535,$70.00,$92.00,https://www.jollychic.com/p/women-s-evening-dress-flower-butterfly-embroidery-long-sleeve-evening-dress-g552822.html,Women's Evening Dress Flower Butterfly Embroidery Long Sleeve Evening Dress,Weddings & Events
406,$95.00,$159.00,https://www.jollychic.com/p/women-s-wedding-dress-lace-flower-appliques-hollow-out-elegant-maxi-long-dress-g554456.html,Women's Wedding Dress Lace Flower Appliques Hollow Out Elegant Maxi Long Dress,Weddings & Events
303,$110.00,$143.00,https://www.jollychic.com/p/women-s-wedding-dress-lace-halterneck-backless-slim-sexy-mermaid-evening-dress-g554510.html,Women's Wedding Dress Lace Halterneck Backless Slim Sexy Mermaid Evening Dress,Weddings & Events
1486,$73.00,$101.00,https://www.jollychic.com/p/women-s-evening-dress-beading-v-neck-backless-fishtail-slim-maxi-dress-g572562.html,Women's Evening Dress Beading V Neck Backless Fishtail Slim Maxi Dress,Weddings & Events
1048,$46.99,$91.00,https://www.jollychic.com/p/women-s-evening-dress-pure-color-lace-v-neck-long-sleeve-elegant-maxi-long-dress-g606276.html,Women's Evening Dress Pure Color Lace V Neck Long Sleeve Elegant Maxi Long Dress,Weddings & Events
169,$64.00,$102.00,https://www.jollychic.com/p/women-s-wedding-dress-flower-appliques-one-shoulder-ball-gown-maxi-long-dress-g609820.html,Women's Wedding Dress Flower Appliques One Shoulder Ball Gown Maxi Long Dress,Weddings & Events
195,$118.50,$158.00,https://www.jollychic.com/p/women-s-wedding-dress-strapless-rhinestones-mermaid-sweep-train-wedding-dress-g609824.html,Women's Wedding Dress Strapless Rhinestones Mermaid Sweep Train Wedding Dress,Weddings & Events
124,$92.00,$123.00,https://www.jollychic.com/p/women-s-evening-dress-blossoms-pattern-strapless-sweetheart-neckline-maxi-dress-g612568.html,Women's Evening Dress Blossoms Pattern Strapless Sweetheart Neckline Maxi Dress,Weddings & Events
1580,$44.99,$83.00,https://www.jollychic.com/p/women-s-evening-dress-one-shoulder-lace-hollow-out-maxi-dress-aline-dress-g619458.html,Women's Evening Dress One Shoulder Lace Hollow Out Maxi Dress Aline Dress,Weddings & Events
1368,$48.99,$73.00,https://www.jollychic.com/p/women-s-evening-dress-sexy-lace-off-shoulder-high-waisted-beading-aline-dress-g619860.html,Women's Evening Dress Sexy Lace Off Shoulder High-Waisted Beading Aline Dress,Weddings & Events
2277,$30.99,$40.99,https://www.jollychic.com/p/women-s-formal-dress-patchwork-retro-design-slim-maxi-long-evening-dress-g624788.html,Women's Formal Dress Patchwork Retro Design Slim Maxi Long Evening Dress,Weddings & Events
2533,$65.00,$89.00,https://www.jollychic.com/p/women-s-evening-dress-red-v-neck-sleeveless-a-line-elegant-maxi-long-dress-g630130.html,Women's Evening Dress Red V Neck Sleeveless A-Line Elegant Maxi Long Dress,Weddings & Events
419,$56.00,$79.00,https://www.jollychic.com/p/women-s-prom-dress-lace-patchwork-half-sleeve-bow-belt-short-homecoming-dress-g630132.html,Women's Prom Dress Lace Patchwork Half Sleeve Bow Belt Short Homecoming Dress,Weddings & Events
344,$39.99,$68.00,https://www.jollychic.com/p/women-s-prom-dress-solid-color-off-shoulder-elegant-short-homecoming-dress-g630134.html,Women's Prom Dress Solid Color Off Shoulder Elegant Short Homecoming Dress,Weddings & Events
774,$112.00,$163.00,https://www.jollychic.com/p/women-s-evening-dress-bridal-gown-lace-solid-fishtail-dinner-dress-g632880.html,Women's Evening Dress Bridal Gown Lace Solid Fishtail Dinner Dress,Weddings & Events
624,$66.00,$89.00,https://www.jollychic.com/p/women-s-evening-dress-strapless-red-slim-fishtail-floor-length-mermaid-g638976.html,Women's Evening Dress Strapless Red Slim Fishtail Floor Length Mermaid,Weddings & Events
421,$66.00,$89.00,https://www.jollychic.com/p/women-s-evening-dress-red-strapless-lace-bow-floor-length-aline-dress-g638978.html,Women's Evening Dress Red Strapless Lace Bow Floor Length Aline Dress,Weddings & Events
312,$66.75,$89.00,https://www.jollychic.com/p/women-s-wedding-dress-banquet-hosted-v-neck-slim-sequins-ruching-aline-dress-g638984.html,Women's Wedding Dress Banquet Hosted V Neck Slim Sequins Ruching Aline Dress,Weddings & Events
919,$98.00,$132.00,https://www.jollychic.com/p/women-s-shoulders-dress-slim-shiny-sequins-toast-bride-gowns-evening-dress-g645424.html,Women's Shoulders Dress Slim Shiny Sequins Toast Bride Gowns Evening Dress,Weddings & Events
1464,$59.00,$79.00,https://www.jollychic.com/p/women-s-short-bridesmaid-dress-a-word-shoulder-hosting-banquet-evening-dress-g649420.html,Women's Short Bridesmaid Dress A Word Shoulder Hosting Banquet Evening Dress,Weddings & Events
621,$80.00,$107.00,https://www.jollychic.com/p/women-s-wedding-dress-a-word-shoulder-toast-bride-sexy-lace-fishtail-dress-g649738.html,Women's Wedding Dress A Word Shoulder Toast Bride Sexy Lace Fishtail Dress,Weddings & Events
411,$15.99,$20.99,https://www.jollychic.com/p/women-s-wraps-cape-lace-floral-hem-sequins-graceful-white-wedding-dress-shawl-g667980.html,Women's Wraps Cape Lace Floral Hem Sequins Graceful White Wedding Dress Shawl,Weddings & Events
258,$16.99,$21.99,https://www.jollychic.com/p/women-s-wraps-cape-lace-floral-stand-collar-graceful-thin-wedding-dress-capelet-g667982.html,Women's Wraps Cape Lace Floral Stand Collar Graceful Thin Wedding Dress Capelet,Weddings & Events
1760,$37.99,$69.00,https://www.jollychic.com/p/women-s-evening-dress-one-shoulder-ruffles-lady-chic-aline-dress-g703440.html,Women's Evening Dress One Shoulder Ruffles Lady Chic Aline Dress,Weddings & Events
806,$153.00,$207.00,https://www.jollychic.com/p/women-s-evening-dress-flowers-strapless-elegance-small-trailing-dinner-dresses-g703656.html,Women's Evening Dress Flowers Strapless Elegance Small Trailing Dinner Dresses,Weddings & Events
438,$95.55,$147.00,https://www.jollychic.com/p/women-s-wedding-dress-floral-lace-strapless-sequins-sweep-train-maxi-long-dress-g704526.html,Women's Wedding Dress Floral Lace Strapless Sequins Sweep Train Maxi Long Dress,Weddings & Events
4728,$63.00,$88.00,https://www.jollychic.com/p/women-s-prom-dress-floral-lace-stand-collar-puff-sleeve-elegant-homecoming-dress-g704624.html,Women's Prom Dress Floral Lace Stand Collar Puff Sleeve Elegant Homecoming Dress,Weddings & Events
328,$77.00,$102.00,https://www.jollychic.com/p/women-s-wedding-veil-white-floral-hem-trailing-long-graceful-wedding-veil-g713804.html,Women's Wedding Veil White Floral Hem Trailing Long Graceful Wedding Veil,Weddings & Events
330,$70.00,$92.00,https://www.jollychic.com/p/women-s-evening-dress-ladylike-floral-aline-tea-length-elegant-banquet-dress-g722536.html,Women's Evening Dress Ladylike Floral Aline Tea Length Elegant Banquet Dress,Weddings & Events
446,$92.00,$118.00,https://www.jollychic.com/p/women-s-evening-dress-hollow-out-backless-sweep-train-slim-elegant-maxi-long-dress-g752886.html,Women's Evening Dress Hollow Out Backless Sweep Train Slim Elegant Maxi Long Dress,Weddings & Events
803,$86.00,$107.00,https://www.jollychic.com/p/women-s-evening-dress-patchwork-stand-collar-embroidery-ladylike-maxi-dress-g753104.html,Women's Evening Dress Patchwork Stand Collar Embroidery Ladylike Maxi Dress,Weddings & Events
854,$80.00,$102.00,https://www.jollychic.com/p/women-s-evening-dress-solid-color-off-shoulder-lace-elegant-maxi-long-dress-g753260.html,Women's Evening Dress Solid Color Off Shoulder Lace Elegant Maxi Long Dress,Weddings & Events
322,$95.00,$118.00,https://www.jollychic.com/p/women-s-wedding-dress-floral-embroidery-off-shoulder-half-sleeve-maxi-dress-g765852.html,Women's Wedding Dress Floral Embroidery Off Shoulder Half Sleeve Maxi Dress,Weddings & Events
258,$68.00,$90.00,https://www.jollychic.com/p/women-s-wedding-dress-flower-appliques-off-shoulder-half-sleeve-sweet-maxi-dress-g765868.html,Women's Wedding Dress Flower Appliques Off Shoulder Half Sleeve Sweet Maxi Dress,Weddings & Events
431,$107.00,$133.00,https://www.jollychic.com/p/women-s-wedding-dress-off-shoulder-short-sleeve-floral-white-sweet-maxi-dress-g765880.html,Women's Wedding Dress Off Shoulder Short Sleeve Floral White Sweet Maxi Dress,Weddings & Events
293,$74.00,$97.00,https://www.jollychic.com/p/women-s-evening-dress-sparkle-sequins-beaded-sleeveless-mermaid-maxi-dress-g791722.html,Women's Evening Dress Sparkle Sequins Beaded Sleeveless Mermaid Maxi Dress,Weddings & Events
441,$61.00,$77.00,https://www.jollychic.com/p/women-s-wedding-dress-white-flower-embroidery-high-waist-aline-evening-dress-g795388.html,Women's Wedding Dress White Flower Embroidery High Waist Aline Evening Dress,Weddings & Events
1043,$78.00,$98.00,https://www.jollychic.com/p/women-s-prom-dress-sleeveless-cascading-front-short-long-back-cocktail-dress-g804646.html,Women's Prom Dress Sleeveless Cascading Front Short Long Back Cocktail Dress,Weddings & Events
3255,$68.00,$90.00,https://www.jollychic.com/p/women-s-prom-dress-ladylike-floral-off-shoulder-aline-elegant-cocktail-dress-g804668.html,Women's Prom Dress Ladylike Floral Off Shoulder Aline Elegant Cocktail Dress,Weddings & Events
542,$99.00,$123.00,https://www.jollychic.com/p/women-s-evening-dress-flower-embroidery-long-sleeve-sweep-train-maxi-dress-g804670.html,Women's Evening Dress Flower Embroidery Long Sleeve Sweep Train Maxi Dress,Weddings & Events
724,$55.00,$85.00,https://www.jollychic.com/p/women-s-prom-dress-red-off-shoulder-half-sleeve-cascading-short-cocktail-dress-g808764.html,Women's Prom Dress Red Off Shoulder Half Sleeve Cascading Short Cocktail Dress,Weddings & Events
1099,$67.00,$109.00,https://www.jollychic.com/p/women-s-evening-dress-off-shoulder-half-sleeve-sequins-elegant-aline-maxi-dress-g817836.html,Women's Evening Dress Off Shoulder Half Sleeve Sequins Elegant Aline Maxi Dress,Weddings & Events
637,$52.00,$69.00,https://www.jollychic.com/p/women-s-evening-dress-solid-red-v-neck-sleeveless-floor-length-maxi-dress-g831416.html,Women's Evening Dress Solid Red V Neck Sleeveless Floor Length Maxi Dress,Weddings & Events
130,$70.00,$107.00,https://www.jollychic.com/p/women-s-evening-dress-multi-color-ruffles-hem-spaghetti-straps-sweet-maxi-dress-g831428.html,Women's Evening Dress Multi-Color Ruffles Hem Spaghetti Straps Sweet Maxi Dress,Weddings & Events
378,$60.00,$93.00,https://www.jollychic.com/p/women-s-evening-dress-flower-appliques-half-sleeve-ladylike-maxi-long-dress-g874752.html,Women's Evening Dress Flower Appliques Half Sleeve Ladylike Maxi Long Dress,Weddings & Events
238,$76.00,$108.00,https://www.jollychic.com/p/women-s-evening-dress-elegant-deep-v-halterneck-sleeveless-aline-maxi-dress-g880566.html,Women's Evening Dress Elegant Deep V Halterneck Sleeveless Aline Maxi Dress,Weddings & Events
98,$145.00,$180.00,https://www.jollychic.com/p/women-s-evening-dress-sparkle-sequins-strapless-aline-floor-length-maxi-dress-g881352.html,Women's Evening Dress Sparkle Sequins Strapless Aline Floor Length Maxi Dress,Weddings & Events
331,$71.00,$109.00,https://www.jollychic.com/p/women-s-evening-dress-pure-color-floral-lace-backless-bowknot-decor-maxi-dress-g908796.html,Women's Evening Dress Pure Color Floral Lace Backless Bowknot Decor Maxi Dress,Weddings & Events
81,$69.00,$91.00,https://www.jollychic.com/p/women-s-prom-dress-solid-color-vintage-back-hollow-out-three-quarter-sleeve-cocktail-dress-g995348.html,Women's Prom Dress Solid Color Vintage Back Hollow Out Three Quarter Sleeve Cocktail Dress,Weddings & Events
137,$57.00,$88.00,https://www.jollychic.com/p/women-s-prom-dress-black-floral-sleeveless-jewel-neck-backless-cocktail-dress-g995360.html,Women's Prom Dress Black Floral Sleeveless Jewel Neck Backless Cocktail Dress,Weddings & Events
485,$88.00,$109.00,https://www.jollychic.com/p/women-s-evening-dress-solid-color-elegant-floral-back-hollow-out-half-sleeve-maxi-dress-g1009264.html,Women's Evening Dress Solid Color Elegant Floral Back Hollow Out Half Sleeve Maxi Dress,Weddings & Events
314,$84.00,$104.00,https://www.jollychic.com/p/women-s-evening-dress-solid-black-sleeveless-draping-split-elegant-dress-g1024944.html,Women's Evening Dress Solid Black Sleeveless Draping Split Elegant Dress,Weddings & Events
267,$96.00,$119.00,https://www.jollychic.com/p/women-s-wedding-dress-brief-slim-off-shoulder-floral-rhinestone-ball-gown-maxi-dress-g1040888.html,Women's Wedding Dress Brief Slim Off Shoulder Floral Rhinestone Ball Gown Maxi Dress,Weddings & Events
49,$72.00,$94.00,https://www.jollychic.com/p/women-s-wedding-dress-off-shoulder-half-sleeve-floral-bow-belt-sweet-maxi-dress-g1040910.html,Women's Wedding Dress Off Shoulder Half Sleeve Floral Bow Belt Sweet Maxi Dress,Weddings & Events
86,$129.00,$161.00,https://www.jollychic.com/p/women-s-wedding-dress-half-sleeve-v-neck-chest-warp-waist-hollow-out-sexy-dress-g1053064.html,Women's Wedding Dress Half Sleeve V Neck Chest Warp Waist Hollow Out Sexy Dress,Weddings & Events
63,$63.00,$83.00,https://www.jollychic.com/p/women-s-bridesmaid-dress-sweet-floral-embroidery-off-shoulder-aline-evening-dress-g1058542.html,Women's Bridesmaid Dress Sweet Floral Embroidery Off Shoulder Aline Evening Dress,Weddings & Events
243,$75.00,$106.00,https://www.jollychic.com/p/women-s-evening-dress-solid-color-floral-lace-half-sleeve-elegant-aline-maxi-dress-g1080370.html,Women's Evening Dress Solid Color Floral Lace Half Sleeve Elegant Aline Maxi Dress,Weddings & Events
472,$70.00,$92.00,https://www.jollychic.com/p/women-s-evening-dress-sexy-flower-embroidery-ruffles-long-sleeve-mermaid-dress-g1087832.html,Women's Evening Dress Sexy Flower Embroidery Ruffles Long Sleeve Mermaid Dress,Weddings & Events
92,$90.00,$102.00,https://www.jollychic.com/p/women-s-wedding-dress-red-beading-backless-three-quarter-sleeve-elegant-maxi-dress-g1139080.html,Women's Wedding Dress Red Beading Backless Three Quarter Sleeve Elegant Maxi Dress,Weddings & Events
87,$60.00,$93.00,https://www.jollychic.com/p/women-s-evening-dress-solid-color-floral-v-neck-sweet-elegant-aline-bridesmaid-dress-g1164632.html,Women's Evening Dress Solid Color Floral V Neck Sweet Elegant Aline Bridesmaid Dress,Weddings & Events
95,$58.00,$90.00,https://www.jollychic.com/p/women-s-bridesmaid-dress-brief-sweet-heart-shape-neck-aline-evening-dress-g1164636.html,Women's Bridesmaid Dress Brief Sweet Heart Shape Neck Aline Evening Dress,Weddings & Events
391,$69.00,$106.00,https://www.jollychic.com/p/women-s-evening-dress-elegant-off-the-shoulder-solid-color-aline-floor-length-dress-g1176862.html,Women's Evening Dress Elegant Off The Shoulder Solid Color Aline Floor Length Dress,Weddings & Events
250,$93.00,$122.00,https://www.jollychic.com/p/women-s-evening-dress-elegant-sequined-gradient-color-three-quarter-sleeve-mermaid-dress-g1176866.html,Women's Evening Dress Elegant Sequined Gradient Color Three Quarter Sleeve Mermaid Dress,Weddings & Events
223,$107.00,$140.00,https://www.jollychic.com/p/women-s-evening-dress-floral-pattern-sleeveless-slash-neck-sexy-cocktail-dress-g1191834.html,Women's Evening Dress Floral Pattern Sleeveless Slash Neck Sexy Cocktail Dress,Weddings & Events
67,$103.50,$138.00,https://www.jollychic.com/p/women-s-evening-dress-solid-color-rhinestone-decor-sleeveless-sexy-cocktail-dress-g1191840.html,Women's Evening Dress Solid Color Rhinestone Decor Sleeveless Sexy Cocktail Dress,Weddings & Events
455,$53.00,$81.00,https://www.jollychic.com/p/women-s-prom-dress-solid-color-halter-neck-off-shoulder-side-split-sexy-fishtail-dress-g1233748.html,Women's Prom Dress Solid Color Halter Neck Off Shoulder Side Split Sexy Fishtail Dress,Weddings & Events
61,$143.00,$189.00,https://www.jollychic.com/p/women-s-wedding-dress-lace-embroidery-slash-neck-off-shoulder-tassel-decor-elegant-dress-g1234354.html,Women's Wedding Dress Lace Embroidery Slash Neck Off Shoulder Tassel Decor Elegant Dress,Weddings & Events
40,$93.00,$124.00,https://www.jollychic.com/p/women-s-wedding-dress-solid-color-lace-rhinestone-decor-sleeveless-o-neck-elegant-dress-g1234356.html,Women's Wedding Dress Solid Color Lace Rhinestone Decor Sleeveless O Neck Elegant Dress,Weddings & Events
58,$61.00,$79.00,https://www.jollychic.com/p/women-s-prom-dress-solid-color-rhinestone-decor-ball-gown-short-cocktail-dress-g1314162.html,Women's Prom Dress Solid Color Rhinestone Decor Ball Gown Short Cocktail Dress,Weddings & Events
26,$68.00,$84.00,https://www.jollychic.com/p/women-s-bridesmaid-dress-solid-color-elegant-butterfly-appliques-strapless-maxi-dress-g1322678.html,Women's Bridesmaid Dress Solid Color Elegant Butterfly Appliques Strapless Maxi Dress,Weddings & Events
41,$66.00,$102.00,https://www.jollychic.com/p/women-s-evening-dress-elegant-pure-color-lace-half-sleeve-backless-aline-maxi-dress-g1336692.html,Women's Evening Dress Elegant Pure Color Lace Half Sleeve Backless Aline Maxi Dress,Weddings & Events
30,$117.92,$134.00,https://www.jollychic.com/p/women-s-wedding-dress-elegant-off-shoulder-half-sleeve-ball-gown-simple-maxi-dress-g1336704.html,Women's Wedding Dress Elegant Off Shoulder Half Sleeve Ball Gown Simple Maxi Dress,Weddings & Events
26,$74.00,$92.00,https://www.jollychic.com/p/women-s-wedding-dress-solid-color-one-shoulder-off-shoulder-back-bandage-rhinestone-decor-dress-g1404898.html,Women's Wedding Dress Solid Color One Shoulder Off Shoulder Back Bandage Rhinestone Decor Dress,Weddings & Events
30,$26.99,$37.99,https://www.jollychic.com/p/women-s-shawl-solid-color-turn-down-collar-long-sleeve-elegant-wedding-accessory-g1404914.html,Women's Shawl Solid Color Turn Down Collar Long Sleeve Elegant Wedding Accessory,Weddings & Events
122,$19.99,$31.99,https://www.jollychic.com/p/women-s-shawl-solid-color-v-neck-thicken-elegant-wedding-accessory-g1404918.html,Women's Shawl Solid Color V Neck Thicken Elegant Wedding Accessory,Weddings & Events
53,$112.00,$124.00,https://www.jollychic.com/p/women-s-evening-dress-solid-color-lace-up-short-sleeve-o-neck-sweet-dress-g1406776.html,Women's Evening Dress Solid Color Lace Up Short Sleeve O Neck Sweet Dress,Weddings & Events
