add_wish,discount_price,original_price,product_link,product_name,header_block
19,$13.99,,https://www.jollychic.com/p/women-s-leggings-solid-color-high-waisted-skinny-elastic-all-match-pencil-pants-g1458340.html,Women's Leggings Solid Color High Waisted Skinny Elastic All Match Pencil Pants,Leggings
65,$10.99,$16.99,https://www.jollychic.com/p/women-s-leggings-solid-color-simple-style-high-waisted-all-match-pencil-pants-g1458342.html,Women's Leggings Solid Color Simple Style High Waisted All Match Pencil Pants,Leggings
54,$15.99,$28.99,https://www.jollychic.com/p/semir-women-s-simple-legging-solid-color-slim-letter-elastic-pant-g1459322.html,Semir Women's Simple Legging Solid Color Slim Letter Elastic Pant,Leggings
1,$12.99,$19.99,https://www.jollychic.com/p/women-s-leggings-solid-color-high-waist-hole-decor-slim-pants-g1460096.html,Women's Leggings Solid Color High Waist Hole Decor Slim Pants,Leggings
16,$21.99,,https://www.jollychic.com/p/women-s-leggings-striped-pattern-elastic-mid-waist-all-match-slim-leggings-g1472166.html,Women's Leggings Striped Pattern Elastic Mid Waist All Match Slim Leggings,Leggings
14,$7.99,$13.99,https://www.jollychic.com/p/women-s-leggings-solid-comfy-stylish-all-match-breathable-leggings-g1477286.html,Women's Leggings Solid Comfy Stylish All Match Breathable Leggings,Leggings
17,$16.99,,https://www.jollychic.com/p/women-s-leggings-solid-color-elastic-high-waisted-comfy-all-match-skinny-pants-g1483262.html,Women's Leggings Solid Color Elastic High Waisted Comfy All Match Skinny Pants,Leggings
8,$8.99,$14.99,https://www.jollychic.com/p/women-s-leggings-letter-animal-pattern-midi-waist-skinny-cropped-leggings-g1490228.html,Women's Leggings Letter Animal Pattern Midi Waist Skinny Cropped Leggings,Leggings
2,$7.99,$13.99,https://www.jollychic.com/p/women-s-leggings-color-block-striped-mid-waist-slim-leggings-g1490242.html,Women's Leggings Color Block Striped Mid Waist Slim Leggings,Leggings
3,$23.99,,https://www.jollychic.com/p/forqueens-women-s-plus-size-legging-slim-brushed-warm-black-pant-g1491500.html,ForQueens Women's Plus Size Legging Slim Brushed Warm Black Pant,Leggings
7,$18.99,$27.99,https://www.jollychic.com/p/women-s-leggings-synthetic-leather-sequins-fleece-thicken-all-match-leggings-g1500746.html,Women's Leggings Synthetic Leather Sequins Fleece Thicken All Match Leggings,Leggings
3,$25.99,,https://www.jollychic.com/p/women-s-leggings-elastic-waist-splicing-color-blocking-casual-sports-base-trousers-g1501248.html,Women's Leggings Elastic Waist Splicing Color Blocking Casual Sports Base Trousers,Leggings
9,$4.99,$9.99,https://www.jollychic.com/p/women-s-legging-skinny-mid-waist-leopard-pattern-casual-pants-g1516368.html,Women's Legging Skinny Mid Waist Leopard Pattern Casual Pants,Leggings
0,$18.99,$28.99,https://www.jollychic.com/p/women-s-leggings-high-waist-solid-hollow-out-leggings-g1521740.html,Women's Leggings High Waist Solid Hollow Out Leggings,Leggings
2,$16.99,,https://www.jollychic.com/p/women-s-leggings-christmas-pattern-elastic-comfy-fashion-skinny-pants-g1525376.html,Women's Leggings Christmas Pattern Elastic Comfy Fashion Skinny Pants,Leggings
11,$14.99,$22.99,https://www.jollychic.com/p/women-s-legging-skinny-mid-waist-hollow-out-pattern-casual-pants-g1526452.html,Women's Legging Skinny Mid Waist Hollow Out Pattern Casual Pants,Leggings
6,$12.99,$20.99,https://www.jollychic.com/p/women-s-legging-skinny-solid-color-high-waist-casual-pants-g1526456.html,Women's Legging Skinny Solid Color High Waist Casual Pants,Leggings
5,$28.99,,https://www.jollychic.com/p/women-s-leggings-solid-skinny-casual-leggings-g1528598.html,Women's Leggings Solid Skinny Casual Leggings,Leggings
5,$24.99,,https://www.jollychic.com/p/women-s-leggings-fish-scale-pettern-high-waisted-sexy-skinny-stylish-pants-g1540388.html,Women's Leggings Fish Scale Pettern High Waisted Sexy Skinny Stylish Pants,Leggings
2,$24.99,,https://www.jollychic.com/p/women-s-leggings-rainbow-unicorn-pattern-fashion-skinny-pants-g1540392.html,Women's Leggings Rainbow Unicorn Pattern Fashion Skinny Pants,Leggings
4,$24.99,,https://www.jollychic.com/p/women-s-leggings-galaxy-digital-print-sexy-stylish-skinny-leggings-g1540394.html,Women's Leggings Galaxy Digital Print Sexy Stylish Skinny Leggings,Leggings
2,$15.99,,https://www.jollychic.com/p/women-s-leggings-star-print-elastic-fashion-comfy-skinny-pants-g1540986.html,Women's Leggings Star Print Elastic Fashion Comfy Skinny Pants,Leggings
3,$16.99,$24.99,https://www.jollychic.com/p/women-s-legging-pure-color-cropped-pocket-pants-g1545988.html,Women's Legging Pure Color Cropped Pocket Pants,Leggings
1,$18.99,,https://www.jollychic.com/p/women-s-leggings-patchwork-comfy-all-match-breathable-stylish-leggings-g1553876.html,Women's Leggings Patchwork Comfy All Match Breathable Stylish Leggings,Leggings
6,$21.99,,https://www.jollychic.com/p/women-s-leggings-solid-color-elastic-high-waist-front-split-slim-leggings-g1563014.html,Women's Leggings Solid Color Elastic High Waist Front Split Slim Leggings,Leggings
4,$19.99,$29.99,https://www.jollychic.com/p/women-s-leggings-striped-comfy-all-match-breathable-stylish-leggings-g1568418.html,Women's Leggings Striped Comfy All Match Breathable Stylish Leggings,Leggings
1,$22.99,,https://www.jollychic.com/p/women-s-leggings-hole-imitation-cowboy-style-elastic-slim-pants-g1585642.html,Women's Leggings Hole Imitation Cowboy Style Elastic Slim Pants,Leggings
6,$22.99,,https://www.jollychic.com/p/women-s-leggings-camouflage-pattern-elastic-waist-stretch-pencil-pants-g1585646.html,Women's Leggings Camouflage Pattern Elastic Waist Stretch Pencil Pants,Leggings
2,$24.99,,https://www.jollychic.com/p/women-s-stylish-legging-camouflage-knee-hollow-elastic-pant-g1586992.html,Women's Stylish Legging Camouflage Knee Hollow Elastic Pant,Leggings
1,$28.99,,https://www.jollychic.com/p/women-s-slim-legging-simple-all-match-elastic-cotton-pant-g1586994.html,Women's Slim Legging Simple All Match Elastic Cotton Pant,Leggings
0,$25.99,,https://www.jollychic.com/p/women-s-leggings-mesh-patchwork-skinny-yoga-leggings-g1587582.html,Women's Leggings Mesh Patchwork Skinny Yoga Leggings,Leggings
2,$24.99,,https://www.jollychic.com/p/women-s-leggings-mesh-patchwork-sexy-skinny-leggings-g1587584.html,Women's Leggings Mesh Patchwork Sexy Skinny Leggings,Leggings
2,$27.99,,https://www.jollychic.com/p/women-s-leggings-color-block-skinny-yoga-leggings-g1587586.html,Women's Leggings Color Block Skinny Yoga Leggings,Leggings
3,$25.99,,https://www.jollychic.com/p/women-s-leggings-letter-pattern-skinny-casual-leggings-g1587588.html,Women's Leggings Letter Pattern Skinny Casual Leggings,Leggings
1,$25.99,,https://www.jollychic.com/p/women-s-leggings-breathable-patchwork-skinny-leggings-g1587590.html,Women's Leggings Breathable Patchwork Skinny Leggings,Leggings
0,$21.99,,https://www.jollychic.com/p/women-s-leggings-solid-hollow-out-skinny-leggings-g1587594.html,Women's Leggings Solid Hollow Out Skinny Leggings,Leggings
2,$24.99,,https://www.jollychic.com/p/women-s-leggings-hollow-out-skinny-yoga-leggings-g1587596.html,Women's Leggings Hollow Out Skinny Yoga Leggings,Leggings
8,$24.99,,https://www.jollychic.com/p/women-s-leggings-animal-pattern-casual-skinny-leggings-g1587622.html,Women's Leggings Animal Pattern Casual Skinny Leggings,Leggings
7,$17.99,,https://www.jollychic.com/p/women-s-corduroy-leggings-mid-waisted-solid-skinny-leggings-g1588232.html,Women's Corduroy Leggings Mid Waisted Solid Skinny Leggings,Leggings
0,$25.99,,https://www.jollychic.com/p/women-s-leggings-brief-design-patchwork-color-block-skinny-leggings-g1590806.html,Women's Leggings Brief Design Patchwork Color Block Skinny Leggings,Leggings
-1,$31.99,,https://www.jollychic.com/p/women-s-pants-stripe-patchwork-casual-pants-g1592796.html,Women's Pants Stripe Patchwork Casual Pants,Leggings
0,$31.99,,https://www.jollychic.com/p/women-s-leggings-letter-pattern-skinny-casual-plus-size-leggings-g1592800.html,Women's Leggings Letter Pattern Skinny Casual Plus Size Leggings,Leggings
1,$28.99,,https://www.jollychic.com/p/women-s-leggings-letter-pattern-skinny-casual-leggings-g1592840.html,Women's Leggings Letter Pattern Skinny Casual Leggings,Leggings
0,$28.99,,https://www.jollychic.com/p/women-s-leggings-letter-pattern-skinny-casual-leggings-g1592844.html,Women's Leggings Letter Pattern Skinny Casual Leggings,Leggings
0,$24.99,,https://www.jollychic.com/p/women-s-legging-skinny-high-waist-rivet-decoration-casual-pants-g1593664.html,Women's Legging Skinny High Waist Rivet Decoration Casual Pants,Leggings
0,$36.99,,https://www.jollychic.com/p/women-s-legging-high-waist-solid-color-straight-pipe-pocket-decoration-casual-pants-g1593708.html,Women's Legging High Waist Solid Color Straight Pipe Pocket Decoration Casual Pants,Leggings
0,$20.99,,https://www.jollychic.com/p/women-s-leggings-elastic-lace-splicing-brushed-warmth-pu-pencil-all-match-pants-g1594176.html,Women's Leggings Elastic Lace Splicing Brushed Warmth PU Pencil All Match Pants,Leggings
0,$22.99,,https://www.jollychic.com/p/women-s-leggings-beading-solid-color-brushed-thicken-pu-skinny-fashion-base-trousers-g1594178.html,Women's Leggings Beading Solid Color Brushed Thicken Pu Skinny Fashion Base Trousers,Leggings
0,$9.99,$22.99,https://www.jollychic.com/p/women-s-leggings-rivets-decoration-slim-cut-brushed-thicken-warmth-full-length-pu-trousers-g1594180.html,Women's Leggings Rivets Decoration Slim Cut Brushed Thicken Warmth Full Length PU Trousers,Leggings
0,$14.99,,https://www.jollychic.com/p/women-s-legging-mid-waist-camouflage-colorful-slim-legging-g1594756.html,Women's Legging Mid Waist Camouflage Colorful Slim Legging,Leggings
2,$14.99,,https://www.jollychic.com/p/women-s-legging-mid-waist-animal-floral-slim-legging-g1594758.html,Women's Legging Mid Waist Animal Floral Slim Legging,Leggings
0,$29.99,,https://www.jollychic.com/p/women-s-leather-legging-solid-color-high-waist-pocket-slim-leather-legging-g1594760.html,Women's Leather Legging Solid Color High Waist Pocket Slim Leather Legging,Leggings
0,$28.99,,https://www.jollychic.com/p/women-s-legging-solid-color-high-waist-slim-casual-legging-g1594762.html,Women's Legging Solid Color High Waist Slim Casual Legging,Leggings
602,$11.99,,https://www.jollychic.com/p/basic-style-solid-high-waist-pu-skinny-leggings-g62122.html,Basic Style Solid High Waist Pu Skinny Leggings,Leggings
2232,$13.99,$17.99,https://www.jollychic.com/p/solid-faux-leather-elastic-waist-fleece-leggings-g139257.html,Solid Faux Leather Elastic Waist Fleece Leggings,Leggings
903,$6.99,$17.99,https://www.jollychic.com/p/plus-size-letter-print-black-leggings-g360352.html,Plus Size Letter Print Black Leggings,Leggings
1107,$7.99,$20.99,https://www.jollychic.com/p/women-s-leggings-high-waist-mesh-side-hollow-out-solid-leggings-g497910.html,Women's Leggings High Waist Mesh Side Hollow Out Solid Leggings,Leggings
135,$9.99,$24.99,https://www.jollychic.com/p/women-s-leggings-straight-chiffon-hollow-out-skinny-leggings-g589382.html,Women's Leggings Straight Chiffon Hollow Out Skinny Leggings,Leggings
28,$15.99,$24.99,https://www.jollychic.com/p/women-s-leggings-yoga-skinny-floral-sports-colorblock-leggings-g589384.html,Women's Leggings Yoga Skinny Floral Sports Colorblock Leggings,Leggings
84,$13.99,,https://www.jollychic.com/p/women-s-leggings-elastic-waisted-geometric-pattern-casual-style-leggings-g607434.html,Women's Leggings Elastic Waisted Geometric Pattern Casual Style Leggings,Leggings
93,$11.99,$20.99,https://www.jollychic.com/p/women-s-leggings-solid-color-hollow-out-sexy-skinny-leggings-g645592.html,Women's Leggings Solid Color Hollow Out Sexy Skinny Leggings,Leggings
47,$87.00,$145.00,https://www.jollychic.com/p/voa-women-s-leggings-cozy-black-cropped-all-match-leggings-g819176.html,VOA Women's Leggings Cozy Black Cropped All Match Leggings,Leggings
83,$14.99,,https://www.jollychic.com/p/women-s-leggings-solid-color-lace-patched-hollow-out-leggings-g864412.html,Women's Leggings Solid Color Lace Patched Hollow Out Leggings,Leggings
19,$20.99,,https://www.jollychic.com/p/women-s-leggings-floral-pattern-skinny-cozy-leggings-g905448.html,Women's Leggings Floral Pattern Skinny Cozy Leggings,Leggings
15,$20.99,,https://www.jollychic.com/p/women-s-leggings-elastic-waist-floral-skinny-leggings-g905450.html,Women's Leggings Elastic Waist Floral Skinny Leggings,Leggings
17,$20.99,,https://www.jollychic.com/p/women-s-leggings-color-block-floral-cozy-leggings-g905452.html,Women's Leggings Color Block Floral Cozy Leggings,Leggings
16,$20.99,,https://www.jollychic.com/p/women-s-leggings-color-block-stripe-floral-leggings-g905454.html,Women's Leggings Color Block Stripe Floral Leggings,Leggings
34,$13.99,$22.99,https://www.jollychic.com/p/women-s-leggings-elastic-waist-color-block-cozy-leggings-g907208.html,Women's Leggings Elastic Waist Color Block Cozy Leggings,Leggings
8,$19.99,,https://www.jollychic.com/p/women-s-leggings-floral-pattern-skinny-yoga-leggings-g1023298.html,Women's Leggings Floral Pattern Skinny Yoga Leggings,Leggings
48,$10.99,$14.99,https://www.jollychic.com/p/women-s-leggings-solid-color-cropped-leggings-g1046322.html,Women's Leggings Solid Color Cropped Leggings,Leggings
59,$14.99,$24.99,https://www.jollychic.com/p/women-s-leggings-elastic-waist-skinny-color-block-leggings-g1054600.html,Women's Leggings Elastic Waist Skinny Color Block Leggings,Leggings
41,$23.99,,https://www.jollychic.com/p/women-s-leggings-mid-waisted-flower-pattern-color-block-leggings-g1055900.html,Women's Leggings Mid Waisted Flower Pattern Color Block Leggings,Leggings
23,$23.99,,https://www.jollychic.com/p/women-s-leggings-elastic-waist-star-pattern-skinny-leggings-g1055904.html,Women's Leggings Elastic Waist Star Pattern Skinny Leggings,Leggings
33,$10.99,$28.99,https://www.jollychic.com/p/women-s-leggings-color-block-print-letter-pattern-leggings-g1070316.html,Women's Leggings Color Block Print Letter Pattern Leggings,Leggings
12,$11.99,,https://www.jollychic.com/p/women-s-leggings-floral-pattern-stretch-skinny-leggings-g1105222.html,Women's Leggings Floral Pattern Stretch Skinny Leggings,Leggings
70,$5.99,,https://www.jollychic.com/p/women-s-leggings-solid-color-slim-stylish-leggings-g1107050.html,Women's Leggings Solid Color Slim Stylish Leggings,Leggings
56,$12.99,$19.99,https://www.jollychic.com/p/women-s-leggings-solid-high-waist-skinny-leggings-g1119150.html,Women's Leggings Solid High Waist Skinny Leggings,Leggings
4,$18.99,$33.99,https://www.jollychic.com/p/women-s-leggings-solid-comfy-all-match-breathable-leggings-g1191774.html,Women's Leggings Solid Comfy All Match Breathable Leggings,Leggings
14,$9.99,$18.99,https://www.jollychic.com/p/women-s-lagging-solid-color-high-waist-zipper-breathable-belly-in-simple-pants-g1220952.html,Women's Lagging Solid Color High Waist Zipper Breathable Belly-In Simple Pants,Leggings
25,$12.99,$19.99,https://www.jollychic.com/p/women-s-leggings-sexy-solid-patchwork-pocket-tight-leggings-g1222582.html,Women's Leggings Sexy Solid Patchwork Pocket Tight Leggings,Leggings
6,$11.99,,https://www.jollychic.com/p/women-s-leggings-low-elastic-cozy-color-block-leggings-g1223762.html,Women's Leggings Low Elastic Cozy Color Block Leggings,Leggings
11,$11.99,,https://www.jollychic.com/p/women-s-leggings-color-block-print-all-match-leggings-g1223786.html,Women's Leggings Color Block Print All Match Leggings,Leggings
22,$11.99,,https://www.jollychic.com/p/women-s-leggings-print-low-waist-cozy-leggings-g1223820.html,Women's Leggings Print Low Waist Cozy Leggings,Leggings
3,$11.99,,https://www.jollychic.com/p/women-s-leggings-print-color-block-thin-leggings-g1223822.html,Women's Leggings Print Color Block Thin Leggings,Leggings
26,$13.99,$19.99,https://www.jollychic.com/p/women-s-leggings-hollow-out-skinny-yoga-leggings-g1249820.html,Women's Leggings Hollow Out Skinny Yoga Leggings,Leggings
17,$15.99,$23.99,https://www.jollychic.com/p/women-s-leggings-solid-color-split-full-length-plus-size-leggings-g1251468.html,Women's Leggings Solid Color Split Full Length Plus Size Leggings,Leggings
10,$25.99,,https://www.jollychic.com/p/women-s-leggings-solid-color-skinny-long-high-waist-leggings-g1269806.html,Women's Leggings Solid Color Skinny Long High Waist Leggings,Leggings
3,$10.99,$15.99,https://www.jollychic.com/p/women-s-leggings-color-block-print-cozy-leggings-g1276692.html,Women's Leggings Color Block Print Cozy Leggings,Leggings
41,$16.99,,https://www.jollychic.com/p/women-s-leggings-solid-color-full-length-high-waisted-leggings-g1277488.html,Women's Leggings Solid Color Full Length High Waisted Leggings,Leggings
18,$17.99,,https://www.jollychic.com/p/women-s-leggings-solid-letter-print-high-waisted-leggings-g1277494.html,Women's Leggings Solid Letter Print High Waisted Leggings,Leggings
12,$23.99,,https://www.jollychic.com/p/women-s-legging-letter-printing-all-match-tight-leisure-shoes-g1288136.html,Women's Legging Letter Printing All Match Tight Leisure Shoes,Leggings
123,$9.99,$14.99,https://www.jollychic.com/p/women-s-leggings-plus-size-patchwork-lace-leggings-g1297262.html,Women's Leggings Plus Size Patchwork Lace Leggings,Leggings
1,$26.99,,https://www.jollychic.com/p/women-s-leggings-high-waist-solid-lace-patchwork-leggings-g1297310.html,Women's Leggings High Waist Solid Lace Patchwork Leggings,Leggings
22,$23.99,,https://www.jollychic.com/p/women-s-legging-colorblock-mid-waisted-striped-comfy-yoga-legging-g1299954.html,Women's Legging Colorblock Mid Waisted Striped Comfy Yoga Legging,Leggings
23,$14.99,$21.99,https://www.jollychic.com/p/women-s-leggings-solid-color-cropped-lace-flare-leggings-g1301126.html,Women's Leggings Solid Color Cropped Lace Flare Leggings,Leggings
10,$8.99,$16.99,https://www.jollychic.com/p/women-s-leggings-elastic-waist-hole-black-leggings-g1302328.html,Women's Leggings Elastic Waist Hole Black Leggings,Leggings
8,$16.99,,https://www.jollychic.com/p/women-s-leggings-elastic-waist-solid-color-leggings-g1302334.html,Women's Leggings Elastic Waist Solid Color Leggings,Leggings
22,$13.99,,https://www.jollychic.com/p/women-s-leggings-letter-color-block-cozy-leggings-g1308004.html,Women's Leggings Letter Color Block Cozy Leggings,Leggings
16,$12.99,$21.99,https://www.jollychic.com/p/women-s-leggings-black-fleece-skinny-leggings-g1308022.html,Women's Leggings Black Fleece Skinny Leggings,Leggings
8,$13.99,$19.99,https://www.jollychic.com/p/women-s-leggings-solid-mesh-patchworkyoga-leggings-g1309646.html,Women's Leggings Solid Mesh PatchworkYoga Leggings,Leggings
11,$15.99,,https://www.jollychic.com/p/women-s-leggings-solid-color-high-waist-slim-leggings-g1309670.html,Women's Leggings Solid Color High Waist Slim Leggings,Leggings
6,$13.99,$28.99,https://www.jollychic.com/p/women-s-leggings-solid-color-bandage-casual-leggings-g1309672.html,Women's Leggings Solid Color Bandage Casual Leggings,Leggings
11,$11.99,$16.99,https://www.jollychic.com/p/women-s-leggings-all-match-skinny-leggings-g1317284.html,Women's Leggings All Match Skinny Leggings,Leggings
2,$34.99,,https://www.jollychic.com/p/women-s-leggings-high-waist-colorblock-hole-sports-leggings-g1318996.html,Women's Leggings High Waist Colorblock Hole Sports Leggings,Leggings
6,$13.99,,https://www.jollychic.com/p/women-s-leggings-striped-patchwork-slim-leggings-g1329608.html,Women's Leggings Striped Patchwork Slim Leggings,Leggings
11,$18.99,$26.99,https://www.jollychic.com/p/women-s-leggings-letters-print-color-block-leggings-g1330070.html,Women's Leggings Letters Print Color Block Leggings,Leggings
6,$16.99,$26.99,https://www.jollychic.com/p/women-s-pants-hole-design-black-skinny-cozy-pants-g1330858.html,Women's Pants Hole Design Black Skinny Cozy Pants,Leggings
1,$14.99,$23.99,https://www.jollychic.com/p/women-s-leggings-mid-waisted-geometric-pattern-color-block-skinny-leggings-g1332016.html,Women's Leggings Mid Waisted Geometric Pattern Color Block Skinny Leggings,Leggings
1,$14.99,$23.99,https://www.jollychic.com/p/women-s-leggings-mid-waisted-fish-scale-pattern-skinny-leggings-g1332020.html,Women's Leggings Mid Waisted Fish Scale Pattern Skinny Leggings,Leggings
3,$11.99,$19.99,https://www.jollychic.com/p/women-s-leggings-digital-print-color-block-all-match-leggings-g1336350.html,Women's Leggings Digital Print Color Block All Match Leggings,Leggings
8,$7.99,$13.99,https://www.jollychic.com/p/women-s-leggings-print-cozy-all-match-casual-leggings-g1336358.html,Women's Leggings Print Cozy All Match Casual Leggings,Leggings
3,$14.99,$23.99,https://www.jollychic.com/p/women-s-leggings-floral-pattern-color-block-skinny-casual-leggings-g1348788.html,Women's Leggings Floral Pattern Color Block Skinny Casual Leggings,Leggings
9,$32.99,,https://www.jollychic.com/p/women-s-leggings-patchwork-skinny-warm-thicken-leisure-slim-leggings-g1356084.html,Women's Leggings Patchwork Skinny Warm Thicken Leisure Slim Leggings,Leggings
4,$21.99,,https://www.jollychic.com/p/women-s-leggings-fashion-sexy-high-waisted-digital-floral-printing-tight-leggings-g1364734.html,Women's Leggings Fashion Sexy High Waisted Digital Floral Printing Tight Leggings,Leggings
59,$7.99,$13.99,https://www.jollychic.com/p/women-s-leggings-popular-fashion-style-elastic-slim-dot-printed-suitable-skinny-pants-g1364812.html,Women's Leggings Popular Fashion Style Elastic Slim Dot Printed Suitable Skinny Pants,Leggings
7,$13.99,,https://www.jollychic.com/p/women-s-leggings-fashion-ladylike-elastic-slim-floral-pattern-printed-mid-waisted-pants-g1364814.html,Women's Leggings Fashion Ladylike Elastic Slim Floral Pattern Printed Mid Waisted Pants,Leggings
2,$39.99,,https://www.jollychic.com/p/women-s-leggings-solid-color-pocket-high-waist-plus-size-pencil-leggings-g1392718.html,Women's Leggings Solid Color Pocket High Waist Plus Size Pencil Leggings,Leggings
9,$16.99,,https://www.jollychic.com/p/women-s-leggings-gauze-patch-skinny-all-match-leggings-g1398116.html,Women's Leggings Gauze Patch Skinny All Match Leggings,Leggings
9,$16.99,,https://www.jollychic.com/p/women-s-leggings-fashion-christmas-cartoon-digital-printing-skinny-render-pants-g1400558.html,Women's Leggings Fashion Christmas Cartoon Digital Printing Skinny Render Pants,Leggings
2,$17.99,,https://www.jollychic.com/p/women-s-leggings-fashion-halloween-pumpkin-digital-printing-skinny-render-pants-g1400624.html,Women's Leggings Fashion Halloween Pumpkin Digital Printing Skinny Render Pants,Leggings
1,$9.99,,https://www.jollychic.com/p/women-s-leggings-mid-waisted-solid-color-causal-skinny-leggings-g1426586.html,Women's Leggings Mid Waisted Solid Color Causal Skinny Leggings,Leggings
2,$16.99,,https://www.jollychic.com/p/women-s-leggings-color-block-cosplay-casual-leggings-g1449564.html,Women's Leggings Color Block Cosplay Casual Leggings,Leggings
0,$13.99,,https://www.jollychic.com/p/women-s-legging-slim-floral-high-waist-fashion-new-american-flag-pattern-legging-g1466006.html,Women's Legging Slim Floral High Waist Fashion New American Flag Pattern Legging,Leggings
2,$13.99,,https://www.jollychic.com/p/women-s-legging-floral-fashion-high-waist-new-wild-star-pattern-slim-legging-g1466010.html,Women's Legging Floral Fashion High Waist New Wild Star Pattern Slim Legging,Leggings
1,$13.99,,https://www.jollychic.com/p/woman-s-legging-hollow-out-high-waist-new-fashion-solid-high-stretch-slim-legging-g1466022.html,Woman's Legging Hollow out High Waist New Fashion Solid High Stretch Slim Legging,Leggings
0,$10.99,$17.99,https://www.jollychic.com/p/women-s-leggings-mid-waisted-color-block-cropped-leggings-g1476786.html,Women's Leggings Mid Waisted Color Block Cropped Leggings,Leggings
2,$22.99,,https://www.jollychic.com/p/women-s-leggings-mid-waisted-hollow-out-skull-pattern-leggings-g1477572.html,Women's Leggings Mid Waisted Hollow Out Skull Pattern Leggings,Leggings
2,$16.99,,https://www.jollychic.com/p/women-fashion-legging-letter-print-simple-sports-stylish-leggings-g1478814.html,Women Fashion Legging Letter Print Simple Sports Stylish Leggings,Leggings
1,$8.99,$14.99,https://www.jollychic.com/p/women-s-leggings-letter-pattern-skinny-mid-waist-casual-pants-g1516324.html,Women's Leggings Letter Pattern Skinny Mid Waist Casual Pants,Leggings
0,$20.99,$31.99,https://www.jollychic.com/p/women-s-legging-skinny-high-waist-solid-color-zipper-decoration-pant-g1516370.html,Women's Legging Skinny High Waist Solid Color Zipper Decoration Pant,Leggings
3,$7.99,$13.99,https://www.jollychic.com/p/women-s-legging-mid-waist-all-match-patchwork-pattern-skinny-casual-pants-g1516386.html,Women's Legging Mid Waist All Match Patchwork Pattern Skinny Casual Pants,Leggings
2,$18.99,$28.99,https://www.jollychic.com/p/women-s-leggings-high-waist-solid-hole-casual-leggings-g1521742.html,Women's Leggings High Waist Solid Hole Casual Leggings,Leggings
3,$18.99,$28.99,https://www.jollychic.com/p/women-s-leggings-high-waist-solid-casual-leggings-g1521746.html,Women's Leggings High Waist Solid Casual Leggings,Leggings
2,$16.99,,https://www.jollychic.com/p/women-s-leggings-striped-christmas-tree-pattern-elastic-waist-belly-in-skinny-pants-g1535476.html,Women's Leggings Striped Christmas Tree Pattern Elastic Waist Belly-In Skinny Pants,Leggings
1,$16.99,,https://www.jollychic.com/p/women-s-leggings-christmas-moose-pattern-elastic-waist-belly-in-skinny-pants-g1535482.html,Women's Leggings Christmas Moose Pattern Elastic Waist Belly-In Skinny Pants,Leggings
3,$16.99,,https://www.jollychic.com/p/women-s-leggings-christmas-snowman-pattern-elastic-waist-belly-in-skinny-pants-g1535486.html,Women's Leggings Christmas Snowman Pattern Elastic Waist Belly-In Skinny Pants,Leggings
1,$10.99,$16.99,https://www.jollychic.com/p/women-s-leggings-christmas-character-pattern-elastic-waist-belly-in-skinny-pants-g1535490.html,Women's Leggings Christmas Character Pattern Elastic Waist Belly-In Skinny Pants,Leggings
