add_wish,discount_price,original_price,product_link,product_name,header_block
43,$109.00,$120.00,https://www.jollychic.com/p/women-s-evening-dress-lace-flower-embroidery-v-neck-sleeveless-elegant-dress-g1407000.html,Women's Evening Dress Lace Flower Embroidery V Neck Sleeveless Elegant Dress,Weddings & Events
4,$88.00,$109.00,https://www.jollychic.com/p/women-s-wedding-dress-pure-white-slash-neck-off-shoulder-lace-patchwork-elegant-dress-g1407026.html,Women's Wedding Dress Pure White Slash Neck Off Shoulder Lace Patchwork Elegant Dress,Weddings & Events
33,$92.00,$114.00,https://www.jollychic.com/p/women-s-evening-dress-delicate-beading-sleeveless-elegant-sweep-train-maxi-dress-g1415114.html,Women's Evening Dress Delicate Beading Sleeveless Elegant Sweep Train Maxi Dress,Weddings & Events
17,$99.00,$125.00,https://www.jollychic.com/p/women-s-evening-dress-simple-elegant-flower-embroidery-sleeveless-floor-length-aline-dress-g1428132.html,Women's Evening Dress Simple Elegant Flower Embroidery Sleeveless Floor Length Aline Dress,Weddings & Events
310,$52.00,$68.00,https://www.jollychic.com/p/women-s-cocktail-dress-elegant-solid-color-ruffles-sleeveless-ladylike-party-dress-g1442898.html,Women's Cocktail Dress Elegant Solid Color Ruffles Sleeveless Ladylike Party Dress,Weddings & Events
18,$81.00,$106.00,https://www.jollychic.com/p/women-s-evening-dress-floral-pattern-lace-patchwork-half-sleeve-o-neck-sweet-dress-g1456796.html,Women's Evening Dress Floral Pattern Lace Patchwork Half Sleeve O Neck Sweet Dress,Weddings & Events
7,$81.00,$99.00,https://www.jollychic.com/p/women-s-evening-dress-flower-embroidery-sweet-v-neck-long-sleeve-aline-maxi-dress-g1465450.html,Women's Evening Dress Flower Embroidery Sweet V Neck Long Sleeve Aline Maxi Dress,Weddings & Events
28,$82.00,$109.00,https://www.jollychic.com/p/women-s-evening-dress-solid-color-slash-neck-off-shoulder-half-sleeve-elegant-sexy-dress-g1492826.html,Women's Evening Dress Solid Color Slash Neck Off Shoulder Half Sleeve Elegant Sexy Dress,Weddings & Events
28,$110.00,$125.00,https://www.jollychic.com/p/women-s-evening-dress-solid-color-elegant-v-neck-half-sleeve-hollow-out-lace-maxi-dress-g1530348.html,Women's Evening Dress Solid Color Elegant V Neck Half Sleeve Hollow Out Lace Maxi Dress,Weddings & Events
1111,$67.00,$98.00,https://www.jollychic.com/p/ladylike-style-strapless-chiffon-evening-dress-g327850.html,Ladylike Style Strapless Chiffon Evening Dress,Weddings & Events
262,$94.00,$124.00,https://www.jollychic.com/p/women-s-strapless-tulle-flower-high-low-evening-dress-g386920.html,Women's Strapless Tulle Flower High Low Evening Dress,Weddings & Events
564,$62.00,$95.00,https://www.jollychic.com/p/women-s-beading-ruching-v-neck-long-evening-dress-g386984.html,Women's Beading Ruching V Neck Long Evening Dress,Weddings & Events
233,$85.00,$112.00,https://www.jollychic.com/p/women-s-strapless-embroidery-short-long-dual-purpose-evening-dress-g386988.html,Women's Strapless Embroidery Short/Long Dual Purpose Evening Dress,Weddings & Events
1537,$124.00,$165.00,https://www.jollychic.com/p/women-s-lace-tulle-sheer-long-formal-evening-dress-g390850.html,Women's Lace Tulle Sheer Long Formal Evening Dress,Weddings & Events
970,$25.99,$36.99,https://www.jollychic.com/p/bride-holding-flowers-wedding-bouquet-g391230.html,Bride Holding Flowers Wedding Bouquet,Weddings & Events
1115,$28.99,$42.99,https://www.jollychic.com/p/women-s-sexy-backless-sequins-long-formal-evening-dress-g391334.html,Women's Sexy Backless Sequins Long Formal Evening Dress,Weddings & Events
468,$26.59,$37.99,https://www.jollychic.com/p/women-s-sexy-ruffle-hollow-out-high-low-long-evening-dress-g454780.html,Women's Sexy Ruffle Hollow Out High Low Long Evening Dress,Weddings & Events
1122,$114.00,$145.00,https://www.jollychic.com/p/women-s-floral-applique-mesh-patchwork-bateau-wedding-dress-g472216.html,Women's Floral Applique Mesh Patchwork Bateau Wedding Dress,Weddings & Events
563,$95.00,$180.00,https://www.jollychic.com/p/women-s-wedding-dress-sleeveless-lace-embroidery-sequins-mermaid-wedding-dress-g479046.html,Women's Wedding Dress Sleeveless Lace Embroidery Sequins Mermaid Wedding Dress,Weddings & Events
1462,$35.99,$49.99,https://www.jollychic.com/p/women-s-capelet-wedding-dress-color-patchwork-widen-elegant-faux-fur-capelet-g484240.html,Women's Capelet Wedding Dress Color Patchwork Widen Elegant Faux-Fur Capelet,Weddings & Events
262,$49.99,$64.00,https://www.jollychic.com/p/women-s-coat-capelet-wedding-dress-rhinestones-button-faux-fur-coat-capelet-g484252.html,Women's Coat Capelet Wedding Dress Rhinestones Button Faux-Fur Coat Capelet,Weddings & Events
200,$47.99,$84.00,https://www.jollychic.com/p/women-s-evening-dress-rhinestones-patchwork-ladylike-long-evening-dress-g488820.html,Women's Evening Dress Rhinestones Patchwork Ladylike Long Evening Dress,Weddings & Events
1496,$39.99,$58.00,https://www.jollychic.com/p/women-s-prom-dress-lace-bow-solid-color-tulle-short-sweet-homecoming-dress-g488952.html,Women's Prom Dress Lace Bow Solid Color Tulle Short Sweet Homecoming Dress,Weddings & Events
319,$56.00,$76.00,https://www.jollychic.com/p/women-s-evening-dress-lace-appliques-one-shoulder-slim-long-evening-dress-g493682.html,Women's Evening Dress Lace Appliques One Shoulder Slim Long Evening Dress,Weddings & Events
439,$54.00,$92.00,https://www.jollychic.com/p/women-s-plus-size-evening-dress-lace-embroidery-slim-long-ladylike-evening-dress-g493686.html,Women's Plus Size Evening Dress Lace Embroidery Slim Long Ladylike Evening Dress,Weddings & Events
301,$98.00,$157.00,https://www.jollychic.com/p/women-s-wedding-dress-lace-embroidery-rhinestones-belt-long-wedding-dress-g494014.html,Women's Wedding Dress Lace Embroidery Rhinestones Belt Long Wedding Dress,Weddings & Events
357,$100.00,$132.00,https://www.jollychic.com/p/women-s-evening-dress-side-split-backless-sequins-faddish-long-evening-dress-g494778.html,Women's Evening Dress Side Split Backless Sequins Faddish Long Evening Dress,Weddings & Events
229,$59.00,$73.00,https://www.jollychic.com/p/women-s-prom-dress-lace-embroidery-hollow-out-bow-ladylike-homecoming-dress-g494888.html,Women's Prom Dress Lace Embroidery Hollow Out Bow Ladylike Homecoming Dress,Weddings & Events
2289,$55.00,$73.00,https://www.jollychic.com/p/women-e-evening-dress-lace-embroidery-back-lace-up-long-sweet-evening-dress-g495138.html,Women'e Evening Dress Lace Embroidery Back Lace-Up Long Sweet Evening Dress,Weddings & Events
1301,$99.00,$131.00,https://www.jollychic.com/p/women-s-evening-dress-sleeveless-sequins-rose-gold-long-evening-dress-g505124.html,Women's Evening Dress Sleeveless Sequins Rose Gold Long Evening Dress,Weddings & Events
200,$76.00,$122.00,https://www.jollychic.com/p/women-s-plus-size-wedding-dress-bateau-lace-hollow-out-ladylike-wedding-dress-g510432.html,Women's Plus Size Wedding Dress Bateau Lace Hollow Out Ladylike Wedding Dress,Weddings & Events
2315,$55.00,$73.00,https://www.jollychic.com/p/women-s-evening-dress-sleeveless-floral-patchwork-sweet-evening-dress-g530126.html,Women's Evening Dress Sleeveless Floral Patchwork Sweet Evening Dress,Weddings & Events
291,$73.00,$133.00,https://www.jollychic.com/p/women-s-evening-dress-v-neck-sexy-lace-fishtail-mermaid-dress-g549976.html,Women's Evening Dress V Neck Sexy Lace Fishtail Mermaid Dress,Weddings & Events
428,$66.00,$90.00,https://www.jollychic.com/p/women-s-wedding-dress-butterfly-tulle-v-neck-sweet-long-evening-dress-g552752.html,Women's Wedding Dress Butterfly Tulle V Neck Sweet Long Evening Dress,Weddings & Events
148,$76.00,$102.00,https://www.jollychic.com/p/women-s-wedding-dress-flower-appliques-off-shoulder-ladylike-maxi-long-dress-g554512.html,Women's Wedding Dress Flower Appliques Off Shoulder Ladylike Maxi Long Dress,Weddings & Events
145,$114.00,$148.00,https://www.jollychic.com/p/women-s-wedding-dress-rhinestone-lace-sweet-ball-gown-wedding-dress-g557706.html,Women's Wedding Dress Rhinestone Lace Sweet Ball Gown Wedding Dress,Weddings & Events
76,$63.00,$84.00,https://www.jollychic.com/p/women-s-wedding-dress-floral-halter-backless-ladylike-maxi-long-dress-g572060.html,Women's Wedding Dress Floral Halter Backless Ladylike Maxi Long Dress,Weddings & Events
132,$64.00,$84.00,https://www.jollychic.com/p/women-s-wedding-dress-floral-lace-strapless-bow-belt-sweet-maxi-long-dress-g573476.html,Women's Wedding Dress Floral Lace Strapless Bow Belt Sweet Maxi Long Dress,Weddings & Events
411,$166.00,$207.00,https://www.jollychic.com/p/women-s-wedding-dress-lace-floral-back-bow-belt-sweet-maxi-long-dress-g577430.html,Women's Wedding Dress Lace Floral Back Bow Belt Sweet Maxi Long Dress,Weddings & Events
379,$87.00,$116.00,https://www.jollychic.com/p/women-s-wedding-dress-strapless-pure-color-floor-length-simple-maxi-dress-g577432.html,Women's Wedding Dress Strapless Pure Color Floor Length Simple Maxi Dress,Weddings & Events
1561,$62.25,$83.00,https://www.jollychic.com/p/women-s-evening-dress-sexy-flower-embroidery-aline-slip-ball-gown-g601142.html,Women's Evening Dress Sexy Flower Embroidery Aline Slip Ball Gown,Weddings & Events
1067,$32.99,$66.00,https://www.jollychic.com/p/women-s-evening-dress-pure-color-v-neck-short-sleeve-split-maxi-long-sleeve-g606278.html,Women's Evening Dress Pure Color V Neck Short Sleeve Split Maxi Long Sleeve,Weddings & Events
587,$38.99,$71.00,https://www.jollychic.com/p/women-s-evening-dress-pure-color-v-neck-side-split-slim-maxi-long-dress-g606280.html,Women's Evening Dress Pure Color V Neck Side Split Slim Maxi Long Dress,Weddings & Events
332,$83.00,$107.00,https://www.jollychic.com/p/women-s-wedding-dress-floral-beading-ball-gown-floor-length-maxi-long-dress-g609660.html,Women's Wedding Dress Floral Beading Ball Gown Floor Length Maxi Long Dress,Weddings & Events
295,$103.00,$128.00,https://www.jollychic.com/p/women-s-wedding-dress-lace-flower-appliques-rhinestones-off-shoulder-maxi-dress-g609818.html,Women's Wedding Dress Lace Flower Appliques Rhinestones Off Shoulder Maxi Dress,Weddings & Events
436,$47.99,$66.00,https://www.jollychic.com/p/women-s-wedding-dress-veil-lace-flower-appliques-trailing-long-veil-g610038.html,Women's Wedding Dress Veil Lace Flower Appliques Trailing Long Veil,Weddings & Events
224,$83.00,$112.00,https://www.jollychic.com/p/women-s-prom-dress-blossoms-pattern-one-shoulder-short-homecoming-dress-g612416.html,Women's Prom Dress Blossoms Pattern One Shoulder Short Homecoming Dress,Weddings & Events
540,$38.99,$71.00,https://www.jollychic.com/p/women-s-evening-dress-floral-embroidery-three-quarters-sleeve-vintage-maxi-dress-g615008.html,Women's Evening Dress Floral Embroidery Three Quarters Sleeve Vintage Maxi Dress,Weddings & Events
1544,$61.00,$83.00,https://www.jollychic.com/p/women-s-evening-dress-lolita-lace-half-sleeve-high-waisted-aline-dress-g619868.html,Women's Evening Dress Lolita Lace Half Sleeve High-Waisted Aline Dress,Weddings & Events
322,$36.99,$52.00,https://www.jollychic.com/p/women-s-evening-dress-sexy-sequins-long-sleeve-high-waisted-backless-aline-dress-g624796.html,Women's Evening Dress Sexy Sequins Long Sleeve High-Waisted Backless Aline Dress,Weddings & Events
295,$38.99,$68.00,https://www.jollychic.com/p/women-s-prom-dress-solid-front-split-neck-sleeveless-short-homecoming-dress-g630128.html,Women's Prom Dress Solid Front Split Neck Sleeveless Short Homecoming Dress,Weddings & Events
223,$43.99,$68.00,https://www.jollychic.com/p/women-s-prom-dress-flower-appliques-off-shoulder-half-sleeve-cocktail-dress-g630136.html,Women's Prom Dress Flower Appliques Off Shoulder Half Sleeve Cocktail Dress,Weddings & Events
83,$72.00,$96.00,https://www.jollychic.com/p/women-s-evening-dress-v-neck-sleeveless-rhinestones-high-waisted-aline-dress-g636716.html,Women's Evening Dress V Neck Sleeveless Rhinestones High-Waisted Aline Dress,Weddings & Events
141,$113.00,$148.00,https://www.jollychic.com/p/women-s-evening-dress-strapless-ruching-solid-bride-wedding-mermaid-dress-g638714.html,Women's Evening Dress Strapless Ruching Solid Bride Wedding Mermaid Dress,Weddings & Events
1131,$53.00,$89.00,https://www.jollychic.com/p/women-s-evening-dress-slim-sexy-elegance-floral-embroidery-aline-wedding-dress-g649410.html,Women's Evening Dress Slim Sexy Elegance Floral Embroidery Aline Wedding Dress,Weddings & Events
265,$51.00,$89.00,https://www.jollychic.com/p/women-s-evening-dress-toast-shoulders-lace-patchwork-colorblock-wedding-dress-g649744.html,Women's Evening Dress Toast Shoulders Lace Patchwork Colorblock Wedding Dress,Weddings & Events
132,$67.00,$84.00,https://www.jollychic.com/p/women-s-cheongsam-grape-birds-pattern-stand-collar-side-split-slim-cheongsam-g665056.html,Women's Cheongsam Grape Birds Pattern Stand Collar Side Split Slim Cheongsam,Weddings & Events
353,$47.99,$84.00,https://www.jollychic.com/p/women-s-cheongsam-floral-pattern-stand-collar-side-split-slim-elegant-cheongsam-g666618.html,Women's Cheongsam Floral Pattern Stand Collar Side Split Slim Elegant Cheongsam,Weddings & Events
60,$18.99,$24.99,https://www.jollychic.com/p/women-s-wraps-cape-lace-tulle-ruffles-hem-bow-two-layers-wedding-dress-shawl-g667938.html,Women's Wraps Cape Lace Tulle Ruffles Hem Bow Two Layers Wedding Dress Shawl,Weddings & Events
466,$13.99,$17.99,https://www.jollychic.com/p/women-s-wraps-cape-lace-tulle-floral-hem-sequins-white-wedding-dress-capelet-g667952.html,Women's Wraps Cape Lace Tulle Floral Hem Sequins White Wedding Dress Capelet,Weddings & Events
128,$77.00,$118.00,https://www.jollychic.com/p/flower-girl-dress-one-shoulder-beading-solid-appliques-aline-performing-dress-g683934.html,Flower Girl Dress One Shoulder Beading Solid Appliques Aline Performing Dress,Weddings & Events
145,$40.99,$58.00,https://www.jollychic.com/p/flower-girl-dress-sleeveless-flower-pink-embroidery-solid-aline-performing-dress-g683980.html,Flower Girl Dress Sleeveless Flower Pink Embroidery Solid Aline Performing Dress,Weddings & Events
1098,$103.00,$136.00,https://www.jollychic.com/p/women-s-evening-dress-lace-stand-collar-sleeveless-backless-elegant-maxi-dress-g704622.html,Women's Evening Dress Lace Stand Collar Sleeveless Backless Elegant Maxi Dress,Weddings & Events
171,$52.00,$68.00,https://www.jollychic.com/p/women-s-prom-dress-v-neck-sleeveless-aline-elegant-sweet-bridesmaid-dress-g722230.html,Women's Prom Dress V Neck Sleeveless Aline Elegant Sweet Bridesmaid Dress,Weddings & Events
74,$63.00,$84.00,https://www.jollychic.com/p/women-s-prom-dress-lace-half-sleeve-bow-belt-elegant-short-homecoming-dress-g738178.html,Women's Prom Dress Lace Half Sleeve Bow Belt Elegant Short Homecoming Dress,Weddings & Events
72,$139.00,$188.00,https://www.jollychic.com/p/women-s-wedding-dress-v-neck-ruffles-short-sleeve-sequins-ball-gown-maxi-dress-g738184.html,Women's Wedding Dress V Neck Ruffles Short Sleeve Sequins Ball Gown Maxi Dress,Weddings & Events
196,$90.00,$112.00,https://www.jollychic.com/p/women-s-wedding-dress-flower-appliques-sleeveless-ball-gown-elegant-maxi-dress-g765858.html,Women's Wedding Dress Flower Appliques Sleeveless Ball Gown Elegant Maxi Dress,Weddings & Events
109,$68.00,$90.00,https://www.jollychic.com/p/women-s-wedding-dress-half-sleeve-floral-sequins-back-hollow-out-maxi-dress-g765866.html,Women's Wedding Dress Half Sleeve Floral Sequins Back Hollow Out Maxi Dress,Weddings & Events
145,$68.00,$90.00,https://www.jollychic.com/p/women-s-wedding-dress-flower-appliques-off-shoulder-ball-gown-sweet-maxi-dress-g765872.html,Women's Wedding Dress Flower Appliques Off Shoulder Ball Gown Sweet Maxi Dress,Weddings & Events
256,$68.00,$90.00,https://www.jollychic.com/p/women-s-wedding-dress-floral-sequins-off-shoulder-floor-length-maxi-dress-g765874.html,Women's Wedding Dress Floral Sequins Off Shoulder Floor Length Maxi Dress,Weddings & Events
131,$68.00,$90.00,https://www.jollychic.com/p/women-s-wedding-dress-sleeveless-floral-sequins-ball-gown-elegant-wedding-dress-g765918.html,Women's Wedding Dress Sleeveless Floral Sequins Ball Gown Elegant Wedding Dress,Weddings & Events
1667,$76.00,$108.00,https://www.jollychic.com/p/women-s-evening-dress-lace-solid-color-beading-slim-elegant-mermaid-dress-g804658.html,Women's Evening Dress Lace Solid Color Beading Slim Elegant Mermaid Dress,Weddings & Events
931,$78.00,$108.00,https://www.jollychic.com/p/women-s-evening-dress-solid-color-sleeveless-sweep-train-ladylike-mermaid-dress-g804662.html,Women's Evening Dress Solid Color Sleeveless Sweep Train Ladylike Mermaid Dress,Weddings & Events
1199,$75.00,$103.00,https://www.jollychic.com/p/women-s-prom-dress-flower-appliques-strapless-ruffles-ladylike-homecoming-dress-g804666.html,Women's Prom Dress Flower Appliques Strapless Ruffles Ladylike Homecoming Dress,Weddings & Events
284,$67.00,$89.00,https://www.jollychic.com/p/women-s-evening-dress-embroidery-sleeveless-elegant-sweet-aline-maxi-dress-g831412.html,Women's Evening Dress Embroidery Sleeveless Elegant Sweet Aline Maxi Dress,Weddings & Events
219,$56.00,$74.00,https://www.jollychic.com/p/women-s-evening-dress-solid-color-vintage-ruffles-long-sleeve-maxi-long-dress-g835546.html,Women's Evening Dress Solid Color Vintage Ruffles Long Sleeve Maxi Long Dress,Weddings & Events
1389,$57.00,$87.00,https://www.jollychic.com/p/women-s-evening-dress-v-neck-long-sleeve-sweet-white-aline-maxi-dress-g858372.html,Women's Evening Dress V Neck Long Sleeve Sweet White Aline Maxi Dress,Weddings & Events
852,$42.99,$68.00,https://www.jollychic.com/p/women-s-evening-dress-latest-stylish-ruffles-length-maxi-cocktail-dress-g863556.html,Women's Evening Dress Latest Stylish Ruffles Length Maxi Cocktail Dress,Weddings & Events
620,$53.00,$82.00,https://www.jollychic.com/p/women-s-wedding-dress-short-sleeves-o-neck-flower-ornament-length-cocktail-dress-g863590.html,Women's Wedding Dress Short Sleeves O Neck Flower Ornament Length Cocktail Dress,Weddings & Events
284,$69.00,$98.00,https://www.jollychic.com/p/women-s-evening-dress-pure-color-half-sleeve-sequins-elegant-maxi-dress-g874760.html,Women's Evening Dress Pure Color Half Sleeve Sequins Elegant Maxi Dress,Weddings & Events
549,$79.00,$113.00,https://www.jollychic.com/p/women-s-evening-dress-sequins-v-neck-sleeveless-slim-mermaid-banquet-dress-g880558.html,Women's Evening Dress Sequins V Neck Sleeveless Slim Mermaid Banquet Dress,Weddings & Events
172,$37.99,$63.00,https://www.jollychic.com/p/women-s-cocktail-dress-sweet-hollow-out-sleeveless-aline-short-prom-dress-g880708.html,Women's Cocktail Dress Sweet Hollow Out Sleeveless Aline Short Prom Dress,Weddings & Events
432,$79.00,$113.00,https://www.jollychic.com/p/women-s-evening-dress-ladylike-sparkle-sequins-v-neck-slim-court-train-dress-g880718.html,Women's Evening Dress Ladylike Sparkle Sequins V Neck Slim Court Train Dress,Weddings & Events
182,$45.99,$74.00,https://www.jollychic.com/p/women-s-prom-dress-solid-color-hollow-out-sleeveless-slim-cocktail-dress-g881346.html,Women's Prom Dress Solid Color Hollow Out Sleeveless Slim Cocktail Dress,Weddings & Events
385,$65.00,$93.00,https://www.jollychic.com/p/women-s-evening-dress-solid-color-brief-elegant-sleeveless-slim-maxi-dress-g885506.html,Women's Evening Dress Solid Color Brief Elegant Sleeveless Slim Maxi Dress,Weddings & Events
194,$75.00,$114.00,https://www.jollychic.com/p/women-s-evening-dress-solid-color-patchwork-sleeveless-elegant-maxi-dress-g908800.html,Women's Evening Dress Solid Color Patchwork Sleeveless Elegant Maxi Dress,Weddings & Events
63,$49.99,$63.00,https://www.jollychic.com/p/women-s-evening-dress-solid-color-two-layers-spaghetti-straps-maxi-dress-g956260.html,Women's Evening Dress Solid Color Two Layers Spaghetti Straps Maxi Dress,Weddings & Events
127,$29.99,$60.00,https://www.jollychic.com/p/women-s-evening-dress-floral-v-neck-ruffles-floor-length-sweet-aline-maxi-dress-g975246.html,Women's Evening Dress Floral V Neck Ruffles Floor Length Sweet Aline Maxi Dress,Weddings & Events
26,$57.00,$103.00,https://www.jollychic.com/p/women-s-evening-dress-sweet-flower-embroidery-v-neck-long-sleeve-maxi-dress-g995362.html,Women's Evening Dress Sweet Flower Embroidery V Neck Long Sleeve Maxi Dress,Weddings & Events
60,$57.00,$75.00,https://www.jollychic.com/p/children-s-dress-sweet-flower-embroidery-off-shoulder-ball-gown-perform-dress-g1028410.html,Children's Dress Sweet Flower Embroidery Off Shoulder Ball Gown Perform Dress,Weddings & Events
31,$71.00,,https://www.jollychic.com/p/women-s-prom-dress-ladylike-embroidery-high-neck-three-quarter-sleeve-cocktail-dress-g1139078.html,Women's Prom Dress Ladylike Embroidery High Neck Three Quarter Sleeve Cocktail Dress,Weddings & Events
28,$100.00,$124.00,https://www.jollychic.com/p/women-s-wedding-dress-brief-elegant-floral-hem-bateau-neck-ball-gown-maxi-dress-g1226854.html,Women's Wedding Dress Brief Elegant Floral Hem Bateau Neck Ball Gown Maxi Dress,Weddings & Events
39,$88.00,$114.00,https://www.jollychic.com/p/women-s-evening-dress-solid-color-lace-flower-pendant-sleeveless-v-neck-sexy-dress-g1233754.html,Women's Evening Dress Solid Color Lace Flower Pendant Sleeveless V Neck Sexy Dress,Weddings & Events
37,$63.00,$97.00,https://www.jollychic.com/p/women-s-wedding-dress-solid-color-lace-patchwork-off-shoulder-rhinestone-decor-elegant-dress-g1233772.html,Women's Wedding Dress Solid Color Lace Patchwork Off Shoulder Rhinestone Decor Elegant Dress,Weddings & Events
18,$78.00,$97.00,https://www.jollychic.com/p/women-s-wedding-dress-solid-color-lace-flower-pendant-short-sleeve-o-neck-elegant-dress-g1233778.html,Women's Wedding Dress Solid Color Lace Flower Pendant Short Sleeve O Neck Elegant Dress,Weddings & Events
16,$100.00,$124.00,https://www.jollychic.com/p/women-s-wedding-dress-solid-color-flower-pendant-sleeveless-backless-elegant-dress-g1234366.html,Women's Wedding Dress Solid Color Flower Pendant Sleeveless Backless Elegant Dress,Weddings & Events
43,$100.00,$124.00,https://www.jollychic.com/p/women-s-wedding-dress-solid-color-lace-embroidery-slash-neck-off-shoulder-elegant-dressss-g1234368.html,Women's Wedding Dress Solid Color Lace Embroidery Slash Neck Off Shoulder Elegant Dressss,Weddings & Events
56,$60.00,$79.00,https://www.jollychic.com/p/women-s-cocktail-dress-solid-color-lace-patchwork-rhinestone-decor-sleeveless-backless-sexy-dress-g1294392.html,Women's Cocktail Dress Solid Color Lace Patchwork Rhinestone Decor Sleeveless Backless Sexy Dress,Weddings & Events
127,$20.99,$26.99,https://www.jollychic.com/p/women-s-bridal-veil-solid-color-lace-embroidery-flower-hem-transparent-wedding-accessory-g1294414.html,Women's Bridal Veil solid Color Lace Embroidery Flower Hem Transparent Wedding Accessory,Weddings & Events
223,$113.00,$125.00,https://www.jollychic.com/p/women-s-evening-dress-elegant-solid-color-stand-collar-hollow-out-sleeveless-maxi-dress-g1298786.html,Women's Evening Dress Elegant Solid Color Stand Collar Hollow Out Sleeveless Maxi Dress,Weddings & Events
19,$65.00,$84.00,https://www.jollychic.com/p/women-s-wedding-dress-lace-up-rhinestone-decor-slash-neck-off-shoulder-half-sleeve-elegant-dress-g1306420.html,Women's Wedding Dress Lace Up Rhinestone Decor Slash Neck Off Shoulder Half Sleeve Elegant Dress,Weddings & Events
48,$70.00,$91.00,https://www.jollychic.com/p/women-s-evening-dress-vintage-flower-embroidery-three-quarter-sleeve-aline-maxi-dress-g1314164.html,Women's Evening Dress Vintage Flower Embroidery Three Quarter Sleeve Aline Maxi Dress,Weddings & Events
104,$82.00,$107.00,https://www.jollychic.com/p/women-s-evening-dress-elegant-flower-appliques-spaghetti-straps-long-sleeve-mermaid-maxi-dress-g1322672.html,Women's Evening Dress Elegant Flower Appliques Spaghetti Straps Long Sleeve Mermaid Maxi Dress,Weddings & Events
69,$57.00,$87.00,https://www.jollychic.com/p/women-s-prom-dress-elegant-blossom-sleeveless-bow-belt-aline-cocktail-dress-g1336674.html,Women's Prom Dress Elegant Blossom Sleeveless Bow Belt Aline Cocktail Dress,Weddings & Events
25,$63.00,$97.00,https://www.jollychic.com/p/women-s-evening-dress-elegant-rhinestone-inlay-sleeveless-aline-maxi-dress-g1336676.html,Women's Evening Dress Elegant Rhinestone Inlay Sleeveless Aline Maxi Dress,Weddings & Events
21,$121.44,$138.00,https://www.jollychic.com/p/women-s-wedding-dress-solid-white-off-shoulder-half-sleeve-ball-gown-maxi-dress-g1336694.html,Women's Wedding Dress Solid White Off Shoulder Half Sleeve Ball Gown Maxi Dress,Weddings & Events
43,$29.99,$39.99,https://www.jollychic.com/p/women-s-bridal-veils-solid-color-lace-flower-hem-decor-floor-length-sweet-wedding-accessory-g1406750.html,Women's Bridal Veils Solid Color Lace Flower Hem Decor Floor Length Sweet Wedding Accessory,Weddings & Events
19,$26.99,$34.99,https://www.jollychic.com/p/women-s-shawl-solid-color-long-sleeve-thicken-elegant-wedding-accessory-g1406868.html,Women's Shawl Solid Color Long Sleeve Thicken Elegant Wedding Accessory,Weddings & Events
11,$45.99,$60.00,https://www.jollychic.com/p/women-s-shawl-solid-color-turn-down-collar-half-sleeve-thicken-elegant-wedding-accessory-g1406876.html,Women's Shawl Solid Color Turn Down Collar Half Sleeve Thicken Elegant Wedding Accessory,Weddings & Events
17,$29.99,$39.99,https://www.jollychic.com/p/women-s-shawl-solid-color-long-sleeve-o-neck-warm-wedding-accessory-g1406992.html,Women's Shawl Solid Color Long Sleeve O Neck Warm Wedding Accessory,Weddings & Events
35,$88.00,$109.00,https://www.jollychic.com/p/women-s-evening-dress-sequins-decor-gauze-patchwork-fish-tail-v-neck-elegant-dress-g1407004.html,Women's Evening Dress Sequins Decor Gauze Patchwork Fish Tail V Neck Elegant Dress,Weddings & Events
19,$60.00,$79.00,https://www.jollychic.com/p/women-s-evening-dress-gauze-patchwork-v-neck-short-sleeve-elegant-dress-g1407008.html,Women's Evening Dress Gauze Patchwork V Neck Short Sleeve Elegant Dress,Weddings & Events
