add_wish,discount_price,original_price,product_link,product_name,header_block
631,$5.99,$8.99,https://www.jollychic.com/p/short-pattern-bowknot-decorate-sun-protective-lace-gloves-for-women-g32959.html,Short Pattern Bowknot Decorate Sun Protective Lace Gloves For Women,Gloves
228,$4.99,$8.99,https://www.jollychic.com/p/new-in-warm-fur-bow-gloves-for-women-g61756.html,New In Warm Fur Bow Gloves For Women,Gloves
784,$12.99,,https://www.jollychic.com/p/new-in-solid-rabbit-hair-solid-warm-wool-gloves-g68956.html,New In Solid Rabbit Hair Solid Warm Wool Gloves,Gloves
900,$5.99,$11.99,https://www.jollychic.com/p/thicken-thermal-elegant-women-s-gloves-g198491.html,Thicken Thermal Elegant Women's Gloves,Gloves
4186,$4.99,$9.99,https://www.jollychic.com/p/thicken-thermal-elegant-women-s-gloves-g213579.html,Thicken Thermal Elegant Women's Gloves,Gloves
1606,$4.99,$8.99,https://www.jollychic.com/p/thicken-dots-bow-gloves-g214823.html,Thicken Dots Bow Gloves,Gloves
1639,$5.99,$8.99,https://www.jollychic.com/p/thermal-warm-elegant-gloves-with-bow-g214825.html,Thermal Warm Elegant Gloves With Bow,Gloves
619,$8.99,,https://www.jollychic.com/p/embroidery-flower-gloves-with-belt-g215369.html,Embroidery Flower Gloves With Belt,Gloves
271,$11.99,,https://www.jollychic.com/p/elegant-fashion-belt-gloves-g215373.html,Elegant Fashion Belt Gloves,Gloves
96,$7.99,$12.99,https://www.jollychic.com/p/high-quality-elegant-thermal-gloves-g215397.html,High Quality Elegant Thermal Gloves,Gloves
703,$5.99,$9.99,https://www.jollychic.com/p/elegant-patchwork-winter-gloves-g216429.html,Elegant Patchwork Winter Gloves,Gloves
858,$9.99,,https://www.jollychic.com/p/lace-winter-protection-elegant-gloves-g216435.html,Lace Winter Protection Elegant Gloves,Gloves
134,$5.99,$9.99,https://www.jollychic.com/p/lace-elegant-patchwork-gloves-with-bow-g216449.html,Lace Elegant Patchwork Gloves With Bow,Gloves
395,$4.99,$7.99,https://www.jollychic.com/p/touchscreen-pearls-lace-gloves-g216469.html,Touchscreen Pearls Lace Gloves,Gloves
275,$6.99,$9.99,https://www.jollychic.com/p/solid-romantic-thermal-gloves-with-bow-g216499.html,Solid Romantic Thermal Gloves With Bow,Gloves
1150,$5.99,$9.99,https://www.jollychic.com/p/delicate-slim-thermal-gloves-g216501.html,Delicate Slim Thermal Gloves,Gloves
368,$5.99,$9.99,https://www.jollychic.com/p/solid-color-fashion-thermal-lady-gloves-g216503.html,Solid Color Fashion Thermal Lady Gloves,Gloves
683,$3.99,$7.99,https://www.jollychic.com/p/lady-classic-solid-gloves-with-button-g216509.html,Lady Classic Solid Gloves With Button,Gloves
673,$5.99,$11.99,https://www.jollychic.com/p/elastic-slim-elegant-women-s-gloves-g216517.html,Elastic Slim Elegant Women's Gloves,Gloves
103,$5.99,$11.99,https://www.jollychic.com/p/slim-solid-color-elegant-women-s-gloves-g216569.html,Slim Solid Color Elegant Women's Gloves,Gloves
1157,$11.99,,https://www.jollychic.com/p/thicken-elegant-fashion-lady-gloves-g216633.html,Thicken Elegant Fashion Lady Gloves,Gloves
403,$6.99,$13.99,https://www.jollychic.com/p/cold-proof-solid-lady-gloves-with-bow-g216681.html,Cold Proof Solid Lady Gloves With Bow,Gloves
255,$6.99,$13.99,https://www.jollychic.com/p/solid-patchwork-lady-gloves-with-bow-g216701.html,Solid Patchwork Lady Gloves With Bow,Gloves
185,$8.99,,https://www.jollychic.com/p/grid-belt-thermal-women-s-gloves-g216755.html,Grid Belt Thermal Women's Gloves,Gloves
677,$4.99,$8.99,https://www.jollychic.com/p/touchscreen-antislip-winter-gloves-g217441.html,Touchscreen Antislip Winter Gloves,Gloves
992,$4.99,$7.99,https://www.jollychic.com/p/button-thicken-brushed-gloves-g219849.html,Button Thicken Brushed Gloves,Gloves
770,$4.99,$7.99,https://www.jollychic.com/p/touchscreen-elastic-cotton-embroidery-gloves-with-bow-g219857.html,Touchscreen Elastic Cotton Embroidery Gloves With Bow,Gloves
685,$9.99,,https://www.jollychic.com/p/patchwork-elastic-warm-thicken-winter-gloves-g227793.html,Patchwork Elastic Warm Thicken Winter Gloves,Gloves
276,$4.99,$7.99,https://www.jollychic.com/p/touch-screen-function-bow-design-gloves-g234125.html,Touch Screen Function Bow Design Gloves,Gloves
83,$4.99,$8.99,https://www.jollychic.com/p/faux-fur-thicken-winter-non-slip-gloves-g234135.html,Faux Fur Thicken Winter Non Slip Gloves,Gloves
260,$6.99,,https://www.jollychic.com/p/charming-elegant-lace-antiskid-high-end-women-gloves-g281066.html,Charming Elegant Lace Antiskid High End Women Gloves,Gloves
6974,$4.99,$8.99,https://www.jollychic.com/p/women-s-gloves-sterling-sweet-lovable-touchscreen-warm-cozy-fluffy-gloves-g425484.html,Women's Gloves Sterling Sweet Lovable Touchscreen Warm Cozy Fluffy Gloves,Gloves
285,$9.99,,https://www.jollychic.com/p/women-s-gloves-chic-touchscreen-elastic-thicken-warm-fluffy-design-accessory-g467626.html,Women's Gloves Chic Touchscreen Elastic Thicken Warm Fluffy Design Accessory,Gloves
66,$8.99,$14.99,https://www.jollychic.com/p/women-s-gloves-sweet-candy-color-bow-knot-ornament-warm-accessory-g467628.html,Women's Gloves Sweet Candy Color Bow Knot Ornament Warm Accessory,Gloves
831,$7.99,$14.99,https://www.jollychic.com/p/women-s-gloves-stylish-sweet-classy-double-layer-thicken-fluffy-accessory-g469066.html,Women's Gloves Stylish Sweet Classy Double Layer Thicken Fluffy Accessory,Gloves
408,$11.99,,https://www.jollychic.com/p/men-s-gloves-stylish-fashion-patchwork-warm-cozy-thickened-gloves-g487140.html,Men's Gloves Stylish Fashion Patchwork Warm Cozy Thickened Gloves,Gloves
301,$8.99,,https://www.jollychic.com/p/women-s-gloves-high-end-ladylike-thicken-warm-bow-knot-accessory-g536244.html,Women's Gloves High End Ladylike Thicken Warm Bow Knot Accessory,Gloves
510,$5.99,$8.99,https://www.jollychic.com/p/women-s-gloves-classy-refined-bow-knot-patch-warm-touchscreen-accessory-g536246.html,Women's Gloves Classy Refined Bow Knot Patch Warm Touchscreen Accessory,Gloves
235,$6.99,$11.99,https://www.jollychic.com/p/women-s-gloves-visible-floral-lace-anti-uv-fingered-comfy-accessory-g573672.html,Women's Gloves Visible Floral Lace Anti UV Fingered Comfy Accessory,Gloves
260,$5.99,$9.99,https://www.jollychic.com/p/women-s-gloves-thicken-anti-uv-lace-pattern-fingered-accessory-g573678.html,Women's Gloves Thicken Anti UV Lace Pattern Fingered Accessory,Gloves
142,$7.99,$13.99,https://www.jollychic.com/p/women-s-gloves-stretchy-lace-themed-half-fingered-long-gloves-g573682.html,Women's Gloves Stretchy Lace Themed Half Fingered Long Gloves,Gloves
243,$5.99,$8.99,https://www.jollychic.com/p/women-s-gloves-elegant-anti-slip-lace-bow-knot-sweet-breathable-gloves-g573694.html,Women's Gloves Elegant Anti Slip Lace Bow Knot Sweet Breathable Gloves,Gloves
649,$3.99,$11.99,https://www.jollychic.com/p/women-s-warm-gloves-unisex-faddish-skeleton-hands-pattern-touch-screen-accessory-g1093194.html,Women's Warm Gloves Unisex Faddish Skeleton Hands Pattern Touch Screen Accessory,Gloves
335,$15.99,$28.99,https://www.jollychic.com/p/women-s-warm-gloves-unisex-elegant-deer-pattern-cashmere-two-ways-wearing-accessory-g1093198.html,Women's Warm Gloves Unisex Elegant Deer Pattern Cashmere Two Ways Wearing Accessory,Gloves
52,$16.99,$29.99,https://www.jollychic.com/p/women-s-gloves-bowknot-decorative-sweet-style-faddish-accessory-g1130104.html,Women's Gloves Bowknot Decorative Sweet Style Faddish Accessory,Gloves
975,$15.99,$29.99,https://www.jollychic.com/p/women-s-gloves-solid-color-brief-style-faddish-all-match-warm-accessory-g1130112.html,Women's Gloves Solid Color Brief Style Faddish All Match Warm Accessory,Gloves
796,$3.99,$7.99,https://www.jollychic.com/p/women-s-sun-protection-gloves-personalized-all-matched-trendy-lace-accessory-g1169632.html,Women's Sun Protection Gloves Personalized All Matched Trendy Lace Accessory,Gloves
50,$13.99,$21.99,https://www.jollychic.com/p/women-s-gloves-stylish-all-match-lace-embroidery-sun-protection-accessory-g1175552.html,Women's Gloves Stylish All Match Lace Embroidery Sun Protection Accessory,Gloves
786,$3.99,$9.99,https://www.jollychic.com/p/women-s-gloves-breathable-all-match-solid-sun-protection-accessory-g1175636.html,Women's Gloves Breathable All Match Solid Sun Protection Accessory,Gloves
80,$7.99,$13.99,https://www.jollychic.com/p/women-s-warm-gloves-solid-color-patchwork-stylish-gloves-accessory-g1186766.html,Women's Warm Gloves Solid Color Patchwork Stylish Gloves Accessory,Gloves
2207,$4.99,$10.99,https://www.jollychic.com/p/women-s-gloves-punk-style-rivets-ornament-all-matched-fashionable-accessory-g1247068.html,Women's Gloves Punk Style Rivets Ornament All Matched Fashionable Accessory,Gloves
1654,$3.99,$9.99,https://www.jollychic.com/p/women-s-gloves-simple-style-all-matched-multifunctional-personalized-accessory-g1247070.html,Women's Gloves Simple Style All Matched Multifunctional Personalized Accessory,Gloves
240,$2.99,$5.99,https://www.jollychic.com/p/women-s-sun-protection-gloves-simple-style-hollowed-out-vintage-accessory-g1272396.html,Women's Sun Protection Gloves Simple Style Hollowed Out Vintage Accessory,Gloves
152,$3.99,$6.99,https://www.jollychic.com/p/women-s-sun-protection-gloves-vogue-hollowed-out-elegant-lace-accessory-g1272400.html,Women's Sun Protection Gloves Vogue Hollowed Out Elegant Lace Accessory,Gloves
41,$2.99,$8.99,https://www.jollychic.com/p/women-s-gloves-solid-color-brief-style-faddish-all-match-lace-accessory-g1308290.html,Women's Gloves Solid Color Brief Style Faddish All Match Lace Accessory,Gloves
40,$4.99,$8.99,https://www.jollychic.com/p/women-s-gloves-brief-style-lace-decorative-solid-faddish-accessory-g1308292.html,Women's Gloves Brief Style Lace Decorative Solid Faddish Accessory,Gloves
204,$1.99,$5.99,https://www.jollychic.com/p/women-s-gloves-ladylike-all-match-brief-style-faddish-hollow-out-accessory-g1308300.html,Women's Gloves Ladylike All Match Brief Style Faddish Hollow Out Accessory,Gloves
86,$2.99,$8.99,https://www.jollychic.com/p/women-s-gloves-brief-style-faddish-solid-color-trendy-all-match-accessory-g1308304.html,Women's Gloves Brief Style Faddish Solid Color Trendy All Match Accessory,Gloves
1073,$5.99,$16.99,https://www.jollychic.com/p/women-s-fashion-warm-gloves-bow-knot-rivets-decor-dance-half-gloves-g1318206.html,Women's Fashion Warm Gloves Bow Knot Rivets Decor Dance Half Gloves,Gloves
87,$4.99,$9.99,https://www.jollychic.com/p/women-s-sun-protection-gloves-brief-style-hollow-out-rhinestone-decor-ladylike-accessory-g1318656.html,Women's Sun Protection Gloves Brief Style Hollow Out Rhinestone Decor Ladylike Accessory,Gloves
13,$7.99,$15.99,https://www.jollychic.com/p/women-s-warm-gloves-fluffy-hair-decor-patchwork-design-gloves-accessory-g1340244.html,Women's Warm Gloves Fluffy Hair Decor Patchwork Design Gloves Accessory,Gloves
102,$3.99,$10.99,https://www.jollychic.com/p/women-s-warm-gloves-fluffy-hair-decor-patchwork-design-elegant-lace-accessory-g1340258.html,Women's Warm Gloves Fluffy Hair Decor Patchwork Design Elegant Lace Accessory,Gloves
83,$5.99,$14.99,https://www.jollychic.com/p/women-s-sun-protection-gloves-elegant-simple-style-all-match-chic-accessory-g1344904.html,Women's Sun Protection Gloves Elegant Simple Style All Match Chic Accessory,Gloves
530,$1.99,$5.99,https://www.jollychic.com/p/women-s-gloves-ladylike-all-match-brief-style-color-block-faddish-accessory-g1354144.html,Women's Gloves Ladylike All Match Brief Style Color Block Faddish Accessory,Gloves
1476,$4.99,$13.99,https://www.jollychic.com/p/women-s-warm-gloves-fresh-style-buttons-decor-all-match-knitted-gloves-accessory-g1358406.html,Women's Warm Gloves Fresh Style Buttons Decor All Match Knitted Gloves Accessory,Gloves
2351,$3.99,$11.99,https://www.jollychic.com/p/women-s-warm-gloves-stylish-hollowed-knitted-short-pattern-fingerless-soft-gloves-accessory-g1358428.html,Women's Warm Gloves Stylish Hollowed Knitted Short Pattern Fingerless Soft Gloves Accessory,Gloves
412,$5.99,$15.99,https://www.jollychic.com/p/women-s-gloves-punk-style-chain-decoration-top-fashion-accessory-g1372672.html,Women's Gloves Punk Style Chain Decoration Top Fashion Accessory,Gloves
91,$5.99,$15.99,https://www.jollychic.com/p/women-s-gloves-solid-color-punk-style-personalized-fashion-accessory-g1372744.html,Women's Gloves Solid Color Punk Style Personalized Fashion Accessory,Gloves
480,$4.99,$12.99,https://www.jollychic.com/p/women-s-gloves-cool-solid-color-personality-top-fashion-accessory-g1372750.html,Women's Gloves Cool Solid Color Personality Top Fashion Accessory,Gloves
690,$6.99,$14.99,https://www.jollychic.com/p/women-s-glove-punk-style-rivets-ornament-personalized-chain-glove-accessory-g1378564.html,Women's Glove Punk Style Rivets Ornament Personalized Chain Glove Accessory,Gloves
84,$3.99,$11.99,https://www.jollychic.com/p/women-s-gloves-multi-function-outdoor-lighting-mitten-design-stylish-accessory-g1392082.html,Women's Gloves Multi Function Outdoor Lighting Mitten Design Stylish Accessory,Gloves
203,$5.99,$11.99,https://www.jollychic.com/p/women-s-gloves-knitted-hollow-out-short-pattern-warm-all-match-glove-accessory-g1433146.html,Women's Gloves Knitted Hollow Out Short Pattern Warm All Match Glove Accessory,Gloves
58,$5.99,$11.99,https://www.jollychic.com/p/women-s-gloves-color-block-short-keep-warm-all-match-brief-design-glove-accessory-g1433160.html,Women's Gloves Color Block Short Keep Warm All Match Brief Design Glove Accessory,Gloves
683,$4.99,$12.99,https://www.jollychic.com/p/women-s-gloves-fluffy-warm-solid-color-short-pattern-ladylike-glove-accessory-g1433162.html,Women's Gloves Fluffy Warm Solid Color Short Pattern Ladylike Glove Accessory,Gloves
289,$6.99,$13.99,https://www.jollychic.com/p/women-s-gloves-long-pattern-solid-color-all-match-graceful-glove-accessory-g1433164.html,Women's Gloves Long Pattern Solid Color All Match Graceful Glove Accessory,Gloves
611,$5.99,$13.99,https://www.jollychic.com/p/women-s-gloves-short-pattern-fluffy-button-decoration-knitting-glove-accessory-g1433166.html,Women's Gloves Short Pattern Fluffy Button Decoration Knitting Glove Accessory,Gloves
178,$1.99,$3.99,https://www.jollychic.com/p/women-s-warm-gloves-sweet-style-bowknot-dotted-short-pattern-accessory-g1433346.html,Women's Warm Gloves Sweet Style Bowknot Dotted Short Pattern Accessory,Gloves
1022,$1.99,$5.99,https://www.jollychic.com/p/women-s-warm-gloves-all-matched-patchwork-fashion-accessory-g1433354.html,Women's Warm Gloves All Matched Patchwork Fashion Accessory,Gloves
452,$3.99,$9.99,https://www.jollychic.com/p/women-s-warm-gloves-lovely-cartoon-design-preppy-style-chic-accessory-g1433362.html,Women's Warm Gloves Lovely Cartoon Design Preppy Style Chic Accessory,Gloves
55,$0.99,$3.99,https://www.jollychic.com/p/women-s-warm-gloves-preppy-style-mixed-color-casual-vogue-accessory-g1433370.html,Women's Warm Gloves Preppy Style Mixed Color Casual Vogue Accessory,Gloves
1024,$4.99,$12.99,https://www.jollychic.com/p/women-s-gloves-short-solid-color-fluffy-plain-style-all-match-sweet-glove-accessory-g1433736.html,Women's Gloves Short Solid Color Fluffy Plain Style All Match Sweet Glove Accessory,Gloves
75,$8.99,$14.99,https://www.jollychic.com/p/women-s-gloves-fluffy-decor-solid-color-elegant-charming-glove-accessory-g1434278.html,Women's Gloves Fluffy Decor Solid Color Elegant Charming Glove Accessory,Gloves
19,$36.99,,https://www.jollychic.com/p/women-s-gloves-brief-style-faddish-solid-color-trendy-all-match-accessory-g1449522.html,Women's Gloves Brief Style Faddish Solid Color Trendy All Match Accessory,Gloves
5,$17.99,,https://www.jollychic.com/p/women-s-gloves-brief-style-faddish-solid-color-trendy-all-match-accessory-g1449530.html,Women's Gloves Brief Style Faddish Solid Color Trendy All Match Accessory,Gloves
18,$14.99,,https://www.jollychic.com/p/women-s-warm-gloves-lovely-cartoon-design-all-match-fashion-accessory-g1451616.html,Women's Warm Gloves Lovely Cartoon Design All Match Fashion Accessory,Gloves
43,$11.99,,https://www.jollychic.com/p/women-s-gloves-snowflake-pattern-color-block-long-pattern-knitting-glove-accessory-g1465238.html,Women's Gloves Snowflake Pattern Color Block Long Pattern Knitting Glove Accessory,Gloves
26,$9.99,,https://www.jollychic.com/p/women-s-warm-glove-suede-flower-embroidery-simple-style-solid-color-warm-gloves-g1476822.html,Women's Warm Glove Suede Flower Embroidery Simple Style Solid Color Warm Gloves,Gloves
18,$9.99,,https://www.jollychic.com/p/women-s-warm-glove-screen-touchable-anti-skid-solid-color-chic-gloves-g1477096.html,Women's Warm Glove Screen Touchable Anti-skid Solid Color Chic Gloves,Gloves
10,$8.99,$18.99,https://www.jollychic.com/p/women-s-gloves-lace-double-uv-protection-sunscreen-sun-protection-gloves-g1490542.html,Women's Gloves Lace Double UV Protection Sunscreen Sun Protection Gloves,Gloves
101,$11.99,$17.99,https://www.jollychic.com/p/women-s-gloves-fluffy-hair-ornament-open-finger-sweet-warm-stylish-gloves-accessory-g1494212.html,Women's Gloves Fluffy Hair Ornament Open Finger Sweet Warm Stylish Gloves Accessory,Gloves
29,$11.99,$16.99,https://www.jollychic.com/p/women-s-gloves-touch-screen-full-finger-fuzzy-ball-decor-warm-solid-color-gloves-g1500146.html,Women's Gloves Touch Screen Full Finger Fuzzy Ball Decor Warm Solid Color Gloves,Gloves
55,$11.99,$16.99,https://www.jollychic.com/p/women-s-gloves-patchwork-warm-wearable-sweet-style-faddish-accessory-g1515820.html,Women's Gloves Patchwork Warm Wearable Sweet Style Faddish Accessory,Gloves
30,$9.99,$13.99,https://www.jollychic.com/p/women-s-gloves-brief-style-faddish-color-block-trendy-all-match-accessory-g1515826.html,Women's Gloves Brief Style Faddish Color Block Trendy All Match Accessory,Gloves
57,$21.99,,https://www.jollychic.com/p/women-s-glove-solid-color-lace-button-decoration-fashion-warm-glove-accessory-g1537398.html,Women's Glove Solid Color Lace Button Decoration Fashion Warm Glove Accessory,Gloves
95,$20.99,,https://www.jollychic.com/p/women-s-glove-solid-color-half-finger-woolen-warm-glove-accessory-g1537402.html,Women's Glove Solid Color Half Finger Woolen Warm Glove Accessory,Gloves
10,$6.99,$9.99,https://www.jollychic.com/p/women-s-sun-protection-gloves-two-figures-design-painting-gloves-accessory-g1568496.html,Women's Sun Protection Gloves Two Figures Design Painting Gloves Accessory,Gloves
3,$25.99,,https://www.jollychic.com/p/women-s-gloves-warm-embroidery-touchscreen-outdoor-fashion-solid-gloves-accessory-g1621142.html,Women's Gloves Warm Embroidery Touchscreen Outdoor Fashion Solid Gloves Accessory,Gloves
2,$21.99,,https://www.jollychic.com/p/women-s-gloves-outdoor-fashion-embroidery-warm-comfy-love-pattern-gloves-accessory-g1621146.html,Women's Gloves Outdoor Fashion Embroidery Warm Comfy Love Pattern Gloves Accessory,Gloves
1,$25.99,,https://www.jollychic.com/p/women-s-gloves-outdoor-fashion-warm-comfy-solid-fashionable-gloves-accessory-g1621148.html,Women's Gloves Outdoor Fashion Warm Comfy Solid Fashionable Gloves Accessory,Gloves
1,$14.99,,https://www.jollychic.com/p/women-s-gloves-warm-color-block-preppy-style-faddish-accessory-g1621188.html,Women's Gloves Warm Color Block Preppy Style Faddish Accessory,Gloves
0,$15.99,,https://www.jollychic.com/p/women-s-gloves-solid-color-brief-style-faddish-all-match-charming-accessory-g1621190.html,Women's Gloves Solid Color Brief Style Faddish All Match Charming Accessory,Gloves
0,$14.99,,https://www.jollychic.com/p/women-s-gloves-solid-color-brief-style-faddish-all-match-warm-accessory-g1621192.html,Women's Gloves Solid Color Brief Style Faddish All Match Warm Accessory,Gloves
0,$14.99,,https://www.jollychic.com/p/women-s-gloves-brief-style-faddish-solid-color-trendy-all-match-accessory-g1621194.html,Women's Gloves Brief Style Faddish Solid Color Trendy All Match Accessory,Gloves
1,$14.99,,https://www.jollychic.com/p/women-s-gloves-ladylike-all-match-brief-style-faddish-accessory-g1621196.html,Women's Gloves Ladylike All Match Brief Style Faddish Accessory,Gloves
1,$14.99,,https://www.jollychic.com/p/women-s-gloves-solid-color-warm-sweet-style-brief-accessory-g1621198.html,Women's Gloves Solid Color Warm Sweet Style Brief Accessory,Gloves
1,$14.99,,https://www.jollychic.com/p/women-s-gloves-patchwork-warm-wearable-sweet-style-faddish-accessory-g1621200.html,Women's Gloves Patchwork Warm Wearable Sweet Style Faddish Accessory,Gloves
0,$13.99,,https://www.jollychic.com/p/women-s-gloves-solid-color-brief-style-faddish-all-match-accessory-g1621202.html,Women's Gloves Solid Color Brief Style Faddish All Match Accessory,Gloves
0,$15.99,,https://www.jollychic.com/p/women-s-gloves-brief-style-faddish-color-block-trendy-all-match-accessory-g1621204.html,Women's Gloves Brief Style Faddish Color Block Trendy All Match Accessory,Gloves
1,$14.99,,https://www.jollychic.com/p/women-s-gloves-warm-solid-color-brief-style-faddish-all-match-accessory-g1621206.html,Women's Gloves Warm Solid Color Brief Style Faddish All Match Accessory,Gloves
1,$13.99,,https://www.jollychic.com/p/women-s-gloves-patchwork-warm-wearable-sweet-style-faddish-accessory-g1621208.html,Women's Gloves Patchwork Warm Wearable Sweet Style Faddish Accessory,Gloves
1,$13.99,,https://www.jollychic.com/p/women-s-gloves-patchwork-warm-wearable-sweet-style-faddish-accessory-g1621210.html,Women's Gloves Patchwork Warm Wearable Sweet Style Faddish Accessory,Gloves
1,$14.99,,https://www.jollychic.com/p/women-s-gloves-solid-color-brief-style-faddish-all-match-warm-accessory-g1621212.html,Women's Gloves Solid Color Brief Style Faddish All Match Warm Accessory,Gloves
1,$13.99,,https://www.jollychic.com/p/women-s-gloves-patchwork-warm-wearable-sweet-style-faddish-accessory-g1621214.html,Women's Gloves Patchwork Warm Wearable Sweet Style Faddish Accessory,Gloves
0,$22.99,,https://www.jollychic.com/p/women-s-gloves-warm-solid-color-brief-style-faddish-all-match-accessory-g1621216.html,Women's Gloves Warm Solid Color Brief Style Faddish All Match Accessory,Gloves
1,$22.99,,https://www.jollychic.com/p/women-s-gloves-warm-color-block-preppy-style-faddish-accessory-g1621218.html,Women's Gloves Warm Color Block Preppy Style Faddish Accessory,Gloves
0,$24.99,,https://www.jollychic.com/p/women-s-gloves-solid-color-brief-style-faddish-all-match-preppy-accessory-g1621220.html,Women's Gloves Solid Color Brief Style Faddish All Match Preppy Accessory,Gloves
1,$17.99,,https://www.jollychic.com/p/women-s-gloves-outdoor-classic-fashion-fold-warm-comfy-mitten-gloves-accessory-g1623252.html,Women's Gloves Outdoor Classic Fashion Fold Warm Comfy Mitten Gloves Accessory,Gloves
0,$17.99,,https://www.jollychic.com/p/women-s-gloves-multi-color-outdoor-elegant-fold-warm-comfy-mitten-gloves-accessory-g1623256.html,Women's Gloves Multi-Color Outdoor Elegant Fold Warm Comfy Mitten Gloves Accessory,Gloves
0,$25.99,,https://www.jollychic.com/p/women-s-gloves-outdoor-long-solid-fashion-warm-comfy-mitten-gloves-accessory-g1623260.html,Women's Gloves Outdoor Long Solid Fashion Warm Comfy Mitten Gloves Accessory,Gloves
0,$10.99,$16.99,https://www.jollychic.com/p/patchwork-touchscreen-outdoor-fashion-solid-all-match-cute-warm-gloves-g1625256.html,Patchwork Touchscreen Outdoor Fashion Solid All Match Cute Warm Gloves,Gloves
134,$5.99,$8.99,https://www.jollychic.com/p/soft-slim-bow-lace-warm-winter-gloves-g69050.html,Soft Slim Bow Lace Warm Winter Gloves,Gloves
480,$5.99,$11.99,https://www.jollychic.com/p/soft-slim-pom-poms-solid-thicken-winter-gloves-g69064.html,Soft Slim Pom Poms Solid Thicken Winter Gloves,Gloves
474,$9.99,,https://www.jollychic.com/p/sweet-warm-fur-outdoors-gloves-for-women-g69874.html,Sweet Warm Fur Outdoors Gloves For Women,Gloves
74,$5.99,$11.99,https://www.jollychic.com/p/lace-flower-fashion-winter-gloves-with-bow-g215321.html,Lace Flower Fashion Winter Gloves With Bow,Gloves
201,$4.99,$9.99,https://www.jollychic.com/p/romantic-solid-women-s-gloves-with-bow-g215355.html,Romantic Solid Women's Gloves With Bow,Gloves
167,$7.99,$12.99,https://www.jollychic.com/p/romantic-thermal-fashion-women-s-gloves-g215405.html,Romantic Thermal Fashion Women's Gloves,Gloves
155,$3.99,$7.99,https://www.jollychic.com/p/pearls-patchwork-thermal-winter-gloves-g216473.html,Pearls Patchwork Thermal Winter Gloves,Gloves
1726,$7.99,$11.99,https://www.jollychic.com/p/romantic-thermal-elastic-women-s-gloves-g216571.html,Romantic Thermal Elastic Women's Gloves,Gloves
310,$8.99,$14.99,https://www.jollychic.com/p/polka-dot-fashion-thermal-women-gloves-g216675.html,Polka Dot Fashion Thermal Women Gloves,Gloves
209,$6.99,$14.99,https://www.jollychic.com/p/thermal-polka-dot-elegant-lady-gloves-g216677.html,Thermal Polka Dot Elegant Lady Gloves,Gloves
405,$13.99,,https://www.jollychic.com/p/patchwork-thermal-elegant-women-gloves-g216711.html,Patchwork Thermal Elegant Women Gloves,Gloves
1169,$7.99,$12.99,https://www.jollychic.com/p/cold-proof-elegant-lady-gloves-g216721.html,Cold Proof Elegant Lady Gloves,Gloves
424,$6.99,$12.99,https://www.jollychic.com/p/belt-elegant-patchwork-gloves-g216735.html,Belt Elegant Patchwork Gloves,Gloves
1017,$7.99,$11.99,https://www.jollychic.com/p/purple-khaki-thermal-romantic-gloves-g216999.html,Purple&Khaki Thermal Romantic Gloves,Gloves
39,$7.99,$12.99,https://www.jollychic.com/p/patchwork-lace-delicate-women-gloves-g217005.html,Patchwork Lace Delicate Women Gloves,Gloves
142,$6.99,$12.99,https://www.jollychic.com/p/romantic-thermal-patchwork-women-s-gloves-g217007.html,Romantic Thermal Patchwork Women's Gloves,Gloves
291,$7.99,,https://www.jollychic.com/p/chamois-grey-pink-touchscreen-gloves-g219853.html,Chamois Grey Pink Touchscreen Gloves,Gloves
766,$4.99,$7.99,https://www.jollychic.com/p/lady-embroidery-brushed-gloves-with-bow-g219855.html,Lady Embroidery Brushed Gloves With Bow,Gloves
97,$7.99,$12.99,https://www.jollychic.com/p/women-s-gloves-new-chic-laced-bow-knot-sweet-warm-sterling-accessory-g467614.html,Women's Gloves New Chic Laced Bow Knot Sweet Warm Sterling Accessory,Gloves
