add_wish,discount_price,original_price,product_link,product_name,header_block
577,$6.99,,https://www.jollychic.com/p/polarized-double-bridge-large-sunglasses-g242535.html,Polarized Double Bridge Large Sunglasses,Sunglasses/Eyewears
726,$12.99,$15.99,https://www.jollychic.com/p/cat-eye-metallic-uv-protection-reflective-sunglasses-g245527.html,Cat Eye Metallic UV Protection Reflective Sunglasses,Sunglasses/Eyewears
255,$5.99,$11.99,https://www.jollychic.com/p/round-circle-color-block-new-fashion-sunglasses-g251565.html,Round Circle Color Block New Fashion Sunglasses,Sunglasses/Eyewears
93,$7.99,,https://www.jollychic.com/p/oval-lenses-snappy-classy-unisex-sunglasses-g274371.html,Oval Lenses Snappy Classy Unisex Sunglasses,Sunglasses/Eyewears
118,$15.99,,https://www.jollychic.com/p/sleek-metallic-ornament-stylish-polarizer-unisex-sunglasses-g283232.html,Sleek Metallic Ornament Stylish Polarizer Unisex Sunglasses,Sunglasses/Eyewears
88,$15.99,,https://www.jollychic.com/p/women-s-sunglasses-metallic-silver-frame-mercury-lenses-glasses-g479374.html,Women's Sunglasses Metallic Silver Frame Mercury Lenses Glasses,Sunglasses/Eyewears
117,$10.99,$16.99,https://www.jollychic.com/p/women-s-eyeglasses-brown-tea-full-rim-spectacles-retro-glasses-g555450.html,Women's Eyeglasses Brown Tea Full Rim Spectacles Retro Glasses,Sunglasses/Eyewears
57,$10.99,$16.99,https://www.jollychic.com/p/women-s-sunglasses-punk-style-rivet-ornament-glasses-accessory-g558536.html,Women's Sunglasses Punk Style Rivet Ornament Glasses Accessory,Sunglasses/Eyewears
169,$61.00,,https://www.jollychic.com/p/vegoos-women-s-round-sunglasses-fashion-retro-polaroid-glasses-accessory-g576768.html,VEGOOS Women's Round Sunglasses Fashion Retro Polaroid Glasses Accessory,Sunglasses/Eyewears
40,$33.99,$52.00,https://www.jollychic.com/p/vegoos-women-s-sunglasses-light-metal-stainless-steel-polarized-glasses-accessory-g576770.html,VEGOOS Women's Sunglasses Light Metal Stainless Steel Polarized Glasses Accessory,Sunglasses/Eyewears
35,$10.99,$16.99,https://www.jollychic.com/p/women-s-sunglasses-rimmed-stylish-cat-eye-shape-simple-classic-accessory-g615174.html,Women's Sunglasses Rimmed Stylish Cat Eye Shape Simple Classic Accessory,Sunglasses/Eyewears
24,$16.99,,https://www.jollychic.com/p/women-s-sunglasses-polarized-retro-semi-rimless-round-glasses-accesspry-g654742.html,Women's Sunglasses Polarized Retro Semi-Rimless Round Glasses Accesspry,Sunglasses/Eyewears
89,$14.99,,https://www.jollychic.com/p/women-s-eyeglasses-vogue-square-zero-dioptre-spectacles-accessory-g671484.html,Women's Eyeglasses Vogue Square Zero Dioptre Spectacles Accessory,Sunglasses/Eyewears
51,$10.99,$16.99,https://www.jollychic.com/p/women-s-sunglasses-arch-design-round-circle-glasses-elegant-accessory-g673414.html,Women's Sunglasses Arch Design Round Circle Glasses Elegant Accessory,Sunglasses/Eyewears
17,$11.99,$18.99,https://www.jollychic.com/p/women-s-sunglasses-metal-frame-square-simple-faddish-accessory-g677984.html,Women's Sunglasses Metal Frame Square Simple Faddish Accessory,Sunglasses/Eyewears
359,$9.99,$15.99,https://www.jollychic.com/p/women-s-sunglasses-classic-round-circle-all-match-vogue-glasses-accessory-g743260.html,Women's Sunglasses Classic Round Circle All Match Vogue Glasses Accessory,Sunglasses/Eyewears
25,$21.99,,https://www.jollychic.com/p/women-s-sunglasses-classic-design-solid-plastic-full-rim-trendy-accessory-g777016.html,Women's Sunglasses Classic Design Solid Plastic Full Rim Trendy Accessory,Sunglasses/Eyewears
15,$2.99,$10.99,https://www.jollychic.com/p/women-s-sunglasses-trendy-rimless-all-match-cool-glasses-accessory-g786552.html,Women's Sunglasses Trendy Rimless All Match Cool Glasses Accessory,Sunglasses/Eyewears
23,$16.99,$26.99,https://www.jollychic.com/p/women-s-polarized-sunglasses-irregular-design-fashion-unique-accessory-g845056.html,Women's Polarized Sunglasses Irregular Design Fashion Unique Accessory,Sunglasses/Eyewears
11,$13.99,$21.99,https://www.jollychic.com/p/women-s-polarized-sunglasses-hollow-out-design-fashion-all-match-accessory-g845074.html,Women's Polarized Sunglasses Hollow Out Design Fashion All Match Accessory,Sunglasses/Eyewears
9,$15.99,$24.99,https://www.jollychic.com/p/women-s-polarized-sunglasses-simple-style-all-match-trendy-accessory-g855136.html,Women's Polarized Sunglasses Simple Style All Match Trendy Accessory,Sunglasses/Eyewears
49,$7.99,,https://www.jollychic.com/p/women-s-sunglasses-retro-polygon-frame-hollowed-trendy-resin-accessory-g871788.html,Women's Sunglasses Retro Polygon Frame Hollowed Trendy Resin Accessory,Sunglasses/Eyewears
7,$27.99,$42.99,https://www.jollychic.com/p/topsight-women-s-sunglasses-vintage-all-match-round-circle-accessory-g900086.html,Topsight Women's Sunglasses Vintage All Match Round Circle Accessory,Sunglasses/Eyewears
22,$20.99,$42.99,https://www.jollychic.com/p/topsight-glasses-vintage-mental-frame-polarized-round-circle-eyewear-accessory-g900738.html,Topsight Glasses Vintage Mental Frame Polarized Round Circle Eyewear Accessory,Sunglasses/Eyewears
110,$11.99,$14.99,https://www.jollychic.com/p/women-s-sunglasses-classic-aviator-round-lens-stylish-sunglasses-g941176.html,Women's Sunglasses Classic Aviator Round Lens Stylish Sunglasses,Sunglasses/Eyewears
23,$8.99,$14.99,https://www.jollychic.com/p/women-s-sunglasses-all-match-full-rim-trendy-chic-glasses-accessory-g941384.html,Women's Sunglasses All Match Full Rim Trendy Chic Glasses Accessory,Sunglasses/Eyewears
46,$8.99,$13.99,https://www.jollychic.com/p/women-s-sunglasses-fashion-full-rim-sun-protection-accessory-g960292.html,Women's Sunglasses Fashion Full Rim Sun Protection Accessory,Sunglasses/Eyewears
2,$12.99,$19.99,https://www.jollychic.com/p/women-s-sunglasses-stylish-irregular-frame-all-matched-glasses-accessory-g965532.html,Women's Sunglasses Stylish Irregular Frame All Matched Glasses Accessory,Sunglasses/Eyewears
9,$7.99,$12.99,https://www.jollychic.com/p/women-s-sunglasses-retro-hollow-out-full-rim-trendy-frame-glasses-g967066.html,Women's Sunglasses Retro Hollow Out Full Rim Trendy Frame Glasses,Sunglasses/Eyewears
26,$25.99,,https://www.jollychic.com/p/women-s-sunglasses-trendy-metallic-round-frame-vintage-glasses-accessory-g971834.html,Women's Sunglasses Trendy Metallic Round Frame Vintage Glasses Accessory,Sunglasses/Eyewears
15,$10.99,$20.99,https://www.jollychic.com/p/women-s-eyeglasses-vintage-preppy-style-metallic-frame-glasses-accessory-g971836.html,Women's Eyeglasses Vintage Preppy Style Metallic Frame Glasses Accessory,Sunglasses/Eyewears
20,$8.99,$15.99,https://www.jollychic.com/p/women-s-cat-eye-sunglasses-metal-frame-uv-protection-stylish-unisex-sunglasses-g984402.html,Women's Cat Eye Sunglasses Metal Frame UV Protection Stylish Unisex Sunglasses,Sunglasses/Eyewears
8,$10.99,$21.99,https://www.jollychic.com/p/women-s-sunglasses-personalized-brief-style-cat-eye-vintage-glasses-accessory-g1014772.html,Women's Sunglasses Personalized Brief Style Cat Eye Vintage Glasses Accessory,Sunglasses/Eyewears
39,$7.99,$16.99,https://www.jollychic.com/p/women-s-sunglasses-chic-hollowed-out-cat-eye-all-matched-glasses-accessory-g1014794.html,Women's Sunglasses Chic Hollowed Out Cat Eye All Matched Glasses Accessory,Sunglasses/Eyewears
19,$10.99,,https://www.jollychic.com/p/women-s-sunglasses-cat-eye-top-fashion-sun-proof-glasses-accessory-g1023426.html,Women's Sunglasses Cat Eye Top Fashion Sun Proof Glasses Accessory,Sunglasses/Eyewears
2,$14.99,$22.99,https://www.jollychic.com/p/women-s-plain-glasses-gradient-color-brief-design-glasses-g1024232.html,Women's Plain Glasses Gradient Color Brief Design Glasses,Sunglasses/Eyewears
6,$11.99,,https://www.jollychic.com/p/women-s-sunglasses-vintage-leopard-print-round-frame-glasses-accessory-g1045008.html,Women's Sunglasses Vintage Leopard Print Round Frame Glasses Accessory,Sunglasses/Eyewears
17,$21.99,,https://www.jollychic.com/p/women-s-sunglasses-cat-eye-shape-lake-blue-sun-protection-accessory-g1046824.html,Women's Sunglasses Cat Eye Shape Lake Blue Sun Protection Accessory,Sunglasses/Eyewears
8,$8.99,$14.99,https://www.jollychic.com/p/women-s-glasses-retro-all-match-brief-design-stylish-eyewear-accessory-g1076710.html,Women's Glasses Retro All Match Brief Design Stylish Eyewear Accessory,Sunglasses/Eyewears
14,$11.99,$18.99,https://www.jollychic.com/p/women-s-sunglasses-rimless-rhinestone-ornament-charming-eyewear-accessory-g1077552.html,Women's Sunglasses Rimless Rhinestone Ornament Charming Eyewear Accessory,Sunglasses/Eyewears
33,$10.99,$16.99,https://www.jollychic.com/p/women-s-sunglasses-fashion-round-circle-thin-rim-eyewear-accessory-g1077772.html,Women's Sunglasses Fashion Round Circle Thin Rim Eyewear Accessory,Sunglasses/Eyewears
12,$5.99,$15.99,https://www.jollychic.com/p/women-s-sunglasses-casual-outdoor-elegant-faddish-glasses-accessory-g1099170.html,Women's Sunglasses Casual Outdoor Elegant Faddish Glasses Accessory,Sunglasses/Eyewears
2,$24.99,,https://www.jollychic.com/p/women-s-glasses-brief-style-faddish-all-match-ladylike-accessory-g1112152.html,Women's Glasses Brief Style Faddish All Match Ladylike Accessory,Sunglasses/Eyewears
19,$10.99,$18.99,https://www.jollychic.com/p/women-s-eyeglasses-simple-style-full-frame-all-match-elegant-chic-accessory-g1144086.html,Women's Eyeglasses Simple Style Full Frame All Match Elegant Chic Accessory,Sunglasses/Eyewears
18,$5.99,$11.99,https://www.jollychic.com/p/women-s-glasses-retro-style-big-frame-retro-style-accessory-g1158256.html,Women's Glasses Retro Style Big Frame Retro Style Accessory,Sunglasses/Eyewears
22,$7.99,,https://www.jollychic.com/p/women-s-sunglasses-retro-style-round-frame-big-frame-trendy-accessory-g1158264.html,Women's Sunglasses Retro Style Round Frame Big Frame Trendy Accessory,Sunglasses/Eyewears
17,$14.99,,https://www.jollychic.com/p/women-s-sunglasses-solid-color-brief-style-trendy-all-match-accessory-g1173714.html,Women's Sunglasses Solid Color Brief Style Trendy All Match Accessory,Sunglasses/Eyewears
2,$12.99,,https://www.jollychic.com/p/women-s-sunglasses-brief-style-big-frame-faddish-all-match-accessory-g1173736.html,Women's Sunglasses Brief Style Big Frame Faddish All Match Accessory,Sunglasses/Eyewears
12,$7.99,$14.99,https://www.jollychic.com/p/women-s-sunglasses-retro-style-all-matched-irregular-shaped-chic-accessory-g1175108.html,Women's Sunglasses Retro Style All Matched Irregular Shaped Chic Accessory,Sunglasses/Eyewears
8,$10.99,$17.99,https://www.jollychic.com/p/women-s-sunglasses-fashion-rimless-sun-protection-accessory-g1176554.html,Women's Sunglasses Fashion Rimless Sun Protection Accessory,Sunglasses/Eyewears
7,$10.99,$16.99,https://www.jollychic.com/p/women-s-sunglasses-fashion-personality-sun-protection-eyewear-accessory-g1176970.html,Women's Sunglasses Fashion Personality Sun Protection Eyewear Accessory,Sunglasses/Eyewears
6,$5.99,$12.99,https://www.jollychic.com/p/women-s-sunglasses-fashion-colorblock-hollowed-eyewear-accessory-g1178398.html,Women's Sunglasses Fashion Colorblock Hollowed Eyewear Accessory,Sunglasses/Eyewears
1,$9.99,$15.99,https://www.jollychic.com/p/women-s-sunglasses-brief-design-solid-color-personality-trendy-accessory-g1178404.html,Women's Sunglasses Brief Design Solid Color Personality Trendy Accessory,Sunglasses/Eyewears
12,$6.99,$15.99,https://www.jollychic.com/p/women-s-sunglasses-square-frame-top-fashion-accessory-g1178732.html,Women's Sunglasses Square Frame Top Fashion Accessory,Sunglasses/Eyewears
5,$68.00,,https://www.jollychic.com/p/skadino-women-s-sunglasses-bamboo-blue-mirror-color-block-trendy-accessory-g1189866.html,SKADINO Women's Sunglasses Bamboo Blue Mirror Color Block Trendy Accessory,Sunglasses/Eyewears
1,$53.00,,https://www.jollychic.com/p/skadino-women-s-sunglasses-polarized-uv400-protection-cycling-chic-accessory-g1214278.html,SKADINO Women's Sunglasses Polarized UV400 Protection Cycling Chic Accessory,Sunglasses/Eyewears
3,$53.00,,https://www.jollychic.com/p/skadino-women-s-sunglasses-bamboo-sunglass-blue-mirrored-uv400-protection-chic-accessory-g1214440.html,SKADINO Women's Sunglasses Bamboo Sunglass Blue Mirrored UV400 Protection Chic Accessory,Sunglasses/Eyewears
14,$16.99,,https://www.jollychic.com/p/women-s-sunglasses-trendy-big-frame-vintage-style-charming-accessory-g1225952.html,Women's Sunglasses Trendy Big Frame Vintage Style Charming Accessory,Sunglasses/Eyewears
3,$17.99,,https://www.jollychic.com/p/women-s-sunglasses-faddish-retro-full-rim-square-frame-all-match-glasses-accessory-g1225968.html,Women's Sunglasses Faddish Retro Full Rim Square Frame All Match Glasses Accessory,Sunglasses/Eyewears
2,$9.99,,https://www.jollychic.com/p/women-s-sunglasses-retro-full-rim-square-frame-all-match-glasses-accessory-g1225974.html,Women's Sunglasses Retro Full Rim Square Frame All Match Glasses Accessory,Sunglasses/Eyewears
3,$13.99,,https://www.jollychic.com/p/women-s-sunglasses-retro-full-rim-round-frame-all-match-glasses-accessory-g1226010.html,Women's Sunglasses Retro Full Rim Round Frame All Match Glasses Accessory,Sunglasses/Eyewears
6,$7.99,$12.99,https://www.jollychic.com/p/women-s-eyeglasses-brief-style-square-frame-retro-all-match-accessory-g1251304.html,Women's Eyeglasses Brief Style Square Frame Retro All Match Accessory,Sunglasses/Eyewears
1,$8.99,$14.99,https://www.jollychic.com/p/women-s-sunglasses-cat-eye-retro-style-big-frame-accessory-g1251332.html,Women's Sunglasses Cat Eye Retro Style Big Frame Accessory,Sunglasses/Eyewears
2,$10.99,$17.99,https://www.jollychic.com/p/women-s-sunglasses-vintage-rimless-feflection-mirror-star-sunglasses-universal-chic-eyeswear-g1278420.html,Women's Sunglasses Vintage Rimless Feflection Mirror Star Sunglasses Universal Chic Eyeswear,Sunglasses/Eyewears
8,$10.99,$17.99,https://www.jollychic.com/p/women-s-sunglasses-ultra-light-cat-eye-mirror-fashion-chic-comfy-eyewear-g1279380.html,Women's Sunglasses Ultra-Light Cat Eye Mirror Fashion Chic Comfy Eyewear,Sunglasses/Eyewears
7,$8.99,$18.99,https://www.jollychic.com/p/women-s-sunglasses-rivet-ornament-geometry-frame-fresh-style-trendy-accessory-g1282002.html,Women's Sunglasses Rivet Ornament Geometry Frame Fresh Style Trendy Accessory,Sunglasses/Eyewears
1,$33.99,,https://www.jollychic.com/p/skadino-women-s-sunglasses-vintage-all-matched-polarized-light-chic-accessory-g1314728.html,SKADINO Women's Sunglasses Vintage All Matched Polarized Light Chic Accessory,Sunglasses/Eyewears
4,$8.99,$20.99,https://www.jollychic.com/p/women-s-eyeglasses-vintage-rivet-inlay-all-match-clear-glasses-g1315928.html,Women's Eyeglasses Vintage Rivet Inlay All Match Clear Glasses,Sunglasses/Eyewears
2,$11.99,$26.99,https://www.jollychic.com/p/women-s-sunglasses-cat-eye-metal-elegant-ladies-fashion-eyewear-g1316710.html,Women's Sunglasses Cat Eye Metal Elegant Ladies Fashion Eyewear,Sunglasses/Eyewears
6,$9.99,$22.99,https://www.jollychic.com/p/women-s-sunglasses-faddish-personality-metal-frame-mirror-gradient-sunglasses-g1321268.html,Women's Sunglasses Faddish Personality Metal Frame Mirror Gradient Sunglasses,Sunglasses/Eyewears
5,$8.99,$20.99,https://www.jollychic.com/p/women-s-fashion-sunglasses-leisure-metal-round-gradient-sunglasses-g1321278.html,Women's Fashion Sunglasses Leisure Metal Round Gradient Sunglasses,Sunglasses/Eyewears
6,$10.99,$24.99,https://www.jollychic.com/p/women-s-sunglasses-all-matched-unique-beams-metal-aviator-mirror-sunglasses-g1321762.html,Women's Sunglasses All Matched Unique Beams Metal Aviator Mirror Sunglasses,Sunglasses/Eyewears
10,$11.99,$26.99,https://www.jollychic.com/p/women-s-sunglasses-faddish-luxury-crystal-inlay-cat-eye-sunglasses-g1321786.html,Women's Sunglasses Faddish Luxury Crystal Inlay Cat Eye Sunglasses,Sunglasses/Eyewears
15,$11.99,$26.99,https://www.jollychic.com/p/women-s-sunglasses-chic-unique-metal-cat-eye-mirror-sunglasses-g1321796.html,Women's Sunglasses Chic Unique Metal Cat Eye Mirror Sunglasses,Sunglasses/Eyewears
1,$11.99,$26.99,https://www.jollychic.com/p/women-s-eyeglasses-vintage-unique-skull-cat-eye-sunglasses-g1324198.html,Women's Eyeglasses Vintage Unique Skull Cat Eye Sunglasses,Sunglasses/Eyewears
1,$33.99,,https://www.jollychic.com/p/skadino-women-s-sunglasses-all-match-metallic-frame-trendy-polarized-light-accessory-g1332538.html,SKADINO Women's Sunglasses All Match Metallic Frame Trendy Polarized Light Accessory,Sunglasses/Eyewears
9,$25.99,,https://www.jollychic.com/p/women-s-sunglasses-vintage-candy-color-cat-eye-simple-style-vogue-accessory-g1341758.html,Women's Sunglasses Vintage Candy Color Cat Eye Simple Style Vogue Accessory,Sunglasses/Eyewears
5,$8.99,$18.99,https://www.jollychic.com/p/women-s-sunglasses-trendy-polarized-light-big-frame-one-piece-accessory-g1344008.html,Women's Sunglasses Trendy Polarized Light Big Frame One Piece Accessory,Sunglasses/Eyewears
2,$11.99,$26.99,https://www.jollychic.com/p/women-s-sunglasses-solid-color-fashionable-unique-colorful-mirror-accessory-g1344974.html,Women's Sunglasses Solid Color Fashionable Unique Colorful Mirror Accessory,Sunglasses/Eyewears
2,$9.99,$22.99,https://www.jollychic.com/p/women-s-eyeglasses-vintage-camouflage-print-frame-all-matched-glasses-accessory-g1374106.html,Women's Eyeglasses Vintage Camouflage Print Frame All Matched Glasses Accessory,Sunglasses/Eyewears
3,$8.99,$19.99,https://www.jollychic.com/p/women-s-sunglasses-vintage-fox-big-frame-sunglasses-g1375830.html,Women's Sunglasses Vintage Fox Big Frame Sunglasses,Sunglasses/Eyewears
2,$25.99,,https://www.jollychic.com/p/women-s-eyeglasses-brief-style-round-shape-retro-all-match-big-frame-accessory-g1381014.html,Women's Eyeglasses Brief Style Round Shape Retro All Match Big Frame Accessory,Sunglasses/Eyewears
3,$8.99,$19.99,https://www.jollychic.com/p/women-s-sunglasses-big-frame-oversized-plastic-rimmed-retro-style-square-rivet-eyewear-accessory-g1412068.html,Women's Sunglasses Big Frame Oversized Plastic Rimmed Retro Style Square Rivet Eyewear Accessory,Sunglasses/Eyewears
5,$6.99,$17.99,https://www.jollychic.com/p/women-s-eyeglasses-anti-blue-light-clear-glasses-frame-rivet-square-eyeglasses-g1412074.html,Women's Eyeglasses Anti-blue Light Clear Glasses Frame Rivet Square Eyeglasses,Sunglasses/Eyewears
1,$6.99,$16.99,https://www.jollychic.com/p/women-sunglasses-candy-color-gradient-lens-cat-eye-shape-uv400-sunglasses-g1413194.html,Women Sunglasses Candy Color Gradient Lens Cat Eye Shape UV400 Sunglasses,Sunglasses/Eyewears
9,$3.99,$11.99,https://www.jollychic.com/p/women-s-sunglasses-retro-style-all-match-geometry-shape-frame-glasses-g1429668.html,Women's Sunglasses Retro Style All Match Geometry Shape Frame Glasses,Sunglasses/Eyewears
2,$3.99,$11.99,https://www.jollychic.com/p/women-s-sunglasses-geometry-design-retro-all-match-ladylike-accessory-g1429672.html,Women's Sunglasses Geometry Design Retro All Match Ladylike Accessory,Sunglasses/Eyewears
2,$11.99,$26.99,https://www.jollychic.com/p/women-s-sunglasses-retro-style-all-match-geometry-shape-frame-glasses-g1429692.html,Women's Sunglasses Retro Style All Match Geometry Shape Frame Glasses,Sunglasses/Eyewears
0,$6.99,$17.99,https://www.jollychic.com/p/women-s-sunglasses-color-block-cat-eye-faddish-retro-accessory-g1430138.html,Women's Sunglasses Color Block Cat Eye Faddish Retro Accessory,Sunglasses/Eyewears
6,$11.99,$25.99,https://www.jollychic.com/p/women-s-sunglasses-metal-cat-eye-shape-cute-ladylike-sunglasses-g1431150.html,Women's Sunglasses Metal Cat Eye Shape Cute Ladylike Sunglasses,Sunglasses/Eyewears
4,$23.99,,https://www.jollychic.com/p/women-s-sunglasses-half-frame-flat-alloy-goggle-fashion-accessory-g1441332.html,Women's Sunglasses Half Frame Flat Alloy Goggle Fashion Accessory,Sunglasses/Eyewears
9,$33.99,,https://www.jollychic.com/p/unisex-fashionable-sunglasses-anti-ultraviolet-sunglasses-accessory-g1441400.html,Unisex Fashionable Sunglasses Anti Ultraviolet Sunglasses Accessory,Sunglasses/Eyewears
6,$9.99,$21.99,https://www.jollychic.com/p/unisex-sunglasses-gothic-steam-punk-metal-round-frame-accessory-g1441418.html,Unisex Sunglasses Gothic Steam Punk Metal Round Frame Accessory,Sunglasses/Eyewears
4,$30.99,,https://www.jollychic.com/p/women-s-sunglasses-personalized-cat-eye-design-fashion-all-match-accessory-g1461128.html,Women's Sunglasses Personalized Cat Eye Design Fashion All Match Accessory,Sunglasses/Eyewears
1,$24.99,,https://www.jollychic.com/p/women-s-sunglasses-irregular-frame-unique-fashion-eyewear-accessory-g1466302.html,Women's Sunglasses Irregular Frame Unique Fashion Eyewear Accessory,Sunglasses/Eyewears
9,$16.99,,https://www.jollychic.com/p/women-s-sunglasses-all-match-brief-design-top-fashion-casual-glasses-accessory-g1481300.html,Women's Sunglasses All Match Brief Design Top Fashion Casual Glasses Accessory,Sunglasses/Eyewears
0,$23.99,,https://www.jollychic.com/p/women-s-sunglasses-rhinestones-ornament-irregular-polygon-shape-fashion-stylish-accessory-g1482792.html,Women's Sunglasses Rhinestones Ornament Irregular Polygon Shape Fashion Stylish Accessory,Sunglasses/Eyewears
1,$9.99,$21.99,https://www.jollychic.com/p/women-s-sunglasses-fashion-round-cat-eye-fresh-style-glasses-accessory-g1484206.html,Women's Sunglasses Fashion Round Cat Eye Fresh Style Glasses Accessory,Sunglasses/Eyewears
7,$7.99,$19.99,https://www.jollychic.com/p/women-retro-round-alloy-frame-sunglasses-round-sunglasses-polarizes-g1487574.html,Women Retro Round Alloy Frame Sunglasses Round Sunglasses Polarizes,Sunglasses/Eyewears
2,$13.99,,https://www.jollychic.com/p/women-s-sunglasses-clear-frame-oversize-mirror-square-eyewear-uv-400-g1490716.html,Women's Sunglasses Clear Frame Oversize Mirror Square Eyewear UV 400,Sunglasses/Eyewears
2,$4.99,$17.99,https://www.jollychic.com/p/women-s-sunglasses-full-square-shape-frame-couple-polarized-sunglasses-g1492300.html,Women's Sunglasses Full Square Shape Frame Couple Polarized Sunglasses,Sunglasses/Eyewears
0,$38.99,,https://www.jollychic.com/p/colossein-women-s-sunglasses-retro-round-sunglasses-metal-frame-women-s-sunglasses-g1496374.html,COLOSSEIN Women's Sunglasses Retro Round Sunglasses Metal Frame Women's Sunglasses,Sunglasses/Eyewears
0,$33.99,,https://www.jollychic.com/p/colossein-women-s-sunglasses-classic-sunglasses-square-metal-frame-driving-women-s-sunglasses-g1496386.html,COLOSSEIN Women's Sunglasses Classic Sunglasses Square Metal Frame Driving Women's Sunglasses,Sunglasses/Eyewears
0,$29.99,$45.99,https://www.jollychic.com/p/colossein-women-s-sunglasses-fashion-sunglasses-women-square-frame-stylish-women-s-sunglasses-g1496388.html,COLOSSEIN Women's Sunglasses Fashion Sunglasses Women Square Frame Stylish Women's Sunglasses,Sunglasses/Eyewears
0,$26.99,$40.99,https://www.jollychic.com/p/colossein-women-sunglasses-orange-label-sports-sunglasses-fashion-women-sunglasses-g1496410.html,COLOSSEIN Women' Sunglasses Orange Label Sports Sunglasses Fashion Women' Sunglasses,Sunglasses/Eyewears
6,$16.99,$25.99,https://www.jollychic.com/p/women-s-eyeglasses-round-frame-thin-frame-preppy-style-all-match-glasses-accessory-g1497434.html,Women's Eyeglasses Round Frame Thin Frame Preppy Style All Match Glasses Accessory,Sunglasses/Eyewears
0,$9.99,$14.99,https://www.jollychic.com/p/unisex-sunglasses-vintage-cat-eye-stylish-resin-glasses-g1498500.html,Unisex Sunglasses Vintage Cat Eye Stylish Resin Glasses,Sunglasses/Eyewears
0,$11.99,$17.99,https://www.jollychic.com/p/pinglas-women-s-sunglasses-round-glasses-oversized-eyewear-women-s-sunglasses-g1500868.html,PINGLAS Women's Sunglasses Round Glasses Oversized Eyewear Women's Sunglasses,Sunglasses/Eyewears
5,$13.99,,https://www.jollychic.com/p/women-s-eyeglasses-round-frame-preppy-style-plain-faddish-eyewear-accessory-g1525542.html,Women's Eyeglasses Round Frame Preppy Style Plain Faddish Eyewear Accessory,Sunglasses/Eyewears
3,$16.99,$24.99,https://www.jollychic.com/p/women-s-sunglasses-heart-shaped-creative-all-match-faddish-eyewear-accessory-g1541946.html,Women's Sunglasses Heart Shaped Creative All Match Faddish Eyewear Accessory,Sunglasses/Eyewears
0,$11.99,$17.99,https://www.jollychic.com/p/women-s-sunglasses-square-frame-simple-style-trendy-polarized-sunglasses-accessory-g1542284.html,Women's Sunglasses Square Frame Simple Style Trendy Polarized Sunglasses Accessory,Sunglasses/Eyewears
0,$14.99,$22.99,https://www.jollychic.com/p/women-s-sunglasses-simple-vintage-style-all-match-cat-eye-sunglasses-accessory-g1542298.html,Women's Sunglasses Simple Vintage Style All Match Cat Eye Sunglasses Accessory,Sunglasses/Eyewears
5,$11.99,$17.99,https://www.jollychic.com/p/women-s-eyeglasses-metal-brief-design-casual-comfy-faddish-eyewear-accessory-g1542526.html,Women's Eyeglasses Metal Brief Design Casual Comfy Faddish Eyewear Accessory,Sunglasses/Eyewears
0,$6.99,$9.99,https://www.jollychic.com/p/women-s-sunglasses-cat-eye-half-frame-creative-all-match-eyewear-accessory-g1545242.html,Women's Sunglasses Cat Eye Half Frame Creative All Match Eyewear Accessory,Sunglasses/Eyewears
0,$35.99,,https://www.jollychic.com/p/colossein-women-s-sunglasses-square-frame-vintage-polarized-light-accessory-g1545742.html,COLOSSEIN Women's Sunglasses Square Frame Vintage Polarized Light Accessory,Sunglasses/Eyewears
1,$12.99,$17.99,https://www.jollychic.com/p/women-s-sunglasses-round-frame-transparent-all-match-ladylike-eyewear-accessory-g1568640.html,Women's Sunglasses Round Frame Transparent All Match Ladylike Eyewear Accessory,Sunglasses/Eyewears
1,$24.99,,https://www.jollychic.com/p/women-s-sunglasses-round-frame-ladylike-elegant-fashionable-eyewear-accessory-g1568646.html,Women's Sunglasses Round Frame Ladylike Elegant Fashionable Eyewear Accessory,Sunglasses/Eyewears
0,$11.99,$16.99,https://www.jollychic.com/p/women-s-sunglasses-faddish-pilot-polarized-coating-eyewear-driving-glasses-g1571566.html,Women's Sunglasses Faddish Pilot Polarized Coating Eyewear Driving Glasses,Sunglasses/Eyewears
