add_wish,discount_price,original_price,product_link,product_name,header_block
18,$65.00,$86.00,https://www.jollychic.com/p/women-s-evening-dress-solid-color-lace-up-v-neck-half-sleeve-elegant-dress-g1456800.html,Women's Evening Dress Solid Color Lace Up V Neck Half Sleeve Elegant Dress,Weddings & Events
7,$62.00,$82.00,https://www.jollychic.com/p/women-s-evening-dress-vintage-v-neck-short-sleeve-chiffon-aline-maxi-dress-g1465448.html,Women's Evening Dress Vintage V Neck Short Sleeve Chiffon Aline Maxi Dress,Weddings & Events
30,$82.00,$109.00,https://www.jollychic.com/p/women-s-evening-dress-solid-color-slash-neck-off-shoulder-half-sleeve-elegant-dress-g1492902.html,Women's Evening Dress Solid Color Slash Neck Off Shoulder Half Sleeve Elegant Dress,Weddings & Events
26,$63.00,$84.00,https://www.jollychic.com/p/women-s-bridesmaid-dress-solid-color-strapless-sweet-bow-belt-aline-short-dress-g1543548.html,Women's Bridesmaid Dress Solid Color Strapless Sweet Bow Belt Aline Short Dress,Weddings & Events
37,$106.25,$125.00,https://www.jollychic.com/p/women-s-evening-dress-solid-color-lace-up-turtle-neck-flare-sleeve-elegant-long-dress-g1574846.html,Women's Evening Dress Solid Color Lace Up Turtle Neck Flare Sleeve Elegant Long Dress,Weddings & Events
423,$27.99,$63.00,https://www.jollychic.com/p/patch-design-o-neck-plunging-back-a-line-dress-g88854.html,Patch Design O-Neck Plunging Back A-Line Dress,Weddings & Events
452,$44.99,$64.00,https://www.jollychic.com/p/women-s-chiffon-lace-patchwork-evening-dress-g388016.html,Women's Chiffon Lace Patchwork Evening Dress,Weddings & Events
361,$95.00,$158.00,https://www.jollychic.com/p/women-s-plus-size-rose-gold-v-neck-sequins-ruching-long-evening-dress-g391152.html,Women's Plus Size Rose Gold V Neck Sequins Ruching Long Evening Dress,Weddings & Events
263,$68.00,$91.00,https://www.jollychic.com/p/women-s-sleeveless-lace-mesh-patchwork-backless-short-prom-dress-g472046.html,Women's Sleeveless Lace Mesh Patchwork Backless Short Prom Dress,Weddings & Events
694,$17.99,$24.99,https://www.jollychic.com/p/women-s-capelet-solid-color-soft-warm-button-plush-faux-fur-capelet-g472454.html,Women's Capelet Solid Color Soft Warm Button Plush Faux-Fur Capelet,Weddings & Events
373,$100.00,$133.00,https://www.jollychic.com/p/women-s-evening-dress-sleeveless-flowers-appliques-long-evening-dress-g474188.html,Women's Evening Dress Sleeveless Flowers Appliques Long Evening Dress,Weddings & Events
372,$23.99,$35.99,https://www.jollychic.com/p/women-s-capelet-wedding-dress-lace-up-lace-hollow-out-ladylike-faux-fur-capelet-g484242.html,Women's Capelet Wedding Dress Lace-Up Lace Hollow Out Ladylike Faux-Fur Capelet,Weddings & Events
359,$28.99,$42.99,https://www.jollychic.com/p/women-s-capelet-wedding-dress-lace-flowers-hollow-out-ladylike-faux-fur-capelet-g484254.html,Women's Capelet Wedding Dress Lace Flowers Hollow Out Ladylike Faux-Fur Capelet,Weddings & Events
550,$52.00,$68.00,https://www.jollychic.com/p/women-s-evening-dress-lace-embroidery-sweet-sleeveless-long-evening-dress-g488956.html,Women's Evening Dress Lace Embroidery Sweet Sleeveless Long Evening Dress,Weddings & Events
359,$76.00,$102.00,https://www.jollychic.com/p/women-s-wedding-dress-sleeveless-lace-sequins-a-line-wedding-dress-g490510.html,Women's Wedding Dress Sleeveless Lace Sequins A Line Wedding Dress,Weddings & Events
186,$64.00,$84.00,https://www.jollychic.com/p/women-s-evening-dress-mesh-patchwork-lace-bow-sleeveless-long-evening-dress-g491918.html,Women's Evening Dress Mesh Patchwork Lace Bow Sleeveless Long Evening Dress,Weddings & Events
808,$76.00,$102.00,https://www.jollychic.com/p/women-s-plus-size-evening-dress-lace-appliques-ladylike-long-evening-dress-g493884.html,Women's Plus Size Evening Dress Lace Appliques Ladylike Long Evening Dress,Weddings & Events
223,$128.00,$163.00,https://www.jollychic.com/p/women-s-wedding-dress-lace-embroidery-mesh-strap-ladylike-long-wedding-dress-g494394.html,Women's Wedding Dress Lace Embroidery Mesh Strap Ladylike Long Wedding Dress,Weddings & Events
202,$128.00,$163.00,https://www.jollychic.com/p/women-s-wedding-dress-lace-flowers-appliques-tulle-long-train-wedding-dress-g494564.html,Women's Wedding Dress Lace Flowers Appliques Tulle Long Train Wedding Dress,Weddings & Events
368,$76.00,$96.00,https://www.jollychic.com/p/women-s-prom-dress-v-neck-hollow-out-bow-ladylike-homecoming-dress-g519922.html,Women's Prom Dress V Neck Hollow Out Bow Ladylike Homecoming Dress,Weddings & Events
99,$101.00,$126.00,https://www.jollychic.com/p/women-s-evening-dress-strapless-rhinestone-evening-dress-g521992.html,Women's Evening Dress Strapless Rhinestone Evening Dress,Weddings & Events
463,$110.00,$143.00,https://www.jollychic.com/p/women-s-wedding-dress-long-v-neck-hollow-out-lace-wedding-dress-g537346.html,Women's Wedding Dress Long V-Neck Hollow Out Lace Wedding Dress,Weddings & Events
516,$36.99,$62.00,https://www.jollychic.com/p/women-s-evening-dress-bow-ruffles-polka-dot-sweet-patchwork-long-maxi-dress-g549912.html,Women's Evening Dress Bow Ruffles Polka Dot Sweet Patchwork Long Maxi Dress,Weddings & Events
615,$41.99,$81.00,https://www.jollychic.com/p/women-s-wedding-dress-lace-flower-embroidery-organza-patchwork-maxi-long-dress-g552978.html,Women's Wedding Dress Lace Flower Embroidery Organza Patchwork Maxi Long Dress,Weddings & Events
137,$114.00,$143.00,https://www.jollychic.com/p/women-s-wedding-dress-strapless-sequins-appliques-sweet-wedding-dress-g557700.html,Women's Wedding Dress Strapless Sequins Appliques Sweet Wedding Dress,Weddings & Events
94,$114.00,$148.00,https://www.jollychic.com/p/women-s-wedding-dress-floral-lace-half-sleeve-hollow-out-maxi-long-dress-g559492.html,Women's Wedding Dress Floral Lace Half Sleeve Hollow Out Maxi Long Dress,Weddings & Events
122,$63.00,$89.00,https://www.jollychic.com/p/women-s-wedding-dress-flower-appliques-strapless-floor-length-evening-dress-g573412.html,Women's Wedding Dress Flower Appliques Strapless Floor Length Evening Dress,Weddings & Events
131,$66.00,$89.00,https://www.jollychic.com/p/women-s-wedding-dress-strapless-bow-belt-floor-length-simple-maxi-dress-g573416.html,Women's Wedding Dress Strapless Bow Belt Floor Length Simple Maxi Dress,Weddings & Events
337,$15.99,$24.99,https://www.jollychic.com/p/women-s-dress-pannier-bustle-ball-gown-soft-yarn-short-mini-skirt-overskirt-g596608.html,Women's Dress Pannier Bustle Ball Gown Soft Yarn Short Mini Skirt Overskirt,Weddings & Events
52,$18.99,$24.99,https://www.jollychic.com/p/women-s-petticoat-3-layered-different-colours-tutu-vintage-underskirt-g596616.html,Women's Petticoat 3-Layered Different Colours Tutu Vintage Underskirt,Weddings & Events
552,$9.99,$13.99,https://www.jollychic.com/p/women-s-petticoat-white-3-hoop-floor-length-bridal-wedding-underskirt-g596618.html,Women's Petticoat White 3-Hoop Floor Length Bridal Wedding Underskirt,Weddings & Events
250,$18.99,$24.99,https://www.jollychic.com/p/women-s-wedding-dress-pannier-hoopless-ball-gown-floor-length-petticoat-slips-g596620.html,Women's Wedding Dress Pannier Hoopless Ball Gown Floor Length Petticoat Slips,Weddings & Events
185,$11.99,$18.99,https://www.jollychic.com/p/women-s-petticoat-gorgeous-trumpet-mermaid-bridal-crinoline-slips-underskirt-g596632.html,Women's Petticoat Gorgeous Trumpet Mermaid Bridal Crinoline Slips Underskirt,Weddings & Events
495,$14.99,$18.99,https://www.jollychic.com/p/women-s-dress-pannier-4-hoop-ball-gown-wedding-bridal-white-petticoat-g596638.html,Women's Dress Pannier 4-Hoop Ball Gown Wedding Bridal White Petticoat,Weddings & Events
337,$80.25,$107.00,https://www.jollychic.com/p/women-s-evening-dress-black-spaghetti-straps-mermaid-slim-elegant-maxi-dress-g603398.html,Women's Evening Dress Black Spaghetti Straps Mermaid Slim Elegant Maxi Dress,Weddings & Events
127,$63.00,$84.00,https://www.jollychic.com/p/women-s-wedding-dress-lace-flower-appliques-sleeveless-floor-length-maxi-dress-g609562.html,Women's Wedding Dress Lace Flower Appliques Sleeveless Floor Length Maxi Dress,Weddings & Events
81,$49.99,$63.00,https://www.jollychic.com/p/women-s-wedding-veil-lace-snowflake-appliques-trailing-long-bride-wedding-veil-g610026.html,Women's Wedding Veil Lace Snowflake Appliques Trailing Long Bride Wedding Veil,Weddings & Events
63,$70.00,$94.00,https://www.jollychic.com/p/women-s-evening-dress-sexy-lace-backless-sleeveless-high-waisted-aline-dress-g619452.html,Women's Evening Dress Sexy Lace Backless Sleeveless High-Waisted Aline Dress,Weddings & Events
372,$56.00,$83.00,https://www.jollychic.com/p/women-s-evening-dress-short-sleeve-deep-v-neck-lace-wedding-aline-dress-g619460.html,Women's Evening Dress Short Sleeve Deep V Neck Lace Wedding Aline Dress,Weddings & Events
225,$67.00,$88.00,https://www.jollychic.com/p/women-s-evening-dress-sexy-lace-half-sleeve-high-waisted-wedding-aline-dress-g619586.html,Women's Evening Dress Sexy Lace Half Sleeve High-Waisted Wedding Aline Dress,Weddings & Events
686,$38.99,$71.00,https://www.jollychic.com/p/women-s-evening-dress-sexy-backless-ruffles-solid-halter-neck-midi-aline-dress-g619592.html,Women's Evening Dress Sexy Backless Ruffles Solid Halter Neck Midi Aline Dress,Weddings & Events
96,$49.99,$68.00,https://www.jollychic.com/p/women-s-evening-dress-sexy-long-sleeve-crossover-high-waisted-solid-aline-dress-g619864.html,Women's Evening Dress Sexy Long Sleeve Crossover High-Waisted Solid Aline Dress,Weddings & Events
41,$43.40,$62.00,https://www.jollychic.com/p/women-s-evening-dress-sexy-lace-one-should-high-waisted-ruffles-maxi-aline-dress-g619874.html,Women's Evening Dress Sexy Lace One Should High-Waisted Ruffles Maxi Aline Dress,Weddings & Events
57,$91.00,$123.00,https://www.jollychic.com/p/women-s-toast-wedding-dress-one-shoulder-leopard-evening-aline-dress-g645412.html,Women's Toast Wedding Dress One Shoulder Leopard Evening Aline Dress,Weddings & Events
172,$78.00,$133.00,https://www.jollychic.com/p/women-s-evening-conference-host-dress-slim-sexy-buching-strapless-party-dress-g645416.html,Women's Evening Conference Host Dress Slim Sexy Buching Strapless Party dress,Weddings & Events
171,$8.99,$11.99,https://www.jollychic.com/p/women-s-pannier-2-hoop-elastic-steel-useful-ball-gown-petticoat-underskirt-g649746.html,Women's Pannier 2-Hoop Elastic Steel Useful Ball Gown Petticoat Underskirt,Weddings & Events
342,$76.00,$102.00,https://www.jollychic.com/p/women-s-cheongsam-white-floral-stand-collar-patchwork-aline-elegant-cheongsam-g665050.html,Women's Cheongsam White Floral Stand Collar Patchwork Aline Elegant Cheongsam,Weddings & Events
110,$63.00,$84.00,https://www.jollychic.com/p/women-s-cheongsam-stand-collar-classical-style-slim-short-elegant-cheongsam-g666616.html,Women's Cheongsam Stand Collar Classical Style Slim Short Elegant Cheongsam,Weddings & Events
266,$17.99,$23.99,https://www.jollychic.com/p/women-s-wraps-cape-floral-lace-strapless-white-graceful-wedding-dress-shawl-g667962.html,Women's Wraps Cape Floral Lace Strapless White Graceful Wedding Dress Shawl,Weddings & Events
216,$16.99,$21.99,https://www.jollychic.com/p/women-s-wraps-cape-tulle-flower-embroidery-lace-hem-wedding-dress-capelet-g667968.html,Women's Wraps Cape Tulle Flower Embroidery Lace Hem Wedding Dress Capelet,Weddings & Events
274,$15.99,$20.99,https://www.jollychic.com/p/women-s-wraps-cape-tulle-lace-floral-hem-white-visible-wedding-dress-capelet-g667970.html,Women's Wraps Cape Tulle Lace Floral Hem White Visible Wedding Dress Capelet,Weddings & Events
134,$16.99,$21.99,https://www.jollychic.com/p/women-s-wraps-cape-white-tulle-flower-appliques-graceful-wedding-dress-capelet-g667986.html,Women's Wraps Cape White Tulle Flower Appliques Graceful Wedding Dress Capelet,Weddings & Events
117,$69.99,$97.00,https://www.jollychic.com/p/flower-girl-dress-sleeveless-flower-lace-appliques-solid-aline-performing-dress-g683946.html,Flower Girl Dress Sleeveless Flower Lace Appliques Solid Aline Performing Dress,Weddings & Events
73,$60.00,$92.00,https://www.jollychic.com/p/flower-girl-dress-sleeveless-flower-v-neck-appliques-aline-performing-dress-g683952.html,Flower Girl Dress Sleeveless Flower V Neck Appliques Aline Performing Dress,Weddings & Events
85,$89.00,,https://www.jollychic.com/p/flower-girl-dress-sleeveless-flower-v-neck-bow-aline-performing-dress-g683962.html,Flower Girl Dress Sleeveless Flower V Neck Bow Aline Performing Dress,Weddings & Events
119,$76.00,,https://www.jollychic.com/p/flower-girl-dress-sleeveless-flower-sweet-aline-performing-princess-dress-g683970.html,Flower Girl Dress Sleeveless Flower Sweet Aline Performing Princess Dress,Weddings & Events
65,$44.99,$74.00,https://www.jollychic.com/p/flower-girl-dress-sleeveless-flower-red-bow-solid-aline-performing-dress-g683974.html,Flower Girl Dress Sleeveless Flower Red Bow Solid Aline Performing Dress,Weddings & Events
33,$75.00,$97.00,https://www.jollychic.com/p/women-s-prom-dress-lace-three-quarters-sleeve-rhinestones-homecoming-dress-g693064.html,Women's Prom Dress Lace Three Quarters Sleeve Rhinestones Homecoming Dress,Weddings & Events
42,$69.00,$89.00,https://www.jollychic.com/p/women-s-prom-dress-lace-peter-pan-collar-bow-belt-short-homecoming-dress-g693068.html,Women's Prom Dress Lace Peter Pan Collar Bow Belt Short Homecoming Dress,Weddings & Events
25,$69.00,$89.00,https://www.jollychic.com/p/women-s-prom-dress-lace-v-neck-sleeveless-bow-belt-short-homecoming-dress-g693070.html,Women's Prom Dress Lace V Neck Sleeveless Bow Belt Short Homecoming Dress,Weddings & Events
44,$145.60,$182.00,https://www.jollychic.com/p/women-s-wedding-dress-ruffles-sleeve-v-neck-sequins-ball-gown-maxi-dress-g704534.html,Women's Wedding Dress Ruffles Sleeve V Neck Sequins Ball Gown Maxi Dress,Weddings & Events
127,$87.00,$111.00,https://www.jollychic.com/p/women-s-prom-dress-flower-appliques-v-neck-sleeveless-sweet-bridesmaid-dress-g704616.html,Women's Prom Dress Flower Appliques V Neck Sleeveless Sweet Bridesmaid Dress,Weddings & Events
129,$67.00,$88.00,https://www.jollychic.com/p/women-s-prom-dress-sleeveless-bow-belt-cascading-short-sweet-homecoming-dress-g704636.html,Women's Prom Dress Sleeveless Bow Belt Cascading Short Sweet Homecoming Dress,Weddings & Events
694,$18.99,$25.99,https://www.jollychic.com/p/women-s-wedding-veil-flower-appliques-lace-cut-edge-nice-bride-wedding-veil-g713794.html,Women's Wedding Veil Flower Appliques Lace Cut Edge Nice Bride Wedding Veil,Weddings & Events
103,$67.00,$88.00,https://www.jollychic.com/p/women-s-wedding-veil-white-lace-floral-hem-trailing-long-nice-wedding-veil-g713802.html,Women's Wedding Veil White Lace Floral Hem Trailing Long Nice Wedding Veil,Weddings & Events
70,$69.00,$92.00,https://www.jollychic.com/p/women-s-prom-dress-short-sleeve-rhinestones-bateau-neck-bridesmaid-dress-g738164.html,Women's Prom Dress Short Sleeve Rhinestones Bateau Neck Bridesmaid Dress,Weddings & Events
67,$68.00,$90.00,https://www.jollychic.com/p/women-s-wedding-dress-lace-sequins-sleeveless-floor-length-ball-gown-maxi-dress-g765916.html,Women's Wedding Dress Lace Sequins Sleeveless Floor Length Ball Gown Maxi Dress,Weddings & Events
126,$49.99,$72.00,https://www.jollychic.com/p/women-s-evening-dress-elegant-flower-embroidery-v-neck-sleeve-maxi-dress-g810156.html,Women's Evening Dress Elegant Flower Embroidery V Neck Sleeve Maxi Dress,Weddings & Events
39,$60.00,$82.00,https://www.jollychic.com/p/women-s-evening-dress-ethnic-style-floral-v-neck-sleeveless-slim-maxi-dress-g831418.html,Women's Evening Dress Ethnic Style Floral V Neck Sleeveless Slim Maxi Dress,Weddings & Events
24,$48.99,$68.00,https://www.jollychic.com/p/women-s-evening-dress-blossoms-v-neck-half-sleeve-split-sexy-maxi-dress-g831420.html,Women's Evening Dress Blossoms V Neck Half Sleeve Split Sexy Maxi Dress,Weddings & Events
69,$47.99,$68.00,https://www.jollychic.com/p/women-s-evening-dress-solid-red-ruffles-short-sleeve-vintage-aline-maxi-dress-g835544.html,Women's Evening Dress Solid Red Ruffles Short Sleeve Vintage Aline Maxi Dress,Weddings & Events
64,$69.00,$92.00,https://www.jollychic.com/p/women-s-evening-dress-embroidery-v-neck-short-sleeve-sweet-maxi-long-dress-g835548.html,Women's Evening Dress Embroidery V Neck Short Sleeve Sweet Maxi Long Dress,Weddings & Events
132,$66.00,$89.00,https://www.jollychic.com/p/women-s-evening-dress-white-lace-floral-half-sleeve-aline-sweet-maxi-dress-g835550.html,Women's Evening Dress White Lace Floral Half Sleeve Aline Sweet Maxi Dress,Weddings & Events
151,$54.00,$72.00,https://www.jollychic.com/p/women-s-evening-dress-solid-color-halterneck-elegant-floor-length-maxi-dress-g858376.html,Women's Evening Dress Solid Color Halterneck Elegant Floor Length Maxi Dress,Weddings & Events
251,$24.99,$44.99,https://www.jollychic.com/p/women-s-evening-dress-solid-color-pleated-v-neck-side-split-elegant-maxi-dress-g871502.html,Women's Evening Dress Solid Color Pleated V Neck Side Split Elegant Maxi Dress,Weddings & Events
19,$46.99,$62.00,https://www.jollychic.com/p/women-s-prom-dress-striped-brief-fashion-short-sleeve-bowknot-cocktail-dress-g874758.html,Women's Prom Dress Striped Brief Fashion Short Sleeve Bowknot Cocktail Dress,Weddings & Events
107,$59.00,$76.00,https://www.jollychic.com/p/women-s-prom-dress-solid-color-floral-lace-hollow-out-sleeveless-cocktail-dress-g875032.html,Women's Prom Dress Solid Color Floral Lace Hollow Out Sleeveless Cocktail Dress,Weddings & Events
250,$43.99,$72.00,https://www.jollychic.com/p/women-s-prom-dress-floral-lace-ruffles-short-sleeve-slim-elegant-cocktail-dress-g875050.html,Women's Prom Dress Floral Lace Ruffles Short Sleeve Slim Elegant Cocktail Dress,Weddings & Events
82,$62.00,$81.00,https://www.jollychic.com/p/women-s-prom-dress-sweet-floral-sleeveless-aline-graceful-party-dress-g880570.html,Women's Prom Dress Sweet Floral Sleeveless Aline Graceful Party Dress,Weddings & Events
48,$38.99,$63.00,https://www.jollychic.com/p/women-s-evening-dress-red-patchwork-stand-collar-short-sleeve-slim-maxi-dress-g880578.html,Women's Evening Dress Red Patchwork Stand Collar Short Sleeve Slim Maxi Dress,Weddings & Events
35,$45.99,$61.00,https://www.jollychic.com/p/women-s-prom-dress-solid-color-asymmetry-straps-elegant-slim-cocktail-dress-g880590.html,Women's Prom Dress Solid Color Asymmetry Straps Elegant Slim Cocktail Dress,Weddings & Events
129,$44.99,$74.00,https://www.jollychic.com/p/women-s-evening-dress-solid-color-vintage-hollow-out-half-sleeve-maxi-dress-g881412.html,Women's Evening Dress Solid Color Vintage Hollow Out Half Sleeve Maxi Dress,Weddings & Events
248,$17.99,$26.99,https://www.jollychic.com/p/women-s-pannier-6-hoop-ball-gown-bridal-petticoat-underskirt-g912460.html,Women's Pannier 6-Hoop Ball Gown Bridal Petticoat Underskirt,Weddings & Events
52,$30.99,$37.99,https://www.jollychic.com/p/women-s-evening-dress-fashion-pure-color-elegant-long-sleeve-sheath-maxi-dress-g963598.html,Women's Evening Dress Fashion Pure Color Elegant Long Sleeve Sheath Maxi Dress,Weddings & Events
113,$61.00,$80.00,https://www.jollychic.com/p/women-s-prom-dress-brief-solid-color-elegant-off-shoulder-aline-cocktail-dress-g1044472.html,Women's Prom Dress Brief Solid Color Elegant Off Shoulder Aline Cocktail Dress,Weddings & Events
61,$60.00,$83.00,https://www.jollychic.com/p/women-s-evening-dress-sweet-floral-embroidery-split-neck-sleeveless-bridesmaid-dress-g1058420.html,Women's Evening Dress Sweet Floral Embroidery Split Neck Sleeveless Bridesmaid Dress,Weddings & Events
61,$63.00,$83.00,https://www.jollychic.com/p/women-s-evening-dress-flower-embroidery-sweet-off-shoulder-half-sleeve-maxi-dress-g1058544.html,Women's Evening Dress Flower Embroidery Sweet Off Shoulder Half Sleeve Maxi Dress,Weddings & Events
49,$61.00,$76.00,https://www.jollychic.com/p/women-s-evening-dress-sweet-solid-color-ruffles-spaghetti-straps-aline-maxi-dress-g1088330.html,Women's Evening Dress Sweet Solid Color Ruffles Spaghetti Straps Aline Maxi Dress,Weddings & Events
60,$65.00,$86.00,https://www.jollychic.com/p/women-s-evening-dress-floral-sweet-ruffles-spaghetti-straps-aline-maxi-dress-g1088332.html,Women's Evening Dress Floral Sweet Ruffles Spaghetti Straps Aline Maxi Dress,Weddings & Events
23,$136.00,$169.00,https://www.jollychic.com/p/women-s-wedding-dress-solid-color-lace-patchwork-backless-hollow-out-o-neck-elegant-cocktail-dress-g1145674.html,Women's Wedding Dress Solid Color Lace Patchwork Backless Hollow Out O Neck Elegant Cocktail Dress,Weddings & Events
28,$71.00,$87.00,https://www.jollychic.com/p/women-s-prom-dress-solid-color-elegant-floral-sleeveless-backless-cocktail-dress-g1176872.html,Women's Prom Dress Solid Color Elegant Floral Sleeveless Backless Cocktail Dress,Weddings & Events
87,$69.00,$106.00,https://www.jollychic.com/p/women-s-evening-dress-solid-color-sleeveless-long-maxi-elegant-cocktail-dress-g1191846.html,Women's Evening Dress Solid Color Sleeveless Long Maxi Elegant Cocktail Dress,Weddings & Events
26,$32.99,$42.99,https://www.jollychic.com/p/women-s-evening-dress-solid-color-rhinestone-decor-sleeveless-backless-sexy-cocktail-dress-g1191856.html,Women's Evening Dress Solid Color Rhinestone Decor Sleeveless Backless Sexy Cocktail Dress,Weddings & Events
44,$79.00,$106.00,https://www.jollychic.com/p/women-s-special-occasion-dress-floral-pattern-sleeveless-scoop-neck-cocktail-dress-g1209392.html,Women's Special Occasion Dress Floral Pattern Sleeveless Scoop Neck Cocktail Dress,Weddings & Events
22,$78.00,$97.00,https://www.jollychic.com/p/women-s-wedding-dress-solid-color-flower-pendant-off-shoulder-backless-elegant-dress-g1233782.html,Women's Wedding Dress Solid Color Flower Pendant Off Shoulder Backless Elegant Dress,Weddings & Events
24,$93.00,$124.00,https://www.jollychic.com/p/women-s-wedding-dress-solid-color-lace-tassel-decor-slash-neck-off-shoulder-elegant-dress-g1234358.html,Women's Wedding Dress Solid Color Lace Tassel Decor Slash Neck Off Shoulder Elegant Dress,Weddings & Events
39,$82.00,$107.00,https://www.jollychic.com/p/women-s-wedding-dress-simple-solid-color-pleated-ruffles-strapless-ball-gown-maxi-dress-g1314146.html,Women's Wedding Dress Simple Solid Color Pleated Ruffles Strapless Ball Gown Maxi Dress,Weddings & Events
87,$26.99,$34.99,https://www.jollychic.com/p/women-s-shawl-solid-color-v-neck-half-sleeve-thicken-elegant-wedding-accessory-g1404928.html,Women's Shawl Solid Color V Neck Half Sleeve Thicken Elegant Wedding Accessory,Weddings & Events
12,$29.99,$39.99,https://www.jollychic.com/p/women-s-bridal-veils-solid-color-lace-hem-decor-floor-length-sweet-wedding-accessory-g1404954.html,Women's Bridal Veils Solid Color Lace Hem Decor Floor Length Sweet Wedding Accessory,Weddings & Events
21,$48.99,$65.00,https://www.jollychic.com/p/women-s-bridal-veils-solid-color-lace-embroidery-floor-length-sweet-wedding-accessory-g1406768.html,Women's Bridal Veils Solid Color Lace Embroidery Floor Length Sweet Wedding Accessory,Weddings & Events
11,$20.99,$26.99,https://www.jollychic.com/p/women-s-bridal-veils-solid-color-lace-hem-decor-sweet-wedding-accessory-g1406846.html,Women's Bridal Veils Solid Color Lace Hem Decor Sweet Wedding Accessory,Weddings & Events
14,$22.99,$29.99,https://www.jollychic.com/p/women-s-shawl-solid-color-v-neck-half-sleeve-thicken-elegant-wedding-accessory-g1406862.html,Women's Shawl Solid Color V Neck Half Sleeve Thicken Elegant Wedding Accessory,Weddings & Events
12,$60.00,$79.00,https://www.jollychic.com/p/women-s-evening-dress-flower-embroidery-pattern-short-sleeve-slash-neck-bridesmaid-dresses-g1407010.html,Women's Evening Dress Flower Embroidery Pattern Short Sleeve Slash Neck Bridesmaid Dresses,Weddings & Events
12,$60.00,$79.00,https://www.jollychic.com/p/women-s-evening-dress-flower-embroidery-sleeveless-slash-neck-bridesmaid-dresses-g1407012.html,Women's Evening Dress Flower Embroidery Sleeveless Slash Neck Bridesmaid Dresses,Weddings & Events
17,$64.00,$84.00,https://www.jollychic.com/p/women-s-prom-dress-sweet-color-block-lace-peter-pan-collar-bow-hollow-out-back-party-dress-g1415110.html,Women's Prom Dress Sweet Color Block Lace Peter Pan Collar Bow Hollow Out Back Party Dress,Weddings & Events
31,$55.00,$73.00,https://www.jollychic.com/p/women-s-cocktail-dress-solid-color-elegant-one-shoulder-hollow-out-sexy-sheath-party-dress-g1445330.html,Women's Cocktail Dress Solid Color Elegant One Shoulder Hollow Out Sexy Sheath Party Dress,Weddings & Events
26,$59.00,$78.00,https://www.jollychic.com/p/women-s-cocktail-dress-solid-color-side-hollow-out-sleeveless-split-sexy-sheath-party-dress-g1446146.html,Women's Cocktail Dress Solid Color Side Hollow Out Sleeveless Split Sexy Sheath Party Dress,Weddings & Events
23,$51.00,$67.00,https://www.jollychic.com/p/women-s-cocktail-dress-solid-color-off-shoulder-package-hip-sexy-elegant-party-dress-g1447292.html,Women's Cocktail Dress Solid Color Off Shoulder Package Hip Sexy Elegant Party Dress,Weddings & Events
20,$51.00,$67.00,https://www.jollychic.com/p/women-s-cocktail-dress-elegant-solid-color-off-shoulder-side-split-sexy-sheath-dress-g1452834.html,Women's Cocktail Dress Elegant Solid Color Off Shoulder Side Split Sexy Sheath Dress,Weddings & Events
12,$59.00,$78.00,https://www.jollychic.com/p/women-s-cocktail-dress-fashion-solid-color-sexy-hollow-out-sleeveless-sheath-dress-g1453262.html,Women's Cocktail Dress Fashion Solid Color Sexy Hollow Out Sleeveless Sheath Dress,Weddings & Events
9,$52.00,$68.00,https://www.jollychic.com/p/women-s-cocktail-dress-solid-color-elegant-hollow-out-sleeveless-package-hip-sexy-dress-g1454348.html,Women's Cocktail Dress Solid Color Elegant Hollow Out Sleeveless Package Hip Sexy Dress,Weddings & Events
8,$54.00,$71.00,https://www.jollychic.com/p/women-s-evening-dress-vintage-floral-belt-off-shoulder-three-quarter-sleeve-maxi-dress-g1465452.html,Women's Evening Dress Vintage Floral Belt Off Shoulder Three Quarter Sleeve Maxi Dress,Weddings & Events
