add_wish,discount_price,original_price,product_link,product_name,header_block
4,$5.99,$16.99,https://www.jollychic.com/p/women-s-belt-solid-color-simple-style-all-match-retro-belt-accessory-g1321492.html,Women's Belt Solid Color Simple Style All Match Retro Belt Accessory,Belts
11,$10.99,$27.99,https://www.jollychic.com/p/women-s-corset-floral-embroidery-all-match-vintage-belt-accessory-g1323508.html,Women's Corset Floral Embroidery All Match Vintage Belt Accessory,Belts
3,$7.99,$26.99,https://www.jollychic.com/p/women-s-belt-solid-color-top-fashion-classic-design-belt-accessory-g1323516.html,Women's Belt Solid Color Top Fashion Classic Design Belt Accessory,Belts
10,$5.99,$16.99,https://www.jollychic.com/p/women-s-belt-patchwork-woven-design-retro-belt-accessory-g1323520.html,Women's Belt Patchwork Woven Design Retro Belt Accessory,Belts
5,$3.99,$11.99,https://www.jollychic.com/p/women-s-belt-elegant-all-matched-retro-style-fashionable-accessory-g1336886.html,Women's Belt Elegant All Matched Retro Style Fashionable Accessory,Belts
7,$9.99,,https://www.jollychic.com/p/women-s-chain-elegant-ladylike-rivet-decorative-faddish-accessory-g1376318.html,Women's Chain Elegant Ladylike Rivet Decorative Faddish Accessory,Belts
2,$25.99,,https://www.jollychic.com/p/women-s-belt-simple-chic-all-match-solid-color-cattlehide-thin-belt-accessory-g1402484.html,Women's Belt Simple Chic All Match Solid Color Cattlehide Thin Belt Accessory,Belts
4,$34.99,,https://www.jollychic.com/p/women-s-belt-chic-all-match-solid-color-cattlehide-pin-buckle-belt-accessory-g1402502.html,Women's Belt Chic All Match Solid Color Cattlehide Pin Buckle Belt Accessory,Belts
13,$19.99,,https://www.jollychic.com/p/women-s-jeans-belt-rhombus-pattern-retro-style-jeans-belt-accessory-g1447404.html,Women's Jeans Belt Rhombus Pattern Retro Style Jeans Belt Accessory,Belts
3,$13.99,,https://www.jollychic.com/p/women-s-corset-sweet-style-brief-solid-color-faddish-ladylike-accessory-g1452996.html,Women's Corset Sweet Style Brief Solid Color Faddish Ladylike Accessory,Belts
0,$10.99,,https://www.jollychic.com/p/women-s-belt-vintage-style-all-match-patchwork-faddish-accessory-g1455610.html,Women's Belt Vintage Style All Match Patchwork Faddish Accessory,Belts
7,$25.99,,https://www.jollychic.com/p/women-s-corset-patent-leather-wavy-shape-edge-wide-comfy-casual-accessory-g1484606.html,Women's Corset Patent Leather Wavy Shape Edge Wide Comfy Casual Accessory,Belts
5,$8.99,$18.99,https://www.jollychic.com/p/women-s-corset-lace-design-wide-comfy-ladylike-style-elastic-belt-accessory-g1484630.html,Women's Corset Lace Design Wide Comfy Ladylike Style Elastic Belt Accessory,Belts
1,$10.99,,https://www.jollychic.com/p/women-s-jean-belt-solid-color-bow-knot-decor-ladylike-sweet-accessory-g1484746.html,Women's Jean Belt Solid Color Bow Knot Decor Ladylike Sweet Accessory,Belts
5,$9.99,,https://www.jollychic.com/p/women-s-jean-belt-candy-color-simple-thin-ladylike-belt-accessory-g1484748.html,Women's Jean Belt Candy Color Simple Thin Ladylike Belt Accessory,Belts
12,$7.99,$21.99,https://www.jollychic.com/p/women-s-jeans-belt-all-match-floral-pattern-jeans-belt-g1486874.html,Women's Jeans Belt All Match Floral Pattern Jeans Belt,Belts
4,$4.99,$14.99,https://www.jollychic.com/p/women-s-belt-solid-color-classic-style-floral-embroidery-design-all-match-belt-accessory-g1491808.html,Women's Belt Solid Color Classic Style Floral Embroidery Design All Match Belt Accessory,Belts
3,$3.99,$14.99,https://www.jollychic.com/p/women-s-belt-rivet-decor-all-match-simple-style-top-fashion-classical-belt-accessory-g1491816.html,Women's Belt Rivet Decor All Match Simple Style Top Fashion Classical Belt Accessory,Belts
14,$14.99,$21.99,https://www.jollychic.com/p/women-s-jeans-belt-classic-all-match-chic-pin-buckle-belt-accessory-g1498122.html,Women's Jeans Belt Classic All Match Chic Pin Buckle Belt Accessory,Belts
15,$5.99,$17.99,https://www.jollychic.com/p/women-s-jeans-belt-rivet-solid-classic-fashionable-pin-chic-belt-accessory-g1498124.html,Women's Jeans Belt Rivet Solid Classic Fashionable Pin Chic Belt Accessory,Belts
12,$8.99,$22.99,https://www.jollychic.com/p/women-s-jeans-belt-leopard-print-patchwork-classic-top-fashion-belt-accessory-g1498126.html,Women's Jeans Belt Leopard Print Patchwork Classic Top Fashion Belt Accessory,Belts
12,$6.99,$25.99,https://www.jollychic.com/p/women-s-jeans-belt-all-match-star-pattern-stylish-jean-belt-g1548318.html,Women's Jeans Belt All Match Star Pattern Stylish Jean Belt,Belts
14,$22.99,$33.99,https://www.jollychic.com/p/3-pcs-women-s-jeans-belt-plain-style-all-match-thin-belt-g1548326.html,3 Pcs Women's Jeans Belt Plain Style All Match Thin Belt,Belts
5,$12.99,,https://www.jollychic.com/p/women-s-jeans-belt-vintage-all-match-comfy-simple-breathable-accessory-g1548584.html,Women's Jeans Belt Vintage All Match Comfy Simple Breathable Accessory,Belts
1,$8.99,$12.99,https://www.jollychic.com/p/women-s-jeans-belt-all-match-comfy-vintage-rivets-simple-breathable-accessory-g1548586.html,Women's Jeans Belt All Match Comfy Vintage Rivets Simple Breathable Accessory,Belts
10,$9.99,$25.99,https://www.jollychic.com/p/women-s-jeans-belt-rivets-decor-double-buckle-design-vintage-style-accessory-g1571948.html,Women's Jeans Belt Rivets Decor Double Buckle Design Vintage Style Accessory,Belts
