add_wish,discount_price,original_price,product_link,product_name,header_block
23,$21.99,,https://www.jollychic.com/p/women-s-wig-compound-color-long-personality-hair-synthetic-accessory-g798144.html,Women's Wig Compound Color Long Personality Hair Synthetic Accessory,Wigs
7,$60.00,,https://www.jollychic.com/p/women-s-wig-charming-short-mixed-color-straight-hair-accessory-g812218.html,Women's Wig Charming Short Mixed Color Straight Hair Accessory,Wigs
3,$60.00,,https://www.jollychic.com/p/women-s-wig-mixed-color-kinky-curly-short-pattern-human-hair-accessory-g813404.html,Women's Wig Mixed Color Kinky Curly Short Pattern Human Hair Accessory,Wigs
3,$111.00,,https://www.jollychic.com/p/women-s-wig-elegant-gold-medium-long-human-hair-accessory-g813408.html,Women's Wig Elegant Gold Medium Long Human Hair Accessory,Wigs
29,$39.99,$65.00,https://www.jollychic.com/p/women-s-wigs-chic-black-short-straight-fringed-human-hair-accessory-g827546.html,Women's Wigs Chic Black Short Straight Fringed Human Hair Accessory,Wigs
4,$82.00,$137.00,https://www.jollychic.com/p/women-s-wig-mature-multi-layer-long-wavy-human-hair-wig-accessory-g853154.html,Women's Wig Mature Multi Layer Long Wavy Human Hair Wig Accessory,Wigs
434,$18.99,$28.99,https://www.jollychic.com/p/women-s-wig-natural-sexy-fashion-black-long-straight-synthetic-hair-accessory-g886062.html,Women's Wig Natural Sexy Fashion Black Long Straight Synthetic Hair Accessory,Wigs
23,$93.99,$122.00,https://www.jollychic.com/p/women-s-wig-color-mixing-style-natural-long-straight-human-hair-accessory-g886074.html,Women's Wig Color Mixing Style Natural Long Straight Human Hair Accessory,Wigs
12,$21.99,,https://www.jollychic.com/p/women-s-wig-simple-style-straight-long-pattern-synthetic-hair-accessory-g940048.html,Women's Wig Simple Style Straight Long Pattern Synthetic Hair Accessory,Wigs
2,$118.00,,https://www.jollychic.com/p/women-s-wig-charming-middle-length-sideswept-bangs-black-human-hair-g964884.html,Women's Wig Charming Middle Length Sideswept Bangs Black Human Hair,Wigs
4,$61.00,,https://www.jollychic.com/p/women-s-wig-ladylike-side-fringe-short-straight-human-hair-accessory-g966758.html,Women's Wig Ladylike Side Fringe Short Straight Human Hair Accessory,Wigs
21,$56.00,,https://www.jollychic.com/p/women-s-wig-fashion-mixed-color-curly-short-pattern-human-hair-accessory-g993500.html,Women's Wig Fashion Mixed Color Curly Short Pattern Human Hair Accessory,Wigs
60,$56.00,,https://www.jollychic.com/p/women-s-wig-brief-style-solid-color-straight-short-human-hair-accessory-g1026426.html,Women's Wig Brief Style Solid Color Straight Short Human Hair Accessory,Wigs
10,$65.00,,https://www.jollychic.com/p/women-s-human-hair-wig-solid-color-simple-stylish-sleek-short-hair-wig-accessory-g1062358.html,Women's Human Hair Wig Solid Color Simple Stylish Sleek Short Hair Wig Accessory,Wigs
3,$13.99,$27.99,https://www.jollychic.com/p/women-s-hair-wig-long-straight-middle-part-synthetic-hair-wig-accessory-g1178254.html,Women's Hair Wig Long Straight Middle Part Synthetic Hair Wig Accessory,Wigs
2,$64.00,,https://www.jollychic.com/p/women-s-wig-fashion-personalized-straight-short-pattern-human-hair-accessory-g1186128.html,Women's Wig Fashion Personalized Straight Short Pattern Human Hair Accessory,Wigs
2,$72.00,,https://www.jollychic.com/p/women-s-wig-mixed-color-elegant-side-part-short-straight-human-hair-accessory-g1195198.html,Women's Wig Mixed Color Elegant Side Part Short Straight Human Hair Accessory,Wigs
4,$78.00,,https://www.jollychic.com/p/women-s-human-hair-wig-faddish-short-curly-fluffy-hair-accessory-g1195518.html,Women's Human Hair Wig Faddish Short Curly Fluffy Hair Accessory,Wigs
4,$33.99,,https://www.jollychic.com/p/women-s-wig-curly-brown-middle-part-long-hair-fashion-wig-g1214540.html,Women's Wig Curly Brown Middle Part Long Hair Fashion Wig,Wigs
13,$15.99,$30.99,https://www.jollychic.com/p/women-s-synthetic-hair-wig-short-curly-faddish-hair-accessory-g1229564.html,Women's Synthetic Hair Wig Short Curly Faddish Hair Accessory,Wigs
12,$16.99,$32.99,https://www.jollychic.com/p/women-s-synthetic-hair-wig-mixed-color-central-parting-long-curly-faddish-hair-accessory-g1229652.html,Women's Synthetic Hair Wig Mixed Color Central Parting Long Curly Faddish Hair Accessory,Wigs
2,$136.00,,https://www.jollychic.com/p/women-s-human-hair-wig-tilted-frisette-solid-color-straight-bob-hair-accessory-g1229902.html,Women's Human Hair Wig Tilted Frisette Solid Color Straight Bob Hair Accessory,Wigs
3,$62.00,,https://www.jollychic.com/p/human-hair-wig-oblique-fringe-short-straight-rear-curl-human-hair-wig-g1304514.html,Human Hair Wig Oblique Fringe Short Straight Rear Curl Human Hair Wig,Wigs
8,$36.99,,https://www.jollychic.com/p/women-s-synthetic-hair-wig-chic-curly-all-matched-elegant-hair-accessory-g1343278.html,Women's Synthetic Hair Wig Chic Curly All Matched Elegant Hair Accessory,Wigs
6,$22.99,$35.99,https://www.jollychic.com/p/women-s-hair-wig-synthetic-straight-short-middle-parted-personalized-hair-accessory-g1363094.html,Women's Hair Wig Synthetic Straight Short Middle Parted Personalized Hair Accessory,Wigs
5,$22.99,$36.99,https://www.jollychic.com/p/women-s-wig-synthetic-hair-short-curly-fluffy-enchanting-retro-style-hair-accessory-g1428436.html,Women's Wig Synthetic Hair Short Curly Fluffy Enchanting Retro Style Hair Accessory,Wigs
7,$14.99,$41.99,https://www.jollychic.com/p/women-s-synthetic-hair-wig-black-long-straight-hair-stylish-elegant-hair-accessory-g1429604.html,Women's Synthetic Hair Wig Black Long Straight Hair Stylish Elegant Hair Accessory,Wigs
13,$37.99,,https://www.jollychic.com/p/women-s-synthetic-hair-wig-straight-side-part-gradient-deep-red-short-wig-accessory-g1432400.html,Women's Synthetic Hair Wig Straight Side Part Gradient Deep Red Short Wig Accessory,Wigs
8,$12.99,$24.99,https://www.jollychic.com/p/women-s-wig-ponytail-long-wave-elegant-solid-color-chic-hair-accessory-g1471176.html,Women's Wig Ponytail Long Wave Elegant Solid Color Chic Hair Accessory,Wigs
191,$15.99,$24.99,https://www.jollychic.com/p/black-nice-straight-style-womens-party-wig-g92722.html,Black Nice Straight Style Womens Party Wig,Wigs
832,$7.99,$15.99,https://www.jollychic.com/p/bob-style-shoulder-length-mix-dyeing-women-s-wig-g145047.html,Bob Style Shoulder Length Mix Dyeing Women's Wig,Wigs
786,$8.99,$30.99,https://www.jollychic.com/p/wavy-curly-grey-fluffy-fascinating-synthetic-women-s-long-wig-g314212.html,Wavy Curly Grey Fluffy Fascinating Synthetic Women's Long Wig,Wigs
254,$58.00,,https://www.jollychic.com/p/upscale-human-hair-cozy-touch-straight-women-s-wig-g385996.html,Upscale Human Hair Cozy Touch Straight Women's Wig,Wigs
367,$33.99,,https://www.jollychic.com/p/exaggerated-sterling-human-hair-kinky-curly-women-s-wig-g388720.html,Exaggerated Sterling Human Hair Kinky Curly Women's Wig,Wigs
15,$148.00,,https://www.jollychic.com/p/women-s-wig-trendy-exquisite-long-wavy-fringe-hair-replacement-loose-wig-g458626.html,Women's Wig Trendy Exquisite Long Wavy Fringe Hair Replacement Loose Wig,Wigs
364,$3.99,$5.99,https://www.jollychic.com/p/women-s-wig-nifty-cute-bohemian-style-ponytail-hair-extension-g505490.html,Women's Wig Nifty Cute Bohemian Style Ponytail Hair Extension,Wigs
12,$144.00,,https://www.jollychic.com/p/women-s-wig-elegant-classic-black-flowing-long-straight-human-hair-g518096.html,Women's Wig Elegant Classic Black Flowing Long Straight Human Hair,Wigs
36,$144.00,,https://www.jollychic.com/p/women-s-wig-natural-black-long-human-hair-accessory-g519350.html,Women's Wig Natural Black Long Human Hair Accessory,Wigs
17,$129.00,,https://www.jollychic.com/p/women-s-wig-blunt-cut-bangs-mixed-color-personalized-human-hair-accessory-g522846.html,Women's Wig Blunt Cut Bangs Mixed Color Personalized Human Hair Accessory,Wigs
4,$69.00,,https://www.jollychic.com/p/women-s-wig-ritzy-winsome-short-hairstyle-human-hair-accessory-g524132.html,Women's Wig Ritzy Winsome Short Hairstyle Human Hair Accessory,Wigs
8,$69.00,,https://www.jollychic.com/p/women-s-wig-natural-sideswept-bangs-short-human-hair-accessory-g524138.html,Women's Wig Natural Sideswept Bangs Short Human Hair Accessory,Wigs
13,$134.00,,https://www.jollychic.com/p/women-s-wig-personalized-gradient-color-curly-human-hair-accessory-g526022.html,Women's Wig Personalized Gradient Color Curly Human Hair Accessory,Wigs
2,$69.00,,https://www.jollychic.com/p/women-s-wig-trendy-loose-short-curly-fringe-human-hair-accessory-g528260.html,Women's Wig Trendy Loose Short Curly Fringe Human Hair Accessory,Wigs
6,$66.00,,https://www.jollychic.com/p/women-s-wig-fresh-style-short-straight-fringe-brief-human-hair-accessory-g528266.html,Women's Wig Fresh Style Short Straight Fringe Brief Human Hair Accessory,Wigs
3,$79.00,,https://www.jollychic.com/p/women-s-wig-stylish-maroon-color-personality-short-curly-human-hair-accessory-g528440.html,Women's Wig Stylish Maroon Color Personality Short Curly Human Hair Accessory,Wigs
8,$99.00,,https://www.jollychic.com/p/women-s-wig-lovely-smooth-short-bobo-style-straight-human-hair-accessory-g528446.html,Women's Wig Lovely Smooth Short BoBo Style Straight Human Hair Accessory,Wigs
7,$79.00,,https://www.jollychic.com/p/women-s-wig-fashion-natural-short-fringe-human-hair-charming-accessory-g528462.html,Women's Wig Fashion Natural Short Fringe Human Hair Charming Accessory,Wigs
35,$98.00,$144.00,https://www.jollychic.com/p/women-s-wig-slightly-curly-mature-attractive-long-human-hair-accessory-g536016.html,Women's Wig Slightly Curly Mature Attractive Long Human Hair Accessory,Wigs
1,$79.00,,https://www.jollychic.com/p/women-s-wig-sparkling-excellent-short-human-hair-replacement-accessory-g536114.html,Women's Wig Sparkling Excellent Short Human Hair Replacement Accessory,Wigs
7,$146.00,,https://www.jollychic.com/p/women-s-stylish-wig-sleek-gradient-long-curly-human-hair-accessory-g536444.html,Women's Stylish Wig Sleek Gradient Long Curly Human Hair Accessory,Wigs
15,$75.00,,https://www.jollychic.com/p/women-s-cool-wig-original-white-short-straight-human-hair-accessory-g536448.html,Women's Cool Wig Original White Short Straight Human Hair Accessory,Wigs
79,$65.00,,https://www.jollychic.com/p/women-s-wig-dynamic-enchanting-natural-short-human-hair-accessory-g540100.html,Women's Wig Dynamic Enchanting Natural Short Human Hair Accessory,Wigs
38,$96.00,,https://www.jollychic.com/p/women-s-wig-vogue-bobo-style-smooth-preppy-human-hair-accessory-g540134.html,Women's Wig Vogue BOBO Style Smooth Preppy Human Hair Accessory,Wigs
15,$111.00,,https://www.jollychic.com/p/women-s-wig-lovely-short-fringe-bobo-style-human-hair-accessory-g540140.html,Women's Wig Lovely Short Fringe BOBO Style Human Hair Accessory,Wigs
32,$42.99,$66.00,https://www.jollychic.com/p/women-s-wig-classic-black-loose-human-hair-replacement-accessory-g554698.html,Women's Wig Classic Black Loose Human Hair Replacement Accessory,Wigs
90,$16.99,$24.99,https://www.jollychic.com/p/women-s-wig-stylish-black-short-side-fringe-synthetic-hair-accessory-g555320.html,Women's Wig Stylish Black Short Side Fringe Synthetic Hair Accessory,Wigs
25,$184.00,,https://www.jollychic.com/p/women-s-wig-trendy-loose-all-wavy-human-hair-accessory-g555328.html,Women's Wig Trendy Loose All Wavy Human Hair Accessory,Wigs
10,$142.00,,https://www.jollychic.com/p/women-s-wig-stylish-long-curly-side-fringe-charming-human-hair-accessory-g555638.html,Women's Wig Stylish Long Curly Side Fringe Charming Human Hair Accessory,Wigs
91,$39.99,$66.00,https://www.jollychic.com/p/women-s-wig-exquisite-short-curly-side-fringe-human-hair-accessory-g557478.html,Women's Wig Exquisite Short Curly Side Fringe Human Hair Accessory,Wigs
13,$66.00,,https://www.jollychic.com/p/women-s-wig-exquisite-short-side-fringe-loose-human-hair-accessory-g557492.html,Women's Wig Exquisite Short Side Fringe Loose Human Hair Accessory,Wigs
62,$45.99,$76.00,https://www.jollychic.com/p/women-s-wig-exquisite-short-kinky-loose-human-hair-personality-accessory-g557502.html,Women's Wig Exquisite Short Kinky Loose Human Hair Personality Accessory,Wigs
12,$131.00,,https://www.jollychic.com/p/women-s-wig-ol-style-sideswept-bangs-bob-haircut-style-shimmering-accessory-g558588.html,Women's Wig OL Style Sideswept Bangs Bob Haircut Style Shimmering Accessory,Wigs
4,$85.00,$142.00,https://www.jollychic.com/p/women-s-wig-blunt-cut-bangs-black-modern-brief-style-slightly-curly-human-hair-accessory-g564606.html,Women's Wig Blunt Cut Bangs Black Modern Brief Style Slightly Curly Human Hair Accessory,Wigs
5,$130.00,,https://www.jollychic.com/p/women-s-wig-lovely-swish-gentle-black-blunt-cut-bangs-human-hair-accessory-g580204.html,Women's Wig Lovely Swish Gentle Black Blunt Cut Bangs Human Hair Accessory,Wigs
13,$65.00,,https://www.jollychic.com/p/women-s-wig-ol-style-short-fringe-loose-exquisite-human-hair-accessory-g597414.html,Women's Wig OL Style Short Fringe Loose Exquisite Human Hair Accessory,Wigs
41,$76.00,,https://www.jollychic.com/p/women-s-wig-faddish-short-straight-human-hair-wigs-accessory-g598118.html,Women's Wig Faddish Short Straight Human Hair Wigs Accessory,Wigs
27,$106.00,,https://www.jollychic.com/p/women-s-wig-adorable-gradient-color-side-fringe-curly-human-hair-accessory-g599142.html,Women's Wig Adorable Gradient Color Side Fringe Curly Human Hair Accessory,Wigs
19,$76.00,,https://www.jollychic.com/p/women-s-wig-faddish-side-fringe-smooth-natural-human-hair-accessory-g599164.html,Women's Wig Faddish Side Fringe Smooth Natural Human Hair Accessory,Wigs
3,$105.00,,https://www.jollychic.com/p/women-s-wig-adorable-bobo-style-side-fringe-smooth-human-hair-accessory-g601436.html,Women's Wig Adorable BOBO Style Side Fringe Smooth Human Hair Accessory,Wigs
4,$65.00,,https://www.jollychic.com/p/women-s-wig-exquisite-side-fringe-loose-kinky-human-hair-accessory-g601440.html,Women's Wig Exquisite Side Fringe Loose Kinky Human Hair Accessory,Wigs
11,$12.99,$22.99,https://www.jollychic.com/p/women-s-wig-exquisite-color-mixed-natural-synthetic-hair-accessory-g601448.html,Women's Wig Exquisite Color Mixed Natural Synthetic Hair Accessory,Wigs
48,$71.00,,https://www.jollychic.com/p/women-s-wig-sleek-sideswept-bangs-short-human-hair-wig-g616106.html,Women's Wig Sleek Sideswept Bangs Short Human Hair Wig,Wigs
4,$12.99,$24.99,https://www.jollychic.com/p/women-s-short-wig-chic-deep-brown-middle-parting-curly-human-wig-g618790.html,Women's Short Wig Chic Deep Brown Middle Parting Curly Human Wig,Wigs
8,$146.00,,https://www.jollychic.com/p/women-s-long-wig-groovy-winsome-big-water-ripple-design-hair-accessory-g619020.html,Women's Long Wig Groovy Winsome Big Water Ripple Design Hair Accessory,Wigs
25,$100.00,,https://www.jollychic.com/p/women-s-wig-popular-lovely-natural-bob-hairstyle-inclined-bang-hair-accessory-g619032.html,Women's Wig Popular Lovely Natural Bob Hairstyle Inclined Bang Hair Accessory,Wigs
12,$24.99,,https://www.jollychic.com/p/women-s-wig-simple-blended-colors-loose-soft-short-hairstyle-accessory-g620082.html,Women's Wig Simple Blended Colors Loose Soft Short Hairstyle Accessory,Wigs
28,$16.99,$27.99,https://www.jollychic.com/p/women-s-long-wig-natural-smooth-central-parting-bang-hair-replacement-g620530.html,Women's Long Wig Natural Smooth Central Parting Bang Hair Replacement,Wigs
6,$76.00,,https://www.jollychic.com/p/women-s-wig-fashion-personalied-short-straight-sided-bang-hair-accessory-g621218.html,Women's Wig Fashion Personalied Short Straight Sided Bang Hair Accessory,Wigs
20,$142.00,,https://www.jollychic.com/p/women-s-wig-winsome-graceful-long-straight-black-hair-replacement-g621226.html,Women's Wig Winsome Graceful Long Straight Black Hair Replacement,Wigs
4,$76.00,,https://www.jollychic.com/p/women-s-wig-short-shiny-silvery-white-human-hair-wig-g621242.html,Women's Wig Short Shiny Silvery White Human Hair Wig,Wigs
13,$142.00,,https://www.jollychic.com/p/women-s-wig-trendy-smooth-gold-color-inclined-bang-long-curly-hair-wig-g621682.html,Women's Wig Trendy Smooth Gold Color Inclined Bang Long Curly Hair Wig,Wigs
22,$65.00,$96.00,https://www.jollychic.com/p/women-s-wig-fashion-nifty-winsome-natural-bob-hairstyle-human-hair-wig-g627606.html,Women's Wig Fashion Nifty Winsome Natural Bob Hairstyle Human Hair Wig,Wigs
35,$85.00,$142.00,https://www.jollychic.com/p/women-s-wig-brief-style-flowing-long-straight-black-human-hair-wig-g627636.html,Women's Wig Brief Style Flowing Long Straight Black Human Hair Wig,Wigs
2,$96.00,,https://www.jollychic.com/p/women-s-wig-elegant-floppy-sleek-short-human-hair-accessory-g632142.html,Women's Wig Elegant Floppy Sleek Short Human Hair Accessory,Wigs
114,$24.99,,https://www.jollychic.com/p/women-s-wig-dark-red-long-straight-synthetic-hair-accessory-g632332.html,Women's Wig Dark Red Long Straight Synthetic Hair Accessory,Wigs
41,$65.00,,https://www.jollychic.com/p/women-s-wig-black-vogue-tilted-frisette-straight-short-human-hair-accessory-g639210.html,Women's Wig Black Vogue Tilted Frisette Straight Short Human Hair Accessory,Wigs
4,$65.00,,https://www.jollychic.com/p/women-s-wig-black-chic-tilted-frisette-straight-short-human-hair-accessory-g639232.html,Women's Wig Black Chic Tilted Frisette Straight Short Human Hair Accessory,Wigs
9,$65.00,,https://www.jollychic.com/p/women-s-wig-multi-color-bang-shiny-natural-straight-short-human-hair-accessory-g647622.html,Women's Wig Multi Color Bang Shiny Natural Straight Short Human Hair Accessory,Wigs
2,$106.00,,https://www.jollychic.com/p/women-s-wig-side-part-short-straight-human-hair-wig-accessory-g647676.html,Women's Wig Side Part Short Straight Human Hair Wig Accessory,Wigs
10,$44.99,,https://www.jollychic.com/p/women-s-wig-mix-color-tilted-frisette-straight-short-human-hair-accessory-g651492.html,Women's Wig Mix Color Tilted frisette Straight Short Human Hair Accessory,Wigs
15,$38.99,$60.00,https://www.jollychic.com/p/women-s-wig-stylish-shiny-tilted-frisette-straight-short-human-hair-accessory-g653764.html,Women's Wig Stylish Shiny Tilted Frisette Straight Short Human Hair Accessory,Wigs
21,$142.00,,https://www.jollychic.com/p/women-s-wig-voguish-natural-tilted-frisette-curly-long-human-hair-accessory-g653768.html,Women's Wig Voguish Natural Tilted Frisette Curly Long Human Hair Accessory,Wigs
4,$43.99,,https://www.jollychic.com/p/women-s-wig-mix-color-tilted-frisette-straight-short-human-hair-accessory-g653776.html,Women's Wig Mix Color Tilted Frisette Straight Short Human Hair Accessory,Wigs
88,$26.99,$40.99,https://www.jollychic.com/p/women-s-wig-black-elegance-tilted-frisette-straight-short-human-hair-accessory-g653800.html,Women's Wig Black Elegance Tilted Frisette Straight Short Human Hair Accessory,Wigs
23,$79.00,,https://www.jollychic.com/p/women-s-wig-human-hair-wig-side-part-short-fluffy-wig-g655542.html,Women's Wig Human Hair Wig Side Part Short Fluffy Wig,Wigs
2,$67.00,,https://www.jollychic.com/p/women-s-wig-solid-color-fluffy-side-part-human-hair-wig-g658858.html,Women's Wig Solid Color Fluffy Side Part Human Hair Wig,Wigs
7,$146.00,,https://www.jollychic.com/p/women-s-wig-voguish-shiny-tilted-frisette-curly-long-human-hair-accessory-g665344.html,Women's Wig Voguish Shiny Tilted Frisette Curly Long Human Hair Accessory,Wigs
3,$73.00,,https://www.jollychic.com/p/women-s-wig-wine-red-tilted-frisette-curly-short-human-hair-accessory-g665480.html,Women's Wig Wine Red Tilted Frisette Curly Short Human Hair Accessory,Wigs
39,$29.99,,https://www.jollychic.com/p/women-s-wig-mid-split-black-shiny-straight-long-synthetic-hair-accessory-g676226.html,Women's Wig Mid Split Black Shiny Straight Long Synthetic Hair Accessory,Wigs
10,$33.99,$54.00,https://www.jollychic.com/p/women-s-wig-short-layers-side-bangs-blonde-human-hair-attractive-accessory-g676646.html,Women's Wig Short Layers Side Bangs Blonde Human Hair Attractive Accessory,Wigs
1,$59.00,,https://www.jollychic.com/p/women-s-wig-short-air-bangs-loose-blonde-human-hair-trendy-accessory-g676958.html,Women's Wig Short Air Bangs Loose Blonde Human Hair Trendy Accessory,Wigs
216,$16.99,$24.99,https://www.jollychic.com/p/women-s-wig-compound-color-natural-lace-short-curly-hair-synthetic-accessory-g678406.html,Women's Wig Compound Color Natural Lace Short Curly Hair Synthetic Accessory,Wigs
1,$54.00,,https://www.jollychic.com/p/women-s-wig-short-straight-human-hair-accessory-g678664.html,Women's Wig Short Straight Human Hair Accessory,Wigs
9,$73.00,,https://www.jollychic.com/p/women-s-wig-graceful-short-tilted-frisette-vogue-human-hair-accessory-g689442.html,Women's Wig Graceful Short Tilted Frisette Vogue Human Hair Accessory,Wigs
10,$69.00,,https://www.jollychic.com/p/women-s-wig-trendy-tilted-frisette-short-straight-human-hair-accessory-g689482.html,Women's Wig Trendy Tilted Frisette Short Straight Human Hair Accessory,Wigs
6,$115.00,,https://www.jollychic.com/p/women-s-wig-tilted-frisette-long-straight-human-hair-accessory-g689484.html,Women's Wig Tilted Frisette Long Straight Human Hair Accessory,Wigs
10,$84.00,,https://www.jollychic.com/p/women-s-wig-graceful-tilted-frisette-short-straight-human-hair-accessory-g689640.html,Women's Wig Graceful Tilted Frisette Short Straight Human Hair Accessory,Wigs
1,$87.00,,https://www.jollychic.com/p/women-s-wig-graceful-tilted-frisette-short-curly-human-hair-accessory-g689644.html,Women's Wig Graceful Tilted Frisette Short Curly Human Hair Accessory,Wigs
10,$135.00,,https://www.jollychic.com/p/women-s-wig-graceful-tilted-frisette-long-human-hair-accessory-g689732.html,Women's Wig Graceful Tilted Frisette Long Human Hair Accessory,Wigs
18,$59.00,,https://www.jollychic.com/p/women-s-wig-short-straight-hair-tilted-frisette-human-hair-accessory-g689748.html,Women's Wig Short Straight Hair Tilted Frisette Human Hair Accessory,Wigs
15,$19.99,$29.99,https://www.jollychic.com/p/women-s-wig-black-african-style-long-curly-synthetic-hair-accessory-g697100.html,Women's Wig Black African Style Long Curly Synthetic Hair Accessory,Wigs
8,$60.00,,https://www.jollychic.com/p/women-s-wig-brown-slanting-bang-short-straight-human-hair-accessory-g701998.html,Women's Wig Brown Slanting Bang Short Straight Human Hair Accessory,Wigs
12,$64.00,$108.00,https://www.jollychic.com/p/women-s-wig-26-inch-gradient-color-long-curly-synthetic-hair-accessory-g724138.html,Women's Wig 26 Inch Gradient Color Long Curly Synthetic Hair Accessory,Wigs
32,$137.00,,https://www.jollychic.com/p/women-s-wig-trendy-long-curly-hair-compound-color-human-hair-accessory-g727706.html,Women's Wig Trendy Long Curly Hair Compound Color Human Hair Accessory,Wigs
4,$61.00,,https://www.jollychic.com/p/women-s-wig-blonde-curly-short-side-bangs-human-hair-accessory-g744532.html,Women's Wig Blonde Curly Short Side Bangs Human Hair Accessory,Wigs
2,$64.00,,https://www.jollychic.com/p/women-s-wig-elegant-gradient-side-bangs-curly-short-human-hair-accessory-g755270.html,Women's Wig Elegant Gradient Side Bangs Curly Short Human Hair Accessory,Wigs
11,$69.00,,https://www.jollychic.com/p/women-s-wig-elegant-side-bangs-short-human-hair-wig-accessory-g755278.html,Women's Wig Elegant Side Bangs Short Human Hair Wig Accessory,Wigs
3,$115.00,,https://www.jollychic.com/p/women-s-wig-gradient-curly-mid-length-side-bangs-human-hair-accessory-g755284.html,Women's Wig Gradient Curly Mid Length Side Bangs Human Hair Accessory,Wigs
63,$51.00,,https://www.jollychic.com/p/women-s-wig-color-block-long-straight-fashion-hair-synthetic-accessory-g798142.html,Women's Wig Color Block Long Straight Fashion Hair Synthetic Accessory,Wigs
6,$62.00,,https://www.jollychic.com/p/women-s-wig-simple-style-dark-mixed-color-natural-short-hair-accessory-g812210.html,Women's Wig Simple Style Dark Mixed Color Natural Short Hair Accessory,Wigs
8,$56.00,,https://www.jollychic.com/p/women-s-wigs-faddish-side-fringe-short-straight-human-hair-accessory-g818254.html,Women's Wigs Faddish Side Fringe Short Straight Human Hair Accessory,Wigs
13,$56.00,,https://www.jollychic.com/p/women-s-wigs-trendy-tilted-frisette-short-straight-human-hair-accessory-g818256.html,Women's Wigs Trendy Tilted Frisette Short Straight Human Hair Accessory,Wigs
13,$77.00,,https://www.jollychic.com/p/women-s-wigs-graceful-tilted-frisette-straight-human-hair-accessory-g818454.html,Women's Wigs Graceful Tilted Frisette Straight Human Hair Accessory,Wigs
5,$35.99,$56.00,https://www.jollychic.com/p/women-s-wig-graceful-trendy-side-parting-fluffy-short-straight-hair-accessory-g894978.html,Women's Wig Graceful Trendy Side Parting Fluffy Short Straight Hair Accessory,Wigs
37,$18.99,$28.99,https://www.jollychic.com/p/women-s-wig-black-long-charming-fashion-hair-synthetic-accessory-g960534.html,Women's Wig Black Long Charming Fashion Hair Synthetic Accessory,Wigs
7,$24.99,,https://www.jollychic.com/p/women-s-wig-long-curly-faddish-black-hair-synthetic-accessory-g966776.html,Women's Wig Long Curly Faddish Black Hair Synthetic Accessory,Wigs
13,$138.00,,https://www.jollychic.com/p/women-s-wig-trendy-straight-long-pattern-all-match-human-hair-accessory-g978320.html,Women's Wig Trendy Straight Long Pattern All Match Human Hair Accessory,Wigs
81,$23.99,,https://www.jollychic.com/p/women-s-wig-side-part-short-curl-shaggy-faddish-ladylike-wig-accessory-g1015660.html,Women's Wig Side Part Short Curl Shaggy Faddish Ladylike Wig Accessory,Wigs
8,$65.00,,https://www.jollychic.com/p/women-s-wig-fashionable-brief-style-short-pattern-charming-human-hair-accessory-g1064498.html,Women's Wig Fashionable Brief Style Short Pattern Charming Human Hair Accessory,Wigs
5,$108.00,,https://www.jollychic.com/p/women-s-wig-vogue-gradient-color-blunt-bangs-midi-pattern-human-hair-accessory-g1064506.html,Women's Wig Vogue Gradient Color Blunt Bangs Midi Pattern Human Hair Accessory,Wigs
2,$67.00,,https://www.jollychic.com/p/women-s-wig-mixed-color-personalized-trendy-straight-short-pattern-accessory-g1186126.html,Women's Wig Mixed Color Personalized Trendy Straight Short Pattern Accessory,Wigs
