add_wish,discount_price,original_price,product_link,product_name,header_block
252,$5.99,,https://www.jollychic.com/p/women-s-belt-romantic-2-flowers-decoration-different-color-sweet-belt-g665476.html,Women's Belt Romantic 2 Flowers Decoration Different Color Sweet Belt,Belts
191,$7.99,$15.99,https://www.jollychic.com/p/women-s-belt-rivet-decorative-faux-leather-waist-belt-punk-style-accessory-g724638.html,Women's Belt Rivet Decorative Faux Leather Waist Belt Punk Style Accessory,Belts
91,$4.99,$13.99,https://www.jollychic.com/p/women-s-belts-stylish-jeans-belt-rhinestones-decor-waist-belt-accessory-g758252.html,Women's Belts Stylish Jeans Belt Rhinestones Decor Waist Belt Accessory,Belts
86,$4.99,$14.99,https://www.jollychic.com/p/women-s-belts-rhinestones-decor-all-match-cinch-belts-accessory-g758274.html,Women's Belts Rhinestones Decor All Match Cinch Belts Accessory,Belts
99,$2.99,$13.99,https://www.jollychic.com/p/women-s-belts-stylish-metallic-plate-style-buckle-thin-waist-belt-accessory-g758960.html,Women's Belts Stylish Metallic Plate Style Buckle Thin Waist Belt Accessory,Belts
249,$4.99,$13.99,https://www.jollychic.com/p/women-s-belts-unique-belt-joint-design-ladylike-belts-accessory-g759146.html,Women's Belts Unique Belt Joint Design Ladylike Belts Accessory,Belts
60,$2.99,$13.99,https://www.jollychic.com/p/women-s-belts-stylish-elastic-wide-cinch-belt-accessory-g759348.html,Women's Belts Stylish Elastic Wide Cinch Belt Accessory,Belts
140,$6.99,$20.99,https://www.jollychic.com/p/women-s-belts-stylish-metallic-chain-belt-bow-knot-ornament-cinch-belt-accessory-g759714.html,Women's Belts Stylish Metallic Chain Belt Bow Knot Ornament Cinch Belt Accessory,Belts
105,$6.99,$17.99,https://www.jollychic.com/p/women-s-belts-elastic-pu-all-match-cinch-belt-accessory-g759722.html,Women's Belts Elastic PU All Match Cinch Belt Accessory,Belts
56,$5.99,$15.99,https://www.jollychic.com/p/women-s-belts-wide-stylish-metallic-ornament-cinch-belt-accessory-g759742.html,Women's Belts Wide Stylish Metallic Ornament Cinch Belt Accessory,Belts
80,$3.99,$11.99,https://www.jollychic.com/p/women-s-waist-chain-alloy-tassel-punk-style-vintage-charming-accessory-g776664.html,Women's Waist Chain Alloy Tassel Punk Style Vintage Charming Accessory,Belts
40,$4.99,$10.99,https://www.jollychic.com/p/women-s-belts-casual-all-matched-trendy-belt-accessory-g929682.html,Women 's Belts Casual All Matched Trendy Belt Accessory,Belts
26,$4.99,$10.99,https://www.jollychic.com/p/women-s-belt-fashion-all-match-simple-style-needle-buckle-belt-accessory-g929684.html,Women 's Belt Fashion All Match Simple Style Needle Buckle Belt Accessory,Belts
17,$1.99,$6.99,https://www.jollychic.com/p/women-s-belt-rhinestones-inlay-center-bar-buckle-belt-accessory-g959584.html,Women's Belt Rhinestones Inlay Center Bar Buckle Belt Accessory,Belts
23,$1.99,$6.99,https://www.jollychic.com/p/women-s-belt-trendy-rose-pattern-buckle-casual-all-match-belt-accessory-g967366.html,Women's Belt Trendy Rose Pattern Buckle Casual All Match Belt Accessory,Belts
22,$2.99,$7.99,https://www.jollychic.com/p/women-s-belt-solid-color-simple-style-fashionable-belt-accessory-g967368.html,Women 's Belt Solid Color Simple Style Fashionable Belt Accessory,Belts
67,$1.99,$6.99,https://www.jollychic.com/p/women-s-belt-trendy-rhinestone-solid-color-versatile-belt-accessory-g967372.html,Women 's Belt Trendy Rhinestone Solid Color Versatile Belt Accessory,Belts
68,$2.99,$6.99,https://www.jollychic.com/p/women-s-belt-casual-style-fashionable-all-matched-belt-accessory-g967378.html,Women's Belt Casual Style Fashionable All Matched Belt Accessory,Belts
39,$3.99,$6.99,https://www.jollychic.com/p/women-s-belt-sweet-style-butterfly-buckle-faddish-belt-accessory-g967382.html,Women 's Belt Sweet Style Butterfly Buckle Faddish Belt Accessory,Belts
26,$5.99,$13.99,https://www.jollychic.com/p/women-s-belt-love-heart-shape-hollow-out-solid-color-casual-belt-accessory-g1062988.html,Women's Belt Love Heart Shape Hollow Out Solid Color Casual Belt Accessory,Belts
36,$3.99,$12.99,https://www.jollychic.com/p/women-s-belt-simple-style-solid-color-faddish-leather-belt-accessory-g1062990.html,Women's Belt Simple Style Solid Color Faddish Leather Belt Accessory,Belts
224,$6.99,$12.99,https://www.jollychic.com/p/women-s-belts-solid-color-all-match-elastic-wide-cinch-belt-accessory-g1095106.html,Women's Belts Solid Color All Match Elastic Wide Cinch Belt Accessory,Belts
42,$3.99,$8.99,https://www.jollychic.com/p/women-s-belts-stylish-solid-color-flower-pattern-mistress-belt-accessory-g1095110.html,Women's Belts Stylish Solid Color Flower Pattern Mistress Belt Accessory,Belts
52,$11.99,$18.99,https://www.jollychic.com/p/women-s-belt-solid-color-retro-style-brief-all-match-trendy-accessory-g1113430.html,Women's Belt Solid Color Retro Style Brief All Match Trendy Accessory,Belts
45,$9.99,$18.99,https://www.jollychic.com/p/women-s-belt-vintage-style-all-match-patchwork-faddish-accessory-g1113432.html,Women's Belt Vintage Style All Match Patchwork Faddish Accessory,Belts
9,$16.99,,https://www.jollychic.com/p/women-s-jeans-belt-thin-woven-vintage-style-all-match-accessory-g1159842.html,Women's Jeans Belt Thin Woven Vintage Style All Match Accessory,Belts
7,$11.99,$18.99,https://www.jollychic.com/p/women-s-cinch-belts-heart-shape-buckle-elastic-wide-belt-accessory-g1181066.html,Women's Cinch Belts Heart Shape Buckle Elastic Wide Belt Accessory,Belts
24,$20.99,$32.99,https://www.jollychic.com/p/women-s-belts-all-match-rivet-ornament-waist-belt-accessory-g1181076.html,Women's Belts All Match Rivet Ornament Waist Belt Accessory,Belts
17,$8.99,$13.99,https://www.jollychic.com/p/women-s-belts-solid-color-bow-knot-ornament-thin-belt-accessory-g1181082.html,Women's Belts Solid Color Bow Knot Ornament Thin Belt Accessory,Belts
16,$7.99,$12.99,https://www.jollychic.com/p/women-s-belts-solid-color-all-match-thin-waist-belt-accessory-g1181084.html,Women's Belts Solid Color All Match Thin Waist Belt Accessory,Belts
23,$13.99,$21.99,https://www.jollychic.com/p/women-s-belts-solid-color-pin-buckle-basic-waist-belt-accessory-g1181086.html,Women's Belts Solid Color Pin Buckle Basic Waist Belt Accessory,Belts
4,$14.99,,https://www.jollychic.com/p/women-s-jeans-belt-vintage-metal-butterfly-pin-buckle-thin-belt-g1214136.html,Women's Jeans Belt Vintage Metal Butterfly Pin Buckle Thin Belt,Belts
7,$18.99,$28.99,https://www.jollychic.com/p/women-s-belt-brief-style-hollow-out-patchwork-faddish-accessory-g1233858.html,Women's Belt Brief Style Hollow Out Patchwork Faddish Accessory,Belts
157,$5.99,$10.99,https://www.jollychic.com/p/women-s-belt-elastic-hollow-out-rivets-decor-wide-belt-fashion-accessory-g1283580.html,Women's Belt Elastic Hollow Out Rivets Decor Wide Belt Fashion Accessory,Belts
5,$5.99,$16.99,https://www.jollychic.com/p/women-s-belt-sweet-style-all-matched-bow-knot-belt-accessory-g1305712.html,Women's Belt Sweet Style All Matched Bow Knot Belt Accessory,Belts
9,$5.99,$16.99,https://www.jollychic.com/p/women-s-corset-all-matched-flowers-ornament-fashionable-accessory-g1305980.html,Women's Corset All Matched Flowers Ornament Fashionable Accessory,Belts
7,$5.99,$16.99,https://www.jollychic.com/p/women-s-corset-all-match-hollowed-out-retro-style-chic-accessory-g1305982.html,Women's Corset All Match Hollowed Out Retro Style Chic Accessory,Belts
7,$5.99,$15.99,https://www.jollychic.com/p/women-s-corset-vintage-all-match-flowers-ornament-trendy-accessory-g1305984.html,Women's Corset Vintage All Match Flowers Ornament Trendy Accessory,Belts
2,$9.99,$31.99,https://www.jollychic.com/p/women-s-belt-casual-all-matched-hollowed-out-candy-color-pin-buckle-accessory-g1313266.html,Women's Belt Casual All Matched Hollowed Out Candy Color Pin Buckle Accessory,Belts
6,$8.99,$22.99,https://www.jollychic.com/p/women-s-belt-candy-color-simple-style-all-match-pin-buckle-thin-belt-accessory-g1313270.html,Women's Belt Candy Color Simple Style All Match Pin Buckle Thin Belt Accessory,Belts
6,$5.99,$15.99,https://www.jollychic.com/p/women-s-belt-casual-all-matched-simple-style-fashion-pin-buckle-accessory-g1313282.html,Women's Belt Casual All Matched Simple Style Fashion Pin Buckle Accessory,Belts
4,$5.99,$17.99,https://www.jollychic.com/p/women-s-belt-sweet-style-heart-shaped-pendant-vogue-pin-buckle-accessory-g1313284.html,Women's Belt Sweet Style Heart Shaped Pendant Vogue Pin Buckle Accessory,Belts
2,$6.99,$18.99,https://www.jollychic.com/p/women-s-corset-simple-style-patchwork-all-matched-bold-belt-accessory-g1313296.html,Women's Corset Simple Style Patchwork All Matched Bold Belt Accessory,Belts
4,$4.99,$15.99,https://www.jollychic.com/p/women-s-belt-candy-color-brief-style-casual-pin-buckle-thin-belt-accessory-g1313308.html,Women's Belt Candy Color Brief Style Casual Pin Buckle Thin Belt Accessory,Belts
17,$5.99,$15.99,https://www.jollychic.com/p/women-s-belt-solid-color-brief-style-casual-all-match-pin-buckle-vogue-accessory-g1313392.html,Women's Belt Solid Color Brief Style Casual All Match Pin Buckle Vogue Accessory,Belts
14,$5.99,$16.99,https://www.jollychic.com/p/women-s-belt-chain-candy-color-brief-style-all-matched-thin-belt-accessory-g1313408.html,Women's Belt Chain Candy Color Brief Style All Matched Thin Belt Accessory,Belts
8,$5.99,$17.99,https://www.jollychic.com/p/women-s-belt-chain-ethnic-style-all-matched-vogue-plume-pendant-accessory-g1313410.html,Women's Belt Chain Ethnic Style All Matched Vogue Plume Pendant Accessory,Belts
13,$4.99,$13.99,https://www.jollychic.com/p/women-s-belt-chain-simple-style-candy-color-all-matched-knitted-thin-belt-accessory-g1313416.html,Women's Belt Chain Simple Style Candy Color All Matched Knitted Thin Belt Accessory,Belts
8,$4.99,$14.99,https://www.jollychic.com/p/women-s-belt-chain-chic-ladylike-bow-knot-imitation-pearl-knitted-accessory-g1313420.html,Women's Belt Chain Chic Ladylike Bow Knot Imitation Pearl Knitted Accessory,Belts
2,$4.99,$14.99,https://www.jollychic.com/p/women-s-belt-chain-sweet-style-flower-ornament-tassel-knitted-accessory-g1313422.html,Women's Belt Chain Sweet Style Flower Ornament Tassel Knitted Accessory,Belts
6,$5.99,$17.99,https://www.jollychic.com/p/women-s-corset-retro-style-hollowed-out-buckle-chic-brief-bold-belt-accessory-g1313428.html,Women's Corset Retro Style Hollowed Out Buckle Chic Brief Bold Belt Accessory,Belts
11,$4.99,$14.99,https://www.jollychic.com/p/1-pc-women-s-belt-retro-style-camouflage-print-all-matched-thin-belt-accessory-g1314742.html,1 Pc Women's Belt Retro Style Camouflage Print All Matched Thin Belt Accessory,Belts
16,$5.99,$15.99,https://www.jollychic.com/p/women-s-waist-chain-solid-color-patchwork-stylish-all-match-accessory-g1321440.html,Women's Waist Chain Solid Color Patchwork Stylish All Match Accessory,Belts
39,$4.99,$14.99,https://www.jollychic.com/p/women-s-jeans-belt-solid-color-patchwork-simple-style-belt-accessory-g1321444.html,Women's Jeans Belt Solid Color Patchwork Simple Style Belt Accessory,Belts
24,$5.99,$14.99,https://www.jollychic.com/p/women-s-belt-solid-color-simple-style-fashionable-all-match-accessory-g1321462.html,Women's Belt Solid Color Simple Style Fashionable All Match Accessory,Belts
14,$5.99,$16.99,https://www.jollychic.com/p/women-s-belt-solid-color-top-fashion-brief-design-belt-accessory-g1321478.html,Women's Belt Solid Color Top Fashion Brief Design Belt Accessory,Belts
18,$7.99,$19.99,https://www.jollychic.com/p/women-s-waist-chain-solid-color-synthetic-pearl-design-accessory-g1321490.html,Women's Waist Chain Solid Color Synthetic Pearl Design Accessory,Belts
12,$5.99,$15.99,https://www.jollychic.com/p/women-s-belt-floral-embroidery-top-fashion-all-match-belt-accessory-g1321494.html,Women's Belt Floral Embroidery Top Fashion All Match Belt Accessory,Belts
21,$5.99,$15.99,https://www.jollychic.com/p/women-s-belt-solid-color-square-buckle-all-match-retro-chic-accessory-g1321502.html,Women's Belt Solid Color Square Buckle All Match Retro Chic Accessory,Belts
3,$4.99,$14.99,https://www.jollychic.com/p/women-s-belt-color-block-all-match-canvas-all-match-belt-accessory-g1321506.html,Women's Belt Color Block All Match Canvas All Match Belt Accessory,Belts
24,$7.99,$20.99,https://www.jollychic.com/p/women-s-corset-solid-color-top-fashion-all-match-belt-accessory-g1323506.html,Women's Corset Solid Color Top Fashion All Match Belt Accessory,Belts
13,$5.99,$15.99,https://www.jollychic.com/p/women-s-belt-solid-color-all-match-chic-accessory-g1323522.html,Women's Belt Solid Color All Match Chic Accessory,Belts
5,$5.99,$15.99,https://www.jollychic.com/p/women-s-corset-opal-patched-vintage-all-match-belt-accessory-g1323530.html,Women's Corset Opal Patched Vintage All Match Belt Accessory,Belts
14,$4.99,$15.99,https://www.jollychic.com/p/women-s-belt-solid-color-creative-design-all-match-belt-accessory-g1323534.html,Women's Belt Solid Color Creative Design All Match Belt Accessory,Belts
14,$5.99,$15.99,https://www.jollychic.com/p/women-s-belt-solid-color-floral-shaped-patched-retro-belt-accessory-g1323536.html,Women's Belt Solid Color Floral Shaped Patched Retro Belt Accessory,Belts
6,$4.99,$15.99,https://www.jollychic.com/p/women-s-belt-color-block-petal-shaped-design-all-match-belt-accessory-g1323540.html,Women's Belt Color Block Petal Shaped Design All Match Belt Accessory,Belts
6,$5.99,$16.99,https://www.jollychic.com/p/women-s-belt-solid-color-hollow-out-buckled-brief-design-belt-accessory-g1324296.html,Women's Belt Solid Color Hollow Out Buckled Brief Design Belt Accessory,Belts
11,$5.99,$18.99,https://www.jollychic.com/p/women-s-corset-solid-color-lace-design-stylish-accessory-g1324300.html,Women's Corset Solid Color Lace Design Stylish Accessory,Belts
8,$3.99,$11.99,https://www.jollychic.com/p/women-s-belt-ladylike-bow-knot-all-matched-patent-leather-pin-buckle-accessory-g1336884.html,Women's Belt Ladylike Bow Knot All Matched Patent Leather Pin Buckle Accessory,Belts
6,$3.99,$11.99,https://www.jollychic.com/p/women-s-belt-ladylike-rhinestone-inlay-all-matched-vogue-accessory-g1336888.html,Women's Belt Ladylike Rhinestone Inlay All Matched Vogue Accessory,Belts
4,$4.99,$13.99,https://www.jollychic.com/p/women-s-belt-elegant-all-matched-rhinestones-ornament-chic-accessory-g1336920.html,Women's Belt Elegant All Matched Rhinestones Ornament Chic Accessory,Belts
0,$19.99,,https://www.jollychic.com/p/women-s-corset-wide-elastic-comfortable-top-fashion-accessory-g1345612.html,Women's Corset Wide Elastic Comfortable Top Fashion Accessory,Belts
10,$14.99,$29.99,https://www.jollychic.com/p/women-s-corset-crocodile-pattern-elegant-all-match-stylish-accessory-g1345620.html,Women's Corset Crocodile Pattern Elegant All Match Stylish Accessory,Belts
15,$20.99,,https://www.jollychic.com/p/women-s-belt-elegant-sweet-metal-decoration-chic-accessory-g1345654.html,Women's Belt Elegant Sweet Metal Decoration Chic Accessory,Belts
22,$7.99,$19.99,https://www.jollychic.com/p/women-s-corset-elastic-lace-up-wide-rivets-decor-stylish-accessory-g1379814.html,Women's Corset Elastic Lace Up Wide Rivets Decor Stylish Accessory,Belts
7,$19.99,,https://www.jollychic.com/p/women-s-belt-retro-style-ladylike-hollow-patchwork-faddish-accessory-g1382116.html,Women's Belt Retro Style Ladylike Hollow Patchwork Faddish Accessory,Belts
12,$16.99,,https://www.jollychic.com/p/women-s-belt-brief-style-hollow-out-jeans-faddish-ladylike-accessory-g1382120.html,Women's Belt Brief Style Hollow Out Jeans Faddish Ladylike Accessory,Belts
16,$4.99,$12.99,https://www.jollychic.com/p/women-s-jeans-belt-no-aperture-simple-style-all-match-belt-g1407342.html,Women's Jeans Belt No Aperture Simple Style All Match Belt,Belts
15,$7.99,$19.99,https://www.jollychic.com/p/women-s-belt-flower-embroidery-design-vintage-design-all-match-belt-accessory-g1430502.html,Women's Belt Flower Embroidery Design Vintage Design All Match Belt Accessory,Belts
3,$14.99,,https://www.jollychic.com/p/women-s-corset-ladylike-patchwork-fresh-style-sweet-charming-accessory-g1452994.html,Women's Corset Ladylike Patchwork Fresh Style Sweet Charming Accessory,Belts
3,$15.99,,https://www.jollychic.com/p/women-s-corset-brief-geometry-design-patchwork-faddish-ladylike-accessory-g1455604.html,Women's Corset Brief Geometry Design Patchwork Faddish Ladylike Accessory,Belts
7,$15.99,,https://www.jollychic.com/p/women-s-belt-retro-style-ladylike-hollow-patchwork-faddish-accessory-g1455608.html,Women's Belt Retro Style Ladylike Hollow Patchwork Faddish Accessory,Belts
1,$11.99,,https://www.jollychic.com/p/women-s-belt-imitation-pearls-decorative-retro-style-all-match-trendy-accessory-g1455616.html,Women's Belt Imitation Pearls Decorative Retro Style All Match Trendy Accessory,Belts
1,$10.99,,https://www.jollychic.com/p/women-s-belt-solid-color-retro-style-brief-all-match-trendy-accessory-g1455630.html,Women's Belt Solid Color Retro Style Brief All Match Trendy Accessory,Belts
4,$33.99,,https://www.jollychic.com/p/women-s-jeans-belt-all-match-top-fashion-chic-original-stylish-classic-belt-g1465996.html,Women's Jeans Belt All Match Top Fashion Chic Original Stylish Classic Belt,Belts
14,$17.99,,https://www.jollychic.com/p/women-s-jeans-belt-color-block-pattern-all-match-faddish-jeans-belt-g1477112.html,Women's Jeans Belt Color Block Pattern All Match Faddish Jeans Belt,Belts
0,$31.99,,https://www.jollychic.com/p/women-s-corset-wide-comfy-rivets-decor-stylish-vintage-style-elastic-belt-accessory-g1484590.html,Women's Corset Wide Comfy Rivets Decor Stylish Vintage Style Elastic Belt Accessory,Belts
3,$14.99,,https://www.jollychic.com/p/women-s-corset-hollow-out-metal-pattern-design-vintage-style-wide-comfy-elastic-belt-accessory-g1484592.html,Women's Corset Hollow Out Metal Pattern Design Vintage Style Wide Comfy Elastic Belt Accessory,Belts
2,$16.99,,https://www.jollychic.com/p/women-s-corset-wide-comfy-vintage-style-hollow-out-heart-design-elastic-belt-accessory-g1484594.html,Women's Corset Wide Comfy Vintage Style Hollow Out Heart Design Elastic Belt Accessory,Belts
6,$8.99,$18.99,https://www.jollychic.com/p/women-s-corset-simple-style-bow-knot-decor-elastic-belt-accessory-g1484628.html,Women's Corset Simple Style Bow Knot Decor Elastic Belt Accessory,Belts
2,$3.99,$10.99,https://www.jollychic.com/p/women-s-jean-belt-metal-bow-knot-decor-patent-leather-thin-ladylike-accessory-g1484750.html,Women's Jean Belt Metal Bow Knot Decor Patent Leather Thin Ladylike Accessory,Belts
13,$12.99,$19.99,https://www.jollychic.com/p/women-s-jeans-belt-metal-buckle-all-match-solid-chic-fashion-belt-accessory-g1498128.html,Women's Jeans Belt Metal Buckle All Match Solid Chic Fashion Belt Accessory,Belts
13,$5.99,$22.99,https://www.jollychic.com/p/women-s-jeans-belt-fashion-knitting-style-all-match-belt-g1548320.html,Women's Jeans Belt Fashion Knitting Style All Match Belt,Belts
2,$8.99,$12.99,https://www.jollychic.com/p/women-s-jeans-belt-all-match-comfy-rivets-simple-breathable-accessory-g1548566.html,Women's Jeans Belt All Match Comfy Rivets Simple Breathable Accessory,Belts
3,$12.99,,https://www.jollychic.com/p/women-s-jeans-belt-all-match-heart-pattern-comfy-basic-simple-breathable-accessory-g1548592.html,Women's Jeans Belt All Match Heart Pattern Comfy Basic Simple Breathable Accessory,Belts
8,$5.99,,https://www.jollychic.com/p/women-s-belt-chain-ethnic-style-tassel-decoration-all-match-fashionable-belt-accessory-g1561728.html,Women's Belt Chain Ethnic Style Tassel Decoration All Match Fashionable Belt Accessory,Belts
2,$4.99,,https://www.jollychic.com/p/women-s-jeans-belt-solid-color-brief-style-all-match-retro-casual-chic-belt-accessory-g1561734.html,Women's Jeans Belt Solid Color Brief Style All Match Retro Casual Chic Belt Accessory,Belts
1,$4.99,,https://www.jollychic.com/p/women-s-belt-chain-tassel-decoration-elegant-plain-style-all-match-belt-accessory-g1561742.html,Women's Belt Chain Tassel Decoration Elegant Plain Style All Match Belt Accessory,Belts
1,$9.99,$14.99,https://www.jollychic.com/p/women-s-belt-chain-hollow-out-color-block-ethnic-style-casual-woven-belt-accessory-g1561748.html,Women's Belt Chain Hollow Out Color Block Ethnic Style Casual Woven Belt Accessory,Belts
4,$9.99,$14.99,https://www.jollychic.com/p/women-s-belt-chain-color-block-hollow-out-design-personalized-ladylike-belt-accessory-g1561754.html,Women's Belt Chain Color Block Hollow Out Design Personalized Ladylike Belt Accessory,Belts
1,$14.99,$28.99,https://www.jollychic.com/p/women-s-corset-floral-embroidery-all-match-vintage-style-belt-accessory-g1565938.html,Women's Corset Floral Embroidery All Match Vintage Style Belt Accessory,Belts
10,$10.99,,https://www.jollychic.com/p/women-s-corset-solid-color-pu-leather-wrap-around-waist-band-belt-accessory-g1565998.html,Women's Corset Solid Color PU Leather Wrap Around Waist Band Belt Accessory,Belts
12,$11.99,$16.99,https://www.jollychic.com/p/women-s-corset-willow-leaves-shaped-fashion-solid-color-belt-accessory-g1570650.html,Women's Corset Willow Leaves Shaped Fashion Solid Color Belt Accessory,Belts
518,$4.99,$17.99,https://www.jollychic.com/p/black-braided-personalized-slim-belt-for-women-g292534.html,Black Braided Personalized Slim Belt For Women,Belts
238,$5.99,,https://www.jollychic.com/p/women-s-jeans-belt-catching-brief-sweet-all-match-belt-accessory-g501906.html,Women's Jeans Belt Catching Brief Sweet All Match Belt Accessory,Belts
675,$6.99,,https://www.jollychic.com/p/women-s-belt-bow-knot-faddish-dresses-belt-accessory-g595562.html,Women's Belt Bow Knot Faddish Dresses Belt Accessory,Belts
33,$8.99,,https://www.jollychic.com/p/women-s-waist-belt-tassel-decor-leisure-stylish-belt-g626378.html,Women's Waist Belt Tassel Decor Leisure Stylish Belt,Belts
67,$3.99,$7.99,https://www.jollychic.com/p/women-s-belt-romantic-muiticolor-5-flowers-appliques-sweet-belt-g665468.html,Women's Belt Romantic Muiticolor 5 Flowers Appliques Sweet Belt,Belts
75,$2.99,$13.99,https://www.jollychic.com/p/women-s-belts-stylish-unique-design-leisure-faddish-waist-belt-accessory-g759338.html,Women's Belts Stylish Unique Design Leisure Faddish Waist Belt Accessory,Belts
146,$7.99,$19.99,https://www.jollychic.com/p/women-s-belts-metallic-elegant-bow-knot-ornament-ladylike-belt-accessory-g759374.html,Women's Belts Metallic Elegant Bow Knot Ornament Ladylike Belt Accessory,Belts
132,$5.99,$20.99,https://www.jollychic.com/p/women-s-belts-metallic-chic-stylish-waist-belt-accessory-g759656.html,Women's Belts Metallic Chic Stylish Waist Belt Accessory,Belts
66,$2.99,$13.99,https://www.jollychic.com/p/women-s-belts-faddish-elastic-bow-knot-ornament-waist-belts-accessory-g759822.html,Women's Belts Faddish Elastic Bow Knot Ornament Waist Belts Accessory,Belts
57,$4.99,$13.99,https://www.jollychic.com/p/women-s-belts-wide-elastic-metallic-buckle-cinch-belt-accessory-g759832.html,Women's Belts Wide Elastic Metallic Buckle Cinch Belt Accessory,Belts
101,$6.99,$19.99,https://www.jollychic.com/p/women-s-belts-flower-shaped-metallic-belt-joint-waist-belts-accessory-g776004.html,Women's Belts Flower Shaped Metallic Belt Joint Waist Belts Accessory,Belts
96,$6.99,$14.99,https://www.jollychic.com/p/women-s-waist-chain-multi-layers-golden-alloy-bell-pendant-charming-accessory-g776838.html,Women's Waist Chain Multi Layers Golden Alloy Bell Pendant Charming Accessory,Belts
60,$27.99,,https://www.jollychic.com/p/women-s-cinch-belt-embroidery-pattern-elastic-charming-vintage-accessory-g779226.html,Women's Cinch Belt Embroidery Pattern Elastic Charming Vintage Accessory,Belts
55,$25.99,,https://www.jollychic.com/p/women-s-cinch-belt-punk-style-rivet-decorative-hollow-out-elastic-accessory-g779228.html,Women's Cinch Belt Punk Style Rivet Decorative Hollow Out Elastic Accessory,Belts
26,$24.99,,https://www.jollychic.com/p/women-s-waist-chain-turquoise-decorative-hollow-out-flowers-vintage-accessory-g780228.html,Women's Waist Chain Turquoise Decorative Hollow Out Flowers Vintage Accessory,Belts
35,$6.99,,https://www.jollychic.com/p/women-s-belt-retro-simple-shell-ornament-chain-accessory-g842600.html,Women's Belt Retro Simple Shell Ornament Chain Accessory,Belts
22,$40.99,,https://www.jollychic.com/p/women-s-waist-chain-ethnic-mental-pendant-dancing-alloy-accessory-g843402.html,Women's Waist Chain Ethnic Mental Pendant Dancing Alloy Accessory,Belts
33,$40.99,,https://www.jollychic.com/p/women-s-belt-elegant-rhinestone-pendant-adjustable-alloy-accessory-g843404.html,Women's Belt Elegant Rhinestone Pendant Adjustable Alloy Accessory,Belts
55,$47.99,,https://www.jollychic.com/p/women-s-waist-chain-clover-shape-design-rhinestone-decor-alloy-accessory-g843406.html,Women's Waist Chain Clover Shape Design Rhinestone Decor Alloy Accessory,Belts
76,$6.99,$16.99,https://www.jollychic.com/p/women-s-belt-metallic-buckled-trendy-leaves-shaped-gold-cinch-belt-accessory-g843574.html,Women's Belt Metallic Buckled Trendy Leaves Shaped Gold Cinch Belt Accessory,Belts
59,$5.99,$16.99,https://www.jollychic.com/p/women-s-belt-stylish-alloy-shell-shaped-cinch-belt-accessory-g843576.html,Women's Belt Stylish Alloy Shell Shaped Cinch Belt Accessory,Belts
46,$5.99,$13.99,https://www.jollychic.com/p/women-s-belts-stylish-solid-color-center-bar-buckled-all-match-belt-accessory-g1026702.html,Women's Belts Stylish Solid Color Center Bar Buckled All Match Belt Accessory,Belts
15,$6.99,,https://www.jollychic.com/p/women-s-belt-vintage-style-all-match-patchwork-faddish-accessory-g1045494.html,Women's Belt Vintage Style All Match Patchwork Faddish Accessory,Belts
49,$3.99,$6.99,https://www.jollychic.com/p/women-s-belt-vintage-style-hollow-patchwork-faddish-accessory-g1045498.html,Women's Belt Vintage Style Hollow Patchwork Faddish Accessory,Belts
30,$10.99,$16.99,https://www.jollychic.com/p/women-s-belt-brief-style-hollow-out-jeans-faddish-ladylike-accessory-g1095226.html,Women's Belt Brief Style Hollow Out Jeans Faddish Ladylike Accessory,Belts
