add_wish,discount_price,original_price,product_link,product_name,header_block
509,$1.99,,https://www.jollychic.com/p/men-s-wrist-guard-lightweight-breathable-adjustable-wrap-type-sports-wrist-support-brace-single-piece-g727062.html,Men's Wrist Guard Lightweight Breathable Adjustable Wrap Type Sports Wrist Support Brace-Single Piece,Sports Safety
106,$3.99,,https://www.jollychic.com/p/men-s-wrist-guard-pressurized-adjustable-elastic-comfortable-sports-wrist-support-brace-single-piece-g727190.html,Men's Wrist Guard Pressurized Adjustable Elastic Comfortable Sports Wrist Support Brace-Single Piece,Sports Safety
217,$6.99,$11.99,https://www.jollychic.com/p/men-s-sport-arm-elbow-pads-sleeve-elastic-spider-web-pattern-sport-accessories-g727678.html,Men's Sport Arm Elbow Pads Sleeve Elastic Spider Web Pattern Sport Accessories,Sports Safety
548,$6.99,$10.99,https://www.jollychic.com/p/outdoor-dustproof-mask-breathable-prevent-mist-haze-sport-mask-g727688.html,Outdoor Dustproof Mask Breathable Prevent Mist Haze Sport Mask,Sports Safety
907,$10.99,$19.99,https://www.jollychic.com/p/sport-mask-soft-useful-mouth-muffle-anti-pollution-cycling-dust-mask-g727694.html,Sport Mask Soft Useful Mouth Muffle Anti Pollution Cycling Dust Mask,Sports Safety
40,$4.99,$8.99,https://www.jollychic.com/p/men-s-sports-guard-durable-sweat-absorption-ankle-protection-accessory-g729584.html,Men's Sports Guard Durable Sweat Absorption Ankle Protection Accessory,Sports Safety
99,$1.99,$3.99,https://www.jollychic.com/p/men-s-knee-guard-pressurized-comfy-shock-absorption-adjustable-sports-accessory-g730110.html,Men's Knee Guard Pressurized Comfy Shock Absorption Adjustable Sports Accessory,Sports Safety
214,$9.99,$18.99,https://www.jollychic.com/p/men-s-waist-guard-soft-cozy-adjustable-elastic-breathable-fitness-sports-accessory-g730370.html,Men's Waist Guard Soft Cozy Adjustable Elastic Breathable Fitness Sports Accessory,Sports Safety
315,$11.99,,https://www.jollychic.com/p/men-s-leg-guard-1pcs-cellular-lgiht-weight-design-solid-color-sports-accessory-g730564.html,Men's Leg Guard 1Pcs Cellular Lgiht Weight Design Solid Color Sports Accessory,Sports Safety
54,$26.99,$43.99,https://www.jollychic.com/p/sports-guards-breathable-waist-support-protective-sports-belt-g749902.html,Sports Guards Breathable Waist Support Protective Sports Belt,Sports Safety
18,$3.99,$6.99,https://www.jollychic.com/p/sports-guard-multi-functional-elastic-outdoor-durable-portable-nylon-band-g752042.html,Sports Guard Multi-Functional Elastic Outdoor Durable Portable Nylon Band,Sports Safety
200,$23.99,$39.99,https://www.jollychic.com/p/sports-knee-guard-roller-skating-universal-durable-sports-accessory-g752044.html,Sports Knee Guard Roller Skating Universal Durable Sports Accessory,Sports Safety
68,$7.99,$14.99,https://www.jollychic.com/p/men-s-waist-guard-soft-comfy-adjustable-warm-breathable-fitness-sports-accessory-g761766.html,Men's Waist Guard Soft Comfy Adjustable Warm Breathable Fitness Sports Accessory,Sports Safety
145,$2.99,$5.99,https://www.jollychic.com/p/men-s-leg-guard-2pcs-support-weight-design-solid-sports-adjustable-accessory-g766380.html,Men's Leg Guard 2Pcs Support Weight Design Solid Sports Adjustable Accessory,Sports Safety
165,$0.99,$1.99,https://www.jollychic.com/p/men-s-wrist-guard-durable-adjustable-sports-wrist-guard-single-piece-g766648.html,Men's Wrist Guard Durable Adjustable Sports Wrist Guard-Single Piece,Sports Safety
53,$5.99,$9.99,https://www.jollychic.com/p/men-s-i-pcs-leg-guard-biking-weightlifting-basketball-outdoors-stylish-sports-accessory-g766656.html,Men's I Pcs Leg Guard Biking Weightlifting Basketball Outdoors Stylish Sports Accessory,Sports Safety
44,$31.99,$52.00,https://www.jollychic.com/p/4-pcs-men-s-sports-guard-breathable-durable-elastic-band-sports-accessory-g784576.html,4 Pcs Men'S Sports Guard Breathable Durable Elastic Band Sports Accessory,Sports Safety
61,$20.99,$32.99,https://www.jollychic.com/p/men-s-sports-helmet-all-match-trendy-cycling-universal-sports-accessory-g784868.html,Men's Sports Helmet All Match Trendy Cycling Universal Sports Accessory,Sports Safety
143,$8.99,$14.99,https://www.jollychic.com/p/men-s-knee-guard-1-piece-protective-durable-lightweight-long-sports-accessory-g784878.html,Men's Knee Guard 1 Piece Protective Durable Lightweight Long Sports Accessory,Sports Safety
229,$9.99,$14.99,https://www.jollychic.com/p/men-s-knee-guard-lightweight-portable-durable-all-match-sports-accessory-g785086.html,Men's Knee Guard Lightweight Portable Durable All Match Sports Accessory,Sports Safety
374,$57.00,$88.00,https://www.jollychic.com/p/men-s-fashion-cool-sports-bike-motorcycle-racing-suits-g810380.html,Men's Fashion Cool Sports Bike Motorcycle Racing Suits,Sports Safety
89,$5.99,,https://www.jollychic.com/p/men-s-guards-mixed-color-perspiration-lengthen-sports-accessories-g908308.html,Men's Guards Mixed Color Perspiration Lengthen Sports Accessories,Sports Safety
57,$6.99,$8.99,https://www.jollychic.com/p/sports-guards-high-quality-stylish-comfortable-leg-guards-for-football-g913730.html,Sports Guards High Quality Stylish Comfortable Leg Guards For Football,Sports Safety
51,$3.99,$7.99,https://www.jollychic.com/p/sports-guards-stylish-breathable-comfortable-leg-guards-for-football-g913732.html,Sports Guards Stylish Breathable Comfortable Leg Guards For Football,Sports Safety
16,$12.99,$18.99,https://www.jollychic.com/p/li-ning-sports-guard-1pc-high-quality-soft-cozy-kneelet-accessory-g915802.html,Li Ning Sports Guard 1Pc High Quality Soft Cozy Kneelet Accessory,Sports Safety
43,$18.99,,https://www.jollychic.com/p/li-ning-sports-guard-1pc-high-quality-unisex-kneelet-accessory-g915806.html,Li Ning Sports Guard 1Pc High Quality Unisex Kneelet Accessory,Sports Safety
149,$8.99,,https://www.jollychic.com/p/men-s-wrist-guard-1pcs-fitness-detachable-outdoor-sports-accessory-g933540.html,Men's Wrist Guard 1Pcs Fitness Detachable Outdoor Sports Accessory,Sports Safety
62,$3.99,$7.99,https://www.jollychic.com/p/men-s-wrist-guard-1pcs-training-durable-simple-design-sports-accessory-g933550.html,Men's Wrist Guard 1Pcs Training Durable Simple Design Sports Accessory,Sports Safety
173,$16.99,,https://www.jollychic.com/p/compress-elastic-breathable-waist-supporter-belt-for-fitness-g945552.html,Compress Elastic Breathable Waist Supporter Belt For Fitness,Sports Safety
14,$10.99,$19.99,https://www.jollychic.com/p/compress-elastic-breathable-waist-supporter-belt-for-fitness-g945558.html,Compress Elastic Breathable Waist Supporter Belt For Fitness,Sports Safety
113,$3.99,,https://www.jollychic.com/p/wrist-guard-durable-elastic-fitness-sport-accessory-g945560.html,Wrist Guard Durable Elastic Fitness Sport Accessory,Sports Safety
25,$10.99,$19.99,https://www.jollychic.com/p/compress-elastic-breathable-waist-supporter-belt-for-fitness-g945562.html,Compress Elastic Breathable Waist Supporter Belt For Fitness,Sports Safety
31,$8.99,,https://www.jollychic.com/p/sports-guard-knee-supporter-breathable-kneecap-g945564.html,Sports Guard Knee Supporter Breathable Kneecap,Sports Safety
10,$9.99,$17.99,https://www.jollychic.com/p/compress-elastic-breathable-waist-supporter-belt-for-fitness-g945566.html,Compress Elastic Breathable Waist Supporter Belt For Fitness,Sports Safety
41,$11.99,$19.99,https://www.jollychic.com/p/compress-elastic-heat-anti-cold-breathable-waist-supporter-belt-g945568.html,Compress Elastic Heat Anti Cold Breathable Waist Supporter Belt,Sports Safety
26,$9.99,$16.99,https://www.jollychic.com/p/sports-guard-knee-supporter-outdoor-breathable-kneecap-g945570.html,Sports Guard Knee Supporter Outdoor Breathable Kneecap,Sports Safety
170,$12.99,,https://www.jollychic.com/p/knee-guard-supporter-keep-warm-breathable-kneecap-g945574.html,Knee Guard Supporter Keep Warm Breathable Kneecap,Sports Safety
29,$7.99,$14.99,https://www.jollychic.com/p/sports-guard-knee-supporter-lightweight-outdoor-breathable-kneecap-g945580.html,Sports Guard Knee Supporter Lightweight Outdoor Breathable Kneecap,Sports Safety
41,$17.99,,https://www.jollychic.com/p/sports-guard-knee-supporter-keep-warm-outdoor-breathable-kneecap-g945584.html,Sports Guard Knee Supporter Keep Warm Outdoor Breathable Kneecap,Sports Safety
37,$7.99,$14.99,https://www.jollychic.com/p/sports-guard-knee-support-outdoor-non-slip-springs-support-breathable-kneecap-g945586.html,Sports Guard Knee Support Outdoor Non Slip Springs Support Breathable Kneecap,Sports Safety
35,$15.99,$29.99,https://www.jollychic.com/p/sports-guard-knee-support-outdoor-breathable-kneecap-g945598.html,Sports Guard Knee Support Outdoor Breathable Kneecap,Sports Safety
66,$8.99,,https://www.jollychic.com/p/compress-elastic-keep-warm-breathable-waist-supporter-belt-for-fitness-g946582.html,Compress Elastic Keep Warm Breathable Waist Supporter Belt For Fitness,Sports Safety
27,$2.99,$6.99,https://www.jollychic.com/p/compress-elastic-breathable-waist-supporter-protection-belt-for-fitness-g946584.html,Compress Elastic Breathable Waist Supporter Protection Belt For Fitness,Sports Safety
43,$11.99,$22.99,https://www.jollychic.com/p/waist-protect-keep-warm-wool-unisex-uterus-protect-waist-support-g946588.html,Waist Protect keep Warm Wool Unisex Uterus Protect Waist Support,Sports Safety
57,$8.99,,https://www.jollychic.com/p/wrist-protect-non-slip-thickening-sports-accessory-g946594.html,Wrist Protect Non Slip Thickening Sports Accessory,Sports Safety
33,$4.99,,https://www.jollychic.com/p/ankle-belt-taekwondo-strength-training-protect-tool-g946598.html,Ankle Belt Taekwondo Strength Training Protect Tool,Sports Safety
27,$16.99,,https://www.jollychic.com/p/waist-band-training-fitness-sports-protect-accessory-g946600.html,Waist Band Training Fitness Sports Protect Accessory,Sports Safety
87,$3.99,,https://www.jollychic.com/p/men-s-codillo-guard-basketball-protection-length-sports-accessory-g946602.html,Men's Codillo Guard Basketball Protection Length Sports Accessory,Sports Safety
156,$3.99,$8.99,https://www.jollychic.com/p/one-piece-men-s-sports-wrist-guard-fitness-protection-sports-accessory-g964556.html,One Piece Men's Sports Wrist Guard Fitness Protection Sports Accessory,Sports Safety
53,$2.99,$4.99,https://www.jollychic.com/p/men-s-wrist-guard-outdoor-sports-cycling-hand-finger-protection-accessory-g964562.html,Men's Wrist Guard Outdoor Sports Cycling Hand Finger Protection Accessory,Sports Safety
875,$9.99,$14.99,https://www.jollychic.com/p/men-s-fitness-gloves-breathable-antislipping-durable-training-guard-accessory-g964564.html,Men's Fitness Gloves Breathable Antislipping Durable Training Guard Accessory,Sports Safety
801,$8.99,$13.99,https://www.jollychic.com/p/one-pair-men-s-fitness-gloves-durable-half-finger-antislip-unisex-training-gloves-g964566.html,One Pair Men's Fitness Gloves Durable Half Finger Antislip Unisex Training Gloves,Sports Safety
106,$3.99,$7.99,https://www.jollychic.com/p/one-piece-men-s-wrist-guard-multi-functional-protective-training-accessory-g964568.html,One Piece Men's Wrist Guard Multi Functional Protective Training Accessory,Sports Safety
18,$19.99,$32.99,https://www.jollychic.com/p/men-s-waist-guard-fitness-breathable-durable-waist-protection-training-accessory-g964570.html,Men's Waist Guard Fitness Breathable Durable Waist Protection Training Accessory,Sports Safety
68,$13.99,,https://www.jollychic.com/p/2pcs-sports-fitness-power-assisted-straps-set-antislip-multifunctional-wrist-guard-g991508.html,2Pcs Sports Fitness Power Assisted Straps Set Antislip Multifunctional Wrist Guard,Sports Safety
439,$1.99,$5.99,https://www.jollychic.com/p/women-s-arm-guard-one-pair-solid-color-sun-protection-sports-sleevelet-g1024146.html,Women's Arm Guard One Pair Solid Color Sun Protection Sports Sleevelet,Sports Safety
647,$6.99,$9.99,https://www.jollychic.com/p/yoga-resistance-loop-bands-4pcs-physical-therapy-exercise-body-building-tools-g1060116.html,Yoga Resistance Loop Bands 4Pcs Physical Therapy Exercise Body Building Tools,Sports Safety
539,$7.99,$11.99,https://www.jollychic.com/p/twister-plate-with-cord-resistance-bands-magnetic-waist-slimming-tools-g1060274.html,Twister Plate With Cord Resistance Bands Magnetic Waist Slimming Tools,Sports Safety
1253,$5.99,$7.99,https://www.jollychic.com/p/3pcs-exercise-tools-elastic-band-fat-burning-slimming-headband-wristband-set-g1060276.html,3Pcs Exercise Tools Elastic Band Fat Burning Slimming Headband Wristband Set,Sports Safety
176,$7.99,,https://www.jollychic.com/p/adjustable-5-20-kg-wrist-hand-rehabilitation-training-refersto-the-force-pull-g1060278.html,Adjustable 5-20 kg Wrist Hand Rehabilitation Training RefersTo The Force Pull,Sports Safety
32,$1.99,$3.99,https://www.jollychic.com/p/yosoo-2-pairs-gel-pads-skin-transparent-color-pu-skid-resistance-metatarsal-ball-of-foot-cushions-g1093644.html,Yosoo 2 Pairs Gel Pads Skin Transparent Color PU Skid resistance Metatarsal Ball of Foot Cushions,Sports Safety
95,$1.99,$3.99,https://www.jollychic.com/p/yosoo-1-pair-toe-corrector-breathable-three-holes-comfort-forefoot-protect-health-care-toe-spreader-g1093656.html,Yosoo 1 Pair Toe Corrector Breathable Three Holes Comfort Forefoot Protect Health Care Toe Spreader,Sports Safety
61,$1.99,$3.99,https://www.jollychic.com/p/yosoo-1-pair-toe-protector-hole-design-breathable-silicone-comfortable-fitness-equipment-g1093662.html,Yosoo 1 Pair Toe Protector Hole Design Breathable Silicone Comfortable Fitness Equipment,Sports Safety
69,$1.99,$3.99,https://www.jollychic.com/p/yosoo-1-pair-toes-protection-set-gel-fiber-toes-set-toe-separator-g1093666.html,Yosoo 1 Pair Toes Protection Set Gel Fiber Toes Set Toe Separator,Sports Safety
54,$2.99,,https://www.jollychic.com/p/yosoo-1-pair-toe-protectors-hole-design-breathable-silicone-comfortable-fitness-equipment-g1093670.html,Yosoo 1 Pair Toe Protectors Hole Design Breathable Silicone Comfortable Fitness Equipment,Sports Safety
208,$7.99,$12.99,https://www.jollychic.com/p/yosoo-back-posture-corrector-adjustable-shoulder-posture-support-strap-g1093682.html,Yosoo Back Posture Corrector Adjustable Shoulder Posture Support Strap,Sports Safety
24,$1.99,$3.99,https://www.jollychic.com/p/yosoo-2-pairs-sole-pad-skin-color-pu-skid-resistant-comfy-foot-pad-g1093742.html,Yosoo 2 Pairs Sole Pad Skin Color PU Skid Resistant Comfy Foot Pad,Sports Safety
28,$6.99,$10.99,https://www.jollychic.com/p/yosoo-1-pc-black-patella-knee-strap-adjustable-infrapatellar-strap-band-g1095272.html,Yosoo 1 Pc Black Patella Knee Strap Adjustable Infrapatellar Strap Band,Sports Safety
64,$4.99,$8.99,https://www.jollychic.com/p/yosoo-1-pc-ankle-brace-breathable-adjustable-ankle-support-stabilizer-g1095274.html,Yosoo 1 Pc Ankle Brace Breathable Adjustable Ankle Support Stabilizer,Sports Safety
160,$4.99,$7.99,https://www.jollychic.com/p/yosoo-1-pc-trigger-finger-splint-adjustable-hook-and-loop-tape-attached-finger-brace-g1095276.html,Yosoo 1 Pc Trigger Finger Splint Adjustable Hook and Loop Tape Attached Finger Brace,Sports Safety
126,$3.99,$5.99,https://www.jollychic.com/p/yosoo-2-pairs-heel-insoles-two-colors-comfy-back-cushion-insoles-g1095280.html,Yosoo 2 Pairs Heel Insoles Two Colors Comfy Back Cushion Insoles,Sports Safety
21,$4.99,,https://www.jollychic.com/p/yosoo-hands-guards-training-durable-simple-design-sports-accessories-g1095282.html,Yosoo Hands Guards Training Durable Simple Design Sports Accessories,Sports Safety
79,$9.99,$15.99,https://www.jollychic.com/p/yosoo-pull-up-gloves-1-pair-black-wrist-support-attached-protective-sports-accessories-g1103184.html,Yosoo Pull Up Gloves 1 Pair Black Wrist Support Attached Protective Sports Accessories,Sports Safety
19,$4.99,$8.99,https://www.jollychic.com/p/yosoo-1-pc-trigger-finger-splint-adjustable-finger-brace-g1103186.html,Yosoo 1 Pc Trigger Finger Splint Adjustable Finger Brace,Sports Safety
167,$11.99,$18.99,https://www.jollychic.com/p/yosoo-1-pair-pull-up-gloves-wrist-support-protective-sports-gloves-g1103194.html,Yosoo 1 Pair Pull Up Gloves Wrist Support Protective Sports Gloves,Sports Safety
25,$7.99,$12.99,https://www.jollychic.com/p/1-pc-yosoo-sport-shoulder-bandage-adjustable-strap-injury-prevention-sportswear-g1103200.html,1 Pc Yosoo Sport Shoulder Bandage Adjustable Strap Injury Prevention Sportswear,Sports Safety
23,$14.99,$23.99,https://www.jollychic.com/p/yosoo-1-pair-knee-guard-elastic-patella-brace-support-protector-sleeve-g1141544.html,Yosoo 1 Pair Knee Guard Elastic Patella Brace Support Protector Sleeve,Sports Safety
35,$11.99,$21.99,https://www.jollychic.com/p/yosoo-men-s-waist-support-high-elasticity-fitness-equipment-g1141560.html,Yosoo Men's Waist Support High Elasticity Fitness Equipment,Sports Safety
15,$5.99,$8.99,https://www.jollychic.com/p/yosoo-1-pair-toe-corrector-breathable-comfort-forefoot-protect-health-care-toe-spreader-g1141576.html,Yosoo 1 Pair Toe Corrector Breathable Comfort Forefoot Protect Health Care Toe Spreader,Sports Safety
64,$21.99,,https://www.jollychic.com/p/yosoo-women-s-waist-support-adjustable-elastic-waist-belt-band-g1141578.html,Yosoo Women's Waist Support Adjustable Elastic Waist Belt Band,Sports Safety
260,$10.99,$17.99,https://www.jollychic.com/p/yosoo-back-posture-corrector-adjustable-shoulder-posture-support-strap-g1141584.html,Yosoo Back Posture Corrector Adjustable Shoulder Posture Support Strap,Sports Safety
25,$10.99,$16.99,https://www.jollychic.com/p/yosoo-wrist-bracer-mesh-adjustable-fitness-equipment-g1141588.html,Yosoo Wrist Bracer Mesh Adjustable Fitness Equipment,Sports Safety
21,$16.99,$25.99,https://www.jollychic.com/p/yosoo-groin-support-adjustable-elastic-waist-belt-g1142158.html,Yosoo Groin Support Adjustable Elastic Waist Belt,Sports Safety
106,$4.99,$7.99,https://www.jollychic.com/p/yosoo-1-pair-gel-bunion-protector-sleeves-corrector-with-gel-toe-separators-g1142162.html,Yosoo 1 Pair Gel Bunion Protector Sleeves Corrector with Gel Toe Separators,Sports Safety
55,$18.99,$29.99,https://www.jollychic.com/p/yosoo-usb-neck-wrap-heating-brace-pad-heated-pack-protector-strap-g1142164.html,Yosoo USB Neck Wrap Heating Brace Pad Heated Pack Protector Strap,Sports Safety
59,$4.99,$7.99,https://www.jollychic.com/p/yosoo-2-pairs-toe-sleeve-and-toe-separator-bunion-protector-metatarsal-pad-g1142212.html,Yosoo 2 Pairs Toe Sleeve and Toe Separator Bunion Protector Metatarsal Pad,Sports Safety
163,$7.99,$12.99,https://www.jollychic.com/p/yosoo-2-pairs-of-heel-protection-socks-moisturizing-silicone-socks-set-g1147918.html,Yosoo 2 Pairs Of Heel Protection Socks Moisturizing Silicone Socks Set,Sports Safety
10,$18.99,,https://www.jollychic.com/p/yosoo-waistband-concealed-right-gun-holster-with-adjustable-elastic-secure-strap-g1147922.html,Yosoo Waistband Concealed Right Gun Holster with Adjustable Elastic Secure Strap,Sports Safety
12,$12.99,$18.99,https://www.jollychic.com/p/yosoo-waistband-concealed-left-gun-holster-with-adjustable-elastic-secure-strap-g1147924.html,Yosoo Waistband Concealed Left Gun Holster with Adjustable Elastic Secure Strap,Sports Safety
108,$26.99,$43.99,https://www.jollychic.com/p/yosoo-medium-size-posture-corrector-brace-and-clavicle-support-straightener-g1147928.html,Yosoo Medium size Posture Corrector Brace and Clavicle Support Straightener,Sports Safety
69,$17.99,$30.99,https://www.jollychic.com/p/yosoo-large-size-posture-corrector-brace-and-clavicle-support-straightener-g1147930.html,Yosoo Large size Posture Corrector Brace and Clavicle Support Straightener,Sports Safety
138,$17.99,$29.99,https://www.jollychic.com/p/yosoo-medium-size-posture-corrector-brace-and-clavicle-support-straightener-g1147932.html,Yosoo Medium size Posture Corrector Brace and Clavicle Support Straightener,Sports Safety
96,$9.99,$16.99,https://www.jollychic.com/p/yosoo-large-size-posture-corrector-brace-and-clavicle-support-straightener-g1147934.html,Yosoo Large size Posture Corrector Brace and Clavicle Support Straightener,Sports Safety
7,$4.99,$8.99,https://www.jollychic.com/p/yosoo-trigger-finger-splint-with-an-extra-hook-and-loop-tape-g1147936.html,Yosoo Trigger Finger Splint with an Extra Hook and Loop Tape,Sports Safety
373,$8.99,$13.99,https://www.jollychic.com/p/yosoo-back-posture-corrector-adjustable-correct-shoulder-posture-support-strap-medium-size--g1147938.html,Yosoo Back Posture Corrector Adjustable Correct Shoulder Posture Support Strap(Medium Size),Sports Safety
43,$27.99,$45.99,https://www.jollychic.com/p/yosoo-large-size-posture-corrector-brace-elastic-clavicle-support-straightener-g1147942.html,Yosoo Large size Posture Corrector Brace Elastic Clavicle Support Straightener,Sports Safety
54,$25.99,$39.99,https://www.jollychic.com/p/yosoo-waist-support-adjustable-brace-belt-with-4-steel-stabilizers-medium-size-g1147946.html,Yosoo Waist Support Adjustable Brace Belt with 4 Steel Stabilizers Medium Size,Sports Safety
51,$8.99,$14.99,https://www.jollychic.com/p/yosoo-adjustable-soft-bunion-splints-brace-big-toe-straighteners-separators-g1147956.html,Yosoo Adjustable Soft Bunion Splints Brace Big Toe Straighteners Separators,Sports Safety
57,$3.99,$7.99,https://www.jollychic.com/p/yosoo-belly-band-concealed-gun-holster-multifunctional-waist-band-g1147962.html,Yosoo Belly Band Concealed Gun Holster Multifunctional Waist Band,Sports Safety
59,$10.99,$18.99,https://www.jollychic.com/p/yosoo-adjustable-belly-band-with-gun-holster-waist-band-g1147964.html,Yosoo Adjustable Belly Band with Gun Holster Waist Band,Sports Safety
316,$8.99,$14.99,https://www.jollychic.com/p/yosoo-ankle-holster-adjustable-neoprene-elastic-wrap-with-carry-gun-holster-g1147966.html,Yosoo Ankle Holster Adjustable Neoprene Elastic Wrap with Carry Gun Holster,Sports Safety
20,$8.99,$16.99,https://www.jollychic.com/p/yosoo-waist-band-concealed-carry-gun-holster-belly-band-g1147968.html,Yosoo Waist Band Concealed Carry Gun Holster Belly Band,Sports Safety
62,$9.99,$15.99,https://www.jollychic.com/p/yosoo-5-pieces-bunion-corrector-protector-bunion-splint-straightener-g1158220.html,Yosoo 5 Pieces Bunion Corrector Protector Bunion Splint Straightener,Sports Safety
20,$80.00,,https://www.jollychic.com/p/yosoo-electric-heated-vest-physical-therapy-vest-xxl-size--g1158224.html,Yosoo Electric Heated Vest Physical Therapy Vest(XXL size),Sports Safety
328,$6.99,$10.99,https://www.jollychic.com/p/women-x-pattern-adjustable-back-support-chest-breast-belt-band-posture-corrector-g1181742.html,Women X Pattern Adjustable Back Support Chest Breast Belt Band Posture Corrector,Sports Safety
19,$3.99,$5.99,https://www.jollychic.com/p/1-piece-elbow-pad-arm-sleeve-outdoor-sports-protector-fitness-equipment-g1181784.html,1 Piece Elbow Pad Arm Sleeve Outdoor Sports Protector Fitness Equipment,Sports Safety
99,$21.99,$34.99,https://www.jollychic.com/p/adjustable-posture-corrector-back-shoulder-lumbar-brace-spine-support-belt-g1181796.html,Adjustable Posture Corrector Back Shoulder Lumbar Brace Spine Support Belt,Sports Safety
67,$4.99,$7.99,https://www.jollychic.com/p/1-pair-lifting-straps-neoprene-padded-wrist-supports-assist-grip-strength-straps-g1216424.html,1 Pair Lifting Straps Neoprene Padded Wrist Supports Assist Grip Strength Straps,Sports Safety
61,$1.99,,https://www.jollychic.com/p/1-pair-tourmaline-magnetic-massage-therapy-self-heating-wrist-guard-g1216432.html,1 Pair Tourmaline Magnetic Massage Therapy Self Heating Wrist Guard,Sports Safety
71,$3.99,,https://www.jollychic.com/p/soft-magnetic-neck-support-protector-collar-pain-relief-heat-therapy-brace-strap-g1216436.html,Soft Magnetic Neck Support Protector Collar Pain Relief Heat Therapy Brace Strap,Sports Safety
12,$61.00,,https://www.jollychic.com/p/cycling-safety-bike-helmet-lightweight-ventilation-design-outdoor-equipment-g1256720.html,Cycling Safety Bike Helmet Lightweight Ventilation Design Outdoor Equipment,Sports Safety
45,$0.99,$2.99,https://www.jollychic.com/p/1-pair-foot-insoles-magnetic-therapy-health-care-massage-shoe-comfort-pads-g1256724.html,1 Pair Foot Insoles Magnetic Therapy Health Care Massage Shoe Comfort Pads,Sports Safety
49,$6.99,$10.99,https://www.jollychic.com/p/pressure-reducing-medical-orthotic-insoles-arch-support-pads-g1256726.html,Pressure Reducing Medical Orthotic Insoles Arch Support Pads,Sports Safety
37,$13.99,,https://www.jollychic.com/p/women-s-2pcs-kneelets-set-fashion-dance-yoga-joint-support-comfy-elastic-kneelets-g1339786.html,Women's 2Pcs Kneelets Set Fashion Dance Yoga Joint Support Comfy Elastic Kneelets,Sports Safety
151,$9.99,$17.99,https://www.jollychic.com/p/2pcs-push-ups-supportors-home-application-fitness-equipment-fashion-gym-accessory-g1344476.html,2Pcs Push-Ups Supportors Home Application Fitness Equipment Fashion Gym Accessory,Sports Safety
10,$9.99,$19.99,https://www.jollychic.com/p/lightweight-athletic-shoulder-brace-support-wrap-rotator-cuff-brace-g1388404.html,Lightweight Athletic Shoulder Brace Support Wrap Rotator Cuff Brace,Sports Safety
5,$24.99,,https://www.jollychic.com/p/sports-waistbelt-breathable-comfy-fitness-guard-g1424606.html,Sports Waistbelt Breathable Comfy Fitness Guard,Sports Safety
18,$27.99,,https://www.jollychic.com/p/adjustable-shoulder-brace-breathable-improved-waist-belt-back-posture-corrector-g1424608.html,Adjustable Shoulder Brace Breathable Improved Waist Belt Back Posture Corrector,Sports Safety
0,$18.99,,https://www.jollychic.com/p/guards-prevent-ankle-injury-keep-off-plantar-fascia-solid-color-stretchy-comfort-socks-g1630350.html,Guards Prevent Ankle Injury Keep Off Plantar Fascia Solid Color Stretchy Comfort Socks,Sports Safety
0,$9.99,,https://www.jollychic.com/p/guards-color-blocking-stretchy-comfort-wear-mountain-bike-riding-protection-protection-g1630416.html,Guards Color Blocking Stretchy Comfort Wear Mountain Bike Riding Protection Protection,Sports Safety
60,$11.99,,https://www.jollychic.com/p/men-s-knee-guard-anti-slip-shock-absorption-breathable-sports-knee-support-single-piece-g726790.html,Men's Knee Guard Anti-Slip Shock Absorption Breathable Sports Knee Support-Single Piece,Sports Safety
