add_wish,discount_price,original_price,product_link,product_name,header_block
377,$2.99,,https://www.jollychic.com/p/men-s-ankle-guard-wrap-type-pressurized-elastic-lightweight-sports-ankle-support-single-piece-g727524.html,Men's Ankle Guard Wrap Type Pressurized Elastic Lightweight Sports Ankle Support-Single Piece,Sports Safety
38,$12.99,$19.99,https://www.jollychic.com/p/men-s-sport-gear-comfortable-protective-elbow-pads-sport-accessories-g727646.html,Men's Sport Gear Comfortable Protective Elbow Pads Sport Accessories,Sports Safety
81,$3.99,$7.99,https://www.jollychic.com/p/men-s-ankle-guard-wrap-type-pressurized-elastic-lightweight-sports-ankle-guard-accessory-g727860.html,Men's Ankle Guard Wrap Type Pressurized Elastic Lightweight Sports Ankle Guard Accessory,Sports Safety
20,$3.99,$7.99,https://www.jollychic.com/p/men-s-knee-guard-1pcs-shock-absorption-climbing-outdoor-ventilate-sports-accessory-g730406.html,Men's Knee Guard 1Pcs Shock Absorption Climbing Outdoor Ventilate Sports Accessory,Sports Safety
102,$3.99,$7.99,https://www.jollychic.com/p/men-s-ankle-guard-1pcs-comforty-protective-climbing-breathable-sports-accessory-g730496.html,Men's Ankle Guard 1Pcs Comforty Protective Climbing Breathable Sports Accessory,Sports Safety
53,$6.99,,https://www.jollychic.com/p/men-s-leg-guard-1pcs-biking-lgiht-weight-design-solid-sports-accessory-g761542.html,Men's Leg Guard 1Pcs Biking Lgiht Weight Design Solid Sports Accessory,Sports Safety
79,$4.99,,https://www.jollychic.com/p/men-s-wrist-guard-durable-adjustable-striped-sports-wrist-guard-single-piece-g761618.html,Men's Wrist Guard Durable Adjustable Striped Sports Wrist Guard-Single Piece,Sports Safety
53,$2.99,,https://www.jollychic.com/p/men-s-wrist-guard-durable-adjustable-striped-sports-wrist-guard-single-piece-g766514.html,Men's Wrist Guard Durable Adjustable Striped Sports Wrist Guard-Single Piece,Sports Safety
34,$16.99,,https://www.jollychic.com/p/lining-men-s-ankle-guard-1-pc-breathable-durable-elastic-protective-sports-accessory-g785534.html,LINING Men's Ankle Guard 1 Pc Breathable Durable Elastic Protective Sports Accessory,Sports Safety
74,$12.99,$20.99,https://www.jollychic.com/p/men-s-ankle-protection-sports-socks-2pcs-athletic-breathable-socks-accessory-g802594.html,Men's Ankle Protection Sports Socks 2Pcs Athletic Breathable Socks Accessory,Sports Safety
7,$20.99,$32.99,https://www.jollychic.com/p/li-ning-sports-knee-guard-1-pc-high-quality-cozy-kneelet-accessory-g915786.html,Li Ning Sports Knee Guard 1 Pc High Quality Cozy Kneelet Accessory,Sports Safety
8,$26.99,,https://www.jollychic.com/p/li-ning-sports-guard-1pc-protection-patella-accessory-g915788.html,Li Ning Sports Guard 1Pc Protection Patella Accessory,Sports Safety
10,$17.99,,https://www.jollychic.com/p/li-ning-sports-guard-1pc-high-quality-cozy-protection-patella-accessory-g915790.html,Li Ning Sports Guard 1Pc High Quality Cozy Protection Patella Accessory,Sports Safety
11,$28.99,$44.99,https://www.jollychic.com/p/li-ning-sprain-protection-ankle-guard-1pc-high-quality-cozy-accessory-g915796.html,Li Ning Sprain Protection Ankle Guard 1Pc High Quality Cozy Accessory,Sports Safety
9,$15.99,,https://www.jollychic.com/p/li-ning-sports-wrist-protection-1pc-high-quality-sports-guard-accessory-g915798.html,Li Ning Sports Wrist Protection 1Pc High Quality Sports Guard Accessory,Sports Safety
11,$18.99,,https://www.jollychic.com/p/li-ning-sports-guard-1pc-protection-high-quality-soft-kneelet-accessory-g915804.html,Li Ning Sports Guard 1Pc Protection High Quality Soft Kneelet Accessory,Sports Safety
7,$8.99,,https://www.jollychic.com/p/men-s-elbow-guard-1pcs-crashworthy-adjustable-ventilate-sports-accessory-g933536.html,Men's Elbow Guard 1Pcs Crashworthy Adjustable Ventilate Sports Accessory,Sports Safety
40,$7.99,,https://www.jollychic.com/p/men-s-wrist-guard-1pcs-thumb-protection-stylish-sports-accessory-g933542.html,Men's Wrist Guard 1Pcs Thumb Protection Stylish Sports Accessory,Sports Safety
31,$5.99,$10.99,https://www.jollychic.com/p/sports-guard-knee-supporter-colorful-nylon-outdoor-breathable-kneecap-g945578.html,Sports Guard Knee Supporter Colorful Nylon Outdoor Breathable Kneecap,Sports Safety
14,$15.99,$26.99,https://www.jollychic.com/p/sports-guard-knee-support-silica-gel-outdoor-breathable-kneecap-g945588.html,Sports Guard Knee Support Silica Gel Outdoor Breathable Kneecap,Sports Safety
15,$6.99,$11.99,https://www.jollychic.com/p/sports-guard-knee-support-silica-gel-outdoor-breathable-kneecap-g945594.html,Sports Guard Knee Support Silica Gel Outdoor Breathable Kneecap,Sports Safety
22,$17.99,,https://www.jollychic.com/p/knee-support-guard-outdoor-breathable-kneecap-g945600.html,Knee Support Guard Outdoor Breathable Kneecap,Sports Safety
10,$37.99,,https://www.jollychic.com/p/lining-sports-guards-multi-functional-resilient-protective-bandage-g1013580.html,LiNing Sports Guards Multi functional Resilient Protective Bandage,Sports Safety
1,$51.00,,https://www.jollychic.com/p/lining-men-s-women-s-patella-retinaculum-running-elastic-cycling-sports-accessories-g1016486.html,LiNing Men's/Women's Patella Retinaculum Running Elastic Cycling Sports Accessories,Sports Safety
7,$2.99,$5.99,https://www.jollychic.com/p/yosoo-1-pc-arm-brace-elbow-band-wrap-comfy-adjustable-strap-g1095278.html,Yosoo 1 Pc Arm Brace Elbow Band Wrap Comfy Adjustable Strap,Sports Safety
22,$8.99,$13.99,https://www.jollychic.com/p/yosoo-1pc-black-thigh-wrap-silicone-anti-slip-strips-adjustable-brace-support-fitness-accessory-g1103190.html,Yosoo 1Pc Black Thigh Wrap Silicone Anti-slip Strips Adjustable Brace Support Fitness Accessory,Sports Safety
13,$13.99,$24.99,https://www.jollychic.com/p/yosoo-breathable-shoulder-brace-support-with-adjustable-strap-g1141542.html,Yosoo Breathable Shoulder Brace Support With Adjustable Strap,Sports Safety
16,$15.99,$27.99,https://www.jollychic.com/p/yosoo-groin-support-adjustable-elastic-fitness-equipment-g1141550.html,Yosoo Groin Support Adjustable Elastic Fitness Equipment,Sports Safety
15,$16.99,$25.99,https://www.jollychic.com/p/yosoo-shoulder-support-adjustable-wrap-belt-band-with-cold-compress-mesh-bag-g1141556.html,Yosoo Shoulder Support Adjustable Wrap Belt Band With Cold Compress Mesh Bag,Sports Safety
9,$8.99,$14.99,https://www.jollychic.com/p/yosoo-knee-guard-adjustable-patella-infrapatellar-strap-g1141580.html,Yosoo Knee Guard Adjustable Patella Infrapatellar Strap,Sports Safety
19,$20.99,,https://www.jollychic.com/p/yosoo-1-pair-ankle-brace-breathable-support-straps-fitness-equipment-g1142314.html,Yosoo 1 Pair Ankle Brace Breathable Support Straps Fitness Equipment,Sports Safety
14,$26.99,$40.99,https://www.jollychic.com/p/yosoo-heated-knee-pad-knee-wrap-brace-therapy-pad-with-pocket-g1147958.html,Yosoo Heated Knee Pad Knee Wrap Brace Therapy Pad with Pocket,Sports Safety
18,$9.99,$15.99,https://www.jollychic.com/p/yosoo-shank-band-adjustable-neoprene-splints-leg-compression-wrap-support-g1147960.html,Yosoo Shank Band Adjustable Neoprene Splints Leg Compression Wrap Support,Sports Safety
28,$11.99,$17.99,https://www.jollychic.com/p/wheel-up-cycling-gloves-half-finger-gel-mtb-road-antiskid-bicycle-gloves-g1181724.html,Wheel Up Cycling Gloves Half Finger Gel MTB Road Antiskid Bicycle Gloves,Sports Safety
13,$12.99,$19.99,https://www.jollychic.com/p/1-piece-adjustable-neoprene-sleeve-knee-brace-support-strap-kneecap-protector-g1181752.html,1 Piece Adjustable Neoprene Sleeve Knee Brace Support Strap Kneecap Protector,Sports Safety
4,$20.99,,https://www.jollychic.com/p/hot-cold-pack-gel-guard-wrap-shoulder-pain-sprains-strains-relief-band-g1216428.html,Hot Cold Pack Gel Guard Wrap Shoulder Pain Sprains Strains Relief Band,Sports Safety
14,$10.99,$22.99,https://www.jollychic.com/p/adjustable-waist-guard-stabilizing-pain-relieving-lumbar-back-brace-belt-g1216430.html,Adjustable Waist Guard Stabilizing Pain Relieving Lumbar Back Brace Belt,Sports Safety
5,$0.99,$2.99,https://www.jollychic.com/p/15-cm-fabric-gel-tube-guard-callus-corn-toes-separator-protective-cover-g1216434.html,15 cm Fabric Gel Tube Guard Callus Corn Toes Separator Protective Cover,Sports Safety
22,$15.99,,https://www.jollychic.com/p/7-pcs-safeguard-set-sports-exercise-protective-pads-set-outdoor-equipment-g1256722.html,7 Pcs Safeguard Set Sports Exercise Protective Pads Set Outdoor Equipment,Sports Safety
14,$12.99,,https://www.jollychic.com/p/fashion-elbow-guard-adjustable-elastic-washable-breathable-joint-support-sports-accessory-g1285850.html,Fashion Elbow Guard Adjustable Elastic Washable Breathable Joint Support Sports Accessory,Sports Safety
8,$24.99,,https://www.jollychic.com/p/waist-support-fashion-universal-solid-color-adjustable-warm-sports-waist-safety-accessory-g1285852.html,Waist Support Fashion Universal Solid Color Adjustable Warm Sports Waist Safety Accessory,Sports Safety
15,$14.99,,https://www.jollychic.com/p/sports-kneelet-fashion-universal-adjustable-elastic-joint-support-kneecap-accessory-g1285856.html,Sports Kneelet Fashion Universal Adjustable Elastic Joint Support Kneecap Accessory,Sports Safety
10,$21.99,$33.99,https://www.jollychic.com/p/sports-kneelet-fashion-universal-adjustable-elastic-joint-support-climbing-kneecap-g1285860.html,Sports Kneelet Fashion Universal Adjustable Elastic Joint Support Climbing Kneecap,Sports Safety
12,$6.99,$13.99,https://www.jollychic.com/p/sports-kneelet-fashion-universal-adjustable-joint-support-damping-patella-retinaculum-g1285862.html,Sports Kneelet Fashion Universal Adjustable Joint Support Damping Patella Retinaculum,Sports Safety
14,$7.99,$14.99,https://www.jollychic.com/p/fashion-elbow-guard-solid-color-adjustable-elastic-washable-joint-support-sports-accessory-g1285864.html,Fashion Elbow Guard Solid Color Adjustable Elastic Washable Joint Support Sports Accessory,Sports Safety
11,$11.99,$20.99,https://www.jollychic.com/p/bandage-guards-fashion-high-elastic-adjustable-velcro-comfy-breathable-sports-protector-g1339794.html,Bandage Guards Fashion High-Elastic Adjustable Velcro Comfy Breathable Sports Protector,Sports Safety
9,$23.99,$36.99,https://www.jollychic.com/p/women-s-waist-support-fashion-solid-color-wool-warm-cold-proof-comfy-breathable-waist-safety-g1339796.html,Women's Waist Support Fashion Solid Color Wool Warm Cold-Proof Comfy Breathable Waist Safety,Sports Safety
12,$13.99,,https://www.jollychic.com/p/adjustable-elbow-brace-wrap-arm-support-fitness-equipment-g1388406.html,Adjustable Elbow Brace Wrap Arm Support Fitness Equipment,Sports Safety
3,$13.99,$23.99,https://www.jollychic.com/p/lining-cuffs-2-pcs-fashion-jacquard-elastic-unisex-fitness-sports-accessory-g1498604.html,LiNing Cuffs 2 Pcs Fashion Jacquard Elastic Unisex Fitness Sports Accessory,Sports Safety
5,$12.99,$22.99,https://www.jollychic.com/p/lining-cuffs-2-pcs-all-match-elastic-fashion-unisex-fitness-sports-accessory-g1498606.html,LiNing Cuffs 2 Pcs All Match Elastic Fashion Unisex Fitness Sports Accessory,Sports Safety
1,$20.99,$36.99,https://www.jollychic.com/p/lining-kneelets-2-pcs-fashion-elastic-all-match-unisex-fitness-sports-accessory-g1498610.html,LiNing Kneelets 2 Pcs Fashion Elastic All Match Unisex Fitness Sports Accessory,Sports Safety
1,$26.99,$43.99,https://www.jollychic.com/p/lining-kneelets-2-pcs-fashion-all-match-elastic-unisex-fitness-sports-accessory-g1498612.html,LiNing Kneelets 2 Pcs Fashion All Match Elastic Unisex Fitness Sports Accessory,Sports Safety
