add_wish,discount_price,original_price,product_link,product_name,header_block
259,$2.99,$5.99,https://www.jollychic.com/p/men-s-knee-guard-shock-absorption-anti-skid-pressurized-comfy-sports-knee-support-single-piece-g726954.html,Men's Knee Guard Shock Absorption Anti-Skid Pressurized Comfy Sports Knee Support-Single Piece,Sports Safety
37,$5.99,$11.99,https://www.jollychic.com/p/men-s-knee-guard-stable-spring-support-durable-anti-skid-sports-knee-support-single-piece-g727622.html,Men's Knee Guard Stable Spring Support Durable Anti-Skid Sports Knee Support-Single Piece,Sports Safety
68,$19.99,$30.99,https://www.jollychic.com/p/men-s-sport-protective-cloth-useful-comfy-soft-breathable-sportwear-g727648.html,Men's Sport Protective Cloth Useful Comfy Soft Breathable Sportwear,Sports Safety
150,$17.99,$34.99,https://www.jollychic.com/p/men-s-sport-shoulder-bandage-adjustable-strap-injury-prevention-sportwear-g727650.html,Men's Sport Shoulder Bandage Adjustable Strap Injury Prevention Sportwear,Sports Safety
82,$20.99,$34.99,https://www.jollychic.com/p/4-pcs-sport-accessories-set-durable-comfy-knee-elbow-motorcycle-gear-set-g727702.html,4 Pcs Sport Accessories Set Durable Comfy Knee Elbow Motorcycle Gear Set,Sports Safety
117,$5.99,,https://www.jollychic.com/p/men-s-knee-guard-wrap-type-lightweight-breathable-adjustable-sports-knee-support-single-piece-g727718.html,Men's Knee Guard Wrap Type Lightweight Breathable Adjustable Sports Knee Support-Single Piece,Sports Safety
77,$0.99,,https://www.jollychic.com/p/men-s-sports-guard-durable-sweat-absorption-wrist-band-accessory-g728332.html,Men's Sports Guard Durable Sweat Absorption Wrist Band Accessory,Sports Safety
123,$1.99,$2.99,https://www.jollychic.com/p/men-s-sports-guard-durable-sweat-absorption-knee-protection-accessory-g729578.html,Men's Sports Guard Durable Sweat Absorption Knee Protection Accessory,Sports Safety
195,$1.99,,https://www.jollychic.com/p/men-s-wrist-band-durable-breathable-sport-accessory-g730060.html,Men's Wrist Band Durable Breathable Sport Accessory,Sports Safety
339,$3.99,,https://www.jollychic.com/p/men-s-knee-guard-sports-outdoor-ventialte-soft-comfy-knee-support-single-piece-g730066.html,Men's Knee Guard Sports Outdoor Ventialte Soft Comfy Knee Support-Single Piece,Sports Safety
29,$2.99,,https://www.jollychic.com/p/men-s-finger-guard-10pcs-leisure-comfortable-solid-color-outdoor-sports-accessory-g730144.html,Men's Finger Guard 10Pcs Leisure Comfortable Solid Color Outdoor Sports Accessory,Sports Safety
47,$3.99,$7.99,https://www.jollychic.com/p/men-s-elbow-guard-1pcs-adjustable-wrap-outdoor-sports-breathable-accessory-g730240.html,Men's Elbow Guard 1Pcs Adjustable Wrap Outdoor Sports Breathable Accessory,Sports Safety
48,$8.99,,https://www.jollychic.com/p/men-s-elbow-guard-1pcs-adjustable-pressure-anticollision-comforty-sports-accessory-g730274.html,Men's Elbow Guard 1Pcs Adjustable Pressure Anticollision Comforty Sports Accessory,Sports Safety
99,$1.99,,https://www.jollychic.com/p/men-s-oversleeve-guard-sun-protect-outdoor-elastic-sleevelet-sport-accessory-g731648.html,Men's Oversleeve Guard Sun Protect Outdoor Elastic Sleevelet Sport Accessory,Sports Safety
87,$3.99,,https://www.jollychic.com/p/men-s-sports-guard-durable-sweat-absorption-elbow-protection-accessory-g744854.html,Men's Sports Guard Durable Sweat Absorption Elbow Protection Accessory,Sports Safety
120,$3.99,$6.99,https://www.jollychic.com/p/men-s-sports-guard-mouth-guard-portable-convenient-moth-guard-sports-accessory-g752508.html,Men's Sports Guard Mouth Guard Portable Convenient Moth Guard Sports Accessory,Sports Safety
33,$1.99,$6.99,https://www.jollychic.com/p/men-s-wrist-guard-durable-adjustable-metal-support-sports-wrist-guard-single-piece-g761496.html,Men's Wrist Guard Durable Adjustable Metal Support Sports Wrist Guard-Single Piece,Sports Safety
14,$2.99,,https://www.jollychic.com/p/men-s-wrist-guard-breathable-adjustable-basketball-sports-accessory-g761512.html,Men's Wrist Guard Breathable Adjustable Basketball Sports Accessory,Sports Safety
359,$9.99,,https://www.jollychic.com/p/men-s-leg-guard-2pcs-support-weight-design-solid-sports-accessory-g761632.html,Men's Leg Guard 2Pcs Support Weight Design Solid Sports Accessory,Sports Safety
242,$8.99,,https://www.jollychic.com/p/men-s-leg-guard-1pcs-candy-color-design-warm-sports-accessory-g766624.html,Men's Leg Guard 1Pcs Candy Color Design Warm Sports Accessory,Sports Safety
95,$17.99,$26.99,https://www.jollychic.com/p/men-s-elbow-guard-portable-all-match-durable-protective-sports-accessory-g784568.html,Men's Elbow Guard Portable All Match Durable Protective Sports Accessory,Sports Safety
68,$12.99,$19.99,https://www.jollychic.com/p/women-s-sports-helmet-solid-color-all-match-durable-sports-accessory-g784870.html,Women's Sports Helmet Solid Color All Match Durable Sports Accessory,Sports Safety
31,$47.99,,https://www.jollychic.com/p/men-s-sports-helmet-trendy-cycling-all-match-durable-sports-accessory-g784958.html,Men's Sports Helmet Trendy Cycling All Match Durable Sports Accessory,Sports Safety
16,$9.99,,https://www.jollychic.com/p/lining-men-s-elbow-guard-lightweight-portable-universal-elbow-guard-single-piece-g785080.html,LINING Men's Elbow Guard Lightweight Portable Universal Elbow Guard-Single Piece,Sports Safety
99,$8.99,$14.99,https://www.jollychic.com/p/men-s-elbow-guard-durable-universal-lightweight-long-sports-accessory-g785088.html,Men's Elbow Guard Durable Universal Lightweight Long Sports Accessory,Sports Safety
15,$27.99,$40.99,https://www.jollychic.com/p/lining-men-s-knee-guard-cozy-elastic-durable-universal-sports-accessory-single-piece-g785356.html,LINING Men's Knee Guard Cozy Elastic Durable Universal Sports Accessory-Single Piece,Sports Safety
501,$9.99,,https://www.jollychic.com/p/women-s-guards-waterproof-patchwork-silica-gel-sports-accessories-g903482.html,Women's Guards Waterproof Patchwork Silica Gel Sports Accessories,Sports Safety
39,$11.99,,https://www.jollychic.com/p/li-ning-sports-sprain-guard-1pc-protection-ankle-guard-accessory-g915792.html,Li Ning Sports Sprain Guard 1Pc Protection Ankle Guard Accessory,Sports Safety
30,$17.99,,https://www.jollychic.com/p/li-ning-sports-high-quality-1pc-sprain-protection-ankle-guard-accessory-g915794.html,Li Ning Sports High Quality 1Pc Sprain Protection Ankle Guard Accessory,Sports Safety
14,$27.99,$42.99,https://www.jollychic.com/p/li-ning-sports-guard-1pc-high-quality-durable-kneelet-accessory-g915800.html,Li Ning Sports Guard 1Pc High Quality Durable Kneelet Accessory,Sports Safety
46,$9.99,$13.99,https://www.jollychic.com/p/li-ning-sports-guard-1pc-unisex-elastic-protection-kneelet-accessory-g915808.html,Li Ning Sports Guard 1Pc Unisex Elastic Protection Kneelet Accessory,Sports Safety
18,$7.99,,https://www.jollychic.com/p/men-s-elbow-guard-1pcs-adjustable-light-durable-sports-accessory-g933530.html,Men's Elbow Guard 1Pcs Adjustable Light Durable Sports Accessory,Sports Safety
14,$3.99,$8.99,https://www.jollychic.com/p/men-s-elbow-guard-1pcs-adjustable-comforty-protective-sports-accessory-g933532.html,Men's Elbow Guard 1Pcs Adjustable Comforty Protective Sports Accessory,Sports Safety
57,$4.99,$9.99,https://www.jollychic.com/p/men-s-elbow-guard-2pcs-light-weight-solid-color-breathable-sports-accessory-g933534.html,Men's Elbow Guard 2Pcs Light Weight Solid Color Breathable Sports Accessory,Sports Safety
44,$6.99,,https://www.jollychic.com/p/men-s-wrist-guard-1pcs-outdoor-anti-sprain-thumb-protection-sports-accessory-g933538.html,Men's Wrist Guard 1Pcs Outdoor Anti Sprain Thumb Protection Sports Accessory,Sports Safety
15,$1.99,$5.99,https://www.jollychic.com/p/men-s-wrist-guard-lengthen-breathable-cozy-letter-patttern-sports-accessory-g933546.html,Men's Wrist Guard Lengthen Breathable Cozy Letter Patttern Sports Accessory,Sports Safety
52,$15.99,,https://www.jollychic.com/p/compress-elastic-heat-detachable-waist-supporter-belt-g945550.html,Compress Elastic Heat Detachable Waist Supporter Belt,Sports Safety
79,$5.99,$10.99,https://www.jollychic.com/p/compress-elastic-breathable-waist-supporter-belt-for-fitness-g945554.html,Compress Elastic Breathable Waist Supporter Belt For Fitness,Sports Safety
24,$11.99,$19.99,https://www.jollychic.com/p/compress-elastic-springs-breathable-waist-supporter-belt-for-fitness-g945556.html,Compress Elastic Springs Breathable Waist Supporter Belt For Fitness,Sports Safety
114,$13.99,,https://www.jollychic.com/p/sports-guard-knee-supporter-non-slip-silica-gel-unisex-outdoor-breathable-kneecap-g945572.html,Sports Guard Knee Supporter Non Slip Silica Gel Unisex Outdoor Breathable Kneecap,Sports Safety
43,$12.99,,https://www.jollychic.com/p/knee-guard-supporter-lightweight-running-outdoor-breathable-kneecap-g945576.html,Knee Guard Supporter Lightweight Running Outdoor Breathable Kneecap,Sports Safety
38,$7.99,,https://www.jollychic.com/p/sports-guard-knee-supporter-lightweight-outdoor-breathable-kneecape-g945582.html,Sports Guard Knee Supporter Lightweight Outdoor Breathable Kneecape,Sports Safety
271,$4.99,,https://www.jollychic.com/p/sports-guard-knee-support-keep-warm-outdoor-breathable-kneecap-g945590.html,Sports Guard Knee Support Keep Warm Outdoor Breathable Kneecap,Sports Safety
111,$4.99,$8.99,https://www.jollychic.com/p/sports-guards-breathable-cozy-kneelet-length-knee-guard-accessory-g945592.html,Sports Guards Breathable Cozy Kneelet Length Knee Guard Accessory,Sports Safety
843,$8.99,,https://www.jollychic.com/p/sports-guard-knee-collision-proof-support-outdoor-breathable-kneecap-g945604.html,Sports Guard Knee Collision Proof Support Outdoor Breathable Kneecap,Sports Safety
21,$15.99,$26.99,https://www.jollychic.com/p/compress-elastic-steel-panel-breathable-waist-supporter-belt-for-fitness-g946580.html,Compress Elastic Steel Panel Breathable Waist Supporter Belt For Fitness,Sports Safety
12,$8.99,,https://www.jollychic.com/p/waist-protect-fluffy-keep-warm-stomach-protect-old-people-waist-support-g946586.html,Waist Protect Fluffy Keep Warm Stomach Protect Old People Waist Support,Sports Safety
19,$3.99,$6.99,https://www.jollychic.com/p/elbow-guard-adjustable-pressure-anticollision-comforty-sports-accessory-g946590.html,Elbow Guard Adjustable Pressure Anticollision Comforty Sports Accessory,Sports Safety
30,$8.99,,https://www.jollychic.com/p/1pc-men-s-sports-wrist-guard-palm-protection-sport-accessory-g964554.html,1Pc Men's Sports Wrist Guard Palm Protection Sport Accessory,Sports Safety
27,$8.99,,https://www.jollychic.com/p/men-s-ankle-guard-multifunctional-running-antislip-bandage-protection-accessory-g964560.html,Men's Ankle Guard Multifunctional Running Antislip Bandage Protection Accessory,Sports Safety
58,$2.99,$5.99,https://www.jollychic.com/p/one-piece-men-s-foot-thumb-guard-fixing-protection-sports-accessory-g964572.html,One Piece Men's Foot Thumb Guard Fixing Protection Sports Accessory,Sports Safety
8,$21.99,$37.99,https://www.jollychic.com/p/lining-sports-guards-couples-solid-color-wrist-protective-sports-accessory-g1013652.html,LiNing Sports Guards Couples Solid Color Wrist Protective Sports Accessory,Sports Safety
9,$21.99,$37.99,https://www.jollychic.com/p/lining-sports-guards-couples-solid-color-resilient-wrist-protective-sports-accessory-g1013752.html,LiNing Sports Guards Couples Solid Color Resilient Wrist Protective Sports Accessory,Sports Safety
7,$43.99,$82.00,https://www.jollychic.com/p/lining-men-s-women-s-waist-surport-running-outdoor-sports-accessories-g1016254.html,LiNing Men's/Women's Waist Surport Running Outdoor Sports Accessories,Sports Safety
207,$1.99,$5.99,https://www.jollychic.com/p/women-s-arm-guard-one-pair-solid-color-sun-protection-sports-sleevelet-g1024160.html,Women's Arm Guard One Pair Solid Color Sun Protection Sports Sleevelet,Sports Safety
11,$1.99,$3.99,https://www.jollychic.com/p/yosoo-2-pairs-sole-pads-skin-color-pu-skid-resistant-comfy-foot-pads-g1093646.html,Yosoo 2 Pairs Sole Pads Skin Color PU Skid Resistant Comfy Foot Pads,Sports Safety
32,$4.99,$10.99,https://www.jollychic.com/p/yosoo-1-pair-knee-guard-running-elastic-fitness-unisex-fitness-equipments-g1093674.html,Yosoo 1 Pair Knee Guard Running Elastic Fitness Unisex Fitness Equipments,Sports Safety
22,$7.99,$12.99,https://www.jollychic.com/p/yosoo-thumb-splint-1-pc-solid-color-breathable-adjustable-neoprene-strap-g1095270.html,Yosoo Thumb Splint 1 Pc Solid Color Breathable Adjustable Neoprene Strap,Sports Safety
20,$7.99,$12.99,https://www.jollychic.com/p/yosoo-1-piece-arm-sling-dislocated-adjustable-shoulder-sling-fitness-training-accessory-g1100462.html,Yosoo 1 Piece Arm Sling Dislocated Adjustable Shoulder Sling Fitness Training Accessory,Sports Safety
14,$5.99,$8.99,https://www.jollychic.com/p/yosoo-adjustable-elbow-brace-wrap-arm-support-strap-band-fitness-equipment-g1100464.html,Yosoo Adjustable Elbow Brace Wrap Arm Support Strap Band Fitness Equipment,Sports Safety
42,$3.99,$5.99,https://www.jollychic.com/p/yosoo-2-pairs-heel-pads-grips-liners-comfy-back-heel-cushion-insoles-g1100466.html,Yosoo 2 Pairs Heel Pads Grips Liners Comfy Back Heel Cushion Insoles,Sports Safety
16,$2.99,$5.99,https://www.jollychic.com/p/yosoo-comfortable-anti-snoring-chin-straps-professional-sleep-snore-guard-g1100468.html,Yosoo Comfortable Anti Snoring Chin Straps Professional Sleep Snore Guard,Sports Safety
41,$4.99,,https://www.jollychic.com/p/yosoo-1-pc-wrist-brace-wrap-carpal-tunnel-arthritis-pain-relief-accessory-g1103188.html,Yosoo 1 Pc Wrist Brace Wrap Carpal Tunnel Arthritis Pain Relief Accessory,Sports Safety
28,$8.99,,https://www.jollychic.com/p/yosoo-1-pc-wrist-splint-supporter-left-hand-fitness-accessory-g1103192.html,Yosoo 1 Pc Wrist Splint Supporter Left Hand Fitness Accessory,Sports Safety
29,$17.99,,https://www.jollychic.com/p/yosoo-waist-surpport-elastic-outdoor-sports-accessory-g1103196.html,Yosoo Waist Surpport Elastic Outdoor Sports Accessory,Sports Safety
65,$8.99,$15.99,https://www.jollychic.com/p/1-pc-yosoo-back-posture-corrector-adjustable-clavicle-posture-support-strap-g1103198.html,1 Pc Yosoo Back Posture Corrector Adjustable Clavicle Posture Support Strap,Sports Safety
19,$13.99,$23.99,https://www.jollychic.com/p/yosoo-shoulder-support-wrap-belt-band-utility-fitness-equipment-g1141568.html,Yosoo Shoulder Support Wrap Belt Band Utility Fitness Equipment,Sports Safety
9,$11.99,$18.99,https://www.jollychic.com/p/yosoo-single-adjustable-knee-support-brace-fitness-equipment-g1141572.html,Yosoo Single Adjustable Knee Support Brace Fitness Equipment,Sports Safety
22,$7.99,$12.99,https://www.jollychic.com/p/yosoo-1-pair-knee-guard-running-elastic-fitness-unisex-fitness-equipments-g1141574.html,Yosoo 1 Pair Knee Guard Running Elastic Fitness Unisex Fitness Equipments,Sports Safety
29,$4.99,$8.99,https://www.jollychic.com/p/yosoo-1-pair-bunion-sleeve-protector-metatarsal-toe-pad-forefoot-cushion-socks-booties-g1142166.html,Yosoo 1 Pair Bunion Sleeve Protector Metatarsal Toe Pad Forefoot Cushion Socks Booties,Sports Safety
9,$9.99,,https://www.jollychic.com/p/yosoo-1-pair-wrist-straps-belt-support-elastic-fitness-equipment-g1142168.html,Yosoo 1 Pair Wrist Straps Belt Support Elastic Fitness Equipment,Sports Safety
38,$3.99,$5.99,https://www.jollychic.com/p/yosoo-4-pairs-gel-toe-separator-stretcher-bunion-corrector-g1142208.html,Yosoo 4 Pairs Gel Toe Separator Stretcher Bunion Corrector,Sports Safety
28,$3.99,$5.99,https://www.jollychic.com/p/yosoo-4-pairs-gel-toe-separators-bunion-corrector-fitness-equipment-g1142210.html,Yosoo 4 Pairs Gel Toe Separators Bunion Corrector Fitness Equipment,Sports Safety
44,$7.99,$12.99,https://www.jollychic.com/p/yosoo-lightweight-athletic-right-shoulder-brace-support-wrap-rotator-cuff-brace-g1142214.html,Yosoo Lightweight Athletic Right Shoulder Brace Support Wrap Rotator Cuff Brace,Sports Safety
31,$7.99,$12.99,https://www.jollychic.com/p/yosoo-lightweight-athletic-left-shoulder-brace-support-wrap-rotator-cuff-brace-g1142216.html,Yosoo Lightweight Athletic Left Shoulder Brace Support Wrap Rotator Cuff Brace,Sports Safety
74,$5.99,$10.99,https://www.jollychic.com/p/yosoo-2-pairs-of-plantar-fasciitis-gel-heel-protectors-g1142220.html,Yosoo 2 Pairs of Plantar Fasciitis Gel Heel Protectors,Sports Safety
56,$7.99,$12.99,https://www.jollychic.com/p/yosoo-2-pairs-large-size-heel-moisturizing-silicone-sock-fitness-equipment-g1142280.html,Yosoo 2 Pairs Large size Heel Moisturizing Silicone Sock Fitness Equipment,Sports Safety
9,$4.99,,https://www.jollychic.com/p/yosoo-unisex-wide-bandana-multi-style-yoga-headband-sweatband-g1142282.html,Yosoo Unisex Wide Bandana Multi Style Yoga Headband Sweatband,Sports Safety
41,$3.99,$5.99,https://www.jollychic.com/p/yosoo-4-pairs-toe-separators-gel-bunion-corrector-protector-spacer-g1142284.html,Yosoo 4 Pairs Toe Separators Gel Bunion Corrector Protector Spacer,Sports Safety
27,$3.99,$5.99,https://www.jollychic.com/p/yosoo-2-pairs-forefoot-pads-anti-slip-gel-metatarsal-cushion-insole-g1142286.html,Yosoo 2 Pairs Forefoot Pads Anti Slip Gel Metatarsal Cushion Insole,Sports Safety
56,$4.99,$8.99,https://www.jollychic.com/p/yosoo-2-pairs-shoes-insoles-insert-foot-pad-heel-cushion-cups-support-g1142288.html,Yosoo 2 Pairs Shoes Insoles Insert Foot Pad Heel Cushion Cups Support,Sports Safety
43,$28.99,$43.99,https://www.jollychic.com/p/yosoo-posture-corrector-back-brace-adjustable-with-waist-support-straps-g1142290.html,Yosoo Posture Corrector Back Brace Adjustable with Waist Support Straps,Sports Safety
10,$12.99,$20.99,https://www.jollychic.com/p/yosoo-1-pair-ankle-brace-breathable-elastic-support-straps-g1142312.html,Yosoo 1 Pair Ankle Brace Breathable Elastic Support Straps,Sports Safety
47,$6.99,$10.99,https://www.jollychic.com/p/yosoo-2-pairs-gel-heel-sleeves-ankle-socks-with-a-massage-ball-g1147914.html,Yosoo 2 Pairs Gel Heel Sleeves Ankle Socks with a Massage Ball,Sports Safety
28,$7.99,,https://www.jollychic.com/p/yosoo-leg-sleeve-elastic-concealed-ankle-pouch-fitness-equipment-g1147916.html,Yosoo Leg Sleeve Elastic Concealed Ankle Pouch Fitness Equipment,Sports Safety
28,$3.99,$5.99,https://www.jollychic.com/p/yosoo-2-pairs-sole-pad-anti-slip-gel-metatarsal-foot-cushions-pad-beige-black--g1147920.html,Yosoo 2 Pairs Sole Pad Anti Slip Gel Metatarsal Foot Cushions Pad (Beige+Black),Sports Safety
20,$19.99,,https://www.jollychic.com/p/yosoo-ankle-holster-adjustable-elastic-wrap-with-carry-gun-holster-g1147926.html,Yosoo Ankle Holster Adjustable Elastic Wrap with Carry Gun Holster,Sports Safety
31,$2.99,$4.99,https://www.jollychic.com/p/yosoo-2-pairs-gel-toe-separator-toe-spacers-toe-stretchers-fitness-equipment-g1147940.html,Yosoo 2 Pairs Gel Toe Separator Toe Spacers Toe Stretchers Fitness Equipment,Sports Safety
26,$23.99,$39.99,https://www.jollychic.com/p/yosoo-large-size-back-adjustable-brace-with-4-steel-stabilizers-protection-waistband-g1147944.html,Yosoo Large Size Back Adjustable Brace with 4 Steel Stabilizers Protection Waistband,Sports Safety
18,$34.99,$53.00,https://www.jollychic.com/p/yosoo-heated-shoulder-brace-adjustable-neoprene-shoulder-with-mesh-bag-g1147950.html,Yosoo Heated Shoulder Brace Adjustable Neoprene Shoulder with Mesh Bag,Sports Safety
29,$3.99,$6.99,https://www.jollychic.com/p/yosoo-2-pairs-gel-toe-separator-bunion-corrector-straightener-g1147952.html,Yosoo 2 Pairs Gel Toe Separator Bunion Corrector Straightener,Sports Safety
18,$12.99,,https://www.jollychic.com/p/yosoo-1-pair-breathable-ankle-braces-wraps-foot-sleeve-g1158222.html,Yosoo 1 Pair Breathable Ankle Braces Wraps Foot Sleeve,Sports Safety
32,$5.99,,https://www.jollychic.com/p/sports-guard-2pcs-knee-guard-elastic-breathable-cozy-kneelet-accessory-g1177632.html,Sports Guard 2Pcs Knee Guard Elastic Breathable Cozy Kneelet Accessory,Sports Safety
54,$3.99,$5.99,https://www.jollychic.com/p/jaw-sleeping-support-strap-anti-snoring-belt-with-hem--g1181708.html,Jaw Sleeping Support Strap Anti Snoring Belt(With Hem),Sports Safety
48,$8.99,$13.99,https://www.jollychic.com/p/adult-humpbacked-prevent-posture-correction-shoulder-back-support-belt-l--g1181710.html,Adult Humpbacked Prevent Posture Correction Shoulder Back Support Belt (L),Sports Safety
15,$8.99,$13.99,https://www.jollychic.com/p/5-pcs-bunion-corrector-protector-relief-bunion-cushion-toe-separators-g1181730.html,5 Pcs Bunion Corrector Protector Relief Bunion Cushion Toe Separators,Sports Safety
48,$9.99,,https://www.jollychic.com/p/1-pair-silicone-gel-socks-moisturizing-hollow-out-breathable-protector-g1181736.html,1 Pair Silicone Gel Socks Moisturizing Hollow Out Breathable Protector,Sports Safety
20,$8.99,$14.99,https://www.jollychic.com/p/1-pair-wrist-wraps-adjustable-wrist-wraps-support-brace-with-thumb-stabilizer-g1181762.html,1 Pair Wrist Wraps Adjustable Wrist Wraps Support Brace with Thumb Stabilizer,Sports Safety
18,$3.99,$7.99,https://www.jollychic.com/p/foot-thongs-dance-paw-pad-half-sole-fitness-accessories-g1181776.html,Foot Thongs Dance Paw Pad Half Sole Fitness Accessories,Sports Safety
22,$3.99,$5.99,https://www.jollychic.com/p/1-pair-therapy-gloves-gel-filled-thumb-hand-wrist-support-arthritis-compression-g1181786.html,1 Pair Therapy Gloves Gel Filled Thumb Hand Wrist Support Arthritis Compression,Sports Safety
10,$6.99,$10.99,https://www.jollychic.com/p/1-pair-toe-bunion-splint-straightener-corrector-fitness-guards-g1181790.html,1 Pair Toe Bunion Splint Straightener Corrector Fitness Guards,Sports Safety
15,$5.99,$9.99,https://www.jollychic.com/p/5-pieces-finger-protector-support-sports-brace-splint-sleeve-guard-bands-wrap-g1181804.html,5 Pieces Finger Protector Support Sports Brace Splint Sleeve Guard Bands Wrap,Sports Safety
16,$2.99,$5.99,https://www.jollychic.com/p/1-pair-lifting-straps-neoprene-padded-wrist-support-hook-wraps-g1216426.html,1 Pair Lifting Straps Neoprene Padded Wrist Support Hook Wraps,Sports Safety
13,$49.99,,https://www.jollychic.com/p/nike-1-piece-ankle-sleeve-breathable-support-straps-fitness-equipment-g1284616.html,Nike 1 Piece Ankle Sleeve Breathable Support Straps Fitness Equipment,Sports Safety
15,$6.99,,https://www.jollychic.com/p/10pcs-finger-protector-sleeves-elastic-washable-joint-care-sports-finger-sleeves-g1285844.html,10Pcs Finger Protector Sleeves Elastic Washable Joint Care Sports Finger Sleeves,Sports Safety
21,$19.99,,https://www.jollychic.com/p/fashion-elbow-guard-solid-color-adjustable-elastic-washable-joint-support-sports-accessory-g1285846.html,Fashion Elbow Guard Solid Color Adjustable Elastic Washable Joint Support Sports Accessory,Sports Safety
13,$7.99,$14.99,https://www.jollychic.com/p/wrist-guard-fashion-solid-color-adjustable-elastic-joint-support-cuff-sports-accessory-g1285848.html,Wrist Guard Fashion Solid Color Adjustable Elastic Joint Support Cuff Sports Accessory,Sports Safety
7,$61.00,,https://www.jollychic.com/p/waist-support-fashion-universal-adjustable-elastic-warm-sports-waist-safety-accessory-g1285854.html,Waist Support Fashion Universal Adjustable Elastic Warm Sports Waist Safety Accessory,Sports Safety
17,$6.99,$14.99,https://www.jollychic.com/p/fashion-ankle-guard-universal-solid-color-adjustable-elastic-joint-support-sports-accessory-g1285858.html,Fashion Ankle Guard Universal Solid Color Adjustable Elastic Joint Support Sports Accessory,Sports Safety
11,$16.99,$27.99,https://www.jollychic.com/p/sports-kneelet-fashion-universal-adjustable-joint-support-damping-velcro-kneecap-g1286364.html,Sports Kneelet Fashion Universal Adjustable Joint Support Damping Velcro Kneecap,Sports Safety
14,$14.99,,https://www.jollychic.com/p/sports-kneelet-fashion-universal-adjustable-joint-support-warm-elastic-kneecap-g1339772.html,Sports Kneelet Fashion Universal Adjustable Joint Support Warm Elastic Kneecap,Sports Safety
16,$13.99,$27.99,https://www.jollychic.com/p/women-s-2pcs-kneelets-set-solid-color-cashmere-warm-lengthen-comfy-elastic-kneelets-g1339782.html,Women's 2Pcs Kneelets Set Solid Color Cashmere Warm Lengthen Comfy Elastic Kneelets,Sports Safety
15,$7.99,$14.99,https://www.jollychic.com/p/patella-retinaculum-fashion-universal-adjustable-joint-support-damping-sports-kneelet-g1339790.html,Patella Retinaculum Fashion Universal Adjustable Joint Support Damping Sports Kneelet,Sports Safety
38,$6.99,,https://www.jollychic.com/p/waist-support-fashion-universal-adjustable-elastic-sports-waist-safety-slimming-waist-belt-g1343900.html,Waist Support Fashion Universal Adjustable Elastic Sports Waist Safety Slimming Waist Belt,Sports Safety
11,$1.99,$9.99,https://www.jollychic.com/p/wrist-bracer-mesh-adjustable-waist-support-guard-g1391966.html,Wrist Bracer Mesh Adjustable Waist Support Guard,Sports Safety
2,$20.99,$33.99,https://www.jollychic.com/p/lining-kneelets-2-pcs-all-match-elastic-unisex-fashion-fitness-sports-accessory-g1498608.html,LiNing Kneelets 2 Pcs All Match Elastic Unisex Fashion Fitness Sports Accessory,Sports Safety
21,$4.99,$12.99,https://www.jollychic.com/p/professional-kneecap-guard-outdoor-sports-non-slip-type-fitness-equipment-g1527170.html,Professional Kneecap Guard Outdoor Sports Non Slip Type Fitness Equipment,Sports Safety
5,$12.99,$21.99,https://www.jollychic.com/p/support-knee-guard-knitted-protective-clothing-silicone-anti-collision-sports-accessory-g1527174.html,Support Knee Guard Knitted Protective Clothing Silicone Anti Collision Sports Accessory,Sports Safety
8,$8.99,,https://www.jollychic.com/p/foot-pads-foot-heel-pain-relief-plantar-fasciitis-insole-support-shoes-insert-pads-g1539662.html,Foot Pads Foot Heel Pain Relief Plantar Fasciitis Insole Support Shoes Insert Pads,Sports Safety
60,$4.99,,https://www.jollychic.com/p/men-s-wrist-guard-comfortable-velcro-adjustable-wrap-type-sports-wrist-support-brace-single-piece-g726876.html,Men's Wrist Guard Comfortable Velcro Adjustable Wrap Type Sports Wrist Support Brace-Single Piece,Sports Safety
