add_wish,discount_price,original_price,product_link,product_name,header_block
23,$10.99,$18.99,https://www.jollychic.com/p/men-s-sunglasses-polarized-style-leisure-fashion-design-glasses-accessory-g650178.html,Men's Sunglasses Polarized Style Leisure Fashion Design Glasses Accessory,Outdoor glasses
25,$9.99,$18.99,https://www.jollychic.com/p/men-s-sunglasses-alloy-frame-fashion-leisure-sports-polarized-glasses-accessory-g650180.html,Men's Sunglasses Alloy Frame Fashion Leisure Sports Polarized Glasses Accessory,Outdoor glasses
28,$11.99,$18.99,https://www.jollychic.com/p/men-s-sunglasses-vogue-polarized-outdoor-handsome-glasses-accessory-g650182.html,Men's Sunglasses Vogue Polarized Outdoor Handsome Glasses Accessory,Outdoor glasses
27,$10.99,$18.99,https://www.jollychic.com/p/men-s-sunglasses-rimless-outdoor-cycling-polarized-glasses-accessory-g650184.html,Men's Sunglasses Rimless Outdoor Cycling Polarized Glasses Accessory,Outdoor glasses
16,$9.99,$25.99,https://www.jollychic.com/p/men-s-sunglasses-cycling-fashion-outdoor-polarized-rimless-glasses-accessory-g669386.html,Men's Sunglasses Cycling Fashion Outdoor Polarized Rimless Glasses Accessory,Outdoor glasses
10,$12.99,$25.99,https://www.jollychic.com/p/men-s-sunglasses-vogue-outdoor-casual-cycling-glasses-accessory-g669388.html,Men's Sunglasses Vogue Outdoor Casual Cycling Glasses Accessory,Outdoor glasses
13,$21.99,,https://www.jollychic.com/p/men-s-sunglasses-outdoor-sports-style-fashion-cool-glasses-accessory-g669390.html,Men's Sunglasses Outdoor Sports Style Fashion Cool Glasses Accessory,Outdoor glasses
16,$18.99,,https://www.jollychic.com/p/men-s-sunglasses-black-grey-lens-cycling-sports-cool-glasses-accessory-g669392.html,Men's Sunglasses Black Grey Lens Cycling Sports Cool Glasses Accessory,Outdoor glasses
49,$9.99,$18.99,https://www.jollychic.com/p/men-s-sunglasses-all-match-chic-design-handsome-rimless-glasses-accessory-g669396.html,Men's Sunglasses All Match Chic Design Handsome Rimless Glasses Accessory,Outdoor glasses
23,$6.99,$20.99,https://www.jollychic.com/p/men-s-sunglasses-casual-all-match-cycling-sun-block-glasses-accessory-g700516.html,Men's Sunglasses Casual All Match Cycling Sun Block Glasses Accessory,Outdoor glasses
10,$13.99,$26.99,https://www.jollychic.com/p/men-s-sunglasses-classic-casual-night-vision-rimless-driving-glasses-accessory-g700536.html,Men's Sunglasses Classic Casual Night Vision Rimless Driving Glasses Accessory,Outdoor glasses
7,$27.99,,https://www.jollychic.com/p/men-s-sunglasses-blue-radiation-protection-polarized-glasses-accessory-g721196.html,Men's Sunglasses Blue Radiation Protection Polarized Glasses Accessory,Outdoor glasses
21,$11.99,$27.99,https://www.jollychic.com/p/men-s-sunglasses-outdoor-cycling-polarized-vogue-glasses-accessory-g721280.html,Men's Sunglasses Outdoor Cycling Polarized Vogue Glasses Accessory,Outdoor glasses
5,$12.99,$26.99,https://www.jollychic.com/p/men-s-sunglasses-cool-chic-personality-vogue-travel-glasses-accessory-g721860.html,Men's Sunglasses Cool Chic Personality Vogue Travel Glasses Accessory,Outdoor glasses
7,$14.99,$22.99,https://www.jollychic.com/p/men-s-sunglasses-cycling-personality-polarized-glasses-accessory-g721870.html,Men's Sunglasses Cycling Personality Polarized Glasses Accessory,Outdoor glasses
15,$17.99,$26.99,https://www.jollychic.com/p/men-s-sunglasses-chic-design-classic-sports-practical-glasses-accessory-g721874.html,Men's Sunglasses Chic Design Classic Sports Practical Glasses Accessory,Outdoor glasses
9,$10.99,$22.99,https://www.jollychic.com/p/men-s-sunglasses-radiation-protection-vogue-cycling-glasses-accessory-g721880.html,Men's Sunglasses Radiation Protection Vogue Cycling Glasses Accessory,Outdoor glasses
8,$9.99,$22.99,https://www.jollychic.com/p/men-s-sunglasses-travel-outdoor-personality-polarized-glasses-accessory-g721882.html,Men's Sunglasses Travel Outdoor Personality Polarized Glasses Accessory,Outdoor glasses
14,$10.99,$22.99,https://www.jollychic.com/p/men-s-sunglasses-cycling-polarized-vogue-sports-style-glasses-accessory-g721884.html,Men's Sunglasses Cycling Polarized Vogue Sports Style Glasses Accessory,Outdoor glasses
6,$12.99,$26.99,https://www.jollychic.com/p/men-s-sunglasses-protective-cycling-resin-lens-glasses-accessory-g721888.html,Men's Sunglasses Protective Cycling Resin Lens Glasses Accessory,Outdoor glasses
7,$14.99,$22.99,https://www.jollychic.com/p/men-s-sunglasses-resin-lens-personality-cool-polarized-glasses-accessory-g721892.html,Men's Sunglasses Resin Lens Personality Cool Polarized Glasses Accessory,Outdoor glasses
35,$16.99,$33.99,https://www.jollychic.com/p/men-s-sunglasses-polarized-vogue-durable-protective-glasses-accessory-g729784.html,Men's Sunglasses Polarized Vogue Durable Protective Glasses Accessory,Outdoor glasses
50,$12.99,$25.99,https://www.jollychic.com/p/men-s-sunglasses-alloy-frame-protective-simple-style-cozy-glasses-accessory-g729796.html,Men's Sunglasses Alloy Frame Protective Simple Style Cozy Glasses Accessory,Outdoor glasses
8,$11.99,$22.99,https://www.jollychic.com/p/men-s-sports-sunglasses-cycling-windproof-fashion-glasses-accessory-g729798.html,Men's Sports Sunglasses Cycling Windproof Fashion Glasses Accessory,Outdoor glasses
52,$8.99,,https://www.jollychic.com/p/men-s-sports-sunglasses-stylish-design-color-block-cycling-glasses-accessory-g750498.html,Men's Sports Sunglasses Stylish Design Color Block Cycling Glasses Accessory,Outdoor glasses
15,$4.99,$6.99,https://www.jollychic.com/p/men-s-sports-sunglasses-all-match-color-block-cycling-glasses-accessory-g750500.html,Men's Sports Sunglasses All Match Color Block Cycling Glasses Accessory,Outdoor glasses
40,$10.99,,https://www.jollychic.com/p/men-s-sports-sunglasses-full-rim-stylish-color-block-cycling-glasses-accessory-g750508.html,Men's Sports Sunglasses Full Rim Stylish Color Block Cycling Glasses Accessory,Outdoor glasses
51,$5.99,,https://www.jollychic.com/p/men-s-sports-sunglasses-fashionable-cycling-outdoor-glasses-accessory-g750512.html,Men's Sports Sunglasses Fashionable Cycling Outdoor Glasses Accessory,Outdoor glasses
61,$9.99,$19.99,https://www.jollychic.com/p/men-s-sports-sunglasses-colorful-stylish-design-glasses-accessory-g750514.html,Men's Sports Sunglasses Colorful Stylish Design Glasses Accessory,Outdoor glasses
40,$14.99,$22.99,https://www.jollychic.com/p/men-s-sports-sunglasses-all-match-handsome-cycling-glasses-accessory-g750516.html,Men's Sports Sunglasses All Match Handsome Cycling Glasses Accessory,Outdoor glasses
34,$6.99,$10.99,https://www.jollychic.com/p/men-s-sports-sunglasses-casual-stylish-cycling-glasses-accessory-g750518.html,Men's Sports Sunglasses Casual Stylish Cycling Glasses Accessory,Outdoor glasses
19,$12.99,$20.99,https://www.jollychic.com/p/men-s-sports-sunglasses-chic-stylish-leisure-cycling-glasses-accessory-g750520.html,Men's Sports Sunglasses Chic Stylish Leisure Cycling Glasses Accessory,Outdoor glasses
78,$13.99,$23.99,https://www.jollychic.com/p/men-s-sports-sunglasses-stylish-design-high-quality-cycling-glasses-accessory-g750522.html,Men's Sports Sunglasses Stylish Design High Quality Cycling Glasses Accessory,Outdoor glasses
244,$6.99,$11.99,https://www.jollychic.com/p/men-s-cycling-glasses-windproof-dust-resistant-portable-glasses-sports-accessory-g752046.html,Men's Cycling Glasses Windproof Dust Resistant Portable Glasses Sports Accessory,Outdoor glasses
7,$15.99,$23.99,https://www.jollychic.com/p/men-s-sports-sunglasses-polarized-protective-cycling-driving-glasses-accessory-g754014.html,Men's Sports Sunglasses Polarized Protective Cycling Driving Glasses Accessory,Outdoor glasses
12,$15.99,$23.99,https://www.jollychic.com/p/men-s-sports-sunglasses-polarized-protective-cycling-outdoor-glasses-accessory-g754072.html,Men's Sports Sunglasses Polarized Protective Cycling Outdoor Glasses Accessory,Outdoor glasses
4,$14.99,$22.99,https://www.jollychic.com/p/men-s-sports-sunglasses-all-match-chic-cycling-glasses-accessory-g784872.html,Men's Sports Sunglasses All Match Chic Cycling Glasses Accessory,Outdoor glasses
25,$2.99,$5.99,https://www.jollychic.com/p/men-s-sports-sunglasses-vogue-stylish-design-cool-full-rim-glasses-accessory-g784950.html,Men's Sports Sunglasses Vogue Stylish Design Cool Full Rim Glasses Accessory,Outdoor glasses
12,$23.99,,https://www.jollychic.com/p/men-s-sunglasses-sports-outdoor-cycling-casual-glasses-accessory-g833954.html,Men's Sunglasses Sports Outdoor Cycling Casual Glasses Accessory,Outdoor glasses
16,$6.99,$15.99,https://www.jollychic.com/p/men-s-sports-sunglasses-unique-design-personality-fashion-glasses-g903654.html,Men's Sports Sunglasses Unique Design Personality Fashion Glasses,Outdoor glasses
36,$6.99,$14.99,https://www.jollychic.com/p/men-s-sports-sunglasses-polarized-protective-personality-glasses-g903716.html,Men's Sports Sunglasses Polarized Protective Personality Glasses,Outdoor glasses
7,$12.99,$23.99,https://www.jollychic.com/p/men-s-sunglasses-full-rimmed-uv-cut-cycling-outdoors-sunglasses-g915494.html,Men's Sunglasses Full Rimmed UV Cut Cycling Outdoors Sunglasses,Outdoor glasses
5,$12.99,$24.99,https://www.jollychic.com/p/men-s-sunglasses-square-lens-polarized-semi-rimmed-cycling-accessory-g915496.html,Men's Sunglasses Square Lens Polarized Semi Rimmed Cycling Accessory,Outdoor glasses
1,$12.99,$25.99,https://www.jollychic.com/p/men-s-sunglasses-uv-cut-sunblock-protective-semi-rimmed-accessory-g915498.html,Men's Sunglasses UV Cut Sunblock Protective Semi Rimmed Accessory,Outdoor glasses
3,$12.99,$25.99,https://www.jollychic.com/p/men-s-sunglasses-polarized-semi-rimmed-cycling-sports-accessory-g915500.html,Men's Sunglasses Polarized Semi Rimmed Cycling Sports Accessory,Outdoor glasses
3,$12.99,$24.99,https://www.jollychic.com/p/men-s-sunglasses-polarized-cycling-all-match-trendy-accessory-g915502.html,Men's Sunglasses Polarized Cycling All Match Trendy Accessory,Outdoor glasses
7,$11.99,$25.99,https://www.jollychic.com/p/men-s-sunglasses-casual-outdoor-sports-professional-cycling-accessory-g915504.html,Men's Sunglasses Casual Outdoor Sports Professional Cycling Accessory,Outdoor glasses
8,$24.99,,https://www.jollychic.com/p/men-s-sunglasses-all-match-semi-rimmed-cycling-outdoors-polarized-accessory-g915508.html,Men's Sunglasses All Match Semi Rimmed Cycling Outdoors Polarized Accessory,Outdoor glasses
11,$13.99,$25.99,https://www.jollychic.com/p/men-s-sunglasses-semi-rimmed-protective-cycling-sports-polarized-sunglasses-g915510.html,Men's Sunglasses Semi Rimmed Protective Cycling Sports Polarized Sunglasses,Outdoor glasses
10,$13.99,$25.99,https://www.jollychic.com/p/men-s-sunglasses-uv-cut-cycling-outdoors-polarized-stylish-sunglasses-g915512.html,Men's Sunglasses UV Cut Cycling Outdoors Polarized Stylish Sunglasses,Outdoor glasses
7,$12.99,$25.99,https://www.jollychic.com/p/men-s-sunglasses-outdoors-protective-polarized-trendy-accessory-g915514.html,Men's Sunglasses Outdoors Protective Polarized Trendy Accessory,Outdoor glasses
5,$12.99,$25.99,https://www.jollychic.com/p/men-s-sunglasses-semi-rimmed-trendy-cycling-outdoors-sunglasses-g915516.html,Men's Sunglasses Semi Rimmed Trendy Cycling Outdoors Sunglasses,Outdoor glasses
15,$13.99,$25.99,https://www.jollychic.com/p/men-s-sunglasses-sports-cycling-outdoors-fashionable-polarized-sunglasses-g915518.html,Men's Sunglasses Sports Cycling Outdoors Fashionable Polarized Sunglasses,Outdoor glasses
13,$12.99,$25.99,https://www.jollychic.com/p/men-s-sunglasses-full-rimmed-square-cycling-outdoors-polarized-sunglasses-g915520.html,Men's Sunglasses Full Rimmed Square Cycling Outdoors Polarized Sunglasses,Outdoor glasses
14,$12.99,$24.99,https://www.jollychic.com/p/men-s-sunglasses-cycling-outdoors-polarized-sunblock-cool-sunglasses-g915522.html,Men's Sunglasses Cycling Outdoors Polarized Sunblock Cool Sunglasses,Outdoor glasses
17,$12.99,$24.99,https://www.jollychic.com/p/men-s-sunglasses-outdoors-polarized-cool-semi-rimmed-sunglasses-g915524.html,Men's Sunglasses Outdoors Polarized Cool Semi Rimmed Sunglasses,Outdoor glasses
19,$11.99,$25.99,https://www.jollychic.com/p/men-s-sunglasses-voguish-cool-wind-resistant-outdoor-sports-glasses-g920320.html,Men's Sunglasses Voguish Cool Wind Resistant Outdoor Sports Glasses,Outdoor glasses
14,$12.99,$24.99,https://www.jollychic.com/p/men-s-sunglasses-popular-uv-protection-half-rimmed-wind-resistant-glasses-g920324.html,Men's Sunglasses Popular UV Protection Half Rimmed Wind Resistant Glasses,Outdoor glasses
7,$12.99,$25.99,https://www.jollychic.com/p/men-s-sunglasses-simple-stylish-half-rimmed-uv-protection-outdoor-glasses-g920326.html,Men's Sunglasses Simple Stylish Half Rimmed UV Protection Outdoor Glasses,Outdoor glasses
13,$11.99,$25.99,https://www.jollychic.com/p/men-s-sunglasses-unique-design-uv-protection-cool-wind-resistant-glasses-g920330.html,Men's Sunglasses Unique Design UV Protection Cool Wind Resistant Glasses,Outdoor glasses
10,$13.99,$24.99,https://www.jollychic.com/p/men-s-sunglasses-charming-durable-wind-resistant-uv-protection-cycling-glasses-g920332.html,Men's Sunglasses Charming Durable Wind Resistant UV Protection Cycling Glasses,Outdoor glasses
9,$11.99,$25.99,https://www.jollychic.com/p/men-s-outdoor-sunglasses-fashionable-full-rimmed-uv-protection-sports-glasses-g920334.html,Men's Outdoor Sunglasses Fashionable Full Rimmed UV Protection Sports Glasses,Outdoor glasses
10,$16.99,$32.99,https://www.jollychic.com/p/men-s-sunglasses-sports-outdoor-polarized-cool-cycling-glasses-accessory-g922482.html,Men's Sunglasses Sports Outdoor Polarized Cool Cycling Glasses Accessory,Outdoor glasses
14,$13.99,,https://www.jollychic.com/p/men-s-sports-sunglasses-outdoor-travel-cycling-polarized-glasses-accessory-g934372.html,Men's Sports Sunglasses Outdoor Travel Cycling Polarized Glasses Accessory,Outdoor glasses
75,$7.99,$12.99,https://www.jollychic.com/p/men-s-sunglasses-outdoor-polarized-elegant-uv-protection-glasses-accessory-g934374.html,Men's Sunglasses Outdoor Polarized Elegant UV Protection Glasses Accessory,Outdoor glasses
15,$15.99,$31.99,https://www.jollychic.com/p/men-s-sports-sunglasses-cycling-metal-frame-fashion-glasses-accessory-g986866.html,Men's Sports Sunglasses Cycling Metal Frame Fashion Glasses Accessory,Outdoor glasses
23,$10.99,$20.99,https://www.jollychic.com/p/men-s-sunglasses-fashionable-uv-protection-outdoor-sports-cycling-glasses-g989512.html,Men's Sunglasses Fashionable UV Protection Outdoor Sports Cycling Glasses,Outdoor glasses
6,$18.99,$33.99,https://www.jollychic.com/p/men-s-outdoor-sunglasses-fashionable-uv-protection-cycling-glasses-accessory-g989514.html,Men's Outdoor Sunglasses Fashionable UV Protection Cycling Glasses Accessory,Outdoor glasses
16,$12.99,$21.99,https://www.jollychic.com/p/men-s-outdoor-sunglasses-fashionable-uv-protection-unisex-cycling-glasses-g989516.html,Men's Outdoor Sunglasses Fashionable UV Protection Unisex Cycling Glasses,Outdoor glasses
12,$10.99,$20.99,https://www.jollychic.com/p/men-s-sunglasses-uv-protection-color-frame-outdoor-cycling-glasses-g989676.html,Men's Sunglasses UV Protection Color Frame Outdoor Cycling Glasses,Outdoor glasses
12,$9.99,$20.99,https://www.jollychic.com/p/men-s-outdoor-sunglasses-fashionable-uv-protection-outdoors-cycling-glasses-g989680.html,Men's Outdoor Sunglasses Fashionable UV Protection Outdoors Cycling Glasses,Outdoor glasses
3,$9.99,$19.99,https://www.jollychic.com/p/men-s-outdoor-sunglasses-fashionable-wind-resistant-uv-protection-sports-glasses-g989682.html,Men's Outdoor Sunglasses Fashionable Wind Resistant UV Protection Sports Glasses,Outdoor glasses
44,$10.99,$21.99,https://www.jollychic.com/p/men-s-outdoor-sunglasses-fashionable-three-lenses-design-uv-protection-cycling-glasses-g989684.html,Men's Outdoor Sunglasses Fashionable Three Lenses Design UV Protection Cycling Glasses,Outdoor glasses
34,$9.99,$16.99,https://www.jollychic.com/p/women-s-sunglasses-casual-large-frame-hollowed-out-glasses-accessory-g994034.html,Women's Sunglasses Casual Large Frame Hollowed Out Glasses Accessory,Outdoor glasses
21,$9.99,$13.99,https://www.jollychic.com/p/women-s-sunglasses-trendy-cool-round-frame-all-matched-glasses-accessory-g994036.html,Women's Sunglasses Trendy Cool Round Frame All Matched Glasses Accessory,Outdoor glasses
19,$12.99,$23.99,https://www.jollychic.com/p/men-s-sports-sunglasses-uv-protection-vogue-cycling-glasses-accessory-g1056392.html,Men's Sports Sunglasses UV Protection Vogue Cycling Glasses Accessory,Outdoor glasses
8,$10.99,$19.99,https://www.jollychic.com/p/men-s-sports-sunglasses-outdoor-handsome-cycling-glasses-accessory-g1056394.html,Men's Sports Sunglasses Outdoor Handsome Cycling Glasses Accessory,Outdoor glasses
12,$2.99,$10.99,https://www.jollychic.com/p/women-s-sunglasses-fashion-all-match-sports-accessory-g1059306.html,Women's Sunglasses Fashion All Match Sports Accessory,Outdoor glasses
21,$2.99,$10.99,https://www.jollychic.com/p/women-s-sunglasses-fashion-all-match-personified-sports-accessory-g1059308.html,Women's Sunglasses Fashion All Match Personified Sports Accessory,Outdoor glasses
6,$13.99,,https://www.jollychic.com/p/women-s-sunglasses-cycling-fashion-all-match-personified-sports-accessory-g1059312.html,Women's Sunglasses Cycling Fashion All Match Personified Sports Accessory,Outdoor glasses
9,$13.99,,https://www.jollychic.com/p/men-s-sports-sunglasses-color-block-windproof-all-match-glasses-accessory-g1063966.html,Men's Sports Sunglasses Color Block Windproof All Match Glasses Accessory,Outdoor glasses
21,$18.99,,https://www.jollychic.com/p/men-s-sunglasses-plastic-frame-cozy-design-eyewear-accessory-g1089048.html,Men's Sunglasses Plastic Frame Cozy Design Eyewear Accessory,Outdoor glasses
3,$16.99,,https://www.jollychic.com/p/men-s-sunglasses-plastic-frame-cozy-design-eyewear-accessory-g1146324.html,Men's Sunglasses Plastic Frame Cozy Design Eyewear Accessory,Outdoor glasses
2,$11.99,,https://www.jollychic.com/p/men-s-sunglasses-polarized-light-outdoors-sport-colorful-eyewear-accessory-g1146328.html,Men's Sunglasses Polarized Light Outdoors Sport Colorful Eyewear Accessory,Outdoor glasses
9,$10.99,$15.99,https://www.jollychic.com/p/sports-fashion-sunglass-polarized-light-unisex-outdoor-cycling-sunglass-g1165178.html,Sports Fashion Sunglass Polarized Light Unisex Outdoor Cycling Sunglass,Outdoor glasses
2,$3.99,,https://www.jollychic.com/p/men-s-sunglasses-sports-stylish-sun-protection-cycling-glasses-accessory-g1210972.html,Men's Sunglasses Sports Stylish Sun Protection Cycling Glasses Accessory,Outdoor glasses
5,$9.99,$15.99,https://www.jollychic.com/p/men-s-sports-sunglasses-outdoor-driving-half-rim-glasses-accessory-g1267054.html,Men's Sports Sunglasses Outdoor Driving Half Rim Glasses Accessory,Outdoor glasses
3,$6.99,$15.99,https://www.jollychic.com/p/men-s-sports-sunglasses-classic-driving-trendy-personality-glasses-accessory-g1267056.html,Men's Sports Sunglasses Classic Driving Trendy Personality Glasses Accessory,Outdoor glasses
1,$14.99,$26.99,https://www.jollychic.com/p/sports-sunglasses-fashion-colorful-cycling-polarized-light-sunglasses-g1344290.html,Sports Sunglasses Fashion Colorful Cycling Polarized Light Sunglasses,Outdoor glasses
2,$17.99,$31.99,https://www.jollychic.com/p/sports-sunglasses-fashion-colorful-cycling-polarized-light-sandproof-sunglasses-g1344294.html,Sports Sunglasses Fashion Colorful Cycling Polarized Light Sandproof Sunglasses,Outdoor glasses
2,$19.99,$34.99,https://www.jollychic.com/p/men-s-sunglasses-retro-solid-color-outdoor-ultra-light-portable-glasses-g1395334.html,Men's Sunglasses Retro Solid Color Outdoor Ultra-Light Portable Glasses,Outdoor glasses
0,$14.99,$26.99,https://www.jollychic.com/p/men-s-sports-sunglasses-trendy-chic-design-durable-glasses-accessory-g1401930.html,Men's Sports Sunglasses Trendy Chic Design Durable Glasses Accessory,Outdoor glasses
3,$7.99,$21.99,https://www.jollychic.com/p/men-s-sports-sunglasses-polarized-vogue-cycling-comfy-glasses-accessory-g1401966.html,Men's Sports Sunglasses Polarized Vogue Cycling Comfy Glasses Accessory,Outdoor glasses
2,$3.99,$12.99,https://www.jollychic.com/p/men-s-sunglassesoutdoor-windproof-cycling-accessory-g1435628.html,Men's SunglassesOutdoor Windproof Cycling Accessory,Outdoor glasses
3,$18.99,,https://www.jollychic.com/p/men-s-sunglasses-windproof-outdoor-cycling-chic-accessory-g1435632.html,Men's Sunglasses Windproof Outdoor Cycling Chic Accessory,Outdoor glasses
2,$20.99,,https://www.jollychic.com/p/men-s-sunglasses-windproof-outdoor-cycling-accessory-g1435634.html,Men's Sunglasses Windproof Outdoor Cycling Accessory,Outdoor glasses
2,$20.99,,https://www.jollychic.com/p/men-s-sunglasses-windproof-outdoor-sunglasses-accessory-g1435636.html,Men's Sunglasses Windproof Outdoor Sunglasses Accessory,Outdoor glasses
1,$21.99,,https://www.jollychic.com/p/men-s-sunglasses-windproof-outdoor-camping-sunglasses-accessory-g1435638.html,Men's Sunglasses Windproof Outdoor Camping Sunglasses Accessory,Outdoor glasses
