add_wish,discount_price,original_price,product_link,product_name,header_block
16,$40.99,$61.00,https://www.jollychic.com/p/one-piece-decorative-curtain-simple-solid-delicate-home-blackout-curtain-g818186.html,One Piece Decorative Curtain Simple Solid Delicate Home Blackout Curtain,Curtains
142,$31.99,$47.99,https://www.jollychic.com/p/one-piece-sheer-curtain-elegant-solid-white-home-decorative-sheer-curtain-g818192.html,One Piece Sheer Curtain Elegant Solid White Home Decorative Sheer Curtain,Curtains
29,$32.99,,https://www.jollychic.com/p/1pc-curtain-simple-flower-pattern-home-decorative-sheer-curtain-g828400.html,1Pc Curtain Simple Flower Pattern Home Decorative Sheer Curtain,Curtains
17,$28.99,$42.99,https://www.jollychic.com/p/1pc-blackout-curtain-delicate-floral-pattern-double-layers-decorative-curtain-g835760.html,1Pc Blackout Curtain Delicate Floral Pattern Double Layers Decorative Curtain,Curtains
11,$32.99,$47.99,https://www.jollychic.com/p/one-piece-living-room-curtain-modern-style-solid-color-half-shading-curtain-g844616.html,One Piece Living Room Curtain Modern Style Solid Color Half Shading Curtain,Curtains
35,$32.99,$47.99,https://www.jollychic.com/p/one-piece-blackout-curtain-modern-simple-solid-semishut-home-curtain-g844618.html,One Piece Blackout Curtain Modern Simple Solid Semishut Home Curtain,Curtains
8,$30.99,$45.99,https://www.jollychic.com/p/one-piece-home-curtain-classic-plaids-striped-design-sheer-curtain-g917268.html,One Piece Home Curtain Classic Plaids Striped Design Sheer Curtain,Curtains
29,$30.99,$45.99,https://www.jollychic.com/p/one-piece-decorative-curtain-simple-modern-plaids-pattern-half-shading-curtain-g917270.html,One Piece Decorative Curtain Simple Modern Plaids Pattern Half Shading Curtain,Curtains
12,$30.99,$45.99,https://www.jollychic.com/p/1pc-living-room-curtain-simple-classic-striped-colorblock-sheer-curtain-g917272.html,1Pc Living Room Curtain Simple Classic Striped Colorblock Sheer Curtain,Curtains
8,$30.99,$45.99,https://www.jollychic.com/p/1pc-bedroom-decorative-curtain-simple-colorblock-delicate-sheer-curtain-g917274.html,1Pc Bedroom Decorative Curtain Simple Colorblock Delicate Sheer Curtain,Curtains
105,$54.00,,https://www.jollychic.com/p/one-piece-sheer-curtain-simple-solid-embroidery-pattern-decorative-curtain-g950310.html,One Piece Sheer Curtain Simple Solid Embroidery Pattern Decorative Curtain,Curtains
35,$30.99,$45.99,https://www.jollychic.com/p/one-piece-home-decorative-curtain-modern-simple-solid-supple-blackout-curtain-g967628.html,One Piece Home Decorative Curtain Modern Simple Solid Supple Blackout Curtain,Curtains
15,$29.99,$44.99,https://www.jollychic.com/p/one-piece-decorative-curtain-simple-solid-suede-comfortable-blackout-curtain-g967634.html,One Piece Decorative Curtain Simple Solid Suede Comfortable Blackout Curtain,Curtains
55,$56.00,$82.00,https://www.jollychic.com/p/1pc-sheer-curtain-embroidery-blue-flower-living-room-retro-style-decorative-curtain-g973334.html,1Pc Sheer Curtain Embroidery Blue Flower Living Room Retro Style Decorative Curtain,Curtains
56,$13.99,,https://www.jollychic.com/p/one-piece-sheer-curtain-polyester-dreamy-solid-decorative-curtain-g994780.html,One Piece Sheer Curtain Polyester Dreamy Solid Decorative Curtain,Curtains
25,$26.99,$39.99,https://www.jollychic.com/p/1pc-living-room-curtain-european-design-yellow-green-simple-blackout-curtain-g1004410.html,1Pc Living Room Curtain European Design Yellow Green Simple Blackout Curtain,Curtains
4,$25.99,$37.99,https://www.jollychic.com/p/1pc-half-shading-blackout-curtain-jacquard-weave-vertical-decorative-curtain-g1004424.html,1Pc Half Shading Blackout Curtain Jacquard Weave Vertical Decorative Curtain,Curtains
19,$25.99,$37.99,https://www.jollychic.com/p/1pc-bedroom-curtain-modern-solid-colour-half-shading-blackout-curtain-g1004436.html,1Pc Bedroom Curtain Modern Solid Colour Half Shading Blackout Curtain,Curtains
18,$25.99,$37.99,https://www.jollychic.com/p/one-piece-half-shading-curtain-jacquard-weave-polyester-decorative-curtain-g1004442.html,One Piece Half Shading Curtain Jacquard Weave Polyester Decorative Curtain,Curtains
19,$26.99,$39.99,https://www.jollychic.com/p/one-piece-blackout-curtain-solid-colour-jacquard-weave-living-room-curtain-g1030846.html,One Piece Blackout Curtain Solid Colour Jacquard Weave Living Room Curtain,Curtains
18,$26.99,$39.99,https://www.jollychic.com/p/one-piece-curtain-vintage-style-solid-colour-camel-blackout-curtain-g1030860.html,One Piece Curtain Vintage Style Solid Colour Camel Blackout Curtain,Curtains
83,$28.99,$49.99,https://www.jollychic.com/p/1pc-window-curtain-modern-grey-half-blackout-living-room-home-decoration-g1246398.html,1Pc Window Curtain Modern Grey Half Blackout Living Room Home Decoration,Curtains
42,$28.99,$49.99,https://www.jollychic.com/p/1pc-living-room-curtain-simple-modern-solid-half-shading-home-decoration-g1246400.html,1Pc Living Room Curtain Simple Modern Solid Half Shading Home Decoration,Curtains
11,$23.99,$44.99,https://www.jollychic.com/p/1pc-window-curtain-pastoral-style-bird-pattern-children-bedroom-curtain-g1289424.html,1Pc Window Curtain Pastoral Style Bird Pattern Children Bedroom Curtain,Curtains
66,$35.99,$60.00,https://www.jollychic.com/p/1pc-blackout-window-curtain-pastoral-style-leaves-pattern-half-shading-curtain-g1320142.html,1Pc Blackout Window Curtain Pastoral Style Leaves Pattern Half Shading Curtain,Curtains
31,$1.99,,https://www.jollychic.com/p/12pcs-home-curtain-hooks-set-c-type-round-shaped-shower-curtain-hooks-g1420288.html,12Pcs Home Curtain Hooks Set C Type Round Shaped Shower Curtain Hooks,Curtains
6,$48.99,,https://www.jollychic.com/p/hks-home-decoratove-blinds-unique-digital-printed-blackout-roller-blinds-g1467580.html,HKS Home Decoratove Blinds Unique Digital Printed Blackout Roller Blinds,Curtains
6,$48.99,,https://www.jollychic.com/p/hks-decorative-window-blinds-pastoral-floral-birds-digital-printed-blackout-roller-blinds-g1467724.html,HKS Decorative Window Blinds Pastoral Floral Birds Digital Printed Blackout Roller Blinds,Curtains
6,$48.99,,https://www.jollychic.com/p/hks-window-blinds-vivid-glorious-landscape-unique-digital-printed-blackout-roller-blinds-g1467880.html,HKS Window Blinds Vivid Glorious Landscape Unique Digital Printed Blackout Roller Blinds,Curtains
5,$48.99,,https://www.jollychic.com/p/hks-window-curtain-glorious-digital-printed-sea-landscape-blackout-roller-blinds-g1467936.html,HKS Window Curtain Glorious Digital Printed Sea Landscape Blackout Roller Blinds,Curtains
4,$48.99,,https://www.jollychic.com/p/hks-decorative-sharing-curtain-unique-digital-printed-blackout-roller-blinds-g1468088.html,HKS Decorative Sharing Curtain Unique Digital Printed Blackout Roller Blinds,Curtains
2,$48.99,,https://www.jollychic.com/p/hks-home-window-curtain-romantic-leaf-unique-digital-printed-blackout-roller-blinds-g1468150.html,HKS Home Window Curtain Romantic Leaf Unique Digital Printed Blackout Roller Blinds,Curtains
6,$48.99,,https://www.jollychic.com/p/hks-blackout-roller-blinds-decorative-shading-unique-digital-printed-curtain-g1468180.html,HKS Blackout Roller Blinds Decorative Shading Unique Digital Printed Curtain,Curtains
2,$48.99,,https://www.jollychic.com/p/hks-home-curtain-unique-greeting-pine-digital-printed-blackout-roller-blinds-g1468318.html,HKS Home Curtain Unique Greeting Pine Digital Printed Blackout Roller Blinds,Curtains
2,$48.99,,https://www.jollychic.com/p/hks-blackout-roller-blinds-cartoon-colored-mushroom-pattern-home-curtain-g1468392.html,HKS Blackout Roller Blinds Cartoon Colored Mushroom Pattern Home Curtain,Curtains
1,$48.99,,https://www.jollychic.com/p/hks-unique-digital-printed-blackout-roller-blinds-g1468396.html,HKS Unique Digital Printed Blackout Roller Blinds,Curtains
1,$67.00,,https://www.jollychic.com/p/hks-decorative-window-blinds-graceful-unique-digital-printed-blackout-roller-blinds-g1468404.html,HKS Decorative Window Blinds Graceful Unique Digital Printed Blackout Roller Blinds,Curtains
2,$48.99,,https://www.jollychic.com/p/hks-decorative-blinds-vivid-digital-shark-printed-blackout-roller-blinds-g1468436.html,HKS Decorative Blinds Vivid Digital Shark Printed Blackout Roller Blinds,Curtains
5,$48.99,,https://www.jollychic.com/p/hks-roller-blinds-unique-digital-printed-purple-flowers-blackout-roller-blinds-g1468608.html,HKS Roller Blinds Unique Digital Printed Purple Flowers Blackout Roller Blinds,Curtains
1,$48.99,,https://www.jollychic.com/p/hks-home-decorative-blinds-unique-digital-printed-blackout-roller-blinds-g1468680.html,HKS Home Decorative Blinds Unique Digital Printed Blackout Roller Blinds,Curtains
8,$48.99,,https://www.jollychic.com/p/hks-decorative-blinds-creative-digital-printed-shading-blackout-roller-blinds-g1468778.html,HKS Decorative Blinds Creative Digital Printed Shading Blackout Roller Blinds,Curtains
1,$48.99,,https://www.jollychic.com/p/hks-roller-blinds-unique-digital-printed-purple-flowers-blackout-roller-blinds-g1468782.html,HKS Roller Blinds Unique Digital Printed Purple Flowers Blackout Roller Blinds,Curtains
1,$48.99,,https://www.jollychic.com/p/hks-home-shading-curtain-fresh-digital-lotus-leaf-printed-blackout-roller-blinds-g1468794.html,HKS Home Shading Curtain Fresh Digital Lotus Leaf Printed Blackout Roller Blinds,Curtains
1,$48.99,,https://www.jollychic.com/p/hks-blackout-roller-blinds-exquisite-lotus-flowers-digital-printed-shading-curtain-g1468894.html,HKS Blackout Roller Blinds Exquisite Lotus Flowers Digital Printed Shading Curtain,Curtains
2,$48.99,,https://www.jollychic.com/p/hks-unique-digital-printed-water-drop-blackout-roller-blinds-g1469006.html,HKS Unique Digital Printed Water Drop Blackout Roller Blinds,Curtains
1,$48.99,,https://www.jollychic.com/p/hks-blackout-roller-blinds-delicate-vivid-unique-digital-printed-curtain-g1469042.html,HKS Blackout Roller Blinds Delicate Vivid Unique Digital Printed Curtain,Curtains
8,$48.99,,https://www.jollychic.com/p/hks-shading-curtain-digital-landscape-painting-blackout-roller-blinds-g1469278.html,HKS Shading Curtain Digital Landscape Painting Blackout Roller Blinds,Curtains
12,$48.99,,https://www.jollychic.com/p/hks-roller-blinds-unique-digital-printed-fresh-vagatables-pattern-blackout-roller-blinds-g1469304.html,HKS Roller Blinds Unique Digital Printed Fresh Vagatables Pattern Blackout Roller Blinds,Curtains
3,$48.99,,https://www.jollychic.com/p/hks-blackout-roller-blinds-cartoon-mushroom-digital-printed-curtain-g1469316.html,HKS Blackout Roller Blinds Cartoon Mushroom Digital Printed Curtain,Curtains
1,$48.99,,https://www.jollychic.com/p/hks-roller-blinds-unique-digital-printed-flower-and-butterfly-blackout-roller-blinds-g1469372.html,HKS Roller Blinds Unique Digital Printed Flower and Butterfly Blackout Roller Blinds,Curtains
4,$48.99,,https://www.jollychic.com/p/hks-home-window-blinds-unique-digital-printed-blackout-roller-blinds-g1469422.html,HKS Home Window Blinds Unique Digital Printed Blackout Roller Blinds,Curtains
2,$48.99,,https://www.jollychic.com/p/hks-roller-blinds-unique-digital-printed-bike-pattern-blackout-roller-blinds-g1469458.html,HKS Roller Blinds Unique Digital Printed Bike Pattern Blackout Roller Blinds,Curtains
1,$48.99,,https://www.jollychic.com/p/hks-bedroom-shading-curtain-digital-whale-printed-blackout-roller-blinds-g1469710.html,HKS Bedroom Shading Curtain Digital Whale Printed Blackout Roller Blinds,Curtains
4,$48.99,,https://www.jollychic.com/p/hks-roller-blinds-unique-digital-printed-pink-flower-blackout-roller-blinds-g1469774.html,HKS Roller Blinds Unique Digital Printed Pink Flower Blackout Roller Blinds,Curtains
3,$48.99,,https://www.jollychic.com/p/hks-home-window-blinds-fresh-forest-digital-printed-blackout-roller-blinds-g1469778.html,HKS Home Window Blinds Fresh Forest Digital Printed Blackout Roller Blinds,Curtains
4,$48.99,,https://www.jollychic.com/p/hks-decorative-shading-blinds-digital-starfish-printed-blackout-roller-blinds-g1469792.html,HKS Decorative Shading Blinds Digital Starfish Printed Blackout Roller Blinds,Curtains
2,$48.99,,https://www.jollychic.com/p/hks-home-shading-blinds-unique-digital-printed-blackout-roller-blinds-g1469850.html,HKS Home Shading Blinds Unique Digital Printed Blackout Roller Blinds,Curtains
1,$48.99,,https://www.jollychic.com/p/hks-roller-blinds-unique-digital-printed-vase-and-flower-blackout-roller-blinds-g1469852.html,HKS Roller Blinds Unique Digital Printed Vase and Flower Blackout Roller Blinds,Curtains
1,$48.99,,https://www.jollychic.com/p/hks-bedroom-blinds-exquisite-landscape-decorative-blackout-roller-blinds-g1469886.html,HKS Bedroom Blinds Exquisite Landscape Decorative Blackout Roller Blinds,Curtains
2,$48.99,,https://www.jollychic.com/p/hks-roller-blinds-unique-digital-printed-pink-flowers-blackout-roller-blinds-g1469890.html,HKS Roller Blinds Unique Digital Printed Pink Flowers Blackout Roller Blinds,Curtains
4,$48.99,,https://www.jollychic.com/p/hks-shading-curtain-cartoon-likable-mushroom-house-pattern-blackout-roller-blinds-g1469922.html,HKS Shading Curtain Cartoon Likable Mushroom House Pattern Blackout Roller Blinds,Curtains
4,$48.99,,https://www.jollychic.com/p/hks-roller-blinds-unique-digital-printed-lovely-tree-and-birds-blackout-roller-blinds-g1470050.html,HKS Roller Blinds Unique Digital Printed Lovely Tree and Birds Blackout Roller Blinds,Curtains
1,$48.99,,https://www.jollychic.com/p/hks-kitchen-window-blinds-starfish-digital-printed-blackout-roller-blinds-g1470204.html,HKS Kitchen Window Blinds Starfish Digital Printed Blackout Roller Blinds,Curtains
2,$48.99,,https://www.jollychic.com/p/hks-roller-blinds-unique-digital-printed-flower-pattern-blackout-roller-blinds-g1470256.html,HKS Roller Blinds Unique Digital Printed Flower Pattern Blackout Roller Blinds,Curtains
2,$48.99,,https://www.jollychic.com/p/hks-roller-blinds-unique-lotus-flowers-printed-blackout-curtain-g1470326.html,HKS Roller Blinds Unique Lotus Flowers Printed Blackout Curtain,Curtains
5,$48.99,,https://www.jollychic.com/p/hks-roller-blinds-unique-digital-printed-white-flower-blackout-roller-blinds-g1470362.html,HKS Roller Blinds Unique Digital Printed White Flower Blackout Roller Blinds,Curtains
4,$48.99,,https://www.jollychic.com/p/hks-blackout-roller-blinds-bright-flowers-digital-printed-shading-curtain-g1470476.html,HKS Blackout Roller Blinds Bright Flowers Digital Printed Shading Curtain,Curtains
8,$48.99,,https://www.jollychic.com/p/hks-roller-blinds-unique-digital-printed-pink-flower-blackout-roller-blinds-g1470644.html,HKS Roller Blinds Unique Digital Printed Pink Flower Blackout Roller Blinds,Curtains
8,$48.99,,https://www.jollychic.com/p/hks-decorative-shading-blinds-unique-digital-printed-blackout-roller-blinds-g1470646.html,HKS Decorative Shading Blinds Unique Digital Printed Blackout Roller Blinds,Curtains
1,$48.99,,https://www.jollychic.com/p/hks-roller-blinds-unique-digital-printed-pink-flower-blackout-roller-blinds-g1470682.html,HKS Roller Blinds Unique Digital Printed Pink Flower Blackout Roller Blinds,Curtains
1,$48.99,,https://www.jollychic.com/p/hks-window-curtain-creative-sea-style-digital-printed-blackout-roller-blinds-g1470686.html,HKS Window Curtain Creative Sea Style Digital Printed Blackout Roller Blinds,Curtains
2,$48.99,,https://www.jollychic.com/p/hks-decorative-blinds-exquisite-sea-landscape-digital-printed-blackout-roller-blinds-g1470748.html,HKS Decorative Blinds Exquisite Sea Landscape Digital Printed Blackout Roller Blinds,Curtains
17,$48.99,,https://www.jollychic.com/p/hks-roller-blinds-unique-digital-printed-swan-pattern-blackout-roller-blinds-g1470788.html,HKS Roller Blinds Unique Digital Printed Swan Pattern Blackout Roller Blinds,Curtains
2,$48.99,,https://www.jollychic.com/p/hks-kitchen-window-blinds-unique-digital-printed-blackout-roller-blinds-g1470792.html,HKS Kitchen Window Blinds Unique Digital Printed Blackout Roller Blinds,Curtains
1,$48.99,,https://www.jollychic.com/p/hks-home-blinds-shading-craetive-digital-printed-blackout-roller-blinds-g1471002.html,HKS Home Blinds Shading Craetive Digital Printed Blackout Roller Blinds,Curtains
4,$48.99,,https://www.jollychic.com/p/hks-roller-blinds-unique-digital-printed-famous-buildings-blackout-roller-blinds-g1472184.html,HKS Roller Blinds Unique Digital Printed Famous Buildings Blackout Roller Blinds,Curtains
2,$48.99,,https://www.jollychic.com/p/hks-roller-blinds-unique-digital-printed-blue-flower-blackout-roller-blinds-g1472288.html,HKS Roller Blinds Unique Digital Printed Blue Flower Blackout Roller Blinds,Curtains
4,$48.99,,https://www.jollychic.com/p/hks-roller-blinds-unique-digital-printed-letters-blackout-roller-blinds-g1472330.html,HKS Roller Blinds Unique Digital Printed Letters Blackout Roller Blinds,Curtains
1,$48.99,,https://www.jollychic.com/p/hks-roller-blinds-unique-digital-printed-white-flower-blackout-roller-blinds-g1472338.html,HKS Roller Blinds Unique Digital Printed White Flower Blackout Roller Blinds,Curtains
1,$48.99,,https://www.jollychic.com/p/hks-roller-blinds-unique-digital-printed-purple-flowers-blackout-roller-blinds-g1472344.html,HKS Roller Blinds Unique Digital Printed Purple Flowers Blackout Roller Blinds,Curtains
1,$48.99,,https://www.jollychic.com/p/hks-roller-blinds-unique-digital-printed-pink-flower-blackout-roller-blinds-g1472348.html,HKS Roller Blinds Unique Digital Printed Pink Flower Blackout Roller Blinds,Curtains
1,$48.99,,https://www.jollychic.com/p/hks-decorative-shading-blinds-digital-flower-printed-blackout-roller-blinds-g1472424.html,HKS Decorative Shading Blinds Digital Flower Printed Blackout Roller Blinds,Curtains
2,$48.99,,https://www.jollychic.com/p/hks-decorative-shading-blinds-digital-hexagon-printed-blackout-roller-blinds-g1472450.html,HKS Decorative Shading Blinds Digital Hexagon Printed Blackout Roller Blinds,Curtains
3,$48.99,,https://www.jollychic.com/p/hks-roller-blinds-unique-digital-printed-pink-floral-blackout-roller-blinds-g1472546.html,HKS Roller Blinds Unique Digital Printed Pink Floral Blackout Roller Blinds,Curtains
4,$48.99,,https://www.jollychic.com/p/hks-roller-blinds-unique-digital-printed-bus-blackout-roller-blinds-g1472554.html,HKS Roller Blinds Unique Digital Printed Bus Blackout Roller Blinds,Curtains
2,$48.99,,https://www.jollychic.com/p/hks-decorative-shading-blinds-digital-marine-life-printed-blackout-roller-blinds-g1472720.html,HKS Decorative Shading Blinds Digital Marine Life Printed Blackout Roller Blinds,Curtains
5,$67.00,,https://www.jollychic.com/p/hks-decorative-shading-blinds-digital-modern-buildings-printed-blackout-roller-blinds-g1472728.html,HKS Decorative Shading Blinds Digital Modern Buildings Printed Blackout Roller Blinds,Curtains
4,$48.99,,https://www.jollychic.com/p/hks-roller-blinds-unique-digital-printed-beautiful-town-blackout-roller-blinds-g1472756.html,HKS Roller Blinds Unique Digital Printed Beautiful Town Blackout Roller Blinds,Curtains
8,$24.99,$44.99,https://www.jollychic.com/p/1pc-bedroom-curtain-plaid-pattern-transparent-blackout-window-curtain-g1513256.html,1Pc Bedroom Curtain Plaid Pattern Transparent Blackout Window Curtain,Curtains
5,$12.99,$27.99,https://www.jollychic.com/p/1pc-bedroom-curtain-transparent-blackout-window-curtain-g1545524.html,1Pc Bedroom Curtain Transparent Blackout Window Curtain,Curtains
0,$31.99,,https://www.jollychic.com/p/1-pc-home-decorative-curtain-animal-park-shade-cloth-cartoon-bedroom-balcony-curtain-g1545528.html,1 Pc Home Decorative Curtain Animal Park Shade Cloth Cartoon Bedroom Balcony Curtain,Curtains
3,$21.99,,https://www.jollychic.com/p/1-pc-home-decorative-curtain-study-room-living-room-balcony-zebra-prints-linen-screens-g1545530.html,1 Pc Home Decorative Curtain Study Room Living Room Balcony Zebra Prints Linen Screens,Curtains
3,$32.99,$57.00,https://www.jollychic.com/p/1pc-living-room-window-curtain-fresh-floral-beautiful-draperies-curtain-g1557162.html,1Pc Living Room Window Curtain Fresh Floral Beautiful Draperies Curtain,Curtains
3,$34.99,$60.00,https://www.jollychic.com/p/1-pcs-curtain-transparent-flower-embroidery-window-tulle-bedroom-room-curtains-g1557724.html,1 Pcs Curtain Transparent Flower Embroidery Window Tulle Bedroom Room Curtains,Curtains
2,$34.99,$60.00,https://www.jollychic.com/p/1-pcs-curtain-transparent-flower-embroidery-window-polyester-tulle-curtains-g1557728.html,1 Pcs Curtain Transparent Flower Embroidery Window Polyester Tulle Curtains,Curtains
12,$34.99,$60.00,https://www.jollychic.com/p/1-pcs-curtain-transparent-birds-embroidery-european-brief-style-tulle-curtains-g1557738.html,1 Pcs Curtain Transparent Birds Embroidery European Brief Style Tulle Curtains,Curtains
865,$28.99,$56.00,https://www.jollychic.com/p/one-piece-grommet-top-regular-graph-bedroom-curtain-panel-g169003.html,One Piece Grommet Top Regular Graph Bedroom Curtain Panel,Curtains
1175,$21.99,,https://www.jollychic.com/p/one-piece-rod-pocket-off-white-sheer-voile-curtains-g169203.html,One Piece Rod Pocket off White Sheer Voile Curtains,Curtains
193,$30.99,,https://www.jollychic.com/p/one-panel-classic-dark-green-corrugated-lightproof-window-curtain-g278523.html,One Panel Classic Dark Green Corrugated Lightproof Window Curtain,Curtains
169,$40.99,,https://www.jollychic.com/p/floral-grommet-top-geometric-pattern-one-piece-window-curtain-g278539.html,Floral Grommet Top Geometric Pattern One Piece Window Curtain,Curtains
309,$11.99,$48.99,https://www.jollychic.com/p/bedroom-deco-one-panel-gradient-curtain-g293734.html,Bedroom Deco One Panel Gradient Curtain,Curtains
78,$92.00,,https://www.jollychic.com/p/colorful-tiny-fox-half-shade-window-curtain-one-piece-g300872.html,Colorful Tiny Fox Half Shade Window Curtain One Piece,Curtains
371,$47.99,,https://www.jollychic.com/p/fancy-european-style-geometric-pattern-decorative-curtain-g302162.html,Fancy European Style Geometric Pattern Decorative Curtain,Curtains
3654,$21.99,$43.99,https://www.jollychic.com/p/japanese-style-sweet-coffee-shop-pattern-half-door-curtain-g333634.html,Japanese Style Sweet Coffee Shop Pattern Half Door Curtain,Curtains
267,$32.99,,https://www.jollychic.com/p/a-panel-elegant-beige-weaving-line-pattern-blackout-curtains-g346602.html,A Panel Elegant Beige Weaving Line Pattern Blackout Curtains,Curtains
79,$20.99,,https://www.jollychic.com/p/1pc-curtain-unique-flags-pattern-simple-decorative-sheer-curtain-g692168.html,1Pc Curtain Unique Flags Pattern Simple Decorative Sheer Curtain,Curtains
18,$33.99,$51.00,https://www.jollychic.com/p/one-piece-curtain-vintage-classic-jacquard-pattern-decorative-blackout-curtain-g818188.html,One Piece Curtain Vintage Classic Jacquard Pattern Decorative Blackout Curtain,Curtains
54,$34.99,$54.00,https://www.jollychic.com/p/one-piece-blackout-curtain-graceful-solid-thicken-home-decorative-curtain-g818190.html,One Piece Blackout Curtain Graceful Solid Thicken Home Decorative Curtain,Curtains
57,$32.99,$47.99,https://www.jollychic.com/p/one-piece-curtain-simple-modern-solid-half-shading-blackout-curtain-g844610.html,One Piece Curtain Simple Modern Solid Half Shading Blackout Curtain,Curtains
36,$32.99,$47.99,https://www.jollychic.com/p/one-piece-blackout-curtain-graceful-solid-linen-half-shading-living-room-curtain-g844612.html,One Piece Blackout Curtain Graceful Solid Linen Half Shading Living Room Curtain,Curtains
8,$30.99,$45.99,https://www.jollychic.com/p/one-piece-home-decorative-curtain-classic-plaids-pattern-half-shading-curtain-g917266.html,One Piece Home Decorative Curtain Classic Plaids Pattern Half Shading Curtain,Curtains
9,$30.99,$45.99,https://www.jollychic.com/p/1pc-sheer-curtain-simple-modern-plaids-patching-colors-half-shading-curtain-g917278.html,1Pc Sheer Curtain Simple Modern Plaids Patching Colors Half Shading Curtain,Curtains
8,$30.99,$45.99,https://www.jollychic.com/p/one-piece-sheer-curtain-classic-brief-design-plaids-half-shading-curtain-g917280.html,One Piece Sheer Curtain Classic Brief Design Plaids Half Shading Curtain,Curtains
27,$30.99,$45.99,https://www.jollychic.com/p/one-piece-blackout-curtain-brief-style-solid-decorative-bedroom-curtain-g967630.html,One Piece Blackout Curtain Brief Style Solid Decorative Bedroom Curtain,Curtains
34,$13.99,,https://www.jollychic.com/p/1-pc-sheer-curtain-solid-colour-light-blue-fresh-style-translucidus-curtain-g994788.html,1 Pc Sheer Curtain Solid Colour Light Blue Fresh Style Translucidus Curtain,Curtains
140,$40.99,$66.00,https://www.jollychic.com/p/1pc-bedroom-curtain-nordic-leaves-pattern-half-blackout-window-curtain-g1320140.html,1Pc Bedroom Curtain Nordic Leaves Pattern Half Blackout Window Curtain,Curtains
21,$14.99,$31.99,https://www.jollychic.com/p/1pc-window-curtain-tulle-solid-color-modern-living-room-curtain-g1391146.html,1Pc Window Curtain Tulle Solid Color Modern Living Room Curtain,Curtains
11,$23.99,$44.99,https://www.jollychic.com/p/1pc-living-room-curtain-star-pattern-embroidery-window-curtain-tulle-g1391156.html,1Pc Living Room Curtain Star Pattern Embroidery Window Curtain Tulle,Curtains
8,$54.00,$80.00,https://www.jollychic.com/p/1-pc-curtain-american-style-half-blackout-grey-linen-window-curtain-for-living-room-g1456118.html,1 Pc Curtain American Style Half Blackout Grey Linen Window Curtain for Living Room,Curtains
0,$24.99,,https://www.jollychic.com/p/1pc-home-window-curtain-snowflake-embroidery-pattern-decorative-screen-g1462968.html,1Pc Home Window Curtain Snowflake Embroidery Pattern Decorative Screen,Curtains
0,$24.99,,https://www.jollychic.com/p/1pc-home-decorative-curtain-embroidered-flowers-pattern-window-screen-g1462972.html,1Pc Home Decorative Curtain Embroidered Flowers Pattern Window Screen,Curtains
5,$35.99,,https://www.jollychic.com/p/1-panel-blackout-curtain-modern-simple-solid-cloud-pattern-home-curtain-g1463220.html,1 Panel Blackout Curtain Modern Simple Solid Cloud Pattern Home Curtain,Curtains
