add_wish,discount_price,original_price,product_link,product_name,header_block
3717,$12.99,$52.00,https://www.jollychic.com/p/one-piece-grommet-top-elegant-blackout-window-curtain-panel-g169279.html,One Piece Grommet Top Elegant Blackout Window Curtain Panel,Curtains
362,$34.99,,https://www.jollychic.com/p/stylish-modern-blue-sheer-window-sheer-curtain-one-panel--g259463.html,Stylish Modern Blue Sheer Window Sheer Curtain(One Panel),Curtains
1496,$16.99,$36.99,https://www.jollychic.com/p/western-red-bus-pattern-window-sheer-curtain-one-panel--g259467.html,Western Red Bus Pattern Window Sheer Curtain(One Panel),Curtains
1260,$16.99,$34.99,https://www.jollychic.com/p/one-panel-creative-colorful-splash-ink-window-curtains-g269857.html,One Panel Creative Colorful Splash Ink Window Curtains,Curtains
4949,$11.99,$24.99,https://www.jollychic.com/p/one-panel-black-grommet-top-window-curtain-g287500.html,One Panel Black Grommet Top Window Curtain,Curtains
1310,$35.99,,https://www.jollychic.com/p/one-panel-see-sheer-print-grommet-curtain-g293766.html,One Panel See Sheer Print Grommet Curtain,Curtains
2911,$22.99,,https://www.jollychic.com/p/one-panel-delicate-peony-et-sunflower-pattern-window-curtain-g299088.html,One Panel Delicate Peony et Sunflower Pattern Window Curtain,Curtains
544,$34.99,,https://www.jollychic.com/p/one-panel-fashion-new-york-impression-pattern-sheer-curtain-g326272.html,One Panel Fashion New York Impression Pattern Sheer Curtain,Curtains
1539,$13.99,$23.99,https://www.jollychic.com/p/a-panel-luxury-black-floral-geometric-pattern-blackout-curtains-g334640.html,A Panel Luxury Black Floral Geometric Pattern Blackout Curtains,Curtains
152,$13.99,$24.99,https://www.jollychic.com/p/sheer-blue-curtain-one-panel-g349762.html,Sheer Blue Curtain One Panel,Curtains
866,$0.99,$1.99,https://www.jollychic.com/p/lovely-cartoon-sun-flower-curtain-holder-g361354.html,Lovely Cartoon Sun Flower Curtain Holder,Curtains
503,$8.99,$17.99,https://www.jollychic.com/p/one-piece-french-window-linen-curtain-clean-blue-design-curtains-g497778.html,One Piece French Window Linen Curtain Clean Blue Design Curtains,Curtains
3187,$9.99,$17.99,https://www.jollychic.com/p/one-piece-french-window-curtains-fresh-color-simple-style-curtains-g497780.html,One Piece French Window Curtains Fresh Color Simple Style Curtains,Curtains
3609,$11.99,$22.99,https://www.jollychic.com/p/one-piece-blackout-curtains-modern-simple-design-fashion-curtain-g497784.html,One Piece Blackout Curtains Modern Simple Design Fashion Curtain,Curtains
388,$24.99,,https://www.jollychic.com/p/one-piece-blackout-curtain-bright-flowers-pattern-home-decorative-curtain-g518344.html,One Piece Blackout Curtain Bright Flowers Pattern Home Decorative Curtain,Curtains
1564,$7.99,$16.99,https://www.jollychic.com/p/one-piece-sheer-curtain-brief-style-solid-light-blue-home-decorative-curtain-g541418.html,One Piece Sheer Curtain Brief Style Solid Light Blue Home Decorative Curtain,Curtains
586,$16.99,,https://www.jollychic.com/p/one-piece-curtain-simple-solid-light-yellow-soft-decorative-window-screening-g541420.html,One Piece Curtain Simple Solid Light Yellow Soft Decorative Window Screening,Curtains
119,$20.99,,https://www.jollychic.com/p/one-piece-decorative-curtain-red-bright-floral-pattern-blackout-curtain-g541422.html,One Piece Decorative Curtain Red Bright Floral Pattern Blackout Curtain,Curtains
478,$9.99,$20.99,https://www.jollychic.com/p/one-piece-blackout-curtain-colored-flowers-pattern-home-decorative-curtain-g541424.html,One Piece Blackout Curtain Colored Flowers Pattern Home Decorative Curtain,Curtains
806,$6.99,$12.99,https://www.jollychic.com/p/one-piece-decorative-curtain-five-satins-half-shading-home-black-curtain-g563746.html,One Piece Decorative Curtain Five Satins Half Shading Home Black Curtain,Curtains
672,$12.99,,https://www.jollychic.com/p/one-piece-black-curtain-solid-fresh-color-half-shading-five-stains-decorative-curtain-g563748.html,One Piece Black Curtain Solid Fresh Color Half Shading Five Stains Decorative Curtain,Curtains
1773,$16.99,,https://www.jollychic.com/p/one-piece-home-decorative-curtain-wickers-pattern-filmy-sheer-curtain-g563752.html,One Piece Home Decorative Curtain Wickers Pattern Filmy Sheer Curtain,Curtains
12947,$9.99,$25.99,https://www.jollychic.com/p/one-piece-window-curtain-vivid-flowers-pattern-decorative-sheer-curatin-g572914.html,One Piece Window Curtain Vivid Flowers Pattern Decorative Sheer Curatin,Curtains
6886,$6.99,$21.99,https://www.jollychic.com/p/one-piece-curtain-colorful-butterflies-pattern-home-decorative-window-screening-g572916.html,One Piece Curtain Colorful Butterflies Pattern Home Decorative Window Screening,Curtains
1911,$8.99,$18.99,https://www.jollychic.com/p/one-piece-curtain-pastorale-style-floral-pattern-fresh-decorative-sheer-curtain-g572922.html,One Piece Curtain Pastorale Style Floral Pattern Fresh Decorative Sheer Curtain,Curtains
415,$7.99,$28.99,https://www.jollychic.com/p/1pc-home-curtain-decorative-clipped-flowers-pattern-sheer-curtain-g614574.html,1Pc Home Curtain Decorative Clipped Flowers Pattern Sheer Curtain,Curtains
1006,$6.99,$27.99,https://www.jollychic.com/p/1pc-home-curtain-bright-blooming-flowers-pattern-washable-sheer-curtain-g614580.html,1Pc Home Curtain Bright Blooming Flowers Pattern Washable Sheer Curtain,Curtains
110,$13.99,$23.99,https://www.jollychic.com/p/one-piece-decorative-curtain-bright-purple-hydrangea-pattern-curtain-g622310.html,One Piece Decorative Curtain Bright Purple Hydrangea Pattern Curtain,Curtains
155,$19.99,$34.99,https://www.jollychic.com/p/one-piece-curtain-light-blocking-brief-design-household-curtain-g634014.html,One Piece Curtain Light Blocking Brief Design Household Curtain,Curtains
1194,$6.99,$19.99,https://www.jollychic.com/p/one-piece-sheer-curtain-slim-colorful-balloon-pattern-cozy-window-curtain-g636524.html,One Piece Sheer Curtain Slim Colorful Balloon Pattern Cozy Window Curtain,Curtains
392,$12.99,$34.99,https://www.jollychic.com/p/one-piece-sheer-curtain-slim-leaf-pattern-lightweight-window-curtain-g636558.html,One Piece Sheer Curtain Slim Leaf Pattern Lightweight Window Curtain,Curtains
1825,$17.99,$42.99,https://www.jollychic.com/p/one-piece-window-curtain-cozy-flower-pattern-half-blockout-sheer-curtain-g636560.html,One Piece Window Curtain Cozy Flower Pattern Half Blockout Sheer Curtain,Curtains
174,$6.99,$19.99,https://www.jollychic.com/p/one-piece-window-curtain-fresh-style-tulip-themed-sheer-curtain-g636568.html,One Piece Window Curtain Fresh Style Tulip Themed Sheer Curtain,Curtains
316,$9.99,$18.99,https://www.jollychic.com/p/one-piece-home-decorative-curtain-pastoral-style-floral-pattern-sheer-curtain-g660070.html,One Piece Home Decorative Curtain Pastoral Style Floral Pattern Sheer Curtain,Curtains
100,$11.99,$21.99,https://www.jollychic.com/p/1pc-sheer-curtain-coffee-color-banana-leaf-pattern-solid-decorative-curtain-g668620.html,1Pc Sheer Curtain Coffee Color Banana Leaf Pattern Solid Decorative Curtain,Curtains
185,$14.99,,https://www.jollychic.com/p/1pc-decorative-curtain-lifesome-flowers-pattern-transparent-sheer-curtain-g668626.html,1Pc Decorative Curtain Lifesome Flowers Pattern Transparent Sheer Curtain,Curtains
673,$9.99,$19.99,https://www.jollychic.com/p/1pc-home-decorative-curtain-classic-plaids-pattern-sheer-curtain-g668630.html,1Pc Home Decorative Curtain Classic Plaids Pattern Sheer Curtain,Curtains
1645,$5.99,$15.99,https://www.jollychic.com/p/1pc-home-decorative-curtain-dreamy-pink-floral-pattern-sector-curtain-g668634.html,1Pc Home Decorative Curtain Dreamy Pink Floral Pattern Sector Curtain,Curtains
1234,$8.99,$20.99,https://www.jollychic.com/p/one-piece-sheer-curtain-dreamy-sweet-butterflies-pattern-decortaive-curtain-g668772.html,One Piece Sheer Curtain Dreamy Sweet Butterflies Pattern Decortaive Curtain,Curtains
97,$5.99,$20.99,https://www.jollychic.com/p/1pc-sheer-curtain-grid-maple-leaf-pattern-solid-decorative-curtain-g672336.html,1Pc Sheer Curtain Grid Maple Leaf Pattern Solid Decorative Curtain,Curtains
105,$8.99,$18.99,https://www.jollychic.com/p/1pc-sheer-curtain-beautiful-big-flower-pattern-solid-decorative-curtain-g672338.html,1Pc Sheer Curtain Beautiful Big Flower Pattern Solid Decorative Curtain,Curtains
66,$7.99,$16.99,https://www.jollychic.com/p/1pc-decorative-curtain-graceful-flowers-pattern-beautiful-home-sheer-curtain-g672346.html,1Pc Decorative Curtain Graceful Flowers Pattern Beautiful Home Sheer Curtain,Curtains
303,$20.99,,https://www.jollychic.com/p/1pc-sheer-curtain-flower-grid-pattern-bedroom-living-room-decorative-curtain-g672368.html,1Pc Sheer Curtain Flower Grid Pattern Bedroom Living Room Decorative Curtain,Curtains
7650,$12.99,,https://www.jollychic.com/p/magnetic-door-screen-with-heavy-duty-mesh-curtain-and-velcro-fits-door-curtain-g692134.html,Magnetic Door Screen With Heavy Duty Mesh Curtain And Velcro Fits Door Curtain,Curtains
1199,$16.99,,https://www.jollychic.com/p/one-piece-sheer-curtain-likable-cartoon-bears-pattern-decorative-curtain-g692140.html,One Piece Sheer Curtain Likable Cartoon Bears Pattern Decorative Curtain,Curtains
82,$13.99,$21.99,https://www.jollychic.com/p/one-piece-curtain-simple-solid-orange-color-soft-blackout-curtain-g712026.html,One Piece Curtain Simple Solid Orange Color Soft Blackout Curtain,Curtains
3124,$13.99,$21.99,https://www.jollychic.com/p/one-piece-curtain-simple-solid-light-coffee-color-thick-blackout-curtain-g717984.html,One Piece Curtain Simple Solid Light Coffee Color Thick Blackout Curtain,Curtains
316,$24.99,,https://www.jollychic.com/p/one-piece-home-decor-simple-solid-three-layers-full-blackout-curtain-g722120.html,One Piece Home Decor Simple Solid Three Layers Full Blackout Curtain,Curtains
82,$24.99,,https://www.jollychic.com/p/one-piece-curtain-simple-solid-red-color-flannel-blackout-curtain-g730196.html,One Piece Curtain Simple Solid Red Color Flannel Blackout Curtain,Curtains
377,$16.99,$24.99,https://www.jollychic.com/p/one-piece-curtain-simple-solid-beige-color-soft-blackout-curtain-g752900.html,One Piece Curtain Simple Solid Beige Color Soft Blackout Curtain,Curtains
91,$33.99,$49.99,https://www.jollychic.com/p/one-piece-curtain-vintage-style-simple-hemp-blackout-curtain-g763802.html,One Piece Curtain Vintage Style Simple Hemp Blackout Curtain,Curtains
18,$94.00,,https://www.jollychic.com/p/one-piece-curtain-vintage-style-chenille-embroidered-blackout-curtain-g772750.html,One Piece Curtain Vintage Style Chenille Embroidered Blackout Curtain,Curtains
83,$33.99,$49.99,https://www.jollychic.com/p/one-piece-curtain-vintage-style-simple-multicolor-hemp-blackout-curtain-g772752.html,One Piece Curtain Vintage Style Simple Multicolor Hemp Blackout Curtain,Curtains
207,$39.99,,https://www.jollychic.com/p/one-piece-home-curtain-simple-solid-chiffon-decorative-curtain-g817726.html,One Piece Home Curtain Simple Solid Chiffon Decorative Curtain,Curtains
89,$26.99,$39.99,https://www.jollychic.com/p/one-piece-sheer-curtain-modern-simple-solid-grey-thin-decorative-curatin-g817732.html,One Piece Sheer Curtain Modern Simple Solid Grey Thin Decorative Curatin,Curtains
73,$48.99,,https://www.jollychic.com/p/one-piece-curtain-decorative-embroidery-flowers-pattern-sheer-curtain-g818180.html,One Piece Curtain Decorative Embroidery Flowers Pattern Sheer Curtain,Curtains
591,$20.99,$31.99,https://www.jollychic.com/p/one-piece-home-modern-simple-solid-jacquard-weave-blackout-curtain-g818184.html,One Piece Home Modern Simple Solid Jacquard Weave Blackout Curtain,Curtains
518,$16.99,$25.99,https://www.jollychic.com/p/home-curtain-modern-solid-full-shading-decorative-living-room-curtain-g848070.html,Home Curtain Modern Solid Full Shading Decorative Living Room Curtain,Curtains
242,$12.99,,https://www.jollychic.com/p/one-piece-sheer-curtain-butterflies-voile-divider-window-curtain-drape-panel-g857022.html,One Piece Sheer Curtain Butterflies Voile Divider Window Curtain Drape Panel,Curtains
445,$19.99,$29.99,https://www.jollychic.com/p/one-piece-home-decorative-curtain-solid-jacquard-weave-sheer-curtain-g926890.html,One Piece Home Decorative Curtain Solid Jacquard Weave Sheer Curtain,Curtains
364,$18.99,$27.99,https://www.jollychic.com/p/one-piece-decorative-curtain-european-style-solid-soft-blackout-curtain-g926894.html,One Piece Decorative Curtain European Style Solid Soft Blackout Curtain,Curtains
130,$26.99,,https://www.jollychic.com/p/one-piece-home-decorative-curtain-modern-solid-flower-design-curtain-g926896.html,One Piece Home Decorative Curtain Modern Solid Flower Design Curtain,Curtains
158,$32.99,,https://www.jollychic.com/p/1pc-decorative-curtain-gradient-color-half-shading-blackout-curtain-g926898.html,1Pc Decorative Curtain Gradient Color Half Shading Blackout Curtain,Curtains
66,$35.99,$54.00,https://www.jollychic.com/p/one-piece-sheer-curtain-fresh-solid-embroidery-pattern-home-curtain-g950306.html,One Piece Sheer Curtain Fresh Solid Embroidery Pattern Home Curtain,Curtains
82,$33.99,$49.99,https://www.jollychic.com/p/1pc-living-room-curtain-modern-vertical-striped-half-shading-blackout-curtain-g950316.html,1Pc Living Room Curtain Modern Vertical Striped Half Shading Blackout Curtain,Curtains
46,$30.99,$45.99,https://www.jollychic.com/p/one-piece-decorative-curtain-solid-modern-super-soft-blackout-curtain-g967632.html,One Piece Decorative Curtain Solid Modern Super Soft Blackout Curtain,Curtains
64,$29.99,$44.99,https://www.jollychic.com/p/one-piece-living-room-curtain-modern-solid-comfy-soft-blackout-curtain-g967636.html,One Piece Living Room Curtain Modern Solid Comfy Soft Blackout Curtain,Curtains
253,$15.99,$24.99,https://www.jollychic.com/p/one-piece-home-living-room-curtain-modern-solid-full-shading-blackout-curtain-g967640.html,One Piece Home Living Room Curtain Modern Solid Full Shading Blackout Curtain,Curtains
126,$23.99,$35.99,https://www.jollychic.com/p/one-piece-blackout-curtain-delicate-solid-full-shading-home-living-room-curtain-g967644.html,One Piece Blackout Curtain Delicate Solid Full Shading Home Living Room Curtain,Curtains
458,$9.99,$18.99,https://www.jollychic.com/p/1pc-sheer-curtain-pastoral-style-embroidery-floral-pattern-home-decor-g996300.html,1Pc Sheer Curtain Pastoral Style Embroidery Floral Pattern Home Decor,Curtains
75,$26.99,$39.99,https://www.jollychic.com/p/1pc-blackout-curtain-european-style-bedroom-decorative-curtain-g1004392.html,1Pc Blackout Curtain European Style Bedroom Decorative Curtain,Curtains
116,$26.99,$39.99,https://www.jollychic.com/p/one-piece-curtain-linen-polyester-vintage-style-blackout-curtain-g1004394.html,One Piece Curtain Linen Polyester Vintage Style Blackout Curtain,Curtains
218,$37.99,,https://www.jollychic.com/p/one-piece-decorative-curtain-sweet-pink-polyester-blackout-curtain-g1004416.html,One Piece Decorative Curtain Sweet Pink Polyester Blackout Curtain,Curtains
719,$17.99,,https://www.jollychic.com/p/one-piece-living-room-curtain-graceful-solid-embroidery-flower-sheer-curtain-g1013256.html,One Piece Living Room Curtain Graceful Solid Embroidery Flower Sheer Curtain,Curtains
2704,$9.99,,https://www.jollychic.com/p/2-pcs-curtain-clasps-cute-puppy-bear-shaped-buckle-curtain-strap-g1015156.html,2 Pcs Curtain Clasps Cute Puppy Bear Shaped Buckle Curtain Strap,Curtains
1405,$4.99,,https://www.jollychic.com/p/2-pcs-curtain-buckles-flower-shaped-countryside-style-curtain-strap-g1015158.html,2 Pcs Curtain Buckles Flower Shaped Countryside Style Curtain Strap,Curtains
107,$3.99,$8.99,https://www.jollychic.com/p/curtain-door-magnetic-fastening-hands-free-insect-screen-net-g1020428.html,Curtain Door Magnetic Fastening Hands Free Insect Screen Net,Curtains
353,$41.99,$76.00,https://www.jollychic.com/p/one-piece-child-room-decorative-curtain-colorful-pencils-pattern-curtain-g1180946.html,One Piece Child Room Decorative Curtain Colorful Pencils Pattern Curtain,Curtains
7947,$1.99,$6.99,https://www.jollychic.com/p/1m-home-decorative-beaded-curtain-delicate-artificial-crystal-transparent-curtain-g1180964.html,1M Home Decorative Beaded Curtain Delicate Artificial Crystal Transparent Curtain,Curtains
69,$6.99,$9.99,https://www.jollychic.com/p/one-piece-sheer-curtain-sweet-tulips-printing-tulle-drape-balcony-window-decoration-g1235142.html,One Piece Sheer Curtain Sweet Tulips Printing Tulle Drape Balcony Window Decoration,Curtains
391,$9.99,,https://www.jollychic.com/p/living-room-decorative-bead-curtain-calabash-shaped-home-decorative-curtain-g1236100.html,Living Room Decorative Bead Curtain Calabash Shaped Home Decorative Curtain,Curtains
5963,$6.99,$11.99,https://www.jollychic.com/p/home-bedroom-bead-curtain-simple-dreamy-artificial-crystal-decorative-door-curtain-g1236106.html,Home Bedroom Bead Curtain Simple Dreamy Artificial Crystal Decorative Door Curtain,Curtains
44,$26.99,$46.99,https://www.jollychic.com/p/1pc-home-curtain-luxury-emboridery-floral-blackout-window-curtain-decoration-g1251916.html,1Pc Home Curtain Luxury Emboridery Floral Blackout Window Curtain Decoration,Curtains
113,$26.99,$48.99,https://www.jollychic.com/p/one-piece-window-curtain-gradient-colour-thin-tulle-voile-sheer-curtain-g1289444.html,One Piece Window Curtain Gradient Colour Thin Tulle Voile Sheer Curtain,Curtains
25,$26.99,$56.00,https://www.jollychic.com/p/1pc-living-room-full-shading-luxuriant-purple-blackout-window-curtain-g1320132.html,1Pc Living Room Full Shading Luxuriant Purple Blackout Window Curtain,Curtains
178,$31.99,$52.00,https://www.jollychic.com/p/1pc-home-decorative-curtain-solid-living-room-blackout-window-curtain-g1320134.html,1Pc Home Decorative Curtain Solid Living Room Blackout Window Curtain,Curtains
43,$8.99,$25.99,https://www.jollychic.com/p/1pc-living-room-curtain-dreamy-vivid-tulip-finished-screen-window-curtain-g1320210.html,1Pc Living Room Curtain Dreamy Vivid Tulip Finished Screen Window Curtain,Curtains
140,$24.99,$45.99,https://www.jollychic.com/p/1pc-home-curtain-simple-modern-hemp-leaves-pattern-blackout-curtain-g1320212.html,1Pc Home Curtain Simple Modern Hemp Leaves Pattern Blackout Curtain,Curtains
82,$6.99,$17.99,https://www.jollychic.com/p/1pc-blackout-curtain-modern-solid-delicate-full-shading-living-room-curtain-g1344676.html,1Pc Blackout Curtain Modern Solid Delicate Full Shading Living Room Curtain,Curtains
85,$8.99,$22.99,https://www.jollychic.com/p/1-pc-line-window-door-durtains-wedding-decoration-curtain-g1376406.html,1 Pc Line Window Door Durtains Wedding Decoration Curtain,Curtains
86,$4.99,$11.99,https://www.jollychic.com/p/1-pc-curtain-heart-shape-line-window-door-curtain-wedding-decoration-curtain-g1376408.html,1 Pc Curtain Heart Shape Line Window Door Curtain Wedding Decoration Curtain,Curtains
47,$6.99,$16.99,https://www.jollychic.com/p/1pc-living-room-curtain-modern-voile-gauze-window-curtain-tulles-g1391136.html,1Pc Living Room Curtain Modern Voile Gauze Window Curtain Tulles,Curtains
306,$5.99,$13.99,https://www.jollychic.com/p/door-curtain-delicate-solid-silver-line-home-entrance-door-curtain-g1391158.html,Door Curtain Delicate Solid Silver Line Home Entrance Door Curtain,Curtains
92,$9.99,$15.99,https://www.jollychic.com/p/1pc-home-curtain-modern-simple-solid-half-shading-blackout-curtain-g1420284.html,1Pc Home Curtain Modern Simple Solid Half Shading Blackout Curtain,Curtains
28,$19.99,$38.99,https://www.jollychic.com/p/1-pc-curtain-tower-print-window-curtains-for-living-room-g1423980.html,1 Pc Curtain Tower Print Window Curtains for Living Room,Curtains
64,$23.99,$44.99,https://www.jollychic.com/p/1-pc-curtain-pastroral-flower-plaid-lace-short-curtain-kitchen-curtain-g1423986.html,1 Pc Curtain Pastroral Flower Plaid Lace Short Curtain Kitchen Curtain,Curtains
149,$26.99,,https://www.jollychic.com/p/1-pc-curtain-pastoral-short-window-curtain-kitchen-curtain-g1423990.html,1 Pc Curtain Pastoral Short Window Curtain Kitchen Curtain,Curtains
149,$4.99,$10.99,https://www.jollychic.com/p/1pc-bead-curtain-simulation-crystal-gold-champagne-hanging-curtain-entrance-g1426348.html,1Pc Bead Curtain Simulation Crystal Gold Champagne Hanging Curtain Entrance,Curtains
37,$12.99,$20.99,https://www.jollychic.com/p/1pc-home-curtain-monolithic-pastoral-style-solid-punch-finished-curtain-g1429630.html,1Pc Home Curtain Monolithic Pastoral Style Solid Punch Finished Curtain,Curtains
38,$7.99,$19.99,https://www.jollychic.com/p/1pc-living-room-curtain-decorative-lavender-shade-pattern-window-curtain-g1455672.html,1Pc Living Room Curtain Decorative Lavender Shade Pattern Window Curtain,Curtains
56,$6.99,$13.99,https://www.jollychic.com/p/1-pc-curtain-line-window-door-curtain-wedding-decoration-curtain-g1456108.html,1 Pc Curtain Line Window Door Curtain Wedding Decoration Curtain,Curtains
28,$6.99,$13.99,https://www.jollychic.com/p/1-pc-curtain-butterfly-line-decoration-window-curtain-for-living-room-g1456114.html,1 Pc Curtain Butterfly Line Decoration Window Curtain for Living Room,Curtains
34,$60.00,$88.00,https://www.jollychic.com/p/1pc-blackout-curtain-embroidery-flowers-pattern-thick-window-curtain-g1491356.html,1Pc Blackout Curtain Embroidery Flowers Pattern Thick Window Curtain,Curtains
5,$35.99,$57.00,https://www.jollychic.com/p/1pc-curtain-linen-modern-design-splicing-living-room-decorative-curtain-g1513182.html,1Pc Curtain Linen Modern Design Splicing Living Room Decorative Curtain,Curtains
54,$8.99,$18.99,https://www.jollychic.com/p/1pc-decorative-string-curtain-european-style-creative-room-decoration-g1513258.html,1Pc Decorative String Curtain European Style Creative Room Decoration,Curtains
0,$29.99,,https://www.jollychic.com/p/1pc-children-s-room-window-curtain-cartoon-printing-adorable-beautiful-curtain-g1589914.html,1PC Children's Room Window Curtain Cartoon Printing Adorable Beautiful Curtain,Curtains
1,$20.99,,https://www.jollychic.com/p/curtain-buckle-modern-simple-novel-magnetic-durable-curtain-accessory-g1597352.html,Curtain Buckle Modern Simple Novel Magnetic Durable Curtain Accessory,Curtains
7,$20.99,,https://www.jollychic.com/p/4-pcs-hanging-screens-set-european-style-divider-safety-hanging-screen-panel-g1597360.html,4 Pcs Hanging Screens Set European Style Divider Safety Hanging Screen Panel,Curtains
0,$8.99,,https://www.jollychic.com/p/2-pcs-curtain-buckle-lovely-bear-doll-bedroom-curtain-tieback-g1599824.html,2 Pcs Curtain Buckle Lovely Bear Doll Bedroom Curtain Tieback,Curtains
0,$15.99,,https://www.jollychic.com/p/1-pc-window-curtain-tulips-pattern-elegant-style-thin-balcony-window-curtain-g1599828.html,1 Pc Window Curtain Tulips Pattern Elegant Style Thin Balcony Window Curtain,Curtains
0,$32.99,,https://www.jollychic.com/p/home-door-curtain-simple-solid-mesh-anti-mosquito-door-net-g1601316.html,Home Door Curtain Simple Solid Mesh Anti Mosquito Door Net,Curtains
0,$57.00,,https://www.jollychic.com/p/1pc-window-dressing-simple-floral-pattern-beautiful-draperies-curtain-g1601324.html,1Pc Window Dressing Simple Floral Pattern Beautiful Draperies Curtain,Curtains
0,$9.99,,https://www.jollychic.com/p/royal-buy-anti-insect-fly-bug-mosquito-door-window-curtain-net-mesh-screen-protector-g1613280.html,Royal-Buy Anti Insect Fly Bug Mosquito Door Window Curtain Net Mesh Screen Protector,Curtains
0,$88.00,,https://www.jollychic.com/p/1-pc-bedroom-curtain-children-s-cute-tree-pattern-lightproof-window-curtain-g1617778.html,1 Pc Bedroom Curtain Children's Cute Tree Pattern Lightproof Window Curtain,Curtains
0,$70.00,,https://www.jollychic.com/p/1-pc-bedroom-curtain-children-s-cartoon-car-pattern-lightproof-window-curtain-g1617780.html,1 Pc Bedroom Curtain Children's Cartoon Car Pattern Lightproof Window Curtain,Curtains
0,$57.00,,https://www.jollychic.com/p/1-pc-curtain-simple-style-modern-striped-pattern-household-curtain-g1621246.html,1 Pc Curtain Simple Style Modern Striped Pattern Household Curtain,Curtains
0,$57.00,,https://www.jollychic.com/p/1-pc-curtain-pastorable-style-curvilinear-pattern-household-curtain-g1621248.html,1 Pc Curtain Pastorable Style Curvilinear Pattern Household Curtain,Curtains
1,$57.00,,https://www.jollychic.com/p/1pc-window-screening-nonopaque-lace-embroidered-pattern-window-curtain-g1621258.html,1Pc Window Screening Nonopaque Lace Embroidered Pattern Window Curtain,Curtains
1,$70.00,,https://www.jollychic.com/p/1pc-window-curtain-nordic-half-blackout-plant-living-room-curtain-g1635508.html,1Pc Window Curtain Nordic Half Blackout Plant Living Room Curtain,Curtains
1,$18.99,,https://www.jollychic.com/p/curtain-tieback-rhinestones-crystal-magnet-flower-shape-curtains-buckle-g1635780.html,Curtain Tieback Rhinestones Crystal Magnet Flower Shape Curtains Buckle,Curtains
993,$13.99,$24.99,https://www.jollychic.com/p/geometric-waving-stripe-pattern-window-curtain-one-panel--g242163.html,Geometric Waving Stripe Pattern Window Curtain (One Panel),Curtains
1548,$25.99,,https://www.jollychic.com/p/luxury-thicken-red-window-curtain-one-panel--g259393.html,Luxury Thicken Red Window Curtain(One Panel),Curtains
2122,$11.99,$25.99,https://www.jollychic.com/p/modern-light-purple-waterproof-window-curtain-one-panel--g259399.html,Modern Light Purple Waterproof Window Curtain(One Panel),Curtains
1288,$19.99,,https://www.jollychic.com/p/one-panel-vintage-red-london-pattern-window-sheer-curtain-g259459.html,One Panel Vintage Red London Pattern Window Sheer Curtain,Curtains
5214,$11.99,$18.99,https://www.jollychic.com/p/one-panel-classic-grey-lightproof-window-curtain-g278415.html,One Panel Classic Grey Lightproof Window Curtain,Curtains
2609,$11.99,$23.99,https://www.jollychic.com/p/one-panel-taupe-grommet-top-elegant-blackout-sun-protect-curtain-g278481.html,One Panel Taupe Grommet Top Elegant Blackout Sun Protect Curtain,Curtains
532,$15.99,$30.99,https://www.jollychic.com/p/floral-grommet-top-mediterranean-style-one-piece-window-curtains-g278531.html,Floral Grommet Top Mediterranean Style One Piece Window Curtains,Curtains
