add_wish,discount_price,original_price,product_link,product_name,header_block
3,$20.99,$31.99,https://www.jollychic.com/p/zhuowolves-men-s-sweater-solid-color-turtle-neck-casual-pullover-g1245828.html,Zhuowolves Men's Sweater Solid Color Turtle Neck Casual Pullover,Knitwear
7,$18.99,$27.99,https://www.jollychic.com/p/zhuowolves-men-s-sweater-crew-neck-color-block-casual-pullover-g1245832.html,Zhuowolves Men's Sweater Crew Neck Color Block Casual Pullover,Knitwear
4,$16.99,$26.99,https://www.jollychic.com/p/men-s-pullover-color-stirped-warm-chic-style-pullovers-g1258278.html,Men's Pullover Color Stirped Warm Chic Style Pullovers,Knitwear
25,$15.99,$24.99,https://www.jollychic.com/p/men-s-pullover-striped-comfy-o-neck-knitted-chic-sweater-g1277702.html,Men's Pullover Striped Comfy O Neck Knitted Chic Sweater,Knitwear
8,$18.99,$30.99,https://www.jollychic.com/p/men-s-pullover-color-block-fashion-crew-neck-all-match-causal-sweater-g1284634.html,Men's Pullover Color Block Fashion Crew Neck All Match Causal Sweater,Knitwear
5,$18.99,$30.99,https://www.jollychic.com/p/men-s-cardigan-solid-color-front-open-long-sleeve-comfy-coat-g1309284.html,Men's Cardigan Solid Color Front Open Long Sleeve Comfy Coat,Knitwear
6,$11.99,$29.99,https://www.jollychic.com/p/men-s-sweater-casual-slim-comfy-striped-patchwork-color-knitwear-g1318180.html,Men's Sweater Casual Slim Comfy Striped Patchwork Color Knitwear,Knitwear
7,$23.99,$39.99,https://www.jollychic.com/p/men-s-sweater-stylish-solid-color-long-sleeve-casual-comfy-pullover-g1322388.html,Men's Sweater Stylish Solid Color Long Sleeve Casual Comfy Pullover,Knitwear
4,$19.99,$30.99,https://www.jollychic.com/p/men-s-sweater-casual-v-neck-comfy-fashion-solid-color-sweater-g1330968.html,Men's Sweater Casual V Neck Comfy Fashion Solid Color Sweater,Knitwear
6,$27.99,$38.99,https://www.jollychic.com/p/men-s-cardigan-solid-color-buttons-long-sleeve-comfy-coat-g1333062.html,Men's Cardigan Solid Color Buttons Long Sleeve Comfy Coat,Knitwear
8,$23.99,$39.99,https://www.jollychic.com/p/men-s-sweater-jacquard-o-neck-solid-long-sleeve-casual-comfy-pullover-g1333686.html,Men's Sweater Jacquard O Neck Solid Long Sleeve Casual Comfy Pullover,Knitwear
19,$39.99,,https://www.jollychic.com/p/men-s-sweater-turtle-neck-zipper-solid-color-long-sleeve-slim-comfy-pullover-g1333688.html,Men's Sweater Turtle Neck Zipper Solid Color Long Sleeve Slim Comfy Pullover,Knitwear
1,$27.99,,https://www.jollychic.com/p/men-s-pullover-heaps-collar-long-sleeve-solid-color-comfy-knitwear-g1340580.html,Men's Pullover Heaps Collar Long Sleeve Solid Color Comfy Knitwear,Knitwear
10,$19.99,$27.99,https://www.jollychic.com/p/men-s-sweater-solid-color-hooded-simple-long-sleeve-knitwear-g1340604.html,Men's Sweater Solid Color Hooded Simple Long Sleeve Knitwear,Knitwear
35,$13.99,$23.99,https://www.jollychic.com/p/men-s-sweater-casual-striped-comfy-fashion-all-matched-sweater-g1345684.html,Men's Sweater Casual Striped Comfy Fashion All Matched Sweater,Knitwear
16,$16.99,$27.99,https://www.jollychic.com/p/men-s-sweater-casual-color-block-comfy-fashion-all-matched-sweater-g1345702.html,Men's Sweater Casual Color Block Comfy Fashion All Matched Sweater,Knitwear
30,$15.99,$27.99,https://www.jollychic.com/p/men-s-sweater-casual-comfy-solid-color-fashion-all-matched-sweater-g1345704.html,Men's Sweater Casual Comfy Solid Color Fashion All Matched Sweater,Knitwear
15,$15.99,$27.99,https://www.jollychic.com/p/men-s-sweater-casual-comfy-all-matched-solid-color-sweater-g1345708.html,Men's Sweater Casual Comfy All Matched Solid Color Sweater,Knitwear
19,$17.99,$27.99,https://www.jollychic.com/p/men-s-sweater-casual-comfy-fashion-solid-color-turtle-neck-all-matched-sweater-g1345710.html,Men's Sweater Casual Comfy Fashion Solid Color Turtle Neck All Matched Sweater,Knitwear
63,$14.99,$25.99,https://www.jollychic.com/p/men-s-sweater-striped-comfy-fashion-all-matched-sweater-g1345744.html,Men's Sweater Striped Comfy Fashion All Matched Sweater,Knitwear
5,$22.99,$38.99,https://www.jollychic.com/p/men-s-pullover-turtle-neck-letter-pattern-all-mach-fashion-causal-sweater-g1346314.html,Men's Pullover Turtle Neck Letter Pattern All Mach Fashion Causal Sweater,Knitwear
8,$21.99,$35.99,https://www.jollychic.com/p/men-s-sweater-all-match-casual-long-sleeve-print-knitwear-g1351020.html,Men's Sweater All Match Casual Long Sleeve Print Knitwear,Knitwear
547,$17.99,$27.99,https://www.jollychic.com/p/men-s-pullover-color-blocking-all-match-chic-pullover-g1374872.html,Men's Pullover Color Blocking All Match Chic Pullover,Knitwear
4,$22.99,$39.99,https://www.jollychic.com/p/men-s-cardigan-all-match-chic-style-striped-cardigan-g1374876.html,Men's Cardigan All Match Chic Style Striped Cardigan,Knitwear
3,$48.99,,https://www.jollychic.com/p/men-s-sweater-striped-warm-casual-style-sweater-g1374880.html,Men's Sweater Striped Warm Casual Style Sweater,Knitwear
13,$27.99,$42.99,https://www.jollychic.com/p/men-s-sweater-warm-winter-solid-all-match-sweater-g1374888.html,Men's Sweater Warm Winter Solid All Match Sweater,Knitwear
2,$30.99,$42.99,https://www.jollychic.com/p/men-s-cardigan-solid-color-comfy-all-matched-fashion-cardigan-g1375300.html,Men's Cardigan Solid Color Comfy All Matched Fashion Cardigan,Knitwear
9,$33.99,$47.99,https://www.jollychic.com/p/men-s-cardigan-all-matched-solid-color-comfy-fashion-cardigan-g1375326.html,Men's Cardigan All Matched Solid Color Comfy Fashion Cardigan,Knitwear
7,$28.99,$46.99,https://www.jollychic.com/p/men-s-sweater-casual-long-sleeve-patchwork-color-knitwear-g1377900.html,Men's Sweater Casual Long Sleeve Patchwork Color Knitwear,Knitwear
3,$17.99,$30.99,https://www.jollychic.com/p/men-s-cardigans-long-sleeve-open-front-solid-color-knitwear-g1389436.html,Men's Cardigans Long Sleeve Open Front Solid Color Knitwear,Knitwear
9,$34.99,,https://www.jollychic.com/p/men-s-sweater-casual-all-match-solid-color-long-sleeve-sweater-g1401690.html,Men's Sweater Casual All Match Solid Color Long Sleeve Sweater,Knitwear
0,$30.99,,https://www.jollychic.com/p/men-s-sweater-casual-color-block-turtle-neck-knitwear-g1402130.html,Men's Sweater Casual Color Block Turtle Neck Knitwear,Knitwear
24,$29.99,,https://www.jollychic.com/p/men-s-sweater-stripe-color-block-fashionable-casual-pullover-g1409620.html,Men's Sweater Stripe Color Block fashionable Casual Pullover,Knitwear
4,$22.99,$36.99,https://www.jollychic.com/p/men-s-sweater-stylish-color-v-neck-fashionable-casual-pullover-g1409630.html,Men's Sweater Stylish Color V Neck fashionable Casual Pullover,Knitwear
16,$13.99,$23.99,https://www.jollychic.com/p/men-s-sweater-o-neck-long-sleeve-color-block-knitwear-g1410454.html,Men's Sweater O Neck Long Sleeve Color Block knitwear,Knitwear
9,$25.99,$38.99,https://www.jollychic.com/p/men-s-knitwear-stylish-all-match-chic-thickened-cardigan-g1411880.html,Men's Knitwear Stylish All Match Chic Thickened Cardigan,Knitwear
2,$17.99,$27.99,https://www.jollychic.com/p/men-s-sweater-solid-color-fashion-o-neck-slim-comfy-knitwear-g1445812.html,Men's Sweater Solid Color Fashion O Neck Slim Comfy Knitwear,Knitwear
1,$20.99,$36.99,https://www.jollychic.com/p/men-s-cardigans-v-neck-splicing-color-blocking-slim-cut-pocket-all-match-cardigans-g1454770.html,Men's Cardigans V Neck Splicing Color Blocking Slim Cut Pocket All Match Cardigans,Knitwear
2,$33.99,,https://www.jollychic.com/p/men-s-sweater-outdoor-chic-style-warm-sweater-g1469136.html,Men's Sweater Outdoor Chic Style Warm Sweater,Knitwear
5,$27.99,,https://www.jollychic.com/p/men-s-pullover-solid-color-all-match-coldproof-pullover-g1469150.html,Men's Pullover Solid Color All Match Coldproof Pullover,Knitwear
3,$46.99,,https://www.jollychic.com/p/men-s-sweater-long-sleeve-comforty-turtle-neck-slim-knitwear-g1473946.html,Men's Sweater Long Sleeve Comforty Turtle Neck Slim Knitwear,Knitwear
4,$43.99,,https://www.jollychic.com/p/men-s-sweater-casual-slim-o-neck-long-sleeve-solid-color-knitwear-g1473956.html,Men's Sweater Casual Slim O Neck Long Sleeve Solid Color Knitwear,Knitwear
2,$25.99,,https://www.jollychic.com/p/men-s-sweater-patchwork-color-long-sleeve-simple-fashion-knitwear-g1508482.html,Men's Sweater Patchwork Color Long Sleeve Simple Fashion Knitwear,Knitwear
0,$40.99,,https://www.jollychic.com/p/men-s-sweater-comfy-animal-pattern-all-match-pullover-g1530360.html,Men's Sweater Comfy Animal Pattern All Match Pullover,Knitwear
0,$36.99,,https://www.jollychic.com/p/men-s-sweater-comfy-fashion-solid-color-all-match-pullover-g1530364.html,Men's Sweater Comfy Fashion Solid Color All Match Pullover,Knitwear
0,$36.99,,https://www.jollychic.com/p/men-s-cardigan-all-match-comfy-striped-chic-cardigan-g1530368.html,Men's Cardigan All Match Comfy Striped Chic Cardigan,Knitwear
1,$30.99,,https://www.jollychic.com/p/men-s-sweater-comfy-fashion-striped-all-match-pullover-g1530372.html,Men's Sweater Comfy Fashion Striped All Match Pullover,Knitwear
3,$35.99,,https://www.jollychic.com/p/men-s-pullovers-color-blocking-long-sleeve-common-round-neck-all-match-knitted-sweaters-g1530834.html,Men's Pullovers Color Blocking Long Sleeve Common Round Neck All Match Knitted Sweaters,Knitwear
2,$45.99,,https://www.jollychic.com/p/men-s-pullovers-stripes-splicing-color-block-long-sleeve-round-neck-slim-cut-knitted-sweaters-g1530838.html,Men's Pullovers Stripes Splicing Color Block Long Sleeve Round Neck Slim Cut Knitted Sweaters,Knitwear
2,$39.99,,https://www.jollychic.com/p/women-s-pullovers-personality-thin-slim-cut-color-blocking-long-sleeve-base-sweaters-g1530840.html,Women's Pullovers Personality Thin Slim Cut Color Blocking Long Sleeve Base Sweaters,Knitwear
3,$42.99,,https://www.jollychic.com/p/men-s-pullovers-jacquard-geometric-pattern-rhombic-round-neck-long-sleeve-casual-sweaters-g1530842.html,Men's Pullovers Jacquard Geometric Pattern Rhombic Round Neck Long Sleeve Casual Sweaters,Knitwear
2,$45.99,,https://www.jollychic.com/p/men-s-sweaters-round-neck-plaid-slim-cut-long-sleeve-thin-knitted-all-match-pullovers-g1530844.html,Men's Sweaters Round Neck Plaid Slim Cut Long Sleeve Thin Knitted All Match Pullovers,Knitwear
0,$30.99,,https://www.jollychic.com/p/men-s-sweatshirt-chic-striped-printing-casual-sweatshirt-g1532746.html,Men's Sweatshirt Chic Striped Printing Casual Sweatshirt,Knitwear
1,$27.99,,https://www.jollychic.com/p/men-s-sweater-pattern-printing-vintage-chic-sweater-g1532748.html,Men's Sweater Pattern Printing Vintage Chic Sweater,Knitwear
1,$27.99,,https://www.jollychic.com/p/men-s-casual-sweater-striped-casual-style-warm-chic-sweater-g1532750.html,Men's Casual Sweater Striped Casual Style Warm Chic Sweater,Knitwear
0,$27.99,,https://www.jollychic.com/p/men-s-sweater-striped-casual-style-warm-sweater-g1532752.html,Men's Sweater Striped Casual Style Warm Sweater,Knitwear
1,$25.99,,https://www.jollychic.com/p/men-s-casual-sweater-color-blocking-chic-style-warm-sweater-g1532754.html,Men's Casual Sweater Color Blocking Chic Style Warm Sweater,Knitwear
1,$38.99,,https://www.jollychic.com/p/men-s-casual-sweater-color-blocking-chic-style-warm-sweater-g1533214.html,Men's Casual Sweater Color Blocking Chic Style Warm Sweater,Knitwear
2,$25.99,,https://www.jollychic.com/p/men-s-cardigan-solid-color-single-breasted-casual-knitwear-g1575960.html,Men's Cardigan Solid Color Single Breasted Casual Knitwear,Knitwear
0,$21.99,$35.99,https://www.jollychic.com/p/semir-men-s-sweater-one-piece-layer-look-long-sleeve-patchwork-comfy-all-match-pullover-g1580508.html,SEMIR Men's Sweater One Piece Layer Look Long Sleeve Patchwork Comfy All Match Pullover,Knitwear
3,$17.99,$36.99,https://www.jollychic.com/p/men-s-sweater-comfy-turtle-neck-color-block-long-sleeve-pullover-g1580510.html,Men's Sweater Comfy Turtle Neck Color Block Long Sleeve Pullover,Knitwear
1,$10.99,$22.99,https://www.jollychic.com/p/men-s-sweater-v-neck-long-sleeve-color-block-comfy-all-match-pullover-g1580516.html,Men's Sweater V Neck Long Sleeve Color Block Comfy All Match Pullover,Knitwear
0,$36.99,,https://www.jollychic.com/p/men-s-sweater-round-neck-letter-print-all-match-basic-top-g1581272.html,Men's Sweater Round Neck Letter Print All Match Basic Top,Knitwear
0,$32.99,,https://www.jollychic.com/p/men-s-pullover-comfy-trendy-all-match-print-sweater-g1583226.html,Men's Pullover Comfy Trendy All Match Print Sweater,Knitwear
2,$33.99,,https://www.jollychic.com/p/men-s-pullover-trendy-comfy-solid-color-all-match-sweater-g1583228.html,Men's Pullover Trendy Comfy Solid Color All Match Sweater,Knitwear
4,$33.99,,https://www.jollychic.com/p/men-s-sweater-solid-color-comfy-trendy-all-match-sweater-g1583230.html,Men's Sweater Solid Color Comfy Trendy All Match Sweater,Knitwear
1,$26.99,$30.99,https://www.jollychic.com/p/men-s-pullover-comfy-trendy-all-match-color-block-sweater-g1583232.html,Men's Pullover Comfy Trendy All Match Color Block Sweater,Knitwear
1,$18.99,$30.99,https://www.jollychic.com/p/men-s-pullover-comfy-trendy-solid-color-all-match-sweater-g1583234.html,Men's Pullover Comfy Trendy Solid Color All Match Sweater,Knitwear
1,$31.99,,https://www.jollychic.com/p/men-s-pullover-comfy-solid-color-turtle-neck-trendy-all-match-sweater-g1583236.html,Men's Pullover Comfy Solid Color Turtle Neck Trendy All Match Sweater,Knitwear
0,$27.99,,https://www.jollychic.com/p/men-s-pullover-comfy-print-trendy-all-match-sweater-g1583238.html,Men's Pullover Comfy Print Trendy All Match Sweater,Knitwear
0,$54.00,,https://www.jollychic.com/p/men-s-pullover-comfy-o-neck-trendy-all-match-sweater-g1583240.html,Men's Pullover Comfy O Neck Trendy All Match Sweater,Knitwear
0,$53.00,,https://www.jollychic.com/p/men-s-pullover-comfy-solid-color-trendy-all-match-sweater-g1583242.html,Men's Pullover Comfy Solid Color Trendy All Match Sweater,Knitwear
1,$47.99,,https://www.jollychic.com/p/men-s-pullover-comfy-gradient-color-trendy-all-match-sweater-g1583244.html,Men's Pullover Comfy Gradient Color Trendy All Match Sweater,Knitwear
0,$32.99,,https://www.jollychic.com/p/men-s-pullover-comfy-color-block-trendy-all-match-sweater-g1583248.html,Men's Pullover Comfy Color Block Trendy All Match Sweater,Knitwear
0,$26.99,,https://www.jollychic.com/p/men-s-pullover-comfy-striped-trendy-all-match-sweater-g1583250.html,Men's Pullover Comfy Striped Trendy All Match Sweater,Knitwear
75,$29.99,,https://www.jollychic.com/p/pure-color-o-neck-pullover-sweater-for-men-g374092.html,Pure Color O Neck Pullover Sweater For Men,Knitwear
234,$23.99,,https://www.jollychic.com/p/casual-turtle-neck-knitwear-solid-color-slim-men-s-pullover-g395696.html,Casual Turtle Neck Knitwear Solid Color Slim Men's Pullover,Knitwear
3354,$14.99,,https://www.jollychic.com/p/men-s-pullover-o-neck-solid-comfortable-fashionable-sweater-g397952.html,Men's Pullover O Neck Solid Comfortable Fashionable Sweater,Knitwear
58,$28.99,,https://www.jollychic.com/p/men-s-sweater-o-neck-long-sleeve-stripe-color-block-warm-casual-knitwear-g451430.html,Men's Sweater O Neck Long Sleeve Stripe Color Block Warm Casual Knitwear,Knitwear
64,$44.99,,https://www.jollychic.com/p/men-s-cardigan-single-breasted-fashion-long-sleeve-warm-knitwear-g456688.html,Men's Cardigan Single Breasted Fashion Long Sleeve Warm Knitwear,Knitwear
288,$11.99,$30.99,https://www.jollychic.com/p/men-s-sweatshirt-fashion-casual-o-neck-long-sleeve-simple-pullover-g462176.html,Men's Sweatshirt Fashion Casual O Neck Long Sleeve Simple Pullover,Knitwear
10170,$17.99,$30.99,https://www.jollychic.com/p/men-s-knitwear-fashion-hooded-thicken-slimmed-sweater-coats-g473074.html,Men's Knitwear Fashion Hooded Thicken Slimmed Sweater Coats,Knitwear
92,$41.99,$59.00,https://www.jollychic.com/p/men-s-pullover-o-neck-long-sleeve-solid-color-casual-style-knitwear-g479020.html,Men's Pullover O Neck Long Sleeve Solid Color Casual Style Knitwear,Knitwear
3155,$14.99,$23.99,https://www.jollychic.com/p/men-s-cardigan-casual-open-front-cozy-fashion-long-sleeve-knitwear-g489376.html,Men's Cardigan Casual Open Front Cozy Fashion Long Sleeve Knitwear,Knitwear
35,$13.99,$23.99,https://www.jollychic.com/p/men-s-sweater-warm-color-bolock-thicken-slim-o-neck-cozy-knitwear-g515672.html,Men's Sweater Warm Color Bolock Thicken Slim O Neck Cozy Knitwear,Knitwear
141,$15.99,$23.99,https://www.jollychic.com/p/men-s-sweater-color-bolock-leisure-o-neck-comfort-warm-knitwear-g515694.html,Men's Sweater Color Bolock Leisure O Neck Comfort Warm Knitwear,Knitwear
35,$8.99,$14.99,https://www.jollychic.com/p/men-s-knitwear-o-neck-long-sleeve-stripe-color-block-pullover-g589614.html,Men's Knitwear O Neck Long Sleeve Stripe Color Block Pullover,Knitwear
5,$19.99,$30.99,https://www.jollychic.com/p/men-s-knitwear-fashion-casual-comfy-trendy-warm-chic-print-knitwear-g871914.html,Men's Knitwear Fashion Casual Comfy Trendy Warm Chic Print Knitwear,Knitwear
33,$17.99,$30.99,https://www.jollychic.com/p/men-s-knitwear-chic-casual-comfy-trendy-warm-color-block-knitwear-g871932.html,Men's Knitwear Chic Casual Comfy Trendy Warm Color Block Knitwear,Knitwear
9,$19.99,$30.99,https://www.jollychic.com/p/men-s-knitwear-casual-comfy-trendy-warm-striped-knitwear-g871934.html,Men's Knitwear Casual Comfy Trendy Warm Striped Knitwear,Knitwear
16,$28.99,,https://www.jollychic.com/p/men-s-knitwear-o-neck-color-block-long-sleeve-pullover-g877756.html,Men's Knitwear O Neck Color Block Long Sleeve Pullover,Knitwear
13,$18.99,$29.99,https://www.jollychic.com/p/men-s-knitwear-o-neck-striped-long-sleeve-pullover-g902326.html,Men's Knitwear O Neck Striped Long Sleeve Pullover,Knitwear
10,$19.99,$28.99,https://www.jollychic.com/p/men-s-knitwear-o-neck-striped-long-sleeve-pullover-g902330.html,Men's Knitwear O Neck Striped Long Sleeve Pullover,Knitwear
19,$15.99,$22.99,https://www.jollychic.com/p/men-s-knitwear-open-front-color-block-long-sleeve-knitwear-g903824.html,Men's Knitwear Open Front Color Block Long Sleeve Knitwear,Knitwear
71,$6.99,$20.99,https://www.jollychic.com/p/men-s-cardigan-sweater-solid-color-big-pocket-weaving-coat-g903846.html,Men's Cardigan Sweater Solid Color Big Pocket Weaving Coat,Knitwear
34,$12.99,$23.99,https://www.jollychic.com/p/men-s-cardigan-sweater-hole-solid-color-weaving-coat-g903848.html,Men's Cardigan Sweater Hole Solid Color Weaving Coat,Knitwear
48,$20.99,$34.99,https://www.jollychic.com/p/men-s-sweater-simple-style-solid-color-v-neck-sweater-g925680.html,Men's Sweater Simple Style Solid Color V Neck Sweater,Knitwear
27,$16.99,$35.99,https://www.jollychic.com/p/men-s-sweater-simple-style-pattern-round-neck-sweater-g926486.html,Men's Sweater Simple Style Pattern Round Neck Sweater,Knitwear
8,$20.99,$35.99,https://www.jollychic.com/p/men-s-sweater-simple-style-round-neck-sweater-g926496.html,Men's Sweater Simple Style Round Neck Sweater,Knitwear
10,$18.99,$26.99,https://www.jollychic.com/p/men-s-pullover-solid-color-all-match-brief-fashion-casual-sweater-g940028.html,Men's Pullover Solid Color All Match Brief Fashion Casual Sweater,Knitwear
371,$11.99,$18.99,https://www.jollychic.com/p/men-s-sweater-o-neck-one-piece-casual-strip-weaving-sweater-g940560.html,Men's Sweater O Neck One Piece Casual Strip Weaving Sweater,Knitwear
34,$15.99,$23.99,https://www.jollychic.com/p/men-s-sweater-round-neck-pullover-long-sleeves-casual-sweater-g940578.html,Men's Sweater Round Neck Pullover Long Sleeves Casual Sweater,Knitwear
110,$12.99,$18.99,https://www.jollychic.com/p/men-s-cardigan-color-block-long-sleeves-casual-cardigan-g978682.html,Men's Cardigan Color Block Long Sleeves Casual Cardigan,Knitwear
25,$34.99,$54.00,https://www.jollychic.com/p/men-s-pullover-solid-color-turtle-neck-long-sleeve-sweater-g991832.html,Men's Pullover Solid Color Turtle Neck Long Sleeve Sweater,Knitwear
186,$15.99,$21.99,https://www.jollychic.com/p/men-s-sweater-v-neck-long-sleeve-color-block-casual-pullover-g998702.html,Men's Sweater V Neck Long Sleeve Color Block Casual Pullover,Knitwear
43,$5.99,$12.99,https://www.jollychic.com/p/men-s-pullover-casual-color-block-striped-chic-comfy-all-matched-warm-sweater-g1000084.html,Men's Pullover Casual Color Block Striped Chic Comfy All Matched Warm Sweater,Knitwear
20,$16.99,$26.99,https://www.jollychic.com/p/men-s-sweater-patchwork-color-casual-comfy-o-neck-knitwear-g1033398.html,Men's Sweater Patchwork Color Casual Comfy O Neck Knitwear,Knitwear
25,$16.99,$29.99,https://www.jollychic.com/p/men-s-knitwear-long-sleeve-o-neck-striped-all-match-fashion-comfy-sweater-g1059956.html,Men's Knitwear Long Sleeve O Neck Striped All Match Fashion Comfy Sweater,Knitwear
6,$14.99,$22.99,https://www.jollychic.com/p/men-s-pullover-all-match-o-neck-patchwork-color-knitwear-g1065394.html,Men's Pullover All Match O Neck Patchwork Color Knitwear,Knitwear
24,$14.99,$22.99,https://www.jollychic.com/p/men-s-pullover-long-sleeve-simple-striped-casual-knitwear-g1065400.html,Men's Pullover Long Sleeve Simple Striped Casual Knitwear,Knitwear
14,$13.99,$22.99,https://www.jollychic.com/p/men-s-pullover-o-neck-casual-striped-long-sleeve-slim-knitwear-g1065404.html,Men's Pullover O Neck Casual Striped Long Sleeve Slim Knitwear,Knitwear
17,$17.99,$27.99,https://www.jollychic.com/p/men-s-vests-all-match-chic-school-knitwear-g1076592.html,Men's Vests All Match Chic School Knitwear,Knitwear
12,$25.99,$39.99,https://www.jollychic.com/p/men-s-sweater-o-neck-long-sleeve-color-block-casual-comfy-pullover-g1081210.html,Men's Sweater O Neck Long Sleeve Color Block Casual Comfy Pullover,Knitwear
6,$39.99,,https://www.jollychic.com/p/men-s-cardigan-zipper-long-sleeve-trendy-comfy-coat-g1081236.html,Men's Cardigan Zipper Long Sleeve Trendy Comfy Coat,Knitwear
27,$21.99,$31.99,https://www.jollychic.com/p/men-s-sweater-casual-solid-color-chic-comfy-o-neck-sweater-g1087626.html,Men's Sweater Casual Solid Color Chic Comfy O Neck Sweater,Knitwear
66,$24.99,$39.99,https://www.jollychic.com/p/men-s-cardigan-solid-color-comfy-long-sleeve-open-knitwear-g1103218.html,Men's Cardigan Solid Color Comfy Long Sleeve Open Knitwear,Knitwear
8,$19.99,$30.99,https://www.jollychic.com/p/men-s-pullover-fashion-color-block-comfy-knitted-o-neck-sweater-g1108098.html,Men's Pullover Fashion Color Block Comfy Knitted O Neck Sweater,Knitwear
1,$19.99,$30.99,https://www.jollychic.com/p/men-s-pullover-fashion-hole-design-solid-color-comfy-knitted-o-neck-sweater-g1108106.html,Men's Pullover Fashion Hole Design Solid Color Comfy Knitted O Neck Sweater,Knitwear
35,$18.99,$29.99,https://www.jollychic.com/p/men-s-sweater-o-neck-long-sleeve-patchwork-casual-comfy-pullover-g1125504.html,Men's Sweater O Neck Long Sleeve Patchwork Casual Comfy Pullover,Knitwear
97,$17.99,$26.99,https://www.jollychic.com/p/men-s-cardigan-breathable-one-piece-layer-look-comfy-cardigan-g1152350.html,Men's Cardigan Breathable One Piece Layer Look Comfy Cardigan,Knitwear
13,$18.99,$34.99,https://www.jollychic.com/p/men-s-sweater-classic-turtle-neck-casual-solid-color-knitwear-g1156088.html,Men's Sweater Classic Turtle Neck Casual Solid Color Knitwear,Knitwear
13,$29.99,$48.99,https://www.jollychic.com/p/men-s-cardigan-solid-color-animal-pattern-fashion-casual-knitwear-g1161074.html,Men's Cardigan Solid Color Animal Pattern Fashion Casual Knitwear,Knitwear
6,$19.99,$33.99,https://www.jollychic.com/p/men-s-sweatshirt-brief-style-all-match-fashion-casual-pullover-g1161096.html,Men's Sweatshirt Brief Style All Match Fashion Casual Pullover,Knitwear
19,$20.99,$29.99,https://www.jollychic.com/p/men-s-sweater-loose-solid-color-all-match-fashion-casual-pullover-g1173090.html,Men's Sweater Loose Solid Color All Match Fashion Casual Pullover,Knitwear
21,$33.99,$55.00,https://www.jollychic.com/p/men-s-cardigan-solid-color-buttons-long-sleeve-comfy-coat-g1187866.html,Men's Cardigan Solid Color Buttons Long Sleeve Comfy Coat,Knitwear
26,$18.99,$28.99,https://www.jollychic.com/p/men-s-sweater-o-neck-long-sleeve-color-block-casual-comfy-pullover-g1202782.html,Men's Sweater O Neck Long Sleeve Color Block Casual Comfy Pullover,Knitwear
4,$31.99,$48.99,https://www.jollychic.com/p/men-s-sweater-turtle-neck-solid-color-long-sleeve-slim-comfy-pullover-g1203038.html,Men's Sweater Turtle Neck Solid Color Long Sleeve Slim Comfy Pullover,Knitwear
7,$18.99,$29.99,https://www.jollychic.com/p/men-s-sweater-o-neck-long-sleeve-stripe-pullover-g1205748.html,Men's Sweater O Neck Long Sleeve Stripe Pullover,Knitwear
35,$20.99,$31.99,https://www.jollychic.com/p/men-s-sweater-turtle-neck-solid-color-long-sleeve-comfy-pullover-g1214892.html,Men's Sweater Turtle Neck Solid Color Long Sleeve Comfy Pullover,Knitwear
14,$28.99,$43.99,https://www.jollychic.com/p/men-s-sweater-o-neck-color-block-long-sleeve-casual-comfy-pullover-g1230120.html,Men's Sweater O Neck Color Block Long Sleeve Casual Comfy Pullover,Knitwear
4,$39.99,,https://www.jollychic.com/p/men-s-sweater-casual-plaid-o-neck-long-sleeve-knitwear-g1234074.html,Men's Sweater Casual Plaid O Neck Long Sleeve Knitwear,Knitwear
12,$24.99,$39.99,https://www.jollychic.com/p/men-s-sweater-simple-style-patchwork-color-long-sleeve-knitwear-g1234080.html,Men's Sweater Simple Style Patchwork Color Long Sleeve Knitwear,Knitwear
10,$16.99,$25.99,https://www.jollychic.com/p/men-s-sweater-color-block-v-neck-fashion-casual-pullover-g1236626.html,Men's Sweater Color Block V Neck Fashion Casual Pullover,Knitwear
11,$17.99,$26.99,https://www.jollychic.com/p/men-s-cardigans-warm-all-match-chic-coat-g1258266.html,Men's Cardigans Warm All Match Chic Coat,Knitwear
16,$19.99,$33.99,https://www.jollychic.com/p/men-s-sweater-patchwork-color-stylish-long-sleeve-knitwear-g1276734.html,Men's Sweater Patchwork Color Stylish Long Sleeve Knitwear,Knitwear
103,$31.99,$47.99,https://www.jollychic.com/p/men-s-cardigan-all-match-color-blocking-cardigan-g1290294.html,Men's Cardigan All Match Color Blocking Cardigan,Knitwear
13,$22.99,$36.99,https://www.jollychic.com/p/men-s-cardigan-all-matched-solid-color-knitted-comfy-cardigan-g1291876.html,Men's Cardigan All Matched Solid Color Knitted Comfy Cardigan,Knitwear
