add_wish,discount_price,original_price,product_link,product_name,header_block
203,$21.99,$26.99,http://www.jollychic.com/p/men-s-polo-shirt-casual-patchwork-short-sleeve-button-comfy-polo-shirt-g589950.html,Men's Polo Shirt Casual Patchwork Short Sleeve Button Comfy Polo Shirt,Polo Shirts
694,$19.99,$26.99,http://www.jollychic.com/p/men-s-polo-shirt-casual-colorblock-turn-down-collar-button-polo-shirt-g590140.html,Men's Polo Shirt Casual Colorblock Turn Down Collar Button Polo Shirt,Polo Shirts
64,$7.99,$14.99,http://www.jollychic.com/p/men-s-polo-shirt-button-decoration-turn-down-collar-color-block-polo-shirt-g612272.html,Men's Polo Shirt Button Decoration Turn Down Collar Color Block Polo Shirt,Polo Shirts
63,$8.99,$14.99,http://www.jollychic.com/p/men-s-short-sleeve-t-shirt-male-lapel-pure-color-polo-unlined-upper-garment-g612286.html,Men's short sleeve T-shirt male lapel pure color POLO unlined upper garment,Polo Shirts
24,$8.99,$17.99,http://www.jollychic.com/p/men-s-polo-shirt-casual-turn-down-collar-classical-stripes-polo-shirt-g612340.html,Men's Polo Shirt Casual Turn Down Collar Classical Stripes Polo Shirt,Polo Shirts
85,$24.99,$37.99,http://www.jollychic.com/p/men-s-polo-shirt-brief-short-sleeve-all-match-breathable-polo-shirt-g619230.html,Men's Polo Shirt Brief Short Sleeve All Match Breathable Polo Shirt,Polo Shirts
27,$22.99,$37.99,http://www.jollychic.com/p/men-s-polo-shirt-stripe-short-sleeve-turn-down-collar-casual-polo-shirt-g619232.html,Men's Polo Shirt Stripe Short Sleeve Turn Down Collar Casual Polo Shirt,Polo Shirts
21,$22.99,$29.99,http://www.jollychic.com/p/men-s-polo-shirt-brief-all-match-short-sleeve-comfy-polo-shirt-g622028.html,Men's Polo Shirt Brief All Match Short Sleeve Comfy Polo Shirt,Polo Shirts
15,$17.99,,http://www.jollychic.com/p/men-s-polo-shirt-casual-print-button-decoration-polo-shirt-g651010.html,Men's Polo Shirt Casual Print Button Decoration Polo Shirt,Polo Shirts
106,$10.99,$16.99,http://www.jollychic.com/p/men-s-polo-shirt-flag-pattern-short-sleeve-turn-down-collar-top-g678586.html,Men's Polo Shirt Flag Pattern Short Sleeve Turn Down Collar Top,Polo Shirts
279,$11.99,$20.99,http://www.jollychic.com/p/men-s-polo-shirt-stylish-pattern-short-sleeve-turn-down-collar-polo-shirt-g683630.html,Men's Polo Shirt Stylish Pattern Short Sleeve Turn Down Collar Polo Shirt,Polo Shirts
96,$12.99,$18.99,http://www.jollychic.com/p/men-s-polo-shirt-turn-down-collar-solid-color-comfy-polo-shirt-g684604.html,Men's Polo Shirt Turn Down Collar Solid Color Comfy Polo Shirt,Polo Shirts
21,$16.99,$26.99,http://www.jollychic.com/p/men-s-polo-shirt-comforty-leisure-short-sleeve-polo-shirt-g684758.html,Men's Polo Shirt Comforty Leisure Short Sleeve Polo Shirt,Polo Shirts
367,$14.99,$19.99,http://www.jollychic.com/p/men-s-polo-shirt-short-sleeve-all-match-patchwork-color-polo-shirt-g686560.html,Men's Polo Shirt Short Sleeve All Match Patchwork Color Polo Shirt,Polo Shirts
9,$15.99,$23.99,http://www.jollychic.com/p/men-s-polo-shirt-turn-down-collar-short-sleeve-patch-polo-shirt-g692796.html,Men's Polo Shirt Turn Down Collar Short Sleeve Patch Polo Shirt,Polo Shirts
5,$26.99,,http://www.jollychic.com/p/men-s-polo-shirt-brief-striped-design-slim-casual-polo-shirt-g715032.html,Men's Polo Shirt Brief Striped Design Slim Casual Polo Shirt,Polo Shirts
2,$12.99,$20.99,http://www.jollychic.com/p/men-s-polo-shirt-all-match-colorblock-short-sleeves-stylish-polo-shirt-g716048.html,Men's Polo Shirt All Match Colorblock Short Sleeves Stylish Polo Shirt,Polo Shirts
11,$22.99,$37.99,http://www.jollychic.com/p/men-s-polo-shirt-short-sleeve-casual-striped-brief-design-polo-shirt-g717910.html,Men's Polo Shirt Short Sleeve Casual Striped Brief Design Polo Shirt,Polo Shirts
50,$13.99,$17.99,http://www.jollychic.com/p/men-s-polo-shirt-polka-dot-print-fashion-polo-shirt-g735198.html,Men's Polo Shirt Polka Dot Print Fashion Polo Shirt,Polo Shirts
66,$19.99,$29.99,http://www.jollychic.com/p/men-s-polo-shirt-color-block-striped-casual-short-sleeve-polo-shirt-g735280.html,Men's Polo Shirt Color Block Striped Casual Short Sleeve Polo Shirt,Polo Shirts
13,$14.99,$23.99,http://www.jollychic.com/p/men-s-polo-shirt-all-match-striped-polo-shirt-g736054.html,Men's Polo Shirt All Match Striped Polo Shirt,Polo Shirts
7,$24.99,$30.99,http://www.jollychic.com/p/men-s-polo-shirt-brief-style-color-block-short-sleeve-fashion-casual-polo-shirt-g761422.html,Men's Polo Shirt Brief Style Color Block Short Sleeve Fashion Casual Polo Shirt,Polo Shirts
69,$15.99,$23.99,http://www.jollychic.com/p/men-s-polo-shirt-one-piece-layer-look-striped-polo-shirt-g777004.html,Men's Polo Shirt One Piece Layer Look Striped Polo Shirt,Polo Shirts
6,$33.99,,http://www.jollychic.com/p/men-s-polo-shirt-fashion-design-solid-color-short-sleeve-polo-shirt-g801462.html,Men's Polo Shirt Fashion Design Solid Color Short Sleeve Polo Shirt,Polo Shirts
6,$20.99,$33.99,http://www.jollychic.com/p/men-s-sports-polo-shirt-outdoor-cozy-print-short-sleeve-pullover-g820514.html,Men's Sports Polo Shirt Outdoor Cozy Print Short Sleeve Pullover,Polo Shirts
19,$66.00,,http://www.jollychic.com/p/life-E2-80-A2after-life-by-yoho-men-s-t-shirt-patchwork-casual-polo-t-shirt-g831646.html,Life•After Life By YOHO Men's T Shirt Patchwork Casual Polo T Shirt,Polo Shirts
29,$12.99,$19.99,http://www.jollychic.com/p/men-s-polo-shirt-patchwork-stand-collar-short-sleeve-polo-shirt-g845282.html,Men's Polo Shirt Patchwork Stand Collar Short Sleeve Polo Shirt,Polo Shirts
3,$22.99,$36.99,http://www.jollychic.com/p/men-s-polo-shirt-solid-color-letter-patched-slim-top-g866564.html,Men's Polo Shirt Solid Color Letter Patched Slim Top,Polo Shirts
7,$23.99,$39.99,http://www.jollychic.com/p/men-s-polo-shirt-turn-down-collar-stripe-print-slim-top-g866586.html,Men's Polo Shirt Turn Down Collar Stripe Print Slim Top,Polo Shirts
12,$25.99,,http://www.jollychic.com/p/men-s-polo-shirt-color-block-stripe-print-slim-formal-top-g889664.html,Men's Polo Shirt Color Block Stripe Print Slim Formal Top,Polo Shirts
2,$16.99,$25.99,http://www.jollychic.com/p/men-s-polo-shirt-short-sleeve-colorblock-stripe-pattern-slim-top-g889932.html,Men's Polo Shirt Short Sleeve Colorblock Stripe Pattern Slim Top,Polo Shirts
2,$17.99,$27.99,http://www.jollychic.com/p/men-s-polo-shirt-casual-fashion-striped-comfy-polo-shirt-g892694.html,Men's Polo Shirt Casual Fashion Striped Comfy Polo Shirt,Polo Shirts
8,$32.99,,http://www.jollychic.com/p/men-s-polo-shirt-short-sleeve-leisure-striped-color-block-polo-shirt-g948074.html,Men's Polo Shirt Short Sleeve Leisure Striped Color Block Polo Shirt,Polo Shirts
11,$19.99,,http://www.jollychic.com/p/men-s-polo-shirt-short-sleeve-casual-solid-color-comfy-polo-shirt-g948090.html,Men's Polo Shirt Short Sleeve Casual Solid Color Comfy Polo Shirt,Polo Shirts
6,$17.99,$27.99,http://www.jollychic.com/p/men-s-polo-shirt-button-decoration-turn-down-collar-solid-color-polo-shirt-g956892.html,Men's Polo Shirt Button Decoration Turn Down Collar Solid Color Polo Shirt,Polo Shirts
5,$37.99,,http://www.jollychic.com/p/men-s-polo-shirt-striped-color-blocking-summer-t-shirt-g982870.html,Men's Polo Shirt Striped Color Blocking Summer T Shirt,Polo Shirts
3,$23.99,,http://www.jollychic.com/p/men-s-polo-shirt-short-sleeve-cotton-blends-casual-comfy-polo-shirt-g998686.html,Men's Polo Shirt Short Sleeve Cotton Blends Casual Comfy Polo Shirt,Polo Shirts
4,$29.99,,http://www.jollychic.com/p/men-s-polo-shirt-cotton-stand-collar-button-short-sleeve-polo-shirt-g1010052.html,Men's Polo Shirt Cotton Stand Collar Button Short Sleeve Polo Shirt,Polo Shirts
25,$11.99,$18.99,http://www.jollychic.com/p/men-s-polo-shirt-long-sleeve-leisure-zipper-design-polo-shirt-g1029544.html,Men's Polo Shirt Long Sleeve Leisure Zipper Design Polo Shirt,Polo Shirts
0,$26.99,,http://www.jollychic.com/p/men-s-polo-shirt-professional-sports-solid-color-quick-drying-polo-shirt-g1046380.html,Men's Polo Shirt Professional Sports Solid Color Quick Drying Polo Shirt,Polo Shirts
12,$21.99,,http://www.jollychic.com/p/men-s-polo-shirt-casual-short-sleeve-simple-comfy-polo-shirt-g1054314.html,Men's Polo Shirt Casual Short Sleeve Simple Comfy Polo Shirt,Polo Shirts
4,$31.99,,http://www.jollychic.com/p/men-s-polo-shirt-casual-comfy-striped-collar-chic-short-sleeve-polo-shirt-g1075602.html,Men's Polo Shirt Casual Comfy Striped Collar Chic Short Sleeve Polo Shirt,Polo Shirts
0,$24.99,,http://www.jollychic.com/p/men-s-t-shirt-slim-turn-down-collar-print-long-sleeves-fashion-shirt-g1082314.html,Men's T Shirt Slim Turn Down Collar Print Long Sleeves Fashion Shirt,Polo Shirts
0,$24.99,,http://www.jollychic.com/p/men-s-shirt-long-sleeves-polo-collar-print-slim-straight-men-s-shirt-g1117940.html,Men's Shirt Long Sleeves Polo Collar Print Slim Straight Men's Shirt,Polo Shirts
4,$27.99,,http://www.jollychic.com/p/men-s-polo-shirt-button-decoration-turn-down-collar-solid-color-polo-shirt-g1124574.html,Men's Polo Shirt Button Decoration Turn Down Collar Solid Color Polo Shirt,Polo Shirts
12,$28.99,,http://www.jollychic.com/p/men-s-polo-shirt-stand-collar-creative-design-fashion-causal-polo-shirt-g1167652.html,Men's Polo Shirt Stand Collar Creative Design Fashion Causal Polo Shirt,Polo Shirts
0,$29.99,,http://www.jollychic.com/p/men-s-polo-shirt-color-block-fashion-casual-polo-shirt-g1190604.html,Men's Polo Shirt Color Block Fashion Casual Polo Shirt,Polo Shirts
0,$29.99,,http://www.jollychic.com/p/men-s-polo-shirt-stripe-color-block-creative-design-casual-polo-shirt-g1190608.html,Men's Polo Shirt Stripe Color Block Creative Design Casual Polo Shirt,Polo Shirts
0,$25.99,,http://www.jollychic.com/p/men-s-polo-shirt-color-block-all-match-casual-polo-shirt-g1190610.html,Men's Polo Shirt Color Block All Match Casual Polo Shirt,Polo Shirts
0,$31.99,,http://www.jollychic.com/p/men-s-polo-shirt-solid-color-all-match-daily-brief-casual-polo-shirt-g1215400.html,Men's Polo Shirt Solid Color All Match Daily Brief Casual Polo Shirt,Polo Shirts
4,$29.99,,http://www.jollychic.com/p/men-s-polo-shirt-camouflage-comfy-fashion-polo-shirt-g1231920.html,Men's Polo Shirt Camouflage Comfy Fashion Polo Shirt,Polo Shirts
0,$32.99,,http://www.jollychic.com/p/men-s-polo-shirt-solid-color-turn-down-collar-casual-polo-shirt-g1241944.html,Men's Polo Shirt Solid Color Turn Down Collar Casual Polo Shirt,Polo Shirts
0,$36.99,,http://www.jollychic.com/p/men-s-polo-shirt-fashion-all-matched-long-sleeve-polo-shirt-g1281476.html,Men's Polo Shirt Fashion All Matched Long Sleeve Polo Shirt,Polo Shirts
0,$39.99,$41.99,http://www.jollychic.com/p/septwolves-men-s-casual-polo-shirt-stylish-floral-printed-top-g1306972.html,Septwolves Men's Casual Polo Shirt Stylish Floral Printed Top,Polo Shirts
14,$22.99,$35.99,http://www.jollychic.com/p/men-s-polo-shirt-turn-down-collar-color-block-plaid-print-slim-top-g866692.html,Men's Polo Shirt Turn Down Collar Color Block Plaid Print Slim Top,Polo Shirts
1485,$13.99,$22.99,http://www.jollychic.com/p/cool-top-fashion-elegant-print-men-s-polo-shirt-g335182.html,Cool Top Fashion Elegant Print Men's Polo Shirt,Polo Shirts
76,$12.99,$34.99,http://www.jollychic.com/p/men-s-casual-polo-shirt-with-contrast-detail-g335194.html,Men's Casual Polo Shirt With Contrast Detail,Polo Shirts
169,$8.99,$16.99,http://www.jollychic.com/p/plus-size-colorblock-short-sleeve-men-s-polo-shirt-g349154.html,Plus Size Colorblock Short Sleeve Men's Polo Shirt,Polo Shirts
171,$8.99,$17.99,http://www.jollychic.com/p/front-pocket-soft-regular-polo-shirt-for-men-g351576.html,Front Pocket Soft Regular Polo Shirt For Men,Polo Shirts
698,$8.99,$19.99,http://www.jollychic.com/p/new-lapel-cotton-short-sleeve-casual-men-s-polo-shirt-g372022.html,New Lapel Cotton Short Sleeve Casual Men's Polo Shirt,Polo Shirts
26,$15.99,$23.99,http://www.jollychic.com/p/men-s-polo-shirt-turn-down-collar-color-block-short-sleeve-polo-shirt-g508730.html,Men's Polo Shirt Turn Down Collar Color Block Short Sleeve Polo Shirt,Polo Shirts
41,$15.99,$23.99,http://www.jollychic.com/p/men-s-polo-shirt-casual-short-sleeve-cozy-color-block-polo-shirt-size-is-a-little-bigger--g510828.html,Men's Polo Shirt Casual Short Sleeve Cozy Color Block Polo Shirt (Size Is A Little Bigger),Polo Shirts
18,$19.99,$27.99,http://www.jollychic.com/p/men-s-polo-shirt-turn-down-collar-letter-patter-cozy-polo-shirt-g550050.html,Men's Polo Shirt Turn Down Collar Letter Patter Cozy Polo Shirt,Polo Shirts
8,$11.99,$26.99,http://www.jollychic.com/p/men-s-polo-shirt-cotton-blends-short-sleeve-breathable-comfy-polo-shirt-g582650.html,Men's Polo Shirt Cotton Blends Short Sleeve Breathable Comfy Polo Shirt,Polo Shirts
5,$18.99,$26.99,http://www.jollychic.com/p/men-s-polo-shirt-comforty-cotton-blends-short-sleeve-polo-shirt-g582940.html,Men's Polo Shirt Comforty Cotton Blends Short Sleeve Polo Shirt,Polo Shirts
36,$11.99,$33.99,http://www.jollychic.com/p/men-s-polo-shirt-turn-down-collar-stripe-color-block-short-sleeve-polo-shirt-g587516.html,Men's Polo Shirt Turn Down Collar Stripe Color Block Short Sleeve Polo Shirt,Polo Shirts
8,$17.99,,http://www.jollychic.com/p/men-s-polo-shirt-casual-patchwork-short-sleeve-button-cozy-polo-shirt-g597160.html,Men's Polo Shirt Casual Patchwork Short Sleeve Button Cozy Polo Shirt,Polo Shirts
22,$17.99,,http://www.jollychic.com/p/men-s-polo-shirt-patchwork-brief-short-sleeve-casual-comfy-polo-shirt-g610282.html,Men's Polo Shirt Patchwork Brief Short Sleeve Casual Comfy Polo Shirt,Polo Shirts
22,$55.00,,http://www.jollychic.com/p/men-s-polo-shirt-color-block-turn-down-collar-short-sleeve-cozy-polo-shirt-g614434.html,Men's Polo Shirt Color Block Turn Down Collar Short Sleeve Cozy Polo Shirt,Polo Shirts
74,$11.99,$31.99,http://www.jollychic.com/p/men-s-polo-shirt-solid-color-cotton-blends-slim-handsome-polo-shirt-g621106.html,Men's Polo Shirt Solid Color Cotton Blends Slim Handsome Polo Shirt,Polo Shirts
25,$17.99,$29.99,http://www.jollychic.com/p/men-s-polo-shirt-button-decoration-stand-collar-solid-color-soft-polo-shirt-g623264.html,Men's Polo Shirt Button Decoration Stand Collar Solid Color Soft Polo Shirt,Polo Shirts
76,$24.99,$31.99,http://www.jollychic.com/p/men-s-polo-shirt-animal-pattern-zipper-design-stand-collar-polo-shirt-g623448.html,Men's Polo Shirt Animal Pattern Zipper Design Stand Collar Polo Shirt,Polo Shirts
11,$45.99,$47.99,http://www.jollychic.com/p/septwolves-men-s-polo-shirt-casual-patchwork-short-sleeve-polo-shirt-g642898.html,SEPTWOLVES Men's Polo Shirt Casual Patchwork Short Sleeve Polo Shirt,Polo Shirts
86,$11.99,$17.99,http://www.jollychic.com/p/men-s-polo-shirt-short-sleeve-patch-vogue-stylish-polo-shirt-g663332.html,Men's Polo Shirt Short Sleeve Patch Vogue Stylish Polo Shirt,Polo Shirts
9,$13.99,$22.99,http://www.jollychic.com/p/men-s-polo-shirt-fashion-letter-short-sleeve-turn-down-collar-polo-shirt-g665834.html,Men's Polo Shirt Fashion Letter Short Sleeve Turn Down Collar Polo Shirt,Polo Shirts
7,$14.99,$23.99,http://www.jollychic.com/p/men-s-polo-shirt-cotton-blends-patchwork-brief-all-match-polo-shirt-g668000.html,Men's Polo Shirt Cotton Blends Patchwork Brief All Match Polo Shirt,Polo Shirts
11,$14.99,,http://www.jollychic.com/p/men-s-polo-shirt-solid-color-cotton-blends-polo-shirt-g676724.html,Men's Polo Shirt Solid Color Cotton Blends Polo Shirt,Polo Shirts
30,$15.99,$25.99,http://www.jollychic.com/p/men-s-polo-shirt-short-sleeve-brief-stripe-short-sleeve-casual-polo-shirt-g681576.html,Men's Polo Shirt Short Sleeve Brief Stripe Short Sleeve Casual Polo Shirt,Polo Shirts
21,$12.99,$34.99,http://www.jollychic.com/p/men-s-polo-shirt-striped-short-sleeve-stylish-cozy-polo-shirt-g681954.html,Men's Polo Shirt Striped Short Sleeve Stylish Cozy Polo Shirt,Polo Shirts
51,$12.99,$20.99,http://www.jollychic.com/p/men-s-polo-shirt-fashion-colorblock-short-sleeve-polo-shirt-g683700.html,Men's Polo Shirt Fashion Colorblock Short Sleeve Polo Shirt,Polo Shirts
18,$20.99,,http://www.jollychic.com/p/men-s-polo-shirt-casual-colorblock-striped-short-sleeve-polo-shirt-g683950.html,Men's Polo Shirt Casual Colorblock Striped Short Sleeve Polo Shirt,Polo Shirts
12,$16.99,,http://www.jollychic.com/p/men-s-polo-shirt-casual-striped-patchwork-color-comfy-polo-shirt-g711924.html,Men's Polo Shirt Casual Striped Patchwork Color Comfy Polo Shirt,Polo Shirts
54,$13.99,$16.99,http://www.jollychic.com/p/men-s-polo-shirt-short-sleeve-casual-patchwork-color-polo-shirt-g712336.html,Men's Polo Shirt Short Sleeve Casual Patchwork Color Polo Shirt,Polo Shirts
15,$12.99,$20.99,http://www.jollychic.com/p/men-s-polo-shirt-zipper-solid-color-short-sleeve-casual-polo-shirt-g713994.html,Men's Polo Shirt Zipper Solid Color Short Sleeve Casual Polo Shirt,Polo Shirts
19,$13.99,$20.99,http://www.jollychic.com/p/men-s-polo-shirt-all-match-striped-print-polo-shirt-g725678.html,Men's Polo Shirt All Match Striped Print Polo Shirt,Polo Shirts
16,$17.99,,http://www.jollychic.com/p/men-s-polo-shirt-all-match-print-striped-polo-shirt-g734702.html,Men's Polo Shirt All Match Print Striped Polo Shirt,Polo Shirts
25,$17.99,,http://www.jollychic.com/p/men-s-polo-shirt-short-sleeve-plaid-fashion-casual-polo-shirt-g735166.html,Men's Polo Shirt Short Sleeve Plaid Fashion Casual Polo Shirt,Polo Shirts
244,$16.99,$28.99,http://www.jollychic.com/p/men-s-polo-shirt-all-match-solid-color-polo-shirt-g735608.html,Men's Polo Shirt All Match Solid Color Polo Shirt,Polo Shirts
69,$14.99,$23.99,http://www.jollychic.com/p/men-s-polo-shirt-all-match-solid-color-polo-shirt-g735954.html,Men's Polo Shirt All Match Solid Color Polo Shirt,Polo Shirts
28,$17.99,$28.99,http://www.jollychic.com/p/men-s-polo-shirt-button-decoration-turn-down-collar-color-block-polo-shirt-g740588.html,Men's Polo Shirt Button Decoration Turn Down Collar Color Block Polo Shirt,Polo Shirts
4,$19.99,$32.99,http://www.jollychic.com/p/men-s-polo-shirt-striped-breathable-casual-short-sleeve-polo-shirt-g754818.html,Men's Polo Shirt Striped Breathable Casual Short Sleeve Polo Shirt,Polo Shirts
14,$15.99,$25.99,http://www.jollychic.com/p/men-s-polo-shirt-stripe-short-sleeve-all-match-polo-shirt-g756922.html,Men's Polo Shirt Stripe Short Sleeve All Match Polo Shirt,Polo Shirts
117,$12.99,$19.99,http://www.jollychic.com/p/men-s-polo-shirt-all-match-short-sleeve-slim-comfy-polo-shirt-g763348.html,Men's Polo Shirt All Match Short Sleeve Slim Comfy Polo Shirt,Polo Shirts
634,$6.99,$14.99,http://www.jollychic.com/p/men-s-polo-shirt-patchwork-stand-collar-short-sleeve-slim-top-g766262.html,Men's Polo Shirt Patchwork Stand Collar Short Sleeve Slim Top,Polo Shirts
87,$14.99,$23.99,http://www.jollychic.com/p/men-s-polo-shirt-solid-color-all-match-polo-shirt-g773570.html,Men's Polo Shirt Solid Color All Match Polo Shirt,Polo Shirts
23,$16.99,$30.99,http://www.jollychic.com/p/men-s-polo-shirt-short-sleeve-color-block-breathable-polo-shirt-g780946.html,Men's Polo Shirt Short Sleeve Color Block Breathable Polo Shirt,Polo Shirts
94,$23.99,$32.99,http://www.jollychic.com/p/men-s-polo-shirt-cozy-print-stand-collar-button-polo-shirt-g782916.html,Men's Polo Shirt Cozy Print Stand Collar Button Polo Shirt,Polo Shirts
14,$14.99,$22.99,http://www.jollychic.com/p/jesun-s-men-s-polo-shirt-polyester-stripe-short-sleeve-turn-down-collar-cozy-polo-shirt-g849462.html,JESUN'S Men's Polo Shirt Polyester Stripe Short Sleeve Turn Down Collar Cozy Polo Shirt,Polo Shirts
3,$32.99,,http://www.jollychic.com/p/men-s-polo-shirt-button-decoration-turn-down-collar-striped-soft-polo-shirt-g855594.html,Men's Polo Shirt Button Decoration Turn Down Collar Striped Soft Polo Shirt,Polo Shirts
3,$22.99,$30.99,http://www.jollychic.com/p/men-s-polo-shirt-cotton-blends-solid-color-short-sleeve-comfy-polo-shirt-g862986.html,Men's Polo Shirt Cotton Blends Solid Color Short Sleeve Comfy Polo Shirt,Polo Shirts
5,$23.99,$36.99,http://www.jollychic.com/p/men-s-polo-shirt-camouflage-print-turn-down-collar-slim-top-g866792.html,Men's Polo Shirt Camouflage Print Turn Down Collar Slim Top,Polo Shirts
7,$22.99,$35.99,http://www.jollychic.com/p/men-s-polo-shirt-cotton-blends-striped-short-sleeve-polo-shirt-g869098.html,Men's Polo Shirt Cotton Blends Striped Short Sleeve Polo Shirt,Polo Shirts
11,$10.99,$17.99,http://www.jollychic.com/p/men-s-polo-shirt-button-decoration-turn-down-collar-solid-color-polo-shirt-g874268.html,Men's Polo Shirt Button Decoration Turn Down Collar Solid Color Polo Shirt,Polo Shirts
8,$18.99,$25.99,http://www.jollychic.com/p/men-s-polo-shirt-turn-down-collar-floral-print-slim-top-g889504.html,Men's Polo Shirt Turn Down Collar Floral Print Slim Top,Polo Shirts
10,$25.99,,http://www.jollychic.com/p/men-s-formal-polo-shirt-short-sleeve-colorblock-stripe-pattern-top-g889786.html,Men's Formal Polo Shirt Short Sleeve Colorblock Stripe Pattern Top,Polo Shirts
3,$27.99,,http://www.jollychic.com/p/men-s-formal-polo-shirt-stripe-pattern-stylish-top-g889908.html,Men's Formal Polo Shirt Stripe Pattern Stylish Top,Polo Shirts
115,$15.99,$23.99,http://www.jollychic.com/p/men-s-polo-shirt-cozy-print-turn-down-collar-button-polo-shirt-g913502.html,Men's Polo Shirt Cozy Print Turn Down Collar Button Polo Shirt,Polo Shirts
41,$13.99,$21.99,http://www.jollychic.com/p/men-s-polo-shirt-striped-pattern-printing-casual-summer-t-shirt-g928096.html,Men's Polo Shirt Striped Pattern Printing Casual Summer T Shirt,Polo Shirts
34,$27.99,$33.99,http://www.jollychic.com/p/men-s-polo-shirt-short-sleeve-solid-color-leisure-stand-collar-polo-shirt-g962088.html,Men's Polo Shirt Short Sleeve Solid Color Leisure Stand Collar Polo Shirt,Polo Shirts
2,$17.99,,http://www.jollychic.com/p/zhuowolves-men-s-polo-shirts-patchwork-stitching-short-sleeve-polo-shirt-g989494.html,Zhuowolves Men's Polo Shirts Patchwork Stitching Short Sleeve Polo Shirt,Polo Shirts
2,$26.99,,http://www.jollychic.com/p/men-s-polo-shirt-striped-color-block-breathable-short-sleeve-polo-shirt-g990204.html,Men's Polo Shirt Striped Color Block Breathable Short Sleeve Polo Shirt,Polo Shirts
6,$24.99,,http://www.jollychic.com/p/men-s-shirt-stand-collar-slim-floral-pattern-fashion-casual-polo-shirt-g991892.html,Men's Shirt Stand Collar Slim Floral Pattern Fashion Casual Polo Shirt,Polo Shirts
19,$22.99,,http://www.jollychic.com/p/men-s-polo-shirt-solid-color-stand-collar-long-sleeve-comfy-polo-shirt-g998250.html,Men's Polo Shirt Solid Color Stand Collar Long Sleeve Comfy Polo Shirt,Polo Shirts
47,$11.99,$17.99,http://www.jollychic.com/p/men-s-polo-shirt-striped-slim-color-block-casual-polo-shirt-g1029516.html,Men's Polo Shirt Striped Slim Color Block Casual Polo Shirt,Polo Shirts
3,$24.99,,http://www.jollychic.com/p/men-s-polo-shirt-floral-collar-solid-color-fashion-casual-polo-shirt-g1050408.html,Men's Polo Shirt Floral Collar Solid Color Fashion Casual Polo Shirt,Polo Shirts
8,$21.99,,http://www.jollychic.com/p/men-s-polo-shirt-short-sleeve-comforty-all-match-polo-shirt-g1054312.html,Men's Polo Shirt Short Sleeve Comforty All Match Polo Shirt,Polo Shirts
14,$26.99,,http://www.jollychic.com/p/men-s-polo-shirt-all-match-business-style-slim-casual-polo-shirt-g1064520.html,Men's Polo Shirt All Match Business Style Slim Casual Polo Shirt,Polo Shirts
4,$15.99,$23.99,http://www.jollychic.com/p/men-s-polo-shirt-cotton-blends-short-sleeve-casual-polo-shirt-g1108806.html,Men's Polo Shirt Cotton Blends Short Sleeve Casual Polo Shirt,Polo Shirts
0,$17.99,$27.99,http://www.jollychic.com/p/men-s-polo-shirt-button-decoration-turn-down-collar-solid-color-polo-shirt-g1116150.html,Men's Polo Shirt Button Decoration Turn Down Collar Solid Color Polo Shirt,Polo Shirts
5,$23.99,,http://www.jollychic.com/p/men-s-polo-shirt-short-sleeve-classical-striped-pattern-stylish-t-shirt-g1119404.html,Men's Polo Shirt Short Sleeve Classical Striped Pattern Stylish T Shirt,Polo Shirts
2,$23.99,,http://www.jollychic.com/p/men-s-polo-shirt-short-sleeve-classical-striped-pattern-casual-t-shirt-g1119412.html,Men's Polo Shirt Short Sleeve Classical Striped Pattern Casual T Shirt,Polo Shirts
2,$28.99,,http://www.jollychic.com/p/men-s-polo-shirt-cozy-embroidery-long-sleeve-cotton-blends-casual-pullover-g1124554.html,Men's Polo Shirt Cozy Embroidery Long Sleeve Cotton Blends Casual Pullover,Polo Shirts
2,$17.99,,http://www.jollychic.com/p/men-s-polo-shirt-solid-color-stripe-brief-style-casual-polo-shirt-g1124842.html,Men's Polo Shirt Solid Color Stripe Brief Style Casual Polo Shirt,Polo Shirts
17,$12.99,$17.99,http://www.jollychic.com/p/men-s-polo-shirt-long-sleeve-retro-solid-color-casual-shirt-g1153828.html,Men's Polo Shirt Long Sleeve Retro Solid Color Casual Shirt,Polo Shirts
7,$19.99,,http://www.jollychic.com/p/men-s-polo-shirt-solid-color-long-sleeve-casual-stand-collar-polo-shirt-g1162238.html,Men's Polo Shirt Solid Color Long Sleeve Casual Stand Collar Polo Shirt,Polo Shirts
1,$42.99,,http://www.jollychic.com/p/men-s-polo-shirt-plus-size-button-decoration-striped-turn-down-collar-polo-shirt-g1221078.html,Men's Polo Shirt Plus Size Button Decoration Striped Turn Down Collar Polo Shirt,Polo Shirts
0,$42.99,,http://www.jollychic.com/p/men-s-polo-shirt-button-decoration-turn-down-collar-striped-polo-shirt-g1221080.html,Men's Polo Shirt Button Decoration Turn Down Collar Striped Polo Shirt,Polo Shirts
0,$42.99,,http://www.jollychic.com/p/men-s-polo-shirt-plus-size-striped-turn-down-collar-casual-polo-shirt-g1221084.html,Men's Polo Shirt Plus Size Striped Turn Down Collar Casual Polo Shirt,Polo Shirts
1,$35.99,,http://www.jollychic.com/p/men-s-polo-shirt-striped-fashion-lapel-polo-shirt-g1289062.html,Men's Polo Shirt Striped Fashion Lapel Polo Shirt,Polo Shirts
105,$10.99,$20.99,http://www.jollychic.com/p/men-s-polo-shirt-turn-down-collar-slim-short-sleeve-polo-shirt-g657878.html,Men's Polo Shirt Turn Down Collar Slim Short Sleeve Polo Shirt,Polo Shirts
2269,$10.99,$20.99,http://www.jollychic.com/p/top-fashion-stand-collar-print-design-long-sleeve-men-s-polo-shirt-g377944.html,Top Fashion Stand Collar Print Design Long Sleeve Men's Polo Shirt,Polo Shirts
