add_wish,discount_price,original_price,product_link,product_name,header_block
688,$60.00,,https://www.jollychic.com/p/deep-blue-letter-sweater-for-men-g328132.html,Deep Blue Letter Sweater For Men,Knitwear
162,$61.00,,https://www.jollychic.com/p/pure-color-o-neck-sweater-for-men-g328174.html,Pure Color O Neck Sweater For Men,Knitwear
181,$16.99,$57.00,https://www.jollychic.com/p/long-sleeve-warm-basic-sweater-for-men-g328200.html,Long Sleeve Warm Basic Sweater For Men,Knitwear
111,$27.99,$78.00,https://www.jollychic.com/p/casual-camouflage-men-s-sweater-g377154.html,Casual Camouflage Men's Sweater,Knitwear
60,$21.99,$78.00,https://www.jollychic.com/p/colorblock-detail-long-sleeve-sweater-for-men-g377176.html,Colorblock Detail Long Sleeve Sweater For Men,Knitwear
317,$16.99,$42.99,https://www.jollychic.com/p/thicken-warm-front-zipper-stand-collar-cardigan-g392230.html,Thicken Warm Front Zipper Stand Collar Cardigan,Knitwear
139,$35.99,$67.00,https://www.jollychic.com/p/casual-style-men-s-sweater-long-sleeve-o-neck-solid-pullover-g393586.html,Casual Style Men's Sweater Long Sleeve O Neck Solid Pullover,Knitwear
569,$27.99,$54.00,https://www.jollychic.com/p/men-s-knitwear-slim-pattern-cozy-casual-fashion-long-sleeve-sweater-g394930.html,Men's Knitwear Slim Pattern Cozy Casual Fashion Long Sleeve Sweater,Knitwear
8232,$11.99,$23.99,https://www.jollychic.com/p/men-E2-80-99s-sweater-o-neck-color-block-long-sleeve-casual-knitwear-g413230.html,Men’s Sweater O Neck Color Block Long Sleeve Casual Knitwear,Knitwear
2407,$11.99,$17.99,https://www.jollychic.com/p/men-s-pullover-o-neck-soft-warm-jacquard-fashion-sweater-g419938.html,Men's Pullover O Neck Soft Warm Jacquard Fashion Sweater,Knitwear
317,$16.99,$28.99,https://www.jollychic.com/p/men-s-knitwear-jacquard-o-neck-fashion-casual-pullover-g426400.html,Men's Knitwear Jacquard O Neck Fashion Casual Pullover,Knitwear
1509,$16.99,$32.99,https://www.jollychic.com/p/men-s-cardigan-fashion-solid-color-long-sleeve-casual-warm-chic-knitwear-g456388.html,Men's Cardigan Fashion Solid Color Long Sleeve Casual Warm Chic Knitwear,Knitwear
758,$18.99,$32.99,https://www.jollychic.com/p/men-s-cardigan-fashion-patchwork-long-sleeve-casual-warm-knitwear-g456394.html,Men's Cardigan Fashion Patchwork Long Sleeve Casual Warm Knitwear,Knitwear
322,$15.99,$32.99,https://www.jollychic.com/p/men-s-cardigan-cozy-breathable-fashion-single-breasted-solid-knitwear-g456686.html,Men's Cardigan Cozy Breathable Fashion Single Breasted Solid Knitwear,Knitwear
43,$39.99,$56.00,https://www.jollychic.com/p/men-s-pullover-solid-button-decorated-fashion-high-quality-knitwear-g457444.html,Men's Pullover Solid Button Decorated Fashion High Quality Knitwear,Knitwear
5800,$10.99,$23.99,https://www.jollychic.com/p/men-s-cardigan-sweater-fashion-style-solid-color-knitwear-the-size-is-a-little-smaller--g459650.html,Men's Cardigan Sweater Fashion Style Solid Color Knitwear(The Size Is A Little Smaller),Knitwear
299,$17.99,$21.99,https://www.jollychic.com/p/men-s-pullover-turtle-neck-slim-solid-color-warm-botton-design-casual-knitwear-g463648.html,Men's Pullover Turtle Neck Slim Solid Color Warm Botton Design Casual Knitwear,Knitwear
98,$10.99,$32.99,https://www.jollychic.com/p/men-s-sweater-o-neck-wavy-pattern-colorblock-casual-knitwear-g465392.html,Men's Sweater O Neck Wavy Pattern Colorblock Casual Knitwear,Knitwear
2433,$14.99,$31.99,https://www.jollychic.com/p/men-s-pullover-sweater-casual-colorblock-long-sleeve-knitwear-g473142.html,Men's Pullover Sweater Casual Colorblock Long Sleeve Knitwear,Knitwear
1506,$21.99,$35.99,https://www.jollychic.com/p/men-s-cardigan-fashion-patchwork-color-comfortable-casual-knitwear-g499826.html,Men's Cardigan Fashion Patchwork Color Comfortable Casual Knitwear,Knitwear
646,$20.99,,https://www.jollychic.com/p/men-s-sweater-turtle-neck-slim-solid-long-sleeves-warm-thick-pullovers-g558644.html,Men's Sweater Turtle Neck Slim Solid Long Sleeves Warm Thick Pullovers,Knitwear
335,$10.99,$16.99,https://www.jollychic.com/p/men-s-knitwear-cotton-blends-o-neck-long-sleeve-stripe-vogue-pullover-g559298.html,Men's Knitwear Cotton Blends O Neck Long Sleeve Stripe Vogue Pullover,Knitwear
56,$13.99,$21.99,https://www.jollychic.com/p/men-s-knitwear-v-neck-long-sleeve-stylish-comfy-pullover-g589616.html,Men's Knitwear V Neck Long Sleeve Stylish Comfy Pullover,Knitwear
91,$16.99,$29.99,https://www.jollychic.com/p/men-s-knitwear-open-front-color-block-long-sleeve-knitwear-g903262.html,Men's Knitwear Open Front Color Block Long Sleeve Knitwear,Knitwear
414,$29.99,,https://www.jollychic.com/p/men-s-knitwear-open-front-solid-color-long-sleeve-knitwear-g903822.html,Men's Knitwear Open Front Solid Color Long Sleeve Knitwear,Knitwear
271,$17.99,$26.99,https://www.jollychic.com/p/men-s-knitwear-single-breasted-solid-color-long-sleeve-knitwear-g903826.html,Men's Knitwear Single Breasted Solid Color Long Sleeve Knitwear,Knitwear
24,$22.99,$34.99,https://www.jollychic.com/p/men-s-sweater-crew-neck-solid-color-preppy-slim-casual-pullover-g957576.html,Men's Sweater Crew Neck Solid Color Preppy Slim Casual Pullover,Knitwear
16,$24.99,$37.99,https://www.jollychic.com/p/men-s-knitwear-thicken-slim-v-neck-fashion-warm-casual-cardigans-g957786.html,Men's Knitwear Thicken Slim V Neck Fashion Warm Casual Cardigans,Knitwear
33,$48.99,$76.00,https://www.jollychic.com/p/men-s-knitwear-solid-color-o-neck-long-sleeve-basic-wool-sweater-g988662.html,Men's Knitwear Solid Color O Neck Long Sleeve Basic Wool Sweater,Knitwear
26,$54.00,$83.00,https://www.jollychic.com/p/men-s-knitwear-patched-colorblock-zipper-turtle-neck-sweater-g988826.html,Men's Knitwear Patched Colorblock Zipper Turtle Neck Sweater,Knitwear
44,$51.00,$78.00,https://www.jollychic.com/p/men-s-pullover-solid-color-patched-o-neck-long-sleeve-sweater-g991882.html,Men's Pullover Solid Color Patched O Neck Long Sleeve Sweater,Knitwear
43,$17.99,$30.99,https://www.jollychic.com/p/men-s-knitwear-o-neck-color-block-long-sleeve-pullover-g992194.html,Men's Knitwear O Neck Color Block Long Sleeve Pullover,Knitwear
133,$20.99,$32.99,https://www.jollychic.com/p/men-s-cardigan-casual-warm-comfy-chic-solid-color-knitted-cardigan-g994240.html,Men's Cardigan Casual Warm Comfy Chic Solid Color Knitted Cardigan,Knitwear
793,$13.99,$22.99,https://www.jollychic.com/p/men-s-sweater-v-neck-long-sleeve-color-block-casual-pullover-g998708.html,Men's Sweater V Neck Long Sleeve Color Block Casual Pullover,Knitwear
382,$7.99,$12.99,https://www.jollychic.com/p/men-s-cardigan-chic-solid-color-buttons-comfy-all-match-long-sleeve-cardigan-g999980.html,Men's Cardigan Chic Solid Color Buttons Comfy All Match Long Sleeve Cardigan,Knitwear
29,$7.99,$12.99,https://www.jollychic.com/p/men-s-sweater-casual-color-block-chic-comfy-striped-all-matched-pullover-g1000080.html,Men's Sweater Casual Color Block Chic Comfy Striped All Matched Pullover,Knitwear
59,$21.99,$33.99,https://www.jollychic.com/p/men-s-knitwear-turtle-neck-solid-color-long-sleeve-comfy-pullover-g1008960.html,Men's Knitwear Turtle Neck Solid Color Long Sleeve Comfy Pullover,Knitwear
67,$23.99,$38.99,https://www.jollychic.com/p/men-s-cardigan-solid-color-zipper-long-sleeve-comfy-coat-g1023160.html,Men's Cardigan Solid Color Zipper Long Sleeve Comfy Coat,Knitwear
39,$39.99,$62.00,https://www.jollychic.com/p/men-s-knitwear-cardigan-sweater-fashion-warm-casual-coat-g1032878.html,Men's Knitwear Cardigan Sweater Fashion Warm Casual Coat,Knitwear
79,$13.99,$23.99,https://www.jollychic.com/p/men-s-sweater-v-neck-long-sleeve-color-block-comfy-all-match-pullover-g1050942.html,Men's Sweater V Neck Long Sleeve Color Block Comfy All Match Pullover,Knitwear
51,$21.99,$33.99,https://www.jollychic.com/p/men-s-cardigan-solid-color-zipper-long-sleeve-comfy-coat-g1053734.html,Men's Cardigan Solid Color Zipper Long Sleeve Comfy Coat,Knitwear
22,$14.99,$22.99,https://www.jollychic.com/p/men-s-pullover-fashion-o-neck-patchwork-color-casual-knitwear-g1065396.html,Men's Pullover Fashion O Neck Patchwork Color Casual Knitwear,Knitwear
54,$14.99,$24.99,https://www.jollychic.com/p/men-s-pullover-fashion-comfy-chic-knitting-solid-color-sweater-g1072256.html,Men's Pullover Fashion Comfy Chic Knitting Solid Color Sweater,Knitwear
20,$20.99,$31.99,https://www.jollychic.com/p/men-s-cardigan-color-blocking-all-match-knitwear-g1081128.html,Men's Cardigan Color Blocking All Match Knitwear,Knitwear
7,$24.99,$44.99,https://www.jollychic.com/p/men-s-sweater-o-neck-long-sleeve-solid-color-comfy-all-match-pullover-g1081216.html,Men's Sweater O Neck Long Sleeve Solid Color Comfy All Match Pullover,Knitwear
17,$13.99,$42.99,https://www.jollychic.com/p/men-s-cardigan-solid-color-front-open-long-sleeve-comfy-coat-g1081218.html,Men's Cardigan Solid Color Front Open Long Sleeve Comfy Coat,Knitwear
24,$17.99,$28.99,https://www.jollychic.com/p/men-s-sweatshirt-color-blocking-chic-hoodie-all-match-sweatshirt-g1081278.html,Men's Sweatshirt Color Blocking Chic Hoodie All Match Sweatshirt,Knitwear
85,$19.99,$33.99,https://www.jollychic.com/p/men-s-cardigan-long-sleeve-casual-personality-comfy-knitwear-g1087868.html,Men's Cardigan Long Sleeve Casual Personality Comfy Knitwear,Knitwear
20,$11.99,$21.99,https://www.jollychic.com/p/men-s-sweater-striped-one-piece-layer-look-fashion-comfy-sweater-g1101950.html,Men's Sweater Striped One Piece Layer Look Fashion Comfy Sweater,Knitwear
26,$30.99,,https://www.jollychic.com/p/men-s-pullover-fashion-gradient-color-comfy-knitted-o-neck-sweater-g1108104.html,Men's Pullover Fashion Gradient Color Comfy Knitted O Neck Sweater,Knitwear
323,$14.99,$21.99,https://www.jollychic.com/p/men-s-cardigan-fashion-solid-color-all-match-comfy-cardigan-g1123200.html,Men's Cardigan Fashion Solid Color All Match Comfy Cardigan,Knitwear
64,$19.99,$33.99,https://www.jollychic.com/p/men-s-cardigan-casual-solid-color-comfy-all-matched-cardigan-g1125876.html,Men's Cardigan Casual Solid Color Comfy All Matched Cardigan,Knitwear
15,$15.99,$25.99,https://www.jollychic.com/p/men-s-sweater-o-neck-long-sleeve-solid-color-casual-comfy-slim-pullover-g1126666.html,Men's Sweater O Neck Long Sleeve Solid Color Casual Comfy Slim Pullover,Knitwear
1073,$27.99,$37.99,https://www.jollychic.com/p/men-s-cardigan-solid-color-zipper-long-sleeve-comfy-hooded-coat-g1132664.html,Men's Cardigan Solid Color Zipper Long Sleeve Comfy Hooded Coat,Knitwear
21,$18.99,$29.99,https://www.jollychic.com/p/men-s-sweater-o-neck-long-sleeve-solid-color-comfy-all-match-pullover-g1133132.html,Men's Sweater O Neck Long Sleeve Solid Color Comfy All Match Pullover,Knitwear
164,$41.99,$65.00,https://www.jollychic.com/p/men-s-cardigan-solid-color-long-sleeve-comfy-warm-hooded-coat-g1136084.html,Men's Cardigan Solid Color Long Sleeve Comfy Warm Hooded Coat,Knitwear
17,$15.99,$27.99,https://www.jollychic.com/p/men-s-sweater-cozy-print-patchwork-long-sleeve-casual-pullover-g1148556.html,Men's Sweater Cozy Print Patchwork Long Sleeve Casual Pullover,Knitwear
63,$14.99,$24.99,https://www.jollychic.com/p/men-s-cardigan-buttons-long-sleeve-loose-v-neck-solid-color-outwear-g1148812.html,Men's Cardigan Buttons Long Sleeve Loose V Neck Solid Color Outwear,Knitwear
123,$16.99,$26.99,https://www.jollychic.com/p/men-s-cardigan-breathable-buttons-color-block-comfy-cardigan-g1152352.html,Men's Cardigan Breathable Buttons Color Block Comfy Cardigan,Knitwear
108,$11.99,$18.99,https://www.jollychic.com/p/men-s-sweater-o-neck-long-sleeve-solid-color-comfy-all-match-pullover-g1155884.html,Men's Sweater O Neck Long Sleeve Solid Color Comfy All Match Pullover,Knitwear
14,$30.99,$47.99,https://www.jollychic.com/p/men-s-cardigan-solid-color-buttons-long-sleeve-comfy-coat-g1205598.html,Men's Cardigan Solid Color Buttons Long Sleeve Comfy Coat,Knitwear
301,$17.99,$26.99,https://www.jollychic.com/p/men-s-sweater-o-neck-long-sleeve-color-block-stylish-pullover-g1205764.html,Men's Sweater O Neck Long Sleeve Color Block Stylish Pullover,Knitwear
15,$20.99,$33.99,https://www.jollychic.com/p/men-s-cardigan-all-match-comfy-solid-color-chic-cardigan-g1211016.html,Men's Cardigan All Match Comfy Solid Color Chic Cardigan,Knitwear
131,$19.99,$31.99,https://www.jollychic.com/p/men-s-sweater-o-neck-long-sleeve-solid-color-brief-knitwear-g1234486.html,Men's Sweater O Neck Long Sleeve Solid Color Brief Knitwear,Knitwear
4,$28.99,,https://www.jollychic.com/p/men-s-sweater-turtle-neck-solid-color-warm-casual-pullover-g1237358.html,Men's Sweater Turtle Neck Solid Color Warm Casual Pullover,Knitwear
19,$19.99,$26.99,https://www.jollychic.com/p/men-s-cardigans-solid-color-vintage-sweatshirt-g1258262.html,Men's Cardigans Solid Color Vintage Sweatshirt,Knitwear
7,$17.99,$26.99,https://www.jollychic.com/p/men-s-cardigans-all-match-chic-design-solid-color-coat-g1258472.html,Men's Cardigans All Match Chic Design Solid Color Coat,Knitwear
70,$20.99,$31.99,https://www.jollychic.com/p/men-s-cardigan-fashion-casual-comfy-buttons-solid-color-cardigan-g1277694.html,Men's Cardigan Fashion Casual Comfy Buttons Solid Color Cardigan,Knitwear
154,$16.99,$27.99,https://www.jollychic.com/p/men-s-cardigans-solid-color-all-match-fashion-casual-knitwear-g1282796.html,Men's Cardigans Solid Color All Match Fashion Casual Knitwear,Knitwear
101,$15.99,$25.99,https://www.jollychic.com/p/men-s-cardigan-slim-color-block-all-match-casual-knitwear-g1282810.html,Men's Cardigan Slim Color Block All Match Casual Knitwear,Knitwear
13,$13.99,$22.99,https://www.jollychic.com/p/men-s-pullover-solid-color-all-match-casual-style-pullover-g1289000.html,Men's Pullover Solid Color All Match Casual Style Pullover,Knitwear
70,$17.99,$27.99,https://www.jollychic.com/p/men-s-cardigan-long-sleeve-open-front-comforty-fashion-knitwear-g1294388.html,Men's Cardigan Long Sleeve Open Front Comforty Fashion Knitwear,Knitwear
42,$21.99,$33.99,https://www.jollychic.com/p/men-s-cardigan-solid-color-buttons-pocket-long-sleeve-comfy-coat-g1310996.html,Men's Cardigan Solid Color Buttons Pocket Long Sleeve Comfy Coat,Knitwear
21,$12.99,$27.99,https://www.jollychic.com/p/men-s-sweater-turtle-neck-solid-color-long-sleeve-slim-comfy-pullover-g1311000.html,Men's Sweater Turtle Neck Solid Color Long Sleeve Slim Comfy Pullover,Knitwear
19,$28.99,$44.99,https://www.jollychic.com/p/men-s-cardigan-comfy-color-block-all-matched-chic-cardigan-g1330294.html,Men's Cardigan Comfy Color Block All Matched Chic Cardigan,Knitwear
4,$36.99,,https://www.jollychic.com/p/men-s-cardigan-casual-comfy-all-matched-chic-striped-cardigan-g1333546.html,Men's Cardigan Casual Comfy All Matched Chic Striped Cardigan,Knitwear
24,$23.99,$36.99,https://www.jollychic.com/p/men-s-pullover-casual-striped-color-block-all-matched-comfy-sweater-g1343270.html,Men's Pullover Casual Striped Color Block All Matched Comfy Sweater,Knitwear
159,$14.99,$22.99,https://www.jollychic.com/p/men-s-sweater-casual-ethnic-patchwork-color-o-neck-knitwear-g1344440.html,Men's Sweater Casual Ethnic Patchwork Color O Neck Knitwear,Knitwear
11,$18.99,$28.99,https://www.jollychic.com/p/men-s-sweater-casual-comfy-fashion-embroidery-all-matched-sweater-g1345686.html,Men's Sweater Casual Comfy Fashion Embroidery All Matched Sweater,Knitwear
5,$28.99,,https://www.jollychic.com/p/men-s-sweater-casual-solid-color-comfy-fashion-all-matched-sweater-g1345688.html,Men's Sweater Casual Solid Color Comfy Fashion All Matched Sweater,Knitwear
35,$18.99,$28.99,https://www.jollychic.com/p/men-s-sweater-casual-solid-color-turtle-neck-comfy-fashion-all-matched-sweater-g1345692.html,Men's Sweater Casual Solid Color Turtle Neck Comfy Fashion All Matched Sweater,Knitwear
15,$25.99,,https://www.jollychic.com/p/men-s-sweater-casual-striped-comfy-fashion-all-match-sweater-g1345742.html,Men's Sweater Casual Striped Comfy Fashion All Match Sweater,Knitwear
15,$23.99,$38.99,https://www.jollychic.com/p/men-s-pullover-solid-color-all-match-casual-pullover-g1377048.html,Men's Pullover Solid Color All Match Casual Pullover,Knitwear
4,$18.99,$33.99,https://www.jollychic.com/p/men-s-sweater-casual-all-matched-knitting-solid-color-sweater-g1401334.html,Men's Sweater Casual All Matched Knitting Solid Color Sweater,Knitwear
4,$39.99,,https://www.jollychic.com/p/men-s-sweater-long-sleeve-warm-all-match-slim-stylish-knitwear-g1405542.html,Men's Sweater Long Sleeve Warm All Match Slim Stylish Knitwear,Knitwear
17,$20.99,$33.99,https://www.jollychic.com/p/men-s-sweater-chic-stylish-preppy-fashionable-casual-pullover-g1409642.html,Men's Sweater Chic Stylish Preppy fashionable Casual Pullover,Knitwear
4,$21.99,$33.99,https://www.jollychic.com/p/men-s-sweater-color-block-all-match-fashionable-casual-pullover-g1409648.html,Men's Sweater Color Block All Match fashionable Casual Pullover,Knitwear
11,$20.99,$33.99,https://www.jollychic.com/p/men-s-sweater-crew-neck-stripe-preppy-fashionable-casual-pullover-g1409650.html,Men's Sweater Crew Neck Stripe Preppy fashionable Casual Pullover,Knitwear
3,$36.99,,https://www.jollychic.com/p/men-s-cardigan-fashion-warm-solid-color-long-sleeve-knitwear-g1428904.html,Men's Cardigan Fashion Warm Solid Color Long Sleeve Knitwear,Knitwear
11,$36.99,$52.00,https://www.jollychic.com/p/men-s-cardigan-all-match-chic-style-cardigan-g1450744.html,Men's Cardigan All Match Chic Style Cardigan,Knitwear
0,$52.00,,https://www.jollychic.com/p/men-s-sweater-comfy-striped-warm-o-neck-sweater-g1619706.html,Men's Sweater Comfy Striped Warm O Neck Sweater,Knitwear
0,$52.00,,https://www.jollychic.com/p/men-s-sweater-casual-solid-color-fashion-all-match-turtle-neck-sweater-g1619708.html,Men's Sweater Casual Solid Color Fashion All Match Turtle Neck Sweater,Knitwear
0,$39.99,,https://www.jollychic.com/p/men-s-pullover-comfy-solid-color-o-neck-chic-all-match-knitwear-g1619710.html,Men's Pullover Comfy Solid Color O Neck Chic All Match Knitwear,Knitwear
0,$49.99,,https://www.jollychic.com/p/men-s-sweater-casual-solid-color-chic-o-neck-sweater-g1619712.html,Men's Sweater Casual Solid Color Chic O Neck Sweater,Knitwear
0,$43.99,,https://www.jollychic.com/p/men-s-sweater-casual-v-neck-color-block-comfy-sweater-g1619714.html,Men's Sweater Casual V Neck Color Block Comfy Sweater,Knitwear
0,$43.99,,https://www.jollychic.com/p/men-s-sweater-comfy-o-neck-all-match-casual-solid-color-knitwear-g1619716.html,Men's Sweater Comfy O Neck All Match Casual Solid Color Knitwear,Knitwear
0,$42.99,,https://www.jollychic.com/p/men-s-sweater-comfy-solid-color-turtle-neck-chic-knitwear-g1619718.html,Men's Sweater Comfy Solid Color Turtle Neck Chic Knitwear,Knitwear
0,$39.99,,https://www.jollychic.com/p/men-s-knitwear-comfy-solid-color-all-match-turtle-neck-sweater-g1619720.html,Men's Knitwear Comfy Solid Color All Match Turtle Neck Sweater,Knitwear
0,$46.99,,https://www.jollychic.com/p/men-s-sweater-casual-comfy-solid-color-turtle-neck-knitwear-g1619722.html,Men's Sweater Casual Comfy Solid Color Turtle Neck Knitwear,Knitwear
1,$60.00,,https://www.jollychic.com/p/men-s-cardigan-comfy-solid-color-all-match-casual-knitwear-g1630636.html,Men's Cardigan Comfy Solid Color All Match Casual Knitwear,Knitwear
0,$39.99,,https://www.jollychic.com/p/men-s-sweater-casual-solid-color-chic-all-match-knitwear-g1630638.html,Men's Sweater Casual Solid Color Chic All Match Knitwear,Knitwear
0,$39.99,,https://www.jollychic.com/p/men-s-sweater-casual-solid-color-comfy-thicken-all-match-fashion-knitwear-g1630640.html,Men's Sweater Casual Solid Color Comfy Thicken All Match Fashion Knitwear,Knitwear
0,$46.99,,https://www.jollychic.com/p/men-s-sweater-comfy-turtle-neck-fashion-solid-color-pullover-g1630642.html,Men's Sweater Comfy Turtle Neck Fashion Solid Color Pullover,Knitwear
0,$45.99,,https://www.jollychic.com/p/men-s-cardigan-fashion-patchwork-color-letter-pattern-knitwear-g1631128.html,Men's Cardigan Fashion Patchwork Color Letter Pattern Knitwear,Knitwear
0,$21.99,,https://www.jollychic.com/p/men-s-sweater-solid-color-retro-style-o-neck-casual-knitwear-g1633898.html,Men's Sweater Solid Color Retro Style O Neck Casual Knitwear,Knitwear
0,$27.99,,https://www.jollychic.com/p/men-s-sweater-loose-long-sleeve-simple-solid-color-knitwear-g1633900.html,Men's Sweater Loose Long Sleeve Simple Solid Color Knitwear,Knitwear
0,$21.99,,https://www.jollychic.com/p/men-s-sweater-striped-patchwork-color-o-neck-trendy-knitwear-g1633902.html,Men's Sweater Striped Patchwork Color O Neck Trendy Knitwear,Knitwear
0,$24.99,,https://www.jollychic.com/p/men-s-sweater-long-sleeve-simple-patchwork-color-knitwear-g1633904.html,Men's Sweater Long Sleeve Simple Patchwork Color Knitwear,Knitwear
0,$30.99,,https://www.jollychic.com/p/men-s-sweatshirt-patchwork-chic-casual-sweatshirt-g1634118.html,Men's Sweatshirt Patchwork Chic Casual Sweatshirt,Knitwear
0,$27.99,,https://www.jollychic.com/p/men-s-sweatshirt-chic-solid-color-casual-warm-sweatshirt-g1634122.html,Men's Sweatshirt Chic Solid Color Casual Warm Sweatshirt,Knitwear
0,$47.99,,https://www.jollychic.com/p/men-s-cardigan-all-match-warm-chic-style-cardigan-g1634124.html,Men's Cardigan All Match Warm Chic Style Cardigan,Knitwear
0,$46.99,,https://www.jollychic.com/p/men-s-sweater-solid-color-all-match-warm-sweater-g1634128.html,Men's Sweater Solid Color All Match Warm Sweater,Knitwear
0,$43.99,,https://www.jollychic.com/p/men-s-sweater-fashion-color-block-loose-warm-casual-pullover-g1634890.html,Men's Sweater Fashion Color Block Loose Warm Casual Pullover,Knitwear
0,$46.99,,https://www.jollychic.com/p/men-s-sweater-animal-pattern-simple-design-fashion-casual-pullover-g1634892.html,Men's Sweater Animal Pattern Simple Design Fashion Casual Pullover,Knitwear
0,$42.99,,https://www.jollychic.com/p/men-s-sweater-fashion-print-simple-design-all-match-casual-pullover-g1634894.html,Men's Sweater Fashion Print Simple Design All Match Casual Pullover,Knitwear
0,$42.99,,https://www.jollychic.com/p/men-s-sweater-fashion-stripe-color-block-warm-casual-pullover-g1634896.html,Men's Sweater Fashion Stripe Color Block Warm Casual Pullover,Knitwear
0,$46.99,,https://www.jollychic.com/p/men-s-sweater-fashion-color-block-warm-casual-pullover-g1634898.html,Men's Sweater Fashion Color Block Warm Casual Pullover,Knitwear
0,$42.99,,https://www.jollychic.com/p/men-s-sweater-fashion-stripe-all-match-chic-casual-pullover-g1634900.html,Men's Sweater Fashion Stripe All Match Chic Casual Pullover,Knitwear
0,$42.99,,https://www.jollychic.com/p/men-s-sweater-animal-pattern-all-match-fashion-casual-pullover-g1634902.html,Men's Sweater Animal Pattern All Match Fashion Casual Pullover,Knitwear
0,$30.99,,https://www.jollychic.com/p/men-s-sweater-casual-comfy-striped-color-block-all-match-sweater-g1636210.html,Men's Sweater Casual Comfy Striped Color Block All Match Sweater,Knitwear
374,$21.99,$58.00,https://www.jollychic.com/p/dual-colors-slim-sweater-for-men-g328108.html,Dual Colors Slim Sweater For Men,Knitwear
101,$26.99,$54.00,https://www.jollychic.com/p/pure-color-high-quality-sweater-for-men-g328266.html,Pure Color High Quality Sweater For Men,Knitwear
225,$10.99,$30.99,https://www.jollychic.com/p/swish-casual-o-neck-patchwork-pullover-men-s-knitwear-g374740.html,Swish Casual O Neck Patchwork Pullover Men's Knitwear,Knitwear
1713,$13.99,$31.99,https://www.jollychic.com/p/fashion-warm-o-neck-color-patchwork-personality-men-s-kintwear-g374758.html,Fashion Warm O Neck Color Patchwork Personality Men's Kintwear,Knitwear
1453,$9.99,$33.99,https://www.jollychic.com/p/men-s-knitwear-casual-cosy-cotton-long-sleeve-patchwork-cardigan-g400606.html,Men's Knitwear Casual Cosy Cotton Long Sleeve Patchwork Cardigan,Knitwear
461,$11.99,$18.99,https://www.jollychic.com/p/men-s-pullover-v-neck-perfect-soft-warm-sweater-g419776.html,Men's Pullover V Neck Perfect Soft Warm Sweater,Knitwear
72,$21.99,$69.00,https://www.jollychic.com/p/men-s-knitwear-stripped-long-sleeve-stylish-comfortable-sweater-g422208.html,Men's Knitwear Stripped Long Sleeve Stylish Comfortable Sweater,Knitwear
270,$41.99,,https://www.jollychic.com/p/men-s-pullover-polyester-casual-comfortable-o-neck-patchwork-sweater-g425152.html,Men's Pullover Polyester Casual Comfortable O Neck Patchwork Sweater,Knitwear
116,$31.99,,https://www.jollychic.com/p/men-s-pullover-casual-perfect-one-piece-layer-look-fashion-knitwear-g443192.html,Men's Pullover Casual Perfect One Piece Layer Look Fashion Knitwear,Knitwear
210,$10.99,$26.99,https://www.jollychic.com/p/men-s-cardigan-fashion-long-sleeve-stand-collar-casual-knitwear-g453680.html,Men's Cardigan Fashion Long Sleeve Stand Collar Casual Knitwear,Knitwear
208,$10.99,$26.99,https://www.jollychic.com/p/men-s-pullover-solid-o-neck-high-quality-fashion-casual-knitwear-g454934.html,Men's Pullover Solid O Neck High Quality Fashion Casual Knitwear,Knitwear
1073,$20.99,$32.99,https://www.jollychic.com/p/men-s-cardigan-striped-design-fashion-long-sleeve-cozy-casual-knitwear-g456684.html,Men's Cardigan Striped Design Fashion Long Sleeve Cozy Casual Knitwear,Knitwear
85,$13.99,$30.99,https://www.jollychic.com/p/men-s-pullover-turtle-neck-solid-long-sleeves-warm-casual-knitwear-g467346.html,Men's Pullover Turtle Neck Solid Long Sleeves Warm Casual Knitwear,Knitwear
4682,$9.99,$14.99,https://www.jollychic.com/p/men-s-pullover-sweater-casual-patchwork-long-sleeve-knitwear-g472842.html,Men's Pullover Sweater Casual Patchwork Long Sleeve Knitwear,Knitwear
132,$14.99,$38.99,https://www.jollychic.com/p/men-s-sweater-slim-casual-o-neck-long-sleeve-thick-colorblock-knitwear-g475090.html,Men's Sweater Slim Casual O Neck Long Sleeve Thick Colorblock Knitwear,Knitwear
84,$22.99,$69.00,https://www.jollychic.com/p/men-s-pullover-turtle-neck-long-sleeve-solid-color-fashion-style-knitwear-g479022.html,Men's Pullover Turtle Neck Long Sleeve Solid Color Fashion Style Knitwear,Knitwear
669,$20.99,$32.99,https://www.jollychic.com/p/men-s-cardigan-single-button-fashion-solid-color-leisure-cozy-knitwear-g499828.html,Men's Cardigan Single Button Fashion Solid Color Leisure Cozy Knitwear,Knitwear
