add_wish,discount_price,original_price,product_link,product_name,header_block
0,$33.99,,https://www.jollychic.com/p/men-s-sweater-letter-pattern-fashionable-casual-pullover-g1409624.html,Men's Sweater Letter Pattern fashionable Casual Pullover,Knitwear
0,$36.99,,https://www.jollychic.com/p/men-s-sweater-o-neck-long-sleeve-all-match-chic-knitwear-g1421496.html,Men's Sweater O Neck Long Sleeve All Match Chic Knitwear,Knitwear
1,$48.99,,https://www.jollychic.com/p/men-s-cardigan-zipper-striped-long-sleeve-casual-knitwear-g1421644.html,Men's Cardigan Zipper Striped Long Sleeve Casual Knitwear,Knitwear
3,$22.99,$34.99,https://www.jollychic.com/p/men-s-sweater-comfy-turtle-neck-chic-solid-color-pullover-g1424522.html,Men's Sweater Comfy Turtle Neck Chic Solid Color Pullover,Knitwear
0,$36.99,,https://www.jollychic.com/p/men-s-sweater-turn-down-collar-one-piece-layer-look-knitwear-g1428998.html,Men's Sweater Turn Down Collar One Piece Layer Look Knitwear,Knitwear
6,$38.99,,https://www.jollychic.com/p/men-s-cardigan-striped-single-breasted-long-sleeve-knitwear-g1435948.html,Men's Cardigan Striped Single Breasted Long Sleeve Knitwear,Knitwear
4,$27.99,,https://www.jollychic.com/p/men-s-pullover-v-neck-long-sleeve-striped-stylish-knitwear-g1435966.html,Men's Pullover V Neck Long Sleeve Striped Stylish Knitwear,Knitwear
6,$39.99,,https://www.jollychic.com/p/men-s-cardigan-fashion-solid-color-open-front-long-sleeve-knitwear-g1445828.html,Men's Cardigan Fashion Solid Color Open Front Long Sleeve Knitwear,Knitwear
3,$23.99,$47.99,https://www.jollychic.com/p/hstyle-men-s-stylish-pullover-solid-color-loose-o-neck-sweater-g1451156.html,Hstyle Men's Stylish Pullover Solid Color Loose O Neck Sweater,Knitwear
3,$46.99,,https://www.jollychic.com/p/men-s-sweater-solid-color-all-match-coldproof-sweater-g1452684.html,Men's Sweater Solid Color All Match Coldproof Sweater,Knitwear
1,$46.99,,https://www.jollychic.com/p/men-s-sweater-striped-color-blocking-chic-style-warm-sweater-g1452690.html,Men's Sweater Striped Color Blocking Chic Style Warm Sweater,Knitwear
3,$23.99,$47.99,https://www.jollychic.com/p/hstyle-men-s-simple-pullover-all-match-loose-stylish-casual-sweater-g1452928.html,Hstyle Men's Simple Pullover All Match Loose Stylish Casual Sweater,Knitwear
6,$16.99,$25.99,https://www.jollychic.com/p/men-s-cardigan-solid-color-all-match-chic-style-cardigan-g1469108.html,Men's Cardigan Solid Color All Match Chic Style Cardigan,Knitwear
1,$34.99,,https://www.jollychic.com/p/men-s-sweater-cotton-blends-o-neck-patchwork-knitwear-g1469966.html,Men's Sweater Cotton Blends O Neck Patchwork Knitwear,Knitwear
2,$46.99,,https://www.jollychic.com/p/men-s-cardigan-solid-color-open-style-cozy-knitwear-g1469968.html,Men's Cardigan Solid Color Open Style Cozy Knitwear,Knitwear
0,$36.99,,https://www.jollychic.com/p/men-s-sweater-o-neck-pure-color-long-sleeve-comfy-knitwear-g1469972.html,Men's Sweater O Neck Pure Color Long Sleeve Comfy Knitwear,Knitwear
1,$40.99,,https://www.jollychic.com/p/men-s-sweater-geometric-long-sleeve-color-block-personality-knitwear-g1473966.html,Men's Sweater Geometric Long Sleeve Color Block Personality Knitwear,Knitwear
4,$40.99,,https://www.jollychic.com/p/men-s-sweater-long-sleeve-turtle-neck-solid-color-knitwear-g1478032.html,Men's Sweater Long Sleeve Turtle Neck Solid Color Knitwear,Knitwear
12,$19.99,$30.99,https://www.jollychic.com/p/men-s-sweater-solid-color-simple-style-o-neck-trendy-knitwear-g1478088.html,Men's Sweater Solid Color Simple Style O Neck Trendy Knitwear,Knitwear
1,$36.99,,https://www.jollychic.com/p/men-s-sweater-o-neck-casual-print-long-sleeve-knitwear-g1481382.html,Men's Sweater O Neck Casual Print Long Sleeve Knitwear,Knitwear
2,$38.99,,https://www.jollychic.com/p/men-s-pullover-all-match-color-block-comfy-chic-sweater-g1545574.html,Men's Pullover All Match Color Block Comfy Chic Sweater,Knitwear
2,$40.99,,https://www.jollychic.com/p/men-s-pullover-all-match-comfy-color-block-chic-sweater-g1545576.html,Men's Pullover All Match Comfy Color Block Chic Sweater,Knitwear
0,$38.99,,https://www.jollychic.com/p/men-s-pullover-comfy-solid-color-o-neck-all-match-knitwear-g1560984.html,Men's Pullover Comfy Solid Color O Neck All Match Knitwear,Knitwear
56,$11.99,$30.99,https://www.jollychic.com/p/plus-size-solid-color-v-collar-cozy-touch-knitwear-for-men-g345842.html,Plus Size Solid Color V Collar Cozy Touch Knitwear For Men,Knitwear
50,$37.99,,https://www.jollychic.com/p/men-s-cardigan-one-piece-layer-look-shirt-collar-long-sleeve-knitwear-g449922.html,Men's Cardigan One Piece Layer Look Shirt Collar Long Sleeve Knitwear,Knitwear
104,$30.99,,https://www.jollychic.com/p/men-s-sweater-patchwork-color-casual-cozy-ventilate-slim-warm-knitwear-g459164.html,Men's Sweater Patchwork Color Casual Cozy Ventilate Slim Warm Knitwear,Knitwear
21,$21.99,$65.00,https://www.jollychic.com/p/men-s-pullovers-v-neck-long-sleeve-solid-leisure-pullovers-g470818.html,Men's Pullovers V Neck Long Sleeve Solid Leisure Pullovers,Knitwear
919,$21.99,$26.99,https://www.jollychic.com/p/men-s-cardigan-fashion-solid-color-open-front-leisure-pocket-design-knitwear-g522854.html,Men's Cardigan Fashion Solid Color Open Front Leisure Pocket Design Knitwear,Knitwear
11,$38.99,,https://www.jollychic.com/p/men-s-knitwear-casual-cozy-o-neck-solid-color-pullover-g554222.html,Men's Knitwear Casual Cozy O Neck Solid Color Pullover,Knitwear
236,$13.99,$20.99,https://www.jollychic.com/p/men-s-knitwear-cotton-blends-o-neck-long-sleeve-geometric-knitwear-g565214.html,Men's Knitwear Cotton Blends O Neck Long Sleeve Geometric Knitwear,Knitwear
9,$18.99,$29.99,https://www.jollychic.com/p/men-s-t-shirt-long-sleeve-solid-color-v-neck-soft-t-shirt-g666032.html,Men's T Shirt Long Sleeve Solid Color V Neck Soft T Shirt,Knitwear
106,$30.99,$63.00,https://www.jollychic.com/p/men-s-knitwear-short-sleeve-o-neck-brief-stylish-casual-knitwear-g685146.html,Men's Knitwear Short Sleeve O Neck Brief Stylish Casual Knitwear,Knitwear
5,$19.99,$30.99,https://www.jollychic.com/p/men-s-knitwear-fashion-casual-comfy-trendy-warm-knitwear-g871904.html,Men's Knitwear Fashion Casual Comfy Trendy Warm Knitwear,Knitwear
13,$19.99,$30.99,https://www.jollychic.com/p/men-s-knitwear-fashion-casual-comfy-trendy-warm-solid-color-knitwear-g871918.html,Men's Knitwear Fashion Casual Comfy Trendy Warm Solid Color Knitwear,Knitwear
27,$15.99,$24.99,https://www.jollychic.com/p/men-s-knitwear-o-neck-color-block-long-sleeve-pullover-g878512.html,Men's Knitwear O Neck Color Block Long Sleeve Pullover,Knitwear
24,$21.99,$35.99,https://www.jollychic.com/p/men-s-knitwear-one-piece-layer-look-patchwork-long-sleeve-pullover-g902324.html,Men's Knitwear One Piece Layer Look Patchwork Long Sleeve Pullover,Knitwear
166,$18.99,$30.99,https://www.jollychic.com/p/men-s-sweater-simple-style-vintage-round-neck-sweater-g926492.html,Men's Sweater Simple Style Vintage Round Neck Sweater,Knitwear
36,$54.00,,https://www.jollychic.com/p/men-s-sweater-o-neck-striped-long-sleeve-casual-comfy-pullover-g968784.html,Men's Sweater O Neck Striped Long Sleeve Casual Comfy Pullover,Knitwear
8,$23.99,$43.99,https://www.jollychic.com/p/men-s-sweater-o-neck-striped-long-sleeve-casual-comfy-pullover-g968808.html,Men's Sweater O Neck Striped Long Sleeve Casual Comfy Pullover,Knitwear
28,$9.99,$15.99,https://www.jollychic.com/p/men-s-sweaters-casual-weaving-geometry-pattern-pullover-g976786.html,Men's Sweaters Casual Weaving Geometry Pattern Pullover,Knitwear
11,$32.99,$46.99,https://www.jollychic.com/p/men-s-pullover-colorblock-patched-striped-o-neck-long-sleeve-pullover-g988582.html,Men's Pullover Colorblock Patched Striped O Neck Long Sleeve Pullover,Knitwear
58,$8.99,$12.99,https://www.jollychic.com/p/men-s-pullover-casual-print-striped-chic-comfy-all-matched-warm-sweater-g1000086.html,Men's Pullover Casual Print Striped Chic Comfy All Matched Warm Sweater,Knitwear
2,$28.99,$38.99,https://www.jollychic.com/p/men-s-sweater-one-piece-layer-look-plaid-design-pullover-g1028290.html,Men's Sweater One Piece Layer Look Plaid Design Pullover,Knitwear
14,$13.99,$41.99,https://www.jollychic.com/p/men-s-cardigan-color-block-zipper-long-sleeve-comfy-outwear-g1034960.html,Men's Cardigan Color Block Zipper Long Sleeve Comfy Outwear,Knitwear
3,$24.99,$41.99,https://www.jollychic.com/p/men-s-pullover-solid-color-long-sleeve-knitwear-g1035068.html,Men's Pullover Solid Color Long Sleeve Knitwear,Knitwear
2,$22.99,$28.99,https://www.jollychic.com/p/men-s-sweater-casual-comfy-striped-preppy-long-sleeve-color-block-sweater-g1043916.html,Men's Sweater Casual Comfy Striped Preppy Long Sleeve Color Block Sweater,Knitwear
4,$16.99,,https://www.jollychic.com/p/men-s-sweater-v-neck-long-sleeve-striped-patchwork-comfy-all-match-pullover-g1048010.html,Men's Sweater V Neck Long Sleeve Striped Patchwork Comfy All Match Pullover,Knitwear
7,$16.99,,https://www.jollychic.com/p/men-s-sweater-v-neck-long-sleeve-patchwork-comfy-all-match-pullover-g1048018.html,Men's Sweater V Neck Long Sleeve Patchwork Comfy All Match Pullover,Knitwear
11,$20.99,$29.99,https://www.jollychic.com/p/men-s-vest-o-neck-sleeveless-solid-color-casual-knitwear-g1050656.html,Men's Vest O Neck Sleeveless Solid Color Casual Knitwear,Knitwear
16,$31.99,$49.99,https://www.jollychic.com/p/men-s-cardigan-solid-color-zipper-long-sleeve-comfy-coat-g1081186.html,Men's Cardigan Solid Color Zipper Long Sleeve Comfy Coat,Knitwear
4,$20.99,$32.99,https://www.jollychic.com/p/men-s-sweater-o-neck-solid-long-sleeve-casual-comfy-pullover-g1081194.html,Men's Sweater O Neck Solid Long Sleeve Casual Comfy Pullover,Knitwear
11,$19.99,$30.99,https://www.jollychic.com/p/men-s-sweater-o-neck-striped-long-sleeve-casual-comfy-pullover-g1081242.html,Men's Sweater O Neck Striped Long Sleeve Casual Comfy Pullover,Knitwear
5,$13.99,$19.99,https://www.jollychic.com/p/men-s-sweatshirt-pattern-printing-chic-all-match-sweatshirt-g1081424.html,Men's Sweatshirt Pattern Printing Chic All Match Sweatshirt,Knitwear
15,$13.99,$22.99,https://www.jollychic.com/p/men-s-knitwear-casual-all-match-light-weight-solid-color-pullover-g1116878.html,Men's Knitwear Casual All Match Light Weight Solid Color Pullover,Knitwear
6,$32.99,$52.00,https://www.jollychic.com/p/men-s-sweater-o-neck-cartoon-print-long-sleeve-all-match-pullover-g1147402.html,Men's Sweater O Neck Cartoon Print Long Sleeve All Match Pullover,Knitwear
5,$21.99,$36.99,https://www.jollychic.com/p/men-s-sweater-solid-color-turtle-neck-light-weight-knitwear-g1147534.html,Men's Sweater Solid Color Turtle Neck Light Weight Knitwear,Knitwear
10,$15.99,$22.99,https://www.jollychic.com/p/men-s-pullover-color-block-patchwork-slim-fashion-knitwear-g1153844.html,Men's Pullover Color Block Patchwork Slim Fashion Knitwear,Knitwear
5,$36.99,,https://www.jollychic.com/p/men-s-sweater-solid-color-long-sleeve-comforty-knitwear-g1156090.html,Men's Sweater Solid Color Long Sleeve Comforty Knitwear,Knitwear
-1,$31.99,$52.00,https://www.jollychic.com/p/men-s-pullover-striped-classic-style-o-neck-long-sleeves-sweater-g1160084.html,Men's Pullover Striped Classic Style O Neck Long Sleeves Sweater,Knitwear
4,$31.99,$52.00,https://www.jollychic.com/p/men-s-pullover-original-colorblock-o-neck-stylish-sweater-g1160108.html,Men's Pullover Original Colorblock O Neck Stylish Sweater,Knitwear
6,$19.99,$31.99,https://www.jollychic.com/p/men-s-sweater-color-block-o-neck-long-sleeve-pullover-g1163690.html,Men's Sweater Color Block O Neck Long Sleeve Pullover,Knitwear
3,$30.99,$46.99,https://www.jollychic.com/p/men-s-sweater-long-sleeve-casual-comfy-color-block-knitwear-g1170704.html,Men's Sweater Long Sleeve Casual Comfy Color Block Knitwear,Knitwear
223,$20.99,$32.99,https://www.jollychic.com/p/men-s-cardigan-solid-color-single-breasted-simple-casual-knitwear-g1173980.html,Men's Cardigan Solid Color Single Breasted Simple Casual Knitwear,Knitwear
12,$18.99,$29.99,https://www.jollychic.com/p/men-s-sweater-solid-color-all-match-casual-knitwear-g1175078.html,Men's Sweater Solid Color All Match Casual Knitwear,Knitwear
3,$29.99,,https://www.jollychic.com/p/men-s-vest-all-matched-letter-pattern-chic-color-block-comfy-vest-g1189764.html,Men's Vest All Matched Letter Pattern Chic Color Block Comfy Vest,Knitwear
6,$24.99,$38.99,https://www.jollychic.com/p/men-s-pullover-all-matched-striped-casual-comfy-sweater-g1195118.html,Men's Pullover All Matched Striped Casual Comfy Sweater,Knitwear
0,$23.99,$36.99,https://www.jollychic.com/p/men-s-sweater-o-neck-striped-long-sleeve-casual-comfy-pullover-g1202786.html,Men's Sweater O Neck Striped Long Sleeve Casual Comfy Pullover,Knitwear
0,$33.99,,https://www.jollychic.com/p/men-s-pullover-animal-pattern-long-sleeve-chic-sweater-g1205762.html,Men's Pullover Animal Pattern Long Sleeve Chic Sweater,Knitwear
8,$35.99,,https://www.jollychic.com/p/men-s-pullover-letter-pattern-stylish-o-neck-long-sleeve-sweater-g1205766.html,Men's Pullover Letter Pattern Stylish O Neck Long Sleeve Sweater,Knitwear
4,$20.99,$31.99,https://www.jollychic.com/p/men-s-sweater-v-neck-casual-long-sleeve-striped-knitwear-g1207770.html,Men's Sweater V Neck Casual Long Sleeve Striped Knitwear,Knitwear
29,$23.99,$38.99,https://www.jollychic.com/p/men-s-pullover-turtle-neck-knitted-fashion-comfy-all-matched-chic-sweater-g1223088.html,Men's Pullover Turtle Neck Knitted Fashion Comfy All Matched Chic Sweater,Knitwear
5,$29.99,$45.99,https://www.jollychic.com/p/men-s-cardigan-stand-collar-fashion-color-block-slim-knitwear-g1224210.html,Men's Cardigan Stand Collar Fashion Color Block Slim Knitwear,Knitwear
4,$24.99,$38.99,https://www.jollychic.com/p/men-s-sweater-comfy-fashion-letter-pattern-chic-pullover-g1230168.html,Men's Sweater Comfy Fashion Letter Pattern Chic Pullover,Knitwear
1,$30.99,$46.99,https://www.jollychic.com/p/men-s-sweater-solid-color-all-matched-fashion-sweater-g1230356.html,Men's Sweater Solid Color All Matched Fashion Sweater,Knitwear
9,$25.99,$39.99,https://www.jollychic.com/p/men-s-sweater-o-neck-casual-comfy-long-sleeve-knitwear-g1234076.html,Men's Sweater O Neck Casual Comfy Long Sleeve Knitwear,Knitwear
11,$23.99,$39.99,https://www.jollychic.com/p/men-s-sweater-casual-long-sleeve-all-match-comfy-knitwear-g1234084.html,Men's Sweater Casual Long Sleeve All Match Comfy Knitwear,Knitwear
0,$26.99,$40.99,https://www.jollychic.com/p/men-s-cardigan-all-match-comfy-solid-color-knitted-cardigan-g1238966.html,Men's Cardigan All Match Comfy Solid Color Knitted Cardigan,Knitwear
1,$70.00,,https://www.jollychic.com/p/men-s-sweater-casual-all-matched-comfy-hooded-sweater-g1243180.html,Men's Sweater Casual All Matched Comfy Hooded Sweater,Knitwear
0,$20.99,$31.99,https://www.jollychic.com/p/zhuowolves-men-s-sweater-solid-color-turtle-neck-casual-pullover-g1245824.html,Zhuowolves Men's Sweater Solid Color Turtle Neck Casual Pullover,Knitwear
3,$16.99,$26.99,https://www.jollychic.com/p/men-s-pullover-all-match-colorblocking-warm-sweatshirt-g1258484.html,Men's Pullover All Match Colorblocking Warm Sweatshirt,Knitwear
1,$16.99,$26.99,https://www.jollychic.com/p/men-s-pullover-colorblocking-chic-style-pullover-g1258486.html,Men's Pullover Colorblocking Chic Style Pullover,Knitwear
0,$16.99,$26.99,https://www.jollychic.com/p/men-s-pullover-striped-pattern-printting-pullover-g1258488.html,Men's Pullover Striped Pattern Printting Pullover,Knitwear
3,$26.99,$43.99,https://www.jollychic.com/p/men-s-sweater-o-neck-long-sleeve-solid-color-stylisn-knitwear-g1263832.html,Men's Sweater O Neck Long Sleeve Solid Color Stylisn Knitwear,Knitwear
9,$32.99,$49.99,https://www.jollychic.com/p/men-s-cardigan-all-match-vintage-style-cardigan-g1289208.html,Men's Cardigan All Match Vintage Style Cardigan,Knitwear
2,$38.99,,https://www.jollychic.com/p/men-s-sweatshirt-chic-style-solid-color-sweatshirt-g1293750.html,Men's Sweatshirt Chic Style Solid Color Sweatshirt,Knitwear
6,$10.99,$27.99,https://www.jollychic.com/p/men-s-sweater-casual-long-sleeve-hooded-pullover-g1295012.html,Men's Sweater Casual Long Sleeve Hooded Pullover,Knitwear
3,$30.99,,https://www.jollychic.com/p/men-s-pullover-casual-striped-comfy-stylish-o-neck-sweater-g1302078.html,Men's Pullover Casual Striped Comfy Stylish O Neck Sweater,Knitwear
8,$40.99,,https://www.jollychic.com/p/men-s-pullover-all-matched-striped-casual-sweater-g1303150.html,Men's Pullover All Matched Striped Casual Sweater,Knitwear
1,$32.99,,https://www.jollychic.com/p/men-s-sweater-color-block-o-neck-long-sleeve-chic-pullover-g1303572.html,Men's Sweater Color Block O Neck Long Sleeve Chic Pullover,Knitwear
4,$27.99,,https://www.jollychic.com/p/men-s-cardigan-solid-color-front-open-sleeveless-comfy-coat-g1309262.html,Men's Cardigan Solid Color Front Open Sleeveless Comfy Coat,Knitwear
5,$30.99,,https://www.jollychic.com/p/men-s-sweater-o-neck-long-sleeve-striped-comfy-all-match-pullover-g1312816.html,Men's Sweater O Neck Long Sleeve Striped Comfy All Match Pullover,Knitwear
0,$36.99,,https://www.jollychic.com/p/men-s-sweater-color-block-stripe-o-neck-long-sleeve-pullover-g1314310.html,Men's Sweater Color Block Stripe O Neck Long Sleeve Pullover,Knitwear
10,$15.99,$25.99,https://www.jollychic.com/p/men-s-sweater-o-neck-color-block-stripe-long-sleeve-pullover-g1320316.html,Men's Sweater O Neck Color Block Stripe Long Sleeve Pullover,Knitwear
2,$36.99,,https://www.jollychic.com/p/men-s-sweater-o-neck-long-sleeve-solid-color-comfy-all-match-pullover-g1322386.html,Men's Sweater O Neck Long Sleeve Solid Color Comfy All Match Pullover,Knitwear
2,$22.99,$36.99,https://www.jollychic.com/p/men-s-sweater-o-neck-jacquard-long-sleeve-solid-color-comfy-all-match-pullover-g1322408.html,Men's Sweater O Neck Jacquard Long Sleeve Solid Color Comfy All Match Pullover,Knitwear
2,$19.99,$30.99,https://www.jollychic.com/p/men-s-sweater-striped-color-block-o-neck-long-sleeve-fashion-comfy-sweater-g1326294.html,Men's Sweater Striped Color Block O Neck Long Sleeve Fashion Comfy Sweater,Knitwear
3,$36.99,,https://www.jollychic.com/p/men-s-sweater-casual-comfy-all-matched-print-fashion-pullover-g1333552.html,Men's Sweater Casual Comfy All Matched Print Fashion Pullover,Knitwear
5,$40.99,,https://www.jollychic.com/p/men-s-pullover-casual-striped-comfy-color-block-all-matched-sweater-g1343218.html,Men's Pullover Casual Striped Comfy Color Block All Matched Sweater,Knitwear
4,$26.99,$43.99,https://www.jollychic.com/p/men-s-pullover-casual-letter-pattern-comfy-color-block-all-matched-sweater-g1343222.html,Men's Pullover Casual Letter Pattern Comfy Color Block All Matched Sweater,Knitwear
7,$30.99,,https://www.jollychic.com/p/men-s-pullover-casual-turtle-neck-solid-color-all-matched-sweater-g1343260.html,Men's Pullover Casual Turtle Neck Solid Color All Matched Sweater,Knitwear
8,$27.99,,https://www.jollychic.com/p/men-s-pullover-casual-geometric-comfy-color-block-all-matched-sweater-g1343268.html,Men's Pullover Casual Geometric Comfy Color Block All Matched Sweater,Knitwear
8,$24.99,$40.99,https://www.jollychic.com/p/men-s-pullover-casual-comfy-color-block-all-matched-sweater-g1343272.html,Men's Pullover Casual Comfy Color Block All Matched Sweater,Knitwear
2,$29.99,$48.99,https://www.jollychic.com/p/men-s-sweater-cotton-blends-o-neck-bee-jacquard-stylish-knitwear-g1350556.html,Men's Sweater Cotton Blends O Neck Bee Jacquard Stylish Knitwear,Knitwear
4,$49.99,,https://www.jollychic.com/p/men-s-sweater-striped-long-sleeve-fashionable-knitwear-g1350560.html,Men's Sweater Striped Long Sleeve Fashionable Knitwear,Knitwear
2,$46.99,,https://www.jollychic.com/p/men-s-sweater-chic-pattern-printing-casual-sweater-g1350582.html,Men's Sweater Chic Pattern Printing Casual Sweater,Knitwear
0,$35.99,,https://www.jollychic.com/p/men-s-sweater-o-neck-long-sleeve-color-block-casual-comfy-pullover-g1350702.html,Men's Sweater O Neck Long Sleeve Color Block Casual Comfy Pullover,Knitwear
0,$56.00,,https://www.jollychic.com/p/men-s-cardigan-all-match-chic-style-warm-cardigan-g1351296.html,Men's Cardigan All Match Chic Style Warm Cardigan,Knitwear
9,$35.99,,https://www.jollychic.com/p/men-s-sweater-o-neck-long-sleeve-color-block-casual-comfy-pullover-g1363790.html,Men's Sweater O Neck Long Sleeve Color Block Casual Comfy Pullover,Knitwear
5,$42.99,,https://www.jollychic.com/p/men-s-pullover-color-striped-all-match-casual-pullover-g1374878.html,Men's Pullover Color Striped All Match Casual Pullover,Knitwear
6,$30.99,$46.99,https://www.jollychic.com/p/men-s-sweater-color-blocking-warm-chic-sweater-g1374886.html,Men's Sweater Color Blocking Warm Chic Sweater,Knitwear
1,$36.99,,https://www.jollychic.com/p/men-s-sweater-casual-o-neck-solid-color-all-matched-pullover-g1375882.html,Men's Sweater Casual O Neck Solid Color All Matched Pullover,Knitwear
3,$28.99,$43.99,https://www.jollychic.com/p/men-s-sweater-solid-warm-all-match-sweater-g1376146.html,Men's Sweater Solid Warm All Match Sweater,Knitwear
0,$26.99,,https://www.jollychic.com/p/men-s-sweater-striped-printing-chic-casual-sweater-g1381418.html,Men's Sweater Striped Printing Chic Casual Sweater,Knitwear
1,$34.99,,https://www.jollychic.com/p/men-s-sweater-solid-color-all-match-chic-sweater-g1396958.html,Men's Sweater Solid Color All Match Chic Sweater,Knitwear
1,$38.99,,https://www.jollychic.com/p/men-s-sweater-casual-all-match-color-block-long-sleeve-sweater-g1401340.html,Men's Sweater Casual All Match Color Block Long Sleeve Sweater,Knitwear
0,$30.99,,https://www.jollychic.com/p/men-s-cardigan-all-matched-solid-color-comfy-chic-cardigan-g1402124.html,Men's Cardigan All Matched Solid Color Comfy Chic Cardigan,Knitwear
0,$45.99,,https://www.jollychic.com/p/men-s-sweater-solid-color-turtle-neck-casual-slim-knitwear-g1405538.html,Men's Sweater Solid Color Turtle Neck Casual Slim Knitwear,Knitwear
1,$46.99,,https://www.jollychic.com/p/men-s-sweater-casual-solid-color-all-match-fashion-slim-knitwear-g1405552.html,Men's Sweater Casual Solid Color All Match Fashion Slim Knitwear,Knitwear
0,$29.99,$45.99,https://www.jollychic.com/p/men-s-sweater-color-blocking-warm-sweater-g1409192.html,Men's Sweater Color Blocking Warm Sweater,Knitwear
4,$25.99,$39.99,https://www.jollychic.com/p/men-s-sweater-color-blocking-striped-chic-warm-sweater-g1409196.html,Men's Sweater Color Blocking Striped Chic Warm Sweater,Knitwear
0,$25.99,$38.99,https://www.jollychic.com/p/men-s-sweater-color-blocking-classic-chic-warm-sweater-g1409286.html,Men's Sweater Color Blocking Classic Chic Warm Sweater,Knitwear
0,$26.99,$40.99,https://www.jollychic.com/p/men-s-sweater-warm-pattern-printing-casual-sweater-g1409294.html,Men's Sweater Warm Pattern Printing Casual Sweater,Knitwear
1,$36.99,,https://www.jollychic.com/p/men-s-sweater-solid-color-all-match-fashionable-casual-pullover-g1409622.html,Men's Sweater Solid Color All Match fashionable Casual Pullover,Knitwear
0,$49.99,,https://www.jollychic.com/p/men-s-sweater-knitted-solid-color-fashionable-casual-pullover-g1409658.html,Men's Sweater Knitted Solid Color fashionable Casual Pullover,Knitwear
2,$36.99,,https://www.jollychic.com/p/men-s-cardigan-solid-color-slim-casual-all-match-cardigan-g1414564.html,Men's Cardigan Solid Color Slim Casual All Match Cardigan,Knitwear
0,$34.99,,https://www.jollychic.com/p/men-s-sweater-o-neck-long-sleeve-color-block-cozy-knitwear-g1421492.html,Men's Sweater O Neck Long Sleeve Color Block Cozy knitwear,Knitwear
1,$34.99,,https://www.jollychic.com/p/men-s-sweater-casual-solid-color-turtle-neck-comfy-pullover-g1424528.html,Men's Sweater Casual Solid Color Turtle Neck Comfy Pullover,Knitwear
1,$40.99,,https://www.jollychic.com/p/men-s-sweater-o-neck-long-sleeve-simple-style-comfy-knitwear-g1429002.html,Men's Sweater O Neck Long Sleeve Simple Style Comfy Knitwear,Knitwear
1,$31.99,,https://www.jollychic.com/p/men-s-sweater-crew-neck-all-match-fashion-pullover-g1443120.html,Men's Sweater Crew Neck All Match Fashion Pullover,Knitwear
4,$22.99,,https://www.jollychic.com/p/men-s-vest-jacke-casual-chic-vest-jacket-g1444896.html,Men's Vest Jacke Casual Chic Vest Jacket,Knitwear
9,$39.99,,https://www.jollychic.com/p/men-s-sweater-slim-long-sleeve-patchwork-color-knitwear-g1445806.html,Men's Sweater Slim Long Sleeve Patchwork Color Knitwear,Knitwear
1,$35.99,,https://www.jollychic.com/p/men-s-sweater-simple-style-patchwork-color-comforty-knitwear-g1445840.html,Men's Sweater Simple Style Patchwork Color Comforty Knitwear,Knitwear
6,$44.99,,https://www.jollychic.com/p/men-s-sweater-color-blocking-coldproof-sweater-g1452686.html,Men's Sweater Color Blocking Coldproof Sweater,Knitwear
0,$32.99,,https://www.jollychic.com/p/men-s-sweater-solid-color-slim-long-sleeve-turtle-neck-knitwear-g1508440.html,Men's Sweater Solid Color Slim Long Sleeve Turtle Neck Knitwear,Knitwear
2,$25.99,,https://www.jollychic.com/p/men-s-sweater-patchwork-color-long-sleeve-simple-style-knitwear-g1508444.html,Men's Sweater Patchwork Color Long Sleeve Simple Style Knitwear,Knitwear
0,$25.99,,https://www.jollychic.com/p/men-s-sweater-color-block-slim-fashion-long-sleeve-knitwear-g1508448.html,Men's Sweater Color Block Slim Fashion Long Sleeve Knitwear,Knitwear
1,$25.99,,https://www.jollychic.com/p/men-s-sweater-long-sleeve-trendy-leisure-comforty-knitwear-g1508466.html,Men's Sweater Long Sleeve Trendy Leisure Comforty Knitwear,Knitwear
2,$29.99,,https://www.jollychic.com/p/men-s-sweater-o-neck-casual-slim-camouflage-trendy-knitwear-g1508488.html,Men's Sweater O Neck Casual Slim Camouflage Trendy Knitwear,Knitwear
0,$36.99,,https://www.jollychic.com/p/men-s-cardigan-casual-solid-color-long-sleeve-open-front-knitwear-g1508492.html,Men's Cardigan Casual Solid Color Long Sleeve Open Front Knitwear,Knitwear
1,$46.99,,https://www.jollychic.com/p/men-s-fashion-pullover-letter-pattern-sports-stylish-knitted-sweater-g1547436.html,Men's Fashion Pullover Letter Pattern Sports Stylish Knitted Sweater,Knitwear
