add_wish,discount_price,original_price,product_link,product_name,header_block
1,$37.99,$58.00,http://www.jollychic.com/p/men-s-crossbody-bag-canvas-camouflage-fashion-high-quality-durable-bag-g820924.html,Men's Crossbody Bag Canvas Camouflage Fashion High Quality Durable Bag,Crossbody Bags
4,$10.99,$16.99,http://www.jollychic.com/p/men-s-crossbody-bag-lightweight-versatile-folded-shoulder-bag-g858068.html,Men's Crossbody Bag Lightweight Versatile Folded Shoulder Bag,Crossbody Bags
25,$28.99,$44.99,http://www.jollychic.com/p/vegoo-men-s-crossbody-bag-all-match-solid-classic-casual-bag-g901188.html,VEGOO Men's Crossbody Bag All Match Solid Classic Casual Bag,Crossbody Bags
11,$36.99,$57.00,http://www.jollychic.com/p/vegoo-men-s-crossbag-solid-color-all-match-stylish-leather-bag-g906822.html,VEGOO Men's Crossbag Solid Color All Match Stylish Leather Bag,Crossbody Bags
18,$18.99,$28.99,http://www.jollychic.com/p/men-s-crossbody-bag-casual-school-bag-g909922.html,Men's Crossbody Bag Casual School Bag,Crossbody Bags
17,$17.99,$26.99,http://www.jollychic.com/p/men-s-crossbody-bag-casual-school-casual-bag-g909924.html,Men's Crossbody Bag Casual School Casual Bag,Crossbody Bags
19,$15.99,$24.99,http://www.jollychic.com/p/men-s-crossbody-bag-pu-zipper-high-quality-stylish-bag-g933098.html,Men's Crossbody Bag PU Zipper High Quality Stylish Bag,Crossbody Bags
7,$11.99,$17.99,http://www.jollychic.com/p/men-s-crossbody-bag-canvas-zipper-high-quality-bag-g933142.html,Men's Crossbody Bag Canvas Zipper High Quality Bag,Crossbody Bags
2,$37.99,$59.00,http://www.jollychic.com/p/men-s-crossbody-bag-crocodile-print-business-crossbody-bag-g942644.html,Men's Crossbody Bag Crocodile Print Business Crossbody Bag,Crossbody Bags
9,$9.99,,http://www.jollychic.com/p/men-s-crossbody-bag-casual-print-canvas-crossbody-bag-g953348.html,Men's Crossbody Bag Casual Print Canvas Crossbody Bag,Crossbody Bags
8,$39.99,,http://www.jollychic.com/p/men-s-crossbody-bag-solid-color-durable-adjustable-strap-zipper-bag-g956524.html,Men's Crossbody Bag Solid Color Durable Adjustable Strap Zipper Bag,Crossbody Bags
8,$42.99,,http://www.jollychic.com/p/men-s-crossbody-bag-solid-color-business-casual-briefcase-fashion-bag-g956532.html,Men's Crossbody Bag Solid Color Business Casual Briefcase Fashion Bag,Crossbody Bags
2,$20.99,,http://www.jollychic.com/p/men-s-chest-bag-casual-zipper-adjustable-chest-bag-g957972.html,Men's Chest Bag Casual Zipper Adjustable Chest Bag,Crossbody Bags
39,$12.99,$21.99,http://www.jollychic.com/p/men-s-crossbody-bag-all-match-solid-simple-messenger-casual-bag-g958042.html,Men's Crossbody Bag All Match Solid Simple Messenger Casual Bag,Crossbody Bags
1,$20.99,,http://www.jollychic.com/p/men-s-crossbody-bag-zipper-vintage-unisex-durable-unisex-bag-g963064.html,Men's Crossbody Bag Zipper Vintage Unisex Durable Unisex Bag,Crossbody Bags
15,$20.99,,http://www.jollychic.com/p/men-s-crossbody-bag-zipper-vintage-brief-all-match-unisex-durable-bag-g963074.html,Men's Crossbody Bag Zipper Vintage Brief All Match Unisex Durable Bag,Crossbody Bags
9,$20.99,,http://www.jollychic.com/p/men-s-crossbody-bag-nylon-zipper-solid-color-all-match-unisex-bag-g963102.html,Men's Crossbody Bag Nylon Zipper Solid Color All Match Unisex Bag,Crossbody Bags
1,$17.99,,http://www.jollychic.com/p/men-s-chest-bag-nylon-casual-zipper-all-match-unisex-bag-g963844.html,Men's Chest Bag Nylon Casual Zipper All Match Unisex Bag,Crossbody Bags
18,$6.99,$8.99,http://www.jollychic.com/p/men-s-chest-bag-waterproof-professional-zipper-outdoor-sports-bag-g974124.html,Men's Chest Bag Waterproof Professional Zipper Outdoor Sports Bag,Crossbody Bags
16,$15.99,$23.99,http://www.jollychic.com/p/men-s-crossbody-bag-zipper-retro-casual-nylon-bag-g980992.html,Men's Crossbody Bag Zipper Retro Casual Nylon Bag,Crossbody Bags
7,$10.99,$21.99,http://www.jollychic.com/p/men-s-crossbody-bag-retro-multilayer-canvas-zipper-bag-g981010.html,Men's Crossbody Bag Retro Multilayer Canvas Zipper Bag,Crossbody Bags
2,$7.99,$11.99,http://www.jollychic.com/p/men-s-crossbody-bag-simple-retro-style-solid-color-canvas-bag-g996044.html,Men's Crossbody Bag Simple Retro Style Solid Color Canvas Bag,Crossbody Bags
2,$11.99,,http://www.jollychic.com/p/men-s-crossbody-bag-casual-fashion-durable-waterproof-bag-g996050.html,Men's Crossbody Bag Casual Fashion Durable Waterproof Bag,Crossbody Bags
2,$9.99,$14.99,http://www.jollychic.com/p/men-s-crossbody-bag-personality-nylon-solid-color-multifunctional-bag-g996088.html,Men's Crossbody Bag Personality Nylon Solid Color Multifunctional Bag,Crossbody Bags
55,$13.99,$21.99,http://www.jollychic.com/p/men-s-crossbody-bag-zipper-casual-all-match-durable-bag-g1005574.html,Men's Crossbody Bag Zipper Casual All Match Durable Bag,Crossbody Bags
1,$17.99,$26.99,http://www.jollychic.com/p/men-s-chest-bag-faux-leather-multilayer-zipper-all-match-stylish-bag-g1030238.html,Men's Chest Bag Faux Leather Multilayer Zipper All Match Stylish Bag,Crossbody Bags
6,$19.99,$29.99,http://www.jollychic.com/p/men-s-crossbody-bag-canvas-casual-all-match-stylish-bag-g1041650.html,Men's Crossbody Bag Canvas Casual All Match Stylish Bag,Crossbody Bags
25,$9.99,$15.99,http://www.jollychic.com/p/men-s-crossbody-bag-zipper-casual-color-block-all-match-durable-bag-g1041656.html,Men's Crossbody Bag Zipper Casual Color Block All Match Durable Bag,Crossbody Bags
11,$32.99,,http://www.jollychic.com/p/men-s-chest-bag-canvas-zipper-vintage-durable-bag-g1094428.html,Men's Chest Bag Canvas Zipper Vintage Durable Bag,Crossbody Bags
3,$6.99,$10.99,http://www.jollychic.com/p/men-s-crossbody-bag-trend-patchwork-color-fashion-light-bag-g1114116.html,Men's Crossbody Bag Trend Patchwork Color Fashion Light Bag,Crossbody Bags
3,$24.99,,http://www.jollychic.com/p/men-s-crossbody-bag-stylish-business-multifunctional-solid-color-bag-g1195038.html,Men's Crossbody Bag Stylish Business Multifunctional Solid Color Bag,Crossbody Bags
3,$18.99,,http://www.jollychic.com/p/men-s-crossbody-bag-zipper-casual-all-match-durable-bag-g1215804.html,Men's Crossbody Bag Zipper Casual All Match Durable Bag,Crossbody Bags
1,$15.99,$24.99,http://www.jollychic.com/p/men-s-chest-bag-2pcs-trendy-solid-color-durable-light-weight-bag-g1227970.html,Men's Chest Bag 2Pcs Trendy Solid Color Durable Light Weight Bag,Crossbody Bags
0,$27.99,,http://www.jollychic.com/p/men-s-crossbody-bag-all-match-zipper-casual-durable-bag-g1235168.html,Men's Crossbody Bag All Match Zipper Casual Durable Bag,Crossbody Bags
1,$16.99,,http://www.jollychic.com/p/men-s-crossbody-bag-zipper-casual-all-match-durable-bag-g1235180.html,Men's Crossbody Bag Zipper Casual All Match Durable Bag,Crossbody Bags
0,$21.99,,http://www.jollychic.com/p/men-s-crossbody-bag-fabric-zipper-all-match-casual-bag-g1239068.html,Men's Crossbody Bag Fabric Zipper All Match Casual Bag,Crossbody Bags
0,$36.99,,http://www.jollychic.com/p/men-s-crossbody-bag-casual-bussiness-simple-bag-g1242112.html,Men's Crossbody Bag Casual Bussiness Simple Bag,Crossbody Bags
0,$21.99,,http://www.jollychic.com/p/men-s-crossbody-bag-canvas-zipper-all-match-durable-bag-g1267676.html,Men's Crossbody Bag Canvas Zipper All Match Durable Bag,Crossbody Bags
0,$21.99,,http://www.jollychic.com/p/men-s-crossbody-bag-canvas-solid-color-large-capacity-durable-bag-g1279400.html,Men's Crossbody Bag Canvas Solid Color Large Capacity Durable Bag,Crossbody Bags
2,$22.99,,http://www.jollychic.com/p/men-s-crossbody-bag-canvas-solid-color-durable-bag-g1279402.html,Men's Crossbody Bag Canvas Solid Color Durable Bag,Crossbody Bags
1414,$9.99,$14.99,http://www.jollychic.com/p/men-s-crossbody-bag-canvas-zipper-fashion-design-functional-chest-bag-g558312.html,Men's Crossbody Bag Canvas Zipper Fashion Design Functional Chest Bag,Crossbody Bags
92,$6.99,$11.99,http://www.jollychic.com/p/men-s-crossbody-bag-canvas-casual-all-match-stylish-bag-g577036.html,Men's Crossbody Bag Canvas Casual All Match Stylish Bag,Crossbody Bags
61,$20.99,$29.99,http://www.jollychic.com/p/men-s-bags-5pcs-neutral-gender-style-cute-cartoon-pattern-bag-g598836.html,Men's Bags 5Pcs Neutral Gender Style Cute Cartoon Pattern Bag,Crossbody Bags
78,$9.99,$15.99,http://www.jollychic.com/p/men-s-crossbody-bag-leather-three-zip-pockets-functional-retro-bag-g673404.html,Men's Crossbody Bag Leather Three Zip Pockets Functional Retro Bag,Crossbody Bags
12,$20.99,$32.99,http://www.jollychic.com/p/men-s-crossbody-bag-solid-color-all-match-pu-leather-business-bag-g674270.html,Men's Crossbody Bag Solid Color All Match PU Leather Business Bag,Crossbody Bags
27,$9.99,$15.99,http://www.jollychic.com/p/men-s-crossbody-bag-vintage-solid-color-pu-zipper-bag-g691108.html,Men's Crossbody Bag Vintage Solid Color PU Zipper Bag,Crossbody Bags
12,$15.99,,http://www.jollychic.com/p/men-s-crossbody-bag-pu-style-retro-casual-all-match-bag-g691110.html,Men's Crossbody Bag PU Style Retro Casual All Match Bag,Crossbody Bags
15,$24.99,$38.99,http://www.jollychic.com/p/men-s-crossbody-bag-solid-color-pu-leisure-durable-bag-g725128.html,Men's Crossbody Bag Solid Color PU Leisure Durable Bag,Crossbody Bags
13,$30.99,$46.99,http://www.jollychic.com/p/men-s-crossbody-bag-pu-solid-color-high-quality-bag-g725132.html,Men's Crossbody Bag PU Solid Color High Quality Bag,Crossbody Bags
80,$8.99,$15.99,http://www.jollychic.com/p/men-s-canvas-bag-multi-pockets-adjustable-strap-useful-crossbody-bag-g753340.html,Men's Canvas Bag Multi Pockets Adjustable Strap Useful Crossbody Bag,Crossbody Bags
24,$11.99,$19.99,http://www.jollychic.com/p/men-s-crossbody-bag-casual-solid-color-zipper-chest-bag-g790834.html,Men's Crossbody Bag Casual Solid Color Zipper Chest Bag,Crossbody Bags
13,$10.99,$16.99,http://www.jollychic.com/p/men-s-crossbody-bag-nylon-zipper-solid-color-multilayer-all-match-bag-g793460.html,Men's Crossbody Bag Nylon Zipper Solid Color Multilayer All Match Bag,Crossbody Bags
7,$11.99,$19.99,http://www.jollychic.com/p/men-s-crossbody-bag-solid-color-zipper-design-durable-chest-bag-g793652.html,Men's Crossbody Bag Solid Color Zipper Design Durable Chest Bag,Crossbody Bags
4,$20.99,$31.99,http://www.jollychic.com/p/men-s-crossbody-bag-canvas-casual-outdoor-durable-crossbody-bag-g818904.html,Men's Crossbody Bag Canvas Casual Outdoor Durable Crossbody Bag,Crossbody Bags
6,$41.99,$64.00,http://www.jollychic.com/p/men-s-crossbody-bag-canvas-zipper-all-match-high-quality-bag-g819480.html,Men's Crossbody Bag Canvas Zipper All Match High Quality Bag,Crossbody Bags
0,$79.00,,http://www.jollychic.com/p/zooler-men-s-crossbody-bag-solid-color-simple-style-chest-bag-g866364.html,ZOOLER Men's Crossbody Bag Solid Color Simple Style Chest Bag,Crossbody Bags
11,$36.99,$57.00,http://www.jollychic.com/p/men-s-crossbody-bag-multi-function-solid-color-vintage-laptop-bag-g882728.html,Men's Crossbody Bag Multi-Function Solid Color Vintage Laptop Bag,Crossbody Bags
3,$52.00,$80.00,http://www.jollychic.com/p/vegoo-men-s-crossbody-bag-solid-color-leather-all-match-business-bag-g908292.html,VEGOO Men's Crossbody Bag Solid Color Leather All Match Business Bag,Crossbody Bags
7,$16.99,$26.99,http://www.jollychic.com/p/men-s-crossbody-bag-simple-fashion-solid-genuine-leather-all-match-casual-bag-g914692.html,Men's Crossbody Bag Simple Fashion Solid Genuine Leather All Match Casual Bag,Crossbody Bags
1,$37.99,$59.00,http://www.jollychic.com/p/men-s-chest-bag-retro-style-solid-color-business-chest-bag-g942656.html,Men's Chest Bag Retro Style Solid Color Business Chest Bag,Crossbody Bags
33,$4.99,$6.99,http://www.jollychic.com/p/men-s-crossbody-bag-vintage-square-shape-stylish-canvas-crossbody-bag-g951670.html,Men's Crossbody Bag Vintage Square Shape Stylish Canvas Crossbody Bag,Crossbody Bags
31,$9.99,$15.99,http://www.jollychic.com/p/men-s-crossbody-bag-brief-design-solid-color-functional-canvas-bag-g951806.html,Men's Crossbody Bag Brief Design Solid Color Functional Canvas Bag,Crossbody Bags
14,$13.99,$20.99,http://www.jollychic.com/p/men-s-crossbody-bag-fashion-briefcase-casual-all-match-bag-g956534.html,Men's Crossbody Bag Fashion Briefcase Casual All Match Bag,Crossbody Bags
1,$20.99,,http://www.jollychic.com/p/men-s-crossbody-bag-nylon-fashionable-zipper-durable-bag-g963086.html,Men's Crossbody Bag Nylon Fashionable Zipper Durable Bag,Crossbody Bags
13,$15.99,,http://www.jollychic.com/p/men-s-crossbody-bag-stylish-design-zipper-chic-bag-g963110.html,Men's Crossbody Bag Stylish Design Zipper Chic Bag,Crossbody Bags
6,$20.99,,http://www.jollychic.com/p/men-s-crossbody-bag-nylon-high-quality-functional-bag-g964472.html,Men's Crossbody Bag Nylon High Quality Functional Bag,Crossbody Bags
5,$17.99,,http://www.jollychic.com/p/men-s-crossbody-bag-high-quality-functional-durable-chic-bag-g964500.html,Men's Crossbody Bag High Quality Functional Durable Chic Bag,Crossbody Bags
12,$9.99,$14.99,http://www.jollychic.com/p/men-s-crossbody-bag-canvas-high-capacity-bag-g964670.html,Men's Crossbody Bag Canvas High Capacity Bag,Crossbody Bags
19,$16.99,$25.99,http://www.jollychic.com/p/men-s-crossbody-bag-oxford-outdoor-sporty-bottle-pocket-kettle-pouch-single-shoulder-bag-g987304.html,Men's Crossbody Bag Oxford Outdoor Sporty Bottle Pocket Kettle Pouch Single Shoulder Bag,Crossbody Bags
4,$11.99,$18.99,http://www.jollychic.com/p/men-s-crossbody-bag-zipper-hasp-solid-casual-all-match-stylish-bag-g1007600.html,Men's Crossbody Bag Zipper Hasp Solid Casual All Match Stylish Bag,Crossbody Bags
3,$13.99,$21.99,http://www.jollychic.com/p/men-s-chest-bag-trend-portable-casual-solid-color-chic-bag-g1017948.html,Men's Chest Bag Trend Portable Casual Solid Color Chic Bag,Crossbody Bags
0,$19.99,$36.99,http://www.jollychic.com/p/men-s-crossbody-bag-zipper-casual-all-match-durable-bag-g1027164.html,Men's Crossbody Bag Zipper Casual All Match Durable Bag,Crossbody Bags
2,$18.99,$29.99,http://www.jollychic.com/p/men-s-chest-bag-trendy-large-capacity-solid-canvas-casual-bag-g1063100.html,Men's Chest Bag Trendy Large Capacity Solid Canvas Casual Bag,Crossbody Bags
2,$13.99,$21.99,http://www.jollychic.com/p/men-s-crossbody-bag-zipper-casual-all-match-durable-chest-bag-g1063102.html,Men's Crossbody Bag Zipper Casual All Match Durable Chest Bag,Crossbody Bags
1,$13.99,$21.99,http://www.jollychic.com/p/men-s-crossbody-bag-zipper-casual-all-match-durable-bag-g1215810.html,Men's Crossbody Bag Zipper Casual All Match Durable Bag,Crossbody Bags
1,$25.99,,http://www.jollychic.com/p/men-s-bags-set-2-pcs-durable-wallet-attached-stylish-solid-zipper-design-crossbody-bag-set-g1216404.html,Men's Bags Set 2 Pcs Durable Wallet Attached Stylish Solid Zipper Design Crossbody Bag Set,Crossbody Bags
0,$30.99,,http://www.jollychic.com/p/men-s-chest-bag-casual-cycling-business-solid-color-bag-g1227980.html,Men's Chest Bag Casual Cycling Business Solid Color Bag,Crossbody Bags
0,$12.99,,http://www.jollychic.com/p/men-s-crossbody-bag-zipper-casual-all-match-durable-bag-g1235172.html,Men's Crossbody Bag Zipper Casual All Match Durable Bag,Crossbody Bags
0,$55.00,,http://www.jollychic.com/p/men-s-crossbody-bag-casual-business-messenger-patchwork-bags-g1252280.html,Men's Crossbody Bag Casual Business Messenger Patchwork Bags,Crossbody Bags
0,$18.99,,http://www.jollychic.com/p/men-s-crossbody-bag-pu-solid-color-stylish-durable-bag-g1267700.html,Men's Crossbody Bag PU Solid Color Stylish Durable Bag,Crossbody Bags
0,$22.99,,http://www.jollychic.com/p/men-s-crossbody-bag-sports-cycling-leisure-canvas-solid-color-bag-g1289508.html,Men's Crossbody Bag Sports Cycling Leisure Canvas Solid Color Bag,Crossbody Bags
63,$34.99,$45.99,http://www.jollychic.com/p/men-s-crossbody-bag-solid-color-multilayer-casual-cozy-bag-g411264.html,Men's Crossbody Bag Solid Color Multilayer Casual Cozy Bag,Crossbody Bags
54,$16.99,$25.99,http://www.jollychic.com/p/men-s-crossbody-bag-high-quality-stylish-solid-color-pu-bag-g556932.html,Men's Crossbody Bag High Quality Stylish Solid Color PU Bag,Crossbody Bags
272,$5.99,$9.99,http://www.jollychic.com/p/men-s-crossbody-bag-canvas-mini-casual-fashion-bag-g577022.html,Men's Crossbody Bag Canvas Mini Casual Fashion Bag,Crossbody Bags
45,$25.99,$37.99,http://www.jollychic.com/p/men-s-crossbody-bag-crocodile-pattern-casual-solid-color-bag-g591458.html,Men's Crossbody Bag Crocodile Pattern Casual Solid Color Bag,Crossbody Bags
429,$9.99,$13.99,http://www.jollychic.com/p/men-s-crossbody-bag-fine-design-canvas-casual-chest-bag-g679526.html,Men's Crossbody Bag Fine Design Canvas Casual Chest Bag,Crossbody Bags
81,$8.99,$13.99,http://www.jollychic.com/p/men-s-crossbody-bag-casual-durable-stylish-cozy-chest-bag-g679530.html,Men's Crossbody Bag Casual Durable Stylish Cozy Chest Bag,Crossbody Bags
16,$5.99,$9.99,http://www.jollychic.com/p/men-s-backpack-patchwork-color-block-fashion-waterproof-bag-g679982.html,Men's Backpack Patchwork Color Block Fashion Waterproof Bag,Crossbody Bags
5,$17.99,$30.99,http://www.jollychic.com/p/men-s-crossbody-bag-multi-color-all-match-fashion-durable-chest-bag-g730814.html,Men's Crossbody Bag Multi-Color All Match Fashion Durable Chest Bag,Crossbody Bags
16,$23.99,,http://www.jollychic.com/p/men-s-crossbody-bag-vintage-all-match-classical-casual-functional-bag-g731448.html,Men's Crossbody Bag Vintage All Match Classical Casual Functional Bag,Crossbody Bags
2,$21.99,$33.99,http://www.jollychic.com/p/men-s-crossbody-bag-pu-zipper-vintage-soft-all-match-bag-g733588.html,Men's Crossbody Bag PU Zipper Vintage Soft All Match Bag,Crossbody Bags
59,$14.99,$22.99,http://www.jollychic.com/p/men-s-crossbody-bag-simple-style-stylish-solid-color-bag-g778048.html,Men's Crossbody Bag Simple Style Stylish Solid Color Bag,Crossbody Bags
8,$64.00,$99.00,http://www.jollychic.com/p/men-s-crossbody-bag-leather-preppy-high-quality-all-match-durable-bag-g821394.html,Men's Crossbody Bag Leather Preppy High Quality All-Match Durable Bag,Crossbody Bags
3,$13.99,$21.99,http://www.jollychic.com/p/men-s-crossbody-bag-canvas-zipper-print-casual-all-match-stylish-bag-g893508.html,Men's Crossbody Bag Canvas Zipper Print Casual All Match Stylish Bag,Crossbody Bags
11,$26.99,,http://www.jollychic.com/p/men-s-crossbody-bag-casual-travel-bag-g909926.html,Men's Crossbody Bag Casual Travel Bag,Crossbody Bags
0,$29.99,,http://www.jollychic.com/p/men-s-crossbody-bag-pu-casual-all-match-durable-bag-g951694.html,Men's Crossbody Bag PU Casual All Match Durable Bag,Crossbody Bags
6,$39.99,,http://www.jollychic.com/p/men-s-crossbody-bag-solid-color-layered-zipper-messenger-bag-g956522.html,Men's Crossbody Bag Solid Color Layered Zipper Messenger Bag,Crossbody Bags
33,$8.99,,http://www.jollychic.com/p/men-s-crossbody-bag-simple-casual-multipurpose-chest-bag-g959830.html,Men's Crossbody Bag Simple Casual Multipurpose Chest Bag,Crossbody Bags
2,$17.99,,http://www.jollychic.com/p/men-s-crossbody-bag-zipper-vintage-functional-unisex-stylish-durable-bag-g963068.html,Men's Crossbody Bag Zipper Vintage Functional Unisex Stylish Durable Bag,Crossbody Bags
8,$17.99,,http://www.jollychic.com/p/men-s-crossbody-bag-colorblock-attractive-chic-zipper-durable-unisex-bag-g963088.html,Men's Crossbody Bag Colorblock Attractive Chic Zipper Durable Unisex Bag,Crossbody Bags
10,$10.99,,http://www.jollychic.com/p/men-s-crossbody-bag-interior-compartment-vintage-bag-g964236.html,Men's Crossbody Bag Interior Compartment Vintage Bag,Crossbody Bags
9,$18.99,$29.99,http://www.jollychic.com/p/men-s-crossbody-bag-canvas-zipper-stylish-breathable-bag-g1067822.html,Men's Crossbody Bag Canvas Zipper Stylish Breathable Bag,Crossbody Bags
3,$34.99,$54.00,http://www.jollychic.com/p/men-s-chest-bag-fashion-water-drop-shape-stylish-multifunctional-bag-g1078642.html,Men's Chest Bag Fashion Water Drop Shape Stylish Multifunctional Bag,Crossbody Bags
6,$11.99,$17.99,http://www.jollychic.com/p/men-s-chest-bag-solid-canvas-multifunctional-casual-bag-g1078718.html,Men's Chest Bag Solid Canvas Multifunctional Casual Bag,Crossbody Bags
7,$13.99,$23.99,http://www.jollychic.com/p/men-s-crossbody-bag-solid-color-simple-style-durable-bag-g1135270.html,Men's Crossbody Bag Solid Color Simple Style Durable Bag,Crossbody Bags
4,$8.99,$13.99,http://www.jollychic.com/p/men-s-chest-bag-canvas-zipper-all-match-casual-stylish-bag-g1152684.html,Men's Chest Bag Canvas Zipper All Match Casual Stylish Bag,Crossbody Bags
0,$30.99,,http://www.jollychic.com/p/men-s-crossbody-bag-zipper-casual-durable-all-match-stylish-bag-g1183728.html,Men's Crossbody Bag Zipper Casual Durable All Match Stylish Bag,Crossbody Bags
0,$24.99,,http://www.jollychic.com/p/men-s-crossbody-bag-zipper-casual-all-match-durable-bag-g1200392.html,Men's Crossbody Bag Zipper Casual All Match Durable Bag,Crossbody Bags
2,$23.99,,http://www.jollychic.com/p/men-s-crossbody-bag-canvas-zipper-casual-all-match-stylish-bag-g1215806.html,Men's Crossbody Bag Canvas Zipper Casual All Match Stylish Bag,Crossbody Bags
0,$166.00,,http://www.jollychic.com/p/ts-men-s-crossbady-bag-stylish-solid-color-all-match-cover-design-bag-g1216340.html,TS Men's Crossbady Bag Stylish Solid Color All Match Cover Design Bag,Crossbody Bags
1,$12.99,,http://www.jollychic.com/p/men-s-crossbody-bag-zipper-casual-all-match-durable-bag-g1235178.html,Men's Crossbody Bag Zipper Casual All Match Durable Bag,Crossbody Bags
0,$20.99,,http://www.jollychic.com/p/men-s-crossbody-bag-interior-slot-pocket-solid-color-canvas-bag-g1261680.html,Men's Crossbody Bag Interior Slot Pocket Solid Color Canvas Bag,Crossbody Bags
1,$18.99,,http://www.jollychic.com/p/men-s-crossbody-bag-faux-leather-all-match-leisure-bag-g1267688.html,Men's Crossbody Bag Faux Leather All Match Leisure Bag,Crossbody Bags
0,$18.99,,http://www.jollychic.com/p/men-s-crossbody-bag-faux-leather-zipper-stylish-bag-g1279568.html,Men's Crossbody Bag Faux Leather Zipper Stylish Bag,Crossbody Bags
1,$23.99,,http://www.jollychic.com/p/men-s-crossbody-bag-solid-color-casual-cycling-vintage-canvas-bag-g1289504.html,Men's Crossbody Bag Solid Color Casual Cycling Vintage Canvas Bag,Crossbody Bags
261,$8.99,$15.99,http://www.jollychic.com/p/men-s-crossbody-bag-solid-color-fashion-functional-casual-pattern-bag-g431298.html,Men's Crossbody Bag Solid Color Fashion Functional Casual Pattern Bag,Crossbody Bags
126,$16.99,$29.99,http://www.jollychic.com/p/men-s-crossbody-bag-top-fashion-pu-waterproof-durable-chest-bag-g449456.html,Men's Crossbody Bag Top Fashion PU Waterproof Durable Chest Bag,Crossbody Bags
597,$9.99,$15.99,http://www.jollychic.com/p/men-s-crossbody-bag-canvas-casual-outdoor-vogue-fashion-functional-bag-g558310.html,Men's Crossbody Bag Canvas Casual Outdoor Vogue Fashion Functional Bag,Crossbody Bags
29,$8.99,$14.99,http://www.jollychic.com/p/men-s-crossbody-bag-classic-all-match-zipper-durable-bag-g577018.html,Men's Crossbody Bag Classic All Match Zipper Durable Bag,Crossbody Bags
90,$16.99,$21.99,http://www.jollychic.com/p/men-s-crossbody-bag-pu-solid-color-casual-durable-bag-g658790.html,Men's Crossbody Bag PU Solid Color Casual Durable Bag,Crossbody Bags
155,$14.99,$21.99,http://www.jollychic.com/p/men-s-crossbody-bag-brief-vintage-durable-bag-g658792.html,Men's Crossbody Bag Brief Vintage Durable Bag,Crossbody Bags
48,$9.99,$16.99,http://www.jollychic.com/p/men-s-crossbody-bag-patchwork-zipper-casual-chest-bag-g658796.html,Men's Crossbody Bag Patchwork Zipper Casual Chest Bag,Crossbody Bags
64,$11.99,$20.99,http://www.jollychic.com/p/men-s-crossbody-bag-cross-section-zip-retro-leather-office-bag-g673168.html,Men's Crossbody Bag Cross Section Zip Retro Leather Office Bag,Crossbody Bags
98,$13.99,$21.99,http://www.jollychic.com/p/men-s-crossbody-bag-business-solid-color-brief-style-durable-bag-g679512.html,Men's Crossbody Bag Business Solid Color Brief Style Durable Bag,Crossbody Bags
33,$25.99,$47.99,http://www.jollychic.com/p/men-s-crossbody-bag-pu-all-match-casual-stylish-bag-g690904.html,Men's Crossbody Bag PU All Match Casual Stylish Bag,Crossbody Bags
67,$17.99,$27.99,http://www.jollychic.com/p/men-s-crossbody-bag-pu-business-casual-durable-bag-g729386.html,Men's Crossbody Bag PU Business Casual Durable Bag,Crossbody Bags
6,$19.99,$32.99,http://www.jollychic.com/p/men-s-crossbody-bag-all-match-casual-durable-trendy-chic-chest-bag-g730802.html,Men's Crossbody Bag All Match Casual Durable Trendy Chic Chest Bag,Crossbody Bags
3,$18.99,$31.99,http://www.jollychic.com/p/men-s-crossbody-bag-multi-functional-all-match-casual-sling-bag-g730960.html,Men's Crossbody Bag Multi-Functional All Match Casual Sling Bag,Crossbody Bags
24,$15.99,$23.99,http://www.jollychic.com/p/men-s-crossbody-bag-retro-casual-pu-leather-zipper-all-match-casual-bag-g731282.html,Men's Crossbody Bag Retro Casual PU Leather Zipper All Match Casual Bag,Crossbody Bags
20,$13.99,$21.99,http://www.jollychic.com/p/men-s-crossbody-bag-pu-zipper-casual-comfy-bag-g733584.html,Men's Crossbody Bag PU Zipper Casual Comfy Bag,Crossbody Bags
41,$22.99,,http://www.jollychic.com/p/men-s-crossbody-bag-business-solid-color-leisure-bag-g778046.html,Men's Crossbody Bag Business Solid Color Leisure Bag,Crossbody Bags
3,$26.99,$41.99,http://www.jollychic.com/p/men-s-crossbody-bag-mini-design-casual-nylon-multi-function-chest-bag-g823148.html,Men's Crossbody Bag Mini Design Casual Nylon Multi-Function Chest Bag,Crossbody Bags
20,$24.99,$37.99,http://www.jollychic.com/p/men-s-crossbody-bag-casual-versatile-all-match-durable-chest-bag-g827332.html,Men's Crossbody Bag Casual Versatile All Match Durable Chest Bag,Crossbody Bags
13,$24.99,$39.99,http://www.jollychic.com/p/men-s-crossbody-bag-trend-camouflage-lightweight-chest-bag-g850302.html,Men's Crossbody Bag Trend Camouflage Lightweight Chest Bag,Crossbody Bags
20,$35.99,$91.00,http://www.jollychic.com/p/zooler-men-s-crossbody-bag-zipper-design-durable-solid-color-bag-g866330.html,ZOOLER Men's Crossbody Bag Zipper Design Durable Solid Color Bag,Crossbody Bags
