add_wish,discount_price,original_price,product_link,product_name,header_block
1,$20.99,$31.99,https://www.jollychic.com/p/zhuowolves-men-s-sweater-solid-color-all-match-casual-pullover-g1245826.html,Zhuowolves Men's Sweater Solid Color All Match Casual Pullover,Knitwear
2,$16.99,$26.99,https://www.jollychic.com/p/men-s-pullover-color-blocking-striped-chic-style-pullover-g1258276.html,Men's Pullover Color Blocking Striped Chic Style Pullover,Knitwear
0,$16.99,$26.99,https://www.jollychic.com/p/men-s-pullover-chic-style-solid-color-pullover-g1258468.html,Men's Pullover Chic Style Solid Color Pullover,Knitwear
5,$16.99,$26.99,https://www.jollychic.com/p/men-s-cardigans-all-match-solid-color-coat-g1258470.html,Men's Cardigans All Match Solid Color Coat,Knitwear
1,$43.99,,https://www.jollychic.com/p/men-s-sweater-o-neck-long-sleeve-stripes-comfy-all-match-pullover-g1259232.html,Men's Sweater O Neck Long Sleeve Stripes Comfy All Match Pullover,Knitwear
0,$43.99,,https://www.jollychic.com/p/men-s-sweater-o-neck-long-sleeve-solid-color-comfy-all-match-pullover-g1259234.html,Men's Sweater O Neck Long Sleeve Solid Color Comfy All Match Pullover,Knitwear
2,$44.99,$68.00,https://www.jollychic.com/p/men-s-sweater-o-neck-striped-long-sleeve-casual-comfy-pullover-g1276248.html,Men's Sweater O Neck Striped Long Sleeve Casual Comfy Pullover,Knitwear
0,$22.99,$37.99,https://www.jollychic.com/p/men-s-cardigan-all-match-school-style-chic-cardigan-g1276820.html,Men's Cardigan All Match School Style Chic Cardigan,Knitwear
1,$26.99,$44.99,https://www.jollychic.com/p/men-s-sweater-o-neck-plaid-pattern-color-block-casual-pullover-g1285188.html,Men's Sweater O Neck Plaid Pattern Color Block Casual Pullover,Knitwear
1,$29.99,$44.99,https://www.jollychic.com/p/men-s-pullover-solid-color-all-match-casual-style-pullover-g1289204.html,Men's Pullover Solid Color All Match Casual Style Pullover,Knitwear
0,$10.99,$33.99,https://www.jollychic.com/p/men-s-sweater-patchwork-color-long-sleeve-all-match-knitwear-g1295874.html,Men's Sweater Patchwork Color Long Sleeve All Match Knitwear,Knitwear
4,$30.99,,https://www.jollychic.com/p/men-s-sweater-o-neck-long-sleeve-plaid-stripe-comfy-pullover-g1303578.html,Men's Sweater O Neck Long Sleeve Plaid Stripe Comfy Pullover,Knitwear
6,$26.99,$44.99,https://www.jollychic.com/p/men-s-cardigan-loose-solid-color-buttons-long-sleeve-comfy-coat-g1305312.html,Men's Cardigan Loose Solid Color Buttons Long Sleeve Comfy Coat,Knitwear
0,$46.99,,https://www.jollychic.com/p/men-s-pullover-casual-solid-color-comfy-o-neck-stylish-sweater-g1307060.html,Men's Pullover Casual Solid Color Comfy O Neck Stylish Sweater,Knitwear
4,$15.99,$33.99,https://www.jollychic.com/p/men-s-sweater-solid-color-long-sleeve-o-neck-leisure-knitwear-g1318178.html,Men's Sweater Solid Color Long Sleeve O Neck Leisure Knitwear,Knitwear
2,$39.99,,https://www.jollychic.com/p/men-s-sweater-o-neck-solid-color-long-sleeve-casual-comfy-pullover-g1322392.html,Men's Sweater O Neck Solid Color Long Sleeve Casual Comfy Pullover,Knitwear
4,$46.99,,https://www.jollychic.com/p/men-s-cardigan-one-piece-layer-look-buttons-long-sleeve-comfy-coat-g1326278.html,Men's Cardigan One Piece Layer Look Buttons Long Sleeve Comfy Coat,Knitwear
0,$19.99,$30.99,https://www.jollychic.com/p/men-s-sweater-o-neck-plaid-pattern-color-block-casual-pullover-g1326296.html,Men's Sweater O Neck Plaid Pattern Color Block Casual Pullover,Knitwear
3,$36.99,,https://www.jollychic.com/p/men-s-sweater-o-neck-long-sleeve-striped-knitwear-g1329888.html,Men's Sweater O Neck Long Sleeve Striped Knitwear,Knitwear
3,$34.99,,https://www.jollychic.com/p/men-s-sweater-v-neck-long-sleeve-breathable-knitwear-g1329892.html,Men's Sweater V Neck Long Sleeve Breathable Knitwear,Knitwear
1,$38.99,,https://www.jollychic.com/p/men-s-sweater-casual-comfy-all-matched-print-fashion-pullover-g1333562.html,Men's Sweater Casual Comfy All Matched Print Fashion Pullover,Knitwear
3,$28.99,$46.99,https://www.jollychic.com/p/men-s-sweater-trendy-long-sleeve-o-neck-comfy-knitwear-g1334532.html,Men's Sweater Trendy Long Sleeve O Neck Comfy Knitwear,Knitwear
3,$36.99,,https://www.jollychic.com/p/men-s-sweater-o-neck-long-sleeve-geometric-pattern-chic-pullover-g1340686.html,Men's Sweater O Neck Long Sleeve Geometric Pattern Chic Pullover,Knitwear
4,$31.99,,https://www.jollychic.com/p/men-s-sweater-o-neck-striped-long-sleeve-casual-comfy-pullover-g1341964.html,Men's Sweater O Neck Striped Long Sleeve Casual Comfy Pullover,Knitwear
4,$40.99,,https://www.jollychic.com/p/men-s-pullover-casual-comfy-animal-preppy-all-matched-sweater-g1343238.html,Men's Pullover Casual Comfy Animal Preppy All Matched Sweater,Knitwear
2,$34.99,,https://www.jollychic.com/p/men-s-sweater-long-sleeve-simple-style-comfy-o-neck-knitwear-g1351054.html,Men's Sweater Long Sleeve Simple Style Comfy O Neck Knitwear,Knitwear
2,$19.99,$30.99,https://www.jollychic.com/p/men-s-sweater-striped-long-sleeve-casual-comfy-pullover-g1357964.html,Men's Sweater Striped Long Sleeve Casual Comfy Pullover,Knitwear
0,$36.99,,https://www.jollychic.com/p/men-s-sweater-casual-o-neck-color-block-all-matched-pullover-g1375894.html,Men's Sweater Casual O Neck Color Block All Matched Pullover,Knitwear
0,$36.99,,https://www.jollychic.com/p/men-s-sweater-fashion-casual-o-neck-color-block-all-matched-pullover-g1375896.html,Men's Sweater Fashion Casual O Neck Color Block All Matched Pullover,Knitwear
0,$27.99,,https://www.jollychic.com/p/men-s-sweater-color-blocking-warm-chic-sweater-g1381468.html,Men's Sweater Color Blocking Warm Chic Sweater,Knitwear
3,$36.99,,https://www.jollychic.com/p/men-s-sweater-comfy-casual-all-matched-striped-pullover-g1401330.html,Men's Sweater Comfy Casual All Matched Striped Pullover,Knitwear
13,$22.99,$34.99,https://www.jollychic.com/p/men-s-sweater-casual-solid-color-turtle-neck-all-match-long-sleeve-sweater-g1401698.html,Men's Sweater Casual Solid Color Turtle Neck All Match Long Sleeve Sweater,Knitwear
2,$18.99,$30.99,https://www.jollychic.com/p/men-s-pullover-comfy-solid-color-long-sleeve-pullover-g1402122.html,Men's Pullover Comfy Solid Color Long Sleeve Pullover,Knitwear
0,$52.00,,https://www.jollychic.com/p/men-s-cardigan-long-sleeve-solid-color-zipper-design-knitwear-g1405458.html,Men's Cardigan Long Sleeve Solid Color Zipper Design Knitwear,Knitwear
0,$40.99,,https://www.jollychic.com/p/men-s-sweater-holes-design-casual-long-sleeve-ventilate-knitwear-g1405556.html,Men's Sweater Holes Design Casual Long Sleeve Ventilate Knitwear,Knitwear
2,$25.99,$38.99,https://www.jollychic.com/p/men-s-sweater-warm-chic-style-casual-all-match-sweater-g1409288.html,Men's Sweater Warm Chic Style Casual All Match Sweater,Knitwear
0,$30.99,$46.99,https://www.jollychic.com/p/men-s-sweater-warm-chic-style-all-match-casual-sweater-g1409290.html,Men's Sweater Warm Chic Style All Match Casual Sweater,Knitwear
0,$22.99,$35.99,https://www.jollychic.com/p/men-s-sweater-striped-casual-warm-chic-sweater-g1409292.html,Men's Sweater Striped Casual Warm Chic Sweater,Knitwear
1,$23.99,$36.99,https://www.jollychic.com/p/men-s-sweater-warm-all-match-casual-sweater-g1409296.html,Men's Sweater Warm All Match Casual Sweater,Knitwear
1,$36.99,,https://www.jollychic.com/p/men-s-sweater-solid-color-all-march-turtle-neck-fashionable-casual-pullover-g1409604.html,Men's Sweater Solid Color All March Turtle Neck fashionable Casual Pullover,Knitwear
0,$38.99,,https://www.jollychic.com/p/men-s-sweater-all-match-solid-color-fashionable-casual-pullover-g1409616.html,Men's Sweater All Match Solid Color fashionable Casual Pullover,Knitwear
7,$30.99,$38.99,https://www.jollychic.com/p/men-s-sweater-stylish-print-all-match-chic-fashionable-casual-pullover-g1409618.html,Men's Sweater Stylish Print All Match Chic fashionable Casual Pullover,Knitwear
3,$33.99,,https://www.jollychic.com/p/men-s-sweater-color-block-warm-fashionable-casual-pullover-g1409652.html,Men's Sweater Color Block Warm fashionable Casual Pullover,Knitwear
5,$44.99,,https://www.jollychic.com/p/men-s-sweater-turtle-neck-solid-color-fashionable-casual-pullover-g1409736.html,Men's Sweater Turtle Neck Solid Color fashionable Casual Pullover,Knitwear
1,$39.99,,https://www.jollychic.com/p/men-s-sweater-turtle-neck-all-match-fashionable-casual-pullover-g1409738.html,Men's Sweater Turtle Neck All Match fashionable Casual Pullover,Knitwear
0,$44.99,,https://www.jollychic.com/p/men-s-sweater-flower-pattern-stylish-fashionable-casual-pullover-g1409744.html,Men's Sweater Flower Pattern Stylish Fashionable Casual Pullover,Knitwear
0,$16.99,$25.99,https://www.jollychic.com/p/men-s-sweater-striped-o-neck-long-sleeve-color-block-pullover-g1410588.html,Men's Sweater Striped O Neck Long Sleeve Color Block Pullover,Knitwear
5,$31.99,,https://www.jollychic.com/p/men-s-sweater-color-block-long-sleeve-simple-striped-knitwear-g1412092.html,Men's Sweater Color Block Long Sleeve Simple Striped Knitwear,Knitwear
8,$21.99,$35.99,https://www.jollychic.com/p/men-s-sweater-long-sleeve-solid-color-slim-cozy-knitwear-g1421502.html,Men's Sweater Long Sleeve Solid Color Slim Cozy Knitwear,Knitwear
5,$36.99,,https://www.jollychic.com/p/men-s-cardigan-solid-color-single-breasted-lightweight-knitwear-g1421640.html,Men's Cardigan Solid Color Single Breasted Lightweight Knitwear,Knitwear
3,$32.99,,https://www.jollychic.com/p/men-s-vest-sleeveless-solid-color-stylish-knitwear-g1421642.html,Men's Vest Sleeveless Solid Color Stylish Knitwear,Knitwear
0,$36.99,$56.00,https://www.jollychic.com/p/jasonwood-men-s-pullover-high-quality-all-match-stylish-fashion-causal-sweater-g1422218.html,Jasonwood Men's Pullover High Quality All Match Stylish Fashion Causal Sweater,Knitwear
0,$34.99,,https://www.jollychic.com/p/men-s-sweater-casual-striped-comfy-warm-sweater-g1424054.html,Men's Sweater Casual Striped Comfy Warm Sweater,Knitwear
3,$35.99,,https://www.jollychic.com/p/men-s-sweater-casual-all-matched-turtle-neck-solid-color-knitwear-g1424546.html,Men's Sweater Casual All Matched Turtle Neck Solid Color Knitwear,Knitwear
3,$26.99,$40.99,https://www.jollychic.com/p/men-s-sweater-color-block-all-match-fashion-casual-pullover-g1431562.html,Men's Sweater Color Block All Match Fashion Casual Pullover,Knitwear
1,$39.99,,https://www.jollychic.com/p/men-s-pullover-striped-comfortable-long-sleeve-knitwear-g1435962.html,Men's Pullover Striped Comfortable Long Sleeve Knitwear,Knitwear
3,$24.99,$44.99,https://www.jollychic.com/p/hstyle-men-s-stylish-pullover-fashion-casual-o-neck-sweater-g1452958.html,Hstyle Men's Stylish Pullover Fashion Casual O Neck Sweater,Knitwear
2,$23.99,$46.99,https://www.jollychic.com/p/hstyle-men-s-simple-pullover-all-match-loose-stylish-casual-sweater-g1452962.html,Hstyle Men's Simple Pullover All Match Loose Stylish Casual Sweater,Knitwear
2,$38.99,,https://www.jollychic.com/p/men-s-cardigan-all-match-hooded-brief-stylish-knitwear-g1459710.html,Men's Cardigan All Match Hooded Brief Stylish Knitwear,Knitwear
1,$25.99,,https://www.jollychic.com/p/men-s-sweater-cotton-blends-striped-o-neck-knitwear-g1469962.html,Men's Sweater Cotton Blends Striped O Neck Knitwear,Knitwear
0,$33.99,,https://www.jollychic.com/p/men-s-pullover-o-neck-striped-slim-cozy-knitwear-g1469976.html,Men's Pullover O Neck Striped Slim Cozy Knitwear,Knitwear
0,$38.99,,https://www.jollychic.com/p/men-s-sweater-patchwork-color-block-slim-o-neck-knitwear-g1473970.html,Men's Sweater Patchwork Color Block Slim O Neck Knitwear,Knitwear
2,$25.99,,https://www.jollychic.com/p/men-s-sweater-simple-breathable-o-neck-casual-slim-knitwear-g1508464.html,Men's Sweater Simple Breathable O Neck Casual Slim Knitwear,Knitwear
0,$25.99,,https://www.jollychic.com/p/men-s-sweater-casual-patchwork-color-long-sleeve-slim-knitwear-g1508480.html,Men's Sweater Casual Patchwork Color Long Sleeve Slim Knitwear,Knitwear
1,$38.99,,https://www.jollychic.com/p/men-s-pullover-all-match-color-block-comfy-patch-sweater-g1545578.html,Men's Pullover All Match Color Block Comfy Patch Sweater,Knitwear
1,$38.99,,https://www.jollychic.com/p/men-s-pullover-patch-all-match-color-block-comfy-chic-sweater-g1545580.html,Men's Pullover Patch All Match Color Block Comfy Chic Sweater,Knitwear
1,$44.99,,https://www.jollychic.com/p/men-s-simple-pullover-o-neck-cotton-knitted-all-match-sweater-g1547440.html,Men's Simple Pullover O Neck Cotton Knitted All Match Sweater,Knitwear
1,$42.99,,https://www.jollychic.com/p/men-s-cardigan-all-match-stylish-cardigan-g1575696.html,Men's Cardigan All Match Stylish Cardigan,Knitwear
80,$27.99,$42.99,https://www.jollychic.com/p/top-fashion-slim-pure-color-all-match-men-s-clothing-g373804.html,Top Fashion Slim Pure Color All Match Men's Clothing,Knitwear
170,$22.99,$25.99,https://www.jollychic.com/p/v-neck-cable-comfy-men-s-sweater-g375794.html,V Neck Cable Comfy Men's Sweater,Knitwear
2275,$20.99,,https://www.jollychic.com/p/men-s-knitwear-jacquard-o-neck-long-sleeve-soft-tops-g397192.html,Men's Knitwear Jacquard O Neck Long Sleeve Soft Tops,Knitwear
3126,$13.99,$20.99,https://www.jollychic.com/p/men-s-pullover-kartoon-print-soft-comfortable-o-neck-sweater-g397600.html,Men's Pullover Kartoon Print Soft Comfortable O Neck Sweater,Knitwear
1969,$10.99,$20.99,https://www.jollychic.com/p/men-s-knitwear-letter-print-simple-style-fashionable-sweater-g397824.html,Men's Knitwear Letter Print Simple Style Fashionable Sweater,Knitwear
14,$9.99,$37.99,https://www.jollychic.com/p/men-s-sweater-3d-print-slim-pullover-g416644.html,Men's Sweater 3D Print Slim Pullover,Knitwear
19,$33.99,,https://www.jollychic.com/p/men-s-pullover-simple-version-v-neck-long-sleeve-solid-casual-knitwear-g428736.html,Men's Pullover Simple Version V Neck Long Sleeve Solid Casual Knitwear,Knitwear
495,$11.99,$31.99,https://www.jollychic.com/p/men-s-cardigan-long-sleeve-solid-casual-style-comfortable-knitwear-g436652.html,Men's Cardigan Long Sleeve Solid Casual Style Comfortable Knitwear,Knitwear
55,$11.99,$30.99,https://www.jollychic.com/p/men-s-pullover-striped-patchwork-soft-casual-cozy-knitwear-g436660.html,Men's Pullover Striped Patchwork Soft Casual Cozy Knitwear,Knitwear
160,$12.99,$38.99,https://www.jollychic.com/p/men-s-cardigan-stylish-long-sleeve-zipper-casual-style-knitwear-g443988.html,Men's Cardigan Stylish Long Sleeve Zipper Casual Style Knitwear,Knitwear
24,$16.99,$37.99,https://www.jollychic.com/p/men-s-pullover-fashion-long-sleeve-o-neck-casual-knitwear-g454228.html,Men's Pullover Fashion Long Sleeve O Neck Casual Knitwear,Knitwear
36,$11.99,$30.99,https://www.jollychic.com/p/men-s-pullover-stylish-o-neck-slimmed-jacquard-knitwear-g471068.html,Men's Pullover Stylish O Neck Slimmed Jacquard Knitwear,Knitwear
118,$13.99,$34.99,https://www.jollychic.com/p/men-s-cardigan-sweater-fashion-patchwork-long-sleeve-knitwear-g471566.html,Men's Cardigan Sweater Fashion Patchwork Long Sleeve Knitwear,Knitwear
61,$10.99,$28.99,https://www.jollychic.com/p/men-s-pullover-sweater-fashion-o-neck-solid-long-sleeve-knitwear-g471674.html,Men's Pullover Sweater Fashion O Neck Solid Long Sleeve Knitwear,Knitwear
33,$74.00,,https://www.jollychic.com/p/men-s-sweater-o-neck-long-sleeve-casual-style-black-jacquard-knitwear-g472988.html,Men's Sweater O Neck Long Sleeve Casual Style Black Jacquard knitwear,Knitwear
17,$32.99,$71.00,https://www.jollychic.com/p/men-s-sweater-o-neck-long-sleeve-color-block-casual-style-slim-knitwear-g473782.html,Men's Sweater O Neck Long Sleeve Color Block Casual Style Slim Knitwear,Knitwear
29,$8.99,$22.99,https://www.jollychic.com/p/men-s-knitwear-solid-color-v-neck-long-sleeve-casual-slim-warm-sweater-g487684.html,Men's Knitwear Solid Color V Neck Long Sleeve Casual Slim Warm Sweater,Knitwear
21,$19.99,$30.99,https://www.jollychic.com/p/men-s-knitwear-fashion-casual-comfy-trendy-warm-striped-knitwear-g871926.html,Men's Knitwear Fashion Casual Comfy Trendy Warm Striped Knitwear,Knitwear
8,$18.99,$28.99,https://www.jollychic.com/p/men-s-knitwear-o-neck-color-block-long-sleeve-pullover-g878508.html,Men's Knitwear O Neck Color Block Long Sleeve Pullover,Knitwear
17,$19.99,$29.99,https://www.jollychic.com/p/men-s-cardigan-sweater-fashion-short-down-swallow-grid-weaving-coat-g903842.html,Men's Cardigan Sweater Fashion Short Down Swallow Grid Weaving Coat,Knitwear
4,$17.99,$30.99,https://www.jollychic.com/p/men-s-pullover-brief-button-design-all-match-fashion-leisure-sweaters-g939206.html,Men's Pullover Brief Button Design All Match Fashion Leisure Sweaters,Knitwear
21,$58.00,,https://www.jollychic.com/p/men-s-sweater-solid-color-all-match-warm-fashion-casual-pullovers-g953198.html,Men's Sweater Solid Color All Match Warm Fashion Casual Pullovers,Knitwear
20,$15.99,$28.99,https://www.jollychic.com/p/men-s-sweater-o-neck-long-sleeve-jacquard-casual-comfy-pullover-g969324.html,Men's Sweater O Neck Long Sleeve Jacquard Casual Comfy Pullover,Knitwear
24,$31.99,$47.99,https://www.jollychic.com/p/men-s-sweater-comfy-casual-patched-chic-warm-all-match-sweater-g994526.html,Men's Sweater Comfy Casual Patched Chic Warm All Match Sweater,Knitwear
19,$13.99,$20.99,https://www.jollychic.com/p/men-s-sweater-o-neck-long-sleeve-solid-color-extended-casual-pullover-g998602.html,Men's Sweater O Neck Long Sleeve Solid Color Extended Casual Pullover,Knitwear
93,$15.99,$22.99,https://www.jollychic.com/p/men-s-sweater-v-neck-long-sleeve-geometric-color-block-casual-pullover-g998706.html,Men's Sweater V Neck Long Sleeve Geometric Color Block Casual Pullover,Knitwear
15,$32.99,$46.99,https://www.jollychic.com/p/men-s-pullover-colorblock-patched-o-neck-long-sleeve-pullover-g999714.html,Men's Pullover Colorblock Patched O Neck Long Sleeve Pullover,Knitwear
25,$19.99,$33.99,https://www.jollychic.com/p/men-s-sweater-casual-comfy-chic-long-sleeve-feather-embroidery-pullover-g1009436.html,Men's Sweater Casual Comfy Chic Long Sleeve Feather Embroidery Pullover,Knitwear
35,$23.99,$36.99,https://www.jollychic.com/p/men-s-sweater-one-piece-layer-look-casual-slim-pullover-g1028302.html,Men's Sweater One Piece Layer Look Casual Slim Pullover,Knitwear
11,$23.99,$36.99,https://www.jollychic.com/p/men-s-sweater-stylish-striped-one-piece-layer-look-pullover-g1028304.html,Men's Sweater Stylish Striped One Piece Layer Look Pullover,Knitwear
6,$23.99,$36.99,https://www.jollychic.com/p/men-s-pullover-casual-striped-color-block-comfy-chic-all-matched-sweater-g1044682.html,Men's Pullover Casual Striped Color Block Comfy Chic All Matched Sweater,Knitwear
5,$22.99,$35.99,https://www.jollychic.com/p/men-s-pullover-cotton-blends-long-sleeve-simple-slim-knitwear-g1066296.html,Men's Pullover Cotton Blends Long Sleeve Simple Slim Knitwear,Knitwear
10,$21.99,$33.99,https://www.jollychic.com/p/men-s-pullover-long-sleeve-comforty-simple-striped-knitwear-g1066298.html,Men's Pullover Long Sleeve Comforty Simple Striped Knitwear,Knitwear
3,$23.99,$36.99,https://www.jollychic.com/p/men-s-sweater-o-neck-long-sleeve-patchwork-casual-comfy-pullover-g1081204.html,Men's Sweater O Neck Long Sleeve Patchwork Casual Comfy Pullover,Knitwear
4,$15.99,$22.99,https://www.jollychic.com/p/men-s-sweatshirts-solid-color-chic-all-match-sweatshirts-g1081464.html,Men's Sweatshirts Solid Color Chic All Match Sweatshirts,Knitwear
22,$18.99,$25.99,https://www.jollychic.com/p/men-s-sweatshirt-turtleneck-chic-warm-all-match-sweatshirt-g1081560.html,Men's Sweatshirt Turtleneck Chic Warm All Match Sweatshirt,Knitwear
7,$14.99,$27.99,https://www.jollychic.com/p/men-s-sweater-v-neck-long-sleeve-comfy-all-match-pullover-g1148554.html,Men's Sweater V Neck Long Sleeve Comfy All Match Pullover,Knitwear
7,$22.99,$35.99,https://www.jollychic.com/p/men-s-sweater-casual-long-sleeve-patchwork-color-simple-knitwear-g1156094.html,Men's Sweater Casual Long Sleeve Patchwork Color Simple Knitwear,Knitwear
0,$30.99,$52.00,https://www.jollychic.com/p/men-s-pullover-geometric-pattern-o-neck-long-sleeves-swearter-g1160102.html,Men's Pullover Geometric Pattern O Neck Long Sleeves Swearter,Knitwear
6,$15.99,$24.99,https://www.jollychic.com/p/men-s-sweater-v-neck-long-sleeve-comfy-all-match-pullover-g1160826.html,Men's Sweater V Neck Long Sleeve Comfy All Match Pullover,Knitwear
6,$26.99,,https://www.jollychic.com/p/men-s-vest-plaid-sleeveless-casual-stylish-vest-g1163686.html,Men's Vest Plaid Sleeveless Casual Stylish Vest,Knitwear
11,$27.99,$41.99,https://www.jollychic.com/p/men-s-sweater-o-neck-geometric-patchwork-color-knitwear-g1170680.html,Men's Sweater O Neck Geometric Patchwork Color Knitwear,Knitwear
6,$29.99,$44.99,https://www.jollychic.com/p/men-s-sweater-stylish-zipper-design-patchwork-color-knitwear-g1170698.html,Men's Sweater Stylish Zipper Design Patchwork Color Knitwear,Knitwear
8,$31.99,$48.99,https://www.jollychic.com/p/men-s-cardigan-long-sleeve-cross-pattern-casual-striped-knitwear-g1170724.html,Men's Cardigan Long Sleeve Cross Pattern Casual Striped Knitwear,Knitwear
7,$17.99,$26.99,https://www.jollychic.com/p/men-s-pullover-long-sleeve-simple-striped-design-comfy-knitwear-g1178606.html,Men's Pullover Long Sleeve Simple Striped Design Comfy Knitwear,Knitwear
4,$19.99,$32.99,https://www.jollychic.com/p/men-s-vests-all-match-chic-school-vintage-knitwear-g1182250.html,Men's Vests All Match Chic School Vintage Knitwear,Knitwear
22,$12.99,$30.99,https://www.jollychic.com/p/men-s-sweater-o-neck-long-sleeve-solid-color-comfy-all-match-pullover-g1195260.html,Men's Sweater O Neck Long Sleeve Solid Color Comfy All Match Pullover,Knitwear
1,$24.99,$38.99,https://www.jollychic.com/p/men-s-sweater-striped-o-neck-long-sleeve-fashion-comfy-sweater-g1203078.html,Men's Sweater Striped O Neck Long Sleeve Fashion Comfy Sweater,Knitwear
6,$12.99,$19.99,https://www.jollychic.com/p/men-s-knitwear-stripe-brief-style-fashion-all-match-casual-sweater-g1213354.html,Men's Knitwear Stripe Brief Style Fashion All Match Casual Sweater,Knitwear
0,$28.99,$43.99,https://www.jollychic.com/p/men-s-sweater-casual-slim-all-matched-patch-comfy-sweater-g1230352.html,Men's Sweater Casual Slim All Matched Patch Comfy Sweater,Knitwear
14,$30.99,$45.99,https://www.jollychic.com/p/men-s-sweater-patchwork-color-turtle-neck-letter-pattern-knitwear-g1238664.html,Men's Sweater Patchwork Color Turtle Neck Letter Pattern Knitwear,Knitwear
2,$22.99,$34.99,https://www.jollychic.com/p/men-s-sweater-color-block-all-matched-comfy-sweater-g1241386.html,Men's Sweater Color Block All Matched Comfy Sweater,Knitwear
0,$31.99,$47.99,https://www.jollychic.com/p/men-s-sweater-all-matched-color-block-comfy-sweater-g1241394.html,Men's Sweater All Matched Color Block Comfy Sweater,Knitwear
9,$28.99,$43.99,https://www.jollychic.com/p/men-s-sweater-all-matched-color-block-fashion-comfy-pullover-g1241396.html,Men's Sweater All Matched Color Block Fashion Comfy Pullover,Knitwear
21,$31.99,$53.00,https://www.jollychic.com/p/men-s-pullovers-color-pattern-printting-chic-pullovers-g1251126.html,Men's Pullovers Color Pattern Printting Chic Pullovers,Knitwear
4,$27.99,$41.99,https://www.jollychic.com/p/men-s-knitwear-casual-o-neck-long-sleeve-solid-color-pullover-g1255134.html,Men's Knitwear Casual O Neck Long Sleeve Solid Color Pullover,Knitwear
2,$16.99,$26.99,https://www.jollychic.com/p/men-s-vest-warm-sweatshirt-chic-all-match-vest-g1258280.html,Men's Vest Warm Sweatshirt Chic All Match Vest,Knitwear
1,$16.99,$26.99,https://www.jollychic.com/p/men-s-pullover-color-blocking-special-chic-sweatshirt-g1258282.html,Men's Pullover Color Blocking Special Chic Sweatshirt,Knitwear
2,$17.99,$26.99,https://www.jollychic.com/p/men-s-pullover-colorblocking-all-match-casual-style-pullover-g1258478.html,Men's Pullover Colorblocking All Match Casual Style Pullover,Knitwear
2,$27.99,$45.99,https://www.jollychic.com/p/men-s-sweater-color-block-casual-personality-long-sleeve-knitwear-g1274528.html,Men's Sweater Color Block Casual Personality Long Sleeve Knitwear,Knitwear
2,$44.99,$68.00,https://www.jollychic.com/p/men-s-sweater-o-neck-long-sleeve-solid-color-comfy-all-match-pullover-g1276250.html,Men's Sweater O Neck Long Sleeve Solid Color Comfy All Match Pullover,Knitwear
6,$17.99,$31.99,https://www.jollychic.com/p/men-s-pullover-solid-color-comfy-knitted-chic-sweater-g1277698.html,Men's Pullover Solid Color Comfy Knitted Chic Sweater,Knitwear
3,$13.99,$22.99,https://www.jollychic.com/p/men-s-pullover-color-all-match-winter-casual-style-pullover-g1288998.html,Men's Pullover Color All Match Winter Casual Style Pullover,Knitwear
2,$10.99,$26.99,https://www.jollychic.com/p/men-s-sweater-o-neck-classical-striped-long-sleeve-casual-comfy-pullover-g1289518.html,Men's Sweater O Neck Classical Striped Long Sleeve Casual Comfy Pullover,Knitwear
0,$36.99,,https://www.jollychic.com/p/men-s-sweater-o-neck-striped-long-sleeve-casual-comfy-pullover-g1322428.html,Men's Sweater O Neck Striped Long Sleeve Casual Comfy Pullover,Knitwear
2,$19.99,$30.99,https://www.jollychic.com/p/men-s-sweater-o-neck-long-sleeve-jacquard-casual-comfy-pullover-g1326290.html,Men's Sweater O Neck Long Sleeve Jacquard Casual Comfy Pullover,Knitwear
1,$30.99,,https://www.jollychic.com/p/men-s-sweater-casual-turn-down-collar-long-sleeve-knitwear-g1328114.html,Men's Sweater Casual Turn Down Collar Long Sleeve Knitwear,Knitwear
6,$40.99,,https://www.jollychic.com/p/men-s-sweater-casual-comfy-all-matched-stylish-pullover-g1333536.html,Men's Sweater Casual Comfy All Matched Stylish Pullover,Knitwear
3,$40.99,,https://www.jollychic.com/p/men-s-sweater-casual-comfy-print-all-matched-fashion-pullover-g1333558.html,Men's Sweater Casual Comfy Print All Matched Fashion Pullover,Knitwear
3,$38.99,,https://www.jollychic.com/p/men-s-sweater-fashion-o-neck-long-sleeve-solid-color-comfy-all-match-pullover-g1333690.html,Men's Sweater Fashion O Neck Long Sleeve Solid Color Comfy All Match Pullover,Knitwear
0,$30.99,,https://www.jollychic.com/p/men-s-pullover-color-blocking-all-match-casual-pullover-g1342530.html,Men's Pullover Color Blocking All Match Casual Pullover,Knitwear
