add_wish,discount_price,original_price,product_link,product_name,header_block
14,$21.99,$34.99,http://www.jollychic.com/p/jesun-s-men-s-polo-shirt-breathable-extended-short-sleeve-polo-shirt-g878768.html,JESUN'S Men's Polo Shirt Breathable Extended Short Sleeve Polo Shirt,Polo Shirts
30,$11.99,$18.99,http://www.jollychic.com/p/men-s-polo-shirt-turn-down-collar-short-sleeve-solid-color-polo-shirt-g967776.html,Men's Polo Shirt Turn Down Collar Short Sleeve Solid Color Polo Shirt,Polo Shirts
208,$6.99,$15.99,http://www.jollychic.com/p/men-s-polo-shirt-leisure-short-sleeve-striped-color-block-polo-shirt-g551628.html,Men's Polo Shirt Leisure Short Sleeve Striped Color Block Polo Shirt,Polo Shirts
584,$14.99,$19.99,http://www.jollychic.com/p/men-s-polo-shirt-short-sleeve-embroidery-solid-color-slim-fit-polo-shirt-g554480.html,Men's Polo Shirt Short Sleeve Embroidery Solid Color Slim Fit Polo Shirt,Polo Shirts
783,$12.99,$18.99,http://www.jollychic.com/p/men-s-polo-shirt-short-sleeve-fashion-print-casual-polo-shirt-g522476.html,Men's Polo Shirt Short Sleeve Fashion Print Casual Polo Shirt,Polo Shirts
1475,$11.99,$18.99,http://www.jollychic.com/p/men-s-polo-shirt-stand-collar-print-short-sleeve-polo-shirt-g640932.html,Men's Polo Shirt Stand Collar Print Short Sleeve Polo Shirt,Polo Shirts
180,$11.99,$15.99,http://www.jollychic.com/p/men-s-polo-shirt-short-sleeve-all-match-casual-polo-shirt-g543802.html,Men's Polo Shirt Short Sleeve All Match Casual Polo Shirt,Polo Shirts
8849,$15.99,$20.99,http://www.jollychic.com/p/men-s-polo-shirt-solid-color-casual-light-weight-long-sleeve-polo-shirt-g589594.html,Men's Polo Shirt Solid Color Casual Light Weight Long Sleeve Polo Shirt,Polo Shirts
3745,$15.99,$23.99,http://www.jollychic.com/p/men-s-polo-shirt-color-block-fashion-durable-cozy-polo-shirt-g453376.html,Men's Polo Shirt Color Block Fashion Durable Cozy Polo Shirt,Polo Shirts
6059,$10.99,$21.99,http://www.jollychic.com/p/slim-turn-down-color-block-long-sleeve-men-s-polo-shirt-g372478.html,Slim Turn Down Color Block Long Sleeve Men's Polo Shirt,Polo Shirts
3840,$11.99,$17.99,http://www.jollychic.com/p/men-s-polo-shirt-short-sleeve-simple-style-casual-comfortable-polo-shirt-g532320.html,Men's Polo Shirt Short Sleeve Simple Style Casual Comfortable Polo Shirt,Polo Shirts
915,$13.99,$20.99,http://www.jollychic.com/p/men-s-polo-shirt-solid-color-stand-collar-long-sleeve-slim-top-g766226.html,Men's Polo Shirt Solid Color Stand Collar Long Sleeve Slim Top,Polo Shirts
94,$13.99,$20.99,http://www.jollychic.com/p/men-s-polo-shirt-all-match-striped-short-sleeve-leisure-polo-shirt-g735382.html,Men's Polo Shirt All Match Striped Short Sleeve Leisure Polo Shirt,Polo Shirts
116,$5.99,$18.99,http://www.jollychic.com/p/men-s-polo-shirt-high-quality-fashion-cozy-polo-shirt-g545952.html,Men's Polo Shirt High Quality Fashion Cozy Polo Shirt,Polo Shirts
4579,$10.99,$15.99,http://www.jollychic.com/p/men-s-polo-shirt-stand-collar-simple-style-casual-cozy-polo-shirt-g572220.html,Men's Polo Shirt Stand Collar Simple Style Casual Cozy Polo Shirt,Polo Shirts
253,$6.99,$14.99,http://www.jollychic.com/p/men-s-polo-shirt-patchwork-color-turn-down-collar-polo-shirt-g634412.html,Men's Polo Shirt Patchwork Color Turn Down Collar Polo Shirt,Polo Shirts
484,$12.99,$23.99,http://www.jollychic.com/p/casual-style-short-sleeve-polo-shirt-for-men-g336704.html,Casual Style Short Sleeve Polo Shirt For Men,Polo Shirts
862,$8.99,$12.99,http://www.jollychic.com/p/men-s-polo-shirt-stand-collar-casual-short-sleeve-polo-shirt-g711938.html,Men's Polo Shirt Stand Collar Casual Short Sleeve Polo Shirt,Polo Shirts
108,$10.99,$16.99,http://www.jollychic.com/p/men-s-polo-shirt-casual-comforty-slim-simple-style-short-sleeve-polo-shirt-g544254.html,Men's Polo Shirt Casual Comforty Slim Simple Style Short Sleeve Polo Shirt,Polo Shirts
489,$10.99,$17.99,http://www.jollychic.com/p/men-s-polo-shirt-casual-short-sleeve-turn-down-collar-soft-polo-shirt-g626398.html,Men's Polo Shirt Casual Short Sleeve Turn Down Collar Soft Polo Shirt,Polo Shirts
11,$26.99,,http://www.jollychic.com/p/men-s-polo-shirt-casual-comfy-one-piece-layer-look-polo-shirt-g1058666.html,Men's Polo Shirt Casual Comfy One Piece Layer Look Polo Shirt,Polo Shirts
2368,$12.99,$21.99,http://www.jollychic.com/p/fashion-stand-collar-color-block-print-design-soft-men-s-polo-shirt-g378058.html,Fashion Stand Collar Color Block Print Design Soft Men's Polo Shirt,Polo Shirts
5,$13.99,$21.99,http://www.jollychic.com/p/men-s-polo-shirt-pattern-stylish-turn-down-collar-brief-design-polo-shirt-g1046394.html,Men's Polo Shirt Pattern Stylish Turn Down Collar Brief Design Polo Shirt,Polo Shirts
21,$17.99,$26.99,http://www.jollychic.com/p/men-s-polo-shirt-casual-comfy-chic-print-fashion-polo-shirt-g1024012.html,Men's Polo Shirt Casual Comfy Chic Print Fashion Polo Shirt,Polo Shirts
719,$10.99,$17.99,http://www.jollychic.com/p/men-s-polo-shirt-simple-style-patchwork-color-slim-polo-shirt-g549356.html,Men's Polo Shirt Simple Style Patchwork Color Slim Polo Shirt,Polo Shirts
176,$7.99,$21.99,http://www.jollychic.com/p/men-s-polo-shirt-patchwork-short-sleeve-breathable-polo-shirt-g566670.html,Men's Polo Shirt Patchwork Short Sleeve Breathable Polo Shirt,Polo Shirts
956,$5.99,$13.99,http://www.jollychic.com/p/men-s-polo-shirt-short-sleeve-comfy-casual-solid-color-polo-shirt-g639120.html,Men's Polo Shirt Short Sleeve Comfy Casual Solid Color Polo Shirt,Polo Shirts
21,$19.99,$27.99,http://www.jollychic.com/p/men-s-polo-shirt-color-block-casual-print-short-sleeve-polo-shirt-g550042.html,Men's Polo Shirt Color Block Casual Print Short Sleeve Polo Shirt,Polo Shirts
557,$8.99,$19.99,http://www.jollychic.com/p/new-turn-down-collar-slim-short-sleeve-polo-shirt-for-men-g371802.html,New Turn Down Collar Slim Short Sleeve Polo Shirt For men,Polo Shirts
70,$26.99,,http://www.jollychic.com/p/exquisite-embroidery-long-sleeve-polo-shirt-for-men-g383320.html,Exquisite Embroidery Long Sleeve Polo Shirt For Men,Polo Shirts
2020,$11.99,$20.99,http://www.jollychic.com/p/men-s-t-shirt-stand-collar-cotton-camisa-polo-tops-g413790.html,Men's T Shirt Stand Collar Cotton Camisa Polo Tops,Polo Shirts
39,$16.99,,http://www.jollychic.com/p/men-s-polo-shirt-patchwork-casual-cozy-turn-down-collar-polo-shirt-g522644.html,Men's Polo Shirt Patchwork Casual Cozy Turn Down Collar Polo Shirt,Polo Shirts
155,$11.99,$16.99,http://www.jollychic.com/p/men-s-polo-shirt-patchwork-color-block-fashion-short-sleeve-polo-shirt-g523494.html,Men's Polo Shirt Patchwork Color Block Fashion Short Sleeve Polo Shirt,Polo Shirts
160,$14.99,$21.99,http://www.jollychic.com/p/men-s-polo-shirt-fashion-short-sleeve-print-cozy-polo-shirt-g523500.html,Men's Polo Shirt Fashion Short Sleeve Print Cozy Polo Shirt,Polo Shirts
79,$13.99,$23.99,http://www.jollychic.com/p/men-s-polo-shirt-short-sleeve-all-match-plus-size-slim-stylish-polo-shirt-g533726.html,Men's Polo Shirt Short Sleeve All Match Plus Size Slim Stylish Polo Shirt,Polo Shirts
134,$12.99,$19.99,http://www.jollychic.com/p/men-s-polo-shirt-plaid-short-sleeve-turn-down-collar-breathable-polo-shirt-g541902.html,Men's Polo Shirt Plaid Short Sleeve Turn Down Collar Breathable Polo Shirt,Polo Shirts
55,$34.99,$59.00,http://www.jollychic.com/p/septwolves-men-s-polo-shirt-turn-down-collar-striped-leisure-polo-shirt-g563630.html,SEPTWOLVES Men's Polo Shirt Turn Down Collar Striped Leisure Polo Shirt,Polo Shirts
375,$10.99,$24.99,http://www.jollychic.com/p/men-s-polo-shirt-comforty-casual-chic-design-short-sleeve-polo-shirt-g582228.html,Men's Polo Shirt Comforty Casual Chic Design Short Sleeve Polo Shirt,Polo Shirts
15,$16.99,$26.99,http://www.jollychic.com/p/men-s-polo-shirt-casual-slim-striped-simple-style-cozy-polo-shirt-g587438.html,Men's Polo Shirt Casual Slim Striped Simple Style Cozy Polo Shirt,Polo Shirts
163,$9.99,$14.99,http://www.jollychic.com/p/men-s-polo-shirt-cozy-short-sleeve-o-neck-button-casual-t-shirt-g595318.html,Men's Polo Shirt Cozy Short Sleeve O Neck Button Casual T Shirt,Polo Shirts
7,$17.99,,http://www.jollychic.com/p/men-s-polo-shirt-classical-patchwork-short-sleeve-turn-down-collar-polo-shirt-g597158.html,Men's Polo Shirt Classical Patchwork Short Sleeve Turn Down Collar Polo Shirt,Polo Shirts
48,$17.99,,http://www.jollychic.com/p/men-s-polo-shirt-cotton-blends-print-short-sleeve-cozy-polo-shirt-g610276.html,Men's Polo Shirt Cotton Blends Print Short Sleeve Cozy Polo Shirt,Polo Shirts
90,$12.99,$17.99,http://www.jollychic.com/p/men-s-polo-shirt-button-decoration-turn-down-collar-classical-stripes-polo-shirt-g612292.html,Men's Polo Shirt Button Decoration Turn Down Collar Classical Stripes Polo Shirt,Polo Shirts
180,$14.99,$23.99,http://www.jollychic.com/p/men-s-polo-shirt-short-sleeve-stylish-cotton-blends-polo-shirt-g621002.html,Men's Polo Shirt Short Sleeve Stylish Cotton Blends Polo Shirt,Polo Shirts
9,$10.99,$31.99,http://www.jollychic.com/p/men-s-polo-shirt-color-block-short-sleeve-patch-vogue-polo-shirt-g623524.html,Men's Polo Shirt Color Block Short Sleeve Patch Vogue Polo Shirt,Polo Shirts
60,$4.99,$18.99,http://www.jollychic.com/p/men-s-polo-shirt-short-sleeve-ventilate-color-block-polo-shirt-g634414.html,Men's Polo Shirt Short Sleeve Ventilate Color Block Polo Shirt,Polo Shirts
62,$12.99,$18.99,http://www.jollychic.com/p/men-s-polo-shirt-short-sleeve-striped-color-block-polo-shirt-g663328.html,Men's Polo Shirt Short Sleeve Striped Color Block Polo Shirt,Polo Shirts
106,$6.99,$20.99,http://www.jollychic.com/p/men-s-polo-shirt-turn-down-collar-pocket-patchwork-design-polo-shirt-g670842.html,Men's Polo Shirt Turn Down Collar Pocket Patchwork Design Polo Shirt,Polo Shirts
37,$14.99,$26.99,http://www.jollychic.com/p/men-s-polo-shirt-solid-color-casual-short-sleeve-soft-polo-shirt-g673058.html,Men's Polo Shirt Solid Color Casual Short Sleeve Soft Polo Shirt,Polo Shirts
62,$13.99,$20.99,http://www.jollychic.com/p/men-s-polo-shirt-casual-colorblock-letter-short-sleeve-polo-shirt-g683696.html,Men's Polo Shirt Casual Colorblock Letter Short Sleeve Polo Shirt,Polo Shirts
17,$16.99,$26.99,http://www.jollychic.com/p/men-s-polo-shirt-short-sleeve-turn-down-collar-solid-color-polo-shirt-g684760.html,Men's Polo Shirt Short Sleeve Turn Down Collar Solid Color Polo Shirt,Polo Shirts
21,$13.99,$20.99,http://www.jollychic.com/p/men-s-polo-shirt-colorblock-short-sleeve-turn-down-collar-polo-shirt-g711984.html,Men's Polo Shirt Colorblock Short Sleeve Turn Down Collar Polo Shirt,Polo Shirts
3,$12.99,$20.99,http://www.jollychic.com/p/men-s-polo-shirt-all-match-striped-short-sleeve-casual-polo-shirt-g713880.html,Men's Polo Shirt All Match Striped Short Sleeve Casual Polo Shirt,Polo Shirts
5,$13.99,$20.99,http://www.jollychic.com/p/men-s-polo-shirt-graffiti-short-sleeves-turn-down-collar-polo-shirt-g714858.html,Men's Polo Shirt Graffiti Short Sleeves Turn Down Collar Polo Shirt,Polo Shirts
2,$12.99,$20.99,http://www.jollychic.com/p/men-s-polo-shirt-striped-colorblock-simple-short-sleeves-polo-shirt-g716012.html,Men's Polo Shirt Striped Colorblock Simple Short Sleeves Polo Shirt,Polo Shirts
18,$22.99,$36.99,http://www.jollychic.com/p/men-s-polo-shirt-zipper-design-simple-style-short-sleeve-polo-shirt-g717902.html,Men's Polo Shirt Zipper Design Simple Style Short Sleeve Polo Shirt,Polo Shirts
6,$20.99,$32.99,http://www.jollychic.com/p/men-s-polo-shirt-casual-short-sleeve-all-match-short-sleeve-polo-shirt-g717918.html,Men's Polo Shirt Casual Short Sleeve All Match Short Sleeve Polo Shirt,Polo Shirts
138,$8.99,$13.99,http://www.jollychic.com/p/men-s-polo-shirt-short-sleeve-o-neck-letter-pattern-casual-polo-shirt-g735634.html,Men's Polo Shirt Short Sleeve O Neck Letter Pattern Casual Polo Shirt,Polo Shirts
16,$15.99,$23.99,http://www.jollychic.com/p/men-s-polo-shirt-all-match-solid-color-polo-shirt-g736066.html,Men's Polo Shirt All Match Solid Color Polo Shirt,Polo Shirts
15,$20.99,$32.99,http://www.jollychic.com/p/men-s-polo-shirt-turn-down-collar-all-match-striped-fashion-polo-shirt-g754816.html,Men's Polo Shirt Turn Down Collar All Match Striped Fashion Polo Shirt,Polo Shirts
855,$11.99,$15.99,http://www.jollychic.com/p/men-s-polo-shirt-breif-design-turn-down-collar-stylish-soft-polo-shirt-g756252.html,Men's Polo Shirt Breif Design Turn Down Collar Stylish Soft Polo Shirt,Polo Shirts
6,$18.99,$30.99,http://www.jollychic.com/p/men-s-polo-shirt-brief-style-short-sleeve-fashion-cozy-casual-polo-shirt-g760978.html,Men's Polo Shirt Brief Style Short Sleeve Fashion Cozy Casual Polo Shirt,Polo Shirts
18,$19.99,,http://www.jollychic.com/p/men-s-polo-shirt-patchwork-color-turn-down-collar-polo-shirt-g763350.html,Men's Polo Shirt Patchwork Color Turn Down Collar Polo Shirt,Polo Shirts
41,$19.99,,http://www.jollychic.com/p/men-s-polo-shirt-cotton-blends-patchwork-color-brief-polo-shirt-g763352.html,Men's Polo Shirt Cotton Blends Patchwork Color Brief Polo Shirt,Polo Shirts
11,$15.99,$23.99,http://www.jollychic.com/p/men-s-polo-shirt-solid-color-short-sleeve-leisure-polo-shirt-g765970.html,Men's Polo Shirt Solid Color Short Sleeve Leisure Polo Shirt,Polo Shirts
37,$14.99,$23.99,http://www.jollychic.com/p/men-s-polo-shirt-short-sleeve-guitar-print-t-shirt-g768204.html,Men's Polo Shirt Short Sleeve Guitar Print T Shirt,Polo Shirts
21,$14.99,$23.99,http://www.jollychic.com/p/men-s-polo-shirt-button-decoration-stylish-floral-print-soft-polo-shirt-g770594.html,Men's Polo Shirt Button Decoration Stylish Floral Print Soft Polo Shirt,Polo Shirts
59,$13.99,$21.99,http://www.jollychic.com/p/men-s-plus-size-polo-shirt-patchwork-turn-down-collar-short-sleeve-casual-polo-shirt-g775356.html,Men's Plus Size Polo Shirt Patchwork Turn Down Collar Short Sleeve Casual Polo Shirt,Polo Shirts
70,$12.99,$14.99,http://www.jollychic.com/p/men-s-polo-shirt-solid-color-comfy-all-match-polo-shirt-g788708.html,Men's Polo Shirt Solid Color Comfy All Match Polo Shirt,Polo Shirts
1,$33.99,,http://www.jollychic.com/p/men-s-polo-shirt-fashion-design-short-sleeve-solid-color-polo-shirt-g801466.html,Men's Polo Shirt Fashion Design Short Sleeve Solid Color Polo Shirt,Polo Shirts
3,$22.99,,http://www.jollychic.com/p/men-s-polo-shirt-turn-down-collar-trend-solid-color-polo-shirt-g821318.html,Men's Polo Shirt Turn Down Collar Trend Solid Color Polo Shirt,Polo Shirts
96,$17.99,$32.99,http://www.jollychic.com/p/men-s-polo-shirt-short-sleeve-casual-striped-slim-polo-shirt-g830422.html,Men's Polo Shirt Short Sleeve Casual Striped Slim Polo Shirt,Polo Shirts
84,$14.99,$22.99,http://www.jollychic.com/p/men-s-polo-shirt-casual-short-sleeve-simple-style-polo-shirt-g845846.html,Men's Polo Shirt Casual Short Sleeve Simple Style Polo Shirt,Polo Shirts
5,$29.99,,http://www.jollychic.com/p/men-s-polo-shirt-striped-turn-down-collar-casual-polo-shirt-g855278.html,Men's Polo Shirt Striped Turn Down Collar Casual Polo Shirt,Polo Shirts
9,$23.99,$35.99,http://www.jollychic.com/p/men-s-polo-shirt-cozy-striped-turn-down-collar-button-polo-shirt-g869096.html,Men's Polo Shirt Cozy Striped Turn Down Collar Button Polo Shirt,Polo Shirts
4,$25.99,,http://www.jollychic.com/p/men-s-polo-shirt-casual-fashion-striped-comfy-polo-shirt-g892538.html,Men's Polo Shirt Casual Fashion Striped Comfy Polo Shirt,Polo Shirts
9,$15.99,$30.99,http://www.jollychic.com/p/aiken-men-s-polo-shirts-solid-color-comfy-button-decoration-shirt-g991380.html,Aiken Men's Polo Shirts Solid Color Comfy Button Decoration Shirt,Polo Shirts
5,$15.99,$28.99,http://www.jollychic.com/p/aiken-men-s-polo-shirt-turn-down-collar-colorblock-trendy-polo-shirt-g1002032.html,Aiken Men's Polo Shirt Turn Down Collar Colorblock Trendy Polo Shirt,Polo Shirts
3,$17.99,$26.99,http://www.jollychic.com/p/men-s-polo-shirt-letter-pattern-long-sleeve-slim-casual-polo-shirt-g1064514.html,Men's Polo Shirt Letter Pattern Long Sleeve Slim Casual Polo Shirt,Polo Shirts
4,$33.99,,http://www.jollychic.com/p/men-s-polo-shirt-long-sleeve-slim-simple-casual-comfy-polo-shirt-g1067168.html,Men's Polo Shirt Long Sleeve Slim Simple Casual Comfy Polo Shirt,Polo Shirts
11,$18.99,$28.99,http://www.jollychic.com/p/men-s-polo-shirt-fashion-long-sleeve-patchwork-color-polo-shirt-g1074466.html,Men's Polo Shirt Fashion Long Sleeve Patchwork Color Polo Shirt,Polo Shirts
1,$70.00,,http://www.jollychic.com/p/brushfinch-vp-cooperation-men-s-t-shirt-short-sleeve-comfy-striped-polo-shirt-g1076410.html,BrushFinch&VP Cooperation Men's T Shirt Short Sleeve Comfy Striped Polo Shirt,Polo Shirts
5,$33.99,,http://www.jollychic.com/p/men-s-polo-shirt-casual-color-block-all-match-polo-shirt-g1097052.html,Men's Polo Shirt Casual Color Block All Match Polo Shirt,Polo Shirts
3,$28.99,,http://www.jollychic.com/p/men-s-polo-shirt-button-decoration-color-block-long-sleeve-polo-shirt-g1116458.html,Men's Polo Shirt Button Decoration Color Block Long Sleeve Polo Shirt,Polo Shirts
1,$22.99,,http://www.jollychic.com/p/men-s-polo-shirt-short-sleeve-all-match-casual-polo-shirt-g1116926.html,Men's Polo Shirt Short Sleeve All Match Casual Polo Shirt,Polo Shirts
5,$11.99,$18.99,http://www.jollychic.com/p/men-s-polo-shirt-color-all-match-casual-chic-polo-shirt-g1133712.html,Men's Polo Shirt Color All Match Casual Chic Polo Shirt,Polo Shirts
1,$13.99,$21.99,http://www.jollychic.com/p/men-s-polo-shirt-cozy-letter-embroidery-turn-down-collar-buttons-polo-shirt-g1153968.html,Men's Polo Shirt Cozy Letter Embroidery Turn Down Collar Buttons Polo Shirt,Polo Shirts
3,$58.00,,http://www.jollychic.com/p/men-s-polo-shirt-striped-long-sleeve-turn-down-collar-casual-polo-shirt-g1159556.html,Men's Polo Shirt Striped Long Sleeve Turn Down Collar Casual Polo Shirt,Polo Shirts
0,$31.99,,http://www.jollychic.com/p/men-s-polo-shirt-solid-color-embroidery-fashion-casual-polo-shirt-g1215384.html,Men's Polo Shirt Solid Color Embroidery Fashion Casual Polo Shirt,Polo Shirts
0,$42.99,,http://www.jollychic.com/p/men-s-polo-shirt-plus-size-button-decoration-turn-down-collar-polo-shirt-g1221092.html,Men's Polo Shirt Plus Size Button Decoration Turn Down Collar Polo Shirt,Polo Shirts
0,$41.99,$43.99,http://www.jollychic.com/p/septwolves-men-s-casual-polo-shirt-double-mercerized-cotton-striped-top-g1304784.html,Septwolves Men's Casual Polo Shirt Double Mercerized Cotton Striped Top,Polo Shirts
586,$11.99,$31.99,http://www.jollychic.com/p/color-block-long-sleeve-polo-shirt-g365068.html,Color Block Long Sleeve Polo Shirt,Polo Shirts
754,$9.99,$17.99,http://www.jollychic.com/p/men-s-polo-shirt-turn-down-collar-brief-leisure-slim-short-sleeve-polo-shirt-g510310.html,Men's Polo Shirt Turn Down Collar Brief Leisure Slim Short Sleeve Polo Shirt,Polo Shirts
186,$11.99,$19.99,http://www.jollychic.com/p/men-s-polo-shirt-short-sleeve-print-stylish-color-block-comfy-polo-shirt-g550502.html,Men's Polo Shirt Short Sleeve Print Stylish Color Block Comfy Polo Shirt,Polo Shirts
54,$17.99,$29.99,http://www.jollychic.com/p/men-s-polo-shirt-stand-collar-comforty-print-vintage-polo-shirt-g553786.html,Men's Polo Shirt Stand Collar Comforty Print Vintage Polo Shirt,Polo Shirts
24,$10.99,$28.99,http://www.jollychic.com/p/men-s-polo-shirt-colorblock-striped-short-sleeves-turn-down-collar-button-shirt-g560014.html,Men's Polo Shirt Colorblock Striped Short Sleeves Turn Down Collar Button Shirt,Polo Shirts
175,$10.99,$17.99,http://www.jollychic.com/p/men-s-polo-shirt-solid-short-sleeves-turn-down-collar-button-casual-shirt-g560164.html,Men's Polo Shirt Solid Short Sleeves Turn Down Collar Button Casual Shirt,Polo Shirts
10,$18.99,$30.99,http://www.jollychic.com/p/men-s-polo-shirt-casual-slim-design-patchwork-color-polo-shirt-g565092.html,Men's Polo Shirt Casual Slim Design Patchwork Color Polo Shirt,Polo Shirts
58,$12.99,$20.99,http://www.jollychic.com/p/men-s-polo-shirt-print-turn-down-collar-short-sleeve-fashion-polo-shirt-g579552.html,Men's Polo Shirt Print Turn Down Collar Short Sleeve Fashion Polo Shirt,Polo Shirts
55,$9.99,$28.99,http://www.jollychic.com/p/men-s-polo-shirt-brief-design-leisure-breathable-short-sleeve-polo-shirt-g580818.html,Men's Polo Shirt Brief Design Leisure Breathable Short Sleeve Polo Shirt,Polo Shirts
56,$13.99,$20.99,http://www.jollychic.com/p/men-s-polo-shirt-cotton-blends-stripe-short-sleeve-all-match-casual-polo-shirt-g581084.html,Men's Polo Shirt Cotton Blends Stripe Short Sleeve All Match Casual Polo Shirt,Polo Shirts
447,$10.99,$23.99,http://www.jollychic.com/p/men-s-polo-shirt-turn-down-collar-simple-style-cozy-polo-shirt-g582222.html,Men's Polo Shirt Turn Down Collar Simple Style Cozy Polo Shirt,Polo Shirts
98,$13.99,$24.99,http://www.jollychic.com/p/men-s-polo-shirt-all-match-comforty-short-sleeve-polo-shirt-g582230.html,Men's Polo Shirt All Match Comforty Short Sleeve Polo Shirt,Polo Shirts
53,$17.99,$28.99,http://www.jollychic.com/p/men-s-polo-shirt-causal-print-turn-down-collar-long-sleeve-comfy-polo-shirt-g589430.html,Men's Polo Shirt Causal Print Turn Down Collar Long Sleeve Comfy Polo Shirt,Polo Shirts
67,$15.99,$26.99,http://www.jollychic.com/p/men-s-plolo-shirt-casual-short-sleeve-turn-down-collar-cozy-print-polo-shirt-g590210.html,Men's Plolo Shirt Casual Short Sleeve Turn Down Collar Cozy Print Polo Shirt,Polo Shirts
355,$18.99,$25.99,http://www.jollychic.com/p/men-s-polo-shirt-striped-patchwork-short-sleeve-leisure-polo-shirt-g597816.html,Men's Polo Shirt Striped Patchwork Short Sleeve Leisure Polo Shirt,Polo Shirts
131,$12.99,$20.99,http://www.jollychic.com/p/men-s-polo-shirt-personality-color-block-turn-down-down-collar-polo-shirt-g597832.html,Men's Polo Shirt Personality Color Block Turn Down Down Collar Polo Shirt,Polo Shirts
682,$12.99,$18.99,http://www.jollychic.com/p/men-s-polo-shirt-cotton-blends-short-sleeve-patchwork-comfy-polo-shirt-g611036.html,Men's Polo Shirt Cotton Blends Short Sleeve Patchwork Comfy Polo Shirt,Polo Shirts
11,$20.99,$31.99,http://www.jollychic.com/p/men-s-polo-shirt-short-sleeve-stripe-pattern-color-block-polo-shirt-g622024.html,Men's Polo Shirt Short Sleeve Stripe Pattern Color Block Polo Shirt,Polo Shirts
50,$29.99,$34.99,http://www.jollychic.com/p/men-s-polo-shirt-color-block-short-sleeve-polo-shirt-g641758.html,Men's Polo Shirt Color Block Short Sleeve Polo Shirt,Polo Shirts
52,$7.99,$12.99,http://www.jollychic.com/p/men-s-polo-shirt-turn-down-collar-cozy-soft-leisure-polo-shirt-g676728.html,Men's Polo Shirt Turn Down Collar Cozy Soft Leisure Polo Shirt,Polo Shirts
70,$10.99,$16.99,http://www.jollychic.com/p/men-s-polo-shirt-short-sleeve-color-block-striped-casual-t-shirt-g678418.html,Men's Polo Shirt Short Sleeve Color Block Striped Casual T Shirt,Polo Shirts
11,$17.99,,http://www.jollychic.com/p/men-s-polo-shirt-casual-solid-color-short-sleeve-turn-down-collar-polo-shirt-g682086.html,Men's Polo Shirt Casual Solid Color Short Sleeve Turn Down Collar Polo Shirt,Polo Shirts
34,$75.00,,http://www.jollychic.com/p/men-s-polo-shirt-button-decoration-color-block-short-sleeve-polo-shirt-g689470.html,Men's Polo Shirt Button Decoration Color Block Short Sleeve Polo Shirt,Polo Shirts
183,$15.99,$18.99,http://www.jollychic.com/p/men-s-polo-shirt-cotton-blends-turn-down-collar-polo-shirt-g711930.html,Men's Polo Shirt Cotton Blends Turn Down Collar Polo Shirt,Polo Shirts
32,$14.99,,http://www.jollychic.com/p/men-s-polo-shirt-plus-size-turn-down-collar-business-casual-shirt-g754786.html,Men's Polo Shirt Plus Size Turn Down Collar Business Casual Shirt,Polo Shirts
11,$18.99,$30.99,http://www.jollychic.com/p/men-s-polo-shirt-color-block-short-sleeve-breathable-polo-shirt-g756458.html,Men's Polo Shirt Color Block Short Sleeve Breathable Polo Shirt,Polo Shirts
9,$11.99,$30.99,http://www.jollychic.com/p/men-s-polo-shirt-brief-style-solid-color-short-sleeve-fashion-casual-polo-shirt-g761504.html,Men's Polo Shirt Brief Style Solid Color Short Sleeve Fashion Casual Polo Shirt,Polo Shirts
25,$18.99,,http://www.jollychic.com/p/men-s-polo-shirt-brief-striped-patchwork-color-polo-shirt-g763334.html,Men's Polo Shirt Brief Striped Patchwork Color Polo Shirt,Polo Shirts
31,$13.99,$20.99,http://www.jollychic.com/p/men-s-polo-shirt-patchwork-turn-down-collar-short-sleeve-casual-top-g770290.html,Men's Polo Shirt Patchwork Turn Down Collar Short Sleeve Casual Top,Polo Shirts
9,$14.99,$26.99,http://www.jollychic.com/p/men-s-polo-shirt-solid-color-fashion-polo-shirt-g773556.html,Men's Polo Shirt Solid Color Fashion Polo Shirt,Polo Shirts
9,$6.99,$18.99,http://www.jollychic.com/p/men-s-polo-shirt-patchwork-striped-short-sleeve-turn-down-collar-polo-shirt-g775354.html,Men's Polo Shirt Patchwork Striped Short Sleeve Turn Down Collar Polo Shirt,Polo Shirts
22,$10.99,$26.99,http://www.jollychic.com/p/men-s-polo-shirt-patchwork-fashion-color-block-polo-shirt-g777170.html,Men's Polo Shirt Patchwork Fashion Color Block Polo Shirt,Polo Shirts
116,$13.99,$23.99,http://www.jollychic.com/p/men-s-polo-shirt-fashion-plus-size-comfy-breathable-polo-shirt-g814844.html,Men's Polo Shirt Fashion Plus Size Comfy Breathable Polo Shirt,Polo Shirts
7,$20.99,$33.99,http://www.jollychic.com/p/men-s-sports-polo-shirt-cozy-print-turn-down-collar-polo-shirt-g820496.html,Men's Sports Polo Shirt Cozy Print Turn Down Collar Polo Shirt,Polo Shirts
6,$25.99,$39.99,http://www.jollychic.com/p/men-s-casual-polo-shirt-turn-down-collar-stripe-pattern-slim-top-g866570.html,Men's Casual Polo Shirt Turn Down Collar Stripe Pattern Slim Top,Polo Shirts
13,$25.99,$39.99,http://www.jollychic.com/p/men-s-polo-shirt-color-block-top-fashion-top-g866580.html,Men's Polo Shirt Color Block Top Fashion Top,Polo Shirts
21,$26.99,$40.99,http://www.jollychic.com/p/men-s-casual-polo-shirt-stand-collar-short-sleeve-slim-top-g866806.html,Men's Casual Polo Shirt Stand Collar Short Sleeve Slim Top,Polo Shirts
11,$29.99,,http://www.jollychic.com/p/men-s-polo-shirt-solid-color-turn-down-collar-button-polo-shirt-g869100.html,Men's Polo Shirt Solid Color Turn Down Collar Button Polo Shirt,Polo Shirts
