add_wish,discount_price,original_price,product_link,product_name,header_block
142,$13.99,$20.99,http://www.jollychic.com/p/men-s-polo-casual-brief-design-turn-down-collar-polo-shirt-g671562.html,Men's Polo Casual Brief Design Turn Down Collar Polo Shirt,Polo Shirts
36,$29.99,$30.99,http://www.jollychic.com/p/men-s-polo-shirt-camouflage-short-sleeve-stylish-polo-shirt-g672740.html,Men's Polo Shirt Camouflage Short Sleeve Stylish Polo Shirt,Polo Shirts
74,$10.99,$16.99,http://www.jollychic.com/p/men-s-polo-shirt-short-sleeve-stripe-pattern-turn-down-collar-t-shirt-g678416.html,Men's Polo Shirt Short Sleeve Stripe Pattern Turn Down Collar T Shirt,Polo Shirts
47,$41.99,$57.00,http://www.jollychic.com/p/men-s-polo-shirt-casual-short-sleeve-patchwork-turn-down-collar-polo-shirt-g681830.html,Men's Polo Shirt Casual Short Sleeve Patchwork Turn Down Collar Polo Shirt,Polo Shirts
13,$28.99,$43.99,http://www.jollychic.com/p/men-s-polo-shirt-casual-split-short-sleeve-polo-shirt-g684140.html,Men's Polo Shirt Casual Split Short Sleeve Polo Shirt,Polo Shirts
16,$70.00,,http://www.jollychic.com/p/men-s-polo-shirt-casual-color-block-turn-down-collar-polo-shirt-g689456.html,Men's Polo Shirt Casual Color Block Turn Down Collar Polo Shirt,Polo Shirts
3,$17.99,,http://www.jollychic.com/p/men-s-polo-shirt-short-sleeve-turn-down-collar-casual-colorblock-polo-shirt-g711672.html,Men's Polo Shirt Short Sleeve Turn Down Collar Casual Colorblock Polo Shirt,Polo Shirts
71,$10.99,$20.99,http://www.jollychic.com/p/men-s-polo-shirt-casual-cozy-print-turn-down-collar-button-polo-shirt-g713870.html,Men's Polo Shirt Casual Cozy Print Turn Down Collar Button Polo Shirt,Polo Shirts
3,$12.99,$20.99,http://www.jollychic.com/p/men-s-polo-shirt-vogue-plaid-color-block-short-sleeve-soft-polo-shirt-g713948.html,Men's Polo Shirt Vogue Plaid Color Block Short Sleeve Soft Polo Shirt,Polo Shirts
15,$26.99,,http://www.jollychic.com/p/men-s-polo-shirt-solid-color-casual-turn-down-collar-polo-shirt-g715024.html,Men's Polo Shirt Solid Color Casual Turn Down Collar Polo Shirt,Polo Shirts
88,$13.99,$25.99,http://www.jollychic.com/p/men-s-polo-shirt-button-decoration-solid-color-polo-shirt-g740462.html,Men's Polo Shirt Button Decoration Solid Color Polo Shirt,Polo Shirts
41,$14.99,$21.99,http://www.jollychic.com/p/men-s-polo-shirt-formal-long-sleeves-turn-down-collar-patching-color-shirt-g754552.html,Men's Polo Shirt Formal Long Sleeves Turn Down Collar Patching Color Shirt,Polo Shirts
8,$14.99,$18.99,http://www.jollychic.com/p/men-s-polo-shirt-classic-striped-pattern-turn-down-collar-slim-casual-shirt-g754804.html,Men's Polo Shirt Classic Striped Pattern Turn Down Collar Slim Casual Shirt,Polo Shirts
7,$11.99,$32.99,http://www.jollychic.com/p/men-s-polo-shirt-stylish-cozy-striped-color-block-polo-shirt-g754814.html,Men's Polo Shirt Stylish Cozy Striped Color Block Polo Shirt,Polo Shirts
1,$17.99,$28.99,http://www.jollychic.com/p/men-s-polo-shirt-fashion-design-casual-polo-shirt-g782236.html,Men's Polo Shirt Fashion Design Casual Polo Shirt,Polo Shirts
36,$13.99,$22.99,http://www.jollychic.com/p/men-s-polo-shirt-short-sleeve-casual-brief-sleeve-cozy-polo-shirt-g821320.html,Men's Polo Shirt Short Sleeve Casual Brief Sleeve Cozy Polo Shirt,Polo Shirts
16,$31.99,,http://www.jollychic.com/p/men-s-polo-shirt-fashion-design-print-casual-polo-shirt-g833152.html,Men's Polo Shirt Fashion Design Print Casual Polo Shirt,Polo Shirts
3,$45.99,$53.00,http://www.jollychic.com/p/preppy-elite-by-yoho-men-s-polo-shirt-letter-pattern-comfy-preppy-polo-shirt-g844824.html,Preppy Elite By YOHO Men's Polo Shirt Letter Pattern Comfy Preppy Polo Shirt,Polo Shirts
163,$8.99,$11.99,http://www.jollychic.com/p/men-s-polo-shirt-casual-short-sleeve-solid-color-polo-shirt-g868118.html,Men's Polo Shirt Casual Short Sleeve Solid Color Polo Shirt,Polo Shirts
27,$23.99,$30.99,http://www.jollychic.com/p/men-s-polo-shirt-casual-comfy-stand-collar-solid-color-polo-shirt-g870582.html,Men's Polo Shirt Casual Comfy Stand Collar Solid Color Polo Shirt,Polo Shirts
17,$19.99,$29.99,http://www.jollychic.com/p/men-s-polo-shirt-striped-simple-style-short-sleeve-comforty-polo-shirt-g877722.html,Men's Polo Shirt Striped Simple Style Short Sleeve Comforty Polo Shirt,Polo Shirts
18,$20.99,$32.99,http://www.jollychic.com/p/men-s-polo-shirt-all-match-striped-patchwork-color-polo-shirt-g877728.html,Men's Polo Shirt All Match Striped Patchwork Color Polo Shirt,Polo Shirts
15,$16.99,$25.99,http://www.jollychic.com/p/men-s-polo-shirt-casual-fashion-striped-comfy-polo-shirt-g892544.html,Men's Polo Shirt Casual Fashion Striped Comfy Polo Shirt,Polo Shirts
29,$14.99,$24.99,http://www.jollychic.com/p/men-s-polo-shirt-striped-pattern-printing-summer-t-shirt-g927936.html,Men's Polo Shirt Striped Pattern Printing Summer T Shirt,Polo Shirts
17,$24.99,,http://www.jollychic.com/p/men-s-polo-shirt-striped-pattern-printing-summer-chic-t-shirt-g930808.html,Men's Polo Shirt Striped Pattern Printing Summer Chic T Shirt,Polo Shirts
10,$18.99,$22.99,http://www.jollychic.com/p/men-s-polo-shirt-casual-stylish-stand-collar-light-weight-polo-shirt-g948070.html,Men's Polo Shirt Casual Stylish Stand Collar Light Weight Polo Shirt,Polo Shirts
2,$42.99,$60.00,http://www.jollychic.com/p/men-s-polo-shirt-short-sleeve-waterproof-dri-fit-solid-color-polo-shirt-g965736.html,Men's Polo Shirt Short Sleeve Waterproof Dri Fit Solid Color Polo Shirt,Polo Shirts
101,$14.99,$23.99,http://www.jollychic.com/p/men-s-polo-shirt-button-decoration-solid-color-long-sleeve-polo-shirt-g969334.html,Men's Polo Shirt Button Decoration Solid Color Long Sleeve Polo Shirt,Polo Shirts
2,$26.99,,http://www.jollychic.com/p/men-s-polo-shirt-turn-down-collar-short-sleeve-polo-shirt-g990192.html,Men's Polo Shirt Turn Down Collar Short Sleeve Polo Shirt,Polo Shirts
12,$10.99,$24.99,http://www.jollychic.com/p/men-s-polo-shirt-embroidery-turn-down-collar-casual-polo-shirt-g1011188.html,Men's Polo Shirt Embroidery Turn Down Collar Casual Polo Shirt,Polo Shirts
13,$21.99,,http://www.jollychic.com/p/men-s-polo-shirt-solid-color-preppy-casual-polo-shirt-g1011224.html,Men's Polo Shirt Solid Color Preppy Casual Polo Shirt,Polo Shirts
29,$12.99,$23.99,http://www.jollychic.com/p/men-s-polo-shirt-turn-down-collar-striped-comforty-polo-shirt-g1025940.html,Men's Polo Shirt Turn Down Collar Striped Comforty Polo Shirt,Polo Shirts
18,$15.99,$23.99,http://www.jollychic.com/p/men-s-polo-shirt-cotton-blends-casual-print-comfy-polo-shirt-g1025948.html,Men's Polo Shirt Cotton Blends Casual Print Comfy Polo Shirt,Polo Shirts
0,$13.99,$21.99,http://www.jollychic.com/p/men-s-polo-shirt-pattern-pattern-design-short-sleeves-soft-polo-shirt-g1046390.html,Men's Polo Shirt Pattern Pattern Design Short Sleeves Soft Polo Shirt,Polo Shirts
8,$15.99,$24.99,http://www.jollychic.com/p/men-s-polo-shirt-business-style-fashion-turn-down-collar-casual-polo-shirt-g1047236.html,Men's Polo Shirt Business Style Fashion Turn Down Collar Casual Polo Shirt,Polo Shirts
33,$18.99,$28.99,http://www.jollychic.com/p/men-s-polo-shirt-long-sleeve-turn-down-collar-color-block-polo-shirt-g1054752.html,Men's Polo Shirt Long Sleeve Turn Down Collar Color Block Polo Shirt,Polo Shirts
7,$30.99,,http://www.jollychic.com/p/men-s-polo-shirt-short-sleeve-classical-striped-pattern-stylish-top-g1119402.html,Men's Polo Shirt Short Sleeve Classical Striped Pattern Stylish Top,Polo Shirts
0,$13.99,$21.99,http://www.jollychic.com/p/men-s-polo-shirt-cozyembroidery-turn-down-collar-buttons-polo-shirt-g1153966.html,Men's Polo Shirt CozyEmbroidery Turn Down Collar Buttons Polo Shirt,Polo Shirts
13,$15.99,,http://www.jollychic.com/p/men-s-polo-shirt-color-block-print-long-sleeve-light-polo-shirt-g1162242.html,Men's Polo Shirt Color Block Print Long Sleeve Light Polo Shirt,Polo Shirts
0,$31.99,,http://www.jollychic.com/p/men-s-polo-shirt-all-match-solid-color-comfy-long-sleeve-polo-shirt-g1205930.html,Men's Polo Shirt All Match Solid Color Comfy Long Sleeve Polo Shirt,Polo Shirts
4,$28.99,,http://www.jollychic.com/p/men-s-polo-shirt-solid-color-all-match-casual-polo-shirt-g1215408.html,Men's Polo Shirt Solid Color All Match Casual Polo Shirt,Polo Shirts
5,$27.99,,http://www.jollychic.com/p/men-s-polo-shirt-all-match-classic-camouflage-comfy-polo-shirt-g1238336.html,Men's Polo Shirt All Match Classic Camouflage Comfy Polo Shirt,Polo Shirts
2,$29.99,,http://www.jollychic.com/p/men-s-polo-shirt-long-sleeve-casual-solid-color-soft-polo-shirt-g1241940.html,Men's Polo Shirt Long Sleeve Casual Solid Color Soft Polo Shirt,Polo Shirts
1,$47.99,,http://www.jollychic.com/p/men-s-polo-shirt-short-sleeve-turn-down-collar-polo-shirt-g1260332.html,Men's Polo Shirt Short Sleeve Turn Down Collar Polo Shirt,Polo Shirts
0,$36.99,,http://www.jollychic.com/p/men-s-polo-shirt-casual-all-matched-long-sleeve-polo-shirt-g1281478.html,Men's Polo Shirt Casual All Matched Long Sleeve Polo Shirt,Polo Shirts
0,$32.99,$34.99,http://www.jollychic.com/p/septwolves-men-s-casual-polo-shirt-fashion-stylish-top-g1305930.html,Septwolves Men's Casual Polo Shirt Fashion Stylish Top,Polo Shirts
966,$7.99,$16.99,http://www.jollychic.com/p/plus-size-stand-collar-polo-shirt-for-men-g348808.html,Plus Size Stand Collar Polo Shirt For Men,Polo Shirts
1076,$12.99,$21.99,http://www.jollychic.com/p/solid-color-v-neck-long-sleeve-men-s-polo-shirt-with-buttons-g373390.html,Solid Color V Neck Long Sleeve Men's Polo Shirt With Buttons,Polo Shirts
73,$13.99,$21.99,http://www.jollychic.com/p/men-s-polo-shirt-long-sleeve-fashion-patchwork-color-casual-cozy-polo-shirt-g482166.html,Men's Polo Shirt Long Sleeve Fashion Patchwork Color Casual Cozy Polo Shirt,Polo Shirts
499,$8.99,$17.99,http://www.jollychic.com/p/men-s-polo-shirt-color-block-casual-striped-breathable-polo-shirt-g517048.html,Men's Polo Shirt Color Block Casual Striped Breathable Polo Shirt,Polo Shirts
1022,$9.99,$14.99,http://www.jollychic.com/p/men-s-polo-shirt-short-sleeve-stand-collar-breathable-cozy-polo-shirt-g541894.html,Men's Polo Shirt Short Sleeve Stand Collar Breathable Cozy Polo Shirt,Polo Shirts
187,$7.99,$14.99,http://www.jollychic.com/p/men-s-polo-shirt-casual-cozy-stand-collar-fashion-solid-polo-shirt-g544258.html,Men's Polo Shirt Casual Cozy Stand Collar Fashion Solid Polo Shirt,Polo Shirts
29,$9.99,$25.99,http://www.jollychic.com/p/men-s-polo-shirt-turn-down-collar-short-sleeve-leisure-polo-shirt-g554226.html,Men's Polo Shirt Turn Down Collar Short Sleeve Leisure Polo Shirt,Polo Shirts
60,$9.99,$20.99,http://www.jollychic.com/p/men-s-polo-shirt-fashion-design-patchwork-comfort-polo-shirt-g566688.html,Men's Polo Shirt Fashion Design Patchwork Comfort Polo Shirt,Polo Shirts
38,$12.99,$20.99,http://www.jollychic.com/p/men-s-polo-shirt-stripe-short-sleeve-breathable-cozy-polo-shirt-g579542.html,Men's Polo Shirt Stripe Short Sleeve Breathable Cozy Polo Shirt,Polo Shirts
35,$11.99,$20.99,http://www.jollychic.com/p/men-s-polo-shirt-cotton-blends-stripe-short-sleeve-polo-shirt-g579564.html,Men's Polo Shirt Cotton Blends Stripe Short Sleeve Polo Shirt,Polo Shirts
23,$11.99,$20.99,http://www.jollychic.com/p/men-s-polo-shirt-cotton-blends-color-block-short-sleeve-stylish-polo-shirt-g581076.html,Men's Polo Shirt Cotton Blends Color Block Short Sleeve Stylish Polo Shirt,Polo Shirts
102,$15.99,$23.99,http://www.jollychic.com/p/men-s-polo-shirt-short-sleeve-simple-design-casual-cozy-polo-shirt-g582218.html,Men's Polo Shirt Short Sleeve Simple Design Casual Cozy Polo Shirt,Polo Shirts
15,$18.99,$29.99,http://www.jollychic.com/p/men-s-polo-shirt-solid-color-all-match-short-sleeve-turn-down-collar-polo-shirt-g583714.html,Men's Polo Shirt Solid Color All Match Short Sleeve Turn Down Collar Polo Shirt,Polo Shirts
76,$18.99,$24.99,http://www.jollychic.com/p/men-s-polo-shirt-color-block-short-sleeve-polo-shirt-g612392.html,Men's Polo Shirt Color Block Short Sleeve Polo Shirt,Polo Shirts
373,$12.99,$20.99,http://www.jollychic.com/p/men-s-polo-shirt-casual-print-color-block-turn-down-collar-button-polo-shirt-g633334.html,Men's Polo Shirt Casual Print Color Block Turn Down Collar Button Polo Shirt,Polo Shirts
15,$26.99,,http://www.jollychic.com/p/men-s-polo-shirt-color-block-short-sleeve-turn-down-collar-stylish-polo-shirt-g633504.html,Men's Polo Shirt Color Block Short Sleeve Turn Down Collar Stylish Polo Shirt,Polo Shirts
13,$33.99,$35.99,http://www.jollychic.com/p/septwolves-men-s-polo-shirt-casual-striped-short-sleeve-polo-shirt-g643004.html,SEPTWOLVES Men's Polo Shirt Casual Striped Short Sleeve Polo Shirt,Polo Shirts
1571,$10.99,$16.99,http://www.jollychic.com/p/men-s-polo-shirt-cotton-blends-short-sleeve-casual-cozy-polo-shirt-g663336.html,Men's Polo Shirt Cotton Blends Short Sleeve Casual Cozy Polo Shirt,Polo Shirts
14,$14.99,$24.99,http://www.jollychic.com/p/men-s-polo-shirt-striped-brief-design-casual-comfy-polo-shirt-g663838.html,Men's Polo Shirt Striped Brief Design Casual Comfy Polo Shirt,Polo Shirts
24,$10.99,$31.99,http://www.jollychic.com/p/men-s-polo-shirt-original-design-one-piece-layer-look-polo-shirt-g670726.html,Men's Polo Shirt Original Design One Piece Layer Look Polo Shirt,Polo Shirts
301,$10.99,$16.99,http://www.jollychic.com/p/men-s-polo-shirt-creative-3d-giant-hand-pattern-turn-down-collar-t-shirt-g678436.html,Men's Polo Shirt Creative 3D Giant Hand Pattern Turn Down Collar T Shirt,Polo Shirts
17,$20.99,,http://www.jollychic.com/p/men-s-polo-shirt-fashion-colorblock-short-sleeve-casual-polo-shirt-g683938.html,Men's Polo Shirt Fashion Colorblock Short Sleeve Casual Polo Shirt,Polo Shirts
18,$21.99,,http://www.jollychic.com/p/men-s-polo-shirt-cotton-blends-brief-style-all-match-cozy-polo-shirt-g690274.html,Men's Polo Shirt Cotton Blends Brief Style All Match Cozy Polo Shirt,Polo Shirts
13,$13.99,$22.99,http://www.jollychic.com/p/men-s-polo-shirt-turn-down-collar-color-block-stripes-polo-shirt-g710932.html,Men's Polo Shirt Turn Down Collar Color Block Stripes Polo Shirt,Polo Shirts
13,$8.99,$16.99,http://www.jollychic.com/p/men-s-polo-shirt-casual-patchwork-color-block-all-match-polo-shirt-g711934.html,Men's Polo Shirt Casual Patchwork Color Block All Match Polo Shirt,Polo Shirts
21,$11.99,$17.99,http://www.jollychic.com/p/men-s-polo-shirt-slim-short-sleeve-brief-style-cozy-polo-shirt-g712222.html,Men's Polo Shirt Slim Short Sleeve Brief Style Cozy Polo Shirt,Polo Shirts
13,$12.99,$20.99,http://www.jollychic.com/p/men-s-polo-shirt-colorblock-striped-turn-down-collar-short-sleeves-polo-shirt-g716002.html,Men's Polo Shirt Colorblock Striped Turn Down Collar Short Sleeves Polo Shirt,Polo Shirts
3,$12.99,$20.99,http://www.jollychic.com/p/men-s-polo-shirt-colorblock-all-match-striped-short-sleeves-polo-shirt-g716044.html,Men's Polo Shirt Colorblock All Match Striped Short Sleeves Polo Shirt,Polo Shirts
71,$11.99,$17.99,http://www.jollychic.com/p/men-s-polo-shirt-all-match-fashion-polo-shirt-g735186.html,Men's POLO Shirt All Match Fashion Polo Shirt,Polo Shirts
5,$17.99,$28.99,http://www.jollychic.com/p/men-s-polo-shirt-solid-color-short-sleeve-all-match-polo-shirt-g756460.html,Men's Polo Shirt Solid Color Short Sleeve All Match Polo Shirt,Polo Shirts
5,$18.99,$30.99,http://www.jollychic.com/p/men-s-polo-shirt-brief-style-turn-down-collar-short-sleeve-fashion-polo-shirt-g761324.html,Men's Polo Shirt Brief Style Turn Down Collar Short Sleeve Fashion Polo Shirt,Polo Shirts
2,$24.99,$30.99,http://www.jollychic.com/p/men-s-polo-shirt-brief-style-color-block-short-sleeve-fashion-casual-polo-shirt-g761338.html,Men's Polo Shirt Brief Style Color Block Short Sleeve Fashion Casual Polo Shirt,Polo Shirts
4,$18.99,$30.99,http://www.jollychic.com/p/men-s-polo-shirt-brief-style-print-turn-down-collar-short-sleeve-polo-shirt-g761470.html,Men's Polo Shirt Brief Style Print Turn Down Collar Short Sleeve Polo Shirt,Polo Shirts
44,$18.99,$19.99,http://www.jollychic.com/p/men-s-polo-shirt-color-block-casual-slim-short-sleeve-polo-shirt-g763340.html,Men's Polo Shirt Color Block Casual Slim Short Sleeve Polo Shirt,Polo Shirts
17,$14.99,$20.99,http://www.jollychic.com/p/men-s-polo-shirt-casual-solid-color-turn-down-collar-short-sleeve-polo-shirt-g775344.html,Men's Polo Shirt Casual Solid Color Turn Down Collar Short Sleeve Polo Shirt,Polo Shirts
72,$12.99,$20.99,http://www.jollychic.com/p/men-s-polo-shirt-large-size-solid-color-stand-collar-polo-shirt-g793370.html,Men's Polo Shirt Large Size Solid Color Stand Collar Polo Shirt,Polo Shirts
13,$16.99,$25.99,http://www.jollychic.com/p/men-s-polo-shirt-stripe-patchwork-short-sleeve-casual-polo-shirt-g855502.html,Men's Polo Shirt Stripe Patchwork Short Sleeve Casual Polo Shirt,Polo Shirts
11,$20.99,$31.99,http://www.jollychic.com/p/men-s-polo-shirt-polo-collar-embroidery-design-slim-top-g856820.html,Men's Polo Shirt Polo Collar Embroidery Design Slim Top,Polo Shirts
1,$26.99,$43.99,http://www.jollychic.com/p/men-s-casual-polo-shirt-stripe-pattern-fit-slim-top-g866832.html,Men's Casual Polo Shirt Stripe Pattern Fit Slim Top,Polo Shirts
10,$21.99,$32.99,http://www.jollychic.com/p/men-s-polo-shirt-striped-turn-down-collar-casual-polo-shirt-g869094.html,Men's Polo Shirt Striped Turn Down Collar Casual Polo Shirt,Polo Shirts
7,$24.99,$38.99,http://www.jollychic.com/p/men-s-polo-shirt-short-sleeve-fashion-striped-color-block-polo-shirt-g877734.html,Men's Polo Shirt Short Sleeve Fashion Striped Color Block Polo Shirt,Polo Shirts
55,$16.99,$25.99,http://www.jollychic.com/p/men-s-polo-shirt-turn-down-collar-button-color-block-slim-top-g889426.html,Men's Polo Shirt Turn Down Collar Button Color Block Slim Top,Polo Shirts
3,$25.99,,http://www.jollychic.com/p/men-s-polo-shirt-casual-fashion-striped-comfy-polo-shirt-g892750.html,Men's Polo Shirt Casual Fashion Striped Comfy Polo Shirt,Polo Shirts
3,$36.99,$57.00,http://www.jollychic.com/p/afs-jeep-man-s-polo-shirt-animal-letter-printed-short-sleeves-business-t-shirt-g908042.html,AFS JEEP Man's Polo Shirt Animal Letter Printed Short Sleeves Business T-shirt,Polo Shirts
6,$28.99,$43.99,http://www.jollychic.com/p/men-s-polo-shirt-single-breasted-color-block-top-fashion-top-g926582.html,Men's Polo Shirt Single Breasted Color Block Top Fashion Top,Polo Shirts
137,$7.99,$12.99,http://www.jollychic.com/p/men-s-polo-shirt-cotton-blends-letter-pattern-print-polo-shirt-g944160.html,Men's Polo Shirt Cotton Blends Letter Pattern Print Polo Shirt,Polo Shirts
124,$10.99,$16.99,http://www.jollychic.com/p/men-s-polo-shirt-button-decoration-long-sleeve-cozy-print-polo-shirt-g968310.html,Men's Polo Shirt Button Decoration Long Sleeve Cozy Print Polo Shirt,Polo Shirts
3,$26.99,,http://www.jollychic.com/p/men-s-polo-shirt-cotton-blends-stripe-stylish-short-sleeve-polo-shirt-g990206.html,Men's Polo Shirt Cotton Blends Stripe Stylish Short Sleeve Polo Shirt,Polo Shirts
9,$22.99,,http://www.jollychic.com/p/men-s-polo-shirt-long-sleeve-turn-down-collar-color-block-polo-shirt-g998272.html,Men's Polo Shirt Long Sleeve Turn Down Collar Color Block Polo Shirt,Polo Shirts
1,$29.99,,http://www.jollychic.com/p/men-s-polo-shirt-casual-striped-comfy-long-sleeve-all-matched-polo-shirt-g1027234.html,Men's Polo Shirt Casual Striped Comfy Long Sleeve All Matched Polo Shirt,Polo Shirts
6,$18.99,,http://www.jollychic.com/p/men-s-polo-shirt-long-sleeve-leisure-simple-style-polo-shirt-g1029518.html,Men's Polo Shirt Long Sleeve Leisure Simple Style Polo Shirt,Polo Shirts
14,$18.99,,http://www.jollychic.com/p/men-s-polo-shirt-zipper-design-casual-rose-pattern-print-polo-shirt-g1029540.html,Men's Polo Shirt Zipper Design Casual Rose Pattern Print Polo Shirt,Polo Shirts
18,$18.99,,http://www.jollychic.com/p/men-s-polo-shirt-stand-collar-long-sleeve-leisure-polo-shirt-g1029572.html,Men's Polo Shirt Stand Collar Long Sleeve Leisure Polo Shirt,Polo Shirts
4,$25.99,,http://www.jollychic.com/p/men-s-turn-down-collar-brief-design-business-style-casual-polo-shirt-g1049890.html,Men's Turn Down Collar Brief Design Business Style Casual Polo Shirt,Polo Shirts
2,$47.99,,http://www.jollychic.com/p/brushfinch-vp-cooperation-men-s-polo-shirt-short-sleeve-stylish-casual-shirt-g1076418.html,BrushFinch&VP Cooperation Men's Polo Shirt Short Sleeve Stylish Casual Shirt,Polo Shirts
1,$29.99,$45.99,http://www.jollychic.com/p/brushfinch-vp-cooperation-men-s-polo-shirt-short-sleeve-solid-color-casual-shirt-g1076428.html,BrushFinch&VP Cooperation Men's Polo Shirt Short Sleeve Solid Color Casual Shirt,Polo Shirts
9,$28.99,,http://www.jollychic.com/p/men-s-polo-shirt-buttons-decoration-turn-down-collar-solid-color-polo-shirt-g1124550.html,Men's Polo Shirt Buttons Decoration Turn Down Collar Solid Color Polo Shirt,Polo Shirts
2,$15.99,$23.99,http://www.jollychic.com/p/men-s-polo-shirt-epaulets-solid-color-slim-brief-casual-polo-shirt-g1124852.html,Men's Polo Shirt Epaulets Solid Color Slim Brief Casual Polo Shirt,Polo Shirts
9,$16.99,$25.99,http://www.jollychic.com/p/men-s-polo-shirt-casual-comfy-embroidery-chic-long-sleeve-polo-shirt-g1195646.html,Men's Polo Shirt Casual Comfy Embroidery Chic Long Sleeve Polo Shirt,Polo Shirts
1,$37.99,,http://www.jollychic.com/p/men-s-polo-shirt-solid-color-fashion-solid-color-casual-polo-shirt-g1266830.html,Men's Polo Shirt Solid Color Fashion Solid Color Casual Polo Shirt,Polo Shirts
176,$31.99,$39.99,http://www.jollychic.com/p/stand-collar-striped-t-shirt-for-men-g326480.html,Stand Collar Striped T Shirt For Men,Polo Shirts
282,$12.99,$26.99,http://www.jollychic.com/p/classic-style-long-sleeve-polo-shirt-for-men-g383318.html,Classic Style Long Sleeve Polo Shirt For Men,Polo Shirts
24,$23.99,,http://www.jollychic.com/p/men-s-polo-shirt-patchwork-color-block-short-sleeve-polo-shirt-size-is-a-little-bigger--g510832.html,Men's Polo Shirt Patchwork Color Block Short Sleeve Polo Shirt (Size Is A Little Bigger),Polo Shirts
108,$10.99,$23.99,http://www.jollychic.com/p/men-s-polo-shirt-stand-collar-casual-long-sleeve-solid-color-polo-shirt-g513986.html,Men's Polo Shirt Stand Collar Casual Long Sleeve Solid Color Polo Shirt,Polo Shirts
97,$11.99,$18.99,http://www.jollychic.com/p/men-s-polo-shirt-brief-design-all-match-slim-casual-short-sleeve-polo-shirt-g522468.html,Men's Polo Shirt Brief Design All Match Slim Casual Short Sleeve Polo Shirt,Polo Shirts
363,$13.99,$18.99,http://www.jollychic.com/p/men-s-polo-shirt-fashion-letter-print-stripe-cozy-short-sleeve-polo-shirt-g522472.html,Men's Polo Shirt Fashion Letter Print Stripe Cozy Short Sleeve Polo Shirt,Polo Shirts
223,$10.99,$16.99,http://www.jollychic.com/p/men-s-polo-shirt-fashion-turn-down-collar-cotton-blends-casual-slim-polo-shirt-g522640.html,Men's Polo Shirt Fashion Turn Down Collar Cotton Blends Casual Slim Polo Shirt,Polo Shirts
78,$17.99,$26.99,http://www.jollychic.com/p/men-s-polo-shirt-short-sleeve-casual-slim-large-size-polo-shirt-g538482.html,Men's Polo Shirt Short Sleeve Casual Slim Large Size Polo Shirt,Polo Shirts
40,$9.99,$15.99,http://www.jollychic.com/p/men-s-polo-shirt-solid-color-comforty-stand-collar-polo-shirt-g546018.html,Men's Polo Shirt Solid Color Comforty Stand Collar Polo Shirt,Polo Shirts
133,$10.99,$18.99,http://www.jollychic.com/p/men-s-polo-shirt-casual-print-color-block-short-sleeve-polo-shirt-g546022.html,Men's Polo Shirt Casual Print Color Block Short Sleeve Polo Shirt,Polo Shirts
131,$17.99,$29.99,http://www.jollychic.com/p/men-s-t-shirt-long-sleeve-all-match-personality-zipper-t-shirt-g553792.html,Men's T Shirt Long Sleeve All Match Personality Zipper T Shirt,Polo Shirts
75,$12.99,$23.99,http://www.jollychic.com/p/men-s-polo-shirt-solid-color-short-sleeve-cozy-slim-polo-shirt-g557934.html,Men's Polo Shirt Solid Color Short Sleeve Cozy Slim Polo Shirt,Polo Shirts
151,$13.99,$23.99,http://www.jollychic.com/p/men-s-polo-shirt-short-sleeve-solid-color-casual-stand-collar-polo-shirt-g572516.html,Men's Polo Shirt Short Sleeve Solid Color Casual Stand Collar Polo Shirt,Polo Shirts
16,$9.99,$14.99,http://www.jollychic.com/p/men-s-polo-shirt-casual-print-turn-down-collar-button-plaid-pattern-polo-shirt-g583610.html,Men's Polo Shirt Casual Print Turn Down Collar Button Plaid Pattern Polo Shirt,Polo Shirts
211,$11.99,$18.99,http://www.jollychic.com/p/men-s-polo-shirt-solid-color-casual-short-sleeve-polo-shirt-g584930.html,Men's Polo Shirt Solid Color Casual Short Sleeve Polo Shirt,Polo Shirts
100,$9.99,$26.99,http://www.jollychic.com/p/men-s-polo-shirt-patchwork-turn-down-collar-short-sleeve-polo-shirt-g589832.html,Men's Polo Shirt Patchwork Turn Down Collar Short Sleeve Polo Shirt,Polo Shirts
25,$17.99,$26.99,http://www.jollychic.com/p/men-s-polo-shirt-casual-letter-print-turn-down-collar-button-polo-shirt-g590330.html,Men's Polo Shirt Casual Letter Print Turn Down Collar Button Polo Shirt,Polo Shirts
32,$16.99,$26.99,http://www.jollychic.com/p/men-s-polo-shirt-cozy-side-split-turn-down-collar-polo-shirt-g590340.html,Men's Polo Shirt Cozy Side Split Turn Down Collar Polo Shirt,Polo Shirts
188,$6.99,$20.99,http://www.jollychic.com/p/men-s-polo-shirt-denim-patchwork-turn-down-collar-personality-polo-shirt-g596982.html,Men's Polo Shirt Denim Patchwork Turn Down Collar Personality Polo Shirt,Polo Shirts
37,$14.99,$24.99,http://www.jollychic.com/p/men-s-polo-shirt-all-match-cozy-short-sleeve-patchwork-polo-shirt-g600212.html,Men's Polo Shirt All Match Cozy Short Sleeve Patchwork Polo Shirt,Polo Shirts
9,$24.99,,http://www.jollychic.com/p/men-s-polo-shirt-stripe-short-sleeve-breathable-polo-shirt-g604062.html,Men's Polo Shirt Stripe Short Sleeve Breathable Polo Shirt,Polo Shirts
36,$10.99,$27.99,http://www.jollychic.com/p/men-s-polo-shirt-solid-color-short-sleeve-cozy-casual-polo-shirt-g606980.html,Men's Polo Shirt Solid Color Short Sleeve Cozy Casual Polo Shirt,Polo Shirts
11,$15.99,$29.99,http://www.jollychic.com/p/men-s-polo-shirt-short-sleeve-turn-down-collar-stripe-polo-shirt-g622034.html,Men's Polo Shirt Short Sleeve Turn Down Collar Stripe Polo Shirt,Polo Shirts
