add_wish,discount_price,original_price,product_link,product_name,header_block
9,$13.99,$25.99,http://www.jollychic.com/p/jesun-s-men-s-polo-shirt-stripe-color-block-short-sleeve-turn-down-collar-polo-shirt-g849458.html,JESUN'S Men's Polo Shirt Stripe Color Block Short Sleeve Turn Down Collar Polo Shirt,Polo Shirts
3,$25.99,,http://www.jollychic.com/p/men-s-polo-shirt-casual-fashion-striped-comfy-polo-shirt-g892858.html,Men's Polo Shirt Casual Fashion Striped Comfy Polo Shirt,Polo Shirts
176,$12.99,$19.99,http://www.jollychic.com/p/men-s-polo-shirt-stand-collar-short-sleeve-casual-comfy-polo-shirt-g903528.html,Men's Polo Shirt Stand Collar Short Sleeve Casual Comfy Polo Shirt,Polo Shirts
41,$15.99,$24.99,http://www.jollychic.com/p/men-s-polo-shirt-striped-pattern-printing-t-shirt-g927992.html,Men's Polo Shirt Striped Pattern Printing T Shirt,Polo Shirts
3,$24.99,,http://www.jollychic.com/p/men-s-polo-shirt-striped-pattern-color-printing-summer-t-shirt-g931190.html,Men's Polo Shirt Striped Pattern Color Printing Summer T Shirt,Polo Shirts
41,$24.99,,http://www.jollychic.com/p/men-s-polo-shirt-button-decoration-stand-collar-solid-color-polo-shirt-g963750.html,Men's Polo Shirt Button Decoration Stand Collar Solid Color Polo Shirt,Polo Shirts
12,$18.99,$22.99,http://www.jollychic.com/p/men-s-polo-shirt-turn-down-collar-short-sleeve-print-button-comfy-polo-shirt-g964774.html,Men's Polo Shirt Turn Down Collar Short Sleeve Print Button Comfy Polo Shirt,Polo Shirts
1,$32.99,,http://www.jollychic.com/p/men-s-polo-shirt-long-sleeve-turn-down-collar-color-block-comfy-t-shirt-g968764.html,Men's Polo Shirt Long Sleeve Turn Down Collar Color Block Comfy T Shirt,Polo Shirts
3,$26.99,,http://www.jollychic.com/p/men-s-polo-shirt-patchwork-cotton-blends-breathable-short-sleeve-polo-shirt-g990198.html,Men's Polo Shirt Patchwork Cotton Blends Breathable Short Sleeve Polo Shirt,Polo Shirts
14,$24.99,,http://www.jollychic.com/p/men-s-polo-shirt-long-sleeve-floral-turn-down-collar-casual-polo-shirt-g1011184.html,Men's Polo Shirt Long Sleeve Floral Turn Down Collar Casual Polo Shirt,Polo Shirts
4,$24.99,,http://www.jollychic.com/p/men-s-polo-shirt-long-sleeve-solid-color-slim-casual-polo-shirt-g1011192.html,Men's Polo Shirt Long Sleeve Solid Color Slim Casual Polo Shirt,Polo Shirts
10,$24.99,,http://www.jollychic.com/p/men-s-polo-shirt-animal-pattern-embroidery-long-sleeve-solid-casual-polo-shirt-g1011194.html,Men's Polo Shirt Animal Pattern Embroidery Long Sleeve Solid Casual Polo Shirt,Polo Shirts
25,$17.99,$26.99,http://www.jollychic.com/p/men-s-polo-shirt-casual-comfy-chic-color-block-fashion-polo-shirt-g1024018.html,Men's Polo Shirt Casual Comfy Chic Color Block Fashion Polo Shirt,Polo Shirts
21,$18.99,,http://www.jollychic.com/p/men-s-polo-shirt-embroidery-turn-down-collar-stylish-polo-shirt-g1029524.html,Men's Polo Shirt Embroidery Turn Down Collar Stylish Polo Shirt,Polo Shirts
6,$17.99,,http://www.jollychic.com/p/men-s-polo-shirt-casual-slim-simple-long-sleeve-polo-shirt-g1029542.html,Men's Polo Shirt Casual Slim Simple Long Sleeve Polo Shirt,Polo Shirts
1,$25.99,,http://www.jollychic.com/p/men-s-polo-shirt-stand-collar-button-decoration-business-style-casual-polo-shirt-g1050460.html,Men's Polo Shirt Stand Collar Button Decoration Business Style Casual Polo Shirt,Polo Shirts
1,$33.99,,http://www.jollychic.com/p/men-s-polo-shirt-simple-striped-casual-short-sleeve-polo-shirt-g1062630.html,Men's Polo Shirt Simple Striped Casual Short Sleeve Polo Shirt,Polo Shirts
0,$15.99,,http://www.jollychic.com/p/men-s-polo-shirt-plaid-pattern-turn-down-collar-short-sleeve-pullover-g1066222.html,Men's Polo Shirt Plaid Pattern Turn Down Collar Short Sleeve Pullover,Polo Shirts
1,$44.99,,http://www.jollychic.com/p/brushfinch-vp-men-s-polo-shirt-casual-ventilate-solid-color-polo-shirt-g1067872.html,BrushFinch&VP Men's Polo Shirt Casual Ventilate Solid Color Polo Shirt,Polo Shirts
1,$20.99,$31.99,http://www.jollychic.com/p/men-s-polo-shirt-solid-color-casual-long-sleeve-polo-shirt-g1116146.html,Men's Polo Shirt Solid Color Casual Long Sleeve Polo Shirt,Polo Shirts
2,$54.00,,http://www.jollychic.com/p/men-s-polo-shirt-striped-turn-down-collar-long-sleeve-pullover-g1138426.html,Men's Polo Shirt Striped Turn Down Collar Long Sleeve Pullover,Polo Shirts
3,$21.99,,http://www.jollychic.com/p/men-s-polo-shirt-button-decoration-turn-down-collar-solid-color-polo-shirt-g1153970.html,Men's Polo Shirt Button Decoration Turn Down Collar Solid Color Polo Shirt,Polo Shirts
2,$21.99,,http://www.jollychic.com/p/men-s-polo-shirt-short-sleeve-turn-down-collar-solid-color-polo-shirt-g1153982.html,Men's Polo Shirt Short Sleeve Turn Down Collar Solid Color Polo Shirt,Polo Shirts
4,$15.99,,http://www.jollychic.com/p/men-s-polo-shirt-fashion-print-stylish-animal-pattern-casual-polo-shirt-g1208468.html,Men's Polo Shirt Fashion Print Stylish Animal Pattern Casual Polo Shirt,Polo Shirts
2,$32.99,,http://www.jollychic.com/p/men-s-polo-shirt-stand-collar-embroidery-brief-casual-polo-shirt-g1215396.html,Men's Polo Shirt Stand Collar Embroidery Brief Casual Polo Shirt,Polo Shirts
1,$29.99,,http://www.jollychic.com/p/men-s-polo-shirt-all-matched-long-sleeve-stylish-color-block-polo-shirt-g1232166.html,Men's Polo Shirt All Matched Long Sleeve Stylish Color Block Polo Shirt,Polo Shirts
163,$7.99,$20.99,http://www.jollychic.com/p/zip-collar-polo-shirt-for-men-g315610.html,Zip Collar Polo Shirt For Men,Polo Shirts
222,$10.99,$32.99,http://www.jollychic.com/p/nice-dots-short-sleeve-fashion-polo-shirt-for-men-g336748.html,Nice Dots Short Sleeve Fashion Polo Shirt For Men,Polo Shirts
102,$8.99,$19.99,http://www.jollychic.com/p/men-s-polo-shirt-solid-color-stand-collar-short-sleeve-cozy-polo-shirt-g545472.html,Men's Polo Shirt Solid Color Stand Collar Short Sleeve Cozy Polo Shirt,Polo Shirts
626,$8.99,$16.99,http://www.jollychic.com/p/men-s-polo-shirt-stand-collar-short-sleeve-casual-slim-polo-shirt-g546012.html,Men's Polo Shirt Stand Collar Short Sleeve Casual Slim Polo Shirt,Polo Shirts
1736,$8.99,$13.99,http://www.jollychic.com/p/men-s-polo-shirt-solid-color-slim-turn-down-collar-polo-shirt-g546690.html,Men's Polo Shirt Solid Color Slim Turn Down Collar Polo Shirt,Polo Shirts
52,$19.99,$30.99,http://www.jollychic.com/p/men-s-polo-shirt-casual-short-sleeve-patchwork-color-polo-shirt-g547670.html,Men's Polo Shirt Casual Short Sleeve Patchwork Color Polo Shirt,Polo Shirts
10,$20.99,$27.99,http://www.jollychic.com/p/men-s-polo-shirt-casual-short-sleeve-patchwork-color-polo-shirt-g549932.html,Men's Polo Shirt Casual Short Sleeve Patchwork Color Polo Shirt,Polo Shirts
159,$12.99,$19.99,http://www.jollychic.com/p/men-s-polo-shirt-solid-color-casual-cozy-long-sleeve-polo-shirt-g557016.html,Men's Polo Shirt Solid Color Casual Cozy Long Sleeve Polo Shirt,Polo Shirts
19,$7.99,$16.99,http://www.jollychic.com/p/men-s-polo-shirt-turn-down-collar-short-sleeve-color-block-slim-casual-top-g558702.html,Men's Polo Shirt Turn Down Collar Short Sleeve Color Block Slim Casual Top,Polo Shirts
13,$10.99,$28.99,http://www.jollychic.com/p/men-s-polo-shirt-colorblock-short-sleeves-turn-down-collar-daily-shirt-g560110.html,Men's Polo Shirt Colorblock Short Sleeves Turn Down Collar Daily Shirt,Polo Shirts
153,$8.99,$17.99,http://www.jollychic.com/p/men-s-polo-shirt-short-sleeves-turn-down-striped-collar-button-solid-soft-shirt-g560246.html,Men's Polo Shirt Short Sleeves Turn Down Striped Collar Button Solid Soft Shirt,Polo Shirts
144,$7.99,$20.99,http://www.jollychic.com/p/men-s-polo-shirt-solid-short-sleeves-turn-down-plaid-collar-button-classic-shirt-g560342.html,Men's Polo Shirt Solid Short Sleeves Turn Down Plaid Collar Button Classic Shirt,Polo Shirts
80,$12.99,$21.99,http://www.jollychic.com/p/men-s-polo-shirt-cotton-blends-patchwork-color-block-comfy-polo-shirt-g563568.html,Men's Polo Shirt Cotton Blends Patchwork Color Block Comfy Polo Shirt,Polo Shirts
23,$11.99,$34.99,http://www.jollychic.com/p/men-s-polo-shirt-all-match-casual-short-sleeve-stripe-slim-fit-polo-shirt-g572306.html,Men's Polo Shirt All Match Casual Short Sleeve Stripe Slim Fit Polo Shirt,Polo Shirts
23,$9.99,$28.99,http://www.jollychic.com/p/men-s-polo-shirt-casual-solid-color-cozy-plus-size-polo-shirt-g580820.html,Men's Polo Shirt Casual Solid Color Cozy Plus Size Polo Shirt,Polo Shirts
28,$9.99,$29.99,http://www.jollychic.com/p/men-s-polo-shirt-solid-cotton-blends-all-match-ventilate-polo-shirt-g580822.html,Men's Polo Shirt Solid Cotton Blends All Match Ventilate Polo Shirt,Polo Shirts
82,$12.99,$20.99,http://www.jollychic.com/p/men-s-polo-shirt-stripe-brief-short-sleeve-fashion-casual-polo-shirt-g581078.html,Men's Polo Shirt Stripe Brief Short Sleeve Fashion Casual Polo Shirt,Polo Shirts
30,$8.99,$14.99,http://www.jollychic.com/p/men-s-plolo-shirt-casual-short-sleeve-turn-down-collar-cozy-polo-shirt-g583814.html,Men's Plolo Shirt Casual Short Sleeve Turn Down Collar Cozy Polo Shirt,Polo Shirts
42,$16.99,$26.99,http://www.jollychic.com/p/men-s-polo-shirt-casual-simple-design-all-match-cozy-slim-polo-shirt-g584082.html,Men's Polo Shirt Casual Simple Design All Match Cozy Slim Polo Shirt,Polo Shirts
94,$15.99,$26.99,http://www.jollychic.com/p/men-s-polo-shirt-patchwork-personality-short-sleeve-polo-shirt-g584086.html,Men's Polo Shirt Patchwork Personality Short Sleeve Polo Shirt,Polo Shirts
26,$9.99,$27.99,http://www.jollychic.com/p/men-s-polo-shirt-short-sleeve-breathable-all-match-casual-polo-shirt-g584196.html,Men's Polo Shirt Short Sleeve Breathable All Match Casual Polo Shirt,Polo Shirts
80,$19.99,$31.99,http://www.jollychic.com/p/men-s-polo-shirt-turn-down-collar-stripe-color-block-short-sleeve-polo-shirt-g587514.html,Men's Polo Shirt Turn Down Collar Stripe Color Block Short Sleeve Polo Shirt,Polo Shirts
11,$14.99,$23.99,http://www.jollychic.com/p/men-s-polo-shirt-casual-coloe-block-patchwork-turn-down-collar-polo-shirt-g597162.html,Men's Polo Shirt Casual Coloe Block Patchwork Turn Down Collar Polo Shirt,Polo Shirts
22,$19.99,$25.99,http://www.jollychic.com/p/men-s-polo-shirt-solid-color-breathable-all-match-casual-polo-shirt-g598908.html,Men's Polo Shirt Solid Color Breathable All Match Casual Polo Shirt,Polo Shirts
16,$26.99,$49.99,http://www.jollychic.com/p/men-s-polo-shirt-cozy-print-turn-down-collar-button-polo-shirt-g614050.html,Men's Polo Shirt Cozy Print Turn Down Collar Button Polo Shirt,Polo Shirts
116,$22.99,$37.99,http://www.jollychic.com/p/men-s-polo-shirt-turn-down-collar-solid-color-casual-polo-shirt-g615068.html,Men's Polo Shirt Turn Down Collar Solid Color Casual Polo Shirt,Polo Shirts
16,$18.99,$29.99,http://www.jollychic.com/p/men-s-polo-shirt-solid-color-stand-collar-leisure-polo-shirt-g615274.html,Men's Polo Shirt Solid Color Stand Collar Leisure Polo Shirt,Polo Shirts
12,$11.99,$17.99,http://www.jollychic.com/p/men-s-polo-shirt-striped-short-sleeve-brief-polo-shirt-g660020.html,Men's Polo Shirt Striped Short Sleeve Brief Polo Shirt,Polo Shirts
18,$17.99,$29.99,http://www.jollychic.com/p/men-s-polo-shirt-slim-short-sleeve-all-match-comfy-polo-shirt-g670724.html,Men's Polo Shirt Slim Short Sleeve All Match Comfy Polo Shirt,Polo Shirts
224,$10.99,$16.99,http://www.jollychic.com/p/men-s-polo-shirt-letter-pattern-casual-turn-down-collar-t-shirt-g678444.html,Men's Polo Shirt Letter Pattern Casual Turn Down Collar T Shirt,Polo Shirts
74,$13.99,$20.99,http://www.jollychic.com/p/men-s-polo-shirt-animal-pattern-short-sleeve-turn-down-collar-polo-shirt-g683694.html,Men's Polo Shirt Animal Pattern Short Sleeve Turn Down Collar Polo Shirt,Polo Shirts
39,$13.99,$20.99,http://www.jollychic.com/p/men-s-polo-shirt-casual-colorblock-butterfly-pattern-short-sleeve-polo-shirt-g683698.html,Men's Polo Shirt Casual Colorblock Butterfly Pattern Short Sleeve Polo Shirt,Polo Shirts
28,$11.99,$19.99,http://www.jollychic.com/p/men-s-polo-shirt-turn-down-collar-striped-leisure-slim-polo-shirt-g686556.html,Men's Polo Shirt Turn Down Collar Striped Leisure Slim Polo Shirt,Polo Shirts
17,$15.99,$20.99,http://www.jollychic.com/p/men-s-polo-shirt-polka-dot-plus-size-short-sleeve-casual-soft-polo-shirt-g713788.html,Men's Polo Shirt Polka Dot Plus Size Short Sleeve Casual Soft Polo Shirt,Polo Shirts
43,$10.99,$17.99,http://www.jollychic.com/p/men-s-t-shirt-short-sleeve-o-neck-cozy-print-hip-hop-stylish-t-shirt-g714094.html,Men's T Shirt Short Sleeve O Neck Cozy Print Hip-Hop Stylish T Shirt,Polo Shirts
137,$13.99,$17.99,http://www.jollychic.com/p/men-s-polo-shirt-all-match-patchwork-color-block-polo-shirt-g725400.html,Men's POLO Shirt All Match Patchwork Color Block Polo Shirt,Polo Shirts
67,$9.99,$14.99,http://www.jollychic.com/p/men-s-polo-shirt-all-match-solid-color-polo-shirt-g735172.html,Men's Polo Shirt All Match Solid Color Polo Shirt,Polo Shirts
122,$11.99,$17.99,http://www.jollychic.com/p/men-s-polo-shirt-all-match-solid-color-polo-shirt-g735176.html,Men's Polo Shirt All Match Solid Color Polo Shirt,Polo Shirts
26,$20.99,,http://www.jollychic.com/p/men-s-polo-shirt-simple-style-turn-down-collar-patchwork-polo-shirt-g763344.html,Men's Polo Shirt Simple Style Turn Down Collar Patchwork Polo Shirt,Polo Shirts
2,$14.99,$23.99,http://www.jollychic.com/p/men-s-polo-shirt-striped-fashion-casual-polo-shirt-g773534.html,Men's Polo Shirt Striped Fashion Casual Polo Shirt,Polo Shirts
4,$18.99,,http://www.jollychic.com/p/men-s-polo-shirt-trendy-patchwork-short-sleeve-turn-down-collar-polo-shirt-g775352.html,Men's Polo Shirt Trendy Patchwork Short Sleeve Turn Down Collar Polo Shirt,Polo Shirts
12,$20.99,$34.99,http://www.jollychic.com/p/men-s-polo-shirt-short-sleeve-cotton-blends-decorative-zipper-casual-polo-shirt-g807566.html,Men's Polo Shirt Short Sleeve Cotton Blends Decorative Zipper Casual Polo Shirt,Polo Shirts
15,$20.99,$33.99,http://www.jollychic.com/p/men-s-sports-polo-shirt-cozy-print-short-sleeve-pullover-g820510.html,Men's Sports Polo Shirt Cozy Print Short Sleeve Pullover,Polo Shirts
2,$11.99,,http://www.jollychic.com/p/men-s-t-shirt-turn-down-collar-print-casual-soft-all-match-t-shirt-g836284.html,Men's T Shirt Turn Down Collar Print Casual Soft All Match T Shirt,Polo Shirts
25,$31.99,,http://www.jollychic.com/p/men-s-polo-shirt-short-sleeve-turn-down-collar-print-polo-shirt-g841444.html,Men's Polo Shirt Short Sleeve Turn Down Collar Print Polo Shirt,Polo Shirts
6,$23.99,$38.99,http://www.jollychic.com/p/men-s-polo-shirt-color-block-stripe-plaid-pattern-slim-top-g866642.html,Men's Polo Shirt Color Block Stripe Plaid Pattern Slim Top,Polo Shirts
14,$27.99,,http://www.jollychic.com/p/men-s-formal-polo-shirt-turn-down-collar-stripe-pattern-slim-top-g889626.html,Men's Formal Polo Shirt Turn Down Collar Stripe Pattern Slim Top,Polo Shirts
12,$22.99,,http://www.jollychic.com/p/men-s-polo-shirt-turn-down-collar-formal-slim-top-g889882.html,Men's Polo Shirt Turn Down Collar Formal Slim Top,Polo Shirts
11,$24.99,,http://www.jollychic.com/p/men-s-polo-shirt-solid-color-business-style-brief-design-casual-polo-shirt-g1011220.html,Men's Polo Shirt Solid Color Business Style Brief Design Casual Polo Shirt,Polo Shirts
13,$17.99,,http://www.jollychic.com/p/men-s-polo-shirt-cotton-blends-solid-color-embroidery-polo-shirt-g1029546.html,Men's Polo Shirt Cotton Blends Solid Color Embroidery Polo Shirt,Polo Shirts
33,$11.99,$17.99,http://www.jollychic.com/p/men-s-polo-shirt-stylish-print-long-sleeve-all-match-polo-shirt-g1035748.html,Men's Polo Shirt Stylish Print Long Sleeve All Match Polo Shirt,Polo Shirts
0,$26.99,,http://www.jollychic.com/p/men-s-polo-shirt-solid-color-casual-brief-design-soft-polo-shirt-g1046384.html,Men's Polo Shirt Solid Color Casual Brief Design Soft Polo Shirt,Polo Shirts
0,$24.99,,http://www.jollychic.com/p/men-s-polo-shirt-simple-pattern-printting-fashion-lapel-polo-shirt-g1057606.html,Men's Polo Shirt Simple Pattern Printting Fashion Lapel Polo Shirt,Polo Shirts
4,$23.99,,http://www.jollychic.com/p/men-s-polo-shirt-cotton-blends-casual-patchwork-color-polo-shirt-g1058662.html,Men's Polo Shirt Cotton Blends Casual Patchwork Color Polo Shirt,Polo Shirts
1,$23.99,,http://www.jollychic.com/p/men-s-polo-shirt-turn-down-collar-casual-all-match-polo-shirt-g1058672.html,Men's Polo Shirt Turn Down Collar Casual All Match Polo Shirt,Polo Shirts
1,$23.99,,http://www.jollychic.com/p/men-s-polo-shirt-striped-short-sleeve-patchwork-casual-polo-shirt-g1066242.html,Men's Polo Shirt Striped Short Sleeve Patchwork Casual Polo Shirt,Polo Shirts
3,$12.99,$16.99,http://www.jollychic.com/p/men-s-polo-shirt-turn-down-collar-slim-casual-polka-dot-polo-shirt-g1088466.html,Men's Polo Shirt Turn Down Collar Slim Casual Polka Dot Polo Shirt,Polo Shirts
0,$13.99,$21.99,http://www.jollychic.com/p/men-s-polo-shirt-buttons-turn-down-collar-pocket-polo-shirt-g1115256.html,Men's Polo Shirt Buttons Turn Down Collar Pocket Polo Shirt,Polo Shirts
0,$25.99,,http://www.jollychic.com/p/men-s-shirt-long-sleeves-polo-turn-down-collar-loose-straight-men-s-shirt-g1117926.html,Men's Shirt Long Sleeves Polo Turn Down Collar Loose Straight Men's Shirt,Polo Shirts
2,$13.99,$24.99,http://www.jollychic.com/p/men-s-shirt-long-sleeves-polo-solid-color-turn-down-collar-loose-straight-men-s-shirt-g1117932.html,Men's Shirt Long Sleeves Polo Solid Color Turn Down Collar Loose Straight Men's Shirt,Polo Shirts
1,$14.99,$23.99,http://www.jollychic.com/p/crocodile-men-s-polo-shirt-short-sleeve-solid-color-all-match-t-shirt-g1120684.html,Crocodile Men's Polo Shirt Short Sleeve Solid Color All Match T Shirt,Polo Shirts
4,$15.99,$20.99,http://www.jollychic.com/p/men-s-polo-shirt-color-block-turn-down-collar-casual-polo-shirt-g1124844.html,Men's Polo Shirt Color Block Turn Down Collar Casual Polo Shirt,Polo Shirts
-1,$42.99,,http://www.jollychic.com/p/men-s-polo-shirt-plus-size-casual-striped-color-block-turn-down-collar-button-polo-shirt-g1221076.html,Men's Polo Shirt Plus Size Casual Striped Color Block Turn Down Collar Button Polo Shirt,Polo Shirts
0,$42.99,,http://www.jollychic.com/p/men-s-polo-shirt-turn-down-collar-short-sleeve-solid-color-polo-shirt-g1221090.html,Men's Polo Shirt Turn Down Collar Short Sleeve Solid Color Polo Shirt,Polo Shirts
7,$31.99,,http://www.jollychic.com/p/men-s-polo-shirt-print-color-block-comfy-fashion-polo-shirt-g1238316.html,Men's Polo Shirt Print Color Block Comfy Fashion Polo Shirt,Polo Shirts
0,$29.99,,http://www.jollychic.com/p/men-s-polo-shirt-cotton-blends-long-sleeve-casual-comfy-polo-shirt-g1241942.html,Men's Polo Shirt Cotton Blends Long Sleeve Casual Comfy Polo Shirt,Polo Shirts
1,$33.99,,http://www.jollychic.com/p/men-s-polo-shirt-casual-all-matched-long-sleeve-color-block-polo-shirt-g1281462.html,Men's Polo Shirt Casual All Matched Long Sleeve Color Block Polo Shirt,Polo Shirts
0,$49.99,$52.00,http://www.jollychic.com/p/septwolves-men-s-polo-shirts-turn-down-collar-patchwork-design-fashion-clothing-g1306156.html,SEPTWOLVES Men's Polo Shirts Turn Down Collar Patchwork Design Fashion Clothing,Polo Shirts
0,$49.99,$52.00,http://www.jollychic.com/p/septwolves-men-s-polo-shirts-turn-down-collar-casual-style-clothing-g1306718.html,SEPTWOLVES Men's Polo Shirts Turn Down Collar Casual Style Clothing,Polo Shirts
133,$6.99,$18.99,http://www.jollychic.com/p/stripe-patch-turn-down-collar-slim-polo-shirt-for-men-g327328.html,Stripe Patch Turn Down Collar Slim Polo Shirt For Men,Polo Shirts
565,$11.99,$17.99,http://www.jollychic.com/p/men-s-polo-shirt-patchwork-short-sleeve-all-match-brief-fashion-polo-shirt-g523496.html,Men's Polo Shirt Patchwork Short Sleeve All Match Brief Fashion Polo Shirt,Polo Shirts
50,$8.99,$19.99,http://www.jollychic.com/p/men-s-polo-shirt-stripe-high-quality-casual-short-sleeve-polo-shirt-g547950.html,Men's Polo Shirt Stripe High Quality Casual Short Sleeve Polo Shirt,Polo Shirts
32,$18.99,,http://www.jollychic.com/p/men-s-polo-shirt-color-block-short-sleeve-breathable-cozy-polo-shirt-g547954.html,Men's Polo Shirt Color Block Short Sleeve Breathable Cozy Polo Shirt,Polo Shirts
98,$19.99,$28.99,http://www.jollychic.com/p/men-s-polo-shirt-short-sleeves-stand-collar-solid-casual-t-shirt-g552254.html,Men's Polo Shirt Short Sleeves Stand Collar Solid Casual T-shirt,Polo Shirts
19,$18.99,$27.99,http://www.jollychic.com/p/men-s-polo-shirt-patchwork-color-block-fashion-comfy-polo-shirt-g554968.html,Men's Polo Shirt Patchwork Color Block Fashion Comfy Polo Shirt,Polo Shirts
13,$11.99,$30.99,http://www.jollychic.com/p/men-s-polo-shirt-turn-down-collar-neck-short-sleeve-slim-color-block-casual-top-g558732.html,Men's Polo Shirt Turn Down Collar Neck Short Sleeve Slim Color Block Casual Top,Polo Shirts
282,$7.99,$13.99,http://www.jollychic.com/p/men-s-polo-shirt-colorblock-short-sleeve-turn-down-collar-comfortable-shirt-g560260.html,Men's Polo Shirt Colorblock Short Sleeve Turn Down Collar Comfortable Shirt,Polo Shirts
48,$9.99,$20.99,http://www.jollychic.com/p/men-s-polo-shirt-colorblock-turn-down-collar-stiped-short-sleeve-polo-shirt-g565332.html,Men's Polo Shirt Colorblock Turn Down Collar Stiped Short Sleeve Polo Shirt,Polo Shirts
167,$11.99,$18.99,http://www.jollychic.com/p/men-s-polo-shirt-fresh-simple-design-patchwork-color-polo-shirt-g572228.html,Men's Polo Shirt Fresh Simple Design Patchwork Color Polo Shirt,Polo Shirts
49,$16.99,$26.99,http://www.jollychic.com/p/men-s-polo-shirt-cotton-blends-breathable-patchwork-short-sleeve-polo-shirt-g581666.html,Men's Polo Shirt Cotton Blends Breathable Patchwork Short Sleeve Polo Shirt,Polo Shirts
21,$19.99,$26.99,http://www.jollychic.com/p/men-s-polo-shirt-short-sleeve-patchwork-color-comforty-polo-shirt-g582610.html,Men's Polo Shirt Short Sleeve Patchwork Color Comforty Polo Shirt,Polo Shirts
5,$18.99,$26.99,http://www.jollychic.com/p/men-s-polo-shirt-stripe-short-sleeve-print-stylish-polo-shirt-g582716.html,Men's Polo Shirt Stripe Short Sleeve Print Stylish Polo Shirt,Polo Shirts
316,$15.99,$26.99,http://www.jollychic.com/p/men-s-polo-shirt-striped-color-block-short-sleeve-cozy-polo-shirt-g584084.html,Men's Polo Shirt Striped Color Block Short Sleeve Cozy Polo Shirt,Polo Shirts
14,$12.99,$20.99,http://www.jollychic.com/p/men-s-polo-shirt-color-block-turn-down-collar-short-sleeve-polo-shirt-g597846.html,Men's Polo Shirt Color Block Turn Down Collar Short Sleeve Polo Shirt,Polo Shirts
24,$7.99,$23.99,http://www.jollychic.com/p/men-s-polo-shirt-stripe-short-sleeve-turn-down-collar-slim-polo-shirt-g610274.html,Men's Polo Shirt Stripe Short Sleeve Turn Down Collar Slim Polo Shirt,Polo Shirts
81,$9.99,$29.99,http://www.jollychic.com/p/men-s-polo-shirt-brief-striped-design-turn-down-collar-polo-shirt-g621104.html,Men's Polo Shirt Brief Striped Design Turn Down Collar Polo Shirt,Polo Shirts
38,$14.99,$20.99,http://www.jollychic.com/p/men-s-polo-shirt-solid-color-plus-size-slim-cozy-polo-shirt-g623368.html,Men's Polo Shirt Solid Color Plus Size Slim Cozy Polo Shirt,Polo Shirts
11,$12.99,$20.99,http://www.jollychic.com/p/men-s-polo-shirt-casual-checkered-turn-down-collar-patchwork-short-sleeve-polo-shirt-g668804.html,Men's Polo Shirt Casual Checkered Turn Down Collar Patchwork Short Sleeve Polo Shirt,Polo Shirts
15,$22.99,$34.99,http://www.jollychic.com/p/men-s-polo-shirt-color-block-short-sleeve-o-neck-casual-polo-shirt-g673022.html,Men's Polo Shirt Color Block Short Sleeve O Neck Casual Polo Shirt,Polo Shirts
63,$10.99,$16.99,http://www.jollychic.com/p/men-s-polo-shirt-cartoon-abdominal-muscles-pattern-turn-down-collar-t-shirt-g678440.html,Men's Polo Shirt Cartoon Abdominal Muscles Pattern Turn Down Collar T Shirt,Polo Shirts
53,$10.99,$16.99,http://www.jollychic.com/p/men-s-polo-shirt-swallow-pattern-turn-down-collar-t-shirt-g678442.html,Men's Polo Shirt Swallow Pattern Turn Down Collar T Shirt,Polo Shirts
38,$17.99,$49.99,http://www.jollychic.com/p/men-s-polo-shirt-fashion-short-sleeve-patchwork-turn-down-collar-polo-shirt-g681824.html,Men's Polo Shirt Fashion Short Sleeve Patchwork Turn Down Collar Polo Shirt,Polo Shirts
36,$20.99,,http://www.jollychic.com/p/men-s-polo-shirt-casual-colorblock-short-sleeve-polo-shirt-g683954.html,Men's Polo Shirt Casual Colorblock Short Sleeve Polo Shirt,Polo Shirts
72,$14.99,$20.99,http://www.jollychic.com/p/men-s-polo-shirt-solid-short-sleeves-turn-down-collar-button-all-match-shirt-g686048.html,Men's Polo Shirt Solid Short Sleeves Turn Down Collar Button All Match Shirt,Polo Shirts
60,$52.00,$75.00,http://www.jollychic.com/p/men-s-polo-shirt-casual-cozy-print-turn-down-collar-polo-shirt-g689466.html,Men's Polo Shirt Casual Cozy Print Turn Down Collar Polo Shirt,Polo Shirts
204,$6.99,$9.99,http://www.jollychic.com/p/men-s-polo-shirt-solid-color-comforty-slim-short-sleeve-polo-shirt-g711926.html,Men's Polo Shirt Solid Color Comforty Slim Short Sleeve Polo Shirt,Polo Shirts
10,$12.99,$20.99,http://www.jollychic.com/p/men-s-polo-shirt-button-decoration-turn-down-collar-stylish-soft-polo-shirt-g713810.html,Men's Polo Shirt Button Decoration Turn Down Collar Stylish Soft Polo Shirt,Polo Shirts
4,$21.99,$33.99,http://www.jollychic.com/p/men-s-polo-shirt-short-sleeve-striped-patchwork-color-polo-shirt-g717896.html,Men's Polo Shirt Short Sleeve Striped Patchwork Color Polo Shirt,Polo Shirts
21,$14.99,$23.99,http://www.jollychic.com/p/men-s-polo-shirt-all-match-polka-dot-striped-polo-shirt-g736064.html,Men's Polo Shirt All Match Polka Dot Striped Polo Shirt,Polo Shirts
15,$19.99,$32.99,http://www.jollychic.com/p/men-s-polo-shirt-simple-style-short-sleeve-striped-comfy-polo-shirt-g754808.html,Men's Polo Shirt Simple Style Short Sleeve Striped Comfy Polo Shirt,Polo Shirts
879,$14.99,$23.99,http://www.jollychic.com/p/men-s-polo-shirt-stand-collar-short-sleeve-solid-comfort-casual-polo-shirt-g758846.html,Men's Polo Shirt Stand Collar Short Sleeve Solid Comfort Casual Polo Shirt,Polo Shirts
5,$18.99,$30.99,http://www.jollychic.com/p/men-s-polo-shirt-floral-pattern-turn-down-collar-short-sleeve-casual-polo-shirt-g761332.html,Men's Polo Shirt Floral Pattern Turn Down Collar Short Sleeve Casual Polo Shirt,Polo Shirts
