add_wish,discount_price,original_price,product_link,product_name,header_block
18,$13.99,$22.99,http://www.jollychic.com/p/men-s-crossbody-bag-stylish-retro-style-solid-color-chest-bag-g793648.html,Men's Crossbody Bag Stylish Retro Style Solid Color Chest Bag,Crossbody Bags
11,$24.99,$39.99,http://www.jollychic.com/p/men-s-crossbody-bag-solid-casual-zipper-design-chest-bag-g793654.html,Men's Crossbody Bag Solid Casual Zipper Design Chest Bag,Crossbody Bags
3,$58.00,$89.00,http://www.jollychic.com/p/men-s-crossbody-bag-solid-color-leather-vertical-design-business-bag-g827064.html,Men's Crossbody Bag Solid Color Leather Vertical Design Business Bag,Crossbody Bags
24,$13.99,$20.99,http://www.jollychic.com/p/men-s-crossbody-bag-business-casual-versatile-all-match-messenger-bag-g867748.html,Men's Crossbody Bag Business Casual Versatile All Match Messenger Bag,Crossbody Bags
4,$40.99,,http://www.jollychic.com/p/men-s-crossbody-bag-fashion-all-match-outdoor-zipper-durable-sports-bag-g868276.html,Men's Crossbody Bag Fashion All Match Outdoor Zipper Durable Sports Bag,Crossbody Bags
19,$13.99,,http://www.jollychic.com/p/men-s-crossbody-bag-canvas-zipper-casual-durable-bag-g874732.html,Men's Crossbody Bag Canvas Zipper Casual Durable Bag,Crossbody Bags
10,$9.99,$15.99,http://www.jollychic.com/p/men-s-crossbody-bag-casual-vintage-sports-bag-g909932.html,Men's Crossbody Bag Casual Vintage Sports Bag,Crossbody Bags
6,$16.99,$25.99,http://www.jollychic.com/p/men-s-crossbody-bag-casual-school-simple-bag-g909936.html,Men's Crossbody Bag Casual School Simple Bag,Crossbody Bags
24,$13.99,$20.99,http://www.jollychic.com/p/men-s-crossbody-bag-zipper-casual-all-match-durable-chest-bag-g922226.html,Men's Crossbody Bag Zipper Casual All Match Durable Chest Bag,Crossbody Bags
6,$33.99,$53.00,http://www.jollychic.com/p/men-s-waist-bag-retro-style-leisure-business-waist-bag-g942626.html,Men's Waist Bag Retro Style Leisure Business Waist Bag,Crossbody Bags
5,$12.99,,http://www.jollychic.com/p/men-s-crossbody-bag-classic-daily-use-sports-casual-travel-canvas-bag-g951580.html,Men's Crossbody Bag Classic Daily Use Sports Casual Travel Canvas Bag,Crossbody Bags
16,$15.99,,http://www.jollychic.com/p/men-s-crossbody-bag-multifunctional-casual-canvas-crossbody-bag-g951620.html,Men's Crossbody Bag Multifunctional Casual Canvas Crossbody Bag,Crossbody Bags
8,$16.99,,http://www.jollychic.com/p/men-s-crossbody-bag-solid-color-travel-casual-canvas-crossbody-bag-g953584.html,Men's Crossbody Bag Solid Color Travel Casual Canvas Crossbody Bag,Crossbody Bags
5,$9.99,,http://www.jollychic.com/p/men-s-crossbady-bag-multifunctional-phone-bag-sports-waist-bag-g956530.html,Men's Crossbady Bag Multifunctional Phone Bag Sports Waist Bag,Crossbody Bags
3,$40.99,,http://www.jollychic.com/p/men-s-crossbody-bag-mini-portable-solid-color-all-match-bag-g956862.html,Men's Crossbody Bag Mini Portable Solid Color All Match Bag,Crossbody Bags
5,$141.00,,http://www.jollychic.com/p/men-s-crossbody-bag-all-match-solid-stylish-business-style-casual-bag-g959042.html,Men's Crossbody Bag All Match Solid Stylish Business Style Casual Bag,Crossbody Bags
3,$21.99,,http://www.jollychic.com/p/men-s-crossbody-bag-simple-casual-multipurpose-chest-bag-g959974.html,Men's Crossbody Bag Simple Casual Multipurpose Chest Bag,Crossbody Bags
7,$11.99,$17.99,http://www.jollychic.com/p/men-s-crossbody-bag-canvas-retro-zipper-unisex-durable-bag-g963054.html,Men's Crossbody Bag Canvas Retro Zipper Unisex Durable Bag,Crossbody Bags
6,$11.99,$17.99,http://www.jollychic.com/p/men-s-crossbody-bag-canvas-zipper-retro-durable-bag-g963056.html,Men's Crossbody Bag Canvas Zipper Retro Durable Bag,Crossbody Bags
5,$15.99,,http://www.jollychic.com/p/men-s-crossbody-bag-zipper-vintage-nylon-unisex-durable-bag-g963072.html,Men's Crossbody Bag Zipper Vintage Nylon Unisex Durable Bag,Crossbody Bags
5,$14.99,,http://www.jollychic.com/p/men-s-chest-bag-vintage-stylish-solid-color-casual-business-canvas-bag-g963692.html,Men's Chest Bag Vintage Stylish Solid Color Casual Business Canvas Bag,Crossbody Bags
4,$20.99,,http://www.jollychic.com/p/men-s-chest-bag-nylon-outdoor-casual-functional-bag-g963838.html,Men's Chest Bag Nylon Outdoor Casual Functional Bag,Crossbody Bags
4,$10.99,,http://www.jollychic.com/p/men-s-chest-bag-waterproof-zipper-professional-outdoor-sports-bag-g973634.html,Men's Chest Bag Waterproof Zipper Professional Outdoor Sports Bag,Crossbody Bags
2,$11.99,$21.99,http://www.jollychic.com/p/men-s-crossbody-bag-nylon-stylish-casual-zipper-solid-color-bag-g979314.html,Men's Crossbody Bag Nylon Stylish Casual Zipper Solid Color Bag,Crossbody Bags
4,$14.99,$22.99,http://www.jollychic.com/p/men-s-crossbody-bag-canvas-zipper-all-match-vintage-bag-g981004.html,Men's Crossbody Bag Canvas Zipper All Match Vintage Bag,Crossbody Bags
5,$13.99,$20.99,http://www.jollychic.com/p/men-s-crossbody-bag-zipper-casual-all-match-durable-chest-bag-g1005364.html,Men's Crossbody Bag Zipper Casual All Match Durable Chest Bag,Crossbody Bags
0,$13.99,$21.99,http://www.jollychic.com/p/men-s-chest-bag-striped-design-waterproof-simple-style-bag-g1017942.html,Men's Chest Bag Striped Design Waterproof Simple Style Bag,Crossbody Bags
12,$48.99,,http://www.jollychic.com/p/men-s-crossbody-bag-canvas-hasp-print-casual-all-match-stylish-bag-g1041688.html,Men's Crossbody Bag Canvas Hasp Print Casual All Match Stylish Bag,Crossbody Bags
2,$9.99,$15.99,http://www.jollychic.com/p/men-s-crossbody-bag-nylon-embroidery-stylish-casual-bag-g1042170.html,Men's Crossbody Bag Nylon Embroidery Stylish Casual Bag,Crossbody Bags
12,$16.99,$22.99,http://www.jollychic.com/p/men-s-crossbody-bag-zipper-design-vintage-solid-color-bag-g1047576.html,Men's Crossbody Bag Zipper Design Vintage Solid Color Bag,Crossbody Bags
0,$17.99,$26.99,http://www.jollychic.com/p/men-s-crossbody-bag-faux-leather-zipper-casual-bag-g1067830.html,Men's Crossbody Bag Faux Leather Zipper Casual Bag,Crossbody Bags
18,$7.99,$11.99,http://www.jollychic.com/p/men-s-chest-bag-casual-simple-durable-solid-color-unisex-bag-g1126662.html,Men's Chest Bag Casual Simple Durable Solid Color Unisex Bag,Crossbody Bags
5,$22.99,,http://www.jollychic.com/p/men-s-crossbody-bag-casual-simple-style-patchwork-color-bag-g1195022.html,Men's Crossbody Bag Casual Simple Style Patchwork Color Bag,Crossbody Bags
1,$25.99,,http://www.jollychic.com/p/men-s-bags-set-2-pcs-chic-wallet-attached-stylish-solid-zipper-design-crossbody-bag-set-g1216408.html,Men's Bags Set 2 Pcs Chic Wallet Attached Stylish Solid Zipper Design Crossbody Bag Set,Crossbody Bags
0,$25.99,,http://www.jollychic.com/p/men-s-chest-bag-2pcs-letter-pattern-solid-color-casual-durable-bag-g1227976.html,Men's Chest Bag 2Pcs Letter Pattern Solid Color Casual Durable Bag,Crossbody Bags
0,$61.00,,http://www.jollychic.com/p/men-s-crossbody-bag-casual-all-match-simple-bag-g1241838.html,Men's Crossbody Bag Casual All Match Simple Bag,Crossbody Bags
0,$17.99,,http://www.jollychic.com/p/men-s-crossbody-bag-casual-striped-waterproof-zipper-chest-bag-g1245028.html,Men's Crossbody Bag Casual Striped Waterproof Zipper Chest Bag,Crossbody Bags
1,$46.99,,http://www.jollychic.com/p/men-s-crossbody-bag-cell-phone-pocket-casual-simple-canvas-bag-g1282538.html,Men's Crossbody Bag Cell Phone Pocket Casual Simple Canvas Bag,Crossbody Bags
674,$8.99,$13.99,http://www.jollychic.com/p/men-s-crossbody-bag-brief-solid-color-design-functional-mini-style-shoulder-bag-g431296.html,Men's Crossbody Bag Brief Solid Color Design Functional Mini Style Shoulder Bag,Crossbody Bags
209,$13.99,$19.99,http://www.jollychic.com/p/men-s-crossbody-bag-solid-color-canvas-casual-pockets-design-bag-g471034.html,Men's Crossbody Bag Solid Color Canvas Casual Pockets Design Bag,Crossbody Bags
651,$7.99,$12.99,http://www.jollychic.com/p/men-s-crossbody-bag-fashion-pure-color-convenient-functional-chest-bag-g473228.html,Men's Crossbody Bag Fashion Pure Color Convenient Functional Chest Bag,Crossbody Bags
358,$7.99,$11.99,http://www.jollychic.com/p/men-s-crossbody-bag-canvas-functional-convenient-durable-chest-bag-g473232.html,Men's Crossbody Bag Canvas Functional Convenient Durable Chest Bag,Crossbody Bags
21,$15.99,$25.99,http://www.jollychic.com/p/men-s-crossbody-bag-patchwork-crocodile-style-vintage-casual-bag-g550890.html,Men's Crossbody Bag Patchwork Crocodile Style Vintage Casual Bag,Crossbody Bags
85,$17.99,$26.99,http://www.jollychic.com/p/men-s-crossbody-bag-leather-solid-color-pockets-functional-bag-g673160.html,Men's Crossbody Bag Leather Solid Color Pockets Functional Bag,Crossbody Bags
14,$17.99,$26.99,http://www.jollychic.com/p/men-s-crossbody-bag-center-zip-solid-color-office-style-leather-bag-g673394.html,Men's Crossbody Bag Center Zip Solid Color Office Style Leather Bag,Crossbody Bags
49,$8.99,$13.99,http://www.jollychic.com/p/men-s-crossbody-bag-multifunctional-zipper-design-casual-bag-g679532.html,Men's Crossbody Bag Multifunctional Zipper Design Casual Bag,Crossbody Bags
19,$14.99,,http://www.jollychic.com/p/men-s-crossbody-bag-canvas-zipper-camouflage-print-casual-all-match-stylish-bag-g690138.html,Men's Crossbody Bag Canvas Zipper Camouflage Print Casual All Match Stylish Bag,Crossbody Bags
57,$11.99,$17.99,http://www.jollychic.com/p/men-s-crossbody-bag-canvas-zipper-print-casual-all-match-stylish-bag-g692960.html,Men's Crossbody Bag Canvas Zipper Print Casual All Match Stylish Bag,Crossbody Bags
8,$17.99,$29.99,http://www.jollychic.com/p/men-s-crossbody-bag-casual-colorblock-all-match-bag-g699708.html,Men's Crossbody Bag Casual Colorblock All Match Bag,Crossbody Bags
16,$36.99,,http://www.jollychic.com/p/men-s-crossbody-bag-fashion-metal-decoration-zipper-bag-g710778.html,Men's Crossbody Bag Fashion Metal Decoration Zipper Bag,Crossbody Bags
8,$16.99,$25.99,http://www.jollychic.com/p/men-s-crossbody-bag-fashion-lightweight-zipper-chest-bag-g790838.html,Men's Crossbody Bag Fashion Lightweight Zipper Chest Bag,Crossbody Bags
3,$36.99,,http://www.jollychic.com/p/men-s-crossbody-bag-pu-stylish-design-functional-casual-bag-g791950.html,Men's Crossbody Bag PU Stylish Design Functional Casual Bag,Crossbody Bags
3,$69.00,$106.00,http://www.jollychic.com/p/men-s-crossbody-bag-pu-zipper-solid-color-casual-all-match-stylish-bag-g812808.html,Men's Crossbody Bag PU Zipper Solid Color Casual All Match Stylish Bag,Crossbody Bags
36,$8.99,,http://www.jollychic.com/p/men-s-crossbody-bag-canvas-zipper-casual-all-match-stylish-bag-g847854.html,Men's Crossbody Bag Canvas Zipper Casual All Match Stylish Bag,Crossbody Bags
5,$28.99,$43.99,http://www.jollychic.com/p/men-s-crossbody-bag-solid-durable-water-proof-simple-style-all-match-bag-g858242.html,Men's Crossbody Bag Solid Durable Water Proof Simple Style All Match Bag,Crossbody Bags
3,$33.99,,http://www.jollychic.com/p/men-s-crossbody-bag-business-all-match-casual-durable-messenger-bag-g868014.html,Men's Crossbody Bag Business All Match Casual Durable Messenger Bag,Crossbody Bags
7,$26.99,$40.99,http://www.jollychic.com/p/men-s-crossbody-bag-vintage-style-trendy-casual-all-match-bag-g868146.html,Men's Crossbody Bag Vintage Style Trendy Casual All Match Bag,Crossbody Bags
18,$28.99,$41.99,http://www.jollychic.com/p/men-s-crossbody-bag-multi-color-durable-fashion-versatile-chest-bag-g882580.html,Men's Crossbody Bag Multi-Color Durable Fashion Versatile Chest Bag,Crossbody Bags
22,$18.99,$28.99,http://www.jollychic.com/p/men-s-crossbody-bag-faddish-solid-color-zipper-versatile-durable-bag-g883726.html,Men's Crossbody Bag Faddish Solid Color Zipper Versatile Durable Bag,Crossbody Bags
1,$52.00,$80.00,http://www.jollychic.com/p/men-s-chest-bag-retro-style-solid-color-business-chest-bag-g942654.html,Men's Chest Bag Retro Style Solid Color Business Chest Bag,Crossbody Bags
2,$34.99,$55.00,http://www.jollychic.com/p/men-s-handbag-pu-brief-style-large-capacity-handbag-g945686.html,Men's Handbag PU Brief Style Large Capacity Handbag,Crossbody Bags
13,$7.99,$12.99,http://www.jollychic.com/p/men-s-women-s-crossbody-bag-solid-color-casual-canvas-bag-g950908.html,Men's/Women's Crossbody Bag Solid Color Casual Canvas Bag,Crossbody Bags
5,$11.99,$17.99,http://www.jollychic.com/p/men-s-crossbody-bag-canvas-zipper-print-casual-all-match-stylish-bag-g951584.html,Men's Crossbody Bag Canvas Zipper Print Casual All Match Stylish Bag,Crossbody Bags
0,$83.00,,http://www.jollychic.com/p/men-s-crossbody-bag-shiny-smooth-trendy-classic-business-bag-g957218.html,Men's Crossbody Bag Shiny Smooth Trendy Classic Business Bag,Crossbody Bags
2,$26.99,,http://www.jollychic.com/p/men-s-crossbody-bag-waterproof-solid-color-casual-classic-bag-g957220.html,Men's Crossbody Bag Waterproof Solid Color Casual Classic Bag,Crossbody Bags
4,$12.99,,http://www.jollychic.com/p/men-s-crossbody-bag-simple-casual-multipurpose-canvas-bag-g959704.html,Men's Crossbody Bag Simple Casual Multipurpose Canvas Bag,Crossbody Bags
18,$7.99,$12.99,http://www.jollychic.com/p/men-s-crossbody-bag-simple-casual-multipurpose-chest-bag-g960136.html,Men's Crossbody Bag Simple Casual Multipurpose Chest Bag,Crossbody Bags
24,$15.99,$23.99,http://www.jollychic.com/p/men-s-crossbody-bag-functional-business-style-canvas-office-casual-bag-g962772.html,Men's Crossbody Bag Functional Business Style Canvas Office Casual Bag,Crossbody Bags
0,$14.99,$22.99,http://www.jollychic.com/p/men-s-crossbody-bag-zipper-nylon-chic-durable-bag-g963062.html,Men's Crossbody Bag Zipper Nylon Chic Durable Bag,Crossbody Bags
8,$10.99,,http://www.jollychic.com/p/men-s-crossbody-bag-canvas-interior-compartment-casual-bag-g963524.html,Men's Crossbody Bag Canvas Interior Compartment Casual Bag,Crossbody Bags
4,$20.99,,http://www.jollychic.com/p/men-s-chest-bag-nylon-outdoor-waterproof-casual-camouflage-unisex-bag-g963846.html,Men's Chest Bag Nylon Outdoor Waterproof Casual Camouflage Unisex Bag,Crossbody Bags
1,$21.99,,http://www.jollychic.com/p/men-s-chest-bag-nylon-outdoor-casual-stylish-functional-bag-g963850.html,Men's Chest Bag Nylon Outdoor Casual Stylish Functional Bag,Crossbody Bags
81,$7.99,$12.99,http://www.jollychic.com/p/men-s-crossbody-bag-canvas-solid-vintage-bag-g964704.html,Men's Crossbody Bag Canvas Solid Vintage Bag,Crossbody Bags
6,$15.99,$24.99,http://www.jollychic.com/p/men-s-crossbody-bag-oxford-vintage-zipper-durable-retro-single-shoulder-bag-g987298.html,Men's Crossbody Bag Oxford Vintage Zipper Durable Retro Single Shoulder Bag,Crossbody Bags
12,$13.99,$20.99,http://www.jollychic.com/p/men-s-crossbody-bag-solid-color-retro-style-all-match-bag-g990560.html,Men's Crossbody Bag Solid Color Retro Style All Match Bag,Crossbody Bags
13,$7.99,$12.99,http://www.jollychic.com/p/men-s-crossbody-bag-zipper-casual-all-match-durable-bag-g1005544.html,Men's Crossbody Bag Zipper Casual All Match Durable Bag,Crossbody Bags
23,$6.99,$10.99,http://www.jollychic.com/p/men-s-crossbody-bag-canvas-zipper-color-block-casual-all-match-stylish-bag-g1007280.html,Men's Crossbody Bag Canvas Zipper Color Block Casual All Match Stylish Bag,Crossbody Bags
22,$9.99,$15.99,http://www.jollychic.com/p/men-s-crossbody-bag-canvas-zipper-casual-all-match-stylish-bag-g1007572.html,Men's Crossbody Bag Canvas Zipper Casual All Match Stylish Bag,Crossbody Bags
11,$8.99,$14.99,http://www.jollychic.com/p/men-s-chest-bag-solid-canvas-multifunctional-casual-bag-g1007578.html,Men's Chest Bag Solid Canvas Multifunctional Casual Bag,Crossbody Bags
3,$15.99,$24.99,http://www.jollychic.com/p/men-s-crossbody-bag-zipper-casual-all-match-durable-chest-bag-g1041824.html,Men's Crossbody Bag Zipper Casual All Match Durable Chest Bag,Crossbody Bags
0,$18.99,$29.99,http://www.jollychic.com/p/men-s-chest-bag-brief-large-capacity-solid-canvas-casual-bag-g1063098.html,Men's Chest Bag Brief Large Capacity Solid Canvas Casual Bag,Crossbody Bags
7,$23.99,$36.99,http://www.jollychic.com/p/men-s-crossbody-bag-solid-color-pu-durable-bag-g1152770.html,Men's Crossbody Bag Solid Color PU Durable Bag,Crossbody Bags
8,$22.99,,http://www.jollychic.com/p/men-s-crossbody-bag-trendy-all-match-letter-pattern-patchwork-bag-g1195036.html,Men's Crossbody Bag Trendy All Match Letter Pattern Patchwork Bag,Crossbody Bags
0,$24.99,,http://www.jollychic.com/p/men-s-crossbody-bag-interior-compartment-casual-hasp-design-bag-g1228732.html,Men's Crossbody Bag Interior Compartment Casual Hasp Design Bag,Crossbody Bags
0,$15.99,,http://www.jollychic.com/p/men-s-crossbody-bag-classic-canvas-outdoor-durable-chest-bag-g1245042.html,Men's Crossbody Bag Classic Canvas Outdoor Durable Chest Bag,Crossbody Bags
1,$35.99,,http://www.jollychic.com/p/men-s-crossbody-bag-solid-color-outdoor-leisure-sporty-comfy-bag-g1261710.html,Men's Crossbody Bag Solid Color Outdoor Leisure Sporty Comfy Bag,Crossbody Bags
1,$22.99,,http://www.jollychic.com/p/men-s-crossbody-bag-canvas-solid-color-stylish-bag-g1279404.html,Men's Crossbody Bag Canvas Solid Color Stylish Bag,Crossbody Bags
154,$18.99,$28.99,http://www.jollychic.com/p/men-s-crossbody-bag-casual-vintage-multi-layer-solid-color-fashion-bag-g462868.html,Men's Crossbody Bag Casual Vintage Multi Layer Solid Color Fashion Bag,Crossbody Bags
140,$6.99,$11.99,http://www.jollychic.com/p/men-s-crossbody-bag-canvas-vintage-casual-durable-messenger-bag-g577034.html,Men's Crossbody Bag Canvas Vintage Casual Durable Messenger Bag,Crossbody Bags
50,$17.99,$23.99,http://www.jollychic.com/p/men-s-crossbody-bag-functional-business-style-leather-office-bag-g673166.html,Men's Crossbody Bag Functional Business Style Leather Office Bag,Crossbody Bags
14,$10.99,$16.99,http://www.jollychic.com/p/men-s-crossbody-bag-functional-simple-style-cozy-chest-bag-g679264.html,Men's Crossbody Bag Functional Simple Style Cozy Chest Bag,Crossbody Bags
108,$8.99,$12.99,http://www.jollychic.com/p/men-s-crossbody-bag-canvas-zipper-cozy-print-casual-all-match-stylish-bag-g690108.html,Men's Crossbody Bag Canvas Zipper Cozy Print Casual All Match Stylish Bag,Crossbody Bags
6,$16.99,$25.99,http://www.jollychic.com/p/men-s-crossbody-bag-zipper-striped-trendy-all-mach-bag-g699782.html,Men's Crossbody Bag Zipper Striped Trendy All Mach Bag,Crossbody Bags
11,$15.99,,http://www.jollychic.com/p/men-s-crossbody-bag-camouflage-stylish-design-cozy-chest-bag-g725152.html,Men's Crossbody Bag Camouflage Stylish Design Cozy Chest Bag,Crossbody Bags
5,$18.99,$31.99,http://www.jollychic.com/p/men-s-crossbody-bag-multi-color-casual-all-match-durable-pu-leather-chest-bag-g731020.html,Men's Crossbody Bag Multi-Color Casual All Match Durable PU Leather Chest Bag,Crossbody Bags
4,$18.99,$31.99,http://www.jollychic.com/p/men-s-crossbody-bag-simple-style-solid-color-all-match-versatile-sport-chest-bag-g731174.html,Men's Crossbody Bag Simple Style Solid Color All Match Versatile Sport Chest Bag,Crossbody Bags
4,$53.00,$82.00,http://www.jollychic.com/p/men-s-crossbody-bag-pu-zipper-solid-color-all-match-stylish-bag-g821316.html,Men's Crossbody Bag PU Zipper Solid Color All Match Stylish Bag,Crossbody Bags
16,$29.99,,http://www.jollychic.com/p/men-s-crossbody-bag-casual-solid-daily-briefcase-bag-g892136.html,Men's Crossbody Bag Casual Solid Daily Briefcase Bag,Crossbody Bags
13,$55.00,,http://www.jollychic.com/p/bostanten-men-s-crossbody-bag-top-fashion-casual-solid-striped-daily-bag-g892142.html,Bostanten Men's Crossbody Bag Top Fashion Casual Solid Striped Daily Bag,Crossbody Bags
3,$37.99,$59.00,http://www.jollychic.com/p/men-s-crossbody-bag-solid-color-leisure-business-bag-g942638.html,Men's Crossbody Bag Solid Color Leisure Business Bag,Crossbody Bags
2,$33.99,$53.00,http://www.jollychic.com/p/men-s-crossbody-bag-simple-solid-multi-pockets-soft-business-bag-g949054.html,Men's Crossbody Bag Simple Solid Multi Pockets Soft Business Bag,Crossbody Bags
4,$83.00,,http://www.jollychic.com/p/men-s-crossbody-bag-simple-lining-solid-color-versatile-business-bag-g957202.html,Men's Crossbody Bag Simple Lining Solid Color Versatile Business Bag,Crossbody Bags
9,$11.99,$17.99,http://www.jollychic.com/p/men-s-crossbody-bag-zipper-durable-color-block-functional-unisex-bag-g963076.html,Men's Crossbody Bag Zipper Durable Color Block Functional Unisex Bag,Crossbody Bags
8,$10.99,$16.99,http://www.jollychic.com/p/men-s-crossbody-bag-nylon-all-match-high-quality-casual-bag-g964464.html,Men's Crossbody Bag Nylon All Match High Quality Casual Bag,Crossbody Bags
14,$20.99,,http://www.jollychic.com/p/men-s-crossbody-bag-nylon-sports-functional-durable-bag-g964470.html,Men's Crossbody Bag Nylon Sports Functional Durable Bag,Crossbody Bags
7,$21.99,$34.99,http://www.jollychic.com/p/men-s-handbag-stylish-side-zipper-solid-color-high-capacity-business-bag-g964754.html,Men's Handbag Stylish Side Zipper Solid Color High Capacity Business Bag,Crossbody Bags
7,$14.99,$28.99,http://www.jollychic.com/p/men-s-chest-bag-pu-zipper-stylish-design-chic-bag-g980326.html,Men's Chest Bag PU Zipper Stylish Design Chic Bag,Crossbody Bags
5,$38.99,,http://www.jollychic.com/p/men-s-chest-bag-casual-durable-personality-solid-color-mini-bag-g990552.html,Men's Chest Bag Casual Durable Personality Solid Color Mini Bag,Crossbody Bags
2,$7.99,$11.99,http://www.jollychic.com/p/men-s-crossbody-bag-solid-color-simple-casual-cycling-bag-g996040.html,Men's Crossbody Bag Solid Color Simple Casual Cycling Bag,Crossbody Bags
2,$9.99,$14.99,http://www.jollychic.com/p/men-s-crossbody-bag-interior-zipper-pocket-creative-design-bag-g996090.html,Men's Crossbody Bag Interior Zipper Pocket Creative Design Bag,Crossbody Bags
2,$18.99,$26.99,http://www.jollychic.com/p/men-s-crossbody-bag-canvas-hasp-casual-all-match-stylish-bag-g1007574.html,Men's Crossbody Bag Canvas Hasp Casual All Match Stylish Bag,Crossbody Bags
4,$23.99,,http://www.jollychic.com/p/men-s-chest-bag-patchwork-color-block-zipper-design-unisex-bag-g1018392.html,Men's Chest Bag Patchwork Color Block Zipper Design Unisex Bag,Crossbody Bags
3,$13.99,$20.99,http://www.jollychic.com/p/men-s-crossbody-bag-zipper-casual-all-match-durable-phone-bag-g1020030.html,Men's Crossbody Bag Zipper Casual All Match Durable Phone Bag,Crossbody Bags
3,$10.99,$15.99,http://www.jollychic.com/p/men-s-chest-bag-casual-canvas-solid-color-outdoor-cycling-bag-g1047706.html,Men's Chest Bag Casual Canvas Solid Color Outdoor Cycling Bag,Crossbody Bags
4,$13.99,$21.99,http://www.jollychic.com/p/men-s-chest-bag-waterproof-all-match-casual-bag-g1067820.html,Men's Chest bag Waterproof All Match Casual Bag,Crossbody Bags
10,$25.99,,http://www.jollychic.com/p/men-s-chest-bag-solid-color-multifunctional-casual-bag-g1090256.html,Men's Chest Bag Solid Color Multifunctional Casual Bag,Crossbody Bags
2,$11.99,$18.99,http://www.jollychic.com/p/men-s-chest-bag-solid-canvas-multifunctional-casual-bag-g1090502.html,Men's Chest Bag Solid Canvas Multifunctional Casual Bag,Crossbody Bags
8,$9.99,$15.99,http://www.jollychic.com/p/men-s-crossbody-bag-faux-leather-vintage-durable-leisure-bag-g1173410.html,Men's Crossbody Bag Faux Leather Vintage Durable Leisure Bag,Crossbody Bags
1,$28.99,,http://www.jollychic.com/p/men-s-crossbody-bag-leisure-patchwork-color-large-capacity-bag-g1195020.html,Men's Crossbody Bag Leisure Patchwork Color Large Capacity Bag,Crossbody Bags
0,$24.99,,http://www.jollychic.com/p/men-s-crossbody-bag-casual-vintage-outdoor-cycling-durable-bag-g1228734.html,Men's Crossbody Bag Casual Vintage Outdoor Cycling Durable Bag,Crossbody Bags
0,$15.99,,http://www.jollychic.com/p/men-s-crossbody-bag-simple-style-canvas-outdoor-sporty-chest-bag-g1245034.html,Men's Crossbody Bag Simple Style Canvas Outdoor Sporty Chest Bag,Crossbody Bags
1,$22.99,,http://www.jollychic.com/p/men-s-crossbody-bag-casual-cycling-simple-style-light-bag-g1261712.html,Men's Crossbody Bag Casual Cycling Simple Style Light Bag,Crossbody Bags
2,$52.00,,http://www.jollychic.com/p/men-s-crossbody-bag-durable-comfy-fashion-solid-color-bag-g1277920.html,Men's Crossbody Bag Durable Comfy Fashion Solid Color Bag,Crossbody Bags
3,$43.99,,http://www.jollychic.com/p/men-s-crossbody-bag-solid-color-casual-school-light-weight-bag-g1282536.html,Men's Crossbody Bag Solid Color Casual School Light Weight Bag,Crossbody Bags
1015,$11.99,$15.99,http://www.jollychic.com/p/men-s-crossbody-bag-solid-color-fashion-casual-bag-g464364.html,Men's Crossbody Bag Solid Color Fashion Casual Bag,Crossbody Bags
197,$27.99,$39.99,http://www.jollychic.com/p/men-s-crossbody-bag-free-clutch-casual-waterproof-pu-high-quality-brief-bag-g499296.html,Men's Crossbody Bag Free Clutch Casual Waterproof PU High Quality Brief Bag,Crossbody Bags
162,$7.99,$12.99,http://www.jollychic.com/p/men-s-crossbody-bag-canvas-vintage-all-match-leisure-bag-g577028.html,Men's Crossbody Bag Canvas Vintage All Match Leisure Bag,Crossbody Bags
27,$162.00,,http://www.jollychic.com/p/men-s-crossbody-bag-retro-style-zipper-closure-useful-leather-bag-g687320.html,Men's Crossbody Bag Retro Style Zipper Closure Useful Leather Bag,Crossbody Bags
25,$14.99,$25.99,http://www.jollychic.com/p/men-s-crossbody-bag-fashion-letter-portable-casual-bag-g699760.html,Men's Crossbody Bag Fashion Letter Portable Casual Bag,Crossbody Bags
3,$21.99,$33.99,http://www.jollychic.com/p/men-s-crossbody-bag-pu-zipper-soft-stripe-durable-bag-g733586.html,Men's Crossbody Bag PU Zipper Soft Stripe Durable Bag,Crossbody Bags
31,$25.99,$40.99,http://www.jollychic.com/p/men-s-crossbody-bag-pu-vintage-solid-color-high-quality-bag-g733598.html,Men's Crossbody Bag PU Vintage Solid Color High Quality Bag,Crossbody Bags
13,$29.99,$49.99,http://www.jollychic.com/p/men-s-crossbody-bag-all-match-durable-solid-color-chic-bag-g739724.html,Men's Crossbody Bag All Match Durable Solid Color Chic Bag,Crossbody Bags
5,$26.99,$40.99,http://www.jollychic.com/p/men-s-crossbody-bag-fashion-zipper-casual-chic-crossbody-bag-g817696.html,Men's Crossbody Bag Fashion Zipper Casual Chic Crossbody Bag,Crossbody Bags
