add_wish,discount_price,original_price,product_link,product_name,header_block
89,$17.99,$26.99,http://www.jollychic.com/p/men-s-crossbody-bag-casual-pu-solid-color-waterproof-chest-bag-g462858.html,Men's Crossbody Bag Casual PU Solid Color Waterproof Chest Bag,Crossbody Bags
10,$23.99,,http://www.jollychic.com/p/men-s-chest-bag-solid-color-travel-durable-simple-faddish-bag-g1138962.html,Men's Chest Bag Solid Color Travel Durable Simple Faddish Bag,Crossbody Bags
41,$36.99,$57.00,http://www.jollychic.com/p/men-s-crossbody-bag-business-solid-color-personality-square-bag-g739726.html,Men's Crossbody Bag Business Solid Color Personality Square Bag,Crossbody Bags
6,$23.99,,http://www.jollychic.com/p/men-s-chest-bag-outdoor-large-capacity-cycling-leisure-bag-g1138966.html,Men's Chest Bag Outdoor Large Capacity Cycling Leisure Bag,Crossbody Bags
179,$7.99,$12.99,http://www.jollychic.com/p/men-s-crossbody-bag-multifunctional-high-capacity-travel-canvas-crossbody-bag-g960924.html,Men's Crossbody Bag Multifunctional High Capacity Travel Canvas Crossbody Bag,Crossbody Bags
14,$13.99,$21.99,http://www.jollychic.com/p/men-s-crossbody-bag-retro-style-simple-casual-solid-color-bag-g1017954.html,Men's Crossbody Bag Retro Style Simple Casual Solid Color Bag,Crossbody Bags
7,$8.99,$13.99,http://www.jollychic.com/p/men-s-crossbody-bag-multi-layer-canvas-solid-color-outdoor-bag-g996046.html,Men's Crossbody Bag Multi Layer Canvas Solid Color Outdoor Bag,Crossbody Bags
49,$14.99,$22.99,http://www.jollychic.com/p/men-s-crossbody-bag-functional-business-style-canvas-casual-bag-g963660.html,Men's Crossbody Bag Functional Business Style Canvas Casual Bag,Crossbody Bags
15,$12.99,$20.99,http://www.jollychic.com/p/men-s-crossbody-bag-zipper-casual-all-match-durable-chest-bag-g602726.html,Men's Crossbody Bag Zipper Casual All Match Durable Chest Bag,Crossbody Bags
9,$29.99,,http://www.jollychic.com/p/men-s-crossbody-bag-vintage-canvas-all-match-casual-bag-g625028.html,Men's Crossbody Bag Vintage Canvas All Match Casual Bag,Crossbody Bags
76,$11.99,$18.99,http://www.jollychic.com/p/men-s-crossbody-bag-stylish-zipper-casual-durable-bag-g711232.html,Men's Crossbody Bag Stylish Zipper Casual Durable Bag,Crossbody Bags
12,$25.99,$40.99,http://www.jollychic.com/p/men-s-crossbody-bag-pu-all-match-leisure-stylish-bag-g725120.html,Men's Crossbody Bag PU All Match Leisure Stylish Bag,Crossbody Bags
21,$25.99,$40.99,http://www.jollychic.com/p/men-s-crossbody-bag-pu-solid-color-pu-zipper-durable-bag-g725140.html,Men's Crossbody Bag PU Solid Color PU Zipper Durable Bag,Crossbody Bags
8,$14.99,$22.99,http://www.jollychic.com/p/men-s-crossbody-bag-pu-casual-zipper-durable-bag-g725150.html,Men's Crossbody Bag PU Casual Zipper Durable Bag,Crossbody Bags
21,$12.99,$19.99,http://www.jollychic.com/p/men-s-crossbody-bag-pu-solid-color-casual-all-match-bag-g725154.html,Men's Crossbody Bag PU Solid Color Casual All match Bag,Crossbody Bags
3,$70.00,,http://www.jollychic.com/p/videng-polo-men-s-crossbody-bag-multifunctional-business-soft-casual-bag-g725928.html,Videng Polo Men's Crossbody Bag Multifunctional Business Soft Casual Bag,Crossbody Bags
20,$32.99,,http://www.jollychic.com/p/men-s-crossbody-bag-casual-all-match-functional-solid-color-chest-bag-g730920.html,Men's Crossbody Bag Casual All Match Functional Solid Color Chest Bag,Crossbody Bags
13,$23.99,,http://www.jollychic.com/p/men-s-crossbody-bag-vintage-pu-leather-durable-business-all-match-sling-bag-g731236.html,Men's Crossbody Bag Vintage PU Leather Durable Business All Match Sling Bag,Crossbody Bags
61,$9.99,$16.99,http://www.jollychic.com/p/men-s-crossbody-bag-nylon-solid-color-zipper-lightweight-bag-g793468.html,Men's Crossbody Bag Nylon Solid Color Zipper Lightweight Bag,Crossbody Bags
20,$14.99,$22.99,http://www.jollychic.com/p/vegoo-men-s-crossbody-bag-fancy-solid-color-all-match-bag-g901596.html,VEGOO Men's Crossbody Bag Fancy Solid Color All Match Bag,Crossbody Bags
0,$76.00,,http://www.jollychic.com/p/men-s-crossbody-bag-business-leisure-solid-color-crossbody-bag-g942650.html,Men's Crossbody Bag Business Leisure Solid Color Crossbody Bag,Crossbody Bags
25,$34.99,$55.00,http://www.jollychic.com/p/men-s-handbag-pu-brief-style-large-capacity-travel-bag-g945684.html,Men's Handbag PU Brief Style Large Capacity Travel Bag,Crossbody Bags
8,$10.99,,http://www.jollychic.com/p/men-s-women-s-crossbody-bag-solid-color-multifunctional-casual-canvas-bag-g951438.html,Men's/Women's Crossbody Bag Solid Color Multifunctional Casual Canvas Bag,Crossbody Bags
2,$9.99,$14.99,http://www.jollychic.com/p/men-s-crossbody-outdoor-travel-solid-color-canvas-crossbody-bag-g952120.html,Men's Crossbody Outdoor Travel Solid Color Canvas Crossbody Bag,Crossbody Bags
3,$60.00,$88.00,http://www.jollychic.com/p/men-s-crossbody-bag-solid-color-vintage-classic-square-business-bag-g956850.html,Men's Crossbody Bag Solid Color Vintage Classic Square Business Bag,Crossbody Bags
5,$21.99,,http://www.jollychic.com/p/women-s-crossbody-bag-small-size-square-brief-case-trendy-bag-g956864.html,Women's Crossbody Bag Small Size Square Brief Case Trendy Bag,Crossbody Bags
2,$30.99,,http://www.jollychic.com/p/men-s-handbag-business-style-solid-zipper-briefcase-stylish-bag-g959044.html,Men's Handbag Business Style Solid Zipper Briefcase Stylish Bag,Crossbody Bags
9,$12.99,,http://www.jollychic.com/p/men-s-crossbody-bag-cycling-outdoor-travel-waist-bag-g961686.html,Men's Crossbody Bag Cycling Outdoor Travel Waist Bag,Crossbody Bags
11,$17.99,,http://www.jollychic.com/p/men-s-crossbody-bag-nylon-zipper-solid-color-all-match-unisex-bag-g963096.html,Men's Crossbody Bag Nylon Zipper Solid Color All Match Unisex Bag,Crossbody Bags
7,$17.99,$26.99,http://www.jollychic.com/p/men-s-backpack-nylon-vintage-zipper-casual-high-quality-unisex-bag-g964468.html,Men's Backpack Nylon Vintage Zipper Casual High Quality Unisex Bag,Crossbody Bags
10,$17.99,,http://www.jollychic.com/p/men-s-crossbody-bag-nylon-high-quality-functional-unisex-bag-g964476.html,Men's Crossbody Bag Nylon High Quality Functional Unisex Bag,Crossbody Bags
4,$26.99,,http://www.jollychic.com/p/men-s-crossbody-bag-canvas-zipper-casual-all-match-stylish-bag-g964652.html,Men's Crossbody Bag Canvas Zipper Casual All Match Stylish Bag,Crossbody Bags
18,$9.99,,http://www.jollychic.com/p/men-s-crossbody-bag-camouflage-zipper-casual-chest-bag-g979228.html,Men's Crossbody Bag Camouflage Zipper Casual Chest Bag,Crossbody Bags
8,$16.99,$25.99,http://www.jollychic.com/p/men-s-crossbody-bag-fabric-zipper-solid-color-bag-g992540.html,Men's Crossbody Bag Fabric Zipper Solid Color Bag,Crossbody Bags
18,$6.99,$10.99,http://www.jollychic.com/p/men-s-crossbody-bag-brief-style-zipper-all-match-solid-color-bag-g996052.html,Men's Crossbody Bag Brief Style Zipper All Match Solid Color Bag,Crossbody Bags
5,$10.99,$16.99,http://www.jollychic.com/p/men-s-crossbody-bag-zipper-casual-all-match-durable-bag-g1007288.html,Men's Crossbody Bag Zipper Casual All Match Durable Bag,Crossbody Bags
6,$9.99,$15.99,http://www.jollychic.com/p/men-s-chest-bag-color-block-multifunctional-casual-bag-g1007592.html,Men's Chest Bag Color Block Multifunctional Casual Bag,Crossbody Bags
24,$15.99,$23.99,http://www.jollychic.com/p/men-s-chest-bag-fashion-unisex-cycling-outdoor-fabric-bag-g1018394.html,Men's Chest Bag Fashion Unisex Cycling Outdoor Fabric Bag,Crossbody Bags
1,$13.99,$20.99,http://www.jollychic.com/p/men-s-chest-bag-unisex-solid-color-zipper-brief-bag-g1018396.html,Men's Chest Bag Unisex Solid Color Zipper Brief Bag,Crossbody Bags
3,$40.99,,http://www.jollychic.com/p/men-s-crossbody-bag-zipper-casual-all-match-durable-bag-g1041670.html,Men's Crossbody Bag Zipper Casual All Match Durable Bag,Crossbody Bags
0,$18.99,$28.99,http://www.jollychic.com/p/men-s-crossbody-bag-pu-casual-all-match-durable-bag-g1041982.html,Men's Crossbody Bag PU Casual All Match Durable Bag,Crossbody Bags
17,$18.99,$24.99,http://www.jollychic.com/p/men-s-crossbody-bag-solid-color-canvas-retro-style-chic-bag-g1047580.html,Men's Crossbody Bag Solid Color Canvas Retro Style Chic Bag,Crossbody Bags
10,$15.99,$23.99,http://www.jollychic.com/p/men-s-crossbody-bag-casual-cycling-canvas-letter-pattern-bag-g1097718.html,Men's Crossbody Bag Casual Cycling Canvas Letter Pattern Bag,Crossbody Bags
10,$14.99,$18.99,http://www.jollychic.com/p/men-s-chest-bag-vintage-solid-color-zipper-casual-durable-bag-g1103958.html,Men's Chest Bag Vintage Solid Color Zipper Casual Durable Bag,Crossbody Bags
1,$8.99,$13.99,http://www.jollychic.com/p/men-s-chest-bag-fabric-solid-color-casual-chic-bag-g1152682.html,Men's Chest Bag Fabric Solid Color Casual Chic Bag,Crossbody Bags
2,$26.99,,http://www.jollychic.com/p/men-s-crossbody-bag-pu-zipper-casual-all-match-stylish-bag-g1183072.html,Men's Crossbody Bag PU Zipper Casual All Match Stylish Bag,Crossbody Bags
52,$11.99,$18.99,http://www.jollychic.com/p/men-s-crossbody-bag-casual-solid-color-simple-style-durable-bag-g1195034.html,Men's Crossbody Bag Casual Solid Color Simple Style Durable Bag,Crossbody Bags
2,$21.99,,http://www.jollychic.com/p/men-s-crossbody-bag-retro-style-pockets-design-solid-color-zipper-bag-g1195046.html,Men's Crossbody Bag Retro Style Pockets Design Solid Color Zipper Bag,Crossbody Bags
0,$30.99,,http://www.jollychic.com/p/men-s-crossbody-bag-solid-solid-color-zipper-casual-all-match-durable-bag-g1215254.html,Men's Crossbody Bag Solid Solid Color Zipper Casual All Match Durable Bag,Crossbody Bags
0,$17.99,,http://www.jollychic.com/p/men-s-crossbody-bag-canvas-zipper-casual-all-match-stylish-bag-g1215802.html,Men's Crossbody Bag Canvas Zipper Casual All Match Stylish Bag,Crossbody Bags
0,$35.99,,http://www.jollychic.com/p/men-s-crossbody-bag-casual-school-simple-small-bag-g1242812.html,Men's Crossbody Bag Casual School Simple Small Bag,Crossbody Bags
0,$18.99,,http://www.jollychic.com/p/men-s-crossbody-bag-faux-leather-zipper-vintage-bag-g1267686.html,Men's Crossbody Bag Faux Leather Zipper Vintage Bag,Crossbody Bags
15,$18.99,,http://www.jollychic.com/p/men-s-crossbody-bag-pu-zipper-color-block-stylish-bag-g564776.html,Men's Crossbody Bag PU Zipper Color Block Stylish Bag,Crossbody Bags
20,$17.99,$26.99,http://www.jollychic.com/p/men-s-crossbody-bag-cross-section-vintage-multi-function-leather-bag-g673400.html,Men's Crossbody Bag Cross Section Vintage Multi Function Leather Bag,Crossbody Bags
22,$10.99,$14.99,http://www.jollychic.com/p/men-s-crossbody-bag-zipper-casual-camouflage-all-match-durable-chest-bag-g690128.html,Men's Crossbody Bag Zipper Casual Camouflage All Match Durable Chest Bag,Crossbody Bags
9,$17.99,$31.99,http://www.jollychic.com/p/men-s-crossbody-bag-vintage-zipper-casual-durable-all-match-chest-bag-g731182.html,Men's Crossbody Bag Vintage Zipper Casual Durable All Match Chest Bag,Crossbody Bags
3,$27.99,$47.99,http://www.jollychic.com/p/men-s-crossbody-bag-casual-large-capacity-multifunctional-pu-bag-g739722.html,Men's Crossbody Bag Casual Large Capacity Multifunctional PU Bag,Crossbody Bags
4,$22.99,$34.99,http://www.jollychic.com/p/men-s-crossbody-bag-solid-color-durable-casual-chest-bag-g778052.html,Men's Crossbody Bag Solid Color Durable Casual Chest Bag,Crossbody Bags
14,$9.99,$15.99,http://www.jollychic.com/p/men-s-crossbody-bag-nylon-zipper-large-capacity-vintage-durable-bag-g793458.html,Men's Crossbody Bag Nylon Zipper Large Capacity Vintage Durable Bag,Crossbody Bags
13,$57.00,$88.00,http://www.jollychic.com/p/men-s-crossbody-bag-leather-high-quality-durable-bag-g821282.html,Men's Crossbody Bag Leather High Quality Durable Bag,Crossbody Bags
61,$9.99,$14.99,http://www.jollychic.com/p/men-s-crossbody-bag-zipper-closure-adjustable-strap-casual-bag-g823738.html,Men's Crossbody Bag Zipper Closure Adjustable Strap Casual Bag,Crossbody Bags
9,$30.99,$46.99,http://www.jollychic.com/p/men-s-crossbody-bag-casual-nylon-all-match-multi-function-sling-bag-g828082.html,Men's Crossbody Bag Casual Nylon All Match Multi-Function Sling Bag,Crossbody Bags
3,$24.99,$38.99,http://www.jollychic.com/p/men-s-crossbody-bag-solid-durable-water-proof-simple-style-all-match-bag-g858180.html,Men's Crossbody Bag Solid Durable Water Proof Simple Style All Match Bag,Crossbody Bags
20,$18.99,$29.99,http://www.jollychic.com/p/vegoo-men-s-crossbody-bag-solid-color-classic-waist-bag-g901158.html,VEGOO Men's Crossbody Bag Solid Color Classic Waist Bag,Crossbody Bags
9,$30.99,$46.99,http://www.jollychic.com/p/vegoo-men-s-crossbody-bag-colorblock-fancy-business-bag-g901668.html,VEGOO Men's Crossbody Bag Colorblock Fancy Business Bag,Crossbody Bags
16,$13.99,$20.99,http://www.jollychic.com/p/men-s-crossbody-bag-zipper-casual-all-match-durable-chest-bag-g922224.html,Men's Crossbody Bag Zipper Casual All Match Durable Chest Bag,Crossbody Bags
13,$14.99,$22.99,http://www.jollychic.com/p/men-s-crossbody-bag-pu-zipper-high-quality-stylish-bag-g931614.html,Men's Crossbody Bag PU Zipper High Quality Stylish Bag,Crossbody Bags
3,$37.99,$59.00,http://www.jollychic.com/p/men-s-handbag-brief-style-large-capacity-handbag-g945682.html,Men's Handbag Brief Style Large Capacity Handbag,Crossbody Bags
2,$88.00,,http://www.jollychic.com/p/men-s-crossbody-bag-casual-simple-solid-color-all-match-retro-bag-g957210.html,Men's Crossbody Bag Casual Simple Solid Color All Match Retro Bag,Crossbody Bags
1,$76.00,$117.00,http://www.jollychic.com/p/men-s-chest-bag-solid-all-match-zipper-fashion-stylish-bag-g959046.html,Men's Chest Bag Solid All Match Zipper Fashion Stylish Bag,Crossbody Bags
25,$12.99,,http://www.jollychic.com/p/men-s-crossbody-bag-simple-casual-multipurpose-canvas-bag-g959602.html,Men's Crossbody Bag Simple Casual Multipurpose Canvas Bag,Crossbody Bags
4,$8.99,,http://www.jollychic.com/p/men-s-chest-bag-simple-casual-washable-adjustable-strap-outdoor-bag-g959826.html,Men's Chest Bag Simple Casual Washable Adjustable Strap Outdoor Bag,Crossbody Bags
5,$10.99,$17.99,http://www.jollychic.com/p/men-s-crossbody-bag-nylon-zipper-color-block-fashionable-casual-bag-g963124.html,Men's Crossbody Bag Nylon Zipper Color Block Fashionable Casual Bag,Crossbody Bags
2,$14.99,$22.99,http://www.jollychic.com/p/men-s-crossbody-bag-nylon-vintage-high-quality-functional-unisex-bag-g964460.html,Men's Crossbody Bag Nylon Vintage High Quality Functional Unisex Bag,Crossbody Bags
6,$15.99,$23.99,http://www.jollychic.com/p/men-s-crossbody-bag-fabric-canvas-vintage-casual-single-shoulder-bag-g987302.html,Men's Crossbody Bag Fabric Canvas Vintage Casual Single Shoulder Bag,Crossbody Bags
8,$25.99,$39.99,http://www.jollychic.com/p/men-s-crossbody-bag-solid-color-all-match-casual-cover-bag-g996070.html,Men's Crossbody Bag Solid Color All Match Casual Cover Bag,Crossbody Bags
3,$10.99,$20.99,http://www.jollychic.com/p/men-s-crossbody-bag-sports-vintage-solid-color-casual-bag-g1007366.html,Men's Crossbody Bag Sports Vintage Solid Color Casual Bag,Crossbody Bags
15,$8.99,$13.99,http://www.jollychic.com/p/men-s-crossbody-bag-pu-casual-all-match-durable-bag-g1041660.html,Men's Crossbody Bag PU Casual All Match Durable Bag,Crossbody Bags
3,$15.99,$24.99,http://www.jollychic.com/p/men-s-crossbody-bag-zipper-casual-all-match-durable-chest-bag-g1041822.html,Men's Crossbody Bag Zipper Casual All Match Durable Chest Bag,Crossbody Bags
3,$14.99,$22.99,http://www.jollychic.com/p/men-s-crossbody-bag-canvas-zipper-casual-all-match-stylish-bag-g1054040.html,Men's Crossbody Bag Canvas Zipper Casual All Match Stylish Bag,Crossbody Bags
7,$19.99,,http://www.jollychic.com/p/men-s-chest-bag-vintage-zipper-high-quality-durable-bag-g1066134.html,Men's Chest Bag Vintage Zipper High Quality Durable Bag,Crossbody Bags
0,$14.99,$22.99,http://www.jollychic.com/p/men-s-chest-bag-casual-vintage-high-quality-zipper-durable-bag-g1067826.html,Men's Chest Bag Casual Vintage High Quality Zipper Durable Bag,Crossbody Bags
6,$5.99,$9.99,http://www.jollychic.com/p/men-s-crossbody-bag-zipper-casual-all-match-durable-phone-bag-g1078588.html,Men's Crossbody Bag Zipper Casual All Match Durable Phone Bag,Crossbody Bags
1,$34.99,$54.00,http://www.jollychic.com/p/men-s-chest-bag-fashion-style-messenger-bag-g1078614.html,Men's Chest Bag Fashion Style Messenger Bag,Crossbody Bags
1,$31.99,$49.99,http://www.jollychic.com/p/men-s-chest-bag-solid-functional-stylish-waterproof-zipper-closure-bag-g1078638.html,Men's Chest Bag Solid Functional Stylish Waterproof Zipper Closure Bag,Crossbody Bags
14,$15.99,$24.99,http://www.jollychic.com/p/men-s-crossbody-bag-fashion-ventilate-canvas-simple-all-match-bag-g1097716.html,Men's Crossbody Bag Fashion Ventilate Canvas Simple All Match Bag,Crossbody Bags
0,$12.99,$19.99,http://www.jollychic.com/p/men-s-crossbody-bag-casual-school-simple-waterproof-bag-g1140978.html,Men's Crossbody Bag Casual School Simple Waterproof Bag,Crossbody Bags
5,$24.99,,http://www.jollychic.com/p/men-s-crossbody-bag-zipper-patchwork-casual-all-match-stylish-bag-g1182796.html,Men's Crossbody Bag Zipper Patchwork Casual All Match Stylish Bag,Crossbody Bags
7,$35.99,,http://www.jollychic.com/p/men-s-crossbody-bag-solid-color-fashion-casual-vintage-hasp-bag-g1195018.html,Men's Crossbody Bag Solid Color Fashion Casual Vintage Hasp Bag,Crossbody Bags
3,$19.99,,http://www.jollychic.com/p/men-s-crossbody-bag-solid-color-stylish-multifunctional-durable-bag-g1195044.html,Men's Crossbody Bag Solid Color Stylish Multifunctional Durable Bag,Crossbody Bags
0,$18.99,,http://www.jollychic.com/p/men-s-crossbody-bag-zipper-design-casual-all-match-durable-bag-g1215260.html,Men's Crossbody Bag Zipper Design Casual All Match Durable Bag,Crossbody Bags
1,$125.00,,http://www.jollychic.com/p/men-s-crossbody-bag-high-quality-solid-color-retro-style-leather-bag-g1228578.html,Men's Crossbody Bag High Quality Solid Color Retro Style Leather Bag,Crossbody Bags
0,$18.99,,http://www.jollychic.com/p/men-s-crossbody-bag-zipper-casual-all-match-durable-bag-g1235176.html,Men's Crossbody Bag Zipper Casual All Match Durable Bag,Crossbody Bags
0,$14.99,,http://www.jollychic.com/p/men-s-crossbody-bag-trendy-all-match-ventilate-light-zipper-chest-bag-g1245040.html,Men's Crossbody Bag Trendy All Match Ventilate Light Zipper Chest Bag,Crossbody Bags
799,$22.99,$35.99,http://www.jollychic.com/p/men-s-crossbody-bag-vintage-solid-color-pu-waterproof-with-clutch-bag-free-g494424.html,Men's Crossbody Bag Vintage Solid Color PU Waterproof With Clutch Bag Free,Crossbody Bags
107,$35.99,,http://www.jollychic.com/p/bostanten-men-s-crossbody-bag-color-block-multi-functional-casual-bag-g640522.html,Bostanten Men's Crossbody Bag Color Block Multi Functional Casual Bag,Crossbody Bags
17,$26.99,$40.99,http://www.jollychic.com/p/men-s-crossbody-bag-solid-color-casual-breathable-bag-g778082.html,Men's Crossbody Bag Solid Color Casual Breathable Bag,Crossbody Bags
16,$7.99,$12.99,http://www.jollychic.com/p/men-s-crossbody-bag-solid-color-zipper-versatile-faux-leather-bag-g785552.html,Men's Crossbody Bag Solid Color Zipper Versatile Faux Leather Bag,Crossbody Bags
17,$15.99,$26.99,http://www.jollychic.com/p/men-s-crossbody-bag-fashion-zipper-durable-chest-bag-g790836.html,Men's Crossbody Bag Fashion Zipper Durable Chest Bag,Crossbody Bags
9,$10.99,$16.99,http://www.jollychic.com/p/men-s-crossbody-bag-vintage-waterproof-zipper-casual-bag-g793456.html,Men's Crossbody Bag Vintage Waterproof Zipper Casual Bag,Crossbody Bags
9,$9.99,$14.99,http://www.jollychic.com/p/men-s-crossbody-bag-brief-design-casual-breathable-chest-bag-g793638.html,Men's Crossbody Bag Brief Design Casual Breathable Chest Bag,Crossbody Bags
34,$31.99,$54.00,http://www.jollychic.com/p/men-s-crossbody-bag-vintage-style-all-match-business-laptop-bag-g868252.html,Men's Crossbody Bag Vintage Style All Match Business Laptop Bag,Crossbody Bags
7,$25.99,$40.99,http://www.jollychic.com/p/men-s-crossbody-bag-all-match-durable-colorblock-versatile-casual-bag-g882648.html,Men's Crossbody Bag All Match Durable Colorblock Versatile Casual Bag,Crossbody Bags
11,$39.99,$62.00,http://www.jollychic.com/p/vegoo-men-s-crossbody-bag-leather-versatile-stylish-bag-g908462.html,VEGOO Men's Crossbody Bag Leather Versatile Stylish Bag,Crossbody Bags
4,$26.99,$40.99,http://www.jollychic.com/p/vegoo-men-s-crossbody-bag-all-match-leather-stylish-bag-g908692.html,VEGOO Men's Crossbody Bag All Match Leather Stylish Bag,Crossbody Bags
0,$52.00,$80.00,http://www.jollychic.com/p/vegoo-men-s-crossbody-bag-leather-top-fashion-business-bag-g908702.html,VEGOO Men's Crossbody Bag Leather Top Fashion Business Bag,Crossbody Bags
1,$88.00,,http://www.jollychic.com/p/men-s-crossbody-bag-leisure-business-bag-g942616.html,Men's Crossbody Bag Leisure Business Bag,Crossbody Bags
5,$36.99,$57.00,http://www.jollychic.com/p/men-s-chest-bag-retro-style-solid-color-business-chest-bag-g942652.html,Men's Chest Bag Retro Style Solid Color Business Chest Bag,Crossbody Bags
5,$17.99,,http://www.jollychic.com/p/men-s-crossbody-bag-zipper-casual-all-match-durable-chest-bag-g951586.html,Men's Crossbody Bag Zipper Casual All Match Durable Chest Bag,Crossbody Bags
18,$6.99,,http://www.jollychic.com/p/men-s-women-s-crossbody-bag-solid-leather-canvas-bag-g951986.html,Men's/Women's Crossbody Bag Solid Leather Canvas Bag,Crossbody Bags
11,$11.99,$17.99,http://www.jollychic.com/p/men-s-crossbody-bag-solid-color-travel-casual-canvas-crossbody-bag-g953102.html,Men's Crossbody Bag Solid Color Travel Casual Canvas Crossbody Bag,Crossbody Bags
7,$14.99,,http://www.jollychic.com/p/men-s-crossbody-bag-layered-portable-large-capacity-computer-bag-g956528.html,Men's Crossbody Bag Layered Portable Large Capacity Computer Bag,Crossbody Bags
2,$10.99,,http://www.jollychic.com/p/men-s-chest-bag-voguish-popular-vintage-solid-durable-adjustable-casual-bag-g960134.html,Men's Chest Bag Voguish Popular Vintage Solid Durable Adjustable Casual Bag,Crossbody Bags
7,$15.99,$23.99,http://www.jollychic.com/p/men-s-crossbody-bag-nylon-zipper-solid-color-high-quality-bag-g963050.html,Men's Crossbody Bag Nylon Zipper Solid Color High Quality Bag,Crossbody Bags
19,$12.99,$19.99,http://www.jollychic.com/p/men-s-crossbody-bag-canvas-zipper-multifunctional-durable-bag-g963052.html,Men's Crossbody Bag Canvas Zipper Multifunctional Durable Bag,Crossbody Bags
9,$14.99,$22.99,http://www.jollychic.com/p/men-s-crossbody-bag-zipper-vintage-unisex-durable-bag-g963058.html,Men's Crossbody Bag Zipper Vintage Unisex Durable Bag,Crossbody Bags
12,$13.99,$20.99,http://www.jollychic.com/p/men-s-crossbody-bag-nylon-zipper-vintage-unisex-durable-bag-g963060.html,Men's Crossbody Bag Nylon Zipper Vintage Unisex Durable Bag,Crossbody Bags
9,$11.99,$17.99,http://www.jollychic.com/p/men-s-crossbody-bag-colorblock-zipper-unisex-durable-bag-g963092.html,Men's Crossbody Bag Colorblock Zipper Unisex Durable Bag,Crossbody Bags
4,$14.99,$22.99,http://www.jollychic.com/p/men-s-chest-bag-nylon-outdoor-casual-zipper-durable-bag-g963840.html,Men's Chest Bag Nylon Outdoor Casual Zipper Durable Bag,Crossbody Bags
2,$10.99,$17.99,http://www.jollychic.com/p/men-s-chest-bag-nylon-outdoor-vintage-casual-functional-unisex-durable-bag-g963854.html,Men's Chest Bag Nylon Outdoor Vintage Casual Functional Unisex Durable Bag,Crossbody Bags
5,$12.99,$20.99,http://www.jollychic.com/p/men-s-crossbody-bag-vintage-canvas-zipper-design-ventilate-bag-g964194.html,Men's Crossbody Bag Vintage Canvas Zipper Design Ventilate Bag,Crossbody Bags
0,$18.99,$29.99,http://www.jollychic.com/p/men-s-crossbody-bag-zipper-casual-all-match-durable-chest-bag-g964650.html,Men's Crossbody Bag Zipper Casual All Match Durable Chest Bag,Crossbody Bags
5,$141.00,,http://www.jollychic.com/p/men-s-crossbody-bag-delicate-solid-leather-large-capacity-travel-business-bag-g964750.html,Men's Crossbody Bag Delicate Solid Leather Large Capacity Travel Business Bag,Crossbody Bags
2,$13.99,$21.99,http://www.jollychic.com/p/men-s-crossbody-bag-canvas-zipper-solid-color-casual-all-match-stylish-bag-g1007282.html,Men's Crossbody Bag Canvas Zipper Solid Color Casual All Match Stylish Bag,Crossbody Bags
11,$13.99,$22.99,http://www.jollychic.com/p/men-s-crossbody-bag-zipper-casual-solid-color-all-match-durable-bag-g1007586.html,Men's Crossbody Bag Zipper Casual Solid Color All Match Durable Bag,Crossbody Bags
9,$19.99,$29.99,http://www.jollychic.com/p/men-s-crossbody-bag-camouflage-hasp-casual-all-match-stylish-bag-g1007588.html,Men's Crossbody Bag Camouflage Hasp Casual All Match Stylish Bag,Crossbody Bags
2,$15.99,$23.99,http://www.jollychic.com/p/men-s-crossbody-bag-retro-style-letter-pattern-canvas-bag-g1018386.html,Men's Crossbody Bag Retro Style Letter Pattern Canvas Bag,Crossbody Bags
2,$40.99,,http://www.jollychic.com/p/men-s-backpack-brief-large-capacity-multifunctional-crossbody-bag-g1041678.html,Men's Backpack Brief Large Capacity Multifunctional Crossbody Bag,Crossbody Bags
4,$12.99,$18.99,http://www.jollychic.com/p/men-s-crossbody-bag-simple-solid-color-cycling-functional-bag-g1047620.html,Men's Crossbody Bag Simple Solid Color Cycling Functional Bag,Crossbody Bags
12,$15.99,$23.99,http://www.jollychic.com/p/men-s-crossbody-bag-zipper-casual-all-match-durable-chest-bag-g1054058.html,Men's Crossbody Bag Zipper Casual All Match Durable Chest Bag,Crossbody Bags
0,$76.00,,http://www.jollychic.com/p/men-s-crossbody-bag-canvas-retro-fashion-large-capacity-handbag-g1077062.html,Men's Crossbody Bag Canvas Retro Fashion Large Capacity Handbag,Crossbody Bags
6,$33.99,,http://www.jollychic.com/p/men-s-crossbody-bag-solid-color-retro-style-cycling-bag-g1084774.html,Men's Crossbody Bag Solid Color Retro Style Cycling Bag,Crossbody Bags
9,$11.99,$17.99,http://www.jollychic.com/p/men-s-crossbody-bag-zipper-casual-all-match-durable-bag-g1090492.html,Men's Crossbody Bag Zipper Casual All Match Durable Bag,Crossbody Bags
0,$11.99,$18.99,http://www.jollychic.com/p/men-s-chest-bag-solid-color-multifunctional-casual-bag-g1090496.html,Men's Chest Bag Solid Color Multifunctional Casual Bag,Crossbody Bags
