add_wish,discount_price,original_price,product_link,product_name,header_block
8,$26.99,,http://www.jollychic.com/p/men-s-crossbody-bag-fashion-solid-color-all-match-crossbody-bag-g1097616.html,Men's Crossbody Bag Fashion Solid Color All Match Crossbody Bag,Crossbody Bags
2,$19.99,$36.99,http://www.jollychic.com/p/men-s-chest-bag-simple-casual-patchwork-color-large-capacity-bag-g1137770.html,Men's Chest Bag Simple Casual Patchwork Color Large Capacity Bag,Crossbody Bags
5,$9.99,$15.99,http://www.jollychic.com/p/men-s-crossbody-bag-faux-leather-zipper-retro-casual-bag-g1173408.html,Men's Crossbody Bag Faux Leather Zipper Retro Casual Bag,Crossbody Bags
0,$32.99,,http://www.jollychic.com/p/men-s-crossbody-bag-casua-simple-style-bag-g1242472.html,Men's Crossbody Bag Casua Simple Style Bag,Crossbody Bags
1,$32.99,,http://www.jollychic.com/p/men-s-crossbody-bag-light-small-high-quality-bag-g1243070.html,Men's Crossbody Bag Light Small High Quality Bag,Crossbody Bags
0,$21.99,,http://www.jollychic.com/p/men-s-crossbody-bag-canvas-casual-all-match-bag-g1279398.html,Men's Crossbody Bag Canvas Casual All Match Bag,Crossbody Bags
4,$30.99,,http://www.jollychic.com/p/men-s-crossbody-bag-casual-solid-color-zipper-design-brief-unisex-bag-g1282540.html,Men's Crossbody Bag Casual Solid Color Zipper Design Brief Unisex Bag,Crossbody Bags
45,$35.99,$55.00,http://www.jollychic.com/p/men-s-crossbody-bag-pu-solid-color-brief-style-multifunctional-bag-g437666.html,Men's Crossbody Bag PU Solid Color Brief Style Multifunctional Bag,Crossbody Bags
26,$16.99,$25.99,http://www.jollychic.com/p/men-s-crossbody-bag-all-match-patchwork-color-durable-bag-g626442.html,Men's Crossbody Bag All Match Patchwork Color Durable Bag,Crossbody Bags
60,$16.99,$26.99,http://www.jollychic.com/p/men-s-crossbody-bag-functional-solid-color-zip-leather-office-bag-g673410.html,Men's Crossbody Bag Functional Solid Color Zip Leather Office Bag,Crossbody Bags
10,$57.00,$87.00,http://www.jollychic.com/p/videng-polo-men-s-crossbody-bag-simple-design-business-bag-g725930.html,VIDENG POLO Men's Crossbody Bag Simple Design Business Bag,Crossbody Bags
4,$16.99,$29.99,http://www.jollychic.com/p/men-s-crossbody-bag-pu-casual-all-match-versatile-durable-chest-bag-g730888.html,Men's Crossbody Bag PU Casual All Match Versatile Durable Chest Bag,Crossbody Bags
9,$27.99,$47.99,http://www.jollychic.com/p/men-s-crossbody-bag-durable-retro-casual-zipper-outdoor-sports-chest-bag-g731184.html,Men's Crossbody Bag Durable Retro Casual Zipper Outdoor Sports Chest Bag,Crossbody Bags
37,$13.99,$17.99,http://www.jollychic.com/p/men-s-crossbody-bag-fashion-solid-color-zipper-bag-g770710.html,Men's Crossbody Bag Fashion Solid Color Zipper Bag,Crossbody Bags
4,$43.99,$67.00,http://www.jollychic.com/p/men-s-crossbody-bag-patchwork-durable-casual-bag-g859088.html,Men's Crossbody Bag Patchwork Durable Casual Bag,Crossbody Bags
28,$13.99,$20.99,http://www.jollychic.com/p/men-s-crossbody-bag-zipper-casual-all-match-durable-bag-g932082.html,Men's Crossbody Bag Zipper Casual All Match Durable Bag,Crossbody Bags
16,$5.99,,http://www.jollychic.com/p/men-s-crossbody-bag-waterproof-army-green-canvas-crossbody-bag-g949994.html,Men's Crossbody Bag Waterproof Army Green Canvas Crossbody Bag,Crossbody Bags
3,$12.99,,http://www.jollychic.com/p/men-s-crossbody-bag-vintage-square-shape-stylish-canvas-crossbody-bag-g953698.html,Men's Crossbody Bag Vintage Square Shape Stylish Canvas Crossbody Bag,Crossbody Bags
6,$19.99,,http://www.jollychic.com/p/men-s-crossbody-bag-multiple-pockets-zipper-durable-bag-g963078.html,Men's Crossbody Bag Multiple Pockets Zipper Durable Bag,Crossbody Bags
1,$22.99,,http://www.jollychic.com/p/men-s-chest-bag-nylon-casual-unisex-vintage-bag-g963842.html,Men's Chest Bag Nylon Casual Unisex Vintage Bag,Crossbody Bags
1,$18.99,,http://www.jollychic.com/p/men-s-chest-bag-nylon-casual-zipper-all-match-unisex-bag-g963858.html,Men's Chest Bag Nylon Casual Zipper All Match Unisex Bag,Crossbody Bags
8,$19.99,,http://www.jollychic.com/p/men-s-crossbody-bag-functional-travel-style-canvas-casual-bag-g963866.html,Men's Crossbody Bag Functional Travel Style Canvas Casual Bag,Crossbody Bags
3,$13.99,$21.99,http://www.jollychic.com/p/men-s-crossbody-bag-interior-zipper-pocket-canvas-light-bag-g964196.html,Men's Crossbody Bag Interior Zipper Pocket Canvas Light Bag,Crossbody Bags
3,$12.99,,http://www.jollychic.com/p/men-s-crossbody-bag-canvas-sports-cycling-vintage-bag-g964390.html,Men's Crossbody Bag Canvas Sports Cycling Vintage Bag,Crossbody Bags
1,$6.99,$10.99,http://www.jollychic.com/p/men-s-crossbody-bag-solid-color-casual-zipper-breathable-bag-g996048.html,Men's Crossbody Bag Solid Color Casual Zipper Breathable Bag,Crossbody Bags
2,$28.99,$39.99,http://www.jollychic.com/p/men-s-crossbody-bag-zipper-print-casual-all-match-stylish-bag-g1007590.html,Men's Crossbody Bag Zipper Print Casual All Match Stylish Bag,Crossbody Bags
17,$7.99,$13.99,http://www.jollychic.com/p/men-s-crossbody-bag-zipper-casual-all-match-durable-chest-bag-g1007610.html,Men's Crossbody Bag Zipper Casual All Match Durable Chest Bag,Crossbody Bags
10,$12.99,$19.99,http://www.jollychic.com/p/men-s-chest-bag-simple-style-fabric-durable-cycling-bag-g1018400.html,Men's Chest Bag Simple Style Fabric Durable Cycling Bag,Crossbody Bags
10,$46.99,,http://www.jollychic.com/p/men-s-crossbody-bag-canvas-hasp-cover-casual-all-match-stylish-bag-g1041646.html,Men's Crossbody Bag Canvas Hasp Cover Casual All Match Stylish Bag,Crossbody Bags
9,$29.99,,http://www.jollychic.com/p/men-s-crossbody-bag-canvas-casual-all-match-stylish-bag-g1041654.html,Men's Crossbody Bag Canvas Casual All Match Stylish Bag,Crossbody Bags
29,$7.99,$11.99,http://www.jollychic.com/p/men-s-crossbody-bag-solid-color-pu-casual-all-match-durable-bag-g1041658.html,Men's Crossbody Bag Solid Color PU Casual All Match Durable Bag,Crossbody Bags
6,$15.99,$24.99,http://www.jollychic.com/p/men-s-chest-bag-pu-solid-multifunctional-casual-bag-g1041816.html,Men's Chest Bag PU Solid Multifunctional Casual Bag,Crossbody Bags
7,$14.99,$22.99,http://www.jollychic.com/p/men-s-crossbody-bag-zipper-casual-all-match-durable-chest-bag-g1041818.html,Men's Crossbody Bag Zipper Casual All Match Durable Chest Bag,Crossbody Bags
5,$17.99,$26.99,http://www.jollychic.com/p/men-s-crossbody-bag-cycling-travel-functional-outdoor-canvas-bag-g1047708.html,Men's Crossbody Bag Cycling Travel Functional Outdoor Canvas Bag,Crossbody Bags
20,$10.99,$15.99,http://www.jollychic.com/p/men-s-chest-bag-solid-color-multifunctional-casual-bag-g1054060.html,Men's Chest Bag Solid Color Multifunctional Casual Bag,Crossbody Bags
1,$13.99,$21.99,http://www.jollychic.com/p/men-s-chest-bag-retro-all-match-casual-high-quality-bag-g1067828.html,Men's Chest Bag Retro All Match Casual High Quality Bag,Crossbody Bags
9,$23.99,,http://www.jollychic.com/p/men-s-crossbody-bag-simple-style-solid-color-canvas-bag-g1084776.html,Men's Crossbody Bag Simple Style Solid Color Canvas Bag,Crossbody Bags
1,$21.99,,http://www.jollychic.com/p/men-s-chest-bag-outdoor-travel-casual-zipper-design-bag-g1138968.html,Men's Chest Bag Outdoor Travel Casual Zipper Design Bag,Crossbody Bags
12,$12.99,$19.99,http://www.jollychic.com/p/men-s-crossbody-bag-zipper-casual-all-match-durable-bag-g1182798.html,Men's Crossbody Bag Zipper Casual All Match Durable Bag,Crossbody Bags
2,$17.99,,http://www.jollychic.com/p/men-s-crossbody-bag-vintage-zipper-design-all-match-lightweight-bag-g1195042.html,Men's Crossbody Bag Vintage Zipper Design All Match Lightweight Bag,Crossbody Bags
7,$20.99,,http://www.jollychic.com/p/men-s-crossbody-bag-canvas-casual-all-match-stylish-bag-g1215800.html,Men's Crossbody Bag Canvas Casual All Match Stylish Bag,Crossbody Bags
2,$15.99,$24.99,http://www.jollychic.com/p/men-s-bags-set-2-pcs-stylish-solid-zipper-design-crossbody-bag-durable-wallet-bag-set-g1216392.html,Men's Bags Set 2 Pcs Stylish Solid Zipper Design Crossbody Bag Durable Wallet Bag Set,Crossbody Bags
1,$24.99,,http://www.jollychic.com/p/men-s-chest-bag-trendy-patchwork-color-sporty-cycling-bag-g1227974.html,Men's Chest Bag Trendy Patchwork Color Sporty Cycling Bag,Crossbody Bags
1,$32.99,,http://www.jollychic.com/p/men-s-crossbody-bag-casual-school-simple-vintage-bag-g1242116.html,Men's Crossbody Bag Casual School Simple Vintage Bag,Crossbody Bags
3,$16.99,,http://www.jollychic.com/p/men-s-crossbody-bag-outdoor-casual-solid-color-canvas-bag-g1245030.html,Men's Crossbody Bag Outdoor Casual Solid Color Canvas Bag,Crossbody Bags
0,$30.99,,http://www.jollychic.com/p/men-s-crossbody-bag-brief-style-all-match-trendy-bag-g1252274.html,Men's Crossbody Bag Brief Style All Match Trendy Bag,Crossbody Bags
0,$16.99,,http://www.jollychic.com/p/men-s-crossbody-bag-color-block-all-match-patchwork-faddish-bag-g1252298.html,Men's Crossbody Bag Color Block All Match Patchwork Faddish Bag,Crossbody Bags
0,$18.99,,http://www.jollychic.com/p/men-s-crossbody-bag-pu-zipper-casual-solid-color-bag-g1267696.html,Men's Crossbody Bag PU Zipper Casual Solid Color Bag,Crossbody Bags
1,$16.99,,http://www.jollychic.com/p/men-s-crossbody-bag-solid-color-retro-outdoor-zipper-bag-g1289506.html,Men's Crossbody Bag Solid Color Retro Outdoor Zipper Bag,Crossbody Bags
195,$18.99,$24.99,http://www.jollychic.com/p/men-s-crossbody-bag-durable-brief-style-ventilate-pu-bag-g556934.html,Men's Crossbody Bag Durable Brief Style Ventilate PU Bag,Crossbody Bags
29,$10.99,$16.99,http://www.jollychic.com/p/men-s-crossbody-bag-zipper-fashion-design-durable-chest-bag-g564780.html,Men's Crossbody Bag Zipper Fashion Design Durable Chest Bag,Crossbody Bags
118,$5.99,$9.99,http://www.jollychic.com/p/men-s-crossbody-bag-pu-zipper-business-all-match-leisure-durable-bag-g577038.html,Men's Crossbody Bag PU Zipper Business All Match Leisure Durable Bag,Crossbody Bags
20,$57.00,$88.00,http://www.jollychic.com/p/men-s-crossbody-bag-casual-vogue-durable-bag-g652458.html,Men's Crossbody Bag Casual Vogue Durable Bag,Crossbody Bags
21,$10.99,$16.99,http://www.jollychic.com/p/men-s-crossbody-bag-solid-color-zipper-design-casual-pu-bag-g679268.html,Men's Crossbody Bag Solid Color Zipper Design Casual PU Bag,Crossbody Bags
14,$28.99,$47.99,http://www.jollychic.com/p/men-s-crossbody-bag-stylish-crocodile-pattern-business-chic-bag-g739730.html,Men's Crossbody Bag Stylish Crocodile Pattern Business Chic Bag,Crossbody Bags
17,$26.99,$41.99,http://www.jollychic.com/p/men-s-crossbody-patch-pu-leisure-high-quality-bag-g740156.html,Men's Crossbody Patch PU Leisure High Quality Bag,Crossbody Bags
65,$10.99,$15.99,http://www.jollychic.com/p/men-s-crossbody-bag-all-match-roomy-high-quality-bag-g770656.html,Men's Crossbody Bag All Match Roomy High Quality Bag,Crossbody Bags
39,$14.99,$22.99,http://www.jollychic.com/p/men-s-crossbody-bag-retro-style-chic-solid-color-pu-bag-g778050.html,Men's Crossbody Bag Retro Style Chic Solid Color PU Bag,Crossbody Bags
16,$51.00,,http://www.jollychic.com/p/bostanten-men-s-crossbody-bag-solid-color-casual-stylish-zipper-bag-g785564.html,Bostanten Men's Crossbody Bag Solid Color Casual Stylish Zipper Bag,Crossbody Bags
4,$29.99,$45.99,http://www.jollychic.com/p/men-s-crossbody-bag-vintage-canvas-high-quality-durable-bag-g820726.html,Men's Crossbody Bag Vintage Canvas High Quality Durable Bag,Crossbody Bags
13,$9.99,$14.99,http://www.jollychic.com/p/men-s-crossbody-bag-solid-color-adjustable-strap-casual-black-bag-g823734.html,Men's Crossbody Bag Solid Color Adjustable Strap Casual Black Bag,Crossbody Bags
10,$8.99,$13.99,http://www.jollychic.com/p/men-s-crossbody-bag-plaid-casual-durable-bag-g828522.html,Men's Crossbody Bag Plaid Casual Durable Bag,Crossbody Bags
18,$23.99,$36.99,http://www.jollychic.com/p/men-s-crossbody-bag-fashion-pu-waterproof-durable-zipper-chest-bag-g833250.html,Men's Crossbody Bag Fashion PU Waterproof Durable Zipper Chest Bag,Crossbody Bags
3,$37.99,$59.00,http://www.jollychic.com/p/men-s-crossbody-bag-solid-color-waterproof-versatile-waist-bag-g857364.html,Men's Crossbody Bag Solid Color Waterproof Versatile Waist Bag,Crossbody Bags
2,$57.00,,http://www.jollychic.com/p/men-s-crossbody-bag-large-capacity-durable-triangle-shape-bag-g858276.html,Men's Crossbody Bag Large Capacity Durable Triangle Shape Bag,Crossbody Bags
5,$42.99,$66.00,http://www.jollychic.com/p/men-s-crossbody-bag-letter-printed-large-capacity-bag-g859028.html,Men's Crossbody Bag Letter Printed Large Capacity Bag,Crossbody Bags
17,$13.99,$21.99,http://www.jollychic.com/p/men-s-sports-bag-solid-simple-design-versatile-zipper-all-match-chest-bag-g882754.html,Men's Sports Bag Solid Simple Design Versatile Zipper All Match Chest Bag,Crossbody Bags
6,$12.99,$21.99,http://www.jollychic.com/p/men-s-crossbody-bag-zipper-casual-all-match-durable-chest-bag-g893510.html,Men's Crossbody Bag Zipper Casual All Match Durable Chest Bag,Crossbody Bags
6,$26.99,$41.99,http://www.jollychic.com/p/vegoo-men-s-crossbody-bag-solid-color-top-fashion-casual-bag-g908680.html,VEGOO Men's Crossbody Bag Solid Color Top Fashion Casual Bag,Crossbody Bags
1,$19.99,$24.99,http://www.jollychic.com/p/men-s-crossbody-bag-zipper-casual-all-match-durable-chest-bag-g932272.html,Men's Crossbody Bag Zipper Casual All Match Durable Chest Bag,Crossbody Bags
18,$9.99,$14.99,http://www.jollychic.com/p/men-s-crossbody-bag-all-match-casual-durable-bag-g933090.html,Men's Crossbody Bag All Match Casual Durable Bag,Crossbody Bags
9,$9.99,$15.99,http://www.jollychic.com/p/men-s-chest-bag-solid-color-all-match-trendy-fashion-casual-chest-bag-g933842.html,Men's Chest Bag Solid Color All Match Trendy Fashion Casual Chest Bag,Crossbody Bags
1,$65.00,,http://www.jollychic.com/p/men-s-crossbody-bag-small-portable-solid-color-square-vintage-bag-g956856.html,Men's Crossbody Bag Small Portable Solid Color Square Vintage Bag,Crossbody Bags
2,$12.99,,http://www.jollychic.com/p/men-s-crossbody-bag-simple-casual-multipurpose-chest-bag-g960192.html,Men's Crossbody Bag Simple Casual Multipurpose Chest Bag,Crossbody Bags
19,$10.99,,http://www.jollychic.com/p/men-s-crossbody-bag-light-interior-compartment-bag-g962076.html,Men's Crossbody Bag Light Interior Compartment Bag,Crossbody Bags
10,$15.99,$24.99,http://www.jollychic.com/p/men-s-crossbody-bag-zipper-vintage-functional-unisex-durable-bag-g963066.html,Men's Crossbody Bag Zipper Vintage Functional Unisex Durable Bag,Crossbody Bags
2,$16.99,,http://www.jollychic.com/p/men-s-crossbody-bag-zipper-stylish-unisex-durable-bag-g963070.html,Men's Crossbody Bag Zipper Stylish Unisex Durable Bag,Crossbody Bags
2,$17.99,,http://www.jollychic.com/p/men-s-crossbody-bag-nylon-zipper-solid-color-all-match-durable-bag-g963100.html,Men's Crossbody Bag Nylon Zipper Solid Color All Match Durable Bag,Crossbody Bags
20,$14.99,,http://www.jollychic.com/p/men-s-crossbody-bag-canvas-interior-compartment-travel-bag-g964576.html,Men's Crossbody Bag Canvas Interior Compartment Travel Bag,Crossbody Bags
16,$11.99,$18.99,http://www.jollychic.com/p/men-s-crossbody-bag-nylon-casual-zipper-all-match-casual-bag-g979324.html,Men's Crossbody Bag Nylon Casual Zipper All Match Casual Bag,Crossbody Bags
7,$7.99,$11.99,http://www.jollychic.com/p/men-s-crossbody-bag-zipper-casual-all-match-durable-chest-bag-g1005552.html,Men's Crossbody Bag Zipper Casual All Match Durable Chest Bag,Crossbody Bags
4,$8.99,$14.99,http://www.jollychic.com/p/men-s-crossbody-bag-zipper-casual-all-match-durable-chest-bag-g1007580.html,Men's Crossbody Bag Zipper Casual All Match Durable Chest Bag,Crossbody Bags
7,$9.99,$15.99,http://www.jollychic.com/p/men-s-chest-bag-solid-canvas-multifunctional-casual-bag-g1007606.html,Men's Chest Bag Solid Canvas Multifunctional Casual Bag,Crossbody Bags
33,$8.99,$13.99,http://www.jollychic.com/p/men-s-crossbody-bag-pu-casual-all-match-durable-bag-g1041662.html,Men's Crossbody Bag PU Casual All Match Durable Bag,Crossbody Bags
9,$40.99,,http://www.jollychic.com/p/men-s-crossbody-bag-brief-large-capacity-multifunctional-travel-bag-g1041668.html,Men's Crossbody Bag Brief Large Capacity Multifunctional Travel Bag,Crossbody Bags
3,$38.99,$60.00,http://www.jollychic.com/p/men-s-chest-bag-vintage-solid-color-fashion-all-match-casual-crossbody-bag-g1078436.html,Men's Chest Bag Vintage Solid Color Fashion All Match Casual Crossbody Bag,Crossbody Bags
7,$10.99,$16.99,http://www.jollychic.com/p/men-s-crossbody-bag-zipper-casual-all-match-durable-bag-g1078722.html,Men's Crossbody Bag Zipper Casual All Match Durable Bag,Crossbody Bags
3,$16.99,$25.99,http://www.jollychic.com/p/men-s-chest-bag-casual-cycling-solid-color-canvas-bag-g1090620.html,Men's Chest Bag Casual Cycling Solid Color Canvas Bag,Crossbody Bags
8,$13.99,$20.99,http://www.jollychic.com/p/men-s-crossbody-bag-casual-school-all-match-simple-bag-g1136474.html,Men's Crossbody Bag Casual School All Match Simple Bag,Crossbody Bags
6,$16.99,$25.99,http://www.jollychic.com/p/men-s-crossbody-bag-casual-bussiness-simple-style-bag-g1140988.html,Men's Crossbody Bag Casual Bussiness Simple Style Bag,Crossbody Bags
0,$59.00,,http://www.jollychic.com/p/men-s-crossbody-bag-pu-zipper-casual-all-match-stylish-hand-bag-g1200396.html,Men's Crossbody Bag PU Zipper Casual All Match Stylish Hand Bag,Crossbody Bags
3,$25.99,,http://www.jollychic.com/p/men-s-chest-bag-2pcs-retro-style-personality-fashion-zipper-design-bag-g1227978.html,Men's Chest Bag 2Pcs Retro Style Personality Fashion Zipper Design Bag,Crossbody Bags
0,$30.99,,http://www.jollychic.com/p/men-s-chest-bag-2pcs-personality-brief-letter-pattern-sporty-all-match-bag-g1227982.html,Men's Chest Bag 2Pcs Personality Brief Letter Pattern Sporty All Match Bag,Crossbody Bags
1,$27.99,,http://www.jollychic.com/p/men-s-chest-bag-all-march-trendy-cycling-sporty-style-bag-g1244724.html,Men's Chest Bag All March Trendy Cycling Sporty Style Bag,Crossbody Bags
1,$16.99,,http://www.jollychic.com/p/men-s-crossbody-bag-solid-color-outdoor-durable-chest-bag-g1245026.html,Men's Crossbody Bag Solid Color Outdoor Durable Chest Bag,Crossbody Bags
0,$18.99,,http://www.jollychic.com/p/men-s-crossbody-bag-pu-solid-color-zipper-durable-bag-g1267704.html,Men's Crossbody Bag PU Solid Color Zipper Durable Bag,Crossbody Bags
0,$18.99,,http://www.jollychic.com/p/men-s-crossbody-bag-pu-solid-color-zipper-soft-durable-bag-g1267708.html,Men's Crossbody Bag PU Solid Color Zipper Soft Durable Bag,Crossbody Bags
65,$6.99,$23.99,http://www.jollychic.com/p/men-s-crossbody-bag-business-casual-solid-color-zipper-single-shoulder-bag-g397156.html,Men's Crossbody Bag Business Casual Solid Color Zipper Single Shoulder Bag,Crossbody Bags
70,$10.99,$17.99,http://www.jollychic.com/p/men-s-crossbody-bag-pu-zipper-all-match-casual-sports-bag-g564778.html,Men's Crossbody Bag PU Zipper All Match Casual Sports Bag,Crossbody Bags
13,$36.99,$57.00,http://www.jollychic.com/p/men-s-crssbody-bag-solid-color-versatile-all-match-fashion-functional-bag-g624850.html,Men's Crssbody Bag Solid Color Versatile All Match Fashion Functional Bag,Crossbody Bags
51,$17.99,$26.99,http://www.jollychic.com/p/men-s-crossbody-bag-pure-black-zip-business-style-leather-bag-g673154.html,Men's Crossbody Bag Pure Black Zip Business Style Leather Bag,Crossbody Bags
27,$16.99,$31.99,http://www.jollychic.com/p/men-s-crossbody-bag-pu-leather-all-match-zipper-leisure-sports-sling-bag-g731032.html,Men's Crossbody Bag PU Leather All Match Zipper Leisure Sports Sling Bag,Crossbody Bags
6,$18.99,$31.99,http://www.jollychic.com/p/men-s-cossbody-bag-multi-functional-casual-durable-zipper-sling-bag-g731150.html,Men's Cossbody Bag Multi-Functional Casual Durable Zipper Sling Bag,Crossbody Bags
7,$47.99,,http://www.jollychic.com/p/callaghan-men-s-crossbody-bag-brief-style-casual-zipper-bag-g785582.html,CallagHan Men's Crossbody Bag Brief Style Casual Zipper Bag,Crossbody Bags
9,$54.00,$83.00,http://www.jollychic.com/p/men-s-crossbody-bag-casual-multi-function-casual-business-bag-g827826.html,Men's Crossbody Bag Casual Multi-Function Casual Business Bag,Crossbody Bags
3,$28.99,,http://www.jollychic.com/p/bear-beauty-men-s-crossbody-bag-sports-casual-brief-design-chest-bag-g846182.html,Bear beauty Men's Crossbody Bag Sports Casual Brief Design Chest Bag,Crossbody Bags
11,$35.99,$55.00,http://www.jollychic.com/p/men-s-crossbody-bag-large-capacity-zipper-triangle-shape-bag-g857442.html,Men's Crossbody Bag Large Capacity Zipper Triangle Shape Bag,Crossbody Bags
3,$28.99,$43.99,http://www.jollychic.com/p/men-s-crossbody-bag-fashion-solid-water-proof-simple-style-all-match-bag-g858294.html,Men's Crossbody Bag Fashion Solid Water Proof Simple Style All Match Bag,Crossbody Bags
6,$102.00,,http://www.jollychic.com/p/esedan-men-s-crossbody-bag-zipper-solid-color-casual-all-match-stylish-bag-g862874.html,Esedan Men's Crossbody Bag Zipper Solid Color Casual All Match Stylish Bag,Crossbody Bags
2,$26.99,$40.99,http://www.jollychic.com/p/men-s-crossbody-bag-multi-function-all-match-trendy-vintage-style-chest-bag-g883572.html,Men's Crossbody Bag Multi-Function All Match Trendy Vintage Style Chest Bag,Crossbody Bags
9,$13.99,$21.99,http://www.jollychic.com/p/men-s-crossbody-bag-pu-zipper-casual-durable-bag-g893512.html,Men's Crossbody Bag PU Zipper Casual Durable Bag,Crossbody Bags
10,$13.99,$20.99,http://www.jollychic.com/p/men-s-crossbody-bag-casual-small-bag-g909618.html,Men's Crossbody Bag Casual Small Bag,Crossbody Bags
15,$23.99,$36.99,http://www.jollychic.com/p/men-s-crossbody-bag-pu-casual-all-match-durable-bag-g933602.html,Men's Crossbody Bag PU Casual All Match Durable Bag,Crossbody Bags
21,$12.99,,http://www.jollychic.com/p/men-s-crossbody-bag-waterproof-canvas-casual-travel-crossbody-bag-g951130.html,Men's Crossbody Bag Waterproof Canvas Casual Travel Crossbody Bag,Crossbody Bags
4,$37.99,$59.00,http://www.jollychic.com/p/men-s-crossbody-bag-mini-size-vintage-classic-all-match-bag-g957212.html,Men's Crossbody Bag Mini Size Vintage Classic All Match Bag,Crossbody Bags
2,$17.99,,http://www.jollychic.com/p/men-s-crossbody-bag-nylon-multiple-pockets-zipper-durable-bag-g963080.html,Men's Crossbody Bag Nylon Multiple Pockets Zipper Durable Bag,Crossbody Bags
38,$9.99,$15.99,http://www.jollychic.com/p/men-s-crossbody-nylon-vintage-high-quality-all-match-durable-bag-g964466.html,Men's Crossbody Nylon Vintage High Quality All Match Durable Bag,Crossbody Bags
5,$37.99,,http://www.jollychic.com/p/men-s-chest-bag-trend-solid-color-durable-sports-style-bag-g990542.html,Men's Chest Bag Trend Solid Color Durable Sports Style Bag,Crossbody Bags
2,$45.99,,http://www.jollychic.com/p/men-s-chest-bag-unique-creative-design-personality-cycling-bag-g990544.html,Men's Chest Bag Unique Creative Design Personality Cycling Bag,Crossbody Bags
1,$13.99,$21.99,http://www.jollychic.com/p/men-s-chest-bag-stylish-simple-style-waterproof-zipper-bag-g1017946.html,Men's Chest Bag Stylish Simple Style Waterproof Zipper Bag,Crossbody Bags
5,$41.99,,http://www.jollychic.com/p/men-s-crossbody-bag-canvas-cover-casual-all-match-stylish-bag-g1041682.html,Men's Crossbody Bag Canvas Cover Casual All Match Stylish Bag,Crossbody Bags
4,$165.00,,http://www.jollychic.com/p/tuscans-men-s-crossbody-bag-casual-simple-solid-color-leather-bag-g1137766.html,TUSCANS Men's Crossbody Bag Casual Simple Solid Color Leather Bag,Crossbody Bags
5,$11.99,$18.99,http://www.jollychic.com/p/men-s-chest-bag-casual-sports-fashion-all-match-bag-g1140980.html,Men's Chest Bag Casual Sports Fashion All Match Bag,Crossbody Bags
32,$13.99,$21.99,http://www.jollychic.com/p/men-s-crossbody-bag-solid-color-all-match-bag-g1152746.html,Men's Crossbody Bag Solid Color All Match Bag,Crossbody Bags
0,$13.99,,http://www.jollychic.com/p/men-s-crossbody-bag-all-match-solid-vintage-simple-messenger-casual-bag-g1183896.html,Men's Crossbody Bag All Match Solid Vintage Simple Messenger Casual Bag,Crossbody Bags
0,$37.99,$59.00,http://www.jollychic.com/p/men-s-crossbody-bag-casual-sporty-solid-color-light-all-match-bag-g1228600.html,Men's Crossbody Bag Casual Sporty Solid Color Light All Match Bag,Crossbody Bags
0,$55.00,,http://www.jollychic.com/p/men-s-crossbody-bag-casual-school-simple-style-bag-g1241836.html,Men's Crossbody Bag Casual School Simple Style Bag,Crossbody Bags
2,$21.99,,http://www.jollychic.com/p/men-s-chest-bag-casual-solid-color-light-weight-brief-bag-g1244728.html,Men's Chest Bag Casual Solid Color Light Weight Brief Bag,Crossbody Bags
0,$18.99,,http://www.jollychic.com/p/men-s-chest-bag-trendy-casual-solid-color-ventilate-cycling-bag-g1244730.html,Men's Chest Bag Trendy Casual Solid Color Ventilate Cycling Bag,Crossbody Bags
0,$18.99,,http://www.jollychic.com/p/men-s-crossbody-bag-pu-zipper-all-match-casual-bag-g1267690.html,Men's Crossbody Bag PU Zipper All Match Casual Bag,Crossbody Bags
0,$46.99,,http://www.jollychic.com/p/men-s-crossbody-bag-breathable-comfy-fashion-color-block-bag-g1277930.html,Men's Crossbody Bag Breathable Comfy Fashion Color Block Bag,Crossbody Bags
27,$25.99,$39.99,http://www.jollychic.com/p/men-s-crossbody-bag-casual-patchwork-fashion-chic-design-bag-g591460.html,Men's Crossbody Bag Casual Patchwork Fashion Chic Design Bag,Crossbody Bags
23,$51.00,,http://www.jollychic.com/p/bostanten-men-s-crossbody-bag-classic-design-solid-color-black-bag-g640526.html,Bostanten Men's Crossbody Bag Classic Design Solid Color Black Bag,Crossbody Bags
29,$17.99,$26.99,http://www.jollychic.com/p/men-s-crossbody-bag-retro-solid-color-hasp-trendy-leather-bag-g673392.html,Men's Crossbody Bag Retro Solid Color Hasp Trendy Leather Bag,Crossbody Bags
234,$10.99,$13.99,http://www.jollychic.com/p/men-s-crossbody-bag-casual-durable-multifunctional-simple-design-bag-g679522.html,Men's Crossbody Bag Casual Durable Multifunctional Simple Design Bag,Crossbody Bags
61,$10.99,$16.99,http://www.jollychic.com/p/men-s-crossbody-large-capacity-zipper-casual-durable-bag-g740136.html,Men's Crossbody Large Capacity Zipper Casual Durable Bag,Crossbody Bags
